Title,doc,topic
This one Out of Sync big screen tv,1783,2
The Summer That Never Ends by Trần Anh Vũ digital 2019,1784,7
Google Maps showing all the pubs in Great Britain,1785,2
Vox is angry as fuk,1786,7
14 year old cows,1787,2
),1788,1
Big ooof,1789,2
Otter wants their human to hold their paw for comfort,1790,4
This Mad Lad Predicted Congratulations 5 Months Ago,1791,7
Potoooooooo,1792,0
Well guess I can’t,1793,2
British military called on to strip the Sultan of Brunei of honorary appointments awarded to him by the Queen as backlash against new antiLGBT laws grows,1794,7
Seriously though,1795,2
In Avengers Age of Ultron (2015) when Tony visits the NEXUS Internet Hub in Oslo Norway one of the interns in the background gets her friend to snap a picture of her next to Iron Man,1796,2
If this makes it into LWIAY Ill make a third panel,1797,2
Someone at Porsche is getting fired today,1798,2
Bit of a hypocrite,1799,5
Just finished this sharpie drawing on my boyfriend’s skis,1800,2
The Reasonably Successful But Kinda Generic Action Movie Starter Pack,1801,6
I hope it left you satisfied #apexlegends #loot #3dprinting,1802,2
Trying again My 74yo retired high school Spanish teacher just completed his bucket list by being on The Price Is Right (link in comments),1803,2
Injured cat craves comfort of human,1804,4
Genius,1805,0
Bernie Sanders Says Fox News Is A Propaganda Arm Of Trump Administration,1806,7
I 3D printed this Chozo statue today,1807,4
This athlete is amazing Victor Assaf  just awesome,1808,9
John Carpenter x Jim Davis,1809,6
Netflix isnt killing movie theaters The audience who steams more also goes to cinemas more,1810,7
me_irl,1811,6
Invest and throw your memecoins at this OC for guaranteed profits,1812,5
me_irl,1813,6
No you didn’t,1814,2
made this because it happened today,1815,2
Almost nailed it,1816,2
Official Poster for Parasite (2019) the latest movie from Bong JoonHo (Memories of Murder Mother Snowpiercer & Okja),1817,7
Physics be damned,1818,5
PsBattle Solar System Chocolates,1819,7
His job is a minion tester,1820,2
He doesn’t know how to bark properly so this is how he expresses himself He was upset he couldn’t ride up front,1821,2
Ive been wearing my hair like the photo on the left for the majority of my life I recently met someone who has encouraged me to embrace my inner curly girl,1822,2
Animation is a dangerous job,1823,2
You have become the very thing you swore to destroy,1824,2
Wheres the lie,1825,2
How This Suitcase Opens,1826,1
How to wake up a pile of sleeping kittens,1827,1
Pride Rock,1828,2
Pupper smuggler in action,1829,7
I bet its named Steve,1830,7
Hes right you know,1831,2
Cardi Bee,1832,6
Who else remembers placing these to know your way back home,1833,2
Dad Review *Clap *Clap,1834,6
Molly,1835,1
adolf intensifies,1836,6
Gatekeeping being poor,1837,7
Its literally bringing more people into getting to actually know Felix growing his fanbase,1838,2
Donald Trump used to call Kirstjen Nielsen at home in the mornings to demand she stop migrants Report,1839,2
The skip intro button on Netflix is so cool,1840,7
Tissue companies profit off of sickness sadness and shame,1841,7
Some Men Just Want to Watch the World Burn,1842,2
Meirl,1843,2
Kid is impressed by dad’s magic trick,1844,2
hmmm,1845,4
Angry Andy,1846,7
Beem baam boom,1847,5
Whoops,1848,4
15 years ago today General Grievous made his fearsome first appearance in Tartakovskys Clone Wars when Chapter 20 aired [Legends],1849,7
This is double true in the mornings,1850,2
I hate titles,1851,2
Besides their accent what’s one way you know a tourist is American,1852,2
Oh Josh,1853,4
I can definitely relate,1854,4
Don’t let these profits fall flat Invest and riches are just over the horizon,1855,2
Via Chris Hemsworths IG  Helping out some fellow avengers with new fresh looks I can now add make up artist to my powers ,1856,7
TIL that Steve Martins wedding came as a surprise to his guests The roughly 75 starstudded attendees (including the likes of Tom Hanks Diane Keaton Eugene Levy and Carl Reiner) said that he had invited them to his house just for a party To their shock,1857,4
The weather map from this morning accurately represents how most Finns currently feel (taken from rsuomi),1858,7
HMJB as I get bamboozled,1859,9
Shazam Sequel In the Works Henry Gayden Will Return As Writer,1860,7
My leaves need me,1861,6
Drunk drivers are ogres and not just because they have layers,1862,5
How it went down in a parallel universe,1863,4
My roommate says my pets wait for me to come home every day I didn’t believe him until he sent me this,1864,2
The only good Pokemon is a fainted one,1865,2
Got this little guy yesterday can’t wait for what’s to come,1866,2
Congratulations 🔥🔥🔥,1867,4
The Law Firm of Rhodes Danvers & Odinson,1868,9
What was this sensor original meant to do anyway,1869,2
That really should not have worked as well as it did,1870,1
Allison Mack of ‘Smallville’ Pleads Guilty in Case of ‘Sex Cult’ Where Women Were Branded,1871,6
Russia moves to free nearly 100 captive whales after outcry,1872,7
Who said chivalry is dead,1873,7
I’ve been pretty down these past few months but Hobbles works so hard to make me smile every day,1874,2
Had to read it a few times,1875,2
LPT Try tying in small easytodo exercises to everyday tasks like doing push ups every time youre about to get in the shower Builds great habits prompts everyday exercise and adds up quickly,1876,2
Foam plane roulette,1877,7
In SpiderMan Homecoming Spidey jumps over a car while chasing the Vulture goons with a license plate of ASM267 The Amazing SpiderMan 267 comic tells the story of SpiderMan in suburbia which served as inspiration for this chase,1878,6
This fortress in Portugal is just stunning,1879,4
Hecker man,1880,2
hope this hasn’t been done before,1881,2
Biggest plot twist of 2017,1882,2
Stare at this as long as you want,1883,6
It was predicted and still happened,1884,2
2meirl4meirl,1885,8
CHAD NO,1886,6
5050 with the rotten flesh,1887,9
Thanks I hate horses [rfunny],1888,2
What are some tips for changing from an Ill do it later person into an Ill do it now person,1889,2
Be kind he’s trying,1890,7
Literally every dank meme video from 2015 starter pack,1891,6
Alabama 100,1892,7
ACLU Asks CBP Why Its Threatening US Citizens With Arrest For Refusing Invasive Device Searches,1893,1
Gonna see the cow,1894,2
hmmm,1895,4
Where did he come from,1896,2
You can make a religion out of this,1897,2
bouncy boi waiting for his ball 😍,1898,4
TIL That the film The Killing Fields cast a real life survivor of the Cambodian Genocide Hang S Ngor survived three terms in Cambodian Prison camp by eating insects He went on to win an Academy Award for supporting actor His fate ended by being murdered my an LA street gang in 1996,1899,4
This is getting ridiculous,1900,2
He was snoring too,1901,5
If we can see ants (which are thousands of times smaller than us) can ants see stuff thats thousands of times smaller than them,1902,2
bUT tHeY dO cAUsE viOLeNCe,1903,2
Someone’s in trouble,1904,7
Foam Plane Roulette,1905,7
A fish like object found in a river,1906,4
When you think you have all the time in the world to loot,1907,2
Omar Stephen Miller is a white nationalist,1908,2
Don’t ask why I used a heavy version,1909,2
Thank you Felix,1910,2
Emma Watson photographed by Andrea Carter Bowman,1911,8
Karea,1912,7
How time flies,1913,2
In mergers no one can hear you scream [OC],1914,7
HMJB as I get bamboozled,1915,9
No Way,1916,2
First ever picture of a black hole may be revealed this week The team at the Event Horizon Telescope (EHT) – a network of telescopes around the globe working together to make an image of a black hole – is going to release its first results on 10 April,1917,2
Now I know where my socks have gone,1918,2
[OC] Generic Goods Shopping,1919,7
If reincarnation is a thing you could be learning about yourself in school without even knowing it,1920,2
I definitely do,1921,4
After 196 days,1922,7
How Apple name their cables,1923,4
My Guinea pigs nose looks like a snow monkey,1924,7
Teach a kid to buy and fish and youll feed wholesomememes for a lifetime,1925,2
I knew Melbourne had cool street art but I did NOT expect to stumble on this gem,1926,2
Honest work,1927,2
Outstanding Move,1928,7
RE3  Jill Valentine cosplay,1929,6
That icon tho,1930,1
My dad 10 years ago I dont want ANY animals in this house My dad today,1931,2
Not just the men,1932,2
I’ve been seeing Cutco posters around the CS building on campus and I got sick of just tearing them down,1933,2
Lawmakers announce bill to grant Puerto Rico statehood,1934,1
Batsaw he who cuts,1935,8
These powerpuff girls are my fav,1936,7
For the first time in 56 ys I finally got a dog Meet Hugo my Whoodle puppy,1937,2
Or 200 when the visit Motherwell,1938,7
What are you trying to promote here school,1939,7
Fly trapper that lures insects in and then trapps them in a lower conpartment,1940,4
Stackexchange,1941,8
Raincoat Boi,1942,4
Minor injuries,1943,3
And that’s a fact,1944,2
After 1427 failed attempts I finally got my first solo victory,1945,2
Just a reminder,1946,9
Line illusion,1947,9
15 middle school friends and I played on our one server for ~7 years This was my home<3,1948,2
Thanos Preparing for Endgame Episode 3 Mohawkeye (mild trailer spoilers),1949,2
I improved Maestro’s icon so it is more Italian,1950,8
Clearly Ron is the real bad boy of the story,1951,2
No alanah I don’t believe you,1952,2
Privileged By Kyle Korver | Players Tribune,1953,5
I dont care that my bully has a troubled home life,1954,4
Frontmounted motor,1955,0
Corgi pups,1956,4
Seems like it,1957,7
A C K C H E W A L E E,1958,2
Sorry fast connection normies,1959,2
Exquisite Wood Carving,1960,9
All 90s horror movies,1961,1
Wait is that a,1962,2
Immediately thought of this sub,1963,2
Drunk at 3am have to be in class at 8am 22 yo biology major Rrrroast me extra toasty,1964,6
TIL about Yasuteru Yamada a retired engineer who after watching the news coverage of the Fukushima nuclear plant disaster organized a group of 200+ fellow retirees and volunteered to go to the site and assist in the cleanup so the younger generation didnt have to and risk exposure to radiation,1965,2
Couldnt stop laughing,1966,2
Here is my concept for a reworked Kirby (Animated image),1967,0
BuT iTs RuSsIaNs,1968,0
____ be hömö,1969,3
Such a supportive grandpa,1970,2
You can do so much good and still be labeled something negative,1971,2
Yesterday I traveled 3000 miles roundtrip to adopt this perfect girl Meet Maleficent,1972,2
A soccer club needs to give this guy a contract,1973,2
Footage from 3019,1974,3
Please dont touch,1975,7
Dont get outworked by a coke head,1976,7
My town has 100% electric school buses,1977,2
Considering the size shape and position of a unicorns horn; it would most likely be used for stabbing potential predators after a high speed chargeThis adaptation would most likely go with an extremely aggressive temperament that would make unicorns one of the most dangerous animals in the world,1978,2
My palms have never been sweatier,1979,7
If the dead could actually roll in their graves there could be a new proffesion where you just say dumb stuff throughout the day to make them generate electricity,1980,2
This is Otto he is a dog skateboarder and currently holds the record for largest human tunnel travelled in one sitting,1981,2
Waves of garbage crash off of the coast of the Dominican Republic This is a moral crisis we need an ecorevolution,1982,9
Object permanence,1983,3
[Freedom intensifies],1984,5
Congress Is About to Ban the Government From Offering Free Online Tax Filing Thank TurboTax,1985,7
TIL The summit of Mt Everest is marine limestone meaning the highest point on Earth was once ocean seafloor,1986,7
32 million karma and accepted to Harvard but never kissed a girl Roast me,1987,2
Movies with campfire scenes always seem to forget to make the smoke annoyingly blow into the characters faces no matter where they move,1988,2
As an IT Admin I had to create this meme that encapsulates my role,1989,6
Our office has a policy; If you get a puppy you need to bring it in to the office This is Henry (Hank) Blep,1990,6
The cutest little helper,1991,6
The line hes a friend from work in Thor Ragnarok was a suggestion from a kid visiting the set Originally he only asked Hulk about where hes been,1992,2
TIL that actor David Herman (Michael Bolton from the movie Office Space) got himself fired from MADtv by screaming all his lines during readthrough Apparently,1993,7
Teachers who regularly get invited to high school reunions what are the most amazing transformations common patterns epic stories saddest declines etc youve seen through the years,1994,2
Waffle House good Samaritan shot to death paying for meals handing out $20 bills,1995,2
All that work was worth it,1996,2
TIL A maximumsecurity prison in Uganda has a soccer league (run and played by prisoners) with an annual soccer tournament The tournament is taken very seriously; they have a uniforms referees cleats and a 30page constitution The winning team gets prizes such as soap sugar and a goat,1997,7
Netflix really do sometimes actually be like that,1998,7
Black bear cubs cross the road in Alaska,1999,7
Sauce,2000,4
The drawing equivalent of fear,2001,7
My grandparents getting married in Iceland in 1976 at 19,2002,4
we neeed it,2003,3
Congress Is About to Ban the Government From Offering Free Online Tax Filing Thank TurboTax,2004,7
TIL that two inmates sued the state of Alabama claiming the cramped space in their cell was a cruel and unusual punishment The state argued that students at Auburn University actually paid to live in even smaller living space in the Magnolia Dorm The inmates lost the case,2005,7
Lpt Dont take unsolicited advice personally Most of the time the person giving the advice is giving advice they wish they had not advice they think you need,2006,2
The mystic tiger boye,2007,2
Thought youd all enjoy my 14 year old cousins sense of humor,2008,2
This is how a tree is used,2009,2
Everyone loves puppies,2010,4
If any of you here are thinking of getting married consider the following before you do,2011,2
To walk,2012,2
Anyone else remember the old Minecraft launcher,2013,2
If Respawn listened to this subreddits UI recommendations,2014,0
For at least 13 years rain or shine this little old man spends EVERY morning walking around our tiny town picking up trash,2015,2
Tried to get a friend to watch Game of Thrones a while ago and this is what she said,2016,2
Employees who force themselves to smile and be happy in front of customers  or who try to hide feelings of annoyance  may be at risk for heavier drinking after work according to a new study (n=1592),2017,2
I made a Game of Thrones tribute pie lemon curd peach and raspberry filling in a lemon almond cookie crust,2018,2
SpongeBob,2019,8
David J Peterson who crafted the Dothraki and Valyrian languages for HBO’s Game of Thrones is joining Denis Villeneuves Dune to build & develop the languages of that world,2020,8
My grandfather on my grandmother’s shoulders Sometime in the 1940s,2021,6
The Blair Witch Project changed horror forever It created a genre and took advantage of trust in the early internet Its ingenious premise required it to break all the rules no script no jump scares no music no professional crew no special effects Hysteria became its greatest weapon,2022,2
TIL 7yr old Tyler Moon walked 1km (06 miles) of forest to save his father’s life after their quad crashed Tyler made the journey to get help despite his own injuries two collapsed lungs filling with blood and seven broken ribs He managed to alert help just in time before collapsing himself,2023,2
me irl,2024,5
1900s history tests be like,2025,2
hmmm,2026,4
Took a picture of my drone flying in a circle last weekend,2027,2
3d Kitchen ad in a newspaper,2028,4
“This post came into my house took me by the ankles and swung me into every available surface”,2029,2
How to Understand the Image of a Black Hole,2030,2
Let me rephrase that,2031,4
paul rudd is basically all of us in a nutshell,2032,8
Trump Had No Problem With Iran’s Revolutionary Guard When He Was Doing Business With Its Associates According to an exhaustive report the group the president just labeled a terrorist organization reportedly had financial ties to the Trump family business,2033,2
I found this on an old Git account,2034,2
Grabbed a bag and decided to pick up trash along the Mississippi River #Trashtag isnt about picking up tons of trash its about everyone doing their part to clean up the world,2035,2
What should I play based on Difficulty and SubGenre,2036,9
Bill Barr I’m Not Giving Congress Unredacted Mueller Report The AG said a redacted version could come within a week But he’s not giving in to congressional demands for the full copy,2037,2
What is something that your generation did that no younger generation will ever get to experience,2038,2
Tiger accidentally licks an excrement stain off the glass,2039,7
MRW they found out someone was streaming The Office at work so they blocked Netflix,2040,2
I can relate to Steve very well,2041,4
Do not disturb the beast while it slumbers,2042,3
Cat Time Lapse EDIT,2043,2
Shoe that is on the longboard vs the shoe that does all the pushing,2044,7
Teachers shouldnt say Make your project on whatever you want,2045,2
Street Art Before & After,2046,7
Dude has nothing better to do,2047,7
Saw these meters painted to look like a bad guy in an alley near my apartment,2048,2
Singles of Reddit what do you like most about being single,2049,7
Over 100000 confiscated weapons were used to create this 26ft tall Knife Angel statue,2050,7
This dog has soul as he sings along to Tennessee Whiskey,2051,2
Eating jello,2052,2
Why is this dog toy so heavy,2053,2
Oh SH–,2054,4
Every Single Time,2055,2
Or maybe we should have a day that is like fathers day but for mothers Oh wait,2056,2
F for the European boys,2057,7
There are 12 black dots on this image but your brain wont let you see them all at once,2058,2
Evolution is amazing,2059,7
Saw her on my way home when I got to pick my dog food on this petshop Im pretty sure she was ready to be adopted,2060,7
I was reading the history of the French Revolution and just found out what happened to Louis XVI ‘s head,2061,8
Man who accidentally stole car 21 years ago searching for vehicles owner,2062,7
I have no idea what you are thinking about,2063,2
This is a whole lotta nope,2064,4
This is the best cat ever Get well soon,2065,2
A girl wrote this btw,2066,2
How to get a balanced budget,2067,2
Whatever it takes,2068,2
Massachusetts becomes 16th state to ban gay conversion therapy,2069,7
Hes been leading a double life this whole time,2070,2
Sorry mods,2071,2
Researchers have developed a novel approach to cancer immunotherapy injecting immune stimulants directly into a tumor to teach the immune system to destroy it and other tumor cells throughout the body The “in situ vaccination” essentially turns the tumor into a cancer vaccine factory,2072,7
I wonder as well,2073,1
Hot template straight out of the front page Invest now,2074,2
cool wood working by @marleyturned,2075,2
Prepare for impact,2076,3
This awesome racing game made of LEGO,2077,2
How can you tell your girlfriend is getting fat,2078,2
PsBattle These helium and nonhelium balloons canceling eachother out,2079,9
Policy of Containment,2080,3
Hmmmm…,2081,7
My old math teacher would play this before we started a test its a 10 minute video of him mowing his lawn We would have to turn in our test after the video was done Please meme him,2082,9
Duo or die,2083,2
Hope this meme doesnt come across as rude Just read about him and thought that making this was the least I could do to show my respect for this man,2084,2
“Ready for impact”,2085,5
The eternal meme,2086,6
David Harbours time to shine has arrived Twenty years into his career the ‘Hellboy’ star is finally experiencing a moment his own superhero movie a major Netflix series several projects in the works and internetdad fame,2087,7
Meirl,2088,2
Øld Grãnny Slayer of thots,2089,6
View from Villa Honegg in Switzerland,2090,1
Real hackerman,2091,7
It’s not cuz you’re smokin,2092,7
Unnecessaryrandom sex scenes in movies or shows are annoying,2093,2
It’s not as sad as it sounds,2094,7
Sir Patrick Stewart shows how pitbulls deserve love too and how not spoiling our puppers is a lost cause,2095,8
F for the boys in Africa,2096,7
Aesthetic no5 | Digital | 1000x1200,2097,7
Sweden has joined the battle,2098,3
🤩🤩🤩,2099,8
Stop doing that,2100,2
Totally Accurate Battlegrounds knows whats up,2101,2
EMOTIONS OFF,2102,1
The most scariest moment I have ever experienced in Minecraft,2103,2
The President of the United States Told Law Enforcement to Break the Law,2104,9
“Ready for Impact”,2105,5
LPT Carry around a card in your walletpurse with some important phone numbers like parents or friends If your phone dies or you don’t have it you have all the numbers you need and you can use a pay phone or borrow someone’s phone,2106,7
What is something perfectly legal that feels illegal,2107,7
Omg chris don’t shoot the squirrel,2108,7
When you’re so broke you can’t afford free things,2109,2
The Forgotten Reason Congress Needs to See the Mueller Report Legislators have a responsibility to police obstruction of justice according to the Constitution,2110,2
[No spoilers] I made a Game of Thrones tribute pie It has a lemon curd peach and raspberry filling in a lemon almond cookie crust and is 100% edible,2111,2
That’s some ball movement,2112,2
i had an orgazm when i saw the vid,2113,2
Truly dead ((,2114,9
Coincidence I think not,2115,2
April on the east coast,2116,4
Chicago is the real Battle Royale,2117,7
Papa Felix,2118,2
this Roblox advertisement,2119,2
EU and China flags go together surprisingly well,2120,2
Moooo,2121,4
*sweats in latin based languages*,2122,4
Diversity university,2123,7
watch out persia,2124,6
Duck public health warning for when they all come out to groove about be nice and have fun in the sun,2125,2
Goodbye glaciers 390 billion tons of snow and ice melts each year as globe warms | Over 30 years,2126,7
Career change,2127,7
Respawn (Titan Fall Apex Legends) is working on a new Star Wars title It is directed by Stig Asmussen (God of War 3),2128,1
Shark Buster Chad Bringer of Arms,2129,3
Tried a mirror glaze,2130,7
No fire burn you,2131,1
[LEAK]MASSIVE BUFF FOR JIB AND CAUSTIC,2132,8
I is a good boi,2133,4
Emotional Budweiser tribute commercial features Dwyane Wade swapping five more “jerseys”,2134,5
2meirl4meirl,2135,8
Me🤔irl,2136,0
Bartender’s lesson,2137,5
Sad truth,2138,7
I can smell your fear Jon,2139,7
PsBattle The abs on this Beluga,2140,2
Ted Lieu plays a clip of Candace Owens’ comments on Hitler to ridicule Republicans for inviting her to a hearing on white nationalism,2141,6
What you looking at ,2142,4
What is this thing Entirely matte black and had a police escort,2143,2
Trump blasted any company doing business with the Iranian Revolutionary Guard Corps as “bankrolling terrorism” But Trump’s own business partners were suspected of helping launder money for the guard through his Trump Tower Baku project in Azerbaijan,2144,2
Can’t fault him on that,2145,2
My (36m) wife (33f) was sued Im feeling resentment towards her and I dont know how to move past it,2146,2
The classic turn,2147,8
Ich bin YEET,2148,1
It must be a new release,2149,7
Close one,2150,2
Royalty approved,2151,4
I want a pop tart,2152,2
Hello there,2153,9
This specially created bald spot mullet,2154,8
How I avoided reaching the top 100 of rall for 2 gifs in a row,2155,2
Here is a little pic of my PewdiepieS closet Iv buy all the merch since 50mill club excluding But can you do this merch and Sub to Pewdiepie merch ( had a problem with my credit card,2156,2
Possibly the most horrifying moment in video game history,2157,2
Mitt Romney Is Now Running Interference on Trumps Tax Returns Because Of Course He Is — One of the few Republicans alive who could credibly challenge this president* will instead do nothing,2158,2
My attempt at Brigittes dance emote,2159,4
every girls weakness,2160,7
You guys really couldnt help yourselves could you,2161,2
How I imagine my recent gifs havent been able to reach All,2162,2
Always on time,2163,2
You know what happens now,2164,2
Schools should not punish bullied kids for fighting back,2165,7
Dudes got game,2166,2
In infinity war (2018) doctor strange says Were in the endgame now Thats stupid because they are in infinity war and endgame is a 2019 movie,2167,2
It looks like my finger went through the cup,2168,7
SHHEHHEEK,2169,3
Moves like Jagger,2170,7
TIL about Minnie Freeman a teacher in Nebraska in 1888 who saved all of her students after a freak blizzard struck The winds were so strong the roof and door blew off the school Using string she roped the kids together and trekked over a mile in whiteout conditions to the closest farmhouse,2171,4
This drain though,2172,2
anime_irl,2173,8
Thousandyard stare,2174,6
Can I say it,2175,9
A Ridiculously Fluffy Chinchilla,2176,4
Hanging by the thread,2177,2
hopefully this hasn’t been done yet (OC),2178,2
Jon is the real monster this time,2179,7
These plebs won’t know what hit them,2180,4
What normal thing is 10 times creepier if you do it with gloves on,2181,2
Can we Start a F chain for Stan Lee,2182,2
Probably the most bad ass thing I’ve done in Halo 3,2183,2
The internet was a mistake 📵📵📵,2184,5
Sometimes reality isn’t disappointing,2185,7
My father carves Pokemons as a hobby,2186,2
*Soviet Union anthem intensifies*,2187,2
My husband died Let’s celebrate with cake,2188,2
Tom Fishburne  Content is my Currency,2189,9
Track and Peak Intensity of US Tornadoes 19502017 [OC],2190,8
RIP,2191,4
cursed_homeschool,2192,0
