Title,doc,topic
TIL when Robert Ballard (professor of oceanography) announced a mission to find the Titanic it was a cover story for a classified mission to search for lost nuclear submarines They finished before they were due back so the team spent the extra time looking for the Titanic and actually found it,0,2
Little Mac met Mike Tyson today,1,4
God April Fools Day pranks be like,2,2
Using Google Sheets to translate batches of words Great for language learning,3,8
In the 90s we were taught to use plastic instead of paper to save the rainforest from deforestation Now were taught to use paper instead of plastic to save the ocean from pollution,4,7
My high school gov teacher put himself on a cover of Forbes and read it on a plane while he sat in first class for the first time in his life,5,2
TIL The original word for bear has been lost People in middle ages were superstitious and thought saying the animals name would summon it They called it bear which means the brown one to avoid saying its actual name,6,2
April fools idea from Utah DOT,7,2
Infinity gauntlet art reveal,8,2
Not today,9,2
Every month I guess date night Today my fiance threw me off and told me to dress in my best outfit Now we feast on Taco Bell,10,2
Dropping the glass into a custom coffee table,11,2
He was a good dad 😊,12,2
wild world were living,13,2
Smooth creativity with paper and scissors,14,0
Restaurant with a little river that carries away empty plates,15,4
Not the usual way of finding out about an eye condition,16,2
This double spiral staircase,17,7
Rocket league this morning I hope they keep it like this,18,7
Expecting mother getting an ultrasound,19,7
April Fools Day sponge cake,20,2
Poor megan,21,4
LPT At the end of the April fools joke the pranked person should be laughing too,22,2
#trashtag with the kids 9 bags off of our county road,23,4
Quick Its April Fools so lets get Timmy Turner to the front page,24,2
TIL Mick Jagger has a greatgrandchild that is older than his youngest child,25,7
SoCal before and after a wet winter,26,4
US will run out of avocados in three weeks if Trump closes Mexico border President says there is a ‘good likelihood’ he will close border this week if Mexico does not stop immigrants from reaching US,27,2
Power washing in NYC,28,0
If I have one,29,2
Frogger,30,1
You may now bow before me,31,7
Quite shy but she said YES (I mean woof),32,4
Trickery 100,33,7
Dubstep music by Skrillex was found to protect against mosquito bites in a new study with its mix of very high and very low frequencies Such music which appears to delay host attack reduce blood feeding and disrupt mating may provide new avenues for musicbased personal protective measures,34,7
Top 10 Anime comebacks,35,2
The best punchline in GTA SA,36,8
Well played mods,37,2
Fresh OC,38,5
Excellent Human Claw technique,39,7
Dislocated shoulder,40,4
Wholesome April fools,41,2
Keanu Reeves being a bro,42,2
To publicly shame her husband into mowing the lawn,43,7
Completely unprompted my son cut a paper spider out and taped it inside my wifes lampshade and Ive never been more proud,44,7
The worlds largest furniture retailer IKEA has revealed that 70% of the materials used to make its products during 2018 were either renewable or recycled as it strives to reach the 100% mark by 2030,45,2
Gun with L E G S,46,2
No joke or April fools This is literally just the Rick Astley  Never Gonna Give You Up song You can see the thumbnail Dont click this youll be rick rolled,47,2
Frick TSeries,48,1
Keeping #trashtag going in Speedway IN,49,2
No bamboozles everyone who comments in this thread will be invited to become a mod of rWSB,50,2
Jam band,51,0
I work at a vet hospital Just left the morning crew a little April Fools surprise,52,4
Wholesome children,53,2
Glass of Water Emma May Riley Oil on canvas 2013,54,2
We forgot to run our bin to the road last night This man was an absolute bro,55,7
there was an attempt to identify robots,56,7
Dog park experience exceeds expectations,57,2
Thats one way to get a truck up an icy hill,58,2
Feels bad man,59,2
Pulled an April fools joke on a monkey 🐒,60,7
US Half Dollar Coin Cut Out By Hand,61,7
to suit the new rules s,62,7
Jim Jarmuschs The Dead Dont Die poster,63,7
Even dogs get april fooled,64,2
I really wish people would check if the sentence is brand new before posting it here,65,7
They deserve it,66,7
White House whistleblower says 25 security clearance denials were reversed during Trump administration,67,2
me_irl,68,6
Today in a nutshell,69,2
China warned other countries not to attend UN meeting on Xinjiang human rights violations – NGO,70,2
Intellectually humble people tend to possess more knowledge suggests a new study (n=1189) The new findings also provide some insights into the particular traits that could explain the link between intellectual humility and knowledge acquisition,71,7
It is a “T” for tolerance,72,2
I’m assuming this is a recurring hilarious problem,73,7
I photoshopped a shark and manatee together and he is my son my legacy my prodigy the Manatark,74,4
Gas Gas Gas,75,2
This sub right now,76,2
I’ve never read a more accurate tweet,77,2
This took a while ,78,2
There are cheetahs called “supermoms” who are relied upon to sustain their population due to their successful hunting rate One supermom known as Eleanor is thought to have mothered 10% of the cheetah population in the southern Serengeti,79,0
Look me up bro,80,2
Update Still no response from Meghan,81,8
Been on reddit for 7 years now,82,7
7up forever,83,2
Team 7 sucks,84,0
Some serious puppet wizardry,85,3
Rapper Nipsey Hussle killed in shooting outside his LA store Two other men were in serious condition in the incident at Marathon Clothing in south Los Angeles A suspect remained at large,86,7
The only day you can upvote this,87,2
A digital Van Gogh walkthrough exhibition,88,7
Vaccinate your kids,89,7
Got a new scarf at CVS,90,7
Good thing to keep in mind when planning your April Fools jokes,91,4
[SPOILERS] GRRM and some of the young cast from 2009,92,2
Death row inmates not guaranteed a painless death Supreme Court rules | Reuters,93,2
My friend is in this subreddit and hates this picture I have of him so can we make this a meme,94,2
Hella wasted,95,3
🔥 leaping snow leopard 🔥,96,2
TIL that Ed Sheeran never sells front row seats in order to see the real fans right in front of him He gives them away to random fans outside so the front row isnt always just wealthy people,97,2
Road to 100 mil,98,7
Our company has received numerous boxes of nothing inclosed but a post card and paper confetti,99,2
IQ lvl Infinite,100,7
The Chosen One,101,2
Yaree Yaree,102,5
Never let #trashtag die,103,2
American Airlines flight departs Manchester 22 minutes early without passenger  and blames passenger,104,7
Youre Spiderman but you have no web so you use your neck to necksling around the city Also youre a deer [Deeeer Simulator],105,7
Ever since I found out that Steve improvised the kiss with Oscar Ive been impressed that Rainn just got up instinctively to kiss Oscar because Dwight would have done it,106,7
OH NO NO NO,107,4
My mom found a couple photos while cleaning today Junior year 2002 rural Midwest,108,2
How can someone not love this,109,2
🚨🚨🚨 CONGRATULATIONS PEWDIEPIE IS BACK IN THE LEAD THIS IS EPIC 🚨🚨🚨,110,2
Sarla Thakral the first woman in India to pilot a plane This was 1936 and she was 21,111,6
Friends with everyone on the internet,112,2
Luckily we can appreciate this armor this day,113,2
Kobe,114,5
The most underrated character in The Office,115,2
Republicans Relax Trump Only Endangered National Security 4–5 Times Tops,116,2
That one stings,117,2
YouTube algorithm is RNG,118,6
The worlds largest furniture retailer IKEA has revealed that 70% of the materials used to make its products during 2018 were either renewable or recycled as it strives to reach the 100% mark by 2030,119,2
A friend of my friend just did this to their Seniors Graduation Ceremony Let this be in LWIAYBrad1,120,8
I have had this saved for like a year now hope you like it,121,2
Part 2,122,7
This dude thought his paintings were good enough to get him into art school in Vienna LOL,123,2
US Open is planning to use dogs for the upcoming tournament,124,2
Bills Have Dominated the Super Bowl Era,125,2
2meirl4meirl,126,8
A quiz while you browse the memes,127,2
Playing with knives,128,2
Death box UI options,129,2
ok,130,2
Gay mod stands no chance,131,7
it’s a simple spell,132,7
Francisco Cervelli reassures his pitcher Trevor Williams as he calls for a low curveball Williams executes perfectly,133,9
When the squad decides to run one while you were booting up because it was taking too long,134,2
Well honed reflexes,135,1
mom why you do this,136,2
April Fools Day in a nutshell,137,2
I live in Florida and can confirm,138,6
This is fun,139,7
Top ten anime comebacks,140,2
I guess its the opposite,141,2
Its April Fools day The mods are mute Upvote a picture of,142,2
Show me the light,143,2
Team 5 > Team 7,144,0
Living out the dream with each other,145,2
PsBattle This Nacho Libre themed kids birthday party,146,2
The cactuses are starting to bloom here in Arizona,147,5
Avengers Endgame Low Budget Trailer,148,2
Til that Harvard student and seminarian Jonathan Daniels traveled to the south to aid the civil rights movement He was walking with a black girl when a deputy pointed his shotgun at her Daniels jumped in front of her sacrificing his life so that she could live,149,2
Let me see some ass with some stretch marks,150,2
So happy,151,4
[Image] You can put down the Red Bull now,152,7
Pewds is really suffering from success,153,7
Thanks I hate everything about this especially the hands,154,2
she caught a damn lightsaber with her hand,155,4
Let the arguments begin,156,4
Team 7 mega gay,157,0
For ur congratulation vid pewds,158,2
2meirl4meirl,159,8
Looks like your good to go,160,2
Alright lets do this one last time,161,2
Nice cover up,162,7
The war no one wanted to fight,163,2
Dog park experience exceeds expectations,164,2
Tis major oof,165,2
BBC News No clear backing for Brexit options,166,7
KOTOR was great you can @ me,167,2
TIFU By thinking my new headset was broken for 6 months,168,7
Technically not wrong,169,1
Best way to bait someone out of hiding Start a fake gunfight with a nonexistent enemy team and wait,170,2
Rick Scott’s Company Committed Historic Medicare Fraud He Will Now Lead Trump’s Health Care Push,171,2
RIP Obama,172,4
Its april fools Quick get this siege tower to the front page,173,2
I wanted to give something back,174,2
Mr Mittens Master of the Glowy Toebeans,175,5
In Prometheus (2012) the android David has the logo of Weyland Corp (the company that created him) on his fingerprint,176,8
nice hit right there,177,7
Get ready boys,178,7
Mmmmmm,179,8
PiCk uP a ScIenCe BoOk,180,7
It’s S o u p t I m e nibbas,181,2
The new look is a triumph,182,7
My gf made a cheese board that looks like a shoreline,183,2
Today hundreds of women will find out they’re pregnant but nobody will believe them until tomorrow,184,2
Hopefully we can all find someone who loves you like I loved this cake 1985,185,2
That was unexpected,186,4
elephants without trunks or ears,187,0
same energy,188,2
The one who is just chilling out and enjoying its life,189,2
There is no other way,190,2
For the new emperor,191,7
Make a wish pixel art 200x250 px,192,2
You get $10000000; but from now on your teeth are naturally flaccid and become hard whenever you are hungry Do you accept and why,193,9
Mr Speaker Id like to put forth a motion to officially declare all Britons crazy Thank you,194,7
Cigarettes are bad mkay,195,2
I liked the cat,196,2
Riot sends imaqtpie a message,197,2
Rise up comrades,198,6
Deal with it,199,7
What is happening,200,5
This is broken,201,7
Allow me to teach you the dance of my people,202,2
Bumble bee in real life,203,7
Today Is the 7 year anniversary of one of the greatest parodies of all time,204,2
Rippy slippy,205,3
1 in a million save as Pathfinder,206,2
How do they do it,207,0
twas like the spanish inquisition,208,7
SO SAD,209,7
mmm bred,210,6
Roses are red I think Justins fainting,211,7
meow_irl,212,0
I genuinely cant believe this lmao,213,2
Maybe 2 nukes were not enough,214,7
This painting was hanging in a McDonalds Everyone looks like they hate their food and the little girl is 65 years old,215,2
Mods uber gay,216,7
Shower though,217,2
Having to use this bread to make sandwiches with,218,7
me_irl,219,6
Amazing AI powered robot that aims to eliminate interior painting and painters,220,7
hmmm,221,4
Obamagon,222,0
I knew that therere more hidden messages in the song,223,5
Pewds made an oopsie,224,2
Say hello to summer,225,9
This has so much potential,226,2
I hate that I have this image on my phone,227,2
Güten Pränk,228,0
PsBattle The president of the Czech Republic on a roller coaster with his security,229,9
Just looking at Google Earth 🌍,230,4
Amen,231,1
Gatekeeping spirit animals,232,7
Me irl,233,5
My mom in 1993 Lithuania 17 years old,234,2
rScience is NOT doing April Fools Jokes instead the moderation team will be answering your questions Ask Us Anything,235,8
This building may be the most evil thing ever constructed,236,2
Who here likes SNAFU,237,4
Cabin bedroom in Big Sur,238,2
Some are good girls,239,7
Horizon Zero Dawn  Comic Review,240,6
I drew Mecha Mr Mime,241,1
Happy April 1st,242,4
Do you ever find people too attractive that they look boring,243,2
I’m officially addicted and can’t stop painting these,244,2
Super Mario Bros Endgame,245,2
Best thing I’ve seen all day,246,2
Had to make a birthday cake for my Canadian friend,247,2
Six years of chasing my wife with a lobster,248,7
This futuristic Amazon blimp pumps out drones,249,2
Her reaction to having her photo taken,250,2
New York lego store knows what theyre doing,251,7
This is Violet she is Deaf and Blind but is responding well to touch signals,252,1
Happy birthday Shirley Curry,253,4
Komodo island is reportedly closing until 2020 because people keep stealing the dragons,254,7
Ultra HD Meme,255,9
Please stop,256,2
TIFU by thinking divorce was an April Fools Gag,257,1
TIL a 96yearold selftaught conservationist dedicated the last 40 years of his life to saving North American bluebird populations building and monitoring 350 nest boxes all across southeast Idaho In part from his conservation efforts bluebird populations have significantly rebounded,258,7
This guy is Harith Al Sodany An Iraqi spy who infiltrated ISIS Having gained the trust of the ISIS high command Captain AlSodany began working as a facilitator Successfully stopping 30 SIEDs and VBIEDs Full story in comments,259,7
Hank getting to play in his new pool for the first time,260,2
My first console as a kid was a PlayStation Back then I would never have dreamed of this but my friends and I are releasing our first game on PS4 today,261,2
This is in the book I’m reading,262,2
In a 500 day period someone could have met someone got married gave birth to a child got divorced and still would have been using the same box of Q tips,263,2
To sound literate,264,0
Currently over 4 meters (13 ft) of snow at Riksgränsen skii resort in northen Sweden,265,0
Poster for “Joker” with Joaquin Phoenix,266,9
Hmmmmm,267,1
Mickey mouses ears always look round from any angle therefor they are balls,268,0
HD meme,269,9
Can we please do this,270,9
Pewdiepie as a Bollywood actress took my computer billions of hours to train,271,2
The first step towards darkness,272,2
Martin Shkreli Placed in Solitary Confinement After Allegedly Running Company Behind Bars Report,273,2
Forever disappointed,274,2
It’s hard cleaning up after others without praise So please tell me I did a good job #trashtag Alaska style,275,2
When someone tells you a man walks into a bar joke,276,2
Puerto Rico,277,1
Dunno tgays reddit,278,7
Murica,279,9
i had a stroke while making this,280,2
What is likethe point,281,2
Me_irl,282,6
A meteor impact 66 million years ago generated a tsunamilike wave in an inland sea that buried fish mammals insects and a dinosaur the first victims of Earth’s last mass extinction event The death scene from within an hour of the impact has been excavated at a fossil site in North Dakota,283,7
My mechanic uses old Barber shop chairs for the waiting area,284,2
Grey hound starts zoomie riot at dog park,285,7
vIcious dUCk ATTaCks HelpLess CoLLegE StudENTS,286,2
Moss terrarium looks like a mystical forest,287,7
Just a baby Hippo,288,2
Bill Gates and Elon Musk should teamup and make a medicine to treat erectile dysfunction,289,7
This isnt a joke Cindy,290,1
Audio engineer YouTuber does video on how music industry screws fans 6 months later Warner Music Group not only demontizes the video but blocks and censors it from YouTube,291,7
This UPS man taks pictures with dogs on his route (long picture),292,2
Drill InstructorsDrill Sergeants of Reddit what’s the funniest thing you’ve seen a recruit do that you couldn’t laugh at,293,1
‘It’s no longer free to pollute’ Canada imposes carbon tax on four provinces,294,7
I have waited a long time for this,295,7
Welp Ganon is in for a rude awakening,296,0
Oh You sorted by new,297,7
Pen that cant be clipped onto jacket when opened,298,2
The perfect pancake,299,2
Pure wholesomeness,300,4
Im freaking out,301,4
LPT If a service dog without a person approaches you it means the person is down and in need of help,302,2
The 4 Flavorbenders Champions of Food,303,2
They mask his voice because he’s in witness protection,304,7
Sadie looking like a distinguished and elegant lady,305,7
Mí familia,306,6
For the last 28 years i’ve wanted a dog more than anything just never happened Reddit meet the newest member of my family Daisy ),307,7
Chinese woman with 2 passports malware arrested at Trumps MaraLago Club,308,7
Every Time,309,2
Man chokes cashier for putting chips and canned goods in same grocery bag,310,8
Now wait a minute,311,2
Saudi Arabia has given the four children of slain journalist Jamal Khashoggis children milliondollar houses and monthly fivefigure payments as compensation for the killing of their father,312,6
But i doubt they will,313,9
White House No Longer Enthusiastic About Releasing Mueller Report,314,2
Me_irl,315,6
Me and my best friend circa 1958 on a hot summer day in Wichita Kansas,316,8
Seriously Walt,317,2
Van Gogh Starry Night Exhibit at Amsterdam Light Festival,318,7
The saddest pun,319,6
Best werewolf movie transformation scene of all time,320,2
A man’s best friend,321,2
What Borderlands looked like before the switch to cell shaded,322,7
What is the greatest upset in sports history,323,2
Dont know why i never thought to post this but it occurred that my Skyrim map signed by all the devs is something you guys might be into,324,2
Oh how far weve come,325,4
Just trying to inform,326,7
REVOLUTION HAS BEGUN,327,9
Committed fisherman great catch and sportsmanship,328,5
Such a patient mom,329,9
Dad puts together a budget costume,330,2
[Spoilers] New Season 8 Poster,331,7
Hugh Jackman recognizes an old student of his who became a reporter,332,2
This TV channel minimizes and mutes the currently airing program to display commercials on top of it,333,3
Good luck to him,334,7
AMC Movie theatres to host 59 hour of all 22 Marvel movies,335,2
I made a custom 100million trophy in 3D it would be super cool if Felix saw it for LWIAY ),336,2
Bringing back this format for the Pooh memes,337,2
2005  Thought I was the coolest Still do,338,2
Fanart for Congratulations,339,4
Girl who likes “The Office”,340,2
Just why you do that,341,0
Barr overstepped his authority and undermined the integrity of the Mueller investigation,342,8
This is my constant state,343,7
A lonely woman aged 70 decided that it was time to get married She put an ad in the local paper that read,344,2
Wait for it,345,2
Single line drawing of Audrey Hepburn,346,9
WE👏ARE👏200000👏 AHEAD 👏OF 👏TSERIES,347,5
my 2 year old decided my laptop should be on Hard Mode from now on,348,2
Hi Brad,349,7
Father admits to staging home invasion to cover up his theft of daughter’s Girl Scouts cookie sales  National,350,2
Everyone has to do their part,351,7
🔥 Redheaded Tit 🔥,352,2
Mirror flip,353,7
Every bus rider knows this,354,2
Instant Karma,355,5
Incorrectly installed part led to gas leak One fatality and 3 injured after explosion when workers were sent to investigate,356,7
2meirl4meirl,357,8
I was at the gas station today and I saw one dog on the top of this truck As I approached more and more dogs got up from their nap to greet me In total 6 adults and two puppies Best day ever,358,2
top photos taken seconds before disaster,359,2
MRW Ive been holding in a fart all day and I finally get home,360,2
Nothing to SEE here,361,2
Absolute madlad writes a book,362,6
All the time right,363,2
Justice Department says attempts to prevent Netflix from Oscars eligibility could violate antitrust law,364,7
NYT crossword today Halfway through it I was like what the hell this cant be,365,2
Of all the inventions of the last 100 years the dry erase board has to be the most remarkable,366,7
That moment when Pewds makes a comeback after releasing a new song,367,2
Purely exquisite meme,368,9
Counties with more trees and shrubs spend less on Medicare finds new study from 3086 of the 3103 counties in the continental US The relationship persists even when accounting for economic geographic or other factors that might independently influence health care costs,369,7
A blinging video of my prosthetic leg,370,9
Marvel Studios’ Avengers Endgame | Special Look,371,2
Killer smile on that bird 😬,372,2
Relatable,373,6
When we rescued him from the Humane Society for $5 he was shaved and looked like a mangy stray Little did we know that Bagheera was actually a majestic Norwegian Forest Cat,374,4
Thou Shalt Not Nerf Bunker,375,5
Driver doesnt go aroundabout,376,2
Access Granted,377,7
PsBattle This car stuck in the snow,378,2
Puerto Rico did NOT get 91 billion dollars in hurricane relief Puerto Rico suffered 91b in damages appx 3000 people died but received only 1b in relief Lies from the President about American lives,379,1
North Carolina GOP chair indicted on bribery charges,380,4
Perfectly balanced,381,1
The og British battle royal,382,7
Comparison between the London Tube map and its real geography [OC],383,7
Baking is mostly just gluing broken plants back together with eggs,384,7
Gaydoof,385,0
Me 1985,386,2
Superbad to the Oscars Jonah Hills evolution from schlubby comedy star to two Oscar nominations in Moneyball & Wolf of Wall Street Growing up idolizing Stanley Kubrick and Martin Scorsese hes set his sights on directing more projects,387,7
Detective Pikachu (2019) | Official Chinese Poster,388,7
Yes,389,2
Flower Dress Photography 2511 × 3139,390,5
[Borderlands 2] The light on the dualshock changes depending on the elemental effect of your weapon,391,2
Former Federal Prosecutor On Mueller Never Took Me 400 Pages To Say ‘Nothing’s Wrong’,392,2
Made this buisness card for my niece to give out everywhere She’s 7 and “always forgets one of the em” Face palm,393,2
I took this photo of a ballerina in the blue hour I think it turned out pretty good,394,2
I got banned from dankmemes so imma post here,395,2
I diagnose myself with depression,396,9
Playing Minecraft at 130 am on a cool 2012 summer night,397,2
Me irl,398,5
More than 20 African countries have joined together in an international mission to plant a massive wall of trees running across the continent The treeplanting project dubbed The Great Green Wall of Africa stretches across roughly 6000 miles (8000 kilometers),399,7
Death is near,400,7
When they know better than “science”,401,4
Quite,402,4
My package that was two weeks late finally arrived,403,2
It was an attempt at being healthy,404,7
A timeless classic,405,6
meirl,406,2
Early Ronald McDonald was nightmare fuel,407,8
Family dinners are usually awkward,408,7
Ended up in Tatooine looking for two droids,409,4
The True Master of the Universe,410,2
I tried [OC],411,7
You aren’t a man unless you have tattoos,412,6
The Alligator Snapping Turtle,413,4
Wow,414,6
Me_irl,415,6
Lost me in the first line not gonna lie,416,2
*Poops*,417,8
Holeinone for $1000000 during the Outback Steak Golf Tournament @ Devils Ridge Golf Course In North Carolina,418,2
In Norway electric cars outsell traditional ones for the first time,419,2
Yeah that’s me,420,2
When I noticed the new rmemes logo,421,7
Got room for one more,422,2
Just a 9 year old cop using code PewDiePie,423,2
The water rises,424,2
Just loving it,425,1
He only took his glasses off,426,2
Waking up to a front page post never felt so good,427,2
Time to dig,428,2
Chased down a Gibraltar the other day turns out he was just a wandering merchant,429,7
The world is 70% water buddy and,430,2
Run lady run,431,7
Made this yesterday but couldnt post,432,2
Alternative Reality if Felix just cooked Hotdogs,433,2
Make sure your profits come in with a bang Invest in this OC now,434,2
UK parliament never disappoints,435,2
Wingman here,436,1
2meirl4meirl,437,8
I thank the 7 people who see this meme,438,2
I’m guessing this guy on my Facebook did not in fact hustle himself a Korean Chick,439,2
LPT when buying a new appliance (eg washer dryer dishwasher) ask an appliance REPAIRMAN which model he recommends Don’t ask the salesman at Lowe’s,440,4
IQ200,441,1
My hobby is 3D printing painting and assembling these kinda statues,442,4
Bruh,443,9
For everyone else who thought a Mars rover was about the size of a dog,444,2
Pronouncing a word the wrong way is a sure sign that you learned it by reading it,445,2
hes not wrong tho,446,1
Blankets,447,0
Red cars go faster,448,7
This right here is why I love my home town Never change Glasgow 😂,449,2
Two babies too young to be vaccinated infected with measles in Sydney,450,7
He went all out AGAIN,451,2
How BioWare’s Anthem Went Wrong,452,1
hmmm,453,4
