Title,doc,topic
2meirl4meirl,5387,8
Thats how they talk,5388,7
Sooooooo anyone else have this happen,5389,2
If Bronn arrives at Winterfell in EP3,5390,9
TINY Lego Cable Car I made,5391,4
[Image] Anything is possible,5392,7
Antivaxxers in a nutshell,5393,0
Me when i get annoyed by seeing the same meme template over and over,5394,2
Invest in this meme and stuff you’re pockets with profits,5395,2
MFW my entire role this season is to walk out when important people are talking,5396,7
Actual footage of people trying to get tickets for Avengers Endgame in my city a few hours after prebooking started [OC],5397,2
He didnt even attempt to enlist the services of twenty good men,5398,7
A meme for the dark mode 9 year olds,5399,9
Wholesome Greentext Anon is loved,5400,2
I hope this hasnt been done before,5401,2
Britain has broken its record for the longest continuous period without generating electricity from coal,5402,2
My friend is absolutely stunning and does professional modelling but she does post unflattering photos to prove that you don’t have to be perfect to be beautiful and to show that every body has flaws even if you can’t usually tell,5403,2
Sometimes you think it b like it b but it dont b like it b,5404,7
Dont spoil it,5405,7
⚠️ TRIGGERED ⚠️,5406,5
How to trick kids into adding $199 onto a restaurant bill,5407,4
Unsubscribing to rASOIAF and rGameofthrones for the run of season 8,5408,7
[Homemade] pierogi,5409,4
Lets pour one out for our Ser Brienne,5410,2
Got engaged near the Golden Gate Bridge I was psyched with how the photo turned out,5411,7
Your “logic” deserves a slap in the face,5412,4
My phone died permanently so I deconstructed and framed it,5413,7
This Muslim woman took a photo In front of an antiMuslim protest like a pro,5414,7
Avengers Endgame flip book,5415,2
Thanks to VR we can now experience lag IRL,5416,2
I think this might be my best meme so far,5417,2
Anon loves his mom,5418,9
This reply is for all the antivaxxers out there,5419,5
Full SelfDriving Tesla,5420,2
The real thanos,5421,7
give me your teeth,5422,2
A single egg carton,5423,2
TIL Lemmy Kilmister of Motörhead loved to play a particular arcade game at his local bar When he found out he was terminally ill the bar owner brought the game machine to Lemmys apartment so he could keep playing it at home,5424,2
Apparently one of my students has been hiding this lil dude in her dorm for a few weeks,5425,7
Start the easter fire with style,5426,6
On any given day 1 in 5 American youngsters dont drink any water at all finds a new study of US children and young adults in JAMA Pediatrics and those who dont end up consuming almost twice as many calories from sugarsweetened beverages “Drinking water is the healthiest beverage to drink”,5427,7
26 years ago today Shaq tore down the entire backboard as a rookie,5428,7
buzzfeed back at it again,5429,7
Human thoughts before language must have been weird,5430,2
Wholesome gatekeep,5431,2
Horses on a Plane,5432,2
Pettiness level 10000000 My husband was angry this morning so he decided he was only making his half of the bed,5433,7
Maisie addressing the white elephant in the room,5434,7
moderator considers banning the CEO of reddit,5435,7
Seen at my local Home Depot,5436,2
Donald Trumps UK State Visit Faces Maximum Disruption Protesters Vow to Make Trip as Unpleasant as Possible,5437,7
This sub,5438,2
Indoor waterfall at Jewel Changi Airport,5439,5
My little brother tried making memes on our switch,5440,2
I hate signing yearbooks for students so I had a rubber stamp made,5441,2
Wholesome tall people,5442,2
A new instrument is born,5443,2
Tobacco company Philip Morris starts life insurance firm that offers discounts to smokers who quit,5444,9
Hope this doesnt die in new,5445,2
What is your childhood memory that you thought was normal but realized it was traumatic later in your life,5446,2
Shiny noodle,5447,0
Damn,5448,4
Thought this needed to be shared,5449,2
Marvin looking dapper in his new bow tie,5450,7
We have no idea whose cat this is but she visits every day I think she accepted me today,5451,2
Shigeru Miyamoto speaking in English at Nintendo GDC 1999  A Gem that I found today,5452,4
Jaguars Are Powerful Swimmers,5453,1
[SPOILERS] I made a Character Safety chart for Episode 3,5454,2
Just finished my MK table Hope you like it,5455,2
It only takes a few to start a moment of Thousands,5456,2
Woman arrested in dumping of 7 newborn puppies into Coachella dumpster,5457,6
Were all together as one,5458,2
Donald Trump was asked what the J in Donald J Trump stood for,5459,2
Great idea,5460,2
Intruder alert Red spy in the base,5461,8
The kid at school who thinks theyd be good in a war starterpack,5462,2
Tailgater didnt know who he is messing with,5463,4
Reddit admins how much time do you spend daily lurking on Reddit,5464,7
Nobody touches my Robbie,5465,2
Video,5466,2
That was the secound obstacle,5467,6
Calm down,5468,2
The problem with anime fans,5469,2
Moved in with this guy in 2013 and lived with him for 5 years while he studied dentistry As of today hes officially my dentist 😍,5470,2
Maurice Tillet the French wrestler who was supposedly the inspiration for the character Shrek,5471,8
Yep not boring at all,5472,5
its old style but it will do,5473,2
[No Spoilers] I’m a balloon artist so I made this for my One True King,5474,2
Cops of Reddit whats the funniest change in (already perfectly legal) behaviour people do in front of you when they realise youre there,5475,2
Bald Guinea pigs look like little hippos,5476,7
me irl,5477,5
For real,5478,7
2meirl4meirl,5479,8
So much quieter and smooth,5480,0
[OC] Franchise Earnings Comparison Over 20 Years,5481,7
I found this rare pup in the wild but it turned out he had a friend,5482,2
Can we get an oof for our little friend,5483,2
This is getting out of hand Now there are two of them,5484,7
I heard black cat adoptions have gone down because they are harder to photograph for social media Reddit meet Beans,5485,2
Perhaps Google is incomplete,5486,8
The true rap God,5487,2
felt relatable might delete later,5488,2
Cute cat react to duster,5489,2
Just remember,5490,2
100% expected all three to fit am now mildly annoyed,5491,2
This is so cute,5492,2
true,5493,2
The Great Republican Abdication | A party that no longer believes in American values,5494,2
UPS will start using Toyotas zeroemission hydrogen semi trucks,5495,2
Today’s The Deadline For The IRS To Hand Over Trump’s Tax Returns,5496,2
A Parisian woman with her cat in her cannabis garden 1910 ⁣,5497,6
I was looking for my room for 5 minutes because my hotel room was number 606 and I went left,5498,7
Chocolate tart,5499,2
TIL Max Yasgur who hosted the 69 Woodstock concert received only $10K shunned by his neighbors gave free water and milk to guests and was hailed He died 4 years later and received a full page obituary in Rolling Stone as a non musician,5500,2
Reddit meme on Facebook this genuinely makes no sense on there,5501,2
Mueller report Russia hacked state databases and voting machine companies Russian intelligence officers injected malicious SQL code and then ran commands to extract information,5502,8
Wife rescued a pregnant barn cat so the kittens wouldnt go feral Found homes for all of them but were keeping this guy Reddit meet Arthur,5503,2
Delicious,5504,7
The worlds first Keanu Reeves film festival (KeanuCon) will take place in Scotland in 2 weeks During the weekend there will be screenings of almost every Keanu Reeves film along with Q&A Bill & Ted double presentation special guests and a postscreening concert,5505,2
KISS ME,5506,7
Choo Choo MF,5507,6
Its his 1st birthday  he finally grew into his ears,5508,2
TIL Gary Hart a politician running for president in 1988 invited the media to follow him around after he was alleged to be a womanizer He was quoted as saying “Follow me around I dont care Im serious” Members of the media complied and he was caught having an affair 2 weeks later,5509,7
Skyrim 100 template is immortal,5510,7
Twitter CEO Gently Tells Trump Your ‘Lost’ Followers Are Bots and Spam Accounts,5511,2
All dressed and asking for attention,5512,9
A Wisconsin DUI case in which police drew blood from an unconscious man is headed to the US Supreme Court,5513,2
On April 23 2005 (14 years ago today) the very first YouTube video was uploaded,5514,7
Silent but deadly,5515,9
I never realized,5516,2
Doing the marathon at AMC They gave everyone blankets and hygiene kits,5517,4
Every Red Carpet Premiere in a nutshell,5518,7
me_irl,5519,6
Cringe tuesdays intro improved version,5520,7
What we learned about marijuana,5521,4
me irl,5522,5
Expectations vs Reality,5523,7
The president has fallen,5524,1
Carl had one of his eyes removed last year and at first it was like he forgot how to walk These sunglasses started as a momentary joke but legitimately seemed to help him (maybe by slightly obstructing his remaining eye’s vision) they were like an ignition key to get him to walk along normally,5525,7
Just try and tell me they arent the same person,5526,2
This guy putting an ad over the SpaceX launch,5527,8
The cuttingedge of cocking about,5528,5
Man of no culture,5529,2
I adopted my best friend yesterday These pictures were taken 4 hours apart On the left Zip at the shelter On the right Zip when I brought him to his new forever home,5530,2
The cutest house tigers,5531,2
Hello Mr Bond Ive been expecting you,5532,7
TIL that in the US a check does not need to be written on a bank check It can be written on anything (including clothing) and legally be cashed as long as it includes the proper information,5533,7
Disgusting behaviour from the world,5534,2
Yeet,5535,1
Best Burger in New York Starter Pack,5536,6
It was getting crowded in Heaven one day so Saint Peter decided for one day to only accept people who could make him laugh,5537,2
Skipper my boy  we’ve done it,5538,2
Oh God,5539,4
[Spoilers] Maisie’s latest tweet,5540,7
It’s not over till she says it’s over Invest and you can profit while losing,5541,2
good boy do not climb into that divine,5542,4
Vin Diesels Groot jacket is awesome,5543,9
A student is suing Apple Inc for $1bn (£077bn) claiming that its instore AI led to his mistaken arrest,5544,4
The guy that makes these is going to heaven,5545,2
This is in a nurses office at a school for 1719 year olds I,5546,2
Lets go paperless,5547,6
Are we winning yet,5548,7
meirl,5549,2
No Hostiles I would actually use Bloodhound if they buffed his scan,5550,1
Poor Theon,5551,4
Steve Golin producer of Spotlight,5552,7
Downtown MPLS,5553,2
Former Trump campaign chair Paul Manafort is now in federal prison,5554,7
Nice tattoo,5555,7
Amazing chalkboard artwork,5556,7
The Downside of a perfect fit,5557,2
I set a reminder for this date,5558,2
I rely a lot on the first 23 Pokémon in my party,5559,2
Bear’s first time in the mountains and needless to say he’s in heaven,5560,7
Wanted to get in on this (OC),5561,2
So Wholesome,5562,2
to resist,5563,4
Our candy comrade,5564,0
Who else here remembers Madeline,5565,6
Surfer rides a wave created by a train,5566,8
This is terrifying,5567,0
Doot doot,5568,5
A girl I went to school with posted some pictures of her art Her little brother comments on it and makes grandma extra proud,5569,2
Not mine therefore hilarious,5570,7
theres always two options,5571,7
Samsung to recall all Galaxy Fold review units,5572,6
My reality until a few months ago,5573,7
Patient snow leopard mother with her cubs,5574,7
I know too many people like this,5575,2
nice mem haha nerpice,5576,7
Apple Ring Pancakes,5577,2
Procrastination,5578,6
Every Kanye album cover in the style of every Kanye album cover,5579,2
Pretty mind blowing when I first found out,5580,4
Instagram has ruined a whole generation,5581,9
I only sleep with antivaxers,5582,3
🔥 An olive tree in Italy known as The Thinking Tree 🔥,5583,2
It be like that tho,5584,7
🔥 NJ at 730pm today I swear I did zero editing 🔥🌈,5585,2
One Bas Ass Dude,5586,7
“I would like to see the beaches of Naath again” Clocking it now everyone thinks Grey Worm is doomed but it will be Missandei who dies I’m thinking Grey Worm will bring her body back to Naath and become protector of its “peaceful people who can’t protect themselves”,5587,2
Yeaaahhhhh boyyyyyy,5588,8
Be like that it be sometimes,5589,7
Our heroes,5590,9
Just like the Warriors,5591,7
Threading the needle,5592,3
So sorry were not more sorry,5593,2
Tips on becoming rich with a webcam,5594,5
The worst kind of person,5595,2
I tried to recreate a joke to get this dude out of my inbox Expectation vs reality at its finest,5596,7
A rival to the Asian tourist,5597,7
My man know how it really is,5598,2
Rowchimin guardian of the 7 seas,5599,0
[OC] Franchise Earnings Comparison Over 20 Years,5600,7
I need some advice So I and my friend are building a castle and we wanted some cheap statues and I was just wondering what you guys think about this,5601,2
Always remember buzzfeed bad,5602,2
Me_irl,5603,6
Environmental kill team wipe ),5604,1
I am Michio Kaku physicist futurist and author of THE FUTURE OF HUMANITYAMA,5605,3
kitten,5606,2
Absolutely cozy bedroom,5607,2
My [33 M] wife [32 F] hit me at a family BBQ Everybody laughed,5608,2
She told something good now,5609,2
When your dog crashes your photoshoot and makes it 10000 times cuter,5610,2
what is this post doing in the new posts section this has to be on the hot posts section,5611,1
Smol paws,5612,8
Oh on Jah,5613,4
Sooo Apparently Epic games has been making People work 100h weeks to push out content You know what I can wait for the next Apex update I dont want Respawn to destroy themselves or go full EA So let Respawn Employees have a life Lol,5614,2
What is the irl equivalent of coming back to a lvl 1 dungeon as a lvl 100 character,5615,7
At Last Scientists Have Found The Galaxys Missing Exoplanets Cold Gas Giants,5616,8
A Doc Badge Animation,5617,2
Rocktype Eeveelution Graniteon,5618,9
I hope this wont die in new,5619,7
Uh oh here they come,5620,4
*1863 FBI intensifies*,5621,2
Gamers of Reddit what gaming experience will you never forget and why,5622,2
Rave Queen,5623,6
Goddess of Cozy,5624,6
Yee to your haw,5625,3
a digital painting I made,5626,2
Brothers implicated in Jussie Smollett hoax attack sue the Empire actors lawyers,5627,7
Frick Off,5628,2
ESAM disrespects Simon player,5629,5
TIL that in Australia when it gets very hot the nectar in some flowers ferments and turns into alcohol The bees get drunk and are not allowed back into the hive,5630,2
EP tries to bully a platoon of Infantrymen in DC on the 4th of July Learns the errors of her ways,5631,4
DeAging One of the many things the MCU does best,5632,2
Tolkien estate disavows forthcoming film starring Nicholas Hoult  Lord of the Rings author’s estate declares it did not ‘approve of authorise or participate in the making of’ new biopic,5633,7
Malawi becomes 1st nation to immunize kids against malaria,5634,3
Failing to impeach Trump would set a dangerous precedent,5635,2
rich kids will never understand,5636,7
cRaZeD oLd MaN mErCiLlEsSlY hUnTs DoWn TeRrIfIeD tOrToIsE,5637,2
I know it’s a dead meme just need to get it out there,5638,2
PSA to anyone buying MK11 the harder towers are literally impossible without rare or better gear and single use consumables earning these are incredibly grindy and the whole system is designed to get you to spend money on the game,5639,2
Buzzfeed is back what a surprise,5640,7
You can always count on dad,5641,2
When one door opens [OC],5642,2
200 iq,5643,7
I can’t stop listening to Jenny of Oldstones Daniel Portman sang it beautifully,5644,2
he really fits his character,5645,7
Party is over time to back home,5646,2
This is perfection,5647,6
Math class in a nutshell,5648,2
A treatment that has restored the movement of patients with chronic Parkinsons disease has been developed by Canadian researchers,5649,2
A Reds fan tried to catch a foul ball,5650,5
Possibly yes not,5651,2
This is good,5652,2
Woof_irl,5653,6
Did I waste my time,5654,2
One of the most badass photos ever taken,5655,2
mom memed epic style,5656,2
I drew the ONLY joke my Mom knew,5657,7
I asked this dapper gentleman for his photograph while out one evening in Cannes FR He was confused and said But I am no one I must disagree He is,5658,2
This is Love,5659,2
Ape using a Smartphone,5660,5
He tries his best,5661,8
Coachella The content farm,5662,7
They had us in the first half,5663,2
Im an event photographer but I wasnt allowed on the floor because of a special guest I found the balcony instead,5664,2
Guys I figured out why Skyrim Skill memes wont die,5665,2
You have been visited by Peaceful Pupper 1000 years good luck,5666,7
These stones beneath Lake Michigan are arranged in a circle and believed to be nearly 10000 years old Divers also found a picture of a mastodon carved into one of the stones,5667,2
Baby boomers share nearly 7 times as many fake news articles on Facebook as adults under 30 new study finds,5668,7
Choose wisely,5669,1
This sign prohibits smoking dogs from entering a bar’s outdoor seating area,5670,2
Dame hits the game winner at the buzzer | TNT,5671,2
People diagnosed with depression are more inclined than healthy controls to choose to listen to sad music A new study in the journal Emotion suggests that depressed people are not seeking to maintain their negative feelings but rather that they find sad music calming and even uplifting,5672,7
TIL Einstein failing a math exam is a myth He failed the entrance exam to Zurich Polytechnic because he did poorly on botany zoology and language sections,5673,3
Smol pup goes awoo,5674,8
8 tricks Dexter can do in a minute  sit paw other paw high five say please down roll over jump up 😸,5675,2
what happens when you ignore your cat for too long,5676,6
My dads latest painting Congrats Tiger,5677,7
The real MVP,5678,7
I drew a slightly more realistic Bowser I’m not sorry,5679,2
Inherited this amazing chess set from my father Just thought Id share it,5680,2
Some things are better than money,5681,2
Just another mirror,5682,7
In Guardians Of The Galaxy Vol1 part of her description shows shes the last surviving member of her race Thanos never went back to check on her planet after he saved them to see if he actually helped,5683,7
At least my Crush,5684,2
If this was already on here my apologies but its definitely true,5685,2
You can also see Saturn during the day if you know where to look This was taken from my backyard at 7am [OC],5686,2
If this isn’t the most relatable thing you’ve ever seen we have an issue,5687,2
We all panic sometimes,5688,7
Cosby b,5689,7
The absolute best cheerleader,5690,8
Vasili Arkhipov (1960s) During the Cuban Missile Crisis a false alarm of nuclear war almost made a Soviet nuclear submarine near the US launch its nukes However the order for a launch needed 3 approvals and Arkhipov refused So this guy is the only reason why all of us are still alive today,5691,2
Vegan café that charged 18 per cent man tax set to close,5692,2
Update,5693,8
Unprecedented UN Finds USBacked Forces Killed More Afghan Civilians Than Taliban and ISIS Did So Far in 2019,5694,9
Elon Musl progression to Memelord,5695,7
Respect bilingual people,5696,7
Redditors with toddlers what’s the most recent illogical breakdown they’ve had,5697,2
An old drawing of Tyrion Lannister I did,5698,2
Laser focused on ya,5699,2
hmmm,5700,4
old but gold,5701,2
2meirl4meirl,5702,8
Colorful hair dye job,5703,7
The US government is targeting immigration lawyers activists and reporters at the Mexico border a leaked Homeland Security database confirms,5704,2
We couldn’t find Harry (dog) or Winston (rabbit) anywhere Then my little sister busted them returning from an adventure along the beach,5705,2
With the new update can we get a F in the chat for these legends,5706,7
Blursed_NicholRoss,5707,5
Finally the eggs have hatched,5708,6
No one would ever know if a tree chirped like a bird,5709,2
The true reason why the Skyrim Skills wont die,5710,2
This guyll tell you how to get in shape (Protip he wont),5711,9
What’s the most personal thing you’re willing to share with us,5712,2
So I was scrolling through random rooms and I found this gem 👌👌,5713,7
6 hours of labor for $15,5714,2
When your boss walks in just before you mess something up,5715,2
Jake Paul has joined the chat,5716,3
Let it Grow,5717,7
Yeah Pretty much,5718,2
Its finally done I crocheted all gen 1 Pokemon,5719,2
Found this in my grandparents boardgame collection,5720,4
Somebody stop him,5721,2
The pinnacle of my Minecraft career,5722,2
The good stuff,5723,2
Cry yourself a river build a bridge and get over it,5724,9
You lied to me,5725,5
38 dogs found at home of woman who left 7 newborn puppies in a dumpster,5726,2
Film Academy Passes Vote to Rename Best Foreign Language Film Category to Best International Feature Film,5727,8
Thats a nice hat,5728,7
me_irl,5729,6
More than 12000 Boy Scout members were victims of sexual abuse expert says,5730,7
Heh,5731,8
A Excavator Operator at Bauma in Germany digging at a jobsite in South Korea,5732,7
Awesome 2B cosplay [Nier Automata],5733,6
Stackoverflow in a nutshell,5734,0
My boy Pod,5735,4
This is outrageous It’s unfair,5736,2
Being cute is exhausting,5737,2
This meme is going to die in new because of its quality,5738,6
I will never be this cool again,5739,2
Cardi BAD,5740,2
I bet he look really stupid right now,5741,2
Perfect timing,5742,2
How do you feel about the recent YouTube videos profiting off of people’s raskreddit threads and personal experiences,5743,7
[Homemade] Cheeses,5744,4
[SPOILERS] What I wanted from Aryas new weapon,5745,2
To steal an egg,5746,2
We shouldnt see it guys,5747,2
It makes sense to me,5748,2
Me_irl,5749,6
Childcare is sooooooo easy it should be cheap right,5750,2
America in 1945,5751,0
Oof,5752,2
All the motivation you need to carry on,5753,6
A woman visiting a pack of wolves that she raised 7 years ago,5754,7
Differences between Ukrainian Russian and Belarussian elections,5755,8
[SPOILERS] Every time someone secondguesses Jon I think of Ser Alliser,5756,2
In “AntMan and the Wasp” Hank Pym’s new lab is built out of blown up LEGO panels,5757,7
Saving Private Ryan Returning To Cinemas Starting June 2nd To Commemorate 75th Anniversary of DDay,5758,5
Somebody said Black cats are hard to photograph for social media Well meet Fig,5759,2
‘We will declare war’ Philippines’ Duterte gives Canada 1 week to take back garbage,5760,2
Surely Its a Coincidence That a Firm Tied to a Russian Oligarch Is Pouring Millions Into Kentucky,5761,8
Some magic,5762,0
Rolling with the equality times,5763,7
Nvm this is not my exit,5764,2
How my brother got grounded for a week,5765,2
Very wise to invest all,5766,5
It has to be done,5767,2
Netflix show producer calls out article for not crediting the shows actual creator,5768,2
🔥 The legendary giant white moose,5769,2
Minecraft has Finnaly implemented the Australian language into their game,5770,2
One brick is good for attacking but a lot of bricks are good for defending,5771,2
The best thing about GoT IS US GUYS,5772,2
The 30 Rock scene that won Alec Baldwin an Emmy Jack Gives Tracy Therapy,5773,2
🔥 Absolute unit of a Pallas cat 🔥,5774,2
Damian Lillard quotes Sun Tzus The Art of War “It is the unemotional reserved calm detached warrior who wins not the hothead seeking vengeance and not the ambitious seeker of fortune”,5775,2
This photo of a pelican trying to eat my phone,5776,7
The Future Is Now,5777,2
cheese,5778,3
Lets give it up for the Russo Brothers for directing 4 great movies in the MCU,5779,2
Today is my girl’s last day on Earth I just want everyone to know she was a dope ass dog and had to leave the party early Flourish in paradise PK,5780,2
I used to be an Intel fanboy but,5781,4
This absolute unit of a great white shark,5782,2
🔥 eastern ring necked snake 🔥,5783,2
Jotaro and Giorno play Minecraft,5784,2
LONG BOI,5785,6
Like it’s over scoob,5786,2
Abusers and human traffickers will often force victims to get tattoos as a way to exert control A Wisconsin woman is giving survivors a fresh start by removing them for free,5787,2
We get it youre cool,5788,2
The banners took too long,5789,6
Legends,5790,7
Twitter CEO Gently Tells Trump Your ‘Lost’ Followers Are Bots and Spam Accounts,5791,2
Level of nastiness I pick up every R301 Carbine I find in a game change their fire mode to singleshot and then drop them all again,5792,2
Ghosted,5793,6
Instagram is ruining everything (a rant),5794,4
Thanks I hate customer service even more now,5795,2
Fbi open up,5796,2
A JJ Abrams twist unlike any other,5797,0
Calling out newspaper for peddling inaccurate headlines,5798,4
Quiet white man noises,5799,2
Why dont you kill Hibana,5800,7
Tropic Thunder stands to have one of the best opening scenes in film history,5801,2
Trying to look legit when you have no idea what you’re doing starter pack,5802,2
A newly discovered ancient crab that lived during the dinosaur age had a hodgepodge of body parts is being called a beautiful nightmare,5803,2
This is beyond Science,5804,7
Those are very choice words for deodorant,5805,7
Intel Wishes,5806,0
2meirl4meirl,5807,8
PsBattle Gordon Ramsay,5808,7
Tim Cook Apple donates $0 to political candidates and doesnt have a PAC because they shouldnt exist,5809,4
Please dont patch this,5810,9
Another detail which ties the MCU films together we saw the teacher in SpiderMan Homecoming as a university student in The Incredible Hulk,5811,7
[Image] It is the unemotional reserved calm detached warrior who wins,5812,2
Awe the size of this lad,5813,6
Does this format have potential,5814,6
Just a small chance,5815,2
they will never learn,5816,7
Dame waves goodbye,5817,9
Resonance of Sand on a Speaker,5818,7
Why tho ,5819,1
MCU things drawn by me,5820,7
The Toronto Maple Leafs have been eliminated from the Stanley Cup playoffs after losing to the Boston Bruins in 7 games,5821,7
