Title,doc,topic
Christoph Waltz Joins Wes Andersons The French Dispatch  Joining Saoirse Ronan Timothée Chalamet Willem Dafoe Tilda Swinton Bill Murray Adrian Brody Benicio Del Toro Léa Seydoux Jason Schwartzman Owen Wilson Frances McDormand Jeffrey Wright and Henry Winkler,3579,8
My moms first time visiting Paris,3580,2
How to get to the high ground on Petra as any hero in Deathmatch,3581,2
Turning a van into a home,3582,2
Feel the Burn,3583,7
HOT freshly baked meme straight out of the EU oven Invest now for RAGING profits,3584,2
Clean Window,3585,6
Eviiillllll,3586,9
I fell on my first run of the day,3587,2
I still love her though,3588,2
[Spoilers] tl;dw Game of Thrones Season 8 Episode 1 Recap,3589,2
I bet he didnt see that coming,3590,2
Handsome Jack approved,3591,2
me_irl,3592,6
Alexandria OcasioCortez ‘I Support Impeaching This President’,3593,2
It depends on the perspective,3594,7
The IrnBru Throne,3595,9
Where Californians move to when they leave CA [OC],3596,7
Makeup artist highlights what Facetune really can do,3597,7
🚨🚨🚨⚠️ SUBGAP IS NOW 145000 ITS TIME FOR ANOTHER COMEBACK LETS DO THIS⚠️ 🚨🚨🚨⚠️,3598,7
Guy gets confused over a random goat and llama encounter,3599,2
Seriously stop,3600,2
Please just go buy one,3601,2
Say Thankyou to Elon Everyone,3602,7
Our general is surrounded,3603,7
Dogs would try harder to not get hair everywhere if they knew they were they reason for the vacuum being used,3604,7
Waiting at the airport for grandma and grandpa to arrive,3605,2
hmmm,3606,4
F,3607,2
Sweet dreams,3608,2
Looks like I won,3609,7
Notre Dame is in golfed,3610,9
The lighter side of horror movies,3611,1
The star doggo (I have over a thousand pictures of dis boi),3612,1
Ayo anyone got a light,3613,2
TIL that the desk in the Oval Office is called the Resolute Desk named after the ship it was built out of in 1880 The HMS Resolute was found empty and adrift in packice then salvaged by the US and gifted back to the UK which helped narrowly avoid a war FDR would add the front to hide his polio,3614,7
Please Consider Donating to The Cause,3615,9
Im a soldier like you,3616,2
Just mind your business,3617,4
[OC] Because I can’t afford the real thing,3618,2
The next fitness craze,3619,4
I can only imagine what this does to highbeams,3620,9
Im just posting this because this picture gives me a good chuckle every time I watch it and it’s a cool wallpaper,3621,2
Test1,3622,9
POOR UMBER BOY,3623,4
Hmmmmmm,3624,6
Thanks i hate faceswap,3625,2
Phineas and Ferb memes are on the rise,3626,6
How Marvel shot some of the fight sequences for Civil War,3627,8
As a 1997 baby I find this offensively accurate,3628,1
When you wanted those elephants,3629,0
I loved him like he was my own,3630,2
Mini cannon,3631,1
Add it to the periodic table,3632,2
Bill Weld I’m Running Against Trump in the Republican Primary,3633,2
Its hot real hot,3634,7
TIL the beard of Tutankhamun’s golden mask fell off during a cleaning process in the Egyptian Museum in 2014 The workers used epoxy glue to reattach the beard but since it wasn’t the professional method and permanent damage had been done they were prosecuted in 2016,3635,2
what are the odds,3636,8
Don’t give up my beautiful friends,3637,2
Bran,3638,7
Wind Chimes,3639,7
hehe,3640,9
What about black ice shield I saw it by accident but this is so dope,3641,2
Too true,3642,2
What the hell is the point in attaching a resume when submitting an online job application if you just have to manually enter everything thats on it when applying,3643,7
Interesting phenomenon,3644,5
What are the chances,3645,4
DABBER the Doer of All Drugs,3646,3
Every Single ½ Hour of My 2018 Recorded [OC],3647,7
That is the thing,3648,2
[No Spoilers] Turned out better than expected,3649,2
I drew the POKEVENGERS  9 of Earths mightiest heroes and the universes greatest threat (A Pokemon X Avengers crossover),3650,9
A hacker group from four chan calling themselves anonymous,3651,6
People are getting banned for reaching the frontpage and Im here like,3652,2
Car pool (OC),3653,2
2meirl4meirl,3654,8
[Screenshot] Horizon Zero Dawns Insane Rendering Distance,3655,6
TIL Americans who only had to pay for the pedestal of the Statue of Liberty struggled to pull together funding Joseph Pulitzer started a crowdfunding campaign and gathered $100000 from more than 120000 contributors most of whom gave less than $1,3656,7
It looks so small from that angle,3657,7
OFFICIAL Kings Announce Luke Walton as Head Coach,3658,6
Repuxt,3659,5
Legand says that she is still typing to this day,3660,2
Yet they never answer,3661,2
The true battle,3662,2
Lets be realistic guys there is only one person that everyone wants to be like,3663,2
Churning These Out,3664,8
[Spoilers] After tonights episode all I want,3665,2
Plants That Keep Bugs Away,3666,7
8lb axe head with a 3ft handle,3667,8
I’m gonna say the Nword,3668,2
Scientists confirm Kraft Dinner has never once successfully fed four people,3669,7
My roommate and our porch,3670,6
Oh no,3671,4
Ovechkin demolishes Svechnikov in a fight,3672,9
Some wacky people,3673,7
The hardest choices require the strongest will,3674,0
Antiwind bills in several states as renewables grow increasingly popular The bill argues that wind farms pose a national security risk and uses Department of Defense maps to essentially outlaw wind farms built on land within 100 miles of the state’s coast,3675,7
[WP] In the future illiteracy is the norm and implanted digital assistants convert text to audio A child who had his implant temporarily deactivated learns to read When the implant is reactivated he realizes that what it reads to him is drastically different than what the text actually says,3676,2
Can I get an E in chat,3677,2
Never seen this before,3678,2
The person who would have become the greatest pianist probably never played; The greatest mind for science may never have been educated The most naturallytalented at something went through life not knowing or ever realizing their potential to be worldclass at something,3679,2
Unlimited power,3680,0
You fool,3681,7
[Homemade] a grazing table I did for my birthday,3682,2
me_irl,3683,6
Response in progress,3684,8
[Slpt] you will need this tip to understand women completely,3685,6
The True Heir Of The Iron Throne,3686,2
You me same same,3687,0
Portrait of my soulmate done by Stampy Goblyn @ Seven Swords in Philadelphia,3688,2
Where are all the RvB memes,3689,2
Hitting ‘GREET’ then ‘ANTAGONIZE’ for the same stranger,3690,9
🤨😑,3691,0
The way his upper body barely moves,3692,2
My friend and I walked around the city after it rained looking for puddles Heres what I captured,3693,2
Broken sign went full showerthoughts,3694,2
Please forgive if already posted I lold hard,3695,9
Reggies last day as President of Nintendo of America You were the best like no one ever was Reggie,3696,2
Mama cat bringing her kittens to her human’s bed as a sign of trust,3697,2
They invite me to every party,3698,2
Lose Some Weight,3699,8
Went all out on this one,3700,2
New study finds simple way to inoculate teens against junk food marketing when tapping into teens’ desire to rebel by framing corporations as manipulative marketers trying to hook consumers on addictive junk food for financial gain Teenage boys cut back junk food purchases by 31%,3701,7
Both weigh 500g but the green one is in a 30% BIGGER BAG MORE TO SHARE,3702,2
the way forest looks from the sky,3703,7
do I look cute,3704,2
The Bishop of Paris in tears has told the French press that After fear of their destruction all 3 irreplaceable Rose Windows considered the greatest medieval artwork still in existence have survived They took years to build in the 13th century,3705,7
Too soon,3706,7
NASA sent mice into space and the results are unintentionally hilarious,3707,7
Learn from the past but give Today the chance to be better,3708,2
In Australia high is the second lowest fire danger rating,3709,1
Catch Of The Day,3710,2
I like to design stupid products for fun so I created blinds for my sunglasses,3711,9
Fake story behind a photo in rtrashy gets called out,3712,2
Lose Some Weight,3713,8
Notre Dame fire fund hits 300 million euros and rising as second billionaire Bernard Arnault offers to pay 200m,3714,2
Nice Shot,3715,7
Horsepower,3716,7
People getting off planes in Hawaii immediately get a lei If this same tradition applied to the rest of the US what would each state immediately give to visitors,3717,2
I remember last year when I Visited the Notre Dame So sad now,3718,2
Popeyes biscuit,3719,0
Max Kellerman tries to cover up a fart with an awkward cough,3720,7
me irl,3721,5
The Holy Samoyed,3722,7
Uber lets female drivers block male passengers in Saudi Arabia,3723,6
I care so much about my homies,3724,6
RIP Alexander Hamilton,3725,4
Little girl gets to meet her hero,3726,2
Disappearing act,3727,1
Applying this mask,3728,9
2nd attempt at making it to LWIAY since animated memes are popular now lol,3729,2
me_irl,3730,6
My brother just earned his Doctorate,3731,7
Greatest party trick ever,3732,2
White Man Gets 10 Years in Prison for Trying to Hire Hit Man to Lynch Black Neighbor Hitman was Undercover FBI Agent,3733,2
You suddenly have all the money youll ever want or need in your life Whats the first thing you do with your newfound wealth,3734,2
Square donuts have 27% more donut per donut and take up roughly the same space as a round one,3735,5
Like father  like son 🙂,3736,2
Aged well this has,3737,1
You hate to see it,3738,2
You gotta do what you gotta do,3739,7
Seems sadly realistic,3740,9
Jumping in the haystack Intensifies,3741,6
A husband notices his wife’s hearing is deteriorating and decides to visit her doctor for advice,3742,2
Ant bite,3743,3
Betty Whites smile 1963,3744,5
His rap name is Lil Chonk,3745,7
Here buddy have some of this,3746,4
Challenge ON,3747,2
The dragons ate ghost,3748,0
Litty,3749,7
I just wanna send a big thank to Tinder I tried it for fun but it brought me happiness,3750,2
The reunion I was most looking forward to,3751,4
Thanks for sorting by new,3752,7
YouTube mistakenly flags Notre Dame Cathedral fire videos as 911 conspiracy,3753,9
This tortoise was raised with these dogs since birth and now they are inseparable,3754,0
im just gonna wait till Apple does it,3755,4
Relatable,3756,6
My friend was splitting logs and found an arrow head,3757,8
5000 pieces later,3758,2
It is a hard choice so why not both,3759,7
My neighbor was watching our foster dog and his daughter returned her like this,3760,2
In the country where you live what would be the equivalent of losing Notre Dame,3761,2
True genius,3762,2
Rain got in between the double layered glass of tram,3763,7
SupermanShazam The Return of Black Adam (2010) took the fight scene from Undisputed 2 Last Man Standing (2006),3764,2
I usually use real life scenery as inspiration for my level designs Hope u like it,3765,7
The secret to success,3766,5
How to overcomplicate a linear scale,3767,9
Therapy dog cheering up her human,3768,2
How do they do that,3769,0
This art restoration soothes me down to the soul,3770,2
Marvel art,3771,2
[NO SPOILERS] This blue eyed boy had better make it to the end,3772,2
Mark Zuckerberg leveraged Facebook user data to fight rivals and help friends leaked documents show,3773,2
Oops,3774,2
TIL that BTS a sevenmember South Korean boy band brings in more than $36 billion to South Koreas economy each year and were the reason one in every 13 foreign tourists visited the country in 2018,3775,2
Why you cant drop water on burning buildings,3776,2
hmmm,3777,4
Stop posting Notre Dame You arent as creative as you think you are,3778,2
It be like that,3779,7
Born 19961999 and confused about what generation they belong to starter pack,3780,6
NotreDame cathedral fire fully extinguished,3781,1
Welcome to the real world kid,3782,7
Mom please,3783,9
This sub is incredible,3784,2
Trust me I’m an engineer,3785,2
My friend really had to go and flex on us with a custom engraving,3786,2
Florida man,3787,2
Overhead view of a tanks smoke screen,3788,2
Evasion 100,3789,7
If insects had to introduce themselves,3790,4
What are some things that people dont realise would happen if there was actually a zombie outbreak,3791,7
How Popeyes Be Training They Employees,3792,0
An unwanted job opportunity,3793,2
Unique in palaeontology Liquid blood found inside a prehistoric 42000 year old foal,3794,2
This is what causes hate crimes,3795,2
Who is Garfield,3796,6
Movies are typically more enjoyable on their first watch while songs are typically more enjoyable after a few listens,3797,1
I am Everywhere Jon,3798,7
Spoiling endgame should be ban worthy,3799,2
White House officials concerned about being exposed by Mueller report,3800,2
Ah yes thé ball bounces,3801,6
Sanders town hall audience cheers after Fox News host asks if theyd support Medicare for all,3802,2
How to waste 100$,3803,7
Not even if there’s a fire,3804,4
MRW I turned on the news today,3805,2
My (future) wife with her Nintendo in 80s,3806,2
Press F,3807,2
TIL that street dogs in Russia use trains to commute between various locations obey traffic lights and avoid defecating in high traffic areas The leader of a pack is the most intelligent (not strongest) and the packs intuit human psychology in many ways (eg deploying cutest dogs to beg),3808,7
Invest now in this burning hot OC and shower yourself with profits,3809,5
Shiba Inus Right hook punch,3810,2
Cops Are Trying to Stop San Francisco From Banning Face Recognition Surveillance  San Francisco is inching closer to becoming the first American city to ban facial recognition surveillance,3811,2
The begining of a troublesome twosome,3812,6
It may be mandatory to leak the full Mueller report to ensure its release,3813,2
JUliET fINDs rOmEo DeAD aNd TAkES hEr LiFE,3814,7
We dont need no water,3815,7
When everything just clicks [Sekiro Shadows Die Twice],3816,7
Maggie’s Sweet 16 Birthday Steak,3817,2
Three Musketeers,3818,7
[SPOILERS] The dragons knew something was a little off,3819,2
2meirl4meirl,3820,8
TIL that Victor Hugo wrote the Hunchback of NorteDame to inform people of the value of Gothic architecture which was being neglected and destroyed at the time This explains the large descriptive sections of the book which far exceed the requirements of the story,3821,2
Lou Williams eats nachos after dropping 36 points in the biggest comeback in NBA Playoff history,3822,9
This is so sad,3823,7
Gonna leave this here,3824,2
High tech indoor farms use a hydroponic system requiring 95% less water than traditional agriculture to grow produce Additionally vertical farming requires less space so it is 100 times more productive than a traditional farm on the same amount of land There is also no need for pesticides,3825,7
proud gen Zs rise up,3826,6
I said yes ),3827,2
Cat cant quite come to terms with their owners makeup mask,3828,2
How dare you Homan 🐈,3829,8
Look how bobs fat flows into the radiator,3830,2
And then this happened,3831,2
Imagine this in real life,3832,7
Stupid wamens,3833,2
Bagged milk,3834,2
An absolute masterpiece,3835,2
I swear 90% of people will understand this,3836,7
PsBattle Tom Morello attending a Rage Against the Machine tribute bands show,3837,9
I told a girl I had a Llamborghini she wasnt impressed,3838,2
I love these two,3839,7
Sea side restaurant built into the side of a cliff,3840,1
2meirl4meirl,3841,8
Found this scrolling through twitter,3842,7
I recently started applying for jobs after taking an extended break unemployed,3843,9
If I donated blood and then person who got my blood immediately went and murdered someone and left some of their blood at the crime scene is there a chance DNA results show it was my blood,3844,2
French forces say theyll use everything but Trumps suggestion to fight the Notre Dame fire,3845,9
I went to Medieval Times cosplaying as Link and that dork popped the question Thought you guys would appreciate this c Best day ever,3846,2
PsBattle George Lucas in the set of GoT,3847,2
Bernie Sanders says its a disgrace that Amazon and Netflix pay nothing under Trumps tax bill,3848,7
Seeing as the last picture of Gracie got so much love thought I would upload a video If you leave the door open while you have a bath she will get up on her back legs and poke you as if to check you are OK and to ask why on earth you would voluntarily be in water 🛁🚿,3849,2
Quinn trying new techniques to get her tail,3850,7
Oh I’m sure that’s exactly what happened,3851,2
Sometimes Ill let noobs kill me I want them to have a good experience in their first couple games,3852,2
Thank god it’s still in tacked,3853,2
We are so close to release Eyes up,3854,2
TIL that in some countries including China Russia Mexico and Germany there is no punishment for escaping from prison because their law considers it human nature to want to escape No extra time is added to an escapees sentence provided they did not break any other laws in order to escape,3855,7
Gun crime,3856,6
Réalité est souvent décevante,3857,5
A beautiful place to wake up in,3858,4
Sorry for the Twitter layout,3859,2
Doge Chad Much Strong Wow,3860,6
Notre Dame Cathedral Light show,3861,2
Why does it work like this,3862,2
Wrecking Balls new highlight intro is the best thing ever Especially with the High Roller skin,3863,1
Uncanny🤔🤔🤔,3864,3
Epic Games vs Steam,3865,7
The poor not that guys kid,3866,2
This tool from a restoring video,3867,9
A smooth excavator operator,3868,0
Does this work for this sub,3869,2
Mother and baby potoroo enjoying a snack,3870,2
Those masters of manipulation,3871,2
Please dont buy pepsi Tseries,3872,2
communism intensifies,3873,6
What boats,3874,6
Exclusive What to Expect From Sonys NextGen PlayStation,3875,9
I don’t even need a title,3876,2
Well🤔,3877,3
every time,3878,2
My uncle sends me updates on his cats,3879,2
I fell 15 feet and broke 16 bones,3880,2
hmmm,3881,4
TIL that George Orwells use of 2+2=5 as a catchphrase of the dystopian government in his book 1984 is based on Joseph Stalins use of that equation in propaganda Soviet posters declared 2 + 2 plus the enthusiasm of the workers = 5 long before Orwell wrote his novel,3882,7
2meirl4meirl,3883,8
Will have your children for 200kyear,3884,6
Cat brought this in and I’m trying to keep it safe What kind of rodent is it,3885,2
The LEGO set we need,3886,2
[Post Game Thread] The Los Angeles Clippers (11) defeat the Golden State Warriors (11) in a nail biter 135131,3887,1
Big F to Cobblestone structure,3888,2
So we should definitely do that,3889,4
Thanos Preparing for Endgame Episode 7 Rocket,3890,0
Bran during the cut scenes so he can get his ass in position to stare at somebody,3891,7
This guy in action,3892,2
NJ ban on gaytostraight conversion therapy for kids won’t be overturned as US Supreme Court rejects challenge,3893,2
My bunny really likes the bed,3894,7
Top Countries by GDP Per Capita Over The Past 200 Years (18002016) [OC],3895,7
real centaur hours who up,3896,0
Pepsi bad Coke good,3897,2
me_irl,3898,6
Wait That s illegal,3899,2
Dominus protector of pies,3900,5
Dark mode gang rise up,3901,6
I know its my fault,3902,4
Sorry what happened 30 years ago,3903,7
*crunchy sounds*,3904,9
EA bad company,3905,2
This is DRstrange be like him,3906,7
if this aint the truth 😓😳,3907,7
An opossum monching on some foods,3908,1
I am debating to adopt the whole family because my heart is so weak to just pick one,3909,2
Season 4 please be here soon,3910,2
The road,3911,4
God Knows Where I Am (2016)  The body of a homeless woman is found in an abandoned New Hampshire farmhouse Beside the body lies a diary that documents a journey of starvation and the loss of sanity but told with poignance beauty humor and spirituality,3912,6
Nasa Astronaut Owen Garriott dies at 88 on april 15 He flew on the Skylab 3 mission and later the space shuttle,3913,5
My life is basically over,3914,7
“hey everyone I studied abroad for a month” starter pack,3915,6
This senior dog and goat LOVE hiking together,3916,2
Guys,3917,2
Nimbus turns 2 today Here he is at 16 weeks compared to now Hes grown a bit,3918,2
Wow I never knew this,3919,7
It’s not fat enough,3920,2
I hope they remember you,3921,2
Cash me outside,3922,2
I made the Nintendo Switch box art in the style of the Nintendo 64,3923,2
Everyone talks up Black Panther for being really diverse but in reality its one of the least diverse films ever made,3924,2
Hehe,3925,9
Stop sending your kid over I am NOT a babysitter,3926,2
[NO SPOILERS] A reminder that PROJECT INSIGHT has launched (once again) and this sub is a spoilerfree zone for everybodyAll posts are being manually approved and all spoilerfilled discussion should be contained on our stickied megathreads,3927,1
TIL that if the Axis ever captured Gibraltar during WWII the British planned to seal 6 men in a secret cave overlooking the harbour to secretly monitor and radio back enemy movements The cave had enough provisions for the men to stay for up to 7 years,3928,7
Totally didnt plan a week in advance and risk my life taking this photo for 7 internet points,3929,7
Kladdkaka  Swedish Chocolate Cake,3930,2
So nice and round,3931,7
Meirl,3932,2
Dirt bike rider goes of cliff,3933,7
RIP 1345–2019,3934,4
Oof owie who left that in my cave,3935,2
Big f,3936,2
Squirrel Eating Avocado With Avocado Hat,3937,5
A Liger which is a cross between a male lion and a female tiger,3938,2
Perfect plates dont exi,3939,7
The perfect haircut,3940,2
04172019 found today in North Carolina,3941,4
DLC required,3942,5
Ringing the bell after a 51day hospital stay recovering from my so far successful bone marrow transplant,3943,4
Somewhere in Switzerland,3944,1
Just watched a guy go into the wrong bathroom at Toronto Pearson Airport He was looking at the top sign,3945,2
Thats the way it be,3946,2
This higly detailed graffiti at my local train station,3947,1
Wholesome Wednesday,3948,2
CB doesn’t get invited to bachelorette party bc she’s a downer She threw a GIANT fit until the bride finally said what the hell you can come The next day bride and all 17 females received this email from CB CB IS NOT the bride or in the bridal party and was invited out of pitty I can’t 😂😂😂,3949,2
Choo choo danger noodle coming through,3950,6
Report card day at daycare,3951,2
I was stopping at a red light she was reaching for her cigarettes,3952,7
Point blank period,3953,2
My daughter got published by GameInformer this month She’s a Undertale fan,3954,2
A Fathers Love,3955,7
Plaque at my university showing that it is the birthplace of Reddit,3956,7
Rise,3957,6
I love this,3958,2
This embroidery took me over 40 hours to finish but Im so proud of it,3959,2
Who needs an AI when 13 year old kids can tell you just as easy,3960,2
This will be a new meme tamplate,3961,6
Dad No you are not allowed to bring that dirty stray in Imagine all the diseases it’s carrying Absolutely not and that’s final,3962,2
You never go full Shackleford,3963,2
Typing the word skepticism is like playing Pong with your keyboard,3964,2
If you curse at inanimate objects no one cares but if you talk nicely to them people will think you’re crazy,3965,7
me_irl,3966,6
Saving a dog from the dogcatcher,3967,7
haha,3968,2
Im going to bed,3969,7
The few the brave the noteworthy,3970,0
Why,3971,0
Maybe Earth’s like the uncontacted tribes in the Amazon the whole Galaxy knows we’re here but they’ve agreed not to contact us,3972,7
Lurkers of Reddit why do you lurk,3973,7
prescription,3974,8
Someone put this woman in a bacta tank,3975,2
People hoping to skip queues by standing like this and trying to slip in,3976,7
Felt cute might grill my foot later idk,3977,2
scathing reviews,3978,6
France is to invite architects from around the world to submit their designs for a new spire to sit atop a renovated NotreDame cathedral,3979,7
Man I love post malone but this is hilarious,3980,2
Cat accidentally tastes peppermint,3981,2
Found this on my car after school Definitely makes me not want to buy one,3982,2
Alexandria OcasioCortez quits Facebook says social media is a health risk,3983,2
Country road Northern Ireland,3984,7
How our cat greets (only) my husband every day after getting home,3985,2
Well steamed peppers,3986,1
The year is 2030,3987,2
Roll Tide,3988,2
My 13 yr old daughter draws stuff I think shes pretty good,3989,2
Surgical precision,3990,9
Smh mom,3991,2
this rolled up piece of a train ticket looks like a cigarette burning (OC),3992,2
The most impressive thing about going to the moon was coming back,3993,2
So that’s why cats don’t like water,3994,2
Get out of my swamp,3995,9
Free fake internet points,3996,2
meirl,3997,2
PsBattle Elijah Wood and a fan,3998,2
Deaccent,3999,1
The maddest of lads who would ever do such a thing,4000,2
I dont own this joke But i havent forgotten about it for five years,4001,7
TIL a woman in Mexico named Ines Ramirez performed a Csection on herself after hours of painful contractions Fearing that her baby would be stillborn she drank 2 cups of highproof alcohol and used a kitchen knife to make the incision Both the mother and the baby survived,4002,7
Getting a teeth ball for your dog,4003,2
The Tampa Bay Lightning have been eliminated from the Stanley Cup playoffs after being swept by the Columbus Blue Jackets,4004,7
to insult capitalism,4005,2
I hope this meme isnt already dead,4006,2
Huskey throws a tantrum because he has to leave the dog park,4007,2
Keep looking there must be one even bigger,4008,7
🔥 Rare yellow harp seal striking a pose,4009,2
Bullseye,4010,5
The brains of dead pigs showed restored cellular activity after they were hooked up to a system called BrainEx 4 hours after death It did not restore consciousness but revived circulation to arteries small blood vessels and capillaries,4011,0
Little bunny is enjoying the breeze,4012,6
You activated my trap card,4013,1
