Title,doc,topic
This would make an awesome anti-zombie fortress.,0,4
I can't tell the difference between /r/firstworldproblems and my Facebook news feed,1,4
My version of the 'Voice Activated Printer' april fools prank... currently causing mayhem at my workplace. COPY!.... COPPPYYYYYYYY!!!,2,4
This needed to be done.,3,9
TIL that you can link YouTube videos on Imgur.,4,4
I must go,5,2
"I know I wasn't supposed to, reddit - for April Fools I told my boyfriend that I am pregnant ....",6,4
Is it still common knowledge that when people flash their lights at oncoming traffic it means there is a police car up ahead???,7,4
Mexico City looks like an urban ocean from up there. Awesome National Geographic photo.,8,4
Holy legalization batman! Every member of Seattle's legislative and municipal government delegations now on record in favor of legalizing marijuana in Washington state,9,9
Afghan Mob Kills 10 UN Workers (to protest Koran- burning by Florida Pastor Terry Jones),10,4
All day today on Reddit,11,4
My officë printër prank backfirëd...,12,8
Cars should definitely come with this feature,13,4
Project Bieber: For April fools this year I've decorated my sisters desk,14,4
Joe Miller's amazing story.,15,8
Sweet armor bro,16,4
anyone else?,17,4
Greatest kids show host EVER!,18,4
"Man spent 14 years on death row because prosecutors withheld evidence, Supreme Court refuses to hold them accountable",19,4
"Actually, it WOULD make an awesome fortress, stacks of corpses or not!",20,9
found this fossil in my backyard.,21,2
Chihiro!,22,3
I used to miss Mitch Hedberg,23,4
She let dozens of horses starve to death and only got misdemeanors because she works for the Illinois state government,24,4
"The JobsOhio Scam: Sell $7B in tax revenue to a private company for $1.5B. Since that company has no starting capital, accept payment in bonds. Oh yeah, and Gov John Kasich is chairman of that company. The US is now literally being looted.",25,4
"Whoa he caught it, WOW",26,8
"From now on, Scientific America will give Creationist's and IDer's an equal voice, starting today.",27,4
Hipsters are gonna go insane over this,28,4
TIL that Steve Carell and Stephen Colbert were the voices for The Ambiguously Gay Duo on SNL TV Funhouse.,29,4
Just finished this after a year of tinkering. Thought someone would like it... First Post!,30,4
There are no words.,31,9
here's my son. in a bag.,32,4
Mexican Pres. on the drug 'war': We live next to the largest drug consumer...,33,4
A friend asked me to summarize Arrested Development so I sent him this,34,4
"X-ray, meet stingray.",35,8
"Ok, this is evil. Just plain evil.",36,6
First ti[m]e,37,4
Equal Rights,38,4
TIL Michael Moore ran for school board while still in high school solely to fire his principal. And he did it.,39,4
RIP e,40,2
I may lose a few facebook friends for this April Fool's joke,41,4
... at least they're polite about it,42,2
I gave my girlfriend an old guitar to paint. Here's the result!,43,4
Got a nice gaming mouse? Keyboard? Now you'll just need this.,44,4
Forever Lazy,45,4
Idiots.,46,6
WikiLeaks Billboard [Los Angeles).. we need to support who ever is behind these to get more up.,47,4
Bathroom Secrets...,48,2
Separation of church and state? South Dakota is going to pass a bill to have women wait 3 days before getting an abortion so they can get counseling at a crisis pregnancy center. Except the crisis pregnancy center is really just a center for fundamentalist Christian anti-abortion activists,49,4
"suddenly, a charger.",50,7
"Foo Fighters Streaming Entire New Album, Wasting Light",51,8
Found my yearbook. Thought I'd share my senior picture. Me and my buddies last names both start with V.,52,2
X-post from r/pics,53,8
Why do I fall for this every year? EVERY. DAMN. YEAR.,54,4
Got this biome with seed fabulous. Can we get unicorns too,55,4
"Mold is a bit of fun, but it should not work on r/Suicid3watch and som3 oth3r s3rious subs, Anyon3 agr33?",56,4
Need your mold cleared up?,57,4
It's hot outside today,58,2
"I present to you, the amazing Matt Andersen -- 350lbs the most amazing voice and guitar blues musician -- Ain't no Sunshine [Blues/Acoustic]",59,4
Aw Rebecca Black can make light of herself.... oh wait....,60,4
This fight in matrix reloaded is improved ten fold with the 1911 filter,61,2
Why is this program erroneously rejected by three C++ compilers?,62,2
Found this in my college paper today...,63,2
This is what a good 75% of Minecraft Let's Plays look like...,64,4
I wish I had friends that would give me mold...,65,4
So my prof3ssor gav3 us a quiz today...,66,4
Saudis admit they supported Libya attack to mute US criticism of Bahrain,67,9
1 joint + 1 candle + 28 pastels =,68,2
"What are we going to do tonight, Brain?",69,2
LOL Horse!!!,70,9
Score one for the bad guys! Remember the website that exposed the Delaware government's forcible removal of a basketball hoop (then lying about it on tape) ... well Homeland Security just seized the domain today.,71,2
April Fools from Lord Inglip!,72,4
"On this day, the day of fools I wish to recognize the greatest Troll-God in history.",73,8
Did You Know?,74,9
Minecraft office prank!,75,9
one man band,76,4
Rollerbladers in a water park...enough said.,77,2
Since it'll be on your front page all day... And today is Friday! What a coincidence!,78,4
"Guys, the April Fools video is owned by a redditor, here's the backup, as irrelevant as the first one.",79,4
Mold is spélt Mould.,80,7
How I feel about all the fake web crap on April Fools.,81,4
"I'll be right down, dad.",82,8
Gamestop has Battletoads!,83,5
This is just silly: Obama accepts transparency award in secret.,84,1
GOP plans to cut $1 trillion of military spending. April fools! It's really Medicaid.,85,4
The first full length trailer for The Hangover II,86,2
Friend of mine made a design of Schrodinger's cat ...,87,4
I had to sleep in until 10:00 am today to avoid talking to the cleaning lady.,88,9
Poverty...,89,5
5'10 white guy wins college dunk contest...,90,9
"Are violent movies/shows fine when you're with your family, but anything with sex/nudity too uncomfortable?",91,4
Is that a spider? Wait...,92,5
"Dear /r/atheism, TIL...",93,4
Illustration I did with a pencil.,94,5
"“PC gamers have to understand one thing: they’re irrelevant jerks, and the whole world will be much better off if they would go away forever.",95,4
zombie fortress,96,9
Paper Vs Rock,97,2
AC/DC's drummer Phil Rudd has his marijuana conviction overturned because it would affect his globe-trotting lifestyle,98,9
:3,99,9
"I always pictured myself buying a new kitten from the pet-store, but instead last week adopted this adorable fuzz-ball. Meet our new tail-less member of the family, Ziggy!",100,4
View from my apartment 2 days ago- Over the Clouds,101,4
I think Wil just gav m a Rddit disas.,102,9
Linus being annoyed by the ARM kernel code,103,2
Just a video of a guy making a paper airplane.,104,4
"X-ray, meet stingray. (x-post from /pics)",105,8
That's what she said...,106,4
How the interaction between Goldman Sachs & the Federal Reserve really works.,107,8
"Part of Arizona, embarrassed by the rest of the state, would like to secede",108,9
happy() happy() birthday,109,4
There are many Rebecca Black Remixes. Not many instill sheer terror however. X-post from r/videos.,110,4
DERIVERY!,111,5
What are the odds? MESSENGER finds a lost Mariner,112,8
No Sex Since 1955!,113,4
I'm busy,114,4
Hillary Clinton gave the go-ahead for Saudi Arabia to invade Bahrain and crush the pro-democracy movement in their neighbor in exchange for a yes on attacking Libya.,115,2
Not right now. Batman is busy!,116,9
Pretty serious printer message,117,4
"Actually, I do. Thanks though.",118,4
"“ I’m not an American by accident of birth, as Glenn Beck is. I’m an American by choice. I came to this country.” - Fareed Zakaria",119,4
Nokia publishes Symbian source code,120,8
"TIL that Albert Einstein was 45 years old when science realized that Galaxies existed. At that time, the prevailing view of the cosmos was that the universe consisted entirely of just the Milky Way Galaxy.",121,4
STARCRAFTING,122,5
Hit the drug cartels by legalizing pot,123,9
Sick of it,124,4
Really interesting view of New Vegas: Anyone think that gaming needs more experiences like this?,125,4
"Reddit Mold needs to be MORE VIRAL. Make mold increase over time, and grant a user one (1) mold spore after receiving five or so infections",126,4
Looks like it's Black Friday over at Funny or Die...,127,4
March to stop the freeloaders - The nation’s greedy corporations and insatiable wealthy are fattening themselves on workers. There’s no trickle down. It’s the opposite; the rich have been sucking the economic lifeblood from the middle class for decades,128,8
I just found an iPhone on the street and I don't know how to find the owner.,129,4
Engineering professor covers a tough problem,130,8
Who knew that 10 minutes of a guy talking after having his wisdom teeth removed would be so damn funny?,131,4
Saudi Arabia wanted to know my religion when I entered and exited their country,132,2
"In the UK, unemployment centers are tasked with tricking people into losing benefits",133,5
Paul Krugman is smarter than you. And me. And most of Washington.,134,4
Dachshund gets stuck in a sweatshirt,135,9
What are little things the opposite sex (or same sex) do that seem mundane but you really appreciate?,136,4
Patch 4.1.11 - Possibly the funniest thing I have ever read,137,4
Malkovich malkovich.,138,5
230 to 190 (22 yo) in 4 months,139,4
Fun with Math,140,9
TSA scanning and groping to be banned on a state level? Pennsylvania is the 5th state to consider such legislation.,141,2
"Every comic on XKCD is now in 3D, and it hurts my brain to look at.",142,4
"The GOP in Maine wants to allow kids to work more, and for less money. Ah, America. You're really starting to scare us.",143,4
No mattr what you’r told,144,2
Dachshund vs. Sweatshirt,145,4
Always Pay People You Owe,146,4
The Good Boy and the 'Kill Team' - The army really let me down out here. When I thought I would come here to do any good,147,4
Found my old laser discs. It's gonna be a great night,148,4
"Thank you! It wouldn't have been possible without your combined knowledge, thoughtful discussion and helpful advice!",149,4
DAE eat bread when they were younger by rolling the bread into little balls?,150,4
The Dawn of Starcraft: e-Sports come to the world stage (Ars on the rise of StarCraft 2),151,4
"Redditors in the US with a Wedding coming up, I have a proposal!",152,4
BREAKING NEWS - All dogs are blue now. Every single dog in the world is blue.,153,4
'Terminal' to be removed Canonical states no longer a viable use in modern GUI age so its use will be discontinued,154,4
[April Fools] Hulu goes back in time to 1996,155,4
And so it begins. Gmail Motion.,156,5
Wolves not going through doors? That's because they need DOGGY DOORS,157,4
My mold transition.,158,7
Boston Cream Pie... I think I nailed it!,159,4
Emacs Lisp now lexically scoped. Oh,160,5
DAE not eat McDonald's for dinner because it is so bad for you but treat a McDonald's breakfast like a special occasion?,161,4
Are onions the ultimate ingredient?,162,5
"An analysis of why a prodigious vocabulary is important, or a Thank you to books",163,9
"Reddit on Ultima Online: From six dedicated founders with nothing to the largest and most powerful guild the server has ever seen. Join us for free, redditors, as we expand our empire in tomorrow's elections.",164,4
Every single Senate Republican has endorsed a constitutional amendment that would’ve made Ronald Reagan’s fiscal policy unconstitutional.,165,4
Shouldn't today's logo say rddit?,166,6
"IAmA former student at Columbine High School, and was at school on 4/20/1999. AMA.",167,4
"Yo Reddit, I'm really happy for you and Imma let you finish, but this peach has the best mold of all time. OF ALL TIME.",168,4
Upgrade Completer!,169,7
Brawl in the Family just finished a 10-part story with the best twist ending ever,170,4
Driving Automatic VS. Driving Stick VS. Riding Motorcycle,171,4
Gmail motion,172,4
"Jesus Christ, just give me 5 minutes alone, will ya?!",173,4
2.71828183,174,5
UW Chancellor Martin's response to the GOP open records request against Professor Cronon,175,4
George R. R. Martin's A Dance With Dragons to be split into separate books due to length.,176,4
[and now for a post that is not an April fools joke],177,4
"I'm pretty sure this is the Napoleon Dynamite dance, nice work Google",178,4
Who wants to join my book club?! Our first book is...,179,2
Security Advisory SMB-1985-0001: Plumber Injection Attack in Bowser’s Castle,180,9
Someone mentioned something about April Fools jokes?,181,4
The Origin of Force Quit.,182,4
It's Friday and I can't decide whether to sit in the front or the back of my friend's convertible.,183,4
I bet that's what 90% of you thought about when you got your first wolf.,184,4
"Is Ignatieff shedding his public image problems? He's intelligent, polite and affable, and he might finally be clicking with Canadians",185,4
Reddit Mold: The whole story...,186,4
Louis Theroux: Westboro Baptist Church revisited [Sunday @ 9pm BST],187,7
Not Joking.,188,0
0uch,189,5
"DAE ever feel overwhelmed that our lives are so over-saturated in entertainment choices, that there is so much art and writing and film that we will never get to experience?",190,4
Some sort of new bad-ass fighting style,191,2
"As a British redditor, I refuse to accept the legitimacy of mold.",192,4
Cat welcoming owner after vacation,193,9
People who are more aware of their own heart-beat have superior time perception skills,194,4
SAP Wish3s som3on3 would giv3 him mold,195,4
The Dispenser Bench. Easy crafting and supply.,196,1
pclinuxos.com domain seized,197,4
Weird metal subculture in Botswana,198,4
Just something that occurred to me in the shower...,199,4
This is how I feel about myself sometimes.,200,4
James Cameron wants movies to abandon the 24 frames per second standard and go up to 60.,201,2
Gun lęash,202,8
"I'll let you decide, should I award my student a bonus point for this?",203,2
"ITAP of gravity shifting [My first photo of a series of 365 photos, one a day -- wish me luck!]",204,8
"Found this guy outside my house, cold and starving... meet Marvin!",205,2
Apple patches the Daylight Savings Time bug.,206,4
Coke please?,207,2
"Report: a Single Worker Needs an Income of $30,012 a year, just Above $14 an Hour. That is Almost Three Times the 2010 National Poverty Level of $10,830, and Nearly Twice the Federal Minimum Wage of $7.25 an Hour! Time for Reform?",208,4
Scientists at McMaster U have discovered a vaccine for cat allergies. I can get a kitty!,209,9
Be yourself and only yourself...,210,4
"This is picture of the cat I walk past everyday, sitting like a person.",211,4
My girlfriend puts an interesting twist on an April Fool's Day standby.,212,4
Worldwide PS3 install-base surpasses XBox 360's,213,8
"Notch, wé lové you :D (mold)",214,4
NEW CORKI SKIN: CORKI + URF,215,8
WotC Announces New Chapter for D&D,216,8
Louis Theroux's documentary of Westboro Bapist Church encouraged one daughter to leave the family - now he's back,217,9
"[BAHRAIN] Human right defenders, bloggers and political activists at high risk, currently targeted, or have have had their homes stormed, or have escaped the country, as compiled by Bahrain Youth Society for Human Rights and Bahrain Center for Human Rights.",218,9
"If you fire an arrow straight up in the air and hit yourself, your dog will attack you",219,9
"Nice work, mods. I guess I'm a Bills fan now...",220,4
Something cool my professor did today <3,221,2
Dragon Fortress 2 - The Newest Epic from Valve Software,222,8
TIL Joss Whedon co-wrote Toy Story,223,4
Giants fan critically injured after attack in dodger stadium parking lot. These types of fans disgust me. Respect your rivalries people!,224,4
"No, THIS is how to offend Pokemon, Digimon, and Yu-Gi-Oh fans",225,1
What's the worst thing you've ever done?,226,4
Engineering Professor Makes Mistake,227,8
Data.gov and other transparency sites to be shut down due budget cuts,228,9
ITAP 10 minutes walk from my school,229,4
Am I the only one who doesn't find April Fools so funny?,230,4
Bring back weather!,231,4
Rode my bike to work today...,232,4
Look what a coworker gave me today for free!,233,2
Prime Minister Stephen Harper's personal support for the death penalty is outlandish and out of step with the world at large,234,9
How to properly receive your gift,235,1
Everyone go subscribe to /r/Christianity and /r/Islam for the day.,236,4
I'd like to thank Australia for this beloved contribution to my childhood.,237,4
Make 5 copies!! is what I have been hearing for the past 2 hours at work,238,4
The Guardian's April Fool Royal Wedding blog is genius,239,2
"TIL that Senator Charles Sumner was a leader of the Radical Republicans, campaigned against slavery and for the equal rights of freedmen, and was nearly beaten to death on the floor of the Senate",240,4
"I'm in Santa Cruz for a few days, tips on what to do here?",241,2
Born to troll,242,4
Sonoran - the typeface that will dethrone Helvetica.,243,8
"Well, it looks like the metal Christian books found in Jordan that everyone is excited about are indeed fake. What great timing.",244,4
"I just opened a new tab for Reddit, and during the wait for the three second load to finish, I opened another tab for Reddit so I could occupy time. ಠ_ಠ What kind of bad habits has the internet developed in you?",245,4
They are this cute where I come from,246,4
Just for today Engadget should adopt Gizmodo's page design.,247,4
I hate this crab,248,3
New extended series 6 trailer!,249,4
Stephen Colbert sings Rebecca Black's Friday,250,9
"Dear Reddit: In 1st grade, our teacher had us write letters to soldiers during Desert Shield/Desert Storm. I was the only one to get a response.",251,4
TIL that Whirlpool donates a fridge and stove to every Habitat for Humanity Home built.,252,4
Batman needs to toughen up,253,4
The Original Auto-Tuner,254,4
Opening the hotel drawer and find...,255,4
"When people ask why I love Lady Gaga, I say it's because she's bringing pop music one step closer to this guy.",256,4
It's the only way to be sure...,257,4
Maine to lower minimum wage for minors from $7.50 an hour to $5.25 for the first 180 days of their employment.,258,4
"California, PLEASE Build This!!!!!",259,4
I see your zombie fortress and i raise you a zombie fortress,260,4
"Tea Partiers, FYI: The original Tea Party was not anti-government, they were anti-corporation",261,4
Went hiking today...This is where we ended up.,262,4
The girls in our office did NOT appreciate our April Fools prank this year :),263,4
"I’ve never bribed my way into a restaurant. I’ve never slipped a C-note or greased a palm. In truth, I’ve never even considered it. I’ve assumed, of course, that people do such things. Curious, I hatched a plan...",264,4
This dude(tte?) ran into my office window today.. 30mins and cup of coke later and he was ready to go,265,2
At least one of these girls will grow up to be awesome,266,4
Stephen Colbert sings Friday,267,9
How I felt waking up hung over this morning.,268,4
"Wow redbull, way to step up your nerd game!",269,4
"Researchers at USC respond to Google's April Fool's Day video on Gmail Motion, actually demonstrate Gmail Motion using Microsoft Kinect",270,4
Many Americans have fallen on tough times. Yet the solution to their woes seems so obvious: end the wars and tax the wealthy. Either step alone would put them back into the black,271,9
"Looks like someone, this cloud does",272,4
And India wins the Cricket World Cup,273,9
I asked the creator of Doctor Cat MD to draw the Reddit alien going under the knife,274,4
"TIL China has planted the biggest artificial forest in the world to stop the spread of the Gobi desert, and plans to expand it to 2,800 miles by 2074",275,4
"JTV, you guys are awesome.",276,9
Back to zero.,277,4
My wife made me this book out of relevant advice animals and memes for our 1 year anniversary.,278,2
DAE feel ashamed about specific instances of bad behavior from when you were a child?,279,4
"Jon Stewart: Why Are We Cutting Corporate Taxes? - GE’s not paying taxes … and public employees are the ones we’re calling “greedy, parasitic, and selfish?”",280,9
Indie Game Developers,281,2
New System.,282,9
This is why clothing in magazines always looks so good.,283,4
This dog totally looks like Splinter from TMNT.,284,4
A message from r/exmuslim to r/atheism,285,3
How I felt when I became an atheist.,286,4
Researchers actually implement Google's Gmail Motion April Fools joke using a Kinect sensor.,287,4
I_RAPE_CATS,288,3
I think I solved the zombie fortress problem,289,9
Oh dear.,290,4
Lenin Cat is not impressed with Mr. Popular,291,4
Why do schools only teach that there are 3 states of matter when really there are four including Plasma. And possibly now a fifth state -- Bose Einstein? Plasmas are the most common state of matter in the universe comprising more than 99% of our visible universe and most of that not visible.,292,4
Zombie-response to new zombie fortress,293,9
"I am the mother of a 14 year old boy who was attacked, stripped, and drowned in the men's sauna room of the Royal Hawaiian Sauna Gyeongsan South Korea (sauna has since changed name to Onsan sauna). Ask Me Anything.",294,2
Angry Bird,295,9
IAmA (real) former Daily Show intern. AMA.,296,8
"Leadership by Example: Ron Paul returns over $140,000 from his office budget to the U.S. Treasury",297,4
Atheism makes so much sense,298,4
Ocarina of Time: Gerudo Valley on Marimbas,299,5
Causes of death worldwide in March 2011 - Starvation: 3,300,8
I got tired of reddit being down and unresponsive. So I spent all day today building this.,301,4
I can't get enough of this guy!,302,4
don't let her go! [PIC],303,9
You will never be as suave as this guy.,304,4
"WARNING: Reddit sterotype defying picture ahead, proceed with dissonance",305,4
Lenin Cat stands strong against shallow bourgeoisie bribes,306,9
"I asked the creator of Doctor Cat MD to draw the Reddit alien going under the knife, this arrived today",307,4
Man wakes up from bender with financial problems solved,308,5
"Of the 1%, by the 1%, for the 1%: Nobel laureate Joseph E. Stiglitz says the rich will come to regret growing income inequality in the U.S.",309,1
I just spent my evening drawing a comic about a ghost who is a detective.,310,4
"Hey Reddit, this took me a while, feedback? :)",311,4
Drunk rides a pig down a pavement (with beer in hand),312,2
"TIL that the US military mounted rocket engines on a C-130 Hercules for a hostage rescue operation, named: Operation Credible Sport",313,6
I have been training for this all my life...,314,0
Harry works his magic.,315,4
Batman really does need to toughen up.,316,4
in case you guys missed XKCD's April fools.,317,4
TIL that most Australian (in fact in most countries) puppies in pet stores come from horrific and unclean puppy farms that keep dogs like battery hens.,318,4
When Muppets Mate: Origin of the Angry Birds.,319,5
Dennis Kucinich exposes information that suggests CIA behind Libyan uprising,320,7
The dumbing down of America: Tennessee legislation would protect anti-evolution public school teachers; labels evolution as controversial,321,4
"Part of Arizona, embarrassed by the rest of the state, would like to secede",322,9
Reddit Batman,323,4
Some friends and I were trying to think of the most awkward TV moment ever. This was my submission.,324,4
"Who else hates seeing a future concept photo, knowing it will never exist?",325,9
"For everyone who can't monitor reddit 24 hours a day, jsyk presents a very clear and concise synopsis of the whole I_RAPE_CATS, April Fools prank fiasco.",326,4
"Bookcase secret passage, using piston mod",327,4
"Location, location, location.",328,0
lenin cat: purrrrifict,329,9
"Fellow Gropagas, we must prepare for BATTLE!",330,5
My friend was looking through her pictures from the pool.,331,4
Road to no regret (pic),332,3
You Are Not So Smart: a site which disproves many common misconceptions,333,4
Foo Fighters Call Out Reddit!,334,4
Sink prank,335,8
Living in 90 square feet,336,7
"You're a wizard, Harry.",337,8
"This is in front of a megachurch in Memphis, TN and cost $250,000 to build. Wow, just wow.",338,9
Please stay,339,4
"Royal Navy medic who 'conscientiously objected' to Afghan war after reading files on WikiLeaks, faces court martial",340,2
I searched and couldn't find this in our subreddit... This is what happens when the conservatives don't register their own campaign slogan as a domain,341,4
Looks like season 3 of Community ain't gonna happen after all...,342,4
Stephen Colbert Sings Friday,343,9
"We starts from A,B,C...",344,6
Brazil banks sued for Amazon deforestation: Brazil's biggest bank - the state-run Banco do Brasil - is being sued for allegedly funding deforestation in the Amazon.,345,9
MC Dude test 2,346,4
Green Lantern - Wonder-con footage,347,8
Can't be convinced they are not the same person.,348,4
The JellyBlock Concept:,349,0
Clarence Thomas writes one of the meanest Supreme Court decisions ever.,350,2
May you sing like noone is listening!,351,4
"A powerful NASA solar observatory has snapped an amazing view of the sun, a photo that shows the star partially obscured by the Earth.",352,8
"Scary: Christian lawyer, who thinks separation of church and state is a myth, is pushing for every city hall in Missouri to put In God We Trust in their buildings; he has been wildly successful so far",353,4
I'm So Fat.. [PIC],354,9
Gov. Rick Scott orders immediate cuts to programs for disabled,355,2
Who would read a Dwarf Fortress Webcomic?,356,9
"YSK how to handle the police: don't say anything, don't consent to a search.",357,6
John Colbert and Stephen Stewart,358,9
