Title,doc,topic
1... 2... 3... Kick It! is full. Everyone move on to AAAAAA now.,3845,4
Harley and Ivy,3846,8
hmmm - The feds have time and resources to bust the internet poker folks but they don't seem to have enough time and money to bust the folks that created the illegal banking schemes that broke the country...,3847,4
Trigun Calvin & Hobbes,3848,9
Are paintings of the aristocracy setting unrealistic standards for starving peasant waifs?,3849,2
Piston Waves,3850,4
An Overview of the current state of /r/Gaming,3851,2
"Ian Tomlinson died of fall injuries from push by police officer at G20 protest, says pathologist",3852,8
I feel like my iPod just isn't getting me today.,3853,4
Quantum teleporter breakthrough,3854,8
Kiwi MP Called Out As Pirate After Passing Anti-Piracy Law,3855,4
This was rejected as a Star Wars product but I would totally buy it.,3856,4
Earth?,3857,0
I am fed up with this. Why is Canada considered a neighbor of New Zealand to US companies?,3858,9
Scumbag,3859,2
Like a Boss (Response to Maze),3860,4
"Redditors, I've been trying to win the weekly Comedy Central sketch contest, but always get beat by users farming their vids (4,000 views in an hour for a video titled real atom film.mov). If you like this vid",3861,4
Who remembers when this was cutting edge?!?,3862,9
"I'm not sure how the hell he got there, but everything I own is in the cabin of that ship...",3863,4
"8000yr>6000yr therefore, that would make me wrong. Bravo sir! Bravo!",3864,4
"The Wonderful End of the World is done, move on to 1 2 3 Kick It.",3865,4
"Why, in the aftermath of a financial mess that generated hundreds of billions in losses, have no high-profile participants in the disaster been prosecuted?",3866,5
I wondered why the ball kept getting bigger,3867,8
Behold! The Dark Knight Rises...,3868,5
Does English food suck? Here's our traditional breakfast. You tell me.,3869,4
"Working nights at Right Track Studio as a handyman and janitor,[1] Reznor used studio down-time to record and develop his own music. Playing most of the keyboards",3870,4
Move Deleter,3871,9
Why onions make you cry,3872,4
Driver's license photo,3873,8
DAE Spend more time on the internet than they do watching TV?,3874,4
Silly Han...,3875,7
Captain Monterey Jack,3876,4
"I've seen everything, my life is complete.",3877,4
Stupid sexy spiderman,3878,4
If you want Portal 2 early: GET POTATOES (instructions in comment),3879,8
America is now more segregated by class divisions than many European countries. I think a major reason for these shifts has been the increasing dominance,3880,9
ITAP of a duckling,3881,8
TIL about black dog syndrome: black doggies in shelters are far less likely to be adopted.,3882,4
Cats at the apartment,3883,4
Neighborhood dog gave birth to this cute puppy :),3884,4
"Thanks to everyone who has been playing 'The Wonderful End of the World' today, the release of Portal 2 has been brought forwards by 51 minutes. -- Play more games to bring it forwards even further.",3885,4
IAmA person who got their file from the government via the FOIA,3886,4
BoxeR StylE!,3887,2
Best read out loud...with an accent.,3888,9
Why can I buy a pound of octopus for three pence while ink is seemingly the most expensive liquid known to man?,3889,4
Gov. Scott Walker Reportedly Planning Financial Martial Law In Wisconsin,3890,2
Ira Glass responds to drug court Judge Williams' press release regarding his show on her court,3891,4
free candy,3892,8
Week Clothes vs Weekend Clothes,3893,4
"TIL that for kazahk boy's to become men, they must steal a eagle chick from its nest and then train it to hunt foxes.",3894,4
My Christian Friend: You know,3895,4
My brother's girlfriend asked me to take photos at her brothers wedding after seeing a picture I took of my niece and assured me that he was only looking for someone to just take some pictures...,3896,4
This kid is my hero,3897,0
Because half of my playtime in Portal has been staring at the information design.,3898,4
"What products are worth paying extra for higher quality (e.g. mattresses, shoes, etc.)?",3899,9
The Beastie Boy's return is triumphant,3900,2
State Emergency Manager replaces elected officials in small Michigan town. Fascism has officially arrived in America,3901,2
Karma: The Truth,3902,2
Fundie claims the Earth is 6000 years old and will not listen to scientific reason. So I argued with Atlantis.,3903,4
Aspidochelone: my favorite mythological creature. What's your?,3904,4
Forever Alone Guildie,3905,9
A How-To for the person that stole my bicycle wheel,3906,4
What is the best non-iPod mp3 player on the market right now?,3907,4
Bummer,3908,7
This is why everyone should watch It's Always Sunny in Philadelphia,3909,4
Creationist Science Fair,3910,4
"Online Cash Bitcoin Could Challenge Governments, Banks",3911,4
U.S doctor discovers Canadian Healthcare: I learned that doctors are compensated much better than what we presumed they were here and their work lives are very nice.,3912,4
"I can't get out, the doors keep coming!",3913,4
This is how EVE is,3914,2
TIL astronauts have a mirror inside their wrist so they can read instruments on their chests (and those instruments are backwards for this reason),3915,9
Fitted sheet.,3916,8
"Tell it like it is, Spiderman",3917,4
this is cookie the penguin. [x-post from r/funny],3918,0
Ketralnis sees Redditor's plea to fix the alignment of the arrows and responds. [See original submission first],3919,1
Don't do stupid stuff just because your buddies dared you to.,3920,4
Is net neutrality disappearing? France's President Sarkozy holding a summit next month to decide the future of the Internet...,3921,7
"Thief smashes car through rail crossing, escapes pursuit",3922,0
"Anyone else's cat sleep with their flippers out? She'll stay like this for hours, too.",3923,4
Boxer's Wings Episode 2 [YouTube] (Click on CC to enable closed captions/subtitles).,3924,8
What my boyfriend wrote on my birthday card,3925,4
IAMA hot pepper grower AMA,3926,8
DAE love pirating songs from the radio?,3927,4
Reddit men: Let's paint our manly toenails in solidarity with that kid from the J Crew ad. Post pics here!,3928,9
Of Optimistic Crabs and Men,3929,4
The Muppets will still be one of the funniest and most clever shows for children. This is their take on YouTube (wait for the end),3930,4
TIL Seattle has an actual superhero that actually fights crime.,3931,4
Did I just blow your mind?,3932,4
He doesn't even realize how gangster he is!,3933,4
"My dog, the nanny",3934,0
Those of you who think reddit 'used to be better.' What exactly was different?,3935,4
DAE love that 3 second window where your blinker and the blinker on the car ahead of you synchronize perfectly?,3936,4
How to make a tune using an amen break & a blender,3937,4
Something looks familiar..,3938,4
I'd like the multiplayer screen to work like the singleplayer world select screen. How about you?,3939,4
Haters gonna hate,3940,4
There seems to be a lot of misinformation about this GLaDOS@Home situation. Please read this to educate yourself about this part of the ARG.,3941,4
YSK that passwords can be both highly secure and easy to type,3942,4
"Adobe throws in towel, adopts HTTP Live Streaming for iOS",3943,9
Rick Santorum disowns campaign slogan when told a gay liberal poet came up with it,3944,2
Why is that section of road red?,3945,8
:P,3946,5
AMA Request: Someone who regrets becoming a parent.,3947,8
Police Try To Confiscate Cell Phone Video of Arrest,3948,4
"Quick, someone give him a hug!",3949,4
For only the finest in fine driving...,3950,4
Still think they don't make them like they used to? '59 Chevy vs. '09 Chevy controlled crash test.,3951,4
Genki Sudo submission wrestling (Damn his flow),3952,1
We are lost....,3953,7
I guess I'll have to take out a Microsoft Point mortgage for this.,3954,4
Translation From MS-Speak to English of Dean Hachamovitch’s “Native HTML5″ announcement,3955,3
"Congressional gridlock could lead to the expiration of the Bush Tax Cuts, solving 75% of the deficit problem",3956,9
"I see your tickled penguin, and raise you a tickled cat!",3957,4
One more!,3958,2
i just spent $110 on lucky charms marshmallows and then realized i was actually craving cap'n crunch.,3959,4
The Skin of Notch - by Halucid...not me,3960,6
irony is,3961,8
Solar power without semiconductors by concentrating sunlight with glass to ten million watts per centimeter to create a magnet from light,3962,2
Git is Inconsistent,3963,9
"I wore pajamas all day, and now that a guest is coming I have to put real pants on.",3964,4
"I have so many books to read, but I keep looking at stupid stuff on the internet.",3965,4
IAmA cop & a Redditor. AMA. (Throw away for a reason - no I won't verify this account. Too much at stake),3966,8
I just changed tv providers and now I have to relearn the numbers for my favorite channels,3967,4
Best fortune cookie fortune I've gotten,3968,6
Mmm this looks cozy.,3969,4
Who else is REALLY impressed by both Boxer and Sen?,3970,4
Justin Bieber's new album cover,3971,4
My life has taken a turn for the lazy.,3972,8
BBC documentary: Pedigree Dogs Exposed.,3973,9
"One day, we'll look back and laugh..",3974,2
Every single Republican congressman votes to end Medicare,3975,4
Under 230 for the first time in years!,3976,4
Catfight,3977,8
"That's it, I quit torrenting",3978,8
"(crosspost from r/bicycles) My friend has spent $33,000+ working on this documentary about Bicycles helping to alleviate poverty in Nicaragua. I promised I would *try* to get his trailer on the front page since I cannot afford a monetary donation.",3979,4
TIL the production team of Lord of War bought 3000 REAL AK-47s because they were cheaper than prop guns.,3980,4
Ralph Nader: The only difference between the Republican and Democratic parties...,3981,4
"Stay up all night browsing Reddit, go to the Reddit offices the next day",3982,4
Armenia makes Chess a compulsory subject in schools - about time we taught kids some logic.,3983,4
"TIL Halo was originally supposed to be released for Mac, and Steve Jobs went bananas when Microsoft acquired Bungie",3984,4
"Reddit, it hailed like crazy last night. So I took a pic. Then my dog photobombed it. Everything went better than expected.",3985,4
Let us not wait until he dies. Let us show some love for Ed O'Neill.,3986,4
Ads for Women vs. Ads for Men - Mitchell and Webb,3987,4
This is what it feels like sometimes.,3988,4
TIL a lot of people are happy to be Forever Alone,3989,4
Spot the atheist,3990,4
"hey reddit, i just made peeps sushi for my friend's party tomorrow!",3991,4
Ridiculously Badass Mini Crossbow,3992,4
Well that's just ludicrous,3993,2
Still Alive on a Music Box,3994,2
DAE read the wikipedia articles for movies after watching them?,3995,4
Stampede of cuteness,3996,0
Here's a self portrait of my girlfriend. What does Reddit think?!,3997,4
Gabe and Valve are sitting on what could potentially be the greatest troll in the history of the world.,3998,4
Why does WalMart have 36 checkout lines if only 5 are open?,3999,4
Barry Zuckercorn Does The Fonz,4000,4
Neutrino joke backfired,4001,9
Rock Vs. Paper,4002,4
"kleinbl00 tells us why we should be outraged at the corporations, the lobbyists and the American tax system",4003,4
Spring is here! All hail the Cherry Blossom Cat!,4004,0
Nothing is impossible!,4005,4
We NEED this to happen,4006,4
"Chinese Official Urges U.S.-Chinese Space Cooperation, particularly in manned deep-space exploration",4007,9
Every. Time.,4008,4
World Bank president warns that the world is one shock away from a full-blown crisis,4009,4
Amount of Toothpaste Left [PIC],4010,9
DAE hate the name eggman,4011,4
New B-BBQ!,4012,9
"For those wowed by double egg yolks, feast your eyes on double bananas",4013,4
Some “Developers” Just Can’t Develop,4014,2
Starting a family,4015,4
Well this is probably the coolest thing ever.,4016,4
Humans can reach almost anything,4017,4
Exams are coming up...,4018,4
Someone posted a first world problem in Chinese and I couldn't read it.,4019,4
Noam Chomsky: In the US,4020,4
吃饱了没事做,4021,3
Endless self hate,4022,4
Sometimes I feel like my pallet looks better than the painting.,4023,4
The political poster I've seen so far. (found in St.John's),4024,4
Not so funny now.,4025,9
The reason I decided to take up Java. Damn you minecraft.,4026,4
They look alike,4027,2
Circuits and Wires and Blocks Oh My! (AKA: My suggestion on something that is drastically needed),4028,8
"Come on guys, give him a break!",4029,4
"So I went to a yard sale at an 80 year old woman's house, and found these...",4030,2
Anyone else feeling this way?,4031,4
"Thank you, Mathematica",4032,4
Request AMA: Someone who worked at Area 51,4033,4
"Why are oil and gas companies allowed to get away with poisoning us to death? Hydraulic fracking fluid contains 29 known human carcinogens, injected directly into ground to pollute groundwater; many of these fluids are still listed as proprietary or trade secret by oil and gas companies",4034,8
Ever pretend you've never heard of god?,4035,4
How to cannon rush a Grand Master,4036,0
TIL that the Masters of the Universe cartoon had a character named Fisto,4037,4
Mouse Grylls,4038,2
More subtle humor and foreshadowing I only just now realized in Arrested Development.,4039,2
Work of Art,4040,4
I am at my local NPR station during the pledge drive and haven't taken even one call...,4041,4
A brother appears?,4042,4
"Well, I can't resist a Facebook audience of that size",4043,4
"You have something on your screen, let me just get that for you",4044,4
Wedding cake!,4045,2
TIL that there is a compound you can taste if it touches your skin,4046,4
Pixar: nailed it,4047,2
"You buy this ship, treat her proper - she'll be with you for the rest of your life.",4048,4
3hrs until the next class? Why not?,4049,6
Romantic Psychopath has a small request...,4050,7
Pretty awesome ambient ads.,4051,9
where fo shizzle my nizzle came from,4052,3
My Favorite Fictional Atheist,4053,4
"DAE find it illogical that, instead of conserving it's life, cell phones light up every 2 minutes to tell you the battery is low?",4054,4
Sudden realization today,4055,2
"At 1:11 A.M. today, Krazbobeans lost his mind.",4056,4
"Me, my dad, and my kitten",4057,4
"dear reddit, am i doing this right?",4058,4
"/R/gaming, have you all lost your freaking minds?",4059,2
It's all about knowing the difference,4060,4
Oh look! Karate Kyle is all grown up and succesful!,4061,8
A person named MrDamianhere is taking credit for my treehouse. Now Machinima's giving him all the credit. All I want is credit for my work.,4062,4
My daughter kept asking me why I was laughing at her pretty Belle cup.,4063,9
I have a scumbag dog,4064,4
So I accidentally paused Fringe just now...,4065,2
Is anyone else amazed that many people now seem to take it for granted that a $20 Indie game will perpetually evolve and keep them entertained forever?,4066,4
"NC towns build municipal-owned fiber optic networks, Time Warner Cable and NC republicans promptly try to ban future attempts at this. Other states: don't let this happen to you.",4067,4
"_Detroit_ Style Pizza, made at home",4068,4
Did anyone else catch the Reddit shoutout at Game 1 between Morrow and HasuObs in TSL3? Watch closely.,4069,4
If logos told the truth,4070,2
"So HuK, Jinro and a Priest walk into a bar...",4071,2
Deal With It,4072,4
Cavalry Commander Child On Leadership,4073,4
"DAE stick out one leg when they get hot while sleeping, but keep the rest of their body covered?",4074,4
This Tech Bubble Is Different: The best minds of my generation are thinking about how to make people click ads,4075,4
Pizza Rage,4076,8
My proposal for next weeks /r/gaming logo :D,4077,4
"I was too reckless with my Pandora skips, and now I'm being forced to listen to a Dave Matthews song.",4078,2
Funny how your spokes look to your camera when you are riding.,4079,8
"OK, I posted that Minecraft Geology proposal to GetSatisfaction—now with cooler graphics and (hopefully) clearer explanations! Vote for it there if you liked it here.",4080,4
I must get this bike[gif],4081,4
Let's send Valve REAL Potatoes!,4082,4
"So it's my first anniversary, hopefully my wife sees this and figures out I still love her",4083,4
Stop. Just stop. No more.,4084,4
Nothing to be scared of,4085,4
Why is everyone so relaxed about the fact that helium will run out soon?,4086,4
Eliot Spitzer challenges investment banker Goldman Sachs: Sue me. You lied to the public. You should be prosecuted.,4087,8
My iPhone display reorients itself incorrectly when I'm lying on my side.,4088,2
I told my new roommate I was gay today. He said he already knew because of iTunes.,4089,4
IAMA young French woman. AMA about stereotypes and let me confirm/deny the myths.,4090,4
Arcade Fire - Wake Up Live at Coachella (Pro Shot) with Crazy Light Balls!,4091,8
ZvT - Beating Terran Mech,4092,8
I bit into my onion ring accidentally pulled out the whole onion.,4093,4
It rained all day so this is what I did instead of going out...,4094,4
"Hey Reddit, I made that tame Minecraft Fanart into a little video...anyone want to troll youtube a bit?",4095,4
Look At This God Damn Sword! (Fixed),4096,4
Technology can't replace god,4097,4
It begins: Michigan's new republican governor un-elects the local government of Benton Harbor.,4098,2
YSK that double-blind tests has proven that the sugar high effect is a myth.,4099,2
IAmA Counselor in an abortion clinic AMA,4100,8
MY VOICE IS HIGHER THAN YOUR VOICE,4101,9
My dad died Thursday and we need help adding brightness to a picture that will be used at the service. Can anyone help?,4102,4
Happy Father's Day,4103,4
A ray of light.,4104,9
awhh,4105,4
Gotta Catch 'em All,4106,3
Alcoholism [PIC],4107,9
This is how I feel every time we finish a game for ARG.....,4108,4
Lucas Films says no to AT-AT for America,4109,2
Bad morning [Cy&H],4110,8
My younger sister made this for her biology class. I thought it was worth sharing.,4111,4
Just found this weird-ass alien bug in my garden and thought I'd share it with Reddit.,4112,4
How did it taste?,4113,2
What is your single favorite post ever on Reddit? Thank you!,4114,4
Anyone else think that Valve is just doing a social experiment to see how much they can control a devoted set of fans?,4115,4
"Minecraft fan art, creepy creeper",4116,9
I am a DEA agent. AMA.,4117,8
Any picture really can be improved by adding Immortal to it.,4118,4
AMA Request: An actor that was in The Room that isn't Tommy Wiseau.,4119,8
Scumbag Elijah,4120,2
Two teenage Palestinians admitted to carrying out the brutal murder of five Israeli family members,4121,7
Laundry Instructions,4122,4
Portal Kombat. A sign we made at work for our dual-launch of Portal 2 and MK,4123,4
Just another day defending Howard,4124,9
IKEA hack.,4125,7
TIL The Big Bang Theory was first thought up by a Catholic priest.,4126,4
TIL that snipers must compensate for the Earth's rotation on long-range shots.,4127,9
The one thing I wish Safari had,4128,4
We're done with AAAAAA!!! Everyone switch to Rush!,4129,4
How to send text messages from email,4130,2
"TIL that in some places, the entire bathroom functions as a shower basin to save space. How common is this where you are?",4131,4
"TIL how to use the memory functions on a calculator: MS, MC, MR, M+, M-",4132,6
Anthony Weiner Tells Republicans Who Got Their Feelings Hurt by Obama's Budget Speech to Get Over Themselves,4133,4
Got my first book signed last night. Can't wait to get more.,4134,4
Making boxes LIKE A BOSS,4135,4
"(By Request) IAmA Chinese Takeout Restaurant owner, AMA",4136,8
Racist camera,4137,8
Oh dear god...,4138,4
School lunches being prepared and served in France [5min. video].,4139,6
I let the microwave timer get to 0 instead of stopping it at 1 second so I had to listen to it beep 3 times,4140,4
"Just got my first Canadian passport, this was in the guide that came with it.",4141,4
Grocer sues food pantry for giving free food to the poor.,4142,4
LOST tl;dw (entire cast) xpost from /pics,4143,1
Caught my dog digging in the back yard...,4144,4
First. In. Flight.,4145,4
Please tell me that I wasn't the only one that smoked these as a kid...,4146,4
TIL that there is a Russian cartoon adaptation of A. A. Milne's Winnie-the-Pooh. I don't know if it's better than Disney's one,4147,4
"Oh god, please follow the rules.",4148,4
"Walmart vs Target = a guy shops for 20 items in both stores, and compares the savings. Very interesting as you choose a place to shop.",4149,4
Daydream Rage,4150,8
Raul Castro proposes term limits in Cuba,4151,3
Just saw We Live in Public. Fascinating documentary about a bizarre dot-com mogul who created a camera-rich party bunker in NY with zero privacy and free booze.,4152,9
Ten more games that make you think about life,4153,4
Why hasn't this been invented? The Bowl Lid! Simply screw back on with no wasted salsa/salsa fingers!,4154,6
I know Reddit is littered with Nintendo fan boys and girls. Who else had one of these bad boys while all of your friends got to play Zelda and Mike Tyson's Punch Out?,4155,4
ITAP of a building reflected in a puddle,4156,8
Thick cut strip steak marinated for 4 days,4157,9
U.S doctor discovers Canadian Healthcare: I learned that doctors are compensated much better than what we presumed they were here and their work lives are very nice.,4158,4
Let me get right on that.,4159,4
Sadly true story,4160,4
BBC Documentary - Nothing explores science at the very limits of human perception...What is nothing,4161,8
Old but gold.,4162,4
Too soon?,4163,0
What if children's drawings were painted realistically?,4164,9
Finished modding my arcade stick!,4165,4
"If you're a fan and can spare it, please subscribe to HBO. Pirating won't bring us a second season.",4166,4
How is it that almost the entire world is in debt? Who takes the money? Where does it go? Shouldn't somebody have a surplus?,4167,4
Where do babies come from?,4168,4
Horse Power.,4169,2
A TnT Mega Cannon Vs. 500 Zombies!,4170,9
"I am a Psychiatrist and Liberal Party candidate in the Canadian federal election, AMA",4171,2
"As we know, GE paid NO TAXES in 2010. They made $14.2 BILLION in profits (as in AFTER expenses). If they had paid, it would have meant $4.975 BILLION in revenue for the government. That's just one company. This is why we have a deficit. NOT Planned Parenthood.",4172,4
WEBBER IS A BADASS....that is all,4173,5
"I put my headphones on before my messenger bag, and now my headphone cord is stuck under the strap",4174,9
Something all us students should remember [repost from r/pics],4175,4
Anymore wallpapers like this one?,4176,4
Pencil Vs Camera,4177,8
"Just hit print, and slap it on your wall",4178,8
Video Update: Ron Paul's NH Speech: The drug war has killed more people than the drugs!,4179,4
"Radio control car runs on soda can rings, Doc Brown approves",4180,8
A Day in the Life of a YouTube Commenter,4181,4
"An abandoned Victorian mansion in Detroit, Michigan, U.S. of A.",4182,7
Our downstairs neighbors put this on our door one morning.,4183,4
Chicago billboard has been funded! [epicstep],4184,9
Iraqi immigrant gets 34 years for killing 'too Westernized' daughter,4185,9
There's an interesting archaic word: gabbledreck,4186,4
I am a turtle. Let me help you with that.,4187,4
Strict Orders,4188,0
IAMA pawn shop manager of five years. AMA,4189,8
just a meme,4190,8
Dream World in Pokemon Emerald,4191,9
Conception of time,4192,4
I can't believe I didn't think of that...,4193,4
Harper's F-35s: Engines Not Included,4194,9
"TIL that in the 17th century, the Roman Catholic Church labeled capybaras as a fish so that it's adherents could eat it during Lent, this continues to this day.",4195,4
Underground telescope could peer beyond the Big Bang: A telescope buried up to half a mile underground could give scientists their first glimpse of the dawn of the universe.,4196,4
DAE use showers as a cure-all?,4197,4
My son is 4 today. I made him a Pokecake!,4198,4
"As a frequenter of /new, I have a request for the next couple of days.",4199,6
"The restaurant I'm at has Pepsi, not Coke",4200,4
The greatest Simpsons character. Period,4201,4
Check Out My Balls!,4202,4
"I was sick of dealing with the iTunes bloat, so I did some hunting and found this little gem.",4203,2
"The world watched as a massive earthquake & tsunami swallowed entire communities, leaving an unprecedented catastrophe in its wake. All the while, amateur videographers, tourists & countless others were recording the sights & sounds of the unfolding chaos",4204,9
Midday Moon,4205,9
European Space Agency (ESA.INT) Hacked – Full Disclosure,4206,4
TIL that many legal drugs for things like ADHD can screw up your life just as much as illicit drugs.,4207,4
"Marina Lutz interview: The sins of my father --- For the first 16 years of her life, Marina Lutz's every moment was filmed, even the most intimate. What was her father's motive – and when does art become exploitation?",4208,4
Koch Brothers Influence on Republican Party: This doesn't get down voted in the UK.,4209,4
Doesn't get much cuter than this,4210,4
NY kills me,4211,9
[NASL] CONSTRUCTIVE feedback from a fellow broadcaster,4212,5
I was halfway through the commercial break when I remembered I could fast forward.,4213,4
Why do ingredients often include natural and artificial flavors? Why don't they tell us what it exactly is?,4214,4
When pedestrians are exposed a representation of a man attacking a woman the reaction is to help and call the police. What happens when the genders are reversed?,4215,4
"Was at Shedd Aquarium, U Jelly?",4216,9
Anything like Khan academy for advanced level?,4217,4
Found this in the 1961 University of Delaware yearbook. A bunch of Aunt Jemima's,4218,2
I'm too distracted by reddit to focus on my education,4219,4
"I love Firefly. Thank you, Reddit, for talking about ad nauseum until I just had to see what the fuss what all about.",4220,4
Win Compilation March April 2011,4221,4
Brushing Maru,4222,4
jQuery Events: Stop (Mis)Using Return False,4223,8
