Title,doc,topic
Courage Wolf exploits the downtime,5298,2
Hitchens' address to American Atheists,5299,9
I bet her mileage isn't very good...,5300,2
"Starting in 2013, student loan interest will no longer be tax deductible for loans past five years into repayment",5301,4
Mission: The Perfect Good Friday pun,5302,2
"Happy birthday, you devil.",5303,4
Best Portal 2 song by far. So amazing! [Spoilers],5304,8
Office Français,5305,2
"Deep Freeze: Mars Orbiter Finds Massive Stores of Buried Dry Ice - Radar soundings point to huge deposits of carbon dioxide near the Red Planet's south pole, which may have once contributed to a different climate",5306,4
Free Kitten...,5307,8
8 Scenes That Prove Hollywood Doesn't Get Technology,5308,4
"Toddler in Florida hotel is saved from 4 storey fall by quick thinking British woman. Mother of child thanks God first, woman second.",5309,4
My Computer Games Design course is almost finished. These are the business cards that I've made to give to potential employers. Thought this subreddit might appreciate the design.,5310,4
Son of Kaspersky CEO Kidnapped,5311,0
Looks like he will probably kill his owner tonight.,5312,4
"Good Friday, Good Friday",5313,2
All Cave Johnson Quotes! Eleven Glorious Minutes!,5314,3
Have you guys seen this Cincinati Reds giveaway?..pretty damn awesome,5315,4
Idaho Republican governor Butch Otter signs executive order ending Medicaid in his state,5316,8
My university's atheist community has supported me more than my own parents.,5317,4
"Hey, Reddit, did you hear? Amazon experienced a failure that took down sites all across the internet.",5318,4
Is it proper to use email?,5319,9
It consists of privileged elites demanding that ordinary,5320,5
On Portal 2,5321,8
Firefox has shut down unexpectedly...,5322,4
How to propose to a member of the fairer sex,5323,3
"Now, I love the Steve Miller Band and all. But this is a really terrible album cover.",5324,4
"Metro 2033 75% off ($5) on GamersGate today, can be registered on Steam",5325,4
Ohai! American Bison,5326,9
Extreme close-ups of the human eye.,5327,8
IT'S A TRIP [gif],5328,4
Scumbag Steve was behind the whole thing.,5329,4
Rally for Reason announced at American Atheists Conference! We will march on Washington DC next spring.,5330,9
French Riot Police outraged that they can no longer drink alcohol during lunch while they work.,5331,4
Apple tries to explain why it's tracking your every move.,5332,4
For when you need it: A guide to Color Theory,5333,2
Review: Learn You a Haskell for Great Good!,5334,4
The reddit ARG. The more things you buy on amazon the faster the site is back up!,5335,4
Why. Why would you abbreviate your product's name knowing it sounds like that.,5336,9
FYI world: This is what 'Canadian bacon' is supposed to look like. (also called peameal),5337,4
A fifth grader attending a sex ed presentation,5338,3
Alan Kay: On User Interface,5339,6
Taco Bell Drive-Thru now opens with How are you today? This adds an extra step to my food and unwanted conversation with the cashier.,5340,9
"I may not like SuckerPunch that much, I do like Ken Taylor's Poster",5341,4
[SPOILER IMAGE] So I decoded the slow scan TV from the Final Transmission radio...,5342,6
"Happy Birthday, Bettie Mae Page",5343,4
"my xbox indie game is out, and it's not entirely rubbish!",5344,4
Over the course of an entire day. One thing after another. [Happened yesterday],5345,4
"My friend, who looks like Jesus, made a hilarious parody of Rebecca Black called Good Friday",5346,4
Over or Under,5347,0
"Humpback whale migration as straight as an arrow: Over the last eight years, researchers from the University of Canterbury have been tracking 16 radio-tagged humpback whales through their migratory paths and learned that these whales follow a straight line for thousands of kilometers.",5348,2
Impressive..,5349,3
Breakdancer Vs Cat,5350,4
"Oh it's nothing, just a bug that looks exactly like Ronald Reagan",5351,4
This is way funnier than it should be...,5352,4
What is the weirdest thing that you have ever experienced at an airport?,5353,4
"Reddit, you've made many things with redstone but now the Air & Space Museum challenges you to make this:",5354,4
TIL I could be arrested for passing out drunk in my not running car...,5355,4
France threatens to 'suspend' Schengen Treaty due to influx of Tunisian and Libyan migrants from Italy; Germany to reinstate border control.,5356,7
The Usual Suspects!,5357,5
"No one calls me a stupid coward and gets away with it, RELEASE THE HOUNDS!",5358,4
A lesson about World War One from Samuel Gompers,5359,2
"More minecart science with powered rails, and build recommendations",5360,4
I'm ready. Are you?,5361,4
Former chief U.N. nuclear inspector Mohamed ElBaradei suggests in a new memoir that Bush administration officials should face international criminal investigation for the 'shame of a needless war' in Iraq.,5362,7
"[IPL] IGN ProLeague Day 2 starts in 6 hours [17:00 PDT, 20:00 EDT, 00:00 UTC, 02:00 CEST, 09:00 KST] produced by WellPlayed.org",5363,9
GLaDOS is not a fan of Garfield... [unused dialog clip!],5364,4
A bionic leg designed for people who have lost a lower leg is undergoing clinical trials sponsored by the US Army. The researchers hope the leg will be able to learn the patient's nerve signal patterns and be able to move in response to the patient’s own muscles and nerves.,5365,9
"Adriana Lima, I love you. [1680x1050]",5366,4
Elaborate tattoo provides a roadmap to solve a murder.... four years later,5367,4
SERIOUSLY? - 9/11 responders to be screened by FBI thanks to dumbass republican amendment.,5368,9
We are really low on cat pictures right now. So here's Steve Martin ironing one.,5369,9
Bear Roar - I don't remember where I got this and I couldn't find it here.,5370,4
One man's quest to build a toaster from scratch - beginning with iron ore and other raw materials.,5371,8
Government Hipster,5372,4
Finally I can post my Business Cat creation!,5373,4
"I paid for in flight wifi yesterday, but there was nothing to do with it because reddit was down.",5374,4
"Sure Governor, let's all do something that will have absolutely no impact on the wild fires.",5375,8
Death toll rising in Syria: At least 90 people were reportedly killed and dozens were injured when Syrian security forces fired live bullets and teargas to disperse “Good Friday” protests in several cities.,5376,2
What will your opponent see if you neural parasite a DT?,5377,4
Chanel designer creates perfume that smells like books. Great... now even more people will catch me smelling them in public.,5378,4
Discovery Makes Fuel Cells ‘Orders of Magnitude Cheaper’,5379,8
Patients Are Not Consumers,5380,9
Was anyone else incredibly impressed by IPL?,5381,4
Good morning,5382,2
Reddit is back. That's grate!,5383,4
"If you're logged in, this message is for you.",5384,4
Why doesn't this exist?,5385,9
Blizzard to address PvP 4gate next patch (Official word),5386,8
My earphone kept falling out of my left ear while I was running.,5387,8
Dali.,5388,5
Hedo﻿ ebedynyun!!,5389,7
How To Draw A Grandma,5390,4
"The wife made these, kids went nuts",5391,4
Security and Data Protection in a Google Data Center,5392,2
Bosh Bosh Binks [Fixed],5393,3
NDP official Opposition not so implausible,5394,2
Too True,5395,2
Bear Grylls and Nintendo,5396,2
Every time I finish a test in Portal 2.,5397,4
R.I.P. Max Mathews father of digital synthesis (and whose name was used to baptize Max/MSP),5398,4
'World's Oldest Champagne' to be Auctioned - The 2 bottles of 200-yr old champagne were salvaged from a Baltic Sea shipwreck,5399,8
US Army picks Android to power its first smartphone,5400,4
Kitty barfing a rainbow. That is all,5401,0
Panty Raid,5402,0
The only responsible budget in town.,5403,4
There is a difference between pictures of something and pictures about something. Vice interview with Donald Weber.,5404,4
I grew up in awe of this guy's talent.,5405,8
Scumbag Amazon,5406,2
I'd forgotten that the rest of the internet exists. What have you discovered (or rediscovered) over the last two days?,5407,2
A 75-year-old Georgian woman who says she has never even heard of the internet is facing a possible prison sentence for single-handedly cutting off the web to an entire country.,5408,4
Every time reddit comes back...,5409,4
Engineering Professor's Syllabus,5410,8
The unimpressed Husky gets a job.,5411,9
Oh How He Will Be Missed: A Courageous Gerard Smith Has Been Returned To Cookie Mountain,5412,0
"Lenin Cat; bring them down, Spread the wealth around.",5413,8
Pizza/booze/telly?,5414,5
The Downfall of Franklin's BBQ...,5415,3
Life,5416,4
I was just reminded that it's good Friday and I just happened to wear this shirt today.,5417,4
Playstation Network may be down for days,5418,4
It's simple. We draw the Batman.,5419,8
Cleverbot: How much wood would a woodchuck chuck if a woodchuck could chuck Norris?,5420,9
"TIL, because of Wikipedia, that a fan named Geoffrey Boothroyd convinced Ian Flemming to change James Bond's gun to the Walther PPK.",5421,8
Reddit mentioned in AP article over Amazon FAILURE,5422,4
The best bathroom art I've seen in a while,5423,4
TIL most trees are dead on the inside.,5424,4
"4/21/11: With the PSN and Reddit Down, My Evening was Even Less Productive",5425,4
Pokemon in 4 words,5426,4
"ITAP of a man standing by a lake, dwarfed by the snow-capped Mountains.",5427,4
"NDP on track to win 60 seats, poll projects",5428,4
"Look what you've done, Reddit!",5429,4
TIL that the QWERTY keyboard was engineered to slow down your typing and was made so that salesmen can impress buyers by spelling 'typewriter' using only the top row.,5430,6
"Syria unrest: 'Bloodiest day' as troops fire on rallies - At least 72 protesters have been killed by security forces in Syria, rights groups say - the highest reported death toll in five weeks of unrest there.",5431,8
Today's fair and balanced Fox News headline (screenshot): Obama Launches Sickening Class War Assault Against Republicans,5432,4
xkcd: Turtles,5433,9
A pictures worth 1000 words,5434,8
"Borrowed a super nice camera, so I've been taking some photos of Oblina.",5435,6
Images from the ISS [34 pics],5436,8
"12 straight hours of gameplay after purchasing, I present to you my happiest Minecraft moment",5437,4
The new documentary about the Isle of Man motorcycle road race looks beautiful,5438,4
Wall Street is loading town hall meetings with conservative activists so they ask softball questions to deflect taxpayer rage,5439,9
French riot police threaten to strike over alcohol ban,5440,4
Dream Theater's American Idol search for a new drummer - trailer,5441,9
Gut bacteria divide people into three groups,5442,4
Syrian security forces shoot protesters - Dozens reported dead in bloodiest day of uprising so far as Great Friday demonstrations rock several cities.,5443,2
"Left this her this afternoon to go to my parents, miss her already!",5444,4
"How's your outlook on life? Optimistic; even chipper? Well, Lars Von Trier would like a word with you.",5445,4
"Amazon denies Skynet involvement in cloud outage, claims genocidal AI not to blame for website downtime",5446,8
Now Scott Walker wants to eliminate county governments - Talk about a government takeover! (by the state),5447,2
Auburn Cash Cab,5448,4
i choose you pikachu!,5449,8
Review: Learn You a Haskell for Great Good!,5450,4
I love superglue.,5451,9
"Hey, you got anymore of that bread you gave me?",5452,4
Minecraft 1.6 will have automap function,5453,9
Why did the LAPD leave the Dodger game early?,5454,2
Best $5 I've ever found...,5455,4
My favorite part of the Bible.,5456,4
Fixing your parents computer,5457,4
ATTN Amazon: This guy knows how to run a cloud.,5458,4
"Reddit was down, my friend left for the weekend, so I aluminum-foiled his room.",5459,4
Charlie Sheen responds to media outrage by ranting about warlocks and tiger blood. Russell Brand steamrollers his way through a 14 minute interview as eloquently as any man I have heard.,5460,8
"What I did today. Long time lurker, thought this was worthy of posting.",5461,4
"This is Barcelona, Spain.",5462,8
I've become awkward with girls online too....,5463,4
It's a proven fact.,5464,2
"Saturday Morning Breakfast Cereal - April 23, 2011",5465,4
CNN Pot Propaganda Fail,5466,3
I take Good Friday VERY seriously.,5467,4
Don't post your picture so fast.,5468,4
"My new favourite graffiti, spotted in Brighton (UK)",5469,8
"Exactly one month since Crysis 2's release, Crytek has now addressed almost every single issue players had at launch. The complaints were justified, but now it is time to give some credit to a company that is obviously listening to its fans.",5470,4
I have nightmares that go like this,5471,4
Jesus is Jesus [PIDJIN],5472,4
[Trailer] Interview with Jim Raynor,5473,8
My girlfriend is in dental school. This is the horrific device she practices on. Enjoy the nightmares.,5474,4
Portal Kombat,5475,8
Portal 2 - Meet Bill,5476,8
Best interview ever [Epic Meal Time],5477,4
"My dad is a photographer, but he rarely gets any pictures of himself taken. Thought I'd share a portrait of him I took.",5478,4
I Was A Writer's Assistant on Arrested Development AMA,5479,8
"We're off to see the Wizard, the wonderful Wizard of Oz.",5480,8
"After practicing all year, North Korea shows the world how Earth Day is done.",5481,9
Earth Day?,5482,5
[Trailer] Interview with Jim Raynor (x post from /r/starcraft),5483,8
The best part isn't even the main subject,5484,4
Greatest in game chase scene ever,5485,4
This is the best way to teach children about spiders,5486,4
"I'm Commander Shepard, and this is my favorite aisle at Target.",5487,2
A drink named after Lindsy Lohan,5488,4
Aww yeahh. Nailed it.,5489,4
"scumbag plug, or If you're a plug and you do this",5490,2
ooooooh gurllllllll,5491,3
It's funny because they'll cry.,5492,9
Source of Reddit problem discovered.,5493,9
TIL that the British military has a great sense of humor.,5494,4
AMA Request: The girl(s) from Two Girls One Cup,5495,4
Mad Props,5496,2
Stop being duped by the 3D scam,5497,4
The Link has been Forged.,5498,4
"China downgrades US debt to A+, three notches below Germany",5499,4
TIL that Siberian Tigers eat bears,5500,4
Fun with Netflix + Projector = Nailed it.,5501,2
We are not alone?!,5502,5
That did not answer my question...,5503,6
I work in a brothel (Photo validation) AMA,5504,8
Google will move its user-submitted videos from video.google.com to Youtube; no videos will be lost,5505,4
I paid $5 for the stack at the thrift store! DAE spend HOURS with these as a kid?,5506,2
some articles just shouldn't have related links...,5507,9
DAE Have a love for valve's developer commentary? From the days of lost coast through portal 2 I have loved playing through games a second time to listen to the devs.,5508,4
"Hey reddit, I'm about to send this to Hitchens. What do you think? (a lurker's first post)",5509,4
a bundle of squirrels!,5510,9
"If you've never heard Nick Drake, you have no idea what you're missing out on. Haunting, bleak, and beautiful music.",5511,4
Renamed the family wireless network to make it easy as possible for technologically challenged mother,5512,4
Scumbag Redditor,5513,4
"Portal 2 Insults: Well played, Valve!",5514,8
What Aperture Laboratories reminds me of,5515,1
The science behind being wrong: Why facts don't change your mind and how to argument against emotion.,5516,4
Mystery Egg,5517,2
the tea party? this is what we're up against.,5518,4
"Reddit cupcakes, upvoting and downvoting for your mouth!",5519,4
I may be alone here but...,5520,9
Awesome global map of skin color.,5521,9
"DAE think we should add to /r/politics Reddiquette that sensationalist headlines be downvoted, even if you agree with the content? Too many times I rage over the title of an article only to find it's highly inaccurate. It's simple: if the title isn't in lock step with the content, downvote.",5522,4
A series of unfortunate realizations,5523,8
Possibly SMBC's Best [Comic],5524,4
DAE agree that sleeping should heal you?,5525,4
"Silly sugar gliders, you are not Cool Whip",5526,4
The effects of the PSN outage are far worse than we could have possibly imagined.,5527,2
The song I was listening to didn't end at the same exact time I parked my car.,5528,4
Ooops!,5529,3
"I turn 21 in ten minutes. Meet Yuri, he fell out of a tree and I kept him.",5530,4
"Minecraft is at 2,000,000 Purchases!!!!",5531,9
Gawker's redesign is killing the network,5532,4
Suggestion: A Separate AMA Request Subreddit,5533,4
...Does anyone else find it hilarious that this pic is the top of /r/Christianity right now?,5534,4
The best quote ever. EVER!,5535,4
Strike A Pose!,5536,9
TIL where Leela from Futurama's name came from,5537,4
Feeding a fish to a bigger fish,5538,8
I took my dad to the mall the other day...,5539,4
More proof that Vermont is the most awesome state - 50 of the most wealthy Vermonters asked to have their taxes raised instead of cutting services to the needy.,5540,4
US banana firm hired Colombian paramilitaries (aka death squads). Paramilitary groups paid by Chiquita banana are considered terrorist organisations by the US.,5541,4
"TIL Earth Day co-founder killed, then composted, his girlfriend.",5542,4
Abed's Pacman Shirt,5543,4
"Ok Frugal, admit it, what are you more 'morally ambiguous' frugal tips?",5544,8
How to upvote.,5545,2
DAE calculate the surface area of differing pizza sizes before deciding which pizza size offers the most value?,5546,9
"Bolaji Badejo, the man in the “Alien” (1979 Ridley Scott)",5547,7
If Christianity never existed...,5548,4
"we've found this on april 20, sorry valve, we live in a country with difficulties to buy at a decent price and with dollar regulations, we had no choice... okface*",5549,2
Amazing 2D Minecraft inspired game!,5550,4
I swear this is true,5551,2
*Another Earth*: it'll blow your mind more than the current hundred million dollar crop,5552,2
My cousin died last night from diabetes he didn't even know he had. Please educate yourselves on the symptoms.,5553,4
The truth about dollar stores.,5554,2
My favorite clip from Whose Line Is It Anyway?,5555,4
This is kinda freaking me out right now.,5556,9
"I go outside to clean our rabbit's cage. I come back in 2 minutes later, and this is what I find.",5557,9
Bobby Ryan's ridiculous goal [HD link].,5558,4
Black Eyed Peas - Everybody Poops [bad lip reading],5559,8
We heard you like cleanliness,5560,4
How many tournaments have to get ruined before we get a solution?,5561,4
"If there was a function I needed, it was this one",5562,2
"TIL Picasa's icon has a house in the middle of it, hence its name being a combination of Pic and Casa",5563,4
TIL A Wisconsin mother spent six years collecting and folding Starburst candy wrappers to make her daughter’s prom dress.,5564,4
Parent of the year,5565,2
This was the last known picture of Mary.,5566,4
"man and religion, a synopsis:",5567,4
"Greetings, Earthl......",5568,5
On Easter Sunday let's all give thanks to the person who rose from the dead to give us all eternal life. Thank you Osiris!,5569,4
Stylin',5570,5
What were the strangest rules your parents had while you were growing up? OR What were some innocent things you did that you got punished for?,5571,4
“Gay people don’t actually try to convert people. That’s Jehovah’s Witnesses you’re thinking of” Tina Fey,5572,4
This sums up my easter spirit,5573,4
This is called Miracle Fruit. After eating one,5574,4
TIL the earth is NOT the centre of the universe...,5575,5
I'm Dan Harmon,5576,4
Dear NASA,5577,4
Dear PSN hacker(s) ...,5578,4
Humanities Professor on Theses,5579,8
"Remember, strategic voting does not necessarily mean to vote Liberal to beat the Conservatives. It varies by riding.",5580,2
110 lbs later...,5581,2
Is Pepsi okay?,5582,0
Awesome homemade NES arcade circa 1990,5583,9
All I hear whenever I debate Christians who say they've come to their faith rationally,5584,4
Uncanny,5585,3
"Europe, as seen by Americans.",5586,4
Reliable Minecart Rider Detection System Without Weird Physics,5587,4
Unpaid interns: The annual race to the bottom of the corporate ladder begins,5588,5
Just a sketch of a girl,5589,9
"Previously denied a restraining order, woman is violently beaten by her ex-marine husband in Judges chamber in front of a dozen bailiffs ...",5590,9
That's no moon...,5591,4
[SPOILERS] The Impossible Astronaut Discussion Thread,5592,8
Dear Human...,5593,4
Trailer of sorts for upcoming Minecraft shorts.,5594,4
"HTML5 audio generation experiment (sine waves generated in javascript, played with <audio>)",5595,5
I love this IdrA portrait. Such a villain.,5596,9
Askscience Panelists- update your CVs!,5597,7
fool proof,5598,3
Forever a Drone :(,5599,4
They should have rethought that banner,5600,4
"By opposing net neutrality, AT&T is asking us to trust them not to censor. Yet, they are attempting to censor my blog.",5601,4
"Not only can I not remember where I parked my car, I can't remember which car I drove.",5602,4
Spiderman,5603,4
Ever wonder why there were so many open proxies on port 9415 in China?,5604,4
mini kitten with a mini bear!,5605,4
Family Guy: Men.,5606,2
"The $23 million book, or why your Amazon dynamic pricing code needs a loop check",5607,4
how i felt once i got to the moon rocks (x-post from r/gaming),5608,4
"If my calculations are correct, Minecraft should sell its 2 Millionth copy within the next day! Congratulations Notch!",5609,4
Church sign asks awkward (and personal) question,5610,4
This guy takes punching a speed bag super seriously.,5611,4
Police beating of Las Vegas man caught on tape. Officer is under investigation but still on the job. Officer has previously killed two people.,5612,4
DAE wish they could have an epic paintball battle inside of a department store?,5613,4
AMD finally in black again. GPUs and Fusion (APU) chips are making AMD profitable for the first time in a long time.,5614,4
I ran a picture of John C. Calhoun that I found on my external hard drive through Tineye and found this gem,5615,2
"IAmA Request: David Simon, creator of The Wire and Treme.",5616,8
It's fairly sunny today... going to go the beach,5617,4
The best thing that the IPL has brought to the Starcraft community [pic],5618,4
"Weather Channel, I am disappoint.",5619,7
TIL that you can't get hot dogs at McDonald's because owner Ray Kroc believed that Mickey D's standard of quality just wouldn't permit that kind of item on the menu.,5620,9
"Five years ago tonight, my sister died unexpectedly. So, to honor her, here's a picture of me putting her in a headlock in front of our Dad's Impala back in 1977.",5621,4
Seinfeld holding up a mirror to the people honoring him to show them how misplaced their values have been.,5622,7
What happens when you try to leave the Church of Scientology?,5623,3
Disney's Latest Attraction: The Brothel,5624,8
Happiness,5625,1
In case of reddit emergency,5626,4
Humanities Professor,5627,8
"You know what, I am ok with higher taxes",5628,9
Towels,5629,3
Rich Girl Poor Girl,5630,9
Charming Karen Gillan interview on Craig Furguson (4/22),5631,8
Five women brutally murdered in Mexico beach resort,5632,8
"RIP John Sullivan OBE, writer of Only Fools and Horses, aged 64",5633,4
We now know where Aperture Science is located [SPOILER],5634,4
This will be the Arab world's next battle: Population growth and water supply are on a collision course; hunger set to become the main issue,5635,6
Does anyone know where I could get a print of this?,5636,4
IAMA researcher at Microsoft Research. Ask me anything.,5637,2
I use alien blue on my iPad and iPhone. Thank you for such a solid product.,5638,9
Redditor baboubouma's new addition to the Lego Architecture line [X-post from pics],5639,4
The Paul Reiser show had the worst ratings in network history,5640,4
so I got on the bus the other day to go to work...,5641,4
One Smooth Criminal,5642,2
"Game of Thrones, anybody?",5643,2
"Now that the NDP is above the Liberals, wouldn't voting liberal or anything else giving your vote away? It was the liberals that made that lie up. Why aren't they practicing what they preach?",5644,4
The Rockies.,5645,3
Why did you learn to program? In one sentence. Hit refresh to see others.,5646,4
"Dan Harmon, creator of the show Community, is doing an AMA right now at /r/Community!",5647,9
Lazy Internet Llama encounters a difference of opinion,5648,4
To my 2v2 Partner,5649,2
Lauren Faust is Awesome,5650,9
Huge statue I found in the middle of nowhere in Vietnam - My first attempt at HDR,5651,8
"As much as I respect him, Dave Mustaine's finally lost the plot.",5652,4
TIL Bruno Mars writes his own music...and he wrote F--- You for Cee Lo.,5653,4
Notice on Reddit an upvote is orange and a downvote is blue?,5654,4
How I felt after beating Portal 2...,5655,4
[IPL] IGN Pro League's Awesome Player Drawings (Compiled),5656,9
"Inspired by a post on here a few weeks ago, I took up crocheting and made a creation of my own!",5657,4
"Germany's increased emphasis on renewable energies requires an all-new power grid. Now, many in Berlin are wondering if the grid powering the country's train system could be used to transport wind power from the north to the south. Some say it could save up to 75 percent of expected costs.",5658,4
My awesome wife made my son very popular at school on his birthday...,5659,4
I had a really good hair day and nobody important saw me.,5660,4
My wife suggested I should trim my beard. This is what she got...,5661,1
Half-Life connections? Easter Eggs? Hidden Chambers? Let's round up all the Portal 2 secrets! [MAJOR SPOILERS],5662,8
I just can't do it.,5663,4
ITAP of some orange water drops in mid-air,5664,2
Anyone else think this is one of the best musicals of all time?,5665,4
YSK what to do when someone else is having a seizure.,5666,4
A gentle reminder from a very wise man,5667,4
Some of you will notice that your posts are disappearing from this subreddit. Here is why.,5668,4
