Title,doc,topic
"I got married in February. Here's the D&D-themed cake a good friend of ours made, and my craptastic design sketch too.",1916,4
To all the other Mojang folks: We appreciate you as well!,1917,4
Tonight I met Michio Kaku.,1918,2
Jerry Holkins: We have expectations about what an RPG is that are deeply,1919,7
[NASL] Grettings from the NASL Reddit account! Stay tuned to our posts for information regarding the NASL!,1920,4
George Takei playing the role he was meant for.,1921,4
Pew Poll: Americans Already Regret Giving House to Republicans,1922,9
Doctors Without Borders: Bahrain’s security forces used hospitals and health centres as “bait to identify and arrest those (protesters) who dare seek treatment.”,1923,4
The only aspect of the Stanley Cup Final that I'm dreading.,1924,2
[click click] Enhance! [click click] Enhance!,1925,3
My Dinosaur Comics whiteboard finally came in the mail today. What do you guys think of my first comic?,1926,4
Bulldog Puppy Trying to Walk,1927,4
Spock. I haven't seen this one before,1928,4
Fire & Bacon Eclairs [possibly not entirely safe for work..ish],1929,8
The Pit - Super Mario Bros. - What really happens to Mario when he falls into a hole.,1930,8
Ducreux sets the records straight,1931,0
Obama administration fighting to prevent the extension of 4th Amendment protections to cloud based computing.,1932,2
Oh sh*t,1933,9
German newspaper publishes the original NRC Assessment about Fukushima concluding that Tepco made mistakes and the situation is worse than they are letting on.,1934,3
"10,000-core Linux supercomputer built in Amazon cloud",1935,8
Easiest way to level up. Abuse the Daycare centre!,1936,2
Karate Kyle shows mercy,1937,9
My TATA box (comic),1938,2
Google has developed speech-recognition technology that actually works.,1939,4
100 people surveyed...they actually were the top two answers!,1940,4
xkcd: Pain Rating,1941,4
So I open up daily #282 in a new tab...,1942,4
"Sent this to TouchArcade, do you think it will work?",1943,9
WTF is the deal with this advertising on the glass? Looks like a bunch of BS to me.,1944,4
Heroes of Might and Magic III (1999),1945,5
Woohoo check out what I just got in the mail,1946,4
I had a good one for r/firstworldproblems but forgot it,1947,2
"JPMorgan CEO's pay jumps 1,500% to $20.8 million.",1948,9
My food pyramid,1949,4
This certifies you have had a personal encounter with me...,1950,4
Judge who struck down Prop 8 confirms he's gay,1951,4
260 to 160 in 2 years.,1952,8
"Genes that can turn normal bacteria into deadly, drug-resistant super-bugs found throughout New Delhi's water supply and is at risk to spread globally through travelers.",1953,2
"Please take the fries off my head, kid. The basket is extremely hot.",1954,4
What I did during the downtime,1955,8
Yamask is the Saddest Pokémon,1956,4
"Liberals have more gray matter in a part of the brain associated with understanding complexity, while the conservative brain is bigger in the section related to processing fear, said the study on Thursday in Current Biology.",1957,8
i was the easter bunny at the white house for the easter egg roll last year.,1958,2
What is THE scariest story you know?,1959,4
Today is a good day...,1960,2
You sure can,1961,2
Lost 60lbs! My friends from school couldn't recognise me! :(,1962,4
"Back in the day it's like, cats, cats, cats",1963,4
His Name is Robert Paulson.,1964,9
Cat on a Leash,1965,9
Novell patent deal modified: Microsoft won't get to own any of the patents,1966,2
Crazy Ex-Girlfriend Praying Mantis got in touch with me again last night,1967,2
DAE wish that you could buy a real physical book containing the Elder Scrolls lore/history?,1968,4
how the minecraft thunder lightning should or could be?,1969,9
What pixels couldn't show you.,1970,4
Peace Sells,1971,2
How i felt during high school.,1972,4
I'm pretty sure this is not how Jesus rolled.,1973,4
Homemade Pokemon,1974,4
Is the initial dubstep craze that hit the UK 5ish years ago happening in the US now?,1975,4
You gotta love your own brand.,1976,9
Virgin America's rendezvous with Virgin Atlantic's White Knight and Spaceship 2.,1977,7
A Flying Bobcat.,1978,2
"/r/NFL just quietly passed over the 7,000 subscriber mark.",1979,5
"TIL if an aftershock is larger than the original earthquake, it becomes the mainshock and the original becomes the foreshock.",1980,4
Manny Ramirez retires.,1981,2
Gabe Newell sends mysterious picture. what is it?,1982,4
Lawyer reveal's that Carson disclosed entire criminal record to PMO before being hired,1983,4
A neat look at a collection of Psygnosis box art:,1984,2
College note-taking nowadays...,1985,3
Eowyn vs The Witch King (Take 2),1986,9
"Lets say i have bad eyesight which meant i could only focus on objects within 5 feet of me. If i stand 5 feet away from a mirror, am i seeing myself focused (at a 5 foot distance) or unfocused (at a 10 foot distance)?",1987,4
TIL you can watch full episodes of NOVA on youtube - bye productivity,1988,2
poor Jorge :(,1989,9
I did it! Geek Plush toy company launched!,1990,4
I dont know if your new friend can come in...,1991,4
Once you enable students to borrow $36,1992,4
"My friend has spent $33,000+ working on this documentary about Bicycles helping to alleviate poverty in Nicaragua. I promised I would *try* to get his trailer on the front page since I cannot afford a monetary donation.",1993,4
Reddit's new datacenter!,1994,9
"Please, please, please keep Portal 2 spoilers out of your titles.",1995,4
The genius is in the details - Arrested Development,1996,8
This Guy.... This Guy is Awesome,1997,9
Happy 50th Anniversary! (Young Me Now Me),1998,4
Ellen Page shows her Juggling skills! Wow.,1999,4
"Steam is great, but it really needs a Will this game run on my computer feature.",2000,4
"Update on my mom moving to Florida with a scammy scammer, and general rules for keeping your parents safe (if they'll listen!)",2001,4
My friend Jocke made an interesting coffee table,2002,4
Firefighter gives kitten survivor fresh oxygen,2003,4
"please, just stop.",2004,4
I am Harley from EpicMealTime aka DrunkBeard AmA,2005,8
I only listen to... [pic],2006,4
Once you make prisons a for profit enterprise magically the number of people in prison goes up. Florida was first in 1981 see graph.,2007,4
What's the most outrageous/hilarious/offensive pick-up line you know?,2008,9
HEROES.,2009,5
Zoo-logically improbable and/or terrifying to small children,2010,4
Bruce,2011,4
Pessimistic crab,2012,3
Flying Alligator Attacks Baby IN 3D,2013,4
"After five years of dating, I realized that my girlfriend and I are slowly becoming the same person.",2014,4
A sobering end to a good night out,2015,2
I decided to drop in on an old friend today...,2016,4
Jon Kyl: When I said 90% of what Planned Parenthood did was abortion it was not intended to be a factual statement.,2017,8
The peak of Nickelodeon,2018,9
Her voice is unmistakable...,2019,4
While on general patrol...my partner and I came across what we thought was only one lynx,2020,2
Why haven't we heard from the aliens yet? Go to the 2:35 mark of this video and I think you'll see why it makes sense.,2021,4
TIL How dogs drink water with their tongues.,2022,4
A list of rock solid scientific evidence which questions the validity of Evolution.,2023,9
Could he be the most badass person on the Internet?,2024,4
Is Chipper Jones a legitimate Hall of Fame candidate?,2025,4
"Well, we tried",2026,4
I never let my children watch big band performances on TV...,2027,4
"Now this, This is a weapon!",2028,4
Man goes on killing spree in Dutch shopping mall. At least 5 to 10 people killed.,2029,4
Math isn't always so lonely!,2030,9
Haters gonna hate [pic],2031,4
Mr. Chi City returns with a long overdue update: Whip Game Unproper,2032,4
"Sidney Lumet, director of 12 Angry Men and many more, dies at 86",2033,4
How many of you are old enough to miss this guy?,2034,4
Stem cells make retina in a dish.,2035,8
A bum with a business plan.,2036,6
Push it,2037,8
The Great Metamorphosis,2038,4
An old friend of mine ran into a familiar face in London - but you've probably never seen it before...,2039,4
Today was Pirate Day at my school. Here's what I wore:,2040,9
"Amish hipsters. Thank you, Apple.",2041,4
My friend works for CATerpillar and someone brought this by the office today.,2042,4
"The X-Y Problem, as it is sometimes called, is a logical fallacy which leads to enormous amounts of wasted time and energy, both on the part of people asking for help, and on the part of those providing help. It often goes something like this:",2043,4
Who else would like to see a Tastless vs Artosis showmatch where they cast the replays?,2044,4
The real reason we still love science today.,2045,4
"hey Reddit, what happened to that kid who sued the FBI after discovering a GPS tracking device in his car?",2046,4
Perhaps the most amazing picture ever taken. (Tip: Look between the fireworks and the lightning.),2047,4
"All these years, I never once thought of trying this to keep the cord away from my leg...",2048,4
Somebody posts first page of Infinite Jest as his own work on Yahoo answers and asks people to comment on it. Hilarity ensues.,2049,4
Bathtub investigation,2050,7
Sit!,2051,0
"Grad students, any ridiculous stories about undergrads in classes you TA?",2052,4
Cat and Dolphins playing together,2053,9
Physics rules,2054,4
glacier cat ^_^,2055,9
Creating a full frontal Wonder Woman poster from a side view,2056,4
Games were so much better in my day,2057,4
What has been seen...,2058,3
Switch,2059,4
Would anyone else love to see more decorative items implemented? For example....,2060,4
"Dear Canada, if you dont keep the Conservatives out of power, you will end up like us. Signed, America.",2061,4
This is all I think of when I hear people complain that Charlie Sheen's live show ripped them off.,2062,4
"The Best Of The Atheist Experience- God, Damn Funny!",2063,2
The perks the recruiters don't mention.,2064,7
"He is NOT your friend, and he can NOT come in!",2065,4
So I improved that Death by Chicken Lag room idea with a bit of help from the piston mod...,2066,4
"After I browse reddit and facebook I don't know what to do on the internet anymore so I go back to reddit and facebook again, only to be bored because I've seen it all 5 minutes ago.",2067,4
This is not the hammer of Thor.,2068,9
Monsanto cash helped fund bill to stifle whistleblowers in Iowa.,2069,4
"Wrong, /r/wtf. I believe this belongs HERE. [pic]",2070,9
This comic is so gay.,2071,9
"would you care for an owl, perchance?",2072,9
I choose you,2073,8
terminator. possibly one of the coolest things ever.,2074,4
Track boosters are planned,2075,8
How lazy can we get? Honestly?,2076,4
Someone was wrong on the internet. One ultra-geek stepped in to save us all.,2077,2
Groklaw exiting out on May 16th: Mission Accomplished,2078,9
I know my boyfriend has been on my computer when I see this.,2079,4
"The internal combustion engine gets a revamp. A completely different design, the 'wave disk generator' : lighter,more efficient, with fewer moving parts is presented to ARPA",2080,4
This pepper market's Scoville Scale is great.,2081,8
Jah sitteth in Mount Zion,2082,5
So I had this handed to me in work today. I read it and was sick in my mouth.,2083,4
Zombie Apocalypse? Costco have planned ahead!,2084,9
So I was looking through my DVDs...,2085,4
The Second Coming? (Mostly SFW. I think.) My friend has been bugging me to post it forever. First post. Little nervous.,2086,4
Cardcaptor Sakura wanders into a bad neighborhood,2087,4
Egyptian soldiers attack protesters in Tahrir square.,2088,8
Scott Adams of Dilbert fame explains how he survived college on business and freebies,2089,6
DAE think that firefox 4 on mac sucks?,2090,4
"I want a portal themed tower defense where you play as GlaDOS, frantically trying to prevent waves of test subjects from escaping",2091,4
Forget Steve Buscemi...,2092,1
"Nice billboard, Audi..",2093,6
Fascinating: The Last Words of Texan Inmates,2094,8
I see that Stormtroopers can run 5k. Although I did see him put the helmet back on for the finish.,2095,4
What is the weirdest childhood memory you have?,2096,6
You a strategy game fan? Have you ever tried the board game Go? Learn the basics in 5 minutes,2097,4
"Steve Buscemi's reaction to being a meme, according to how much free time I have.",2098,4
FIFA 11 + Black Ops,2099,2
My breakfast this morning.,2100,4
Its true..,2101,9
Atheist student files suit against School,2102,2
The FIRSTWORLDPROBLEMS label is taking up too much space on my favorites bar.,2103,4
"Know 1,000 songs. Go to guitar store. Can't think of anything to play.",2104,4
I think Calvin's discovered the secret to life.,2105,4
My cousin doesn't speak english so she doesn't know why I found this so funny.,2106,2
Nasa - The Sun's magnetic north pole,2107,8
Fun with gravity.,2108,9
Cats used to be worshipped. They have not forgotten this.,2109,4
SHASKEL,2110,9
"TIL The RZA had a 5 year long dictatorship in Wu-Tang controlling most everything, but promising to take the group to the top. He kept his promise!",2111,4
Real badasses code with pixels. (IQ is one of them),2112,4
Vin Diesel with hair is disturbing,2113,1
TIL Britney Spears is legally controlled by her father and has to keep making music or she will lose her kids (she's a slave 4 u),2114,4
Interesting Fact...,2115,4
the ideal prom date..,2116,2
My new favorite - great deep color,2117,4
"The merging of online and offline life: e.g. '... credit card companies can predict with 98% accuracy, two years in advance, when a couple is going to divorce'",2118,4
"Really, Dave? Really?",2119,5
Best iPad app for ...,2120,4
"AMA request, Jemaine Clement and Bret Mckenzie. The genius duo behind Flight of The Conchords.",2121,8
Damn cheetos,2122,2
Girls...Don't read this magazine.,2123,2
My very tame Minecraft fan-art.,2124,4
Charizard,2125,5
Time To Take Aim Reddit: US Representative Marsha Blackburn,2126,4
TIL that Chevy Chase turned down Kevin Spacey's role in American Beauty,2127,4
A complete lightweight laptop,2128,2
CN Tower in the fog (xpost from r/Canada),2129,6
Does Vladimir Putin Make Everything Look Awesome?,2130,4
Miley Cyrus with Buscemi eyes,2131,1
"Why do McDonalds, BK, Wendy's, etc. not serve hotdogs?",2132,5
Talking to friends about the best cartoons nobody remembers. This guy won.,2133,2
The Most Awesome Photo Ever Taken [SFW],2134,8
I made this at work last year and thought you guys might like it! Ten Post-its in total.,2135,4
"Kathy Nickolaus in Waukesha forgot to save? Really? Microsoft Access (any version) doesn't ask you to save. Even if you stop to take a phone call from your buddy the governor (for example), your data will still automatically save.",2136,4
"I am The Master of Used Book Buying! Behold, my $25 purchase!",2137,0
my birthday cake,2138,4
Anybody else think this feature would be useful?,2139,4
ITAP of a Lizard Basking in the Sun Behind a Palm Frond,2140,8
What does black metal look like?,2141,2
I have you now!,2142,9
I SEE YOU DRIVIN' ROUND TOWN WITH THE GIRL I LOVE,2143,4
Found him!,2144,2
Every time we dive down it's like we're experiencing a different planet. The ocean is this beautiful,2145,4
GOP Clerk 'Finds' Votes to Reverse Defeat of Conservative Wisconsin Justice -- a jaw-dropping intro; read this and tell me there isn't electoral corruption in the US.,2146,8
My favorite novelty team for Black/White so far,2147,4
I wish games were like they were in 1999..,2148,4
Long term and subtle trolling (hint: Diamonds),2149,2
"A low pressure system in the eastern North Pacific Ocean - photographed on Mar. 20, 2011 by an Expedition 27 crew member in the Cupola of the ISS [pic]",2150,9
i dont know what way its going...,2151,4
Ryan Braun tells it how it is,2152,4
Scumbag Manny,2153,2
"Pet baskets, how do they work?",2154,9
"I accept Visa, American Express and Mastercard",2155,9
Next of kin learning the ways of the gentlemen,2156,6
And then I decided a zombie fortress island was the perfect solution.,2157,4
When Cheese Fails 101 --Going to NASL!!,2158,1
am i herding it right?,2159,3
What can four DJs with 5 turntables do?,2160,4
Me every weekend.,2161,9
Just some spiders,2162,4
Gay,2163,4
"Touché Mark, Touché",2164,0
Are you sure? [fixed],2165,3
Just a cheerful hawk guarding the entrance to my office building,2166,8
The Original TL;DR,2167,4
Two minimal dark zerg 1080p wallpapers,2168,5
Yay!,2169,8
it's begun..,2170,3
Flash use drops (2%+) as jquery climbs.,2171,2
"Its my Reddit birthday, I could submit a picture of a dog or something my girlfriend made. But I like kids falling on tricycles.",2172,4
"Let me get this straight - If foreign spies were caught phonetapping government ministers the result would be an international crisis; if the tapping was done by individuals, the result would be a jail term; but because it was done by a corporation, the result is a settlement out of court?",2173,4
"What well known phrases or sayings were you often told as a child, that you consider to be wrong or full of crap?",2174,2
major mplayer dev leaving the project,2175,9
Took kids to Hop. Contemplated suicide. Instead ruminated on future of Hollywood.,2176,4
P. Diddy asks for your favorite bible quote. Oblige him.,2177,4
Dropbox authentication: insecure by design,2178,3
Bruce - crosspost from /r/pics,2179,8
I open my door to find...,2180,4
Long exposure Minecraft screenshots,2181,4
Cat plays with Dolphins,2182,9
Camouflage: Activated.,2183,9
DAE when traveling in a different state see other cars from the same state via license plate and consider them your brethren in a foreign land?,2184,4
Philosoraptor on origins,2185,6
"Thousands rally in Columbus, Ohio against new anti-union law.",2186,2
The battle of vimy ridge began 94 years ago at 530am; Easter Monday - April 9 1917. Remember those who fought for us and for those who are right now.,2187,4
"Amtrak had more riders in March than in any March in its 40 yrs of existence, the 17th straight month of increased ridership. So why do Republicans oppose high speed trains, a proven technology? And, if the interstate highway system has never been profitable, why demand Amtrak be profitable?",2188,2
"Giants vote to give sick clubhouse attendant full World Series share ($317,631.29) to help pay for medical bills",2189,4
Scorched Earth (1991),2190,5
"The shareholder awakens: Companies’ owners are slowly beginning to hold bosses to account, starting with closer scrutiny of their pay",2191,4
In reference to waiting for series 6,2192,4
"Teachers of reddit, what are some of the dumbest things a student has asked you?",2193,4
"600 years ago, Chinese sailors shipwrecked and swam ashore in Kenya, marrying locals. The story is often told in Beijing and heard around the world as a heartwarming narrative of friendly relations, selling the country as a peace-loving partner to Africa. Problem is, this doesn't appear to be true.",2194,9
"You're The Last Of The Time Lords, Charlie Brown",2195,8
Saw Bassnectar live last night....do yourself a favor and go to one of these shows!,2196,2
Somebody posts first page of Infinite Jest as his own work on Yahoo answers and asks people to comment on it. Hilarity ensues.,2197,4
"Yogscast 300,000 subscribers",2198,5
TIL Jackie Chan has his own stunt fighters that communicate when they attack him by specific grunting noises.,2199,7
Is anyone else reluctant to buy more books until you've finished your ridiculous backlog of unread ones?,2200,4
My project to get rid of excess cobblestone.,2201,9
"I finally saw Serenity, the film. It was awesome. That is all.",2202,8
So who else here is a Safari fan?,2203,4
Socially Awkward Penguin In The Park,2204,4
the saddest day,2205,4
Teaching the controversy,2206,3
Tron,2207,9
A quote from my favorite author.,2208,4
At the mexican restaurant tonight. (X-Post from f7u12),2209,4
DAE assume a heavily advertised movie is going to suck big time?,2210,4
CN Tower: Above the fog,2211,6
Banana Love.,2212,4
Rasta Science Teacher: Joint,2213,9
"Sprint radar imaging system peeps inside walls, floors to detect bombs, tell-tale hearts. I'm sure no one will abuse this tech.",2214,2
Some love from PC Gamer UK,2215,4
YSK how to determine your dominant eye with this simple trick (no optician required!),2216,8
Why must you turn my office into a house of lies?,2217,2
Many people report problems with Shogun 2 only using a single CPU. CA simply says Shogun 2 does support multiple cores. then closes the 10 page thread.,2218,4
We Did It!,2219,4
"Gaming, we need all the Defense Grid players we can find",2220,4
Gnome 3 is 'Fisher Price' Linux. What can we do about it?,2221,9
"If the Ducks join the Kings and San Jose Sharks in the playoffs, there will be more California-based teams competing for the Stanley Cup than Canada-based teams. Vancouver and Montreal will represent hockey's homeland.",2222,2
Comparing truffle oil to real truffles is like comparing sniffing dirty underwear to having sex.,2223,4
Big Bang Theory fans might appreciate this...,2224,4
Getting your girlfriend into Starcraft 2...,2225,4
My '93 Mazda RX-7 FD,2226,8
Torrent Anonymity,2227,2
"In a language with gendered nouns, who decides the gender of a new invention, like the internet or Pepsi?",2228,4
"If a super volcano wiped out the human race, how would an alien, or sufficiently evolved post-human species be able to find, and then access/recover Wikipedia? Should we not just print it all out one day and hide it in a cave?",2229,9
Most redditors get caught up in the main stream(top10) subreddits. What not-so-popular subreddits do you participate in?,2230,4
Vegetarianism is murder,2231,5
Happening outside,2232,9
Spanishiwa (Z) continues to be a stylish badass vs. EGLzGamer (T) on Xel'Naga Caverns,2233,4
The Greatest Long John Silver there will ever be... period.,2234,4
Every time I play a game or do homework. [PP],2235,4
"I'm kind of hungry, but my roommate has guests over, so if I go into the kitchen I'm going to have to introduce myself.",2236,2
"I got rejected tonight by a girl I like. On the way back to my room, I remembered Goliath's advice.",2237,2
Me when I realize I have accidentally stumbled into /r/politics,2238,4
Seedbombs,2239,7
I don't care about the money. I just want to know why the prosecutors who hid evidence,2240,4
I altered the picture of the girl with the penguin so we can see if it will be as popular without a girl in a bikini,2241,4
Welcome to America,2242,7
I found a mysterious hard drive sewn into a bag. How can I find out what's on it?,2243,4
"In Sweden, IKEA plant workers start at $19/hr, get 5 weeks vacation and are unionized. In Danville VA, they start at $8/hr and get 12 days vacation (8 picked by IKEA), have mandatory overtime and required meetings discouraging union membership. What could go wrong?",2244,9
Blast wave,2245,7
I'll see your penguin friend and raise you A MOUNTAIN OF PENGUINS!,2246,4
No thanks,2247,4
The smallest man in the world dancing with his pet cat,2248,4
Haters gonna hate,2249,4
Everything I see on reddit now.,2250,4
How I feel every time I send out Magikarp,2251,4
How does this work....?,2252,3
System of a Down's Serj Tankian is my mom's cousin. She just found this picture from her brother's wedding. Probably taken around 1990.,2253,2
Everytime when browsing US-only websites.,2254,0
That's one lonely brotha.,2255,2
"One year (and one chewed doorframe) later, my rescue dog is much healthier and happier.",2256,2
Astronomers may have witnessed a star torn apart by a black hole,2257,9
"Why, Valve? Why don't we have this yet?",2258,0
Smile Reddit :),2259,4
This was in my hotel room in Taiwan...,2260,8
Mom sent me this bizarre mousepad from China,2261,4
TIL Dave Grohl (Foo Fighters Frontman) doesn't believe that pirating music is or should be a crime,2262,4
Piston Pinball,2263,4
Moon,2264,9
touché,2265,0
The doctor gave me this for being a brave boy.,2266,4
The world.,2267,9
Murdoch faces flood of hacking claims - could face criminal charges,2268,4
Hairless Cats,2269,4
ADULT CONVERSATION ONLY,2270,9
"Dear Blackberry Auto-Correct,",2271,4
This kills the crab.,2272,4
How to make edible desert bowls,2273,2
Found an Airman Redditt today.,2274,2
This is how they sleep every night.,2275,4
I SEE WHAT YOU DID THERE,2276,4
"A couple digital paintings I did recently, wanted to share them with Reddit!",2277,2
Don't get me wrong - Crysis 2 looks AMAZING. But this is a bit sloppy :),2278,4
IAmA woman who had a surgical abortion three days ago and fails to feel anything but relief. AMA.,2279,4
DISHMASHER SAFE,2280,2
Supermarket Scrabble anyone?,2281,3
._. No more Omegle for me...,2282,9
Chicks with Steve Buscemi's eyes,2283,1
Bruce Willis takes an hour to get out of bed,2284,4
This made me rofl.,2285,4
This is... just...wonderful.,2286,0
NC man denied pardon after 17 years of wrongful imprisonment,2287,4
Amish Hipsters,2288,6
Origami Jedi,2289,7
'Nailed' it. Both of them.,2290,8
The Teenage Mutant Ninja Turtles are always right,2291,9
How I feel on Reddit at 4am.,2292,4
Challenge: Tell me your life in just six words.,2293,4
She blows...air rings.,2294,5
I made a pretzel.,2295,4
You were forewarned,2296,5
Just ran across Palin's book at the store. I was shocked.,2297,2
The 4 stages of life...,2298,7
Thanks so much for letting me know.,2299,4
"Milo, Our Rescue Dog: 6 Months Before & After",2300,9
Only in Canada would they reschedule a televised election debate so that it doesn't conflict with a hockey game.,2301,4
Alien abductions aren't so fun anymore,2302,9
There's just something creepy about this,2303,4
Building penetrated by an expressway.,2304,8
Could you live here?,2305,9
The power of words!,2306,2
Stuck a feather in his cap and called it Macaroni,2307,9
"What can an atheist possibly celebrate? (beautiful video, will make you smile)",2308,4
"Pokemon, so real.",2309,8
Hackers...,2310,2
