Title,doc,topic
Ten Years in Afghanistan  German General Says NATO Mission Has Failed,1765,2
Faceshift,1766,5
How I feel most days working in IT,1767,2
TIL there is a Darth Vader grotesque on the Washington National Cathedral,1768,2
Paypal screws yet another game developer (Xenonauts XCom inspired game),1769,4
This guy is killing esports,1770,2
He exists,1771,1
Red Velvet Ice Cream on a Dark Chocolate Ice Cream Cone (xpost from rtrees of all places),1772,2
Are Canadians more excited aboot crossing the street than Americans,1773,8
Uranus takes a pounding more frequently than thought,1774,2
Bad call made by a mod,1775,2
we only let atheists in heaven,1776,2
TIL a NASA intern stole a safe full of moon rocks sprinkled them on a hotel bed and had sex with his girlfriend on them,1777,2
My mom painted this on her front screen door Thought you guys might like it,1778,2
Just a new EA Sports Hockey glitch,1779,7
My Favorite arcade game EVER,1780,2
Im a girl I push doors that clearly say PULL wat,1781,2
Netflix to Stream The Walking Dead,1782,2
New Zealand facing one of its largest ecological disasters as authorities forecast a significant oil spill from a big container ship grounded off Tauranga Harbour  Bad weather is now threatening an already complicated salvage operation of the ship,1783,2
IGN Pro League 3 $100000 StarCraft 2 live tournament + $20000 League of Legends live tournament,1784,7
I Can Agree With This,1785,2
This Week In Gaming October 2  8,1786,2
Just another hamster gif,1787,2
Jupiter Io Europa Ganymede and Callisto through amateur telescope [1920 x 1080],1788,5
As Marines Occupy Wall Street Republican Rep Paul Broun Calls Protests ‘An Attack Upon Freedom’,1789,8
Im going to put this on all my books,1790,2
Al Davis has passed away,1791,2
Oh no a bear attack,1792,2
Occupy San Diego from Above,1793,7
What it is like to find a job,1794,2
This took my breath away the first time I played  CoDMW,1795,2
I took this at the Bronx Zoo yesterday Its a snow leopard,1796,2
This is my 14 pound dog Rosa Yesterday she fended off a fully grown black bear She has ovaries of steel,1797,2
Cartoon Network Just Put Up A Cartoon Making Application,1798,2
At first I didnt get it,1799,2
Please make this happen,1800,2
Every time I get into a jet in Battlefield 3,1801,2
For the love of God please go away,1802,2
Dont believe in the Napkin Ill pray for you,1803,2
Spreading protests reach No 2 US banking city Hundreds of people converged on downtown Charlotte Saturday to march on Bank of Americas corporate headquarters as the antiWall Street protests spreading across the country reached the secondlargest US banking hub,1804,8
What i hope NPCs are like part 1,1805,2
Im hungover and now I have to go drinking again,1806,2
Thought rCooking would like some Carnitas,1807,2
This is one of the many reasons why Greenman Gaming rocks,1808,2
Facts about US Economic Inequality,1809,7
USA redditors vs UK redditors,1810,2
Had a weird realization this morning Photo of me vs Hermione turning Harry,1811,2
Soo i made a castle and then switched nearly every block to water and ice This is the result,1812,2
Obviously,1813,8
I have to tell you something,1814,2
Hey reddit so i survived me first car accident,1815,2
Bernie sanders Rein in Wall Street and rescue the middle class Its time for us to end the financial oligarchy so destructive to our economy If a bank is too big to fail it is too big to exist,1816,2
Ea sports,1817,7
Its Simple,1818,2
TIL Tesla invented wireless power transfer more than 100 years ago but was overshadowed by Edison,1819,1
Anyone else want this kind of map for BF3,1820,2
In honor of my reddit cakeday I present the littlest tenth doctor and her pet adipose,1821,2
TIL Steve Jobs eliminated all corporate philanthropy program after resuming control of Apple,1822,2
How I felt waking up to the UK vs US on reddit,1823,2
I just got banned into the past,1824,2
Whatever you say Notch,1825,2
Now that the richest 1 percent have backed the rest of us into a corner — a corner without health care decent wages and jobs that are not in danger of being outsourced — we have no choice but to organize and fight,1826,7
Happy 68th Birthday Chevy Still awesome as ever,1827,2
Random Acts of Books I want to buy a book for any TWO people who cant afford one for any reason,1828,2
Alfa Romeo 33 Stradale,1829,7
Look who ran into me at Starbucks,1830,2
Actually I just want to have sex with you,1831,2
They were delicious,1832,1
My girlfriend wont send me naked pictures because she wants to be the President of the United States someday,1833,2
Screw your Quake I want to see this game get remade,1834,2
50 top signs from Wall Street protesters,1835,8
Lucky deagle toss,1836,4
TIL We are actually living in the least violent century in human history,1837,2
Lucky,1838,4
Looks like Ill be calling the people at Fancy Feast in the Morning,1839,2
inspiration,1840,1
Today is my birthday and this is how I feel,1841,2
Nuclear Power Plant (BuildCraft & IndustrialCraft),1842,1
Looks like RMS is right again Today there is no tech company that looks more like the Big Brother from Apple’s iconic 1984 commercial than Apple itself,1843,2
Wall Street Protests Expand to DC to ‘Take Back Our Country’,1844,8
A flow chart for all potion makers,1845,7
Homer Beats the lie detector,1846,0
The people mowing my lawn woke me up,1847,2
This is how I used to see my old boss,1848,2
Physicist languishes in French prison for two years without trial French intelligence services say he is a dangerous terrorist family members and colleagues argue that he is a brilliant young physicist singled out because of his academic background,1849,8
What are your GodTier dubstep jams Im talking about those upper echelon tracks that,1850,2
Got a free pen from work,1851,2
Hotshotgg  GG Generation,1852,2
I rode my bicycle across the USA twice sleeping for free 95% of the nights AMA,1853,2
Its illegal to kill an ant,1854,2
Theres some truth to that,1855,6
Dont mess with me OR my bunny,1856,2
How modest,1857,2
Forever Alones wife is worried,1858,2
My deodorant is running low and I scraped my armpits with the plastic,1859,6
Hadnt burned up so far,1860,2
Gary Oldman  the chameleon,1861,2
Police need a refresher course in pursuit training,1862,2
Homemade Pizza,1863,2
Imgur I did not know you were like that,1864,2
Abandoned Mill built in 1866 Sorrento Italy,1865,0
Some idiot Redditor deleted his comment and now I cant downvote,1866,2
Demuslim eliminated by Ret Show him some love,1867,2
A SAP I can relate to,1868,4
Russian Tank pulled from the mud,1869,1
Spheres of influence,1870,6
Greetings from Sweden (Sorry for my bad english),1871,0
TIL that none of The Beatles could read music,1872,2
Vasili Arkhipov — When in 1962 the submarine B59 was trapped by the US near Cuba three officers were required to authorize the use of its nuclear weapons Only Arkhipov dissented,1873,7
The new line of Pillow Pets are surprisingly realistic,1874,2
Outside the SF Apple Store,1875,2
British PM supports gay marriage in the UK,1876,0
First try at a photo of Jupiter and moons,1877,2
TIL that there is a type of frog that breaks its own legs and uses the protruding bones as claws to maim enemies if attacked,1878,2
US Drug Policy Would Be Imposed Globally By New House Bill Under this bill,1879,2
Owlcat,1880,0
I Support Occupy Wall Street Even If They Dont Have a Unified Message,1881,8
We are witnessing Americas first true Internetera movement which  unlike civil rights protests labor marches or even the Obama campaign  does not take its cue from a charismatic leader express itself in bumperstickerlength goals and understand itself as having a particular endpoint,1882,2
Weeping Angels In Minecraft,1883,7
The most hick video Ive ever seen,1884,2
What cute weird things has your partner done that puts a smile on your face,1885,2
Gunter is truly evil,1886,2
Latest addition to my fam,1887,9
Science publishing The trouble with retractions A surge in withdrawn papers is highlighting weaknesses in the system for handling them,1888,4
The original TeaParty was a revolt against tax breaks for corporations just like OWS,1889,2
I love looking through old files on my computer,1890,2
What usually happens when I submit a link,1891,8
RIP Al Davis of the Oakland Raiders,1892,8
Im developing my own style of stencils does reddit think I should continue,1893,2
Hidden Message on the side of the Assassins Creed Encyclopedia,1894,8
A mate of mine is housesitting for me and just sent me this pic with the words I couldnt look at it without knowing  $50420,1895,2
Kidnapped my boy Youre forgiven,1896,2
I left a note for my brother this morning,1897,2
Ender Pearl Golf Course  186 Yards Par 7 with Map Download,1898,2
Oh God,1899,2
Alive41stime makes a life changing decision over a joint,1900,8
What’s So Great About Siri,1901,7
Not MY anus Google,1902,8
While Westboro Baptist Church was picketing a funeral they were counterprotested by none other than,1903,6
Dat Seeker Missile blast (WCG Top vs Supernova),1904,2
The greatest metal band ever,1905,2
Bunny Lipstick Now In Strawberry Flavor,1906,0
TIL Walt Disney often filmed actors as models for his animated features,1907,2
I want a battlefield 3 map like this,1908,2
Welcome to Norway,1909,0
Draw me like one of your French girls,1910,2
Science,1911,4
Mom Email rage,1912,7
A Great Man Died Today,1913,2
Gannett newspapers CEO resigns with $37 million payout after firing 20000 workers doubling his own compensation and overseeing the company stocks freefall from $72 to $10share,1914,1
IGN has the best SC2 production quality out there by a long shot This is so amazing,1915,2
The award for best comment ever goes to,1916,2
The more and more I listen to CatsPajamas the more I respect him,1917,8
The best age verification tool,1918,4
Chaos Computer Club analyzes government malware,1919,2
Giancarlo Esposito (Gus) only has ~600 followers on Twitter Lets help him out,1920,5
Owners baffled by theft of 50footlong Pa bridge,1921,1
OpenGL vs Direct3D The War Is Far From Over,1922,2
Wishing I Could Pull This Off,1923,2
Mind was blown,1924,1
Trying to win an internet argument,1925,7
Awesome PvZ artwork,1926,6
Steam Pug,1927,8
Pretty sure this is how Skynet started,1928,2
The truth about technical writing,1929,6
Eric S Raymond on Steve Jobs’ passing,1930,8
Derp IRL,1931,5
Please help keep the protest areas clean Please its important,1932,2
No This is the Greatest Story Ever Told,1933,2
Last night I met someone who works for a company printing photos on glass Anyone tried something like this,1934,2
ZING,1935,5
The inappropriate choice is always the best one,1936,2
Puppy craziness,1937,0
Why is Lee Sin always instabanned in Draft Pick,1938,9
THE most intense arcade game (and my favorite),1939,2
Got skills,1940,2
Knock knock Whos there Interrupting horse Interrupting horse wh,1941,2
Only in Balkans,1942,5
ALL 5 GENERATIONS,1943,2
I am a wabbit you see,1944,2
The internet has ruined me (repost realised there were a persons details on cover),1945,7
My dad died when I was 14 he served in Desert Storm I would like to know more about it,1946,2
Fine ladies and sirs Here to be seen is an excellent example of our obligation to express our nonacceptance towards certain social and economic comportments,1947,9
This must be in the books,1948,2
Why do humans develop pubic hair,1949,7
Gay R2 (x post from rWTF),1950,2
How to open a beer bottle with a paper,1951,2
Great new lunch bag for the ladies…,1952,2
Best restaurant review ever,1953,2
Alright Reddit when have you had enough,1954,2
never leave units at a rally again,1955,2
Chaos Computer Club analyzes government malware  The largest European hacker club Chaos Computer Club (CCC),1956,2
Evolution,1957,2
I want to pour salt on this person,1958,2
plan on going to some garage sales tomorrow,1959,2
Look at the awesome plate I found in an art store,1960,2
Sure wish theyd make a new game like this,1961,2
2 Tibetans Set Selves on Fire in Latest Protest,1962,2
I am not cut out for leadership [Project Reality],1963,4
Batman Begins,1964,2
If you charge this for parking f*** you,1965,2
TIL That Joss Whedon Helped Write Toy Story,1966,4
Keep on Harping  Stairway to heaven,1967,2
The Legend of Zelda,1968,2
Just spent the last 5 hours making this It was worth it,1969,2
Dead monitor fixed for $10 instead of buying new for $200 Easy to do,1970,2
[SPOILERS] What Jebs livestream today showed us,1971,7
Occupy Wall Street protesters are American patriots  CNNcom,1972,8
TIL that every single German spy sent to Britain during WWII became a double agent or was executed even the guy that only pretended to be in Britain,1973,2
Its Always Sunny fans will appreciate who I saw tonight,1974,2
Attempted Murder,1975,2
Reddit Jersey 2012 version 2,1976,7
Elizabeth Warren The people on Wall Street broke this country,1977,8
I didnt even get a chance to say anything before she disconnected Thanks EA,1978,2
The strangest and most intense animated short I think Ive ever seen,1979,2
Like a boss,1980,2
Cinnamon PullApart Bread,1981,4
anyone want to help me fix this,1982,2
I think I need to stop playing Portal 2,1983,2
How I felt as the designated driver tonight,1984,2
New Zealand upvotes more than the average country,1985,2
Starbucks CEO suggests fellow businessmen withhold campaign contributions to politicians until action is taken to better the economy,1986,2
Star wars dog,1987,2
Woah The Pearl Waterfall China,1988,1
Occupy Wall Streetstyle protests spreading to Britain  “People are not stakeholders in democracy in the workings of the nation anymore,1989,8
Best day in gym ever,1990,2
Its not just white people that are racist you know,1991,2
Wait for it,1992,1
My son and grandpa Pure joy,1993,9
Adobe Reader is a wonderful program It’s main function seems to be to sense when you are deeply involved in writing something you haven’t yet saved and interrupting you with a notice that it is time to update Adobe Reader,1994,2
Ive never seen a more overwhelming reason to learn to play snare,1995,2
A little game of hide&seek at worksee if you can find me,1996,2
Had a garage sale great success,1997,7
Everest College You too can aspire to make minimum wage one day,1998,2
As its nearly Halloween how about we share some creepy stories Ill go first,1999,2
Teenagers keep knocking on my door and running off waking up our baby Can I get in trouble if I hide in the bushes and shoot them with my paintball marker,2000,2
One of my favorite comics,2001,2
Overkill,2002,4
Flying to Florida,2003,1
I see the [fixed] pictures before I come across the originals,2004,2
Careful not to allow this to get any legitimacy,2005,1
So my sister and I attempted to make those Martha Stewart vampire pumpkins last night Nailed it,2006,2
After being away from Reddit for a day,2007,2
TIL that there was a solitary tree in the Sahara Desert keeping itself alive by a 110 deep root system Until a drunk driver managed to ram his truck into it,2008,7
A nicely setup fish tank,2009,6
Why are the Feds bothering with marijuana When you look at what has happened because of corruption on Wall Street and the loss of houses,2010,2
Amazing fake punt Terrible flag,2011,2
This is how you play Battlefield 3,2012,2
Had to design an envelop for my drawing class I went with Hayao Miyazakis Spirited Away,2013,4
58 companies accounting for 70% of overseas profits repatriated in the 20042005 tax break collectively saved $64 billion in taxes then laidoff 600000 workers Large companies are lobbying again for such a tax break to repatriate $15 trillion in overseas profits for well below the 35% tax rate,2014,1
Not Enough Torches by *ghostfire,2015,2
Stay classy Bill Murray,2016,2
Delivery Drivers of Reddit What is the weirdest thing you have experienced when delivering a package ill start,2017,2
(╯°□°）╯︵ ┻━┻,2018,6
Humans have a perplexing  tendency to fear rare threats such as shark attacks while  ignoring far greater risks like  unsafe sex and an unhealthy diet Those illusions are not just  silly—they make the world a more dangerous place,2019,2
Does anyone know who drew these They are amazing and so true,2020,2
I bought a Silent Scope machine Am I doing it right,2021,2
How it feels posting from Alaska,2022,2
I accidentally clicked on Send Image instead of Save image as and now I have to wait for outlook to load,2023,2
Uh guys White House Petitions now require 25000 votes in 30 days to warrant a response The Edit the Pledge petition,2024,2
I am the 99%,2025,6
Im not a kid anymore but this still looks fun,2026,2
Found this instead of a bible in my hotel room today,2027,2
Death is the best wingman,2028,2
Whenever someone says WAKE UP SHEEPLE,2029,2
Why my friends think Im weird,2030,2
What would actually happen to you if you were exposed to outer space,2031,2
What is this ball of cuteness sitting in a tree,2032,4
Truly a man among men,2033,2
Good guy creeper,2034,2
White people,2035,2
High school pictures of musicians  so cute,2036,2
Occupy the lawn 2011,2037,8
Nothing to see herejust washing my car,2038,2
Sleepy and smiley,2039,1
Thatssss a niccce ball you have there,2040,2
Meanwhile in the Norwegian army,2041,2
I actually generally see them as separate timelines,2042,2
Every Sunday before NFL games start this is the first battle I enjoy watching,2043,2
Guy realizes he played Oblivion blackout drunk and discovers the chaos he has caused,2044,2
I had a chance to take a photo with Adriana Lima last summer,2045,2
Epic Trampoline Skills,2046,2
I just Myspaced for 5 minutes and this is what it felt like,2047,2
These must be Americans,2048,2
I was sleepily facebook stalking when Bill Murray,2049,2
This infuriated me,2050,6
Canadian Content,2051,2
The evolution of duckface,2052,2
Free nude girls (SFW),2053,2
What is the most upvoted comment on Reddit so far,2054,2
My friend put it perfectly,2055,2
EverySingleTime,2056,9
Meanwhile in outer space,2057,8
Britain versus America Origins,2058,2
I feel like this more and more each day,2059,2
Picasso Pants,2060,9
Apollo your casting is WELL good,2061,2
Best comeback ever,2062,2
A card he got from his 8 yearold sister when he left for college,2063,2
my favorite room,2064,2
Dad came back from his business trip with these,2065,2
Its downright disgusting to listen to conservative and Republican lawmakers,2066,8
If I were a cartoon,2067,2
Why I love being halfblack at a predominantly white college,2068,2
Starting with $200 this is a good night in Vegas,2069,2
TIL Brazil has an Island so populated with extremely venomous snakes that Humans are banned Density is as high as one snake per square meter,2070,7
Sorry,2071,2
Something I made this weekend Title; Crazy Legs,2072,2
Follow These Directions,2073,7
The liberty of a democracy is not safe if﻿ the people tolerate the growth of private power to a point where it comes stronger than their democratic state itself That,2074,2
Oh sweet A Charlie Brown comiwhat,2075,2
Cannon Run  EthosLab,2076,2
Graffiti on my campus that is all,2077,6
GUESS,2078,2
MC Hammerhead,2079,7
Palestinian officials urge Blair to quit as he is accused of using his position to further business interests while lobbying against Palestine,2080,8
A Plumber Who Caters to Women,2081,2
IGN Pro League cannot happen without our great sponsors Special thanks to AMD Astro Gaming Korea Daily Mountain Dew Razer Riot Games Samsung Square Enix Team Liquid and all the volunteers and contributors Check out the photos from the events through out the day,2082,7
Dara OBriain on video games,2083,7
what a name,2084,1
I stayed up late preparing for a season finale watch party,2085,2
4000 meters up in the sky lies the Buddhist Monastery of Ki Ki is a tiny village in the middle of the Himalayas and it is probably the most peaceful place on Earth,2086,6
How do it know,2087,2
I think I need to obtain a Norwegian Forest Cat,2088,2
You Can Never Go Home Again  Installment 10,2089,2
TIL Burn victims can be cured by a skin gun that turns purple goop into skin,2090,6
I always thought,2091,2
Best Wife Ever,2092,2
Troublemakers,2093,4
Wampa Cupcakes,2094,6
Who else would like Siri on their Mac,2095,2
abandoned submarine,2096,0
We must make this happen,2097,2
IAmA 15 year old who unschools AmA,2098,2
Engineering problems in class in the homework and on the exam,2099,2
Dark circles arent always bad,2100,2
In Finland 79 children between the ages of four and 19 developed narcolepsy after receiving the Pandemrix swine flu vaccine in 2009 and 2010; Finnish govt and insurance companies will pay for their lifetime medical care,2101,6
I always thought of them more as a timeline,2102,2
My favorite gif,2103,2
IPL3 The last American hope,2104,2
Cant decide what to carve into your pumpkin Why not Zoidberg,2105,2
Agreed,2106,4
My friend recently started playing TF2 I guess no one told him about the Dead Ringer,2107,2
The war hasnt even started and already,2108,2
So I finally tried pistons today,2109,2
TIL that the tradition of singing national anthems before sporting events started before a rugby game in 1905 when the Welsh captain lead the crowd in singing the Welsh National Anthem in response to the New Zealand teams Haka,2110,1
TIL John Ratzenberger (Cliff on Cheers) not only appears in every single Pixar Studios movie but also surpasses Harrison Ford as the Highest Grossing Actor,2111,8
Dat beat (Nostalgia overload),2112,4
This is a GM ad in my Universities computer lab Reality sucks Stop pedaling  start driving WTF,2113,2
Haters Gonna Hate At least my fingers arent orange,2114,2
Just a vampire hedgehog,2115,4
Eat this,2116,8
Infection,2117,0
Take THAT Jesus,2118,2
How I feel when people tell me how they feel,2119,2
Lux and her lasor at work,2120,8
What its like posting in Germany,2121,2
Overtone an open source audio environment for sampling livecoding and collaborative jamming,2122,4
Tom Haverford on business card design,2123,2
Pickup line Its super effective,2124,2
winter is coming,2125,2
Satisfied with life couple ends life,2126,2
Mother,2127,8
In my opinion the only way Final Fantasy 15 could be successful is if they went back to this formula,2128,2
Your brain on whoadude,2129,7
Take a wild guess who Im going to be for Halloween,2130,2
Painful Living,2131,2
Please do this more often Those are awesome Especially MLG,2132,2
With BF3 being on everybodys lips am I the only one who wants this revived,2133,2
What up haters,2134,6
Epic Waterfall City Timelapse,2135,2
iNcontrol Appreciation,2136,5
Hey kids Who wants to havnever mind,2137,2
Accused kitteh is *SHOCKED* at these baseless allegations,2138,4
Too Soon,2139,4
Found this gem at the local thrift shop for 20 bucks Good deal or what,2140,2
[Response to]Dear genitals,2141,5
Bruce Lees special day,2142,7
Ubersaw chaining to the EXTREME,2143,2
Speaking of outfits The translator looks fantastical in a simple outfit,2144,2
FF8 Balamb Garden a semicomplete recreation,2145,3
500 AM London Lunchtime In America QUICK UPVOTE EVERYTHING RUSSIAN,2146,2
As an American I concede,2147,8
Those are cool Photos Wait those are paintings,2148,2
The loneliest animal on the planet  BBC Animals,2149,2
Next time someone tries to convince me to convert,2150,2
How I often feel while reading Game of Thrones,2151,2
Jensen Punch,2152,2
Yeah guys Totally,2153,2
This is the only thing I ever think when I find a Tentacool,2154,2
We just dont want to be picked last,2155,2
Last foreigner ranger left,2156,2
The Other Rooms in my Grandparents House,2157,2
so now Im afraid I have something of a mess on my hands,2158,2
I like to paint space pictures and this is my latest (1900x1200),2159,2
What small insignificant thing has someone said to you that will stuck with you forever,2160,2
Sunday evening at 11 pm,2161,4
Rice fields of vietnam,2162,5
German government accused of spying on citizens with statesponsored Trojan,2163,4
He still has a lot to do up there,2164,2
Falls Here,2165,7
Banksys amazing artfull of emotion this one,2166,6
NO,2167,0
Just made my day,2168,2
Did I just get goatsed by Food Network,2169,2
Hi My name is,2170,1
@notch Made the wings bigger and made them make sense httpimgurcomavk1pf,2171,2
Saw a Redditor at Starbucks today and left him a note,2172,2
TIL Loyal customers to Xbox LIVE are eligible for 33% off a year subscription,2173,1
This always disappointed me,2174,2
ITAP of Drifting,2175,0
I made a custom launcher concept for fun D,2176,2
Ralph,2177,3
Update Puerto Rican having language and billing issues with Origin I may criticize EAOrigin about a lot of things but I also have to give respect when it is due,2178,8
My fundie aunt came to visit when I was playing the guitar This was what she said,2179,2
But mom,2180,8
Heres my Turducken Turkey stuffing bacon duck stuffing chicken Baked for almost 10 hours close to 30 lbs when finished,2181,2
Those lousy stickers didnt even work,2182,2
A very frustrating thing to see if you support Occupy Wallstreet,2183,2
TIL there are more Subways than McDonalds globally,2184,2
Reddit why wont anybody accept the fact that I just dont like dancing,2185,2
Crosspost from rfunny titled Wait for it,2186,1
ELI5 Tantric sex,2187,7
Notes for Steve outside Apple store in Chicago,2188,8
Hug Chair,2189,6
Ben Franklin would weep The republic that he helped birth is lost The 89 percent of Americans who have no confidence in Congress (as reported by the latest Gallup poll) are not idiots They are not even wrong Yet they fail to recognize just why this government doesnt deserve our confidence,2190,9
Just rescued her yesterday,2191,2
Unity I just cant,2192,2
An abandoned amusement park in Chernobyl,2193,0
The hottest and sexiest Translator,2194,7
[YSK] To brush your teeth in circles not straight lines,2195,5
Americans here How did we do,2196,2
At least we know fansubbers have a sense of humor,2197,2
A course on Software Foundations — the mathematical theory of programming and programming languages — by Benjamin Pierce,2198,7
