Title,doc,topic
NYPD arrests protesters at a Citibank branch also appear to arrest a nonprotester customer unfortunate enough to have been trying to do her banking at the time,3533,8
Butthat was my place,3534,1
Ingame Scumbag Scout hat WIP looking for feedback,3535,4
I want my son to experience Ocarina of Time but I know I will eventually have to help him with the Water Temple,3536,2
Exactly like Reddit,3537,2
Scumbag Laptop,3538,4
The goddamned 1% is spoiled rotten,3539,2
My friends brother got bored with his gold fish,3540,2
ELI5 What is the purpose of Occupy Wall Street,3541,8
Montana Man Shot and Killed by Estranged Wife He was DENIED a restraining a order 3 weeks earlier,3542,2
Militant Atheism Its Funny Because Its True,3543,2
No one IRL seems to get the reference,3544,2
Canadas National Boardgame,3545,7
Im gonna just stay here and smoke a cigarette,3546,2
AMPUTATION,3547,6
AMA request someone who has had Richard Dawkins Carl Sagan or Stephen Hawking as a professor,3548,7
if i had a scrap for every time this happens,3549,2
Sorry if its a repost but Damn its so True,3550,2
Hey gurl wanna see my triforce,3551,2
In Private Wall St Bankers Dismiss Protesters As Unsophisticated Its not a middleclass uprisingIts fringe groups Its people who have the time to do this,3552,8
A reminder to stay single and spend your money and time on yourself,3553,2
Whiteshirt police officer punches woman in the face UNREAL,3554,2
Im having a House Warming party; this is the event image,3555,2
Wall Street duck just doesnt understand,3556,8
Best headline ever,3557,2
Drawing like a boss [pic],3558,2
A musical proposition,3559,3
Did anyone ever think about this,3560,2
IE6 usage drops below 20% web developers around the world rejoice,3561,4
IAmA 28 year old who spent his life savings putting his mother through college  AMA,3562,2
Thats right sweetheart,3563,1
So true,3564,2
When you see it,3565,2
You Have The Right,3566,2
Huks parents at Orlando cheering him on,3567,4
FOUNDER of the 53%,3568,6
The original Hangover,3569,2
The best dog leash I have ever owned,3570,2
Siris Favorite Color Illustrated,3571,2
Had a party last night Someone must have gotten a little hungry,3572,2
Go for the Gold MKP,3573,2
Pat yourself on the back if you do this,3574,2
Sexygators,3575,0
How to Trolling the TV news,3576,2
Overthinking It,3577,2
The top 10 most visited countries in the world,3578,2
Late night drawing,3579,2
Bachmann for President Am I doing this right,3580,2
OK You can now submit your video to the Hitchens project Heres how,3581,2
Lawrence Lessig Congress is corrupted by a system of privately funded elections,3582,2
I was using my friends Spotify account then I realized it updates the facebook feed,3583,2
Hey I made this AFTER writing a paper,3584,2
Occupy Wall Street protests spread to major cities around the world,3585,8
Redditors Wife asks the meaning of this meme,3586,2
I made a L4D kit for my friends birthday I thought you guys might be interested in seeing it,3587,2
Problem,3588,2
Real men dont eat,3589,2
How could this day possibly get any worse oh,3590,2
If everyone in the world were allowed one free murder should they choose to accept it would you still be alive,3591,2
Baby alpaca girl born 3 days ago,3592,2
Romney’s ‘Middle Class Tax Cut’ Would Provide No Benefits To Most Of The Middle Class,3593,7
I can see,3594,2
Well played rempty,3595,2
Its my VERY FIRST reddit birthday No cat or kid pics Just me harassing religious protesters at the EXXXOTICA Expo,3596,2
Paranormal Cattivity,3597,4
My husband loves cookie dough I made him this cake for his birthday,3598,2
After a day in Forza 4 I bring you this,3599,2
What is the most mindnumbingly dumb thing anyone has done or said in your presence,3600,2
Little Orphan Millie,3601,2
Texting with Dan Harmon,3602,3
Obama has failed not because he is a progressive in the mold of Franklin Delano Roosevelt but because he is not,3603,8
Barbie was never meant to be a nudist,3604,4
I kicked my roommate out today for bringing home an unwanted guest,3605,2
Teds cave a relatively unknown peice of Internet fiction that utilises the fear of the unknown to chill the reader,3606,5
So the 4s camera is pretty good,3607,2
Just got back from Times Square 5000070000 people It was amazing But when I got home there was NADA ZERO ZILCH coverage on ANY of the major news stations Not that Im surprised,3608,2
Sometimes you know they are going to lose,3609,2
Evil Troy and Evil Abed,3610,2
Minecraft anyone,3611,2
Hands down the best novelty account on reddit,3612,2
What the new MLG player booth cams remind me of,3613,2
What about a junglerainforestbiome No new blocks needed,3614,2
July I love you more and more,3615,7
I probably shouldnt have taken away all those intelligence points,3616,2
Yes quite (Theres even a narwhal),3617,2
TIL Mary Kay Bergman voice of cartoon characters such as the original Timmy Turner Batgirl Gwen Stacy and many more voices from our childhood committed suicide,3618,1
miracle muffins (xpost from F7U12),3619,9
Scumbag puppy,3620,4
TLO massage Husky during interview,3621,7
Our Generation,3622,2
How the US Republican candidate fracas sounds to an atheist,3623,2
Hermione Granger,3624,9
Broken foot Green cast What would you do,3625,2
My brother in Iraq (2008),3626,7
Yep I think sending MKP to MLG was the right decision What a Boss,3627,2
This is all I see when I play SpyO_O,3628,2
Philosoraptor,3629,5
In my quest to make business trips more bearable I finally found good use for the hotel safe,3630,2
The First Ever Minecraft Game show,3631,2
John Mayer on Steve Jobs,3632,8
Classic Game Made Better,3633,2
Just comment out,3634,2
Check out my birthday cake,3635,2
Why I love Top Gear,3636,7
Scumbag Immune System,3637,4
Shut up and give sick kids your money,3638,2
One of the best features of MLGs stream,3639,2
Playing Super Smash Bros,3640,7
My Minecraft School Project  A Renaissance Museum,3641,2
I realized this only just now I feel stupid,3642,2
I asked Siri to read me a story,3643,2
Duck,3644,0
What is something that never fails to blow your mind,3645,2
What has Aperture Science done,3646,4
Whoever you are thank you,3647,0
Happy birthday Apollo,3648,2
Just a reminder before Halloween,3649,2
Fruit Dealer vs TSL Killer  EPIC trash talking,3650,2
One thing is for sure about Marineking,3651,2
CSIEnterprise,3652,5
Nyan cat Meets Metal,3653,2
To commemorate TSMs new gaming house,3654,2
Got a deal on a sweet lunchbox with sandwich cutters,3655,2
Conservatives pull funding from the Canadian Environmental Network,3656,2
Ron Paul to announce agenda next week He will eliminate five departments saving one trillion in spending and only take a presidential salary of $39336,3657,2
Dear Xboxcom,3658,8
Encouraging both sides to get along (Budapest Hungary),3659,1
This is my favorite Seinfeld scene Replace daily news with reddit and thats basically me,3660,2
The maid I hired from craigslist was actually a maid,3661,1
Can we get a link to the latest prerelease in the sidebar,3662,2
A protester at Occupy Denver confronted by a state trooper hes known since 1st grade,3663,2
This is my town _,3664,6
That I should leave it but I just have to say something moment,3665,2
Badum Tss (Wait for it),3666,8
Dan Harmon explains everything,3667,1
Then suddenly the mountain of joy became terrifying,3668,6
This shirt is no longer valid ,3669,2
Solitaire,3670,3
If I could have ANY puppy,3671,2
Wood Settling Rage,3672,9
The Cain 999 plan will be a ~100% tax increase on median income families as far as I can tell,3673,7
A wallpaper for the first gen fans,3674,2
TIL the largest per capita tea drinking nation is the Republic of Ireland not Britain,3675,2
My Granny turns 99 tomorrow Awwwwww Yeeeaaahhh,3676,2
Forgive me for my stupidity but for the life of me I cannot figure out why this is wrong,3677,2
I used to make 3D South Park pics  heres my first pic in about 9 years,3678,2
Enjoy a picture of a fatherson combo (,3679,2
my gay cousin,3680,2
Before getting back into turn 944 of an epic Civ V game Steam automatically applies the latest patch,3681,2
This is going to be difficult to come back from  Day[9],3682,2
Houston (xpost from rfunny),3683,2
Rick Reilly absolutely eviscerates Al Davis,3684,6
I hope this gets implemented,3685,2
Its almost that time of year again,3686,2
A Programmer’s Greatest Enemy,3687,4
I dont know who this is but please dont stop,3688,2
Pluto Might Be the Largest Dwarf Planet after All for years it appears to rank a distant second in terms of size to Eris a dwarf planet discovered in 2005 New data show that Eris is almost the same size as Pluto—and possibly even a bit smaller,3689,2
I asked my mom for sticky notes She brought me this Do you think she knows,3690,2
I concur,3691,0
I think I know who Im voting for,3692,2
Because this is AMERICA God dammit,3693,2
re watching XFiles,3694,2
Having TwitchTV stream IEM NY has convinced all the viewers of how much better Own3d is,3695,2
How true it is,3696,2
Thatsssss A very nice iPhone you have there,3697,2
MarineKing playing funday monday,3698,7
Looking forward to paintball this season,3699,2
Troys candy cigarette case (xpost from gifs),3700,2
Child Slaves Made Your Halloween Candy Stop Buying It The connection between major candy bar manufacturers and child slavery is one of the worlds bestkept secrets,3701,2
I was looking through my grandparents attic then i found this,3702,2
Odd sight in Santa Monica All black badgeless and special GA plates,3703,7
My reaction when my friends persistently tell me Wrestling is fake,3704,2
Six reasons why Return of the Jedi is better than its reputation,3705,2
10 commandments I think most of us can agree on regardless of religion or lack thereof,3706,2
What about reincarnation,3707,3
Parks and Recreation Knows Whats Going On,3708,8
first world solutions,3709,2
Saw this at Legoland Florida yesterday Well played Lego designers,3710,2
Me in my bubbly fortress of manliness,3711,1
Big Food makes Big Finance look like amateurs 3 firms process 70% of US beef; 87% of acreage dedicated to GE crops contained crops bearing Monsanto traits; 4 companies produced 75% of cereal and snacks,3712,2
I feel more like this everyday,3713,2
A wild dingo eating a shark Welcome to Australia,3714,7
Herman Cains 999  a family of 4 earning 50kyr will go from $3850 in fed taxes a year to $6250,3715,2
Some people just dont get it,3716,2
I like photoshopping ferrets into photos of my brother and then tagging him on facebook,3717,2
Interesting spring phenomenon,3718,2
I have never ever seen anything more awesome,3719,2
California Medical Asssociation calls for legalization of marijuana,3720,2
Brazilian President Dilma Rousseff takes hard line on corruption fires chief of staff and ministers People are making it clear in the streets and elsewhere that longtolerated sins such as bribery graft and other acts of corruption are no longer tolerable,3721,2
After all the players left for the day one remained to practice,3722,2
My Dad vs Duck Face,3723,2
FOTC on womens rights,3724,2
Teenagers of IAmA Please take note,3725,2
Oval gears,3726,0
Teachers of Reddit what is the creepiest thing youve ever seen a child dosay Ill start,3727,2
Ignorance,3728,8
A true Robinsons Survival Island with beautiful landscape,3729,2
I am a TA at a university My professor and I are currently in an unusual and very awkward situation and we could use some advice,3730,2
MLG Orlando Championship Sunday LIVE with Starcraft 2 Halo and Call of Duty Finals featuring Day9 Tastosis djWHEAT Husky and more,3731,7
Scientists confront Perry administration over censorship in Texas People who do research on the gulf coast need to be more organized,3732,2
This Is My Grandmother Somewhere in South Dakota probably around 1910,3733,2
My friend fell through a glass table and unknowingly onto a cup of grape juice For a brief moment I thought he died,3734,2
My friend strapped a camera to a pug and made this Pugs world POV,3735,2
Oh Nevermind,3736,2
Looks like he never left,3737,2
Catholic Church stole 300000 babies in Spain and then sold them,3738,1
Dark Side of the Loom,3739,7
What is the most authentic UFO footage ever captured on film that is clear to look at and has not been proven to be fake,3740,2
I like turtles,3741,2
BMI Hurting Artists Yet Again a small restaurant had to stop having a local band perform every Friday night after BMI demanded $3000,3742,2
Senate republicans kill President Obamas bill that could have raised economic growth by 125 percentage points and have created 13 million jobs in 2012,3743,2
Seriously why,3744,2
TIL that when the DDay forces landed Hitler was asleep None of his generals dared send reenforcements without his permission and noone dared wake him,3745,2
Gently down the stream,3746,2
IAmA 23yo whose parents are imprisoned for my brothers murder AMA,3747,7
Oh I love surprises FFFFFFFUUUUUUUUUUUU,3748,2
Its what were all doing RIGHT NOW,3749,2
Just saw this on the Wheel of Fortune,3750,2
Inspired by all the drunks an nere do wells of rfood I have attempted one of your pies of America,3751,4
Recently in New York,3752,2
Michael Scott on love,3753,7
I would love to know if others feel this way,3754,2
Just A Mom Protesting Wall Street,3755,8
OH NO,3756,2
Seriously[From my local newspaper],3757,8
Just realized this while playing through Mass Effect 2 again,3758,2
Anyone else miss this guy,3759,2
I know Im not the only one who does this,3760,2
Last hand of a card shark,3761,2
Were trying to automagically recreate the whole of Azeroth in Minecraft Heres a first test of Stormwind,3762,2
I felt that this was necessary,3763,2
Seriously happens every semester,3764,2
Its simple now we get rid of the Batdog,3765,2
Grandpas Reaction To 2 Girls 1 Cup,3766,2
EU considering massive cuts to food aid for poor The European Union is considering a roughly 75 percent cut in funding for a program that helps feed 18 million of its poorest citizens The cutswould come at a time of rising unemployment and consumer food prices in many parts of Europe,3767,2
IAMA female ambulanceworker in Oslo Norway I was at work during the shooting and terrorism July 22 AMA,3768,8
Hot off the press,3769,7
TIL that in 1997 Microsoft invested $150 million in Apple to help revitalize the then failing company and had they kept a hold of that investment until now it would be worth $457 billion,3770,2
A smiling husky,3771,7
Can we make these popular again please,3772,2
House passed a bill that would allow doctors and hospitals to exercise their conscience by letting pregnant women facing emergency medical conditions die Yes die,3773,2
City,3774,2
My friends will not stop saying Nope,3775,2
I caught six black students plagiarizing but cant fail them for fear of legal retribution,3776,2
Last weekend my wife and my sister and I took a glass making class Yesterday we got our pieces back and here is what we made,3777,2
My boyfriend ruined our picture with Notch,3778,2
MarineKing doing the upvote sign,3779,2
California Medical Assn calls for legalization of marijuana  urges it be regulated like alcohol,3780,2
Mind blown with just paper,3781,1
The aTeam,3782,9
Janitor finds mentally disabled people chained in basement; 3 arrested,3783,2
Why dont we go to work looking like this anymore,3784,2
The average human,3785,2
Two great tastes that taste great together,3786,2
 3,3787,2
How I Know Its Saturday Night,3788,2
Sesame Streets YouTube account hacked,3789,2
Bored after work at a banquet hall 2 cups of salt 12 a cup of pepper and an hour of tedious work,3790,8
TIL The Carolina Panthers Logo is shaped to resemble the combined borders of North and South Carolina,3791,8
How Starbucks logo should be in the future,3792,2
Amazing ICO fanart,3793,6
Made my kids a Minecraft bed,3794,2
Crap did I buy the ghetto version of word,3795,8
No Netflix I dont think thats how movie recommendations work,3796,2
Reddit guess who i saw today,3797,2
Good Dog Greg goes out,3798,2
Dance like you got it all figured out,3799,2
Would everyone closing out our banking accounts be an effective means of protest Not all of us can Occupy Wall Street but we CAN show our support Would this be a good idea How many people would need to do this for it to be effective,3800,2
Just my Princess Leia costume and my little Ewok,3801,2
Lesbian kama sutra,3802,0
Battleship Supporting womens rights since 1931,3803,7
Pimped Pad [Fixed],3804,1
What is wrong with 2Fort today,3805,2
Im so glad my uncle remarried and had a son,3806,2
GDG is the best wingman,3807,4
A cat and a box,3808,2
The Original most interesting man in the world,3809,2
Poor Polt,3810,5
One of my favorite childhood activities,3811,2
Everyday Iz shufflin,3812,6
Laughterhouse,3813,0
A case of terribly slow paypal emails,3814,7
Long Live The Emperor,3815,2
My secular hypocrisy,3816,7
The platypus truly the greatest of all creatures,3817,4
Eliot Spitzer Why Occupy Wall Street Has Already Won  OWS brought the issues of equity fairness justice income distribution and accountability for the economic cataclysm front and center,3818,8
Destroying cancer cells by incorporating an artificial biological computer ork recognizes certain cancer cells using logic combinations of five cancerspecific molecular factors,3819,8
Devil Child Teenage Atheist Shares Hers Story,3820,6
ಠ_ಠ,3821,2
Man made rainbow,3822,2
Browsing rwtf,3823,7
Last year antipiracy outfit AiPlex Software admitted launching DDoS attacks against several torrent sites This led to negative PR and several retributive attacks from Anonymous A year later AiPlex attempts to erase these events from history by asking bloggers to take down their reports,3824,8
I saw this painting on the wall at a party,3825,8
I didnt think the video quality was that bad,3826,2
MarineKing I just want to let you know,3827,2
my name is spelled with 2 ts dumbass,3828,1
Perspective,3829,5
Ive got news for you buddy,3830,2
This guy is hosting SNL on November 5th I could NOT be more excited,3831,6
Britain is Awesome,3832,2
Dreams,3833,1
Was it good for you MLG Orlando day 2,3834,2
Im not quite sure Ill be able to follow this piece of advice,3835,2
Cube [gif],3836,2
Found this in a bathroom stall of the engineering building,3837,2
SpongeBob Redux,3838,5
Scumbag Wireless,3839,4
My fridge,3840,2
I come back from college and this is what I find in my room (xpost from rvalve),3841,2
Its been over a month and Im still lauging at this comment,3842,2
Sleepy Kitty,3843,1
Zachary Quinto Comes Out as a Gay Man,3844,2
These two players should never sit together,3845,2
Exsqueeze me (first post),3846,3
Anyone else looking forward to this as much as I am,3847,2
Fifteen People Youll See At Every Nerd Convention,3848,2
My BF is a manager at a game store and asked me to do a painting he could raffle off at tomorrows midnight launch,3849,1
Im sure Im not the only one who does this,3850,2
My kingsize bed is too wide so I cant tell which way around the sheets go,3851,2
God Adam and Eve and our sexual behavior,3852,8
Before and After pics to celebrate achieving my weight lose goal the same weekend I ran a 25min 5k,3853,2
Cats love balloon gloves,3854,4
Sunset Flower,3855,0
How PR works,3856,6
This headstone is in the graveyard by my childhood home It has always stood out to me,3857,2
Addict,3858,7
Difference of Perspective,3859,8
12 Most Absurd Laws Used to Stifle the Occupy Wall St Movement Around the Country As protests spring up in cities across the country authorities are thinking up creative ways to contain this peaceful uprising,3860,8
Yeah we can make one too,3861,2
I wish I was this good at anything,3862,2
Does anyone else miss cheat codes,3863,2
Awesome picture of a fireman and the pregnant Doberman he just rescued from a fire,3864,2
‘Bank Transfer Day’ Protest Attracts Massive Facebook Following As Well As “Bank Trolls” 32000 people have pledged to do as a form of protest against the muchreviled debit card fees that some banks are planning on introducing,3865,8
Not Against The NYPD,3866,8
Redditors Wife,3867,2
World before and after Steve Jobs innovations,3868,8
So Ive just found this cubistic Creeper carpet What you guys think,3869,2
Trolling 19721983,3870,5
Who else found this sweater delightful,3871,2
Epic Dwarven City Timelapse,3872,2
The truth is,3873,6
i am not a clever man,3874,4
Bachmann $41 million raised $61 million spent,3875,2
YSK If you hover over the redditor for x years text on your userpage you can see the date  time you joined the site,3876,2
The top 1 percent havethe best lifestyles,3877,7
This elevator makes me nervous,3878,2
Alice in Nukeland,3879,6
Great Bargain,3880,2
Baby fennec fox,3881,4
Evolution,3882,2
What I see when I press on my eyelids [gif],3883,2
Do you realize we just paid for,3884,8
A friend of mine found Dexters apartment,3885,2
Love it when this happens,3886,2
So you finally get the girl back to your house How did you blow it,3887,2
I think I annoy a lot of my Facebook friends but I cant imagine why,3888,2
The Pyro showing his hatred for spies,3889,0
SAP on MLG Orlando,3890,7
OMG thats so true,3891,1
A woman goes to the doctor all black and blue,3892,2
TIL Native Americans introduced the front crawl swimming stroke to the West when they beat the British who only used the breaststroke,3893,2
Every saturday night,3894,2
I have three of these on my street There needs to be more around the world,3895,2
As Requested Sases Cheercannon,3896,9
MKP + Reddit = <3,3897,2
IAMA request  MusclesGlasses,3898,2
Police called after passengers stranded on plane or an entire day,3899,2
Cranky Kong on piracy (Donkey Kong Country),3900,5
Too soon,3901,4
My collection of Victorian Postmortem photography,3902,2
Looks like Rex is living up to his old Chicago standards,3903,2
ELI5 Why do I get a metallic taste in my mouth and a fuzzy ache in my head and hands after a nap but not a full night of sleep,3904,7
You shot twice (Leslie Nielsen in Police Squad),3905,8
OpenOfficeorg is now officially part of the Apache family,3906,7
Were gonna miss you buddy,3907,2
Slowpoke acknowledges the Middle East,3908,9
This might be old but check out whats behind Capt Jack (from torchwood),3909,2
Deer and fox kiss,3910,8
Volcker Rule Made Simple  Banks Cant Gamble With Our Money FDIC unanimously approved the rule the Federal Reserve backed it and SEC followed suit final version up for public comment for 60 days,3911,2
TIL Frederick the Great of Prussia is believed to have said a crown is just a hat that lets the rain in,3912,2
He was the 8th 10th 12th 14th 18th 22nd 24th 26th 34th 36th and 44th President of Mexico,3913,3
Tonight,3914,8
I wanted to put some beer in the fridge but it was already full of food,3915,2
The Fall of Man  [Robert Ingersoll],3916,2
Dear Reddit I was at Occupy Wall Street today,3917,8
Having multiple fantasy teams is a hard life,3918,2
yes yes I am,3919,2
I come back from college and this is what I find in my room (xpost from rvalve),3920,2
ITAP of my friends badass dad,3921,2
SNL Ron Paul,3922,6
If real life was more like Pokémon,3923,2
War Veteran stands up to NYPD in Occupy Wall Street protests,3924,8
Fire and Blood and Pumpkin (Targaryen Jackolantern),3925,2
Helped paint a diversity mural at a Brooklyn elem school today Gave my kid a rainbow head,3926,7
She gon be a big dog,3927,2
Never be this guy if you want to be an Indie Dev,3928,2
A Special Friend,3929,2
The exact moment when he found his love for HoneyBaked Ham,3930,2
I like your Christ,3931,2
Nyan Turret,3932,1
Forever Alone is a Man of Principle,3933,2
Röyksopp  Happy up Here,3934,2
My friend carved this AMAZING jackolantern,3935,2
I think our chicken wants to come inside,3936,2
Rare transit of Venus across the face of the Sun,3937,2
An accurate representation,3938,0
Jackpot,3939,6
Best protest sign ever,3940,2
Our newest member of the family,3941,7
I work retail and someone paid for their purchase with a check,3942,2
Dat focus fire,3943,2
DRM Needs To Be Banned Because It’s Toxic,3944,2
Gintama always has the best episode titles,3945,2
Kratos Kitty disapproves,3946,2
Daydreaming kitty,3947,0
My astronomy tattoo by Michelle Helmer at Sacred Soul Tattoo in Renton WA (take 2),3948,5
TIL that in Poland they let painters create all film posters even international,3949,2
Dark portal monitor frame,3950,5
The banana failed to cheer her up,3951,8
Nitrogen Fixing trees boost crop yields in Africa,3952,4
Lowlight photo taken with iPhone 4S Shot at dawn straight from the phone Pretty pretty good,3953,2
Quantum Levitation,3954,6
Scumbag penguin,3955,4
NEWS,3956,2
One of the worst ways to die,3957,2
Delicious,3958,1
Ultimate effect of trolling,3959,5
School demolishes its chapel to make way for new science classrooms,3960,2
Picture taken this past weekend by friend of my Moms In the mountains just outside of Boulder CO,3961,2
yummy,3962,5
An unprecedented study that followed several thousand undergraduates through four years of college found that large numbers didnt learn the critical thinking complex reasoning and written communication skills that are widely assumed to be at the core of a college education,3963,2
Dont Get Mad,3964,2
Best wedding picture ever,3965,2
My stats textbook author must have hated his life Found this is the glossary,3966,2
Manniversary in a nutshell,3967,5
happening at skewl,3968,0
shower,3969,2
How NOT to handle hecklers,3970,5
Reddit  whats the most satisfying picture on the internet,3971,2
Quantum Levitation [Xpost from Technology],3972,6
gohan tsubu,3973,6
Credit union websites see a huge jump in traffic after Bank of America announced their debit card fees  Credit Union National Association saw an eightfold jump for their website,3974,2
Using computer modelling software Ive been able to predict the cover for next years Fifa game,3975,2
Picture of Zach Braff screwing one of his fans,3976,2
The Rich Say the Funniest Things Someone making $200,3977,2
Running out on your $60 billpriceless,3978,6
