Title,doc,topic
Being single really gives a bicep workout,5797,2
This guy pisses me off and I dont know why,5798,2
Please Kill me,5799,2
Its not just the pit bulls,5800,1
Dont EVEN Get Me Started,5801,2
Appropriate grimaces,5802,5
My thoughts exactly,5803,2
Artosis Face,5804,9
Are you my mummy,5805,8
The Midwestern United States at night with Aurora Borealis is featured in this image photographed by an Expedition 29 crew member on the International Space Station,5806,2
My Explosive Pal,5807,4
Every Day,5808,2
Saw this in a coffee shop today CANNOT BE UNSEEN,5809,2
Epic teacher is epic (fixed),5810,2
For those who cant sit down and get to work (aka everyone on Reddit) use the magic work cycle,5811,2
immorality,5812,6
No idea when or where but god damn they all look good,5813,2
Its important to be respectful,5814,8
I dont think this is going to help Verizon,5815,2
I would sit by this stream for hours Snowdonia NP in Wales,5816,2
The cutest thing ive captured,5817,2
Insanity Wolf is running for office as well,5818,1
Puppy dog eyes [Nailed it],5819,2
Found this on a trash can in the city,5820,2
Red Dead Redemption GOTY edition has some interesting bonus content,5821,2
Completely starstrucktwo of the nicest guys I have ever met,5822,2
Whenever Im the first person to leave an exam,5823,2
Reload,5824,5
Adorable Scumbag,5825,4
The Paradox Of The New Elite [I]n economic terms,5826,2
The nations largest union of registered nurses is calling on its membership in Chicago to picket City Hall this morning to demand that misdemeanor trespassing charges against the nurses and all of the protesters be dropped The charges were made at the Occupy Chicago protest,5827,8
Dont mind me Mr Biology Teacher,5828,2
Let Me Mod That For You Pig fat an alternative to slime balls (Download link in comments),5829,2
Coworker kept telling me there was a dead duck in the bathroom Now I cannot unsee,5830,2
In the week of Hallowe’en,5831,2
The Gaben Vow Aninteresting weapon style for the Solemn Vow,5832,7
Temporary Island Created By Floods,5833,6
come at me hose,5834,2
Bad Timing (Why dates and times are hard),5835,2
Microsoft blew my mind again,5836,1
You cant tell me no one took a video of this,5837,2
Admiral Adama on agnosticism and atheism,5838,6
My first submitted pic Be(e) n(ice),5839,2
Cal Clutterbucks fine mustache takes us all beck to a more gentlemanly era of the game,5840,2
Yup pretty much,5841,2
Success Daryl,5842,2
ITS BACK,5843,2
TIL that climbing up the stairs on all fours is what started the DAE subreddit,5844,3
guy cuts off parking meter with saw,5845,2
If every country consumed as much as the US,5846,2
New decal preview (I never know where the line is for shameless selfpromotion),5847,2
I hate free to play [The Word of Notch],5848,2
Nipples Or Heads Of Dancers,5849,4
I totally almost got in to Yale,5850,2
Recent Mount and Musket Battle (hint its hilarious),5851,7
What is the most accidental creepy thing youve done,5852,2
This House in Oak Park Will Eat You,5853,8
I saw this today and remembered my last submission to roccupywallstreet about winter coming,5854,2
I still cant get over this,5855,2
correspondence;revelations;00,5856,6
Meerkat,5857,9
Battling Death to the death,5858,2
I choose you,5859,9
Who is resisting the urge to get the 4s and is waiting for 5,5860,2
Found a kitten a few days ago being bullied by a big cat and covered in fleas; a bath some food and a trip to the vet later hes well on his way to a long and happy life We named him Lucky,5861,2
Its not you its me (plumber style breakup),5862,7
Really Commander,5863,2
10 years of PTI openings,5864,2
My favourite zombies at the toronto zombie walk this year,5865,2
My humble home network nexus,5866,2
The impossible nailthroughwood trick,5867,8
A pic of my Grandpa 65 years ago like a boss it would be amazing if anyone could add color Hes had a rough year with Prostate cancer,5868,2
Damnit,5869,5
Little map Im working on ),5870,2
Mike Rowe on morality and the reality of the working world One of the better talks Ive ever seen,5871,2
What did i just watch,5872,2
Sadly only 1 person recognized my pumpkin (,5873,2
A letter from Richard Feynman to his deceased wife,5874,2
My first century my first post =),5875,2
1251  The Strokes,5876,2
Al Capones cell at Eastern State Penitentiary,5877,6
Im freaking out man Ahhhhh,5878,4
Reducing rage clarifying simplifying I thought the earlier ones missed the mark,5879,2
She used to be a stray Now she is Tonks,5880,2
In honor of Halloween and for those who have not had the chance to read it here is flossdailys gripping tale from a while back,5881,2
Finally a demo for the Metroid 2 Remake,5882,1
Earthquake damage Nope just coastal erosion,5883,7
Minecraft coming soon for xbox why not get this one,5884,2
whoa (photo from RamsCowboys),5885,7
Supernovas > Christ,5886,4
Occupy Wall Street demonstrations lay bare the militarization of the police forces across the country But it shows that America has been ignoring whats been going on in African American communities White Americans ignored the militarization of police when it wasnt directed at them,5887,2
Woops,5888,4
Linux 31 released,5889,2
My UChicago supplementary essay – a limerick proof of the Four Color Theorem,5890,6
TIL no life has ever been saved by emergency oxygen masks in commercial airplanes nor has any life ever been lost due to their absence,5891,2
Any time I start to feel discouraged like Im not making any progress I look back to pics from a few years ago,5892,2
A Song of Ice and Lemoncakes,5893,2
What would happen if you detonated a nuclear bomb in the Mariana Trench,5894,7
Chain post fail,5895,2
I destroyed every mushroom I saw in a dungeon while playing Dragon Nest When I got back to town this was in my mail box Oh Nexon you so silly,5896,2
My hand painted Jake bag,5897,2
Looked up the lyrics to an instrumental song was not dissapointed,5898,2
dear atheism {fixed},5899,8
IGN gives Uncharted 3 a perfect 10,5900,1
Scumbag IAMA (European style),5901,4
Predictions for Free Champions in Week 68 (Preseason 2 Week 6),5902,1
A Song of Ice and Lemoncakes,5903,2
TIL that the Supreme Court ruled that the tomato is a vegetable even though its botanically a fruit,5904,2
BBC radio tribute to Dennis Ritchie With commentaries from Brian Kernighan Tim BernersLee and Bill Thompson (And for Soul fans theres also a tribute to Sylvia Robinson in the same programme),5905,2
Will corporate media stop saying that it is A tough economy and it is tough for everyone Nations wealthiest individuals even better off since the recession,5906,2
NBA Where _____ Happens,5907,6
Torrenting at its finest,5908,5
I balanced some random things and snapped a photo,5909,2
What does rscifi think of this SciFi painting I did yesterday afternoon Constructive criticism encouraged,5910,1
The joys of working Customer support,5911,1
On Parenthood | Your children they ruin everything in the nicest way,5912,4
Wanted to go as my favorite comic book character for Halloween Howd I do,5913,2
My Pumpkin Totoro,5914,2
Bell Canada Says It Plans To Stop Throttling Internet,5915,2
My sister entered a contest to have this picture she took at our cabin on the front cover of a phonebook What do you think,5916,2
Great waste of time,5917,2
Well that explains it,5918,1
Stronghold meets abandoned mineshaft in a library,5919,0
Who decided that this month is the perfect month to release all great games at once and why is the rest of the year almost like a wasteland in comparison,5920,7
How to get the old lady smell out of thrift store clothes,5921,2
c 1325 in what is now South Dakota almost 500 people including children were tortured mutilated and killed If someone hadnt come along later to bury the victims we would have never known it happened,5922,2
Dear Blizzard Please dont kill the Carrier Here are some reasons why,5923,2
Reddit how do you cope with your anxiety,5924,2
Y U NO ONLINE GOT,5925,2
Drew Brees had less incompletions (4) than touchdown passes (5) tonight,5926,8
Atheism is a religion like off is a TV channel,5927,2
Why I Use Google,5928,8
Good News Everyone India close to wiping out polio,5929,2
Bruce Wayne on medication,5930,3
Not sure if you want Skyrim This may help [Fixed],5931,2
This weight loss program really works,5932,2
RPS Exclusive Lack Of A Battlefield 3 Review,5933,0
Different projectile models for rocket launchers,5934,3
The bankers blockade of WikiLeaks must end Whether you support WikiLeaks or not the blockade by Visa Mastercard Paypal and others is a sinister attack on free speech,5935,2
Reddit meet Josh While camping my friends and I were approached by a bear Out of nowhere Josh rode in front of the bear and screamed  driving the bear away Josh declined food and payment  he had to get back to biking across the country for charity If youre out there Josh thank you,5936,2
I went away on vacation and came back this at work,5937,2
Oakland Police Use Rubber Bullets Flash Grenades And Smoke Bombs To Evict Occupy Oakland,5938,8
Classic Picture of Bill Clinton and Al Gore,5939,2
Its my (real) birthday today I did an image search for birthday meme and laughed out loud when I got to page 6,5940,2
GTAV trailer debuts November 2nd,5941,6
Awaiting takeoff in the plane that will bring them home,5942,0
Just a guy making chess pieces,5943,2
Petition to take rbestof off the frontpage,5944,2
New NZ drink driving ad farking hits the maori nail on the head bro chur,5945,0
My 4 year old nephew has it bad,5946,2
My pumpkin scares the crap out of me,5947,2
Seems legit to me,5948,3
Why I get annoyed when people ask me to draw a tattoo for them,5949,2
Women in Chicago being arrested for wearing one piece bathing suits without the required leg coverings 1922,5950,2
Found these in a used book I bought,5951,2
Found these lying on my desk My roomates excuse I knew you wouldnt buy it,5952,4
Taibbi Wall Street isnt winning its cheating,5953,8
They’ve become a vengeful cult that will never back the president on anything even their own jobgrowth policies They will even destroy the economy to achieve their goals They do not care about democracy They want absolute control And they’re succeeding,5954,2
Apple Continues To Insist Only It Can Use An Apple In A Logo; Threatens Small German Cafe,5955,2
Two congressmen are asking the FTC to investigate super cookies that websites use to track visitors after they leave the site,5956,2
If you eat Ill work better,5957,2
My kids first Halloween costume,5958,2
Strawberries protect the stomach from alcohol ,5959,2
We adopted this puppy yesterday In with his papers I found this note from the foster familys children,5960,2
Rainn Wilson loves DelTaco,5961,5
my friends brother helped design this,5962,2
Fallout 3  The 1%,5963,2
Found this guy relaxing on campus,5964,2
A month after surgery someone asked me this That is actually her profile picture,5965,2
‘Anonymous’ vows to ‘destroy’ Fox News website on Nov 5th,5966,8
I have never seen my cat look so concerned I waited 3 months before I felt I was worthy of sharing this photo,5967,2
US Senators introduce bill to stop warrantless GPS tracking It is the job of Congress to protect and defend the United States Constitution and the personal liberties provided to American citizens under the Fourth Amendment,5968,2
At Least WE are Peaceful,5969,2
It wasnt,5970,2
ill just leave this here reddit,5971,2
Am I the 2%,5972,0
A friend of mine works at a zoo and they recently banned an old Italian man who kept turning up in a tuxedo and hurling naked photos of himself at the elephants while swearing at them in Italian Has anyone heard of a stranger nonsexual fetish,5973,2
Wait for it,5974,1
The Church of Scientologys trying to hit back at Matt Stone & Trey Parker by digging up dirt on them (using private investigators),5975,7
Yup that pretty much sums it up,5976,2
My dad knows an engineer working on One World Trade center in New York He took these awesome pictures from an altitude of 1115ft [MORE INSIDE],5977,2
727 makes an emergency landing after front landing gear malfunction,5978,7
Amazing Akali Cosplay,5979,6
chameleon,5980,2
Painted over a picture from goodwill for my friends birthday,5981,2
Have you no decency English,5982,8
[Idea] Graveyards,5983,4
This was probably meant to be private,5984,2
Women just cant shoot 3s,5985,2
My friend drew this for halloween Try to find the ghost,5986,2
Angry birds for Blackberry,5987,0
Jeff Bridges 3 different films same shirt,5988,2
i enjoy this style of facebook status,5989,2
Flight Back From Iwo To (Iwo Jima) Sorry I didnt slide my seat back far enough to get the whole HUD,5990,2
The most difficult part of being the guy caught in wind for Halloween is holding the pose all night,5991,2
Not sure if it fits but you guys understand,5992,2
AskReddit is for questions only,5993,9
Patricks got the right idea,5994,2
My secret to surviving Mondays,5995,2
Beautiful picture of a peacock in flight,5996,2
This is my moms idea of an apropriate Halloween decoration Its the only thing she put out and no other house on our block has ANY decoration,5997,2
Ive never seen my cat look so concerned (xpost rcatpictures),5998,2
TIL the richest man in China is named Kashing,5999,1
I can hear the people in coach complaining from my first class seat,6000,2
Dexter doesnt know how to use an iPhone,6001,2
This is what a sneezing puppy looks like,6002,2
GGG is a considerate man,6003,4
Made a Halloween appetizer Mummies,6004,2
Five guys is just a restaurant,6005,2
my tshirt design for How to Make it in America let me know what you think,6006,2
Well theres your problem right there,6007,2
Bacon Wrapped Stuffing Balls,6008,2
Googles biannual transparency report shows US tried to get videos of Police brutality removed from YouTube,6009,8
Evolution of the Battlefield Minimap(xpost from rbattlefield3),6010,0
Sunrise in Hawaii from Stairway to Heaven,6011,2
Is anyone else not buying BF3 because its not on steam,6012,2
TED Rated Jaw Dropping,6013,0
Now this is a pumpkin carving,6014,2
Season 4  Metalopolis is back,6015,2
So I had my second maternity shoot on sunday What do you guys think,6016,2
Insanity Woolf,6017,1
A hell of a drug,6018,2
A favorite moment in the final pages of Steve Jobs biography,6019,2
In calc 3 you get credit for honesty,6020,0
Gary Johnson I urge you to exert some leadership and reclaim the nominating process from the national news media who are today preordaining the viability and success of candidates,6021,9
GAME,6022,2
How to avoid extinction,6023,6
This year for Halloween i decided to go as the red heavy,6024,2
Winter is coming,6025,2
),6026,2
How did he,6027,0
Taking a**hole to a whole new level,6028,2
Everyones posting their halloween costumes Im pretty shy but I figured I could post mine,6029,2
This Wine is My Blood Drink of It,6030,0
Toronto city council bans sale and consumption of shark fin,6031,7
My cat found a new way to sleep,6032,2
My friends husband wins Halloween,6033,2
About that karma,6034,2
Shut Up,6035,7
In Jesus name Amen,6036,1
Can I keep him,6037,2
New hat for the Soldier,6038,2
Maybe just a phase,6039,9
Giant Lego Man washes ashore in Florida (Photo by Jeff Hindman),6040,1
Battlefield 3 on PC Max settings and 1080p looks INCREDIBLE,6041,0
US Congress to try to pass a law making it a felony to upload a video with any amount of copyrighted material Even if youre just singing it to showcase talent,6042,2
Road traffic safety  You do it wrong,6043,4
Some Days You Just Cant Get Rid of a Bomb,6044,2
karmasutur3 dates a sociopath lives to tell the story,6045,7
Ive waited many years Now I will finally get my revenge,6046,2
Scumbag Jon,6047,4
Scumbag christians,6048,4
Thought you guys might like this,6049,2
Lets Give Blizzard A Round of Applause,6050,2
My family photo,6051,2
Sketch of Charles Darwin as a character in Jak and Daxter,6052,4
I am so sorry 200 seconds Short,6053,2
Heres a spreadsheet plan a workable budget Just plug in your salary,6054,2
Shader Toy,6055,2
How you should treat the audience  Polt,6056,2
I tried I dont think I can do it,6057,2
My kids first Halloween costume,6058,2
IAMA Girl who has Alopecia Universalis AMA,6059,2
John McCarthy the researcher who invented LISP and coined the term Artificial Intelligence has died at age 84,6060,8
The 1% decides to Occupy Itself,6061,8
My roommate and his girlfriend with Nick Cage,6062,4
Brands A Cautionary Overview,6063,8
Bicycle Parking,6064,2
My brothers quote on being stuck in Bronze League,6065,7
Dubstep dancing so smooth its unreal,6066,4
Me and a buddy airbrushed these curtains for a little 5 year old girl Hope she likes them,6067,2
A 2000 year old cult is still a cult Sorry,6068,2
Congressional approval has reached a new low at 9 percent,6069,7
Media Watch tear Today Tonight a new one,6070,2
Obama Plan Would Cut StudentLoan Interest Rates  WSJcom,6071,2
Stayed up all night again,6072,2
My costume for Halloween is nearly complete,6073,2
Thanks wall,6074,8
Advertising is a poison that demeans even love – and were hooked on it,6075,2
Cut my hair for my Tonks costume Yay or nay,6076,2
Alarm Why not Zoidberg,6077,6
little owl,6078,2
These protesters,6079,8
My fellow undergrads am I the only one,6080,2
The intern gets revenge,6081,3
Look what I found at GAP,6082,2
What the Oh Its just a robot riding a bicycle,6083,2
If an astronaut killed another astronaut on the moon would he be arrested when he got back to earth,6084,2
Perry On Whether His Tax Plan Gives Millions In Tax Breaks To The Rich ‘I Don’t Care About That’,6085,7
TIL I can contact Mayor Quan and tell her what she ordered the police to do to Occupy Oakland was unjust and disgusting And so can you (510) 2383141,6086,8
So a friend of mine made this Nailed it,6087,2
Robert Englund tearing off his Freddy Krueger makeup,6088,4
Diagram of Orbital Altitudes,6089,0
The mostused unit of measurement in the design world Period,6090,2
Wait for it,6091,1
PeanutSriracha Ramen with Chicken Bok Choi and Brocolli,6092,5
Rawwwr,6093,7
The most important ingame purchase ever [Mass Effect 2],6094,4
Easy way to run Minecraft Server as a service (247) and keep it up to date,6095,2
An Astronaut dropping a feather and a hammer on the moon That is all,6096,1
This may very well be the strongest picture Ive ever seen,6097,2
Into the abyss,6098,5
If you ever want a good facebook quote just look to the bible,6099,2
Father of the Year,6100,2
DAE read stuff about their friends lives on Facebook but pretend you didnt know about it IRL if they tell you because you feel creepy about knowing already,6101,2
This made me laugh for a full minute,6102,2
Ive always taught my kids to respect cops today I had to explain this picture to my 10 yr old,6103,2
Painted this valve cover for my boyfriend ) whatchu think,6104,2
No Hitler WAS NOT an Atheist,6105,6
I found this at a pawn shop today for FOUR BUCKS,6106,2
Toronto City Council bans sale consumption of shark fin,6107,7
What is the grossest thing you have extracted from your body,6108,2
Young Stephen Hawking wedding day,6109,2
The real reason Tony La Russa brought in the wrong reliever last night,6110,2
Why a capacitor blocks DC,6111,1
So I found this old picture of My Bernese mountain dog who is now dead and my now 7 year old Golden retriever in all out war All over a toy,6112,2
Idea regarding the relationship between fence posts and glass panes,6113,7
Raynor My Pumpkin for the Blizzard Comp,6114,2
Way better than a trampoline Id say,6115,2
Whenever I use a map,6116,2
I Cry Manly Tears,6117,2
I gotta SHIIIIT,6118,4
I think this auction is getting out of control,6119,2
Im very guilty of this,6120,2
Thought you guys might like this [fixed],6121,2
Every time I intentionally avoid thugs when exploring Arkham City,6122,2
The face of the average religious person on rAtheism,6123,2
I am LORD of all I survey,6124,7
DAE check behind the shower curtain before using the toilet when at someone elses house,6125,2
Youre all going to get a good laugh out of this one,6126,2
GTAV location revealed,6127,5
I married by first cousin (maternal) and have two lovely children (twins) AMA,6128,2
Fake,6129,2
This is how I feel about Reddit lately,6130,2
Cool pic of NYC my dad took from his office,6131,2
Baby Capybaras,6132,4
Oakland Police Use Rubber Bullets Flash Grenades And Smoke Bombs To Evict Occupy Oakland,6133,8
Reddit users blackmail and get someone fired on rgameswap over Deus Ex keys,6134,8
Hey you pay attention in class,6135,2
I volunteer at a coffee house at school Our cup sleeves are plain One of the regulars draws these,6136,2
At the USCanadian border on the way to Vancouver,6137,4
Contact,6138,7
Disapproving Dog,6139,8
ITAP of Aurora Borealis,6140,1
Was playing Mass Effect 1 the other day happened upon this mysterious encounter,6141,2
Oh October you so delicious,6142,2
Thoughts on 100% sell price for the first 60 seconds of a match,6143,2
My Store Manager came up with the idea of having our midnight customers sign a posterI like how it turned out,6144,2
Destiny grabbing some baneling ass,6145,2
By far the most insane awesome dude on the world wide web,6146,2
In a world where geography and rivalries are meaningless conference alignment should be dictated by mascots,6147,3
Rather than being a safeguard against injustice law has become a weapon used by the most powerful to protect their illgotten gains,6148,2
Some men,6149,2
After 3 hours in the bathroom (I know Im not the only one to have done this),6150,2
Time for a new Reddits favorite books thread,6151,2
Microsecodn,6152,8
The bankers blockade of WikiLeaks must end Whether you support WikiLeaks or not the blockade by Visa Mastercard Paypal and others is a sinister attack on free speech,6153,2
Im having a pretty crappy day But this helps,6154,2
Im not a very big Shirley fan but this scene never fails to make me burst out laughing,6155,2
another day on reddit,6156,2
Mornings,6157,0
Todays my boyfriends birthday He loves both TES and Minecraft so I drew this for him,6158,2
This just happened,6159,1
PolitiFact Alan Graysons defense of Occupy Wall Street is impassioned but is it accurate Yep,6160,8
Teenage Ghandhi,6161,1
Researchers Create Fluoride Battery Look to Replace Lithiumion Technology; A fluoride battery has the potential to hold ten times more energy than a lithium battery,6162,0
Are people seriously this sensitive Being offended by Costumes on Halloween,6163,2
and this is exactly why I hate the Discovery Channel,6164,2
Candy Corn Murder,6165,2
Why yes of course I play Terran,6166,2
AMC Renews The Walking Dead for Season 3,6167,2
Rescuing a dog from the Nevada desert,6168,8
Toronto Mayor Rob Ford calls police against 22 Minutes crew wanting to ambush him to discuss Movember,6169,8
I want to start investing in stocks but want to practice first Is there a tool or easy way you know of that would track a fake investment over time,6170,2
Soooo Metal,6171,7
Look what I found in my macroeconomics book,6172,2
The Man Who Knew Too Much — Libyans may be celebrating the killing of Muammar alQaddafi but youd better believe that Western governments are breathing a sigh of relief themselves,6173,4
Researchers have found evidence for the existence of a hypnotic state,6174,2
People like this make me sick,6175,2
who needs a watch,6176,2
Im sorry tumblr but the truth is,6177,2
The United States of America is on the verge of becoming a Police State The Occupy movement has placed a spot light on the fact,6178,2
Nice Lady……,6179,2
Hey guys was told I should post this here Valve cover I painted for my boyfriend ),6180,2
I made this gif the other day and it still makes me laugh,6181,2
Scott Olsen twotour veteran of the Iraq war who was hit in the head by a teargas canister has a fractured skull brain swelling and is in critical condition,6182,7
I have to use a decoy keyboard to get any work done,6183,2
outside my window just now,6184,8
Lord of the Rings reunion (photo by Sarah Dunn for Empire Magazine) [crosspost from rpics],6185,7
PROTECT IP Renamed EPARASITES Act; Would Create The Great Firewall Of America,6186,2
Halloween costumes  cannot believe how cool this is,6187,2
Ken Jennings is(nt) the 99%,6188,6
I love it when people get into the spirit of the holiday This was parked outside of my buddys work,6189,2
EA Support is amazing Thanks Nicole,6190,2
This little guy won Halloween,6191,2
A fruit label that turns into soap when you wash your fruit How awesome is that,6192,6
Oakland Police send a flashbang grenade into group trying to aid an injured protester Why is this not top news,6193,7
Trent Reznor comments on Facebooks Spotify integration in the November issue of Wired,6194,4
Motherboard City,6195,2
So I was watching the World Series and saw Mitch Moreland blast a home run to right then I got this text from my dad,6196,2
Reddit what is your best and thats why I got banned story,6197,2
Meanwhile in Colorado,6198,8
Lord of the Rings reunion (photo by Sarah Dunn for Empire Magazine),6199,7
I want to do it too,6200,2
Somebody stole my mood ring and I dont know how to feel about it,6201,2
The Three (older) Amigos,6202,2
It seems so,6203,3
Robert Reich Obama Should Call For Glass Steagall Reinstatement And A Breakup Of Big Banks,6204,7
My badass uncle owns a serval Its as big as his daughter,6205,7
The presenter said if she had a bigger laptop we could see more of the website,6206,2
Halloween costume,6207,2
4chan at its best,6208,4
TIL Nobody will insure Jackie Chan or his team so he pays for himself and his stunt team,6209,2
My Generation is Doomed,6210,2
Almost everyday,6211,2
Your DNA may carry a ‘memory’ of your living conditions in childhood,6212,2
Londons Metropolitan Police discovers existence of a secret mobile phone within News Internationals east London HQ that was used in more than 1000 incidents of illegal hacking,6213,2
Disrespectful,6214,4
that old man,6215,2
The Parallel Park,6216,8
Spotted BeBop and Rocksteady downtown tonight Nailed it,6217,8
We Are the Creators & Executive Producers of THE LEAGUE on FX Ask Us Anything,6218,7
