Title,doc,topic
And so ends 20 years of frustration,0,2
We need to stop saying They should legalize Marijuana and start saying,1,2
My husband told me if I ever showed anyone this picture of him on stage at a StarTrek convention when he was 8yo he would divorce me Im so calling his bluff enjoy,2,2
Taking traffic school online and its telling me I answered a question incorrectly You be the judge,3,2
RachelRay Halloween costume for last year,4,2
What is something you realized embarrassingly late in your life,5,2
Facebook sued over tracking users after logout,6,8
Banksy,7,5
CY&H Dubstep,8,4
I am a large portion of the 99% (dont worry its not a rage comic or sob story),9,6
Thousands of Australian schoolchildren are being forced to sing an alternative version of the Australian national anthem that installs Christ as the countrys head of state and removes any reference to the Southern Cross,10,2
Found outside my Taco Bell that closed yesterday,11,4
Of all the things that make me feel old this hits me the hardest,12,2
What are some mind blowing quotes you wish everyone would read,13,2
Britneys Fragrance AdvertCommercial,14,0
This explains so much,15,2
A 2500 year old chariot complete with horses unearthed in the city of Luoyang in central China,16,1
Someday,17,4
My roommate left,18,4
Oh to be young again,19,2
Well Im ready for the Zombie Apocalypse,20,2
This is insane And needs to stop,21,2
Problem solved,22,2
One of the most underrated men in comedy,23,2
Audrey HepburnNatalie Portman,24,3
ratheism mods Why have you removed the Invisible Pink Unicorn from the subreddit logo,25,8
So this was in my schools parking lot today,26,2
Inexpensive cat treadmill,27,2
What do you mean excessive I only used one source water block for my fountain like everybody else,28,2
I have to mail a letter,29,2
National Elections should be held on Federal and State holiday open from dawn till dusk Support Voting Day,30,2
Occupy Wall Street protestors being arrested on Brooklyn Bridge right now,31,8
Coworker sent out angry companywide email asking for tape dispenser back This was my reply,32,2
I walked into a McDonalds and did not expect the prices to be so damn high,33,2
What was rockbottom in your life,34,8
if you ever need an emergency laptop bag,35,2
I go to college people thought we were Macgruber and Einstein,36,2
Little Brother Video Bombs Sisters Dance Video,37,2
How true,38,2
TIL Nixon proposed national healthcare in 1971 and the major partisan debate centered only around WHAT KIND of national plan should be created,39,1
Redditors Husband,40,2
Intervention,41,5
Zombie Apocalypse  I commissioned another Redditor to draw this for my little brother for his birthday Hes in the front,42,2
This means something,43,2
TIL there are thousands of slaves buried under Wall Street,44,8
This is called MINEcraft right,45,2
So I got really bored tonight and decided to spend 3 hours reimagining reddit awards as military decorations and what that would look like Its not a suggestion or anything just sharing,46,2
Im exploring the bottom of Pavillion Lake for NASA logging what is found at 35 meters deep I run into this,47,2
I am the 1%,48,8
I believe in *micro*erosion but not macro,49,8
The greatest unsolved mystery,50,4
One of my students lunchbox,51,2
Verizon sues to overturn net neutrality rules,52,7
Concerning villagers and their impact on gameplay,53,6
Ive noticed an eerily common thread running through the anti99% posts Kind of scares me,54,6
In response to Texas elimination of last meals for condemned prisoners a former prison cookinmate is offering to provide the meals himself free of charge,55,1
How I felt after buying a wine rack,56,3
I hate how little this happens lately,57,2
Google be trippin,58,8
Look what I found on my university campus in Idaho,59,2
Brainfu*k Turing Machine (Javascript),60,2
My first take on the updown arrows,61,2
Bunnyhopping extraordinaire,62,0
Dogs vs Cats,63,2
Why do people say Occupy Wall Street is poorly defined or has no clean meaning or goals It cant fit on a bumper sticker but everyone knows what its about Occupy Wall Street can be summed up in two simple word economic justice,64,8
This Week In Gaming September 25  October 1,65,2
My baby bengal Nikita,66,4
Still the greatest fight I have ever seen in my entire life,67,2
Rising gold inflation and craft supply shortages got you angry,68,6
My 99 story,69,2
It was my friends and I who held the candle lit vigil outside the closed Taco Bell,70,4
If you pass out at my house,71,2
Throwing myself to the wolves  I am part of The 1%    AMA,72,2
To TheJosh,73,5
I cant jerk off to Justin Beiber,74,1
I see what you did there,75,2
Scumbag British Weather,76,2
My mother crossstitched this for my upcoming daugther,77,8
Found this on a scaffold outside a museum in New York during my road trip this summer Worth thinking about [xpost from rpics],78,2
Knitting is not manly,79,2
AMA request Aziz Ansari,80,2
A colleague quit today and sent this to everyonetouche,81,7
No NOW its art,82,5
Realistic combat simulator my ass,83,2
Milk SERIOUS BUSINESS,84,2
Its really the only acceptable way to go to a Disney Princess party,85,2
Why I shouldnt be a babysitter,86,2
I love pandas so heres an evoline I thought would be neat,87,2
The simple request of a heavy machine operator From one Redditor to another,88,2
My sister is way too gullible,89,4
What is one thing you suffer from that other people should be grateful they dont have,90,2
The doctor has bad news,91,2
Redditor Johnnysoldier shows what Afghanistan is really like via helmet cams,92,2
I R 99%,93,6
How to manage cables for 8 hard drives,94,2
Occupy Wall Street Bernie Sanders celebrates protests calls for real Wall Street reform,95,8
I cant be the only one,96,2
This is my first dog; I adopted him a year ago and am starting to think we have the same personality,97,2
Thought Id share my first scraper board with you guys,98,2
Christian for all my life on the fence for several months and I finally made it to the other side Heres what made me lose faith in a God,99,2
Pandas  from David Attenboroughs deleted scenes,100,2
Youll regret it,101,2
A little criticism of ratheism,102,8
Mmm Breakfast burrito with roast pork scrambled eggs jalapenos and two cheeses with a sprinkle of ground ancho and chipotle peppers,103,5
Deciphered lettering from enchantment table screenshot (spoilers),104,1
AMAZING I dont even,105,2
Hot chocolate,106,7
RooMagroo explains in great detail what its like to be dead,107,2
YSK about jury nullification if enough people knew about this we could have radical political changes very quickly at least theoretically,108,4
Truly Made Me lol,109,2
IAmA The creator of the Hands of God image AMA,110,2
Why should we miss out just for being Brits I AM THE 99,111,2
Parents of Reddit tell us embarrassing stories about your children,112,2
Jerry and his ball machine,113,2
Oh naive Anderson quit while youre ahead,114,2
I would feel like such a Ninja if I wore this,115,2
Please do not drop cigarette buts on the ground,116,2
17 Inventors killed by their own inventions,117,3
Helpful Tyler Durden got your text,118,2
Corgi smooch,119,2
God Damn it Food Network,120,2
rescued this little guy now i drink my morning coffee with him on my shoulder,121,2
POPsickleSTRIP Fribbleberries (see comments),122,3
League Painting  Complete,123,2
Its not what it looks like,124,2
Im Ready,125,2
I have gone without diagnosis from 7 specialist doctors and have been painfully sick for 9 months I dont know what to do,126,2
So I decided to see how many sex offenders were within a 5 mile radius of my apartment,127,2
Neal Stephenson signed all of my books,128,3
Fluttershy destroying Twilight in a game of DDR,129,4
Although Aladdin is a Middle Eastern tale the story is set in China and Aladdin is explicitly Chinese,130,6
So much for discreet packaging,131,2
morphism explains why Pi is infinitely long,132,1
If Donald Trump doesnt get elected president,133,2
A Westboro Church we could all get behind,134,2
Wrong place wrong place,135,2
24 Arrested As Protesters Pack Financial District in Boston,136,7
I live in Stockholm Sweden Lately I find myself scanning the people I walk by when walking down the street searching for a specific person,137,2
Found this while playing Fallout New Vegas,138,2
orange koalas in a pineapple tree,139,7
What is the 99%,140,6
As a nonfps player this is how I see the average fps player based on the game they play,141,2
TIL the first President of Zimbabwe was called President Banana,142,2
Longtime Coffee Shop Employee Thought Customers Would Care More About His Last Day,143,2
Saw this at my local game shop why did i find this so funny,144,2
Thought you guys may like the Dalek cake I had made for my sons birthday,145,2
Scumbag Mom GoldSilver Edition,146,4
America why havent you revolted yet,147,2
The Sun September 29 2011  I took this photo yesterday,148,2
A friend of mine led me to believe that Dustin Browder was judging the TL Map Contest I threw this together,149,2
Hospital you say Meh I got this,150,2
I think I misunderstood the commercial I saw in Holland,151,2
This Week in Starcraft 2 September 25  October 1,152,2
Business Cat,153,2
Im paying $86 a month for this Not cool Rogers,154,2
How to Procrastinate and Still Get Things Done,155,2
Whoa thats WAY more dangerous than drunk driving,156,4
The Real 99,157,2
Getting up for work on a Monday,158,2
Constant Companion [Comic],159,6
My attempt on Villagers (stumpy arms small noses ),160,2
fish and chips,161,4
Why dont heated paths work Ive had enough of shovelling snow,162,2
This is how I die,163,2
Ready for my close up (suggested xpost from pics),164,2
Why you dont have kids,165,2
False advertising,166,8
99% is subjective,167,6
The reddit karma train,168,2
The First World Problem I wanted to post was already posted,169,2
Time to get away for awhile,170,2
sharpest view of the sun,171,8
In defense of the Armchair Activists,172,0
Looks like Vengeance Baby found you,173,2
Meet The 4 Democratic Senators Who Are Refusing To Raise Taxes On The Rich,174,2
Coal Energy Drink,175,0
Mark Twain on the Bible,176,6
Tolerance,177,5
IAMA Son of a polygamist cult leader AMAA,178,7
Just remember As Occupy Wall Street continues to grow there will be false reports of attacks and illegal behavior Keep it in mind that people will accuse the crowd of doing things they didnt do,179,8
True love,180,2
Deceit,181,9
Its the little things (Thanks Notruenorseman),182,2
Colander,183,3
Hit me,184,2
Now that its October there are only 3 ladies I really wanna see,185,2
WhiteRa gives a super polite small tour of the Red Bull LAN With Tyler Ret Socke and Destiny,186,8
The protesters have marched onto the Brooklyn Bridge and met with cops and paddy wagons on the other side who wont let them continue The orange net is out and the cops are unsure what to do,187,2
Ready for my closeup,188,7
Dont forget to take the sun into account in your design,189,2
Evolution of Cat to Nyan Cat,190,2
Photographer Uses Star Wars Toys In Amazing Photo Scenarios,191,1
If only I was a child again,192,2
First Pavilion (Cedar),193,2
Pawbump,194,5
Puppy Learns how to howl,195,0
American redditors will never know addiction like this,196,2
4chan has no sympathy,197,4
To this day why I hate bees,198,2
My friends,199,2
My minecraft crafting idea,200,2
Is this yours,201,0
Chicken Trap Extreme Soulstone+Signs+Pressure Plates,202,3
TIL That the film Three Men and a Baby was directed by Leonard Nimoy,203,2
A group of black woman react to the east coast earthqauke,204,2
Every time I laugh at this every time,205,2
Imma let you finish,206,4
Would there be intrest in a IAMA from a Russian Soldier that was dispatched to Chernobyl,207,7
Photo of the Occupy Wallstreet Library Quite a few good reads,208,2
Up All Night by Blink 182  Covered by some guy to make it sound like older Blink 182 This version is a LOT better,209,2
Best novelty account ever I think so,210,2
How round is your circle,211,2
Captain America Hoodie,212,2
Some day it will happen,213,2
Official Discussion Thread  Episode 13 The Wedding of River Song,214,2
WTF Gamespot,215,2
Mass arrests of Occupy Wall Street protestors at Brooklyn Bridge,216,8
Baby octopi everywhere A whole rainbow of baby octopi,217,4
Laughed harder than I probably should have,218,2
So I got my new Kindle With the buttons reversed and upsidedown,219,2
I believe I was at Casterly Rock today,220,8
Occupy Wall st Has Taken Over the Brooklyn Bridge,221,8
[NSV] Got a daaaamn girl as I walked down the street,222,2
Never fails to make me laugh,223,2
He just might go to the NFL,224,2
The question isn’t why some people become addicts but why we all dont,225,2
I have to sleep facing the wall because everything in my room has a power light indicator on it,226,2
Sybill Tyler,227,3
October is here,228,2
How does Bruce Wayne not own a tailored suit ಠ_ಠ,229,3
Two kinds of awesomeness combined,230,8
So I just figured out that you can do this,231,2
Stark Grammar,232,4
Whats the scariest thing youve been woken up bywoken up to,233,2
Whats your best took one for the team moment Ill start,234,2
How i farm,235,5
I figure Id tell my 99% Story,236,2
Cigarette vending machines banned in England,237,2
River Song(TWORS spoilers),238,2
QXC on Day9,239,1
I love how playful a serious game can be,240,2
My Favorite Part of the Finale [Spoilers],241,2
Im a lurker and my girlfriend isnt a Redditor Tell me what you think of the engagement ring I bought her,242,2
I just cant beat that one star world level I am the 99%,243,2
Meanwhile in Russia,244,8
My father passed away from Leukemia when I was four years old He wrote this letter to me a year before he passed I felt it was time to share how awesome my dad was with everyone,245,2
Friends,246,2
Bloomberg Koch Brothers get richer with secret sales to Iran bribed foreign officials and stole oil,247,1
When my grandpa was my age he legally fenced off an intersection,248,5
President of the USW The United Steelworkers union stands in solidarity with and strongly supports Occupy Wall Street The brave men and women,249,8
To the Occupy Wall Street Movement Thank You,250,8
7 YEARS of stacking at its finest,251,2
German Politician Violates His Own TwoStrikes AntiPiracy Plan Siegfried Kauder was hosting at least two photos on his website which were taken from a photo sharing site without permission,252,2
TIL that in Finland (and other nordic countries) they mostly dont have the restriction of trespassing You can roam across and camp on nearly all land pick berries and mushrooms and catch fish,253,2
Nuns learn Karate and Aikido as selfdefense There are many glorious moments in these 2 minutes,254,2
I dont know why I keep falling for this,255,2
Father records sons reaction to Empire Strikes Back reveal,256,2
This is the most synchronised thing I have ever seen in my life,257,2
My first vintage computer,258,2
Facebook claims it does not track users but files patent to do same,259,7
This Is Impressive,260,6
At first glance I thought this woman was horribly deformed ,261,2
only white man to use every racial slur known to man in one movie and be revered for it,262,2
My daughter went to a TF2 themed birthday party She thought rtf2 would like this picture,263,2
Went to the pub with my girlfriend last night,264,2
I give this man respect Hes more of a man than Ill ever be He knows who he is and not ashamed of it And hes a redditor Can we show him some love,265,2
This is the coolest thing you will see all day,266,2
Best Advertising Ever,267,2
My sister is overly sentimental,268,4
Hoth not even once,269,2
TIL in India there are 500 years old bridges weaved from living roots that can withstand the monsoon floods and dont ever rot instead they grow stronger with time,270,2
Scumbag Bison,271,4
Proud kitty out for a stroll,272,2
I made an infographic summarizing different ethical theories,273,3
Invasion of the body scanners in UK Wed all better get used to it – privacy could soon be a thing of the past even at stations,274,2
Matt Taibbi There is a huge number of Americans who simply dont realize that theyve been victimized by Wall Street,275,7
Ive just noticed this in Diablo 2,276,2
The Bible,277,6
long exposure of a plane takeoff at nigh,278,0
Every time I wear a tank topwife beater,279,2
Anyone else think we need mo ice caves,280,2
Nodejs is Cancer,281,6
The single life,282,2
I had to shut it off after i saw this because i couldnt stop laughing,283,2
Forever Astone,284,2
UK Home Secretary calls for the scrapping of the Human Rights Act warns that the Act is hampering the Home Office’s struggle to deport dangerous foreign criminals and terrorist suspects,285,2
Good Guy Greg,286,2
Those awesome Korean comics youve been enjoying Thank Yang YoungSoon,287,6
Redditors wife wants to watch a film,288,2
Amazing Teddy Bear Tattoo,289,2
My best friend was born without eyes This summer we took a crosscountry road trip together and this turned out to be my favorite picture,290,2
I really want to be able to do this,291,2
Battlefield 3 server files leak modded servers appear; DICE responds by stating that joining one may result in your entire Origin account being banned losing access to all games on it,292,0
Thanks to this guy 016 feels like forever ago,293,2
Friend sent this adorableness to me,294,2
Bought a house found the previous owners shame hole,295,2
Wadsworth Constant (resubmitted from a screencap stupid screencappers),296,6
Look what you made me do,297,2
Accidentally clicking on frontpage rdoctorwho links before watching the latest episode,298,9
We are the 99% Occupy Wall Street is a peaceful stand against the big American ripoff Support it and regain your dignity  Mark Ruffalo,299,8
How I feel when Im wearing my sunglasses,300,2
As a huge fan of the game and rminecraft I realize that this may be sacrilegebut I just cant help myself anymore,301,2
DAE not put in the email address in the to field of an important email until youre ready to send,302,2
well thats one way to stop abortion,303,2
I made a lesbian soldier cry last week,304,2
Awesome Art,305,2
How I see Occupy wall street America is starting to learn that when elections dont work protests will,306,2
We got my GFs 9 year old sister a Minecraft account and set her loose in my server We discovered something diabolical under her house weeks later,307,2
Tutorial How to drain water (Probably for beginners),308,1
Rising atheism in America puts religious right on the defensiveHigh profile of faithbased politicians such as Michele Bachmann and Rick Perry masks a steady growth in secularism,309,6
I really want to be able to do this [Fixed],310,2
World Trade Center advertisement,311,2
Bullet impacting a row of M&Ms,312,6
Time Traveler,313,2
Cholos,314,6
I suppose this may happen,315,2
Wheres this game,316,1
Heres an interesting fact There were 600 people arrested over several days during the 1999 Seattle WTO protests The NYPD just arrested 700 in 5 hours,317,2
Youtube Rage,318,9
Thats exactly how they work,319,2
Pure joy,320,6
My first console since the N64 won it too,321,2
So hes stabbing people in the neck sniping their heads off blowing them up etc and hes worried about this,322,4
This happened to me last night,323,2
Im an Arab gamer This just made my day,324,2
IAmA school lunch lady AMA,325,2
My reaction when I heard,326,2
This is how mens bathrooms should be set up,327,6
got pregnant with my daughter while on birth controlshe is the 1%,328,2
a friend of mine is hiking and he just texted me this,329,8
Would you (or your kids) play a violent mathbased multiplayer fighting game,330,2
Every time i see this scene in 2001 A Space Odyssey,331,2
TIL Roys old Koho Lefebvre pads were designed to give the illusion of a wideopen fivehole,332,1
I hate when that happens,333,2
How I saw Pokemon when I was a kid,334,2
If you do this during the entire concert I hate you,335,2
my Pumpkin King and his minions,336,2
I cant see whats playing,337,2
Meanwhile on page 8732,338,8
No thanks McDonalds I will pass,339,2
You cant see me,340,2
We are the 957%,341,7
TELL ME WHERE THE FOUNTAIN IS,342,2
Y U No Use Meme Correctly Please close garage,343,2
After marriage a mans testosterone level will drop significantly,344,1
Ive never been more proud of my sister than when I saw this FB update,345,2
Scumbag tea,346,4
I found a cool use for stairs,347,2
From the creator of The Sagan Series comes The Feynman Series,348,2
Pirate Fortress 2,349,2
Artosiss has the best timings,350,4
I Feel Like Ive Achieved Something Great Today,351,2
Girl Language,352,2
Nintendo If you make a table of these cards so we can watch real pokemon battles I will buy everything you make forever,353,2
LPT When writing an important email leave the to field blank until youre ready to hit send,354,2
[Suggestion] Blaze rods could be crafted into Blaze bows that fire flaming arrows,355,2
Richard Feynman on Beauty,356,7
When you see it,357,2
Saw this on my neighbors garage this morning,358,2
Samus made of pipe cleaners,359,0
ELI5 Monopolies are illegal but I only have one choice for cable internet,360,2
Hipster Dumbledore,361,8
Just took my 2 year old on his first roller coaster ride This is what pure happiness looks like,362,2
No one disrespects chocolate milk,363,2
Sonic Youth  Teen Age Riot,364,2
Determination,365,5
Airport security pre911,366,4
I dont think that its because there arent any jobs in your feild,367,2
I heard you like parkour so i made this adventure map,368,2
German Politician Violates His Own TwoStrikes AntiPiracy Plan Siegfried Kauder was hosting at least two photos on his website which were taken from a photo sharing site without permission,369,2
Just made my Google homepage awesome,370,2
The thing that keeps me going after I lose,371,2
My Kyogrethemed electric guitar,372,9
Reddit this is my first post Id like you to meet my birdson Oliver Hes a Blue Jay and quite the Angry Bird,373,2
IAmA Dermatologist with 34 years experience AMA,374,2
Pokemon,375,8
Propeller Bike,376,4
In socialist Sweden people respect their elders,377,8
Grizzly Adams death,378,1
Olive at 4 weeks,379,1
Can this be a thing,380,2
Flowchart for posts on rfunny,381,2
Bear Grylls may be entertaining but I feel I actually learned something from this guy,382,2
This is where I found my phone after I drove across town,383,6
From Dusk Till Dawn,384,2
Kittens turn on the vacuum monster,385,2
I Had To (S6 Finale Spoilers),386,2
Apples success explained,387,2
Its a big deal,388,2
Reddit We need to talk about Spiders,389,2
Would anyone else but me find this useful,390,2
TIL that a marshmallow hitting the earth at just under the speed of light would cause an explosion equal in energy to the power of a few dozen hydrogen bombs,391,2
After coming home from my first day of work I find this on my laptop,392,2
I can never win these games,393,7
Now I see why hes called Minigun,394,2
It irritates me to no end,395,2
It Only Takes 20 Minutes To Shift The Blame,396,2
Hey rdoctorwho so much Moffat rage so much confusion so many theories and questions but lets not forget,397,2
[SPOILERS] Because someone had to do it,398,7
TIL that a Black Bear almost triggered WWIII,399,2
The Doppler effect,400,0
AlterNets staff Kristen Gwynne Trapped on Brooklyn Bridge Theyre arresting us one by one I just asked a cop and they said theyre going to arrest all of us There are hundreds of people who dont have room to sit down Were just clammed in,401,2
Just when you thought Freddie Mercury couldnt get any more internet friendly,402,2
How I feel whenever someone dies in a PuG Im healing,403,2
Whos the idiot in Jacksonville who painted the field,404,2
Internetbecomingdifficult,405,0
57m headed goal pretty impressive,406,2
Truth,407,6
Two Towers + Enderman Forcefield,408,8
What I just purchased for $1 at auction,409,4
When is Joss Whedon gonna write for Doctor Who,410,4
Meanwhile on the Sun,411,8
Sugar cookie cup cream cheese icing and fruit,412,7
World of Warcraft Class Stereotypes,413,2
Wheelchair Rage (xpost from F7U12),414,9
Seven deadly glasses,415,0
Have you ever been so pissed off that you suplexed a Ghost Train,416,2
If it does not already exist Id like to organize a OWS legal defense fund Will reddit support this,417,2
Verbing weirds language,418,8
Wolves these are my fears,419,4
Wasp Sucking Machine,420,2
That UCLA  Stanford game got out of hand quickly,421,2
Hipster doctor,422,4
[request] Help me proving my students sent a fake corrupt file to me You have just to search for a file in your hard disk,423,2
Cant wait for this time of year,424,2
YSK a Redditor made a script to apply the Wadsworth Constant to all YouTube videos It works wonderfully,425,2
Your argument is invalid,426,7
Awesome LEGO Minecraft scene from Seattles BrickCon [pics],427,6
Number 1 Fan,428,2
The Latest Crime Wave Sending Your Child to a Better School,429,2
Garelux,430,1
In Ireland weve been putting up with torrential rain for the past few days I propose a solution,431,2
I hate it when this happens,432,2
Found while checking our HVAC registers [xpost from rpics],433,7
How come in alien movies everyone knows what aliens are but in zombie movies nobody knows what a zombie is,434,2
IAmA PIANIST Reddit ask me what you would like to hear and I will upload Videos to YouTube,435,7
Its a trap,436,3
Nyan stitch (About 25 hours; counted crossstitch is tedious) (xpost from redditcom because they hated it  I hope you guys dont),437,2
it says to serve and protect,438,2
Just a Drawing of Clint Eastwood,439,4
Breakin it down,440,0
A true British cause,441,2
Little brat gets whats coming,442,2
My husband said not to but,443,2
Forever Alone Paper Mache Man,444,2
Mommys eating Quit being a nuisance,445,7
BF3 Trollrobot,446,7
IAmA member of the censor board for the Internet in a Middle Eastern country AMAA,447,2
I guess Im not the only one,448,2
THIS Is Impressive,449,6
Is anyone else worried that newegg will become the next buycom,450,2
I love that Disney is getting whorish,451,2
Does anyone else wonder this,452,2
