Title,doc,topic
The IRS is made of people,0,4
"Friend of mine just pulled this at a Sonic, gotta hand it to him...",1,4
After drilling for two decades through more than two miles of antarctic ice,2,2
Street Name means something different in a Cleveland high-school,3,4
Five Years Ago Today,4,4
Former CIA Agent Charged Under Espionage Act For Reporting Torture,5,4
Only in Canada,6,2
Custom made wedding bands with waveform of the couple’s own voices. ”I do”.,7,5
So I am online searching for foreclosures...I find this cute little house on a realtor's website (top pic) and I look up the address on Google Maps...,8,9
Imgur just got a new office. We're thinking about doing Tux Tuesdays.,9,2
"I got an amateur telescope for my birthday. Last night, I put my camera up to the eyepiece...",10,2
"Acta goes too far, says MEP-Kader Arif, the lead Acta negotiator in the European Parliament, says Acta potentially cuts access to lifesaving generic drugs and restricts online freedom",11,4
Just a happy little boxer pup on a trampoline.,12,4
Third World Success Kid,13,4
First look at Bill Murray as Franklin Delano Roosevelt for his new film Hyde Park on Hudson,14,4
Waterskiers set new world record in Tasmania,15,4
Sen. Rand Paul Proposes Amendment 1490 to the STOCK Act which would force former elected officials to forfeit their benefits if they choose to become lobbyists,16,4
TIL French mathematician Joseph Fourier believed wrapping his body in a blanket was beneficial to his health. He died after tripping on it and falling down the stairs.,17,9
I sent an email to my PA state rep who sponsored the 'Year of the Bible' resolution. No response yet.,18,9
Expert Mode,19,0
"I'm Dr. Norman Rosenthal, Psychiatrist, Author and Scientist who first described Winter Depression (SAD). AMAA",20,5
The Outrageous Illinois Law That Makes Recording Police Arrests a Felony,21,6
Dominos Knows How To Connect With Its Customer Base,22,8
How an unpopular post got me two free pairs of Björn-Borg underwear,23,4
Nothing stands in the way of a Scotsman and his local fish & chip shop,24,4
What is one cliché movie technique that you never get sick of?,25,4
Found this statue in a mall in Seoul. I think we all know this feeling.,26,4
Efficiency,27,6
who can forget Samuel L. Jackson’s famous role in 1989’s Sea of Love?,28,9
Bill Murray's still got it...,29,4
Sounds like Mass Effect 3 is going to be awesome!,30,4
all of us,31,4
Black cats have been found to have lower odds of adoption in American shelters compared to other colors. Share their cuteness to battle this!,32,4
Wikileaks is looking into buying a boat to protect itself from totalitarian government censorship. Time to join the Wikileaks Navy!,33,4
Spain orders $500M in gold found under the Atlantic by US treasure hunters back home. US courts agree.,34,4
Creation Kit & Skyrim Workshop Preview,35,4
"Reddit, help a reporter: Have you applied for jobs that ask for your log-in information for Facebook?",36,4
"Six years ago I joined reddit, and soon after, my then gf, made this drawing to complain. I present you, what I believe it is, the first ever version of the redditors wife pic.",37,4
"Senate Democrats introduce the Buffet Bill, which would require millionaires to pay at least 30% in federal income taxes",38,9
Isn't this nice? Sweden has a 1:20 million scale model of the solar system. It runs the length of the country. Road trip? Ja tack!,39,3
Single Mother in Milwaukee Raped by Cop – Then Arrested for “Assaulting an Officer”,40,9
"How I feel every time I see a, What does reddit think/Any love for my... post.",41,4
"I eat grapes every morning at my desk, came in to find this on my monitor this morning",42,4
Poland 'may not ratify ACTA' (xpost R/evolutionReddit),43,2
You win a dollar every time you don't play the lottery.,44,4
Why I suck at trivial pursuit,45,3
Very soulful freestyle/beatbox/singing on his porch... wait for it.,46,2
Best part about moving to a new city...,47,4
Kids these days,48,4
The stork theory,49,5
A fox kit I rescued from a window well,50,4
A local gym's solution to feeling fat and ugly,51,1
A Comparison of Tattoos.,52,3
Facebook wisdom (FIXED),53,9
DEAL WITH IT,54,9
Just as Batman suspected.,55,2
How low does your enchanting skill have to be for this to happen??,56,7
Just got back from watching 'The Grey'. Thought I'd make a comic to sum up my thought process. [POSSIBLE SPOILERS],57,4
Turtle bros,58,7
Greatest Italian riders,59,0
Flanders at it again.,60,2
First picture of giraffe bread in the wild.,61,4
Romney says he’s ‘not concerned with the very poor.’,62,6
Original LEGO patent,63,4
So I bought a bootleg copy of a Pokemon game while I was in China...,64,4
A friend of mine went to a house party. He found this in one of the bedrooms. It's 6 ft tall.,65,4
Futurama Fry on friend zones,66,7
Got in a discussion with my roommate who said he couldn't believe in evolution because it seemed too improbable that we were the result of chance. I made up this metaphor in response.,67,2
Toyota reinvents,68,0
"it wasn't really a slow day.. but still, BOR'GATH!!!",69,2
My reaction when I found out my best friend got back together with his ex for the 3rd time,70,4
For those of you wondering why winter is late: he has been crashing at my place for some times now.,71,1
How I feel as an atheist in rural Australia.,72,4
Kim Jungs Children,73,4
"Found an iPad 2 at Goodwill New in Box. 32 gig, wifi for $65. Can't believe it!",74,4
So my wife and I were shopping at Williams and Sonoma when...,75,4
You can tell your reps to oppose the Lamar Smith anti-privacy/data retention/save the children bill over here.,76,4
Don Cornelius: 1936-2012. The World has a little less Soul today.,77,4
"I've seen quite a few typos in my day, but this...",78,4
"No matter how many times I see this 'car' around town, it never gets old...",79,4
I got friendzoned by Good Girl Gina. Friendzones you - still sets you up.,80,4
"Alright Reddit, I think that's enough",81,4
As a military atheist... this kinda pisses me off,82,2
My boyfriend makes really cool animal sculptures by assembling rusty metal and drift wood. [x-post],83,4
I see what you did there...,84,4
Google Earth doing a skiers view of the mountain,85,9
Safety first!,86,8
Tony Hawk & Riley Hawk,87,6
Doin the facebook?,88,9
Futurama Fry on car driving behind at night,89,4
"Well, I have now.",90,4
Our new kitten likes our yellow lab,91,4
Everybody on board?,92,2
First Day On The Internet Kid Has Terrible News,93,4
Browsing REDDIT at my new job...,94,4
Infinite Littlefinger creeping,95,0
Anyone who drives stick can relate,96,9
Not a single ruff was given.,97,4
What Berlin thinks about Occupy Wall Street,98,4
"Hi, I'm Black, and I'm a Mormon. Wait, no. I'm a stock image.",99,4
Bibimbap with Bulgogi - Best. Korean. Food. Ever.,100,4
I love being extremely stupid.,101,2
Scumbag Bed,102,2
Differences between then and now,103,5
How Can you tell A Cockatoo's Gender?,104,4
The First time I had sex,105,4
Zero Punctuation: Star Wars: The Old Republic,106,0
That is a badass dog,107,9
[Detail] Beavers,108,8
Classy sailing,109,3
Christian logic,110,4
My girlfriend and a lost puppy we found in South Korea,111,4
Man deflects police taser wire with lightsaber.,112,4
Indiana Senate passes bill putting religion in science class,113,4
"What is something that has happened to you that is beyond ridiculous? Here, I'll start:",114,4
Not sure if this should be under atheism or advice animals,115,4
Yup... that's a 1-base Battlecruiser all-in.,116,9
My reaction to When you see it posts,117,4
"serious cat, surprised cat",118,2
Truer words never spoken.,119,4
anyone else see a problem here?,120,4
Thought: Do We Own Our Steam Games?,121,3
Kamasutra for parents,122,4
These fine ladies are almost 18.,123,4
Every multiple choice question I don't know.,124,4
Never going to Queensland again,125,4
To all you middle/high schoolers making stupid r/atheism rage comics...,126,2
I wonder if Einstein felt the same way,127,4
"I thought the cow that watched me work couldn't get any creepier, my boss disagreed.",128,4
"Ah, well played Mr. Bond",129,4
Play Half-Life 2 for Half-Life 3 This Weekend,130,2
New Twilight Game!,131,4
Tell me I'm not the only one who always found it an accomplishment when it was in the middle like this.,132,4
Girls: What is the best way in which you have been approached by a guy?,133,4
"In mein opinion, yes, it would be.",134,2
Korean pregnancy test,135,4
Every student at the university I work at,136,4
"Look who I met today, Reddit! Eat your heart out.",137,4
This may be the beginning of the end of the world...but I'm still impressed.,138,4
The Elder Scrolls told of their return,139,9
"Paulo Coelho calls on readers to pirate books. Multimillion-selling author links with Pirate Bay, saying 'the more people pirate a book",140,4
6.5 years of service,141,2
Soon,142,4
I am actor James Allen McCune and I play Jimmy on The Walking Dead. AMAA!,143,9
Doctor Who + Peanuts = Awesome,144,9
At least 40 dead in Egypt Football violence,145,4
How I feel when i play Video Games,146,4
I would pay soooo much money for this. Not even funny. Hope this isn't a repost.,147,4
"Luckily, he had an extra pen",148,2
I've got an unopened letter from WWII. Should I open it?,149,4
Good Guy Lucifer,150,9
Good Kid Greg,151,9
Just when I thought I was the best roomate ever...,152,4
"This poster had been on my bus stop everyday for a month. Today, i found this.",153,4
The harsh truth about catching Pokémon.,154,9
Downvoting Roman,155,5
Apple Scotland Having a little trouble - iPhone commercial for Siri,156,4
"Reddit, we need to clear up some misunderstandings about the Constitution. The Bill of Rights does not 'give' you rights; you and all men are *born* with rights. The Bill of Rights was meant to stop the Government from *infringing* on your rights.",157,4
Best feeling in the world as demoman.,158,4
Never a Quiet Moment - Complete!,159,4
My favorite boys.,160,4
"Planned Parenthood said it has raised $400,000 in online donations in the 24 hours since news broke that Komen would no longer fund cancer screenings at Planned Parenthood clinics.",161,9
Madagascar's ports are closed.,162,7
How I feel as a Canadian on r/atheism/,163,4
Skyrim kept over heating my Xbox. Not any more.,164,4
How I feel when I'm taking a test on a Scantron.,165,4
"My boyfriend's friend wants to buy my car, but he wanted me to get the tags and inspection (all the hard work)... We told him these are his new tags",166,4
South African atheist here: letting my sister-in-law know how 'bold' she is in her faith,167,4
"Black People on Reddit, what are your best white people Jokes?",168,4
While that guy was up in the air...,169,9
How I feel about the radio in Fallout,170,4
Bro recovering from his back surgery with his cat :P,171,4
McWaste,172,0
What Happens When 500 People Trace the Same Line?,173,4
A teacher gave his 26 students the start of a proverb each and asked them to complete.....here are the results,174,4
choose wisely,175,9
Finally got tired of looking at the default loading screen and put one together,176,4
Pretty much the only way I can interpret the release lists,177,4
Don't give up,178,4
"just doing some research for school,.. wait what!?",179,8
My cat Rocko passed away this afternoon. Please enjoy this picture of him looking majestic.,180,4
Well this beats using them for laundry...,181,4
Damn you Dad,182,4
First thing I did when I saw my brother's new TV,183,4
I call them Xanax Bananas (bananas filled with Nutella and oranges,184,8
Socially Awkward Penguin in class,185,9
This guy is selling information from the wiki.,186,4
Idra and Cella know how to have a good time.,187,4
I dont know if this has been posted before. Reddit alien easter egg in Archer,188,4
LPT: Prevent headphones from tangling in your pocket with a small binder clip,189,2
Hopefully adopting him soon.,190,9
"My first post, so I tried to submit something I haven't seen yet",191,4
IAmA Request: Someone who is older than his or her step-parent,192,4
WWE my balls!!,193,3
Living with women...,194,4
An apparent jump in public awareness over Internet throttling and other practices by service providers in Canada has led to a sharp jump in complaints to the federal regulator,195,4
PSA - Do not use LoLRecorder!,196,4
Zing! or: How I Learned to Stop Worrying and Own Theists on Facebook.,197,9
Box Fort,198,6
"How NASA Solved a $100,000,000 Problem for $5.",199,2
Who I originally thought of when I saw Lazy Bachelor Bear.,200,4
"I turned 25 last night, this was my dinner...",201,2
"Seriously, check your tabs before posting a screenshot!",202,2
Waking up to some unexpected karma,203,2
Conspiracy Cats,204,6
Zero Punctuation: Star Wars the Old Republic,205,0
I made Pasta Pie!,206,4
I just got an awesome idea for a secular bookstore name.,207,9
The worst feeling after a long day.,208,4
"Alright /r/Minecraft, you asked for it four months ago, now you finally have it!",209,4
Reddit likes puns right?,210,4
Poor Australian bloke just wants his girl back...,211,4
Why does net rise up against SOPA then ignore Twitter censorship?,212,4
I borrowed Reservoir Dogs from my aunt because I have never seen it before. Whose stupid idea was this? (spoilers),213,2
Thanks mister!,214,4
Zigg's Patch Notes,215,2
"Let's have an upbeat thead, reddit. What's one thing that makes you feel, Wow",216,4
They see me rollin...,217,4
Doritos didn't like our commercial. Maybe reddit will.,218,4
Do you ever rocket jump too far?,219,9
"For my mutt, nothing compares to a cool afternoon breeze...",220,9
The first game I ever 'took notes' on.,221,4
I went to my first hockey game yesterday,222,4
TIL Coinstar operates and owns Redbox.,223,2
A Request to the r/Gaming Community,224,2
Mass hysteria in upstate New York: Why teenage girls are showing Tourette’s-like symptoms,225,4
This just made me horribly depressed,226,4
'Gasland' Journalists Arrested At Hearing By Order Of House Republicans,227,2
My Norwegian Forest Cat,228,8
My favorite Disney atheist!,229,9
I hate this hypocrisy,230,9
My best friend went into labor..,231,4
Good Guy Cat,232,4
Who hates Community?,233,8
STILL working flawlessly after all these years!,234,4
Put your cell phone into a mason jar (with a hole cut in the lid) so you can't turn your alarm off as easily.,235,4
My poor brain.,236,9
"Redbox refuses to push Warner movie delay to 56 days, will rent flicks as they go on sale.",237,8
My new wedding ring. Thought r/Zelda would appreciate it.,238,4
So Beautiful <3,239,5
I had my Minecraft character set in stone! It is amazing!,240,5
User feature suggestions are often not good business decisions,241,4
Baby otter + Keys = GLORY,242,4
The Atmosphere and Sense of Scale this Mod Lends to the Game is Incredible.,243,6
My mum is too generous for her own good,244,9
Happy bucket,245,4
Hahahaha!!,246,8
I have found my calling in life.,247,4
Go ahead. Say it.,248,2
Now don't tell me you don't remember me Reddit,249,4
"The captain is coming! Quick, do something important!",250,2
Graffiti from Scotland,251,8
Protip for customising your Reddit experience,252,4
Taught me more history than my teachers did,253,8
French court rules that it's illegally anticompetitive for Google to provide free maps,254,9
This is now my favorite sushi place.,255,4
Scientology condemned in France for organized fraud,256,5
"TIL there exists a song composed solely for stress testing auto-pianos, and is not remotely playable by humans - Circus Galop.",257,8
Valve sent me a bunch of stuff to give away at my LAN party! Thank you Valve for being so generous!,258,4
Another person who is sick and tired of receiving these..,259,4
Susan G. Komen Website Banner Hacked Last Night,260,9
My friend has terminal cancer and may die by June. I’m trying to fulfill one of his last wishes. Is there any way to obtain a copy of a book that hasn’t been released yet? (Letter to Harry Turtledove attached),261,4
"IAMA writer/producer The Wire and Treme, George Pelecanos, AMA.",262,2
I had a lot of explaining to do when my parents found this on their camera roll... In my defense he deserved it...,263,4
I found this in the hallway on campus today. It is too amazing and funny for words. This person needs some Reddit love via email!,264,4
I love it when people don't look at the source of an article.,265,4
Magic Mushrooms' Effects Illuminated In Brain Imaging Studies: Brain scans of people under the influence of the psilocybin,266,9
Washington State Approves Gay Marriage!,267,9
"If I ever go to an awards show, I am definitely doing this.",268,4
A plane crash site at deep sea,269,9
Komen: A study in how to ruin a brand in 48 hours. Guidestar.org ratings for Komen slump to 1 out of 5 stars.,270,4
I want one of these in my living room,271,4
Badass,272,9
Electric Pole Hanging After a Wild Fire,273,6
Fan made Portal 2 Wheatley cosplay doll.,274,4
Now then. What can you tell me about this cake??,275,4
My brother made this chess set out of engine parts.... I thought it should be on reddit :),276,4
"As requested, IAmA man who was in an extended coma for a period of 4 months. AMA.",277,4
Occupy Sanity,278,9
"Coworker is taking a leave of absence to have his colon removed, so we got him a cake",279,4
I'm going to get so laid,280,4
It happens to the best of us.,281,4
Vintage 1959 phone ad,282,9
Possibly one of the most beautiful bookstores in the world,283,4
Bulgarian ISPs Rise against ACTA (xpost r/evolutionreddit),284,2
How I feel as a-,285,4
TIL that there is a hiding spot in Pac-man where you can sit still safely for as long as you like.,286,4
Accuracy in reporting is important.,287,1
Happy Bill Murray Day!,288,4
Fabulous.,289,5
I'll just leave this here.,290,4
My cousin's daughter has a better sense of humor than most adults I know.,291,4
"Tea, it's boring now",292,9
I take pictures of my roommate when he falls asleep on the couch and photoshop them. He hates me for it. (x-post from r/pics),293,2
APPARENTLY you can't pay your phone bill with kittens..,294,4
And it was the best game ever.,295,4
So what?,296,4
Scumbag Groundhog...,297,2
"Crystal Clear Waters of Sameranger Lake, Austria",298,2
Makes sense.,299,4
Sea Nuke and Beach,300,9
"In wake of Komen defunding, Bloomberg to give $250,000 of his own money to Planned Parenthood",301,9
"Ctrl, Alt, Banana?",302,8
These are going to be the most sheltered kids ever...,303,4
Seems like good advice to me...,304,4
Donald Glover Save Community PSA,305,2
What most AMA's feel like,306,4
Come with me as I make my cake day man meal!,307,4
The OTHER other white meat ... nom! (xpost r/funny),308,2
My roommate discovered Skrillex,309,7
Brace Yourselves,310,6
After six years of World of Warcraft he managed to stop,311,4
Beautiful math handwriting recognition in javascript,312,9
"Just finished an acrylic painting of a fellow redditor's daughter, criticisms welcome.",313,1
Slow Rider.,314,7
Every face tells a story,315,4
What my Valentine's will look like since we broke up...,316,4
Is this some kind of joke?,317,9
First World Fundy Problems,318,4
How I feel as a 51 year old woman on Reddit.,319,4
Super-Earth detected 22 light-years away within the habitable zone of red dwarf star GJ 667C.,320,4
Lazy Rebel,321,4
"Look at me, I'm Dr. Zoidberg - Homeowner!",322,4
"Went to a party, saw this human disco ball...",323,4
As an African American male this is how I feel about black history month.,324,4
I died of laughter when i stumbled upon this,325,4
My english professor had this in his presentation today... New favorite teacher.,326,4
Hilarious Tampax ad,327,9
My dog got a free professional photo because she volunteers at childrens hospital. Enjoy.,328,4
Ricky Gervais scaring Warwick Davis,329,8
First Day on the Internet Kid,330,4
"I don't know why he does it, but I love it",331,4
If pikachu can do it why not us?,332,0
My wife and I both got the same fortunes with our Chinese food last night. I guess this Saturday we're trying anal?,333,9
Thank you reddit! My 66 year old dad is going to participate in his first art show due to your support. Here's the piece that will be featured.,334,4
You'll never know,335,4
ACLU sues Obama administration over assassination secrecy,336,4
The real reason Valve haven't released Meet the Pyro,337,4
"TIL text messages cost you, in some cases, over 5000% more than what they cost your provider to send.",338,2
Pac-man dress... hot,339,6
Scumbag Shoe,340,2
How it feels being 30+ years old and browsing r/gaming.,341,4
Every YouTube video I watch...,342,2
Friend did this today...,343,4
Because nipples.,344,6
Praise be to Natalie! (FB),345,5
I Was 12 When My Father Told Me This Regarding My Little Brother,346,4
"TIL that Xanax's active ingredient only costs $0.024 to make, but the consumer pays $137.79 for 100 pills. A markup of 570,000%",347,2
popped up on my facebook today,348,4
"Reddit, I can die happy; Bill Murray called me pretty.",349,4
Parade of the Lunar Revel (Contest Submission),350,3
What is the dumbest way you have injured yourself?,351,0
Washington State Senate Approves Same-Sex Marriage Bill,352,9
"Mayor Bloomberg to Personally Give $250,000 to Planned Parenthood in Wake of Komen Controversy",353,9
Fox News (FIXED),354,9
Oh hai,355,4
Socially Awesome Awkward Penguin meets a girl at a bar,356,9
Story-time Jesus' party miracle,357,4
Pecky turned up 4 years ago and never left since then he has a family and will come on walks with us.,358,4
This annoys me to no end.,359,4
An important message for the r/gaming community.,360,2
Mommy,361,4
no text required,362,4
I miss the glory days of chatroulette.,363,4
what my Feb 14th will look like....[FIXED],364,4
curiosity,365,1
For Uni I was told to draw a picture that showed my personality,366,4
Flash Fans - A really cool commercial from Budweiser,367,2
I ran into the walk-in fridge at work and startled all the boxes.,368,2
PLEASE Lucasarts...,369,2
How's your math?,370,6
The power of prayer.,371,9
About the survival guide,372,9
My flawless childhood U-Haul truck logic,373,0
Rising from the ink,374,8
"My Lunar Revel entry (Yakuza Riven), with bonus doodles!",375,3
"This popped up on my Facebook newsfeed, couldn't help myself.",376,4
Little Pooh Bear,377,2
Foul Bachelor Frog,378,8
This dad plays ping pong with his baby. That's about the long and short of it.,379,4
"10-Year-Old Discovers new molecule, listed as co-author on academic paper",380,3
NES logic is the best logic,381,4
First Day on the Internet Kid,382,4
Not a good start...,383,9
The door might have a point,384,4
This doesn't look like a fun place.,385,4
Not a flash mob [FB],386,4
Crying kitty,387,2
Oh. My. God.,388,7
Jailbreaking my iphone was the best idea EVER.,389,9
Chocolate Shart,390,0
Math Gusta.,391,9
what my Feb 14th will look like...,392,4
"TIL that there is a star chart inlaid into the floor of the Hoover dam that is so precise it can be used to calculate the moment of the dam’s dedication for the next 14,000 years.",393,4
That moment,394,9
"Pretty lame, Batman.",395,4
Saurtosis,396,7
"TIL that Onni Nurmi, a Finnish man who made rubber boots, died in 1962 and left all 780 shares in his company to a nursing home. One stipulation: They could not sell them. The company went on to become Nokia, making all the elderly residents multi-millionaires.",397,4
"My 9-week-old Dachshund, Snickers: Cuteness Overload.",398,0
No... it's not..,399,3
My Facebook cover photo today,400,4
We don't feel anything.,401,4
Catching a griefer before carnage occurs. Feels good man.,402,9
Dog licking an ice-cream,403,9
Story Time Jesus Turns the Other Cheek,404,4
TF2012!,405,7
Year of the Dragon Cassiopeia [contest entry],406,4
YouTube comments never disappoint me.,407,2
Doctor Who Alignments,408,9
Redditor helps terminal cancer patient fulfill last wishes.,409,9
Washington State Senate Votes 28 - 21 to Legalize Same-Sex Marriage,410,9
"Long time reader, first time caller...I bought Samuel Greybeard Cottontail today, and now my GF's daughter and I have actually been able to truly bond after a year of dating.",411,4
Top 5 Regrets of the Dying,412,4
By Request: IAmA Battlebots champion with the robot the Blender. AMA,413,4
"Harvard Prof.: Congress will not fix Citizens United - the “cancer” of money and corruption in DC has grown to such a degree that the Congress will refuse to make such a change, leaving it to the states to call for a constitutional convention to force that change.",414,4
"Well, at least Domino's is trying to be honest.",415,4
Everytime I see someone post a photography album to facebook,416,4
Is whale sperm any bigger than human sperm?,417,2
Nobody reads ads.,418,4
MOSAICRAFT (progress update) ore feedback please,419,2
i need you to stay late tonight.. we really have to catch that red dot.,420,4
"It's my Cake Day! Here are my 3 boys! Stu, Jr & Derek",421,4
but but but ... it's red..,422,9
How I felt this morning,423,4
"Brit here, I recently got in to (American) football, and I'm really looking forward to watching my first Superbowl in the wee small hours on Sunday night. What should I look out for? Who's everyone's favourite to win? And most importantly what typical snacks and drinks should I prepare?",424,4
Taking Chinese in College,425,4
My entry for the contest.,426,3
Troll Level : Master ...,427,9
TF2 Kids by Syringes,428,4
Top 10 WTF Mods For Skyrim,429,4
Would you like Damage dealt to Champions added to the end game stats?,430,4
The freckles next to my eye make the constellation Cassiopeia,431,4
How it feels being a cat on reddit,432,4
An image of Battling Robots on TV gets the builders of BOTH robots to reply.,433,5
Such a handsome boy,434,4
Seven Days (Fixed),435,4
This picture my friend took a few months ago is finally much more accurate.,436,4
"It's a little long long, but made a great episode even better",437,4
I found these I though you would like them!,438,4
I don't think this one will go over well with Reddit's demographics,439,4
A very interesting cover of Scary Monsters and Nice Sprites,440,4
P.E.M.D.A.S,441,8
