Title,doc,topic
"please, please, please, be careful out there.",1795,2
Found on my college campus. What's wrong with this picture?,1796,9
Proof that Dog exists,1797,9
"TIL That while studying at Cornell, Bill Nye had Carl Sagan as a professor",1798,2
"League of Legends Online Wallpaper Editor (Read first comment before click, please)",1799,4
You can never be too careful,1800,2
Pervert vs Artist,1801,2
If religious people at religiously affiliated institutions don't want to use birth control they can simply not take advantage of its availability. That's their right. Obstructing the rights of other people who disagree with them should not be permitted.,1802,4
Every time I see a bad quality video on YouTube,1803,4
HELP!!! IT'S A SCARY BASKETBALL!!! RUN AWAY!!!,1804,4
"TIL That in 1996 Mark Harmon (Special Agent Leroy Jethro Gibbs, NCIS, TV show) rescued two teenage boys from a car accident that occurred outside his home. He used a sledgehammer from his garage to break a window and pull the two out of the burning car.",1805,4
"c'mon tom, not the waterslide again..",1806,5
I hope it's the first,1807,4
Does anyone else see it?,1808,4
A splash of rose,1809,8
/b/ wants to name the Toronto Zoo's new bear Gaben. Let's get behind this!,1810,4
The secret of happiness is,1811,4
Go Ellen! Go JCPenneys too for not giving in to those hateful old hags at OMM. I'll be shopping at JCPenneys now.,1812,4
She thought his notes were a joke.,1813,4
"Oh, okay.",1814,4
Good Guy Picard,1815,9
What goes through my head moments before giving an upvote,1816,4
I'm going to spend the rest of my day at work watching this,1817,4
My brother spotted Walter White in a McDonald's in Winnipeg. I am the one who knocks.,1818,4
Remorseful Kitty,1819,2
Hipster Level 99,1820,8
I Want you to want me....,1821,4
Molar Bear...,1822,0
Valve makes the bestest mods!,1823,4
"TIL in medieval times clothes were stored close to the toilet shaft, as the ammonia fumes would kill any fleas",1824,2
They said we could listen to music in class...,1825,9
Misty and Staryu.,1826,1
"Why is it morally ok to euthanize a pet to spare its suffering, but not ok to do the same for people?",1827,9
Dual inguinal hernia repair was a success... and I had a hot nurse!,1828,6
TIL that there is a dissociative phenomenon called derealization that causes the external world to feel unreal or dreamlike. 74% of the population have experienced it.,1829,4
Well this is how MY cat poops,1830,4
A small college in Nebraska rallies around a Kenyan student who received word that his mother had died and he couldn't afford to fly home to be with his family.,1831,4
"Okay guys, I cannot stress enough how vital it is that Paul win Maine. Every single ounce of effort needs to be towards getting him that victory. It's time he get a state!",1832,4
Discovered my University has a Facebook meme page,1833,4
My friend doesn't realize the amount of douchery that he has,1834,2
Facebook nowadays...,1835,4
elvis loving snacktime,1836,5
The only primate to communicate in pure ultrasound,1837,0
Can't get enough of this picture,1838,4
Soon... very very soon,1839,4
"Goddammit, Skyrim....really?",1840,7
I'm not sure this kid has bones...,1841,4
Dear Wednesday...,1842,2
good guy goku,1843,9
You heard him.,1844,4
Proof that inventors hate children!,1845,9
My friend Steve is an atheist...,1846,2
switch clothes Wednesday,1847,4
Bill O'Reilly comes to Ellen's defense. Slams million mom's rep on his show. Compares million mom's to McCarthyism.,1848,4
My Kitten likes to think he can roar.,1849,4
A wild Abra appears!,1850,6
Woman calls 911 after a brick is thrown through her window. One of the police officers that responded to the call raped her.,1851,4
Great idea for Valentines Day!,1852,4
LeVar Burton to Bring Reading Rainbow Back … in an App,1853,9
What is something slightly evil that you take pleasure in?,1854,8
Nobody recognizes this decal on my car.,1855,4
Anyone else love surfing?,1856,9
Found in the backyard,1857,4
My kitten's reaction to a new toy.,1858,4
Coworker got a new guard dog. I made a warning sign so nobody would get hurt.,1859,4
OMG Obama,1860,4
Ellen DeGeneres shares her Traditional Values. Yeah!,1861,7
They have this idea that people should be left alone [...] that's not our founders' view of freedom. ~Rick Santorum,1862,9
OMG Obama,1863,4
Greg Jones proposes to his girlfriend after winning the Super Bowl. What do you think Greg's mom is thinking?,1864,4
Screw your BF3! THIS is the most realistic moment I've ever had in an FPS,1865,9
So a friend was asking me for some tech advice online,1866,4
The US Constitution is losing its appeal as a model for new democracies around the world -- “Nobody wants to copy Windows 3.1”,1867,4
"I can watch this all day, every day",1868,4
Creepy Eye Condition My Friend Has,1869,2
"Reddit points, or why there are no posts with like 200,000, 500,000, or more upvotes",1870,4
"Yep, pretty much",1871,4
Why not?,1872,8
A house sized mass,1873,2
How I'm ending my Wednesday.,1874,4
Shepard should really consider Mordin's advice,1875,4
AMA: Philip DeFranco,1876,4
House of the Undead,1877,2
A forest of hills,1878,8
good at dodgeball,1879,9
Drug enforcement director responsible for eradicating marijuana not investigated after deputies find marijuana and rolling papers inside her home,1880,4
Success on a Wednesday,1881,9
Furby loved you!!,1882,9
Say cheese!,1883,4
Gabe sure has had an illustrious career...,1884,4
But it failed...,1885,5
Hey man,1886,4
Cold Comfort from Dawkins,1887,2
Successful Black Man,1888,4
"I was jealous of seeing everyone's cats on here so, here is mine ^.^",1889,4
BBC confronts Facebook troll,1890,3
Getting an inch of snow is like winning 10 cents in the lottery - unless you are a pooch...,1891,4
My best friend is gay and he's happy to finally be able to have the same rights as we do.,1892,4
Cactus tree,1893,1
My turtle thinking she's a dog.,1894,7
"They're ours, dammit!",1895,3
My dog running in the snow,1896,4
Little brother and his service dog. Matching t-shirts :P. awwhh.,1897,4
Why is it more interesting to spend an evening with this book than with a beautiful woman.,1898,4
This happens to me way too often.,1899,2
"Half Black Lab, half Corgi. I give you, Corgador.",1900,4
Apparently you can use a hanger as a scale (x-post from /r funny,1901,4
"Had to put our 11 yr old Great Dane, Roxie down today. Here's a pic of my son and her this morning...",1902,4
Best camp ever.,1903,4
An apology / AMA / Feedback - Dyrus,1904,4
you're a wizard!,1905,0
Howl's Moving Castle - Lego style!,1906,4
22 and as handsome as ever,1907,4
My Love,1908,2
Someone added a helpful reminder to the construction signs in my neighborhood.,1909,4
Bad boy,1910,4
Defriended,1911,3
Anyone else really starting to feel this way...,1912,4
"Upgraded my internet, it's ok I guess",1913,9
Smash Bros,1914,4
"As an Atheist, This is How I View North America",1915,2
Math teacher logic (pic),1916,4
Seems legit.,1917,4
Shuffling in Heels,1918,7
Saudi Arabia Promises To Go Nuclear if Iran Does,1919,4
Wise words Guybrush.,1920,4
Dem state senator adds ‘Every sperm is sacred’ clause to ‘personhood’ bill,1921,9
unattractive seal feels left out...,1922,4
"Well, it made me laugh..",1923,4
Playing on words,1924,4
Nailed It,1925,4
Sorry Gamestop,1926,1
When boss comes back to the office,1927,4
Drew this! A pic of my team! :) let me know what you think!,1928,4
Overworld+Nether+Underwater?,1929,5
Just re-watched Star Wars: Episode I and had a huge realization.,1930,0
"Don't give up! Even if you've lost 1 pound, you've lost a lot! Don't believe me? Come look at the link in the comments.",1931,4
Condescending Wonka grew up in the 90s too!,1932,4
Found this parked outside a gas station,1933,9
You do get to choose between different mallets though.,1934,4
Engineers boost AMD CPU performance by 20% without overclocking,1935,4
Brace Yourselves...,1936,6
Admit it...,1937,4
BSG fans help write One More Episode featuring some familiar faces.,1938,4
Hippie kid charged with eight felonies and $400K bail for throwing oak seeds at Oakland police; citations all signed John Doe,1939,9
The Zuckerberg Tax,1940,5
good bye 'good eats' :(,1941,9
Golf ball after collision,1942,4
Human Wormholes: Lincoln assassination eyewitness goes on TV in 1956; US Civil War widows lived (and collected pensions) after 2000,1943,4
When I step out of the shower,1944,2
Dear TakeTV,1945,2
Got this awesome request today working at Jimmy John's.,1946,4
TIL!!! (no spoilers),1947,2
We've all been there,1948,2
ಠ_ಠ,1949,6
TEST POST PLEASE IGNORE,1950,4
Saw this the other day at the Windows store.,1951,4
Walmart's frozen vegetable aisle,1952,0
truth about pokemon gym battles.,1953,9
Just a fluff-nugget.,1954,5
"Reddit, this is a maze.",1955,4
Xkcd - Car Problems,1956,2
When I post my pets to r/aww,1957,0
"Pat Robertson Says You Should be Christian First and American Second, But Attacks Muslims Who Put Religion Ahead of Nationality",1958,4
The guys who work above me got a new toy,1959,4
Seems like it should be able to cl- oh...,1960,4
Guys,1961,4
"1st session of Darth Vader of Guadalupe by Dor Stocker of Sims Tattoos, London",1962,9
How to wear a suit courtesy of GSL.,1963,4
My Little Turret (Portal related),1964,2
"'Starve the Beast' -- The Pentagon: Instead of firing teachers, closing libraries and senior centers, and cutting bus routes, let's put the Pentagon on a diet.",1965,4
Hey Proggit. I created Coder Weekly to keep track of in-depth programming articles. What do you think?,1966,9
"My friend's english springer spaniel puppy, Bentley, during his first snowfall.",1967,4
You go to the science museum... (X-post from r/dundermifflin),1968,0
Started a documentary project about 9 months ago that is about halfway through production. I would like some outside thoughts and opinions!,1969,4
dont mess with him.,1970,4
Where is this from?,1971,9
Solid Jake,1972,0
"Not a bully now, eh?",1973,4
STAY THE COURSE: Ron Paul CAN win in a brokered convention.,1974,9
Lemon Meringue Cupcakes,1975,8
Climbing stairs rage (x-post from /r/4chan),1976,0
cute bunnies,1977,4
Hey reddit. It's my friend's 23rd birthday. Here's a collage I made of him sleeping through classes during our undergrad. Happy Birthday Chris!!,1978,4
Assassin's Creed: Revelations Multiplayer Mayhem - Episode 6,1979,9
If Skyrim was like Pokemon...,1980,4
Every Christian I know,1981,4
What misconceptions do people commonly hold about your line of work?,1982,4
Breakdancing Jesus [x-post from r/bboy],1983,4
Top lane Nunu's Surprise Ultimate.,1984,2
It finally ends,1985,4
LPT: Use a (clean) dustpan to fill a container that doesn't fit in the sink,1986,2
All the Books in the World Except One,1987,4
Charlotte Church stands alone as hacking victims settle. Singer's refusal to accept pre-trial deal means Murdoch empire still faces damaging court case,1988,9
Drop-in,1989,5
"JCPenny CEO: ‘Ellen represents the values of our company’ - Despite a campaign by the group “One Million Moms” to have DeGeneres fired, Johnson said keeping her on was “a no-brainer.”",1990,4
"Change.org, sumofus.org, moveon.org, etc... stop being so pushy with the g*ddamn emails. You're clouding your own issues and causing fatigue in your target demographic.",1991,4
Arnold and Stallone get shoulder surgeries together.,1992,9
My little cousin just finished her valentine's day cards.,1993,4
"All the Books in the World, Except for One.",1994,5
They are removing a relic of the past from the Tech Lab today:,1995,8
Millionaire Investor Calls for Higher Taxes on the Rich - 'We are systematically destroying our customer base in this country by undercutting the middle class,1996,9
"Bare with it, this is British Comedy at its finest",1997,8
TIL Damon Albarn won't let Glee cover any Gorillaz songs,1998,2
Bethesda went crazy for a week and added all kinds of awesome things into Skyrim for fun. Here's hoping we see them in the future as DLC or whatnot [x-post from r/skyrim].,1999,4
What is this I don't even...,2000,7
T.V. Series First World Problem,2001,4
"If a guy used this on me, it may just work...",2002,4
It's a shame that miracles don't apply to physical deformities or amputees.,2003,0
So my friend saw this on his way to school today,2004,4
Don't you judge me Siri!,2005,6
The only argument ever needed.,2006,4
Yea I think that sums it up pretty well.,2007,4
House by the Water,2008,2
Help donate to a new Adventure game made by Double Fine and Ron Gilbert.,2009,4
Someday it will prove worthwhile,2010,2
"Megaupload shutdown did nothing to slow piracy, study finds",2011,7
Rick Santorum's regrettable tweet.,2012,9
Macaulay Culkin looks like a goddamn street rat.,2013,4
Plastic Eating Fungus could solve landfill problems in the near future. Cheap too!,2014,8
400 year old painting I found in a museum? Of course reddit must see this.,2015,4
Took a rare photo of 2 Copperhead Snakes in Australia,2016,4
What is the most awkward thing that a professor has done during a lecture?,2017,9
Just C.S. Lewis,2018,9
"NYPD Must Pay $15 Million for Illegally Arresting 22,000",2019,9
A gravestone commissioned by a widow to express her eternal and unbound love for her deceased husband.,2020,2
A Humpback Whale is over joyed after being freed from a fishing net.,2021,7
I want a job where I drive a dump truck full of fire.,2022,4
6 months since my brain surgery!,2023,9
Smoke from volcano mixes with the sunset,2024,3
SoulCalibur writers room,2025,4
It takes a hero to break a promise,2026,9
How Your Cat Is Making You Crazy,2027,4
This is always awkward when you share an office,2028,4
The Models for American Gothic.,2029,0
So I was always wondering why your SNES controllers all had purple buttons. I searched a little bit and found this. Why did they do this?,2030,2
I got my SupaBoy today. This thing is awesome! I am getting to enjoy all my old games again.,2031,4
I never Yao-ed so hard in my life.,2032,4
Why I loved used books...,2033,9
I see what you did there.,2034,4
In 1997 my boss asked me to download the internet to a floppy disk so he could surf the web at home. What is the strangest technical request anyone has asked of you?,2035,4
The hardest concept known to man.,2036,4
Lesbrarians,2037,5
What do we want?,2038,8
My face when I log in facebook these days,2039,4
Bill O'Reilly Stands With Ellen DeGeneres. WTF.,2040,4
every time i see a person on the road driving the same car as me.,2041,4
"100 million years from now, most if not all of today's continents will assemble into a single landmass called Amasia. Here is what it will look like.",2042,4
"It's my cakeday, so here are 5 eight week old kittens that I fostered for a shelter.",2043,4
"is it me, or has the rock(dwayne johnson) become the new Brendan Fraser?",2044,4
My wife won't let me hang this above our fireplace.,2045,2
I had no idea....,2046,1
A student did this in the lab I taught,2047,8
Storm Tripper,2048,3
Big Banks are about to get off the hook for Trillions of dollars of Mortgage Fraud. Please Call New York State Attorney General Eric Schneiderman and tell him to NOT sign on to the $25 Billion settlement. It's like stealing a million dollars and only having to pay a $1000 fine.,2049,4
the naked gun 2 1/2 might be my favorite of the trilogy,2050,4
American exceptionalism: the ability to celebrate freedom and democracy while tolerating neither,2051,0
"My friend, just before his boss found out he'd accidentally ordered 500 metres of bubblewrap instead of 50...",2052,4
A plea about biomes.,2053,3
Coexist,2054,3
NYPD Marijuana Crusade Led to Cops Killing a Teenager in the Bronx. The cops followed him,2055,9
The only real use for little kittens,2056,4
Best thing I ever got from a cereal box,2057,4
Had some spare time with the girlfriend. I give you: Doctor Guess Who.,2058,9
"After 1 year, we finally found her again. I'm glad she still remember us.",2059,4
RE: Valve sends a package to a man named Gordon Freeman,2060,4
"Sad, sad Redditors in the Friendzone, put yourself in the other persons shoes: What would you do if a person you only want to be friends with is in love with you?",2061,4
Spotted at Whole Foods,2062,4
I made a snow angle,2063,4
This was posted to Facebook by an ultra-religious theology student.,2064,4
DONT GIVE ME THAT LOOK!,2065,4
The Human Body. There is so much going on here.,2066,4
"Diamond has been passed up by three different families now, how could you not love this face?",2067,4
The punchline.,2068,5
"Oh, Daria",2069,4
No instructions Needed,2070,3
When I realize my foot was on an ant hill.,2071,4
TIL that elephants mourn and bury their dead.,2072,2
DEER LORD,2073,4
"TIL: Silently, we broke 1,000,000 subscribers. I do believe, and correct me if I'm wrong, we are the largest user-created subreddit.",2074,4
What happens during sleep that gives us energy?,2075,4
This is how a candlefire looks in zero/micro-gravity,2076,4
I came home late from work to find another man in my bed...,2077,4
I had no idea.... [fixed],2078,4
Ha!,2079,3
Peggy Gets Around,2080,4
1st thing I saw this morning out of the bedroom.,2081,4
Google should add this feature to the Maps street view.,2082,4
Big Brown Couch,2083,4
"With Tim Schafer and Notch joking about Psychonauts 2 being called 'Psychonotch', I couldn't resist drawing this up.",2084,4
He was outside my hotel this morning. I ended up feeding him and he came straight into our lobby. I couldn't help giving him cuddles!,2085,4
Scientists sound alarm over threat of untreatable gonorrhea in United States,2086,0
"Turns out that any iOS app can upload a complete copy of your address book to the app developer's server. That is unconscionable. Apple, please respond to this issue immediately.",2087,2
The anatomy of a baby,2088,4
Look what i found...,2089,4
Workplace friendly (╯°□°）╯︵ ┻━┻,2090,8
Living in southern Ontario... [x-post from r/adviceanimals],2091,4
What she does while my son is at school,2092,4
Batman Owl,2093,2
My cat likes to play mind games,2094,4
Imperial wedding,2095,4
"It's my cake day, but all of my dogs are pretty ugly, so here's one of my baby goats.",2096,4
"It doesn't look like much but,",2097,4
Scumbag Firefox,2098,2
I'm stumped for a title.,2099,9
How I feel showing up at job interviews.,2100,4
"Dear Tim Shafer, Ron Gilbert, and everyone else at Doublefine, Thank you for proving the gaming industry can be fixed.",2101,9
Flynn Rider. Disney's subtle Atheist.,2102,8
Newly Gamer Girlfriend (#2),2103,4
a more accurate title...,2104,3
Condescending Wonka on morals,2105,9
How I feel watching my wife do yoga.,2106,4
I am a skinny man. But I don't know if I am a hurted ass man as well.,2107,4
My mother just texted me this. I think I should visit more often.,2108,2
CNN on Santorum ಠ_ಠ,2109,9
I see your Supaboy and raise you a n64 portable kit,2110,4
Could you do it?,2111,4
Just to be clear.,2112,7
Get One Million Mom's removed from Facebook,2113,4
My sister-in-law was on The Price is Right. Groping ensued.,2114,0
Hey! Listen!,2115,8
Apparently women can be educators on tax payers' dollars but not get abortions. Both outlawed by the Bible.,2116,4
"If a guy used this on me, it may just work...",2117,4
Reason is sexy!,2118,4
Good Guy Hank,2119,9
"As requested, my first overlay for redditors (link inside)",2120,4
I refuse to believe that these fit in anyone's ears comfortably and securely,2121,2
My Childhood!,2122,5
Accidentally Dropped Cat On My Flour,2123,4
Close Enough,2124,4
A pool in Mumbai that looks like sunken Manhattan built to raise awareness of climate change,2125,4
"John Williams turned 80 today, can we give the master musician a reddit sized happy birthday wish?",2126,4
We call this pose the flying frog,2127,4
"TIL Seth Macfarlane wrote for Cow and Chicken, Dexters Laboratory, I am Weasel, Jonny Bravo and Ace Ventura: Pet Detective",2128,9
Jets take out ad in paper to congratulate Giants,2129,9
"Photo of bubble, floating in the air, with the sunset visible in its reflection",2130,3
Norway Presents: Flagception! [Fixed],2131,2
The Dota2 and HoN subreddits each have a link to the LoL subreddit. Shouldn't we do the same?,2132,4
Happy birthday to this guy right here,2133,4
Optical Illusion,2134,5
Good Girl Gina knows what she wants,2135,4
How I feel when I've been on Reddit all day.,2136,4
Teaching-You're Doing It Right. Letters To Celebrities.,2137,4
God works in mysterious ways,2138,9
Polar Bear Tripping,2139,4
"Um sir, I'd prefer my car show with a british accent. Thank you.",2140,4
"Hey Reddit, wanna see what 3 major comic syndicate rejection letters looked like in 2003? (They look to me like a bullet dodged)",2141,4
Scumbag Sexist Redditor,2142,2
The stare I give my mom when she walks in the room on the phone while I'm watching a movie,2143,4
QB Class of 2004,2144,8
WTF did I just encounter?,2145,4
"Honestly Reddit, how's your day going?",2146,4
If a lawyer stole $5 from a client,2147,2
The original Nintendo Badass.,2148,4
Second world problem,2149,4
"Before electricity was discovered, static shock must have still existed. How was it explained thousands of years ago?",2150,4
Pigtruck of Awesomeness,2151,3
Hitler and bank charges according to 4chan (shockingly good for them),2152,9
Accidentally dropped flour on my desk,2153,4
The least played level in gaming history,2154,4
Some men just want to watch the world burn...,2155,4
How I feel breaking up with someone a week before valentines day.,2156,4
One of my favorite lines from Deathly Hallows. It really sums up Harry's character.,2157,4
How I look every time I browse a university's meme page.,2158,4
When reddit is down [OC],2159,4
Some girl said Obama was the anti-Christ. I told her to prove it. Hilarity ensues.,2160,4
College Freshman is smooth with the ladies,2161,9
Why I subscribe to /gameofthrones and /asoiaf,2162,0
Learn from this,2163,9
Glitches Explained: Celebi Egg [.png],2164,9
In a perfect world.,2165,4
First time in Australia. What a beautiful place.,2166,4
Turtle neck.,2167,7
You shall not pass!,2168,3
Hey guys,2169,4
"Stuff like this is why your company is struggling THQ! Trying to charge extra for the most iconic weapon of the space marine army, in a game called SPACE MARINE? No respect for the fans at all.",2170,2
She's the lady of the house,2171,2
Double Fine and 2 Player Productions will use Kickstarter to fund an Adventure Game + documentary!,2172,4
Anybody have or remember this poster?,2173,2
Thanks genes!,2174,4
Truffle pig,2175,4
It's the simple things that never fail to make me laugh.,2176,4
Oh math jokes,2177,4
Skeptical Mutt can't differentiate,2178,4
Whenever my friends post something funny or original on Facebook.,2179,4
This is way too much fun.,2180,4
Nokia says it will not buy mineral products that benefit armed groups or those engaging in human rights abuses,2181,4
conceited.,2182,6
Going to a party and not knowing anyone,2183,4
"Made my bf a valentines card, think he'll like it?",2184,4
After I saw pictures of a girl I know on r/gonewild [Fixed],2185,4
Just a puppy.,2186,1
9 years later....,2187,4
Hath I done this verily?,2188,8
Life [abridged],2189,4
Idiot Nerd Girl,2190,4
How I felt about school today.,2191,4
That Pyro's A Spy!!!,2192,5
"While my son and I were playing MW3 last night, my wife asked us why Patrick was on the bottom of the screen.",2193,2
"Whenever a woman says, My girlfriend...",2194,9
FOX: House M.D. is cancelled.,2195,2
Awesome Semi Truck Advertisement,2196,9
Let me smell your skin,2197,2
How I feel seeing memes being plastered over Facebook,2198,4
After 20 posts and not a single upvote,2199,4
I'm with Stupid.,2200,4
Instant Happy,2201,4
The creator of Ghost Rider is being crushed by Marvel. Reddit can once again make a difference! Let Marvel know how wrong this is!,2202,9
Accidentally Dropped Flour On My Orc,2203,4
Pizza?,2204,5
The Losing Side,2205,9
"High School Senior, in college.",2206,9
After hours of trying to come up with a good cake day post,2207,4
what an adorable difference 6 months makes.,2208,9
This is what happens when I let my non-frugal friends stay at my apartment for a night.,2209,2
My Yellow Lab Pup found these not too long ago in the back yard,2210,4
Happens every morning,2211,4
Double Fine meets its Kickstarter Goal in less than a day's time.,2212,4
What if...,2213,3
When life gives you lemons...,2214,4
"After finishing skyrim, the devs were given one week to do whatever they wanted",2215,4
"Today is my cake day, so here is my favorite llama, Otis, hollering at the ladies!",2216,4
God wants Community back on the air.,2217,4
"LISTEN UP,",2218,9
Johnny at it again,2219,9
"TIL that just as America entered WWII, serial bomber George Metesky informed NYPD that, as a patriot of his country, he would make no bomb threats for the duration of the war. He stayed true to his word.",2220,2
The absolute WORST thing to wake up to in the morning,2221,4
Muahahaha!,2222,0
My seat at the Joe tonight.,2223,4
Paraplegic throws first ever Sit Ski backflip.,2224,4
I don't believe bisexuality exists.,2225,2
Pure Evil.,2226,0
Cannibal Bread,2227,9
Coolest picture of wave you'll see today,2228,4
So true.,2229,9
How I feel about starting to see someone a week before Valentine's Day,2230,4
"How to fold a suit, pants and shirt to go in a suitcase without wrinkling.",2231,2
The manliest of men,2232,9
Old Jesus vs new Jesus. MORTAL KOMBAAAAAAAT,2233,4
"Hey Reddit, the one man army that created the visual style for Fallout 3 and other Bethesda games passed away before his time yesterday. Lets show him some appreciation.",2234,4
A Year of Chemotherapy: From Cancer to Cyborg,2235,4
Will this guy shut up and take our money!,2236,8
11 current Latin American leaders call for legal drug regulation as an alternative to the war on drugs.,2237,4
It works.,2238,9
"Study confirms BitTorrent piracy doesn't affect US box office ticket sales even though the MPAA presses on with SOPA, PIPA, and ACTA",2239,4
Underwater dog photography,2240,9
Poachers dehorned her with a chainsaw. This photo really got to me.,2241,4
