Title,doc,topic
"Mandatory drug sentences 'colossal mistake', Canada told",5377,2
This is exactly how I feel about the current contraceptive scandal,5378,4
Smoking twin vs. non-smoking twin,5379,4
Those of us in retail thank you,5380,4
Imposter Philosoraptor!,5381,7
"The men who own the GOP: Have you heard of William Dore, Foster Friess, Sheldon Adelson, Harold Simmons, Peter Thiel or Bruce Kovner? They are the real candidates for the Republican nomination for president.",5382,4
Santorum is the devil?,5383,9
Begging for Karma in GW is like begging for Ice Cream in Baskin Robbins...,5384,2
Play Dead!,5385,6
Busted because of the worst title choice ever.,5386,4
Engineering Professor,5387,4
Searched cute spider and this came up. It might be shopped.,5388,4
Lent,5389,9
Am I the only one who does this?,5390,4
Sous Vide Filet Mignon,5391,1
If MythBusters ever needed ideas for a new season ...,5392,4
New Redditors,5393,4
We lived in different cities for a year... he mad me this,5394,4
Zach Braff - like a Sir,5395,9
W.C. Fields was a bad-ass.,5396,8
"If bionics were to become so advanced that human enhancing technology could be seamlessly integrated with our bodies, would you build a better you and start replacing your limbs and/or organs with machines?",5397,4
"Don't mind me, just drinking some water...IN SPACE",5398,4
God and torture,5399,9
Favorite gif,5400,4
"TIL: David Hayter, the voice behind Solid Snake, gave up half his paycheck to bring back the original voice cast of MGS 1 for the Game Cube remake The Twin Snakes.",5401,4
"Haters gonna hate, spies gonna spy.",5402,0
This is why you should use GMail,5403,4
I will be so happy if all of you remember these,5404,4
"TIL Albert Einstein originally wrote a letter to FDR warning him that the US would lose the nuclear arms race to Germany. Years later, he admitted that he regretted signing that letter, the letter that apparently caused the nuclear arms race itself.",5405,4
Only the Dead,5406,4
"I'm giving up Reddit for Lent, at the request of a friend. Gentlemen, it's been an honor serving with you, God save the queen.",5407,9
Do We Finally Know Who Tossed the Flash-Bang Grenade At Scott Olsen and His Rescuers? The Sgt. has killed three before in the line of his duty.,5408,4
[EFF] Government Pressures Twitter to Hand Over Keys to Occupy Wall Street Protester's Location Data Without a Warrant,5409,4
he must have been cold... and cranky that i woke him up!,5410,9
I just had to cash in on her cuteness.,5411,5
7 foot supermodel,5412,3
"Finally, a laptop design that gets the trackpad placement right...",5413,4
Pokemon = Childhood,5414,2
Breaking Bad - Minimalist,5415,4
"By request, Grandpa Breeze and Me.",5416,4
Lent,5417,9
/v/ on fallout,5418,4
Stephen Colbert and a couple of kittens.,5419,8
Rick Santorum [Finally Fixed],5420,9
O__O,5421,2
"My Christian friend, doing it right",5422,4
Let's not forget Sigourney Weaver's famous role in that movie about aliens.,5423,9
Most episodes of The Walking Dead,5424,4
Mario Kart <3,5425,5
You shouldn't be winded!,5426,0
A Normal Day in Skyrim,5427,4
Just my friends vicious pit bull cuddling with a cat.,5428,4
Warning: might explode from cuteness,5429,0
Hiding spot,5430,4
How far away from Earth would you be able to detect human presence?,5431,2
Creepers hate Reddit,5432,9
To all the girls at my school,5433,4
Personal Triumph.,5434,4
Bottled Catastrophes,5435,7
"Sheth all-kills EG, MVP all-kills EU",5436,2
How I feel when fundies attack another religion.,5437,4
Soup can god. No tl;dr here.,5438,7
Wolfram Alpha designer owns a periodic table table,5439,4
Finding pony links in a non-MLP subreddit.,5440,4
I'm never getting another achievement again either.,5441,4
"If Atheists worship the Flying Spaghetti Monster AND a can of soup, then I present to you, the ultimate & true God",5442,9
"Hey reddit. Meet my 165 lb Newfy, Atticus. Then and now.",5443,4
What's so bad about Rick Santorum?,5444,9
When I play with same level Terran friends,5445,4
This jewel just came up on my news feed... Reddit Gold!,5446,9
When I win something purely by chance,5447,9
"I painted a man surfing the web far, far away.",5448,4
It took a lot of pieces to finish the inside,5449,4
I know I'm not the only one...,5450,4
Lego Hockey,5451,8
"Swedish foreign minister has acted as an informant for the United States since the 1970s, says Wikileaks",5452,4
zombie parade,5453,3
trollcat,5454,9
Giving up for lent. . .,5455,7
Brace yourselves...,5456,6
Borderlands 2 Launch Date Trailer: 'Joy Puke Your Face Off',5457,4
Game physics problems,5458,4
A few weeks ago I asked Reddit for help in getting an advance copy of Harry Turtledove's new book for my friend with cancer. Here's he is receiving it.,5459,4
"Alaska bill would criminalize TSA screening procedures; it is being introduced by Rep Sharon Cissna, a breast cancer survivor, whose mastectomy scars showed up on a TSA scan; this led to a horrifying pat-down once before, so she refused the pat-down for a second flight and was barred from flying",5460,8
stand still...the camera won't notice you.,5461,9
Chocolate? Chocoshchsmmm,5462,7
Just saw my girlfriend and my ex-girlfriend having a conversation on each others walls,5463,4
"Fake Apple store, meet fake dead Steve Jobs",5464,2
This is probably one of the better tattoos I've seen.,5465,4
"Rick Santorum: I will not cut the defense budget, I will cut food stamps",5466,9
Obama proposes online privacy bill of rights: Seven point plan calls for individual control,5467,4
Huntsman calls for third party: ‘The system is broken’,5468,4
Obama: Drilling alone isn't an energy plan. The Republicans offer nothing but more drilling and political promises of $2 gal. gasoline. The American people aren't stupid. That's not a plan,5469,2
"George Takei visits Rohwer Concentration Camp (Desha Co., Arkansas) where he was interned as a child during World War II.",5470,0
Accurate,5471,3
2 and a half minutes of Pixar's new movie: Brave,5472,4
robotic elephant.. can carry up to 49 passengers.,5473,6
Good thing I'm a guy,5474,9
Streetlight Manifesto Proudly Boycotts Itself,5475,5
What's your best I've made a huge mistake moment? Mine is happening right now.,5476,4
"Finally, Outrage in China Against Bear Farming",5477,4
TIL that during WWII the Army Corps of Engineers concealed entire factories as small towns to confuse enemy bombers. Here's one example.,5478,2
The most badass ground support aircraft to ever be built,5479,4
r/atheism A Christian family man is being put to death in Iran this week simply for not being a Muslim. I think we should help...,5480,4
I'm glad I checked out the reviews first...,5481,4
Imagine a country where the state spends more on preschool child care than on its defence budget.,5482,4
Left handed problems...,5483,4
Scumbag Pallet Jack,5484,2
So I decided to buy offbrand poptarts this time...,5485,4
"Another High School student taking a stand against religion in schools, this time in TN, and having her opinions quashed by administration.",5486,4
This is a type of courtesy I'd like to see emulated,5487,4
Data the Redditor,5488,9
Not the best place to land,5489,2
Taking notes in Psychology today when all of the sudden...,5490,4
They see me rollin'...,5491,4
7 years later she still jumps into my arms.,5492,4
Report: London no safer for all its CCTV cameras,5493,9
Look who this weeks star in a reasonably priced car is,5494,4
WWF,5495,8
Impassable,5496,9
Golden Girls on lesbians...,5497,4
I'm just gonna put these right here..,5498,4
Marie Colvin - One of the bravest and most bad-ass women who ever lived,5499,4
my drinking buddy striking a pose (trailer shooting),5500,4
Captain Kitteh,5501,2
That's pretty devious,5502,4
"Mormon father of five comes out as gay. Wife leaves him, takes his kids and outs him to church officials. He then shoots himself on his front lawn.",5503,1
"‘Occupy Wall Street’ announces convention in Philadelphia for July: The plan is to select a man and a woman from each of the 435 congressional voting districts to create and ratify a “redress of grievances,” emulating how the Declaration of Independence was formed in 1776 in Philadelphia.",5504,9
Klingon,5505,3
6 Wailord Fight.,5506,9
America outruns two one-legged Ethiopians. Britain can't believe it.,5507,2
I for one welcome our new Robot overlords,5508,4
Found this at my school today...,5509,4
Archer Renewed for Season 4!,5510,4
"As a single Indian woman living in America, this is the ultimate win",5511,9
100% Class.,5512,2
"Boreray, an uninhabited island in the North Atlantic",5513,4
"TIL that midway through production on Shrek, Mike Meyers decided his character should speak with a Scottish accent, costing DreamWorks roughly $5 million in wasted animation",5514,2
Team: This Chick.,5515,2
Funk as druck,5516,5
What's the best lie you ever told that turned out to be true?,5517,9
Now I can bring all of my friends...,5518,2
It's like they hate money.,5519,4
This is ERIK GRIFFIN aka MONTEZ from WORKAHOLICS,5520,7
Found a secret code tube in the back of a cave. I need help opening it Reddit! (More pics and detail in comments),5521,4
Defense of Marriage Act Ruled Unconstitutional by US District Judge,5522,4
Have you got a hat and some toy to steal eyes from? Then post your photo here!,5523,4
My friends never post pictures of our outings on Facebook so it appears that I have no social life.,5524,4
Proof that Haywood was going for the ball and not Gasol's entire head.,5525,4
My Puppy and My Puppy's Puppy,5526,4
Two minutes of Pixar's new film BRAVE!,5527,2
Hero,5528,3
Photobombs...for science!!!!,5529,0
Every time I read a thread about Sweden,5530,4
"IAmA filmmaker/comedian/etc David Wain, AMA",5531,4
Rare whale caught on film for first time - Australian researchers Thursday revealed they had filmed a pod of extremely rare Shepherd's beaked whales for the first time ever.,5532,4
"TIL right before his death, Jim Henson did not go to the hospital right away because, his wife believes, it was likely due to his desire not to be a bother to people.",5533,2
I wish I could tell a joke this well,5534,4
The Real 'Cancer' of BioWare,5535,2
One of my first 3D models - It's my SNES!,5536,4
I think God is going to break up with me.,5537,4
Goatse Effect 3,5538,2
IAMA request: Gabe Newell,5539,4
The Squirtle Squad have TM87,5540,0
Voice actor for Male Shep was at my local gamestop... this is what he left behind,5541,4
Steve Buscemi Restores Faith in Humanity Yet Again...,5542,2
"My mom is NOT a baker but she did an amazing job on my graduation 'Oh, The Places You'll Go!' cake last year (I want her to do this professionally!)",5543,2
Benefit of waiting until level 50 to do the main quest: Daedric GreatAxe of Whiterun.,5544,8
"TIL in Rugrats The Movie, Reptar was voiced by Busta Rhymes",5545,2
Reporter to Obama's Press Secretary: You want aggressive journalism abroad; you just don’t want it in the United States.,5546,2
"The answer Santorum just gave in the debate about contraception was a pretty good argument for it, and he doesn't get called on it!",5547,4
Soda for 6 cents. The obvious course of action!,5548,9
Now give Mommy a kiss...,5549,4
"PUPPY, THATS NOT HOW U PLAY",5550,4
The only Battlefield 3 patch I care about.,5551,2
Diabolical!,5552,1
mind = blown (level cosmic),5553,8
Cat knows how to sign 'eat' and get attention,5554,4
Captain Kitteh,5555,2
Saw this today and thought that you guys might like it.,5556,4
If we had DLC in the 1990's...,5557,4
"Pawn Stars, Please..",5558,0
Remember this?,5559,2
This kind of thing drives me up the goddamn wall...,5560,9
"Came home for the break, I gave my 8 year old brother the laptop, ten minutes....",5561,4
Old people looking into mirrors. Beautiful and kind of sad.,5562,4
My friend is in Ukraine with the Peace Corps. Today is Men's Day.,5563,4
He's a total dic,5564,9
So my high school put this up...,5565,4
This classifies as 'breaking news' in my city.,5566,8
Jet Set Radio coming to XBLA and PSN!,5567,1
Undoubtedly the best beard the world has ever seen.,5568,4
NOPE.,5569,6
When us Canadians protest [FIXED],5570,4
"Lichtenstein Castle, Germany",5571,2
Where were you last night?,5572,9
"Beauty is on the inside, after all.",5573,2
Found this wisdom in a Taco Bell bathroom.,5574,2
He turned fifty today.,5575,4
Good guy christians,5576,9
Let me introduce you to my friend Fred,5577,2
I hate him so much.,5578,9
My nephew was asked to draw himself running...this is the result,5579,4
Italian Catptains,5580,0
Scumbag Steve - you have to invite him,5581,2
Isn't it about time we had this change?,5582,4
I'm baby sitting my friends guinea pigs for a few days... My dogs have been like this for 2 days straight.,5583,4
It just so happens that my cake day and my Anniversary of Quitting Smoking are on the same day.,5584,4
"I am not American, but I think I understand. Is this correct?",5585,0
I Want to Help Him,5586,2
Unethical HTML video copy protection proposal draws criticism from W3C reps - A new Web standard proposal authored by Google,5587,4
Rich Chicken Curry,5588,9
Let's do this...,5589,4
"Little, Brown is going to publish J.K. Rowling's first adult novel. Release date and title to be announced later this year.",5590,4
I give you… forcefields.,5591,4
UK Christians are not persecuted,5592,9
"Ladies and gentlemen, the north sea wind turbines:",5593,9
High School Freshman,5594,9
"First World Problem, Third World Success!",5595,4
TIL there is a guy named Reddit. He is the pastor of a Presbyterian church.,5596,4
Just got an I'm a Mormon ad on a Richard Dawkins vid. They asked for it. I present the all new I'm a Mormon Meme.,5597,4
I brewed my first beer. What does Reddit think of my label?,5598,4
Look at that cute little puppy tongue!,5599,4
Map of countries by metal bands per capita,5600,4
"The 3,000 year old meme",5601,4
"Oh, look what I found",5602,4
Origin of dubstep,5603,8
Sister in-law asked for a cool picture of my broken arm. I blew her mind.,5604,8
"During an appearance Wednesday on CNN, former Sen. Russ Feingold (D-WI) said he “absolutely” did not regret being the only Senator to vote against the PATRIOT Act following the September 11 terrorist attacks. “That was probably one of the best things I’ve ever done,” he said.",5605,4
Grandpa's newborn horsey,5606,6
A socially awkward cashier's nightmare,5607,9
Socially Awkward Penguin's Worst Nightmare.,5608,9
So this is now an insult on Xbox Live.,5609,5
How I feel when I browse /r/atheism at the moment,5610,4
No one will ever know what the original said..,5611,4
Ron Paul On Rick Santorum: 'He's Fake',5612,9
"Alaska bill would criminalize TSA screening procedures; it is being introduced by Rep Sharon Cissna, a breast cancer survivor, whose mastectomy scars showed up on a TSA scan; this led to a horrifying pat-down once before, so she refused the pat-down for a second flight and was barred from flying",5613,8
Socially Awesome Birthday,5614,9
Moody Blues - Nights In White Satin,5615,2
I was just watching Parks and Rec when all of a sudden.,5616,4
I think I've finally figured out ZvZ...,5617,4
Deodorant rage,5618,2
What I see when I see a post with my girlfriend made me this or my girlfriend did this,5619,4
Did anyone else ever notice the background of The Last Supper?,5620,9
Why my friend is looking forward to Mass Effect 3 (If only real life was like this),5621,4
They see me rolling...,5622,4
At White House press briefing: There just seems to be disconnect here. You want aggressive journalism abroad; you just don’t want it in the United States.,5623,2
How I feel after reading the old testament.,5624,4
I saw this on my english teacher's cabinet. This is in Texas by the way.,5625,4
Whenever I play Fallout,5626,4
Finally got his licence...,5627,4
YOUR MONEY,5628,4
I see your cats and your dogs. What?,5629,4
i'm looking forward to the texturepacks already,5630,4
Only 10 Euro? What deal!,5631,2
Whenever someone asks for the time,5632,4
Ta-da!!,5633,5
"Cannot unsee: 8 really bad creationist comics, aimed at children, that attempt to refute Darwin and the theory of evolution",5634,4
Parenting: Oregon Trail style,5635,2
No take backs,5636,8
My couch is bigger than yours,5637,2
"My cousin made this awesome cake, and I thought you might like it better than the Facebook folks",5638,4
"TIL there have been many attempts to officially return Mt. McKinley to its Native American name Denali, but congresspeople from Ohio (President McKinley's home state) have procedurally blocked them for over 35 years.",5639,4
How I feel reading most arguments on Facebook...,5640,4
What a front-runner.,5641,6
"People like the sound of 'democracy,' but...",5642,4
"Accidentally typed 'askredit' instead of 'askreddit', into the browser; thanks, roger_!",5643,4
"Day[9] announces Red Bull LAN Orlando, March 16-18th.",5644,4
Honestly..,5645,3
God made me an Atheist.,5646,4
Ron Paul: I think the biggest misconception about me is that I can't win.,5647,9
This is a digital painting I did.,5648,9
"This guy really describes how careers have changed from the last generation to ours (sorry there's another comment best of'd on this thread, but this one's better)",5649,9
"I've replayed OoT a million times, never saw this part until now.",5650,4
Undressing level = Asian,5651,8
Call me Rock God Apple Commercial FIXED!,5652,4
All my years of troubleshooting finally pay off,5653,4
Found this in the woods...,5654,9
My bid for cutest kitten of all time... Meet Zora.,5655,4
Exponents?,5656,9
hmm...,5657,6
"After I took this picture, she ate the tassels",5658,2
Syrian leaders listed by UN for crimes against humanity,5659,3
Facebook Parenting dad responds to Dr. Phil's hypocritical comments,5660,4
Some lovely Redditor decided to paint the Whiteboard Monster I submitted a while ago! (thanks to jlo2006),5661,9
Seriously...this debate...damn.,5662,3
When Someone pulls out gum in school,5663,4
Why do we see the milky way as having a black strip running through it?,5664,4
My 100th time through Nagrand and just noticed this,5665,2
I made this .gif the week I began watching FiM last June. Enjoy.,5666,2
It's sad how true this is.,5667,9
H. P. Lovecraft's rendition of Spongebob Squarepants,5668,0
Please insert Disc 2.,5669,2
Has anyone else made this connection?,5670,9
Adam Savage: No One is in Charge,5671,4
Text from my girlfriend. You start getting different types of messages when you've been in a relationship for a few years...,5672,4
Otter.,5673,0
Always as soon as the lights are off [x-post from funny],5674,4
Now where is that mouse they are all talking about?,5675,2
Me and my big baby,5676,4
What is a dangerous thing you did as a kid for fun?,5677,4
He's baaaaaaaack,5678,4
Jet Set Radio / Jet Grind Radio announced for PSN/XBLA release,5679,1
Ready to walk through the fog gate yet r/gaming?,5680,6
The original three,5681,4
Zombie Toss!,5682,8
"New research provides, for the first time, a clear answer to the debate as to whether Triceratops and other extinct creatures took on a more mammal-like or more reptile like posture.",5683,4
Congrats on the Triple Double,5684,4
My 2 year anime collection,5685,4
So I was watching tv the other day when...,5686,4
My brother would be 28 today. Happy birthday man.,5687,4
Nineteen UC Davis students are suing in Federal Court campus police for unconstitutionally dispersing their occupy-style protest with pepper spray and targeting students for arrest.,5688,9
"Reddit, I trust you. Will you please help me subscribe to all the best subreddits? My password is 'wiki'",5689,2
"[Detail] Map models. Display a large area into a small room, and mark special locations.",5690,4
7 years later she still jumps into my arms [fixed],5691,4
You know you have done this before,5692,4
Every time when im drunk and looking for a quicky,5693,4
Damn I love medics who know how to listen.,5694,4
Meanwhile in Greece...,5695,6
"My parents' rescue. They were away, so I picked her up from the kennel. She ran across the yard jumping up to the fence barking to greet me. We had never met before.",5696,2
Deal with it.,5697,9
Not really pretentious then...,5698,2
"Tilt-Shift Photography. These are real, not models.",5699,3
Fully automatic Iron Golem grinder - 145 iron ingots/minute!,5700,4
A message for Shaggy Dog.,5701,4
University of Vermont biologist Bryan Ballif solves blood type mystery,5702,2
"Just realized something... [FIXED, spent a lot of time and effort fixing]",5703,9
Intel joins The Document Foundation and pushes LibreOffice,5704,3
chocolate rage,5705,0
I think Levi is a little confused about what All shapes and sizes means.,5706,2
How I feel on r/atheism at the moment as a New Zealander,5707,4
Copper Tile. $1.44 sq/ft,5708,7
Court rules that TrueCrypt user cannot be compelled to decrypt hard disk [PDF],5709,4
What if the male Avengers posed like the female one?,5710,4
The propeller clock,5711,5
"Last day at work. I think the office dog wants me to stay, he brought me all of his toys.",5712,4
"Moving out of France by train gave me a unique opportunity: this is a picture of me, 25, with every single thing that I own",5713,4
Some random little boy gave this to me today at work and said if I need help to call him. I am a security guard at a library.,5714,4
"Reddit, whats your best No time to explain",5715,4
One way running has changed my life...,5716,4
"My friend had her bike stolen 3 days ago. She found her bike back in its normal spot today, with this note attached...",5717,4
Driving in Poland,5718,2
"Hamas ditches Assad, backs Syrian revolt",5719,3
"Bill Maher can be a smug jerk, but he's 100% right about Rick Santorum",5720,9
it's always the comments that get me,5721,4
Jello shots with a handle,5722,4
TIL that Dolphins name themselves when they're young and keep the same name throughout their lives. Other dolphins know the name even if it's not spoken by the dolphin whose name it is.,5723,4
A snoring hummingbird,5724,8
AMA JIMMY KIMMEL... online now for your enjoyment,5725,4
"Utah House bans birth control education: The Utah House has passed a bill banning any mention of contraception in sex education classes; if a school does offer sex ed, it has to be abstinence only",5726,4
D:,5727,1
GGG moment at Gamestop.,5728,4
Another one of Mario's parties,5729,4
"Telecomix are the silent heroes who have successfully wired up and maintained free dialups for Tunisia, Egypt, Libya and Syria when the government turned off the Internet. They need support.",5730,4
In the Flesh,5731,3
At least he left a note,5732,4
tape rage,5733,2
Nice people on the internet,5734,4
Ouch !!!,5735,6
My finished Fallout Fan-art Collection,5736,4
"Sorrento, Italy",5737,5
You don't run red lights at Gibraltar airport,5738,4
From my friend's new litter. Might be a furby.,5739,4
Absolutely incredible save by Ondrej Pavelec,5740,8
CS:GO Terrorist's style guide,5741,9
"TIL that while accepting his honorary Oscar in 1972, Charlie Chaplin received a 12 minute standing ovation when introduced to the crowd.",5742,8
Witnessed this tragedy during class today...,5743,8
"My niece was playing with Mr. Potato head - my dog wanted to play fetch, so he brought me what he found",5744,9
Well... This is unfortunate.,5745,0
Two Wongs...,5746,2
Gas is only $3.16????,5747,9
Ultimate Easter Prank,5748,4
Why I don't mind my girlfriend taking forever to get ready.,5749,4
The Lorax will be used to advertise SUVs,5750,5
Girlfriend: Do you have an account on Reddit?,5751,2
Every time,5752,4
"So yesterday as I was leaving school with my brother, I was hit by an Excursion van. My car was flipped over and the van ended up on top of us. My brother and I were fine since our seat belts kept us secured. Please, let this be a reminder to always wear your seat belt, no matter what.",5753,4
Forever Alone Status: Cat Lady,5754,2
The most common cooking mistakes,5755,0
Glorious PC gaming master race,5756,4
@Jeb_ is getting married! Congrats!!,5757,4
New Orleans FTW!,5758,4
The Foo Fighters just posted this Youtube video to their Facebook page. A pretty impressive cover.,5759,4
When I wake up from an awesome dream,5760,4
"I swear, it jumped out right in front of me!",5761,4
Bachelor level 99.,5762,8
O_o,5763,3
"Editorial cartoons are not my usual thing, but I made this for the Pennsylvania freethought society (ftsociety.org.) I've lurked in this subreddit for ages, thought I'd toss this in and see if y'all like it.",5764,4
"First hair cut in 3 and a half years. Pretty hard to build up the courage to do it, but I'm glad I did.",5765,4
What I apparently look like approaching a chick at the bar,5766,4
Ghostbuster cupcakes - filled with key lime slime,5767,8
Who I Imagine is Upvoting all of the Reposts...,5768,4
Rule 151 (found this on the bus shelter on my university campus),5769,8
So a friend got fed up of bad bills...,5770,4
Happy Birthday to this man. So say we all!,5771,4
love you granny,5772,2
Good Guy Wade Kach,5773,9
What the hell did I just watch Rooster Teeth?,5774,4
IAmA Guild Wars 2 Game Designer AMA About World vs. World PvP,5775,4
It's a valid arguement.,5776,9
This is me when I moved to Patagonia with everything I own,5777,4
When a baby is staring at you and the parents aren’t looking:,5778,1
"Man fights 3 cowards, defending his wife",5779,4
DE-NIED.,5780,0
Just a baby tiger getting a bath,5781,4
Gay Texas judge won't marry straight couples,5782,9
You shall not pass!,5783,3
Whimsical Logic On A Bathroom Wall...,5784,4
True Homies,5785,4
Kitten in the middle of Lecture,5786,4
Kids these days...,5787,4
Return of the Group,5788,4
A dolphin in the middle of its flight.,5789,9
I used to to think this guy was wearing one of those hats the British royal guards wear,5790,4
Push Button For Free Hat.,5791,4
Lack of Vatican co-operation over child sex abuse led to closure of embassy,5792,4
"As a zerg player, this is the best feeling ever.",5793,4
Making tip jars more interesting....,5794,3
Well that's awkward...,5795,4
Alexa Meade's body-painting blows my mind.,5796,1
YSK how to Google properly [Fixed],5797,4
