Title,doc,topic
"Bill to privatize prisons dies in Senate: After the Senate vote, the state will NOT undertake what would’ve been the greatest expansion of prison privatization in U.S. history.",3577,2
He has a point.,3578,3
valentines day present I made for my husband,3579,4
Give me that milk,3580,4
She has chosen a dangerous bed.,3581,8
18. He Is 18 Years Old.,3582,4
Atheism is an easy way out? Really?,3583,4
Slide to unlock,3584,8
What I Think I Do: Storm Trooper Edition,3585,3
Someone just spent 100 bucks to do this. -_-,3586,4
Why I walk funny,3587,4
"Hi, World! [FIXED]",3588,4
Got drunk on valentines day. Woke up with these pics on my computer.,3589,4
The brutality,3590,0
The natural evolution of the Crayon Thing,3591,2
Whenever I see an EX in the street,3592,4
A fellow Redditor dropped this off for me today because I'm poor and hungry (x-post from r/victoriabc),3593,4
My brothers and I staying classy back in the day,3594,2
Only 7 seasons to go!,3595,3
Scottish Bathrooms,3596,9
Our kids will never know this frustration,3597,4
Obama approval hits 50% for first time since Bin Laden death amid more signs of rising economic confidence,3598,4
My new hands-free feeding system while gaming...,3599,4
"Thanks for making me feel old, Scumbag Brain",3600,4
The new height limit in perspective.,3601,3
favorite picture on the internet today.,3602,4
What things do you know about your roommate that they don't know you know?,3603,4
Good Guy Ganado,3604,9
"After I kicked him out of a box, my cat decided to just chill in some bubble wrap.",3605,4
Where's Wall-e?,3606,4
Friend put together this keyboard for his gf. Nyanyanyanyan,3607,4
We found him in a box outside of Blockbusters.,3608,9
This still seems very relevant to r/atheism...,3609,4
Dating Service by Jon Lajoie,3610,4
Dodgy Dolphin,3611,9
Lord Snow Blankface,3612,4
"Just my Deku Mask I made 4 years ago, still in one piece! :D",3613,4
My service tech team are members of an awesome fight club...,3614,4
I gets my nails did,3615,9
I too am a doctor.,3616,4
Scrap Metal Monsters,3617,1
Scumbag Genetics Recipe for Success,3618,2
The unavoidable truth,3619,9
10-week-old Samoyed puppy is all like this is mine. step off.,3620,2
Look who I found on NatGeo...,3621,4
"More restaurants needs to do this, gaps for my utensils! Good job, ManchuWok!",3622,9
Did Maine GOP Blatantly Cheat Ron Paul out of a Victory?,3623,9
Evolution of Nintendo,3624,2
I was filling out a survey for school and they almost got me.,3625,4
Mojang is getting their game making faces on again,3626,4
What People Say vs. What God Says,3627,9
"TIL that in the making of Saving Private Ryan, Matt Damon was spared from grueling army training so that the other actors would show their resentment for him subconsciously on screen.",3628,2
Don't. Laugh.,3629,8
It's official! I bring home my new Husky puppy on March 3rd. Meet Lucy :),3630,4
How I feel when cute pet pictures dominate the front page,3631,4
Who else loved these as kid?,3632,9
We didn't change anything!,3633,4
Before Punching People Was Cool...,3634,4
Best bday ever,3635,4
123456.7 891.0,3636,0
"After revolution in Egypt, women's taste of equality fades: Women were at the vanguard in the protests that ousted Hosni Mubarak. But long-held sexism has reasserted itself at the hands of the military and the Islamists.",3637,3
Why don't Americans elect scientists? (John Allen Paulos),3638,4
"AT&T is throttling unlimited data users after only 1-2 GB per month; customers are outraged, saying AT&T is just trying to get them to use tiered data plans",3639,4
First class of second semester? I love college Professors,3640,4
Received this message in my reddit inbox from a loving Christian,3641,4
This is what decides if girls hit on me or not,3642,4
What I actually do...,3643,4
I wrote this animated Assassin's Creed Revelations short for Adult Swim. It only aired one special night.,3644,9
Whenever people show me pictures of their babies.,3645,4
Hipception,3646,6
How I imagine people who whine about r/atheism talking about atheism,3647,4
A sneak peak at my new Computer Case Mod: A Link to the Past (Video coming soon),3648,4
He does it again....,3649,8
"As an Englishman, this kind of thing annoys me more than it should.",3650,9
Tonight...You,3651,3
Just my sister drawing with a crayon,3652,4
To Women in Relationships,3653,2
"Look who I saw in a Swedish ad, can it be her?",3654,4
So my dad (atheist) convinced a predominantly christian school that teaching creationism will lead to the end of the world...,3655,4
Happens Everyday. Good Guys Teacher,3656,4
Downvoting the Complainers,3657,2
After 200+ hours of playing Skyrim together this seemed like the right thing to do,3658,4
I found my bulldog like this after he made a mess in The house - he gets upset,3659,4
Maine Republican Party Cancels Missing Votes In Three Counties. Man responsible for cancelling votes in Washington County where Ron Paul won 4 years ago is a Romney supporter,3660,9
"Found this on my bike yesterday, you spelled narwhal wrong but thanks for the laugh!",3661,4
Louis C.K. nailed it,3662,9
The most satisfying part of my day.,3663,4
When Whenever I try to make it to the front page posts make it to the front page.,3664,4
Otter shares a Valentine with trainer at SeaWorld,3665,8
Probably the best uncrate I'll ever get,3666,4
Hand shake,3667,8
Africa.,3668,4
"My wife and I are buying books at Chapters; god is not Great, The Hungry Caterpillar, and some random recipe binder. The checkout girl looks at the books and remarks So",3669,2
Woke up to homemade donuts. Why haven't I proposed yet?,3670,2
My theist facebook friends provide some occasional entertainment,3671,4
The first time Husky has made me laugh in ages.,3672,4
David Jaffe handled bad game reviewer like a boss,3673,4
When you use contraception...,3674,4
Good Guy Greg - Stood Up,3675,9
Jeremy Lin - The Spanish Killer,3676,5
And this is why I is nothing for valentine's day,3677,4
Got bored. Drew Bella killing Bella.,3678,4
The real reason Reddit hates The Big Bang Theory,3679,4
DailyTech - UK Manager Says Major Labels Steal More Music Than Filesharers,3680,4
What are some tips from the jobs you worked?,3681,9
This is how he likes to sleep...,3682,8
If wizards had the Internet...,3683,1
What happens inside your body when you get hit on the head hard enough to black out?,3684,4
I can't believe no one's reposted these yet.,3685,4
"Angry Grandpa in 3, 2, 1..",3686,0
I was the substitute teacher at a continuation high school today...this was the only thing I could think of for most of the day.,3687,4
Hagrid Rage [x-post from f7u12],3688,4
This is a made up fact if I've ever seen one.,3689,4
AAAAAAAAAAAAAAAAAAAAAAAAAAA,3690,0
Mass Effect Choices,3691,2
How I feel as a Nihilist on Reddit,3692,4
Found this wig in my dad's closet. Hilarity ensued.,3693,4
GGG on /r/athiesm,3694,4
Jim Gaffigan following in the footsteps of Louis CK!,3695,7
Looks like someone tried to dissolve a body without using a plastic tub.,3696,4
Bill Cosby,3697,4
Many in the Christian faith have said,3698,4
Breaking Bad: Canada,3699,2
Liberty,3700,0
"don't worry fellow heathens, we'll be fine either way!",3701,4
The biggest achievement of my life.,3702,9
New Santorum ad literally douses himself and opponent with a frothy brown mixture.,3703,9
He needs to give it a brake.,3704,2
This is happening to me now,3705,5
Denial,3706,5
Dog Valentine's,3707,4
Ron Paul Is Secretly Taking Over The GOP — And It's Driving People Insane,3708,4
My dad took some self shots with duckface. Thought Reddit would enjoy.,3709,4
Super Smash Bros Scumbag [Fixed],3710,4
Detroit Red Wings set NHL record by winning 21st consecutive home game,3711,4
You want a Valentine's card? Here's your goddamn Valentine's card.,3712,4
Climate science deniers exposed: leak reveals how US based Heartland Institude bankrolls sceptics using millions in funding from carbon industry,3713,0
Santorum calls Occupy protesters intolerant after having three of them arrested,3714,9
Just Akira cover art in Lego,3715,4
Back Back Low Punch,3716,4
"After well over a month, my comic is complete (late for Valentine's!). Enjoy!",3717,4
This is how I spent Valentines Day,3718,4
...damn it Steve!,3719,8
OSS: giving you a good laugh when you dont expect it.,3720,4
Ban lifted: It only took 10 years but government gives R18+ video games the go ahead,3721,4
"Mojang partners with HumbleBundle to make a game in one weekend, genre based on poll results. All profits go to charity. If they raise over 1 million dollars, Notch shaves his beard.",3722,4
"Bill C-309, if passed, would make it a crime to protest in a mask. Could be up to a five year sentence.",3723,4
I was working in his neighbor's yard. He kept climbing up and nudging the ball at me. How could I deny him?,3724,4
Is it html5?,3725,3
Love is not a political statement,3726,4
"By a lopsided margin of 66 percent to 26 percent, Americans support President Barack Obama's proposal to require private health insurance plans to cover the full cost of birth control for women",3727,4
awww cute dog....,3728,5
It won't happen again. I promise,3729,2
The Pirate Bay's Peter Sunde Questions Why We Let Dying Industries Dictate Terms Of Democracy,3730,2
A picture of the Google car taking a picture of me taking a picture of the Google car.,3731,4
a photo i took with my phone,3732,4
How to defend yourself in case of a bear attack,3733,0
"You may not appreciate sports or athletes, but Michael Jordan's abilities transcend what mere humans can do.",3734,8
Would you support a law that states when video/audio footage from a police officer encounter is lost that the testimony of the officer becomes inadmissible in court?,3735,4
Had an epihany,3736,9
A valentine I made when I was 5,3737,4
21st century dating problems,3738,4
A boy retrieves his ball in front of a solider during a festival in Liberia,3739,4
How Do We Know That Piracy Isn't Really A Big Issue? Because Media Companies Still Haven't Needed To Change As A Result Of It,3740,4
good point,3741,9
"Perhaps shame will stop her, nothing else has worked",3742,4
Valve runs Windows 7 on their Macs,3743,3
UK Parliament members concluded that the Internet plays a major role in the radicalization of terrorists and called on the government to pressure ISPs in Britain and abroad to censor online speech,3744,4
Found this on my desk when I got into work. I'm scared.,3745,4
"My brother worked on this poster in secret for 2 years. It's full of some of the awesome things from our childhood, and it just showed up in my mail!",3746,4
got shot by the paparazzi in LA...didnt know I was that famous...,3747,2
Who's more qualified to testify about women's reproductive issues than a trio of adult male virgins?,3748,5
"After a 53 year engagement, John and Rudy are now able to make it official in WA. Here there are where they belong, at the front of the line.",3749,4
Favorite gif,3750,4
My friend made this Hydra out of copper,3751,4
Why 3D doesn't work in first-person view on Metal Gear Solid 3 on 3DS.,3752,4
just a duck in a cup,3753,3
True love is indestructable,3754,2
AMA Request: Participant in the Stanford Prison Experiment,3755,4
I accidentally clicked Restart instead of Postpone 4 hours,3756,4
Every time I'm moving large and heavy stuff with friends...,3757,4
Unicorn Itch,3758,5
dubstep hipster cat,3759,8
My friend defaced a dollar bill...,3760,2
"Don't worry, 4chan fixed it...",3761,4
Night snowboarding in an LED-covered suit,3762,9
Ferrari 166,3763,0
How many people would be interested in a subreddit full of tabled IAMAs?,3764,4
I am Spandy Andy... AMA,3765,4
A bomb won't go off here...,3766,2
This guy (Alan Tudyk) needs to do more things,3767,2
"TIL that MI6 successfully hacked an al-Qaeda website, replacing instructions to make a bomb with a recipe for cupcakes",3768,4
Evolution of Louis CK-- really cool video about how Louis changed as a comedian.,3769,2
Came home to this...,3770,4
Simply Geography,3771,4
A hundred years from now,3772,2
Grocery store is doing it right.,3773,9
Maddow: Proof Ron Paul Was Robbed In Maine.,3774,9
Grammar.,3775,7
Perfect timing,3776,4
Total badass,3777,9
The world should follow Italy's lead!,3778,2
No Excuses!,3779,2
Look what I found in my bathroom.,3780,4
I've been subtly adding random interests to my girlfriends page.,3781,4
"Meanwhile, some men...",3782,3
"Congratulations to our community! Yes, you!",3783,2
Impeccable Timing,3784,7
First morning having to walk away from this face since I adopted him yesterday. Meet Bear.,3785,4
It's going to be extremely difficult to punish this guy,3786,2
Just Combat Kitty and I hanging out in Afghany Land,3787,2
"Yeah, me too.",3788,2
Australian road safety sign. Typical Aussies.,3789,8
"As of today, I have $0 credit card debt.",3790,4
Nevada is becoming the first state to regulate self-driving vehicles on its roadways.,3791,4
Daddy! Don't forget your Sandvich!,3792,9
Never take advice from a magikarp,3793,4
What this meme has turned into,3794,4
Election picture,3795,4
Who else misses the games that came out of this company?,3796,4
Found this badboy in the basement at my work today. Not sure what do with it.,3797,4
What if Girls had PREMATURE ORGASMS?,3798,4
My first time shooting a gun.,3799,4
Today I came to a fork in the road.,3800,4
"You win this round, Facebook.",3801,9
Science teacher here. Here is why I face palmed today.,3802,4
Disney Problems,3803,2
Successful Black Man's Son,3804,4
Met this little guy during field exercises...,3805,2
I can confidently say we've all done this.,3806,2
"TIL Playing with a cat, with a laser, is patented",3807,2
Hey Notch...,3808,4
Park benches,3809,8
"Oh, neighbours...",3810,4
Everytime my jeans feel a little looser...,3811,4
The Temptations,3812,3
Confidence,3813,8
My grandma is a Century old today,3814,4
Forever Alone while giving blood,3815,2
What does reddit think of this pic my friend took mid concert. (I was extremely jealous),3816,4
New York City 2012,3817,4
Dear BF3 players...,3818,2
TIL that the man who voiced Mickey Mouse was married IRL to the woman who voiced Minnie Mouse,3819,2
"Sydney opera house, at dusk",3820,0
This is what a happy cat looks like,3821,4
The Wordwall,3822,5
Did I do it right?,3823,4
David and Goliath,3824,4
"University of Alberta researcher discovers vaccine for hepatitis C, effective against all known strains",3825,3
My coworker took a day off..,3826,4
When girls want me to play strip poker...,3827,4
Now we wait..,3828,5
ಠ_ಠ,3829,6
Hiking through the rainforest with a Half-Life mentality,3830,2
There are some things that even a cat can't dodge!,3831,4
We were concerned that they wouldn't like each other.,3832,6
"How do we measure mountains on Mars without a level for zero? Ie, our sea level.",3833,9
"Generic store brand, you're doing it right.",3834,9
Baby Anteater!,3835,4
Hey /r/iiiiiiitttttttttttt! You're today's featured sub reddit of the day! Congrats!,3836,4
The force is strong with this one.,3837,4
Jealous alpha male monkey attacks man,3838,4
Skyrim Marriage [Fixed],3839,4
What I think every time someone asks why Harry didn't just shoot Voldemort.,3840,4
Roomba ride,3841,2
Watt is love?,3842,8
I laugh every time i see this,3843,4
Virginia law requires women to have a penetrative ultrasound in order to get an abortion.,3844,2
"The Irony, it Burns",3845,6
My dad's first attempt at Insanity Wolf,3846,8
Flip that cat!,3847,6
"Still one of the coolest backdrops in gaming, even after all these years.",3848,4
The funniest thing is that it usually works.,3849,9
How i feel after watching A Clockwork Orange for the first time,3850,4
I knew it!,3851,4
Saw this when coming home from the bar. How in the world...,3852,4
Street Monsters,3853,4
TIL that foreskins were used to surgically replace eyelids of WWII soldiers injured by fiery explosions,3854,2
Yao Ming on Jeremy Lin,3855,5
CLOSE ENOUGH,3856,4
I'm about to take my 7 year old son out of his Christian school after reading their middle and high school handbook. Am I doing it right?,3857,4
Hipster Warren Harding,3858,8
"So, I took a short cut through an alley at the back of a temple in Mongolia",3859,4
The Paradox of Our Age,3860,2
What I wake up to most mornings,3861,3
That might actually be correct.,3862,4
Superintendent Chalmers on prayer in school.,3863,4
Killing Floor In a Nutshell,3864,4
George and Tyrion,3865,0
"Meanwhile, in Poland...",3866,3
Some things don't change,3867,4
Some pals and I turned the local go kart track into Mario Kart this past weekend. It was pretty epic.,3868,4
"Court of Justice of the European Union: The owner of an online social network cannot be obliged to install a general filtering system, covering all its users, in order to prevent the unlawful use of musical and audio-visual work",3869,4
GGG driving,3870,4
"ESPN, you've gone too far.",3871,2
Teller on the bible,3872,9
I need an adult!,3873,4
Just sitting there... judging you.,3874,2
Busted!!!,3875,0
"Seriously, where do some of you guys work?",3876,2
They are merciless. They will hunt you down,3877,6
What your Girlfriend really wanted on Valentines day,3878,4
How I feel about teen moms who post pics on facebook,3879,4
Socially Awkward EMT,3880,9
TIL Ye Olde Shoppe should be pronounced The Old Shop because of a lost letter,3881,4
Wat,3882,5
Take acid they said!,3883,8
I hate it when a book I'm reading unexpectedly does this...,3884,9
HOLY GUACAMOLE I'M DJ'ING AT ULTRA!!!,3885,4
"Found this site, every time you order from them they ship a book to a kid in Africa.",3886,4
Elephant Armor!,3887,4
Ian McKennel,3888,0
"That's how the story goes, right...?",3889,9
Why does changing 0.1f to 0 slow down performance by 10x?,3890,7
My friend's cat takes Valium for anxiety. This is what happens when it's accidentally given to the other cat.,3891,4
so you want to be a modern poster designer?,3892,2
Oh Rory,3893,4
"Oh YouTube comments, always a joke to be found in them.",3894,2
Scumbag Girl Lets Scumbag Steve Take Photos Of Her On ONE Condition,3895,2
Alex Ovechkin does not approve,3896,6
Never heard truer words than these,3897,4
It's genetics,3898,0
Cute Rabbits,3899,5
Blizzard HQ after releasing a new store mount,3900,4
Hey! I was here first!,3901,8
But...but....I really need to go!,3902,4
"TIL Wikipedia's highest editorial honor is the Vanguard Editor (or Lord High Togneme), which requires 132,000 edits and 16 years of service.",3903,4
"Democratic women boycott Rep. Darrell Issa's House contraception hearing, after Republicans prevent women from testifying",3904,5
DIY Baby Princess Leia Costume,3905,1
"So, picked this up at Walmart for $10 USD. It is nothing short of amazing",3906,9
Power of gravity,3907,9
German Humor,3908,6
She's not here...,3909,2
Browsing r/funny in a galaxy far far away (video driver crash),3910,2
Abstinence,3911,5
... catholic sex [fixed] [fixed],3912,4
Ponder on that.,3913,9
TIL Over the Last Few Thousand Years Our Brains Have Beeen Shrinking—Fast,3914,2
Subliminal message!,3915,6
My computer monitor is so big I can't find my mouse pointer.,3916,4
Massive Irony,3917,7
"I don't like posing for pictures, so this little guy comes with me everywhere I go.",3918,4
urinal with a view,3919,4
what i do,3920,0
Don't Mess With the Pep Band...,3921,5
So I was making a Fansign Contest and I came across this,3922,2
Can we please stop bestofing unworthy comments just for karma?,3923,2
Enough.,3924,9
This meme can be relevant.,3925,4
Dominant Cat,3926,8
"Ah, Young Love.",3927,4
Red Vs. Ash.,3928,9
My friend started as a dish washer and I used to give him rides home at 2am...... this guy did a piece on his restaurant recently..,3929,4
"It's Julia Roberts, run!",3930,3
Succesful Black Mans son (Fixed),3931,4
Coincidence? I think not.,3932,4
Come on teachers.,3933,4
"My friend just sent me this, I don't know if it's an invitation or an insult.",3934,4
I made The Dude in Minecraft.,3935,4
GGG,3936,4
Thank God!,3937,4
What I want to say when someone asks why I accidentally reposted something to Reddit,3938,4
I guess this is why we're a community.,3939,9
"Gearbox Sent Me An Expired Logitech Discount Code As A Prize. They Didn't Have A Valid One Left, So They Hoped I'd Settle For These.",3940,4
Canadian Movie Map,3941,4
Just. Wow.,3942,0
Just the tip,3943,3
BOOM! HEADSHOT!!,3944,3
Vic Toews and Bill C-30 in a Nutshell,3945,4
Post I saw on FB this morning.,3946,4
Beastie Boys' Mike D Forces AT&T Shareholders to Vote On Net Neutrality Principles,3947,3
Update to I think my wife cheated on me,3948,2
"Cast iron seared burgers, aged cheddar, jalapeños, and caramelized onions",3949,2
What time is it?,3950,4
"As a kid, this was my first little nudge towards atheism.",3951,2
Apology accepted!,3952,8
Give him a hand [GGG],3953,4
Well..,3954,5
Remedy winks at PC gamers in a cool Alan Wake easter egg.,3955,3
TIL Julius Caeser was kidnapped by pirates for a ransom of 25 gold but he told them that he was worth atleast 50,3956,2
Every time I'm at the university library,3957,4
Don't forget your sandvich daddy!,3958,9
Scrollwork I created and engraved on a dogtag.,3959,9
Så sant,3960,2
Penn Jillette on the bible.,3961,5
Bethesda explains why Morrowind and Cyrodiil are in Skyrim – Geek.com,3962,9
My thoughts on college debt,3963,4
Told my co-worker about Reddit last week,3964,4
"My brother's been down in the dumps lately & has been doing this. He believes it's not reddit worthy, I disagree. Any thoughts?",3965,4
It took me a LONG time to get him to sit still.,3966,4
Every writing assignment I get,3967,4
I know what I'll be getting next...,3968,4
Gran turisimo of the 80's,3969,3
In class and the hot girl two seats ahead keeps glancing back at me...,3970,4
Scumbag God strikes again...,3971,2
"reddit, Look at the Wall YOU built in Kenya! Updated pic from Omari and Faraja Children's Orphanage",3972,4
"I see that you guys have dogs that are excited to see you when you get home, this is my dog when I get home",3973,4
"Congrats, US Government: You're Scaring Web Businesses Into Moving Out Of The US",3974,4
Hey Rick Santorum: Removing access to contraceptives in order to discourage premarital sex is like taking away seat belts to encourage safer driving habits.,3975,4
We have all dealt with crazy girls but this one tops them all! This is after 1 date,3976,4
My poor little guy outgrew his bed and doesn't want to give it up.,3977,4
"Self-destructive? Nahh, worth it!",3978,4
It was that dude!,3979,4
Obama May Ditch Most US Nukes: Conservatives in Congress say the president's policy is reckless lunacy—but military strategists think it's smart.,3980,4
$6 Trillion in counterfeit US bonds found. Am I wrong for thinking this should be bigger news?,3981,2
A bit dark,3982,4
Made from shattered CDs.,3983,4
Google yourself?,3984,9
I decided that my facebook timeline needed a little CSI flair to it.,3985,4
"At 5:00pm on Sunday, 3rd September 1967, Sweden changed from driving of the left to driving on the right. This is what happened.",3986,4
German president Christian Wulff resigns in corruption scandal,3987,8
This is one reason why I hate roommates,3988,4
"Friend dropped her phone down the stairs, this is how it takes pictures now",3989,4
100% Boss,3990,4
Soul Caliber x South Park... slow clap,3991,9
Damned Deep Voice,3992,4
Party on,3993,4
The Welfare State didn't destroy our innercities,3994,9
TIL that after the fall of the Roman Empire the technology to make concrete was lost for 1000 years.,3995,4
Whenever I buy a used textbook...,3996,4
Good Guy Biker,3997,9
My Favorite Jack Donaghy line of ALL TIME.,3998,4
Dave Grohl clarifies his speech at the Grammys,3999,9
When the top comment is exactly what I hoped it would be.,4000,4
My pastor told me that no one of true faith could lose in an argument against a non-believer,4001,4
"Mojang and friends have begun the Humble Bundle Mojam for charity! One weekend to make a game, live streamed for all.",4002,4
When he grows up.....,4003,2
I don't think you're supposed to add those.,4004,4
That's a book case,4005,9
My Kitty Whiskey Anne,4006,2
I get penalized for this all the time.,4007,4
"Saw this guy in the woods cold and alone, so I brought him home and warmed him up.",4008,4
How males communicate via text,4009,4
"Reddit, I'm watching my mother die because she doesn't have insurance. Help me figure out the system so she can get care?",4010,4
IAmA person who was stabbed in the neck and experienced clinical death 3x one year ago today. AMA.,4011,4
The Creation of Reddit.,4012,4
School can be awkward sometimes...,4013,9
"Sometimes, Evolution Sucks!",4014,2
Tissue bed,4015,4
Abandoned Soviet Submarine Base,4016,4
David Blaine's latest trick,4017,4
"TIL that 350 million years ago, there existed a 20 foot tall mushroom in Saudi Arabia. It was likely the largest living thing on dry land at that time.",4018,2
Caught a House Hippo,4019,2
"I just found this in a forgotten folder, thought you may like it",4020,4
The Ginger and Mary Ann of outer space,4021,2
Pot legalization gets enough signatures for Colo. ballot: The Campaign to Regulate Marijuana Like Alcohol said Friday morning that it had turned in more than enough valid signatures to get an initiative on the ballot this November in Colorado.,4022,4
"Giant Supernova set to explode any day now, a blast so violent that its flash will briefly outshine the entire Milky Way.",4023,4
"Since Eric Cantor blocked the registration of Political Intelligence consultants, anyone can be one. Call his office and ask for insider trading tips. 202.225.4000",4024,4
I found Reddit's secret headquarters,4025,4
99% of Women Have Used Contraceptives. The GOP Again Goes For The 1%,4026,4
Jim Gaffigan follows Louis C.K. in not using a big label to distribute stand-up material,4027,4
"Adolf Hitler had a son with a French teenager while serving as a soldier during the First World War, according to new evidence.",4028,4
I drew Chell and GLaDOS as kittens <3,4029,5
"When working IT Help Desk, I've never used a response not found on here...",4030,4
