Title,doc,topic
Cop here I have seen a large increase in suicides this year and I dont know why For my Cake Day Id like to Ask Reddit to look out for each other and know that there are resources put there if you need them And to ask Wgat can you do today to save someones life,3481,2
A little bit of what is this sorcery & take my money,3482,2
How Big Banks Are Still Lying Cheating and Ripping Us Off The American media are downplaying a huge banking scandal thats rocking the UK,3483,2
Saw this driving around the other day thought Id share,3484,2
Duke Nukem reads 50 shades of grey,3485,7
Pie for $Pi,3486,8
trying to select user names with RES,3487,1
I am Cory Booker Mayor of Newark NJ founder of #waywire Inc social media enthusiast  AMA,3488,2
I heard you guys liked my dads Scruffy costume Heres another one of his many looks,3489,2
Just left an adoption event Going to my forever home,3490,7
Customers Told Server to Pick a Number Between 1 and 10,3491,2
50 Sheds Of Grey,3492,7
rmovies wouldnt allow it so here it is My favorite cosplay from Comiccon,3493,2
Google tries to ban websites that convert youtube videos to mp3,3494,4
After cleaning and painting her room I left my girlfriend a surprise,3495,2
Im sure the Archer fans can appreciate,3496,2
How different can one man look,3497,2
IAmA Olympic Weightlifter and The Strongest Woman in America,3498,1
Its that time of the month,3499,2
a rare sight to see in alberta canada i was all smiles,3500,2
LPT How to read hazard signs,3501,2
Celebrating Bastille Day,3502,7
The fun you can have with an air bedouch,3503,7
London is now considered to be the “moneylaundering capital of the world”,3504,2
Us Last year,3505,2
classic winger,3506,6
I told my cousin he had lego man hair and he didnt understand so I had to show him,3507,2
Living the dream,3508,4
Wow they really are just like us,3509,2
So I was in Malaysia a month ago found this,3510,2
What my friend saw on the highway,3511,2
Up Up and Away,3512,2
Abandoned roller coaster,3513,7
He was like this for an hour,3514,7
Id like to put a drunk or really stoned person in here and just watch and see what happens,3515,2
Dustin Penner hometown beauty,3516,9
Blind rhino rescues helicopter,3517,6
Thanks Reddit D,3518,7
At a local BBQ place here in Texas,3519,7
A skeptic faces possible charges for debunking Mumbai’s miracle statue Sanal Edamaruku faces a Catholic backlash after insisting that the holy water dripping from a statue of Christ in Mumbai,3520,1
Tweet of the day from Andy Borowitz,3521,7
I got antsy waiting for season 5 and made myself a viewing buddy for tonight,3522,2
Why I love Pokemon contests,3523,2
Friend met Seth Green at ComiCon Instead of an autograph he just gave him this,3524,7
Hide and Seek,3525,2
So my friend decided to take his cat for a walk The cats reaction was a resounding NOPE,3526,2
Theres Been a Tectonic Shift on Marijuana Across the US Except in Washington More Americans and local politicians than ever before are demanding an end to marijuana prohibition  but for change to happen we need federal officials to start listening,3527,2
Westboro Baptist Church sign translation,3528,1
TIL There is a town in Alaska that has had a cat as mayor for 15 years,3529,2
Im actually working on a survivaladventure map Could I have feedbacks and suggestions from rminecraft ,3530,2
Last year I got into geometric artwork after months of slow progress this was the product 3 x 3 done in sharpie pen and paint pen on the backside of a thin cardboard frame insert,3531,7
Friend consoling dog,3532,7
Sometimes I think we forget the Doctors real reason for his adventures,3533,2
A quote from the church,3534,4
A rather intense photo of Obama,3535,2
When I wear a tight shirt,3536,1
My local stores game collection is simply amazing,3537,2
Its turned into a waiting game,3538,2
Go Go Gadget ,3539,7
3 days after I shave my balls,3540,7
Well I dont like you either building,3541,2
We all know this douche,3542,2
Ice Age Ice cave Iceland,3543,1
When I hear two people talking about me and they dont know Im there,3544,2
Is that anevermind,3545,1
Synchronization 1 Gravity 0,3546,2
Storm approaching,3547,6
Meet Theodore best friend for over 12 years,3548,2
The best part of an English Sunday afternoon,3549,1
Use Velcro strips on your common items to keep them where you want them,3550,2
Liking your own status on Facebook,3551,7
SOPA author wants to arrest journalists over leaks Lamar Smith the angry old man who doesnt understand the internet and author of SOPA thinks that its time for the Justice Dept to bring down “the full force of the law” against journalists who leak sensitive information,3552,2
Our neighbors cat loves us and visits 56 times a day This is what she does when she wants to visit at midnight,3553,2
Sign seen in a liquor store in Western Australia,3554,2
Saw this the day before moving I am going to miss this town,3555,2
Studying for the bar exam when suddenly,3556,2
Whenever my family go out and Im the only one in the house,3557,2
TIL there was a bridge in southern Hungary that was found to still be rigged with dynamite from World War IIin October of 1999,3558,2
Whenever I see nonreaction GIFs getting tons of karma in this subreddit,3559,2
My cat Dexter smiling for the camera,3560,7
Romney Adviser Romney Not Responsible For Bain Because He ‘Retired Retroactively’,3561,2
HBOs The Newsroom  A brutally honest 3 minutes,3562,7
I was eating pretzels when I came across this,3563,7
For those of you who have more swag than you can handle,3564,2
Herb and Fran go Human Watching,3565,7
Official Poster for Man of Steel,3566,6
Learned from a relative this morning,3567,9
I wish I couldve thought of this,3568,2
if u allergic to tomatos then why is ur punk ass eatin the salsa,3569,4
Seems legit,3570,7
stops_to_thinks double personalitied girlfriend,3571,7
Overgrown railroad tracks,3572,6
My Favorite DayZ video so far,3573,2
Playing through Ghost Recon all stealth,3574,1
safe sex on the beach,3575,7
Its all fun and games until[FB],3576,7
Classic,3577,6
*Sigh*,3578,0
Not sure where she got the idea for this but I should of known to be worried when my 3 year old daughter was quiet for 10 mins Came downstairs and all I could hear was I can do it,3579,7
Ill try to put this Gingerly,3580,2
I could see this kid regretting his tattoo choice in the near future,3581,2
TIL that 50% of the worlds golf courses are in the United States,3582,4
I live 2000 miles away and i woke up to this text from my grandpa,3583,2
Lately when someone horribly hurts themselves,3584,3
The Greatest Lesson Any Video Game Can Teach You [FIXED],3585,2
Late to the party I know but the best £5 ive ever spent,3586,2
I like the current 3D craze as much as the next man but I cant help feeling like theyve taken it a bit too far,3587,2
Ray Allen takes out ad in Boston Globe to thank Celtics fans,3588,6
Biggest smile ever,3589,2
My Pokéball mansion and Ash,3590,7
I guess I have to accept my failure,3591,8
My husband insisted that I take this picture and post it here He said you guys would understand,3592,2
Ran into this little Joker at ComicCon,3593,2
You know youre unemployed when,3594,2
These religious nuts were trying to ruin Comic Con but luckily we had some help,3595,2
The image that lost me 5 facebook friends in one day Gotta love them fundies,3596,2
Hai,3597,8
The perils of living in England,3598,4
Neil deGrasse Tyson just came into my restaurant and said he really liked the food I set up my life is complete,3599,2
I woke up to a neck warmer this morning,3600,2
Off to a bad start,3601,2
70 Lightning Strikes In One Shot,3602,7
Victory for Open WiFi Judge Rejects Copyright Trolls Bogus Negligence Theory  The owner of an Internet connection cannot be found liable for negligence simply because another person uses his wifi connection to commit copyright infringement,3603,6
Does a jar of flies weigh less if the flies are flying around in the air rather than if theyre at the bottom of the jar,3604,2
A Morning Line of Stars and Planets The Pleiades open star cluster Jupiter Venus and the Follower star Aldebaran,3605,4
Reddit Help  I have found an Baby Duck and have no Idea what to do httpimgurcomngYb0,3606,7
In Time For The Dark Knight Rises,3607,7
One of the funniest scenes IMO,3608,2
I think he was wrong,3609,2
The mind is willing but the flesh,3610,2
When a post is full of advice from teenagers,3611,2
The other night these Anonymous fliers surrounded the parking lot of a Church of Scientology headquarters,3612,2
Protest in India,3613,7
Couple meets for the very first time after dating long distance for 5 years So sweet,3614,2
My favourite Animorphs book,3615,2
Too soon,3616,4
The greatest lesson any game can give you,3617,2
I must go my people need me,3618,2
Green Pepper,3619,4
This happens when I sing,3620,2
TIL the Chinese name for America is Meiguo which literally means beautiful country,3621,2
Dont be that guy,3622,2
Attended a wedding for the first time as a single lady when I realized   ,3623,2
I knew Minecraft was big but damn,3624,2
Good books,3625,7
Friends Nephew meeting his hero,3626,2
I think I need to go to the farmers market more often,3627,2
Hogwarts is racist [Fixed],3628,2
in my friends beer earlier,3629,7
This made me giggle I read it in his voice,3630,2
Steam Summer Sale Day 04 20120715 Cities XL Darkness Hitman Saints Row 3 more,3631,7
Robert Downey Jr crashes a kids Iron Man costume contest at Comic Con declares himself the winner,3632,7
My girlfriend made this,3633,2
My friend does this,3634,7
HELLO,3635,7
Never saw this when it aired but for $6 at Goodwill the whole series is mine,3636,2
Mr Cat didnt get much love in raww I dont get it,3637,2
Hey Reddit I just wanted to share my mutation Thoughts,3638,2
Matt Smith (the Doctor) wants to make an appearance on Community,3639,7
How rats get ripped,3640,8
For the Doctor Who fans I present the greatest crossover of all time,3641,2
Every time I see commercials for weight loss medication,3642,1
Sons iPod not working,3643,2
So a guy punched a hole in the hallway of my apartment buildingmy response,3644,7
Well played Matt Groening well played,3645,4
Do Not Disturb,3646,6
Criticism of a copyright claim is ironically removed due to a claim of copyright,3647,6
One of these things is not like the others,3648,2
My girlfriend made this(xpost from rgaming),3649,2
Hi rstarcraft a message from rtribes,3650,2
Im no graphic designer but,3651,7
Forget Team Rocket theres a new Pokemon gang,3652,2
When My Friend Said He Didnt Like My Moms Cooking [GIF],3653,2
Pretty good for a dagger,3654,7
My favorite lullaby,3655,2
How I feel when I submit a link and the first 3 votes are downvotes,3656,2
Theres No Hiding It Citizens United Wasnt About Speech  It Was About Takeover of American Democracy,3657,2
ratheism Sudden Clarity Clarence,3658,2
My brother asked me to get him the can opener I guess I took too long,3659,2
TIL It was Nietzsches sister Elizabeth who edited and falsified his later works in order to portray him as antisemitic,3660,2
Thanks but Ill pass,3661,2
Youtube comment is pure gold,3662,2
Successful Black Man,3663,2
only thing I can think of when I see angry koala become a meme,3664,2
i think one of them may be lying,3665,2
Hey everyone meet Goggles,3666,7
When Christians tell me about Free Will,3667,2
Facebook now scanning chats and posts for criminal activity,3668,3
Who else loved this opening,3669,2
Gets me Everytime,3670,2
TIL that the Portuguese Man O War jellyfish is not a single creature but actually a colony of interconnected specialized organisms functioning in unison which are themselves incapable of independent survival,3671,6
Just found my old Red version with this save on it,3672,2
My Girlfriend said we need to talk,3673,2
So Much Potential,3674,2
My friend about to leave to become a Marine,3675,2
How I feel using the bathroom at friends houses,3676,4
Disturbing realization baby,3677,7
Funny cartoon portraying Drew Brees signing,3678,7
Colorful train cars,3679,7
Dilemma,3680,6
Poor Book (Serenity spoilers),3681,1
Smartest kid in 2nd grade,3682,7
I made some glazed maple cinnamon roll muffins Delicious,3683,1
Scarlett 20s Ostojiy to take WCS Canada,3684,2
Weird patterns on Earths moon finally explained,3685,3
Ermger,3686,5
Walked in on my dog watching TV like this,3687,7
The origin of Seems Legit,3688,7
Top percentage of scumbag,3689,2
Houston ready for launch,3690,2
How I found out the steam summer sale started,3691,2
[PSA] This is not the subreddit to post your omegle chat logs,3692,7
YSK How to read hazard signs (xpost from rLifeProTips),3693,2
First world gay activist problems,3694,2
This is why the Steam sales can suck sometimes as a nonAmerican,3695,2
An honest mistake,3696,6
I made this PacMan necklace with a laser cutter for a girl I like what do you think,3697,2
I have only read the first book so far and this is one of the funnier quotes that I have found [AGOT],3698,2
Story at 11,3699,2
Several weeks ago a friend detonated a lot of TNT We have since filled the resulting crater in with over 100000 TNT,3700,2
Everything you needed to know you learned in kindergarten,3701,2
I friend made me this for passing my first board exam,3702,2
Just a little buddy,3703,2
So i went to get my mail when i realized,3704,2
Its things like this Christians,3705,2
Why wont anypony take my downvotes for free,3706,2
Eyegasm 64,3707,4
Well thats weird,3708,1
My first new car,3709,2
When you think about it it makes sense why this is true,3710,7
So I found a trainer I didnt battle on my initial run through the game I dont think its a very fair match,3711,2
NASL Soundguy by USAUSAUSASTARCRAFT,3712,7
The chocolate chip cookies were actually raisin cookies,3713,9
Logging onto reddit to find out Ive been down voted to hell,3714,2
McCain Campaigns Full 2008 File On Mitt Romney,3715,2
So I was watching the season premiere on my laptop,3716,2
My mom and dad just got this picture text from a random number and this is what they replied back with,3717,2
walked up to him and before we could ask he took the camera from my hands and snapped this amazing photo,3718,2
My grandfather and his men heading to the Russian front Not one of them returned,3719,2
New Axe commercial featuring Kiefer Sutherland is actually kind of tasteful,3720,1
Terry Pratchett despite battling Alzheimers can still make us laugh with his unique witty logic,3721,2
From an episode of Mongrels a single frame that flashed for less than a second This is why I love BBC comedy,3722,2
Players at court,3723,2
isolated shower,3724,7
Just be,3725,0
Dean Martin once gave his famous burger recipe to a celebrity cook book This was the result,3726,2
My mom walking in on my private time when I was a teen,3727,2
My dads attempt at killing the wasp colony in our backyard,3728,7
Deputies shoot kill man after knocking on wrong door  deputies knocked at 130 AM did not identify themselves as police and shot the man who answered the door with a gun,3729,2
As an Englishman reading the front page just now,3730,7
Skills of a cat,3731,7
For you younger redditors this is how they signal batman in the daytime,3732,2
Canadians favor decriminalizing marijuana,3733,8
Always happy to be surprised,3734,7
Failed Attempt to Provoke an Accident,3735,2
a sketch by my 12yrold little brother constantly upstaging me in coolness,3736,0
My aunt recently passed away My parents found this letter while cleaning out her apartment,3737,2
Aaron Pauls latest tweet Nuff said,3738,7
Im with Elaine on this one,3739,7
My dads way of transferring pictures,3740,2
Facebook distilled,3741,7
Defense analyst John Arquilla believes the US should stop prosecuting elite hackers and instead hire them to wage an online war against terrorists as well as other American enemies He argues if the US played its card rights with hackers the war on terror would have been long over,3742,2
I really see this,3743,2
Now THATS a double rainbow shot,3744,7
The Koch Brothers by themselves will spend more money in this election cycle than the entire presidential campaign of John McCain in 2008,3745,2
Residual Effects of Cannabis Use on Neurocognitive Performance After Prolonged Abstinence A MetaAnalysis  there was no evidence for enduring negative effects of cannabis use,3746,1
We didnt have a wine key in the house Then one of my friends asked me if I had a dime,3747,2
The only thing better than the Muppets might just be Muppets bloopers,3748,1
Ranger with a Big Iron,3749,7
To everyone posting pictures of your pizza box towers this is how I see your house,3750,2
I go to ComicCon every year only to take Cosplay pics This year I left with 611 great photos Enjoy,3751,2
Set aside your ADD For all the love given to science and NASA Reddit sure hasnt given much love to their video,3752,2
Amazing photo of our Moon Jupiter and its moons,3753,7
Met fem shep at comic con the gun was surprisingly heavy,3754,2
My dog fell asleep in a weird position,3755,7
My local coffee shop found out they made the front page of Reddit,3756,2
Steam contest idea,3757,7
how I feel when I have to reread the same thing 6 times,3758,2
I see you,3759,2
I was playing Skyrim when suddenly I found myself in a strange glitchy world but decided to explore it instead of reloading,3760,2
He couldnt back up far enough,3761,2
Moon Landing,3762,3
Someones having fun at Home Depot,3763,7
Protective of her sister,3764,7
years of Mario Kart have prepared me for this moment,3765,2
Customers needed,3766,2
Mr Tee,3767,2
Damn Imperials,3768,2
Meet puffhes pretty chill,3769,7
TIL there wasnt an actual script for the original Iron Man In primitive rehearsals,3770,7
We put a lot of work into this stupid Dark Knight parody but I think youll like it,3771,7
The vandals in Canada are going too far now,3772,2
Scottish standup comedian live tweets a breakup on a train,3773,8
Surreal Rodeo,3774,8
[Pics] goal acquired From 215 pounds to 150 in 6 months,3775,4
Sounds like a plan,3776,7
Press A to goat,3777,2
Some days I just feel like,3778,2
no that cant be right,3779,2
Why is no one talking about this Ikea is senselessly slaughtering endangered sesame street animals,3780,2
He is hauling a truck load of karma right there,3781,2
As someone who just picked up a more recent Pokemon game after not playing since Pokemon RedBlue,3782,2
It cant be him,3783,2
Man Down,3784,2
jQuery 20 Will Drop Support For IE 6 7 8,3785,9
My dad had me move some cinder blocks; needless to say I had my fun,3786,2
Every day around this time,3787,2
My 9 year old brother asked me a question with this same face,3788,2
Fortune Cookie,3789,1
Parking Bender,3790,4
That isnt a word,3791,7
Peeked out from under a blanket to see this,3792,2
Found this taped to my bathroom door this morning ~930 My brother looking out for me,3793,2
Romney (94) I also would abolish PACs I dont like them I dont like the influence of money I think we have to really become much more vigilant in seeing the impact on money in politics,3794,2
Mario marbles,3795,2
Me and someone not so skeptical,3796,2
Im quite sure it is dinner time,3797,2
Legendary Deep Purple organist and classical composer Jon Lord has died at the age of 71,3798,2
This may be the best license plate Ive ever seen on a truck,3799,2
At least he didnt wink,3800,2
TIL Today humans create more data in just two days than was created in all of history up until the year 2003,3801,2
The 25 Best That Guy Actors,3802,2
Last week was my friends birthday and I decided to make him a Borderlands themed cake Thought you guys would like it,3803,2
Oh Capn,3804,2
Ill watch it again when Im alone,3805,2
Ooh burn,3806,2
Walt is missing his wedding ring,3807,8
My son (12) draws Pokemon and a themed human version He would love to know if Reddit likes his work,3808,7
Skeptical Catholic,3809,1
The feelsall of them,3810,3
[s] Stephano wins NASL Season 3 40,3811,7
Dont tell me what to do Rihanna [xpost from rfunny],3812,2
True Education,3813,8
Masks  You cant be a hacker without one,3814,2
A flower with 80000 volts running through it,3815,8
Success Kid on Success Kid,3816,4
More protective than most human parents,3817,7
Mugshot,3818,3
Birds Oh hell no,3819,2
Thorette,3820,5
Dissected Mouse,3821,9
Things got a little heated during Jrs reconnection with his father,3822,2
Spock Slapped,3823,9
Turns out my dorm room is 52 pizza boxes tall,3824,2
My friend tried to do this once,3825,2
Lady Cyclops Cosplay,3826,7
I guess the blue ones Jewish,3827,8
Appreciate the old Redditors,3828,2
Ladies there is enough of me to go around,3829,2
We were stuck for 6 hours and got punishedbut it was worth it,3830,2
After seeing so many posts about 50 shades of gray,3831,7
DEA feel irritated watching people look something up on the internet because they feel like they could do it quicker and more efficiently,3832,2
How I feel browsing rfunny,3833,4
My latest batch of Facebook timeline coverprofile pics,3834,7
He was surprisingly calm when we put this on,3835,8
Velcro,3836,8
Mom just got an iPhone,3837,2
South Park Morpheus checks in to clarify something,3838,2
Kohs greatest challenge [Stare down by jesterry],3839,9
Well HELLO,3840,4
Baby bats ^____^,3841,7
Yahoo now has the hottest CEO ever,3842,1
Look what I found in my friends garage,3843,2
I walked into the kitchen and saw this,3844,2
Good thing we have the police here to protect us from obnoxious swimsuits,3845,2
Something that never made sense to me,3846,2
My dog is normally not very photogenic but hes always goofy,3847,7
Seven Tea Party Freshmen Congressmen spent more than $100000 in taxpayer money on personal cars,3848,9
Broken space bar = Broken heart,3849,2
Hackers Publish 1000+ Encrypted Emails From Oil Industry Giants,3850,8
Every time someone tells me I look good with some facial hair,3851,2
Happened to a friend of mine,3852,2
I already thought paying someone to hold a sign was ridiculous and then I see this,3853,2
What About Magnets,3854,0
Shadows,3855,0
The oldfashioned way,3856,2
I never should have let him drive the helicopter,3857,2
Im pretty liberal with my upvotes,3858,7
Cigarette lighter at 1000fps,3859,1
flying like a boss,3860,2
Whenever im down,3861,2
So my wife left 50 Shades of Grey on the table This is how I felt after reading the first paragraph,3862,7
What its like peeing after sex,3863,2
Vodka + Steam = Bad,3864,2
Bison Burger Sweet Potato Fries and a Scotch Ale,3865,5
Goldrush  SFM,3866,7
Was going through old pics from winter this was his first experience with snow,3867,2
Its upsetting that I cannot have an educated discussion with my father; word for word heard this fly out of his mouth today,3868,7
Culinary level Reddit,3869,7
Funny and sad,3870,2
Like winning the lottery,3871,2
Ill try to put this gingerly [FIXED] (only posting in funny bc op posted in funny),3872,2
No risks here,3873,1
They didnt understand why I was laughing,3874,2
When i see the youre gonna have a bad time text changed,3875,2
My local coffee shop found out they made the front page of Reddit,3876,2
Polydactyl and dwarf cat Lil Bub,3877,7
Redoing a substandard tattoo one of my favourite challenges as a tattooist,3878,2
My cat high on chickenflavoured morphine (after minor surgery) reenacted the psychedelic climax of 2001 A SPACE ODYSSEY (raww didnt seem to dig it so I thought you might),3879,7
Tasmanian cops decline to censor internet content,3880,2
I wonder what this could be about,3881,2
Like father like son,3882,2
Stop being gross,3883,5
This embarrassing picture is me on the first day of 5th grade What ridiculous styles did you think would never go out of style,3884,7
My first time using Fortune III [MS Paint],3885,2
As much as I liked Abed and Hilda I wish this character would come back,3886,7
It doesnt get more aww than this,3887,2
That pyro there deserves a medal to perseverance,3888,4
Magic,3889,6
whenever my 2 year old son gets his toy tools to help me fix something,3890,2
Shes not very unique shes not a kitten anymore she doesnt make funny faces but shes mine and I love her,3891,2
Steam Summer Sale Day 05 20120716,3892,7
Stupid or smart,3893,7
I dont always climb into things… but when I do I prefer rolled up carpets,3894,2
Browsing new,3895,2
Couldnt help but notice  The Darkness 2s JP Dumond and Badass Professor,3896,2
Futurama panel at Comic Con,3897,2
First World Problems about First World Problems,3898,2
My Favorite Subtle Soviet Russia Joke,3899,7
There isnt a skills gap Employers are just looking for unrealistic qualifications for low pay and not willing to do inhouse training,3900,7
every time i do laundry,3901,2
And the bonus was he stilled owed me a favor,3902,4
Everyones favorite mail mare Er person,3903,2
So I was in Albuquerque this morning and I decided to look for Mr Whites house since tonight is the season premiere,3904,2
My Girlfriend Said She Wanted To Try Anal,3905,2
This always made so much sense to me,3906,2
After all these years,3907,2
I see your pizza boxes and raise you the beer can alcove,3908,2
Goodbye Steam Badge,3909,2
The Dark Pie Rises,3910,7
YouTube knows whats up,3911,2
Rainbow Falls,3912,7
Ama request Edward Norton,3913,4
I had to write a check,3914,2
I do this just to give them a chance,3915,7
My wifes reaction when she shows me a funny Facebook post and I tell her I saw it on Reddit 3 weeks ago,3916,2
How many gigs is that,3917,2
Those abs,3918,2
PCGamingWiki cake day multigame giveaway,3919,7
Mexican drug cartels spreading influence Graphic,3920,7
That look,3921,2
Maybe we should let McDonalds run our economy,3922,2
Found this in my facebook feed Seems fairly Accurate,3923,7
my family dog finally learned how to use the stairs,3924,1
And A One And A Two,3925,2
Wheel of Death  Cirque Du Soleil  this is insane,3926,7
Any Drugs Or Alcohol,3927,8
When I see a username Ive given [+25] upvotes,3928,2
Soon,3929,4
Hospital gave me Laxatives last night,3930,7
Overly Attached Girlfriends Parents,3931,6
Im bald and today i tried hair powder I think the result is pretty amazing ,3932,2
Pics doesnt like my Star Wars boots Maybe you guys will,3933,2
