Title,doc,topic
TIL that Crocodiles Alligators and Flounders have no finite life span but continue to live forever unless affected by their environment,5649,1
Karate Cub,5650,3
He knows your pain [FB],5651,2
This made me laugh for way too long,5652,2
When the girl I was hitting on told me she is 16,5653,2
My dog Gretchen died at 16years Her brother Basil doesnt know where she went,5654,2
Every time a bell rings,5655,2
My indie game Super Lemonade Factory is free for redditors for 24 hours,5656,2
Heard a guy at Walmart tonight mention Reddit I said woot,5657,2
111 Victories since 1998,5658,6
Happy Husky,5659,7
It looks so boring,5660,2
Almost Politically Correct Redneck on ChickFilA,5661,2
Seriously,5662,8
Kojima being Kojima,5663,2
The first thing I saw when I logged on to Facebook,5664,2
The one gif that always make me smile for you on my cakeday,5665,2
I cant believe Penn State took the Joe Paterno Statue down,5666,2
Best Ben & Jerrys flavor,5667,2
Skull glass,5668,8
The Husband Store,5669,2
My grandmother whos had 4 strokes ran into this dashing young gent at a benefit for mental health,5670,2
WAKKA WAKKA WAKKA WAKKA,5671,3
You women are crazy,5672,1
My girlfriend asks me this everytimeEVERYTIME Please dont tell me Im the only one,5673,2
Somy mom just found a discipline report from me from 1st grade,5674,7
Gay dating app Grindr crashes as Olympic athletes arrive in East London,5675,4
The jackets for my friend groups highschool workout club doing it right,5676,2
My 4 year old calls this fruit bacon,5677,2
Its like a newborn Ewok,5678,6
Yeah about that,5679,7
Mario Tennis Open QR Codes for North America,5680,2
What do you guys think of this custommade tuxedo I had a tailor in Iran make me,5681,2
We broke Would you rather,5682,7
Swimming Instructor Seal,5683,4
Dammit HeMan,5684,0
My mum must have made every cake in this for me and my sisters over the years,5685,2
Saturday night lies,5686,7
This may actually happen to someone in the future,5687,2
TIL  In 526 AD there was a worldwide dust cloud that blocked out the sun for a FULL YEAR resulting in widespread famine and disease >80% of Scandinavia and parts of China starved to death 30% of Europe died in epidemics and empires fell No one knows the cause,5688,2
Christian Bale visits an Aurora Victim Carey Rottman,5689,4
Dual income no kids DINK,5690,6
Gorillas Seen Destroying and Dismantling Poachers Snares In Rwanda,5691,1
Annnnd now Im stuck up here,5692,9
Aurora shooting victim could face $2 million in medical bills because of lack of health insurance,5693,4
I am possibly by far the worst babysitter,5694,2
Iranian nuclear facilities hit by ACDC virus that turns off automated system operations turns on PCs at night playing Thunderstruck,5695,4
My fiancée doesnt understand why I refuse to replace the burnt out light bulb,5696,2
After years of having an office in the basement my department gets moved to the second floor and has windows This is them during the first storm,5697,2
I asked my friends son what kind of cookies he wanted me to make for his 5th birthday and he screamed STAR WARS Star Wars cookies it is,5698,2
NASA satellites see unprecedented Greenland ice sheet surface melt On July 8 about 40% of the ice sheet had undergone thawing at or near the surface; 4 days later it was 97%,5699,1
My evening project a Text to ERMAHGERD translator,5700,7
Awesome Medieval Tavern Prague,5701,6
The Missing Scene from The Dark Knight Rises,5702,7
Sir Patrick Stewart carrying the Olympic torch like a badass,5703,2
Diamond Back Terrapin,5704,7
My coworker put a racial stereotype to bed today,5705,2
Today marks the first time a Catholic church official will be sentenced for enabling clergysex abuse,5706,2
Sams Club stops advertising on Rush Limbaughs show,5707,7
NSA whistle blowers warn that the US government can use surveillance to ‘see into your life’,5708,1
After months of waiting the turtle eggs are starting to hatch,5709,2
Its my 5 year cake day Heres Maya not understanding personal space,5710,2
Source Filmmaker at its best,5711,2
Ads youll never see again,5712,2
This is not photoshopped,5713,2
Yard sale gold,5714,2
While on vacation my brother took this pic of this little guy on my foot,5715,2
Happened to my roommate this morning,5716,2
So I just played Snake with the YouTube buffering wheel What other easter eggs am I missing out on from popular sites,5717,4
Threeinone drug wipes the floor with TB A new drug combination is less toxic quicker and cheaper than existing treatments and seems to work against drugresistant TB strains,5718,7
Remember me Representative Jared Polis I helped stop SOPA and did an AMA Need your quick help,5719,2
Im 25 years old and starting college the end of August I was told I have to take a freshmen seminar in order to graduate,5720,2
Im putting this where more people will see it,5721,2
With this I would run EVERY DAY,5722,7
Catfro A cat in my afro That is all,5723,7
Do as the sign says,5724,2
Kermit supports you,5725,7
“Go to hell Senator McCain it’s time for you to take your final dirt nap” says head of North Arizona Tea Party,5726,2
To celebrate 7 years of being cancer free I went to a dubstep concert,5727,2
The Human Future [pic],5728,7
TIL that Ewan McGregor has a feud with Sir Sean Connery Because of Connery telling Scots how to vote while living as a tax exile in the Bahamas,5729,2
A friend runs a dog rescue in the MO area One of her newest rescues,5730,7
How I Feel as a Med Student When the Surgeon Asks Me to Hold an Instrument,5731,7
A Man Must Respond Accordingly,5732,6
O hi I see you are launching a Rocket today thats AWESOME,5733,2
Lick lick lick,5734,0
Mass Grave The Hardy Tree London,5735,1
Alex Kingston being beautiful,5736,8
So thats how its done,5737,1
Sea monster under the ice,5738,1
Dinnerbone announces sideways Log blocks in Twitter,5739,2
Kelp Forest,5740,9
Its her birthday today I think Im more excited about her party hat than she is,5741,2
TIL that Kodak invented the first digital camera then went bankrupt because they didnt convert to digital,5742,2
This many people showed up for the Packers shareholders meeting today,5743,2
A dutch guy once said this,5744,2
TIL Disney once planned to build an Astronomers Club,5745,1
Everyone says my stuffed animal looks like a dog,5746,7
Steak Steak and Potatoes,5747,5
Mondays are tough,5748,1
My friend was looking online for a cat to adopt and found this guy,5749,2
Official Map of Christopher Nolans Gotham City,5750,1
Sometimes I think that I might be a bit childish,5751,2
found this tshirt in the kids section of salvation army,5752,2
TIL that there is a body of water in space that is large enough to give every person on earth enough water to fill the planets oceans,5753,2
1000 rounds,5754,5
Colbert on Hell,5755,8
She seemed mildly confused about the whole bath experience,5756,2
Shes been asleep like this for 20 minutes,5757,2
Roommates suck,5758,0
College food reviews,5759,2
My greatest achievement in life,5760,2
Gaben always does us right,5761,2
Things Nobody Did To GLaDOS Infographic,5762,8
My cat is a smiling fool,5763,7
This is what happens when you blink,5764,2
YSK that if you sometimes get a very intense,5765,8
So my brother drew eyebrows on his dog,5766,7
Her first time experiencing snow,5767,2
Decoy keyboard,5768,3
All of my Muslim friends,5769,2
Today at work I briefly fell asleep on the toilet When the automatic flusher went off I was jolted awake thinking I was pantsless at my desk with a maelstrom raging beneath my bare ass What was your rudest awakening,5770,7
Forever Alone,5771,2
Made an Aperture EdgeLit Sign,5772,2
A hero visited my work today,5773,7
If you are quitting d3 you dont have to announce it here,5774,2
How I feel going to work after having played Skyrim all night,5775,7
No bottle opener Improvise,5776,5
I couldnt resist,5777,2
Im ready,5778,7
Links in a hurry,5779,2
For my cakeday I present our dog Scotty My friend companion and just a great dog for 13 good years,5780,7
UN Commission Calls for Legalizing Prostitution Worldwide,5781,1
I bought Uncle Boogie a pool so he could cool off I guess I overestimated his enthusiasm for water,5782,2
Its time to stop I want to play,5783,2
New use for 3D glasses,5784,2
I dont think Id ever be able to have sex again,5785,2
Its too exhausting to use my turn signal all the time If I put this on my car I dont have to use it right,5786,2
Doctors strike,5787,8
I seriously feel alone sometimes on Reddit cause of this,5788,2
My daughter imitating a Coca Cola can,5789,0
my favorite Marilyn picture,5790,2
To those who didnt buy Rail Works 3 during the Steam Summer sale,5791,2
Why I use IMDB,5792,2
Browsing New,5793,2
I present to you 65lbs of pure chicken during a storm,5794,6
Dead,5795,2
To all the people who singed the petition  you better buy it,5796,2
Just a mural my friend and I put in our new apartment,5797,2
What is something you wish you could tell the opposite sex,5798,2
as a canadian browsing reddit lately,5799,2
Today is my cake day I dont own a karma machine so I offer a baby quail instead,5800,2
Painful to watch 3way handshake,5801,0
hell to the yeah good buddy,5802,7
Its my first cake day Reddit Heres my cat enjoying the outdoors,5803,7
Good GuyGal Parents,5804,7
Best Car Dealer Name Ever,5805,2
The picture has been saved on my phone for months just waiting for the right moment,5806,2
Principle,5807,6
Almost pissed myself laughing at this,5808,2
Bernie Sanders Exposes the 26 Billionaires who are Buying the 2012 Election,5809,2
Corgis first bath,5810,2
My obese coworker received a heart transplant and is back now still eating fast food twice a day Are thereshould there be specific guidelines these people need to follow in order to receive lifesaving treatments like transplants when so many other people need them too,5811,2
Next question please,5812,2
Frozen Sperm Offer a Lifeline for Coral Scientists hope that building what is essentially a coral sperm bank will someday help restore damaged reefs,5813,7
Foodhipsters  Friend said its Reddit worthy,5814,2
Hermit Crab in a Glass Shell Says it all really,5815,2
Feels good man,5816,6
High Expectations Gramps,5817,4
My dads a dentist He overheard this at his office one day,5818,7
Baby monkey taking a bath,5819,7
This is what $32 will get you at your local whole foods market,5820,2
My bestie is fostering kitties and likes to put them in socks,5821,6
All you need is love,5822,2
UPDATE Our summer intern has gotten lazy what should I do,5823,2
Ill delete your app if you do this,5824,8
Well that escalated quickly,5825,4
Alyssa knows how to party,5826,2
Yo Dawg I heard you like bullets,5827,2
I think Wikipedia may be on to something,5828,2
Where is your god now,5829,1
My little cousin called me from Louisiana and told me I had to put this on Reddit,5830,2
My mom dropped this at church on sunday,5831,1
just happeneddammit,5832,8
If i fits,5833,6
Damn that man,5834,2
My best friend realized he lost his ID when we returned from vacation Faith in humanity restored,5835,2
How I feel as a redditor who isnt afraid of spiders,5836,7
My friend cosplaying as Mako,5837,7
Jerrod Carmichael lets a drunk rapper tell a joke during his set Hilarity ensues,5838,2
Obamney,5839,1
Jon Stewart defines marriage from the Bible  Destroys Boy Scouts and Chickfil A,5840,7
Photo restoration is one of my hobbies This picture was one of my favorites to work on,5841,7
Awesome Batman Trilogy Movie Art,5842,2
The second i get my hands on my friends guitar,5843,2
Why cant I just sip it like a normal drink,5844,2
Luau,5845,0
Little guy knew the jig was up when spotted tiptoeing away from the scene of the shredded beef jerky bag  ,5846,2
Excuse me while I go worship him,5847,7
Whats the scariest dream you ever had I mean one so chilling its stayed with you,5848,2
Look who I saw running around the Renascence Fair,5849,2
Hes not perfect but I made him and Im proud,5850,7
Once in a lifetime,5851,5
well it was bound to happen eventually i guess,5852,8
Conan OBrien Reviews Minecraft Hilarity Ensues,5853,6
Id probably be pretty annoyed too,5854,7
I have 1 day to come out of the closet to my family Has anyone else felt forced to come out before they were ready,5855,2
Good Guy Greg,5856,7
Russia just celebrated the 66th anniversary of victory in World War II a commemoration almost totally ignored in the west The Soviets destroyed 7580% of all German divisions and most of the Luftwaffe Russia lost at least 14 million soldiers and a similar number of civilians,5857,2
GF and I introduced my brother to LoL This was our thanks,5858,7
Ain´t that the truth[fixed],5859,5
Rage comic depicting what I overheard this morning regarding the news on Sally Ride,5860,2
My pack of gum was doublepacked,5861,0
Suddenly Swan,5862,7
Its very soft yes,5863,4
Old friends playing a game of Pai Sho,5864,2
Did I miss the blue heeler karma train Meet my originally named puppy Blue,5865,7
A mans story on starting to smoke at 46,5866,2
How I feel when the top comment is what I was going to say,5867,2
Redditors Wife Welcomes Her Man Home,5868,2
 Stay cool,5869,7
We cannot ignore the fact that our world is inherited We dont stand in isolation from a primitive and brutal past Were not so civilized that we have conquered the tyranny of our own vanities we stand not only on the shoulders of giants but on the corpses of slaves,5870,2
Bad Luck Brian,5871,2
The most ludicrous Batman scene ever (from the 60s),5872,2
A tour of my mansion,5873,7
How I feel as a 23 yo with my friends getting married,5874,2
My sister left a quarter and a penny on her car seat in the sun all day then sat on them,5875,7
My newly acquired killing machine,5876,0
Changing species is easy (fb),5877,0
Everyone You Have Ever Loved,5878,2
Tibbers <3 Volibear,5879,6
Silversun Pickups  Lazy Eye,5880,4
Economists GOP jobs bills wont actually create jobs,5881,7
Its really a lonesome feeling,5882,2
10 Guy Advice,5883,2
So  tired,5884,2
My teacher´s drawing didn´t get much credit in rpics maybe it will get a little more attention in here,5885,2
She really said this I let out a long sigh,5886,2
Kids love my new fragrance,5887,2
What do you think of my Portal theme,5888,2
Regarding the Ferris Wheel Scene With A Male Character,5889,7
I couldnt take it anymore my first blow up on facebook Christianity,5890,2
Dude smoking is bad for you health,5891,2
Upon returning to America after a month long trip in China,5892,2
SavageInside explains nicely what women men and everyone in general should know about each other,5893,2
Its my cake day Without further ado I present my cat,5894,7
Seriously Why,5895,8
What I think of any time a redditor mentions a girlfriend,5896,2
3Desque Stamping,5897,3
When my parents have company over,5898,4
[s] Just Jaedong enjoying SC2,5899,7
Seriously China get your priorities straight,5900,2
I wanna see this guy come back in Season 4,5901,2
This is a story all about how,5902,2
Nom Nom Nom,5903,3
Aint that the truth,5904,2
I dont always post to Reddit,5905,2
So I forged a throne,5906,7
I feel it,5907,4
Insult to injury,5908,5
4chan on Amelia Earhart,5909,5
A certain blue box is making an appearance on a very big day for me,5910,7
In response to the guy stuck on the roof,5911,2
The Doctor knows how to prioritise,5912,2
Desktop phone has a browser,5913,8
I still cant think of a better insult than this,5914,2
King Juan Carlos of Spain ousted from World Wildlife Fund presidency — a title he’d held since 1968 — after hunting elephants in Botswana  A photo of him with a rifle & a dead elephant caused outrage He was also criticized for an ostentatious lifestyle when 1 in 4 Spaniards are out of work,5915,2
Throwing Facebook a Curveball,5916,7
An interesting realization,5917,2
On his own Romney ad star took over $1 million in government loans,5918,2
When youre short,5919,2
TIL that unlike other professions in the USA members of the Clergy can optout from Social Security and 30% do Many who optout from paying into the system have been let back in to collect benefits when they retire,5920,2
Theres no such thing as a dead meme,5921,2
I keep thinking I will have fun,5922,2
Christian Bale is meeting with victims of the Aurora CO theater shooting,5923,4
Mako the fangirl,5924,4
Daniel Radcliffe as if i needed another reason to love him ) (Sorry if repost hopefully this is a first for some others like it was for me),5925,2
My smashing collection,5926,1
My father just buy a house near Broceliande forest (France) let me introduce you the tomb of Merlin (from the graals tales),5927,1
uhhhh,5928,8
Hannibal Buress on Jesus,5929,1
how I feel now I have some free time and my friends are working,5930,2
This is becoming increasingly true,5931,8
Glad to know they are still in circulation,5932,2
Rock Paper Scissors,5933,3
My close friend called in his family and his other friends and made an announcement that hes dropping out of high school to pursue proLoL gaming,5934,2
Romney vows that if you elect me President you are not going to see legalized medical marijuana I am going to fight it tooth and nail,5935,2
So its gonna be one of those mornings,5936,7
ChickfilA damage control FAIL,5937,6
Ron Pauls Audit The FED bill passes the House; 32798,5938,1
Dress Rehearsal of SNL skit The Californians,5939,1
Letter to ChickfilA from Boston mayor Thomas Menino,5940,6
My friend spend 3+ years working on this game by himself please help spread the word,5941,2
Your phone company is watching (TED Talk with Standing Ovations),5942,8
Reporter on acid covers the Westminster Dog Show,5943,2
Letter from the Mayor of Boston to the President of ChickfilA,5944,6
She finally trusts me enough to do this,5945,2
I built this last year Thought I would share,5946,2
911 caller blows NYPDs cover for safe house where detectives monitored Muslim Rutgers students,5947,7
TIL Russians take guns into space to protect themselves against bears if they land offcourse,5948,2
Samsung Apple,5949,2
Big head squirrel feeder,5950,7
I wanna see,5951,2
At my Mcdonalds we have a WalkThru,5952,8
Momma cat introducing her family to her friend dog,5953,7
Oh THATS what it sounds like,5954,2
Best Review For Mountain Lion So Far,5955,2
Windows 8 is a Gaming Catastrophe According to Newell,5956,2
3500 pound walrus practices his vocalizations,5957,7
Christian Bale also paid his respects at a memorial in Aurora today,5958,4
Dozens of Boy Scouts return Eagle Scout award and resign as a protest against the antigay law of Scouting,5959,7
World of Warcrafters Anonymous,5960,2
Ive seen a lot of people saying that we should have a version of the BoyGirl scouts that lets everyone in Well we do Its called 4H and it teaches kids science and other cool stuff,5961,2
Not what I expected,5962,1
My house was just renovated for the first time since it was built in 1959 My boyfriend did the whole thing himself [xpost from pics],5963,2
happened this morning the worst,5964,2
Our son is sick and were having financial problems as a result Got this in the mail today from a friend,5965,2
Askscience my coffee cup has me puzzled so I captured it on video and brought it to you Is there a name for this Why does it do this,5966,2
Custom collapsible Blood Bowl pitch I made for a friend for his birthday  Countless hours trial and error but here is the finished product Go to the imgur page for higher res and full descriptions Enjoy (Xpost from rWarhammer),5967,7
Just me in my reddit jersey and the Cup,5968,7
You may not think its funny but I cant stop laughing I found a $2100 3DTV bundle on Amazon for $0 with free shipping and bought it as a joke Ill have to change my username now because I just got this email,5969,2
Ice T responds to his sisterinlaws request to be a godparent,5970,0
Nick Offerman Megan Mullally and Alison Brie smoking weed in bed  [115],5971,8
How I feel about all the ChickFilA controversy,5972,4
Pure bliss,5973,6
Found these in a convenience store,5974,2
Have you seen this girl,5975,2
It turns out its not just Yahoo Answers,5976,7
Whenever I see Confession Bear this is what I expect,5977,2
Come sit down We need to talk,5978,2
To the guy who asked why you dont put personal information on the internet,5979,2
Ive always felt like theres a social taboo about asking this but Reddit what do you do and how much money do you make,5980,2
Absolutely stunning picture of a dragonfly in all its glorious detail,5981,7
My favorite quote of all time,5982,2
IAm Matt Barkley Quarterback of the USC Trojans AMA,5983,9
Will the real Abby Farle please stand up,5984,2
I Admit ItI Took The Last Banana,5985,7
I recently encountered this scumbag coworker,5986,2
Bad place to put a waste container,5987,2
So I repurposed this old TVthought I would share,5988,2
Woke up for Sunrise; Was Not Disappointed [xpost rpittsburgh],5989,8
Killer Whales play in yachts wake [MIC],5990,2
LPT Hang on to those silica packets for drying out your wet phone Works better than rice,5991,2
IAmA former Playboy model turned hardcore adult performer Victoria Rae Black aka TeamVRBAsk Me Everything,5992,7
So Fitz fell asleep after I got out of the shower Now I cant move,5993,2
Flawless equation,5994,6
Bought a beer aaanndd,5995,7
[update] My sisterinlaw showed up with my nephews very upset and asked me not to tell my brother shes here What should I do,5996,2
Marketing 101,5997,4
Archaeologists uncover Palaeolithic ceramic art Ceramics found on the coast of the Adriatic attest to a hitherto unknown artistic culture which flourished during the last Ice Age thousands of years before pottery was commonly used,5998,2
I grew a salad in three weeks in 1 square foot of space,5999,2
As I age the question remains,6000,2
Why people stopped watching History Channel,6001,4
Im the guy with the computer camp who was struggling and got such an amazing response back in February Our numbers have doubled this summer and today were announcing our initiative to bring more girls into coding Thanks for the good karma Reddit,6002,7
Antihomeless bus stop bench,6003,5
Every time,6004,2
TIL the sea monsters on maps were originally put there to indicate that it was uncharted,6005,1
Woke up to this today,6006,7
So a mama cat came to my house and gave birth to these bundles of joy,6007,7
Pigeon trying to eat bread HOLD IT DOWN WITH YOUR FOOT Whats something you wish you could tell animals but obviously cant,6008,2
The race for karma,6009,8
Some awesome life hacks that actually is useful,6010,2
Girlfriend asked me to wash the bed linens I bought new ones instead,6011,2
The view of the farm my grandmother grew up on from the farm my grandfather grew up on,6012,7
Its happened The Inevitable My kitten has discovered my mouse icon on my computer monitor Gaming is over,6013,2
Saw this sign on a door in London,6014,2
My contribution to the world,6015,2
This is what access to a 3D printer and an interest in videogames yields,6016,4
The Reddit way of looting,6017,2
I have started doing item cards for Day Z,6018,7
SKELETOR,6019,5
Enough Already,6020,2
My new hobby turning my friends cryptic Facebook statuses into poetry,6021,7
1976 Volvo Amazon  788 HP,6022,7
Forget Scarlett Johansson or Sarah Michelle Geller THIS is the body of a female super hero,6023,2
YSK How to estimate remaining daylight,6024,8
Tried to act like I was asleep last night and my OAG actually said this,6025,2
Chemistry 101,6026,4
Alison Brie smoking pot with Ron Swanson in bed Amazing,6027,8
How big really,6028,2
You wanna know how I got these scars,6029,2
Sister got her iPhone wet Her last hope,6030,2
If youre going to wear your pants that low at least wear boxers,6031,1
My favorite piece of sidewalk graffiti,6032,2
Since Dark Souls got a PC port via petition can we do the same for this,6033,6
This Nightblooming Sirius has been in my family for 20 years It was given the name Monster awhile back by my grandmother,6034,2
Art Deco Style Lion King,6035,4
Tea Party Leader Says Its Worth Throwing Five MILLION Legal Voters Off the Voting Rolls If It Means Preventing Twenty THOUSAND Potentially Illegal Voters From Voting,6036,2
Only a Sith deals in absolutes is an absolute What famous lines bug the hell out of you,6037,7
My wife is tracking my phone I can spoof my location What do,6038,8
Guy places rubber animals on the side of the road to see who would swerve out of their way to kill them 89% of the killers drove SUVs,6039,2
My boyfriend came home on Saturday with this cutie,6040,7
I guess Im not brushing my teeth this morning,6041,2
Shiny CD Falcon,6042,3
Quicker than AAA,6043,2
Why I use IMDB [fixed],6044,2
Totally makes sense,6045,7
My roommates went out of town I mentioned having company over Found these on their beds,6046,2
I can see Sigurd I can see,6047,2
My dad learned to surf today,6048,9
The reasons people drink what they do,6049,2
Today I saw a father calmly leading his son as if he were blind Why The child had had his head buried in a book What other examples of patience and good parenting have you seen recently,6050,2
The Dark Knight Trilogy Explained,6051,6
I cant let you do that Hal,6052,2
Ive always wondered why this guy is locked up,6053,2
I think we all know which one,6054,2
Chicken nuggets,6055,7
Proud to be an American,6056,2
Today is my birthday This is how they woke me up,6057,2
IAmA guy who married a blind girl AMA,6058,2
Im allergic to peanuts luckily I saw this warning,6059,7
So happy,6060,7
What is your biggest turnon and turnoff but dont say which is which,6061,2
If Liefeld directed Cap,6062,7
Snapped a pic of my coworker at the Rennaissance Fair in the rain didnt notice what I captured until later,6063,9
What is something you used to think was cool but now realized is not,6064,2
Grandmas TV went out and she didnt like the new one cause theres nowhere to set plants on top so they did this,6065,2
Everyone once and a while you can judge a book by its cover,6066,2
Foxs Dana Perino Cant Explain How Bush Tax Cuts Created Jobs During Bush Administration,6067,2
Then we told everyone that she ran away never to be found But we know the truth,6068,2
