Title,doc,topic
My mother spent her Sunday making pillows Asked me to tell her if I got any feedback on them,1796,2
Before and After,1797,0
Cat using me as a chair at work,1798,7
Fun with £50,1799,7
Batman Close enough,1800,2
From stray kittens to the cats that I love so so much My babies,1801,7
I wish the weather app icon would have the same effect the calendar app has by showing current info,1802,4
Look who I met today Excuse my weird face D,1803,7
One of the many responsibilities that come with being a Daedric champion,1804,2
Baby chimpanzee loved my beard,1805,7
Jackie Chan holding a baby panda,1806,7
When someone tells me to smile for a photo,1807,2
TIL after a student was suspended for wearing their tshirt Korn donated hundreds of shirts to be given out and police officers helped to do so,1808,2
Getting this off my chest,1809,1
I grew up in Colonial Williamsburg (a living museum depicting 18th century America)  AMA,1810,7
Sorry about the mess,1811,1
Classic MrBean,1812,6
The Dark Knight Rises  Featurette,1813,7
Kid Goes Insane At Karate Competition,1814,4
Walking home and I saw this guy hit the jackpot,1815,2
Reddit sometimes you amaze me After 48 hours of Megaman we raised a bit of money for a 3 year old with leukemia The Internet is awesome,1816,2
If Zuko became a musician this would be his debut album,1817,7
The Ultimate Sacrifice Yes Quite,1818,4
Bad to the bone,1819,2
This puddle kind of looks like Australia,1820,1
Little brother wrote me a thank you card I thought it was funny,1821,2
Learned this one first hand,1822,2
Handful of otter,1823,3
Life goals achieved,1824,1
Found this guy in the oceanI told him to calm down but he wouldnt listen,1825,2
After Andy Murray didnt win Wimbledon,1826,2
Just MC enjoying HomeStory Cup V,1827,7
The new SpiderMan movie,1828,2
A mural I painted for my moms daycare what do you think,1829,2
My dad didnt like my sisters swimsuit Problem solved,1830,2
Life forms survive space exposure,1831,2
Check out this new pokemon card I just got,1832,2
Whenever a Creationist asks Why are there still monkeys,1833,2
I lost 70 pounds entirely playing Dance Dance Revolution and have since gained 25 pounds of muscle and growing AMA (Xpost from rFitness),1834,2
My friends husky going for a swing,1835,2
South Korea to Reconsider Plan to Drop Evolution Examples From Textbooks,1836,4
How I feel when a girl Christian is against gay rights,1837,4
I flinch every time,1838,2
The only contest I ever won,1839,1
How I feel living in a house with 5 other dudes,1840,2
Me after 5+ hours in the sun,1841,7
WTF am I eating,1842,2
Saw a guy today at New London CT Sailfest who just BEGGED to be submitted to rgaming,1843,2
Found this guy in a phonebox in Edinburgh yesterday,1844,2
Insanity Wolf writes his life story,1845,2
Sent a picture of my first tattoo to my grandpahe sent this back,1846,2
I commissioned a very special pony,1847,1
Group hug,1848,2
Got kicked in rugby today,1849,9
My god hes been underwater this whole time,1850,2
Hot threesome,1851,7
Amazing runaway car save,1852,2
Book Art,1853,2
A subtle reminder in my chemistry classroom that I have no idea what Im doing,1854,7
I feel myself getting judged when ever I do this,1855,1
After a long day conquering Napoleon heads home,1856,7
No thanks Cadburys,1857,7
After lighting up my tower I looked down to see the shadows created this,1858,2
Christianity in a Nutshell,1859,6
Brand new pups,1860,2
Endless Spaces Futurama game event,1861,7
Every day at the local pool,1862,7
Photoshop master,1863,1
Teachers of Reddit describe the most interesting student youve ever had,1864,2
The Most Interesting AntiTheist In The World,1865,2
Breakfast on the beach,1866,7
Quasiracist Italian Boromir,1867,9
Ice Canyon,1868,1
Its Spideys day off,1869,7
Not cool SpongeBob Right on the table cloth,1870,4
My Dad and I built a deck,1871,2
Futurama Fry on working for a horrible boss for 3 years,1872,2
Since everybody around here likes drawing their teams I decided to do something a bit different,1873,2
I competed in my first sidewalk chalk competition yesterday couldnt have done it without Marios help,1874,2
My girlfriend is the lead aquarist for octopuses at a major aquarium Occasionally she gives behindthescenes tours to celebrities This was todays interaction,1875,9
How I imagine I sound when coming home late,1876,7
A little game I like to play,1877,2
Sure to get some down votes from Leafs fans,1878,4
An unexpected gem in qkme_transcriber bots AMA,1879,9
I think the P51 Mustang is the most beautiful war plane ever made,1880,2
Oblivious Suburban Mom,1881,1
This is the hero reddit needs,1882,7
Calibrations ^_^,1883,6
Thank you Take ,1884,2
What is a subreddit you think has potential but nobody visits,1885,2
It took three days for my package to arrive from Amazoncom using two day shipping,1886,2
I think Ive taken postraid taunting too far,1887,2
TIL that when you drop a 50 pound ball of silly putty off a building it shatters upon impact with the ground,1888,7
I accidentally sent my potential future boss a picture of Nicolas Cage rather than my CV,1889,2
Honesty  I like that in a company,1890,2
Foreigner problems  Imgur,1891,2
Tried out the Gordon Ramsay Crispy Salmon Recipe,1892,3
Found this guy in a Monopoly documentary,1893,2
Is this a new Google feature Seemed to work for various historical figures,1894,7
Whats the creepiest nonparanormal thing thats happened to you,1895,1
Satellite captures day and night,1896,7
IAmA spontaneous solo traveller  Ill take your next flight out AMA,1897,7
Blur  Coffee And TV,1898,2
I need to get this off of my back,1899,2
Dear LoL streaming community having problems with DDoS,1900,1
Just Noticed the Title of the Newspaper in The Shawshank Redemption,1901,9
Heres some wallpapers I made based off of the greatest book covers of all time (xpost from rbooks),1902,2
Mirror fail,1903,7
Never forget Katara was f**king hardcore,1904,2
TIL Back in 1997 astronaut John Grunsfeld pulled off one of the great radio gags of all time by calling in to National Public Radio’s ‘Car Talk’ program while orbiting the Earth aboard Atlantis in STS81,1905,2
What a bargain,1906,9
One of the wonderful Thank You gifts Valve sent me when they heard I will be leaving my business of six years,1907,2
A fact of French fries,1908,2
Little guy didnt leave my side all night,1909,2
Flashbangs,1910,1
Heres some wallpapers I made based off of the greatest book covers of all time,1911,2
How it feels being a Heavy,1912,6
Im not the first and I wont be the last but damn this feels good,1913,2
Gay Marriage == Polygamy == Human Extinction The Slippery Slope Argument Unraveled,1914,4
Explanation for exploding barrels in video games  webcomic,1915,2
Famous paintings but improved with cats,1916,7
My dog just lays there and takes his bath,1917,7
I realised this today,1918,9
Meanwhile in Ireland,1919,9
Whenever a customer complains about something being out of stock,1920,1
TIL there are only 2 Nascar drivers to graduate from college,1921,2
Not sure if Fry or just REALLY drunk¿,1922,2
Fatherson bonding,1923,0
Im a Christian but I have to shake my head when I hear other Christians do this,1924,2
Overly Attached Girlfriend This is going to be a long road trip,1925,2
I have no idea what he is talking about [FB],1926,7
Not so wise men,1927,4
Keep this up and you are entering a world of pain,1928,2
The Toddlers and Tiaras show in ten years,1929,2
DAE find themselves speaking differently depending on which crowd of friends theyre hanging out with,1930,2
Got kicked in rugby today,1931,9
8yearold girl shreds a guitar to pieces,1932,2
All hail HypnoCat,1933,9
So I left my bottle of gummy vitamins in my car,1934,7
I will destroy everything you hold dear,1935,1
12 years later and i still love the little guy,1936,2
Just 9 months ago I was the biggest conservative fundie in the world I had this hanging up in my room You guys helped change my entire thinking process Thanks,1937,2
To the Christian church behind my house,1938,2
Lookin good Spidey,1939,1
The 99% needs a raise,1940,2
tidy sleeper,1941,9
My friend and I needed cheering up so we went to visit the kittens at the pet store,1942,2
Happy Birthday Boy,1943,7
Smart Guy TaKe,1944,2
Ladies and Gentlemen the Geo Metro Limo,1945,5
i cant believe that these two have the same voice,1946,2
I was just relieved it wasnt a Jehovahs witness,1947,7
Childhood Trauma Doing it right,1948,2
Still my favorite part of any game,1949,2
This is Lemon she is about 8 weeks old now D,1950,2
Im sure its been suggested before but why dont we have something like this for voice commands,1951,2
[s] Nerchio takes out YongHwa 41 in a quick Bo7 at Homestory Cup V,1952,7
This is my friend in Thailand doing volunteer work Meet his mate Farkram who he spends each day with (I hate him),1953,7
Oh the irony,1954,2
Finally After 15 years,1955,2
Remember this when you are about to get into an argument with Christians,1956,2
Troll doctor said this during my friends circumcision,1957,2
Stuck in the middle,1958,2
Four thousand years of history in a single picture,1959,2
Weapon XXX,1960,5
Friends Portal themed birthday cake,1961,2
The realistic transformation of Zukos physique over the course of the series,1962,1
Everyday we grow stronger and bolder,1963,2
Easy monsterproof minecart gate,1964,0
i could not stop laughing at this,1965,2
Pele and British captain Bobby Moore trade jerseys in 1970 as a sign of mutual respect during a World Cup that had been marred by racism,1966,2
Fruits are so whiny,1967,0
I really dont want to live on this planet anymore,1968,2
As an Aussie working in England this is the most offensive thing anyone has ever given me,1969,2
Since Pocket Edition doesnt have a chest this is what I have to do,1970,2
Why i love coming home from college [FIXED],1971,7
I Hope You Find Awkward People Adorable,1972,7
Got this shirt in the mail yesterday,1973,2
My dads truck Built in 3 months in our garage from the frame up after he got diagnosed with Parkinsons disease,1974,2
My New Scammer Formula,1975,2
greatest 10 seconds of my life,1976,2
John Turturro hilariously explains why sex scenes are so difficult to shoot [xpost from rmovies],1977,4
After a couple of days as a redditor,1978,7
Two chemists walk into a bar,1979,2
Looks like my niece will be sleeping soundly for this trip,1980,7
Worst TB outbreak in 20 years kept secret Florida government covered up TB outbreak while rushing to close hospitals as a part of Gov Rick Scotts cost cutting campaign,1981,2
$21122304 in cash The Oatmeal raised for charity,1982,2
My brothers and I decided to wear the amazing 100% polyester hamburger shirts from Walmart around town today People would stop and stare like we were celebrities,1983,2
KEN BLOCKS GYMKHANA FIVE,1984,7
Watched The Lord of the Rings on Friday with a live orchestra playing the soundtrack It was amazing,1985,2
Yahoo submitted an article about Olympians with Tattoos Poor Nicholas RobinsonBaker,1986,1
Ghandis letter to Adolf Hitler (1939),1987,6
Greenwald The most revealing fact of the Obama presidency is the lack of a single prosecution of Wall Street execs for the massive fraud that caused the 2008 crisis As long as we maintain impunity,1988,2
Okay now Im confused,1989,2
Valve announces Steam Greenlight,1990,2
My First Computer,1991,2
Neil deGrasse Tyson Im not worried about kids Im worried about grownups,1992,7
Samsung Galaxy Tab doesnt copy Apple designs UK court rules,1993,2
Friend on a dare had to get what ever tattoo was in a blindpackage from 1979 I think its pretty cool (Xpost from rpics),1994,2
Lamar Smith Looking To Sneak Through SOPA In Bits & Pieces Starting With Expanding Hollywoods Global Police Force,1995,2
9 years ago a man convinced English bookmakers to give him 661 odds on Roger Federer winning Wimbledon 7 times The man died but the charity he gave the ticket to has cashed it in for almost $158000,1996,2
Everything looks better with googly eyes,1997,4
Honestly the worst high school mascot ever,1998,2
Why did you order food,1999,2
I saw a mirror in the selfcheckout lane at Walmart today this was all I could think of,2000,2
Dozens of women who attended a high school run by the Legion of Christ have urged the Vatican to close the program saying the psychological abuse they endured trying to live like teenage nuns led to multiple cases of anorexia stressinduced migraines depression & suicidal thoughts,2001,2
So this is what $21122304 looks like,2002,2
Kyoto bamboo forest,2003,9
TIL That the single largest infiltration of the United States government in history was up to 5000 covert agents and was carried out by the Church of Scientology,2004,4
Traffic slowed down to walking speed along the Pacific Coast Highway yesterday but when we found out why we werent even mad,2005,2
3 Men Stealing Meat From A Pack Of 15 Feeding Lions  Absolutely Insane,2006,7
Engineers at UCLA have developed a camera that can take 367 million frames per second with a shutter speed of 27 picoseconds among other applications that the device will massively improve our ability to diagnose earlystage and premetastatic cancer,2007,7
Crimes in Canada are getting out of hand,2008,7
My strategy whenever the CEO does a walkthrough of the office,2009,2
Just my neighbor & his cat reading,2010,7
Why dont they sell variety packs of soft drinks (mixed carton of Coke Sprite Mello Yello Barqs etc) the same way they sell variety packs of snack chips and breakfast cereals,2011,3
Perfectly timed spiderman suit picture (xposted from rperfecttiming),2012,6
Close look at a lion,2013,2
Wife sent me a text Theres a deer stuck in our fence I asked for a pic,2014,2
My daughter doesnt seem to appreciate Spidermans fast driving,2015,2
Amazing Game Of Thrones Impressions,2016,2
Dark Knight Archetypes,2017,6
Physics according to Jenga,2018,4
Wholl buy him Adult Sized Krabby Patties now,2019,9
Playing Dead Space 2 and this just made me scream like a girl,2020,2
Meet Rufio my BatStache rescue kitty,2021,5
On the way to goodwill to find some n64 carts when I saw this new store and got too excited,2022,2
My dog playing with bubbles,2023,7
Classy,2024,0
KFC,2025,6
The Inconvenience Store,2026,2
This is a Friesian one of the most badass horses ever,2027,2
TIL a 2300 year old man was found preserved so well they could tell he used gel for his Mohawk,2028,2
Found a shiny Pidgey in the wild today,2029,2
Just a slightly above average day at work,2030,7
Rick Perry To 65 Million Texans With No HealthcareYoure On Your Own  Forbes,2031,2
The worst week of the year,2032,2
I got mine in the mail today,2033,2
Wash it,2034,9
so my room mate saw a snake,2035,2
Disappointing Diablo 3,2036,7
On faith that is absolute and unwavering,2037,1
LPT Unscrewing a screw or connecting an electronic connector that you cant see,2038,2
Every morning when I log on to reddit,2039,2
So what if Cerberus had chosen a male scientist to infiltrate the Prothean Archive on Mars,2040,5
Over Obsessive Girlfriend Level TShirt,2041,2
On a dating website when suddenly BAM,2042,6
dumbledore gives the best advice,2043,2
Ever do anything that unintentionally went viral at work Heres what I did,2044,2
facebook and twitter are so last century,2045,7
Really 69 Points,2046,2
Took my cousins to Chuck E Cheeses I had no idea these existed,2047,7
SIXSix gears,2048,1
This popped into my newsfeed just wanted to share,2049,2
Rated M for,2050,3
Coffee maker for our building broke this morning Think I found the issue,2051,2
Saw this at a clothing store,2052,2
There are starving people in the streets but this church has come up with the best way to spend their money,2053,2
Driving through the Northern Irish countryside when suddenly a goat in a high visibility vest,2054,7
TIL that seeing eye dogs are train to poop on command so that their vision impaired owners can easily clean up after them,2055,4
I tweeted calling Dogfighting rapper Calicoe a scumbag This was the response i received,2056,2
Marxism no longer corresponds to reality,2057,6
Hey what a cuteoh deer god,2058,1
TIL in England there is a Chap Olympiad where contestants compete in events like Umbrella Joustin and Shouting at Foreigners,2059,1
At Dairy Queen my mom asked me what a wipecan was,2060,8
A pastor said something irritating to me today,2061,2
Why I Hate Eating Pudding,2062,7
Sand in Minecraft,2063,6
Im sorry,2064,2
Fingers personality,2065,7
Meter maids are ruthless justice is served,2066,1
Whats the dumbest thing you have ever said on a date,2067,2
Its taken Game Freak years but finally,2068,2
I accidentally did yoga in here and they asked me to leave,2069,2
On the way to Woodstock 1969 (Xpost from rOldSchoolCool),2070,2
Howhow did you know,2071,2
If only Bill Clinton knew this,2072,2
Canadas PM Stephen Harper faces revolt by scientists,2073,4
well they are,2074,4
28 Year old male here,2075,2
Karl Pilkington on the hardships of being a stick insect,2076,4
Reddit it took me 3 months and over 500 girls and heres the end result,2077,7
This can be anything from two chairs to a sheltered bed to a changing room,2078,2
Drunk mom at it again,2079,2
Today at Taco Bell,2080,4
Our Little Leopard,2081,2
Toph youve changed,2082,4
Look whos passed out on the couch,2083,2
I have a Flight of the Conchords sticker on my car Someone left this on my windshield,2084,7
The truth about legalizing gay marriage (xpost from rpics),2085,4
Aurora Borealis over Iceland,2086,2
Stop the bleeding,2087,5
He knows a good deal when he sees one,2088,2
I found a shiny Pidgey in the wild today,2089,2
Bacon Elvis,2090,5
The Internet has ruined me,2091,1
Ayyy,2092,0
Tire shop advertising level Korean,2093,2
The Corrections Corporation of America the largest private prison corporation has proposed to 48 state governors that it will operate their prison systems for 20 years with a guaranteed 90 percent occupancy rate A majority of all those incarcerated have committed nonviolent offenses,2094,9
TIL that before antivenom the black mamba had a 100% mortality rate,2095,1
what a noble gesture google,2096,4
Cuteness overload,2097,6
Off to the washing machine,2098,0
Fallout 3 Logic,2099,2
I never dance because I look like this,2100,2
After about 20 seconds into my first visit,2101,2
Found the entrance to the Water Temple while hiking the Grand Canyon,2102,1
What most Good Girl Gina pictures boil down to,2103,7
I need to break this habit,2104,2
You cant tell ME what to think fascists,2105,2
Today a very very bad thing happened,2106,2
Do not pity the dead Harry,2107,1
I do chalk memes at my bar job when I am bored,2108,2
TIL there was an episode of Whose Line is it Anyways where Drew Cary handed out $100 bills to the performers instead of points,2109,1
Just a regular day at work,2110,7
Pokmemes Shut Up and Reopen This Park,2111,5
Which did Moses REALLY see,2112,2
Why cant i entertain people,2113,2
Youtube on a new game show,2114,2
Tech Demo of what a Crash Bandicoot remake would look like,2115,7
Erica Masters was sleeping in her bed when Columbia County Code Compliance Officer Jimmy Vowell came to serve a violation notice for her grass being too long    He let himself in and actually came through the house and into my bedroom And yelled at me to wake me up,2116,2
Thalmor inspired coat this is the second installment of my newly discovered love of sewing ) took about three weeks and with lots of unpicking and resewing but got there eventually,2117,2
Hey Reddit Im a single father that has his kids every evening for dinner and I need cheapeasy things to make that everyone can eat,2118,2
The school system in vault 101 is quite advanced,2119,4
The Senate is about to take up CISPA FFTF has lined up meetings w Senators offices in TX TN MD WI IA & MT starting tomorrow and we need some Redditors to attend taking a stand for online privacy Can you,2120,2
First time on rpokemon(FIXED),2121,2
Paper Mache Dragon Whoa,2122,3
My sister and I with our great grandpa on his 101st birthday Forever young,2123,2
My mother told me she threw away all my legos,2124,2
Fallout 3 logic,2125,2
I am John Ventimiglia You may know me as Artie Bucco from The Sopranos Im currently starring in a new film called Ponies AMA,2126,2
What questions have you been afraid to ask because of social reprecussions Ill start,2127,2
Made this when watching the history channel,2128,4
Narcissism at its best,2129,2
Uncle Iroh would be proud,2130,2
For some reason The worst part is that not one of the contestants got it,2131,2
Lady friend and I disagree on some fundamental ideas It was good while it lasted,2132,7
This lady came into a tattoo parlor in my town today to get pierced She is 88 years old,2133,2
I see your worst high school mascot and I raise you the worst college mascot,2134,2
Just popped out to adjust my tie,2135,2
spys creed 3,2136,7
How I feel when someone says Im unattractive,2137,2
Historically Hardcore,2138,6
fatherly morpheus,2139,9
Why Sejuani is viable,2140,8
Hey guys Did you know there are things called shiny pokemon,2141,2
Rising plastic menace choking sealife The amount of plastic pollution in the Pacific Ocean has reached alarming levels drastically impacting seabird populations according to a new study,2142,4
TIL the coroners report revealed Whitney Houston wore full dentures probably as a direct result of her drug use,2143,1
Im not a math person,2144,2
Balloonicorn owners will know that Balloonicorns horn is blown up separately from the rest of him Today I realized why that is If you deflate the horn theres room on his head for HATS,2145,7
Seattle Zombie Walk 2012,2146,2
OP Delivers The Oatmeal Posts Picture of $21122304 in Cash,2147,2
Why I love Oregon,2148,7
To be fair she did ask for it,2149,2
different view of Spongebob,2150,7
Firing in 3 2 1,2151,2
twins,2152,5
Satan is helping now,2153,2
So it seems the words ring true even in the Seven Kingdoms,2154,7
Whenever I hear that atheists should shut up I look at this picture,2155,2
When I wake up to the smell of fresh baked cookies,2156,9
One of best pictures on the internet,2157,2
Story of my extra life,2158,2
Found this while browsing random pictures on imgur,2159,2
Adrian Petersons mugshot released,2160,3
Dean Hall creator of DayZ posted something in the DayZ forums todayI think youll like it,2161,7
Do flies and other seemingly hyperfast insects perceive time differently than humans,2162,2
Whenever I see a post when people are requesting karma or suggesting you upvote their post,2163,2
TIL Furbies didnt really learn English,2164,2
I just found an addition to my facebook timeline that drunk me added 7 months ago,2165,2
Pareidolia in League of Legends bot lane it watches me,2166,9
Redditors Wife,2167,2
Good Guy Scientific Community,2168,7
So this happened to me last night just ruined my whole summer,2169,7
Crashed today but bike and I are OK,2170,7
Damn,2171,2
Obama to call for Bush tax cut extensions for those making less than $250000  CNNcom,2172,2
The Creator of the universe cant do basic maths,2173,4
Never build more than one compass or clock  they work in the stats screen,2174,7
Horses in Iceland,2175,1
Obamacare PointByPoint  Part 2,2176,2
The Library,2177,7
Episode The Show Stoppers in a nutshell,2178,1
Kickstarter rejected my smartphone gaming rig What do you guys think (info in the comments),2179,2
Always felt for this guy,2180,2
Call me maybe came on the radio and I though of this,2181,2
Dont judge too quickly,2182,2
Riot should consider adding the visible amount of rating you gained or lost from previous games,2183,6
This weekend I sat on the Iron Throne,2184,7
People who doubt science make me want to bash my head in,2185,2
You dont have to wear make up to be beautiful,2186,2
Every time I see a 5 Hour Energy commercial,2187,2
Rocket I commend you,2188,5
First the crayons now glitter,2189,2
Just my puppy hopping like a wittle bunny,2190,6
I still think like this do you,2191,2
I recently realized that many who are born blind do not just see darkness  they simply dont see anything at all What somewhat obvious fact did you not realize until later in life only to have it blow your mind,2192,2
7 Americans (including US cops) at Colombian drug lords party,2193,2
Ill be watching you,2194,2
Twins,2195,5
well i guess its not so bad then,2196,4
He has a point,2197,4
Hey Islam,2198,7
Tenzin of the Hill,2199,5
Whenever Im moving house,2200,2
Walked Outside To A Grizzly Discovery,2201,7
Why,2202,0
ERMAHGERD,2203,7
RIP Mermaid Man 19172012 (SpongBob SquarePants),2204,6
My dads faith in religion almost cost me my life when I was just 3 weeks old,2205,2
DAE have dreams where you fall love with a girl you know and afterwards you find yourself emotionally attached to her,2206,2
Oh okNOW it makes perfect sense,2207,2
This always bothered me,2208,2
Laughed more than I should have,2209,2
I just dont,2210,2
German government slammed over controversial data law that allows government offices to sell peoples private information to marketing companies,2211,6
What I would do with xray vision,2212,7
This heart,2213,2
Futurama Fry,2214,7
I thought I was a Fallout fan but this guy takes the cake,2215,2
Realizing my friend has been ignoring me for the past 3 weeks,2216,2
TIL that Ancient Greek was the official language of Greece until 1976,2217,1
Nutella nuff said,2218,2
A friend working in China [FB],2219,2
My sister is doing a study abroad in Europe This is Hallstatt Germany I am so jealous,2220,4
Happy birthday dear,2221,2
TIL an empty spacesuit was tossed out of the ISS and turned into the funniest satellite ever,2222,2
When someone posts a good GIF I havent seen before,2223,2
How tough am I HOW TOUGH AM I,2224,1
But I was still lonely,2225,2
He might have been a little offended,2226,1
Just doing mah job,2227,4
Perfect red line in a Hungarian forest marking the high point of a toxic aluminum sludge spill,2228,4
