Title,doc,topic
Tens of thousands of Hong Kongers demanded democracy today,0,2
US trying to prosecute UK citizen for copyright crime that took place on UK soil Sign Wikipedia founder Jimmy Waless petition to stop his extradition to the US (184000200000),1,2
Apples patent absurdity exposed at last US appeal court judge Richard Posner has finally said the unsayable that Apples and other tech firms patent battles are a ridiculous abuse of intellectual property law,2,4
More flashmobs like this,3,2
Vegetable garden VS front lawn,4,0
Australia introduces controversial carbon tax The law forces the countrys 500 worstpolluting firms to pay a levy for every tonne of greenhouse gases they produce,5,2
So I was having dinner last night with Stan Lee and Patrick Stewart,6,2
Oatmeal v FunnyJunk Update Charles Carreon files restraining order to keep donated funds from being distributed to charities,7,2
One of my favorite pictures from a train,8,2
TIL 400k balls saved LA reservoir from being health hazard,9,1
Meanest prank in history,10,4
In order to do the Kamehameha wave,11,9
TIL that the Soviets landed a spacecraft on Venus and took pictures of the surface4 times,12,2
google imaged Canada Day this is what turned up  now terrified of Canada and their moose overlord,13,2
I think Im going to make it a habit to photoshop random pictures from raww,14,2
Here is the full image Cropping this to make them seems more hateful is stupid,15,7
She Gets Me,16,1
McConnell Cant Answer How GOP Will Insure Americans After Repealing ObamaCare That Is Not The Issue,17,8
I was in the mood for pizza last night but wanted to try something new Introducing pizza cupcakes,18,2
Oh American Dad,19,2
China hires tens of thousands of North Korea guest workers Because of sanctions North Korea is unable to export weapons So it is using its people to raise money Most of their earnings will go directly to the North Korean regime,20,2
My Grandpa (WW2 Scottish Veteran) never talks about the war Today he gave this to me and said the man I took it from,21,2
The Death Star made from a ping pong ball This is insane,22,7
Alfred Hitchcock for photographer JeanLoup Sieff [1962],23,0
My friend found his cats (brother and sister) ballroom dancing in his drive way,24,7
And yet somehow the world is still spinning,25,2
reddit emergency,26,7
I hope they have insurance,27,7
Ever wondered why is x the unknown,28,1
Overly Attached Boyfriend,29,6
Slow Shutter Firework,30,6
Break in the Clouds,31,4
So this kid I used to go to camp with took a kayak out to the middle of a lake to take a picture,32,7
Parents of Reddit what is the creepiestmost frightening thing one of your kids has said to you,33,2
Didnt want to spend this fine day inside playing video games,34,2
So my brother and I have been working on a New Yorkesque city in Minecraft [WIP],35,2
At last A ticket I can support,36,2
The chair Abraham Lincoln was shot in,37,2
Its Canada Day Time to bust out our national board game,38,2
I didnt want to waste the cup,39,2
Round Table Pizza targeting the right audience,40,2
Recording airplane propellers creates this effect,41,2
This Week We Kill ACTA – Or Get Locked Down In Monopolies For Decades,42,7
Spanish team and their children on the field celebrating Spains win over Italy in Euro 2012 finals,43,2
I seethe with jealousy every time I go to these peoples house,44,2
Lamborghini Ankonian concept looks like a stealth fighter you can drive,45,1
Someone suggested a trex champ,46,2
So glad my 3 year old was with me last night,47,2
TIL after winning 4 gold medals at the 1936 Olympics in Berlin AfricanAmerican track star Jesse Owens was not invited to the White House or recognized in any way by President Franklin D Roosevelt Instead it was Adolf Hitler who gave Owens a special commemorative gift,48,2
My local comic shop has a great promotion on now,49,2
Saw this guy at a bar in NYC,50,2
Red handed thieving muffin mix milk,51,1
A Kindergarten Building Covered In Rainbows,52,7
An Egg Guide,53,4
Old man from the 90s on todays gaming,54,6
The hell are you looking at,55,2
A True windows 95 classic,56,8
George Carlin They dont want a population capable of critical thinking,57,2
Friend swallowed a bottle cap,58,7
So I found my second grade journal today,59,7
A typical day on Omegle,60,7
You can easily judge the character of a man by their comments on a facebook photo,61,2
God vs Santa Claus,62,1
One of my friends is running an online shop all prices are stated in £ (pound),63,2
Todays Phones,64,6
Legends grow over time of course But there are still some who swear the duel lasted for hours,65,2
Made this fourstorey cabin for our cats,66,2
Zach Weiner being a genius,67,5
worst comedian ever,68,2
Crashed on my friends couch last night  woke up to this,69,7
This is the baby squirrel my boyfriend and I rescued and raised meet Pip,70,7
Yarn bombing in Germany,71,2
What Katie Holmes is Saving Suri From Scientologys Interrogation of Children   the frightening prospect that faces all Scientology kids beginning at 6 years old a form of interrogation known as sec checking,72,4
Minecraft Xbox360 Rage,73,6
How us Canadians give high5s today,74,2
So this exists,75,2
Couldnt Have Timed This Shot Better,76,2
A review of a cemetery,77,7
Thought Id help out in the cafeteria at my uni,78,2
Your move forever aloners,79,2
Epic aww (xpost from rgifs),80,6
I bet this is why The Doctor chose a bow tie,81,2
Dont Buy The GOP Narrative That Obamacare Is A Tax On Middle ClassIts A Lie Designed To Mislead,82,2
How the hell did﻿ you know im 14,83,2
This is the hell in which I live,84,2
Declassified FBI and CIA docs confirm Israel stole US uranium to build nukes in 1950s,85,6
Oh no,86,2
Always unhappy to see this guy And the feeling is apparently mutual,87,2
Every single CoD sniping montage ever,88,2
And I live in AMERICA,89,1
Tattoo artists of Reddit what is the worst mistake you have made while tattooing a client,90,2
How I feel when I have more comments than upvotes,91,4
I cant be the only one,92,2
Huge Bubbles,93,4
Today we sent socks and love notes into North Korea by balloon,94,2
whenever a title says be gentle,95,2
A good representation of what a lot of guys do when theyre bored laying in bed (sfw),96,7
LPT When you are at the pool or beach set your flipflops facedown Then they wont be scalding hot from the sun when youre ready to leave,97,7
You suck,98,0
Several years of playing Pokemon has led me to this question,99,2
Silicon HeavenHuman Heaven,100,4
Thanks subtitles that almost went over my head,101,2
I cant be the only guy with this problem,102,2
I woke up to see this awesome cake today for my birthday,103,2
I cant be,104,2
Finally my old soda cans are starting to become relevant Thatll show my wife,105,2
My thoughts today,106,2
Dear Valve with 80+ Steam friends this would be much appreciated,107,2
To the last breath,108,7
My wife cant winkclose one eye This is her using an SLR camera,109,2
I am 22 yrs old Today I sat through my first church service ever,110,2
Classy Instagramer,111,0
Finally a salad Ill finish eating,112,2
Dear god what have you DONE,113,1
Friend of mine drew this for today Happy Canada Day from Quebec everyone,114,7
Tweet Of The Year,115,7
Another great Ocarina of Time pick up line,116,2
I told my friend I hated villagers I later found this built outside my house,117,7
On prayer,118,6
And the waters ran red with blood,119,4
The Sims 2,120,2
I cant be the only one (Most Interesting Man),121,2
3rd World Skeptical Child about rain,122,4
Benefits of living in Europe,123,2
Great Quote,124,2
I went to my first protest  I met these guys,125,7
A word of advice,126,2
I think this applies to many of us here,127,2
Creeper Defense,128,6
Epic awwww right there,129,6
My mom didnt notice anything odd about this blanket she bought,130,2
My baby sister wouldnt let me leave for university without the dog she got me since I cant take my real one,131,2
TIL that Charlie Sheen Emilio Estevez Sean Penn Chris Penn Chad Lowe and Rob Lowe all went to high school together and made short films together,132,2
View from bathroom in Italy,133,4
Inaccessible Dispenser,134,6
Phones today,135,2
Im not sure what to make of this,136,2
He still hasnt let it go,137,2
His nose looks like an ink stain but gosh hes cute,138,2
So Im eating at Cheesecake Factory with the Mrs and I cant shake the feeling that were being watchedby a bunch of evil eyes,139,2
Im counting on the Doctor being right about this(London 2012),140,2
Almost finished with my husbands coming home present,141,7
TIL that in most Nordic countries there are laws called Every mans rights which state that it is legal to trespass,142,2
I turned my friends house into Reddit for his birthday How did I do,143,2
If a single woman with no next of kin dies during childbirth and the infant is thereafter a ward of the state who names the child Is a name generated at random by some bureaucrat,144,4
Meet the Pyro 2 Behind the Mask,145,2
Like mother like son,146,2
Larry David on Christians and lobster,147,2
Look who I found at AX,148,2
This picture melts my heart every time,149,2
I like the way she thinks [FB],150,2
Me facing my immense fear of heights 103 floors up on the Willis tower in Chicago I did it reddit  I DID IITTTT,151,7
Portalbending,152,1
Awww Yeah Flowers,153,7
The most hated man of my childhood,154,2
Credit to LevelSkullBoss,155,0
Family guy1 Christians 0,156,2
POW Right in the kisser [FB],157,1
Brad Pitt gives tribute to Quentin Tarantino,158,4
Making a meme,159,2
Perfect day for a swim,160,7
TIL that there is a mutated gene possessed by about half of the population that prevents a person from tasting the bittertasting chemical used to grow brusselsprouts If a person does not possess this gene they can taste the chemical thus making them much more likely to dislike brusselsprouts,161,5
The best thing I saw in Pittsburgh [FIXED],162,2
The Original Knock Knock Joke,163,4
why he should never have an imagination,164,8
My cats name is Bean so that makes this aBeanbagchair,165,7
Adorable derp,166,7
Boba Fett and Jango Generations,167,3
Vegetable garden VS front lawn (Based on photo posted to rpics earlier today),168,0
Am I the only one that really wants one,169,2
OH YOU,170,2
À la cart,171,1
girlfriend said you should put this on your reddit,172,2
How you know youre in a stable longterm relationship (and how much of a scumbag you are),173,2
Meet Crusty,174,7
lets just finish off this guy and his dog shirt,175,7
100 degrees out should I break the window,176,4
Happy Canada Day from Australia,177,7
Paranoid Parrot,178,9
I need to grow up,179,2
Soon,180,4
This is my new kitten Her name is Ruby,181,2
Donald Glover being awesome,182,2
I lost my Grandad today He was a real hero,183,2
The Barclays scandal is not wholly inappropriate Its a crime,184,6
No matter what your mother said this is not the same as a hotdog bun,185,2
Yay,186,8
It took me 14 years to make this connection,187,2
Did a cleanup of my computer  came across this picture  laughed for about an hour,188,7
its true,189,8
Mass Effect  This is the scene wanted to see at the ending So I drew it myself I call it Lovers Lament,190,2
My new favorite gif,191,2
Meanwhile inside the Iron Man suit [Fixed],192,2
Falls out of building,193,7
shooters sandwich saturday my god its full of meat [album],194,4
I know I am not alone on this,195,2
If Betelgeuse goes Supernova how will it affect Earths ecosystems,196,3
rip kurt kobain (,197,4
She will do anything to get that laser,198,2
Legend of the Samurai,199,2
happens to me all the time,200,2
This hit me while playing HeartGold,201,2
Pikababy,202,8
Walked past this place yesterdayI wonder if Bruce is home,203,7
Just got back from Thailand here is a picture of me and a tiger cub,204,7
Saigon Hot Dog,205,7
My friend is insecure has low selfesteem no girlfriend and is quite the loner but he cleans up well and kittens,206,2
Its okay the fire is healing,207,9
FTW,208,9
Stephen Fry on QI In England we live in houses,209,4
The best thing about being done with school is having the freedom to read what one pleases In the 13 months since I graduated I have enjoyed these,210,2
A sculpture once located in Vancouver Canada Removed for being too controversial,211,6
Never mess with a cow,212,2
He doesnt know what internet is even less what Reddit is but I want to post him here anyway My grandfather is turning 101 years today Congratulations D,213,2
Giving out 2 Arctic Warfare Cait codes,214,5
Introducing Vindictive Canadian Moose Overlord,215,2
How I feel as someone who has $25k in student loans,216,2
My friends thoughts on Magic Mike [FB],217,8
Just browsing some reptiles when suddenly THIS LIZARD THINKS HES A BARTENDER,218,7
Some more Alien Logic,219,2
How to kill your sister,220,2
Happy Canada day,221,7
Ive made a huge mistake,222,2
My friend died a year ago His dog waits for him ever since,223,2
YouTube Eye Spy (xpost from rfunny),224,4
Reddit vs Facebook,225,7
The first three,226,2
Hes also good in Politics,227,7
Waiting for Season 2,228,2
better than 9gag,229,4
When Im watching a movie with my parents and a sex scene comes on,230,2
Race you home,231,7
If you could travel back in time to 1920 and take one movie with you to show at a theater what would it be,232,2
One of my favorite dialogue from ATLA,233,2
Good Guy Tyler Perry,234,2
Look at this I have a green cow,235,4
As requested IAmA Marketing Manager at a big Tobacco company AMA,236,7
5000 ducks herded through a road in China,237,2
Who else would love to see this expanded in DLC or in TES VI [College Spoilers],238,7
My four day old daughter and I,239,7
Went on a date today I must say her choice of location was impeccable,240,2
Orions Reflection,241,2
Learned this the hard way as a kid,242,2
Pawn Stars before they were stars,243,7
So I just inherited my Grandfathers old coat Can I be Captain Jack yet,244,4
Dancing in Circles,245,4
Reddits down maybe I should go outside today,246,7
How I feel when everybody talks about the Reddit maintenance and I missed it,247,7
Male redditor here Stumbled across this subreddit and thought Id have a go Heres my water marbling attempt while watching the Euro 2012 final,248,7
So my friend gave her rabbit a cherry   ,249,7
This person thought adviceanimals gave animal advice,250,2
To avoid perpetuating gender stereotypes I gave my daughter a mix of dolls and toy cars to play with This is what happened,251,2
If Jupiter was the same distance away from Earth as the Moon is,252,1
QWOPQWOPQWOPQWOP,253,9
Walmart Greeter (with 20+ years of service) gets fired after unruly customer pushes her and she instinctively tries to steady herself by touching the customers sweater after which the customer storms out and management suspends and then terminates her employment,254,0
Announcing The Declaration Of Internet Freedom A whole bunch of organizations and individuals are getting together today to launch the beginning of a process,255,1
My Mom started doing stain glass I asked her for Freeman and this is what I got,256,2
This is how you deal with road rage in Russia,257,1
Its been a bit warm in Georgia,258,2
We were eating at a French restaurant when I saw this,259,2
Bought this 10yearolds painting today while at a flea market I was as excited to buy it as he was to sell it,260,2
This horse mustve had a rocket up its arse (skip to 050),261,5
Pizza delivery used to be so much more classy,262,4
Apes With Apps  Sitting with his Motorola Xoom tablet,263,6
Got lost on a walk This sign didnt help,264,2
My new prosthetic,265,2
In the bathroom of a Scottish pub,266,8
My friend got a parking citation from the Department Of Fun right before walking into a job interview today he said it made him feel awesome and he nailed his interview,267,2
Today Im 71 From a post a week ago I learned Im not the oldest redditor Now Im wonderingHow has technology affected you over the years,268,2
Finally some sense,269,2
The Tampon King who sparked a period of change for Indias women,270,1
Neil deGrasse Tysons thoughts on the movie Ted,271,8
I am Serj Tankian AMA July5th 10pmPT,272,9
One Unbelievably Lucky Ice Climber,273,1
Whenever Im on a quick escalator,274,2
Abraham and Isaac Not even once,275,4
My country needs me,276,2
My dog chewed my bra in half I present the hat of shame,277,7
A friend on facebook took this photo in the tram today,278,7
The look on his face,279,2
Prisoners in Brazil Reducing Their Sentences by Producing Electricity  For every 16 hrs spent pedaling to charge a battery connected to the bike prisoners of good standing will shave a day off their sentences,280,7
WHO LET THIS HAPPEN,281,2
So our Vet sent us this today Made me tear up,282,2
Jachvi Tsashi  Chained to the Sky Our new city floating in the sky anchored to the ground,283,2
Swamp labs ),284,7
Most Horrifying face swap EVER,285,2
I made this gif earlier hope you enjoy D [Season 2 Spoilers],286,7
Expired Are you kidding me,287,6
The craziest turn of events I have ever witnessed in basketball,288,1
I own a bar in NYC Yesterday at our Canada Day party I asked guests what they loved best about Canada These are the results,289,2
Its so hot in Texas,290,7
Not the usual on this sub but I think these guys are pretty cute,291,7
I love literal humor,292,7
This tree looks like something out of LOTR I was hoping for some Hobbits underneath it,293,1
Saw my sons flip flops and decided to try them on Perfect fit For my toes,294,2
That title oversold and that article underdelivered,295,9
FB God smites another heathen,296,2
Henry Rollins makes it clear,297,7
Sozin and Roku in The Avatar and the Firelord,298,9
While watching the womens Olympic gymnastics trials,299,2
Realized this after hiking this past weekend,300,2
Went to Maui last week and found a heart cut out of a rock so naturally my dad and I wanted a picture,301,2
A real conversation stopper,302,2
Something about a heat wave,303,6
Meanwhile in Brazil,304,9
I traveled by map,305,2
When my dad heard that Anderson Cooper came out,306,2
Parenting level Linux,307,2
I didnt know you had it in you Windows,308,2
Waaait a minute Ive done this before,309,2
Its my Duck in a Box,310,7
Ran into this guy last weekend while walking the floor at the American Library Association,311,7
A Timeless Classic,312,6
Rabbits,313,6
This is how a runner representing their country should behave,314,2
Old man from the 90s on dialup,315,6
Guy purchases animatronics from an amusement park This is what happens next,316,2
Senator Rand Paul puts forward measure that would require the Senate to actually read the bills it passes,317,2
How half of you get your karma,318,2
I told my sister that she was holding Big Ben,319,7
Enhance,320,1
Showed my dog Reddit he was not impressed,321,2
Me encanta fajitas,322,3
My city just put up a bunch of awesome street signs for the 4th of July,323,2
My friends girlfriend went to see Magic Mike so she got him a present,324,2
The best picture Ive ever taken,325,2
As someone who works outside I wish sandals were in our dress policy,326,2
My sister wanted to show me how big this beetle was She didnt realize she had another visitor until the stinging started,327,2
Practice,328,7
IAmA Charles Stross science fiction writer,329,7
As a male I obviously admire Barney Stinson but this is something I dont get,330,2
Baby bunnies on the couch,331,7
So I found this button on the street today,332,2
The only GAME store in my city closed down a few weeks ago The local violinist playing a solemn requiem outside made for a sad sight,333,2
Trampoline youre drunk You are not a bird,334,2
As an atheist Id love this to be what proves me wrong,335,2
Meet Joey we got him when the car ahead of us threw him out (when they were still moving) then 6 months later he got ran over by a car and the vet said he would only live 3 more years tops Today marks 12 years of him being with us,336,2
Found at my local fireworks stand,337,2
My friend ran out of shot glasses They had to improvise,338,7
Abandoned WalMart Transformed Into A Functioning Library,339,7
wearing sweatpants a lot lately,340,2
I made a shirt and completely messed up while applying the paint but it came out pretty cool I think,341,4
My buddys mother inlaw did NOT want to play a game,342,2
How can I ask my gynecologist out,343,2
Manbaby face swaps make the best face swaps,344,2
Even Batman has to downsize in this economy,345,2
Whats the point of the browser war Why do Microsoft or Google care if you use their free browsers,346,2
My Mom painted this for my 23rd Birthday present,347,2
I never realized this before,348,2
A fox a kitten and a dog Hold the front page of the internet,349,1
Gotta run from the sun,350,7
Im Freeeeee,351,7
OP,352,2
My favorite quote from the prequels,353,2
Good Guy Balotelli,354,7
Anderson Cooper The Fact Is,355,6
Bill enclosed,356,2
i would make it my only goal in life to find and kill the ones responsible for this,357,2
Call of Booty Saw this on Fios,358,2
Just my dad in central park,359,2
I Was Success Kid Today,360,4
The American section of a grocery store in Finland,361,2
Silly Americans,362,7
How I feel when people make Overly Attached Girlfriend memes about their own girlfriends,363,2
Rising sea levels cannot be stopped over the next several hundred years even if deep emissions cuts lower global average temperatures but they can be slowed down climate scientists said in a study on Sunday,364,2
NJ Gov Chris Christie is hoarding money saved by cuts to programs aimed to help poor and working class families and using it as a bargaining chip to ram through tax cuts that will predominately favor the rich,365,2
This infuriates me,366,1
my humps my humps,367,0
My Dads hand painted basement that is his baby (Xpost from rpics,368,7
Yeah Its Hot (Kentucky),369,7
Saw this being built while at the mall today (Houston Galleria),370,2
My kitty Gilly,371,5
Kids today,372,2
School kids receiving their Vitamin D in Soviet Russia,373,7
With the recent talk of the possible discovery of the Higgs Boson heres a video explaining what it could be and what it could mean to science The Higgs Boson Explained,374,2
Block Party,375,2
I Was the Success Kid Today,376,4
TIL declawing a cat is anatomically the equivalent of removing the entire last bone in a human finger at the joint,377,7
Nyan Cat Story,378,7
Pokemon master Korra,379,1
Optimism,380,8
Damn Scouts,381,7
My new card has arrived,382,2
Just your average protester,383,7
My mom wants us to lie to our religious cousins about our beliefs,384,2
Houston this is dog,385,7
How I feel as someone who never played past Gen II browsing rPokemon,386,2
The Blackfish has been cast  Clive Russell,387,7
Sax Gandalf,388,7
1 in 5 children experiment with Palaeontology,389,2
Butcher Block Style Dinning Room Table (xpost rwoodworking),390,2
Terrible Math Teacher,391,1
So the coordinates 44 143977N 7°461071E on Google Maps point to something strange in Italy,392,4
I dont even know how to respond to this,393,2
My neighbor f*#%ing loves the 4th of July,394,6
For all you Pokélovers heres a background I designed some time ago (1920x1080),395,2
oh Canada,396,2
Get to wear some real history on my chest,397,1
I think they seriously need to reconsider the puppet design on this show,398,2
Took the perfect picture of my pup,399,7
So This happend,400,5
Aang on promises,401,2
Sorry Italy maybe next time Nah,402,2
So THATS why it too so long for my package to arrive,403,9
Thats a brave dog,404,1
genius,405,5
TIL mediaeval theologians held that part of the pleasure of Heaven was watching the suffering of Hell,406,4
and I shall rise from between the sofa cushions and bless those who ventured into New and bring home the bacon Kitty Jesus 122112,407,1
RPG gets sponsored,408,1
Its True,409,8
Thats a mouthful,410,1
A friend of mine (also a fellow Redditor) used to do what he called Chat Roulette Partner of the Day Can we convince him to continue these,411,2
Michael Scott gets it right,412,2
Recently Ive taken a fancy to building Airboats Here is the latest one Im working on,413,2
Just a little too slow kermit,414,7
Never posted anything before and seeing its my real cake day and I know you guys love catsI thought Id show my kids off to you guys,415,2
She didnt even see it coming,416,2
My cat enjoying some shade on this 100 degree weekend,417,7
I let my 10 year old brother use my computer I found this open in my browser,418,2
Murder Death Bunny on Easter,419,2
Met the coolest kid on my last cruise,420,7
How I feel after browsing rnew for 1 hour,421,2
Original Indie,422,4
Colbert puts it bluntly,423,0
They really know stromboli in York PA This fine specimen from Parma blows away anything Ive found in Philly Someone prove me wrong please,424,2
Not entirely accurate but it does have a point,425,1
How to get a date,426,8
TIL the NBA has only had 9 different champions in the last 33 Seasons The NHL has had 9 different champions in the last 9 seasons,427,6
well thats cute,428,4
Well OK then Ill leave and I will not exit,429,2
Believe those who are seeking the truth,430,2
When my house is cold,431,7
Philosoraptor meet philososloth,432,7
PokemonLion King crossover,433,4
Why is mycleanpc not sued to hell,434,8
Never thought Id stumble on such gold on my own newsfeed [fb],435,2
What I learn about women from movies,436,1
TIL NASA invented invisible braces scratch resistant lenses and much more,437,1
Beautiful 3D printed skull sculpture,438,8
Super Score,439,4
Touché,440,6
What are you really bad at that everyone else seems to have no trouble with,441,2
The Last Airbender helped me in a way I cant repay,442,2
Hahahahano,443,0
Some people just cant handle the sour,444,2
Who else is guilty of this,445,1
at my friends house when I see this framed in his living room,446,7
A Declaration of Internet Freedom we need legislation supporting this,447,1
The Eyrie,448,0
TIL  That in 1962 Bruce lee landed 15 punches and a kick and knocked out his opponent in a fight that lasted 11 seconds,449,2
I just wanted some water and then found this,450,2
