Title,doc,topic
"I haven't played WoW since this morning, what has changed? is it worth coming back?",3882,4
I still get pissed thinking back on this moment.,3883,4
"This Guy Sent Sierra Leone 4,000 Bottles of Holy Water to Cure Ebola",3884,4
Aphex Twin blimp flying over london that says 2014,3885,4
No no no,3886,0
This bar has belt-driven ceiling fans,3887,8
Why is there no pants item in League of Legends,3888,4
60 year old grandpa killing it back in the 70s,3889,4
Captive Minecraft III,3890,9
"So tropico 4 collectors bundle is $0.39 right now, grab it while you can!",3891,9
Uh.. Sir you might have a bit of fire on your everywhere,3892,4
Whats inside of the new soda machines. They work like ink cartridges!,3893,9
The Truth About Third Party Console Exclusive Games.,3894,9
"ELI5:If films are shot at 24fps, then why did we standardise 60 fps for monitors and tvs, a number that doesn't divide evenly into 24?",3895,2
Men just can't have anything to themselves...,3896,4
Unbelievable graphic regarding illegal contact penalties shown in the Eagles vs. Patriots game,3897,9
These kinds of moments as a kid were the worst.,3898,5
"A burger with eggs, bacon, hash browns and cheese",3899,9
MRW my friend who has lung problems started smoking,3900,4
"After 13 years of Scouting, I finally made Eagle Scout.",3901,4
"We received a new member of the family today. Reddit, meet Loki.",3902,4
I'm not a pervert; I'm a time traveler!,3903,2
Smooth timmy,3904,9
Working in hospitality,3905,4
We had an increase in subshibers yesterday - want to know why?,3906,4
What kind of festival?,3907,2
"TIL that in order to obtain the vast amounts of titanium needed for the construction of the SR-71, the CIA created fake companies throughout the world to purchase the metal from the biggest supplier, the USSR.",3908,4
Vince McMahon takes part in the Ice Bucket Challenge,3909,4
This is what happens when you mix Taco Bell with alcohol,3910,4
The poles at this gas station look just like a cigarette,3911,9
I'm very good friends with 25 letters of the alphabet...,3912,4
Deadpool and Batman,3913,8
"My foster kitten, Dante, seems to have have malfunctioned.",3914,0
I did a sketch of the new stormtrooper design thought you guys might enjoy.,3915,4
What's the worst argument that people try to use?,3916,2
This bread seems to have the top half of a perfect Times New Roman 7,3917,4
My new motto.,3918,4
"As the water washed over his stinky, stinky fur, Porter contemplated the long and painful deaths of his owners.",3919,4
This Louis CK joke belongs here,3920,9
TIL Louis Armstrong was 1 of the few people who could move between East and West Berlin without papers. The East Germans had their guns out,3921,4
I give you the television character that gave me nightmares as a child,3922,9
"Is there a difference between your right eye and left eye? If you need a transplant for your right eye, can you only take right eyes from donors?",3923,4
This sign on a beach... (x-post from /r/mildlyinteresting),3924,4
Amaz's Final RNG Form!,3925,9
Robert Downey Jr. ALS's Ice Bucket Challenge,3926,4
My daughter was born yesterday! She has her mother's hair...,3927,4
It looks like Ellie has no feet.,3928,4
"LPT: Avoid pets and children from opening off-limit doors by turning the handle upside down, resulting in a pull up instead of push down.",3929,4
To my friend who said I can't wait for all the old conservatives to die so that it's just us young liberals left.,3930,4
How could anyone not think these guys are cute?,3931,4
Dadjoked by Ana from Frozen today,3932,4
Don't be creeped out. Just know it's a compliment.,3933,4
Here's the back of the David Lynch Dune glossary sheet. I found it tucked into a copy of the book that someone bought for me at a used bookstore in 1999 and assumed it came with every copy of Dune.,3934,4
"A cinema that exclusively airs movies with numerous twists. Built into each chair is a drink device which connects to an underground milkshake factory, and as the plot thickens, so too does the milkshake.",3935,8
Welcome to The Bible Belt,3936,4
My life was ruined because of an email I should never have received (Part Two),3937,4
'Do Androids Dream Of Electric Sheep' has grabbed me and successfully shaken my perceptions of reality.,3938,2
Custom Made Desk For My Battlestation,3939,9
It ruined the mood real quick.,3940,4
I'm a little jealous of this happy little guy,3941,4
I've seen quite a few of these today.,3942,4
PHENOMENAL COSMIC POWER... itty bitty living space.,3943,3
My parents went on a 3 weeks vacation and I decided to make them a surprise. Here's how I GabeNized my house.,3944,4
"TIL: When filming Jaws 2, cast members were circled by actual hammerhead sharks. Because the scene called for the actors to yell for help, the crew did not immediately realize they were in danger.",3945,5
Liquid nitrogen frozen balloon slowly becomes airborne.,3946,4
Fourth comment down was what did it for me....,3947,9
How i feel when I dungeoneer with friends.,3948,4
"Another evolution gif, only took 9 hours...",3949,4
I'm just a lil' puppy.,3950,2
Small dog left inside shop's baggage locker,3951,9
Sent this to a Tinder match after she asked me if I watched Archer,3952,4
Who's sperm is it anyway?,3953,4
2014 Season World Championship teaser by OGN,3954,7
MRW someone complains about too much Robin Williams content on reddit,3955,4
My freedom leveled up at Annual Training this year!,3956,5
MRW my girlfriend wants to leave Sunglass Hut but I'm not ready,3957,4
Scumbag Radio Station,3958,2
Netherlands - Where The Bike Path Is Twice As Wide As The Sidewalk,3959,4
Someone else feels this is too big???,3960,4
"[All spoilers]Original post was flagged for spoilers, so here are the GoT business cards again, with some extra ones added.",3961,4
what if radiation in space was designed so human's can't explore? Like in a video game when you are outside the map you die?,3962,4
I got my Wife Hooked on adventure time. I always know she likes a show when she starts drawing it.,3963,4
What Amy Poehler really is,3964,2
So Hot Right Now,3965,4
The official symbol for people with lisps,3966,9
Video game con in dc is a graveyard! Come out and play some old systems with all of us!,3967,4
This girl is on fire.,3968,4
"My friend doesn't like sesame seeds, so she asked for a burger made with two bottom buns. This is what she was served...",3969,4
Tap on glass,3970,9
My garden has the cutest infestation,3971,2
What is your greatest strength as an employee?,3972,2
"32 on-set photos of Christian Bale and Heath Ledger during the interrogation scene from THE DARK KNIGHT, accompanied with Christopher Nolan interview bytes breaking down the scene",3973,4
"We have a journalist in the UK known for his no BS approach, here he is in action.",3974,9
Baby fox gets his head stuck in a can. (rescue),3975,1
Colbert,3976,5
To the people who don't drive fast in the left lane.,3977,9
She was bullied as a child because of her vitiligo; now she's a model,3978,1
"TIL that Morocco, in December 1777, became the first nation to recognize the United States, and together they maintain the United States' longest unbroken treaty.",3979,4
That is kinda clever,3980,9
I'm sweating balls,3981,2
Carl just doesn't learn.,3982,2
A Reminder for Those Starting College This Fall,3983,4
This is how my brother makes bacon,3984,4
Friends bachelor party!,3985,4
Make this the new loading gif,3986,4
The Windows Store is a cesspool of scams — Why doesn’t Microsoft care?,3987,6
What this meme has become,3988,4
Role-playing can only go so far in an established franchise [GTA V Online],3989,9
Whenever my girlfriend laughs at something she found on her phone,3990,4
From 004 to 006,3991,0
The most uncomfortable flight of my life!,3992,9
Jigsaw puzzle with 7 different outcomes,3993,4
You Had One Job,3994,4
Table Saw Cutting Wood,3995,4
Be thankful for the little things.,3996,6
Timing.,3997,8
IamA survivor of Stalin’s dictatorship. My father was executed by the secret police and my family became “enemies of the people”. We fled the Soviet Union at the end of WWII. Ask me anything.,3998,4
"I was hungry, and this just made me feel worse.",3999,9
The worst local commercial I've ever seen,4000,4
39 Endangered African Vultures Killed by Poison - Now more endangered than rhinos. The scavengers are hated by poachers since they alert rangers to their presence. Poachers lace kills with ­poisons so birds die before they can take to skies again.,4001,4
...and the horse jumped over the dog,4002,4
So I'm in the marching band in my university . . .,4003,4
How you know you're in a good neighborhood,4004,4
Our values,4005,3
My mother was married today at 61 years old. I think this picture sums it up well,4006,4
When my daughter was 8 I bought her her first pair of high top sneakers.,4007,4
Apple ignores calls to fix 2011 MacBook Pro failures as problem grows,4008,4
Poor Dan,4009,4
Protected,4010,5
Told my girlfriend I got new outlets that can charge iPhones...,4011,4
Bob-omb Battlefield in LEGO,4012,4
Messing with kids at the baseball game,4013,8
Well played equine,4014,4
Sometimes I forget how huge Central Park is.,4015,4
I worked retail and saw this way too often,4016,4
India's Forgotten Stepwells,4017,0
MRW the girl I took out asks if I'd like to have a drink at her place,4018,4
Just a lighthouse keeper out for a smoke,4019,9
She hates being alone. This is her way of ensuring she'll be with me everywhere I go,4020,9
It's an aquarium,4021,8
The dog that deserves an Oscar.,4022,4
Release this Pokémon?,4023,1
Loot of a captured Manhattan drug lord including a painting of himself as Scarface,4024,4
I'm in line for pie. There's no way they didn't choose the building at this address on purpose.,4025,4
What is something popular that you refused to get into but once you tried it you were hooked?,4026,4
A good observation from Karl Pilkington...,4027,5
"Strongest protective effect ever observed against multiple sclerosis (MS): HIV antiretroviral therapy or infection itself reduces rate of MS diagnosis by 60-80%, diminishing symptoms",4028,9
This is a good idea,4029,4
"You must be joking, I'm a lady. I'm not getting my paws wet.",4030,2
"He grew up to be a funny looking cat, but in the beginning he was just a funny looking kitten.",4031,4
Harrison Ford's response to Ian McKellen is hilarious,4032,8
Bro.,4033,8
Karen Gillan,4034,2
A Happy Bulldog,4035,4
Scumbag Radio stations,4036,2
Ten years ago.,4037,4
Dog has skills!,4038,4
Abusive girlfriends? This woman got her Judge boyfriend arrested charged with domestic violence by faking her injuries. Here's a video he recorded of her jumping out of a moving vehicle and blaming it on him! (jump at 8 minutes),4039,4
I give to you a joke I made up when I was seven: Why did the computer crash?,4040,9
space vampire,4041,2
Standard issue shoulder mounted K9,4042,7
"Yep, it's a medicine ball",4043,4
TIL the entire GoldenEye 007 game on the N64 is only 12 MB.,4044,9
Don't have a projector? Don't like drinking? Deal with it.,4045,4
Robin Williams Overdosed on Asphyxia!,4046,9
Today is national black cat appreciation day!,4047,4
"Visitors had an odd request, I hope they weren't disappointed! xD",4048,4
One of my favorite party games of all time,4049,4
"For the dashing bachelor on the front page, meet Cercei.",4050,4
TIFU by kicking my husband in the balls.,4051,2
Yesterday 33 animal shelters in North Texas waived their adoption fees as part of Empty the Shelter Day. Over 2200 animals found homes in one day!,4052,4
Mountain Cooking,4053,9
View from the Golden Gate Bridge.,4054,4
My dad made this squirrel a pancake,4055,4
First Dress made with a 3D printer worn by Dita Von Teese,4056,4
My Dad's reaction to seeing his daughter in her gown on her wedding day.,4057,4
It goes so fast!,4058,0
Yesterday my brother managed to get this shot AND successfully duck and dive in time,4059,4
Real conservatives are conservationists. The radical libertarians’ knee-jerk rejection of the scientific consensus on climate change isn’t just anti-Conservative. It borders on sociopathy in its extreme anti-intellectualism and recklessness.,4060,2
Taking my GF to the 6th grade dance,4061,4
I live by myself,4062,4
child runs in front of my friend on active mountain bike course.,4063,9
Drumsticks was the correct word,4064,8
I get this often as a tall skinny guy.,4065,4
"Feds: Red light camera firm paid for Chicago official’s car, condo",4066,4
F*ckin' Magnets,4067,6
Down 121 lbs and counting.,4068,4
Had to share one of my mates wins,4069,4
"My father, 1942.",4070,9
lvl 80 Hammering,4071,9
My old man was pretty tired after his walk. Nap time in his favourite box.,4072,4
This mailbox is a scale model of the house,4073,1
"My 10 year old son that is 5 minutes older than his brother was bragging to his little brother that if I was a King, he would inherent everything as firstborn. My younger son's response.",4074,4
"New champions are fun but honestly, we need more items...",4075,9
This is supposed to be a kids show,4076,4
Photobombing level = octopus,4077,2
Challenge Accepted! [gif],4078,4
Suicide,4079,9
Flare surfing,4080,8
Free diver riding a great white shark,4081,4
So true anymore,4082,2
Maybe honesty in advertising isn't such a good idea after all ...,4083,4
Weird Al's ALS Ice Bucket Challange,4084,4
Let's roll!,4085,8
"Cygnus entering the atmosphere, photographed by Alexander Gerst on the ISS.",4086,2
Face paint,4087,9
Pachirisu won the World Championships. Pachirisu!,4088,5
This missed connection popped up in my neighborhood recently,4089,4
Found an old book I made in elementary school when I was 9. I'm starting to understand why they wouldn't let me finish it.,4090,4
My girlfriend's dad had a very cool group of friends. (c. 1976),4091,4
Found this on Facebook.,4092,4
MRW the jerk playing music from his phone speakers on the bus plays a song I actually like,4093,4
Wife left me home alone for 2 days and this is what she left me.... I am 33,4094,4
Might be a long shot...but does anyone have a contact for Coheed and Cambria? (serious only),4095,4
A nice sleepover.,4096,1
Vet says he has the longest eye lashes he has ever seen.,4097,9
"Goalie Camo, taking every advantage you can get",4098,2
My Great Grandpa Eddie. Omaha 1939,4099,2
Not so subtle insult from Full House,4100,4
"She may be 16 and only have one eye but to me, my Molly is the most adorable doggie in the world!",4101,4
I was making my niece some waffles when she asked,4102,4
Homemade Tomato Sauce,4103,8
Found this little guy on my sons TV yesterday. He doesn't think he's any good but I do - what do you think?,4104,4
Turn Any YouTube Video Into A GIF By Just Adding “GIF” To The URL,4105,4
The first day of lecture,4106,4
"If someone offered you $10,000 with the condition that you had to spend all of it within the next 4 hours, what would you do?",4107,4
Even Sweden's candy is atheist.,4108,4
A father designs a headstone for his wheelchair-bound son depicting him free of his earthly burdens.,4109,4
Why guys shouldn't write advice columns.,4110,2
5-7-96 The night my favorite book went missing.,4111,9
Aquaman problems,4112,4
Heavy Van Damme,4113,9
"If driverless cars save lives, where will we get organs? It's a dark thought, and the sort of thing only a futurist would think of.",4114,4
Just popped up on my FB feed (Public shaming),4115,2
The sunset lit up the rain and made it look pink this evening in Texas.,4116,9
"TIL in its 44-year history, Sesame Street has won 153 Emmys and 8 Grammys. An estimated 77 million Americans watched the show as children",4117,4
"[OC] Three and a half great powers: How the US, EU, China and Russia stack up on military and economic measures of power",4118,2
Thanks for the ride,4119,4
Berlin after WWII,4120,4
We are moving. This was the first thing my 6 year old son packed.,4121,4
This guy is the reason you don't have a beer for lunch while working.,4122,4
Clowning with style,4123,9
The fan stopped working at my job's single-stall bathroom,4124,4
My hair she was looked ruined amazing?,4125,3
TIL Coca Cola switches back to cane sugar from corn syrup during Passover.,4126,4
PsBattle: A guy driving his car made of LEGO [1280 × 853],4127,4
Mexican bomb hammer festival WTF,4128,9
DVD relative size on a 4k screen. I could watch like 20 movies at the same time!,4129,4
Went to Disney World a couple months ago and got this shot of the fireworks finale (taken on my LG G2),4130,4
What happened to Patty in Risen(1 to 3)?,4131,4
"Heath Ledger while filming THE DARK KNIGHT in Chicago, summer of 2007",4132,4
Zedpeke,4133,5
Responding to My[m19] girlfriend[f18] of 2.5 years just died. I'm a mess,4134,2
TIL That a baby porcupine is called a porcupette.,4135,4
ITAP of a baby lion playing with my camera strap.,4136,4
Made a histogram of my wife's shoes vs. mine. Ran out of house.,4137,4
Science Summary of The Week,4138,4
Johhny cash has been everywhere,4139,4
Show-off,4140,0
Play time,4141,4
"Seven different restaurants. Three local and four pretty big franchises. It's 2014, this is inexcusable.",4142,4
One of the Best CSGO Profiles I've Seen,4143,4
American sex education(x-post from /r/funny),4144,4
TIL Tracy Morgan was married with three kids and living on welfare when he got his role on Saturday Night Live,4145,4
"Heath Ledger waits for filming to begin on THE DARK KNIGHT (Chicago, 2007)",4146,4
DK.BurNIng announces retirement,4147,5
"Freelo only $9,99 !",4148,5
Someone started a petition to make Robin Williams an NPC in the new Zelda game and Nintendo responded!,4149,9
Table Saw Cutting Wood (x-post r/gifs),4150,4
Looking for kill la kill wallpaper when suddenly...,4151,4
Return Of The Jedi Fire In The Sky Poster,4152,4
MRW someone says I have 24 hours to complete the Ice Bucket Challenge,4153,4
Had a long stay at a mental facility earlier this year. Drew this throughout the whole stay. After a few months I'm finally up to share it.,4154,4
Maybe why depression is so poorly understood by most,4155,8
What is the development like for games that are clearly going to be bad (like games based on movies)?,4156,4
My friend brushed his puppy.. I don't think Rico likes his new 'do.,4157,4
"I haven't drawn in years, but I'm really enjoying Pokemon Art Academy",4158,4
Revenge of the Green Dragons Poster,4159,9
"I love all the Parks and Rec posts lately, but this is still one of my favorite clips from any show.",4160,4
"A lot of people don't think about this, but personal finance is also about deciding how to spend the remaining prime hours of your life - including how much of it to trade for money.",4161,4
Dropping into the living room.,4162,4
MRW I realize the microwave popcorn stopped popping about 30 seconds ago.,4163,4
He has been known to manifest in mysterious and wonderful ways...,4164,9
LPT: Use hair straighteners to iron creased collars and hems in a hurry.,4165,4
YouTube channels getting shut because Google is gentrifying the internet,4166,4
"Whenever there is a food thread on reddit, people immediately want to drizzle Sriracha all over it.",4167,4
Ebola patients flee from Liberian isolation centre,4168,4
Understanding RAID configs,4169,6
You Should See the Other Guy,4170,4
"[Spoiler] Alliance vs Fnatic / EU LCS Summer, Final / Post-Series Discussion",4171,9
Kitten's first time meeting her roommate,4172,4
You never know if a guy will show up mid-way through.,4173,4
The Carry Your Carry Could Farm Like [SFM],4174,4
"After listening to many podcasts, I have constructed an accurate, to-scale map of Texas",4175,9
"My girlfriend made me a quilt based on our favorite episode, Vincent and the Doctor.",4176,4
[Haiku] Gary Numan - Cars (VroomVroom Remix),4177,4
I woke up in a stranger's house today.,4178,4
What is a trend that you would like to start?,4179,4
In response to all the abusive girlfriends videos...this totally astounds me!,4180,4
Anatomically correct vascular systems made from blown glass by Gary Barlow.,4181,9
Reddit makes me feel like this guy from Get Him To The Greek,4182,4
This Energizer flashlight did not come with Energizer brand batteries.,4183,3
10 guy is quickly becoming the worst meme available.,4184,4
ALS Ice Bucket Challenge video describes what it's like to actually have ALS,4185,4
Mutombo accepts the ALS Ice Bucket Challenge,4186,4
Gnar can Hop on Syndra's balls!,4187,7
"Preparing for looting overnight tonight. Ferguson, MO.",4188,3
Sleepy Bird,4189,7
"YSK about Tomahawk, a free cross-platform client that combines your music collection from Spotify, Youtube, Grooveshark, last.fm, soundcloud etc, along with your local music collection.",4190,4
So about Morgana's q's hitbox ...,4191,6
You should hear me play guitar ;P This guy is a ridge runner!,4192,4
VG.rOtk announces retirement,4193,5
Game of Stones,4194,9
Maybe its time to stop playing.,4195,4
Instant regret,4196,9
"With sex-ed falling out of schools, I fear this situation growing",4197,4
My GF painted this for my birthday. I don't know what she is trying to suggest? (x-post /r/lotr),4198,4
You really don't need mods to make Fallout 3 gloriously weird,4199,9
And now the moment you've all been waiting for... Introducing the heavyweight champions of the Arctic Circle. Colonialist Legacies presents the much anticipated Inuit civ!,4200,5
I'm glad I happen to be visiting London when this was happening...,4201,2
"Inside the NBA: Chuck claims he got suspended for only taking 1 step from the bench during an altercation. So they look at the tape, hilarity ensues",4202,9
"Think, Plan, Execute [1280 x 800][OC][x-post /r/minimalism]",4203,5
Cop Who Saved Baby's Life 20 Years Ago Will Watch Her Marry: a New York cop will look on with pride at the wedding day of the baby girl he brought back to life.,4204,4
"Chemists uncover powerful new click chemistry reactivity: The findings open a doorway on an unexplored chemical galaxy containing vast numbers of new molecules for making drugs, plastics and unprecedented smart materials",4205,4
Check out the barcode on my beer,4206,2
What did the clock do when it was hungry?,4207,4
"I want to take a moment to thank everyone who was behind ESL One Cologne, for giving us this fantastic tournament",4208,4
Together in the Grid (analog collage),4209,0
Wireless electricity,4210,7
Usually I don't find anything worth buying for from thrift-stores but today I scored big time,4211,4
Music festival in 90 degree weather wouldn't allow venders to sell beverages...,4212,9
Comcast’s Corporate response to my recent Reddit front page post (“Comcast’s Notorious Unreturned Equipment Fees”) sends clear message: Comcast does not give a sh*t about customers – unless your story goes national.,4213,4
"Every American town should do what Rockport, Maine and Chattanooga, Tennessee have done and build a publically-owned fiber-optic network. If they can't afford to do that, the state or federal government should step in and help them finish the job, just like we did with electric power in the 1930s",4214,4
Dear Reddit. Yesterday my people officially won their court case battle against a major logging company to save our rainforest and home from been further logged. I wanted to show you some pictures of our beautiful home and want to say thank you for everyone who has taken an interest in it.,4215,4
"Our Husky Stark seemed a little overheated after his walk this morning, so we decided to tried something out. We regret it now because it is next to impossible to get him to come out...",4216,4
Until recently my apartment complex thought I only had one cat.,4217,4
my daughter's priceless reaction when I decided to take the XL bowl of Pho challenge,4218,4
[OC] The first gif I actually made,4219,4
This sign accounts for refraction,4220,4
Got a Rare opportunity to hang out with the Original Black Power Ranger at the Command Center!,4221,4
"This 86 year old man challenged me to a pole dancing contest while at happy hour, he won.",4222,4
Awesome shot of a whale underwater.,4223,9
If Michael Bay directed Up.,4224,4
"Damn, I have a six pack and everything!",4225,4
My favourite line from Charlie Brookers 'A Touch of Cloth',4226,4
Handy dandy venn diagram for your TV watching experience,4227,2
Skipity bopity boo I got the paper for you,4228,4
It pretty much destroyed Seaworld's reputation.. maybe it can do the same for Comcast.,4229,4
Senior pictures was a success,4230,4
Feels great.,4231,4
Mobile games be like,4232,4
"As a Comcast employee, I offer their customers this important piece of advice.",4233,8
A Muslim groom and his Jewish bride marry in Tel Aviv as police block protest outside.,4234,4
If Jupiter were as far away as the Moon (the little white circle is our Moon),4235,9
ONE OF US!,4236,4
I usually only share my birding pics with r/birdpics but this hummingbird I got in the rain seemed particularly beautiful to me.,4237,4
defenseless graduates flee as planes bombard the stadium with hats,4238,4
Jeff Victor's new print: The Evolution of Robin Williams,4239,9
What's a motto?,4240,2
it can wait,4241,8
Rare historical photos,4242,4
In a world where the price of everything seems to be rising,4243,4
Friend's SO installed Tinder a few weeks back for a social media experiment,4244,3
My uncle does moving right,4245,4
A PM i got recently from a fellow redditor,4246,4
One of my favourite moments from Doctor Who!,4247,4
Moving out of the apartment,4248,4
What happens when the mist around a waterfall freezes,4249,9
Medieval Aquaman Armor,4250,4
90-year-old Holocaust survivor Hedy Epstein was arrested in St. Louis (Near Ferguson) for speaking out against police brutality,4251,4
How to make friends,4252,4
Box is not impressed with the meat selection,4253,4
Internet logic,4254,9
Yay! I'm born!,4255,2
People who have worked at hotels during fan conventions: which fanbase is the most inconsiderate?,4256,4
Science Channels Explained,4257,4
Rapture.,4258,0
"IamA 94 year old WWII Veteran who was conscripted by the Soviets, captured by the Germans, and emigrated to the United States, AMA.",4259,4
