Title,doc,topic
My wife and I decided to do something creative for our 21st anniversary portrait. 21 Years of Adventure,0,4
Schools are getting pretty strict nowadays.,1,4
"TIL that Alice Walton, heir to the Wal-Mart fortune and one of the richest people in the world, has had a history of reckless collisions. Her latest DWI arrest was expunged after the Texas trooper who arrested her was mysteriously suspended, and the statute of limitations was allowed to expire.",2,9
How to postpone your execution,3,4
"My neighbor owed me $288.66 for my vet bills after his Great Dane attacked my Golden. This is how he paid me, one day before I was going to take him to small claims court.",4,4
My Friend Was Peeling an Orange and Decided to Make the World...,5,9
This made it to my local mall today,6,4
Best headline I've ever read,7,4
Employee of the year,8,4
Someone decided to bring an Ebola patient to be treated in the US,9,4
My girlfriend is going to be an elementary school teacher. This is her handwriting.,10,4
Do I hear...treats?!,11,8
Girls complain about falling in the toilet all the time...,12,4
A NES built into a NES cartridge. NESception,13,4
Baby deer cries every time it tries to be put down,14,9
Was cleaning out an older laptop. Found this collection of artwork for Star Wars set in an 80's highschool. Thought I'd share,15,4
its the first job I've had in 7 months,16,4
The smart ones at least mention the name of the product or show the logo right off the bat,17,4
A few words of wisdom...,18,1
What Kindergartners Can't Live Without...,19,9
Eating your drink? That is genius!,20,4
Ryan Reynolds filming the recent Deadpool footage,21,2
I'm a huge introvert. I married an extrovert. Here are how most of our wedding photos looked.,22,4
Every time I go to Best Buy,23,4
"We are The Gig City (Chattanooga, TN) - The city that is terrifying big telecom with our 600 sq. mile gigabit fiber grid. Mayor and network CEO here - Ask Us Anything!",24,4
This is why you should always knock,25,2
If the word bomb was pronounced like womb and tomb it would be almost onomatopoeic.,26,4
"Redditor explains why Canada, not Isreal, should be the United States number 1 ally.",27,4
Pringle stacking!,28,3
What's your name again??,29,2
One of the most photogenic spots of NYC. Forgive the iPhone quality.,30,9
That is the correct answer,31,8
A judge condemned motorists who use mobiles while driving as a “plague on society” as he jailed a woman who caused a fatal pile-up after texting and taking calls on two phones while travelling at 70mph.,32,4
"The Swedish government announced that it plans to remove all mentions of race from Swedish legislation, saying that race is a social construct which should not be encouraged in law.",33,4
Friend in coma looking for a way to get in touch with The Offspring (serious only),34,4
1000 ft hole found at Lower Ruth Glacier in Alaska covered only by a sheet of clear ice. Photographed by National Geographic photographer Aaron Huey,35,4
This sticker is both a bird and a woman.,36,4
Just moved into a new house. This is the first thing I put on the wall. GF is not amused.,37,4
My dad loves his drawing from /r/redditgetsdrawn! I think...,38,4
Bag of coke my buddy picked up in Thailand,39,4
"TIL, Al Capone was responsible for expiration dates on milk jugs.",40,9
The wife zone,41,4
A waterfall in Yosemite that turns rainbow when the sun strikes it from a certain angles,42,4
He hates getting washed but he knows if he stays still it'll end quicker,43,4
Before and after smoking weed,44,7
Drove like that for about 2 miles so the other car couldn't pass,45,4
"Bosses of reddit, what is the stupidest thing you have had to fire someone for?",46,2
This homeless man roams our Campus everyday without bothering a sole. He is a campus hero having saved a girl from being raped 15 years ago.,47,4
'Sunrise in the Office' - Aboard an Airbus 320,48,2
So many troll accounts lately,49,6
Spotted outside my office.,50,4
Seems About Right,51,4
Comcast Affiliated News Outlet Censored My Article About Net Neutrality Lobbying,52,9
Apparently my front door has a PHD and signs for packages for me,53,9
I-- I don't even remember your last name,54,4
"Jerry Stiller and his son, Ben, in NYC (1978)",55,0
Found on Facebook: So my dad made his own LIFE HACKS.,56,4
lost my iPhone at festival but apple found it...(i live in Denmark),57,9
Honestly how and why is this illegal?,58,0
What time is it?,59,4
Because Physics,60,8
What Tetris has taught us.,61,4
Pennies_From_Heaven offers his side of the story after paying a neighbor's vet bills in nothing but pennies.,62,9
The all new Xbox Tree Fiddy™,63,4
"In light of the conflict between Orlando Bloom and Justin Bieber, let us always remember this.",64,9
Android grabs record 85 percent smartphone share,65,1
Box Office: 'Guardians of the Galaxy' Rockets to $11.2M Thursday Night,66,4
This is why he needs a movie.,67,9
"Director, Colin Trevorrow, Shares Pic of Chris Pratt in Jurassic World.",68,4
Well that was unnecessary. It seems personal.,69,4
Flying Squid,70,7
My boss's daughter just dropped this one on me. I was like Ooooooo,71,4
In response to the gentlemen who forgot the name of his lady friend.,72,4
"As someone who works at a Senior Center, I worry about this on a daily basis.",73,9
"As an IT guy, somebody should have mentioned this to Master Cheif.",74,9
Transparent Ruler with display that supplements drawings,75,3
DAT reflection,76,3
New tenant moved into the birdhouse this AM...,77,4
Found an old shoe-box filled with photos and re-discovered evidence of the perfect crime (roughly 15 years ago),78,4
"For the record, I think both are equally classless",79,9
"Tesla announces plan to boost production in 2015. Tesla will produce 35,000 cars this year and up to 100,000 in 2015.",80,4
Yes it does.,81,4
IamA 17 year old male living with phenylketonuria (PKU): A rare genetic disease that would leave me brain dead if I didn't follow a strict low protein diet. AMA!,82,4
Batty,83,0
Lame pun is lame,84,4
It never works,85,4
Always leave your hotel room like this.,86,4
This Week in Technology,87,4
How quickly we forget,88,4
What a non-bogus babe Betty is,89,3
I can't stand people like this,90,4
It's Wookiee Goldberg!,91,0
So I talked to my new neighbor in the complex this morning...,92,4
PsBattle: This overstressed mother-pug,93,4
"Signs, a new restaurant in Toronto, is staffed with Deaf waiters. Every diner here is encouraged to order in sign language. No need to worry if you are sign language illiterate, everyone gets a sign language cheat sheet.",94,4
time flies,95,4
Why I Hate My Workplace,96,2
They are selling MakerBot in Home Depot.,97,4
I made a cat gif!,98,4
Alan never fails.,99,4
Guy sings halo theme in church.,100,4
Should Obama Fire His CIA Chief for Misleading the Public About the Senate Spying Scandal?,101,4
I thought you wanted a Dad joke...,102,4
"I was told to talk with the special needs kids, so I started by asking their names.",103,4
MRW someone starts honking at me to go one second after a light turns green.,104,4
"Heres a 1920's water heater I restored, good for another 50-60yrs service",105,4
"I work at a nuclear physics laboratory, and this was on a door!",106,4
People at modern at museums,107,8
I'm looking at you elementary school teachers,108,4
"Science AMA Series: I'm Stephen Morse, a Professor of Epidemiology at Columbia University’s Mailman School of Public Health. I work to understand the factors leading to emerging infectious diseases like Ebola, and can answer your questions on the current outbreak. AMA!",109,8
we can all relate,110,3
Someone brought this little guy into work,111,4
Sleepy baby sloth,112,9
Got my daily phone call from red cross,113,4
MRW I read that we are flying the two American citizens infected with the Ebola virus back to the United States,114,4
For Those Who Can't Relate,115,9
Sometimes it's hard to tell.,116,4
"I'm as white as they come. I just married into an Italian family. Here is my father-in-laws speech, teaching me Italian 101.",117,9
PS4 outselling the Xbox One 3-to-1 as total sales gap grows to 9 million vs. 5 million,118,4
IDF soldier feared kidnapped in Gaza; cease-fire deal collapses - Diplomacy and Defense,119,4
"Mom & Dad, 1971, College Winter Formal. Lung Cancer got him good in '09. R.I.P. Dad, you go, Glenn Coco.",120,4
The baby cobra's skin is so translucent you can see it's veins and heart,121,2
Senator Elizabeth Warren; I've teamed up with Senator Levin and more than a dozen of our Democratic colleagues to introduce the Stop Corporate Inversions Act.,122,1
An X-Ray of a Sting Ray,123,3
Matchmaking algorithm: the investigation's shocking truth,124,5
Ebola 'spreading too fast' - WHO,125,4
ELI5: Why do the bonds between humans and dogs/cats seem so much stronger and more intimate than those between the animals themselves? My cat is much more attached to me than she was ever to her mother or her daughter (with whom she lives).,126,4
The only Venn Diagram you'll need for the rest of your life.,127,4
"888, 246 red ceramic poppies in a flowing sea around the Tower of London, to remember fallen soldiers.",128,2
TIFU by spilling black widows all over my living room,129,4
Cute baby seal,130,8
Apparently someone has been shot with a starter pistol at the athletics track,131,4
"TIL a Dilemma is a difficult choice between just 2 options, Trilemmas, Quadrilemmas, and so forth exist for more options",132,4
This guy on my fb always posts these convoluted statuses. I responded with this and he didn't get it.,133,4
Harold enjoys a story with his grandson,134,9
Lucky the duck is all grown up,135,0
[No spoilers] Well said George,136,4
"TIL in the original story of Peter Pan, the Lost Boys do age, even in Neverland. The reason the group is always made up of children is because if they don't die by other means (which is common), Peter thins them out. The author never clarifies whether this means they're executed or banished.",137,4
We did it! Thank you to everyone who contributed!,138,4
MFW I find out Will Smith is a Scientologist.,139,4
"Palm Jumeirah, Dubai. Woah dude.",140,8
Between avengers movies.,141,4
If Star Wars was set in an 80s high school- By Dennis Hedri (xpost r/pics),142,4
"Jack White delivers scorching 38-song, three-hour set at Detroit’s Jack White Theater",143,9
Subtitles are sometimes funny,144,4
"Transparent god, Peter Callesen, 2009",145,2
My son wanted to play Hide and Seek. He might go pro.,146,4
Girlfriend Logic. Edited for accuracy.,147,4
"The Fifth Element - Diva Plavalaguna's full, unedited opera performance (green screen.)",148,2
Took me a while,149,4
Stephen Colbert's hysterical take on the Justin Bieber / Orlando Bloom feud,150,9
Unexpected Help,151,4
Females can never provoke their own beatings,152,4
Ballerina Misty Copeland in new Under Armour ad,153,4
Alabama editorial cartoon challenges state Public Service Commissioner's plan to Pray Away the EPA,154,4
"Well, I might not be a rocket scientist...",155,9
My Grandfather during WW2. He's 91 now and still as badass as he was here,156,4
Honduran white bats make their own shelters by manipulating the leaves of large plants to form a tent,157,4
Red hoodie,158,4
First generation perspective,159,2
The place I work today has a slide... I'm 25 and used it to get to the first floor,160,4
MRW My Wife gets home from a night out with the girls leaving me with our two toddler boys alone,161,4
Local bank had this beauty up,162,4
"Rick Santorum Blames Gay Marriage For Rise In Single Moms, Polygamy Is Next",163,2
Uh oh...,164,7
EMSK: Beef Made Easy - Retail Beef Cuts and Recommended Cooking Methods,165,4
Twitch Plays Pokemon has beaten a pokemon game from every generation (including remakes)! Here's a chart of how long each game took for them to beat it.,166,9
Whenever I travel to the south I get BBQ. It never disappoints.,167,4
Student starts global class action against Facebook: Austrian law student Max Schrems appealed to a billion Facebook users around the world on Friday to join a class-action lawsuit against Facebook's alleged violations of its users' privacy.,168,4
Get it away from me!,169,4
BBQ place in Dublin,170,9
Milky Way over the Mcdonald Observatory,171,9
Created a beginning-to-end guide on how to install the 2TB Seagate HD that was circulated last week. It is so quick and so easy.,172,9
Thank you for putting Marshawn Lynch's holdout into terms I could understand.,173,4
Some guy put a lot of work into this cover of Prince Ali from Disney's Aladdin.,174,4
Colonel Chris Hadfield has been caught smoking weed....IN SPACE!,175,7
There's just no avoiding them.,176,4
(Spoilers ALL) Ned Starks motivation for everything.,177,8
Just wanted some Pringles,178,9
Following the mans rules gets you know where,179,4
Competition creates better internet: Google Fiber leads to Comcast doubling internet speeds in Kansas City,180,4
You are literally perfect *swipes right*,181,4
Official Discussion: Guardians of the Galaxy [SPOILERS],182,2
I've Replicated Thresh's Flay Bug,183,4
"Ying Yang Dove Crow. Nirvana, Glasgow.",184,5
World’s Park Rangers Murdered in Widespread Bush War – War underway in forests,185,2
"[Picture] A lot of work for one tweet, but damn, I lol'd.",186,4
Bald Eagle getting a health check-up,187,2
DyrusTage,188,1
I guess I don't count as an American,189,4
Twins,190,6
I don't know what a group of Redditors would be...,191,4
Maybe I need to get some of that,192,4
CosmoWright's Ocarina of Time Any% 18:10 run commentated,193,0
"Finally, an honest product review...",194,1
I got a new kitten to keep my dog company..,195,4
Now you're just showing off,196,8
"Sixteen years later, he's still my best friend.",197,4
[Poetry] David Guetta made a huge mistake at Tomorrowland 2014,198,4
A reminder to all of you how much we all screwed up in not voting Io Arcana (warning: paint),199,4
460 Million Internet-Connected Devices,200,4
MRW I'm talking to a girl at a bar after my third sentence,201,8
Since some of you mentioned I looked like her I decided to have a go at a sultry look inspired by Eva Green a'la movie 300.,202,9
My brother is finally home after serving in the military and I think my new rescue cat has become quite attached!,203,4
You can only raise a guy's mana cost soooo many times until he snaps.,204,9
"As a fat guy who has been trying to lose weight, it's nice to see progress.",205,4
Overheard these love birds at Olive Garden.,206,4
Massive gas explosions destroy Taiwan streets - video compilation,207,9
two of them also got gold...,208,4
"Congress approves $225 million additional funding to Israel, totaling $0.575 billion in past 2 weeks",209,4
"Wait a minute, Scully. What's the point of this test?",210,2
GOD DAMN IT!!,211,8
Now I just have to iron the rest of her!,212,4
Say goodnight Gracie,213,4
"Cheer up, Dexter",214,7
Lion-o Richie,215,5
Joe Machi - Friends Don't Let Friends Drive Drunk,216,4
What is an unrealistic expectation many people have?,217,9
Ninjas hate crunchy leaves. I assume they do. But if I'm being honest...,218,2
The Coney Island Rotor ride. Back when rides were fun and dangerous.,219,4
LPT- Pay yourself first,220,4
"You are forced to fight to the death with the last item you've purchased, what are your chances?",221,4
"Guy with friend in coma asks for help contacting The Offspring, Dexter Holland of The Offspring shows up in the thread",222,2
I etched a custom design into a steel bottle with salt water and a 9V battery.,223,4
No.,224,2
Thank you Riot for putting Phreak back on the LCS casters desk.,225,4
A photograph of me on my 18th birthday. Damn I was stylish in those days!,226,8
US calls Hamas attack 'barbaric' violation of Gaza ceasefire,227,4
Every. Single. Time.,228,4
not the intent of TSA's 3-1-1...i'm getting drunk on a plane,229,2
"Why Yes, These *Are* New Shoes!",230,4
New Digimon series in Spring 2015! Sequel of the Digimon Adventure 02!,231,1
The ‘do-nothing’ Congress isn’t even good at doing nothing anymore,232,4
Mom's (or Grandma's) Tupperware,233,9
"Hi, people call me prog. Former Smash Bros. commentator/caster/storyteller. Ask me anything.",234,4
Cat Playing Jenga (x-post from animalsbeingbros),235,4
That wasn't my husband who slept next to me last night (UPDATE 4),236,4
My dog can curl his tongue into a spiral when he yawns,237,7
Your face without muscles,238,9
Letting go,239,9
New leaked CoD footage showcases stunning next-gen graphics.,240,4
Essentially a baby Puss in Boots,241,8
President Obama signs cellphone unlocking bill into law,242,4
Aui_2000 next level play on Singsing's stream,243,2
"LPT: Unsure if something, eg an apartment, is a scam? Use reverse image search on Google.",244,4
Friends wedding photo...tripped me up at a glance.,245,4
I took a panoramic photo at a concert and lights changed in the middle of it. This is the result,246,4
I found the cutest dog in Berlin.,247,4
This is a cosplay.,248,9
One of the penguins escaped while I was at the zoo..,249,9
"News broke over-night in Toledo, Ohio - Microcystin contamination contaminating water supply. You can not even boil this away, avoid any contact with the water.",250,9
FallOut cosplay,251,9
The difference between cats and dogs.,252,8
TIL That America has 19 aircraft carriers. Compared to the rest of the worlds combined 12.,253,4
"As a lifeguard of 5 years, this crosses my mind every single day. It's a skill that will only benefit you!",254,4
"The Love Tunnel, Ukraine",255,8
This has gone too far.,256,4
I miss when she slept like this.,257,4
"At yesterday's Dodgers game, Jeff Bridges threw out the first pitch in character as The Dude.",258,9
"Before / After weight loss pics. suit-up edition (304 lbs ->165 lbs, 15 months)",259,9
A challenge you say? On guard!,260,4
Thanks for that useless fact,261,4
So I traveled to England and Ireland last week...,262,4
Not surprising.,263,7
Volkswagen earned my respect today,264,2
Who are you?! And why are you on reddit!?!?,265,3
Take that,266,4
When a physics teacher knows his stuff,267,8
ANARCHY!,268,1
"Seriously, do I have an Iron Anus or does everyone just exaggerate?",269,0
That escalated quickly.,270,7
Tiny knights battle,271,4
Came home to a kitchen full of catnip and this space cadet in the living room...,272,4
TIL that the season 6 blu-ray of Dexter had an unskippable trailer that spoiled that season's finale.,273,7
I have been working at an A&W (fast food joint) for 2 years and just noticed this about our main line of food products.,274,4
TIL Steven Spielberg declined to direct the Harry Potter movies and said It's just like withdrawing a billion dollars and putting it into your personal bank accounts. There's no challenge.,275,8
ᵐᵉᵒʷ,276,3
Well now you've gone and done it..,277,4
"Pretend I'm saying something much more intelligent & witty than I really am. Gilbert Gottfried, AMA.",278,4
Just got my diploma in engineering. I feel like I learned nothing to use in any future job.,279,4
Mesmerizing,280,4
So my boss kept asking why his battery was dying so fast.... He's pretty much had the stop watch running since he got the phone. 631 days,281,4
"Bill Murray joins the cast of 'The Jungle Book' alongside Christopher Walken, Idris Elba, and Scarlett Johansson",282,4
Zippo tricks are sweet.,283,5
form over function,284,4
So nosey,285,3
"Now that man is a genuine steel-belted, gear-jamming rig jockey",286,9
I live near Boston..,287,4
It's My First Birfday!,288,4
That moment you realize your song is now bigger than you,289,4
Normal is relative,290,4
The heavens were opened on my dog on this morning's hike.,291,4
"Windows 9 Could Be Free for Windows XP, Vista, and 7 Users",292,4
"Low testosterone could be what made us civilized humans: According to a study published in Current Anthropology, our transition into modern civilization might have coincided with our species’ drop in testosterone.",293,4
it's unusually cold here in Australia,294,5
Why would they do this?,295,4
Just some red pandas playing in the snow,296,8
Finally snapped a pic of this albino fella in my backyard,297,4
Trimming a sidewalk,298,4
Can't dance?,299,9
The cat makes this look a lot easier,300,4
I've never wanted cheap chinese merchandise this badly,301,4
What is your favorite fun-fact about the human body?,302,4
A cube made out of one way mirrors,303,4
President Obama signs cellphone unlocking bill into law.,304,4
[No Spoilers] Best Cosplay seen today at Tampa Bay ComicCon,305,9
The baby cobra's skin is so translucent you can see it's veins and heart,306,2
Seaside Grotto Restaurant in Italy,307,4
These grammar police,308,4
Our dog and new kitten are learning to coexist,309,4
Dutch ban display of Islamic State flag,310,4
"MLB trashes ISPs, doesn’t like the FCC’s ‘fast-lane’ plan one bit",311,4
How to paint around your thermostat (nest),312,9
The economy is rough and you don't know their stories so shut up.,313,4
The coolest way to kill a creeper,314,9
On the edge of a lava ocean,315,0
"TIL in 2002, while returning to the US, the USS John C. Stennis aircraft carrier stopped in Australia, where the sailors wore out the local sex workers to the point the brothel had to close down temporarily.",316,4
MRW Guardians of the Galaxy finished,317,2
Kentucky House Speaker Greg Stumbo: We Shouldn’t Give Tax Incentives for the Noah’s Ark Theme Park -- There is separation of church and state,318,4
How did you get fat?,319,4
My GF said this when her face cleared up in 2 weeks after giving up and using nothing.,320,4
What happens when things aren't attached to the floor on a cruise ship,321,4
Kings Landing entirely built in Minecraft.,322,2
"Jesus IMDB, spoilers.",323,5
Importance of eye makeup,324,9
What the hell is going on here?!,325,4
Happened when I worked Sundays at a drive-thru. I put it back in her bag between napkins.,326,4
Bad luck chilli,327,9
House Republicans made a dead-of-night rule change that has gone largely unnoticed,328,4
Why do Peasants think PC gaming is so expensive?,329,4
The Fast and the Furious,330,4
As a college student living with 2 other male college students...,331,4
Rough seas,332,7
Shy fox gets food from a person,333,4
Where the white man went wrong,334,9
This is MY puppy! Get your own!,335,3
Never thought of the relationship like this.,336,4
"A normal day in Red Brick Park, Yokohama",337,4
duck duck duck...,338,0
MRW A website asks me to pick my country and the United States is the first option,339,4
The rental computer at Staples make more per hour than the people that work there.,340,9
My sushi chef friend made this yesterday. I want to eat all of it.,341,4
Bring it here!,342,4
I made an illustrated glitchy hand in the rain gif,343,4
This is not photoshopped.,344,1
Old School - Cigarette Card Life Hacks from 1900 to 1910,345,4
Criticism of a YouTube channel (Achievement Hunter) gets a constructive reply from channel founder (Geoff),346,7
You'll be happier this way.,347,4
She gets so excited when we go for car rides...,348,4
Took a sugar glider selfie today. This is a split second before he jumped from my arm and perched himself atop my phone. Meet Dmitri!,349,4
Glad I didn't go overboard when I decided to get a cat,350,4
Found in an Ikea store.,351,4
Sometimes honesty is the best policy.,352,8
36 different ways to hide secret doors.,353,4
Teenage Guy Problems,354,4
"Global warming is a hoax, says Louisiana congressional hopeful Lenar Whitney. We’ve lost track of how many times we’ve fact-checked climate change denial claims and found them to be False or Pants on Fire.",355,4
What do you call a Bosmer who joins the Bard's College?,356,2
"93 percent of the members of the National Academy of Sciences, one of the most elite scientific organizations in the United States, do not believe in God.",357,1
I'm a little proud of myself for these. [X-post],358,4
I've been waiting six years for this occurrence.,359,4
Scientists Discover Massive Species Of Extinct Penguin,360,5
My view when I'm on the laptop most of the time,361,4
"I don't care how lazy, tired, or inconvenient it is.",362,4
Italy as seen from the ISS 200 miles above earth,363,4
Pronunciation of Ambulance - Garrard McClendon,364,3
"I think you're old enough to understand now, son...",365,4
A 26 year old Joe Biden [1964?],366,4
Growing older taught me not to care,367,4
"Living in Britain, I hate these things",368,8
Tired girl..,369,5
"Girl says she dropped her phone in a cake, has over 5000 retweets",370,4
The most awesome way to eat jello in public,371,9
Racing Game Logic,372,9
Classic David.,373,9
"Well, that's embarrassing.",374,9
I'm not even going to argue with that. At least he's not a complete peasant.,375,4
Poké centers really do exist!,376,4
Plumping your pillow,377,6
She actually said she wants a pianist...,378,4
"If you could attach a GoPro to any human or object through history, what would it be?",379,4
Go Figure...,380,9
She got REKT.,381,4
How many rights should we give the people? [OC],382,4
"The results are in, here are the most hated NFL teams in each U.S state!",383,4
Curry knows his limits.,384,8
[Haiku] Schizophrenic Robert De Niro,385,4
China admits pollution has caused 'cancer villages',386,2
"Never thought I'd own a cat, but this little pile of hair and razor blades is freaking awesome!",387,4
A change machine always contains the same amount of money.,388,4
More than a third of the 140 rockets fired by Hamas at Israel yesterday fell short and exploded inside the Gaza Strip,389,4
Matilda is the G version of Carrie.,390,1
[Image] Think Plan Execute,391,4
DIY Arcade Coffee Table,392,8
Harold's Pride and Joy,393,6
This wall is supposed to be preverved in a French children's museum to showcase childhood dreams,394,9
"TIL that there's a Cartoon Network special crossover episode called The Grim Adventures of the Kids Next Door, also featuring Ed Edd n' Eddy, with cameos from the Powerpuff Girls and Dexter's Lab among other shows.",395,8
Am I doing this correctly?,396,3
"My ice cube is the exact size of the cup, so it holds back the water.",397,4
