Title,doc,topic
City of London Police have denied a Freedom of Information request for access to correspondence relating to The Pirate Bay. According to the police it would take more than 18 hours to locate the requested information and would therefore cost too much money,5769,4
Week 1 of Fatherhood (2014) - Eating Out,5770,4
My reaction to seeing Cappuccino flavored potato chips.,5771,6
Sunday at my parents house...,5772,9
I got tricked by a tricksy blind man.,5773,4
It's all in your head [image],5774,4
I've been going about this all wrong.,5775,4
My father made this floor in his house. What do you think Reddit?,5776,4
Paris.,5777,5
I have sensitive skin,5778,9
Actor Richard Attenborough dies at 90,5779,9
The Real Mr. Smooth,5780,4
Triple Rainbow,5781,9
He moves when you pull on the roll of TP,5782,2
TIL Kevin Spacey was originally slated to play the president in Independence Day. Studio executives insisted the part be rewritten for Bill Pullman because they felt Spacey was incapable of starring in blockbusters. He won his first academy award 10 months later.,5783,4
Watching P&R and noticed this origin story.,5784,2
[gore] I asked a Best Buy agent what I would need to play games at max settings...,5785,4
Can't argue this!,5786,9
I accidentally dad-joked my wife yesterday,5787,4
"Redditors, do you know someone that has followed through with their if we're both not married in 10 years... marriage pact?",5788,4
Noticed this after playing the Podracing game on the N64 again.,5789,8
When someone calls customer service...,5790,4
A machine that produces paper planes.,5791,4
They aren't pets. They aren't toys. The fact that you don't see the mother doesn't mean that they're abandoned and somehow up for grabs.,5792,4
My friend's hamster looks like a cartoon,5793,4
I definitely miss this show.,5794,4
MRW there's one more or fewer steps on the stairs than I thought.,5795,4
I have no idea where to start with this,5796,4
[X-post /r/teenagers] Our new school IDs have these on the back. I can't appriciate this enough.,5797,4
She's so sweet until you tell her she can't have any of your cereal...,5798,9
Getting Hassled By The Man,5799,9
"Since a straight line only needs two points, you and I are perfectly lined up right now.",5800,4
We tossed her right out of the kitchen.,5801,4
I guess there just wasn't much to say.,5802,4
"Pencil portrait, I've made 2 years ago",5803,4
Hand Balancing,5804,4
My friend is going to die a virgin,5805,4
Opened my drink to find this,5806,4
PsBattle: Behind the Scenes for Guardians of the Galaxy,5807,2
"[Spoiler] Curse vs Counter Logic Gaming / NA LCS Summer, Playoffs Quarterfinal / Post-Match Discussion",5808,9
Going to the bar in your 30's,5809,8
My brother proposed to his girlfriend yesterday. This serendipitous photo of the engagement ring happened!,5810,4
Hmm... I think we all need to refresh our memory of the bible,5811,9
"My son decided to save up money and build his own PC at the start if the year, his PSU only lasted 4 months, he was crushed until...Amazon support.",5812,4
Didn't realize how gross the tattoo is until I read the name,5813,4
I thought it was a new design at first.,5814,4
Pretty English thatched house.,5815,4
Mosquito.,5816,1
How I think some Americans currently view the rest of the world.,5817,4
The Council Has Spoken!,5818,2
Here’s a part of an aircraft that you don’t get to see - the crew rest compartment on Emirates' Boeing 777s flying on long-haul routes.,5819,4
Heading for work after 3 and a half month break.,5820,4
BBC News - 'Widespread methane leakage' from ocean floor off US coast,5821,4
What would be the cruelest item to drop to a person stranded on an island?,5822,4
I went to my surprise birthday party last night and was gifted this Reddit cake,5823,4
Mimi doesn't give a hoot,5824,9
Someone Yelp reviewed the liquor store near my house after it burned down.,5825,4
Out of the Park,5826,4
The Haunted Hotel Of Colombia (xpost/woahdude),5827,8
"SO was saying I never take her on trips, she thought my response was clever and didn't even get mad",5828,4
I was on a train for the first time in a long time.,5829,4
TIL that exactly 200 years ago today the British captured Washington DC and burnt the White House to the ground.,5830,4
"We both deal with it, stop complaining",5831,4
Nuclear bomb less than a millisecond after detonation,5832,4
Asiago tenderloin cheesesteak,5833,5
My parents adopted a formerly abused dog with one of the most human faces I've ever seen. Meet Miley.,5834,4
Fire tornado,5835,9
"Don't worry, it's safe!",5836,3
TIL that Vermont (42% gun ownership rate) had the lowest rate of gun murders in 2010: only 2,5837,9
Great thought... poor execution.,5838,9
My Girlfriend Texted This To Me,5839,4
PSN apparently down because of DDoS attack.,5840,8
They fell asleep holding 'hands'.,5841,4
Would anyone else really like Brendan Fraser to make a comeback?,5842,4
"TIL During the 9th century AD, two Vikings graffitied their names in the runes of Hagia Sophia. These carvings have survived since the Byzantium era, and are still viewable in modern-day Istanbul.",5843,4
Java update is ready!,5844,9
This Week in Science,5845,4
Best Friends,5846,4
Very accurate review of Reddit on the app store,5847,4
Only straight lines,5848,4
The Micky Mouse club in the early 30's.,5849,6
"That's not how abbreviations work, Asus",5850,9
My mom told me to buy a first aid kit for my new house. I sent her this.,5851,4
"My hero, the Dalai Lama, showing his sense of humour",5852,8
Freedom blanket 2.0,5853,4
Congo declares Ebola outbreak,5854,8
My friend,5855,9
Advertising 101,5856,8
"China, The source of fantasy.",5857,5
My parents rescued a couple of kittens who were abandoned in the woods. Not sure how well they're adjusting...,5858,4
Husband and wife accidentally discover a genie,5859,4
American Harry Potter,5860,8
The night before my wedding my little sister got an eyebrow wax and they caused a HUGE burn on her face. Luckily I had the most AMAZING make up artist swoop in and save the day!,5861,4
Alien vs. Predator,5862,6
Keep this in mind during your next journey,5863,4
"Still kinda refreshing, I guess.",5864,9
True Story.,5865,2
Witness Offered $3.50/hr to Testify Against Pirate Bay Founder Gottfrid Svartholm,5866,2
Dark net drug markets kept alive by great customer service,5867,9
"Hi Reddit, I'M Nick Mckinless; A professional Stuntman/Stunt Coordinator, Filmmaker and Strength Athlete. I have personal trained a few of Hollywood’s finest including Anne Hathaway, Ralph Fiennes and Mickey Rourke and worked on Troy, The Matrix and Kick-Ass to name a few. AMA!",5868,2
Am I the only one baffled by people like this?,5869,4
Are mouse macros cheating?,5870,6
"TIL Hitler was a vegetarian and against any form of animal cruelty. During movies in which animal cruelty was portrayed, he would cover his eyes and look away until someone said the scene was over.",5871,4
My Girlfriend Was Lecturing Me About Scaring Her with The GoPro I got Today,5872,4
I went away for college 3 years ago and this is what my parents have done to Gary,5873,4
"Fell asleep, foot in mouth. <3",5874,4
One of the saddest hidden story in Skryim.,5875,9
TIL Braille was originally created as a way for Napoleon's spies to read documents without needing any light. It was Louis Braille that pointed out the flaws of the code which created the version we use today.,5876,9
This is her I Love You face.,5877,4
My little Beaglador doing her part to help everyone know there's a firetruck coming!,5878,4
Found a clever graffitied movie poster in Brisbane - 'four reasons to get out of Australia',5879,4
"Bradford out for season, per Mort",5880,7
TYFC IndieGoGo page hacked and made look as if it was closed.,5881,9
(media) He Would Of Been 3 This Year,5882,4
TIL the Soviet Union closed down many churches and reopened them as Museums of Atheism dedicated to scientific education and anti-religious exhibitions,5883,9
MRW I finally learned how to make my own gifs,5884,4
Always yell Fore,5885,2
"For my cake day I present to you: Percy and Nico, attorneys at paw.",5886,4
Walked into my classroom and saw this.,5887,4
For those of you becoming adults,5888,9
High-tech out-of-order sign on Kiev ATM.,5889,9
"Blizzard, PlayStation Network and more have been under a huge DDoS attack.",5890,8
I wasn't even surprised,5891,9
This ad for a women's help centre in Munich uses the same picture as the First World Problems meme.,5892,4
ELI5: How does freerice.org work?,5893,5
Shhh,5894,0
That's not how school works...,5895,4
"I work at a bar, had the pleasure of serving this lady last night.",5896,4
You can trust him... He's a professional. [OC],5897,4
"Found these laying on the floor of my gym, oh the irony...",5898,4
"[Serious]CPS workers of Reddit, what are some horror stories that you've encountered?",5899,2
Fake Gamer Boy,5900,4
Good Guy Kid. Doesn't get enough appreciation around here.,5901,4
"[Spoiler] Team SoloMid vs. Dignitas / NA LCS Summer, Playoffs Quarterfinal / Post-Match Discussion",5902,9
TIL Every single 2K Game is banned in China,5903,2
The Drill Team (x-post from /r/gifs),5904,9
My new roommate is a GGG,5905,4
"How my friend mines for caves, kinda trippy",5906,9
Wanna go for a spin?,5907,9
You don't have the required grades...,5908,6
What quote or saying changed your life? [Serious],5909,4
Car right before it hits the water,5910,4
For my two year cake day...,5911,4
Every damn time.,5912,4
Enjoying my sweet new bluetooth nes controller on my phone with an old fave...so much better than touch screen!,5913,4
[SPOILER] Doublelift on CRS vs CLG,5914,9
The regeneration cycle - the fandom's reaction every time there's a new Doctor.,5915,4
"Gary Schwarts, who does the voice acting for the Heavy character, came in to the bar I work at last night and gave me a proper shout out! Someone told me to post it here. I hope you enjoy!",5916,9
Mine. All mine.,5917,1
There's no kill like overkill (Legend of Galactic Heroes),5918,8
a vandal did the math,5919,6
[Spoiler] The Epic replay from the NA Challenger Series #2,5920,9
Muslim leader (and ISIS supporter) Anjem Choudary once said anyone who drinks should be given 40 lashes in public. He also tried getting these pictures removed from the internet.,5921,4
MRW I'm at a movie and the person in front of me stands up,5922,4
Grandpa learns how to play FPS,5923,2
3 Chinese Tortures :).... Trust me You will love it.,5924,4
Time for the duck to go back to dispensing actual advice.,5925,4
Watch it buddy!,5926,4
Look what came in the mail today!,5927,9
After an internship at EA,5928,0
Blizzard vs. Valve vs. Blizzard,5929,2
Shark God.,5930,3
"This little guy chilled last night with us, he stayed for over an hour and then took off.",5931,4
I work at Subway,5932,9
Aww my balls,5933,4
"[Serious] Has anyone ever had an ex boyfriend, girlfriend or partner kill themselves after the break up?",5934,4
My wife getting a hug after feeding an abandoned baby squirrel that she's been taking care of.,5935,4
Hacker threat diverts flight carrying Sony Online president,5936,4
Stand on your desk. What are they going to do?,5937,4
Allow us to turn off cooldowns in Custom Games to practice combos,5938,4
I wanted to delete the video of my niece because it seemed soiled beside that picture,5939,9
The Joys of Childbirth,5940,6
"Stopped at an intersection, saw this. The irony.",5941,4
Lions were fed frozen blood during the heatwave in Melbourne,5942,4
Those cherry blossoms look pretty.,5943,9
"No, we're too busy to fix that properly.",5944,2
"TIL That dolphins give each other unique names, just like humans. They use distinctive whistles to identify each other.",5945,9
My slow cooker,5946,8
Good guy cockatoo,5947,4
After an internship at Microsoft...,5948,0
Came home to trash everywhere in the house. Compelling evidence found.,5949,4
A prosthetic Arm I made for a friend,5950,9
How they prevent people from urinating in public in the Czech Republic,5951,6
Recently our local news covered some flooding in a nearby town. This guy noticed the helicopter and rushed outside to pose with his hulk statue.,5952,4
Suckers,5953,1
I threw a party last night and somehow somebody managed to steal my couch...,5954,9
"If I touch my phone in the right places, a pizza will show up at my front door.",5955,4
The most hardcore handshake of all time.,5956,4
After an internship at reddit,5957,4
This is why we should use the Imperial System,5958,9
Orion deserves some credit. (Resubmitted),5959,8
Comcast customer gets bizarre explanation for why his Internet won't work: Confused Comcast rep thinks Steam download is a virus or “too heavy”,5960,4
Row row row your boat,5961,9
By far the best prank call on simpsons.,5962,9
Super-mega-faceplant,5963,3
"This is what a £125,000 sim racing setup looks like.",5964,8
$107 Rustic Cabin Man Cave I Built In My Basement,5965,9
Amazon Buying Twitch for Nearly $1 Billion,5966,4
I recently got 100Mbps Fiber Broadband..,5967,4
The Little Engine That Could Not,5968,4
"A typhoon hit my school today (Busan, South Korea)",5969,4
"TIL that the Tesla Model S scored 5 out of 5 stars by the National Highway Safety Administration, the highest in the history of the automobile. It even broke the machine that was intended to crush it during a rollover test.",5970,4
Found this today at Aaron Paul's scavenger hunt in LA!,5971,2
"Medical marijuana laws may reduce painkiller overdoses -- States that have legalized marijuana for managing chronic pain have significantly fewer deaths from prescription painkiller overdoses each year, according to a new study published Monday in JAMA Internal Medicine",5972,4
TIL there is a homeless shelter organization called My Friend's Place so that those in need don't also have to go through the embarrassment of telling others that they're homeless.,5973,4
"Spent the weekend at a comic con, and this is the only photo I took.",5974,8
Product Placement at its best.,5975,4
I changed my sister's bathroom art while dog sitting. She still doesn't realize that it doesn't say HOPE.,5976,4
Homer Simpson is [10] guy,5977,2
Otter sitting at the kitchen table eating dinner,5978,4
Poor innocent clementine..,5979,4
Have a quick look around,5980,9
Zorba has two eye colors... in each eye.,5981,2
This Belgian medieval armor looks like a really happy anime character,5982,4
A face was scuffed into my car after a minor car accident...,5983,4
One of My Dads,5984,9
TIL there is an abandoned subway station under City Hall in New York that no train stops at but that you can see in passing if you take the number 6 train,5985,4
The last Pokemon game I played was Silver; this is my entire journey so far in Pokemon: X.,5986,9
Vandal Eyes,5987,6
So I turned into a toad last night...,5988,4
These people stood in line under the shadow,5989,4
My Name is Ken - A quadriplegic who plays and streams Diablo 3.,5990,7
The retail store I work at just got an order of Canadian Spidermen,5991,4
Simpsons Marathon--Words of Wisdoms,5992,4
Let's take a selfie! -- no,5993,4
"Dear MTV, Lorde is not Rock.",5994,7
"TIL that sniper bullets can travel for so long, the rotation of the earth will move the target",5995,9
Revenge sometimes doesn't work out.,5996,4
"MR when I saw a very morbidly obese guy exercising at the park by walking a few laps, trying to do a pull-up, and then a few standing up push-ups using the metal gymnastic bars set up there",5997,4
But if a child says then you know...,5998,9
My co-worker. I thought about making this a Scumbag Steve but I felt Insanity Wolf was more appropriate.,5999,4
"I worked as various princesses at Walt Disney World in Orlando, Florida. AMA!",6000,4
Federal Law Ordering US Attorney General To Gather Data On Police Excessive Force Has Been Ignored For 20 Years,6001,4
Probably the greatest feeling in the world,6002,4
"We're all curious, especially when they're in the negative.",6003,2
This is a puppy Australian Shepherd Husky,6004,2
"When your gun store is being robbed, your best weapon? A dog.",6005,4
"What movies claim to be based on a true story or an actual event, but is actually a lie?",6006,4
Match Box,6007,4
After an internship at Reddit,6008,4
"The Hunt For Red October starts out in Russian, then switches to English in an early scene as the political officer reads the passage from the Bible. The switch occurs on the word Armageddon",6009,8
My buddy is either desperate or completely insane!,6010,4
Sometimes the line between best and worst parents is sort of murky,6011,4
Exclusive Pants,6012,9
Taylor Swift at the VMAs,6013,3
Australia: Conservationists making last ditch plea to fed. govt to help prevent endangered black cockatoos from becoming extinct due to the felling of their pine forest - “Perth people love their birds & this is an iconic species. We need the state & federal govt to take urgent action over this.”,6014,4
Googled Who's a good boy - was not disappointed,6015,4
Jesus to Aisle 3,6016,4
The T-Rex was ahead of his time.,6017,4
What is your favorite to change a light bulb joke?,6018,9
He would of been 3...,6019,4
How to ruin a party with a carrot,6020,2
New Foxcatcher poster featuring Steve Carrell.,6021,4
MRW another guy makes my girlfriend laugh,6022,4
the best ice bucket challenge post i've seen thus far,6023,4
There should be an ELI65 to help seniors around here who want to get caught up on things in the world.,6024,4
ELI5: How has Stephen Hawking lived so long with ALS when other people often only live a few years after their initial diagnoses?,6025,4
TIL Bicycle cards sent decks containing nothing but the Ace of Spades to troops during the Vietnam War to be used in psychological warfare.,6026,4
"What does a girl from America bring to a potluck in Australia? A snack stadium, of course.",6027,6
Religion comes from the period of human prehistory where nobody had the smallest idea what was going on. Today the least educated of my children knows much more about the natural order than any of the founders of religion. C.Hitchens,6028,4
TIL Wookie designs come from a George R.R. Martin novellette,6029,4
MRW I'm at a party and I remember I had homework due,6030,2
What a way to start my day....,6031,4
"A handsome Hansom cab, NYC, 1900. colorized by me",6032,5
Loris eating a banana.,6033,4
British police at Notting Hill Carnival!,6034,4
Today's harvest from the garden ☀️,6035,2
"Israeli Prime Minister Benjamin Netanyahu's approval rating hits 38%, down from 82% last month.",6036,9
"I'll admit, i underestimated the size of Africa.",6037,7
It's confirmed. Twitch bought by Amazon,6038,9
"Scientists have found one new gold molecule, a catalyst containing exactly 25 gold atoms, that is powerful as well as sophisticated. It catalyzes the conversion of a variety of molecules, including the transformation of poisonous carbon monoxide into harmless carbon dioxide",6039,4
I see you also have good taste in art.,6040,4
Airstrike in Gaza,6041,3
"In fact, I'm doing this right now.",6042,4
"TIL Danny DeVito produced Pulp Fiction, Gattaca, How High, Man on the Moon, and Garden State",6043,9
How could a store sell this and not expect it to happen?,6044,4
The first puppy to leave me speechless,6045,4
"TIL Around 1000 of the world's approximately 5,000 languages are spoken solely in New Guinea.",6046,4
Going through my late grandfather's things when suddenly Hitler,6047,4
Poor Will.,6048,4
"As a Reddit user for almost a year, who has yet to go over 200 combined karma on several accounts",6049,4
"Respected Canadian medical journal that was sold to offshore owners last year is now printing scientific junk for hire, but still trading on its original good name. (Cross-post to /r/EverythingScience, subscribe for more general science submissions!)",6050,4
I'm forever grateful for this GGG.,6051,2
Got splashed filling up my cup,6052,4
"Walking back to your hotel room, when you realize that you are facing a clock tower with torture chamber beneath, and across the street was the house where Vlad the Impaler, a.k.a. Draculae, is said to have been born in 1431.",6053,4
"My University uses a lottery system to assign dorm rooms, a student who got a bad pick made this video",6054,4
"Checkmate, atheists",6055,8
Should I... should I tell somebody about this?,6056,9
"Oh C'mon, Phrasing!",6057,2
mom had idea to build $100 pond in a weekend. 3 weeks and several hundred dollars later...,6058,4
1 bit SSD,6059,4
What do women want?,6060,4
Zelda Mural,6061,2
Time to cancel my LA Fitness membership as well.,6062,4
Old Mill in Colorado,6063,4
More Chili Peppers = More Heat,6064,8
First look at Keanu Reeves as John Wick,6065,4
"TIL Weezer's first gig was opening for Keanu Reeves's band, Dogstar",6066,4
Brother went to the zoo and caught this baboon having an epiphany,6067,9
As someone with extreme difficulty understanding accents,6068,2
My wife made Welcome back from Africa cake for her brother,6069,4
Bill Nye accepted our invitation to play some disc. So much respect for this guy.,6070,4
[S04] That's why he's Hand,6071,4
My grandpa on his Harley ca. 1955. Grandma made him sell it after my dad was born.,6072,4
"Destiny in Times Square, NYC! Insane!",6073,0
When my SO tells me to stop behaving like a robot and suppressing my emotions,6074,4
My wife let this one slip when we moved in to our new place...,6075,4
TIFU by thinking that today was Labor Day,6076,4
What's the dumbest thing your pet has ever done?,6077,2
In the Comments Section of Every Cooking Recipe Online...,6078,9
Idiot keeps his finger on the trigger.,6079,2
A strange day being a satellite technician in the south. The mother said her kids get along great.,6080,4
Nice change from the NObama stickers,6081,4
The American Hogwarts Houses,6082,6
Getting ready for work today,6083,4
This very geometrical photograph,6084,8
Our newly adopted kitten disappeared in the house. Was about to give up looking when I heard a tiny mew from the bed.,6085,4
Polish immigrant to the UK explains what aspects of British Culture baffle him,6086,9
My Biology professor has a great sense of humor.,6087,2
Earthquake early-warning system gave 10-second alert before Napa quake felt,6088,9
One of the perks of living on a farm,6089,4
A reminder to everyone complaining about MTV's choice of artists to award.,6090,4
A man doing market research for Vaseline knocked on a door...,6091,9
Random stuff that baffles me as an immigrant,6092,9
"30 Metre Wide Sinkhole Appears in Durham, England - So deep its bottom can't be seen. Gaping void discovered by woman walking dog, still growing in size. The sound was phenomenal. We could hear rumbling & smashing & crashing from down below.",6093,4
The Autumn Adder from Indonesia,6094,3
My brother took a picture of me while we were kayaking to a glacier in Alaska. It looks like something that could be on National Geographic to me.,6095,4
Ok.. Sorr-wait,6096,8
When I ask the girl I'm talking to what she wants to do for a first date and she responds with Take-out and Netflix.,6097,4
I didn't eat a single one of them before i was done. X-post from r/pics,6098,4
48-inch shell firework,6099,8
"India’s ‘Untouchables’ Still Being Forced to Collect Human Waste by Hand - Practice of forcing low-caste people in Indian communities to remove accumulated human waste from latrines is continuing despite legal prohibitions, according to new report.",6100,4
"I really enjoyed Psycho-Pass. I tried to draw some fanart, but partway through I realized I can't draw.",6101,4
Do not open that door.,6102,8
Heard people may like this photo on here.,6103,4
Pokemon ALS Ice Bucket Challenge!,6104,4
[Image] Discipline is just....,6105,4
Asking all the important questions,6106,8
Gaming journalists Patricia Hernandez of Kotaku and Ben Kuchera of Polygon have published articles in which they have a conflict of interest,6107,9
"Today I adopted from the Humane Society, Meet Dobby the Kitty.",6108,4
I hide 3/4's of my news feed.,6109,9
Home from summer vacation what's that smell?,6110,2
Any love for Blank Check?,6111,4
Oh boy Oh boy,6112,2
"TIL Chris Farley collapsed in an attempt to make a hooker stay with him after a money dispute. She then took pictures of him, stole his watch, and wrote a note saying she'd had a lot of fun. His last words were Don't leave me.",6113,4
Saw this lovely couple yesterday,6114,4
Ran into a gentle Giant tonight...,6115,2
Elephant diverts the attention of an attacking Rhino by throwing a stick,6116,9
"Actual Advice: If you need to call a company and they hide their contact phone number or put you through a lengthy automated answerer, this website has the numbers and tells you how to get a live person on the phone.",6117,4
My ex got upset when I was in town and didn't make any effort to see her.,6118,4
My setup w/ a view,6119,4
Amazon buys Twitch,6120,9
Weeeeeeee!,6121,5
Help fight type 1 diabetes by acquiring type 2!,6122,2
Director Colin Trevorrow shared this photo featuring a tribute to John Hammond (played by the late Richard Attenborough) on the set of JURASSIC WORLD,6123,4
Man destroying paprika jar with baseball bat [source and html version in comments],6124,9
A column of Russian tanks and armored vehicles has crossed into southeastern Ukraine,6125,8
"Found myself in a bit of a predicament today, GGG found me.",6126,4
Good guy Shroud.,6127,4
"Each tick a startle. Can't take it, can't stop it.",6128,9
"To earn the love and affection of a cat you have to understand, relate and empathise with them. Otherwise they will turn their backs to you. It is especially rewarding to know the love of a cat, because they don’t give their love to just anyone. This is a picture of my mum with my cat, Saphira.",6129,4
Away team cosplay,6130,9
A task usually handled by a gf but I'm single so knock yourself out I guess?,6131,2
Didn't believe my eyes,6132,6
End of season rewards and Victorious Skin announced.,6133,4
TIL Kalos E4 are named after plants for some reason,6134,4
Revenge is sweet!,6135,9
PsBattle: Angela Bermudez cosplaying as female Sheppard from Mass Effect [800 × 1302],6136,4
