Title,doc,topic
This is what goes through my mind anytime I see the new Geico commercial...,1956,4
What is the estimated total population of uncontacted peoples?,1957,2
9V battery belt,1958,4
"Guy I barely knew in high school began harassing me earlier this year saying he liked me, then he backpedals and claims it was all a joke when I reject him. This guy is around 26 years old.",1959,4
"This pic was tweeted by Bad Robot, The C3ped Crusader. (x-post r/batman)",1960,2
A tiger being really nice to a lion,1961,1
Rocky relationship,1962,9
Some people are really clever...,1963,4
Even my car can do 1080p 60fps,1964,4
"Obama agrees with teens for less homework in exchange for RTs, can confirm am Mr. President",1965,2
First Ebola patient arrives in Spain under tight security,1966,4
I was told y'all might like this. I took my bike apart.,1967,4
I've been under the same AT&T contract for six years. I still have no data limit. This is how much $52 (plus tax) gets me per month.,1968,4
"24/F down 45kgs so far... I am still 30kgs+ from my goal, but finally feeling like I can see some progress",1969,4
Chocolate Dipped Matcha Green Tea pops! xpost from /r/icepops :),1970,6
What truly gets better with age?,1971,9
"Piracy police arrest Nottingham man, 20: Apparently running a proxy server is a copyright issue now.",1972,4
I call it SnapCat,1973,2
Urban Dictionarys definition of Creationism,1974,2
Still my favourite cat gif.,1975,4
Owain with a rare moment of scathing wit. (Fire Emblem: Awakening),1976,8
"TIL that in the 1980s Fats Domino decided he would no longer leave New Orleans, claiming he could not get any food that he liked any place else. He refused to go to his induction to the RocknRoll Hall of Fame and an invitation to play at the White House. (xpost from r/NewOrleans",1977,4
My Gaming Sleeve that I have been working on for 3 months and waiting to show you guys =).,1978,9
MRW I stand up after browsing Reddit for 30 minutes on the toilet.,1979,8
He wasn't a good fit but DAMN.,1980,8
"When a dhole pack scores a kill, the first to eat is not the alpha male, but rather the pups",1981,4
Now I ain't sayin' she a gold digger,1982,3
The best Dad joke in film history,1983,4
"Every year, our Navajo Code Talkers graced our parade with their presence. And every year, the group of World War II Marines got smaller. This year, their float was empty.",1984,4
"Was chatting to a girl and her friend at a bar, heard this when I went to go to the bathroom...",1985,4
"Do you need a blood sample too, Facebook?",1986,9
My 10 year old daughter's attempt at Bob Ross's The Joy of Painting. Not bad.,1987,4
"TIL In 2011, people playing Foldit, an online puzzle game about protein folding, resolved the structure of an enzyme that causes an Aids-like disease in monkeys. Researchers had been working on the problem for 13 years. The gamers solved it in three weeks.",1988,8
When you're getting driven home after getting stupid drunk,1989,4
"Facebook Messenger is no. 1 in app store, has one-star rating",1990,4
French MPs propose forcing supermarkets to hand over all unsold food to charity,1991,4
Let me go! I am the night!,1992,9
What cops do to you in China if you drive around with high beam,1993,4
It always amazed me how cats can look so comfortable in the most uncomfortable places.,1994,4
I hope this rain slows up,1995,9
The shadow cast by pegs on my clothes line looks like a rock band finishing a set.,1996,4
Darwin approves,1997,3
This guy goes around the neighborhood selling bar b que like an ice cream truck guy on the weekends.,1998,4
What are the YouTube videos you constantly feel the need to show people?,1999,4
Seriously. Why am I wired like this?,2000,4
The ocean is inside of this opal.,2001,0
Do not listen to the idiot that suggested burning poison ivy.,2002,2
Word.,2003,5
Tico is my kind of dog,2004,4
"Homs, Syria. 3 years into the civil war",2005,4
NSA Tried To Delete Court Transcript In Lawsuit Over Deleting Evidence,2006,4
Two buddies I took a picture of in Paris,2007,4
I forgot a song's name and typed this to google without any hope. I'll name my first child Google.,2008,7
Well I know where I'm getting murdered...,2009,4
Ali G on sexism,2010,1
My parents dropped by today. They recently took up beekeeping.,2011,4
The new art displayed at Tesla Motors. Evolution,2012,4
"I lost $6,000, my best friend, and the girl I thought I was going to marry...",2013,4
Joker has his limits.,2014,3
TIL James Cameron altered the stars in the night sky of the raft scene in Titanic 3D after Neil DeGrasse Tyson sent him a snarky email pointing out that the star field would have been different in 1912.,2015,4
Flying mountain.,2016,7
Heartfelt card from my brother to my parents.,2017,9
"TIL that after his abdication, Murad II of the Ottomans received an angry letter from his 12-year-old son, Mehmed: If you are the sultan",2018,4
What Soaking Is,2019,5
"Say hello to Vale, 8 weeks old today",2020,4
Fish sandwich,2021,9
"Saw this at a local store, no love for bulbasaur :(",2022,4
We took up beekeeping last year. I built the hive myself and we got a small harvest before the winter.,2023,4
Betty Boops new human. Courtesy of Sunny Saints St Bernard rescue. <3,2024,1
Apple is no longer Apple – but Tesla Is: The reshaping of the car industry has all of the drama and big personalities that defined the phone industry seven years ago,2025,4
Oh no.,2026,2
This is what 5 day old Emus look like.,2027,4
Only thing Rocket's patient with,2028,2
It ain't easy being cheesy,2029,3
IamA American Prisoner of War who was imprisoned for 6.5 years & returned there 20 years later to meet they guy credited with my capture. AMAA!,2030,4
That determination,2031,0
In response to the guy whose roommate brought an extra girl home for him,2032,4
Who You Gonna Call?,2033,9
View out of a McDonald's in Austria,2034,4
So..what exactly am I buying?,2035,4
Salvation Army SCORE!,2036,4
"I'm 31, male, and not very proud of myself right now.",2037,4
TIL that during WW2 the Allies discovered that the Germans were using the Leaning Tower of Pisa as an observation post. A U.S Army Sergeant that was sent to the tower to confirm the presence of German troops was impressed by its beauty and decided to not order an artillery strike on it.,2038,4
"Because some of us can't afford a$100,000 car",2039,4
Storm over ocean,2040,0
Jedi Entrance Only,2041,4
The wish of an 11 years old Israeli boy,2042,4
First of a kind stem cell therapy reverses brain damage caused by stroke in human trial,2043,4
American football is like a turn-based strategy game while soccer is like an real-time strategy game,2044,9
Don't leave your squirrel at the scene of the crime,2045,4
One of these things is not like the other...,2046,4
My grandfather told me this before he passed.,2047,4
Jägerbomb bartrick at Heidis,2048,2
He wonders why he didn't get approved.,2049,9
Clayton Kershaw's amazing curve ball,2050,4
The end of the world,2051,4
What is the worst thing you have ever witnessed another person do?,2052,2
"MRW I found out freshwater snails kill 10,000 people a year",2053,4
Jubilee trifle anyone?,2054,0
"Yeah, I'm glad they be all like that",2055,2
"Three year tracking of supernova prove its the source of cosmic dust, the building block of planets: by year 2 enough ejected to make 830 Earths",2056,4
NSA Tried To Delete Court Transcript In Lawsuit Over Deleting Evidence,2057,4
MRW I turn on my phone camera and the front facing one is still active,2058,4
The eagle eye,2059,2
I call this 'Pregnant Woman Smoking at a Gas Station next to the Blob.',2060,2
"White Teacher Wins $350,000 in Racial Lawsuit",2061,9
See this hat? Tis' my cat.,2062,4
"Coworker aggressively came up to me and asked,  WHY YOU GOT THE MOST PERFECT MILK CHOCOLATE SKIN!?",2063,4
When I take her outside to go potty she just sits down and looks at me like this.,2064,4
"When my room mate, who claims she is OCD, is only OCD when it involves the actions of others.",2065,4
"So my gay grandfather recently passed away, and today is the estate sale. The company organizing it put this with the Christmas ornaments for sale...",2066,9
A ferocious jaguar cub.,2067,9
The story of a girl who waited until her wedding night and regretted it,2068,4
Found this guy's car today,2069,4
Father Ted,2070,2
"TIL on September 11, 1857, a group of Mormons dressed up like Indians and massacred about 120 men, women, and children who were traveling through Utah in a wagon train.",2071,8
Mesmerizing..,2072,2
In light of recent events,2073,4
This is a charcoal and ink drawing I did in 2012 of a man I met at a homeless shelter. His name is William.,2074,9
Amazing Steve Irwin tribute painting.,2075,9
Redditor offers to pay for a user from the UK to see his dying Grandmother in Canada,2076,4
Dartmouth student wants to carry gun on campus: I got responses like,2077,4
"My brother works in tech support, I got him these shoes",2078,4
My little bro decided to take up painting and just blew my grandmother's mind:),2079,4
Better than hamburgers,2080,9
"My slice of American life. It might not be much, but it's mine.",2081,4
"It's really good for my image. Plus, its such a fun YouTube channel to watch and they are incredibly funny.",2082,4
the art of stealth,2083,4
So my friend dislocated his knee the other day. Look at the shirt he was wearing when it happened.,2084,4
TIL Singapore is the only country in the history of the modern world to gain independence against its own will.,2085,4
ELI5: Why do we feel the urge to destroy things when we're angry?,2086,2
White people ruin everything,2087,4
Aliens Concept Art - Guardians of the Galaxy,2088,4
Facebook Users Don’t Want Messenger App,2089,4
Drinking satanic drinks,2090,4
FCC chairman rejects Verizon's throttling defense -- The wireless carrier's argument that all the kids do it isn't good enough,2091,1
The 20 Deadliest Events in Human History,2092,4
you could say her job is quite emotional,2093,4
Its the dress dont worry...,2094,5
My dog's crest fallen face whenever my husband leaves the car for a minute.,2095,4
"What if 40 year old men driving fast cars aren't going through a midlife crisis, but instead can finally afford the car they wanted when they were 20?",2096,4
Peeping.,2097,3
The Secret to Battling,2098,4
"I am 48, and I have a degree in culinary arts.",2099,9
My 40 hour Battlefield 3 Work,2100,4
On my way to work this morning I stopped for breakfast and saw a filthy man on a bench sleeping next to a bunch of bags.,2101,9
Waiting for Comcast to install your cable.,2102,4
I had an unwanted resident on my brain for several months.,2103,4
What Disney characters would look like in modern clothing.,2104,4
My dads room key from 9/11.,2105,9
I'm biking a lot to get fit and meet women. When I see one during my ride...,2106,4
My parents' views on my sister and I,2107,6
Haven't felt this good for a while,2108,4
My Capri-Sun came with 10 straws,2109,4
"Comet 67/P, Raleigh NC for size",2110,7
learnin,2111,8
There's something not quite right about this picture.,2112,4
"Purchased Wi-Fi at a hotel for the day, not sure they understand what opt in means",2113,9
He was a true visionary,2114,2
Street fighter 2 now inflight entertainment,2115,4
A Rift Welcome (Flash Animation),2116,4
Little Suzie didn't realize she would see her mortal enemy today...,2117,4
Do you have a college degree or higher in science? Get flair indicating your expertise in /r/science!,2118,0
Maple Bonsai in Autumn,2119,3
On the wall at my local coffee shop,2120,4
My little sister attached a jump rope to her handle bars so it's like riding a horse!,2121,4
This is Entirely made out of Tooth Picks,2122,9
Hackers in coop games...,2123,5
The struggle was real in my day too.,2124,4
"Quit job, sent back old hardware. Re-arranged and added 4K monitor. THIS IS EXECB33FSTATION V3.0",2125,9
"Queen (then Princess) Elizabeth, photographed while writing at her desk in 1944",2126,2
Some chemical reactions,2127,5
ELI5: How did knowing Einstein's theory of relativity lead scientists to make the first atom bomb?,2128,4
Amazing Reaction From Old Man When He Finds Out What His Navajo Blanket Is Worth,2129,4
Sisyphus machine using gears to imitate organic movement.,2130,8
Too scared to walk through the door,2131,2
Only on PC does this ever happen,2132,4
Why I love Iron Man,2133,4
First attempt at decorating a cake (pikachu),2134,4
Me when i'm drunk and I feel badass,2135,9
"What 3 completely unrelated films, can you put together to make a great trilogy?",2136,4
Word of advice,2137,4
The Stranger,2138,0
Consumer Reports responds in regards to Walmarts non-melting ice cream.,2139,4
A ferocious jaguar cub.,2140,9
The only 2 positions that Duke sleeps in,2141,4
Embarrased my 15yo daughter today at McDs,2142,4
Booze+Shark+Roof+Pool=funny picture my buddy took of me. First reddit submission.,2143,4
Actual Advice Mallard,2144,4
This is a warm spot,2145,4
Has the guest rapper in songs become the new guitar solo?,2146,4
"TIL there are North Korean labor camps in Siberia, under an agreement between NK and a company run by British businessmen. The camps are tiny 'home away from home' villages complete with propaganda.",2147,4
MRW my boss walks away and I Alt+Tab back to the internet.,2148,4
Shots fired by local church,2149,4
"New to Civ, didn't know what it meant by Civilization Adjective",2150,4
A friend took a picture with this guy in Morocco.,2151,4
"Friend bought a Jaguar, all I could think of was this.",2152,4
Egg carton zen,2153,9
This box came with extra cat,2154,4
Two flies are arguing on a toilet seat when...,2155,4
Photoshoping coaches reactions,2156,5
TIL that the CIA hired a magician to train agents in sleight of hand techniques for use in their mickey-slipping LSD experiments...,2157,4
Nice ass ! I wonder how much it can carry ?,2158,4
Seems like everyone would enjoy it,2159,4
My mom kept telling me how gross it was to know that about me,2160,4
Found this in the paper,2161,4
he would like another.,2162,4
The Islamic flag that was raised at a council estate in London has now been taken down by a Catholic nun and Muslims from the local area: 'There is no place for hate in Tower Hamlets',2163,2
My SO when I asked if she's ever done something illegal,2164,4
Why didn't this catch on?,2165,2
We park how we want!,2166,4
"We were at a dairy farm, and saw these two under the barn waiting for mom.",2167,4
Drew Tails in class the other day!,2168,4
My coworker was given this apology letter from one of the kids we work with. The kid is eight.,2169,4
I've made this mistake enough times...,2170,4
I just spent half an hour refolding my t-shirts so the designs face up and I can search through them easily.,2171,4
[No Spoilers]. George RR Martin has said this depiction of the Iron Throne best represents the one in his mind.,2172,4
When did this...,2173,4
Mom sues after cops tased her 8-year-old,2174,6
I always wanted to build a tree house,2175,4
He fell asleep with his head up.,2176,4
My wife thinks she's funny.,2177,4
/u/flamuchz explains how Finnish soldiers were easily able to defeat the Soviet army in 1942.,2178,9
"Batman Sleeve, Mat Lapping, Creative Vandals, 36 George St, Hull, UK",2179,2
Was digging potatoes when I found this guy.,2180,4
Custom wooden depth chart,2181,4
"Because you know, you cant customize windows in any ways.",2182,6
Minecraft 1.8 . . . in ten seconds,2183,4
MRW I show friends a new song/video and they love it.,2184,4
What's a famous quote that has a completely different meaning if you change the person who said it?,2185,4
Fitness Club in Oslo tells it like it is,2186,9
Patriotic Russian Cat Stands To Attention For National Anthem,2187,8
[Comic] Reddit VS Riot Changes,2188,8
"TIL that Michelle Pfeiffer actually performed her whip stunts in the film 'Batman Returns'; the famous mannequin trick was shot in one take, surprising even her trainer (Anthony De Longis)!",2189,4
Battlestation ready,2190,4
Breakfast b***,2191,5
My online music listening history over the past 365 days by Artist,2192,4
Now throw a spider on them,2193,9
A moth landed in a candle and got stuck as the wax hardened,2194,2
Heard this while in line for TMNT...,2195,4
Persona Souls 4,2196,2
TIL Muammar Gaddafi had a strange obsession with Condolezza Rice. He had Libya's most famous composer write her a song called Black Flower in the White House. He also kept a photo album filled with pictures of her.,2197,4
By far the greatest line in this show by Walt,2198,4
Preview of Alien Blue 2.9,2199,6
Why....? WHY!?!? Why is this now a thing!?!?,2200,5
Apparently drunk me is smoother with the ladies than sober me,2201,1
Welcome to Sesame Street,2202,4
Boss battles. (Bravely Default),2203,4
I saw Jesus today,2204,4
TIFU by letting my toads croak.,2205,6
Cop to see tot he saved in '94 become a bride,2206,4
Peter Capaldi and Jenna Coleman,2207,4
[Spoiler - NLB] Faker is just amazing,2208,4
The name of this user just tops it off,2209,4
Very useful,2210,3
"Friday Report: 'Ninja Turtles' shreds competition on Friday, earns 25.6M, will earn around 65M for the weekend. Guardians plummets 67% from last Friday to 12.3M",2211,4
Northrop B-2 Spirit,2212,3
Peasant vision©,2213,4
100+ League of Legends based Hearthstone Cards,2214,4
"[Serious] AIDS/HIV Positive redditors, what's your daily life like?",2215,2
Just the tip.,2216,0
Monkey hug,2217,4
Every single time,2218,4
A guy from 4chan named his kid Remington. The company appreciated it.,2219,5
Something went horribly wrong in the creation of this Maya (Borderlands 2),2220,4
Dorell Wright's extremely classy wedding photo.,2221,8
"Go fast, lean in, commit.",2222,9
Google Lets You Watch LIVE Data From NASA's Long Lost Satellite ISEE-3 in a beautifully constructed webpage,2223,4
What do Chinese people think is crazy about America/Western culture?,2224,9
Kelvin Benjamin's TD catch vs Bills. His First NFL catch.,2225,4
All you need to know about Source 2,2226,4
Pink Wards should be on every champions' recommended items page,2227,9
Meat Liquor in London... the Philly cheese steak is my new favourite item on the menu,2228,4
"Just a reminder to put in at least 3 points into INT, or else you could end up like this.",2229,4
"One green apple, a few shallow razor cuts, and a week in the Las Vegas heat.",2230,4
"TIL after a Florida Highway Patrol Officer ticketed a Miami cop for driving in excess of 120MPH on his way to an off-duty job, she was relentlessly harassed by other officers, including finding out that her driver's license info had been accessed by 88 officers from 25 agencies over three months.",2231,4
My 13 year old nephew turns into a 70 year old Asian when he eats it skateboarding,2232,4
"TIL In 1907 Joseph Stalin said at the funeral of his first wife, This creature softened my heart of stone. She died and with her died my last warm feelings for humanity.",2233,4
"My son didn't want to be a tiger or a superhero, he wanted to be a traffic light",2234,9
My Favorite Thing I've Ever Seen.,2235,4
"Hey Bobby, listen",2236,2
To the kid who tried buying cigarettes at my job tonight.,2237,4
"At least half of the 40,000 people besieged by jihadists on a mountaintop in northern Iraq have escaped in the past 24 hours, aided by Kurdish rebels who crossed from Syria to rescue them.",2238,2
Raw Fire Opal,2239,9
Oh Andy,2240,1
"Okinawa Churaumi Aquarium (1,981,000 gallons of water)﻿",2241,8
Shark week again.,2242,4
My cat found herself a boyfriend the other night. This is how they spend time together.,2243,4
Dog vs Baby.,2244,4
not sure what she meant exactly,2245,4
Someone likes to follow us as we mow. I present Ms. Green Socks on Cake Day :),2246,4
This won't end well,2247,4
A lizard's eye's dilating,2248,3
Sunset over Lake Michigan August 7. the silhouette of Chicago inside the sun,2249,9
Guy was buying Morning After pills and was short $2.,2250,4
My German Shepherd loves to carry bricks around. He gets upset when I won't let him bring them inside.,2251,9
Can't argue with that logic.,2252,9
My GF asked me to draw us together.,2253,4
Haircuts make a huge difference,2254,4
After watching Tony Stewarts video of running over a guy,2255,2
First aww moment with the new puppy,2256,4
Saw this driving down the highway in Iowa. It's massive!,2257,4
My dad sent me this picture from Guam,2258,4
My buddies Bernese had babies a month ago...,2259,8
"Goggles, how do they work?",2260,9
This picture is an entire room full of objects.,2261,4
The world needs more Courage Wolf,2262,4
Finnish sergeant in second world war.,2263,4
Katy Perry is Loki,2264,9
Software Engineers will understand..,2265,4
Black opals are my favorite,2266,4
Lara Croft (Tomb Raider) cosplay,2267,9
Paris from the Eiffel Tower,2268,4
I think someone just got abducted,2269,4
Foods of the Wisconsin State Fair,2270,1
Let's not forget that this happened.,2271,4
Resin inlaid chestnut shelves,2272,1
Civilians in an abandoned McDonald's seize control of a wandering space satellite,2273,4
Pimp my Ride should do a where are they now episode,2274,9
The bullet failed to penetrate this guy's head,2275,1
"To be fair, she was checking it out in the mirror herself",2276,0
My wife tells me that my monthly $15 MMO subscription is a waste of money,2277,4
STOP RESISTING!,2278,4
My son turns 7 in September. He told me this was the only gift he wanted from me.,2279,4
What old person name should make a comeback?,2280,4
Redditor spells 'Unfortunately' so incorrectly that it only has three results in Google. Twist: All three are him.,2281,4
The Truth about BuzzFeed.,2282,5
Bill Gates in an airport lounge,2283,2
I feel safe already...,2284,9
how Russians shoot skeet,2285,4
Chuck Norris Bridge,2286,8
User jokingly asks to have a graphics card shown on OP's picture. OP instantly ships it out to user.,2287,4
found a dog this morning,2288,4
The CIA isn’t reporting any data to federal transparency site,2289,4
Great job guys...,2290,4
My mom worked at City Hall in 1988. This is how her boss let her know he wanted candy,2291,4
This puppy still thinks he's a lap dog. Otis the 90 lb 7 month old Newf pup!,2292,4
"Obama: Not A Single CEO I Talk To Denies Climate Change, Even Those In The Fossil Fuel Industry",2293,4
"If you were a spooky ghost, who would you haunt first?",2294,8
"In response to my family's upcoming AMA, I thought I'd try this again: I am a former member of the Westboro Baptist Church. Ask Me Anything!",2295,4
Modding gone horribly wrong,2296,4
You looked.,2297,3
From comics to theaters.,2298,3
Typewriter art.,2299,3
Robocop so sci-fi,2300,9
They love each other soo much...,2301,4
Be careful who you trust.,2302,6
Lunch time!!!,2303,2
This water bottle is shaped like a flask.,2304,4
"Lurkers of Reddit, why do you lurk?",2305,2
"My sister is moving to South Korea to teach English for a year, this is her going away cake.",2306,4
"I work at a grocery store. I present to you, scumbag customer",2307,4
"Stanley Kubrick's daughter Vivian just uploaded these rare photos of him and his assistant editors editing Barry Lyndon in the converted garage of his home in Abbots Mead, December 1974",2308,5
"Just moved, I love my new setup. Thought you would like it too.",2309,4
Pretty well accurate,2310,4
Pass me a beer,2311,4
Should I be worried about my dad?,2312,5
A great find at my local liquor store,2313,4
Saw this while competing in Virginia Beach,2314,4
Apparently it's too much effort to read these days...,2315,4
Can we get you to stop licking the seat mam?,2316,4
Find out your IQ with this new interactive test,2317,4
Most unpredictable fight you will ever see,2318,4
MRW I'm finishing up 5 weeks abroad in India,2319,9
This just happened on my co-workers facebook... awkward.,2320,6
It would be ironic if in 2020 we elect a blind president.,2321,4
Seattle's chief attorney says 66 people ticketed for public marijuana smoking by a single Seattle police officer should contest those citations.,2322,4
My friend just started dating a 19 year old. He's 31. I told him she was too young for him. I was not prepared for his response,2323,4
The Blue Jays & Tigers playing rock/paper/scissors to pass the time,2324,4
In response to the Why do you lurk? question. This is what goes through my mind before posting.,2325,4
MRW the person in front of me in line agreed to sign up for a rewards card,2326,4
MRW my dad asked if he should switch to Comcast,2327,4
Woke up early for this.,2328,4
Facial Recognition,2329,2
"TIL that Canada hands out a 1-year free Cultural Access Pass to new citizens. Free access over a 1,000 museums and cultural centers across Canada.",2330,4
"The Fire Opal, looks like someone put the sunset in a stone.",2331,4
"Phthalates, a class of environmental contaminant that disrupts hormones, analyzed in wine: 59% of the wines contained significant quantities. Epoxy resin coatings used on vats represent the major source of contamination.",2332,1
The Music Industry Is Literally Brainwashing You to Like Bad Pop Songs — Here's How -- Music Mic,2333,4
Science Summary of The Week,2334,4
Driftwood Horse,2335,4
When an app sends me a notification and I haven't enabled push notifications for it,2336,4
Just made the final and most important adjustment to my restaurant.,2337,8
Have you ever boycotted anything solely because the tv commercial was so annoying?,2338,4
Rick and Morty know how to handle sensitive social topics. (X-post rickandmorty),2339,9
A favorite passage from The God Delusion.,2340,8
"Okay, who was the jerk that dropped some molly in my coffee?",2341,8
"Truly, the best kiss cam...",2342,9
Interesting day at the park...all the adults glared in my direction,2343,4
News crew gets robbed while reporting on controversial app which helps people avoid sketchy neighborhoods,2344,8
"IamA Kurd who was in the capital, half an hour away from the recent ISIS attacks. It was choas. AMA!",2345,2
Candy Bar,2346,8
Guy is PISSED OFF at electric company!,2347,2
TIFU by giving my girlfriend a gorilla mask,2348,4
