Title,doc,topic
Half a million Hong Kongers are demanding full democracy from Beijing right now,0,2
To be fair they all look alike,1,2
Comic from a Belgian paper this morning,2,2
it was just easier this way,3,2
Rude Goldberg Machine,4,2
This is Sonny Sonny had a stroke as a puppy that gave him this incredibly lovable derpy face,5,2
Parga Greece,6,9
A nice pillow doesnt hurt either,7,2
This photo from my cousins wedding should be on the cover of Hollywood Reporter,8,2
George Takei Hobby Lobby is not a church It’s a business Businesses must and should be required to comply with neutrally crafted laws of general applicabilityWe are a nation that respects religious beliefs,9,4
I know every one of you always wondered the process,10,2
Favorite King of The Hill moment,11,7
My dead girlfriend keeps messaging me on Facebook I’ve got the screenshots I don’t know what to do,12,2
Didnt see the Pope but I ran into someone else in the Vatican,13,2
This fits all the recall hype,14,0
A couple years ago uthefrek designed an Earth Flag I really liked the idea so I made a keychain out of it My friends keep calling me a hippie,15,2
A Golden Wiener (Golden Retriever Wiener Dog Crossbread),16,2
Timo the Cat and his hammock,17,6
The perfect poker face,18,2
Catching yourself on the big screen ,19,2
Walk of shame expert level,20,2
Venus the Chiimera Cat,21,2
McCorgi  Its extra funny because shes blind and doesnt care that shes wearing it,22,2
Patriot of the Day,23,2
Bad Luck Tim Howard,24,8
Harry Potter v Justin Bieber,25,1
My girlfriends reaction after we decided to move in together,26,2
I took a picture of the Andromeda Galaxy through my telescope It turned out alright,27,2
Gus from Breaking Bad signed my fried chicken,28,2
What is your greatest weakness,29,2
I always wondered what would happen,30,2
Bath time for Monkey,31,2
Win or lose this man just became my hero,32,2
There has been some flooding in my area recently so I spent the day kayaking through the forest,33,2
How Mac users are born,34,8
Redefining success,35,2
You want me to show you a good time,36,2
What I saw on my way to work,37,2
My friends Husky is too perfect to not post,38,2
The House has quietly stripped away the requirement that privately sponsored travel be included on lawmakers annual financialdisclosure forms,39,1
What is your favorite line from Spongebob,40,7
TIL In 2012 a cat saved its owners life the night he was adopted The owner got a diabetic seizure the cat brought her back to consciousness and then ran to her sons room pounced on him until he woke up and called for medical assistance,41,2
Belgium 2  USA 1,42,2
Glad he is home now,43,2
Oh Richard Hammond,44,4
German pirateparty sponsoring,45,2
As someone whos internet connection is slow sometimes,46,2
Wishing everyone a happy Canada Day as is tradition,47,2
Buzz Lightyear Cosplay,48,7
College Application From 1922,49,2
Why I dont use gglass in public,50,2
Happy Canada Day,51,2
The post that started everything,52,2
The way the suggested gratuity was affected by the total of this receipt,53,4
PayPal freezes over $275000 in donations to email service stating encryption use requires US government approval,54,7
A knife my dad carved entirely out of wood,55,2
Baby gender reveal at my family reunion,56,2
Photobomb level  Bill Gates,57,4
Was skyping with the gf when the Hedgehog saluted me,58,0
African leaders vote to give themselves immunity from war crimes,59,5
Scooby Doo Logic,60,6
Sure Electrician,61,2
Triple lightning strike over Chicago,62,2
Yesterday a bunch of you were wondering what the Andromeda Galaxy actually looks like visually through a telescope Last night I took this picture to give you all an idea of what it looks like,63,2
Thought he could get away with it,64,2
Holy  ,65,5
[Season 1] With all these Updog posts I thought Id post this one from Season 1,66,2
Relationship Actual Advice Mallard,67,2
Jingles what do your cat eyes see,68,2
Englishman to Americans after your World Cup exit,69,2
88 years of Awww,70,0
Stoplights in the fog,71,7
Hello I am musician Roger Daltrey and ask me anything,72,4
A playful Sea Lion,73,2
Lord of War,74,2
Supreme Court Upholds Little Caesar’s Right to Feed Christian Employees to Lions,75,2
Best pc repair in all of Los Santos,76,2
My new favorite gif Jenna Fischer eating ice cream,77,2
Hey look Im Steve Irwin,78,2
My brothers cat is also named Stache,79,2
This ad doesnt actually have a question on it,80,2
Every American should be feeling this about their performance tonight against Belgian As a life long English football fan all I can say is they were a world class addition to this years World Cup,81,2
Canadian Scumbag Steve,82,2
TIL that selfperceived unattractive people are more inclined to care about equality issues and hold liberal values where as selfperceived attractive people are less likely to care about equality movements and hold conservative values,83,7
Daniel Radcliffe walking 12 dogs while smoking,84,2
Hobby Lobby Still Covers Viagra and Vasectomies,85,2
I too have not had Burger King,86,2
OP used a seal but i think it should have been this,87,2
My friend and I met Giorgio Tsoukalos aka aliens guy,88,2
Had to deal with this today,89,2
Because one trip is better than two,90,2
Just a regular day at the lake,91,7
Patrick Stewart William Shatner to read at Reading Rainbow Kickstarter events,92,2
Now I can die in peace,93,7
Dont smell that,94,2
Removing juniper bushes at work and found this,95,2
1000 years ago unknown Viking lost his chest while he traveled across the lake Mästermyr on the island of Gotland,96,2
Zoe Saldana I like being in space because there are better parts for women in space I don’t have to subject myself to just being the love interest with these kinds of filmmakers there’s a neutral sense to the way they develop characters cross post,97,7
Lord of War,98,2
Guaranteed $20K income for all Canadians endorsed by academics,99,8
Lasagna Crab,100,3
Correct use of Deal with it,101,7
Should be the side bar image,102,2
Lous first trip to the Hamptons A damaged pup finds his spirit on the beach,103,2
This has to be one of the most annoyingly named mobile games ever,104,2
My Friends Cat Named (Appropriately) Stache,105,2
All I can think of with Yahoo saving Community,106,0
Saw this today at a theme park,107,2
Gay Jesus showed up at Chicago Pride,108,2
You cant afford to pay me what you owe me,109,2
Whoosh,110,4
Man teases dog,111,2
After Yahoos outofnowhere rescue of Community I thought this was extremely appropriate,112,7
Newegg now accepts Bitcoin,113,7
Makes me feel sexy,114,2
Stopped to eat at a family owned BBQ in Florida everything was great accept,115,2
Only on PC,116,2
David Hahn aka The Nuclear Boy Scout made a small reactor in his mothers garden as a child In 2006 he was arrested for stealing smoke alarms for their radioactive materials his mugshot shows him covered in sores as a result of his extensive exposure to radiation,117,2
19th Century Math Tactic Gets a Makeover—and Yields Answers Up to 200 Times Faster With just a few modernday tweaks the researchers say they’ve made the rarely used Jacobi method work up to 200 times faster,118,4
Hyundai Empty Car Convoy Demonstration,119,3
What this meme has turned into,120,2
My dad was born with blue rings around his irises,121,2
Anytime someone hyphenates Robert Downey Jrs name to RDJR this is all I imagine,122,9
Just picking a little cotton,123,6
The TV broke this was my solution,124,2
The Reading Rainbow kickstarter ends in 39 hours If they manage to get to 5 million Seth MacFarlane will double the pledge,125,2
Road trips with my cat,126,2
What looks really fun but in fact sucks,127,2
You can never be too sure,128,2
Wifes a dietician Like most women shes always right,129,2
MRW as an intern I overhear someone needing help with something I can do,130,2
If Dunsparce followed Magicarps evolution line,131,7
TIL a homeless man lived for three years in the spaces between the girders of a drawbridge complete with working TV and Playstation holding on to the beams every time the bridge raised and lowered to keep from falling,132,2
I took this photograph of an elderly couple who fell in love while in Auschwitz survived got married and lived happily ever after,133,2
My greatuncle was killed in the Battle of the Bulge on December 26 1944 About 70 years later his camera (with undeveloped film) was found in a foxhole [xpost from rphotography],134,2
SOMEBODY ONCE TOLD ME THE WORLD WAS GONNA ROLL ME,135,2
Thats what you get,136,2
Accurate depiction of end users,137,8
Tim Howard,138,8
Modded my Dualshock 3 Controller Dualshock 1 style [OC],139,7
I still find this one of the finest pictures the internet has given me,140,2
Canada may be Americas hat but   ,141,2
Who Belongs in the Kitchen,142,6
We found my friends older brother at sports authority,143,2
Even though we lost a heartbreaker of a match to those damn commie Belgians lets give it up for a real American hero tonight Tim Howard heres to you,144,2
Robin Thicke is getting savaged on Twitter #askthicke,145,2
Bruce Lee Preaching Motivation,146,9
If NewEgg ever starts accepting bitcoins,147,2
The german goalkeeper could have been a Quarterback,148,2
This was all I could see,149,2
Scumbag Redditors,150,2
Bikers attack with an unexpected ending,151,6
Sequelitis  ZELDA A Link to the Past vs Ocarina of Time,152,4
The SIKHEST USA fan,153,2
Why Im Antisocial [FIXED],154,2
For the first time in its history the Navy promoted a woman on Tuesday to become a fourstar admiral,155,2
IQ test (Gold at 018),156,4
Just the soundwave of a song I like,157,2
[All Spoilers] Theres still time,158,2
This is my Dad in the 80s when he moved to Ireland The white suit hes wearing was bought by my aunt who pawned off her jewellery to make him look respectable in his travels,159,2
Lovebird crafts new paper tail feathers for herself,160,2
rFuturology enters TOP 50 subreddits,161,7
Friends cat gave birth to some kittens here is one of them,162,2
The Vatican tweeted this picture,163,2
My husky attempting to catch a football,164,2
For my cake day I present My 120lb dog winning at Hide and Seek I looked for him for over an hour,165,2
My friends puppy just got spayed She wouldnt stop licking the wound so now she has to wear a tshirt,166,2
The ocean is swallowing up Virginia so rapidly that its leaders are forgetting to bicker about climate change,167,7
My mother has no filter when she talks to me,168,2
The Ultimate Wedge Salad,169,9
im a lifeguard,170,2
To my niece who suggested to play the quiet game in a 2 hour car ride with 2 other kids,171,2
Make me seem like an idiot at work kid Let me go out of my way to get your mom to ground you,172,2
Close Call with a Trolley,173,2
Smooth Operator,174,4
So my best buddy brought me and his new girlfriend to a family dinner at his parents house He wanted to die,175,2
May staying true to character #Worldcup,176,2
Neuroscientists find cause of withdrawal symptoms in addicts,177,9
Even Aaron Paul knows what its like,178,2
TIFU by unknowingly spraying mold on my face every day for weeks,179,2
The Art of Rat Dota,180,2
He waited a year and a half to ask again,181,2
Redditor posts about soundtrack for a show in ranime Composer creates account to respond,182,2
The one dungeon you cant miss,183,2
Bill Murray gets better with age (St Vincent Official Trailer),184,2
This game tickles my insides,185,2
Hobby Lobby Invested In Numerous Abortion And Contraception Products While Claiming Religious Objection,186,4
this belongs here,187,6
Battle Toads,188,4
Meet Cocoa shes 17 years old today,189,2
My sister painted a picture of the Loop at sunset from a picture that I found on this subreddit awhile ago,190,2
IT professionals of Reddit what are some tips to keep your computerlaptop running smoothly,191,6
honest mistake,192,1
Even if you dont like soccer we can all agree that this should happen in all sports,193,2
In Canada,194,2
How to lose respect,195,8
I bought my nephew a ball pit for his 1st birthday,196,2
Have you ever thought of an unethical experiment youd love to try but obviously cant,197,2
Seven years ago an unenlightened administrator told me I would be fired from my teaching job if I put my bike in my classroom She got fired yesterday; Im back,198,2
New version of dwarf fortress next week after twoyear wait Soon you will get to join us in the living hell of debugging this monster,199,2
African leaders vote to give themselves immunity from war crimes,200,5
Took this photo at just the right time,201,2
TIL Paul McCartney used the pseudonym “Bernard Webb” on the song “Woman” to prove that his music would be successful no matter who took credit for it And sure enough “Woman” went to #14 on the US pop charts and #28 in the UK,202,2
The nice thing about playing tons of games and getting old,203,2
College students in California and three other states filed lawsuits against their campuses Tuesday in what is thought to be the firstever coordinated legal attack on free speech restrictions in higher education,204,2
Patch 411 Notes,205,8
The Rise of the Older Mom,206,2
Ive been playing since S1 guess what I found today,207,2
In Canada,208,2
Right well throw our diplomas in the air and take a cute photo ONE TWO THREE,209,2
Still waiting for this to happen ,210,2
Instant karma,211,7
One of the most devastating weapons in gaming history (Worms Armageddon),212,2
1000 People watching a Minecart ride to the End of Minecraft  Thank you guys D,213,2
Just a guy making scissors Not sure why its so fascinating but it is,214,2
Cmere bro,215,4
SMBC Job Interview,216,6
How (if at all) do architects of large buildings deal with the Earths curvature,217,2
GOAL,218,2
We are Karyn Parsons and Tatyana Ali (Hilary Banks and Ashley Banks from The Fresh Prince of BelAir) Ask us Anything,219,4
Ant Vs Bee,220,7
The sprinkler head in my front yard doesnt disrupt the grass growing on top of it,221,2
After thousands of years of fighting over land no one bothered to look east,222,2
TIL he world record for longest most accurate shot with a bow is made by an armless man hitting the target 230 yards away,223,2
Crows are damn smart,224,2
Has anyone ever said something to you that was so stupid you couldnt respond with words,225,2
Too many people ask gas stations for directions when there is a much simpler tastier option,226,2
I saved this water balloon from my 15th birthday It lives in my office and is 23 years old today Happy birthday water balloon,227,2
Napoleon Syndrome,228,0
George Takei Hobby Lobby is not a church It’s a business Businesses must and should be required to comply with neutrally crafted laws of general applicability We are a nation that respects religious beliefs,229,4
New ducklings at the pond where I work The mallards have been getting their freak on,230,2
TIL that in response to complaints about the long wait times for baggage the Houston airport made the walk to baggage claim 6 times longer Complaints dropped to near zero,231,2
Im gonna fight this deer itll be hilarious,232,2
Canadian Archaeology,233,6
TIL that statistically women not taking birth control kill more fertilized zygotes than women taking birth control,234,2
Egoraptor Zelda Sequelitis,235,4
Those of you who have been with your SO for several years how do you feel about their body after all this time [Serious],236,2
Two Dominos branches on the same call,237,2
The World Cup refs are being paid off This article proves it guys,238,2
Cidade de Deus (City of God) An incredible movie that tells the story of two different boys growing up in a slum outside of Rio de Janeiro,239,1
Saw this car today,240,2
We may be sad about the World Cup but we can at least be happy that we had the BEST DAMN GOALKEEPER OF THE ENTIRE DAMN THING LONG LIVE TIM HOWARD,241,2
Best Feeling 2  Bluebuff Irelia,242,2
Vaccines have low risk of serious side effects review study reports,243,2
Want accurate fridge temperatures Stick a thermometer in a water bottle (xpost rpics),244,2
Awww yusssss,245,0
Evolution of lifes operating system revealed in detail The evolution of the ribosome a large molecular structure found in the cells of all species has been revealed in unprecedented detail in a new study,246,2
Death metal band to play in airtight cube until they run out of oxygencant see this going wrong,247,2
Sea eagle dropped what appeared to be a soccer ball from its talons and it bounced a couple times Upon closer inspection,248,2
Reddit Can we have a reddit job fair,249,2
He finds bombs for belly rubs,250,2
I didnt even realize I had said it out loud until I heard him sobbing,251,2
When youre detonating your Independence Day payload please keep the servicemen in your area in mind PTSD is serious business Thank you,252,2
Told the wife the floor was gross and needed cleaning Told her I was willing to do it She said we dont need to Clean half she said and lets see the differencemission accomplished (We dont have tiled floors),253,2
who wore it better wednesday,254,2
Bad Luck Bay Area,255,7
Driving my 91 year old grandma to the doctors office and she dropped this on me,256,2
What happens to all Canadians on Canada Day I assume,257,2
If it fits I sits pig edition,258,6
Never miss an opportunity,259,2
Things Tim Howard could save [gallery],260,8
The coolest optical illusion you will see today  21 sec,261,2
We all have our dumb moments,262,7
My job is to take pictures of homes for realtors Master bath in this home was a bit occupied,263,2
Facebook Is Under Investigation For Mood Manipulation Study,264,4
My Best Friend the Moment he saw his Bride to Be Walking Down the Aisle,265,2
Gilbert Gottfried in Celebrity Wife Swap,266,2
I figured it all out just fine by myself thank you,267,2
My gf works in an OBGYN clinic She found this amazing little picture chart and thought I should share it with that upvote site,268,2
Newly exposed emails reveal Comcast execs are disturbingly cozy with DOJ antitrust officials,269,5
Move out on your own they said it will be fun they said,270,2
With only about onesixth of the original coral cover left most Caribbean coral reefs may disappear in the next 20 years primarily due to the loss of grazers in the region The damage can be reversed however,271,2
Good guy Belgium,272,2
My daughters award winning painting she is 8,273,2
A Krispy Kreme just opened in my area yesterday and I couldnt be happier,274,2
TIL Cockroaches can make group decisions When 50 cockroaches are presented with 3 shelters that can only house 40 theyll split evenly into two groups and leave one shelter empty,275,7
My boyfriends Grandma just passed away  she was present for one of the only photos with President FDR in a wheelchair,276,2
This is what happens when you take a black metal musician give him an acoustic guitar and tell him to make a cover of Avicii’s “Wake Me Up” (Percussive Guitar Cover),277,2
TIL Switzerland has forbidden people from keeping lone guinea pigs because the animals are sociable and need each others company,278,2
College Students Will Get This,279,2
That face,280,2
A tiltshift image of the moon in front of stars,281,2
High and low tides,282,2
A classmate blurted this out during lecture it got dead silent after the response and all you could hear was beepbeepbeep,283,2
My friend went hunting for actual news on CNNs homepage It didnt go so well,284,2
The current state of US public schooling,285,2
As a Belgian heres how I feel about yesterdays game,286,2
Excuse me sir,287,3
Cosplay for Charity Me at an event for disabled children and those with Downs Syndrome,288,2
Megs real name from Family Guy,289,2
Thai tea master,290,3
I have never seen anything described with such clarity Let ucorpuscle634 explain spacetime to you,291,2
Soon,292,6
The World Cup according to American redditors,293,2
George Takei What if Hobby Lobby was run by Muslims imposing Sharia law on workers,294,2
A skater after Hurricane Sandy on the Outer Banks in North Carolina,295,4
My power washer looks like Mike Wazowski,296,2
Today my boss suggested we use this chrome extension to brighten our day and boost productivity,297,2
Size of the Andromeda galaxy in the sky if it were not so dim,298,4
Threw chunk of banana down in driveway Came back about 5 hours later to see the ants had built a wall of gravel around it,299,2
GTA 4th of July update allows you to ride roller coasters,300,2
Tim Howard scores a goal,301,8
Good Guy Origin,302,2
Discovered this lifehack this morning,303,6
Payday 2 Logic,304,8
To everyone graduating this summer,305,2
Loving the GTA update,306,1
Sisters wedding had a photobooth I think I did alright,307,2
How I think my dogs reaction is like on July 4th,308,2
Nice Touch Game Freak,309,2
She prefers the once over method,310,4
Clueless,311,1
Facebooks Psychological Experiments Connected to Department of Defense Research on Civil Unrest,312,5
My girlfriends cat got sedated at the vet today,313,2
My daughters meet their baby brother for the first time,314,2
Welp time to go,315,2
It was my first day working at a grocery store,316,2
Hey who wants to feel old,317,2
My son 15month old son begged me to pick him up I upped the ante on him His delight was unfettered,318,2
This is Striker Striker is still learning how to ear,319,2
Congress is* in session Congress has passed just 56 public laws this year,320,2
My father in 1982 When I asked him what he was doing in this photo he said Shooting an album cover Duh,321,2
A car rim after a Drunk woman drove 3 miles after a hit and run,322,2
What urban legend terrifies you the most,323,4
Just started waitressing got my first no tip table last night,324,2
Got back from a 9 month deployment decided I deserved a reward Cuban cigar 18 year old Scotch and a lightsaber(Xpost from rMilitary),325,2
Awww how old is your baby 900 weeks,326,2
Leave it to the professional,327,2
Guy builds a squirrel obstacle course in his back yard Provides amazing commentary,328,2
MRW my friends wife said only poor people get cancer from smoking,329,2
Good thing I checked to see where the noise was coming from before I started my car,330,2
My gf made me literally laugh out loud on the way home,331,2
How to flirt 101,332,5
I felt absolutely horrible for her but that didnt make dinner any less awkward,333,2
I dont think they understand,334,2
EA defends business model and blames own customers,335,2
I never knew I wanted an outdoor bathtub until right now,336,2
Eminem will get you,337,2
My local pizza pub,338,2
New mens room hygiene poster,339,0
So I saved this little guy from the paws of an overly curious puppy the other day,340,2
Just eat it,341,2
In light of the upcoming 4th of July,342,2
My whole life has been a lie Its just rubbish at the end of the rainbow,343,2
A man asked me out today while I was filling his prescription for antibiotics for several STDs,344,2
Little red fox,345,2
Goooal Facebook shows which countries use the most os to celebrate World Cup scores,346,2
Boxer Dog Loves Her New Water Fountain,347,2
Track on the roof at the Fiat factory,348,5
Traffic lights in the fog,349,7
Flight delayed Probably not even an issue,350,2
Family Guy,351,2
Took this photo at just the right time (xpost from rfunny),352,2
Scumbag England,353,2
Human Look at me Ive hands,354,2
$60 from Victorias Secret and you will make her evening  before you make her evening,355,1
TIL Americas poverty line was designed with the thought that every American household had a housewife who was a skilled cook and has only ever been adjusted for inflation,356,2
Eggs on Avocado with bacon reggiano parmigiano and sirracha,357,5
Whats he do Nibble your bum,358,1
I guess on the bright side nothing like this has happened during sex,359,2
Oh Lime you old trickster you,360,2
Since this Monday,361,2
Tim Howard is the worst,362,8
This picture looks just like a shipwreck but when a mirror is placed at a certain angle it creates a portrait of Jules Verne,363,4
This baby squirrel fell from a tree but hes gonna make it,364,2
Geodude use SelfDestruct,365,7
I suggested my wife make a fourth of july music video This is what happened,366,2
My cat upon realising she was no longer living in a one cat household,367,2
This drawing seems to be a (more or less) normal depiction of a shipwreck on an island but if you put a cylindrical mirror in a certain place you’ll see Jules Verne portrait…,368,2
This guy I work with,369,2
As a bartender this is the first thing I thought when I saw the inebriator,370,2
Follow your dreams,371,2
My Four Month Old Golden Retriever Enjoying Her New Bed,372,2
My friend is Asian but speaks Spanish This happened to her at a restaurant where all the waiters were South American,373,2
What is one thing that can easily kill you but everyone overlooks,374,2
To my coworker whose husband divorced her after she got pregnant by another (married) guy and whom is now trying to destroy someone elses marriage,375,2
The Sims in Sim City Have Some Interesting Logic,376,6
It is against Swiss law to keep guinea pigs alone A service even exists that provides a guinea pig companion to keep a lonely guinea pig company should its partner die,377,2
Close,378,2
[No Spoilers] Those disgusting Kingslanding castles,379,7
Guy goes around New York putting up signs with Rap quotes referencing that location,380,2
Ewwww or Awwww,381,0
Yearbook quote of the century,382,9
Ron Swansons first day on reddit,383,2
We all have goals,384,7
Stress,385,2
California calls for constitutional convention over Citizens United,386,8
Getting my appendix out today which is the first exciting medical thing Ive ever had happen I expect nothing short of this,387,2
The only appropriate name for a sword with these enchantments,388,9
[AMA Request] USMNT Goal Keeper Tim Howard,389,8
TIL Congress added the Under God phrase to the Pledge of Allegiance during the Cold War This symbolized the resistance to communists,390,5
That look of disappointment,391,2
Im Brann Dailor drummervocalist of Mastodon,392,2
Click,393,2
DIY Baseball Bat Bench for my friends wedding gift,394,2
