Title,doc,topic
Dota 2  Its Like a Game of Chess,3596,2
Not exactly sure what kind of propoganda these advertisers were trying to spread in the 50s,3597,2
A Rookie makes a Veteran play,3598,4
Am I the only one who never realized this,3599,2
Our vegetable garden is under attack and google is not on my side,3600,2
The fun you can have with Homebrew,3601,2
Happy 11th Anniversary,3602,2
OP has had better gains recently,3603,2
Jesse Pinkmans Apartment,3604,2
My Grandmother working in a cafe Circa 1944,3605,2
Street Art,3606,2
The Console War Is Over The PC Already Won  Forbes,3607,2
Dont be fooled like I was,3608,2
If you owned a McDonalds and all of your employees were just clones of yourself what problems would your McDonalds have,3609,4
Sasuke figurine that can withstand anything,3610,4
TLDR PATCH NOTES 412,3611,8
First Tattoo Done by JJ at 805 Ink in SB,3612,7
So my cactus bloomed,3613,1
Minecraft pet owner of the year award,3614,2
*yaaaawn*,3615,5
This is what Im into abstract shapes integrated in realistic environment,3616,7
Gravity defying illusion,3617,9
TIL Birds that live close to the ground have low pitched calls that burst with chatter allowing the sound to cut through ground clutter effectively Birds that live high in trees have long high pitched calls more suited for traveling long distances through the air,3618,2
Reddit what is a quote that has stuck with you over time,3619,2
TIL In the 80s New York City was terrorized by a street gang called the Decepticons They had names like Megatron and Soundwave and they called Brooklyn Cybertron,3620,2
They make a good point,3621,2
Today I took my US citizenship test Im very happy to announce that I passed,3622,2
TIL that wearing a white tshirt with a large letter T on the front is scientifically proven to make you 10% more attractive to women,3623,2
NASA astronaut Bruce McCandless walking above space shuttle payload bay,3624,1
This is Abbie She has a hat No relation to Ben,3625,4
Whats one thing youre pretty sure everyone does but doesnt say or talk about,3626,2
A coworker complained about the grammar and vocabulary I use in my emails,3627,9
MRW I turn off my bedroom lights at night and see my new clocks face,3628,2
When faucets are too close to the sink edge and you cant rinse without rubbing knuckles on the sink,3629,7
Found a bee thinking about its day in one of my Raspberries,3630,2
TIL Mao Zedong ordered the people of China to kill sparrows because they steal grain Since sparrows also eat insects their absence caused a locust epidemic that ravaged crops and killed millions of people,3631,2
TellTale have a subtle yet great sense of humor,3632,4
My baby duck Stanley was excited for all the popularity so here are some more pictures,3633,2
All Aboard,3634,8
Naxx Confirmed Not Out Yesterday,3635,2
Battery powered brick,3636,6
Dog riding a turtle,3637,2
The taps at my work look really depressed,3638,2
What is the maximum rate of rainfall possible,3639,2
Lebron gives Harry a ride back to Cleveland,3640,2
I just came home to this,3641,2
This happy ass elephant,3642,2
So I tried the dragon egg thing,3643,2
Found a gamecube controller with a fan at goodwill,3644,2
ELI5 Why dont they rebuild ancient structures like the Acropolis in Athens like theyve done in other places like Cambodia,3645,2
Mango Sour Altoids,3646,8
Together,3647,2
Friends Are the Family You Choose GenomeWide Analysis Reveals Genetic Similarities Among Friends,3648,2
Jesus Christ saints row IV with the dark humour,3649,7
Game of Good Decisions,3650,2
story of my life,3651,2
My 16 day old rescue kitten and his year old big brother Husky,3652,2
What Might Happen If Kirk and Spock traveled Back in Time to 2014,3653,2
Because this is totally how Virginity works,3654,0
This wall of books,3655,7
Scientists Are Beginning To Figure Out Why Conservatives Are…Conservative Ten years ago it was wildly controversial to talk about psychological differences between liberals and conservatives Today its becoming hard not to,3656,2
Xray video of a dog drinking,3657,2
Patch 412 Notes,3658,6
Its officially a party,3659,2
Hello reddit Meet my baby duck Stanley,3660,2
A PitbullHusky Mix,3661,1
I know I wont get it back but that logic really annoys me,3662,2
Andrew Wiggins Baseline Spin Move To Dunk,3663,6
After 3 years of trying my goose is finally a mom,3664,2
Makes sense now that I think about it,3665,4
TIL there was a woman in 1972 who possessed a visual acuity 20 times better than average She could identify people at a distance of more than a mile (16 km),3666,2
I finally watch The Princess Bride and…,3667,2
100% fire resistant,3668,7
Honey,3669,4
Dog is so happy in new home his tail wags as he sleeps,3670,2
[Stein] Dirk Nowitzki has taken bigger pay cut than previously thought Deal finalized today at three years $25 mil,3671,2
World’s First Thorium Reactor Designed,3672,4
TIL Crows hold funerals for fellow crows Often neighboring crows who didnt know the now deceased crow or even see it die will attend these funerals,3673,7
Whale  By Yann Black in Montreal ,3674,2
I reached 1000 games on Steam and just finished building my new rig As a celebration I am giving away 100 games,3675,2
Man single handedly plants a forest larger than Central Park NYC,3676,4
Meanwhile in my local classifieds a very specific trade offer has been brought to our attention,3677,2
wasnt quite the follow up song to The Ramones that we expected,3678,2
rGTAA decided to recreate the Mountain Biker jumping over the Tour De France,3679,6
Watch the cutting board,3680,2
Jeb posts about a possible new feature slimmer player arms,3681,2
TIL Lance Henriksen and Bill Paxton are the only two actors to face off against a Terminator an Alien and a Predator,3682,2
Liberal Town USA,3683,2
Halo 2 vs Remastered Halo 2,3684,7
just got my car back from the dealership looks like they forgot something,3685,2
LCS semifinals will be Best of 5,3686,2
The rPokemon Cycle,3687,2
Poor guy just got diagnosed,3688,2
Last kiss by Adam Martinakis,3689,2
Because we would die if it didnt,3690,2
Me and a few buddies made the Stanley Cup out of beer cans,3691,2
All over my instagram right now,3692,2
And people still think he is cute,3693,2
Cake day Have a stretching fox,3694,2
Showed my cousin the Sharkeisha coke bottle this was his response,3695,2
RIP Nanna <3,3696,7
How not to date,3697,2
Feyische as a Draenei Warrior (xpost rSexyCosplayGirls),3698,8
If you tell a guy what you want hilarity ensues,3699,2
This adorable Corgi was getting groomed at my work yesterday His owners are lucky I didnt steal him,3700,2
Theres something in the water,3701,2
Leo watching Jake,3702,7
Diamond Returns to Gambit starting lineup,3703,3
New Dragon Ball Z movie to be released in 2015 and will be written by original creator Akira Toriyama,3704,2
Is it because Im Redguard,3705,2
Batgirl  Justice Magazine Cover by Stanley Lau,3706,2
Google creates Project Zero team to protect the internet You should be able to use the web without fear that a criminal or statesponsored actor is exploiting software bugs to infect your computer,3707,2
HOW 2 QUICKSCOPE MIRACLE (montage parody) [050],3708,8
Eastern Germany the most godless place on Earth A 2012 survey was unable to find a single person under the age of 28 in eastern Germany who believed in God,3709,2
What a way to go,3710,2
Roosevelt and his wouldbe team,3711,9
Face sitting,3712,2
She Jukes Herself Twice,3713,2
To the guy on hard times with the scumbag sister and brother in law,3714,2
Was cooking pasta when suddenly cookie monster,3715,5
Root canal procedure,3716,9
Killed a wasp nest at work and decided to check out the growing process,3717,2
Thanks Andy,3718,1
They never grow up,3719,2
Act Immediately to Stop Congress’s Sneaky Move to Shut Down Broadband Competition (XPost rnews),3720,7
14yearold boy wanted to know if John Cleese had a fan club This was his reply,3721,2
Afghanistan,3722,2
Took this two nights ago when a storm was moving in over the university in town,3723,2
Who wants a hug,3724,5
Kayak struck by lightning,3725,7
Im your new mom,3726,2
Two 30 year old guys lip syncing a conversation between two 60 year old women Why is this so damn funny,3727,2
My cat giving up on being a cat,3728,2
Netflix to FCC reclassify Comcast and Verizon so they can’t choke the internet,3729,2
And that reddit is what she said,3730,2
I work at a summer camp and this was one of my campers post cards he sent home,3731,2
The 4 Stages of Pizza Bargaining,3732,2
Kanye West attempting to seduce Kanye West,3733,7
Are you lonely,3734,2
Thank you Weird Al for bringing him back,3735,4
My GF told me this gem this morning Im not sure which sub to put this on but either way Im freaked out,3736,2
This excellent joke was hidden in the credits of Pulp Fiction,3737,2
How to get girls,3738,2
Bad Luck Archer Fan,3739,7
I spent a lot of high school life single,3740,2
[spoilers] The opening and closing images of Batman Arkham City Amazing,3741,2
The Whole World Cup on a GIF,3742,2
Look at what two months in foster care can do,3743,2
First official look at Avengers Age of Ultron,3744,4
Parents dont really pay that much attention to the details,3745,2
Worst Typo Ever On My College Diploma,3746,2
Nerd Dating 101  Every WOW players dream,3747,2
So hot right now,3748,2
So Nintendo just posted this,3749,2
Under appreciated Cosplay,3750,7
Florida scientists press Gov Rick Scott on climate change You responded that you are not a scientist We are scientists and we would like the opportunity to explain what is at stake for our state,3751,2
The UNs’ top human rights official says her office sees strong evidence that govts on every continent are hiding their increasing reliance on private companies to snoop on citizens’ digital lives It warns that mass surveillance is becoming “a dangerous habit rather than an exceptional measure”,3752,2
Dear Comcast When your lobby needs bulletproof glass youre doing something wrong,3753,2
What is the strangest true fact about the universe that we typically dont consider everyday,3754,2
Looks like Yoda got a job with my local internet company,3755,2
A Volkswagen Beetle compressed into a ball From artist Ichwan Noor,3756,7
I have two uvulas,3757,1
We met Henry Winkler at a fly fishing lodge in Montana and requested a photohe took my iphone and spent several minutes setting up this shot before handing the phone off to a guide to take the final pic,3758,2
And nothing of value was lost,3759,2
New image from Mad Max,3760,0
No need to rub it in (but I am jealous),3761,3
Weird Al Yankovic  Foil [Comedic Spoof] [2014] Official Music Video,3762,4
The bug mockery escalated quickly,3763,7
45 years ago today Apollo 11 took off carrying the first men to the moon Buzz Aldrin Neil Armstrong and Michael Collins,3764,2
Black Stereotypes,3765,2
He wants to make sure he captures every moment,3766,2
Giant hole appears at worlds end,3767,2
Israeli naval ship bombs Palestinian children on Gaza beach killing four A journalist who saw the incident said some of the children who survived were running away when another shell seemed to be aimed at them,3768,2
High quality renders of all of the Smash Bros Characters so far,3769,2
Friendship,3770,4
Seriously I love you guys,3771,2
Cant tell you how many words I learned from good guy Lemony Snicket,3772,2
Lightning Strike,3773,7
They say it is for security purposes  riiigghhttt ,3774,2
Baby teaching a yoga class,3775,2
Kid running from guy in mankini,3776,2
TIL Morgan Freeman played a singing vampire obsessed with vegetables on The Electric Company in the 70s,3777,2
Did you say more fluff ),3778,2
When my wife asks me what I want for dinner,3779,2
My 8yr old nephew dropped this gem while playing Mario Kart Wii,3780,2
This one time my Grandpa drew a landscape on MSpaint With a trackpad on a laptop At 69 years old And he thinks its awful,3781,2
Local news shoots guy making video games,3782,2
Met this guy at a book signing He didnt rush anyone who wanted to talk and even signed old stuff for people who didnt buy the book 1010 coolest guy ever,3783,2
I see your Tupacabre & raise you 50centaur,3784,2
Its a cheesy pick up line and it worked and it worked,3785,4
Nebuchadnezzar II just went full teenage girl on me,3786,2
Not only was this game a rarity for being a stellar movietiein game Its blend of stealth FPS RPG and production value makes it a compelling play that was ahead of its time and still solid 10 years later,3787,2
My alltime favorite cosplay,3788,7
When the #1 post on rreactiongifs is making fun of people with Downs syndrome,3789,2
Best Friend Turned 15 Today,3790,2
This is Odie (with his stuffed duckling Charles) Almost a week out of the shelter hes starting to figure out that were not going to abandon him,3791,2
The new Alderaan addition at Disneyland,3792,2
What are you doing out running in snow,3793,6
You made the effort and thats all that matters to me  GGG boss,3794,2
Iama IDF (Israeli) solider Ready to talk about my opinions and the way we deal with Gaza Please ama,3795,2
Just started using Tinder and there seems to be a pattern,3796,2
When his owner died woody was left behind,3797,2
Missed it last week but this is the view from my office,3798,8
Thought this was cool,3799,2
Heard my cat screaming outside found her stuck like this,3800,2
The green part of my moms shirt caused the computered background to seamlessly go with the rest of the shirt,3801,2
I know its the Alzheimers but its still awkward,3802,2
Hardest choice of my life,3803,2
Does this please you,3804,7
Makes me laugh every time,3805,2
Touring van vigilante,3806,2
Millennials Don’t Like Either Party Democrats Viewed as the Better of Two Bad Options,3807,2
The US Should Not Prosecute Edward Snowden UN Official Says,3808,2
A threewomen backflip,3809,9
The only road out of my home town looks like this right now (photo credit Huffington Post),3810,2
30 animals with their parents now you can melt in peace,3811,7
James you ladies man,3812,4
When frightened of the dark,3813,7
WTF is THAT abomination,3814,4
Those are serious eyes,3815,2
To my wife and her two sisters who always interrupt me with questions when I am trying to tell them something,3816,2
When the rapture happens,3817,5
This feather duster,3818,8
A girl announced her engagement on my Facebook by saying I said yes  But her finger said no,3819,2
Are we still doing Jurassic Park gifs,3820,2
Charlie Sheen Drunk Taco Bell Drive Through,3821,2
My dog usually gets 1 wet and 1 dry pouch of food in the am Grocery day and no dry food I thought I could do 2 wet pouches NOPE hes so disappointed he wont look at the bowl,3822,2
In response to the article about Comcast not letting the user cancel his account Not much they can do about this,3823,2
One of these bottles of Corona has more beer than the others,3824,2
Science AMA Series Im Paul Héroux a Professor of Toxicology and Health Effects of Electromagnetism at McGill University in Montreal Canada I do research on health effects of electromagnetic radiation at all frequencies both in terms of disease risks and therapeutic medical applications AMA,3825,2
When my dance teacher complained I wouldnt take off work to attend day as well as evening classes,3826,2
The dangers of following directions Let this be a lesson to us all,3827,2
My life is pretty boring without her,3828,2
ELI5 Can someone explain Rocky Horror Picture Show to me I feel like I didnt get it,3829,2
15 Reasons why Scotland must be on your bucket list,3830,2
(xpost) Bad Luck Archer Fan,3831,2
Cheating,3832,2
Ive wanted to say this for a while,3833,2
Signs will now have the break animation while breaking,3834,1
The options that should have been available for uAmir_114 while dealing with Teenage Girl Nebuchadnezzar II,3835,2
Someone rendered the Futurama Opening shot in 3D and it is Absolutely Breathtaking,3836,2
LBS Hours,3837,2
So I reported Water Simulator for not being a game Today I received this email and sure enough Water Simulator is gone,3838,2
I Wouldnt Cut Down That Tree If I Were You,3839,2
How a Glock works,3840,0
Journalists will face jail over spy leaks under new security laws in Australia,3841,2
So Graves and Lucian are basically the same champion now Except Graves is bad,3842,2
4chans view on vault 69 and vault 68,3843,8
[Season 3] Khleesi goes to Starbuks,3844,7
I am an economist and an expert on video game economies virtual currency and bitcoin AMA,3845,4
I bet these guys know if Nike will be on time with those sneakers,3846,2
The Multiverse collides,3847,5
Joaquin Phoenixs forehead When you see it,3848,4
Root canal procedure,3849,9
Worst Album Ever Forneys 12inch Masonry,3850,2
Worst Choir ever tries to sing early 2000s hip hop hits,3851,2
Is this guy serious,3852,2
The arctic summer when the sun does not set,3853,6
Five more minutes,3854,2
Boo,3855,0
Jimi Hendrix on Carnaby Street in London June 1967,3856,7
Mr Sun,3857,2
Shunned by the other chicks Pepper Ann is being raised by humans,3858,7
MRW a vegan tells me they dont use Vaseline because its derived from dead dinosaurs,3859,2
Here I come and theerre we go,3860,2
I put my Nexus 7 tablet on my cars dashboard,3861,2
Hey rnotinteresting you are NOT Subreddit of the Day congratulations,3862,2
MRW my friend gives me booze and weed in exchange for being able to crash on my couch for a few days,3863,2
Koko the gorilla and her kittens,3864,2
The greatest soccer tackle ever,3865,2
Im a guy A friend had asked me to date his gay daughter in hopes of making her straight,3866,2
Booker T with the perfect comeback from a missed elbow drop,3867,3
I am David Wernsman I was taken by strangers in the middle of the night to a Christian reform program overseas and Im the main subject of the Showtime Documentary Kidnapped For Christ AMA,3868,2
The actual reason Riot implemented automatic jungle timers,3869,2
Love this game but this one thing always bugged me,3870,2
Hey men I dont think you get enough credit for your lovely physiques Here are the observations of a twenty year old lady,3871,2
I dont understand why the cool secret trick I learned on Facebook doesnt work anymore,3872,2
MR as a swede when reading the thread about how attractive swedish girls are,3873,7
Lucky enough to get this shot with my phone at the beach,3874,2
TIL that there is a push to replace the skull and crossbones as the international symbol for poison Because of the popularity of pirates many children no longer see the symbol as a warning A proposed alternative is Mr Yuk,3875,2
A dentist explains why bad teeth are a common trait in humans,3876,2
Riot now is your chance to add a Skins tab in the profile section,3877,6
This is a website that finds a Ja Rule song to fit your exact mood and level of thugness (xpost from rhiphopheads),3878,8
Matryoshka doll,3879,1
Open the DAMN door,3880,2
Here let me help clean that up for you,3881,2
A man chooses a slave obeys,3882,4
I saw this guy yesterday whilst working out He is genuinely one of the nicest individuals who I have ever met,3883,2
Grandmas been getting in trouble again,3884,2
Man carries a game around with him every day for 6 years; can confirm am phone,3885,2
A simple silly video; did not expect to rofl in the last few seconds Worth the wait  [111],3886,7
This is how my boss decided to organize our color chips,3887,2
Lots of guys,3888,2
Attack on Pokemon Art,3889,2
Coming too late like a boss,3890,2
I was at Best Buy and saw Tomb Raider for XBox One for $50 I laughed came home to see this and then I laughed harder,3891,2
Controlled destruction of a cooling tower,3892,5
Margie,3893,9
Either zoom in or dont give me the option,3894,2
TIL in 1969 there was a commercially sold adult board game called Chug A Lug it involved smoking beer and marijuana The purpose was to win the most ALCOHOLIC UNANIMOUS cards and penalties involved liquor store runs removing clothing or not being allowed to go to the bathroom,3895,2
Those who work a ton of days in a row will understand,3896,4
Coincidentally sneezing when its time for mascara Never fails,3897,2
I just want to pet you,3898,2
IamA We are Trampled By Turtles the band lets do this Ask Us Anything,3899,2
My graphite work from the last 6 months,3900,2
TIL officers in the US armed forces face an up or out system If they are not promoted within a certain timeframe,3901,2
How a gun works,3902,2
My new setup,3903,2
Squad hang in there  We love you,3904,2
MRW I found out that my friends planned and went on a trip to Europe without telling me,3905,2
Thought I would share some fan art I created for an indie game inspired art show Im putting on as part of my graphic design thesis project,3906,2
Weird Al  FOIL (Parody of Royals by Lorde),3907,4
Valve for the love of the intergalactic confederation of xzrfgfrl please put a server on Mars,3908,7
One of my favorite Joker panels (Whatever happened to the Caped Crusader Part 1),3909,7
Telstra just tweeted this,3910,2
I just introduced my brother to reddit and this was his reaction to his first post,3911,2
Flight anxiety  Im doing it wrong,3912,2
TIL vegetable is a culinary term,3913,2
When I got to go you got to go,3914,2
Apparently Adult Large means something different in Korea than in the US,3915,2
TIL that at the embryonic stage of development humans have two hearts They eventually fuse into one but theoretically if they were kept separated they would develop into two functional hearts,3916,7
Im a terrible person for laughing at this,3917,2
There is nothing about this I dont like,3918,2
Professional golfer ChiChi Rodriguez tries to break glass panel with golf ball The glass panel fights back (video w audio in comments),3919,1
Reddit please allow me to introduce my new friend Chikuzen,3920,2
Tupacabra 50Centaur Try JayZebra,3921,9
Journalists will face jail over spy leaks under new security laws Australian journalists could face prosecution and jail for reporting Snowdenstyle revelations about certain spy operations in an “outrageous” expansion of the govt’s national security powers leading criminal lawyers have warned,3922,1
THEY WARNED ME ABOUT THE SKOOMA,3923,7
Sergeant Frank Praytor looks after a twoweek old kitten during the height of the Korean War,3924,2
Some Lucidity On What Is Wrong With The World From rConspiracy Of All Places,3925,2
(Broussard) Sources Lance Stephenson accepts 3 yr $27 million deal with Charlotte,3926,7
A wave viewed from underwater,3927,1
Visual concept of the Surprise Party Twitch skin idea,3928,2
A Plea for Professionalism at TI4 from ESPORTSREP,3929,7
Cleaning a Vinyl Record with Wood Glue wait for the satisfying peel sound,3930,2
Champion pool is not the real problem items are,3931,2
The accuracy of Watch Dogs phone hacking is amazing at representing society,3932,2
Touched By A Major,3933,2
Only the Gods are Real  A Guide to the Gods featured in American Gods,3934,2
Something different How about the H440,3935,2
TIL Pat Sajak admitted that the Wheel of Fortune took so long to film that he and Vanna used to sneak off the set for margaritas at a nearby bar He and Vanna would have “two to six” margaritas before returning to the set where they would “have trouble recognizing the alphabet”,3936,2
Ive started biking to the gym and just realized this the other day,3937,2
Noice,3938,3
I just finished building my racing rig for VR I present the White Chest of Darkness,3939,2
Bills Hall of Famer Jim Kelly on why he kept his commitment to work at a football camp despite battling cancer “I’m not going to let these kids down I was a kid once I know what it is like when you look forward to meeting someone and I want to make a difference in these kids’ lives”,3940,2
I found out who it was,3941,2
An abused dogs transformation and future as a therapy dog,3942,2
why was Oedipus against profanity,3943,0
In 10 minutes youll be travelling exactly 1000 years into either the past or the future (5050 chance)  how do you prepare for either one,3944,2
Why to put spaces between function parameters,3945,2
Laboratorygrown beef meat without the murder but would you eat it Growing meat in labs could cut hunger,3946,2
Nike is coming out with these Air Max Lunar90s to commemorate the 45th anniversary of Neil Armstrong setting foot on the moon,3947,0
Today I became a Canadian Citizen,3948,2
Ahri buff because she isnt seeing enough high tier play neither is half the other AP midlaners,3949,2
I came home from work to find this,3950,2
Reddit what seemed like a good idea at the time,3951,2
Lucian Clearly Nerfed,3952,2
Tumblr and Dental Hygiene,3953,7
Comcast customer service,3954,2
[Poetry] Husband Calling Contest,3955,2
uperiphery72271 explains why batmans secret identity would be revealed in a month of the real world,3956,2
Marty Crane is definitely a comedic genius,3957,5
Arizona be like,3958,2
My dog accepting my laziness by bringing the Frisbee to my bedroom window,3959,8
Every time I fold fitted sheets,3960,2
MRW Im on the phone with Comcast Home Security and find out that if I dont cancel within the month I will be locked in for three years with a $1k termination fee,3961,2
Malaysian Plane crashes over the Ukraine,3962,1
Was at a record store today seems that some guy is making miniature drum sets in soda cans,3963,2
3 wheels 2 pedals 1 seat 0 practical purposes,3964,2
My grandpa asked why the trail mix tasted so bad,3965,2
I got it,3966,2
happened to a guy i work with made me cry,3967,2
Wanna know what a cow looks like washed and blow dried,3968,2
This guy buys signs from the homeless for $2000,3969,2
The dog slept through the rain and left an imprint on the deck,3970,2
New WoW legendary for the old school players,3971,2
My wife paints awesome original content,3972,2
At this bar I go to the prices of the beers change every 15 minutes based on supply and demand inside the bar,3973,2
Malaysian plane going from Amsterdam to Kuala Lumpur with 295 passengers on board crashes near Russian border,3974,2
What I think everytime I watch one of those survival shows,3975,2
Had to sit behind this guy at the movies,3976,2
