Title,doc,topic
Its tough being awkward around women,5529,2
Sisters,5530,2
How I imagine quarrels with troll accounts must be like,5531,2
I realised today was my cakeday and this is the only thing I can come up with,5532,2
after hearing that Norway faces imminent terror attack,5533,6
She laid on every cold surface after her haircut but this was her favorite,5534,2
Just your everyday friendly neighbor,5535,2
His name is turbo his wheels are built from toy parts,5536,2
Drove past the local elementary school today and I just have to ask,5537,2
Never too old to be a Pokémon master,5538,2
Summer in England,5539,2
My steak looked like Africa,5540,2
What was cool back in elementary school,5541,2
How my family tells me they wont be home for the rest of the day,5542,2
When performance is measured by plates washed per minute,5543,2
Boy heard screaming for help rescued from rip current by lifeguard,5544,2
I never made a customer cry before,5545,2
I received this advice at a very young age and it has helped me out considerably,5546,2
Bird of paradise mating dance,5547,8
This isnt a model,5548,2
Wait you can do that,5549,7
Today I saw a car that reminded me of something I saw on the front page a couple days ago,5550,2
Well theyre not wrong,5551,2
A Friend showed me this,5552,2
I wonder if Ive ever eaten a crab that was caught on TV,5553,2
I mean the sites not wrong but,5554,2
Reddit you sent letters postcards and love from all over the world to ensure that my grandfathers 88th birthday wasnt so lonely As promised here are photos of the celebration THANK YOU SO MUCH,5555,2
My Fire Emblem Proposal (xpost rfireemblem),5556,8
My cat was having some issues this morning,5557,2
This caterpillar looks like it came straight out of a scifihorror flick,5558,2
Collaboration piece by David Hale and Kris Davidson done at Wonderland Tattoo in Portland OR,5559,7
If runes are balanced then why do they have different prices,5560,7
So sad,5561,4
Obsidian would like to make another fallout and set it either on the west coast or New Orleans,5562,2
I do my best to avoid eye contact,5563,2
This is my famous homemade fettuccine and fresh tomato sauce Its a process but its worth it Heres the recipe in photo form,5564,2
First Poster For Penguins of Madagascar,5565,0
Overheard this in a change room Double the awkward,5566,2
Girlfriend went on vacation and doesnt know this happened while she was away,5567,2
I turbocharged my minivan (with pictures this time),5568,7
I like to draw in negative,5569,2
The hiring manager said this to my coworker when she arrived for a job interview unsurprisingly she promptly declined the position and left,5570,6
Nothing super special about this pic I just really love my dog,5571,2
Sassy Martial Arts Kids,5572,2
Given URFs popularity,5573,1
ELI5How is it we have advanced medical science to a point where we can grow ears on mice but cannot grow hair on a bald head ,5574,2
Google’s $1B purchase of Twitch confirmed — joins YouTube for new video empire,5575,2
First page in a 50 Ways the Bible can Cange Your Life,5576,2
What Happens When Extremism Becomes Mainstream What used to be widely seen as loony is now broadly accepted or tolerated by the Republican Party,5577,2
Baby owl learning to fly,5578,2
sign I saw on the interstate a few days ago,5579,2
Probably my greatest and most memorable gaming moment ever,5580,2
TIL The Nation of Islam believe that white people were invented as an evil race by a scientist named Yakub 6600 years ago The experiment also produced red yellow and brown people Some of the white people Yakub created ultimately became gorillas,5581,2
A Pokemon tale with a child customer at Gamestop (Warning Will make you feel old),5582,1
Miniature gravel pit created with tilt shift,5583,0
My girlfriend killed a fly in the house I jokingly told her to put its head on a toothpick as a warning to the others This was at my desk when I got home,5584,2
Thats the worst thing you could do,5585,2
I crawled to the edge of a cliff to take this photo of a Himalayan Monal a flightless bird from India [OC],5586,7
TIL that JK Rowling was asked to use her initials instead of her full name (Joanne Rowling) because her publishers were worried that boys wouldnt want to read a book written by a woman,5587,2
Ive hosted what I believe to be the first Smash Bros tourney in Saudi Arabia Id say it went well,5588,2
Dean Norris knows how to blend in,5589,1
Awesome offroad segway,5590,7
Norway faces imminent terror attack,5591,6
You have to be creative sometimes,5592,2
Weight Loss,5593,8
A sad trend going around my town,5594,2
Next Champion confirmed by Scarizard,5595,2
Happy Tequila Day,5596,2
Whats the most youve ever cried over a FICTIONAL event or person And why,5597,2
Best breakfast ever,5598,2
Still waiting for Facebook to implement this,5599,2
Im the farthest from a professional but pretty proud of how my cupcake Big Macs turned out,5600,2
Israeli agency bans radio clip by human rights group naming children killed in Gaza calling it Politically Controversial,5601,2
Truly the finest road safety ad Ive ever seen No gore no scares,5602,2
Quokkas have no fear of humans But its illegal to touch one you could be fined up to $2000,5603,7
Dr Doom and Namor (found on rcomicbooks),5604,4
Let me eat your fingers,5605,2
Well that got awkward fast (Seriously wait for it),5606,7
Wheres the pizza,5607,2
Can we talk to you about Jesus Sure but do you have a warrant,5608,2
10000 Palestinians protestingwalking from Ramallah to Jerusalem right now in Israel,5609,2
MRW I noticed my friends girlfriend has 17000 tweets and 32 followers,5610,2
Ray LaMontagne storms offstage during concert saying Why dont you go the (expletive) home and talk to concertgoers talking during his set,5611,2
This sub has taught me how to deal with creepers Thank you rcreepyPMs [OKC],5612,8
My friends change from WalMart,5613,2
Saw this thing on my way to work Was gone by lunchtime,5614,2
Puppey  The oneman army,5615,2
Everyday I have to deal with this lift panel,5616,4
Vader vs Maul,5617,7
I love Weird Al but I imagine this is how the artist who he bumped out of the Number 1 spot must feel,5618,2
Training for the xgames,5619,7
What the crystal clear water in La Grotta Cove Corfu Island Greece really looks like,5620,2
EMSK what the symbols on your clothing mean,5621,7
Its official They know what theyre doing,5622,2
Get Ready With Me Victorias Secret Look Tutorial,5623,2
[Spoiler] 3 Minutes with Lazerbeams; what is the Secret to Dignitas,5624,2
My Lego Art,5625,2
Had a box get a bit sexy on me today,5626,2
Id take a bullet,5627,7
Americans Really Like to Drink Beer Says Unsurprising Poll,5628,2
What Really Happens Inside Iron Mans Suit,5629,2
Community A Yahoo Original Series [SDCC Promo] #CommunityLivesOn,5630,0
If I sit nice I get treats,5631,2
MRW my family doesnt realise Im stoned at the dinner table,5632,2
My friend has had a bad few weeks,5633,2
My buddy had a break in at his shop He forgot what door he smashed upon exit,5634,1
What makes a person boring,5635,4
I dont believe in losses,5636,2
I made a huge mistake [Banners],5637,2
Bryan just posted this on Tumblr,5638,7
Rainbow Chameleon,5639,2
God damn it,5640,2
I came to remind you of a something,5641,2
My IQ is,5642,4
Crosssection of a closed water lily,5643,2
Last Christmas my brother received a gift that had gone missing for over 30 years,5644,2
Some see Jesus everywhere I see the Dark Lord,5645,2
[No Spoilers] George RR Martin donates $10000 to UK wolf charity following 13yearolds pocket money plea,5646,7
Any examples of predators overexploiting their prey population leading to the extinction of both,5647,5
A new generation of teddy bear,5648,2
Snape Snape Severus Snape on the streets of NYC,5649,4
From Forgotten to Loved Forever in 58 Days Story in Comments,5650,2
You all meet in a tavern ,5651,2
A great source of confusion for child me,5652,4
My conservative father met his gay cousins life partner and adopted child for the first time,5653,2
Saw this at Walmart what a deal,5654,2
Awkward moment at work the other day,5655,2
Take a minute to appreciate the levels of derp here,5656,2
Deaths in the Iliad a Classics Infographic,5657,1
China is set to build a particle collider twice the circumference of the LHC | Science,5658,2
Driving down the 5 fwy when suddenly,5659,2
I made this a while ago and realized that I never showed it to anyone when I found it today,5660,2
The Terrible Truth,5661,1
GOGcom announce Linux support and Linux game sale,5662,5
What dont you get,5663,2
Germany to spy on US and UK intelligence gathering for the first time in 45 years | Germany orders surveillance of British and American intelligence gathering according to reports,5664,2
Waited for a good 3 minutes for it to load then i started to read,5665,2
MRW I see that Dwayne Johnson did an AMA,5666,2
Patrick Kane poses for a photo with a young fan censors his Blues shirt,5667,2
I hate you,5668,2
The Video Statistics on the classic song Never gonna give you up show the days where it looks like people were rick rolled on a major site,5669,2
I forgot I had a copy of the best game of all time,5670,2
the only graphs I understand,5671,4
It feels like a huge success every time,5672,2
TIL in the 1980s Casablancas script was sent to major studios under its original title Everybody Comes to Ricks Most readers didnt recognize the script and many complained that it was not good enough to make a decent movie Others said too dated,5673,2
[The Wolf Among Us] Real Talk,5674,2
D,5675,0
Dog passes out from overwhelming joy,5676,2
What is my purpose,5677,9
He likes to go through the garden and find the perfect cucumber for him,5678,2
Rate of organ donorship in countries with optin vs optout polices,5679,4
Dwights take on the Triceratops,5680,7
Transport of KATRIN a giant antineutrino detector trough a small town in Germany,5681,7
Bandit Hes a labhound mix Look at those eyes,5682,8
Poster for Jake Gyllenhaals upcoming film NIGHTCRAWLER (2014),5683,0
One of the funniest newspaper comics Ive ever seen,5684,2
Wasnt I just here,5685,8
Self Control is strong in this one,5686,2
I just got my Corvette out of storage after 25 years Still runs like a dream,5687,2
I wish more restaurants did this,5688,9
Pass the 28th Amendment to Ensure Corporations Are Not People,5689,4
Cat Found in Stomach of Shark,5690,2
Bluuuuuuuurg,5691,3
Its 2014 chips im looking at you also,5692,2
This 90 yr old woman who served the 1st scoop ever at Little Man Ice Cream in Denver serves scoop number 1000000 to a lucky guest,5693,2
Cut and Polished Meteorite,5694,2
My buddy is an NFL running back His kids dressed as Flash and Batman to fight him dressed as Bane,5695,2
A US cyclist who pedaled across 50plus countries for peace and charity was run over and killed in Russia by a drunken truck driver,5696,2
Best Buy Canada accidentally priced Xbox One at $45 this morning  a few lucky people got them,5697,2
This shower has a thermometer for the water,5698,2
Nope,5699,3
Smashed potatoes,5700,1
I know that feel little bird ˡ ᵏᶰᵒʷ ᵗʰᵅᵗ ᶠᵉᵉᶫ,5701,2
Long Abandoned,5702,2
So I saw Ace Ventura today in London,5703,2
325 pound 6 foot 4 inch Pittsburgh Steeler Steve Mclendon 28 years old checking into training camp with his Ninja Turtles pillow,5704,2
Its worked when someone has said it to me so now I make sure to say it to others,5705,2
New friends,5706,2
Destiny logo explained,5707,1
Honey,5708,4
MARK CUBAN If Your Company Is Moving For Tax Reasons Im Selling Your Stock,5709,2
Had to do a double take,5710,2
My cat is obsessed with the printer so I send her messages during the day,5711,7
3 yos death grip (OC  56secs),5712,2
Get your hands off my sister,5713,2
Weve been dating for a while now,5714,8
Calls for NYPD chokehold investigation  “Let’s not play games with this one You don’t need no training to stop choking a man saying I can’t breathe You don’t need no cultural orientation to stop choking a man saying I can’t breathe You need to be prosecuted”,5715,2
I woke up to my cat acting normal Nothing to see here,5716,2
petch and Lonk,5717,7
Share the love,5718,2
I didnt realise fahrenheit was a thing,5719,2
Mother and Baby The Ugly Duckling Personified,5720,2
My cousin just posted this picture of him in 1990,5721,2
Decriminalising sex work would cut HIV infections by a third Mathematical modelling work by researchers from Imperial College London estimates that decriminalising sex work could prevent up to 33 to 46 per cent of HIV infections among female sex workers and clients worldwide over the next decade,5722,2
Nope,5723,3
Id say right place right time  for the bird and the photographer not so for the fish,5724,2
Just adopted this little guy from the local shelter Reddit meet Legolas,5725,2
TIL that while recording their debut album 40oz to Freedom Sublime did not have permission to use the studio they were using Their friend snuck them in Bradley Nowell had said they never knew we were there We managed to get $30,5726,2
This was such great news I had to hang up on him and cry,5727,4
Like Father Like Son,5728,2
Biologist warn of early stages of Earths sixth mass extinction event,5729,2
This one always helped me out,5730,2
Do you have a friend for whom you feel the need to provide a “warning” before introducing him to other friends,5731,2
This man was taking pictures on the tour using gummy bears as the main focal point,5732,2
Baltic Sea from space,5733,2
Quite possibly the best run ever on American Ninja Warrior,5734,2
Went to Granddads after work for dinner couldnt believe what was waiting for me Hed spent all day making all the food from scratchhes 80 years old,5735,2
The Last of Us movie has been officially announced at ComicCon Sam Raimi to produce,5736,2
Its just the right thing to do,5737,2
Expendables 3 Leaks Online 100K+ Copies Down in Hours,5738,7
The perfect excuse,5739,3
I think I can handle all the sex,5740,2
Today was my last day of work I AM SCUMBAG STEVE,5741,2
Walgreens,5742,9
So I ran into the guy with the top selling album today he was not weird,5743,2
Next time youre having sex with your girl,5744,2
Im super cereal right now,5745,2
Lightning from above,5746,7
I decided to build an improved cat door and inadvertently made it amazing,5747,2
Which person could do an AMA and end up taking the AMA #1 spot from Barack Obama,5748,2
Youve been banned,5749,2
Truer words were never spoken,5750,2
TIL that Douglas Adams came up with the idea for The Hitchhikers Guide to the Galaxy while lying drunk in a field holding a copy of The Hitchhikers Guide to Europe,5751,2
My GGG 19 yo son Shes been looking forward to this for months & its definitely not a genre he is into,5752,2
TIL Back when the NYC Subway used tokens people called token suckers would jam token slots with paper and suck out stuck tokens with their mouths To prevent this,5753,2
After late night diarrhea and you get back into bed and get comfortable again,5754,2
A caricature artist at the San Diego Zoo drew me Wind Waker style,5755,7
he seemed so sincere,5756,8
Look at this tiny Maple Bonsai  LOOK AT IT,5757,2
Tiny raincloud About to ruin a single persons day,5758,7
This is why you dont mess around with a baby bear,5759,2
What Kind Of Tea Is This,5760,2
MRW I find a Coke that has the name Esteban on it (My name is Stephen),5761,2
If we as a society cannot stomach the splatter from an execution carried out by a firing squad,5762,3
Girl and chicken face swap,5763,2
Mark Hamill talks about returning to play Luke Skywalker in ‘Star Wars Episode VII’; says Harrison Ford is recovering well,5764,2
IamA Max Glauben the Holocaust survivor that was on the front page on Monday AMA,5765,2
thanks grandma,5766,2
Thought Id share,5767,2
ELI5 Why does Islam seem to have more violent fanatics than other religions,5768,2
I just wanted the attention,5769,2
I pretended not to understand,5770,4
TIL that in the US Army there is a rank higher than the 5 Star General of the Army called General of the ARMIES and that only 2 people in history have ever held that rank,5771,2
Abandoned railway in Australia,5772,1
She doesnt know what she got herself into,5773,2
Its either stare at the player or walk away,5774,2
I used to be a man in a womans body,5775,2
Each time I come here I sketch on a sandwich bag with a sharpie while they make my lunch,5776,1
white cat+street chalk=trouble,5777,2
Too many people judge those who are just starting out,5778,2
Who’s banned from editing Wikipedia this week Congress,5779,6
Baby fox dazzled by the sun in my schools park,5780,2
1930s pic of my Sioux grandmother on a South Dakota Indian Reservation,5781,2
Someones happy to see me,5782,2
TIL The most valuable vinyl record of all time is not a rare recording its a plain off the shelf version of Double Fantasy by John Lennon and Yoko Ono Its worth half a million dollars because John Lennon signed the cover for Mark David Chapman 5 hours before Chapman murdered Lennon,5783,8
[Spoilers S4] Smoothest man in Westeros,5784,4
Meet Sneakers,5785,2
Nice try Take 5 Magazine,5786,2
Probably not that cool but the progression of my family through family portraits from mid 1940s to mid 1980s,5787,1
The fact that the first person they suspect after someone is murdered is the spouse tells me everything I need to know about marriage,5788,2
Found a trainer with Kadabra at lvl 13 and remembered,5789,6
Asked my dad to paint with me this is what he did for his first painting,5790,2
The Last of Us movie poster at Comic Con,5791,2
This Week in Technology,5792,6
Today I found a stronghold,5793,2
Dr Robotnik must have been driving,5794,4
Tickle monster,5795,5
Powerful artwork,5796,0
My puppy is so proud of the hole she dug,5797,2
Turn your head sideways,5798,2
Was at a Walgreens and my credit card was maxed out Cant believe people like this exist I wish I could be half the man this guy is,5799,2
Bad Luck Destiny,5800,7
I walk around a lot when Im on the phone taking a personal call at work can be dangerous,5801,2
PTSD Kitty,5802,7
Nintendo just sent us this for free Story in comments,5803,2
TIL Deadpool once killed off the entire Marvel Universe including the writers themselves,5804,2
Meet Pew Pew And her new heated bed,5805,2
TIFU having sex with a guy I really like,5806,2
Water break,5807,2
Florida girls charged for torture and killing of rare tortoise,5808,8
TIL that a bank worker fell asleep on his keyboards number 2 button causing him to transfer 222222222 euros on a transfer that shouldve been worth only 62 euros A coworker was later sacked for not spotting the error,5809,2
Israel Bans Radio Broadcast Naming Children Killed in Gaza because its politically controversial,5810,2
I know some people that would starve in this situation,5811,2
TheOddOne is up for a duo cast with HotshotGG,5812,4
Scientists create videos from human memories,5813,2
Why does my $99 phone still have better software and hardware than a $35k+ car in 2014,5814,2
Adventure Time renewed for Season 7,5815,2
TIL the Cheyenne chief Black Kettle a major advocate for peace and coexistence between white settlers and Native Americans was twice attacked by American troops despite explicit agreements of nonhostility resulting in the death and mutilation of he and at least two hundred Cheyenne villagers,5816,2
Wikipedia blocks disruptive page edits from US Congress,5817,6
After a long exciting hike Rocky was just too tired to go on No problem,5818,2
As much as you might hate him this was brilliant,5819,2
Two Cities Asked the FCC to Bypass State Laws Banning Municipal Fiber Internet,5820,2
This bear,5821,6
Why Reclassification Under Title II Won’t Hurt Innovation ISPs Already Aren’t Innovating Anyway,5822,2
When the tongue on your shoe does this,5823,5
Aunt made an amazing Ezio suncatcher,5824,2
First Ebola victim in Sierra Leone capital on the run  The family of the patient stormed the hospital and forcefully removed her and took her away,5825,2
This is why I always have my camera with me,5826,2
Removing lint from the filter,5827,2
Follow the white alien,5828,2
My boss jokingly claimed to be a Brony so we decided to go all out for his birthday,5829,2
This layout on my banks mobile app,5830,4
This fad is a nuisance,5831,0
More proof from Finding Bigfoot,5832,3
There is a lizard sex satellite floating in space and Russia no longer has it under control,5833,2
A is for Adventure,5834,2
Imagine putting your hand on this,5835,2
What in your mind is the worst idea or product that ever achieved huge commercial success,5836,2
My own little derp derp,5837,6
So today I asked my 3 year old son who was his best friend,5838,2
VFX test of Nicolas Cage flying as Superman from Tim Burtons cancelled Superman Lives,5839,2
I was a good Mormon wife  until my husband stopped believing in God,5840,2
My coworker is scumbag Stacy,5841,2
ELI5 Why is it so difficult to get young children to eat Wouldnt survival instincts make them want to eat in the first place,5842,2
Fishing for piranha  the easy way,5843,2
The first recorded instance of Scumbag Steve,5844,2
Cat loves his owner,5845,2
I carved a wizard staff not really sure why,5846,2
If Super Mario World had been released on an App Store,5847,2
I finally did it,5848,2
This desk in my university library is made up of perfectly fitted book ends All real books too,5849,2
Why Midnight is the most terrifying Doctor Who episode ever not Blink,5850,2
Pauls Boutique is 25 years old today,5851,2
All of Aladdin was a story told by the merchant to get us to buy a worthless lamp,5852,2
Famous tan lines of the DC universe,5853,5
Someone pulled a heist on my parents bike shop plz help,5854,2
Ill take a potato,5855,7
[LPT Request] How to retain what you read,5856,7
Official Season 5 Trailer,5857,2
Got Mimirons Head today I decided to have some fun with it,5858,2
Judge the deed not the breed,5859,5
Theres no wrong way to eat a Reeses,5860,2
TIL that Nicorette was created in Sweden for submariners who couldnt smoke on board,5861,2
When I see a random gif request and I already have the source video to make it,5862,2
What movie did NOT need a sequel,5863,2
(Spoilers All) New characters for season 5 cast,5864,2
It took hours and left me with an aching wrist but Im happy with the result,5865,2
Egypt sides with Israel in conflict with Hamas,5866,2
One year can change so much,5867,2
Baby Koala from the wildlife hospital where my gf works,5868,2
Weeeeeee,5869,5
Anyone interested in playing a little joke on MLB The more the merrier,5870,2
All concept art so far from Avengers Age of Ultron combined,5871,2
Banana anatomy,5872,0
[Poetry] Going to the Endzone,5873,2
Cosmospolitan  Id buy the hell out of this magazine,5874,2
There should be a Call To Arms in Team Builder that gives a bonus to the roles that are currently needed,5875,8
TIL the Wright Bros after numerous incidentfree tests were poised to make their pitch for the Army airplane contract With Lt Thomas Selfridge as passenger the plane crashed injuring Orville and killing Selfridge resulting in the first airplane fatality They received the contract anyway,5876,1
Middleaged woman posts phone number and selfie on bodybuilders facebook (ALBUM),5877,7
Up on the hill,5878,7
A Back To The Future background,5879,2
TIL several studies suggest Americans consistently over report how much they attend religious services  and actually attend just slightly more than the British and Germans,5880,2
TIL the base sound of the lightsaber is an old projection motor Ben Burtt worked with as a projectionist The sparkling,5881,4
KEEP OUT,5882,2
Instagram would be a great nickname for a drug dealer,5883,4
Canadian group brings 1000 litres of Canadian water to citizens in bankrupt Detroit as part of protest,5884,2
CEO pay vs stock market returns,5885,2
If Mecha Malphite Looked Like The Splash Art (with example),5886,2
Can not unsee,5887,0
And the winner is,5888,2
The best recreation of A New Dawn 1010,5889,2
I bet this guys a good Dad,5890,2
Currently underway,5891,8
My friend does replays for the KC Royals He sent me this,5892,2
Gained 1000+ damage from duels last weekend (TI4 album),5893,8
enough is enough,5894,2
Sad Batman,5895,2
This is how a lock works,5896,2
Payback,5897,3
That new Batfleck image along with the first “Sad Batman” one work really well together It reminds me of one of those weird 70’s floating head portraits,5898,2
Whoever titles these articles deserves a raise,5899,4
My Father,5900,2
I really wanted this to be for sale,5901,2
Dat Gap,5902,8
Daniel Bryan stops burglar in Phoenix,5903,7
In space everything is a stones throw away,5904,2
Meet No Name She wandered into my garage and shes very pregnant,5905,9
[Spoiler] Congratulations to the first team to qualify to the S4 World Championships,5906,2
Actress Dona Drake playfully takes aim with a rifle on the balcony of her Los Angeles home 1942,5907,2
Fuel burning in space,5908,2
Im Hououin Kyouma,5909,3
Follow the white alien (OC),5910,2
[Season 4] Game of Thrones Season 4 Bloopers (Comic Con),5911,7
Homeless man compliments a guy from rgainit on his veiny arms after working out It made his day because noone else noticed his gains Turns out the homeless man is probably a junkie,5912,2
Primus Announce New Album Due Out in October,5913,2
Living in an apartment and having to pay to do laundry I realized my attitude towards clean clothing hit a new low,5914,2
Dadjoked my sons friends in an online game Nobody laughed,5915,2
Well she tried,5916,2
Mecha icon should be available for IP,5917,9
This squishy doggy,5918,4
TIL there are companies that make foil kites which can be fitted to cargo ships to significantly reduce fuel consumption by using high altitude winds as an alternate power source,5919,2
A RL fort that looks like the ones in Civ V,5920,2
Dublin café at night oildigital,5921,2
A picture of my little girl Im quite proud of with my beat up old s3,5922,2
Who needs a trailer when you have a trunk,5923,9
Orlando Magic rookie Aaron Gordon teaches young girls not to reach,5924,2
