Title,doc,topic
This is what i come home to every day,1625,2
Googled attractive Sycamore Was not disappointed,1626,2
I caught myself thinking this after I got stuck in my third traffic jam of the day Im a horrible person,1627,2
My water boiler looks like its pure evil,1628,2
I told my Dad you should learn from your mistakes,1629,2
I enchanted a shield that increases my blocking ability I think I named it appropriately,1630,1
The sushi chef recommended that I order seared Salmon and Hamachi Bellies It was easily the best sushi Ive ever had,1631,8
Ebola out of control in West Africa as health workers rush to trace 1500 possible victims,1632,3
I always loved this scene [Halo 3],1633,7
Wait for it,1634,7
The line up at breakfast time,1635,2
I Guess This is Growing Up,1636,1
Todd Frazier made his first AllStar game this year but its not the first time he will be on a field with Derek Jeter that was 1998,1637,2
Just a puppy and his stuffed kitten,1638,2
TIFU by meeting my Girlfriends brother for the first time,1639,2
XMen Days of Future Past to get an extended directors cut with added Rogue,1640,2
My kitten was staring into the sun like a fool but I was able to snap this photo showing her eyes changing slowly from blue to yellow,1641,2
He is 1 next month and has many boxes,1642,2
Witnessed this shopping cart scumbag recently,1643,2
TIL that when a Ford plant pulled out of Green Island NY the town seized its waterpowered electrical turbine by eminent domain and now it provides electric to its residents for about 40% cheaper than surrounding areas Most residents have electric heat,1644,2
3005 members found this helpful,1645,2
This Kid Made an App That Exposes Sellout Politicians,1646,2
My wife surprised me with a great start to the holiday weekend,1647,2
How do we have pictures of our own galaxy,1648,2
Pranking the wrong guy,1649,2
There can only be one,1650,2
Thanks Obama,1651,1
Its only smells,1652,6
This just happened to me,1653,2
MRW the USA got eliminated from the World Cup and my motherinlaw told my disappointed daughter that theres always next year,1654,2
Oh the curiosity of my 7 year old daughter,1655,2
Subaru Impreza battles its way out of a large mudpit,1656,4
8 years old yet still just a kitten,1657,2
She doesnt even know him,1658,2
Ilerminaty,1659,9
Energems commercial featuring Curse and LMQ Shots Fired,1660,7
ELI5 How can hotel room showers provide stable water temperatures while our fourapartment brownstone cant,1661,2
United Steaks of America,1662,2
Officially done with Handles,1663,2
Im never calling it water again,1664,2
Learned this the hard way from a doctor in the ER last night,1665,2
When one breaches the barrier that is the Friendzone a truly euphoric family is created,1666,0
Beautiful picture of ISS,1667,2
cool camera drone that follows you,1668,2
Orphaned baby bats at Tolga Bat Hospital require a lot of care and get wrapped in blankets,1669,2
Divinity Original Sin has been #1 Best selling game on Steam for a week now with no price reduction,1670,2
Thank you,1671,2
60 FPS 360 degree turntable of my city,1672,2
planetexpress comments on why Futurama is the cartoon series that hits home for him,1673,2
Im not sure if he even knows its public,1674,2
A tornado made its way through our town last night and this tree was not giving up without a fight,1675,2
When it comes to the beauty of Canada Saskatchewan is often overlooked Ive compiled an album to show my fellow Canadians that the stereotypes arent true,1676,2
Lovers digital 5906X8268px,1677,1
The supposedly 1px size of the moon on that web site ,1678,2
I crunched some numbers after the Steam Sale ended,1679,0
A reminder to fight against your comfort zone,1680,4
Meet Murphy This is how he sleeps,1681,2
Reddit what could a stranger do to make your life a little bit better,1682,2
Wise words from Corridor Digital,1683,2
I painted my own UNNACCEPTABLE,1684,7
A bot posted this in Rankedchampselect,1685,7
Old School Cool is cooler with the boxes,1686,2
About sums up my one and only visit to Golden Corral,1687,2
This dog has a better life than I do,1688,2
Simultaneous triple lightning strike of Chicagos tallest buildings,1689,7
Audrey Hepburn sure knows how to smile,1690,7
ITAP of a cow,1691,2
Audrey Hepburns Brow Journey My obsession,1692,7
Toy Story has so many great oneliners,1693,2
Street racers,1694,7
I was this guy today I could feel the loathing,1695,2
James Rodriguezs selfie at Colombias welcoming party of over 90000 fans after arriving home from the World Cup,1696,2
The Kiss,1697,2
DreamWorks Lays Off Dozens of Employees As ‘Dragons 2′ Continues to Underperform,1698,9
Jumping fox my first tattoo  Done by Scott Santee Memento Tattoo Columbus OH,1699,7
[Other] How not to tinder,1700,2
history is repeating itself,1701,2
Videogames cant tell me what to do,1702,7
The hats of King Carl XVI Gustaf of Sweden,1703,7
NASA approves budget to build SLS rocket,1704,2
My grandfather discovered time travel RIP,1705,7
How to instantly make an interview uncomfortable,1706,2
Did anyone else havelove these old Disneys Hercules plates I know I did,1707,2
This is NOT the right advice Mint,1708,2
MRW I hear my food in the microwave poppingexploding from my room,1709,2
Cherry Juice Thief Caught ),1710,7
TSM Shows us Just How Dangerous Recalling on a Ward REALLY is,1711,7
What happens to the human body when exposed to overwhelming amounts of radiation,1712,5
I salvaged the wood from my old couch and made a coffee table,1713,2
This kid at the hostel on the island Im staying on,1714,2
The view from my aunts house is unreal Seattle WA,1715,2
Im glad I noticed this before I sat down,1716,2
Did they get lost,1717,2
Shoryuken the biggest fighting game community releases Learn How to Play Fighting Games,1718,2
The International 4 Survival Guide,1719,2
When my daughter gets a birthday card full of cash and a note saying For the College Fund,1720,2
Worlds Largest Flying Bird Was Like Nothing Alive Today,1721,2
Reddit whats your favorite drinking game,1722,2
(Broussard) Rockets will offer Chris Bosh 4Yr 96 Million Contract,1723,7
My nephew has the smile of a future serial killer,1724,7
I think we need to redo our image,1725,2
My brother REALLY likes King of the Hill,1726,2
TIL Pregnant women are affected by morning sickness to protect the unborn fetus in its most vulnerable stage when organs first start developing It clears her system (via vomit) of substances that typically carry microbes or toxins,1727,2
He gave up huffing and puffing,1728,2
American Redditors what is small town America actually like,1729,2
Best way to find out youre getting fired,1730,2
Noel Cruz  The incredibly talented man who paints dolls,1731,4
LEAGUE OF LEGENDS COSPLAY @ ANIME EXPO 2014,1732,7
LEGIT TINKER COSPLAY AT ANIME EXPO,1733,7
I am Buzz Aldrin engineer American astronaut and the second person to walk on the moon during the Apollo 11 moon landing AMA,1734,2
Am I doing this right,1735,2
Is roommate shaming a thing,1736,4
The clouds were like a rolling ocean tonight,1737,2
Roxy knows shes allowed on the barstool and not the counter Roxy also likes to test her limits,1738,2
Germany vs Brasil right now,1739,7
The sky at the reds game last night was pretty intense,1740,2
My hedgehog just had anesthesia for an oral exam [album],1741,0
My hunting dog is on high alert,1742,2
Brazil right now,1743,7
New Brazilian Flag,1744,2
I wish my parents were still alive,1745,2
it was about 90° today,1746,2
I have learned this the hard way,1747,2
Barack Obama and his grandfather c 1965,1748,2
Brazilian kid collects his tears for thirsty Germans,1749,2
Elephant Cries After He Is Rescued Following 50 Years Of Abuse,1750,2
Asian American grading scale,1751,2
NASA confirms Voyager is the first Earth craft to travel into interstellar space,1752,2
Pay to Win is now infecting real world games too,1753,2
People born on 070707 turned 7 today,1754,2
I am Mike Tyson Ask Me Anything,1755,4
Guardians of the Galaxy  CG and Colour updates Interesting watching shots develop throughout trailers these days,1756,2
We never really wanted them smaller after all,1757,2
We killed all those slum children for this,1758,2
Hey brazil I know your are a bit tired and thirsty Here I got you one of this,1759,2
If we could only be so lucky,1760,2
Old man with a mustache hugging a world cup while watching Brasil lose,1761,2
My sister is currently stuck on the Ninja roller coaster in Six Flags California after the front train derailed,1762,2
The hospital I work at lists the number of calories you burn walking up the stairs from the ground floor at each level,1763,8
A Moth Orchid,1764,9
Hipster Level Grand Master,1765,2
Are you lost little one,1766,2
I was just being honest,1767,1
This guy rode its a small world at Disneyland alone,1768,2
Karma,1769,7
Okay 321Lets jam,1770,7
MRW my gf tells me Im too old to have a themed birthday party,1771,2
Science vs Engineering vs Liberal Arts,1772,7
Its a trap,1773,6
I bet Germany fans are highfiving each other,1774,6
Nintendo called it,1775,2
Religion does NOT correlate with ethics,1776,4
Traffic has come to a dead stop (xpost from rCreepy),1777,7
Unmanly firework guy gets in the way of in the way guy,1778,2
Emma Watson as Harley Quinn,1779,9
TIL that in 2013 Google went down for 5 minutes and in that time the global internet traffic dropped by 40%,1780,2
MKBHD Reveals the iPhone 6 Sapphire Display,1781,4
Im a chicken,1782,2
Friend posted this on Facebook the Seattle skyline from 511,1783,2
My husband travels for work He gave me this so I am never really alone,1784,2
This bourbon is so strong that ice sinks in it,1785,7
( ͡° ͜ʖ ͡°)‎,1786,8
Julio Cesar everyone,1787,2
This was completely unexpected,1788,8
The World Cup is serious business in Germany,1789,2
Challenge Accepted [GTAV],1790,2
Portal Platter,1791,0
Next door has a new kitten We have rabbits,1792,2
The Beatles lied,1793,3
TIL That one of the poorest countries on earth The Gambia is a hotbed for female sex tourism Wealthy older European woman seeking out young African men is the countrys main attraction,1794,2
Traffic has come to a dead stop,1795,7
Im sure lots of Germans feel like this right now They still have to stay in Brazil for the finals,1796,2
I dont think anyone will ever top this level of advertising,1797,2
Mona Lisa by del Prado believed to have been made by an apprentice of Leonardo da Vinci at the same time as the original,1798,2
Jesus is So Lucky to Have Us,1799,2
[No Spoilers] What popped in my head when I first saw this,1800,2
Tried to post pictures of my sisters newborn kittens in raww and was downvoted within 2 seconds after posting,1801,2
new Russian tram lovely designed,1802,2
Why I got no sleep last night,1803,2
8th grade student is wearing this shirt and he has no idea what it represents,1804,2
Latest photo from set of STAR WARS EPISODE VII confirms that part of the movie will be filmed in IMAX,1805,2
Nananananananananana Batman,1806,2
Pallass cat discovers hidden camera,1807,2
Im the brother who chose to get a belowtheknee amputation Ask Me Anything,1808,2
Wrestler gives no look fistbump (xpost rsquaredcircle),1809,8
TIL In a housing experiment that moved families from poor neighborhoods to wealthier ones boys experienced PTSD rates comparable to those of combat soldiers while psychological wellbeing improved for girls,1810,5
Hate doing laundry Try a wombat,1811,2
Our offices were recently remodeled Here is the window one poor sap got left with,1812,2
Update Pedro the drill site puppy three weeks later,1813,2
More animals that you may not have known existed,1814,6
Looks like Im not getting any typing done,1815,2
The type of people who do this sort of thing need to be put down Pure vanity,1816,2
Hes been avoiding me ever since,1817,2
I know Im not the only one,1818,2
My girlfriends son lost a tooth Then she gave him a haircut She didnt know why I was laughing I sent her this,1819,2
Sony we have to talk,1820,4
Harry Potter is back JK Rowling writes new story on 34yearold Harry Potter on Pottermore,1821,1
I work as a Social Worker in the ER & to relax at home I paint my face I wanted to share a few of my creations with Reddit,1822,2
Brazilians of reddit how is your country reacting to the semifinal in the world cup,1823,2
Actual sign at local pizza shop,1824,2
An Iraqi soldier passes time in a foxhole,1825,2
She came up gagging,1826,2
Teamwork,1827,1
I feel like lab Corp is judging me,1828,2
Brazil vs Germany Pokemon style,1829,7
I made this gif to prove to my friend that AWings are cooler than YWings,1830,2
Is the GOP the party of the wealthy Many Americans think so What does it mean when someone says theyre a Republican About one out of five Americans interpret that to mean they support the wealthy and business interests and are not for the people,1831,2
Not even a chance,1832,2
Found a ladybug in my usb port,1833,2
I recently started working in HR,1834,2
Shaolin monks training,1835,7
When,1836,0
The most shocking thing isnt the Trex,1837,2
Germany Vs Brazil,1838,7
If I go 24 hours without committing an act of violence Ill consider that a victory,1839,2
If you have to convert others to your religion in order to go to heaven it is a pyramid scheme,1840,2
Espresso being made in slow motion,1841,2
Forever Alone,1842,2
The saddest man of the World Cup,1843,2
So my friends new puppy is pretty cute,1844,2
Recently got Outlast and this really bothers me,1845,2
Sarah Palin just joined the ‘impeach Obama’ crowd That’s bad news for the GOP,1846,4
As an American MR watching Germany vs Brazil with my Brazilian friends,1847,2
Gunnar is unpacked and loving his new home,1848,2
The rguy in todays Google doodle never actually shaves the Gs beard,1849,9
This guy gets it,1850,2
My neighbor lets my dog out everyday while im at work This is the result Needless to say; hes a bit attached,1851,2
My Grandmother being photo bombed by some beefcake in 1941,1852,2
My Birthday Ten Years Ago (22) VS My Birthday Today (32),1853,2
TIFU by playing league of legends with diabetes,1854,2
This is what I think represents Canada (Original Art),1855,2
5K No way,1856,4
Teased by his teammates for lack of a personal life here is JJ Watts response,1857,2
Stoner conversations,1858,5
Youll never look at them,1859,2
Found this lil guy on the floor of the airplaneand to think I take off my belt and shoes and this piece still makes it through,1860,2
Testing the reflexes of seven kittens,1861,2
This is why you dont propose in a skydive,1862,2
I made this thing for a thing Im doing,1863,2
Pokemon Weapons,1864,7
My Grandpa on his motorcycle 1950s,1865,3
I Fixed The rguy in todays Google doodle never actually shaves the Gs beard,1866,9
Saw this on the official Watch Dogs FB page i had to,1867,2
Patcher & Landing Page Visual Refresh to PBE,1868,1
Backyard Is Now Mosquito Free,1869,2
Brazil vs Germany,1870,7
Cashier would you like your milk in a bag My dad,1871,2
My local screen printing shop has very specific hours,1872,2
Here is JK Rowlings new Harry Potter piece without registration required,1873,1
My cats fur pattern says love,1874,2
To the black guy who is meeting his white girlfriends parents for the first time Theyre very excited to meet you,1875,2
Shhhhh no tears,1876,2
Heres what real life Superbad looks like,1877,2
Minnesota preschooler 89yearold WWII veteran neighbor become fast friends,1878,2
Triple kick,1879,2
OK so our Nerf gun thing *might* be a little out of hand,1880,2
[Poetry] HYUH HYEAH HYEA HYUH HYEAH HYUH,1881,8
Miss the Brazil game Heres a recap,1882,7
LPT Use the a penny and a rubber band to prevent your skirt from exposing too much when you bike,1883,7
Brazil vs Germany right now,1884,7
We Are Richard Dawkins & Lawrence Krauss  Subjects of the new film The Unbelievers Ask Us Anything,1885,4
Layered string art of the Denver skyline,1886,2
Met this happy stray just outside of the Grand Canyon,1887,2
I found this diagram in the trunk of a BMW First world problem averted,1888,2
If only there was something to fix it,1889,2
Blood sunset over Cincinnati last night,1890,2
Reddit meet our boys Theyre fancy,1891,2
TIL a Florida town forced a couple to uproot their 17yearold vegetable garden because it was in the front yard “Only vegetables are explicitly banned—trees fruit and garden gnomes are just fine”,1892,2
Samsung factory robbed at gunpoint in Brazil $36 million in smartphones tablets and laptops stolen,1893,8
History of the American Soldier,1894,2
When people take The Onion seriously,1895,2
TIL Albert Einsteins brains were kept and dissected both improperly and against his wishes and his eye balls remain in a safe deposit box in New York City,1896,2
So I put some lightning bugs in a jar and took a picture,1897,2
Kansas was supposed to be the GOP’s taxcut paradise Now it can barely pay its bills,1898,8
Hollywood Director I download stuff myself,1899,3
ELI5 If the brain is 5% by weight but consumes 25% of our calories shouldnt we be doing puzzles to lose weight,1900,8
So I just found out that Archer was renewed not just for season 6 but season 7 already,1901,2
An argument aimed at increasing the speed limit,1902,0
Kim JongUn clapping,1903,4
TIL in 1937 a natural gas leak at the local school in New London Texas caused a massive explosion that killed more than 295 students and teachers the deadliest school disaster in US history Adolf Hitler even sent his condolences via telegram,1904,2
Fat sounds awesome,1905,2
Volcano eruption from ISS (GIF),1906,1
Why do they call you the Joker anyway,1907,2
What is completely worth its negative repercussions,1908,8
Took a picture of the shoot today through some binoculars from my office in Atlanta Walkers attacking a van,1909,2
Parkour,1910,0
Curse of Naxxramas™ Wing Entry Details and Heroic Mode  News,1911,7
Nintendo called it,1912,2
TIL the last Great Auk (the extinct penguin of the Northern Hemisphere) seen in the UK was captured and tied up by 3 men The men kept the bird alive until a large storm hit the area Thinking the bird was a witch they killed it,1913,2
South Park returns with new episodes September 24th,1914,2
Come on Gamefreak its not too much to ask for,1915,2
New Client Will Be Based Off HTML5 UI + Riots Code Base  NOT Adobe Air,1916,0
A Germany fan celebrates among Brazilians,1917,2
Good guy orangutan,1918,2
ELI5 What would happen if all the mosquitos in the world suddenly went extinct,1919,2
Reading Rainbow Kickstarter Campaign Just Broke A HUGE Record,1920,2
Great advice from my dad,1921,2
TIL In 1886 3 people were killed and many more injured in a Texas train companys publicity stunt They had invited the public to watch two of their trains crash headon into one another at full speed promising a good show,1922,2
A hip hop concert in germany,1923,7
A few weeks ago I shared a pic of our local zoos baby jaguars This spring was also witness to the birth of Fennec fox pups,1924,2
Rihanna accidentally steals idea for song from radio show hosts,1925,2
I just found a R2D2 measuring cup set,1926,2
GGG30 years old gamer living in Moms basement,1927,2
Science AMA Series Im Dr Adam Franssen a neurobiologist at Longwood University My research focuses on how changes in the brain during pregnancy and parenthood make moms smarter AMA,1928,2
How Star Wars would have realistically ended,1929,2
TIFU By sending 22000 text messages,1930,2
Horse protecting his goat buddies during hailstorm,1931,9
Just come in and buy it you fool,1932,2
Colorful fish,1933,1
Before there was Kinect,1934,6
Hey rpcmasterrace You guys helped us get attention when we raised 37500 lbs of food for the local homeless shelters last year Now I need your help to raise money for kids in need of medical care MIC,1935,2
How solar power works,1936,2
Brazil scoring their first goal of the game,1937,2
Liverpool fan unintentionally trolls media on big money transfer news,1938,7
Hope this makes you all smile This is my suit that I will race in my Iron Man 703 in 2 weeks,1939,4
DF 04001 released,1940,2
My 4 year old Just Pink PC Master Race Things,1941,2
My toilet roll got cut wrong,1942,2
Valve please fix the microphone sound in the next games,1943,2
That Esquire intern that got a makeover That was me AMA,1944,8
Meanwhile in local bank,1945,2
Stahp It tickles,1946,8
TIL You can remove free to play games from your game library,1947,2
Yellow traffic paint [2560x1600],1948,2
Gambit Gaming Replace Diamondprox and Darien  Dailydot; Richard Lewis,1949,4
Tech savvy mafia,1950,6
Court moves toward death for contraceptive coverage The court has signaled that the contraceptive requirements days are numbered It has also quietly adopted a reading of the Religious Freedom Restoration Act so broad that the worst fears of Hobby Lobby protesters  appear to be wellfounded,1951,4
Autocorrect is always by my side when talking to new people,1952,2
What about an alternate reality Lucian legendary skin where his soul got abducted by Thresh and you play as Senna,1953,2
My Beautiful Sister inlaw and her hair I colored ),1954,2
Democrats Draft Bill to Override Contraception Ruling,1955,4
I dont think bfs cat likes me coming over,1956,2
Is it plausible that black holes orbit something the same as how stars orbit black holes and planets to stars,1957,8
Bitcoin Could Be Used To Fund [Jihad] [Charity]  How Would You Like This Wrapped,1958,2
Student Tried Returning This At The End Of The Year (iPad 2),1959,2
Last Whispers last whisper,1960,8
MRW I see someone with a [16] next to their name,1961,2
The sad part is at the time I had quit smoking and I was only keeping it because it was given to me by my friend before he passed,1962,2
Habs fan spotted at the World Cup,1963,2
TIL that Ringo Starrs first exposure to percussuion happened when he contracted tuberculosis at the age of 13 and was admitted into a sanatorium for 2 years The staff encouraged him to join the hospital band where he used a makeshift mallet to strike against the cabinets next to his bed,1964,2
I dont use google+ but the album had over a thousand views,1965,7
Recycling,1966,6
That time when i got to meet Captain Jack dressed as Captain Jack Then got hit on while he signed my time vortex manipulator,1967,2
It has been becoming a problem so Im taking steps to quit,1968,2
Saddest Brazilian reaction,1969,2
Battlefield Vietnam had the perfect mini game,1970,2
My son was envious of my Lord of the Rings sword collection So I made this for him,1971,2
Saw this in line for Shake Shack NYC,1972,4
How to be Fly [OC],1973,2
Dont be shy,1974,2
Dual Boot Battlestation  Work & Play,1975,4
Dog having fun riding a horse made out of wood,1976,2
Quotes From Fireside Chat With Google Cofounders,1977,7
My ex after we broke up and I moved away Sometimes its better to cut your losses ad never see them again,1978,2
Sound advice but no,1979,2
225 study metaanalysis Active learning (as opposed to lecturebased learning) increases student performance in science engineering and mathematics,1980,2
Dwarf Fortress ver 04001 released (xpost from rdwarffortress),1981,8
ACLU calls into question why West Springfield police have two grenade launchers,1982,7
My friend had her daughters at a zoo when she heard Maam,1983,2
Norway has invented a bicycle escalator,1984,1
Saw this guy on War Thunder,1985,2
My friends dog ate a bee,1986,2
Took my daughter out for a nice dinner,1987,2
After brain surgery my boyfriend couldnt think of the right names for things,1988,2
My local newspaper,1989,2
Grammar,1990,6
Went cayaking with my girlfriend and we made the cutest friend,1991,2
Happiest boy on earth right now,1992,2
Please Help 15YearOld Missing After Warped Tour in Toronto,1993,2
Recently got invited to Valve and took some photos,1994,2
Dirty Dog ),1995,2
Batbear fighting an invisible enemy in a bath [xpost raww],1996,2
Went to Thailand so here is a elephant with sunglasses,1997,2
Aww thats so amazing congratulwait what,1998,2
Not saying you are gonna need it but if you do,1999,2
Bath time can be hard on any parent,2000,2
I am the banana king,2001,2
The future is here,2002,2
In my hotel room I can either close the closet or the bathroom but not both at the same time,2003,2
First photo of Ian McKellen as Sherlock Holmes in Mr Holmes,2004,2
Classic Colbert,2005,7
Whenever I try to grow facial hair,2006,2
This sad Brazilian fan was shown crying But no ones published this beautiful picture of him handing the trophy to a German fan He was quoted as saying Take it to the final As you can see,2007,2
Waiting for me at home,2008,2
When a pregnant woman swims she is a human submarine,2009,2
TIL murderers in medieval Ireland were given to the deceaseds family as slaves if they failed to pay a hefty fine to buy their freedom The family could then legally kill the murderer themselves,2010,2
Who I imagine is in charge of rfunny,2011,2
Coworker supported Brazil I told her I would bake a cake to make her feel better,2012,2
Heres my friends dog in a banana costume,2013,2
Best joke in Skyrim,2014,2
Oooh,2015,9
Booked a budget room last minute for a business trip ended up in the most beautiful and decadent hotel I have ever stayed in,2016,2
He cant believe his eyes,2017,2
Im attracted to my boss I think,2018,2
This guy is my hero,2019,2
This Man Shouldnt Be the Next US Patent Office Director (Its the FCC Appointment All Over Again),2020,2
This is what happens when flyimg the flag becomes socially acceptable again in Germany,2021,7
TIL Shaggys real name is Norville Rogers and in the original ScoobyDoo series he was born in Coolsville,2022,2
Boy called out when seeking attention,2023,2
MY version of Grand Theft Auto growing up,2024,7
Im so in debt I can,2025,2
dog graduates now too good for direct sunlight,2026,2
The first 1000 digits of pi connected,2027,2
God Dammit Norman,2028,6
Looking back it really did,2029,2
Driving home on the highway this utility pole is a clown,2030,2
Approximately 23 buses have been set ablaze in Sao Paolo Brazil following the World Cup defeat to Germany,2031,7
