Title,doc,topic
My average experience in Gold/Plat - TSM OddOne,1971,2
The Moon,1972,4
British problems.. they remained there for the rest of the train journey,1973,4
"My kitty just had a litter of three, here's one of them. (4weeks old)",1974,4
#KMFace photos mock Kinder Morgan claim that facial expressions are a form of assault.,1975,2
To the guy who wants to know why those in congress have a 90% re-election rate,1976,4
Guy finds a nice surprise in his can of soda,1977,4
My MIL begged for a grandchild...we said sure why the hell not?,1978,4
What is one image that sums up Top Gear for you?,1979,4
That's one way to do it!,1980,4
"Best Buddies at 10, 17 and 29 years old",1981,4
MONSTER Energy drinks are the work of SATAN!!!,1982,4
Lil Jon just shared this on Facebook,1983,4
Benjamin Franklin's unrecorded wisdom...,1984,5
Glow stick blows up in kids face - one of the funniest things I've ever seen,1985,4
Fire and Ice,1986,4
I'll be more careful next Thursday,1987,4
Dad saves kid from ball,1988,9
you gotta dress for success!,1989,0
Ellen on candle salad,1990,3
Top 0.1%'s wealth about to overtake bottom 90% for first time since 1929,1991,4
He left the party shortly thereafter...,1992,4
"The storm scared her, so she started crying and ran to me. And yes, she is sucking her thumb.",1993,4
How to spot a dad,1994,9
Today is Remembrance Sunday in Britain,1995,2
An ancient work of art depicting the console wars from 2001,1996,4
"As a reminder, don't start celebrating until you are actually IN the endzone.",1997,4
Uh oh,1998,4
Movember,1999,0
A katana fight between two robots,2000,4
I am now the proud owner of this,2001,4
This is my piece of the Berlin Wall. I've had it for 25 years. I love the colours.,2002,9
"Here I am, in all of my '80s grandeur, taking a whack at the Berlin Wall. (repost from a few years ago)",2003,9
Sherlock's Shirt,2004,4
I underestimated my own laziness.,2005,3
Why wont this damn thing start?,2006,4
"TIL that Jerry Seinfeld's annual earning from Seinfeld in 2004 was $267 million. Between June 2008 & June 2009, Seinfeld earned $85 million AND as of May 2014, his estimated net worth is $820 million.",2007,7
NFL fans in London took Cowboys literally,2008,4
The necessity of the Oxford comma...,2009,5
Interstellar Explained [Massive Spoilers],2010,7
I proposed to my fiancee 6 months ago,2011,4
EFF: ‘Jailbreaking is not a crime’ and we will fight to ‘keep it that way’,2012,3
Oh snap-e,2013,4
"Technically speaking, the fattest person in the world is also the most 'attractive'.",2014,4
"Club that Ernest Hemingway used to use to beat drunks at a bar in Key West, still has blood on the end.",2015,4
Pokemon Blue Super Nintendo Cartridge,2016,4
The best thing about winter coming.,2017,4
Went to France. Was not disappointed.,2018,5
"Was talking with one of my friends that just got a new Macbook Air, when i came up with this",2019,4
How to properly advertise memory cards,2020,8
My girlfriend keeps sending me pictures like this since she got her second golden.,2021,4
A very long rock conveyor,2022,4
"When half the server are cheaters, you get helicopter bus.",2023,4
My favorite gif,2024,4
This pen came from a fertility clinic.,2025,4
Got Thanksgiving dinner already planned,2026,4
"The elegant way medieval scribes would repair torn pieces of parchment in their books, this example from the 1300s.",2027,4
Bird making laser gun sounds,2028,4
I don't want to seem too eager,2029,4
the goat's witnesses,2030,3
[gifv] It's the earth that's moving.,2031,4
They're not lying...,2032,4
Friend posted on FB. Still trying to figure this one out...,2033,4
If I were to describe my very first sexual intercourse (SFW),2034,4
Half Sheared Sheep,2035,4
My 5yo son is obsessed with Pokemon & requested an Ash costume for Halloween. Our whole family got into it. My husband's squinty eyes really make his Brock costume.,2036,4
[Suggestion] Let us see our team mates heroes behinds ours in the pick screen.,2037,9
Best Dog Ever,2038,4
Genius Inventions.,2039,5
I'm a 28 years old bearded dude.,2040,4
"Yeth, yeth I am awesome.",2041,4
Liam Neeson Kill map,2042,4
"My nose is running and I can't feel my toes. Being a group of poor students, this is the mentality of my roommates and I.",2043,4
No peeking!,2044,0
Darkness has fallen,2045,2
The way this water spilled looks like a tree,2046,4
"Scientists advance basic wound healing with a synthetic platelet that accumulates at sites of injury, clots and stops bleeding 3 times faster. The synthetic platelets have realistic size, disc-shape, flexibility, and surface proteins as real platelets",2047,9
NASCAR tire removal,2048,7
His response to everything,2049,4
A New York sheriff’s deputy was suspended late this week after a viral video surfaced that appeared to show him slapping and threatening a man who declined to let him search his car without a warrant,2050,2
Anon has sexual encounter (x-post /r/4chan),2051,9
"Working in health care, I have learned to never underestimate their power to screw people over.",2052,4
"Good intentions, bad dog.",2053,4
Catching a big one,2054,4
How I picture every dad joke in real life,2055,4
Kim just can't handle it,2056,4
This tiny door,2057,4
"Adderall, its a hell of a drug.",2058,3
Dogs in Business (by Twisteddoodles),2059,4
My husband made the Nutella Cheesecake for us :),2060,4
Swimming Up A Lightbeam (Underwater),2061,4
One of those stupid Buzzfeed type websites used a famous eating disorder picture as a 'Mirror Photoshop Fail' example.,2062,4
Found this fridge with obese spidy in my dorm,2063,4
Refurbished a 14' canoe to keep busy and try and cope with losing my daughter...I think it came out pretty nice,2064,4
He's been hitting on me for a month now and lied and said UPS asked him to hold on to it,2065,4
I had a coupon for a free photo mug. I couldn't think of a better way to start my day.,2066,4
And I have plenty,2067,4
Just a pug in a ball pit...,2068,9
Giving his buddy a hug,2069,4
What makes you uncomfortable?,2070,4
Best tank top ever,2071,4
Louis CK on not taking pictures with people,2072,9
How real men rage quit,2073,4
I'm pretty much a badass.,2074,4
Guy my brother works with pulled this on a coworker who was 25 years sober,2075,4
Its just a really awkward situation.,2076,4
My wife spent all day making this birthday cake!,2077,4
We were on a first date together...,2078,4
Good-time neighbours!,2079,5
Sunday morning breakfast at the firehouse.,2080,2
"/u/oPHILcial's gif was stolen by foxsports and used on their website without permission, hilarity ensues when he edits the gif",2081,8
Accidentally,2082,4
Yeah boss don't worry about it I got your back...,2083,4
Well...,2084,7
LPT Always take a picture of your valet parking ticket or coat check ticket in case you lose it.,2085,4
Lightsabers,2086,7
This is possibly the greatest face swap ever...,2087,4
This drink shimmers when shaken.,2088,9
"My friends going travelling, this was his going away present to us all....",2089,4
These are the doors of the Mexican Government Palace being set on fire in this moment.,2090,4
One of the VIPs who sexually abused boys at an apartment complex near Parliament has been identified as a former deputy director of MI6,2091,2
Trying to explain Movember to grandpa,2092,4
Who did this,2093,0
"Oh hey, I sat on that tank!",2094,4
My new kittens being bros.,2095,4
Reddit what is a lie you have told for so long that you aren't sure whether or not it is actually true?,2096,4
"Protests flare in Mexico after attorney general's 'enough, I'm tired' remarks | ‘Ya me canse’ becomes a rallying call for anger over the government’s handling of the apparent killing of 43 students",2097,8
250 MB Hard Drive. 1979,2098,4
This is what happens when my wife let's me get our dog a new tag for his collar.,2099,4
Can I at least have a cup of coffee?,2100,4
Some cool publicity photos of actors from the 1930s-60s,2101,9
[Image] Knowing is not enough.,2102,3
Whenever I line up at Chipotle,2103,4
I am Russell Szczepanik I was a RSO who flew the SR-71 in missions. AMA!,2104,2
We will remember them...,2105,4
"ELI5: When a singer is performing during a concert and they have an earpiece, what are they listening to?",2106,0
Epic Stan's Dad Costume,2107,9
Tinder problems,2108,3
I will not bow to the machines,2109,2
Chinese guy successfully installed Windows 98 on iPhone 6 Plus,2110,4
I see foods. I do not have foods. Fix dis.,2111,4
This is ridiculous. Why do digital downloads still cost more than physical copies?,2112,4
My dog loves his toys!,2113,4
"Maybe I'm the crazy one, but after two years of not having a cell phone just $100/month sounds absolutely insane.",2114,4
Five nuclear engineers murdered near Damascus,2115,2
ITAP at the local fair,2116,2
Not so fast MONSTER ENERGY.. RED BULL is the official drink of Satan!,2117,9
McDonald's menu in Israel,2118,5
"Conservatives Don't Hate Climate Change, They Hate The Proposed Solutions: Study",2119,4
This guy is INSANE... but you know at the beginning of the 2 minute mark that something isn't right with his brain. Robbie Maddison.,2120,4
Culture Shock Sudanese refugees coming to America,2121,9
Surfaces of different worlds...,2122,6
"1.9 mile long tunnel for irrigation canal, the small bead of light in the center of the blackness is the end.",2123,4
Kitten on the beach,2124,4
TF2 is a serious game.,2125,7
[No Spoilers] Met this cosplayer yesterday at the medieval fair. Flawless.,2126,4
My mistake,2127,4
Study shows that Psilocybin in Magic Mushrooms Create a Hyperconnected Brain...disrupt the normal communication networks in the brain,2128,0
Baby's first tunnel,2129,8
Even bears apologize,2130,4
Donald Duck Costume,2131,4
Sign put up at my local airsoft field.,2132,4
What's the worst experience on Reddit you've had so far?,2133,4
Crs Saintvicious intentionally feeding,2134,4
"Just know, you will probably never peak as high as this man.",2135,4
The Cleveland Browns have sole possession of first place for the first time since 1995,2136,4
If Earth were the size of Jupiter,2137,4
Ben Franklin,2138,4
What Would Jesus Do?,2139,4
Grading one of my 3rd grade student's homework tonight and came across this beauty. This was.....accurate. Trying to decide if I should give bonus points.,2140,4
Preseason for Dumbies – A Guide for Every Change Coming to League in the Preseason,2141,9
TIL Mike Myers was sued by Universal studios for 3.8 million because he backed out of his Dieter contract,2142,2
Let me in! Let me in! Ok fine.,2143,2
How are these frauds not prosecuted? 8,2144,9
Ketchup spout wasn't at the end.,2145,4
"TIL in 2007, Serbian vandals drove a stake into former president Slobodan Milosevic's grave to prevent him from coming back as a vampire.",2146,5
"[Haiku] Koffing, Use Smokescreen!",2147,6
MRw I see all these hoes ain't loyal posts [Picture],2148,4
Elon Musk and Google want to develop satellites for global internet access.,2149,4
MRW My wife ruins the punchline of my joke,2150,4
The Moon......a little patience......and a Helicopter,2151,4
Hayao Miyazaki makes ramen for his staff during production of Spirited Away,2152,4
Please don't say this guys,2153,4
Got drunk at a party last night and lost the cap to my new lipstick :( ...luckily my husband saved the day by 3D printing me a new cap!,2154,4
There is a perfectly shaped star of death forming in my front yard.,2155,4
Tried taking a photo of my dog for a Christmas card. She nailed it.,2156,4
Gotta stitch 'em all! Epic Pokémon cross-stitch my partner made [gif],2157,9
This is not Venice. This is Iraq's city of Basra in the 1950s.,2158,4
Skulls - Pencil Drawing on Canvas by Sergio Barrale,2159,9
So I was cleaning out an old house...,2160,4
...I'll just be on my way,2161,4
I wonder where their honeymoon will be?,2162,4
Azir is broken. Need to be disabled.,2163,4
"TIL that the founder of Israel, David Ben-Gurion, was an atheist.",2164,9
Yawning dog.,2165,8
Even Mark Hamill is ripping on the new movie title.,2166,4
"Housemate was away this weekend, so I decided to improve his bike. Should have plenty of rear wheel grip now!",2167,4
Flying,2168,2
The ten year old girl destroying top players in Smash 4 was staged,2169,4
It takes a lot to make a stew.,2170,4
"This Week in Science: Ion Doping, 30 cm Long Particle Accelerators, and an Interconnected Web of Stars Across Galaxies",2171,4
"No I mean England. As in England, England.",2172,4
You get Flash at level 8 and smite at level 10 on PBE!,2173,4
So I tried the one-pot pasta recipe,2174,6
MRW my teacher returns a test that I thought I failed and I end up passing it,2175,4
Visualizing the Netherlands by just looking at the canals and the rivers (excluding lakes). [OC],2176,4
"Man, this scared me!",2177,4
Good Guy Crane Fly,2178,4
Anyone else finding themselves cancelling a lot of autos recently?,2179,4
"Any K-On fans here? Today I visited the school that the show was based off of, and had a grand ole time (More comparison shots in the comments) [x-post /r/k_on]",2180,4
Squeesh,2181,5
Kitty to Infinity!,2182,3
He insisted on going outside when it was raining. Then regretted it 2 minutes later.,2183,2
This guy does his RC car from scratch.,2184,4
How to ruin enemy junglers life ft. Araneae,2185,2
Black and white,2186,4
I found this interesting,2187,4
Kiss,2188,4
Adventures at the art institute,2189,2
Isn't it the time to buff Zac?,2190,4
"My cousin caught a rare, blue lobster.",2191,4
Probably the hardest I have laughed throughout the entire series,2192,4
Not your typical reentry,2193,5
"TIL Meat Loaf attempted to avoid being drafted into the army by gaining 68 pounds, presuming he would fail his medical. He didn't fail, but he did ignore the draft call.",2194,2
Does anyone else do this? Or am I just odd?,2195,4
"Thought you all would like to meet Bronson, my friend's new puppy.",2196,4
ROCK AND ROLL!,2197,9
may god strike me down,2198,4
*Not Actual Size,2199,2
Halo title menus in your browser (x-post /r/Halo),2200,0
I think I want a job cleaning mirrors.,2201,4
"MRW my younger brother tells me that he has beaten my karma I've collected through a whole year by getting 2000+ upvotes on his first post ever, after I finally convinced him to join reddit.",2202,4
I got my hands on some old Ethernet Jacks at work.,2203,4
"This is the peak, EA",2204,0
Dire Straits - Money For Nothing [Rock],2205,4
the only way ill get a boyfriend,2206,4
Maru gives high fives,2207,4
Steph Curry gets a steal off the inbound and drains the 3.,2208,4
Aram surrender time needs to be reduced.,2209,4
This orc is too good for good death.,2210,4
Speaking of micro-pay transactions,2211,4
Sometimes I feel like Shulk can see visions of the future.,2212,4
"Goodnight, sweet prince.",2213,4
My wife's friend is pregnant again.,2214,4
Diablo Heaven vs Hell Battlegrounds for Heroes of the Storm,2215,9
I'm a white dude with a shaved head and a beard. A black customer with a shaved head and a beard greeted me with this photography pun the other day.,2216,4
Logic behind Rock-Paper-Scissors (best present ever!!),2217,0
Where will you be when the acid hits?,2218,9
Meanwhile over at /r/askreddit,2219,4
My brother is a bartender,2220,4
Anyone else feel like Tristana's icon looks too similar to Poppy?,2221,4
White girl claw machine,2222,4
"Redditors 20+, what was the first thing you remember doing on the Internet?",2223,4
"I just discovered speech recognition in Windows, and I could never remember Invoker's spells, so...",2224,4
[No Spoilers] My nearly finished Kingsguard Cosplay (gallery in comments),2225,4
That's one courteous smart car!,2226,4
Delphine's sword is....a little hardcore.,2227,4
Almost every frame of this video is a photo from a different photographer. To a creative person it’s like a three-minute horror movie. [2:55],2228,4
High school teachers try to break up ePIC SENIOR BATTLE,2229,4
In high school my friend got two pictures in the yearbook by pretending to be his own twin brother.,2230,4
Obama Makes His Move To Make The Internet A Public Utility,2231,4
Taking the $5000 taxi in GTA V,2232,4
first time seeing snow.. I think he liked it,2233,4
My roommate put this on our fridge,2234,4
Got hot shingles?,2235,4
After seeing a friend blow his entire paycheck on a new 4K TV.,2236,4
"10 year-old Romeo. And yes, he is smiling.",2237,4
Cake a daughter made for her lumberjack dad.,2238,4
This fish at the aquarium looks like someone stepped on his face,2239,4
"Mom, you're doing it wrong",2240,4
I made a useless wireless hat. Follow-up to Useless wireless duck,2241,1
The lady on this record from the 70s looks like Jimmy Fallon.,2242,4
"TIL After JFK was assassinated, there was a brief scuffle between local and federal authorities when the President's security detail wasn't allowed to remove his body from the hospital. It ended when the Secret Service agents put the local officials against the wall at gunpoint.",2243,4
"After the commercial break, the wife yells for me... (x-post from r/TheWalkingDead)",2244,4
Rage quit,2245,4
"Geologists who didn't predict an earthquake aren't killers, Italian court rules--seven scientists are free after appeals court overturns manslaughter conviction",2246,7
Cat Christmas Lights,2247,4
TIL Pope Benedict defrocked nearly 400 priests for abusing children,2248,2
TIL that John Constantine is one of the only comic book characters to age in real time with his publication. This year he turned 61.,2249,4
"I know it makes no logical sense, but....",2250,4
This goes through my head every Veteran's Day,2251,4
I browse Reddit on my phone a lot. This is appreciated more than you know.,2252,4
Classic Eli Manning,2253,5
Got a light?,2254,4
Astronomy professor asked this question. Our clicker remotes only have 5 buttons.,2255,4
I don't feel bad one bit.,2256,4
The stage crew looked at me like i was an idiot.,2257,4
Obama: Classify the Internet as a Utility,2258,2
Not just a number...,2259,7
There is a birds nest in this 'tree',2260,2
World War Eleven Veteran,2261,4
"this is my buddy Harris. He was KIA 4 years ago today. I try to live my life as a good person, and not complain too much because he never got the chance to. he was 23.",2262,4
"TIL: Later in his life, Voltaire developed the habit of living near borders so he could more easily escape the authorities if his writings angered them",2263,2
Hot shingles you say?,2264,4
This gif makes me wish I had a little buddy.,2265,4
"Wife saw a thread on Reddit about partners leaving after sexual assault, asked if I would leave her if she was raped.",2266,4
Evolution,2267,4
A prairie dog too fat to get out of its hole.,2268,4
Today is my coworker's last day. She told me I could have her family pictures.,2269,4
gramps dropped this one on me while waiting at a red light,2270,4
Women in advertising,2271,4
379 Movie stills I like to use for my desktop background,2272,4
Amazing how many people don't do this.,2273,4
"Teachers of Reddit: What was the most BS answer you've seen on a test, quiz, essay, etc.?",2274,8
My 2 yr old daughter looks exactly like my mom when she was 2yr old.,2275,4
All I can think of when I hear that Obama has weighed in on Net Neutrality. His actions speak much louder than words.,2276,4
When you didn't study for the test,2277,4
Plot Twist.......,2278,4
Timing,2279,4
"I am David Hayter v/o actor, writer, X-men 1 and 2, Watchmen, Solid Snake, etc... AMA!",2280,2
My Mom and Dad in the late 50's. Damn I miss them.,2281,4
I work at a middle school in West Philly. I intercepted this note today.,2282,4
"Couldn't find my candle holder, as a musician I improvised the best I could.",2283,5
Next stop Mordor...,2284,4
MRW my code starts working but I don't know why,2285,4
I love clever advertising,2286,9
Netherlands rolled out the first solar powered roadway (bike path) today,2287,4
How my wife watches tv with me,2288,4
New photo of earth with the moon in the background taken by Chang'e 5-T1,2289,4
Girls: what romantic gift by your significant other was really awesome?,2290,4
Guy who lives down the street from me drives a Google maps car.,2291,4
My shirt came alive...,2292,4
The cake my wife ordered for my birthday.,2293,4
I.......don't think I will be working there.,2294,4
It looks like a perfect fit.,2295,4
It really was the best answer. And I laughed in front of everyone else who thought it wasn't funny.,2296,4
100$ knife 0 - Garlic 1,2297,4
This bar bathroom has strict standards,2298,4
This is so very appreciated..,2299,1
So my friend told me this. I almost thought I had a redditor friend in real life.,2300,4
Friend got a book called 'Crap Taxidermy' this is my favorite.,2301,4
You can have this,2302,0
This is the happiest field mouse I've ever seen.,2303,4
At the science museum chaperoning with a Mom of another student.,2304,4
Beauty standards are getting weirder,2305,4
After watching The Simpsons/Futurama crossover.,2306,4
My laptop has that Hermann grid illusion,2307,0
Went kayaking this weekend and this curious Sea Otter swam over to say Hi,2308,4
I've worked here for 7 years and only today noticed this blunder...,2309,4
Found this while duck hunting yesterday,2310,4
I wonder if the average headphone cable is long enough for Yao Ming to put his iPod in his pocket.,2311,8
Bird imitating R2D2,2312,4
Every child's horror at the grocery store,2313,4
"Pura Lempuyang Door in Bali, Indonesia",2314,9
Just a 'Massive' Cape Cobra having a stroll and a swim on the beach by my house.,2315,8
I asked my classmate a simple question and got the weirdest answer of all time.,2316,4
Still my favorite gif,2317,4
Co-worker asked me to watch her plant while she was out for the week. Here's what happened.,2318,4
EXCLUSIVE: Oscar Pistorius may be forced to stay in jail because he has NO ANKLES for electronic tag,2319,4
"TIL: That up until the early '90's, Appliances sold in Britain were NOT required to have a plug on them. If you purchased a toaster, you were expected to buy a plug and wire it in.",2320,2
This quote will go down in history,2321,4
Since they refuse to discuss things with the people they're supposed to serve,2322,4
Good Guy Squirrel,2323,4
"WTF is going on in Pinal county, Arizona??",2324,4
'Too big to fail' bank rules unveiled - New global rules to prevent banks that are too big to fail from being bailed out by taxpayers have been proposed.,2325,2
College in Germany is utterly free. It should also be free in the United States. I am Andrew Ross of Strike Debt and the Rolling Jubilee (we buy debt and get rid of it) and author of Creditocracy. AMA!,2326,4
Mother & Daughter,2327,4
[Image] For people who plan more than they execute: Today's XKCD,2328,4
Had to reboot this router recently. I was very worried. Took this just before hitting 'reload'.,2329,6
Asking the tough questions.....,2330,8
Simple image sharing,2331,4
I wish it wasn't so true...,2332,5
Not two minutes before my alarm,2333,4
Putin's motorcade everyone... cumin' into town,2334,9
Crossfi✝,2335,9
Chalk Drawings,2336,1
The shock wave created when two male Muskox collide at 30 mph,2337,4
Who are the gatekeepers?,2338,4
I don't understand my SO,2339,4
Baby ducks on a water slide,2340,4
This boat is in the water.,2341,4
Fire Alarm During Gold Promo...,2342,2
This is one evil looking gecko...,2343,4
Cat leaves house to hang out with a deer,2344,9
Pirate Bay Founder Peter Sunde Released From Prison,2345,9
TIFU by teaching my co-worker anal.,2346,8
Man buys 99 iPhones to propose to girlfriend; She says no,2347,4
Ted Cruz Says Net Neutrality Is 'Obamacare For The Internet',2348,2
"Well played PCMasterRace, well played.",2349,4
Teenagers at a party in 1947,2350,4
life hack,2351,4
I know you like it...,2352,4
Somewhere in rural America...,2353,9
Can we please be adults about this?,2354,4
I'll see your new professor and raise you the Dogtors.,2355,4
I say ole chap... would you mind passing that morsel my way...,2356,4
"Out of all the people online, 1-on-1 matched me with my brother, who was sitting beside me.",2357,4
So I give my daughter an inflatable T-REX for her birthday....,2358,2
"Riot, can we have the inverted death animation for champions ulted by Zilean?",2359,9
My dad carves carousel horses,2360,9
We won! We won!,2361,3
Microsoft files trademark for Battletoads,2362,9
"After the commercial break, the wife yells for me...",2363,4
Irish fisherman,2364,4
"Mike Mitchell tries to jump over the Jets' victory formation, and Nick Mangold is not having it.",2365,4
Self Cleaning Roads In South Korea,2366,4
Do Not Disturb.,2367,1
Another classic on uplay,2368,5
NOT RACIST,2369,4
The kid who sits next to me in class brought a clothing iron to class and used it as a water bottle (With a straw and all),2370,4
My whole day is ruined.,2371,4
Sad but true,2372,4
My buddy and I met for a run today. It was 55°f (13°c). He's from Florida. I'm from New York. We seem to have different views on how to dress for this temperature.,2373,4
Meteor caught on camera at a Modest Mouse show this past weekend!,2374,4
My godmothers late mother in the 1930's,2375,4
"While watching the football game last night my wife ask, Why do they tell you what political party the players support?",2376,4
Someday soon you'll start shooting webs of your own!,2377,4
Amateur Thrift Shop Chair Redo,2378,9
This guy always makes me want to play as an Orc.,2379,4
Police Use Department Wish List When Deciding Which Assets to Seize,2380,4
Special delivery,2381,4
He's looking good,2382,4
Gluten-free is the only thing hyphenated on the box,2383,4
I felt so good about meeting new people,2384,4
Net neutrality activists blockade FCC Chairman Tom Wheeler's house just as he's getting into his car,2385,2
TIL the original 'Mind the Gap' recording used on the London Underground was restored at Embankment station last year because the actor's widow was comforted to hear her husband's voice again.,2386,4
Our human is home!,2387,3
Our lord and saviour Qtpie has some motivational words to all the spartans grinding RIGHT now!,2388,7
My older sister got this private message,2389,4
Cheeky Crono,2390,1
