Title,doc,topic
My co-worker's Halloween costume was spot on.,0,4
Took 4 months to grow my hair like Marv and 5 week to grow my beard! Turned out pretty good.,1,4
"Went to a bar with my sis last night, my sis dressed up as Slash, Norman Reedus from the Walking Dead took a picture of my sis, TEXTED IT TO THE REAL SLASH",2,4
The Walk of Shame After Halloween Is Always the Worst Walk of Shame,3,9
The best group costume I saw last night,4,4
This is Carter. He knocked on my door to ask if he could have a banana then left.,5,4
"If I offered to install a solar array on your house for free with the only caveat being that you would use half your electric bill savings to help your neighbors install their own solar arrays, would you participate?",6,4
"TIL since many female insects mate just once in their lives, insect populations can be controlled by releasing swarms of sterile males into the wild; the females mate with them, never have babies, and die. The method has eradicated populations of dangerous insects in several regions.",7,5
"For the stranger that showed up with one of my party guests last night, brought alcohol, defended my female friend from drunk advances, and helped clean up afterwards.",8,4
The girl in this photo is not being treated; She died over 500 years ago and is being examined.,9,4
There are 2 types of girls on Halloween,10,4
Chocolate Lab Kiss,11,4
Corgi Avengers?!,12,9
Guy at worked pulled off a pretty good Borat today...,13,4
The guy who was motivating people at the gym.,14,4
Burrito Baby,15,4
This is TF2 right now,16,4
My good deed went wrong,17,4
"If you want to feel old, this is what they were stealing in Fast and Furious 1",18,4
My daughter was a marionette for Halloween. Now I'm afraid to sleep.,19,4
Super Smash Bros 3DS banned me from online play for 136 years.,20,4
This guy always boosted my confidence before facing the gym leader,21,3
My wife made my son a Baby Groot costume for Halloween.,22,4
What I've been asking my kids this morning...,23,4
Time to go haunting.,24,4
If you see a black cat...,25,4
This is the first time I have made it through the month of October without hearing Monster Mash once.,26,4
I thought this was funny,27,4
This hero came to the defense of my muslim friend,28,4
Americans are paying more for slower Internet,29,2
"Wands and wings, floaty crown things!",30,8
Anatomical Make Up,31,4
Ebola situation in Sierra Leone is catastrophic and vastly under-reported - There are several villages and communities that have been basically wiped out. In one of the villages I went to,32,4
My kids went Trick or Treating at the White House yesterday. These are M &M's and Hershey Kisses. The kids are saving these...,33,4
GAWH! Randy wants to party,34,4
I found some guy dressed up as Neil Degrasse Tyson.,35,4
My Friend's Attempt at Starlord (Guardian's of The Galaxy),36,9
"She doesn't speak english well, and got confused, so she just sat in his regular seat",37,4
She said I should dress-up like Homer...,38,4
Crazy ex-girlfriends are like a box of chocolate,39,4
While Defending Sikhs Costumes,40,0
I saw this sign last night ...,41,4
Best Pet Halloween Costume of the Year,42,4
Found a bird nest in my yard. The inside is lined with my dog's fur.,43,4
I just moved to a different part of town.,44,4
Justin Timberlake,45,5
I hope he still does this,46,4
you have a serious problem,47,4
"Calmer than you are, Dude",48,4
Someone dared to repost Beast the flower cat? Beastie don't care! She's just doing her thang.,49,3
My pizza came with a cardboard crust layer.,50,4
"If you are old enough to drive a car, you are getting condiments.",51,2
China completes first mission to moon and back,52,4
What happens you mix a Husky and a Golden Retriever.,53,4
"Dressing your pet up for halloween is kind of cheesy, but this is f*ng awesome (PIC)",54,4
Just a friendly reminder,55,4
Why does Walmart sell fish if they can't care for them properly. All are dead except one and he is nearly dead...,56,4
TIL the student council of an Illinois high school played Justin Beiber's Baby on the loudspeaker between every class until students donated $1,57,4
no one knew who I was..,58,4
The guys from Supernatural dressed up like each other for Halloween,59,4
Eiffel Towered,60,2
Halloween Dalmatian,61,4
You know the drill.,62,4
Best Breaking Bad gif of all time?,63,4
I Love Nuclear Chess!!,64,9
MRW the kids go to sleep and they leave all their halloween sweets with me,65,4
When I was a kid I had to walk miles to fill my pillowcase.,66,9
Boyfriend and I dressed as famous graffiti. People didn't get it...,67,4
"Walk of Shame? Doesn't matter, had sex...",68,9
"My friends daughter dressed as Supreme Court Justice Ruth Bader Ginsberg, along with her Bailiff for Halloween.",69,4
Ziploc's ads are all lifehacks (x-post from r/Advertising),70,5
Move Over Westboro: This Years Costume is Lactose Intolerance,71,4
The reported FCC ‘hybrid’ plan for Net neutrality is not winning many fans,72,2
"Not all of us can dress up like a koala and a tree, some of us have a restaurant to run.",73,0
Bill Gates' mug shot after being arrested for driving without a license - 1977,74,4
You guys might like my costume,75,4
All the Single Mutants,76,4
This one's for you Robin Williams. Our Halloween tribute!,77,4
We'd like to talk to you about the Dark Side,78,4
My wife pretty much made all that you see! Maleficent costume worn by my daughter Melody.,79,4
"TIL downtown Seattle actually sits on top of the original city from the 1800s. It was rebuilt on top of ~20-foot high walled tunnels following a great fire, in order to prevent floods from high tide and sewage. You can go underground to see the original city remnants.",80,4
Wacky Waving Inflatable,81,2
Two of my good friends absolutely nailed Marv and Harry,82,4
TIL of a guy who drove around talking into cookies decorated like iPhones with the intention of getting cops to pull him over,83,4
When i open reddit on halloween,84,4
My cat Taco... dressed as a taco... eating a taco... from Taco Bell.,85,4
"Just moved to DC and I went to a Halloween party dressed as Carlton Banks. As soon as I walked in, I met Will Smith.",86,4
You're a wizard Harry,87,8
TIL the US left reflectors on the moon. They are used to track plate tectonics on Earth by firing lasers into the reflectors. This is also commonly cited as evidence that the moon missions aren't a conspiracy theory.,88,4
Meet Baby Bruno,89,4
Specular reflection on Titan (the sun glinting off of Titan's north polar seas),90,9
What happens when a poolball hits the edge of the table,91,4
Almost had a heart attack when I opened the door,92,4
Been scaring people all morning ;),93,4
The Nurse,94,2
Little Red Riding Hood and her Big Bad Brother,95,4
There actually are some pretty creative ones...,96,4
My greatest scientific discovery to date..,97,3
A mushroom grew underneath some fallen needles and formed a wigwam-like nest,98,2
A few guys from my city put some cardboard to good use tonight :),99,4
British Telecom has GCHQ backdoors in all of its modem/routers,100,8
This is by far the best costume I saw last night.,101,4
My friend is an art teacher. This was his costume.,102,4
"He was due Nov. 2, but showed up 10 weeks early. Meet my little baby burrito, Sam.",103,4
I work at a bank and was put through this very awkward situation this week.,104,4
PsBattle: Corgi wearing a unicorn mask,105,9
My attempt at Miles Tails Prower,106,9
I am Mrs Nesbitt,107,8
"Furious 7 Official Trailer, in theaters April 3, 2015",108,4
"TIL A man who would later become the president of Mormon church once declared, We will never get a man into space. [...] The moon is a superior planet to the earth and it was never intended that man should go there. You can write it down in your books that this will never happen... in 1961.",109,4
That moment when you're lost in thought,110,4
Took Uber last night and the total ended up being $123,111,4
"Boss gave me $80 to spend on candy, randomly grabbed a bunch of bags and bars and hit $80 exactly",112,4
Oh look! A penny!,113,4
my roommates are out of town and I'm stuck with this.,114,4
Lava skull descending into the ocean,115,2
"Being born w/ PFFD and having a prosthetic for 27 of my 29 years, I finally decided to be a one legged pirate. It was a hit.",116,4
2nd Best Job Interview,117,4
This is a rarity in etiquette today.,118,1
"As you enjoy your Halloween chocolate, spare some time to think about this tiny fly, the sole pollinator of cacao, the plant from which chocolate is derived. Thanks, Forcipomyia!",119,4
It is pronounced bouquet!,120,9
"Since no one knew the reference, I guess I went as apple man.",121,4
My girlfriend said she was dressing up as a Star Wars character. I assumed Leah. I was wrong.,122,9
"Um, I'm not sure...",123,4
"'I can infect whomever I please': HIV-positive woman steals frozen food from Texas Walmart, tries to infect employee",124,2
My friend made an Oogie Boogie costume and was feeding people gummy worms. I think he won halloween.,125,4
[Serious] Have you ever been tortured ? tell us your story,126,4
My son won Scariest Costume as a grunt,127,4
[OC] Shadow of the Colossus. My fan art of a masterpiece.,128,2
Manic Doodles by Keita Sagaki,129,0
"TIL: When Simon and Garfunkel first began performing, their music was considered a joke. The words Hello darkness",130,2
Face Folding is the best (Album),131,4
Actual Katarina Faceroll (Mommie),132,2
Kevin Spacey does impressions,133,4
Seems like an appropriate jersey for this sub . . .,134,8
I have way too much,135,4
"LPT: Replace the word 'problem' for the word 'challenge', it can drastically change your feeling about a difficult situation.",136,4
Yay?,137,7
[Spoilers S4] I will be your champion. (x-post from /r/pics),138,5
There are 2 types of girls on Halloween,139,4
"Sanders: Only If 'Millions and Millions' Rise Up, Can Progressive Agenda Win: Looking beyond the importance of election day, independent from Vermont says grassroots movement must embrace bold progressive agenda and understand that 'politics is a 365 days a year.'",140,9
I asked my friend to cut the cornbread,141,4
"First tattoo, went big. Slim Brown of Acme Ink in Louisville, KY",142,4
Being today is November first...,143,4
I'm super proud of this years costume. I thought I would share.,144,4
Homemade pastrami!,145,0
My chef costume,146,4
Our graphic designer and his girlfriend nailed it.,147,4
I too did an Officer Jenny cosplay! My hair wasn't as Fabulous as humm1n984D93R though.,148,5
Too many people didn't understand my costume last night. Losing faith in the younger generation :-(,149,4
Found this gem while on a trip to Dublin.,150,4
My kid got someone's sink stopper in his Halloween candy.,151,4
Us animals gotta stick together out here on the farm,152,4
Chad Smith as Will Ferrell's SNL Spartan Cheerleader,153,5
After a Long Day [OC],154,4
Reminder: It's time to Tina TURNER your clocks back tonight!,155,4
Pretty much,156,4
66 million years ago I never would have thought this was possible,157,4
MRW when a gonewild post begins with a lot of clothed pics,158,4
You all enjoyed my Flanders costume last year so I thought i'd share my Milhouse costume from this year!,159,4
Having fun isn't hard when you've got a library card,160,4
Beautiful black cat,161,4
took the bear costume plus brown shirt idea and made this :D,162,4
My homemade link costume,163,9
"My 4 y/o son lives Minecraft, he is either playing, watching a stream, or running around making zombie noises. My wife made his costume this year. He is in heaven.",164,4
I made our costumes this year.,165,4
Every time I play video games,166,4
Nomination for best and worst costume.,167,4
"Reddit, what actually lived up to its hype?",168,4
3 sisters from the Bucovina region of Romania.,169,9
Happy Halloween,170,4
An old castle being eaten by the swamp.,171,2
Guess who's 4 weeks old today!,172,4
November 1st,173,9
"Lithuania enacts ban on energy drinks for minors, in global first",174,2
My wallpaper when it's 12 o'clock,175,9
Probably the most dramatic example of sudden aging I've ever seen in a Pokemon game,176,4
RAM-MAN peasant destroyer!,177,8
Why people hate Pyro,178,4
"So I was drunk last night, and somehow I found myself in a bookstore that was open until midnight. I met this friendly guy there!",179,4
"The National Security Agency listed Israel among a handful of nations considered to pose the “greatest threat” to American government, military and industrial secrets, classified documents leaked by whistleblower Edward Snowden reveal.",180,4
DIY: Powder Coating Oven & Motorcycle Build,181,9
It's Day of the Dead and someone in San Antonio dedicated their altar to Robin Williams... Thought r/movies would appreciate this as much as I did...,182,4
Diameter and depth....awesome.,183,9
My dog,184,4
Jonathan Ericsson rails Jordan Nolan after illegal hit on Darren Helm,185,2
As a person with clicky joints,186,4
Plane crash kills three in flight simulator,187,4
My bartender wins Halloween,188,4
After a night of drinking....,189,4
Do you know the password?,190,4
Adventure is out there!,191,4
Kobe Reverse Dunk On Matt Barnes,192,7
Reddit meet Murray,193,4
This scumbag kid abandoned my 12 year old daughter 5 minutes before they were supposed to go trick or treating together and left her crying in our driveway.,194,4
My daughter the Golden Girl,195,4
A man on a mission.,196,4
"Here is polling place, candidate and initiative info for all 50 states. In 2010, less than half of eligible voters voted. There are 36 Governors races, 33 Senate seats and 435 Reps up for election. Several states are voting on legal marijuana, the minimum wage and abortion rights. Vote Tuesday!",197,2
My daughter wanted to be the Mona Lisa for Halloween,198,4
"My co-workers Groot costume. Yes, he is on stilts.",199,4
My gf tells me this place has turkey burgers that taste just like beef...,200,4
me irl,201,8
Own XCOM: Enemy Unkown on Steam? You can now install the Evolve Big Alpha. No key required.,202,2
Almost won my school's scariest costume contest with this!,203,4
The UK government has admitted for the first time that its intelligence agencies can access data collected by other international agencies about UK citizens without a warrant,204,8
TIFU by leaving my panties on the floor,205,4
I work at Sephora inside jcpenney and we have to clean the top layer of every lipstick in the store every night. Its pretty beautiful,206,4
I've been on reddit long enough I feel I should know,207,4
Facebooker just got back from Colorado after doing some major shredding....or did he?,208,2
This Halloween I am Optimus Prime's lesser known cousin and master of logistics. Sworn to deliver the cube in two busbiness days or less. I am Amazon Prime.,209,4
Blue Screen of Death crashed our meeting today...,210,4
My friends adams family photo.. too good not to share! :),211,4
Another reason to hate Ubisoft,212,4
HOW TO USE TELEPORT IN CHALLENGER,213,4
Cop Pulls Gun On Former Senator For Honking At Him,214,2
I wasn't aware there was a difference until then.,215,9
My whacky waving inflatable arm flailing tubeman costume performance for my company contest.,216,2
Grocery store was out of pumpkins.,217,4
"My new puppy, Mulder.",218,8
joke = true;,219,4
Baby Skunk,220,4
Star Citizen FPS reveal [WIP zero-G combat],221,9
The Christian God - Why does God hate amputees so much ? No human has gotten an arm or leg grow out again but at the same time God has gotten credit for miracles such as...finding lost cats...winning Academy awards...hitting a home run in baseball. If God exists I want nothing to do with him.,222,2
Being Asian has it's perks.,223,4
My friends' Beetlejuice costumes are ridiculously good.,224,8
Look who I found on Catalina Island.,225,4
10 Hours of Walking in DOTA2 as a Support:,226,4
"TIL in 2006 an Australian man tried to sell New Zealand on eBay. The price rose to $3,000 before eBay shut it down.",227,4
ELI5: How do anti-bacterial hand gels/soaps kill bacterial cells but not your own cells?,228,4
[No Spoilers] What the fans of my local icehockey team did yesterday before the game,229,4
"Reddit meet Fergus, aka snarf",230,4
Horseless Headless Horsemann Costume,231,9
D is for Drifter!,232,9
Baby alpaca falling asleep,233,4
"[B4E5] Goddammit, Suyin",234,0
This blows ...all night and only got 3 treats!﻿,235,4
My four year old son's unconventional Minecraft costume I made for him this year.,236,4
PsBattle: A cat standing up.,237,4
"Majestic, you say?",238,4
this site stores every Adult Swim bump since 2001,239,4
"During last night's home opener, the Bucks sold out the Bradley Center for the first time in four years.",240,4
"When my parents throw a party, there's always one member of the family who's not invited.",241,4
Heard this as a waiter,242,4
A judge has rejected the federal government's effort to dismiss a lawsuit challenging the constitutionality of the no-fly list on the grounds that the lawsuit would expose state secrets,243,4
The boys last night waiting for the trick-or-treaters.,244,4
Heat Miser and Snow Miser (nobody got it wtf),245,2
"Arachnophobia chopped out of a man's brain: For the first time, a person's lifelong phobia has been completely abolished overnight. Unfortunately, it required removing a tiny bit of the man's brain. [x-post from /r/science]",246,6
Korean Diamond 1 AP Kog'maw insane prediction,247,0
A clever way to show how ancient ruins looked like,248,4
I was the royal baby for Halloween,249,4
How daylight savings affects us in the north,250,9
"TIL of a Chinese general with 100 troops who had to defend a town against 150,000. He told his men to hide, flung open the gates and sat on the walls playing a lute. The opposing general, certain it was a trap, ordered a retreat",251,4
Pope Francis: 'Caring for the poor does not make you a communist',252,3
Made an account after three years of lurking just to show you guys the Groot costume I made (I'm Rocket),253,4
After her first day at Disney World...,254,4
I chose to make my own costume this year,255,4
Parents' reaction to my best man speech at my brother's wedding: Priceless.,256,4
"Late to the party, but here is my costume for 2014",257,4
And the price for the kids who clearly didn't have any help from their parents..,258,4
For all my graveyard shift brethren.,259,4
Received this in-game mail (WoW) from my son who just turned 7. Teared up.,260,4
Human Fuel,261,4
Dutch quadruplets,262,4
Buddy of mine had a really unique idea for handing out candy for Halloween this year.,263,4
We won best group costume for being the only group.,264,4
"TIL that all Sikh places of worship serve free meals for all visitors, regardless of religious, regional, cultural, racial, caste, or class affiliations.",265,4
Every Redditor,266,4
America's Media,267,8
Steve Jobs unintentionally outlines the reason behind Apple's future demise,268,4
Looks like a hand coming out of the sky,269,4
My 9yo Son Was Waiting For Me As I Exited A Stall In A Public Bathroom,270,9
Exactly,271,4
Indian Father Tortures and Kills Man That Raped His Daughter.,272,4
Peter and her shadow,273,9
I hit gold,274,2
This is reddit.,275,4
An image from Titan's surface — the only image from the surface of an object farther away than Mars.,276,4
Big media companies suddenly seem terrified of Netflix – and they should be.,277,4
"TIL that William Whipple freed his slaves when he signed the Declaration of Independance, because he believed that he could not fight for freedom and own slaves.",278,4
Finally found a use for my old TV!,279,4
"A man standing next to his grandfather on the streets of Pleurtuit, France in 1944 and 2013",280,4
Bengal kitties all tuckered out after thrashing around all the sunday beer boxes.,281,3
Chancellor Angela Merkel would rather see the UK exit from the European Union than compromise over the principle of free movement of workers,282,2
"Reddit, which fictional antagonist was right?",283,4
Stormy weather + low tide =,284,4
Unchained,285,0
Classic Irishman's dilemma,286,5
Volunteering at the Goodwill and this came in today,287,4
There's something wrong with the Avengers...,288,4
I have the cutest little falcon,289,4
This guy was walking around campus really slowly yesterday.,290,4
So cute,291,4
You are... By two days...,292,4
MRW as a European I look up how much American students pay for university,293,4
"When life gives you a red beard, you be Yukon Cornelius for Halloween",294,4
As an Australian,295,4
Los Angeles is going to try more friendly parking signs,296,4
I think I found my new lawyer.,297,4
"After being unemployed and selling all my games, electronics and most of my nicer clothes to get by this really lifted my spirits.",298,4
"I am a 28-year veteran of the Internal Revenue Service – having left IRS, I am free now to reveal how the agency is failing in its mission to serve the American people. Here is a 16-point summary of my 67-page open letter to Congress.",299,4
"Federal Drug Sentencing Reforms Go Into Effect Today: They should result in tens of thousands of federal prisoners seeing their sentences cut and being released early, as well as ensuring that future offenders are not sentenced so harshly",300,4
Would you care for some nuts?,301,4
The best by date on my mayonnaise is MAY0.,302,4
How To Deal With Junk Mail. Must try,303,4
How exactly do I try a sample of this in the middle of Costco?,304,4
Some dude sent me this picture of his available balance with the message Can i spoil u.,305,4
I teach 8th grade. They use Green Screens for school pictures now.,306,4
"Have a hunchback posture? Try these exercises for one month, twice a day, and try to improve your posture. [3:10]",307,4
Lost In Thought,308,4
So this is how our kitten eats its food,309,4
MRW I get drunk for the first time after being a Mormon for 31 years,310,4
Not a scratch,311,4
Came across this on my Facebook feed,312,4
Kitten Pie Anyone?,313,4
This is why I can't have nice things.,314,4
Come back here and take my money!,315,4
Case in point: Beats by Dre,316,9
I don't know if I want to take this bus.,317,4
Ping Improvement Concept by JiYung,318,6
Nobody is wearing a watch in this watch ad.,319,4
Suicide (x-post from /r/funny),320,5
Every time I see another scumbag ex meme,321,4
"In my defense, I just like everyone and see who liked me also. Apparently she does the same.",322,4
"That is not how you change gears, India[X-post /r/bakchodi]",323,9
My first attempt at shrimp&coconut milk soup with shiitake shrooms,324,2
I was lorde for Halloween. Credit to my wife for her artistic skills,325,5
Redskins suing 5 Native Americans offended by team name,326,4
"Tomorrow marks Gaben's 52nd Birthday! Happy Birthday Gaben! (Yes, that's confetti)",327,4
Women can be confusing sometimes [FIXED],328,4
"14 year old Halle, lookin pretty!",329,2
"Girls all dressing as literally sexy anything for Halloween, and I'm like It's for the best...",330,4
"LPT: When applying for jobs (especially to large organizations), look through the job description and add any keywords they use to your resume as frequently as possible to get your application through HR.",331,4
Have you ever heard a chicken sneeze?,332,4
Minnie and her Auntie Darcey enjoying a walk/bound along the beach.,333,2
Out duck hunting. Birds weren't flying. He was getting impatient. If those aren't puppy dog eyes I don't know what are.,334,4
Mara Wilson (Matilda) put this on her Facebook today,335,4
Science AMA Series: We are graduate students at Cornell University studying what things like colliding black holes and wormholes actually look like. We also provided black hole visualizations for the special effects team of Interstellar. AUA!,336,4
Didn't even get caught,337,4
My SO knows a guy who went on the Vomit Comet. She showed me a picture and I couldn't believe what I saw.,338,4
If Tetris was played with pillows,339,4
We've been friends for 4 years,340,4
About sums up how this year of school is going for me.,341,4
DIY: Hot Sauce!,342,4
"TIL that Google founded Calico, an anti-ageing company designed to ultimately cure death",343,4
Baltimore Mayor says she will stop a bill requiring all police to wear body cameras,344,4
Winter is coming.,345,4
My friend has two Bengal kitten brothers,346,4
Scheming,347,6
Listening to my favorite song,348,4
Iceland,349,4
Let me show you how it's done...,350,2
Chance of slight winds today (x-post r/foxes),351,5
"Large-scale study shows how common different sexual fantasies are. Based on responses, sex fantasies were also classified as rare",352,4
"A few years late, making it an even creepier comment.",353,4
Invasion,354,9
The AIM away message was the original facebook status.,355,4
"My lovely low poly Fox cover by Sasha Novik, Maruha Tattoo, St.Pete Russia",356,2
My boyfriend and I also went as Lana and Archer.,357,4
hey I'll even tickle ur back.,358,4
Bud lightyear,359,9
Coworker said happy Halloween and gave me this.,360,4
Unless you really need everything from the cereal aisle,361,4
Civilization: Beyond Earth Logic,362,0
My dating troubles,363,6
If you have a younger sister who doesnt play videogames you know this sadness,364,4
Poor guy,365,4
Grumpy,366,2
"I'm a little late, but I threw a costume party and lets just say the competition was pretty rough.",367,4
This tree is growing out of the side of a house,368,4
"Meet my 9-week old, Artie the panda",369,4
"What is something that is common sense to your profession, but not to anyone outside of it?",370,4
The Poke-Doctorate program,371,4
I met this curious buddy while hiking.,372,4
DIY Alakazam!,373,4
SGA: You are NOT supposed to lose heavy/special ammo when you die. Raise awareness.,374,4
This is not the place for you!,375,2
The evolutionary line of Silver,376,4
Wayne Static - Dead at 48. Horrible news.,377,2
PAX Australia Cosplay,378,4
Insomnia,379,5
"No one celebrated /u/hawkeye1515 birthday, reddit does.",380,4
Morning fog swan,381,4
My dad had a pretty great costume for halloween this year,382,4
Coins in Tape in Tin.,383,4
Feel the beat,384,4
