Title,doc,topic
"Movie Quiz, A Series Of Famous Movie Characters Reimagined In LEGO Blocks.",3933,4
WHEN MOM ISN'T HOME - League of Legends Version,3934,4
Old Person Spotted on the Cards Against Humanity Amazon Page,3935,4
"[WP] An undercover cop is given an obscure word or phrase to drop into conversation only if things go badly and the mission is aborted. However, for some reason, the natural flow of conversation with the people he's infiltrating makes it very hard to avoid saying it.",3936,4
"What small decision you've made, turned out to be the biggest?",3937,4
Don't screw around.,3938,4
I came downstairs to see my mom cutting onions while wearing swimming goggles...,3939,4
Bioshock print my girlfriend had made for my birthday,3940,4
Special delivery across the map,3941,4
Puppy doesn't understand the concept of personal space,3942,4
Sniff Sniff,3943,6
Torque it to 999 - foot pounds.,3944,2
"Springfield, Springfield! It's a hell of a town! The schoolyard's up and the shopping mall's down!",3945,8
Evolve,3946,2
So apparently this is a thing now.,3947,4
SI.com has learned that Will Muschamp has been dismissed at Florida,3948,4
"Four workers die after a chemical, used to make insecticides and fungicides, leaks at a DuPont plant near Houston",3949,4
Sent this to my classmates while lecture was going over an hour longer than it should have.,3950,4
"As a retail worker, this time of year especially drives me nuts",3951,4
Mecca at night.,3952,4
What I looked like before and after starting Serial this week...,3953,4
"This is my happy old dachshund. At 12-years-old, he still gives great smiles.",3954,4
And about hypocrisy...,3955,3
I love screwing with Sniper players,3956,9
"[No Spoilers] So, now people are shipping Korra... with Korra?",3957,4
A comic that we can all relate to,3958,4
I needed extra warmth so I turned my cat into a living scarf.,3959,4
Oh because what you say is always questionable to me.,3960,4
7up ad from 1984,3961,4
/u/soupjuice presents his pictures of the leaders of Civ 5 wearing blue jeans,3962,4
I spent 2 hours helping him..,3963,4
"The Burrowing Owl collects mammal dung and puts it around its burrow. The dung attracts dung beetles, which the owl then captures and eats.",3964,3
I'm pretty sure he's going to have to do some cleaning now,3965,4
"Every 10,000 miles of driving or so, I get to see something like this.",3966,4
I am Jack's color pencil art.,3967,9
I'm Asian and recently visited my white wife's family. I look like their adopted kid in this picture.,3968,4
"I work at a hotel, a guest left this when they checked out.",3969,4
Tinder,3970,3
We lost the dude in the sled about a mile back,3971,4
When you pause cartoons at the right moment..,3972,4
The Original ELI5,3973,9
Pay attention to the guy in the middle,3974,4
Masked smasher beats everyone ass in 9 hour tournament without eating or speaking,3975,4
"The woman I am most likely interested in isn't at bars or meetup, but at home watching Netflix, and there's no way I'll ever meet her.",3976,4
Full moon above Prague,3977,4
People still beg me for the recipe.,3978,4
WHAT ARE THE CHANCES,3979,9
Uh.. hello,3980,2
I am actress Natalie Dormer. AMA!,3981,2
My old Barbie TV looks like it's playing 9/11,3982,4
"TIL that Robert De Niro was so dedicated, to prepare for his roles, he actually gained 60 lbs for Raging Bull, lived in Sicily Italy for The Godfather Part II, ground his teeth for Cape Fear, became a cab driver for Taxi Driver, and learned to play the saxophone for New York, New York.",3983,4
The frost-line tells me the highest point the sun reached today.,3984,4
This ladybug landed on my binder so I decided to track its adventure instead of taking notes,3985,4
First pic of David Spade as Joe Dirt from Joe Dirt 2: Beautiful Loser (2015),3986,4
Bernie Sanders Wants To Make Election Day A National Holiday,3987,4
I didn't come to reddit to test my flexibility.,3988,4
This is fruit in the czech republic. In mid November. I didn't do anything to this picture. That's how good it really looked.,3989,4
"I think my son enjoyed his first time in the snow, even if he couldn't move his arms",3990,4
This encounter played out right in front of me.,3991,4
My wife left me alone with our son during a critical decision. She was less than amused. Dad win.,3992,4
Mexican Hero,3993,4
Putin claims west is provoking Russia into new cold war,3994,4
Texas poetry,3995,4
Mexican proverb [Image],3996,4
MRW when I drove through the Amish towns in my state last weekend,3997,4
Obama Puts Australia's Climate-Denying Prime Minister Tony Abbott on the Spot,3998,2
This plastic sheet keeps the bag open for you when you rake leaves,3999,4
Tumblr user judges a book by its cover. Gets told by another user.,4000,4
Someone wonders what would happen if an Ogre found a Paladin sword. This user tells us.,4001,4
My dog lies in bed like a dying old man,4002,4
Congress may soon vote on legislation outlawing Internet gambling. It is an open secret,4003,4
"The CSPC has won, magnet spheres are now illegal",4004,5
TIFU by out-farting a cabbie on the way to the airport,4005,2
How to impress the ladies,4006,5
"My car hit 222,222 miles today. .2 miles later, my trip odometer hit 222.2 miles. I was going 22mph.",4007,2
"Got an Xbox for $5 at a thrift store, anyone recognize this mod?",4008,4
"A snug fit: this is what the ride home from the ISS, aboard a Soyuz capsule, looks like on the inside.",4009,4
sniped,4010,2
My wife's cousin found this in Chicago today.,4011,4
"Adults with no best friends and no SO, how do you spend your free time?",4012,4
Article titles like this...,4013,4
"BP wants a federal judge to cap its potential oil-spill pollution fines at a maximum of $12.3 billion, a move that would cut away nearly a third of the penalties U.S. prosecutors are seeking for the Deepwater Horizon disaster.",4014,2
"I bought this for my boss but he didn't think HR would approve, so he made it HR approvable",4015,4
We ended the phone conversation 2 hrs ago. I took my phone out of my pocket to make another call and said 'Hello?'....,4016,4
Nobody expects it,4017,2
Next week is going to be brutal,4018,4
"Ted Cruz Doubles Down On Misunderstanding The Internet & Net Neutrality, As Republican Engineers Call Him Out For Ignorance",4019,2
Massive study of gay twins (409 pairs!) gives strongest indication yet that being gay is genetic,4020,4
Corgis can get cold too!,4021,9
More Moments of World History,4022,4
"As a Canadian, I've let my nation down.",4023,4
"I need all this money for ME, you GREEDY little boy",4024,4
Sushi eaters pushing Pacific bluefin tuna to brink of extinction,4025,0
[Image] This hits home...,4026,6
Alligator Bread,4027,6
"Saturday Night Live makes a sketch mocking sitcoms, but ends up with an eerily realistic commentary on today's society.",4028,6
Identity Crisis,4029,5
Still waiting for their logo to load,4030,4
Being Mexican I can confirm.,4031,4
"Robin Williams, circa 1977",4032,2
Snapchat is enabling money transfers to friends straight from a debit card...,4033,4
TIL actor Joe Pesci started as a singer and guitar player and played in the same band as Jimi Hendrix,4034,4
I drunkenly said this to my friend over the weekend. I hope it sinks in soon.,4035,4
Picture of my dog ended up looking like she was decapitated,4036,4
You bet it was a Tinder date,4037,4
Uncomfortable Situation Seal,4038,4
Hard times have hit one of my friends,4039,4
My dogs don't understand how to use their dog house,4040,4
Having a black President,4041,4
I've seen this more common than I'd like to.,4042,4
Good Guy Lowes Employee,4043,4
"I made a Santa shaped Bread from a recipe I found, it turned out a bit different from the picture",4044,6
Today is a good day no more student loan payments,4045,4
It was a 40 mile drive too.,4046,2
Fun Number: Apple Is Now Worth More Than The Entire Russian Stock Market,4047,4
My wife's jenga submission,4048,1
Girl makes dolphins laugh by doing gymnastics,4049,4
Sushi art,4050,2
My supervisor asks me how I get so many creative ideas,4051,4
Should have just gone to Wal-Mart...,4052,4
Oh seasonal candy,4053,4
Met this little guy this morning. He was really curious about me and followed me for a bit!,4054,4
First post :-) This is Millie - she loves chilling out on top of the door,4055,4
Kids riding a magic carpet,4056,0
A handful of pure cuteness,4057,5
I don't know if I should tell him,4058,4
MRW my post hits the top of /r/whitepeoplegifs,4059,4
"TIL the 1964 Hollywood War Spectacular 'The Battle of the Bulge' was so historically inaccurate, that President Dwight D Eisenhower came out of retirement and held a press conference just to denounce the film.",4060,2
Nintendo now officially gives its permission for anyone to use their properties for derivative works,4061,4
Being paid to poop!,4062,4
Preparing for the holiday season,4063,4
"This gif kind of grew on me, so hair it is.",4064,4
NBA 2k15 is so realistic.,4065,4
The REAL original ELI5...,4066,9
It's the little things in life like this,4067,4
"This hyper-realistic drawing of a twix bar, credit to Marcello Barenghi.",4068,5
"My wife teaches Grade 3, this was not the answer she was expecting..",4069,4
AMC to offer Interstellar Unlimited ticket; See the film as many times as you want,4070,4
Breathtaking view of the Milky Way from the surface of Mars,4071,4
Now that it's winter coat season...,4072,4
"TIL that in 2012 Jessica Alba co-founded a company that is now valued at one billion dollars, with annual sales of 150 million.",4073,4
"Australian man, wearing a dead Emu, catches a Kangaroo bare handed",4074,4
This is how you earn my business.,4075,5
It's been a while...,4076,4
How I take notes in Art History,4077,4
Goat Simulator expands into Goat MMO Simulator,4078,9
A mere flesh wound!,4079,0
What performers ask for in their dressing rooms,4080,2
This is what happens when you can not decide which two kittens to take out of a litter of three...,4081,4
Wakka wakka wakka,4082,6
"I adopted a kitten that looks like my eldest, her expression says it all!",4083,4
TIL that Ranch dressing is named as it is because it was the signature dressing of the Hidden Valley Ranch in California and was imitated by competitors as Ranch style.,4084,4
Fluffy orange puddle,4085,0
ten years ago today this masterpiece came out.,4086,4
that was....a pretty damn awesome transition (60fps),4087,4
[::] Poor Eeyore :(,4088,1
"Behold, bowling with cats!",4089,9
Bright lights and precipitation don't mix,4090,3
PC Master Wreath,4091,4
Christianity is a full-blown mental illness...﻿,4092,1
Kids on a magic carpet,4093,4
Deviantart: Me vs Most people my age,4094,4
Liquid Glitch,4095,4
This little creature likes to jump on our bed from the top of our bedroom door. It's not that cute when it's in the middle of the night...,4096,4
"I am Nina Totenberg, NPR legal affairs correspondent. AMA!",4097,9
"New York City is building 10,000 internet pylons for free public Wi-Fi 'up to gigabit speeds'",4098,4
My favorite Rosetta selfie so far,4099,4
Restroom funnies.,4100,0
It could literally happen to anyone...,4101,4
Developers of The War of Mine give out their game for free on piratebay to the people who planned to torrent it,4102,4
My Dad painted Teemo for me =),4103,9
What stage of cat lady is attaching a bed to your headboard? Cause I'm there.,4104,4
140 Hour Cardboard Millennium Falcon Project,4105,7
Baby hippo playing with bubbles,4106,4
Everyone in Michigan right now,4107,4
Moving forward,4108,4
My yearly review is today no less,4109,4
"What's something that I can learn to do in 5 minutes, that will impress 90% of the general public?",4110,4
An ms paint artist's rendition of last night's events,4111,4
PsBattle: Cleveland Browns DE Desmond Bryant drunken [11] mugshot,4112,0
"Was just introduced to our new employee, Bill Williams.",4113,4
‘Imagination gap’: We need more radical science fiction to inspire future technology,4114,4
They are both warm so why wouldn't this make sense!,4115,9
Deconstructed whale graffiti,4116,9
When your alarm goes off for a job you hate.,4117,4
Wait,4118,4
Apparently my cat thinks this is acceptable behavior.,4119,4
"TIL that exercising makes you both more productive and happier for the day that you exercise. It affects your brain function and memory, and the positive effect lasts for the entire day.",4120,9
"Colorado hands out $975,000 in pot funds to schools for health workers.",4121,5
Lilo keeps finding new ways being cute!,4122,4
By far the best face-swap in a long time!,4123,4
Pixar style Captain America,4124,4
The icon sizes on this page,4125,4
Amazing penalty kick,4126,4
My guildmate had a bad experience the other day,4127,4
Wait over: Josh Gordon officially reinstated,4128,4
I am MonteCristo and I'm back! AMA,4129,4
"5 year old was sent home today, does not regret incident.",4130,4
IGN caught fibbing about the way Dragon Age looks on PC (will post details in comments),4131,4
And I was wondering why he was being so weird when I got there. Why didn't he lead with this!?,4132,4
Mother Squirrel Holds Baby,4133,4
[Rappaport]: Tim Duncan has more NBA experience (17 years) than every active member of the Sixers combined (16 years),4134,9
Flame sword crafting,4135,4
Half Pipe Accident,4136,2
The Oakland Raiders are officially eliminated from playoff contention.,4137,6
This makes browsing Craigslist impossible at times,4138,4
ITAP of a bottle rocket taking off,4139,2
My badass friend.,4140,4
A born to be leader,4141,4
"Walk into attractive female co-worker's office, and smell her nasty fart",4142,9
Why does Dave become a mouse? (Language confusion),4143,4
Sears.com was advertising a 3DS XL Blue/Black console for only $59.99. Walmart honored it. They would have honored the Wii U Deluxe 32gb Mario and Luigi U for $59.99 but they were out of stock.,4144,4
"If Daft Punk released an album of sampled and reworked Pink Floyd songs, would it be a success?",4145,2
Can the Philae recharge its battery over time?,4146,4
Kitten loves car rides,4147,4
That zombie was intense,4148,4
"He didn't say a word for 9 entire hours, beat everyone there and won the bracket, gave a thumbs up and left without saying a word. When asked what to enter him as in the tournament he wrote Falcomaster3000.",4149,4
"Girl cheats on boyfriend with best friend, turns out they're both gay",4150,4
"The Monkey King (Adam Sky @ Rose Gold's Tattoo, San Francisco, CA)",4151,9
Whenever I fix a bug in a large project...,4152,4
Someone put the snow to work outside my friends office.,4153,4
Barracuda jumps into fishing boat,4154,4
He was trying to sniff the camera,4155,4
Josh Gordon officially reinstated,4156,4
"If you look hard enough, you can see it.",4157,4
"Metallica - The Call of Ktulu [Heavy Metal] - 1984 - You'll always be remembered, Cliff Burton!",4158,4
My friend's 16 year old cat looks like a bond villain,4159,4
Rarely Seen Moments of World History,4160,4
10/10 would watch,4161,4
I love listening to her talk...,4162,9
Zero Awareness,4163,0
TIL that 1000000000000066600000000000001 is a prime number. It's called Belphegor's prime.,4164,4
What would be the WORST way to propose to someone?,4165,4
"I called jinx on Pwyff in the 4.19 patch notes thread. Pwyff owed me a coke, and he delivered!",4166,4
VERY SERIOUS FULL AD RYZE MONTAGE,4167,4
"Colorado hands out $975,000 in pot funds to schools for health workers.",4168,5
Official confirmation by Inven that all 10 of the Samsung players have left,4169,9
This is why nothing ever gets done around here,4170,4
Watching interstellar made me giggle like an idiot because of South park,4171,4
Clickbait headline generator that lets you post results to facebook as a fake content farm style webpage.,4172,4
"Wrote a quote, Time well spent IMO",4173,4
My brother's Halloween costume in 1983.,4174,4
Yeah!!! Star Wars!!,4175,9
This one made me laugh,4176,4
[Haiku] Who are you?,4177,4
Got my wife while making the shopping list,4178,4
"I'm Promise from AHQ KR, AMA and thanks reddit for fund-raise.",4179,4
Jonas Gray is going to get 20+ carries and 100+ yards rushing tonight,4180,4
[NO SPOILERS] Norman Reeds posted this to instagram.,4181,4
I found a weeping angel in Lego Batman 3,4182,4
Tony Hawk rides a real hoverboard this time. Seriously.,4183,9
Going to public school for freshman year of HS after being home schooled my whole life... Every.single.day.,4184,4
You'd like to pet my dog?,4185,4
I created shirts for all 50 U.S. States + DC for a fake tournament between them. (X-post r/soccer),4186,4
"Facebook slams the door on political campaigns; In 2016 elections, political candidates will no longer be able to access users' friends lists to target potential voters",4187,4
My dog is ready to roll in CSGO,4188,4
First Love.,4189,4
/r/wow - I would like to request this. IAMA former moderator trying to mitigate an issue.,4190,2
Did this sub just go through Siege of Orgrimmar?,4191,4
"Can't wait for this to be a thing, we need more grittiness",4192,4
Most of us have gone through this at least once,4193,4
Can we have manacost on items like we have on spells?,4194,4
An ant crawled into our soap dispenser.,4195,6
Stair-set,4196,8
What sort of witchcraft is this??,4197,8
ELI5:Why do clothes put away in storage come out with a smell?,4198,4
This sticker needs a fix before Dreamhack.,4199,4
Tomorrow will mark 365 days since the Raiders' last win,4200,2
"Hi, welcome to Wallmart!",4201,2
"Shopping on Amazon.ca is frustrating as a Canadian, especially seeing what our friends down south pay for the same item...",4202,4
I made these little BOI characters and their starting items,4203,4
"Seriously, is physics not working for everyone but me today?",4204,4
"A breakdown of Detroit's financial history and how, ultimately, whole swathes of it had to be closed forming urban prairies",4205,4
93 year old and her Son try Marijuana for the first time ever.,4206,4
This is what happens when you connect your computer to itself with Chrome Remote Desktop.,4207,4
Hello ladies,4208,2
'Troll's Tounge' in Norway. 2300ft separates you from the lake below,4209,0
[PRESEASON 5] Pantheon can solo dragon at lvl 3 without taking damage. All credits to author of video.,4210,4
This popped up today.,4211,4
Germany warns Uefa may quit Fifa if World Cup report not published,4212,4
"I don't know what this fuss about large tools is all about, I seem to manage just fine?",4213,4
Chest bump...,4214,3
"Dude chillout , he wont kill you",4215,4
Putting a woman on a dollar bill,4216,4
After being informed that I can't post to r/videos because I don't have enough karma.,4217,4
My work gave me a hard time for calling off. 1. The buses aren't running. 2. There is a driving ban and 3. My car is in the garage,4218,4
O_O,4219,4
Advantages of Interstellar Travel,4220,4
"Let's be honest, this is the only thing that can break the internet",4221,4
Conductive ink,4222,4
war games,4223,4
You can plug a wired or wireless mouse into an android phone and it'll work.,4224,4
Best week of elementary school.,4225,4
"Sorry for the potato quality, but some days my job is awesome!",4226,2
"AOL, APPLE, Dropbox, Microsoft, Evernote, Facebook, Google, LinkedIn, Twitter, and Yahoo are backing the US Freedom Act legislation intended to loosen the government's grip on data | The act is being voted on this week, and the EFF has also called for its backing.",4227,0
I work at a nursing home. Today a resident said this while I was cleaning her room.,4228,4
I've decided to give my husband difficult information exclusively in meme form,4229,4
Comet Landing 2014: Rosetta Probe Philae Discovers Organic Molecules: Report,4230,4
Dave Grohl is the man,4231,4
Stray dog joins Swedish multi-sport team.,4232,4
I got a B-,4233,4
I'm Marques Brownlee (aka MKBHD) and I make tech videos on YouTube. AMA!,4234,4
after viewing r/malefashionadvice,4235,7
How to upsell Origin,4236,8
So rude...,4237,7
Something exploded in the sky over the Sverdlovsk region in Russia,4238,9
"Yes, in GTA V first person mode you CAN see your feet when you look down.",4239,4
Cartoonist draws on his coffee cup every morning,4240,4
When your essay is too short,4241,3
"Open game in Steam, which opens Uplay which opens the game in Steam. WHY.",4242,4
TIL that in the 1980s the Naval Investigative Service undertook a massive and futile search for a woman named Dorothy in the Chicago area,4243,4
"ELI5: How could Germany, in a span of 80 years (1918-2000s), lose a World War, get back in shape enough to start another one (in 20 years only), lose it again and then become one of the wealthiest country?",4244,4
This is how my tech support chat with Netflix started at 3AM.,4245,4
My girlfriend started showering at my place and this weird mold started growing.,4246,4
Ebola Nurse: Stop calling me the 'Ebola Nurse',4247,4
Why guys hate being in pictures.,4248,4
Senate rejects Keystone XL pipeline,4249,8
"For most of human history, vehicles had automatic collision avoidance and could even take you home when you were sleeping or drunk. Then we got rid of the horse.",4250,4
My son protecting the garden.,4251,2
"I was a Network Administrator, She's now my Wife",4252,4
Laughing in the face of death,4253,4
6 links that will show you what Google knows about you,4254,4
Found this gem in r/screenshots,4255,4
"Ubisoft May Get a lot of things wrong, but at least they promote healthy trigger discipline",4256,4
"TIL Saving Private Ryan depicted combat so realistically that veterans left theaters during the opening scene, stating that it was the the most realistic depiction of combat they had ever seen.",4257,6
The person in the stall next to me burst out laughing.,4258,9
Having Birthday Sex essentially means that you're having sex to celebrate your parents having had sex.,4259,4
Why OKCupid should have its own sitcom.,4260,8
"Driving in the UK, summarised eloquently by a Londoner.",4261,0
The Nerd is Strong at my Office,4262,4
Still my favorite photo on the Internet.,4263,4
Amputee girl Army of Darkness costume,4264,4
"Yeah, that was college for me.",4265,4
Stop Pre-Ordering Games,4266,4
Your grandparents reaction when you tell them you haven't ate since breakfast.,4267,8
Hospital patient asks local subreddit to bring him tacos,4268,4
Much better!,4269,4
I'm sorry I won't even feel bad if these people go bankrupt.,4270,4
If Josh Gordon doesn't get 20+ fantasy points we're shutting this sub down,4271,4
Scary Stories To Tell In The Dark to traumatize a new generation with film adaptation,4272,4
MRW I see Charles Manson has a hot 26yo fiance' and even Hitler had Eva Braun and I've been single for over 4yrs.,4273,4
Every time I come back from the shower in the mornings,4274,4
Keystone XL pipeline vote fails in the Senate,4275,8
I let him on the couch he's usually not allowed on. he watched the trains for an hour.,4276,2
"No, you're just supposed to sniff it!",4277,6
"As a gay man, I feel really welcome at TJ Maxx",4278,4
"Just a reminder to BYU, who has banned all 'chin hair' since the 70's, who their school is named after.",4279,4
"TIL Al Capone was taking in about $105,000,000 a year in the 1920's, or about 1.4 billion in today's dollars",4280,4
Crop yield was unexpectedly low this season.,4281,3
"I was undercover. You couldn't have spotted me, officer. I thought I was camouflaged",4282,4
Steve...,4283,0
Dark matter could be detected by looking for time glitches in the existing network of GPS satellites. One researcher is already mining 15 years' worth of GPS timing data for its signature.,4284,4
Sorting algorithms,4285,6
What my dad is currently dealing with.,4286,4
"My friend is selling his apartment, this is how he's showing it this afternoon",4287,4
A man walked into the restaurant I work at with a sketchbook and I jokingly asked if he could draw a hamburger for me. He left this on the table without saying a word.,4288,4
Ice Blossoms,4289,4
My grandparents know how to DMV,4290,8
Pro football player leaves behind $37 million contract to become a farmer,4291,4
Wood sculpture.,4292,1
And now I know exactly how much all my new co-workers make,4293,4
Vying for attention,4294,8
It was all in one smooth motion,4295,4
7 US CEOs made more money than their companies have paid in taxes,4296,4
43 in of snow last week in upper Michigan.,4297,4
My buddy's motion sensor camera captured this stylish deer.,4298,5
How to get a driver's license the right way!,4299,4
This Whole Foods display.,4300,4
This just makes me avoid asking entirely,4301,4
Whats a common thing today that a person from the Middle Ages would think is a torture device?,4302,4
My reaction to the advice about cleaning off the roof of your car. Never caused any accidents but people didn't follow me too closely for very long...,4303,4
The Anarchinator,4304,8
"Im on the front page, and the worst part is that everyone is telling me to run from myself.",4305,4
I recently moved out of state. My mom sent me this photo of my dog laying in my bed waiting for me.,4306,4
It's been a long day for Mya,4307,4
Just doing my part to help my fellow brothers and sisters avoid malware,4308,4
Equal and opposite reaction,4309,8
They are best friends,4310,4
Sharon Tate a few years before her 1969 murder by the Manson family,4311,4
The most powerful amiibo,4312,2
At least they called her out on it.,4313,4
Never posted before but I thought my amazing birthday cake was worthy :-),4314,4
"E-mailed an Indie Dev about a PC port for my favorite Ouya game, and got an unexpected response. Support devs that support us!",4315,4
"The more I see it on social media, the more I get annoyed",4316,4
There's a glitch in the matrix,4317,4
The 60FPS Horse,4318,3
School board which proselytizes during meetings dares the FFRF to sue them. The FFRF has obliged.,4319,5
"Actually, you really can.",4320,4
Steven Hyde understands,4321,3
Small jumps in salary if you have less than college degree [OC],4322,4
