Title,doc,topic
After listening to my sister scream for 3 hours about how that is a stupid reason to break up with her I've decided to make this while I hide in my room,5463,4
I found this spilled bag of M&Ms in the parking lot. The rain removed some of their shells.,5464,4
Yay! You're back!,5465,7
Old people wearing funny shirts,5466,4
I like to pain tiny pictures on my nails. These are some of my favorites.,5467,4
I work as a wind turbine tech in Sweden. The view some days are just amazing.,5468,4
"After some punk tried to steal my car, this was completely solidified for me",5469,2
The Angel for our Christmas Tree.,5470,4
"I like this idea, I'm not even famous!- no interaction for me today, all I need is 20 dogs :/",5471,4
"Tourist fined $30,000 for tagging Colosseum",5472,3
When Netflix asks me if I'm still watching while binging on a show,5473,4
My friend's sister got married yesterday. This was her dress.,5474,4
Unbelievable Shadow Art,5475,2
Took me a minute.,5476,4
Burger King axes 89 of its 688 franchises in Germany at once over ongoing scandals about poor hygiene and mistreatment of staff.,5477,0
Goat Simulator MMO is Fantastic,5478,9
My cats as he gets older and older is starting to look like a villain,5479,4
"Thanks to Facebook, I know what celebrities my friends look like. I wanted to know what celebrities celebrities look like.",5480,4
Do the studios even want my money?,5481,4
Trying to relate to the youth,5482,4
Hugs? HUGS!!!,5483,9
The signature on the wall of my basement steps turns 100 years old today.,5484,4
This FCC Commissioner Did A Reddit Chat. It Did Not Go Well.,5485,4
"Once again, Walmart.",5486,0
When I found out my friends had a Friendsgiving dinner and I wasn't invited,5487,4
"Jurassic World, teaser for trailer",5488,4
TIL that P.T. Barnum noticed people were lingering too long at his exhibits so he posted signs indicating This Way to the Egress. Not knowing that Egress was another word for Exit,5489,4
The annual red crab migration is on again on Christmas Island. This is behind a friends house on the island.,5490,4
The couple in the background of HIMYMhas been through a lot,5491,4
Watching Christmas movies as a European.,5492,4
Best review I have found for glue yet.,5493,4
One of my international law lecturers had this slide a few years ago,5494,4
What lurks beneath the cupboards?,5495,9
"These very english gentlemen were watching me during a photo shoot, I asked if I could take a picture of them with the model. Ended up being the best shot of the day.",5496,4
Please don't eat me!,5497,4
Discussing women's issues on the internet,5498,4
"During my prostate exam I asked the doctor, where should I put my pants?",5499,4
Do you think before you speak?,5500,4
Chuck on his way to the vet,5501,4
I'm currently serving as an English Teacher with Peace Corps in the mountains of Western Mongolia. This is my home for the next two years.,5502,4
"Random redditor, who are you?",5503,4
Just replayed Half Life 2 today...,5504,4
This is why I hate when my parents Friends are over.,5505,4
TIL there are Stevie Wonder Truthers,5506,4
There are some differences...,5507,0
Baltimore residents demand tougher laws on police officers: The hearing came two months after an investigation showed that residents have suffered broken bones and battered faces during arrests ... Nearly all of the victims in incidents that sparked those lawsuits were cleared of criminal charges.,5508,4
She is getting older but she's still beautiful,5509,4
It's my choice!,5510,0
Ikea has discovered perpetual energy,5511,2
Comcast Trolls America Part 4 - Non sequitur: Comcast Math,5512,4
You have to be careful buying from obscure sites,5513,4
Think she might be onto something //edit,5514,4
Breakfast in London,5515,2
So this is the most exciting thing happening in my life right now,5516,4
He pulled up behind me last night,5517,4
Police dog saves his officer,5518,4
Convenience often trumps ideologies,5519,2
My legally blind father and I made a coffee table out of the tree I climbed as a kid.,5520,4
[no spoilers] Nickelodeon summed up in one simple drawing........,5521,4
95% sure I found a fairy that impaled itself on barbed wire..,5522,5
Seafood Restaurant Birthday,5523,4
"Pod-like thing, growing vertically, with top about an inch above ground. Soft bodied and hollow inside.",5524,9
Two months of birth control acquired,5525,4
Thankfully English is not her first language,5526,4
Hey redditors in Portugal: How has it been since your government decriminalized all drugs? Have addicts been able to get help and has the crime rate gone down?,5527,4
What did you say to me?!,5528,4
"Princess Mononoke, Tianhua Xu, 2014",5529,9
Gaining his trust [x-post from /r/MadeMeSmile],5530,9
Just brushing off the snow on our car,5531,4
This actual reason that dinosaurs went extinct!,5532,2
Dutch boy with a pillow strapped on his backside in order to soften the falling on ice while skating. 1930s,5533,4
How to shock your hamster,5534,9
Pouring Cereal,5535,0
Recent trip to Shanghai! Tower above the clouds!,5536,2
I'm growing an avocado tree in a glass. It's about 2 1/2 months old and 40 inches tall.,5537,4
Woman dies after metal detector causes pacemaker to malfunction,5538,9
The world according to Home Depot,5539,4
My 6th grade gangster phase.,5540,2
The college put these railings up a few weeks ago.,5541,4
The happy atheist,5542,4
just some high-speed photographs of ink being dropped into water,5543,4
I am so lucky to have survived that...,5544,8
Was going through my late uncle's things and came across this relic from when he worked at the Fairfax county school system.,5545,4
ELI5: How did adding Le- or De- to the beginning of a more traditional name become prominent in Black American culture?,5546,4
Hit a deer with a company car a week before my last day...,5547,2
Charles Manson,5548,4
saturday morning cartoons,5549,4
I found this in my friend's bathroom,5550,9
Not all those who wander are lost. Middle Earth Map,5551,4
I had never heard of a silver lab until my boss brought little Maverick by the office today.,5552,4
Two T-Rexes Fighting Over Baby Jesus,5553,4
I can show you the world,5554,4
The Failed NSA Reform Bill Was a Sham Anyway: Data handshakes,5555,0
Thousands evacuated after British WWII bomb found in French city of Rennes - Packed with 70 kilos of high explosives,5556,4
Someone threw away a perfectly good cat.,5557,4
How did Einstein figure out relativity in the first place? What problem was he trying to solve? How did he get there?,5558,4
That's Right.,5559,4
[Image] A terrifying reality.,5560,4
"Had an encounter with this gem yesterday at my MarioKart party, she even woke the neighbors",5561,4
Fawn in the Forest,5562,4
"My new roomie, half pitbull half huskie, Nico",5563,4
PsBattle: Stylish Shiba,5564,4
I Left my fast food job to become a waiter,5565,4
"Reddit, what compliment do you never want to hear?",5566,4
"There is a line that should never be crossed, Christians!",5567,4
This is even more annoying when cashiers don't say anything to customers.,5568,4
"Mum running late asked me to go feed her cats, this is how I found them...",5569,4
We got this note with our paper delivery on Saturday morning,5570,4
Must. Get. That. Shot.,5571,1
How I imagine guys with no link karma and tons of comment karma,5572,4
"If you slow down a Nicki Minaj song, it sounds like a gay Jay-Z",5573,4
My M.C. Escher Attempt.,5574,8
MRW my SO says lets use the toys tonight,5575,4
On-Air Confession to Police,5576,7
if you dont look like this by 6pm thanksgiving day you aint doing it right!,5577,4
College during exams,5578,4
A newsletter to my mom,5579,4
Spaghetti eating contest: golden retriever vs german shepherd.,5580,2
New images from Jurassic World (2015),5581,4
What are we eating?,5582,0
It's quite annoying,5583,4
Paid for A-list...it is backfiring,5584,0
Arizona desert after rainfall,5585,7
"I'm almost completely blind. Some Redditors asked to see how I use the computer and browse Reddit. Thought maybe you guys would want to see, too.",5586,4
"Our new kitten, Mew, right after her first shower.",5587,4
Why we should stop pre-ordering games,5588,4
Forever Alone,5589,4
Absolutely Insane 1v5 Vayne Play,5590,4
There's something inhuman south of Seattle if you want to go looking for it,5591,4
"ELI5- Why is milk measured in gallons, but soda measured in liters?",5592,5
"Something both interesting, and a bit sad.",5593,4
TIFU by posting a naked picture of myself on Snapchat 'My Story',5594,8
"[AMA Request] Any of the kids from the 2006 documentary on Evangelicals, Jesus Camp.",5595,3
Roadrage in Korea,5596,1
"TIL In 17th century Italy conjoined twins were on trial for murder. Authorities arrested Lazarus after he stabbed a man for teasing his parasitic twin brother. Though he was sentenced to death the court let him go, finding that they could not execute him without killing his innocent conjoined twin.",5597,4
Lady on my local Buy & Sell gets it.,5598,4
When you see it...,5599,4
Three of my employees adopted three littermates yesterday,5600,4
I think Nexus explosion is not so explosive.,5601,4
[No Spoilers]Made this for my friend's birthday,5602,4
Someone made a nature documentary in GTA 5. Titled Into the deep.,5603,4
"Ayyy, don't want to lose all that hard work",5604,4
PsBattle: Caucasian Ovcharka (Russian Bear Dog),5605,4
"Thanks Facebook, that's actually really clever!",5606,4
*Inspiration* Theatrical/Extreme Look,5607,4
TIL a woman by the name of Lydia Fairchild took a DNA test that showed that the biological mother of her own children was her twin sister that did not exist. Further testing showed she was a chimera: a person who absorbs their twin in the womb and has two sets of DNA.,5608,4
Samuel L. Jackson just tweeted this picture; The Hateful 8 with all the faces! Heading to the snow SOON!!,5609,5
Man frees robot trapped in room,5610,4
Burning 360 flip,5611,3
This is Charlie and he likes to cuddle his feet,5612,2
India tea workers kill boss over pay,5613,4
Cat trying to eat a pea (x-post /r/gifs),5614,4
Meet Kai. My half Siberian husky and half Pit.,5615,4
She's finally starting to accept that she's here to stay,5616,4
My wife's friend couldn't figure out how to print from her tablet... I came home to this...,5617,4
All three disapproved of this joke before I'd even made it,5618,4
Switzerland Voting to Abolish 152-year-old Tax Break for Rich Foreigners,5619,9
Drank last night...,5620,2
a gavin free interview,5621,4
"Alpha to final release, what examples from other games can we find? (Bastion)",5622,8
"Big Apple, 3 A.M!!!!!",5623,2
I had to dig it out of the dumpster- great start to the day.,5624,4
Dumbest taxi driver ever,5625,4
"MRW at the end of a youtube video, they start to say thanks and tell me to subscribe",5626,4
This will be the 20th year I do it.,5627,4
"Canada moving toward American-style inequality, U.S. economist suggests",5628,4
"When you create a custom game, the map selected by default should be Summoner's Rift, not the Crystal Scar",5629,4
Classic Michael.,5630,5
"My Dad posted a photo of him standing next to his new fire pit he built. However, based on his pose, I had to photoshop something else in.",5631,4
I Take Pictures Too Seriously,5632,4
"Vladimir Putin says he won't be Russia's president for life, will step down in 2024",5633,4
MRW I am high and walk into the kitchen while my girlfriend pulls a cake out of the oven.,5634,4
A little tip for finding those annoying tiny blonde eyebrow hairs! Sweep a tiny amount of mascara over them so you can see them!,5635,4
"TIL Denis Cyplenkov, an arm wrestling champion and bodybuilder, has the biggest and most densely muscled hands in the world",5636,9
My old man is getting too tired for walks.,5637,2
"American Woodcock sometimes rock their bodies backward and forward as they forage, shifting their weight heavily from foot to foot. The vibrations from this motion may prompt their prey, earthworms, to move underground and make slight sounds that the woodcock may be able to hear or feel.",5638,4
Opening Up a Can of Worms for Everyone to See...,5639,4
Greg Maddux was a pretty good fielding pitcher...,5640,4
PLAYING AGAINST WARWICK 4.20,5641,4
Crazy pool vortex,5642,5
Our hen looks like McNuggets.,5643,4
Dreamhack and Asus gets it. ;D,5644,4
Eminem Feat. Dr. Dre - Guilty Conscience [Hip Hop ; Music Video],5645,2
the mods of /r/HighQualityGifs...,5646,6
Soon.,5647,0
[Serious] Do you feel that current US culture is TOO socially sensitive? Why or why not?,5648,9
Hundreds of parents attended and all of them had phones,5649,4
Seems fair to me...,5650,4
PA Arcana gives away when Roshan is being taken,5651,4
Note to self: Never book an appointment in public again.,5652,4
I was struggling and about to give up,5653,4
Skeletons Unearthed From The Catacombs Of Rome,5654,5
Cleared my browser history...,5655,3
Is anybody else having way too many visual bugs lately?,5656,8
"So I broke my charging cable this morning and I popped into the first shop to grab a new one, when suddenly...Doctor Who quote",5657,4
Atheist extremists,5658,5
Inquisitor? Wrex? [Dragon Age: Inquisition],5659,0
MRW I walk out after finishing an exam.,5660,4
ELI5: How do the materials and processes used to produce a 4GB flash drive differ from those used to produce a 128GB flash drive? And how do those materials and processes cause the 128GB one to be more expensive?,5661,2
Jungle does not give enough EXP!!!,5662,2
My new favorite tumblr post,5663,4
"A fellow Redditor came into my place of work today, and I told him I would try and make him famous. Can you help you me out?",5664,4
"This Week in Science: Inspector Satellites, Underwater Cities, A Privately Funded Robotic Moon Mission, and More!",5665,1
Apparently this makes me a monster. Truth be told - I like it and don't see the issue...,5666,4
My legally blind father and I (who am also legally blind) made a coffee table out of the tree I climbed as a kid,5667,4
Things have been going well these four months but now I'm second guessing the situation,5668,4
More students should be aware of this,5669,4
"Kill all bamboo not growing in the shape of a spork. Evolution will drive bamboo to provide a continuous supply of sporks, thus ending the need to wash silverware.",5670,4
Two T-Rexes Fighting Over Baby Jesus (xpost from /r/Pareidolia),5671,4
What is the funniest thing you can say to someone if they walk in on you naked?,5672,4
My sister's neighbor has dozens of kittens. This little angel comes running to me every time I visit. Meet Gouda.,5673,4
This froot-loop looks like it has a tongue,5674,4
Sometimes I like to take a break from questing and just enjoy the scenery,5675,4
Principals have to deal with this every term,5676,4
Flareshot,5677,5
"Never felt so disappointed opening sweets. Not cool man, not cool.",5678,4
"I went to Italy and had the best 12 course meal of my life at a 3 Michelin star restaurant, Le Calandre. All it took was a small loan and some spandex.",5679,4
"Tesla in talks with BMW about cooperating on battery technology, charging technology, and carbon fiber technology.",5680,1
“Highway at Night” — created from just 1023 bytes of JavaScript,5681,2
The Statue of Liberty as seen from Jersey City in 1973.,5682,4
"“The made in China e-cigarette had malware hardcoded into the charger, and when plugged into a computer’s USB port the malware phoned home and infected the system.”",5683,5
[GTA V] The Hook,5684,6
This is why you should keep your car clean,5685,4
Gender differences in emoticon usage,5686,7
Just got back from Antarctica. Met some locals along the way..,5687,4
Man's best friend,5688,4
Above a Rainstorm,5689,0
"I met reddit's favorite astronaut today, Chris Hadfield",5690,4
WE ARE A TRENDING SUBREDDIT EVERYONE GET ON YOUR BEST BEHAVIOUR TIME NOW,5691,4
My jailbroken iPhone has a tweak that puts Batman masks on my emojis!,5692,7
Canada to lose one of the world's leading facilities in materials science research due to budget cut-backs. Closure of the National Ultrahigh-Field NMR Facility for Solids in Ottawa,5693,4
Colt McCoy is the only Redskins QB to start and finish the game as the winning QB.,5694,9
Everybody's Circulation (Mashup),5695,0
"I'm on a road trip, currently driving through Kansas. Talk about minimal landscapes...",5696,4
Never burn lasagna edges again!,5697,4
Flobots - Handlebars [Modern Rock],5698,2
TIL the atomic bomb dropped on Hiroshima released an amount of energy equivalent to the conversion of 0.7 grams of matter into energy.,5699,2
"Ten years ago, a 6-4 Florida Gators team marched into Doak Campbell Stadium and upset #10 FSU two games after Ron Zook was fired. This year, a 6-4 Florida Gators team marches into Doak Campbell trying to upset #3 FSU two games after Will Muschamp was fired. Can history repeat itself?",5700,4
"The optimist, the pessimist, and the opportunist.",5701,0
Image from the Arena in Mexico City during the Latin American Finals.,5702,4
Fighting the good fight.✊,5703,4
Dark humor,5704,4
Didn't know how to even begin to explain myself,5705,4
My dad's friend took this on 9/11 inside his plane that was just about to take off. I haven't shared this with anyone before. [OC],5706,4
Afghan woman kills 25 Taliban rebels to avenge her son’s murder,5707,2
President Clinton didn't realize my friend was taking a selfie with him,5708,4
My school's 3D printer just finished this beauty,5709,4
So this is how my friend decides what to get for dinner.,5710,4
Safe to say that my hedgehog doesnt enjoy trips to the vet anymore,5711,4
Someone is missing their snips back at the plant.,5712,4
Happened to my friend the other day,5713,4
Asked my wife to get more magnets for the fridge with no restrictions on what kind,5714,4
Winner of this years sand sculpture contest,5715,4
Nailed it.,5716,4
Local University's cafeteria staff lays down the law,5717,4
"Axe with intact wooden shaft uncovered at Rødbyhavn, Denmark. Dates to the Stone Age, about 5,500 years ago.",5718,0
But....But.....,5719,5
A True Giant,5720,4
Imagine being completely naked in a room full of people who speak a different language and everyone wants to touch you. This is the life of a dog.,5721,4
Who never thought about this?,5722,4
Virtual sculpting with the Oculus Rift,5723,7
Every. Single. Weekend.,5724,4
Scientists urge governments to turn old TV frequencies into free “super WiFi”,5725,4
That bench turned into a snowfa,5726,4
"I need a new phone cover. Quick, blow up a balloon!",5727,4
J.J. Abrams confirms 88 second Star Wars: A New Dawn trailer will be released this Friday.,5728,4
Michael Jordan was just unreal,5729,0
Everything is more dramatic like this.,5730,4
Care for a drink?,5731,4
A few guys recreate the famous 300 fight scene in a gym,5732,4
Crows Playing in the Snow,5733,4
"It's going to happen, and I don't know when.",5734,4
London Underground Tongue Click Ping Pong Battle,5735,4
She likes pepperoni. A lot.,5736,4
Hatching baby ladybugs,5737,4
Some people just want to watch the world burn,5738,4
TIL that the British army tested LSD on its Marines in 1964...and filmed it.,5739,8
First time seeing snow,5740,4
Far Cry 4...,5741,4
Better check it again.,5742,4
Seems legit,5743,8
"Well, I would hope so...",5744,4
First Look at Hugh Jackman as Blackbeard in Joe Wright's 'Pan',5745,4
His face says it all,5746,4
You must become more than just a man in the mind of your opponent.,5747,4
Rejoice!!,5748,1
"My SO knew how to 90's, she'd kill me if she found this pic here on Reddit.",5749,4
Hide your shame!,5750,5
Stoke the fire!,5751,7
It's tiring,5752,8
"I just moved to Alaska. It's going to get about 40 degrees (F) colder, but things are already getting ridiculous",5753,4
This cosplay guy,5754,4
Smash Smashed,5755,4
One Of My Favorite Al Bundy Moments,5756,4
Rocket launches at sunset or sunrise produce a light show known as twilight phenomena.,5757,2
Cat trying to eat a pea (x-post /r/catpranks),5758,4
"Nearing the end of my semester, and Kronk is helping me write my papers",5759,4
It was worth a shot,5760,4
Water used to project road signs,5761,4
"New study shows that being in a position of power can fundamentally change the way you speak, altering basic acoustic properties of the voice, and other people are able to pick up on these vocal cues to know who is really in charge.",5762,4
And this is our son's room.,5763,4
Throwing up the deuces,5764,7
Went to the Kubrick Exhibit in Toronto today,5765,4
"A friend is bored and doodling in work, this is the kind of thing I'm being sent ...",5766,4
Actually there are 3 sides to every story,5767,4
Finally got photos of my home made Wonder Woman costume!,5768,4
There should be a hat store called ALL CAPS where the employees all yell at you,5769,4
The train was in motion....,5770,4
"After scrapping nuclear energy, Germany is pondering pulling the plug on coal too.",5771,2
How to wear out your todller during a 5-hour layover.,5772,8
"This clever name, made me not get mad for his slow loading",5773,4
Leonardo's swords were made of rubber.,5774,8
My friend works at the movie theater. This is his dad reaping the benefits.,5775,4
This notebook has a hole cut in the paper for your pen.,5776,4
no one wants to work on holidays... No matter of job description or family status,5777,4
meow,5778,0
The future looks great!,5779,4
Ran into this inappropriate needle point this week. I had to have it.,5780,4
The door wasn't locked. I just left the beer on the counter and walked out.,5781,4
Human Rights Watch calls on Indonesia to scrap 'virginity tests' for female police,5782,4
"Not too old, but Paul Rudd had some awesome hair when he went to the University of Kansas in the 80's.",5783,4
I saw Denzel Washington on the street today.,5784,9
The Simpsons depicts every job ever,5785,4
Good Advice for Petting Dogs (AKA another side of the story.),5786,4
"First semester of college, last semester of university.",5787,4
After reading through some peoples comment history,5788,4
I know a few people who need this book.,5789,4
"If there was a 7 season Harry potter show (1-2 chapters per episode, 1 book per season), and it was 100% accurate to the books, would you watch it?",5790,4
Every time I see Americans say their school lunches are terrible,5791,4
"If anything breaks the internet, it would be this",5792,4
A friend of mine likes to stick stuff to stuff.,5793,4
Downsides to Immortality,5794,5
I'm not sure this is the right place,5795,4
He first arrived 5 minutes ago and has been telling me all sorts of secrets...,5796,4
Found a creationist museum in my home town. This was the best display,5797,4
AT&T will do anything for new customers.,5798,2
Came across this school art project. Pooh's honey problem is getting out of hand.,5799,4
[Image] Don't you dare quit.,5800,4
We got a baby pig. Our German Shepard took her in as her own.,5801,4
TIL The Walking Dead creator Robert Kirkman was only able to get his comic green-lit because he told Image Comics that there would be a plot twist revealing that the zombie apocalypse was caused by aliens who were using the zombies to weaken humanity's defenses. It was a lie.,5802,4
Say Hi to Violet,5803,4
I think she likes her new buddy,5804,4
He picks the best time and place to poop sometimes,5805,4
Horse is afraid of the water until he gives it a try.,5806,4
Can we please just talk about the weather?,5807,4
Bill Gates should create a political party and hire some nobody to become president to prove that money buys elections,5808,4
"I'm failing the semester, and my dog just went missing after ending a two year relationship.",5809,4
"TIL there's a laser procedure that breaks up brown eye pigment (melanin) in the iris. It effectively changes one's eye color from brown to blue, as blue eyes exist under all brown eyes.",5810,4
Finally got it right,5811,4
Those textures though... [Shadow of Mordor],5812,2
Forsberg really missed having a cat. Problem solved.,5813,4
Driving at heavy rain,5814,4
How does Harry Potter get down a hill? By running.,5815,4
Another Great Play from this Weekend's NFL... for a Different Reason,5816,4
To the person that went through my entire history and downvoted all of my +1 posts.,5817,4
The Terror Beneath,5818,9
"I see this kind of thing regularly from some of my less educated, former high school friends.",5819,4
ELI5: How Doom (1993) had online multiplayer on dialup and now games require a fast broadband connection,5820,6
That's what I'm talkin about. [xpost r/funny],5821,4
This guy used to be a sports photographer,5822,4
Light wont block light,5823,4
Sorry Rex,5824,2
I'm cute :P,5825,4
"Then all the reindeer loved him, and they shouted out with glee...",5826,9
If you remove all the space in the atoms,5827,4
My girlfriend got a puppy. I think he loves me...,5828,4
It can happen to us all! (x-post /r/mildlyinteresting),5829,4
Maybe the last thing I would've expected.,5830,4
I work at petsmart and some guy today brought in a kitten and dumped it on us. I bought formula and a bottle for it and took it home to keep. Everyone meet Sherlock!,5831,4
There is something so calming about this picture of Emma Watson.,5832,4
PsBattle: Ballerina in mid-air. Also there's a dog. [720x720],5833,4
Don't like the term Gay Marriage,5834,4
"Louisiana village issues ban on pit bulls and rottweilers, expects to collect them for disposal by December 1st [x-post /r/rage]",5835,9
"The Alpine city of Grenoble is the first European city to ban all commercial street advertising. Instead, the French city will plant trees. From January to April 2015 more than 300 advertising spaces - 2,000 square metres - will disappear and 50 trees will be planted.",5836,4
Spinning around at 120 mph on a rainy road,5837,4
finishing these usually doesn't happen,5838,4
A Mission to Europa Just Got a Whole Lot More Likely,5839,4
you made me wet!,5840,4
Western Union filed a copyright claim against me for posting the parody ad to my large facebook page,5841,2
Drive carefully,5842,2
