Title,doc,topic
My town in Central Texas has a bird problem,3722,2
This supermodel cat looks extra majestic,3723,2
Tiny trees an awesome Bonsai display,3724,6
Healthy levels of Vitamin D are linked to a 75% lower risk of depression new research finds The Irish study followed almost 4000 older adults for four years,3725,2
This staircase,3726,5
console war,3727,1
These doughnuts are designed to look like the classic ones out of The Simpsons,3728,8
Good point,3729,2
Why would red block when he could win,3730,2
Oh my god this mad lad broke the rules,3731,2
Jab Jab Murdered,3732,1
We surprised my parents with Grover today I think they like him,3733,2
New report shows Russia used every major social media tool to help Trump,3734,2
Priorities,3735,2
How to find a mimic,3736,2
Nice camera lens,3737,1
Love me a borgar,3738,2
🔥 Fearless lion intimidates a crocodile who got too close to his pride 🐊,3739,7
Im surprised she made it this far,3740,2
This amazing view from Grand Hotel Giessbach in Switzerland,3741,6
🔥 Trilobite Beetle 🔥,3742,2
Roses are red some parrots may talk,3743,2
Ah yes a genious plan,3744,8
I had quite a few people do this for my wedding I shouldnt have to chase you down for an answer,3745,2
me_irl,3746,7
I see a potential in this template,3747,2
Whenever Im outside at night I always try to look up and enjoy the stars for a minute This view is from a camera I set to stare at the entire sky for 24 hours straight,3748,2
LPT If you have to give or take names addresses serial codes etc on your job take time to learn the NATO phonic alphabet It will make the communication go much smoother Plus youll gain the appreciation if the other person is a pilot,3749,2
Im a single man in my 30s,3750,2
Beto O’Rourke Calls for “Public Pressure” on Trump to Close Child Migrant Camp,3751,2
Miniature Scottish highland calf,3752,5
As a student paying thousands of dollars in tuition this bothers me,3753,1
hmmm,3754,2
Pendulum Waves  Fifteen uncoupled simple pendulums of monotonically increasing lengths dance together to produce visual traveling waves standing waves beating and (seemingly) random motion,3755,2
US military sends $331 million bill to Saudis UAE after refueling accounting error,3756,8
China’s Detention Camps for Muslims Turn to Forced Labor,3757,1
You cant just stay under bed all night,3758,2
+10 Defense,3759,1
Good crop this year,3760,2
They see me rollin,3761,2
I’m just a simple man,3762,2
Service Dog Receives his Masters Degree in Occupational Therapy from Clarkson University after he attends every class with his owner,3763,2
Didnt think anyone could see me here,3764,2
He done played himself,3765,2
How to find your soulmate,3766,2
The real hero of the MCU,3767,2
[Homemade] Beef Wellington,3768,9
This is outrageous It’s unfair,3769,8
Today I saw an ad that said radio for sale,3770,2
You’ve been outfoxed,3771,2
Surface tension,3772,7
Jaw dropping capabilities of newest generation CGI software (Houdini 17),3773,7
I got a PS4 Pro and am gifting my old PS4 to my nephew,3774,1
Idk about the girl parts,3775,7
Movies featuring snowmobile action scenes have an average critical score of 51% and average an inflated $369 million worldwide on $111 million budgets This makes movies featuring jet ski action scenes and their 27% RT score and $123 million worldwide box office average look silly,3776,2
Mueller Investigation Cost $25 Million So Far Report Says It’s Pulled in $48 Million From Tax Cheats,3777,6
Nick Eh 30 accidentally plays jingle bells with his AR,3778,8
Searching Santa on YT for the kids,3779,2
Spotted in Birmingham,3780,6
Coming to get you,3781,2
I’ve found my soulmate,3782,2
TIL in the original airing of “Rudolph the Red Nosed Reindeer” Rudolph visited the island of Misfit Toys and promised to help them but never actually did Tons of children wrote to RankinBass concerned for the toys and got the company to make another scene showing the toys had been saved,3783,2
Anyone else feel it’s a shame Klaw was killed off after only two appearances Serkis was great in the role,3784,2
It really do be like that,3785,2
This spectacular coloured foliage on this beautiful old building,3786,2
You died,3787,2
What’s one rule everyone breaks,3788,2
That real hot,3789,2
SLEIGHER,3790,1
Precious smol boye practices his awoos,3791,7
NASA on going ‘back’ to the moon “This time when we go to the moon we’re going to stay This isn’t about leaving flags and footprints  but we’re going to go with sustainable reusable architecture so we can go back to the moon over and over and over again”,3792,2
I smell pennies,3793,6
ObiWan tells us a joke,3794,2
It really do be lik that,3795,8
Wildlife photographer hazards,3796,1
Indeed,3797,8
Alpha move,3798,8
PsBattle This weird kangaroo,3799,2
People who met and became acquainted with at least one gay person were more likely to later change their minds about samesex marriage and become more accepting of gay and lesbian people in general finds a new study Contact theory suggests diverse friendships can spark social transformations,3800,2
I had to,3801,0
The Aurora Tree a visual coincidence between the dark branches of a nearby tree and bright glow of a distant aurora,3802,8
2meirl4meirl,3803,2
My mum spends hours working on decorations I always think she’s really good at it so I wanted to share it with some others,3804,2
Now all we need is the goddamn poncho,3805,1
The full rotation of the Moon as seen by NASAs Lunar Reconnaissance Orbiter,3806,1
A reminder 💗,3807,2
Rather than issuing parking fines this holiday season my city’s parking inspectors are leaving notes asking people to donate to a food bank or local charity,3808,2
Merry Christmas,3809,2
To attack people eating Chic Fil A,3810,2
300 years of element discovery,3811,2
Lake Solitude Digital 3D 1800x2400px,3812,7
Nani,3813,9
Meme,3814,4
After more than 10 years I believe these are the greatest 6 moments in the MCU,3815,2
Shes in love with the tiny human,3816,2
yeah see thats the problem,3817,2
Cats arent the only ones that like warmth,3818,2
Fixing the painted line,3819,2
Always test the water before swimming,3820,2
Find Waldo,3821,2
FBI OPEN UP,3822,2
Changing a light bulb on top of a 2000ft mast while the clouds are below you,3823,2
Can I have some of your ice cream,3824,1
The greatest plan we have ever created,3825,2
Going for a celebration knee slide at the end of a race,3826,3
A couple of teachers put this up in our library it hurts me so much,3827,2
me irl,3828,2
Nephew wouldnt stop asking everyone to play their phone games I gave him the original Pokemon He has been like this for hours,3829,2
Since were sharing emo phases me 2009 Was always the token black girl,3830,2
Let her enjoy her swim time,3831,2
Trash meme inbound,3832,4
This always cheer me up hope it does too to all of you,3833,2
Get this thing off of me pls,3834,2
Checkmate Instagram,3835,2
me irl,3836,2
In Harry Potter and the Deathly Hallows Part 2 (2011) When Professor Slughorn leaves the castle to cast the defensive shield you can see him drinking a bottle of liquid luck﻿,3837,2
Halo Infinite Developer Has No Interest In A Battle Royale Mode,3838,2
When Yukon Cornelius buries his pick axe into the ice removes it and licks it in ‘Rudolph the Red Nosed Reindeer’ (1964) he isn’t checking for silver or gold He was in fact searching for peppermint mines which he eventually finds,3839,1
Please Mum,3840,2
Clint Youngreen good job,3841,7
Today I released baby sea turtles on Sumba Island Thought this pic was epic,3842,2
Pupper and duck enjoy each others company,3843,2
When you mention the ‘W word’,3844,6
Aloona Larionovas reaction to being in pewds new video,3845,2
We have a single mission,3846,2
As useful as an ashtray on a plane,3847,4
Reality is Often Disappointing,3848,7
My class got a 35% average last Friday,3849,2
While the astral form of Dr Strange were traveling through time and space his body turned to ashes and back twice The scene in Dr Strange resembles the same turningtoashes graphical form at the end of Infinity War,3850,1
Chill,3851,1
What have I done,3852,2
this has got to be one of my coolest goals ever,3853,2
GOP set for blame over shutdown,3854,2
I hope this man finds the girl of his dreams,3855,2
Bens timing couldve been better,3856,8
Neverending mesmerizing hallway,3857,9
The way he just slides in there,3858,2
me🍴irl,3859,5
Best pal,3860,2
Just a reminder to everyone,3861,2
The more I look at my POTG the better it gets somehow Everything fits perfectly together Happened in the Open Division,3862,2
Purrkour,3863,6
Is this title interesting enough,3864,2
I made a site where you can visualize visa requirements of more than 238 countries on a map [OC],3865,2
Outnormie the normies,3866,7
Posting anything from an adults perspective on Reddit,3867,2
Divine discussion,3868,3
Man cheetah found his avatar,3869,7
Workers in the video games industry have formed a union for the first time in the UK,3870,2
Trump Auctions Off 150000 Acres of Public Lands for Fracking Near Utah National Parks,3871,8
I am real 🐶,3872,2
Roxie is the most adorable puppy I’ve ever met,3873,2
Whos the pretty dinosaur,3874,2
Fool of a Took,3875,2
Gimme that spray on Dracula,3876,6
Snow in european languages,3877,1
meFirl,3878,0
A new challenger approaches,3879,2
No skybases on my watch,3880,2
Personal Experience,3881,2
AhemSirCan you stop please,3882,2
Shouldnt have woken him up,3883,8
honestly makes me mega sad,3884,1
One of my favorite Ron lines,3885,2
The Chicago Bears have clinched the NFC North,3886,2
Recieved this message out of the blue absolutely no idea who she is,3887,2
Remember when this made it to the front of reddit and we all thought the world would change Simpler times,3888,2
Spring Mist Watercolor 9X12,3889,9
Pretty much,3890,2
rteenagers in a nutshell,3891,1
Lodge under the Canadian Rockies,3892,2
Ding Dong its a new format,3893,2
All I want for Christmas is democracy say Hungary protesters  Thousands of Hungarians thronged the streets of Budapest on Sunday in the fourth and largest protest in a week against what they see as the increasingly authoritarian rule of rightwing nationalist Viktor Orban,3894,2
I performed Witch Savanna for my geometry honors class and got them all to subscribe to PewDiePie even my teacher I’m doing my part,3895,2
Saw this in Colombo Sri Lanka 🇱🇰,3896,3
My sister’s dog when you tell him to smile He’s a cheese,3897,2
Had my dad watch my daughter for the afternoon This is how I found them,3898,2
Stranger Things in Amsterdam today,3899,2
A change on a existing format but with the same main theme very safe investment,3900,2
April 14 1912,3901,0
How do I reeeeach these kids,3902,2
Smash has WAY more and better player icons than the actual switch has for profile pictures,3903,2
Yeah about that,3904,7
Norwegian politican Heidi Nordby Lunde on Brexit Norway + style Source Channel 4,3905,6
Stealth is his greatest weapon,3906,1
The almost perfectly spherical shape and prolonged stillness of a huddled Arctic hare are part of its winter strategy for keeping warm Hares assume this posture when they finish feeding tucking extremities in tightly in order to conserve warmth by folding their tails down between their hind legs,3907,4
Sad this has to be a warning,3908,1
Are you making a gif Let me help,3909,2
2 meirl 4 meirl,3910,1
I am the Lorax and I speak for the trees The trees say ____________,3911,2
Stunning new report details Trumps labor secretarys role in plea deal for billionaire sex abuser,3912,2
Representation matters,3913,1
Paint me like one of your Christmas trees,3914,2
Photography 101,3915,7
Aneurysm [Legit],3916,8
Only the mongols,3917,9
level 9 cpus parry game,3918,1
When soft food ages it gets crunchy when crunchy food ages it gets soft,3919,7
An overused format with a refreshing twist,3920,2
Husky pouts on way home from vet,3921,2
White guy thats really into rap starter pack,3922,2
They installed the digital display upside down but I like to think Im setting the high score,3923,2
[Blade and Sorcery VR] Hooking onto weapons,3924,3
24 hours and I think she likes her new home,3925,2
The 4 stages of anime,3926,9
Go leave a like on the video guys,3927,2
I appreciate yall,3928,2
Were ready for company ,3929,2
🗣 I do what i want,3930,2
praise the queens,3931,5
Arizona Lawmaker Faces Calls for Resignation After Saying Black People Don’t ‘Blend In’ With Society,3932,2
[Homemade] Chicken Kebabs,3933,9
[WP] Space law dictates the first to discover any intelligent species in the galaxy would have absolute rights over them It worked out fine until Earthlings developed space travel without outside help and “discovered” the First Civilization,3934,2
MRW ufolkingawesome spends 4 hours on a gif that only gets 15 upvotes,3935,2
🗣change🗣my🗣mind,3936,0
Man of culture,3937,7
This 70s Tupperware patent lid holder at my grandmas house,3938,2
The struggle is real,3939,2
This was the trophy for a Super Smash tournament hosted by my friends,3940,2
Peter Jacksons Restored WWI Footage,3941,2
We got a new puppy yesterday I asked my 4 year old to put him to bed This is what I came back to,3942,2
New Folder [OC],3943,2
netflix is overrated hulu is the move,3944,2
TIL the FBI followed Einstein compiling a 1400pg file after branding him as a communist because he joined an antilynching civil rights group,3945,2
This cat wishes you a good night,3946,2
My SO’s mother has cutting boards that look like books when they’re put away,3947,2
What a shot,3948,2
Cashier notices the lady exhibiting signs of a seizure and grabs her baby before it fully hits her,3949,6
TIL that Freddie Mercury approved the Waynes World Bohemian Rhapsody scene just before his death,3950,1
This church looks like a gingerbread house,3951,2
Kurt Russell and Goldie Hawns Christmas card,3952,2
Oh Your Majesty Sorry if I disturbed you,3953,7
2018 worst year on record for violence and abuse against journalists with at least 80 killed in connection with work further 348 imprisoned and 60 held hostage according to Reporters Without Bordersfigures suggest more than half of journalists killed in 2018 were deliberately targeted,3954,2
Billiards trick shot,3955,6
Reddit right now,3956,2
4 paintings of the same sunflower by each of my 4 children all painted at the same age of 5,3957,2
Missouri man must watch ‘Bambi’ monthly as part of poaching punishment judge rules,3958,1
I built a site that combines Rotten Tomatoes IMDb Letterboxd and Metacritic ratings with Netflix and Amazon Prime availability and can notify you when top rated movies are released on each platform [OC],3959,7
My brother asked for God of War for Christmas Im getting my clueless gamer mom to prank him with this first,3960,2
Burnout stress lead more companies to try a fourday work week It leads to higher productivity more motivated staff,3961,2
I’m here with two cursed images,3962,2
Where do you think youre going (Battlefield V),3963,1
This Pantheon style Cathedral allows for a 6 second reverb which makes singing sound even more beautiful,3964,2
this is me being scratched by my cat reminds me of a renaissance painting,3965,6
I miss u franku,3966,2
No uggos NEXT,3967,2
Thought It was a MAGA hat had to do a double take,3968,7
How a golf course changes holes,3969,1
Nintendo knows everyone wants,3970,2
I utilized what I had at hand,3971,2
Assembling an engraved coin,3972,0
My mom looking like a queen on her wedding day 1979,3973,2
Putin That’s not how you hold a pupper,3974,8
TIL North Korea ordered 1000 Volvos from Sweden in 1974 and has yet to pay it off resulting in a debt of 22 billion kronor ($322 million),3975,2
Funniest road rage video I’ve ever seen,3976,2
New cervical cancer test has 100 percent detection rate detecting all of the cancers in a randomised clinical screening trial of 15744 women outperforming both the current Pap smear and human papillomavirus (HPV) test at a reduced cost according to a new study,3977,2
Posting this until Felix sees it,3978,8
Fox News Guest Says Trump Voters Should Pay for Border Wall by Crowdfunding It,3979,2
This is cute,3980,2
Antivaxxers yay,3981,9
its just me,3982,0
patrick is just a wonderful man,3983,2
Package Thief vs Glitter Bomb Trap,3984,1
The cup I soak my paint brushes in broke and the inside sort of looks like a landscape painting at dusk,3985,2
cat girl here this is what the pic was supposed to look like,3986,2
Spread the word,3987,2
YouTube removes 58 million videos featuring hateful or inappropriate content,3988,6
So the government is facing a shutdown over funding for the border wall,3989,2
Hello Reddit Meet Bolt He is 1 now We adopted him as a puppy who beat Parvovirus and lived He is a Mastador and has a built in downvote He loves watching videos of dogs playing He is gud Boye ;),3990,2
Misleading box art makes it seem like you get a pair Literally just came with one wireless earphone,3991,2
me🐸irl,3992,3
Making these Christmas tree meringues,3993,2
Your boi knows anatomy,3994,2
I see no lie,3995,2
High school football team celebrates their season,3996,2
Mark Zuckerberg Lost $15 Billion This Year More Than Any of the 500 Richest Billionaires in the World,3997,2
soɹq uɐǝdoɹnǝ ǝɯ dlǝɥ,3998,5
My trip to Mount Rushmore last year,3999,2
Tightening the join,4000,2
Birds using a dead Pikes mouth to nest,4001,7
When you gotta go,4002,2
Indubitably,4003,0
My little Pitmas tree,4004,2
Anxious teens gain confidence by performing ‘off script’ Improvisational theater training can reduce fearfulness and anxiety among teens struggling with social interactions a new study suggests and may be effective for social phobias and anxiety disorders,4005,2
Hello There,4006,8
How To Steal A Song With Millions Of Views | TheFatRats music video for his own song The Calling,4007,2
PsBattle This Mayor dog,4008,2
Fantasy Beggar,4009,9
Bought a couch from Craigslist heard noises coming from it after bringing it home Cut it open and found a cat,4010,2
Im making this pixelpainted RPG with my bf Its been 8 years now still together,4011,2
Amazing tail onboard view of Virgin Galactics Unity flight to the edge of space,4012,6
Please tell if you saw him recently,4013,4
YouTubes content claim system is out of control,4014,1
The Perfect Snowball,4015,8
they’re about to go sicko,4016,2
These cats,4017,4
To wrap a present,4018,8
Cement is the most widely used manmade material in existence second only to water as the mostconsumed resource on the planet and source of about 8% of the worlds CO2 emissions A startup is now using trillions of bacteria to grow bioconcrete bricks similar to the process that creates coral,4019,2
I’m planning a charity event for people who struggle to achieve an orgasm,4020,2
Meatloaf and Tim Curry  1975,4021,1
Such a dirty boy,4022,8
When ____________ first joined reddit,4023,2
hmmm,4024,2
hmmm,4025,2
The dumbest elevator in the world,4026,2
Oh that hair looks like fun,4027,2
And this is how you properly promote a movie,4028,6
Children of the corn The all knowing snitches,4029,8
[Blade and Sorcery] Catching an arrow out of the air,4030,3
Alfonso Ribeiro Sues Fortnite Creators for Stealing His Carlton Dance,4031,5
This working wooden escalator in an old department store,4032,2
Holidays 1996 SO to my parents They knew to buy 4 controllers,4033,2
Coworkers Diehard ornament,4034,7
Carrie Fisher New York City  1980,4035,2
Entire text history with my GF from first swipe on Bumble until today [OC],4036,2
Oof my comrade,4037,6
Incredible Parenting,4038,4
Michael Flynn’s business partner charged with illegally lobbying for Turkey,4039,3
Company directors whose firms make nuisance calls will now be directly liable and could face fines of up to £500000 New rules mean the UKs data protection watchdog the Information Commissioners Office (ICO) can target the company director and not just fine the firm,4040,2
Having a healthy relationship even with bad mental health,4041,2
Well that’s terrifying,4042,8
She never greets people at the door “emptyhanded”  everyone gets shown a toy No takes though For your viewing pleasure only,4043,2
My Neighbor Totoro (1988) finally gets an official screening in Chinese cinemas,4044,7
The reverse Centaur,4045,5
In Labyrinth David Bowies face is hidden in several landscapes,4046,8
Fairy Lights digital 907 x 1200 px,4047,7
Hopefully they can recharge their life,4048,1
🔥 Stargazer fish is often called the ‘meanest thing in creation’ as it can deliver both venom and electric shocks often locally known as motherinlaw fish,4049,2
New format with tons of potential,4050,2
I can’t be tamed,4051,7
but how will i know if it works,4052,2
🔥 Dolphin joining a wakeboarder 🔥,4053,2
Ralph doesnt understand but still wants to be involved,4054,2
If they find our reddit account its all over guys,4055,2
An Armadillo Girdled Lizard,4056,4
New Folder [OC],4057,2
Your move IG,4058,8
Trying to hide their FACTORY from ruining their claim at being HOME MADE,4059,2
Legolization gone wrong,4060,7
Why are dogs afraid to go to space,4061,6
Lets see what we can hate whites for today Its pets,4062,2
Damn boy better watch out,4063,2
She has a quest for you,4064,9
My revenge story almost killed a man,4065,2
Emo teen in 2018 starterpack,4066,7
I awoke to the sound of my dog chewing something plastic Came out to this,4067,2
SLPT Kids have gotta learn,4068,2
Palm Beach County deputy faces no charges after running stop sign at twice the speed limit and putting a teen in a coma,4069,2
Im sad were sad You all have helped him stay a cool cat forever Thankyou Rip Ulrich my favorite loaf,4070,2
meirl,4071,1
pls let him see this took me a long time ( I miss the old studio decoration and slippy),4072,2
When Wikipedia asks me to donate 3 dollars,4073,2
Just picked up this furry potato Been with my wife for 14 years This is our first dog Meet Jace the Awwsculpture,4074,2
anyone,4075,2
In Interstellar (2014) Cooper wears an automatic watch which winds itself using the wearers natural movement After he wakes up from several months in cryostasis he can be seen manually adjusting the time and date as his watch would have stopped after a few motionless days,4076,2
i was scared for a second there,4077,2
sCp682 HaS bReAcHeD cOnTaInMeNt,4078,1
51% of Voters Think Russia Has ‘Kompromat’ on Trump,4079,2
[Homemade] Egg in hole bacon and cheese sandwich,4080,9
I’ll never do anything this cool again,4081,2
The kind of friend everyone needs,4082,2
Canadian Prime Minister Justin Trudeau speaking in an interview that aired on Sunday said for the first time that his Liberal government was looking for a way out of a multibilliondollar arms deal with Saudi Arabia,4083,2
Peter Parker hardest assignment [OC],4084,2
If you remember this you basically own the subreddit at this point,4085,2
Doing scooter tricks,4086,4
This banana looks like a bird,4087,2
Crazy wooden marble machine,4088,5
How do ya do sir,4089,8
The armadillo girdled lizard is a species of lizard in the family Cordylidae and its size can range from 75 to 9 cm (30 to 35 in),4090,4
Every year we spend $20 at Goodwill to dress each other then get cheesy photos taken instead of buying presents We did great this year,4091,2
I have no intention of changing my behavior,4092,2
good boi SPOTTED,4093,8
redesign of an older post,4094,2
Interesting what just a few frames can do,4095,8
Roses are red he bought a season pass,4096,1
Washed up on a beach near me bomb disposal blew it up but didnt say what it was,4097,2
Merry and pippin sitting on a tree,4098,2
Gender reveal parties [OC],4099,1
Cmon,4100,8
Cant be sick and miss work because someone in 1945 had it worse,4101,2
Shes a Witch,4102,0
The sun gives a guy a shoulder rub,4103,2
Me and GitHub,4104,4
Be happy,4105,2
Petition for Pewds to hire the Slav Queen as Brad 4,4106,9
Theres allways a bigger fish,4107,1
A box full of rottweilers,4108,1
🔥 Eagle is released in the Nature  What a beautiful bird,4109,2
Sex offender serves as grand marshal of Mississippi town’s Christmas parade,4110,8
Live like an animal die like an animal,4111,2
The most insulting move in Pokémon,4112,8
this glitch is giving me an existential crisis,4113,9
If you send him a card Yule be sorry,4114,2
Dolphin enjoying some wakesurfing,4115,7
She has a quest for you,4116,9
living in apartments = bad,4117,2
Samsung patents phone display that projects holograms like In Star Wars,4118,6
A volcanic eruption as seen from space,4119,7
Father of murdered Parkland student slams Marco Rubio over God and gun violence  Marco,4120,2
Can we get this to LWIAY,4121,2
Jesuliath  the holy goliath of stone,4122,6
Three poachers eaten by lions after breaking into game reserve to hunt rhinos,4123,1
Thanks for holding my beer,4124,2
They see me coughin,4125,2
Just look at the size of him,4126,2
I think this belongs here,4127,0
I’m trapped too,4128,2
People who say millennials look stupid,4129,2
Sen Jeff Merkley Wants to Stop Congress Members From Insider Trading By Banning Them From Owning Stocks,4130,2
Kid drinks water,4131,2
France be like,4132,2
You don’t need to retype lifehacks to post on facebook just screenshot and circle,4133,1
Yi haw,4134,4
Found on rme_irl,4135,1
Repost because got removed for rule 1b violation,4136,2
Just some light banter,4137,2
“Basketball are my favorite sport because it keep you in shape and healthy”,4138,2
I’ve been doing it wrong all my life,4139,2
Owl sees himself in the mirror,4140,2
I drew every legendary Pokémon and gave them a slightly younger look See you in gen 8,4141,2
Meme,4142,4
👺,4143,5
We have to hold off the jugular vein after drawing blood but this sweet old girl thought I was just there for the hugs this is why I love my job,4144,2
HA HA HA ONLY HUMANS WILL GET THIS REFERENCEexe,4145,0
This is so unfortunate,4146,7
A raped migrant teen asked Trump officials for an abortion She got counseling with Bible verses and coloring,4147,5
