Title,doc,topic
1994 the shawshank redemption Red I have no idea to this day what those two Italian ladies were singing about The opera is the marriage of Figaro About 2 people looking for freedom under other circumstances Themes of anger,5839,1
The Russo Brothers new profile pic on Twitter,5840,2
“Siren” Hokyoung Kim Digital 2017,5841,7
When I sell something on Steam,5842,2
1M sub channel shutsdown small comedy channel for pointing out her slurping habits Can we put more exposure on this incident,5843,2
Woah there easy boy,5844,8
The revolution has begun,5845,9
*slaps head* this bad boy can fit so many songs in it,5846,2
DIY Christmas Gift Dead Eye Tonic,5847,2
3 year old regrets his diet,5848,2
Big Data,5849,8
Oliver got a Christmas gift,5850,2
I would go to this,5851,2
Donner wasn’t pulling his weight this year so sadly we had to put him down Merry Christmas Eve everyone,5852,2
To Brad,5853,4
 got nothing to say,5854,2
Thank you google,5855,2
Invest now my hairy brothers,5856,2
Picture of my cat through a screen door makes it look like hes painted on canvas,5857,2
My grandma just made an instagram This was her first post,5858,2
Is that legal,5859,9
aaaaayyyyoooooo,5860,9
IamA 22 year old male who received a living donor liver transplant from my best friend 3 weeks ago and am spending Christmas in the hospital AMA,5861,2
My girlfriends hammer,5862,0
TIL Former General Electric CEO Immelt wasnt happy with just one corporate jet flying him around the world He had a second empty jet tailing the first one in the rare event that the primary jet needed maintenance,5863,1
Worst Birthday Ever,5864,2
Want one,5865,2
Instead of paying $1 for a bookmark you could just use the dollar as a bookmark,5866,2
Me and my boyfriend’s Super Mario Tree,5867,8
It be like that sometimes,5868,2
Definitely witchcraft,5869,8
Tattoo tribute to my lost son,5870,2
Guys it FINALLY happened to me Original Content,5871,2
Go tell your mom you love her,5872,2
You want your fries now OK,5873,7
This fence making machine,5874,2
Study Confirms Global Quantum Internet Really Is Possible,5875,8
The real mystery,5876,1
This wetsuit,5877,0
Ask Felix to decorate his room with this reference  🚨sub to pewds🚨,5878,5
Brakes are important,5879,2
Tree house in Maine,5880,2
I was pulled over four times because I looked too young to drive,5881,9
Get a medical capsule—immediately,5882,2
China imports zero US soybeans in November for first time since trade war started,5883,2
Back in the golden days,5884,2
Cosy kitchen in the British countryside,5885,2
[WP] Immortals and time travelers pass along messages for each other Its customary and expected One day a stranger sits across from you at a restaurantcoffee shopbar and asks you to give a message to someone youll meet in New York in 2070 As far as you know youre just an ordinary person,5886,2
This Mighty Ducks wrapping paper from 1993 I found in a handmedown box of Christmas stuff,5887,2
Elon Musk says Tesla to pay customers for missed tax credits,5888,2
[Skyrim] A game in which bugs are actually a feature,5889,1
Okay this is epic,5890,2
Old days,5891,2
I can name five asians that arent good at math,5892,2
MRW my 2 year old son hears Paul McCartneys Wonderful Christmastime on the radio for the first time and declares midway through I dont like this song,5893,2
Don’t know where he thought he was,5894,2
Why dont doctors just work for free,5895,2
Can we all just go back to when life was simple,5896,2
ho ho ho,5897,4
Youre ruining Christmas,5898,2
Her first pic is a Morty Halloween costume,5899,2
Learning to write,5900,4
True,5901,2
Very bestest boy,5902,8
OH MY GOD,5903,7
Time to get schwifty in here,5904,2
This man is living in 3018,5905,7
Holiday Packs random operator to unlock,5906,1
Its easy to see which son our parents love the most Merry christmas,5907,2
Merry Christmas from Arizona😁,5908,2
So this is Christmas,5909,2
*insert funny title*,5910,0
Useful on these dates,5911,4
My dad got me right in the feels today with a wallet,5912,2
My sister’s blind dog loves fetch,5913,7
Truly a yearly highlight,5914,8
It took me over 160 hours but I finished knitting my brothers Christmas present this morning Just in time,5915,2
14 years ago The Numa Numa video was uploaded to newgrounds 26% of the human population was born during or after 2004,5916,2
Brink is one of my least favorite games of all time For the past 6 years my friend has purchased me a copy to remind me of that fact This year he managed to get an original copy and put it under my familys tree,5917,2
Ahh the queen,5918,9
Journalist thinks hes interviewing a random diplomat,5919,2
My grandmother has an original cel used in a ScoobyDoo cartoon,5920,8
I’m single and decided to celebrate the holidays by bringing this guy home today Merry Christmas They put him in a Christmas adoption sweater,5921,2
One in a million,5922,2
Not a meme but,5923,4
When we sleep our brains have enough power to generate its own reality in dreams When we’re awake it doesn’t have enough power to remember why we walked into a room,5924,2
Whats the most kindbeautiful thing youve overheard about yourself by accident,5925,2
Poor Emily,5926,2
Its time to choose guys,5927,2
Something to think about,5928,2
My mom’s husband is a pilot so he wraps all his gifts in old flight maps,5929,2
Kindness matters,5930,4
Lost kitten need forever home,5931,2
TIL orcas can teach themselves to communicate with dolphins A group of researchers in California discovered that orcas living alongside dolphins changed their vocalizations by adding in more clicks and whistles to match the dolphin’s communication,5932,2
Im a motherf***ng starboy,5933,2
Anything is possible,5934,2
This is why you never turn traction control off,5935,2
Chocolatexit,5936,7
The ‘clean plate’ mentality drives us to overeat New research explores our tendency to overeat when we only have a little bit of food left over Many of us were raised with a ‘clean your plate’ mentality stemming from a desire to not be wasteful but this can also lead to overconsumption,5937,2
You’re doing great,5938,2
Will Ferell Was Originally Afraid Elf Would Ruin His Career Fearing It Was Too OverTheTop & Risky,5939,8
How igloos are built in a spiral,5940,6
How to make a fresh Zelda playthrough fun,5941,2
To sound tougher,5942,6
Draymond Green Jr spots a picture of his dad,5943,2
Pope slams insatiable greed at Christmas Eve Mass Pope Francis has reminded Christians that their messiah was born in poverty and said they should focus on love and charity instead of consumerism 10,5944,2
A surprise to be sure,5945,2
This is outrageous Its unfair,5946,8
RIP A workhorse of 22 years died today GPU has gone to heaven,5947,2
Us  Official Trailer [HD],5948,4
Wtf google assistant,5949,2
Mom exam,5950,1
How igloos are built in a spiral,5951,6
This is pretty sad but this is a KO,5952,1
Corn and wheat are the same thing apparently,5953,2
Somewhere on I25,5954,1
Arizona man finds a little girl’s Christmas wish list attached to a balloon all the way from Mexico Tracks her down and delivers her toys,5955,2
Democrat wants to block Paul Ryans gym access during government shutdowns,5956,2
ExMossad Head Russia Decided Trump Was Their Best Candidate and Ran Him for President,5957,2
Great grandma fishing off Marthas Vineyard after a storm circa 1930s,5958,5
My gift from my grandparents today,5959,2
hmmm,5960,2
Walked in this morning to my cat helping my brother watch Netflix,5961,2
whats the most hurtful thing you’ve overheard about yourself by accident,5962,2
Be more like Santa,5963,2
Lets confuse them )),5964,2
Big mans birthday,5965,2
Dads need more love,5966,2
Air Canada flight turns back halfway to Hawaii passengers get $10 vouchers,5967,2
What does someone have to do to get a day offJesus Christ,5968,8
Jake fromHEB (found on rTexas),5969,3
Freshly sharpened axe head,5970,1
hmmm,5971,2
CEO problems,5972,1
Guy accidentally steps on accelerator in the car wash,5973,2
Quite possibly my favorite gift this holiday season,5974,2
Big shout out to my uber driver last night who was a great bro,5975,2
My neighbor wrote a book about the interesting things he heard as Santa,5976,2
keeps me up at night,5977,6
LEGO was my Reddit Secret Santa gifter and sent me the Hogwarts LEGO set some smaller sets and a personalized letter,5978,2
The greatest achievements of mankind,5979,2
It’s a Christmas Miracle,5980,2
When you’re celebrating Christmas alone with a severe gaming backlog,5981,2
me_irl,5982,7
Christmas special Finale [OC],5983,2
When your wanted level goes up,5984,2
PsBattle This man drinking sake at dinner,5985,2
Timmy was always a bit different from the other ostriches,5986,2
Been a long time since my parents have seen me as the one who has it mostly together,5987,2
Apparently lots of kids woke up disappointed today,5988,2
Here’s Mikey 15 years old I’m scared to lose him but seeing him so peaceful like this makes me happy,5989,2
Thanos movie on Netflix,5990,2
Merry Christmas,5991,2
Christmas Doggo,5992,8
Terms and conditions for Santa,5993,2
So close we gotta do it for Hillenburg,5994,7
Gotem,5995,5
Guess Im not the favourite child,5996,2
Finally,5997,2
My weakness,5998,5
Never be forgotten,5999,2
lil boy just wants hugs,6000,2
What are some nonobvious early signs that a relationship is coming to an end,6001,2
Paid friend,6002,2
When My Friends Invte Me Out For Christmas But I Have Crippling Anxiety,6003,2
PsBattle Sleeping Cat in Bowlshaped Scratching Post Bed,6004,2
A minipearl I found in an oyster I was eating,6005,1
[At a parole hearing] Officer Tell me why should you be released early,6006,8
That cat is around the corner pointing and laughing,6007,2
We let my dog open his own present this year  wrapping paper and all  and I’ve never seen him so excited in my life,6008,2
TIL that USPS collects all letters addressed to Santa and allows people to “adopt” a letter and fulfill the gift request helping children in low income situations experience Santa and a Christmas they might usually not,6009,9
[Image] It is about Perspective,6010,6
You’re browsing reddit on Christmas Day what is your family doing that’s so boring,6011,2
You seeing this dance,6012,2
TIL Army ants can accidentally misinterpret the chemical trails left by other ants and start walking in circles If too many members of the colony join in it can kill the whole colony in what is sometimes known as the Death Spiral or Ant Milling,6013,2
Reminder to all of you that got new computers for christmas disable pointer precision,6014,2
Damn Kids & Their Phones,6015,2
enjoy the best of both worlds uhmno thanks,6016,2
This picture my wife captured at the perfect moment of our cats 😂,6017,2
Cats are poorly adapted to playing fetch,6018,3
I love the little wink,6019,2
My brothers are twins Wanted to make sure they know which presents are just for them and which ones are shared,6020,2
YouTubes copystrike controversy should be the least of YouTubes problems,6021,1
First edition,6022,1
Just a regular everyday normal MF,6023,5
this silica gel bag,6024,1
Robert Downey Jr Wishing everyone a Merry Christmas,6025,2
Christmas will always be safe Thomas Visscher Digital 2015,6026,2
Signal has just been received at mission control New Horizons has successfully started its flyby program of stored commands and the exploration of Ultima Thule 4 billion miles away,6027,2
Mariah Careys All I Want For Christmas Is You just broke the global Spotify record for the most streams in a single day,6028,8
Some parts of Western US have had a 41% reduction in the yearly maximum mass of snow according to new research the first time anyone has assessed the trend at the 25mile by 25mile pixel level over the 35year period from 1982 to 2016,6029,1
*chuckles* Im in danger,6030,2
Playing video games may increase your brains gray matter and improve how it communicates,6031,3
Merry Munchkin dabs when you get a kill,6032,2
Operators of Texas Tent City for unaccompanied migrant children plan to close it,6033,2
Legs going numb on the toilet I sit,6034,6
Your notoriety means nothing to me,6035,2
Me_irl,6036,7
Where are they,6037,0
Christmas Ski Show Cypress Gardens FL 1969,6038,2
Woof_irl,6039,5
Scientists have succeeded for the first time in directly reprogramming human blood cells into neural stem cells They can be modified with CRISPR and multiplied indefinitely in the culture dish and can represent an important basis for the development of regenerative therapies,6040,1
Anarchy is cool That crab’s a real beauty,6041,1
meirl,6042,1
Knows everything about you starterpack,6043,7
My grandparents gave me these Best Christmas ever,6044,2
[OC] My SO got me a gorgeous set of dnd dice for Christmas They’re 100% made of amethyst crystal,6045,2
Sucha good girl getting a shot at the vets,6046,2
Looking for my sons heart In Canada even though the donor and recipient want to meet you cant find each other Help me find my greatest gift and AMA,6047,2
My coworker thinks this article is speaking directly to him,6048,1
Do you know,6049,2
My hotel wants you to take the nice soap home,6050,2
My past neighbor rescued a fawn and it’s grown into the family,6051,2
My dad made me these decorative trees in his workshop for Christmas,6052,2
A singlecelled organism dying,6053,6
The mods are opening presents Can we make Creed the new manager,6054,2
*wheezing laughter*,6055,0
Ironic,6056,7
I choose you Chikapu (xpost from rcrappyoffbrands),6057,7
Just got off a 12hr 🤒night shift MERRY CHRISTMAS EVERYONE And to all those working night shifts throughout the holiday 😍 you got this,6058,2
I [M 32] ruined Christmas and I have no regrets,6059,2
My missing cat came home this morning He’s a little muddy a little nervous and a little less stocky but he’s safe and home and already cuddled up beside me A little Christmas miracle Meet Coco,6060,2
He responded to himself,6061,2
Celebrate the holidays right,6062,2
TIL that when Harry Winston was 12 years old he bought a 2 carat emerald for 25 cents in a pawn shop after the owner had mistaken it for coloured glass He sold it two days later for $800,6063,2
Visiting my parents for Christmas and they dont have wifi,6064,2
Get Me Out of Here digital 1600x1600px,6065,7
Me_irl,6066,7
Our Lord and Savior is born,6067,2
[Video] PlayStation App Concept,6068,8
First Look at IG88 from the upcoming show ‘The Mandalorian’,6069,2
Hey Reddit Im sure this is going to get buried but this is the first Christmas that Ive had a job and I just wanted to share the first time I can buy my mom a present with yall Merry Christmas,6070,2
Its not real Morty,6071,2
Merry Christmas Pewds Here is my gift Good luck with Vox and WSJ,6072,8
I mean sure,6073,2
Merry Christmas to all the cats that got empty boxes this year,6074,2
[Teamwork] Pass the puck to gain the point,6075,2
So this just happened on the overwatch XMas Stream (Bill calls Jeff) Oh boy Jeff knows his memes,6076,2
Mei with a special christmas message ),6077,2
Kid tries to catch Santa on video but gets this instead,6078,2
When Santas elves have to stay up super late putting the smallest decals imaginable on tiny toys,6079,2
Tom Hanks buying everyone meals for Christmas Eve,6080,2
Something I noticed while rewatching Solo,6081,2
What failure feels like,6082,2
When you don’t have kids so you get your cats all the presents,6083,2
My life is a lie,6084,2
Trump Couldnt Even Say Merry Christmas Without Whining About His Border Wall,6085,2
Who else is watching Die Hard today,6086,2
3dprinted my dad a Needler for Christmas He and I used to play lots of Halo together My skinny arms for scale,6087,2
15 years later not much has changed,6088,2
Squidward Santa,6089,2
I get called out for posting photoshopped image without any further evidence (gif of me touching chair in comments),6090,2
How Christmas is done in Catalonia,6091,2
Show has been over for 11 years and we‘re still growing 300000,6092,2
My 16 yr old daughter drew this for me for Christmas,6093,2
merry christmas my fellow dankmemers,6094,2
Endangered tiger DNA sent into space as backup  Dry powder of DNA from a South China tiger of the Guangzhou Zoo was blasted into space by the Long March 11 carrier rocket on Saturday for backup storage of the genes of this endangered species,6095,6
Its true,6096,2
Wow It works,6097,2
Goes both ways,6098,2
The sultan is here,6099,1
Guess I’ll die 🤷‍♂️,6100,2
Insta wifi,6101,2
Thems the laws,6102,2
TIL that under Ontario traffic laws it is illegal to operate a horsedrawn sleigh on public roads with fewer than two sleigh bells attached to it Penalty on conviction is a fine not exceeding $5,6103,8
Please go away,6104,2
Goddamn it Farkas,6105,1
The map just got covered in snow,6106,2
Someone ought to tell them about socks,6107,8
my brother and me every christmas,6108,2
This doesnt make sense guys,6109,2
Dear Microsoft when I’m in store looking for sales I want to see prices not this,6110,2
[homemade] knit hat cake for xmas eve,6111,2
Scientists have succeeded for the first time in directly reprogramming human blood cells into neural stem cells They can be modified with CRISPR and multiplied indefinitely in the culture dish and can represent an important basis for the development of regenerative therapies,6112,1
Buffalo Chicken pullapart bread,6113,6
A regular client at my store put one of the tree ornements we gave him on his foster squirrel I think this little guy wins it all,6114,2
NBA WISH LIST BR,6115,2
All aboard the fluff train,6116,2
Here Ill give you a little rub too,6117,2
Christmas Puppy,6118,2
Start the doggy,6119,2
Merry Christmas,6120,2
me irl,6121,2
Merry Christmas from Schrödingers Santa,6122,2
Youre finally an adult when you have a net loss from the holidays instead of a net gain,6123,7
My grandma in her senior year of high school  1971,6124,2
When you browse the subreddit of your new game and everyone is talking about killing Christmas Noobs,6125,2
[Satire] The Smell Of Incest,6126,0
𝕀𝕥 𝕕𝕠 𝕓𝕖 𝕝𝕚𝕜𝕖 𝕥𝕙𝕒𝕥,6127,3
Robber time,6128,1
After years of trying to have a baby i can finally say that my wife is finally _______ ,6129,2
Not one but two bee crashes,6130,2
I just realised that Kevin and Patrick are literally the same people,6131,2
It really do be like that sometimes,6132,2
[Image] Build a new you,6133,2
Merry Christmas,6134,2
That anxious first ride home,6135,2
Gordon Ramsay gets schooled,6136,7
Santa really came through on stocking stuffers this year,6137,2
How to start your day off right,6138,2
He wasn’t born today,6139,2
What a great subreddit,6140,5
Basically the whole website of Soulja Boy’s tech company,6141,2
Steam is now refunding people for Atlas even if you have more than 2 hours,6142,2
TIL that the discovery of oil as a fuel was an environmental miracle for whales as it made hunting whales for their oil far less competitive,6143,2
I’ve been saving this meme since Thanksgiving,6144,2
This levitating Golden Snitch,6145,8
Oh Karen,6146,7
Nice immitation both of ya,6147,1
When your parents wrap your presents last minute,6148,2
No not you,6149,0
They want our healtcare,6150,2
I do not mean to bother you but can I get a signature please,6151,2
me_irl,6152,7
No one messes with those who sort by new,6153,2
Ugly Christmas Sweater Winner,6154,2
This was an image in a book my fiancé got in his stocking Thought you’d all appreciate this,6155,2
United States in the style of Saudi Arabia,6156,2
Elon Musk We know well run out of dead dinosaurs to mine for fuel & have to use sustainable energy eventually so why not go renewable now & avoid increasing risk of climate catastrophe Betting that science is wrong & oil companies are right is the dumbest experiment in history by far,6157,2
Our AirBnB had a translucent bathroom door I’m used to my impatient toddler stalking me through the bathroom door but this took it to a much creepier level,6158,2
This is the last time you can upvote this for an entire year,6159,2
Im just leaning This is where I lean,6160,2
Im going back home on Trainy McTrainface,6161,2
gave my nieces and nephews nightmares for christmas,6162,2
Makes sense,6163,1
This brass instrument sink in my stepuncles bathroom,6164,5
Vances Incredible 365day transformation inspired by Bert Kreischer,6165,5
Sexy Sexy Sexy Boo,6166,0
Big facts,6167,2
I feel unique,6168,2
Dan Rather asks Trump what’s more ‘marginal’ ‘Believing in Santa at age 7 or not believing in climate change at age 72,6169,2
Shut up back there,6170,2
TIL while shooting for Deliverance (1972) Burt Reynolds insisted on doing a stunt by himself instead of a dummy During the stunt he got injured and his clothes came off Waking up in hospital he asked the director what it looked like who said It looked like a dummy falling over a waterfall,6171,2
Hey reddit Just thought I’d share my brothers artwork He doesn’t get a lot of love cause no one ever really sees these so let’s surprise him with some love,6172,2
TIL every Dec 25th a town in Peru celebrates Takanakuy where men,6173,2
Germany mulls introducing mosque tax for Muslims  The idea similar to Germanys church tax would aim to make mosques independent of foreign donors Germanys government and progressive Muslim leaders have supported the idea,6174,1
Augmented reality,6175,7
What’s the adult version of “there is no Santa Claus”,6176,2
Nephews coming over Starter Pack,6177,1
When your drysuit floods,6178,5
Facts don’t care about your feelings,6179,2
Damn,6180,7
Its not a Christmas movie,6181,2
2 Children Found Buried 2 Years Apart in a Yard Their Father a Walmart Santa Has Been Arrested,6182,2
So when did you hop on this wild ride,6183,6
me_irl,6184,7
Famous wrestler tryna comfort young fan in the ICU,6185,8
My drive into work almost 1 year ago (I90 in the Berkshires MA),6186,2
Myself in 1983 Republic of Korea,6187,2
One of humankind’s greatest achievements is the standardization of lefty loosey righty tighty,6188,8
My friend rocking this glorious cut in 1993,6189,2
Water vapor flames lit by LEDs,6190,3
The pillow my mom made me really ties the room together,6191,2
God damnit guys,6192,7
The moment Djokovic felt the ball hit his racket,6193,2
Gamers rise up,6194,8
Succulents,6195,3
My new holiday tradition,6196,2
Captain America on his way to fight Thanos,6197,2
Shirtception  my favorite gift every year from my brother Were now at level 5,6198,2
Didnt know pewds was a priest,6199,2
Its a rock,6200,3
Its hard to hide him tho,6201,4
The Screaming Bear Attack Scene from ‘Annihilation’ Was One of This Year’s Scariest Horror Moments,6202,2
So nice of him,6203,1
I put a Santa hat on every Clone Troopers head Enjoy,6204,2
You can’t change my mind,6205,7
Snowboard with LEDs that change patterns when you perform certain tricks or movements,6206,3
Jeff,6207,2
🔥 Penguins on a Blue Iceberg caused by thousands of years of compression 🔥,6208,2
Dads not happy with this gift for his daughter,6209,2
These restroom stalls have translucent doors,6210,9
I drunk ordered a Christmas present for my brother was not disappointed in myself,6211,2
Subway entrance in Frankfurt,6212,4
Ruth Bader Ginsburg released from hospital after cancer surgery,6213,9
he made it to the top of google when you type u thats wild,6214,2
Guess what I got for Christmas,6215,2
This mesmerizing installation in Singapore Changi Airport,6216,9
Wack,6217,5
The nurses let Henry see Nona for Christmas and he spent the entire day on her lap,6218,2
Hi my name’s Nick and I’m traveling through Europe alone from America and just met the nicest family in London They invited me to Christmas dinner and I just want to wish you all a Merry Christmas,6219,2
He’s just a simple man trying to make his way in the universe,6220,2
Science Fiction,6221,2
Brigitte Lindholm from Overwatch cosplay by trinitylimit,6222,6
Hope something like this hasnt been posted on here before,6223,2
LPT if you are buying something high quality prefer material over brand For example a good merino wool pair of sock will be almost certainly better than a fancy cotton one Or a good full grain leather belt will be almost certainly better than a fancy genuine leather one,6224,2
This exchange between Rand Paul and a person with common sense is priceless,6225,2
Toys these days,6226,2
hmmm,6227,2
Pretty sure Tyrone Biggums just wandered past my job site,6228,2
No Guns Allowed,6229,2
27 years ago the USSR officially ceased to exist Press F to pay respects,6230,2
A magical mirror that showed an oppositely gendered equally attrative version of ones self could be very insightful,6231,4
He could save others from gold but not himself,6232,2
Pretzel Stanley,6233,5
Name a better Duo I’ll wait,6234,2
Adam RuInz EvEryTHAnG,6235,3
This is the best One shot scene and it has all the first Avengers,6236,2
remove usb safely,6237,4
Instant regret,6238,1
30 years on its still hard to improve on perfection,6239,2
2meirl4meirl,6240,2
Anakin youre breaking my heart,6241,7
Coyotes meeting reintroduced wolves,6242,1
Found on fb Lol if you say so Karen,6243,1
Driver mistakes a footbridge for an overpass,6244,2
She just dead bcs she sad,6245,1
All Fred Master of traps Clapper of daphnes cheeks,6246,7
Uh guys Where are the birthday wishes for our favorite clone,6247,2
Water vapor flames lit by LEDs,6248,3
My latest and greatest Minecraft build The Canyon City,6249,2
Felt cute might delete later 😉😜,6250,2
This leather jacket my uncle carved out of wood,6251,6
Someone forgot to debug their coffee cup design,6252,8
Petfect Timing,6253,8
A new study shows 7 key features shared by both social anxiety and depression irritability feelings of worthlessness mood instability depressed mood positive affect social avoidance and social fear The key “bridging” symptom in the new model proved to be feelings of worthlessness,6254,2
This shoecake,6255,4
Microsofts Fortnite bundle says it comes with the full game and 2000 vbucks,6256,1
