Title,doc,topic
I got off the horse by accident right before a cutscene in red dead,0,2
19 of 20 World Leaders Just Pledged to Fight Climate Change Trump Was the Lone Holdout,1,2
Former President George HW Bush Dies at 94,2,2
A cute amazon review I revisit just for a smile An 88 year old woman and her 92 year old husband attend a Halloween party Btw they liked the bee costume,3,2
When people brokenly speak a second language they sound less intelligent but are actually more knowledgeable than most for being able to speak a second language at all,4,2
Antivax movement blamed for 30 per cent jump in measles cases worldwide,5,1
Well this was a highlight of my day,6,2
Glitter drops,7,2
Antivaxxers are another damn breed,8,8
Me North Pole 1992,9,2
Casually make you look like a fool,10,2
Sir your bottle,11,8
So I proposed to my girlfriend yesterday and a stranger came past congratulated us and offered to take a picture with their drone Thank you for making this day even more perfect for us,12,2
Michael Rapaports viral cat video taken down by Instagram because they find it degrading towards the cat,13,2
Minnesota Vikings player Anthony Harris adopted a teeny tiny cat last night,14,2
Whats a joke thats so stupid its funny,15,2
Open up,16,2
Found a meteorite any idea how much it’s worth,17,1
TIL Amelia Earhart and Eleanor Roosevelt once sneaked out of a White House event commandeered an airplane and went on a joyride to Baltimore,18,2
Toby used to be a drug dog for a prison he worked hard for 9 years and he is a very good boy,19,2
Dark web dealers voluntarily ban deadly fentanyl | Society,20,6
This dog throwing ball on the beach,21,2
What is the most useful Windows keyboard shortcut you think everyone should know,22,2
James Harden no look blocks DeMar DeRozan,23,1
Every UK political advert on Facebook will now be required to come from someone who has proved they live in the UK and carry a disclaimer revealing who paid for it the site has confirmed,24,2
Parents who force unremorseful kids to apologize to others before they’re truly sorry may do more harm than good suggests a new study That’s because the point main point of an apology is lost as children may dislike the apologizer even more after the insincere apology than before,25,2
It’s the circle of life,26,1
Tiny gremlin at just over a pound,27,8
First Image of Adam Driver in Drama The Torture Report  Explores the aftermath of the 911 attacks when CIA agents begin using extreme interrogation tactics on those they think were behind it,28,2
The spirit of Christmas,29,2
That kid will grow up to be 200 years old,30,2
🦐🍤🦐🍤🦐🍤🦐🍤🦐🍤🦐🍤,31,8
[GTAO] Turning the tides in styleee,32,8
Just discovered the Grinch in my floorboard,33,2
Hedgehogs,34,9
FEmaLe bRuTAlly MuRDeReD,35,2
Class presentation day starter pack,36,1
How is Reddit so popular yet everyone I ask either doesnt use it or has never even heard of it,37,2
You look best with the lights off,38,2
New Poster for Peter Jacksons CriticallyAcclaimed World War 1 Documentary They Shall not Grow Old,39,2
Dogs and snow,40,2
Reddit janitorial services coping with the end of No Nut November,41,2
Roses are red my humor may worsen,42,1
They say some of the greatest minds are required for designing modern cars,43,9
CIA finds Saudi crown prince sent at least 11 messages to adviser who oversaw Khashoggi killing around time of his death,44,2
Accomplished,45,5
Its go time lads,46,2
Is a DoOver Election Incoming North Carolina Republicans Alleged to Have Committed Massive Voter Fraud,47,2
Canada Leads Joint G7 Statement Condemning Russian Aggression in Ukraine,48,8
me_irl,49,7
Jeep drives straight up a canyon cliff,50,5
Couldnt agree more,51,2
Goofy moron,52,9
My girlfriend likes to make relaxing cooking videos but struggles to find suitable music Apparently my suggestion of Slayer was not helpful,53,7
The way this box gets perfectly wrapped,54,2
When a frog eats a firefly,55,5
Her dad photoshops her in dangerous places to freak out the relatives during the holidays,56,2
Only 25 stairs Losers 😎😎😎,57,8
Pardon me while I play the worlds smallest fiddle for greedy corporations,58,4
TIL During Prohibition moonshiners would wear cow shoes The fancy footwear left hoofprints instead of human shoe prints,59,2
Cohen believed Trump would pardon him but then things changed,60,2
Goldman Sachs asks in biotech research report Is curing patients a sustainable business model,61,2
Would probably take about 10 minutes,62,2
Lets drop 675lbs and hope for the best,63,2
The tide flowing in and out,64,5
Solar powered but under a shelter,65,2
Just the most realistic simulation of digital paper i have ever seen,66,2
Stunning overhead photo of a road destroyed in today’s earthquake in Alaska (Photo by Marc Lester),67,2
Smack of love,68,2
I for one welcome our new owl overlords,69,2
The Pearl with the Girl Earring Digital Art 30x30cm,70,7
How Bethesda takes care of the players Now you know where all material went to ;),71,2
My dog making me feel extremely uncomfortable,72,2
Me waiting to see if it’s ok to post Christmas memes,73,2
Okay this time Im gonna install only one Skyrim mod One Three hours later,74,2
Mad dad and mad lad jr,75,2
Mattis Russia interfered in 2018 midterms,76,1
humans are amazing,77,2
What is the weirdest thing you have ever seen a stranger do,78,2
Chameleon missed its owner,79,2
TIL Juan Catalan Spent nearly 6 months in jail for the murder of a teenage girl until his lawyer found unused footage from HBOs Curb Your Enthusiasm that proved he had been at a Dodgers game with his 6 years old daughter,80,2
Mamas Pride,81,7
To spell lion,82,2
2meirl4meirl,83,2
[LEGIT]  Taken from a runescape chat room  paper view,84,8
TIL déjà rêvé is a feeling similar to déjà vu except instead of feeling like you’ve previously experienced an event in real life you feel like you previously experienced it in a dream,85,2
Family first,86,2
My cats are better at Christmas card material photos than I am,87,2
woof_irl,88,5
Me and my friend doing some lasso experiments last night was not disappointed,89,2
Damn beeping,90,7
The other day my friend was telling me i didnt know what irony meant,91,2
Hmmmmmmmmmmm,92,1
Botton Text,93,2
The sun never sets,94,2
A dishwasher at a restaurant in Louisiana had saved up money for months to buy a car for his family only to have it stolen His coworkers pitched in to raise money for a new one,95,2
me irl,96,2
Random people found a stray dog in the desert with a metal wire around its neck,97,2
Girlfriend’s Cat has Never Seen Christmas Tree Before,98,2
meirl,99,1
That was close,100,2
Trump cancels G20 press conference,101,2
Scandinavia in a nutshell,102,1
[OC] I will go to live in pullover,103,2
PsBattle Grimace wearing the Infinity Gauntlet,104,2
Me🚘irl,105,4
Thank you soap dispenser Very helpful,106,7
The spirit of Christmas,107,2
The fine women of DM,108,5
In 60 years there will be retro themed diners where the staff wears skinny jeans and look at their iphones while working,109,2
This fridge of stickers,110,6
I will never forget,111,2
Came home today to find my bathroom mirror in a million pieces,112,2
I don’t know who is more surprised lol,113,2
Absolute chonker of a cat,114,2
Seems about right,115,2
Redneck talks about modern music,116,1
Argentina 1960,117,7
I don’t think my dog is photogenic,118,2
Saw this reply on a Rockstar Games post about community feedback thought it was hilarious,119,2
My grandparents in 1948 shortly after eloping at 17 They were married for over 60 years,120,2
Neck to meet ya,121,2
Is This A Supermarket,122,2
Great Dane Pup Just 14 Weeks Old,123,2
Being derp during a riot,124,2
Delusional Babysitter Requirements,125,8
Tucker the winter resistant,126,2
Im making a game for Pewds please upvote this so he can see it and give me permission to put it on Play Store Thanks,127,2
🔥 violet backed starling,128,2
Window Cleaning,129,8
In The Year Without a Santa Claus (1974) during the mayor’s song you can see Charlie Chaplin in the crowd of Southtown USA,130,2
Caretaker left cat without access to water for days and died as a result,131,2
Name a more iconic duo,132,8
Ah… finally,133,2
hmmm,134,2
MBS communicated with adviser during Khashoggi killing WSJ,135,4
THE 10 LEVELS OF JAZZ GUITAR,136,2
Best friends going night nights,137,2
Best reason why Russia wont invade EU,138,2
My dad was Santa at our local Petsmart was not expecting this,139,2
NNN is almost over bless up,140,2
It did be like that,141,2
He had such a knowledge of the Dark Side he could even keep the memes he cared about from dying,142,6
[WP] The lone survivor of an Arctic exploration you were captured generations ago by a band of tiny warriors They’ve placed you under an enchantment to do their bidding; heading out into the world once each year as their unwilling emissary They call you “slave” or in their tongue “Santa”,143,2
What are some red flags from teachers that shout drop this class immediately,144,1
I dont remember asking you a Goddamn thing,145,2
The best thing about social media is you can call yourself whatever you want,146,2
Different kind of CB (yes I answered the questions it was mandatory after all ;) ),147,2
Totally,148,7
HMRB As I hit this jump,149,1
Not sure if it was a joke or not Pls tell me,150,2
19 of 20 World Leaders Just Pledged to Fight Climate Change Trump Was the Lone Holdout,151,2
Last meal,152,2
In a joint declaration released Saturday leaders of G20 nations reaffirmed their commitment to fighting climate change by upholding the Paris Agreement — with the exception of the US,153,8
This isnt the dog park,154,2
i think of myself as above the average person,155,2
Gotta get that epic victory royale,156,2
Devin Nunes protected Roger Stone and Donald Trump Jr from Mueller probe Democrats won’t,157,6
An app that tricks you into paying 150$ by asking you to hold your finger on the home button for 10 seconds,158,2
Anyone else notice that Rockstar recreated the distracted boyfriend meme in the game,159,2
YSK Khan Academy has a section on Personal Finance that teaches you things such as how to do your taxes pay for college and save for retirement,160,2
PsBattle This “Just over 1 pound” kitten,161,2
🔥 The Mesmerizing Atlantic Eagle 🔥,162,2
So you want me to fire everyone at the Christmas Party Okay then,163,2
So much potential in this bad boy,164,2
Touchy tha footies,165,7
Chimpanzee returns selfie stick stolen by its companion,166,2
[Image] Sail against the wave,167,4
Finn bartends when he’s not helping my sister with her vertigo,168,0
Kevin Hart was “upset” that there was a Rubik’s Cube portrait made of the Rock but not him This was made to even things out,169,2
A rather permanent way of showing your higher intelligence,170,2
Somewhere someone is sitting on a couch that has the most money through spare change than any other couch in the world and they have no idea,171,2
Any of you fellas get hearthorny,172,2
An old joke modernised for 2018 Australia,173,2
Incredible photo of an osprey going in for the kill 🦅 Photo credit Wilson Chen,174,4
Trump doesn’t want you to know but it’s time to sign up for Obamacare,175,2
When the realisation hits you,176,4
Cats will be cats Regardless of size,177,4
He only got to go to the park *once* today,178,2
Til High IQ is associated with various mental and immunological diseases like depression bipolar disorder anxiety ADHD as well as allergies asthma and immune disorders,179,2
What did we do to deserve dogs,180,1
The Slow Death of a Cubicle Life,181,1
I bet Christmas is a lot cheaper,182,2
Seriously give it a rest,183,2
Harden nonchalantly strips the ball from Derozan on the fast break without looking,184,2
They just keep jinxing it,185,7
Swords,186,4
Were all just trying to have fun online,187,2
A tour of the Kings row streets with a Lúcio main,188,4
My new kittens toebeans alternate in color,189,2
It happens to everyone now and again🤷🏼‍♀️,190,4
And we shall have peace,191,9
He’s still out there,192,2
She’s a maaaaniac maaaaaniac in the pool,193,0
Doing Take The L before the Scorecard emote causes it to always be 0,194,7
Skin too hard for mosquito,195,4
hmmm,196,2
Waking up to this gorgeous view,197,6
Satisfaction Guaranteed Or Your Trash Back,198,2
No tears for Paul Ryan On the short unhappy tenure of the worst House speaker ever,199,2
If you say so,200,2
A quiet snowy evening in Watertown SD,201,1
Child with a really long arm,202,2
ABSOLUTE MAD LAD,203,2
Can we get Pewds to give a shout out for this war veteran and youtuber pleaseif he becomes homeless he will die because of his disease(he needs to plug a machine before he sleeps) link for his GoFundMe is in the comments,204,2
The first time Peanut let me pet him He was a feral kitten then I got sick and was away for a few day When I came back he didn’t want to leave me and I went for it,205,2
Reddit is not a bastion of free speech and is actually highly censored by the wrong people,206,2
No show offs allowed onboard,207,6
Apparently YouTube doesn’t care about who you are subbed to anymore,208,6
Fiancee cuddling with Legolas Hes accepted his fate,209,4
[UPDATE] I have been paying for my entire apartment buildings water heating And my landlord’s response was “If you don’t like it just move out”,210,2
Whatever you are doing right now stop it for a moment and just relax,211,2
Saw this at a con today,212,2
Blueberry pie with cinnamon cookie crust,213,4
Cute shirt for pup,214,2
KatEvolved outplays a minion,215,5
I found out my high school bully is dead and Im ecstatic,216,2
Marvel should post a video called “Avengers 4 Title Revealed by Cast Member”,217,2
No nut life,218,1
Planet Earth working on 3 Mars landers to follow InSight,219,2
I asked Tommy Wiseau if he supports Pewdiepie in this war against Tseries and he responded,220,2
All the selfish reasons we need an antioil foreign policy Its not just about climate We have the power to cripple the oil states and build US technological superiority A dramatic shift to renewables will help us not other countries,221,2
ORDER SHEETS,222,2
This would be SO amazing if real  please make it happen Nintendo,223,2
Merry Xmasssssss from a snake in an extremely tiny hat,224,2
Where’s Ben Shapiro,225,7
Am I a joke to you,226,2
They told me I was nothing but a dog,227,2
He’s mine now,228,2
Id really like to know the context,229,2
Mario Hezonja with the dunk on Giannis then stares him down  MSG,230,3
bet you wont do it pewdiepuss,231,2
Megathread George HW Bush 41st president of the United States dies at 94,232,2
Near perfect sponge print,233,8
Cookies for Satan,234,2
Lularoe allegedly owes over $48 million to the manufacturer of their clothes Paperwork has been filed,235,6
MRW there are those who oppose my 25 Days of Christmas movie gifs,236,2
Do a pushup every time someone says Trump It wont solve our political differences but at least youll have gains,237,2
Gorgeous view,238,6
Reddit Coin is stupid,239,2
The kids from Jimmy Neutron needed new jobs when booted from Nickelodeon,240,2
Just a note Humble Bundle was hackedexploited They did the right thing by telling us quickly,241,2
First year putting up our “millennial nativity scene”,242,2
Something someone posted over on the Facebook page “Is Mayonnaise an Instrument”,243,2
*clicking noises*,244,9
Hey dad,245,2
The dedication to that smile,246,2
It says more than a thousand words,247,1
If youve never seen an armadillo rolling up here it is,248,2
My friends cat was recently put down and the vet gave him this paw print of his cat that is full of flower seeds to be planted,249,2
Today is your lucky day dont mess it up ,250,2
My greatgrandmother and me in the same spot 89 years apart,251,2
When you are the younger sibling,252,1
A 3 day break you feel well rested A 5+ day break you forget how to be a productive member of society,253,2
Donald Trump was heard off camera saying get me out of here to an aide as he left the G20 summit in Buenos Aires,254,2
Do you know who I am ,255,2
Hes doing what he can,256,2
This bonsai tree recently sold for ¥1800000,257,8
Wholesome daughter,258,8
Bringing a son’s imagination to life,259,1
Paz was way too content just floating around with me,260,2
LPT Think twice before buying someone a gift associated with their hobby Unless you are just as knowledgeable you will likely buy something they dont want or need,261,2
They say with pessimism youll either be correct or pleasantly surprised but that’s an awfully optimistic way to see pessimism,262,2
Quality Assurance,263,2
The reflection of these sticks make interesting shapes,264,8
the perfect sheet throw,265,8
Lowkey Office reunion,266,2
The Most 90s Photo Ever,267,2
Cap Space,268,2
The Giants punt coverage manages to keep the ball out of the endzone to avoid a touchback,269,1
What are a vaccine for,270,7
We need a christmas flair already,271,2
Me playing Resident Evil back in the 90s,272,3
Bringing a son’s imagination to life,273,1
OcasioCortez Frustrating that lawmakers oppose MedicareforAll while enjoying cheap government insurance,274,2
What is a song lyric that really hits you hard,275,4
Snow tracks in the sunset,276,2
Billy the endangered baby blue Pingu,277,2
We found this little guy sitting at our front door tonight in the rain,278,2
Virtual experience in the world of Vincent van Gogh,279,1
Reddi Whip can comes with different complexion Santas,280,1
Accurate,281,1
Looking after my friend’s cat who has never seen stairs before,282,2
Literally spent the best part of 6 hours making this You better appreciate it,283,2
When you post a meme but everyone downvotes it because its EAs battlefront 2,284,4
🔥 path to the sun,285,2
me_irl,286,7
Grandma mistakenly booked into allmale jail staff thought she was transgender,287,4
Tummy Rubs,288,8
Brought my mullet metal shirt and grunge flannel to the mall’s food court to play Dungeons & Dragons with people I met online circa ‘92,289,2
Tesla Vehicles have driven well over 12 billion miles while on autopilot during that time there has only been 3 fatalities the average is 125 deaths per billion miles so Tesla Autopilot is over 4 times safer than human drivers,290,2
Spyro tries to be the centerpiece of my table,291,9
When the library doesn’t account for people actually using their brains,292,2
Found this in rthatHappened and figured this particular comment belonged here,293,1
[Image] Your future self is watching,294,2
Thanks to better science and engineering no one died in Fridays 70 earthquake in Anchorage Alaska,295,2
Poor souls,296,2
My dog on the frozen lake after a little rain,297,2
Tis the shibeson,298,9
TIL The crew of Planet Earth II filmed the mass birth gathering of Saiga Antelope only to witness a disease spread and wipe out more than 150000 antelope within 3 days,299,2
Make snow lumps Insert glow stick eyes Freak out neighbors,300,2
Funny Also I’m dying,301,2
OcasioCortez In my onboarding to Congress,302,2
Youngest US Marine Medal of Honor awardee (28) meets the oldest Marine Medal of Honor awardee (94),303,2
More Hercules memes,304,7
Wrong lever,305,7
But a talking fish,306,2
🚨🚨73 MILLION But the gap has shrunk to 15K (🚨🚨,307,6
Dont do it bro its not worth it,308,1
What windows,309,7
The way these lights look,310,2
to invoke amputated soldiers as patriotic appeal in a political ad,311,2
Hilarious Actual Cannabis Commercial,312,2
Putin final boss of Russia The Game archnemesis of the Saudi Prince,313,1
Things escalated quickly here,314,2
This sevenyearold girl shows friends her new prosthetic leg for the first time,315,2
Parrot in a poncho,316,6
What is one piece of advice you wish you had when you were younger,317,2
My aunt makes really cool art and I wanted to show you guys,318,2
I couldnt be happier,319,1
2meirl4meirl,320,2
Pigs in a Blanket Baked Brie,321,5
🔥 Magma spilling out of crust,322,2
Hail damage to a moon roof,323,9
Parrot in a poncho,324,6
Flares being deployed to attract heat seeking missiles away from the plane,325,4
Murica,326,6
TIL Macys originally agreed to be the department store in Elf however one stipulation was that Santa couldnt be revealed as a fake Jon Favreau was unwilling to change the content so he changed the store to Gimbels and filmed it in the cafeteria of a Vancouver mental hospital,327,2
My bio mentions Im a musician,328,2
Roses are red I hate the taste of lime,329,1
untapped meme goldmine,330,4
Putin refuses to release Ukrainian sailors and ships,331,7
mirror mirror,332,4
I didnt see that coming,333,2
Never give up,334,2
I brought in a cake for my last day with my team,335,2
Somewhere in Germany,336,1
Review for my local bookstore,337,2
This sub in a nutshell,338,1
Braille at the ATM Covered in glass,339,2
Poor health inspector,340,2
TIFU by being so pregnant I couldn’t see what I was wearing before I went on stage,341,2
A lumberjack went in to a magic forest to cut a tree Upon arrival he started to swing at the tree when it shouted “Wait I’m a talking tree,342,2
What a comeback,343,8
Big pupper shows little puppers how to dig,344,2
Ancient Jewish Secret,345,7
So uncivilized,346,8
Bear got hit right in the picanic basket,347,2
The way these dice are packed really annoys me,348,2
SLPT,349,1
Equal opportunity,350,0
All the conflict,351,4
Its the barkness monster,352,2
This company erects statues of employees that work at the company for at least 3 years,353,2
Supermarket ban sees 80% drop in plastic bag consumption nationwide in Australia,354,2
The greatest hunt  I put my cat in the game,355,2
The best magic trick in the world,356,2
hmmm,357,2
TIL that cruise ships have morgues in them On average roughly 200 people die on cruise ships each year so most ships have the capacity to store up to 10 bodies at a time,358,2
Madlad establishes ground rules,359,1
🔥 Little Jaguar First Day On Hunt 🔥,360,2
Sweet Victory in high quality,361,2
Roses are red I eat lots of fiber,362,2
Target Employees what’s the worst incident you’ve witnessed with one of the giant red balls in front of the store,363,2
Teaching a trick,364,6
My first PC with a case entirely made out of lego based around the Portal game,365,2
I used to pay my middle school bully not to bully me then I found out he actually needed the money,366,2
I think I want to marry this girl,367,2
Keanu Reeves a down to earth superstar,368,6
NYPD hunt couple who lost ring during romantic proposal,369,2
shockwave onto a self guided missile for game winner,370,2
Man crashes into tree after driving with his head out car window like Ace Ventura,371,2
Pup wakes up to the sound of food,372,2
CAN SOMEONE PLEASE CONTROL THIS MAD SWEDISH MAN,373,2
All Necks Matter,374,6
In 2003 Adam Nieman created this image illustrating the volume of the world’s oceans and atmosphere (if the air were all at sealevel density) by rendering them as spheres sitting next to the Earth instead of spread out over its surface,375,7
My boyfriends stunning cat 😍,376,2
hmmm,377,2
After breaking cultural barriers 5 years of strength and tenacity I get to say Im engaged to my best friend,378,2
We need to talk about Anakin,379,7
30 secs is enough,380,8
sirens song,381,4
hmmm,382,2
Dwayne Johnson shares a new photo of Vanessa Kirby and himself on the London set of Hobbs and Shaw Kirby plays an MI6 operative and a sister to Jason Stathams Deckard,383,4
I quit Instagram and Facebook and it made me a lot happier — and thats a big problem for social media companies,384,2
Danny Devito is timeless,385,9
Parents to prepare kids financially give them practice with money  Providing children with handson experience with money is essential to preparing them for financial success a new study suggests,386,2
In Jurassic Park you can see Dr Wu erasing a data sheet in the lab Erasing lab data is highly improper and unethical in scientific settings hinting at Dr Wus corrupt nature in later films,387,1
Cancelled,388,2
My Minecraft build Nakazawa Pagodas,389,8
She does not separate from her mother even for a minute,390,2
Was told this belongs here,391,0
[I ate] Eggs Benedict with smoked salmon,392,0
MARKIPLIER IS FINALLY DOING HIS PART,393,2
How babies are made [OC],394,2
A Must Read Crazy Craigslist Car Seller,395,2
Prison Mike approves,396,4
You’re never truly safe,397,2
Straight out of a video game,398,2
top 10 most influential philosophers,399,2
Well,400,2
All necks matter (w sound i hope),401,6
amethyst starling native to tropical africa,402,2
I think I know what the A4 title is,403,2
WE NEED MORE M O N E Y,404,1
This is Didi Bonnie and Clyde and they hunt poachers in Africa for the Big Life Foundation,405,2
NSW Australia Last month a friend began to cross a flooded river in his car with me in it I jumped out because Id been caught on a flooded causeway before I now have a letter from his lawyer asking for damages because the car was washed off the causeway and written off,406,2
What is the most lawful evil thing you have witnessed,407,9
30 seconds,408,8
Congratulations rantiMLM You are Subreddit of the Day,409,8
Tummy Rubs,410,8
What should I do,411,0
In Mark’s 50 min livestream Pewdiepie gained 70k subscribers This increased the gap from 63k to more than 130k Thank you Markiplier We couldn’t do it without you,412,2
Blue Crab Teapot Mitchell Grafton ceramic & steel 18,413,7
Rome Metro vs actual geography [OC],414,2
My friend is way too dumb,415,2
History lesson,416,2
PsBattle Infrared Photography Salt Lake City,417,6
My friends and I live in Alaska you know we had to do it,418,2
Oof,419,6
Let’s get this bred,420,2
Homeopathic quack gets shut down,421,7
Programmers literally only want one thing,422,2
Tiny Planet in the Cosmos,423,2
mirror mirror,424,4
A salt crystal i found at Salar de Uyuni,425,4
Its the little things in life,426,2
Odd flex but okay,427,8
absolute unit,428,0
Shes only doing it to get through flight school,429,2
Mr President if youre attacking the FBI youre losing,430,1
