Title,doc,topic
How Criminals Steal $37 Billion a Year from America’s Elderly,1643,2
Oof owie my neck hurting tie,1644,6
RDR2 Online in a Nutshell,1645,2
God Wrongfully Impregnated Teenage Virgin Mary Without Consent Says Minnesota Professor,1646,2
Im a simple tank I see friends in danger I intervene,1647,2
We must make this happen guys,1648,2
Just realized today that Jaden and Willow Smith are named after their parents just the opposite genders,1649,2
Hi Skyrim dev Jonah Lobe here Just thought I’d share a drawing I did of Aela the Huntress Had a wonderful time designing her armor for the game,1650,2
A cozy street in Old Quebec,1651,2
Elon Musk If somebody comes and makes a better electric car than Tesla so much better than ours that we can’t sell our cars and we go bankrupt I still think that’s a good thing for the world,1652,2
The Outer Worlds – Official Announcement Trailer,1653,4
Ants got in my bag of Jolly Ranchers ate every last one and the wrappers are still intact,1654,2
The beautiful Werewolf Cat,1655,2
Lets show them who is their actual audience,1656,2
Wait for it,1657,2
Accurate,1658,1
21 year old recently diagnosed with end stage kidney disease AMA,1659,2
It was pretty bad,1660,2
The best spot to be,1661,2
Special delivery,1662,1
me_irl,1663,7
True that,1664,2
‘Make better choices’ Endangered Hawaiian monk seals keep getting eels stuck up their noses and scientists want them to stop,1665,2
Im still depressed about it,1666,2
Just finished my Smash Bros Poster to celebrate the game What do you guys think,1667,2
Avengers 4 will be released on April 26 2019 instead of the previously announced May 3 2019 release date,1668,2
I think my dads company is responsible for his death [California],1669,2
You know what this meme needs K pop,1670,2
Good boi,1671,8
For each country in the world the red area shows where 95% of them live the percentage is how much land this represents for each country [OC],1672,2
Lamborghini driver very loudly expresses his regret after smashing the car’s bumper into a curb,1673,5
Truck accident,1674,1
TIL that one medium McDonalds milk shake contains 630 calories the same as a whole average dinner meal One milkshake also contains 90g sugar which is more than your daily maximum recommended sugar intake of around 75g,1675,2
Two idiots in one clip SUV cuts off a car running it into the curb Flustered car driver then reverses into camera car,1676,2
Moo,1677,6
Imagine their faces,1678,2
It’ll be okay,1679,8
Not only the chair made it into Youtube Rewind 2018 We have to thank her,1680,2
Geez a wee bite of yer biccy,1681,9
Mini steering wheel for controllers,1682,5
why couldnt my parents call me something cool 😤😤😤,1683,2
My Granddaddy’s little brick kitchen (OC),1684,2
Supposed Marvel fan destroyed by Marvel history,1685,4
EveryDamnTime,1686,1
[WP] When you ask your daughter what she wants for Christmas she asks for a unicorn Your wife laughs it off but you dont Neither your wife or daughter know that youre the best monster trapper in the world and your daughter is getting her unicorn no matter what,1687,2
I did it,1688,0
Oh god,1689,7
I pass this cat on the way to work Here she is complaining I didnt bring treats today,1690,2
Focusing on simplicity,1691,9
Sweetest smile ever,1692,2
YouTube rewind is a potato,1693,1
We are an Explosive Detection Team and he’s also my Bear,1694,2
My preorder hasn’t come in the mail yet but I don’t want to feel left out,1695,2
90s taco Bell,1696,3
[OC] I compiled the Top 10 most upvoted highlight plays on rNBA for the month of November and made a fun little Top 10 reel Hope you enjoy,1697,2
How about you rewind me into not existing,1698,1
In absolute awe of how totally juiced this lad is,1699,7
What a terrible crime,1700,2
I fixed that Meme you found,1701,2
Mamma Mia,1702,0
You guys like Huey Lewis and The News,1703,2
Special counsel Mueller says in new filing that Russia reached out to Trump campaign as far back as 2015,1704,2
Can’t wait,1705,2
My son keeps his fur siblings company every morning while they eat,1706,2
Open letter to ableist antivaxx crowd,1707,2
In awe of this lads chonk,1708,7
Dissolve,1709,4
Big oof there,1710,8
This person tried adding me on Facebook; I didn’t accept,1711,2
Riiiiight,1712,7
The Outer Worlds – Official Announcement Trailer,1713,4
Cripples am I right,1714,4
My MIL sewed this beautiful stocking for me for Christmas I feel that all this love and hard work needs to be shared,1715,2
Too old for this 😔😔,1716,1
Some video game weaponsitems drawn by me,1717,1
These seats once the view changed to just water,1718,6
My day in a meme,1719,2
CAN WE COPYSTRIKE YOUTUBE REWIND,1720,1
Sure thing mate,1721,2
fish,1722,1
Marvel Studios Avengers 4  Official Trailer,1723,4
This black cabin floats above the Norwegian landscape,1724,6
My Nonna wanted me to post this on the internet so that “everyone in Italy can see how big my Tomatoes have gotten”,1725,8
My Husband is a powerlifter and tends to break things around the house on accident Its become a running joke He sent me this today,1726,2
UPS man is Snow White,1727,7
This one dude in the crowd in a neon shirt,1728,2
TIL that in Hinduism atheism is considered to be a valid path to spirituality as it can be argued that God can manifest in several forms with no form being one of them,1729,2
He hadnt seen his mom in months so he surprised her like this,1730,2
There’s a solar farm in China shaped like a Panda,1731,2
Blizzard time lapse,1732,1
TIL while waiting for his audition for The Office John Krasinski was telling someone about how he was worried the producers were going to screw the show up because of how great the British version is The person he was talking to was Greg Daniels the shows executive producer,1733,2
Image topped coffee maker,1734,1
My wife leaving money for her sister,1735,2
TIL about Smoky the Yorkie a pet dog to soldiers in the south pacific weighing 4lbs who kept operational 40 United States fighters by running a wire tied to her collar through a 6in pipe completing a 3 day construction job in minutes Also had 10 recognized combat flights 8 combat stars,1736,2
UPS man is Snow white,1737,7
screw led lights,1738,7
What are you gonna do Shoot me,1739,6
The snowice in this pic looks like the ocean,1740,2
Kratos right now,1741,4
Honestly 200+ IQ on youtubes side here,1742,1
This epic guardy boi I saw in Ireland,1743,4
Photo I took of a lake through the lense of binoculars looks like a planet,1744,2
just enjoying the music,1745,2
After 18 years of being told ‘No pets’ by my mum today I adopted my first kitten,1746,2
The Feds Are Now Investigating The Millions Of AntiNet Neutrality Comments Filed With Stolen Identities,1747,2
Everyones reaction to the new Kim Possible,1748,2
Miss getting this kind of stuff with the game,1749,2
Hair Mask,1750,2
Never give up,1751,2
I’m gay,1752,2
He hides the pain he brings the pain,1753,2
Coconut octopus clams up,1754,3
I literally could not think of any car less “compact”,1755,2
A six year journey,1756,2
This black cabin floats above the Norwegian landscape,1757,6
Prosecutors Michael Cohen acted at Trumps direction when he broke the law,1758,2
One of his better qualities,1759,2
Donald Trump Jr reportedly hiding in Canada from media as Mueller indictment looms,1760,2
Dog waited weeks for owners at home burned in Camp fire,1761,2
In a new study involving people over 70 who have exercised regularly for years scientists discovered that the participants hearts lungs and muscles were in equivalent shape to those of people in their 40s,1762,2
Oof Profacts,1763,6
Northern Michigan seals the victory with the first goalie goal in program history,1764,2
What strange thing did you find out about someone else that they thought was perfectly normal,1765,2
My girlfriend holding the moon,1766,7
First Image of Stealth Suit SpiderMan in ‘SpiderMan Far From Home’,1767,1
To write a math question,1768,4
Oof,1769,6
Otterly adorable,1770,2
The UPS man is Snow White,1771,7
Revive the format,1772,2
Cuddling with my forever Mommy this is Mocha the very first day we adopted her,1773,2
An Englishman a Scottish man and an Irish man all walk into a pub with their wives,1774,7
Ok this is epic 75 MILLION 9YEAROLDS,1775,6
Blind & Deaf  he’ll walk through the yard up the steps across the deck and through the open door It almost seems like he counts his steps and uses the transitions along with smell to get him where he needs to be,1776,2
Theories on why we havent found alien life yet,1777,1
Man talks about his childhood,1778,2
🔥 Hawk stealing a honeycomb 🔥,1779,2
An insecure toilet door,1780,6
Blep,1781,3
Netflix,1782,2
US President Donald Trump on Saturday renewed his call to end a federal probe into Russian election meddling describing the investigation as a “witch hunt” a day after US prosecutors detailed a previously unknown attempt by a Russian to help his 2016 presidential election campaign,1783,2
ExEPA chief Scott Pruitt used personal email for government work,1784,2
Wait a minute,1785,2
Here in Finland we only get snow on the highest mountains,1786,2
Our pup found his favorite section at the pet store,1787,2
Almost winter in Norway,1788,2
Answering lifes most important questions,1789,2
Train Vs Snow,1790,2
Ill come back later,1791,2
TIL that a female Giant Pacific Octopus can lay 50000 eggs She quits eating and spends six months slowly dying as she tends to and protects them On average only 2 out of the 50000 baby octopuses survive,1792,2
Hes Baaack,1793,2
LPT request  Do not request one hour dry cleaning if you can help it,1794,8
Steelworker touching the tip of the Chrysler Building  1931,1795,1
Wait for it🐶,1796,2
Me irl,1797,2
Just one of those days,1798,2
hmmm,1799,2
When I picked these up the person at the register asked if the kids would enjoy it I said yes There were no kids,1800,2
Swords,1801,4
TIL there is a grizzly bear in Banff Canada thats name is Boss; he has been hit by a train 3 times eats smaller black bears and elk and has never cause any harm to people and lives in town,1802,2
This mother literally carries the family,1803,2
Just keep running just keep running,1804,7
The Mozarts,1805,6
JJ Watt calls out his own team 😂,1806,2
We are doing our part from Hungary👊👊,1807,2
Does anyone else press later every time when an app asks you to rate it because never ask again sounds too harsh,1808,2
Bunch of garbage,1809,4
The United States of Horror Movies,1810,2
To stereotype a body builder,1811,1
To become a better person,1812,2
Water reflections,1813,6
Lockpicking Lawyer attempts to break into a bike lock causes a small explosion,1814,2
Rest in peace little one,1815,2
Man casually and successfully performs the Heimlich maneuver like a boss,1816,2
pupper hug,1817,1
what the actual fricking frack happened to your office,1818,2
Surprise,1819,2
[Image] Truth,1820,1
Senator who dared Philippines Duterte to do drug testing faces jail time in Davao City(dutertes bailwick),1821,4
My kids are having a sleepover with a friend at our house I bought Super Smash Bros Ultimate and they love it With 3 girls it’s hard to be the hero in things they’re interested in However when I unlocked Peach there was a roar of girlish glee and cheers Loved this game in 1999; love it today,1822,2
The common street scene to the people who live near Mount Fuji,1823,2
hmmm,1824,2
🔥 Rainbow Lattice Sunstone 🔥,1825,2
Top Post Of All Time Thank You Please Be Gentle With My Corpse,1826,2
They be mad like you insulted their ancestors,1827,2
White House in a state of chaos as Trumps chief departs,1828,2
[homemade] charcuterie board,1829,9
Filing the daily report,1830,2
How they filmed Sherlock Holmes,1831,8
Opening the Battlefield V menu changes my keyboard lightening Nice one Dice ],1832,1
Trump would have made hundreds of millions of dollars from Russia for Trump Tower Moscow Mueller filing reveals,1833,2
Special counsel says Paul Manafort lied on a variety of subject matters,1834,2
Turning girls gay,1835,2
We dont do that here,1836,2
Watching Bethesda constantly screw up,1837,2
LPT How to die alone,1838,2
YouTube really dosent care about our troops,1839,2
Researchers tested more than 500000 chemical compounds for their ability to inhibit the malaria parasite at an earlier lifecycle stage than most current drugs finding 631 promising ones that could form the basis for new malaria prevention drugs which they are making open source and not patented,1840,1
Caption this,1841,4
Meirl,1842,1
Jari Shoot those commies,1843,6
I (28M) with fiance (27F) about a month ago overheard her tell a friend her previous Ex was the best lover she ever had,1844,2
Brand new versatile format Invest now,1845,2
Today begins the rest our life,1846,2
Start your day with some quality,1847,2
In the movie Alien Covenant during the scene when the evil android David recounted his act of planetary genocide the deployment of the genetic bioweapon was shaped like the helical strand of DNA,1848,1
Jaiden covered everything Rewind was supposed to cover in literally one second,1849,1
me_irl,1850,7
Kid Rock paid off all the layaways at a Walmart in Nashville,1851,3
Journalist doesnt know Bretagnes flag and goes for the stupidest interpretation possible,1852,2
I’m no longer a 15 year old virgin,1853,2
Godspeed Jaiden,1854,4
Video game effects added to swordplay,1855,1
Jänïtår the keeper of keys,1856,5
Mom fighting leukemia gives birth to twins after finding perfect bone marrow match thanks to viral video,1857,5
Video Game Section at Goodwill Starter Pack,1858,1
Not My Pic But damn its awesome,1859,7
Chill capybara with a mandarin on its head,1860,1
The percentage of likes to dislikes for each years YouTube Rewind [OC],1861,2
Toast sandwich,1862,5
COLOssAL WaRrior turTLe frAcTuRes MANS lEG fORcinG hIm tO SurreNDEr,1863,5
oh no not the dinosaurs,1864,7
Exposed,1865,3
Delivery friend,1866,2
End of the Line Digital 1200x1600,1867,7
A year ago i was in a bad car accident My vehicle landed ontop of my pelvis split it in two and shattered my hip socket I was trapped for 40 minutes at 1030pm the temp was 20°c and i had a 6 hour surgery the next day Today I celebrate being Alive,1868,2
1 carwash pls,1869,1
A lion A tiger and A jaguar playing together,1870,2
ThEreS oNe THinG thIS viDeO nEeDs,1871,2
woof_irl,1872,5
My playing cards drawer,1873,3
Santa punisher of the naughty,1874,0
PsBattle This Hawk and a honeycomb,1875,2
I owe my future and life to this girl Met her at a dog park in Las Vegas over 1000 miles from home Her owner and I fell in love after that night We are now getting married buying a house and we just had a baby Matchmaking puppers let me finally live my fairy tale 💗,1876,2
This cute chonker,1877,2
Three land dolphins,1878,2
This is a POTG where Reinhardt scares Sombra into the water,1879,6
their morning trainings,1880,2
Didnt know what he was doing until looking further,1881,2
You have my permission,1882,6
Motherly love,1883,2
Shell oil executive boasts that his company influenced the Paris Agreement,1884,2
Animatronic Nightmare,1885,6
We’ve come full circle,1886,2
The Hateful Eight | RDR2 Quick Edit,1887,2
Travelling Faun Digital 1994x3370,1888,7
Can’t touch this,1889,2
Fun vdeo,1890,2
True Centrism,1891,2
‘12  ‘15  ‘18  ‘19,1892,6
A tiny mite,1893,2
This is Mr Banks He was used as a bait dog before some amazing people rescued him and now hes a therapy dog that brings joy to so many people,1894,2
Giving this another try,1895,2
SpaceXXX,1896,4
Show me Grandfather and I Will finish what you started,1897,2
Why I can’t use treats to get a photo,1898,2
When entering planes your banner icon should appear on the wings and tail,1899,5
Reee,1900,1
The Itchy & Scratchy cartoons are the same quality and style as all the other characters in the Simpsons World so to them it must be hyperrealistic and extra gory No wonder the parents hated it so much,1901,2
WellThat is better,1902,8
Anime_irl,1903,7
Dem Cohen filing means Trump committed two felonies,1904,2
A goat herder tried to rob me After killing him and looting his home I came back outside to discover the goats has turned on him (RDR2),1905,2
Elon Musk says Boring Company tunnel under LA will now open on Dec 18,1906,2
Nanny,1907,5
It makes me so happy for Jeremy Renner that Hawkeye has gone from people’s least favourite Avenger to having him be one of the main things people want to see in the trailers and next Avengers,1908,2
Pls dont feed me,1909,3
Should have paid better attention in school,1910,2
Trump’s Justice Department just implicated him in directing a felony,1911,6
I made this crochet Niffler ),1912,2
He has a point but whats his problem with Karen,1913,2
[Just Cause 4] Perfectly Balanced,1914,2
Hes not even subtle about it,1915,2
Barber gimme that covfefe cut,1916,6
And that professor’s name Why Albert Einstein of course,1917,2
I love the way Mom explains this in Calvin terms,1918,2
Let it go its not worth it bud,1919,6
me_irl,1920,7
Following your Childhood Dream is basically letting an immature and less educated version of you decide your future,1921,2
Dobbys First Christmas,1922,2
Lady and her fox,1923,2
Hang gliding above the cloud,1924,7
Guess who’s healthy Jing Jing Jamestown and Beverly are,1925,7
The real reason why Valve made CSGO free to play,1926,2
[I ate] mille crepe cake and gateau aux marrons cake,1927,0
I am very ready for this,1928,2
How does it stay balanced for so long like that,1929,2
Congratulations you deserved it,1930,8
Their armor is thick and their necks broad,1931,6
When I step on my sons lego and my wife asks did that hurt,1932,2
me_irl,1933,7
[Image] The Smallest Step,1934,4
Tonys new suit carfted from spareparts lying around,1935,2
I’m a sled now,1936,2
How do you do,1937,0
How Virtual Assistant names change Baby names [OC],1938,2
Is it that difficult to buy a bag,1939,8
When two satellites from the Galileo global navigation system were accidentally launched into elliptical instead of circular orbits physicists were able to use their orbiting atomic clocks to confirm Einstein’s theory of relativity even though the satellites weren’t designed to do the experiment,1940,8
Sharing secrets,1941,0
2000 IQ,1942,1
The Man cant get you down if you have an imaginary clown girlfriend,1943,7
Old people NextDoor,1944,2
Cards against hunmanity,1945,2
Get a dog they said Merry Christmas,1946,2
This is everything I have phobia from being stuck underground underwater in a tiny cave chased by a predator fish in the risk of either being crushed to death drown or get eaten by a fish,1947,2
Macklin gets a little excited about squirrels,1948,2
shes doing her part ,1949,2
Failed Prince of Failed Fail,1950,7
Nae kissing under the mistletoe for they two,1951,1
Its my duty sir,1952,8
Donald Trump blames the Paris climate agreement for the violence in the French capital,1953,2
All 3 Baskets,1954,2
Theyll never know its me,1955,2
How Louisiana Stays Poor (2018) “With all Louisiana’s in natural resources and industry why do we stay poor [1525],1956,2
Rare footage of Arctic adventurers trying to tame a wild shovel,1957,2
If you dont like the Suns you dont like NBA basketball,1958,2
Teachers of Reddit what’s the funniest thing you’ve heard a student say that you unfortunately had to punish them for,1959,2
Lets give the people what they want,1960,2
Planes,1961,5
St Bernard’s were bred to be avalanche rescue dogsthen there’s this little guy,1962,2
It was such a nice house too,1963,2
Wholesome turned bad,1964,8
[Poetry] YouTube Rewind 2018 was BAD,1965,2
They should add a YouTube Rewind flair,1966,1
Frenchman explains the riots in France,1967,2
I made a model of the House map for a school project,1968,2
This is not exactly how i remember it,1969,2
An unexpected friendship,1970,3
This teacher has a chart for the kids to choose on how they wanna be greeted,1971,7
Every time I see news coverage of a protest I remember this image of a single overturned trashcan in front of The Washington Post building,1972,2
Next question,1973,2
My local bar has a drunk test for people leaving,1974,2
I got to snuggle with a capybara,1975,2
The slap,1976,5
TIL director Peter Weir wanted to have cameras installed in behind every theater showing ‘The Truman Show’ and have the projectionist cut the power at some point during the film cut to the viewers so theyd be watching themeselves and then cut back to the movie,1977,2
I was gonna say friendship goals but this is humanity goals,1978,2
Best artwork at my office was just a window,1979,2
US Saudis and Russia block climate report,1980,2
Costa Rica went 300 days using only renewable energy beating their own 2015 record of of 299 days on renewable energy,1981,2
My roommate painted ornaments of everyone in our house,1982,2
The ever elusive Narwhals in the Canadian Arctic where its home to ~90% of the population Photo taken by Paul Nicklen,1983,2
Dad and son squirrel hunting when an interested deer came up to say hi,1984,2
Whats in the box,1985,2
The truth,1986,1
TIL electricity was first installed in the White House in 1891 It was such a new concept that President Benjamin Harrison and his wife both refused to touch light switches due to their fear of electrocution so the White House staff had to follow them around and turn the lights off and on for them,1987,2
Harvested some bananas that grew in my backyard I guess success,1988,2
Im a nursing manager at a healthcare organization A former acquaintance I haven’t talked to in years reached out in response to my post about looking for help for a CNAMA position and then I ruined her Christmas,1989,2
Facebook Employees Are So Paranoid They’re Using Burner Phones to Talk to Each Other,1990,7
Puppys first time at the beach and he couldnt stop smiling,1991,1
The Unit Circle [OC],1992,0
Absolutely no way,1993,2
Its not my sport,1994,9
13th century church doors in Gloucestershire,1995,4
Hes ready to meet Santa,1996,2
The goodest boye,1997,2
Patrick Stewart on TopGear,1998,2
Work smarter not harder; correcting chopsticks,1999,7
Busses carrying pilgrims in Mecca looks like cassette tapes,2000,2
The way this snow stayed in place when the trunk was openedclosed,2001,2
Vaccines don’t kill children ______ kills children,2002,2
I live alone and had to change my duvet cover I filmed it Worth,2003,2
Voice actors,2004,8
The story we deserved but didn’t get,2005,2
A mom was wondering where her son had gone  she found out that he had seen an elderly neighbor walking in the rainstorm without an umbrella He walked the neighbor all the way home,2006,2
Senate Republicans are responsible for the most unethical and incompetent administration ever,2007,2
Poor guy,2008,2
Local news catches scamming tow truck companies and gets state investigators to swarm in realtime for instant justice,2009,1
Quite wintry night Quebec city,2010,6
TIL Alcoholics anonymous cofounder Bill Wilson experimented with LSD He found the experiences to be so life changing that he considered the use of LSD as a step of AA He then removed himself from the AA governing body after backlash,2011,1
Sam Adams knows whats up,2012,2
To wrap up the year I made a 4K wallpaper out of my favorite astrophotos taken throughout 2018,2013,2
The yt rewind sums youtube shis year,2014,1
LeBron James surprises the assistant equipment manager for the Grizzles with his game worn shoes after the win in Memphis,2015,1
Sign Me Up,2016,2
hmmm,2017,2
$35 Trillion on Healthcare Each Year and We’re Still Uninsured Underinsured and Unhappy,2018,2
Legless Superman,2019,7
At least you were wearing socks,2020,2
[Highlight] Dolphins score on the final play to beat the Pats,2021,2
When youre not tall enough for the ride,2022,7
Oh come on now,2023,7
My grandpa realized he was having a stroke and gave my grandma a huge hug right before he died,2024,4
When your voice isn’t high enoughhelium,2025,2
Fast Food workers whats an item people should absolutely stop ordering from your restaurant,2026,2
To correct someone,2027,2
2meirl4meirl,2028,2
Dont wanna ruin the plot,2029,8
Comey Testified That We’ve Become ‘Numb’ to Trump’s Lies,2030,8
Burned my hand by leaning on freshlydriven Phillips head screw,2031,1
Five generations of women in a family,2032,2
Dr Mantis Toboggan Gifologist,2033,1
This tweet didn’t age well,2034,2
Photobombed by a bee,2035,2
Melbourne  Australia Doing our Part,2036,2
An Alligator bellowing This is also how they got some of the sounds for Jurassic Park,2037,2
Ramen by Kenze Wee Hon Ming,2038,9
Nobel laureates dismiss fears about genetically modified foods,2039,7
$0 it is,2040,3
Deaf people of Reddit when did you find out that farts made a noise,2041,2
My husband after he cut our daughter’s umbilical cord this August,2042,6
Any Portal fans over here Hope you like my cosplay,2043,2
PsBattle this cute retrievers face perfectly centered behind a decorative cast iron fence,2044,2
Uber drivers cant file class action lawsuits so 12500 drivers filed individually for 3rd party arbitration,2045,2
Cops were called on us so now we gotta do a match with them,2046,2
I wanted a dog; my husband wanted a cat because dogs are too needy So instead we got a cat who wont leave my side and loves when I hold her little paw while she sleeps,2047,2
I farted and my dog moved to the far side of the sofa and has been looking at me like this since,2048,2
TIL Anna Bagenholm survived the lowest body temperature ever recorded at 567 F (137 C) She had been skiing when she fell through a frozen stream and became stuck for 80 minutes Despite being clinically dead she made a full recovery and is now working at the same hospital that saved her life,2049,2
Fresh Guacamole,2050,2
Andy Serkis just posted a video of himself doing the Gollum voice while dressed up as Theresa May,2051,2
A spirallike aurora,2052,8
Its a breed of goat known as the Shami,2053,4
Fallout logic,2054,2
My grandpa looking suave in the 1940s,2055,8
hmmm,2056,2
