Title,doc,topic
Mail Bombs Are Killing People in Texas but Donald Trump Hasn’t Said a Thing There’s a Reason for That,3691,8
PsBattle Cat coming out of a swimming pool,3692,8
This trip bites,3693,8
I yakked I bet she did knot,3694,8
Roses are red my PC is overclocked,3695,4
Holy hypocrisy Evangelical leaders say Trumps Stormy affair is OK  Robert Jeffress pastor of the powerful First Baptist Church in Dallas assured Fox News that Evangelicals know they are not compromising their beliefs in order to support this great president,3696,2
Gimme five dude ,3697,8
Flake Never has a party fled beliefs as quickly as GOP under Trump,3698,2
[WP] The last remnants of humanity collectively put themselves into a suspended state of sleep with AIenabled androids repairing the planet When revived the world is completely healed there seems to be magic and new sentient species abound The androids are revered as longvanished gods,3699,8
We’ve now discovered that spending a year in space can change your DNA  What does this change about what we thought we knew about DNA,3700,2
Perfect Loops,3701,6
Steve Bannon Says He Doesnt Deny Anything That Michael Wolff Wrote About Trump In Fire And Fury,3702,2
[Request] If a humans eyes were this big how much room would they have for a brainother organs and systems,3703,2
This hurts my soul,3704,7
Putin critic who warned he was on Russian hitlist was murdered police confirm,3705,2
Two kids pose for the camera at Hong Kongs Quarry Bay,3706,8
I made a Doom Logo in my metalshop class what do you guys think Its not done yet,3707,8
TIL Socrates was very worried that the increasing use of books in education would have the effect of ruining students ability to memorise things We only remember this now because Plato wrote it down,3708,2
A pub in Dublin Ireland getting ready for St Patricks day,3709,8
Ghanaian teacher who Taught his Students How to use mS word on a blackboard gets computers donated to his school,3710,2
Baby penguin hugs his caretaker,3711,8
My wife makes wedding bouquets out of old comic books I figured Reddit would enjoy them,3712,2
Britain is now threatening to seize Russian oligarchs luxury real estate after exspys poisoning,3713,2
After eating Chipotle for 500 days an Ohio man says hes ready for something new,3714,8
Kill it Kill it with fire,3715,7
TIL of Robert Smalls a slave who freed himself his crew & their families by overtaking Confederate ship CSS Planter and sailing it north The ship contained a code book letting them pass CSA checkpoints He became new captain of the ship & convinced Lincoln to admit African Americans to the Army,3716,4
Marvel Studios Avengers Infinity War  Official Trailer,3717,2
Black Panther sequel,3718,7
An accurate look inside my daily morning ritual of posting gifs on Reddit and Imgur,3719,4
Girl With Muscular Dystrophy Makes Amazing Paintings,3720,6
Dungeon Masters of Reddit what is the most surprising thing your players have done ingame,3721,8
Marvel Studios Avengers Infinity War  Official Trailer,3722,2
Everyones doing it,3723,3
Leaked scene from Pacific Rim 2,3724,4
This bridge,3725,4
You had one Job ,3726,8
Ready Player One (2018),3727,8
Help us find a cure by buying a mega jug,3728,8
TF2 problems,3729,2
Didnt knew shredding could do this,3730,8
Hippie Dad walking with his daughter in Amsterdam 1968,3731,4
Humans being bros in rwouldyourather,3732,7
Weve been working on FAR Lone Sails for two years now and are finally releasing it this spring  Its a puzzle adventure where your only friend is this rickety vehicle,3733,8
Sayisnt he that actor,3734,8
Wisconsin legislator to propose banning marijuana tests for most jobs,3735,4
PsBattle Baby Groot finds a gift,3736,8
Trump decides to remove national security adviser and others may follow,3737,7
Earlier people used to write personal stuff in their diaries and get mad when people read them Now people write personal stuff on social media and get mad when people DONT read them,3738,8
Vanessa Trump hires criminal defense lawyer in divorce from Donald Trump Jr Report,3739,7
Give a man a gun and hell rob a bank,3740,4
Staple City,3741,2
Do it,3742,0
RIP Caesar,3743,2
Inverted Mouse,3744,7
Amateur Canadian scientists discovered a new type of northern lights and promptly named it ‘Steve’,3745,8
Unlicensed Forklift Operator,3746,7
Stormy Daniels attorney says his client was threatened physically,3747,1
It would be a generous 30 minutes,3748,8
GASP HISSSSS,3749,9
I handcut this then framed it for a friends birthday (Idea found on Pinterest),3750,6
Trampoline,3751,3
Apparently this was the best photo they could get for my first Christmas,3752,8
Montage of Fox News blasting Obama for stating he would speak with North Korea and Iran and then praising Trump for doing the exact same thing,3753,2
People are dying because we misunderstand how those with addiction think | a philosopher explains why addiction isn’t a moral failure,3754,8
Oklahoma Senate votes to wipe out tax break for the wealthy potentially saving $120 million a year,3755,4
🔥 Army ant bridge collapses then recovers GIF,3756,4
Curious cows investigate a strange visitor in their field,3757,4
damn I just wanted a lottery ticket,3758,2
Avengers Infinity War Poster,3759,2
New format,3760,7
This is how I die,3761,4
me irl,3762,1
They Besieged a giant face hugger,3763,2
Chinese Invisibility Cloak Hoax DESTROYED,3764,5
🔥 Polar Bear goes after a seal chilling on ice,3765,8
Good girl runs to get the mail,3766,8
No longer alternative mainstream renewables are pushing prices down  While the government insists that renewables have made our grid unreliable lights have stayed on and prices are dropping,3767,4
PsBattle Trump putting hand on wrong knee,3768,8
Everyone this is our new world leader please welcome her and make her feel loved and appreciated,3769,8
Boom Roasted,3770,5
Bens lightsaber falls from Reys hands and it spins at his feet giving him an idea how to kill Snoke,3771,7
When you down the crate guy,3772,8
hmmm,3773,2
Luke calling the force lesbian lol,3774,4
Knock knock joke Thats a good trick,3775,8
MRW my computer tells me I need administrator access,3776,8
Are oil memes worth investing,3777,2
Ready Player One Disney DID Allow STAR WARS,3778,8
OhHi,3779,5
Trump decides to remove national security adviser and others may follow,3780,7
China to bar people with bad social credit from planes trains People who would be put on restricted lists included those found to have committed acts like spreading false information about terrorism and causing trouble on flights as well as those who used expired tickets or smoked on trains,3781,2
Made this fanart of my alltime favorite Pokemon,3782,7
wtf is wrong with HIM,3783,8
In CSU lab laserheated nanowires produce microscale nuclear fusion with record efficiency The work is detailed in a paper published in Nature Communications,3784,8
A Magical Moment in Motherhood,3785,2
The ultimate game of hide and seek,3786,1
Sweet sweet home Alabama,3787,8
Rescuing a stray pup,3788,4
Yellow digital 5000x5000 px,3789,8
My new laptop can change gears,3790,1
Fortnite Editing Walls,3791,4
This Spongebob and Patrick Wallpaper,3792,4
Im so sick of Linus lies,3793,4
Why is 0 = 1,3794,2
Andys Got Talent,3795,8
Cozy little corner on the top floor of a mountain cabin,3796,7
Sgt 🚽 on Duty,3797,2
The charging icon doesnt line up with the charging port,3798,4
Whats the worst example of poor financial choices youve witnessed,3799,7
Skydiver suffers seizure midair,3800,1
LeBron James posters Jusuf Nurkic,3801,1
The trailer release date was under our noses THE ENTIRE TIME,3802,8
Moana cosplay,3803,7
[Homemade] Atlantic Cod & Caper Fish Pie,3804,7
Use facebook manual,3805,8
Apple vs Apple,3806,1
Traveled ~~millions~~ thousands of miles just had to stop off here,3807,7
How to be a cool kid,3808,8
A starlings final moments,3809,0
Me🚨irl,3810,5
Cat and baby,3811,8
Whaaaaa,3812,6
[Poetry] How United Airlines Transports Your Dog,3813,8
Assaults increased when cities hosted Trump rallies Cities that hosted a Trump campaign rally saw an average of 23 more assaults reported on the day of the event than on a typical day No such link was found for Hillary Clintons rallies,3814,8
LPT if you think someone is following you make a turn into a dead end alleyway If they follow you into the alley you’ll know for sure that they’ve been following you,3815,8
Literally the Best Torbjorn POTG You Will Ever See,3816,8
I Actually Kinda Like This,3817,8
From day of rescue to one year of being adopted,3818,8
Dog running to retrieve the mail,3819,8
2meirl4meirl,3820,9
Taking advantage of a poorly worded question on a music History test,3821,8
Hello Daddo welcom home I was a v v v good boye while you were gone,3822,2
Fox News incredible ObamaTrump hypocrisy in 1 damning video,3823,1
Scratching some itches,3824,7
I thought this might fit here,3825,2
This is not what I needed to see first thing in the morning,3826,8
HMRB while I do a backflip,3827,5
Cookies on cookie,3828,6
Entering the theatre for iron man | entering the theatre for infinity war,3829,2
Careful Gru You’ve Got Competition,3830,8
Tried to recreate the feeling I had watching Pokemon 2000 in theaters as a kid,3831,8
No bullying guys Hila is on duty,3832,2
Meet Max the newest addition to the family He’s nothing fancy but I think he’d a very handsome guy,3833,8
when people say pewds isnt multicultural,3834,4
At 50 years old I still have my quick precise aimbotlike skill 25 years of FPS experience on display here,3835,4
Everyone going out for St Patricks day tomorrow,3836,8
Oh Im sorry,3837,0
The Squad Lookin Good,3838,8
TIL of Samoset the first Native American to make contact with the Pilgrims of Plymouth Colony He entered the settlement unannounced greeted the colonists in English (which he had learned from fishermen in Maine) and asked for beer,3839,8
Okay im ready,3840,4
What social norm has never made any sense to you,3841,8
Dog and Tortoise,3842,8
A guide to regional pizzas,3843,0
Feel the power of the quench,3844,2
In a world where you can be anything be kind,3845,8
The 8 on this card is upsidedown,3846,2
Dont sneak up on me like that,3847,2
Met one of those guys from the math problems tonight,3848,2
My kind of marathon,3849,8
From 20152018 weve driven a lot of miles together,3850,8
The longer you look the more uncomfortable it gets,3851,7
ELI5 Why do soft baked goods go hard when they get stale and hard baked goods go soft when theyre stale,3852,8
Correction TrumpCIA story,3853,1
Hello There,3854,3
“The man exudes sex“,3855,4
User claims they rescued a dog,3856,8
One handed half court Hail Mary,3857,8
Quick bite for a slow creature,3858,4
When life gives you limes [OC],3859,7
Court Overturns ObamaEra Rule on Retirement Planners,3860,6
﻿ＡＥＳＴＨＥＲＩＣＫ,3861,3
Meat vs cat = 10,3862,8
Have you ever been this comfortable,3863,6
Just bought my first house Current state of the living room,3864,8
Fallen from the sky gold bars in Yakutsk found laying in the snow Some people are just lucky,3865,2
After years of waiting i finally got a dog Say hi to oliver Hes a bit shy,3866,8
TIL that in Kenya elephant poop is being used to make paper Elephants poop up to 50kg a day which can produce 125 sheets of paper This helps save the indigenous tree population and forest from being destroyed along with creating a need for the 7000 elephants left in Kenya,3867,8
TIL that in the late 1700s and 1800s there was widespread panic about the evils of bookreading which was described as “an outrage on decency and common sense” People were concerned that avid novelreaders were ‘addicted’ and were becoming antisocial,3868,8
me irl,3869,1
Put that sign in windows boss,3870,8
Therepy,3871,4
Aaaaas yooouuuuu wiiiiiiish,3872,3
Unwinnable by design (Xpost BetterEveryLoop),3873,2
TIL Brad Pitt believes he has Prosopagnosia or face blindness,3874,2
Yesterday my Fitbit app forgot how to draw circles,3875,8
When a cheater cant control his power,3876,2
Sticky surprise,3877,8
Actual image of Chinese city Shenzhen at night,3878,2
Adam you really know how to make a guy mildly chuckle Well done,3879,8
When you cant handle the recoil,3880,8
To be discreet,3881,5
Apparently the AntiDoping Agency hasnt caught onto the AntiGravity Pill yet,3882,4
In medieval Britain if you wanted to get ahead you had to speak French,3883,2
Train scale model,3884,4
Matt Foley Lives,3885,8
I turned 32 years old today,3886,8
Home alone 💦,3887,8
As a store manager I always post or write a motivational quote under the lunch schedule Today I printed one and stapled over it,3888,8
This Bull Truck I saw in Houston Yes that is fuzzy leather,3889,8
ELEANOR RIGBY by The Beatles but as a BATTLE THEME,3890,2
Take all of my moneys,3891,1
I just solved the adpocalypse,3892,5
Marvel Studios Avengers Infinity War  Official Trailer,3893,2
Thousands of people in Rios city council in honour of Marielle Franco councilor and activist that was executed after denouncing corrupt police officers Her voice will not be silenced We demand justice,3894,2
Monkey about scares himself to death,3895,4
Dr Betty has been practicing veterinary medicine for 44 years and for the first time today a patient came in with her exact hairstyle,3896,8
Anime_irl,3897,2
If its too good to be true give it a shot anyway I found 6991 for $15,3898,8
White JoyCons w Colored buttons,3899,4
major turn off,3900,8
Those are just bathroom tiles with windows painted,3901,8
90s kids remember,3902,8
Classy,3903,8
This flip,3904,5
Maine House candidate who insulted Florida teens drops out of race,3905,8
Boxing referee Steve Willis really loves his job,3906,8
Otters sleep belly up in water often holding paws with each other to avoid being separated by the currents,3907,2
Made a Ghosttype eeveelution Eterneon (Pokémon),3908,7
Got removed from rprequelmemes,3909,8
yawning bunny,3910,1
HR McMaster likely to lose job; John Kelly could resign today,3911,8
Someone unplugged something and now the office internet doesnt work,3912,2
I just read my first SciFi Novel Do Androids Dream of Electric Sheep,3913,7
Castle Pixel the developers of Blossom Tales avoids closing down after Switch revenues surpass Steam revenues by 20 times,3914,2
So we bought some catnip bubbles he’s turnt,3915,4
Bootiful snekkk,3916,3
I didnt know there was this much green in the whole galaxy,3917,7
Georgia Republicans are trying to eliminate Sunday voting to suppress black turnout,3918,7
Mapping relationships between Twitter bots,3919,6
So I said a while ago to a few of you that I was building a room in my garden where i was surrounded by plants and was asked to share when I’m done Here it is Obviously things need time to grow fill out ect and that takes time but I’m pretty happy with how it’s turned out 🌿,3920,8
Huh,3921,7
Everytime you try to clutch,3922,8
Rocket riding on a rocket ride into a sniper kill,3923,8
TIL Disney does not own the rights to show big Marvel characters (Avengers,3924,2
A couple weeks ago I saw this post of a Totoro cake I tried making one for a friend’s birthday Also by the time I realized I forgot his whiskers it was too late to add them (,3925,8
[Video] Astros outfielder George Springer who is very open about his stuttering gets interviewed during Spring Training by a brave reporter with similar issues,3926,7
When Chinese memeing their hacker problem,3927,8
3D printing has changed the game for prosthetic limbs,3928,1
This woman is trying to sell Herbalife by using her pregnancy photos as before photos,3929,8
Thought your day could use a little Lando,3930,8
Star Trek The Meta Generation,3931,4
[OC][CC] Feel Good Inc,3932,1
Every morning she licks my nose to wake me up This morning I woke up to a blep,3933,7
No need to sign,3934,2
It’s here,3935,8
Amazon didnt kill Toys R Us Heres what did | Debt,3936,8
Still counts,3937,8
Basketball to the face,3938,2
Jeff Loveness shares his script punch up for Avengers Infinity War,3939,2
Scratching some itches,3940,7
Oh my bad,3941,8
Who’s a pretty girl,3942,8
Only good photo Ive ever gotten of my black cat,3943,8
History in the making,3944,8
This is fair,3945,1
A simple artificial heart could permanently replace a failing human one,3946,8
Irelia The Defiant Blade | Champion Teaser,3947,4
Cat taps the ground as it advances so it doesnt have to break eye contact with prey,3948,8
Ok the truth Whats your secret identity,3949,7
Tomasz Komenda was in prison for 18 years due to a crime he did not even commit Today he was declared innocent,3950,8
Gary Oldmans mother about to turn 99 hugs her son the morning after he won his first Academy Award,3951,8
Virgin Active just opened a gym near my apartment A for effort F for execution,3952,5
Dad cat brings baby separated from mom back to her,3953,2
You know what youre doing ill give you that Excellent form But hows your footwork,3954,2
I met this cat today who showed me how to pet her,3955,8
11 different brands of AA batteries tested in identical flashlights [OC],3956,7
First image leak of VWs selfdriving car,3957,4
Are we there yet,3958,2
KIdS FoRCeD ONtO TOrTuRE dEViCE UNtIL THeY DIE oF NaUSEa,3959,8
This persons handwriting,3960,1
Pulled a weed and it unearthed a lost tennis ball,3961,8
Madlad reuploads his own post then does it again then does it again,3962,2
TIL Robert Williams a Ford assembly line worker is the first human in history to have been killed by a robot He was hit by a robotic arm in 1979,3963,8
You could write a popular show by releasing a cryptic big budget highly promoted teaser trailer and then lifting all the major plot points from fan theories on the Internet,3964,8
Who cares,3965,0
ExCIA director slams Trump after McCabe firing Youll be remembered as a disgraced demagogue,3966,2
Disappointment,3967,8
hmmm,3968,2
She was gone for 2 weeks,3969,4
Youtuber “Samcrac” buys salvage Domino’s DXP pizza delivery car now threatened with legal action over fair use of leagally obtained property,3970,8
Netflix please stop with the autoplay of trailers when were trying to browse the titles,3971,7
Megathread Former FBI Deputy Director Andrew McCabe has been fired,3972,2
THATS WHY IT IS SOO HARD TO GET A JOB,3973,8
Elon Musk Predicts How the Martian Government Will Operate “Most likely the form of government on Mars would be something of a direct democracy […] where people vote directly on issues instead of going through representative government”,3974,2
Sometimes Chaz gets really sad and goes into koala mode when Mom and Dad are about to leave,3975,2
Solemates for life,3976,7
That’s nice,3977,8
Two girls practice their dance,3978,8
This hair dryer melts its own casing,3979,8
Playing Mahjong,3980,3
20 second Judge Judy case,3981,8
[SPOILERS] If Disney made Game of Thrones by Nandomendonssa,3982,2
Revealed 50 million Facebook profiles harvested for Cambridge Analytica in major data breach | News,3983,8
TIL George Lucas thought Steven Spielbergs Close Encounters of the Third Kind would out perform Star Wars so he proposed they trade 25% of the profit on each others films; Spielberg took the trade,3984,8
For the first time in NCAA tournament history a 16 seed has beat a 1 seed UMBC (16) beats Virginia (1) 74 to 54,3985,8
There was an Attempt to Cheat the System,3986,8
Police lay in wait at backdoor arrest 3 Costco thieves,3987,8
At the end of The Shawshank Redemption the DA who arrests Guard Captain Hadley reads the Miranda rights off a card This scene takes place in 1966 the same year as the Miranda v Arizona court case that required these rights to be read to a suspect upon arrest,3988,2
Digging Dirt is hard work fren,3989,7
Roses are red Hit me with a bus,3990,4
That Merch Though,3991,4
Things that are taken for granted until needed starter pack,3992,8
[Gang Beasts]Getting the hang of the physics,3993,5
The face of regret,3994,2
“I may use my computer skills to help humanity one day In the meantime I’m working on this”,3995,8
PsBattle A bird and a squirrel,3996,4
[Poetry] Practiced every day for 5 years,3997,8
How a fire sprinkler works (155°F = 68°C),3998,2
Never forget Skippy The droid who made Star Wars happen,3999,8
She was gone for 2 weeks,4000,4
😤 Just cuz it doesnt fit 😤,4001,2
Comey told 3 FBI officials about his conversations with Trump — all 3 have now been forced out or reassigned,4002,7
Xi Jinping reappointed as Chinas president with no term limits,4003,2
Circus act doesnt go as planned,4004,8
The Cup,4005,8
Dem offers to hire McCabe to help him qualify for his pension,4006,2
Wedding photo[OC],4007,2
Me irl,4008,1
MRW I spot someone walking over to pinch me because Im not wearing green on Saint Patricks Day,4009,4
Mows grass gets ass,4010,7
No,4011,0
12 years on disability 7 years sober 300lbs lost in 2 years and next week I move to NYC to start a new Job Keep looking up and keep moving forward,4012,8
My Fathers new job allows dogs in the office he said she spent all day going around getting cuddles from all the employees,4013,8
me irl,4014,1
Some things are faster than reflexes,4015,8
Fight the power,4016,2
How we can get the best looking ObiWan,4017,8
Open Mind Johnson Tsang Clay 2018,4018,7
Happy St Patricks Day,4019,8
Ants,4020,8
Pandas,4021,0
LPT If you have no goal in life become addicted to drugs Then make it your life purpose to get clean again,4022,8
James Comey just now Mr President,4023,1
2meirl4meirl,4024,9
TIL that Lorenzo Music the voice of Garfield would volunteer at a suicide hotline Callers would sometimes change their tone to remark Hey,4025,2
Accurate,4026,4
We all need this kind of seller D,4027,8
My friend just found his favorite year book photo,4028,8
[Homemade] Vietnamese Spring Rolls,4029,7
Teen scientist wins USD 250000 with late blight prediction model,4030,4
New MexicoColorado border,4031,8
TIL that the St Patricks Day tradition of dyeing the Chicago river green arose by accident when a group of plumbers used green dye to trace illegal substances that were polluting the river The dyeing of the river is still sponsored by the local plumbers union,4032,8
Whats the most WTF scene in an otherwise normal movie,4033,8
Mark who,4034,8
[Homemade] Pineapple Cake,4035,7
A Systematic Review Shows How to Maintain Sexual Desire in a Relationship Studies show that partners must both feel attractive and be attracted to their significant others This encompasses emotional and physical facets Emotionally confidence and attentiveness factor most into attraction,4036,1
Solenodon This bizarre venomous mammal that survived the asteroid that killed the dinosaurs has had its genome sequenced for the first time Scientists found the genus most likely diverged from other living mammals around 736 million years ago before the devastating asteroid impact,4037,8
We love our Lord Vader,4038,8
Someone on the Shakespeare subreddit check all my grammar on an essay and not only that he also gave me the rational behind each change which really did help with my knowledge regarding grammar,4039,2
Cool website that explains algorithms as if they are IKEA instruction manuals,4040,4
IAmA Bar owner on Paddys day in Dublin AGAIN,4041,8
Secret AList celebs of Reddit how ya doing,4042,9
I saw this and figured it belonged here,4043,8
Theres a nightmare in my boot,4044,1
The rerelease of Disneys Robin Hood looks pretty insane,4045,4
Nobody Like spOILers,4046,1
ELI5Why cant our teeth heal like our skin and bones,4047,1
Goliath and his legion of coward clones,4048,0
Retired fourstar Army general Barry McCaffrey Reluctantly I have concluded that President Trump is a serious threat to US national security He is refusing to protect vital US interests from active Russian attacks It is apparent that he is for some unknown reason under the sway of Mr Putin,4049,2
44 Mag vs Gel Block,4050,8
Pouring one out for toys r us,4051,8
When your whole squad leaves you to die in the storm,4052,7
MaN hIrEs HiTmAn On SeLf,4053,1
woof irl,4054,1
Thought this might belong here too,4055,2
White House staffer left email passwords on official stationery at bus stop report,4056,8
Tire testing machine,4057,8
And this is why I never leap on to the bed without checking first,4058,8
Unsure if other side effects,4059,7
Democrat calls for ‘open hearings’ on Trump administration after McCabe firing,4060,9
“I actually feel like Cinderella”,4061,1
Presented without comment,4062,6
Wood burning using ammonium chloride,4063,7
I Hope This Hasnt Been Posted Here Before,4064,8
Dropkick Murphys  Im Shipping Up To Boston [punk rock],4065,4
Worldwide Recognized,4066,5
Dat is MINE,4067,8
This girl’s mom just got destroyed,4068,7
These scientific names are so hard to pronounce sometimes,4069,8
Lobster bike,4070,4
TIL that on the set of Spiderman Homecoming Michael Keaton would troll Tom Holland by whispering Im Batman during fight scenes,4071,4
Toys R Us 1996,4072,4
YouTube now contacts authorities based on search results,4073,8
I forged a steel leaf here it is while its still hot ),4074,8
Weve all had this feeling getting a new game,4075,8
I am green,4076,8
Anytime someone talks about the weather,4077,2
Well thats rare,4078,8
Knock knock its the united states,4079,5
Put together a Ron Swanson Minifig this morning,4080,3
This book with its pages folded to say “Read”,4081,8
When Justice Has Officially Been Served,4082,2
TIFU by trying to have a dating life,4083,7
When your cat is having a bad day,4084,8
Like other formats but small differences Still invest,4085,8
Irish Boomerang,4086,6
Whackamole dog edition,4087,8
Meet Dude foster turned pet,4088,8
Drinking beer,4089,2
Facebook suspends Trumplinked firm Cambridge Analytica,4090,8
Me_irl,4091,1
Devils Bridge,4092,4
[WP] So they are a war species then,4093,8
Thicc meat,4094,8
Trump’s Lawyer It’s Time to Fire Robert Mueller,4095,2
Happy St Patricks Day,4096,8
Proud papa corgi,4097,2
Happy St Paddy’s Day ya filthy lads,4098,8
Attack Helicopter Mating Ritual 💏,4099,4
