Title,doc,topic
Ive lost a lot of weight a lot of sadness and a little facial hair Ive gained a whole new appreciation for life Remember to always love yourself,0,8
Therapy dogs waiting to welcome the Parkland kids back to school for the first time today,1,8
Father and son,2,8
From human to jellyfish,3,8
Undo undo undo,4,6
Canada Makes National Parks Permanently Free For Kids,5,8
The American food shelf at a local store in Finland,6,8
Vandalized Las Vegas billboard has ‘Shoot a Kid’ message,7,6
Shouldve stopped at four punches,8,8
The future is now,9,2
Jacksonville States Norbertas Giga who came to the US from Lithuania to pursue a basketball career sees his mom for the first time in 5 years,10,8
Woke up today to her just staring me down purring,11,1
Ultimate SniperAssassin,12,1
At least he’s honest,13,2
god damnit brad,14,2
Avengers Infinity War release date has been moved to April 27,15,2
My girlfriend likes to cut my sandwiches into weird shapes just to watch me suffer,16,3
In Lego Star Wars if you disable ingame music the Cantina band will stand around looking confused,17,1
Love the IT Crowd,18,2
Gravity is creepy when you realize you’re not walking around on a surface but getting pulled into a burning core of magma,19,7
Good friend actually manages to kick bottle on friends head without accidentally kicking his head,20,8
Worlds smallest fidget spinner,21,1
PsBattle This Photo Shoot of a Dog,22,8
Mayor of San Jose looks like Prison Mike,23,2
A very satisfying hologram [Titanfall 2],24,9
Austrians can swear or make obscene gestures at politicans court rules,25,8
please,26,7
Up you go fren,27,8
Harden drops Johnson then hits the three,28,4
She now refuses to travel anywhere at all,29,7
me_irl,30,1
Dog deemed ‘unadoptable to become firstever deaf K9 in Washington,31,8
16 yards of aluminum foil balled and hammered,32,8
Yep,33,0
Basketball player who came to the US from Lithuania sees his mother for the first time in 5 years,34,8
This perfect story in three panels of my cousin,35,8
Joan of Arc wood stain markers and acrylic on skateboard 8 × 32,36,2
Listen these hoomans will give us treats if u sit,37,1
Cows are real bros,38,4
MRW Im browsing Reddit on my desktop but feel that its time for my midafternoon poop,39,4
FBI counterintel investigating Ivanka Trump business deal,40,7
“Excuse me sir but I do believe you’ve dropped your wallet”,41,8
My brother is a glaciologist who does ice core drilling in the Antarctic This is what dropping a piece of ice down a 90 m borehole sounds like,42,8
Exactly where it belongs,43,2
Pink Floyd’s album “The Dark Side of The Moon” now turns 45 yearsold,44,7
1975 Redondo Beach bowling league teamThe Stoned Rollers,45,7
Cheesy bread [homemade],46,7
Saw this on rUrbanHell One of the most dystopian images Ive seen,47,8
Kushner’s Business Got Loans from Companies After White House Meetings,48,8
[IMAGE] These stairs count the calories that you burn instead of riding the escalator,49,8
Why,50,0
What a cutie,51,5
When I hear that Kroger is going to stop selling guns to people under 21,52,8
Now that everyone understands the seriousness of the situation,53,5
oh look a penny,54,7
Our DIY Maple Syrup System,55,4
I was at a low point in life until I found and rescued this little guy from the woods,56,4
A giant ball of fur playing with its caretaker,57,2
Tide instantly freezing on impact with the beach,58,8
All these spoiled kids these days with their AV cables dont know about RF adapters,59,8
Meirl,60,2
I see your car doors and bus windows and give you this,61,8
Me irl,62,1
Equifax finds an additional 24 million Americans impacted by 2017 breach,63,7
Psychologists confirm the narcissistic spectrum model in a new study The higher the narcissist’s selfentitlement and grandiosity the more and more separation occurs between grandiosity and vulnerability Those highest in selfentitlement are either almost all grandiose or almost all vulnerable,64,3
User explains how Chinas economy is set up for a crash bigger than the US housing bubble of 2008,65,4
They say ignorance is bliss,66,4
Found this in my study material,67,8
Worth it,68,8
Golden State Warriors meet Nancy Pelosi after declining Trump invitation to White House,69,8
Hank American Hero,70,8
assault rifles aren’t real,71,2
52 years after my dad served on the USS Midway my family toured it and on the wall I found a picture of him sleeping on the Midway at age 18,72,2
JJ slowly looking more like George Lucas,73,1
Claims her brother bought loads of shares in Google in 1998 6 years before they went public,74,8
Kiss me you fool,75,1
Fried Vermicelli,76,7
Weather memes by the fellow kid weatherman,77,2
Octopus running is 🔥,78,8
Redditors who enjoy a song from a language they dont understand which and why,79,2
Fried Vermicelli,80,7
woof irl,81,1
ጌዪቿልጕጎክኗ ክቿሠነ ክቿዪሀዐሁነ,82,0
PsBattle This lifelike tree,83,1
Calvin is an honest boy,84,8
Avengers Infinity War In theaters April 27th,85,2
I was watching my friends 3 yo and thought he was asleep MRW he snuck downstairs used a step ladder to get ice cream from the fridge and ate half of it before I realized he was awake,86,2
Bro Code,87,7
Saying bye to her human when he leaves for work in the morning,88,7
The pub is ten minutes from my house,89,8
A pernicka sphere,90,4
A group of linemen from my hometown are currently in Puerto Rico They got the power back on at a school today and this was the reaction These guys have been away from their families for more than six weeks but its stuff like this that makes it worth it for them,91,2
NYT Kushners business got $500M in loans after White House meetings,92,8
Brigitte HUGE boop potential,93,2
To be suave,94,4
DoG TrAapPEd iN TiMe LoOP FoR aLL EtErNiTY,95,8
This is lovely,96,8
If Only,97,0
A startup thats making superblood to treat conditions like cancer just raised $100 million to get its treatments through key trials,98,1
Not like other girls,99,2
Giant anatomically correct heart made of legos [OC],100,7
Spotify should have a feature you can turn on to find local artists while traveling,101,8
SNEAKING PAST HUMANS,102,2
Our grumpy lady just turned 19 so for her birthday we got her her own little black cloud,103,8
Looks like we can make 8192 more trebuchets happy LETS GO FOR 8192 I know we can crush our final goal,104,8
A friend of mine captured this moment in Thailand and it’s now my favorite photo,105,8
Hello Mr Krabs,106,3
Some assembly required,107,8
TIL that until 2013 Shark Tank required 5% equity of all companies  just to pitch in the show Lawyers at ABC later changed the requirement after Mark Cuban gave them an ultimatum — remove the equity clause or Im not coming back,108,8
Lots of Potential  Invest,109,8
Friendly dog is a good reason to go for a run every day,110,8
Yellow things hmm,111,7
My daughters laundry hamper with an inspiring quote,112,1
Just a little Civ V,113,2
Millennials hate Trump eager to vote in midterms poll,114,2
The vet makes a house call,115,8
When playtime is getting real and the ref has to step in,116,8
[Haiku] How it feels saying I don’t want to see Black Panther,117,8
Got this guy a few days ago Were already best friends,118,8
Casually Washing Plates At Work,119,4
This is what I get for posting on rneedafriend,120,2
Life keeping,121,4
In Rare Incident Suburban Man Claims Hes Smaller Than He Actually Is,122,4
Ultimate Survival  Snout edition,123,1
[WP] Youre a powerful dragon that lived next to a small kingdom For centuries you ignored humanity and lived alone in a cave and the humans also avoided you As the kingdom fell to invaders a dying soldier approaches you with the infant princess begging you to take care of her,124,8
swinging with pals,125,5
The Greatest Lifehack In Human History,126,8
TIL in 1988 a US Senator invoked an obscure rule to allow the SergeantatArms to arrest absent Senators and bring them into the chamber for a vote One Senator attempted to escape but was caught and carried feetfirst into the Senate chamber by three officers,127,8
MRW I need to switch Reddit accounts to reply to a comment on my other account,128,2
Achooo,129,9
Cannot believe we reached 16384 Heres that number in trebuchets Thank you all for this epic journey Long live Trebuchet,130,8
Mistakes were made,131,7
Being a rad dude is serious business,132,8
Most insane decoy kill ever I swear,133,8
When you dont understand how electricity works,134,2
Fre’ya Forlorn Fire Fairy,135,7
Worst cameraman ever,136,6
My mother tried to plant something and a Demogorgon was born instead,137,8
meirl,138,2
James Harden drops Wesley Johnson and hits the 3,139,4
Is this true,140,8
THERE IS NO CAROL,141,9
“Puerto rico” paint markers 9x12”,142,3
Once Upon a Time in Hollywood Tarantinos Latest Gets Leo DiCaprio Brad Pitt,143,7
MAGA Trade Deals,144,6
Digit doesnt like Spaghetti,145,2
Close Call,146,8
This is what your ride turns into when your riding buddy gets a new bike,147,4
Sculpting Doc Brown,148,0
Only thing worse than a bomber,149,7
I did naaaaaat,150,0
Whos a Good Boy,151,8
Power move,152,2
Steam train passing by a mine in China and igniting coal particles in the air,153,7
Low clearance,154,4
Then and Now How things change,155,2
Recharging,156,4
Tippy Tapping Baby Cow,157,7
Well that’s racist Youtube,158,8
The Beast from the East,159,6
No Mans Sky might not have lived up to its many promises but at least it gave us this,160,2
They say ignorance is bliss,161,4
This headscarf and blue lipstick may be a new thing for me (xpost from rbrownbeauty),162,8
Steam engine going 55mph,163,4
How Rednecks Get Things Done,164,8
The challenge that separate men from kids,165,8
Blizzard tease Diablo for Switch on Twitter,166,7
2meirl4meirl,167,9
2meirl4meirl,168,9
She doesn’t need health insurance she has a gun,169,8
As a 4 year old working 7 jobs and over 160 hours a week I couldnt be prouder to say I worked my ass off to afford this setup,170,8
Always time for a lesson from batman,171,8
A Democrat no ones heard of just raised triple the amount Ted Cruz did despite rejecting special interest money,172,1
Inspired by all of the incredible weight loss photos heres how I lost 160lb in just one day,173,8
I made this reversible eevee hoodie that evolves into umbreon  a gift for my nephew,174,7
James Webb Telescope sun shield snags further launch delays likely,175,4
Snek is now borns,176,2
On the fence,177,1
This isnt what I ordered at all,178,4
My dad died on 021918 this joke came to me while signing paperwork at the funeral home,179,9
**Beware** If you see this vehicle stay away,180,8
Wife took petty revenge on my mom,181,4
Redditor Does the Math and Shows Legitmate Bias in Sentencing for Teacher  Student Sex Crimes,182,2
What You want the EXACT time on this log Alright then,183,8
Anyone else miss the days when there was no stress in the world and you could just read diary of a wimpy kid,184,7
It might be harder to continue from this point on but lets try to push through with 4096 trebuchets and 4096 upvotes Long live Trebuchet,185,8
How would you feel if Nasa discovered a sign on mars that read Congratulations humans,186,2
ManTalk about the greatest character development ever (I Think Im crying),187,8
For the first time in 5+ years the island beside my house can be walked to on ice My neighbors immediately walked over with trash bags to start cleaning it,188,8
Get out of my wasteland,189,2
Fire Spewing Train,190,7
Tesco worker does an excellent impersonation of a church service,191,2
For the first time Mueller looks to be moving up the food chain to ensnare Trump for potential Russian collusion,192,2
Good morning to you too Grandma,193,8
Nap partners,194,2
Take the whole wedding party back to the future,195,2
Dow drops 350 points after Trump says steel and aluminum tariffs coming next week,196,8
Marco Rubio slams teens as infected by arrogance and boasting as his approval rating plummets,197,0
Oddlysatisfying camo,198,0
New Survey Shows Young People Are Staying Liberal and Conservatives Are Dying Off,199,8
Sammy is the official emotional support and greeter dog at the psychiatrist office where I work Licks and love are his specialties,200,2
Rescued this guy from the middle of the road last night don’t worry he’s doing superbly now,201,8
ITAP of two people dancing in the street,202,8
Carson cancels $31K dining set order,203,4
The Truth about Mark Hamill,204,8
Star Size Comparison,205,0
me irl,206,1
Our punching bag finally ripped apart only to reveal its filled with old clothes,207,4
South Korea cuts inhumanely long 68hour working week President introduces 52hour work week to country that has among the longest hours in the developing world,208,7
Sorry Trumpists But We Didn’t Make Trump Attack Guns and Gun Owners He Chose To,209,8
Overwatchs new Hero in a nutschell,210,8
Mueller prepares indictments on DNC and Podesta hacking,211,2
When there was 12 doughnuts in the break room and only 10 employees but you didn’t get one,212,8
Wth my phone shut down while I was uploading this too,213,9
Eleven vs supermodels,214,8
Got no love over at rart  thought I’d try here This was painted by my 9 yr old son for a girl he’s crushing on So proud,215,8
My family Just died in an drone attack Please clap,216,8
TIL Jimmy Carter said if he became president he would release all government UFO information to the public Once elected however he decided not to due to national security concerns,217,2
How to loudly whistle with four fingers in your mouth,218,8
E n d G a m e,219,4
Saying that you speak without an accent is like saying your research paper was not typed in a font,220,8
My new studio equipment arrived so Frideriki had to pose for me and I got this LOL,221,8
Mueller eyes charges against Russians who stole spread Democrats’ emails,222,8
Mueller investigation examining Trump’s apparent efforts to oust Sessions in July,223,2
[CA] Grandmother gave my brother and me an equal share portfolio each in the late 90s when we were kids Brother sold his when they were worth a car I left mine in and now theyre a substantial amount Brother and his girlfriend want my half now,224,8
TIFU by being too tough for a novacane shot,225,4
“9 characters per second”,226,2
[WP] World War 3 has begun every nuke is being launched or droppedtheyve sat in storage for so long that every single one was a dud,227,8
Kyle Shanahan ‘The way to make people feel good about 610 is to start 09’ #49ers,228,8
I got this as a birthday present Was absolutely blown away,229,8
Undocumented Sombra PTR Buff  Environmental Kills + Ult Charge,230,4
Trapped no more Down 140lbs 😁,231,4
Marine Le Pen French farright leader charged over Isis tweets,232,2
Everyone in Britain today,233,8
Goals,234,3
B R O W N B O Y E doing a falling,235,4
Fried vermicelli,236,7
Starting to make some Rick and Morty emojis,237,8
Trapped Found the way to Escape Died,238,8
Her protest to me throwing away chicken bones,239,8
Park piggy,240,4
World War Z Sequel Delayed for Tarantino Film,241,7
[FOX 4 NEWS] Texas Wesleyan baseball coach fired after denying Colorado recruit citing states marijuana laws,242,3
Wham Bam Thank You Mam,243,2
[OC] i painted a Blastoise and her baby,244,7
yo wtf,245,8
Lost about 40 minutes of work just now PSA if you have a cat don’t buy a computer case with an upwardfacing power button,246,8
Saw this on rwholesomememes,247,2
Movie Time,248,8
Tilly lost her hands as a baby Now shes bionic ✌️,249,8
I gave up alcohol when my daughter turned 1 (left) Im 5 years sober today,250,4
Fun for the whole family,251,2
[Image] Life gives you two paths,252,8
ExTrump adviser sold $31m in shares days before president announced steel tariffs,253,8
TIL of Endal the service dog After Endals owner was knocked out of a wheelchair by a passing car Endal put him in the recovery position covered him with a blanket from his wheelchair retrieved his phone from under the car and went into a nearby hotel to get help,254,8
Call me a racist if you want but south of the border is a sea of violence corruption and stupidity I wouldnt touch with a ten foot pole,255,8
Parents begging for grandchildren have the same mentality as a child begging for a puppy they get all of the cute with none of the work,256,7
TIL in 1967 a man appeared on Jeopardy intending to win just enough money to buy an engagement ring He won that amount halfway through and kept his mouth shut from there on To prevent a recurrence the rules were changed shortly thereafter allowing only the winner to keep all hisher winnings,257,8
I discovered I can write messages in my girlfriends new blanket,258,8
Corporate bought pizza and wings for those who made it in after our area was hit with 2 feet of snow I’m the only one who came in,259,8
Bob Ross peeling contact paper,260,2
PsBattle Cats finishing move,261,8
My cat finally figured out how to get in this floating tunnel He is so proud of himself,262,2
The number of Delta Air Lines passengers who bought tickets with NRA discount 13,263,8
Its time to stop Youtube,264,8
Relationship goals,265,3
Scotch tape makes frosted glass clear,266,1
I saw a guy proposing to a girl in Chicago on Michigan Avenue today Hope the couple see this,267,8
The way the snow melted in my universitys courtyard makes the floor look like a video game,268,1
A review for just cause 3,269,1
Are you chewing gum,270,8
I watched 2 fortnite videos,271,4
TIL after surviving the plane crash that killed three of his bandmates Artimus Plyle (the drummer of Lynyrd Skynyrd) was shot in the shoulder by a farmer as he stumbled though a field with a group of survivors,272,4
My son is ready for picture day at school,273,8
The starter pack for me,274,6
Mark Hamill posted this on his Twitter account,275,8
In 2013 it cost $330000 to grow a hamburger in the lab Theyre soon expected to sell for $11,276,0
The King with his Queen (1969),277,7
If your employer gave you the option to work 10 hr days MonThurs instead of 8 hr days MonFri would you do it Why not why not,278,8
Super Troopers 2 Movie Poster,279,8
Final Jeopardy ended in a tie last night and we got to see the firstever tiebreaker,280,8
The Internet is great,281,2
My mom wanted a selfie of her sons at our sisters wedding,282,2
Hundreds of people gather to say ‘wow’ like Owen Wilson,283,2
MRW February is Over,284,2
Fat shaming takes a turn,285,8
Previously Unknown Supercolony of more than 1,286,2
Vital when out on the lash ,287,6
Reddit dragged into Russian propaganda row,288,2
A deleted scene from The Avengers,289,7
Little girl standing in awe of Michelle Obamas official portrait (photo by Ben Hines),290,4
love u grandma,291,2
Catto provides warmth while doggo provides transportation,292,8
Lets come together,293,8
I made fake Criterion covers for all the Best Picture nominees this year,294,8
This Chinese ad for a pepper mill,295,5
My kitten has two canines,296,4
Boston Undynamics,297,4
Schools are safer than they were in the 90s and school shootings are not more common than they used to be researchers say,298,8
TIL in the late 1960s some researchers reported that catnip gave people a marijuanalike high when smoked but it turned out they had simply mixed up the two plants,299,8
Humpback whale flipped perspective,300,1
Well this is disturbing,301,2
me irl,302,1
Meirl,303,2
P U P P E R does an A D D,304,4
Camera in a furniture screw,305,6
After my wife died I couldn’t look at women for 20 years,306,4
The United States Postal Service,307,7
Taking a family photo,308,8
LeBron with the ridiculous and 1,309,2
In Sully (2016) the ferry captain Vincent Lombardi who was the Captain of the first ferry to reach the plane played himself in the movie,310,8
Delta CEO says Our values are not for sale after Georgia lawmakers drop tax break,311,1
CaNcEr RiDdLeD TeAcHeR RiPs HiS OwN HeAd oFF,312,2
I ask my brother if he has a spare impact drill that I could buy off of him Im starting at an HVAC company soon In response he goes out and buys me all of this Im in complete disbelief,313,8
Violet was an easter present to a young child who lost interest She was kept in tiny wire cage in their basement and forgotten about Now she lives cagefree and sleeps in bed with me every night,314,8
me irl,315,1
What I know about AKs and AR15s,316,3
snowdrift and dirt mixed together,317,7
NASA Finds a Large Amount of Water in an Exoplanets Atmosphere,318,8
THIS IS THE EXACT OPPOSITE OF MY JOB,319,8
Never the right fit,320,8
The onion got it right,321,8
[Image] You are a descendant of stars,322,8
Charcoal helping her little buddy out adorable,323,7
Twitch streamer who calls tech scammers correctly guesses syskey password set by scammer,324,9
When you need asterisks for your asterisks,325,1
I screenshotted every moon in Odyssey Each frame is one of those screenshots,326,8
Scott Walker Refusing To Hold Elections GOP Might Lose,327,7
What are you looking at,328,1
A surprise to be sure,329,8
Every time before a deployment,330,8
Best friends,331,6
When you realize that Only a Sith deals in absolutes is an absolute,332,8
Depth Of Russian Politicians Cultivation Of NRA Ties Revealed,333,2
Gamers of Reddit what is the scariest most disturbing or eeriest game youve ever played,334,2
Customer asked me if I wanted to see a picture of his pride and joy,335,8
A bucket of cuteness,336,3
Surgical procedure for thigh cancer,337,2
2meirl4meirl,338,9
Rate my setup,339,7
Depth of Kremlin ties to the NRA revealed,340,2
[Homemade]Totoro mini pizza,341,1
And thats why you always read the patchnotes,342,8
A superb choice,343,1
A foolish man built his house upon the sand,344,3
I just love Bryan,345,4
This is my dad in An Lôc Vietnam in 1972 My dad never talked about being in Vietnam until I showed this to him He started crying I thought this would be the best place to share this with you Will post more photos of him soon,346,2
The Emperor offers a warning (Vader #8),347,8
This has got to be fraud in some way,348,8
Sticky Sesame Popcorn Chicken,349,1
solar panels are set boss,350,4
I think I’ve broken something,351,8
First sustainable Lego pieces made from plantbased plastic sourced from sugar cane to go on sale 85yearold Danish toymaker said production has begun on a range of Lego botanical elements or pieces such as leaves bushes and trees made entirely from plantbased plastic,352,4
This is snapchat not Facebook,353,8
Breaking a string while playing guitar,354,8
Prime Time,355,8
Ultra Modern Mansion,356,7
Playing a sold out crowd,357,2
First escalator ride,358,8
Smudge is a special boy,359,2
Watching Stranger Things for the first time and this has been my experience,360,7
TIL that the term canola oil is short for Canada Oil low acid,361,2
I wonder if shes worried about a yeast infection  ,362,8
This is Blizzard he’s 18 and can’t jump very high anymore This is the look he gives me when he wants to get on the bed,363,8
Worst app ever,364,8
To hate on America,365,2
Toasty Vader,366,8
[Windhorst] JR Smith was suspended for throwing a bowl of soup at Cavs assistant coach Damon Jones sources tell @mcten and me,367,2
This happened to me not that long ago Its a feeling of both disappointment and relief,368,8
Dancing,369,6
Toilet map (You can rate bathrooms you have visited),370,7
Im just a little hedgehog,371,4
Google accused in lawsuit of excluding white and Asian men in hiring to boost diversity,372,4
Audi R8 LMS Cup driver takes his car out for a spin,373,4
AT&Ts is now saying keeping America safe is dependent on them creating internet fast lanes,374,2
9(Rambler) | Oil | 16x20inches,375,4
She unmatched me,376,3
Chinese poster for Black Panther,377,8
Another amazing use of FaceID sensors on iPhone X,378,2
Americans today are much more tolerant than in the 1970s [OC],379,7
This Is the Real Reason the CocaCola Logo Is Red | 130 year ago Coke was sold in barrels so they painted the barrels red to help customs distinguish it from alcohol which as also in barrels but taxed,380,8
Was treating myself to a scotch and logging it in my fitness pal,381,1
Im statistically dead if I come,382,1
A 6th grader in my wifes class drew this comic  Lord help me,383,8
Creme Savers,384,9
It works I even tried,385,8
Saving the bees one sniff at a time,386,8
My mother loves this photo of me so much that she had it printed on a canvas and has it hanging over her fireplace No visitor is allowed to leave her home without being forced to acknowledge it,387,8
Google street view has blurred the face of Ballinas Big Prawn Privacy first,388,2
FennakThe Stack,389,1
When you scroll too far down into the comments,390,2
You dont deserve DotA,391,2
ExTrump adviser sold $31m in shares days before president announced steel tariffs,392,8
Gears of War Theron Guard Cosplay,393,2
I just finished binging The Office last night I didnt expect the last episode to get me in the feels like it did,394,8
Camo dog,395,8
We’re conducting an experiment with the cat,396,2
Found this format Should I sell or buy,397,8
Reddit meet Annabelle She is officially old enough to vote today (18) and gets some steak as a treat,398,8
Espresso on the banks of Lake Como,399,5
Went to an important meetings put on my nice shirt Got there to see that the wallpaper was exactly like my shirt,400,8
There have been 241 posts in rThe_Donald linking directly to the twitter account @TEN_GOP which we know from the indictment on 312018 was a fake account controlled by Russian operatives,401,3
The moment my cat decided to curl up by the fire,402,7
Taking advantage of the rare snowfall we get in Ireland,403,4
I love finding preJackson LOTR imagery,404,4
The DepthsAbove,405,6
[ Raibow Six Siege ] gravity bends light,406,6
2meirl4meirl,407,9
When a teacher sees a student wearing a hat in class,408,8
Spoke too soon,409,0
Ben SWOLO and Rey,410,9
Jeff Kaplan Perhaps we can try an alternate game mode to Mystery Heroes at some point… “Slightly Balanced Mystery Heroes” or something along those lines,411,2
Thanks I will,412,2
My biggest fan so far Oh,413,4
