Title,doc,topic
Elephant looks like hes auditioning for a shampoo commercial,5697,8
Facebook scraped call text message data for years from Android phones,5698,8
HowToBasicFace Reveal,5699,4
A guy in my town makes these skeleton displays,5700,1
Sign of the times in the meme economy,5701,7
How To Permanently Delete A Facebook Account,5702,8
Timeless,5703,7
Few noticed but Congress just banned restaurants from skimming tips,5704,0
[I ate] Texas BBQ,5705,3
me irl,5706,1
Waves of fluff,5707,6
In a parallel universe,5708,2
Teachers equipped with guns starter pack,5709,6
press f to pay respect,5710,8
🔥 Diving with dolphins 🔥,5711,8
LPT If you’ve made a mistake screwed up already STRONGLY fight the temptation to overexplain justify what happened Own up to it offer to make up for it and move on,5712,8
Didn’t know that Guillermo Del Toro had a brother,5713,8
My right eye contact lenses are made in the USA but my left are made in Ireland,5714,8
Hmmmm,5715,6
Sick haircut,5716,4
PsBattle Cambridge Analytica moving boxes from their office before the search warrant,5717,8
LET ME LOVE YOU [OC],5718,7
I don’t know what to say,5719,8
White House announces ban on most transgender service members,5720,1
German language in a nutshell,5721,4
Best Sign Ever,5722,8
woof irl,5723,1
People with covers like thease,5724,2
I was born with 6 toes on my left foot and my Coworker was born with 4 toes on her right foot,5725,8
Netflix Originals Are Now Banned From Competition At Cannes Film Festival,5726,7
The Witchs Den,5727,7
Still cant find them,5728,8
The faucet in my hotel room is in the ceiling,5729,1
ELI5 if fruit is sweet to encourage animals to eat it and carry the seeds away from the parent tree how do lemons and limes fit into this mix,5730,2
This looks like a fire exit for mice,5731,2
Emma Gonzalez Is Responsible for the Loudest Silence in the History of US Social Protest,5732,2
give the people what they want,5733,8
Happy Puppy,5734,8
Meirl,5735,2
TIL Leonardo DiCarpio was offered the lead role in Hocus Pocus but turned it down to act in Whats Eating Gilbert Grape Though he was paid far less it earned him his first Oscar nomination for Best Supporting Actor,5736,8
Being Very Careful Not To Wake The Baby Dragon,5737,7
Opening the CD drive,5738,8
One is hot one is cold,5739,8
Making toothpaste addictive would result in a lot more people with clean teeth,5740,8
meirl,5741,2
I started a Triphop playlist 15 years ago after falling in love with Glory box  Portishead Here is my 52 hours  700 tracks playlist of this awesome genre ),5742,8
About the new live action Mulan movie,5743,8
Only a commoner would ask such a question,5744,2
I mean give me a little credit,5745,7
me🎓irl,5746,0
Revealed secret memo warned Trump data firm about breaking US Law,5747,8
Favorite sign in the rally,5748,7
I hand fed a bumblebee today,5749,8
Well,5750,8
Waiters and Waitresses of Reddit what can we as customers do to make your lives easier,5751,2
A new way to mess with your friends when you ship them something Fine print matters(Zoom In),5752,8
Donald Trump is walking out of the White House and heading toward his limo when a possible assassin steps forward and aims a gun,5753,8
Big boxer scared of tiny corgi puppys bark,5754,5
My naem is Lou,5755,2
Saw this posted on rpareidolia,5756,8
Moira no longer blinds you with her ult on the PTR People with eyes rejoice across the world,5757,8
Inside an Automatic Mahjong Table,5758,3
When meme royalty visits Manchester,5759,8
You should come out here the sun is nice Charles,5760,8
2meirl4meirl,5761,9
Next time on Project Runway,5762,8
Vitiligo,5763,6
Sand meets road in Dubai,5764,2
Only you can prevent firnvm,5765,6
SpiderMan hair,5766,4
My great aunt who played professional Roller Derby for the New Jersey Jolters (1949),5767,8
Mark Hamill is such a Joker,5768,8
Me_irl,5769,1
But he boot too big for he gotdamn feet,5770,2
Forgot to take the chocolate Easter bunny out of the car,5771,1
Moved across the country for university buddies still drove all the way over for a glorious LAN party,5772,8
17 years ago Randy Johnson threw the ultimate fastball,5773,8
Fortnite Kid Starterpack,5774,2
YouTube ads on YouTube,5775,8
Decorated Fried Donuts [Homemade],5776,7
hmmm,5777,2
Hacky Hat,5778,9
Three students at the CIA Academy were about to graduate,5779,2
It’s over mannequin,5780,8
Am I doing this right,5781,8
Some guy took up 3 parking spots so my friend left him a little note,5782,8
Instagram is a gold mine,5783,1
[I ate] Beer and girl scout cookie pairings,5784,1
The Director,5785,2
My daughter met George Clooney at the March for Our Lives rally today,5786,8
When a user reports uhero0fwar for mod abuse on this sub,5787,8
When you view Top of all time on HighQualityGifs,5788,8
No tutorial needed,5789,8
They mounted a vegan to the wall at my local butcher shop,5790,4
A six year old was handing these out at the march today,5791,8
The Fellowship,5792,0
gIrL bRutALLy dEaD hAd hER Body DraGGED awaY,5793,8
Like a boss😎,5794,1
Climbing stick,5795,8
I found a lake shaped like a heart buried in the woods in Northern Ontario with my drone,5796,8
I have a helper in the garage today,5797,8
TIL To prevent cheating during university entrance exams Uzbekistan shuts off the entire countrys internet for five hours on exam day,5798,8
Yoshi cake I made for my niece’s birthday,5799,7
Had to add him to friends after this gg wp,5800,6
Just broke up after months of her becoming increasingly rude and disrescpectful No nice memories to cherish,5801,8
Early 2002 Goth phase with my black cat Tinkerbell My mum has this pic on her fireplace in a flowery photo frame just to add to the cringe factor,5802,8
Doctors back in the day,5803,8
Voodoo,5804,8
I need this to be in the game,5805,1
Thats my boi,5806,8
I live in a tiny house but I have my priorities,5807,8
The Calmest Man On The Planet In A Car Crash,5808,4
Trump Wants a LineItem Veto on Budget Bills That Was Ruled Unconstitutional 20 Years Ago,5809,8
Lightning in slowmotion,5810,4
‘Love Simon’ Kristen Bell and Neil Patrick Harris Buy Out Screenings So People Can See the Film for Free,5811,2
When you flying United,5812,7
In a parallel universe,5813,2
Man this movie is so lit and cool,5814,8
Idk guys this combat is kinda boring,5815,2
March for Our Lives crowd tops Trump inauguration according to organizer estimates,5816,2
FeRaL HipPo EaTS maN aLIvE,5817,8
Colmar France In the Litte Venice neighborhood,5818,7
7 day old kitten in deep snuggles with 5 day old puppy,5819,4
Wow Lots of people mustve been born in 1969,5820,8
PsBattle Tuba Man,5821,4
CHNAGE MY MIND,5822,2
An immediate heider,5823,0
Every 8090s kid dreamed of the ToysRus Super Toy Run,5824,7
yup,5825,5
Dem March for Our Lives rally for sure larger than Trump’s inauguration,5826,2
How to correct an underbite (Orthognathic Surgery),5827,1
*Prepares inbox for death threats*,5828,5
Hes definitely enjoying it,5829,8
Crossing America in a 1964 stationwagon,5830,6
Pastor who starved toddler to death to exorcise demon gets 99 years in prison,5831,4
Man pulls his meat out in front of strangers,5832,4
Lion sneaks up on a leopard,5833,4
A well behaved danger noodle gets the heckin chin rubs,5834,8
Nice try Netflix,5835,7
A hunter shoots a deer and is pulling it back to his truck,5836,2
Is this meme dead yet,5837,8
I made the Iron Giant,5838,7
ITAP Of My FireHaired Girlfriend,5839,3
TIFU at a gas station in New Jersey,5840,4
I TOO HAVE ENJOYED THIS PARTICULAR HUMAN ACTIVITY,5841,8
Ken M in Pringle Cans,5842,3
A surprise to be sure,5843,8
General Kaadbohrd the Flammable but Fearless,5844,5
Spider,5845,8
Just some nice lawn décor,5846,8
Yuffie cosplay [FF VII],5847,7
I revived an old iPod Classic 6th Generation (3k mAh battery and SD card storage mod),5848,6
“I can do that too”,5849,8
I see through the lies of the Jedi,5850,8
He didnt care much for the view but he sure had a good time,5851,8
The amount of room in the bed that my parents give to our dog seems excessive,5852,8
My friends are having a 90’s theme party and asked for Lisa Frank cookies,5853,8
Cat discovers water,5854,2
In Toy Story 2 when the pig starts flipping through the channels super fast most of the channels show shots from Tin Toy (including this famously creepy baby) one of the original Pixar shorts,5855,7
Kitten wants to be just like it’s mama,5856,8
Having a good hair day despite the humidity,5857,8
Oh the table’s have turned,5858,0
Pool,5859,8
How pineapples grow,5860,7
There is almost no relationship between how many points NFL teams get through kicking and how successful they are overall [OC],5861,8
Hampton Inn throws shade at msncom,5862,3
That time when Fox & Friends called Mr Rogers an evil,5863,8
French officer who swapped places with a hostage in terror attack dies,5864,8
NBA experimenting with in app microtransactions offering 4th quarter of a game for $099 The future is here,5865,8
Heres a list of champions i dont like,5866,1
Whats the difference between a bee and a wasp,5867,7
Better view of the nest that some birds made in my bicycle seat pack while I was away I’ll take the bus to work as long as they need it,5868,8
Facebook data privacy scandal has one silver lining Thousands of new jobs AI cant handle  The Facebook data privacy and Russian election interference scandals show that artificial intelligence is still not up to many critical jobs in the technology sector,5869,8
Dalai Lama cancels all foreign travel due to age and exhaustion,5870,8
Drugs Make Music Better,5871,8
Obamas message to marchers Youre leading us forward,5872,8
Washington protest could be one of largest since Vietnam era,5873,8
Honestly,5874,7
Day six The kitten has begun plotting my demise,5875,4
He cant be stopped,5876,8
Sea of Thieves is a disguised early access,5877,8
please look at this baby angora rabbit i met today,5878,7
Mother crashed car into pole to prove to kids God is real police say,5879,8
Every time I rage cause of Genji or Tracer I watch my Mei compilation,5880,8
A better use of textbook money,5881,8
Nothing says I care like forced entry,5882,1
I feel like this guy never got enough credit for his part in making Captain America look great This is Leander Deeny Chris Evans’ “skinny” body double,5883,8
Welcome to Flavour Town,5884,8
The way this draw is drawn,5885,7
Me waiting for season 4 everyday,5886,8
[WP] Your father is forcing you to marry someone you have never met The night before your wedding you tie your sheets together and make your escape through the window Half way down you make eye contact with someone doing the exact same thing a few windows over,5887,8
Im not very good at PUBG and for once I actually made a sniper shot I was a bit excited,5888,8
He beat me to the rejection,5889,8
Taking shots at work,5890,8
Colorado among first states to give consumers the right to store energy from alternative sources A new right — the ability to store energy without discrimination in rates or excessive barriers in connecting to the grid,5891,8
You don’t know how powerful your jaws are until you try to break an M&M with your fingers,5892,8
Alright that’s one way to immortalize a movie,5893,8
At least I tried,5894,2
Pitbull rescued from dog fighting ring is given his first snack and loses his mind,5895,8
Took me many years to get this right,5896,8
Idk guys this combat is kinda boring,5897,2
I put boots on my dog when he was asleep,5898,8
master hitcat puts down a challenger,5899,5
Anyone know what this guard pull is called,5900,8
sticky balls test,5901,7
Another one found on rAskReddit,5902,8
This is real gatekeeping,5903,2
me_irl,5904,1
When youre her favorite person ),5905,8
Confused,5906,2
This new standee is epic,5907,8
Hold His Redbull So He Can Make This Awesome Penalty Shot,5908,8
Had to reupload this because I was dumb and forgot to remove names,5909,8
When youre sick of the Yiga clan,5910,6
That time Cris Carter was assigned to block Reggie White,5911,8
The numbers 666 appear in DOOMs soundtrack in a spectrogram,5912,2
Russia has Open Carry no need to conceal,5913,2
The NRA is attacking the teen organizers of March for Our Lives,5914,8
Well I had to draw our memelord already (Hope you all like it) PS Ive been watching The Room while drawing this 🤔🔥,5915,8
Facebook tried to shape Australias election Facebook approached Australias major political parties with a new and powerful tool Liberal strategists rejected it over legal fears,5916,2
The Best Thrift Store Find,5917,8
Fish goo smeared on a floor tile,5918,1
This is all I can think about when I pass this building,5919,8
A guy was screaming at the TV “Run idiot run”,5920,9
Time consuming but effective,5921,1
[WP] You were born on the 29th of February 1964 a leap year It didnt take long to notice that you only aged a quarter of the speed of everyone else You have now been alive for 54 years but with the body of a teenager,5922,8
TIL Sun Tzu had to train the kings concubines as soldiers so he chose 2 as captains & gave an order but they all just giggled He ordered the captains death to the kings protests Sun Tzu said he had to complete his mission The captains were killed & the squads then performed perfectly,5923,4
The perfect cosplay doesnt exis,5924,8
Ahh the nostalgia of VHS tapes Lets try this tape I found in a thrift shop,5925,8
Today our rescue became an anatomically correct heart,5926,8
Guy wanted me to make him a queensize blanket,5927,8
TIL President Harry S Truman was so poor after his presidency that Congress had to enact a law to give him a pension President Herbert Hoover the only other living expresident took the pension as well despite his wealth to avoid embarrassing Truman,5928,8
Canada wants clearer warnings on junk food The US is using NAFTA to stop them Canada is poised to be the first highincome country to put warning labels on foods high in salt sugar and fat,5929,8
My short mom sends our family photos of her with really tall people,5930,2
My buddys carpet matches his dads dog perfectly,5931,2
The Northrop Grumman B2 Spirit Stealth Bomber temporarily crosses paths with the moon during a rare appearance at the Melbourne Air and Space Show,5932,2
Black Panther has become domestically the highest grossing superhero film of all time with $630 million beating previous record holder The Avengers,5933,7
Nerd in the 80s,5934,4
I shot the sheriff,5935,4
My sweet girl Cheech is 15 years old After her haircuts everyone always thinks she’s a puppy,5936,8
This minimalist cereal box,5937,7
Marzieh Ebrahimi survivor of the 2014 serial acid attacks on women in Esfahan Iran,5938,2
My 17 hour exposure of the Flaming Star Nebula in natural color,5939,3
Native American music sung in english,5940,6
Who made this burger,5941,7
March against abortion ban in Poland,5942,7
France terror attack Hero policeman married hours before he died,5943,8
A lot of people didn’t read the signs before booing And neither did security that let him stay there,5944,7
Dude saw a little old lady was having trouble bagging some stuff so he stopped and held her bag open for her Small act but man did it make my dayand yes I absolutely took a pic of 2 complete strangers,5945,8
The Milky Way over Kilauea Volcano Hawaii,5946,7
TIL Mark Twain was born on the day when Halley’s Comet flew by earth He said “I came in with Halley’s Comet in 1835 It is coming again next year and I expect to go out with it” Halley’s Commet next appeared on April 21 1910 which is the day Mark Twain died,5947,8
A Potential Customer kills my mother(,5948,8
How players communicate in MMORPGs,5949,2
Alice In Upvote Land,5950,2
Im a zucker for pranks,5951,4
This Baby seal is happy to see you,5952,8
Happens every time,5953,8
Baby bunny enjoying some pets,5954,7
Snoop knows,5955,2
In Guardians of the Galaxy when Peter Quill is arrested it shows that he has a translator in his neck which is how hes able to speak to different alien species,5956,8
Why developers dont sleep,5957,2
From the march today in Eugene Oregon,5958,8
Padmes death is an argument we cant afford to lose,5959,1
Researchers reviewed claims that meditation reduced violence quoting the Dalai Lama “If every eightyearold in the world is taught meditation the world will be without violence within one generation” Study found it caused a modest increase in compassion and empathy but noted potential biases,5960,8
Join now 😍🤑,5961,2
Mystic my 15 year old mini kitty doing an awfully cute blep,5962,8
Crossplay allowed me to play with my bro who is currently deployed in Iraq Thank you Epic,5963,2
They never messaged me back At least I thought it was funny,5964,2
Alex the African Grey parrot is the only animal to ever ask an existential question He asked “what color” he was,5965,2
We better investigate,5966,4
PsBattle Baby Seal with Mouth Open,5967,7
Anakin is a good guy,5968,8
Me🌕irl,5969,3
Even big boys need their Brushies,5970,1
I just matched with two girls back to back both have a picture in front of the same sign Kilimanjaro is about 8000 miles away so not like I’m right next to it,5971,8
A first meeting,5972,8
Am goodboye so will do u a protec,5973,2
NYPD officers get ambushed,5974,2
Yum Yum,5975,7
Bob Ross does it again,5976,2
Joe Rogan calls out Ryan Fournier for copying his tweet from five years ago,5977,8
TIL Hippos can sleep underwater using a reflex that allows them to bob up take a breath and sink back down without waking up,5978,8
My personal favorite,5979,7
Popular Guy,5980,8
Rick Santorum to Student Activists Dont March Learn CPR,5981,2
While the Nation Protested Gun Violence Trump Went Golfing and Pence Tweeted About a Movie,5982,8
“What do you want to be when you grow up”,5983,8
No need to tell me why,5984,8
What the crossbow is actually used for,5985,8
Cutting Aloe Vera,5986,5
How car accidents looked in the 20s,5987,4
Facebook quietly hid webpages bragging of ability to influence elections,5988,8
this guy genuinely needs to calm down,5989,8
How I always pictured Old Master Skywalkers life [art by Cristi Balanescu],5990,4
Like how is this even comfortable,5991,2
Tiffany Trump Liked a March for Our Lives Poster About GOP Getting Massacred in Midterms,5992,2
Youve come to the right neighbourhood,5993,8
What did Spartacus say to the cannibal who killed his wife,5994,4
pickup line,5995,4
Dont be sad,5996,2
watching the world burn,5997,7
Only people that work more than 95 can be tired,5998,7
Applying epoxy coating to a factory floor,5999,1
The salmon cannon a pipe that moves live salmon upstream when there is a dam in the way,6000,8
“The Constitution was never meant to change”,6001,8
Chefs of Reddit what do we all need to stop ordering,6002,2
LPT The first time you give someone flowers do it randomly Dont wait for a special occasion,6003,8
Anakin where have you bean,6004,7
Fancy sex only,6005,2
LPT,6006,8
[NRL] Chip chase flick pass try,6007,1
Oh well this is your new home now,6008,8
Big difference,6009,2
The Real THANOS theory,6010,2
Let’s put her face right in the middle,6011,2
The back of this business card,6012,2
This Dva suicide bomb that finally got me to diamond,6013,8
My bad,6014,8
Michael Phelps secret,6015,9
Ah yes I completely understand,6016,2
*Teleports into the White House* nothing personal kid,6017,8
This bench made to look like a stack of books,6018,1
Peak WPT,6019,4
My heaven on earth,6020,1
PsBattle Gravity defying elephant sculpture,6021,6
In another blow to Trump’s efforts to combat Russia probe diGenova will no longer join legal team,6022,2
meirl,6023,2
Buy this,6024,8
I walked out in front my my camera for a selfie as the crescent moon and milkyway were rising at Popham Beach ME,6025,7
Jack Nicholson Vince Low Pen 2012,6026,2
He killed millions and made them pay,6027,4
When the speedy freeze can’t fill the void inside,6028,3
Was wondering how this guy knew exactly where I was then checked replay oops,6029,6
Went on my first cruise this week and noticed a familiar face Happiest I’ve ever seen him minus pretzels,6030,8
Truly inspiring,6031,1
he loves the ice,6032,2
Facebook Vs Redditors,6033,8
This place looks so inviting,6034,2
Google searches for the word Summer peak at different times of the year for the US and Australia [OC],6035,8
Thank you for keeping her cozy,6036,2
Rejection in HD,6037,3
They must be really well trained,6038,8
Mods asleep upvote Ewan,6039,2
Before and after cat adoption fed him for 4 months outside then captured him Most likely left behind in my apartment complex by previous owners hes awesome,6040,8
Help me…,6041,8
MRW a girl walks up to me in a bar,6042,8
🔥 Cat Eye 🔥,6043,8
My mom helped me take the perfect rock ‘n roll picture for my myspace profile This physically hurts me to look at now,6044,2
Just act natural,6045,8
2meirl4meirl,6046,9
[Poetry]Alice In Upvote Land,6047,2
Reddit in a nutshell,6048,4
Died while AFK in a corner because I was eating my lunch but the guy who killed me said he’d win for me And he did,6049,8
Cats arent that great at fetch,6050,2
Jim gives solid advice,6051,8
The testicular ergonomic accommodation on this bathtub,6052,3
This hurts,6053,7
Hydraulics fail on dump truck,6054,5
A family of squirrels moved into the hole in my tree,6055,2
hmmm,6056,2
Team SoloMid vs Clutch Gaming  NA LCS 2018 Spring  QuarterFinal  PostMatch Discussion,6057,8
Book shop in New York,6058,8
handy guide about intenal pc cables,6059,0
Typical PCMasterRace member when the new panels drop,6060,1
YouTube has decided to give me 30+ minute ads,6061,8
Mom will be mom,6062,7
If you go to Google maps and go 53583275 7838294 you will see this V G O O D B O Y Y E doin a look at the Google street view car,6063,4
A nun at a Catholic School was asking her 10 year old students what they wanted to be when they grew up,6064,2
When someone tells you youre boring because youre against smoking,6065,2
Freedom Tower,6066,8
How to open aluminium lock with gallium,6067,1
Canada wants clearer warnings on junk food The US is using NAFTA to stop them Canada is poised to be the first highincome country to put warning labels on foods high in salt sugar and fat,6068,8
How the world curling final ended on NBCSN online,6069,8
Cat nailed the moonwalk,6070,8
[Text] There are people out there you haven’t met yet who will love you,6071,2
White cat and koi fish,6072,4
Perfect Balance,6073,8
Delicious,6074,9
My hotel has a Texas shaped pool,6075,1
Member Robert He grew up so fast,6076,7
Found this guy living in my garage,6077,8
Older pic when I was a server and these people got salads with everything on the side,6078,8
My 18 year old girl and having a well deserved rest,6079,8
Brain hurting cancer oof,6080,7
So I logged into 9GAG after 3 yearsI regret it,6081,7
THE PHILADELPHIA 76ERS HAVE CLINCHED A PLAYOFF BIRTH,6082,9
Rejection in HD,6083,3
Wiggins loses himself in the music,6084,4
Yea let’s just get a spider tattoo,6085,6
My new best friend She doesn’t want to leave me because she loves cuddles I found her in the forest,6086,8
My nephew doing the electric slide 😂,6087,2
To the organisers the folks who let him on their team who cheered for him and gave him tips you made this shy boy feel like a champ doing something he loved You are amazing Thank you so much mum xxx,6088,8
I wasnt satisfied with the post yesterday,6089,2
How the cat got its sound,6090,8
When the two friends you introduced to each other start hanging out without you,6091,8
Cool,6092,8
My dog next to my moms puppy 8 months difference between the two pictures,6093,8
Word of a veteran,6094,8
Straight from the mall,6095,2
Pence secretly drafted Trump’s latest transgender military ban,6096,2
Powerful sign we can all get behind,6097,2
Hair loss concealer,6098,8
The key to parenting,6099,4
Wtf since when,6100,8
Im OK,6101,4
anime_irl,6102,2
Amazing Chemical reactions using household materials,6103,8
CkY  96 Quite Bitter Beings[Alternative Metal],6104,4
I adopted the cutest office assistant,6105,8
The rare soft faced pupper,6106,4
In and Out,6107,0
Yin and Yang,6108,0
My brigantine done today by Jeremy Golden at Eye of Jade in Chico CA,6109,8
The Calmest Man On The Planet Records His Own Car Crash,6110,4
You WHAT your dog,6111,8
I put a twist on the river table idea and made a floating epoxy waterfall,6112,2
This picture of my cat Oliver enjoying the spring sun is just mealting my heart,6113,8
Preppy UpperMiddle class Highschool Student Starterpack,6114,6
I mean its probably better than testing them on humans,6115,8
Just a day in the life of a nerd,6116,4
NRA Claims March for Our Lives Was Organized by ‘GunHating Billionaires and Hollywood Elites’,6117,8
Did you not read the bylaws,6118,7
My Guinea Pig Peaches gave birth today,6119,8
This Charizard made of leaves 😍,6120,7
[A] Matryoshka Cube,6121,0
The worlds largest Coke bottler is shutting down operations in one of Mexicos most violent states because of harassment from organized crime and a lack of response by authorities,6122,1
Puppy tries to get his bed back Cat does not care,6123,8
My girlfriends Korean grandma using talk to text,6124,8
KT Rolster Rush will make his LCK debut in the final match against Afreeca Freecs,6125,8
Dwight Schrute was truly one of the greats,6126,1
The demons inside him are released ,6127,3
Only known footage of Sandy Koufaxs perfect game 1965,6128,8
This package at my door,6129,8
A single exposure to rudeness in the morning can contaminate employees’ perceptions of subsequent social interactions leading them to perceive greater workplace rudeness throughout their workday This leads to interaction avoidance and psychological withdrawal,6130,3
IQ Elite Cosplay ,6131,8
Guess Ill just die,6132,8
My cousins wifes mothers zhuzhus xtreme tippytaps,6133,0
DONT NEVER SHOOT AGAIN,6134,8
Sex in the City star turns 53 today,6135,2
Meet Lenox our 8 week old Blue Heeler,6136,7
When the mods say there is no Meme War,6137,2
My girlfriend and I adopted a puppy today Reddit meet Lola,6138,8
Tiny pupper zoomies,6139,5
