Title,doc,topic
Big white fluff meets bigger white fluff,1635,6
I live in a West Virginia coal mining town This is our creek today We are being told that this is normal,1636,8
A free coffee in exchange for litter,1637,2
Heard it was wendys week,1638,1
Bolognese sauce [homemade],1639,7
Single chocolate chip cookies,1640,4
Soccer player spits gum out of and then back into mouth the long way,1641,8
Every single time,1642,8
This is my pig Hes gone from being scared of being held to running into my lap any chance he gets,1643,4
When you Mike Tyson someone right off the bat,1644,2
When all your friends at the party finally get the joke,1645,8
Woof irl,1646,1
Elizabeth Warren Blasts Fellow Democrats for Supporting a Massive Bank Deregulation Bill,1647,2
When its 4am at the end of a banger,1648,1
This pub offers £30 to whoever wins a game of fortnite on their machine,1649,8
VA plan would give every service member mental health benefits after leaving military,1650,8
Does School Count,1651,2
Aztec dancer,1652,1
Definitely a tide but no ad,1653,2
2meirl4meirl,1654,9
Any potantial in this format,1655,7
Soma Ulte the telepathic lovers,1656,0
What are the little things people do that make you question their intelligence,1657,8
The software development process,1658,5
Motorcycle Time,1659,8
Kevin Love Without DeMar coming out,1660,8
The NYPD is close to arresting Harvey Weinstein,1661,4
What commonly held beliefs are a result of propaganda,1662,8
Me irl,1663,1
Betsy DeVos Ends Parkland Press Conference Abruptly After Reportedly Refusing to Speak With Students,1664,9
“So you’re telling me that any line from the Prequels can be used in a template”,1665,8
When Deep State Libruls come for your guns & ponieswill YOU be prepared,1666,8
Wind from a Red Giant star revived its formerly dead neutron star companion new study shows,1667,8
When you enter the wrong GTA code,1668,8
The fog makes this stadium look like an UFO,1669,1
1939 Child poses with the first Mickey Mouse and Minnie Mouse costumes Walt Disney was very unhappy with the costumes and later had them redesigned,1670,7
Project managers and mushrooms,1671,6
I painted a dog ),1672,8
AP icon is 1 pixel bigger than AD icon,1673,4
Hate it when this happens,1674,8
Top 10 Anime Betrayals,1675,8
Our sweet Cousteau From a scrawny street kitty in New Orleans to a prince living in Paris ♥️,1676,8
Looking good for 13,1677,8
The resemblance is uncanny,1678,5
They grow up so fast,1679,7
Greatetht bokther of all time,1680,8
In the 15th century the literacy rate in Italy was 15% one of the highest in Western Europe By the 18th century it had increased to just 23% one of the lowest [OC],1681,7
TIL Abraham Lincoln prior to becoming President was an avid boater and traveled on the Ohio and Mississippi rivers where his boat often got stuck on sandbars In 1849 Lincoln invented a method for Buoying Vessels Over Shoals making him the first and only US President to receive a patent,1682,8
2meirl4meirl,1683,9
TIL that dragons leave footprints behind when they land,1684,6
Who else loved superb Archimedes,1685,8
Poll Trump picked as worst president since World War II,1686,2
Happy goat loves his bestie Michael even though Michael thinks its too hot outside to cuddle,1687,9
Who lives in a pineapple under the sea this set is not for you if you have OCD,1688,8
Meanwhile at the Canadian diving academy,1689,8
Botanical acrylics 8 x 18 feet,1690,2
For April Fools they should replace the default announcer with Jeff from the Overwatch Team,1691,2
Custom hoverboard,1692,1
Tried to dry my hands Now theres trash everywhere,1693,1
This Day In 2001 Patriots sign QB Drew Bledsoe to a 10year $103 million deal as Robert Kraft says he’s locking up one of the great Patriots of all time He plays less than two games under the deal gets hurt gets replaced by Tom Brady & never plays again for New England,1694,8
Yeahabout that Jimmy,1695,2
I made a barrel wine rack for my Dads 60th,1696,2
Leslie Chow trying his best to make Duke likable,1697,8
James Comey to Make First LateNight Appearance on ‘Late Show With Stephen Colbert’,1698,1
SELF IMAGE DEPICTING STANDARD FACE SWAP MODULE OF CHOSEN SOCIAL MEDIA UTILITY,1699,2
Bacon served on a clothesline,1700,3
No thanks I am a vegetarian,1701,2
Girlfriend has an admirer who appears to also be a motivational speaker Too Shay my friend Too Shay,1702,8
Dark Messenger pen and ink A3,1703,2
The bees should stop them,1704,4
Well Ill be a monkeys left nut,1705,2
My favorite tattoo Just as sharp and beautiful today as when I got it done in 2015 By the fantastic Dino Nemec at Lone Wolf in Columbus OH,1706,6
Slowly,1707,1
The Cincinnati Bearcats know how to do post game interviews,1708,2
038 Second Rubiks Cube Solve,1709,0
Trump administration quietly makes it legal to bring elephant parts to the US as trophies,1710,8
Take a seat Nick Fury,1711,1
TIL of Steve Comisar a man who sold solar powered clothes dryers for $4995 in national magazines Unsuspecting customers would receive a length of clothes line,1712,4
Political roasts are the best roasts,1713,6
Case closed,1714,8
My 17 year old Corgi passed away last year and I decided it was finally time to have another one in my life This is Toast and she’s the sweetest girl in the world,1715,8
lol omg dont come to school tomorrow 😂😂,1716,2
Creative editors,1717,3
This tshirt label has a bio of who sewed it,1718,9
I think its safe to say that Phase 3 is the best MCU Phase yet,1719,8
To hold the rings,1720,7
The best fix in season 3,1721,7
I think my brother doesnt fully understand why people do this,1722,8
Tit Slapper,1723,3
Running a wipe out track like its nothing,1724,4
Austrian farmer goes on a rant about Red Bull This is internet gold,1725,4
[poetry] just dudes,1726,1
Ropz has flashbacks near Vietnam,1727,5
Isnt it weird how we basically have an endless mental conversation with ourselves,1728,4
Clean sweep,1729,8
This isnt a joke Seriously  buy me,1730,8
Stuck the landing,1731,8
Super Smash Bros coming 2018 to Nintendo Switch,1732,7
A harmless prank,1733,0
How Disneys multiplane camera worked,1734,6
A rare accomplishment a family photo,1735,2
Even the hat flipped,1736,9
Why can’t I do that,1737,8
A SnowKrumm I made last night,1738,8
Romeo and Juliet,1739,1
False news stories are 70% more likely to be retweeted on Twitter than true ones  and people not bots appear to be to blame,1740,8
If you pay to see the results of an online IQ test then you failed the test,1741,8
A sticker I designed,1742,4
This lady watching a beach wedding,1743,7
LPT Want a good dog Take them with you everywhere you go There is a reason that dogs of street people are amazing and coopedup condo dogs are hyperactive spaz dogs,1744,8
How these apples collide,1745,5
Just donated my kidney to my dad,1746,2
How Disneys multiplane camera worked,1747,6
This Chinese ad,1748,8
Dollar bills from 1935 without “In God We Trust”,1749,8
Searches for International Mens Day peak every International Womens Day [OC],1750,8
TIL of Cardinal Sin The Cardinal Jaime Sin from the Phillipines who was generally known as The greatest sin of all Cardinal Sin He was also known to jokingly welcome guests of his home saying Welcome to the house of Sin,1751,8
He finally changed his mind,1752,8
Actoronactor wholesomeness,1753,9
TIL that the set of Sesame Street was intentionally made to look like a poor inner city block complete with trash and decay because the original target audience was inner city children and the producers wanted it to feel familiar,1754,4
When your dangerous carefree past keeps coming back to haunt you,1755,4
Thousands of homes in Vancouver have been declared unused and liable for new empty homes tax as part of government attempt to tackle skyrocketing home prices and soaring rents After introducing 20% tax on foreign buyers city is continuing to tackle housing affordability,1756,8
Quick Reminder to Not Give Away Your Salary Requirement in a Job Interview,1757,8
Kim Jong Un invites Moon Jaein and Donald Trump to discuss denuclearization,1758,7
Steve Irwins in heaven,1759,1
Unsure how legal this is,1760,2
The Last Star,1761,8
Oklahoma Teachers union demands $10K raises increased funding for education state agencies,1762,8
Harvesting carrots,1763,7
Super Smash Bros for Switch Confirmed,1764,7
BBC News Trump approves controversial tariffs,1765,2
the pants,1766,4
Dude with 10 Charizard Pokemon Cards goes on Pawn Stars,1767,8
My bosss mousepad shaped like a tiny rug,1768,1
Truth in Advertising,1769,2
TIL Dylan McDermott was 5 years old when his mom died of a gunshot in 1967 Her death was ruled an accident at the time but Dylan was able to get the cold case reopened 40 years later Through the new investigation they discovered a coverup and that her boyfriend (a known gangster) had murdered her,1770,8
Super Smash Bros Trailer for Switch,1771,7
Liquid 4 Life,1772,4
Russian state TV anchor warns traitors not to choose the UK as a place of abode,1773,2
Climate change skeptic thought hed found a real zinger of a post to share,1774,2
Eminems Lose Yourself one of under 20 songs to reach Diamond Certification by the RIAA,1775,7
Good news,1776,8
Visionimproving nanoparticle eyedrops could end the need for glasses,1777,1
I stand corrected,1778,6
The sun came through the window of my new apartment and hit a mirror setting my carpet on fire,1779,4
hmmm,1780,2
Super Smash Bros 2018 Teaser,1781,7
wee woo wee woo,1782,5
[Homemade] salted caramel cheesecake,1783,7
I wonder if he will take me to court 👀,1784,1
TIL Joan Murray survived a 14500 ft fall when her main parachute failed while skydiving She landed in a fire ant mound Numerous venomous stings caused an adrenaline rush to keep her heart beating long enough for doctors to assist,1785,8
me irl,1786,1
Jon Favreau to Executive Produce and Write LiveAction Star Wars Series,1787,7
New Boyfriend,1788,8
Splatoon coming to Smash for Switch,1789,7
In Monty Python and the Holy Grail you can see Sir Bedevere finding out the airspeed velocity of a laden dove before he helps the town with their witch problem,1790,4
LPT When you break a glass on a hard floor shine a flashlight parallel to the floor so you can see the shadows of tiny pieces you would otherwise miss,1791,8
woof irl,1792,1
Super Smash Bros is coming to Nintendo Switch (official video),1793,7
GOP Sen Jeff Flake to Introduce Bill to Nullify Trump’s Tariffs,1794,2
Tennessee GOP kill bill to ban child marriage,1795,7
TigeR SnEaKS Up On MaN AnD StIcKs HiS ClaWS iNtO HiS SidEs KilLiNg HiM,1796,4
Dancing,1797,6
My dad caught the moment I opened Pokemon Red back in 1999,1798,4
She made me say wow,1799,8
Someone should keep an eye out on this guy,1800,8
Dangerouslooking mantis,1801,5
Call the police We have a breaking and entering,1802,8
Not gonna lie Im impressed,1803,4
Yo WTF he got shot outside of the map lol,1804,8
Former US Ranger demonstrates the Ranger Roll,1805,2
No Violence To The Sky video mapped drawing 2m x 2m,1806,2
CNN Trump upset with Sarah Sanders over handling of Stormy Daniels questions,1807,1
Girl plays with German Shepherds,1808,4
I got a new pair of gloves today but theyre both lefts,1809,8
Transformation,1810,1
Democrats Demand Rex Tillerson Explain Why Hes Not Spending Money To Stop Russian Meddling,1811,2
Oof thats cold,1812,8
Laced her feet and didn’t notice,1813,2
Mueller gathers evidence that 2016 Seychelles meeting was effort to establish back channel to Kremlin,1814,2
‘Selfdomesticating’ mice suggest some animals tamed themselves without human intervention,1815,8
Want to listen to Voyager 1s Golden Record NASA uploaded it to SoundCloud,1816,1
When I want my gif to include a meme Ive never used before,1817,8
PsBattle this dog with blue eyes,1818,8
The young lady who helped the elderly man cut his ham at Waffle House was given a $16000 College Scholarship by the mayor,1819,2
Cant fool the generation raised in BS,1820,1
Theories,1821,8
to rip jacket,1822,8
When was the last time you drank straight mixer,1823,8
My custom plate finally arrived,1824,8
A lot can change in 3 years,1825,8
Companys Policy All beverages must be in a cup with a straw too amused to argue with the employee loophole discovered tonight,1826,8
I thought this was a really good one,1827,8
Need new coasters Go to the tile store Just stick adhesive felt or cork on the underside,1828,8
Someone took their Adderall today,1829,8
Vet’s mew surgical assistant,1830,6
Took a picture of the Chicago skyline as my phone vibrated and it distorted the picture,1831,8
This is the first flower ever grown entirely in space,1832,8
gaming platforms portrayed by Spongebob,1833,1
Magic pill,1834,8
TIL Apple seeds do not produce the same apples as their parent To keep the same flavor apple trees must be grafted Every Honeycrisp apple you have ever eaten has come from the same tree just split apart,1835,1
Following doctors orders,1836,8
Me🙂irl,1837,9
Rohrabacher under fire over Russia ties,1838,2
me irl,1839,1
Remember saying this to mum when I was younger It did not go down well,1840,8
I made diamond and sapphire earrings for my girlfriends birthday,1841,7
The homeless in San Diego are getting jobs  thanks to a 16yearold boy,1842,8
A bird making Itself Some Accessories,1843,4
DeRozan with the clutch posterization  TSN,1844,7
Gave everyone with hair the Steve Rogers treatment,1845,4
Why does Winston not like Pharah mains,1846,2
A harmless prank,1847,0
Saw someone explaining indentation to their friend on a Facebook thread Nailed it,1848,8
Must be that new Xray windshield,1849,1
When we encounter another individual truly as a person not as an object for use we become fully human Martin Buber,1850,8
Winter map like THIS Ive spent 100+ hrs over the past few weeks on a winter map concept based on Scandinavia Welcome to Nördheim,1851,8
I live in Switzerland This is the train i commute to school with,1852,8
Code never lies,1853,8
They put ice in my milk,1854,2
Poetry In Motion,1855,7
On the coast of British Columbia a mutation causes some black bears to be born white These are known as spirit bears and have a prominent place in First Nations oral traditions,1856,8
A First Nation in northwestern Ontario that had been under a boilwater advisory for 14 years now has clean water with the opening of a new treatment plant,1857,8
Which programming language should I learn first,1858,8
My wife asked me why I carry around a gun in the house,1859,8
I tell myself I don’t want one but then they do things like this ,1860,8
Mueller gathers evidence that 2017 Seychelles meeting was effort to establish back channel to Kremlin,1861,2
I spent almost a hundred hours hand painting quotes from the Dark Knight to create this painting of the Joker,1862,8
Scoo Driver,1863,4
Theres so much joy in this video,1864,1
5 bucks at the thrift store,1865,4
BotW Link confirmed for Super Smash Bros for Switch,1866,7
A bird making Itself Some Accessories,1867,4
Always 2 there are,1868,4
Even the hat flipped,1869,9
Now I know who she reminds me of,1870,3
The world’s biggest seafood firms are all contributing to the deaths of more than 100000 whales dolphins seals turtles and seabirds that are killed in agony every year by discarded fishing equipment Litter from boats becoming so bad that oceans could end up empty of edible fish,1871,8
Give us that wholesome predator cut,1872,7
Sister always steals my food I make a fool of myself on her graduation to stop her,1873,8
How to get free food from a vending machine,1874,8
meirl,1875,2
This feral cat lives in my barn and stands to be pet,1876,8
Cabin in Alaska after a fresh snowfall,1877,6
Dude just got a sister it’s a bit of an adjustment Reddit meet Boo (on the left),1878,8
Im not sure thats what they meant,1879,8
Soe has received death threats for thanking men for their support for International Womens Day,1880,8
This tattoo,1881,6
When the Ts Align,1882,6
Hey Im James Cordrey the guy that brought you Drunk Christmas Cards Now Im doing something crazier Running for State Representative in Missouri Ask me Anything,1883,4
[Line Rider] gottem,1884,0
“We’ll always be friends forever won’t we” “Yeah forever”,1885,6
Everyone is always praising Judge Judy but I think we all know who the best judge is,1886,8
This was sent out at my school and legit had me worried,1887,2
Happy international womens day from my two good girlies,1888,8
LPT Magnify your phone screen by putting it in a glass of water,1889,8
Just visited the new mall that opened recently and saw this beauty,1890,8
TIL of William Kamkwamba who at the age of 15 taught himself how to build windmills out of junk to provide his family electricity and later to pump water for his community that was suffering from a huge drought He did all of this through library books as his family couldnt afford schooling,1891,2
TIL Aztec midwifes advised women to continue having sex until the 7th month of pregnancy saying that if women abstained their children would be sickly and weak,1892,2
My little Freya,1893,7
Would it surprise anyone if Bethesda did this,1894,2
This relatable billboard at my university,1895,0
An Idiot crossing the tracks,1896,9
Ken Bone wears Teddy Fresh,1897,7
I thought these games were difficult,1898,8
Round 2,1899,4
[EU]You ask for unlimited bread sticks as your final meal and the prison obliges The warden brings you the first basket of bread sticks sets them down and says as soon as you stop eating,1900,0
My vegetarian niece visited last night and I couldnt get this out of my head,1901,8
[Adrian Wojnarowski] Free agent guard Derrick Rose is signing with Minnesota for the rest of the season league sources tell ESPN,1902,2
You have to trust your gut,1903,4
Reverse Sear a Ribeye in the Oven,1904,5
If there was “no collusion” why did the Trump transition team work so hard to set up a back channel with Russia,1905,8
What a kind pedestrian,1906,4
Mercy Gets Two Guns,1907,8
In response to the hat flip yesterday,1908,8
[Poetry] When you have to drive an automatic,1909,3
Not sure if anyone has seen this before but my friend found this in Melbourne,1910,8
The hierarchy of our family explained in one picture,1911,2
The face he makes right before he zooms,1912,2
Time for Some Serious Protection,1913,8
TIL The most successful Bond movie ever is Thunderball released back in 1965 The movie made over $141 million which amounts than $1 billion today when inflation is adjusted,1914,8
Wellbehaved girl is excited to be an inside doggo today I introduce you all to Nelly,1915,8
Replaying Kingdom Hearts on Proud Mode and all I could think of was this image,1916,2
Stormy Daniels bringing down Trump would be the poetic justice America needs,1917,2
Episode nine name leaked,1918,4
ELI5 We know the body “burns” fat when losing weight but how does it get rid of all the extra nerves blood vessels and skin cells it creates when gaining weight,1919,8
TIL that Baby Got Back by Sir Mixalot was a call to see beauty in diversity Sir Mixalot used the song to blame the media for skewing the notion of beauty and hoped his music would empower women of all shapes and sizes,1920,4
Im not sure thats what they meant,1921,8
Menu said “spaghetti *on* toast” I beg to differ,1922,4
Trucker helping a stranded motorcyclist,1923,7
Republicans are starting to panic about next weeks Pennsylvania congressional election,1924,7
Keanu getting his star on the Hollywood Walk of Fame,1925,8
Hide your girlfriends,1926,1
The Literature Club,1927,2
ITAP with my two best friends under the stars,1928,8
Havent seen one this bad in a while,1929,8
There is no Plan B Morty,1930,2
2meirl4meirl,1931,9
This banister covered in snow looks like an old lady with an old timey hat and scarf,1932,8
That’s why I’m here,1933,8
Robbing a bank doesnt always go to plan,1934,8
Its told that the camera adds 10 pound,1935,8
My son born at 24w1d has had heart eye and stomach surgeries Now 144days going strong,1936,8
[Serious] Derrick Rose has suffered I wish we as both fans of the game and as human beings could support him like we have the other players dealing with Depression,1937,2
How easy my friend makes this game look,1938,8
I’m the second one from the left Also I’m not a girl,1939,8
Duck tape By @Hombre_McSteez,1940,1
This cozy little geodome,1941,7
In honor of International Womens Day I would like to say thank you to the true Caretaker of the world,1942,8
Would make 20v20 much more interesting IMO,1943,8
this guy has posted about 200 posts asking people to help pay off his house,1944,8
Hitchhikers Guide 40th anniversary tribute in LEGO,1945,0
Little girl tries wasabi for the first time,1946,8
You never realise how boring you are until someone asks you what you do for fun,1947,2
The joy on Queen Elizabeths face whenever she is feeding her horses,1948,4
I think theyre lovely,1949,8
Space Sleeve (unfinished) done by the talented Peter Nelson of Lord Nelson Tattoos in Chester England,1950,2
The dead pool in Deadpool features celebrity references Ryan Reynolds included,1951,1
Photo of her new grandson,1952,8
Abu Simbel + Cyberpunk,1953,0
If your boyfriend,1954,4
Anime_Irl,1955,2
1vs9 clutch ,1956,9
Its furry breathes smaller than a tangerine and I found it in coastal San Diego today,1957,8
Value of the US Dollar,1958,8
US not coordinating against Russian cyber threat top general,1959,2
Artichoke Spinach dip [homemade],1960,7
Animation Cel of Violet Evergarden,1961,4
Pouring A Red Bull Like A Boss,1962,8
How could we be so blind,1963,8
When you have to wake up an hour earlier because of Daylight Savings Time and someone tries explaining how Daylight Savings Time works to you,1964,8
TIL in 2002 Microsoft forgot to pay to renew one of their domains and a random guy paid the bill so he could check his hotmail,1965,8
Based on a true story,1966,8
[SPOILERS] I found my new phone wallpaper 😍,1967,8
ACTually,1968,8
Happy Womens Day R6 Community,1969,8
Things Are So Bad For Paul Manafort He Now Has To Wear Two GPS Monitoring Bracelets,1970,8
Poor aul Hozier,1971,7
YouTubes policies all make sense now,1972,8
North Korean leader to visit South for first time,1973,8
UPDATE I won my case against former employer without a lawyer Its been almost 3 years I want to thank the community for the directionadvice,1974,8
Disaster movies really over estimate the average news anchors commitment to their job,1975,2
Ah You Got Me Is He Still Lookin Oh Crap,1976,8
Pharma bro Martin Shkreli sentenced to 7 years in prison,1977,4
3 of them are hand drawn Guess which one,1978,8
TIL China creates so much synthetic diamonds that are identical to real diamonds that prices of diamonds are being driven down and De Beers has created a university to study how to identify natural and man made diamonds because no experts can tell the difference,1979,7
Mark Hamill got his star today,1980,8
More please,1981,7
Civil rights pioneer Viola Desmond a black woman who refused to leave the whitesonly section of a Canadian movie theatre in 1946 – nearly a decade before Rosa Parks’s act of defiance – has been honoured on the country’s newest $10 bill,1982,8
Candy machine at my work spreading hope,1983,2
The young lady who helped the elderly man cut his ham at Waffle House was given a $16000 College Scholarship by the mayor,1984,2
The arm of a Tyrannosaurus rex is only about as long as mine,1985,8
No,1986,0
Popsicle Stick circle,1987,8
When president Obama visit Vietnam he went to a restaurant and the deskchairs he sat on now on display,1988,2
The remains of my latte made a map of the world,1989,7
Never forget,1990,8
Human rights defenders who challenge big corporations are being killed assaulted harassed and suppressed in growing numbers Research shows 34% rise in attacks against campaigners defending land environment and labour rights in the face of corporate activity,1991,2
Baseball fan army crawls back to seat so as to not obstruct the view of his fellow humans,1992,2
Curious Emperor Penguin in Antarctica investigates camera,1993,4
The intern struggle,1994,7
Dear Parents These ratings exist for a reason,1995,8
Doing lots of exercise in older age can prevent the immune system from declining and protect people against infections Scientists followed 125 longdistance cyclists some now in their 80s and found they had the immune systems of 20yearolds The research was published in the journal Aging Cell,1996,8
George Lucas when the prequels finished,1997,7
Greg Popovich conducts a vote on whether to let Patty Mills keep playing while in foul trouble,1998,8
I think Ive peaked Its all downhill from here,1999,8
Getting a traffic ticket,2000,3
When roommates disagree,2001,0
The fact that Bings first suggestion is Google instead of goggles when you search for goggles is a good indicator as to why they arent the #1 search engine,2002,8
RIP to the Civic,2003,2
North Carolina police officer resigns after beating choking and tasing suspected jaywalker,2004,8
safety first,2005,8
I fixed the bathtub faucet boss,2006,8
Heat Map of 1058383 Basketball Shots from NCAA Games [OC],2007,7
Always in our hearts,2008,4
Former US Ranger teaches you how to quickly pickup someone significantly heavier than you,2009,2
I I just wanted a soda,2010,2
Ouch,2011,3
Stubborn jar [OC],2012,7
The old cartoon network,2013,7
The answer is obvious,2014,2
[I ate] An ice cream taco,2015,3
🔥 Arctic fox carrying a goose egg 🔥,2016,1
Tiny tiny shells,2017,5
Happy women’s day,2018,8
A live version of Theyre Taking the Hobbits to Isengard that I never knew I needed,2019,8
Denis Villeneuve Is Planning At Least Two ‘Dune’ Films,2020,8
InGeNiUs KiD,2021,7
Basic necessities,2022,4
Retail Sales,2023,8
If you truly think violent video games are the problem,2024,1
Baby chameleons,2025,7
Beast from the East  from the recent snowstorm that passed thru Ireland,2026,2
In Chicken Run every character has something around their neck usually a scarf or necklace to hide the seam of the models detachable heads,2027,8
