Title,doc,topic
[WP] Time travel exists By law every citizen is given one day they may repeat on loop until they get it right This morning you found your spouse looking exhausted and crying I cant save you Ive tried hundreds of times,5881,2
Because technology,5882,8
I met my best friend 7 years ago on PlayStation We met this week for the first time [image],5883,2
We got married yesterday my favorite picture from the day,5884,2
The “1st” Thanos [BTS circa 2011  Avengers],5885,5
Map of the series of earthquakes reported in the days since fracking has resumed in the Blackpool area after a seven year hiatus [OC],5886,2
*cries in johnny sins*,5887,7
Brian Kemp Caught on Tape Warning His Donors About Black People Voting  Again,5888,2
but is the bus driver ok ,5889,6
12 year old girl leaves hidden note in her parents car OP find its 12 years later and the post is discovered by the (now grown up) girl Shes been a redditor for nearly a year,5890,2
Starbucks opens a store with employees who know sign language and are partially deaf Customers in DC are delighted,5891,2
MRW when we set the clocks back for Daylight Savings,5892,2
LPT How to make infinite money,5893,2
Tracy Chapman sues Nicki Minaj over unauthorised sample,5894,9
It‘s Wednesday my dudes,5895,1
TIL that on October 24 1975 an estimated 90 percent of women of Iceland participated a “women’s day off” to demonstrate the value of their work both paid and unpaid Fathers had little choice but to bring their children to work or stay home themselves leading them to call it “the long Friday”,5896,2
Solution,5897,9
Conicus Watcher of the Terminal Ramp,5898,0
Sean Connery on set of Thunderball with Bond girl Claudine Auger (1965),5899,7
Go on say the line,5900,2
The hottest one in the store right now Invest now,5901,2
Let it down gently,5902,2
I accidently dropped my AK at the wrong time,5903,1
me irl,5904,8
This is why I should never edit a video for 3 months,5905,2
I fall asleep watching my boyfriends YouTube channel so he gets more views on his videos because it makes me happy how excited he gets about more views,5906,2
Nordic Gang,5907,6
Tim Cook data privacy speech Apple CEO calls for comprehensive data laws in America,5908,1
Step tippytaps,5909,0
She gets to start this adventure with no idea whats ahead Im jealous,5910,2
Give me that shoe polish look Fam,5911,2
You lovely thing tilt your screen into view,5912,2
help help,5913,6
ESPNs Monday Night Football is close to unwatchable,5914,6
After 2 years and thousands of hours of work this is ODYSSEY A STAR WARS STORY Hope you guys enjoy,5915,2
An eye disorder may have given Leonardo da Vinci an artistic edge A neuroscientist offers evidence that the artist had exotropia  in which one eye turns outward  enabling da Vinci to switch from 3D to 2D and back again with ease to more easily translate details into two dimensions,5916,2
Since chupinazo seasonal skin from year 2 season 1 is one of my favorites i decided to replicate it on GTSport Thoughts,5917,2
G O C O M M I T D I E,5918,1
WHAT HAVE I DONE,5919,2
The Boy Who Just Wanted To Fit In,5920,2
One day Ill succeed,5921,2
The past three days of this sub,5922,2
This can happen,5923,7
🔥 Tawny Owl agility,5924,1
What are the odds really though,5925,6
LPT To make being gay a choice,5926,2
Well Aang escalated quickly,5927,6
Bathtub Zoomies activated,5928,9
Ellen Page the early years,5929,2
Sergei in training,5930,4
He loves his new hat,5931,2
As a father I finally understand why my back is sore,5932,2
[WP] On one hand youre average at everything On the other hand youre average at EVERYTHING,5933,2
MELMETAL  Official Artwork,5934,7
We dont serve your kind,5935,6
I know more than you,5936,2
Just got Photoshop Its been a productive day,5937,2
I mean it,5938,4
Friend found this in her neighborhood,5939,2
Comparison of the progress Ive made in my game (The Pedestrian),5940,8
These dudes at my wife’s work Halloween game is respectable,5941,1
LEEEEEEEEEEEEEEEEEAVES,5942,1
Another useless talent,5943,2
Seven years ago I was yelled at go back to your country in high school Today I finally became a US citizen,5944,2
Baby Khajit,5945,4
Men should be cuddled too ❤️,5946,7
Ive never seen a baby squirrel I am not disappointed,5947,1
My nephew nailed his Ace Ventura costume,5948,1
That selfie,5949,2
When I trimmed a piece of Velcro and wound up with a perfect little line of hooks along the scissor edge,5950,2
TIL about Nelly Bly America’s first investigative journalist who faked being crazy and was sent to an asylum where she experienced misdiagnosis abuse and harassment In 1887 “Behind Asylum Bars” was printed A grand jury investigation soon forced NYC to allocate more money for the mentally ill,5951,6
The son of murdered journalist Jamal Khashoggi has left Saudi Arabia after the travel ban was lifted,5952,1
Strong magnet & clay,5953,6
Psychedelic psilocybin therapy for depression granted Breakthrough Therapy status by FDA,5954,4
A toucan’s skull,5955,1
I always follow the rules,5956,2
Dress code,5957,4
Taron Egerton training for the upcoming Robin Hood movie,5958,4
A beautiful moment in Reddit history,5959,2
This toy airplane,5960,6
Those beautiful ears,5961,2
My boyfriend carved another AMAZING pumpkin,5962,2
Weed brush,5963,2
Dedication,5964,2
What is a fun game you play in your head to kill time,5965,2
61% of “EntryLevel” Jobs Require 3+ Years of Experience,5966,7
My Local EbGames is adorably excited about Red Dead Redemption 2’s release,5967,2
Shout out to caring parents,5968,6
using facebook is like time travel,5969,2
Cannabis pain relief without the high  In the wake of cannabis legalization Canadian scientists have pinpointed the effective dose of marijuana plant extract cannabidiol (CBD) for safe pain relief without the typical high or euphoria produced by the THC,5970,7
TIL Eleanor Roosevelt held weekly press conferences and allowed female journalists to attend forcing many news organizations to hire their first female reporters,5971,2
These instructions suggest that Germans take less time assembling a couch,5972,2
Trump claims ‘I rarely use a cellphone’ in tweet sent from iPhone,5973,2
My drawing of Childish Gambino,5974,1
We live in an age where if Amazon actually offered a free $50 gift card or Apple wanted to give a free iPhone 10 away nobody would believe them,5975,2
My girlfriend made me these from scratch She was embarrassed to give them to me but I think they are friggin awesome Thought I’d share with y’all,5976,2
RDR2 looking awesome on the Switch,5977,7
Not on my watch,5978,2
MRW I walk into my friends house and his parents are screaming at each other,5979,2
Genius Madlad,5980,3
I did not expect that,5981,6
This creepy pizza serving its own kind as food,5982,6
Michelle Pfeiffer  1970s,5983,7
We recommend Beto ORourke for US Senate,5984,2
hmmm,5985,2
The obstruction of my front door that prevented UPS from delivering my package,5986,8
Beto ORourke Earns the Endorsements of Texas Two Largest Newspapers,5987,2
Over the Moon,5988,2
My first birthday (1986) vs My son’s first birthday (2018),5989,2
Reports Megyn Kelly out at NBC,5990,2
The UN estimates that there are currently 77 billion people alive on Earth What is something not even ONE of them is doing right now,5991,2
After years of borrowing other people’s dogs trolling raww and talking about how much I want one Meet my baby girl Lyra,5992,2
Father and son switched places for Halloween,5993,1
Always beware of Thwomp,5994,2
Help,5995,6
TIL Bert Williams a black man and the most popular vaudeville minstrel star of his time went to the Hotel Astor in New York and when the bartender trying to get rid of him told him drinks were $50 because of his race Williams pulled a wad of $100 bills and bought a round for the bar,5996,2
Adam Sandler looks like he owns about 4 strip clubs,5997,6
The EU Just Voted to Completely Ban SingleUse Plastics,5998,2
Whats your biggest This isnt what it looks like moment,5999,2
she should have listened to my dad,6000,2
Star Wars took place way in the past really far away but we are seeing it now because of how long it took for the light to reach us,6001,2
Saudi Arabia now says Jamal Khashoggi was killed in premeditated murder,6002,1
A Hindu a Rabbi and a Jehovahs Witness are lost,6003,1
Perfect save,6004,2
Nice one RBS,6005,2
Dont worry fam,6006,2
hmmm,6007,2
This madlad,6008,3
Kids sing happy birthday in sign language for deaf custodian,6009,4
Uncanny,6010,4
This photo made my day a little brighter and I hope it does yours too(,6011,2
I think Im lostagain,6012,1
Whenever I take a shower,6013,2
A President Who Hates Half The Country Doesn’t Get to Call For ‘Unity’,6014,2
You will not take him from me,6015,6
What may be that joke,6016,2
This foster dad provides a loving home to children who need it the most,6017,2
Son and father switched places for Halloween,6018,1
2meirl4meirl,6019,2
This beer can explains how to turn a ringpull into a fishing hook,6020,6
Literary teacher be like,6021,6
Suspect package found at De Niro restaurant,6022,2
This really satisfying graffiti,6023,6
What I quit my job a year ago to finish Finished today,6024,2
I have never seen a baby crow or even thought of it I want now,6025,2
G Y M G I R L S doing a snuggle,6026,1
I see this at my university every day,6027,2
In Harry Potter and the Goblet of Fire (2005) you can see the snake Nagini slithering in the reflection of the Warner Brothers logo a subtle detail thats easy to miss The first shot in the film is of Nagini slithering toward her master,6028,4
🔥 The Sebright chicken gives you the impression it needs to be colored in,6029,2
Picture Cube,6030,1
Hanni🅱️al,6031,9
Picture Cube,6032,1
This sums up my day Why isnt my stock simmeringits been over an hour,6033,2
Wait for it,6034,2
A True 9 Year Old,6035,2
Freddy Mercury Halloween Costume,6036,1
Father and son dressed up as each other for Halloween Its uncanny,6037,1
Double,6038,4
1066 WORST YEAR OF MY LIFE,6039,2
Woman looking for someone to walk her dog every day for free gets called out in the comments for asking someone to do it free when she charges people $20h to walk their dogs,6040,2
All bark no bite,6041,8
Cotton candy colored pencil 8x10”,6042,7
This is how I am,6043,0
Dropped a brand new gallon of milk As a bonus I also got a flat tire today,6044,2
Donald Trump blames the bombing victims That didn’t take long,6045,2
Who wore it better,6046,2
MRW Im at work browsing Reddit and hear my boss behind me,6047,2
A Jimmy Johns driver delivered an ailing veteran — who dialed the wrong number — to the emergency room,6048,2
Paper science,6049,6
Can you write where I can read it,6050,7
My 7 month old daughter ready to go out into the cold,6051,2
RDR2 confirmed GOTY,6052,4
Paul Bettany loved Mark’s TBT picture that much,6053,1
Kawhi Leonard reads the play perfectly,6054,6
Immortal memes,6055,8
Trump’s tapped phone may be the largest White House breach ever former official,6056,2
Driverless Cars Should Spare Young People Over Old in Unavoidable Accidents Massive Survey Finds  In the Moral Machine Experiment a survey of more than two million people from 233 countries people preferred to save young over old,6057,2
Wholesomeness during World War Two,6058,6
Bannon holds rally for Republican candidates but none show up,6059,2
me_irl,6060,7
Female game characters,6061,2
Aren’t some transgender people just enforcing the stereotypes of genders,6062,4
2010 was a damn good year for games,6063,2
On a post about the XXXTentacion audio clip where he confessed to stabbing 8 people among other things,6064,2
TIL the only university that would allow the movie Animal House to film on their campus was the University of Oregon The Dean of the school had previously refused to allow The Graduate to film there and didnt want to miss another opportunity so he gave them full access without reading the script,6065,2
This is the happiest dance,6066,2
Earth moves about one degree around the sun each day,6067,7
New copyright exemptions let you legally repair your phone or jailbreak voice assistants  The US Copyright Office has made it legal to hack your tractor,6068,1
After stem cell transplant man with MS able to walk and dance for first time in 10 years,6069,2
Zenyattas Nastiest Tracer blink prediction,6070,3
Blue Screen of Death,6071,2
The way she sits in the sunny corner of the room,6072,7
Just go ahead and dump my shrimp all over some empty beer cans please,6073,7
LPT making sure your teachers are passionate about teaching,6074,2
The manhunt FBI treating serial bomber as domestic terrorism,6075,5
Im crying (,6076,2
Our longest streak is two,6077,6
Just a few more days till the end of the monf,6078,2
PsBattle this cat catching milk in its mouth,6079,6
Safety first,6080,2
WhItE kIdS iNsULT a DeAf BlAcK mAn AnD mAkE hIm CrY,6081,2
I never really knew how long 15 seconds really was before this bad boy came into play,6082,2
The floor is all muddied this professor is a sham,6083,1
This is a cool concept as to how the “pickaxe backbling” could work,6084,2
I made a severed head hummingbird feeder,6085,6
Kowalski ______,6086,8
Ireland is about to vote on removing the offense of blasphemy from the constitution,6087,2
Empire testing our some cloud cammo,6088,6
China denies report it spies on Trump’s iPhone suggests he get a Huawei instead,6089,2
Oooooof,6090,1
thank you,6091,7
To ask for memes,6092,8
Vincent Van Doge painting “A Very Good Boi”,6093,2
Chicken Curry Naan Bowls,6094,6
Location location location,6095,6
He watches me scroll on Reddit before sleepy time,6096,1
Everything is cheaper at 9eleven,6097,2
New poll finds 57% of young adults believe Trump encourages violence against journalists,6098,2
He may not be a smart boy but he knows what love is,6099,2
Interesting opinion from King Richard that I completely agree with,6100,6
Quack,6101,4
Fs,6102,4
I did wanted to mess with the Witch spawning but uhm I wasnt expecting to get this kind of view,6103,2
Another one for the night lurkers,6104,2
void time 😎,6105,7
Meme review colab confirmed,6106,2
On an Australian meme,6107,6
A nice evening balcony,6108,2
I thought of a new emote Poke it with a stick For all those players that need a little BM when enemyteammates are knocked,6109,2
Me_irl,6110,7
LOOK AT HIS SMILE,6111,2
I think Toby and Angela are selling houses in my home town,6112,6
rpolitics might be 1 of the worst and most misleading subreddit,6113,2
Parks and rec coloring set,6114,6
Jim Henson and the Muppets Halloween Costume,6115,1
[Request] Networking Enhancements  Detailed Information And Roadmap,6116,7
Luigi knows whats up,6117,2
My sister is down since her miscarriage To cheer her up Ill get her ________,6118,2
Ugh sorry teacher 😫😫😫,6119,1
Ive been waiting for 24 years but I finally got a kitten Reddit meet Marley,6120,1
[Homemade] Bacon Cheeseburger Quesadilla w Guacamole & Pico de Gallo,6121,6
Posting to save a life,6122,2
For the first time in 6 years I’ve caught my cake day and I only have 5 minutes left so here’s my dog,6123,2
Pond in the woods,6124,0
[EU] With Voldemorts army closing in the students try one last trick they try to summon a power they have only a vague notion of from stories told by muggles After uttering Accio NATO air support,6125,7
You can now create an entire lineup of current managers in MVP Baseball 2005,6126,6
Drinking something with caffeine when you have ADHD is like playing Russian Roulette 56 times you get enough energy to complete a task but 16 times it just makes you sleepy,6127,2
Angry doot,6128,8
My first time carving a pumpkin in years Love the end result,6129,2
I was looking at this Yoga poster and I realised that the pose looked a bit like a kid going down a slide,6130,2
Musician has been advertising that he is touring with Marilyn Manson in 2019 gets called out when someone emails Mansons management,6131,2
Ethiopia gets first female president,6132,2
To those that dont like zombies in PVP just bee glad they didnt add this guy,6133,2
Let me buy it cheap while I call other people cheap,6134,2
[Image] Remember,6135,2
Im gonna say the f word,6136,2
Ill make you famous,6137,2
bye daryl,6138,3
woof irl,6139,8
it really do be like that sometimes,6140,6
Guarantee this kid will be scared of clowns,6141,2
Yeah sure Ill come back with ID  I only live around the corner,6142,2
Extreme VR,6143,0
More Spooky Halloween Pokemon This time its Hexkitty and Spellcatty,6144,1
Protip you cant,6145,2
Spotted at my local coffee shop,6146,1
Every year that I leave home to go back to college this handsome guy sits in my boxes to try and stop me from packing (and leaving him) Little does he know this time he’s finally coming with me,6147,2
[homemade] Crunchwrap Supremes,6148,6
Punishments shall be made,6149,8
[Wojnarowski] Story posting soon The Houston Rockets are making a renewed bid to acquire Minnesota AllStar Jimmy Butler including four future firstround draft picks in their most recent trade offer league sources tell ESPN,6150,2
Oh Hello there,6151,4
After Public Outcry Arizona Rejects AntiEvolution Science Standards for K12,6152,8
[OC] Transition Period,6153,7
Who remembers the struggles of trying to get the chest at the top of these containers,6154,2
PsBattle Cat brothers sleeping,6155,6
When you see that cute Dragonborn entering Riften,6156,7
English doesnt always translate well into Turkish,6157,2
Contessa with Squid Omar Rayyan Oil on Panel 2011,6158,5
Its treason then,6159,4
My first attempt at a DIY Halloween costume,6160,1
Cannabis Time To End The Ban (2018) | Over two million people smoke cannabis in the UK Some police forces no longer prosecute for possession Canada and several American States have legalised it So should the UK follow suit [2555],6161,2
Think About It,6162,1
Pretty much,6163,2
I DO work here lady,6164,2
A fine addition,6165,6
In Moana Maui is also a Disney Princess He needed to be rescued Has a small sidekick (his tattoo) And by the end of the movie had learned a valuable life lesson,6166,2
Have you ever been so desperately trying to avoid studying that you started shaving your pillow,6167,6
Texas election officials report complaints from voters who say machines flipped votes,6168,2
TIFU by trying to visit my girlfriend,6169,2
So which version are you getting,6170,2
Braineating amoebae which are almost always deadly killed by silver nanoparticles coated with antiseizure drugs while sparing human cells finds a new study,6171,2
Spooky Bridge with foggy buildings,6172,6
He warned us,6173,2
Me🚽irl,6174,4
I thought it looked familiar,6175,6
And it was that day Jon knew he was gay,6176,4
Elon Musk please buy,6177,2
[WP] Death is a gentle thing if you welcome it,6178,2
THE END IS NEAR EVERYBODY THE END IS NEAR,6179,2
I was watching Jurassic park the other day,6180,2
5 years ago today the rose was removed from Minecraft,6181,2
Unsupervised human workforce,6182,4
Found my PS4 buried under soaking wet sheetrock and insulation after hurricane Michael destroyed our home recently Alittle worse for wear but functioning like I just took it out of the box [Image],6183,4
Mitch McConnell says it out loud Republicans are gunning for Social Security Medicare and Obamacare next,6184,2
Part of the Halloween display my wife and kids put together,6185,6
2 years and 1 baby later my husband finally finished his massive hidden object tortoise,6186,2
Blue screen of death,6187,2
Uber driver hair formed a perfect 25,6188,6
Ever been licked so hard it drags you across the ground,6189,2
Congratulations to Red Dead for nearly being as good as Wii Sports,6190,2
Van Gogh Halloween costume,6191,1
Giving credit to those who do what we dont want to,6192,2
Hes practicing for pageants,6193,2
Fahrenheit is basically asking humans how hot it feels Celsius is basically asking water how hot it feels Kelvin is basically asking atoms how hot it feels,6194,4
The MAGABomber’s van,6195,1
Good Morning from Alabama,6196,2
TIL lack of personal hygiene and body smell is such an issue at Super Smash Bros tournaments that some tournaments now disqualify players not keeping up with hygiene and even resorted to passing out deodorant,6197,6
The pattern my coffee made after I fell and the cup rotated on the floor,6198,8
Obama If Republicans really cared about Clintons emails they would be up in arms over Trumps iPhone,6199,2
Fun fact Cheetahs cant roar so instead they meow similar to house cats,6200,2
Using a hotknife to cut away excess foxing tape from a pair of Vans,6201,0
An actual interview going on at the office We take Halloween very seriously,6202,2
The future of gaming,6203,2
TIL while assisting displaced Vietnamese refuge seekers actress Tippi Hedrens fingernails intrigued the women She flew in her personal manicurist & recruited experts to teach them nail care 80% of nail technicians in California are now Vietnamese—many descendants of the women Hedren helped,6204,3
TIL In an effort to reduce drunk driving the city of Austin TX will waive parking tickets if a receipt showing that a rideshare company taxi or bus was used within 24 hours of receiving the ticket,6205,2
Portal Halloween costume,6206,1
18 Year difference,6207,2
I was trying to be as accurate as possible and discovered The Rock had a napkin under his elbow Keeping it clean since the 80s,6208,2
When my neighbour’s dog comes over and always wants to play We live on the end of a deadend road in the country so he comes over all the time It’s great like he’s my dog for a hour a day,6209,2
Star Wars jackolantern,6210,7
Adopted this handsome boy from the shelter yesterday,6211,2
Lucasfilm confirms the Boba Fett Star Wars movie is 100% dead,6212,2
Look at his stupid face,6213,2
Better start installing,6214,1
Humans are most physically vulnerable when naked yet nothing is more physically threatening than a naked person running at you,6215,2
My twin cats meeting their new baby brother 😹❤️,6216,2
Robotically giving a street performer change,6217,2
Does this work,6218,2
Hole in one,6219,7
catwalk,6220,0
After 11 years in the US I finally became a citizen this past July Voting has been a dream of mine and I finally can,6221,2
Good boy gets his own jackolantern,6222,2
Verified fake account,6223,7
This is how trust looks like,6224,6
Sorry kid I tried to help,6225,6
Truth,6226,7
Michael knowing the name of Angela’s cat was an awesome detail by the writers,6227,7
Netflix lost $39 million sacking Kevin Spacey and scrapping his last movie Gore,6228,7
Uh huh,6229,5
Respect your liver🙏🙏,6230,7
What’s for lunch,6231,2
Vive la Belgique,6232,7
An Ojibwe Native American spearfishing Minnesota 1908,6233,7
Mans wife has a better explanation for where this frog came from,6234,2
Double standard,6235,4
You seem a decent fellow Id hate to die,6236,6
How to buy Red Dead Redemption 2,6237,2
hmmm,6238,2
Men of Reddit what do you put in that tiny pocket in the right side front pocket of your jeans,6239,6
One job should be enough Marriott hotel workers strike hits eight US cities,6240,2
I took great pleasure in this (Havent seen this person since high school and even then I dont think we ever talked to each other),6241,1
The Dont text and drive signs on the highway are probably not seen often by their target demographic,6242,2
Can i get my 16 upvotes,6243,2
TIL Inspired by a Renaissance writer who said a wellrounded man should be an artist,6244,2
This is getting out of hand,6245,4
Horse Bodyguard,6246,7
ManSpider [OC],6247,7
Donald Trump Repeats Lock Him Up Chant About George Soros Minutes After Calling For Unity Around Bomb Threats,6248,2
Get yourself together Karen,6249,2
My husky finally got to cuddle the cat without being bit and she couldnt be more surprised,6250,2
Texans say voting machines are flipping selections to the other party,6251,2
me_irl,6252,7
My niece is Boo from Monsters Inc for Halloween,6253,1
me🎂irl,6254,5
Thanks Satan,6255,2
🔥 Bizarre and beautiful heirloom carrot called Turkish Black 🔥,6256,2
to make fun of someone,6257,2
Press F to pay respect to Elon,6258,2
During the battle of Hogwarts one of the giants uses a broken Quidditch goal hoop as a weapon,6259,1
Net fix and chill,6260,7
In Terminator 2 the only time that the T800 and T1000 actually talk to each other they are both impersonating other people,6261,2
If you died tomorrow and it said Press X to spectate Who would you spectate and why,6262,2
My laptop was making funny noises today it sounded like it was singing,6263,2
Did you ever hear the tragedy of Darth Henry the Eighth,6264,2
We worked with Jamal Khashoggi We are Karen Attiah and Jason Rezaian of The Washington Post Global Opinions section Ask Us Anything,6265,2
How do you milk sheep,6266,4
Erased by the Light Ink on paper 13*8cm,6267,6
And it all unravelled,6268,5
Thought these boys could be here,6269,2
Harrison Ford  1980s,6270,7
A smoke alarm using a mother’s voice significantly outperformed a tone alarm in a new randomized trial The maternal voice alarms awakened 86%91% of children and prompted 84%86% to escape compared with 53% awakened and 51% escaped for the tone alarm,6271,9
My mom accidentally included a picture of me sleeping in an ad she posted,6272,1
Real men,6273,2
This Google Tasks guy,6274,2
Jamal Khashoggi praised Canada for ‘raising the flag’ on Saudi human rights abuses,6275,1
Ryan Gosling made a movie about space while not risking his life and made 66 times more money than Neil Armstrong who actually went to space with the risk of never returning,6276,2
Texans say voting machines changing straightticket choices,6277,2
me_irl,6278,7
Robot Workout,6279,6
When you rustle they hustle,6280,1
This goodboye had to get his leggy fixed and is vvv sad that doin a frolick is off limits for now plz send schmackos,6281,2
25 cents seems like too much,6282,6
The Driving Test,6283,2
Ying and Yang,6284,5
Our family costume this year,6285,2
Look dad Im making friends,6286,2
2meirl4meirl,6287,2
Shame on Halloween,6288,1
