Title,doc,topic
This is why I love reddit,0,8
Our boxer made a new friend today,1,2
Otter family,2,4
I almost died today,3,2
Pic of noodles at 60°C Concordia research station Antarctica,4,2
Good boy wanted some love so he interrupted football game,5,2
Red Dead Redemption 2 Comparison between platforms,6,2
Hopkins researchers recommend reclassifying psilocybin the drug in magic mushrooms from schedule I to schedule IV,7,4
Hang on I gotta get my moose,8,2
The first person to make ice cream probably ate all the ice cream in the world (at the time),9,6
25 years of sobriety and powerlifting,10,6
Especially with the new iOS measurement tool,11,2
3day weekends would make people happier and more productive according to a new Oxford University study,12,2
Police Sniper cloaked under a towel at an Orlando area hospital during a standoff with a suspect,13,1
Snug tiles,14,0
First Look at First Person Mode in Red Dead Redemption 2,15,2
TIL that honeybees let out a ‘whoop’ when they bump into each other This vibrational pulse long thought to be a signal to other bees to stop what they are doing might actually be an expression of surprise,16,2
Pokémon go Halloween costume,17,1
Send Dunes,18,2
DemocratRepublican divide is worst its ever been and neither party can shoulder the blame as it doesnt matter which party is in charge finds a new study published in journal Social Networks,19,2
Dont Dead Open Inside,20,2
Facebook hack gets worse as company admits Instagram and other apps were exposed too,21,2
TIL Elton John answered an ad for a talent search After failing the audition he told the person behind the desk that he cant write lyrics He was handed an envelope with lyrics by another person who answered the ad and failed the audition Bernie Taupin who then wrote the majority of Eltons songs,22,2
Art of Photography,23,2
Purest thing i’ve seen all day,24,1
I flew 5913 Miles to enjoy the view from the legendary California State Route 1 Worth it,25,8
Please like me Please take me,26,7
RV Camper Graphic Design Starter Pack,27,2
Size of the universe,28,8
This lady has been on the phone since she sat down while her kid is running around doing this to the salt shakers,29,2
The absolute MAD of this lad,30,7
Gov Brown signs tough net neutrality law sets up battle with FCC tech companies,31,8
I found my doppelganger at work,32,2
Outrage Grows As Omissions From Kavanaugh Probe Become Apparent,33,2
Pastor claims that you are robbing god if you do not donate 10% of your income Later says that being in debt is not an excuse and that donating 10% will eventually get you out of debt WTF,34,2
GunVault SVB 500 Opened With A Gum Wrapper,35,6
Oh no,36,4
Gov Brown signs California Net Neutrality Bill SB 822,37,8
meirl,38,8
How does this work so well,39,2
This is what an elephants tail looks like up close,40,6
The Path to Success,41,2
Lunch Atop Tilted Towers,42,7
Kavanaugh lied under oath Sen Patrick Leahy says,43,2
Watching two megachurch preachers defend ownership of their private jets and personal planes was one of the most surreal and absurd viewing experiences of my life,44,7
Jogging,45,0
What is your accidently caught your spouse cheating horror story,46,7
Bought this vintage shirt as a prop for a job at work Realized it matched my beard which also matches my dog Had to have a photo shoot,47,2
doot for visually superior only,48,8
Our landlords slipped this letter under our door this afternoon,49,2
The perfect wolf cloud,50,4
Not the Alabama kind,51,8
hmmm,52,2
I spent 4 minutes on this and Im here for my 6 karma,53,2
PsBattle puppy in a shopping cart,54,6
Idk who did this but it’s genius (Sound),55,2
Mutual friend of Ramirez and Kavanaugh anxious to come forward with evidence,56,2
This was posted by a local tattoo artist,57,1
This upside down billboard in Kings Cross Sydney Australia,58,4
ITS SPOOKTOBER AND SKELETON MEMES ARE ONLY GOING UP INVEST INVEST INVEST,59,6
Perseverance,60,1
What made you break up with the person you thought you’d marry,61,6
MRW a study finds that people would be happier with 3 day weekends,62,2
Time Traveling Florida Man,63,2
California Red Sided Garter Snake,64,4
Me trying to make small talk,65,2
Octopus attacked by numbray (one master of disguise vs another),66,7
hmmm,67,2
Her face,68,2
me irl,69,8
Advice for cashiers especially with the busy Christmas season coming up,70,2
Porknado Piglet Swarm Matron,71,0
Dogs are so stupid,72,2
Wait,73,2
Why was 10 traumatized,74,2
Let’s avoid that,75,6
It’s not about you,76,4
Gary is a liar,77,6
The look on his face,78,2
2meirl4meirl,79,2
A true smart TV would lower the volume of a shows intro music to match the rest of the volume of the show,80,2
This is Chloe She took a dangernoodle (copperhead) bite to the face last night protecting my dad And she got to come home today 1310 bravest pupper,81,8
I stole this and I am reposting it Happy Spooky Month,82,6
Exploring a wreck and suddenly,83,4
Honestly,84,5
Absolutely not a treat,85,5
Heart goes out to the 19yearolds,86,4
Colorado,87,8
TIL Joeys character in FRIENDS was not supposed to be dumb according to the original script It was only when Matt LeBlanc auditioned for Joey he put a different spin on the character,88,6
Martin Luther 1517,89,7
If Adrian Toomes had Eitri in the backseat of his car instead of Peter Parker,90,4
Money is a bit tight right now so I made some homemade Halloween decorations Turned out pretty good I think,91,2
My Kid Does Competitive Soccer Starter Pack,92,2
The look in his eyes,93,6
MoviePass getting even shadier after I cancelled,94,4
It’s meta time baby All in,95,4
Timoclea pushing the captain who raped her into a well (1659),96,7
Kavanaughs Yale classmate Brett once started a fight that ended with our friend in jail,97,6
Cutest ass,98,7
Indestructible Cloak II [OC] [Art],99,7
These elk playing in water so blue it looks like Gatorade,100,6
What is a silly lie you once told and you are in so deep that you have no other choice but to uphold it,101,2
Chiropractic treatment and vision loss  In rare occurrences forceful manipulation of the neck is linked to a damaging side effect vision problems and bleeding inside the eye finds the first published case report of chiropractic care leading to multiple preretinal hemorrhages,102,2
Flake says if FBI investigation finds Kavanaugh lied nomination is over,103,2
Why cant you hear a pterodactyl urinate,104,2
Designer where shall we put the strings to hold it Boss right here,105,6
How to get karma,106,2
🔥 Hammerhead Worm,107,2
[I ate] a freshly made Belgian waffle,108,6
We’re all the same when we get the guillotine,109,9
This is what happens when you dont follow rules 1 and 2 boys,110,2
,111,7
Just gotta flip it around a couple times,112,2
My local Costco in México was built around a Cenote (Mérida Yucatán),113,4
Anime_irl,114,4
MRW I get another @everyone on discord,115,2
Twins dressed as Slinky Dog from Toy Story,116,6
You have to either wipe or walk away without wiping Both choices aren’t pleasant,117,4
They hit a speed bump at high speed,118,2
🔥 Took this while on Tioga Pass this past week when the moon was below the horizon and Yosemite had a managed burn 🔥,119,2
Kavanaugh was questioned by police after bar fight in 1985,120,2
A Bright Dot Digital 1750x2450,121,7
TIL violent crime in New York City has been dropping since 1991 and as of 2017 is among the lowest of major cities in the United States In 2017 there were 290 homicides the lowest number since the 1940s,122,2
me💀irl,123,5
The last support,124,7
Simply amazing,125,7
💀Its💀spooky💀time💀my💀dudes💀,126,9
Military school dean fired after using cannabis to treat cancer,127,4
TIL that in 1913 Trotsky Stalin Freud Lenin and Hitler were all living in one neighborhood of Vienna at the same time,128,7
Bought an angle grinder and want to trim your grass and maybe have some fingers to spare,129,0
He just wants to drink water in bed but it keeps disappearing before he gets there,130,7
Ninja skills [OC],131,7
I hate this game,132,8
Voice actor for sheogorath Wes Johnson in uniform,133,9
Dogs have historically been a symbol of a paws in hostilities between North and South Korea  so Pyongyang has sent two pups to South Korean President Moon Jaein as a token of friendship,134,8
Nate is such an underrated character He brought a lot to the table,135,2
My secret girlfriend,136,1
999% tinfoil knight 15ish feet,137,7
[Update] Being sued for helping a choking victim (OR),138,2
And a doot doot,139,8
Plz do it Pewds,140,2
Millionaire Sen Chuck Grassley Applying For Trumps Farm Bailout Funds,141,8
that’s one way to do it,142,2
[SPOILERS] StarkTargaryen jackolantern with dragon projection in a craft pumpkin,143,8
Swimming pool untouched by dirty flood water,144,7
We’re all the same when we get the guillotine,145,9
The fact that the YouTube “dark” theme still opens up with this bright white loading screen,146,2
Dog steal key to prevent his humans from leaving,147,2
Been waiting to post this,148,2
Worm Monster,149,9
Pumpkin Despairs,150,8
excuse me wtf,151,7
When people ask me what Obiwan does in the prequels,152,2
To reach is owned [legit],153,2
2D Animation,154,2
Cat reacts to magic trick,155,6
Let battle begin,156,2
We use silverware every day but nobody even knows what brand they usethere could be a silverware monopoly going on under our noses and we wouldn’t know because we don’t even know what brand we bought,157,2
Row row row your boat,158,8
What are the odds lmao,159,7
Hitlab trying to drown target,160,3
HE HE,161,0
YOULEFTUSFORFOURDAYS teefies while trying to unpack,162,6
Ah yes I see,163,2
This is why they are endangered,164,7
Cat gets scared of owners facemask,165,2
My wife asked me what tendies were,166,6
Can a dad reflex score go into negatives,167,2
All of your social media today,168,2
Men can’t say the C word women can’t say ________,169,2
You cant  look away Halifax cartoonist on his image of Lady Justice with a hand over her mouth,170,2
The genie asked What’s your first wish Steve replied,171,2
Spooks R US,172,1
uHopefulList describes how certain online Mens groups teach men how to get away with sexual assault,173,6
Carrying a Boulder,174,1
ａｌｌ ｉｓ ｗｅｌｌ,175,5
Incredible throw in ultimate frizbee,176,2
ELI5 Why is lower stomach fat and lower back fat the slowest parts to get rid of during fat loss,177,2
I made a Plague Doctor fanskin for Ana,178,8
Didnt know why this wouldnt be on here,179,2
Just a friendly reminder to keep your eyes on the road especially if you have kids in the car,180,2
how many,181,2
This shot in the newest RDR2 trailer looks like the cover of the first game,182,2
Cant wait for Captain Marvel,183,2
How the Titanic sank,184,7
I have student loan debt I am very poor,185,8
Hes special,186,2
woof_irl,187,6
Went to Ireland for 10 days and brought my old pup back a sheep so he would forgive me for leaving him,188,2
0_0,189,6
Tastes like chicken,190,6
A friend posted this abomination in Instagram,191,6
I’m the first I’m the first Weeeeee,192,1
Trumpet > låmp,193,8
The game changer,194,8
I was homeschooled “Victorian Gothe”,195,5
In with the Spooky Memes,196,6
Ah I see youre a man of culture as well,197,2
The pewdiepie version,198,2
Audrey Hepburn 1949,199,7
Yay Grandma,200,4
If Achilles was a child today a razor scooter would be the most likely cause of death,201,2
Liquids,202,5
Claudia Schiffer 1992,203,1
Sen Collins wants 3rd Kavanaugh accuser interviewed as part of broader investigation,204,2
As a little kid in the early 80s this made my head explode,205,2
My Pizza Skull by Tomo at Victorian Tattoo Honolulu Hawaii,206,1
Original Wonder Woman Lynda Carter 1979,207,2
doot doot,208,8
Victim of the Jedi crimes,209,2
Not mine but I thought it belonged here,210,6
[Poetry] Deer Phil,211,8
Jeff Flake Says Brett Kavanaughs Nomination Is Over If He Lied to the Senate So What Are We Still Doing Here,212,2
82 Patch notes leaked  Azerite gets replaced by salt after backlash from Reddit comunity,213,2
Run The Jewels  Lie Cheat Steal [HipHop],214,2
Escapig the Uncontainable,215,5
Miu & Murr the twins Murr is deaf and doesnt know he makes murrrrr sounds everytime he thinks of something Miu doesnt ever meow completely she only makes tiny mi or miu sounds when she demands petting They love each other infinitely,216,2
I really love my local post office,217,8
LeVeon Bell comments “ I’ll be the bad guy for all of us” on a post regarding Earl Thomas,218,2
Not your Average Pokemon trainer X,219,1
An interesting shirt,220,2
Disco Domination LTM Coming Soon,221,2
Crochet Predator Costume by Crochetverse,222,1
LWIAY everyone,223,2
A wife was making a breakfast of fried eggs for her husband,224,4
in awe of the size of this pupper,225,8
Shes been posting basically the same thing every hour or so all day,226,2
WTF happened to my human,227,4
This cottage by the mysterious sea in the Faroe Islands,228,9
Who is good whos evil,229,9
When An Exorcism Is Needed,230,5
Göod boy master of deceit,231,6
Its Spooktober get ready,232,2
SLPT if a young customer is paying with their Apple Pay on their watch tell them that they’re what’s wrong with America and you’ll get a free cup of coffee,233,2
woof_irl,234,6
These tiny truck mints my wife got to give to her customers,235,8
[Richard Sherman] My question is why won’t they just put flags on the QBs They would rarely hit the ground then Guys would be able to grab the flags and that would be a sack Guys are losing thousands of dollars just doing their job Something has to change,236,2
PsBattle This man and his dog,237,6
pocket sausage,238,6
You accidentally cut your arm open and instead of bone you see wires and metal realizing youre a robot what do you do,239,8
IMG_0156,240,6
Geese bodyguards help hedgehog cross the road,241,1
Looks an awful lot like a repost,242,6
Another Trump coverup Former FBI agents question limits on probe of Kavanaugh,243,2
Doot,244,8
Leaked Harry Potter game in development by Rocksteady,245,2
Look what I caught my contractor doing,246,7
Just found out that my friend was on the front page yesterday heres another angle of it,247,6
The rise of Netflix competitors has pushed consumers back toward piracy  BitTorrent usage has bounced back because theres too many streaming services and too much exclusive content,248,2
If modern internet companies existed in the 1970s  early 1990s,249,2
My 100th day without alcohol is a cause for celebration,250,0
Mr Bottleopener Rides A Rollercoaster,251,1
Amazon raises minimum wage to $15 for all US employees,252,2
My Grandparents just put up a photo of three generations all cute,253,2
Worlds deepest sinkhole in China,254,2
My friends save the date for their wedding,255,2
If you have a bachelors degree in science or engineering you have as much formal science education as Bill Nye You are officially a Science Guy,256,6
YesterdayToday,257,6
That new Harry Potter game better have this majestic creature in it,258,2
The breastplate of cuirassier 19 years old Antoine Fraveau struck and killed by a canonball during battle of Waterloo (1815),259,7
What I got my boyfriend for his birthday,260,2
TIL Donnie Darko was filmed in 28 days which coincidentally virtually matches the time that transpired in the film The movie took place between October 2nd 1988 to the weekend party scene before Halloween on October 31st 1988,261,2
Much better,262,2
Trump Administration to Deny Visas to SameSex Partners of Diplomats UN Officials,263,2
Oh  well,264,2
The things we do for love,265,8
Follow me Harry,266,4
LEAVE,267,7
Piece of dried seaweed with one end stuck in sand drew concentric circles as it was rotated by the wind,268,8
Jim Watson is the Mayor of Ottawa Hes awesome,269,7
Toys ‘R’ Us cancels bankruptcy auction plans to revive brand,270,1
Trump Engaged in Suspect Tax Schemes as He Reaped Riches From His Father,271,2
California Law Bans Bots From Pretending to Be Human,272,4
Now that’s teamwork,273,7
Antivaxxer experiments on herself,274,4
This cloud that looks like a thumbs up,275,6
Rise of the Machines,276,2
Cruise Ship Refunds Passengers After 1300 Men Took Over and Turned It Into a Giant Burlesque Show,277,2
Removing bubbles from epoxy resin,278,2
TIL that Joe DiMaggio was so devastated after Marilyn Monroes death that he had a halfdozen red roses delivered three times a week to her crypt for 20 years never married again and his last words were Ill finally get to see Marilyn,279,2
These bricks are made from wood,280,2
When a dead meme returns but is now undead,281,2
[confused doot],282,7
German presenter drops a custom Lego build,283,6
If you owned a bank and left the door wide open with no security and got robbed in the middle of the night is it the robber’s fault or yours,284,8
Outrageous and unfair,285,4
me_irl,286,7
Just throw him in the trash,287,2
David Bowie and Debbie Harry 1977,288,8
I rarely find memes that make me do an awww,289,2
Brother helps his little sister ),290,2
Im dirty Dan,291,2
Got a real spooker here Invest now (Template in comments),292,2
4 Seasons in Berlin,293,1
And then the sales went up $500%,294,2
Curious Crustaceans,295,7
Shocking card trick,296,5
White House Edits Trump Insult to Reporter Out of Official Transcript,297,2
me irl,298,8
North and South Korea begin disarming their heavily fortified border,299,8
Next level welding job,300,2
meirl,301,8
Legal Experts New Text Messages Show Kavanaugh Might Have Tampered with Witness,302,2
My girlfriends sleeping habitsduring movies [OC],303,7
Everyone gets a high five,304,2
A moment of clarity about our favorite bearaliens,305,2
My sister needed a job,306,2
Yale alum calls FBI with tip for Brett Kavanaugh probe gets embarrassing runaround no response he says,307,2
What is your best My friend is dating a terrible person and nobody can get through to them story,308,2
Theres a cloud casting a shadow in front of the setting sun,309,6
You sure,310,2
Black holes ruled out as universe’s missing dark matter,311,2
The light opening in the buildings design fits perfectly with the car dimension,312,2
Found this on an AskReddit thread about horror stories of people catching their partner cheating Desperate is the only word,313,7
2meirl4meirl,314,2
Beware of that one snake,315,4
The northern cardinal is probably the most romantic bird species they mate for life travel together sing before nesting and during courtship feed seed beaktobeak,316,2
How the frisbee stays along the wall,317,2
What a pro,318,6
Trump Engaged in Suspect Tax Schemes as He Reaped Riches From His Father,319,2
I made him irritated phase 3 is almost upon us,320,2
God has chosen this vehicle,321,2
DOOT DOOT,322,8
Mad lad,323,7
When you keep creating fake accounts for free trials,324,7
Harvard Says Kavanaugh Won’t Be Teaching His 2019 Supreme Court Class,325,2
Petition to change the upvotes to downvotes and the downvotes to upvotes,326,2
Wheres the lie,327,2
Why do we use adblock,328,2
Wow,329,2
Blue lotus with opals borosilicate glass 24 mm,330,1
Eric Murray Commits Highway Robbery on This Interception,331,2
A little bit about the logic in Fallout 76,332,2
Friendly Deweys worker,333,7
hmmm,334,2
Meanwhile in the parallel universe where I am a box,335,7
Im 19 shes 15 thats only four years,336,2
A dress,337,1
[Homemade] Cuban sandwiches on homemade bread,338,1
Lets not forget this very day,339,2
Well,340,2
puppers stunt for human goes wrong,341,4
Me🎃irl,342,8
Next level welding job,343,2
What a bargain,344,0
This photo I took of a Taxi in the rain from an alley,345,2
Donald _______ is the greatest president America will ever have,346,2
Hawaiian carnivorous caterpillar,347,1
The New York Times Proves President Trump Is a Crook,348,2
Daily joke in US History,349,2
Flying at the beach,350,7
What a good boy,351,2
Explosive situation,352,2
Carlsberg glues beer cans together becoming one of the first breweries to abandon plastic rings,353,6
Ya cause being asleep in your car means you’re in college,354,2
A better world,355,2
What a weird piano,356,1
Craussfit Goals,357,5
This is what 20182019 looks like according to my school,358,6
Tom Hardy Says 40 Minutes Of Venom Were Cut From Final Film,359,2
They had it coming,360,2
Motorcyclist entering a curve at full speed,361,7
Admitting is the first step,362,1
meirl,363,8
Let me block an entire lane on the highway because I failed at cutting everyone off,364,2
Mr steal your girl,365,2
me🥁irl,366,4
The final fight scene between Bane and Batman in The Dark Knight Rises is the only scene where the Caped Crusader appears in daylight,367,2
Two collided bullets from the Battle of Gallipoli 19151916,368,6
When someone asks me why I keep removing their YouTube links from rReactionGifs,369,2
Roses are red they make my heart melt,370,4
My art of a tranquil hero,371,2
Nou,372,4
Monterrey scores against Tijuana with a little help from the rain in Liga MX,373,2
Splish splash puppy taking a bath,374,1
Friend Who Said Kavanaugh Wasn’t Aggressive When Drunk Was Arrested in Bar Fight Kavanaugh Allegedly Started,375,2
Rewatching Infinity War and noticed just after Iron Man asks for no more pop references from Spidey this happens,376,2
This cabin looking lovely in Autumn,377,2
I’m a sociopath and we live in a society 😎👌🏻🤑,378,1
This 👈👉 is money snek 🐍🐍💰💰 Upsnek ⬆⬆🔜🔜 in 7123 7⃣ 1⃣2⃣3⃣ snekonds 🐍🐍 or you ✋✋ will NEVER ❌❌❌❌ get monies 💰💰 again Beware ✋✋❌❌ You😏😏 dont ❌❌ have much time🕛🕧🕐🕜🕑🕝🕝 You 😏😏 may never ❌❌get monies 💰💰🐍💰💰 again,379,2
The Wind Witch,380,8
Tiny Tank Puppy enjoying life,381,2
Hobbies that Redditors get a little too into,382,2
Nosey cat,383,6
On a post about midterm season at my university,384,8
Sketchy Situation Part 3,385,2
Here I am,386,0
You just activated my trap card,387,2
Eyewitness Books with every subject imaginable,388,7
Meta memes always sell Invest,389,2
HELLO THERE,390,2
Honest mistake,391,2
Melom the fruity simbiote,392,0
PsBattle This goat casually laying on cliff edge,393,6
Hit this after hours of grinding,394,2
A Record 800000 People Registered to Vote on National Voter Registration Day,395,2
I still havent recovered,396,2
Because normal people dont think puns are funny,397,2
TIFU by trying to sound more interesting on a date,398,2
My friends masterpiece Thanos Fish,399,2
Remember Techno Viking This is him now,400,7
hmmm,401,2
The HOA is the hero this time,402,7
Tony was going to give SpiderMan a top of the line NanoTech suit before he even had one for himself ready,403,2
OP puts dead creature on his dogs nose for over 50k karma,404,2
Thanos obviously playing favorites,405,5
A Visual History of Homes In America,406,7
[Homemade] Simple stout beef stew over creamy mashed potatoes,407,6
Stunt gone wrong (Xpost),408,1
An Evening at Mont SaintMichel [OC][1638x2048],409,2
RIP old buddy Keep chasing rainbows,410,2
I am not impressed with myself,411,2
me irl,412,8
Spook ops,413,4
This is too true,414,8
Im a Dad who was laid off back in 2010 and hasnt had a real job since Now I design and publish board games on Kickstarter AMA,415,2
Its an older meme sir but it checks out,416,2
DOOT DOOT,417,8
Rare photo of the whole doggo family,418,2
I had to go out to this delivery guys van to get our package because he was scared of a 4 foot tall inflatable Jack Skellington,419,2
Amazon raises minimum wage to $15 for all US employees,420,2
Time to buy a lottery ticket,421,2
TIFU by spending $300 on laundry UPDATE,422,2
TIL Mark Henry has the world record for combined lifts of snatch clean&jerk squat bench press and deadlift totaling 33245 lbs all in drug tested competitions Making him arguably the strong man to have ever lived,423,2
Cozy cabin life,424,2
winner of space race,425,6
Symbio Meerkats had babies,426,4
Old man and a bar,427,2
Ron Swanson teaches JeanRalphio a lesson,428,1
I designed the SpiderCop Suit,429,2
woof_irl,430,6
What a lazy ass,431,0
This old lady brings a smile to my face every single day,432,2
How do I embarrassed 18 year olds in 2018,433,2
Gotta set em straight,434,2
Rumour Animal Crossing for Nintendo Switch could be released as early as Q1 2019,435,2
[OC] Debtors,436,7
Since the very first time I saw Jimmy I had this thought Never posted it because I thought it was an overdone joke but I still havent seen it anywhere,437,2
Russia claims it has killed 85000 terrorists and zero civilians in Syria The Syrian Observatory for Human Rights say Russian air strikes and artillery shells have killed 18000 people including nearly 8000 civilians,438,2
[Highlight] Pat Mahomes avoids Von Miller and gets it to Tyreek Hill with his left hand,439,2
meirl,440,8
I designed the suit for Spider Cop,441,4
Its spooktober so I thought Id diagnose everyone with anxiety,442,2
How Thor would’ve beat Thanos if he still had his hammer,443,2
Calcium Yeah🎺🎺,444,0
Saw this review on Amazon today for fruit snacks,445,2
The last thing my teammate saw during a ranked game before a flashbang went off,446,7
See I pulled a spooky one on ya,447,2
A wild bear randomly shows up to your camp spot,448,7
Found on facebook & thought it was too good not to share with everyone here,449,2
Having a coworker quit is almost like they died Everyone thats left has to deal with the aftermath while they move on unaware of the situation they left behind,450,2
Even the symbol of peace stands behind the one true pillar of justice,451,7
Unfortunately,452,8
My BotW screenprint releasing at NYCC,453,1
These curious crustaceans,454,7
Make our opponents number of eliminations pop up,455,9
Shark taking test bite on the boat,456,8
[Poetry] Say when,457,2
Law banning gay conversion therapy for minors goes into effect today in Maryland,458,4
Any excuse to eat cake,459,7
meme market ,460,2
The high fidelity sound of the most common weapons in recent games,461,2
Strange squid turns translucent,462,2
