Title,doc,topic
I took this picture with the sun at my back so it cast my shadow thru the smoke and out into the trees,1678,6
TIL that the SR71 Blackbird (fastest plane ever) used to covertly spy on the Soviet Union during the cold war was built from Titanium that the US anonymously bought from Russia,1679,2
Why I’m Leaving the Republican Party,1680,2
Shiver me timbers,1681,5
The Onion Report Majority Of Money Donated At Church Doesnt Make It To God,1682,2
[Highlight] Graham Gano makes a 63 yard field goal to win it for the Panthers,1683,0
Casualties of Conspiracy,1684,8
I made an illustration of Nookling Junction from New Leaf a few days ago,1685,2
ulamontcranston elaborates with lots of detailed sources the vast scope and horrifying progress of efforts by the Koch Brothers to dismantle American civic institutions beyond traditional ability to repair,1686,6
Perfect shirt for this sub found in the American Art Museum in DC,1687,2
Man in excavator helps free Rhino stuck in deep mud,1688,2
Breathtaking view from my hot air balloon ride today in Göreme Turkey,1689,7
WHOA,1690,1
The year my dad didnt buy my school pictures,1691,2
These pigeons walking,1692,4
If it fits I sits XXL,1693,7
Two people at my school dance both wore spiderman costumes,1694,2
Well thats one way to do it,1695,2
me irl,1696,8
The coolest blanket Ive ever seen,1697,2
This morning my beautiful boy had a seizure he never recovered from He loved carrotshaped toys and eating things he shouldnt No one will ever make a better nap partner tricklearner or friend Im sorry your life was cut so short You are dearly loved,1698,2
A loving family,1699,4
My parents watching my little brother (Magi) advance to day 3 of The Big House Hope this is ok to post here C,1700,2
This website will tell Georgia voters if they were purged… but they must reregister by Tuesday,1701,2
Comment on a video about kids and their grades dude completely misses the message (kid talking is like 10),1702,6
Drone Footage from above Ogden Valley Utah,1703,2
Clap Clap,1704,2
read the dictionary,1705,7
Six cases of rare poliolike illness diagnosed in children in Minnesota,1706,2
Astronauts tripping,1707,1
I was delivering a fridge to a rural property and was met by some extremely cute security at the gate,1708,2
ELI5 Why is acne so hard to get rid of,1709,2
Meow_irl,1710,4
Peak Fashion,1711,6
1 star Read it yourself,1712,7
The father the son the holy spirit,1713,1
[Request] Is this right,1714,6
rgatekeeping can’t take a joke,1715,7
High ping in real life,1716,2
Good Manners,1717,2
Whoopsie,1718,0
This is Copper taking a nap,1719,2
TIL that the author of Forrest Gump had a deal to receive a lump sum and a cut of the films net profits but Paramount reported a loss and refused to pay him the cut He settled with Paramount and they bought the rights to the sequel which has been stuck in development for over a decade,1720,2
Warm milk,1721,4
Quentin Kenihan the Australian disability advocate and actor best known as Corpus Colossus in Mad Max Fury Road has died at age 43,1722,2
Taylor is finally voicing political opinions,1723,2
How to keep a corgi from getting fat Doctors orders saying he needs more exercise He loves the treadmill,1724,2
Girlfriend wanted to just look And we left with this cutie Everyone,1725,2
This coffee mug I found in my parents cupboard,1726,1
Update to previous post Wife took a picture of our adventures I included a image of my way to help my daughter to remember WASD After a couple hours I can see that this will drastically help her with reading and creativeproblem solving skills,1727,7
I hated my black table Instead of buying a new one I painted it Love how it brightens up the space,1728,2
Bridge of water,1729,6
Whats the smallest good thing you got going for you,1730,2
You dont want this water,1731,2
Message board above my bed to keep me motivated  Thanks Todd,1732,2
Hold his Redbull,1733,4
Cory Booker puts Kavanaugh impeachment on the table if Democrats take back Congress,1734,6
Kansas City fire department rescues Kansas City police department from a stuck elevator,1735,2
A new Navy recruit has his first day on the submarine,1736,2
Unexpected Gender Reveal,1737,1
Deciding to become a parent is like choosing to take care of a a drunk person for 13 years straight and a hungover person for the next 5 Then paying for their rehab for the next 4,1738,2
When a Black Leopard sees his favorite zookeeper,1739,4
TIL the movie Paranormal Activity had a budget of only $15,1740,4
Caught lying,1741,0
Once in a lifetime Spook,1742,4
Seals are just dogs of the sea,1743,2
Want some snickers,1744,4
TIL Steve Jobs is the name of an Italian clothing company created in 2012 when the creators realized that Apple never trademarked Jobs name,1745,2
This is so damn sweet and sad,1746,2
I dont know who made this But its beautiful 💜,1747,2
UPS in Italy uses these bicycle trucks to deliver packages to places in narrow streets of Rome,1748,1
Spyro incense burner is one of the best purchases I’ve ever made,1749,2
This pilot found out that the OH58 Kiowa helicopter hed been flying was the very same aircraft which made him want to become an army pilot in the first place,1750,2
A few years makes a big difference,1751,2
Probably the cutest thing on the internet today,1752,2
Local advertising done right,1753,2
The limo that crashed and killed 20 people failed inspection And the driver wasnt properly licensed,1754,6
Love Hulten’s aesthetic retro concept,1755,8
Trust in Vladimir Putin declines steeply among Russians poll shows | World news,1756,2
Loner but happy Starterpack,1757,8
Look closely between the 75 and 80,1758,6
Verizon creates first responder ad just weeks after throttling California fire department during wildfire crisis,1759,2
Poor 13 It just missed the clock times tables the dozen the apostles the calendar (months) and is considered the unluckiest number It can’t get a break,1760,8
New Overwatch Hero Confirmed,1761,2
Gary,1762,6
TIL most cities have poorer areas in the east due to prevailing winds carrying smoke and odours that way during the industrial revolution,1763,7
Grace Kelly and Audrey Hepburn backstage at the Oscars  1950s,1764,7
Best greeting ever,1765,2
These girls taking up 2 seats each while other people have to stand,1766,2
I mean Patrick is never wrong,1767,1
TIL that at Jon Bon Jovis restaurant JBJ Soul Kitchen you can pay for your meal with either a donation or one hour of volunteer work in the kitchen In 2014 JBJ served 11500 meals and half of them were paid for with a donation and the other half were paid for with volunteer work,1768,2
Parents of Reddit what lessons have to tried to teach your kids that completely backfired,1769,6
Obi Wans fake out is one of the most iconic moments in the entire saga,1770,7
Burnout pie,1771,6
my dude,1772,6
Wowee,1773,1
1999 pieces done just to find they packed the wrong 2000th [OC],1774,2
This absolute unit,1775,6
Thirtysix Indian schoolgirls have been treated in hospital after they were attacked by a large crowd of teenage boys and their parents when they complained of sexual harassment,1776,6
Mike Pences NFL walkout cost taxpayers $325000 and was likely staged report says,1777,2
me_irl,1778,7
My college says if I miss class to testify at my assault trial they’ll drop me from my classes (UPDATE),1779,2
Now and then,1780,0
The first 00 rating on Barstool Pizza Review,1781,7
My man was going for the handshake This is so sad,1782,2
Chossingbeggars for subreddits about getting money,1783,2
My friend was 12 going on 45,1784,2
Coziest cuddle ever,1785,2
I am Jodie Whittaker I play The Doctor on Doctor Who AMA,1786,2
This apple peeler my dad just bought,1787,2
Psychiatrists are using VR to submerge patients in virtual worlds that allow them to face their fears without consequence A new study shows that these worlds and the virtual therapists that inhabit them can reduce fear of heights by 67%,1788,2
Invisible doors,1789,7
The way this bench comes “out of” the fence,1790,7
Is she trying to tell me something,1791,2
Taylor Swift breaks silence on politics supports Democrats in Tennessee races,1792,2
Party Rock Anthem has the same BPM as I’m Gonna Be (500 Miles),1793,1
Wow,1794,2
Columbus Ohio will not observe Columbus Day,1795,8
Air Force One has been breached,1796,7
2meirl4meirl,1797,2
Pizza time,1798,7
me irl,1799,8
I pet my 3 cats as much as they wanted for a week (and charted it) [OC],1800,2
Good neighborhood,1801,2
Trump Campaign Aide Requested Online Manipulation Plans From Israeli Intelligence Firm,1802,2
Whats a fact that sounds fake but is actually legit,1803,2
MRW I am 32 and going back to college for the second time,1804,2
The Shepherds,1805,3
This tested friendships,1806,5
Some days you just don’t feel like doing anything,1807,2
hmmm,1808,2
Spend your calcuim at the skeledor,1809,0
Pizza Time,1810,7
Jack Black is me in twenty years at some 6 yr olds birthday party,1811,2
EPICs own Battle Pass video got Copyright Striked by themselves,1812,1
self serve ice cream,1813,6
Hide and Seek Champions,1814,0
You never know what youre going to see when it starts getting dark on the water,1815,2
After more than 40 years in space Voyager 2 is finally reaching the edge of the heliopause — the boundary where the Suns solar wind can no longer overpower the combined winds from other distant stars,1816,2
If you cant get your emergency fund to grow because of emergencies that keep coming up youre still doing a good job,1817,2
Getting floofier for fall #sweaterweather,1818,4
hmmm,1819,2
The true Dunder Mifflin alignment chart,1820,8
Justin Roiland struggling to keep it together while voice acting a Rick and Morty scene,1821,2
To be grammatically correct,1822,7
daydreamer by Berat Pekmezci digital 1000x1279,1823,7
me🏀irl,1824,5
Well what is it Cosmo,1825,2
Trig be like,1826,6
Stan Lee Breaks His Silence Those I Trusted Betrayed Me,1827,2
A police station in Peru has set up a food and water dispenser for homeless dogs,1828,2
Respect to big boi,1829,2
Leonardo DiCaprio startled by Lady Gaga,1830,8
Tesla Model 3 achieves lowest probability of injury of any vehicle ever tested by NHTSA,1831,2
How does the Scotsman feel about that,1832,2
Steak for dinner anyone Invest now,1833,2
An orangutan rescues a drowning baby bird,1834,0
To paint candlelight,1835,2
I don’t know if i’ve ever seen a more magnificent picture,1836,2
Christine Blasey Ford still unable to live at home due to death threats lawyers say,1837,2
Everytime I code in C,1838,7
LPT  it only works once,1839,2
Gets me everytime,1840,2
Carving gun out of chopsticks,1841,8
This scene did not age well,1842,2
Cthulhu Digital 1800x1080,1843,7
It’s official Americans are living under the rule of a minority,1844,2
Our local pizza place usually gives treats through the drivethru window but I guess they were out this time My fiancé sent me a video of my poor pup’s reaction,1845,1
100% agreed,1846,1
What a beautiful seashell,1847,2
SLPT How to meet your favourite celebrity,1848,1
The History of HQG,1849,2
Husky does not approve of the new family member,1850,2
The ending shot of Gone Girl shows ultimately how little has changed,1851,2
me_irl,1852,7
I thought this belongs here,1853,2
How to avoid a Genji ult in a really stupid way,1854,6
Nikon at 6 weeks 1 year and 5 years,1855,2
lil bun eats flowers,1856,4
Dealing with a Gas Thief,1857,6
The President of Ireland introducing his Dog to some distinguished guests,1858,2
Students keep downloading Minecraft to the school computers,1859,2
Mitch McConnell got called out for his Supreme Court hypocrisy on two different Sunday shows,1860,2
I ignored my destiny once I cannot do that again,1861,9
AntMan and the Wisdom of PepPep,1862,5
hmmm,1863,2
Roses are red Let me show you my wrath,1864,2
TIMAAY,1865,0
My grandfather at his retirement party in 1986,1866,4
Damn,1867,2
An underground water pipe explodes,1868,7
Oof ouch my superpowers,1869,6
Bomberman was so good,1870,2
Me_irl,1871,7
Things like this keep employees around,1872,2
The aardwolf (alphabetically the second creature) are a monogamous species of hyena that mostly eats termites with their long sticky tongue They will raise their cubs for up to a year as a pair with the male watching the child for up to 6 hours a night while their mother finds food,1873,2
Inverts himself,1874,5
We all know you are faking being sick to avoid the class,1875,2
While the admins are asleep upvote everyones favorite tiny horse,1876,7
me irl,1877,8
The Milky Way experienced a cosmic fender bender with a small dwarf galaxy just 500 million years ago which is right around the time of the Cambrian Explosion (when the number of species on Earth increased exponentially),1878,7
[homemade] Chocolate Chip Cookies with Espresso,1879,6
Just dance,1880,2
Me👀irl,1881,2
Why,1882,0
A Tornado and Rainbow,1883,2
To the redditor who made this a couple of years ago WHERE IS THE REST,1884,2
Deep breaths everyone,1885,2
slip n slide,1886,2
[visible confusion],1887,3
Fast hungry boi,1888,6
Anton Sjöberg Studio 13 Eskilstuna Sweden,1889,1
Box Office Week Venom smashes the October opening weekend record with a massive $80M debut at #1 A Star is Born also far outpaces expectations with a fantastic $415M opening at #2,1890,2
True,1891,8
Vëgëtæll Protecter of Valhallas Cucumbers,1892,0
Just some window shopping,1893,6
Doot Doot now your rich,1894,8
Highly exploitable text field invest for quick profits,1895,2
Denmark to label food according to effect on climate,1896,2
Democrat Joe Manchin faces firestorm at home after voting for Kavanaugh,1897,6
What’s some things that I hope to see in The Mandalorian,1898,2
Posted by my mom on facebook,1899,1
When Air Force Ones crew Learned of the Kennedy assassination They refused to put his body in the cargo hold and modified the plane with a hacksaw to be able to take the coffin in the cabin,1900,6
Nothing like sacrificing passenger comfort In order to cram in more passengers,1901,6
Can’t tell if my neighbors are playing along with the joke or seducing me,1902,2
My life,1903,2
Antarctic deep seas,1904,5
🤷‍♀️🤷‍♀️,1905,3
Penguins playing with bubbles,1906,6
Another animated artwork I did,1907,7
An opossum got into my buddys house and he snapped a selfie with it while he was carrying it out,1908,1
Today is his 11th Birthday,1909,2
Greetings from Naboo,1910,5
Horror Beneath the Ruined Tower [OC],1911,7
SpaceX has landed on the West Coast for the first time  This was SpaceXs 17th launch this year,1912,1
Totally true,1913,8
This pilot found out that the OH58 Kiowa helicopter hed been flying was the very same aircraft which made him want to become an army pilot in the first place,1914,2
Memes getting wholesome,1915,8
Gatekeeping a gatekeeper 2018 halloween edition,1916,8
Upvote to get this to the top search result for Bitcoin CEO,1917,2
Years of paint built up on my saw horse at work,1918,2
My aunt brought her paparazzi jewelry to a family dinner (,1919,7
Google did not disclose a security breach to its Google+ social network because it feared regulation according to a Wall Street Journal report citing documents and people briefed on the incident,1920,2
ddx(e^x),1921,6
You know its going to happen,1922,2
12 Grimmauld Place in Lego,1923,2
Super Soaktress The Prepared,1924,8
Metas through the seasons,1925,1
Cozy and cold,1926,2
TIFU by trying to separate frozen burgers and making my dad call the police,1927,2
Facts,1928,0
PsBattle Prince with the midrange jumper,1929,6
Dr Ford horrified by President Trump mocking her on campaign trail,1930,2
Viral “Manspreading” Video is Staged Kremlin Propaganda,1931,2
Lost at Sea,1932,2
Time for Halloween,1933,1
Our rescue puppy’s first night in a real bed,1934,2
The President Just Turned Around and Called Dr Christine Blasey Fords Story a Democratic Hoax,1935,2
Rosa got married irl 🎉,1936,8
Tinkerbell introduces herself to a girl that uses sign language to communicate at Disney World,1937,6
The Browns have achieved every possible outcome (5) to an NFL Game,1938,7
I was the last one Everytime,1939,7
We played The TSeries diss track in our school in IndiaIt was a lot of funif oewds sees thisplease tell him to check his dm(Instagram) under my name,1940,4
meeirl,1941,3
Shalom there,1942,0
[AMA] hey we are Tyler and Josh from twenty one pilots ask us anything…,1943,2
Malcom McDowell and Charlize Theron to Play Rupert Murdoch and Megyn Kelly in Fox News Movie Nicole Kidman John Lithgow and Margot Robbie will also star,1944,7
Global warming must not exceed 15C warns landmark UN report Carbon pollution would have to be cut by 45% by 2030 – compared with a 20% cut under the 2C pathway – and come down to zero by 2050 compared with 2075 for 2C,1945,2
😍,1946,6
anime_irl,1947,4
anime_irl,1948,4
Khal Drogo never raped Dany in the books He was a lovely husband Sure,1949,2
Is she sleeping with Mike Birbiglia,1950,4
Original Trix cereal Shaped like fruit,1951,6
The disappearing waist,1952,7
When you dont know what doors you want on your car so you just get all of them,1953,2
Can’t afford 20” rims No problem,1954,8
Moving Elements,1955,2
Tea with Tati featuring Tammy Lasagna,1956,6
I dont think thats true,1957,2
The most interesting friendship,1958,2
I killed a guy on Fortnite I stole his guns materials medkits and most importantly his _________,1959,2
After almost 14 years my buddy took his last breath Rip my friend i wish we couldve played more hide and seek like this,1960,2
Smol (OC),1961,6
Doppler shift,1962,7
me🕷irl,1963,3
Mask,1964,9
Heres a little moo to brighten your day,1965,2
Even a cat can not take these 9am classes,1966,6
Russian Simpsons,1967,4
Not gonna waste them,1968,2
me irl,1969,8
I can explain officer,1970,2
If A is for Apple and B is for Banana then what is C for,1971,7
Trumps tariffs have already cost Ford $1B; now its planning layoffs,1972,7
What a time to be alive,1973,2
[NO SPOILERS] Visited the filming location for Winterfell yesterday,1974,6
[Skin Concept]  Reaper Rex,1975,7
First tattoo and went with a full sleeve Done by the talented Devan Smith at Fountain Square Tattoo in Indianapolis,1976,1
Fish,1977,6
World population by highest level of education [OC],1978,7
Pickle Brick  Spotted this at a Lego show over the weekend,1979,2
In honor of Columbus Day Christopher Columbus lands on Hispanola (1492) Colorized,1980,8
A map of every European city,1981,2
What vets do behind closed doors,1982,2
Greece bans obese tourists from riding on donkeys,1983,4
Laura Croft cosplay,1984,2
This Uber driver 😊,1985,6
The difference in lighting between my sister’s room vs my room at the exact same time of day,1986,7
This is Lily She’s 21 She doesn’t see or hear too well but she smells good enough to wake up and run to the kitchen when she smells chicken,1987,2
Nike surprises Justin Gallegos with a contract Justin is their first professional athlete with Cerebral Palsy,1988,1
Brad and Chad convention,1989,2
These two signs kinda look like theyre warning of UFOs beaming people up,1990,6
TIL Calvin Kleins cologne Obsession can draw big cats like Tigers Jaguars etc from as far as half a mile who then proceed to taking long sniffs and cuddling against the source savouring the smell much longer than they savour even their meals,1991,7
TIL in 1897 3 Swedes attempted to be the first people to reach the North Pole They travelled by hot air balloon but crashed after 65 hours 33 years later a ship discovered their camp along with their dead bodies journal and camera Theyd survived for weeks by killing and eating polar bears,1992,2
Grieving Indiana bride poses for wedding photo alone after firefighter fiancé is killed by drunk driver,1993,2
Thought you guys might like this spooky pumpkin,1994,6
Dad on a vacation,1995,8
TIL After South Park aired the episode Chef Aid the term Chewbacca Defense entered the legal lexicon The legal strategy aims to deliberately confuse juries than refute cases The practice was widely used by lawyers before the episode but South Park gave it a term,1996,2
The best use of Snapchat filter,1997,2
If I had my wishes about a legacy I could leave,1998,2
This is how my apartment’s landscaper decided to mow the lawn today,1999,2
Picture accidentally taken on the disposable camera delivery line,2000,2
Emo dissapeared because now everyone wants to die and it isnt special anymore,2001,2
We thought Izzy would grow into her Disney princess eyes She has not to say the least,2002,2
Say hi to Ollie the blue heeler,2003,2
His foster sister had surgery today and is still too tired to groom herself so her bro is helping out,2004,2
Ted Cruz declines so challenger Beto O’Rourke gets an hour on national TV by himself,2005,2
What my week old spaghetti sees when Im microwaving it at 4 am,2006,2
Next level selfish Unplugging the free charging station to charge your phone,2007,2
This is my cat Keiko,2008,6
1st 2nd and 3rd Place in the Miss Correct Posture Contest pose with trophies and their Xrays (1956),2009,2
James Gunn Boards ‘Suicide Squad 2’ To Write And Possibly Direct,2010,8
Octopus burying itself into the sand,2011,8
I think my boyfriend has been drugging me to make me forget things He is a doctor,2012,2
5000 Pieces Color Spectrum,2013,2
The 1972 Clean Water Act dramatically cut pollution in US waterways according to the first comprehensive study of water pollution over the past several decades,2014,2
It’s you,2015,4
Perfecting the model pose,2016,9
The pulse of the gas thrusters on SpaceXs Falcon 9 as the rockets boost stage guides itself back to Earth,2017,2
Teachers will be quick to say that a classroom isn’t a place to sleep but by that logic a house isn’t a place to study,2018,2
4 years ago today I shared the worst joke I ever created Here it is again for those that missed it,2019,2
No downside New Zealand firm adopts fourday week after successful trial  Perpetual Guardian says staff were more focused and productive after the experiment and better able to manage worklife balance,2020,2
Wrong hand,2021,1
hmmm,2022,2
In honor of indigenous peoples day My Uncle Bearclaw,2023,8
The Eagles have replaced late singer Glenn Frey with his son Deacon Frey He sounds nearly identical to his dad circa the Hotel California era,2024,8
Typing Minimum on a keyboard is like playing a really crap game of ping pong,2025,6
Welcome to hell,2026,2
Thanks for your collaboration,2027,2
Spitfire jumps a distance of over 31 feet to create a new world record for the farthest leap by a dog,2028,6
Coke Pepsi Nestle top makers of plastic waste Greenpeace,2029,2
Me irl,2030,8
Trump says no one more competent in the world than daughter Ivanka to replace Nikki Hayley as UN ambassador,2031,2
if Banksy was italian,2032,4
My dog has a downvote on her chest,2033,0
Banksy strikes again,2034,4
PsBattle This shaved husky,2035,6
Nikki Haleys resignation comes one day after an ethics watchdog requested an investigation into her acceptance of free flights on private jets,2036,7
Not the dad joke,2037,2
Cost of cigarettes must rise to reflect environmental damage from tobacco industry WHO says Sectors carbon footprint is comparable to entire countries study finds,2038,2
Plz guys no fighting,2039,2
me_irl,2040,7
hmmm,2041,2
Glasses with office window privacy film block screens tvs billboard ads,2042,4
Had this doggo to my grooming shop today I think he had a relaxing time,2043,1
What do you think about my hedgehog drawing,2044,1
What is something you enjoyed after previously believing you wouldnt like it,2045,2
Family Guy is so wholesome sometimes,2046,2
The Simple Joys in Life,2047,2
The mirror in my hotel room let’s anyone look in on the bed even with the curtains close,2048,2
🍁,2049,5
BrettKavanaughcom is Now a Resource for Sexual Assault Survivors,2050,6
His day is only going to get worse from here,2051,2
🔥 Cardinal Beauty 🔥,2052,2
UN Ambassador Nikki Haley resigns,2053,0
When ads on reddit try and act like posts,2054,2
My teacher dressed up as the meme for Meme Day at my school He also browses this sub supposedly,2055,2
This game has a genius logo,2056,2
Republicans Threaten Lawsuit After Bar Declines to Host ProKavanaugh ‘Beers 4 Brett’ Party,2057,2
Found this and thought you all might like it Trash panda,2058,2
Advertising A Concert You Cant Go To,2059,2
Good boy becomes a big brother,2060,2
Young and Happy,2061,2
Trump ‘poses the single greatest threat’ to our climate bombshell UN report makes clear Trump team approves landmark climate report  and then rejects it,2062,2
Overwatch Your Damn Kids,2063,6
Apple quotes customer $1200 to fix one bent pin on a ribbon cable,2064,2
5000 pieces later,2065,2
Space X launch viewed over LA,2066,2
Yer da’s at it again,2067,4
Sounds about right,2068,2
Called out for “bare faced” looks,2069,6
me_irl,2070,7
A face tattoo is actually the ultimate display of wealth as it represents never having to work another real job for the rest of your life,2071,2
Petition calls for national ban on conversion therapy for LGBT youth,2072,2
DoG eAtEn alIVe bY iNsaNE cOw,2073,0
A soldier whose house was looted during Hurricane Florence gave away the money raised for him instead,2074,2
PsBattle Dog breaking through RV door,2075,6
3 years of radiotransmitted locations of Waldo the eastern box turtle in Raleigh NC [OC],2076,7
I collect bugs and sometimes sell my sets I just had this conversation yesterday,2077,7
Fairys and the peasant girl Yuliya Litvinova Digital 2018,2078,7
“Myside bias” makes it difficult for us to see the logic in arguments we disagree with finds a new study in the Journal of Cognitive Psychology (n=387) The results provide a striking demonstration of how our powers of reasoning are corrupted by our prior attitudes,2079,2
The maddest 11year old out there,2080,2
My latest acrylic painting I call Sunset Trip,2081,2
ObiWan tells Padame why they should confront her husband on Mustafar,2082,2
New Poster  Fantastic Beasts The Crimes of Grindelwald,2083,1
