Title,doc,topic
Me and my mother have the same nervous fidgets,3766,4
A bench at a metro station,3767,2
Wassup girl,3768,7
This coin,3769,6
Say goodbye to the roof of your mouth starterpack,3770,2
Californian teacher giving a lecture about waves (1970),3771,7
America’s reaction to Germany’s complaints about the use of shotguns in trench warfare,3772,8
All dogs go to heaven,3773,2
PsBattle Scared dog,3774,6
F16 flying through the Alps,3775,7
MVP,3776,7
Gaussian distribution of usage marks at my local gym,3777,1
Since the reintroduction of wolves to Yellowstone National Park in 1995 the parks ecosystem has become a deeply complex and heterogeneous system aided by a strategy of minimal human intervention The new study is a synthesis of 40 years of research on large mammals in Yellowstone National Park,3778,2
When people try to suggest actors who arent called Ewan McGregor for the Obi Wan movie,3779,2
MRW I try to help an elderly customer trouble shoot a computer problem via phone call,3780,6
hmmm,3781,2
When our baby was born she was a little cold so the nurses took her back to the nursery to warm up They sent back Mother Theresa,3782,2
Portland police found rightwing group on rooftop with weapons at major rally,3783,2
Poor mama cat just wants to sleep,3784,2
Walter,3785,2
From rinsanepeopleonfacebook,3786,4
Kurt Cobain showing his daughter a kitten (1993),3787,1
I like her already,3788,6
Vet tech sent a picture of our pup waiting to be picked up,3789,2
Bill Gates leads global call to accept realities of a warming planet  It is not enough that we try to limit further global warming – we must also do far more to ensure we survive it That’s the message from a coalition of major global figures,3790,2
A protein moving a molecule,3791,8
People with psychopathic tendencies are slightly more likely to be a company boss but a new study finds that psychopathic traits in men help them emerge as leaders and be seen as effective but these same tendencies are seen as a negative in women,3792,2
Invest in this highly variable format Who has the biggest pp,3793,2
In I am Legend (2007) in Dr Robert Neville’s house you can see multiple famous paintings hanging in his home that he took from the Museum of Modern Art and other famous galleries in New York In this scene while Ethan watches Shrek you can see Vincent Van Gogh’s Starry Night,3794,2
me irl,3795,8
My grandmas profile picture is a cropped screencap of her in someones friends ranking in which she has no profile picture,3796,1
Powdered sugar is highly flammable so take care when you make a birthday cake,3797,2
TJ Dillashaw uses Renan Barão’s head as a punching bag successfully defending his Bantamweight championship,3798,6
hmmm,3799,2
LPT if you don’t care about football go see a movie during the super bowl there will be no lines and you might have the whole theater to yourself,3800,2
Well,3801,2
Low Tide High Tea by Krista Brennan  watercolor on cotton,3802,7
McMeth the addicted one,3803,6
Illusion Makeup,3804,4
This is not rust “It’s the design”,3805,0
SUV passes stopped bus nearly kills three children,3806,2
LPT Sick of seeing the same ads on Instagram If you block the account you wont see ads from them anymore,3807,4
Insane chainwhip,3808,8
Comcast complains it will make less money under Calif net neutrality law,3809,2
rPrequelMemes showing of all their new Clone wars 2003 memes,3810,2
There is a difference,3811,6
Most Americans arent aware that Facebook owns WhatsApp,3812,2
putting outwardly imperceptible laser etched branding on prescription glasses so the always look like they have a smudge on them to the wearer,3813,6
Bed bugs be like,3814,7
I have no words for this,3815,7
God Knows Where I Am (2016)  The body of a homeless woman is found in an abandoned New Hampshire farmhouse Beside the body lies a diary that documents a journey of starvation and the loss of sanity but told with poignance beauty humor and spirituality [Trailer],3816,2
Inspiring shot,3817,4
I present to you the “No U” attack,3818,1
Youre a Hairy Wizard,3819,8
This is so me,3820,0
MaN bRuTaLlY KiLlS lIoN WiTh oNe pUnCh,3821,2
Flat screen,3822,2
This coin,3823,6
2meirl4meirl,3824,2
Trump’s Attacks on the Press Are Illegal We’re Suing,3825,9
The Adams Family 1964,3826,4
Crasher Golf,3827,6
There is no God says Stephen Hawking in final book,3828,2
Romantic Dinner Date on a Crosswalk Overpass to Set the Mood,3829,2
Dropped her off at the vet as a dog Picked her up from the vet as a taco,3830,0
10 10 10,3831,2
TIL you can play warioware on 3DS INSIDE warioware on 3DS,3832,6
I tossed a fortune cookie in my wifes lunch today She angrily sent me this picture Like I control the fortunes inside the cookies and I picked this one on purpose,3833,6
We did it boys,3834,2
Finally warmed up to each other,3835,2
var a b c;,3836,7
Ouchie my pimples,3837,8
meirl,3838,8
Parrot saw the ocean for the first time,3839,7
Wall collapses at Morton Salt building in Chicago,3840,4
I got a photo with Chris Evans holding my signed shield,3841,2
Me and my twin finally went back to school,3842,2
Cool Dad Gets Bullied For Driving Son To School In A Ferrari 488,3843,2
me😔irl,3844,8
Meet Opal,3845,1
My mom(right) and her sister back in 1961,3846,2
SLPT  How to get your child to read more,3847,2
Hes known for holding up positive signs in Panama City Hes back and its making everyones day,3848,2
My diet starts today,3849,2
I’m getting laid off and my last day is Halloween We’re allowed to wear costumes at work so I am going as a homeless person,3850,2
How to make a gaming keyboard,3851,2
Ralph Fiennes to Receive Lifetime Achievement Award at 2018 European Film Awards,3852,2
Stuff that will probably be nostalgic in several years starter pack,3853,2
Lets make Brad 1 and Brad 2 see this,3854,2
Who else wishes that Oscar actually said something at the shareholder meeting,3855,2
This is so sad can we collapse under our own gravity,3856,1
Do you remember the best Mercy save of all time  It has been immortalized as my first Twitch emote (comments),3857,2
I love Dota but I just cant stop playing League,3858,2
Colorful Girl,3859,7
What do you think,3860,1
How tf did someone make this kind of coin,3861,6
The hashtag just makes it better,3862,2
Hill Harper dies a little more inside every time he has to fake smile,3863,7
You can do it Elon,3864,2
THANOS EXTINCTION,3865,5
Saudi consul to Turkey has fled to Saudi Arabia after more evidence was found that Journalist Khashoggi was killed inside the consulate,3866,1
Court allows Obamaera student loan rules to take effect delivering defeat to DeVos,3867,2
2010 internet be like,3868,2
My fridge Yay or nay,3869,9
I feel you bud,3870,2
Cockroach Cake,3871,0
I’m just gonna leave this here,3872,1
Do bears count Check out this guy just chilling by a lake with a rainbow contemplating life,3873,6
Fillionso hot right now Fillion,3874,6
[Homemade] Cake that looks like an egg and cheese biscuit,3875,6
me irl,3876,8
0100 Real quick,3877,2
SUGGESTION Allow console players to cycle weapons while gliding to pick which one they pull out upon landing,3878,2
This is a rare chocolate english P O T A T O B O Y E This is truly one of the most rarest puppers,3879,2
Thought Id give the roof a repaint,3880,2
DONT BLINK Dont even blink Blink and youre dead,3881,2
An UnSanctioned Gif,3882,7
Owl bath,3883,1
[OC] 20182019 NBA Almanac,3884,7
Which state do you live in,3885,7
Beautifull morning in Bergen Norway,3886,2
A force to be reckoned with,3887,6
Trump joins Saudi Arabia’s Khashoggi coverup,3888,1
Motorcycle chariot race Sydney Australia 1936,3889,2
A meme is never late nor is it early it arrives precisely when it means to,3890,2
TIL that giant sloths excavated hundreds of miles of tunnels in South America that still exist to this day,3891,2
There is no God says Stephen Hawking in final book,3892,2
Ding dong ditch,3893,9
Here’s my friend again with his latest 3D printed Death Trooper suit,3894,2
My Mario Kart  Yoshi Circuit map for Rocket League is finally done I will release it soon ,3895,2
Hoo,3896,9
[OC] Silly Item  Vampire Bat,3897,7
Saw this on Facebook & liked it too much to not share,3898,2
Weak Apple ID password,3899,4
My heart 😭,3900,1
Roger Eberts Anaconda review Generally trashed by critics but legendary now as a bmovie spectacle Ebert gave no f***s and in a glowing review declared it superior massaudience entertainment His level of appreciation for a movie like Anaconda is why hes truly one of the greats,3901,6
Its been more than a year Gone but not forgotten RIP Slippy (,3902,7
Okay so I’m not 100% sure if this is allowed (just remove it and I send 1000 apologies) but I painted this 2’x3’ portrait of handsome squidward the other day,3903,2
Im dying but havent told anyone,3904,2
Saw this in a room at my school I want to die,3905,7
The scariest urban legends in each state,3906,8
Red vs Blue,3907,2
classic scooby,3908,7
Thought this way until I was 16,3909,2
Support for Trump is fading among activeduty troops new poll shows,3910,2
Rejoin charging cables to connector,3911,7
No talking vs ONLY talking,3912,2
[WP] You are a spiritual null Werewolves and vampires cant turn you fairy lights hold no charm and you can stare at a medusa all day This makes you the ultimate fantasy lawyer,3913,2
Mom got a new camera and I was her model,3914,1
Kachoooooow,3915,6
Sweetheart ferret wants to show off her babies to her human friend,3916,4
Aang forgetting that he is more powerful than anyone else on the planet,3917,6
The meeting between my nephew and a bison besties,3918,2
Welcome to the UK,3919,2
Selfie with friends,3920,2
Lies,3921,5
Human for scale,3922,4
Trump Just spoke with the Crown Prince of Saudi Arabia who totally denied any knowledge of what took place in their Turkish Consulate,3923,1
Me_irl,3924,7
all was fine til the dog came along,3925,2
We’ve all been there lad,3926,7
The male Kudu a species of antelope easily recognizable by their beautiful spiraling horns,3927,4
[Highlight] Fat man highlight OL Dan Connolly returns kick for 71 yards (2010 Week 15),3928,0
Mixed emotions,3929,9
Printer Makers Are Crippling Cheap Ink Cartridges Via Bogus Security Updates  Epson is just the latest company to wage covert war on consumer choice,3930,2
Balconies,3931,5
Woke up to a pretty dystopian reddit,3932,6
Saudi Arabia warns those who spread fake news will be jailed,3933,1
You have to create an account to switch off autoplay on IGN,3934,4
Prosthetics improve life for more than humans,3935,2
Walter,3936,2
Twitter suspended 1500 for spreading wrong election date,3937,2
A regular noticed me trying not to cry behind the bar after a table was rude to me and totally turned my day around,3938,2
InGame dance VS My mediocre attempt with the new LEGO Bastion set,3939,2
I mean it’s not quite how we drew it up but whatever works,3940,4
Why would he kill one of his own,3941,2
anime_irl,3942,4
the Omen,3943,5
[AC Origins] The one way door,3944,2
Urban Dining in a local supermarket,3945,1
Me_irl,3946,7
If you wanna be my lover,3947,6
Mitch McConnell blames the poor for Trump’s TrillionDollar deficit,3948,2
miaou_irl,3949,8
Colorcode the perks so theyre easy to identify,3950,2
Flooded underpass in the UK [audio],3951,1
This ranch dog walked us back to the vehicle after a rough day of survey and was kind enough to keep the cows away,3952,2
A car crashed into my friends building in Chicago causing all the balconies to collapse,3953,1
My Friend is a clockmaker This is not a clock,3954,6
N O K I A,3955,2
knowledge,3956,2
Kids in Elementary school hold a surprise party for their beloved school custodian,3957,4
i editted myself into SEVEN and switched the head in the box with a pair of pink crocs Why No idea,3958,7
Came across some random ground art on my walk yesterday,3959,2
I took a film photo of my wife waiting at the car wash,3960,2
Luigis mansion inspired pumpkin that I carved,3961,8
The war is over,3962,2
Today marks the first day people can legitimately earn all of The Stanley Parables achievements,3963,2
In 5th grade I was a baked potato for Halloween,3964,1
A more accurate representation of what happened with YouTube,3965,2
Best of luck reaching 30 John,3966,6
2000 years old green serpentine stone mask found at the base of Pyramid of the Sun Teotihuacán Mexico,3967,2
Mission Accomplished 2 legged dog with prosthetic on stump conquering the stairs,3968,0
Outta nowhere,3969,0
When you choke on water you’ve failed at breathing and drinking the two most important activities in your life,3970,6
TIL in test screenings Willy Wonka had a scene with a hiker seeking a guru asking him the meaning of life The guru requests a Wonka Bar Finding no golden ticket he says Life is a disappointment The director loved it,3971,2
Just mad I tell you,3972,7
TIL Richard Norris Williams survived Titanic sinking but spent too much time in freezing water and rescue doctor recommended amputation of both his legs He refused and proceeded to win his first tennis tournament a few months later and became Wimbledon doubles champion in 1920,3973,2
Toronto police to Canadians stop snitching on your neighbors about marijuana,3974,6
The 3D printer at my school messed up printing out this mug,3975,2
Social Media Right Now,3976,2
Overparenting or helicopter parenting a narcissistic parenting style may impede the development of young adult independence and be linked to development of narcissistic traits which may be how narcissism can be passed on from generation to generation suggests new study (n=380 college students),3977,2
Saudi Consul fired and placed under investigation after he is recorded saying Do this outside; youre going to get me in trouble during torture of journalist,3978,1
How 3 games logos combine into a nice landscape,3979,2
TIL The mysterious winner of a $560 million lottery ticket who fought to keep her identity a secret was allowed to stay anonymous a judge ruled in March The woman’s lawyers argued that she is part of a group that “has historically been victimized by the unscrupulous”,3980,2
Cat using sign language to communicate with his owner who is deaf,3981,2
A short life but a wellspent one,3982,2
Bob Ross petting a fawn,3983,6
They added no vaping onto the plane safety manual,3984,2
Life in a pokeball,3985,2
Lineup for legal weed in my hometown this morning Nova Scotia Canada,3986,2
Celtics Fan from my school,3987,2
Seal playing peekaboo,3988,8
Youtube is down,3989,2
Rod Rosenstein says the Russia probe has uncovered a widespread Russian effort to meddle in the 2016 race,3990,2
Having an unseen handicap is like fighting through life with the difficulty set on high while everyone judges you against the default difficulty level,3991,2
LPT On mobile use chrome to watch youtube and request the desktop version Now you can listen to youtube in the background while the screen is locked,3992,2
Almost Half of US Births Happen Outside Marriage Signaling Cultural Shift,3993,2
She was his souperlike,3994,2
Minecraft > Taio Cruz,3995,8
Who will be the 1 brave kid who tells the manager,3996,2
How fast,3997,6
Who doesn’t like $30 airfare though,3998,6
Disturbingly realistic graffiti,3999,5
Cat using sign language to communicate with his deaf owner,4000,2
Vermont hits record 925 percent voter registration ahead of election,4001,6
One letter liscence plate I found in my neighborhood,4002,2
Oh Canada,4003,4
Chicken Strips,4004,6
Meeting the Queen B,4005,2
me_irl,4006,7
Kitty exactly 15 years ago and today,4007,2
Kids in Elementary school hold a surprise party for their beloved school custodian,4008,4
I found this carved fox inside a tree stump in a forest close to my home,4009,6
Posing for a photo,4010,2
The truth,4011,7
If it aint Pam it a scam,4012,7
House in Iceland,4013,4
Portuguese Navy new drone flawless takeoff,4014,2
Up to 95 million net neutrality comments were made with stolen identities,4015,7
In a time when Prequel memes are running low let us remember the first ever prequel memer,4016,2
My Mario pumpkin,4017,8
What is something that MOST adults can do but you for whatever reason cannot pull off,4018,2
What’s an unspoken rule that is universally accepted,4019,1
Top Reddit posters should use their karma to help the environment,4020,2
Didnt even notice,4021,2
hmmm,4022,2
Not your every day landing,4023,2
A weasel walks into a bar The Bartender says Wow,4024,2
This kid makes Fortnite dances go cry in a corner,4025,2
Chilling in the spa,4026,6
Always something interesting,4027,2
Thought I looked cute,4028,6
SLPT flip bitcoin,4029,6
This welcome home never gets old,4030,2
Bruce Willis film Air Strike canceled after costar Fan Bingbing disappears,4031,7
To be speechless,4032,2
Oh okay,4033,2
meirl,4034,8
“Stanley yelled at me today”,4035,1
Ope,4036,5
Web shooting menace,4037,8
Hatcher comes home after Surviving 2 weeks alone in the Mt Hood National Forest 10010 good boy,4038,2
Jackie Mitchell the only female pitcher to strike out Babe Ruth and Lou Gehrig 1931,4039,7
Firefighters Driving To a Call,4040,2
Hi children of Thanos first post here Thought I could try to do a low effort OC,4041,2
hmmm,4042,2
thanks ned,4043,2
Alternate switch cover is a fan art,4044,2
Launching the newest Portuguese drone,4045,2
Yall better not do this 😤😤,4046,2
🔥 Tree tunnel in an Italian nature park 🔥,4047,2
Drag her,4048,2
Company says I tip too high when I travel Now I intentionally order more expensive food so I can tip what I think is an appropriate amount,4049,2
Well that’s how it is,4050,2
Hardtoswallowpillsjpg,4051,5
Youtube broken for anyone else,4052,6
Hundreds of absentee ballots rejected in Atlanta prompts legal challenge,4053,1
Me and my dad back in 1990 when he owned the family bakery,4054,2
Yeah no thanks,4055,2
You are a wizard Harry,4056,4
Now what do we do,4057,0
Thanking the Bus Driver,4058,6
Dopey falling off the boat during Fantasmic at Hollywood Studios,4059,8
New York Attorney General Subpoenas Industry Groups Lobbyists Over Fake Net Neutrality Comments,4060,7
Canadians greeting law enforcement today,4061,8
me🕸irl,4062,7
Seagull eating a starfish,4063,2
Costume ideas,4064,1
when i try to retake b on cache,4065,2
White woman dubbed Golfcart Gail calls police on black father at soccer game,4066,2
PsBattle Thanos the Mad Pumpkin,4067,6
University of Michigan recovering a Woolly Mammoth skull in a farmers field in Michigan,4068,2
I think this might be the most guilty face Ive ever seen,4069,2
I put SexyBack over Spot the robot dog dancing and its way more disturbing now,4070,7
This bathroom has pretty minimalistic signs,4071,6
watch out boys,4072,2
me irl,4073,8
Wow Did you see how good he hit that,4074,2
Researchers found that people who underwent a virtual reality experience called Becoming Homeless were more empathetic toward the homeless and more likely to sign a petition in support of affordable housing than other study participants,4075,2
Haha Americans,4076,1
Training with Spidey,4077,4
Invest in native roots Amaizeing returns,4078,8
Kids Keep No Secrets,4079,2
85yearold McDonalds worker recieves $69K in online donations after wife dies in restaurant,4080,7
One kiss is all it takes,4081,2
China Communist Party Kicks Out General Who Killed Himself,4082,2
Alexa this is so sad,4083,2
Ain’t my WiFi,4084,5
TIFU when I brought my pregnant wife home a meatball foot long instead of the teriyaki chicken she asked for,4085,2
YouTube is down for users worldwide  NZ Herald,4086,2
Best one today,4087,2
No slots left sorry,4088,1
Yes its actually down,4089,2
Micro transactions that I can get Behind,4090,2
To promote dairy consumption,4091,3
Last month I found a 70 year old handmade atomic bomb shelter under a house and barn in North Carolina so I called my contractor friend and we descended ~30 feet into the darkness (OC),4092,2
understand the influence,4093,2
Retired admiral says climatechange research may mean our survival Climate change is a threat to coastal military installations and in a larger sense to national security overall,4094,2
Biden says “absolutely positively without question” voter suppression is ongoing,4095,2
The Internet Has Ruined Me,4096,2
There is no better state,4097,2
Piers Morgan gate keeping parenting and masculinity Chris Evans dropping truth bombs,4098,7
by ms paint,4099,2
What might feel like a loss to us may be a gift to many others This is Goodbye and Welcome by artist Charles Santoso,4100,2
After Leaked Video Sanders and Warren Demand Bezos Answer for Amazons Potentially Illegal Union Busting,4101,2
me irl,4102,8
me_irl,4103,7
Cows [oc],4104,7
An illustration showing how our mouth pronounces different words and sounds,4105,2
meirl,4106,8
When Charlie and Frank boil their denim an egg falls out of the pair of jeans,4107,6
Roses are red,4108,4
Late is the hour in which this conjurer chooses to stop working,4109,2
Met Dustin at my job today,4110,2
Hidden cata weapon to surpass metal gear,4111,7
Marvels Daredevil on Netflix  October 19 | Official Poster,4112,7
Real time GTA; knocking off a biker and trying to escape,4113,2
The fastest way down the stairs,4114,2
Sorry if repost but I’m guilty for doing this,4115,1
oof owie my burqah,4116,6
Thanks reddit worked like a charm,4117,6
Please pet me,4118,7
A mystery donor has given $130000 to a fouryearold boy battling cancer so he can go to the US for treatment that could save his life,4119,2
He probably goes to Cally,4120,2
Hand Charcoal 16x17,4121,6
I was told this was the play of the century,4122,2
A Hellbender holds a water snake in its jaws in Tennessee,4123,4
Ultra Realism,4124,5
Pam and Dwights honest friendship is one of my favorite things,4125,2
This is what really happened to YouTube,4126,2
Pour some cuevo ,4127,6
When you both equally hate Moira duels,4128,4
Only in Canada,4129,7
The deals are unreal,4130,1
My mailman must read this sub,4131,2
TIL We are closer to the date when The Jetsons is set (2062) than the original airing date of the series (1962),4132,2
Drew a nice picture of a cat on my iPad the other day Black background with only the white hairs drawn What do you guys think,4133,2
This Rottweiler with vitiligo is gorgeous,4134,8
Up to 95 million net neutrality comments were made with stolen identities,4135,7
Meanwhile in Canada,4136,7
Found in the halls of my university,4137,2
FedExcellent,4138,8
Want the camera too,4139,2
Ted Cruz snaps at debate moderator when asked about civility Don’t interrupt me,4140,2
Secret Service blocks CBS reporter from asking Jared Kushner about Saudi journalist,4141,1
Such a funny joke about politicians,4142,7
Petition to make this happen,4143,6
Important matters,4144,2
All grown up,4145,2
Hairy potter,4146,4
A British teenager who is trying to become the youngest person to cycle solo around the world has had his bike stolen in Australia,4147,2
Homemade Cinnamon Rolls (You *Could* Actually Make at Home),4148,2
Taylor Swift encourages fans to vote early It makes it so quick and easy,4149,2
2meirl4meirl,4150,2
Ninja Just Hit a Snipe in MidAir in a Quadcrasher,4151,7
So a Junior of mine decided she really needed my help passing a course my Supervisor offers,4152,6
Predinner tippytaps,4153,7
Weed just got legalized in Canada Toronto knows how to celebrate,4154,2
Journalist Jamal Khashoggi butchered while still alive horrific audio of his murder allegedly reveals,4155,1
Ultra Realism,4156,5
The “oh thank god” still stands,4157,7
Mad lad,4158,7
A tool so powerful it can cut cardboard,4159,6
Give this man an Oscar,4160,2
Oh no 😭😭😭😭😭,4161,4
The entrance to this bounce house displayed by my mother,4162,2
spare change,4163,2
Shoob has dinner with her frens,4164,7
A big scoop,4165,9
[Homemade] 5 cheese Mac and cheese,4166,6
Paying taxes really pays off,4167,2
Officers get year in prison for roles in framing black teen in crimes,4168,2
Seal plays peekaboo,4169,8
Axe from Viking era before and after conservation (1100 years old),4170,7
Me irl,4171,8
My school had “Netflix day” for spirit week I think I’m the only one who didn’t dress up as a Riverdale character,4172,1
Meme gatekeeps music and television interests,4173,2
They really stepped up their game,4174,6
[2006] April Fools Joke from blizzard stating GCD was added for all spells and abilities,4175,7
With extra vcheese and extra vsauce,4176,2
Perfectly balanced,4177,5
Seriously we dont get the respect we deserve We are often looked down on,4178,2
Now who’s laughing,4179,9
Only gets worse at night,4180,2
Let us never forget one of the most wholesome sendoffs of any show,4181,2
[OC] Sharpest Sword,4182,7
Rockfall at the road,4183,8
11 senators request Trump sons disclose business ties with Saudi Arabia,4184,2
In case youre wondering what happened,4185,8
It’s gonna be a good day bois,4186,2
This one will be different,4187,2
Defending The Motherland,4188,8
Bye bye backpack,4189,3
Getting pumped for Halloween night,4190,1
Something to brighten your mood (Not OC Link in comments),4191,2
TIFU by taking my wifes last name,4192,2
Is it just me or is YouTube getting worse and worse,4193,4
He was sent in by CyberLife to defeat T Series,4194,6
I’ll just have water thanks,4195,2
Oh no it looks like a shark hide,4196,6
This photo I took looks like four photos stitched together,4197,2
The Gang is Ready watercolors 11x8,4198,5
A mosaic of world countries retaining their correct size and shape [OC],4199,7
Good ol facepalm,4200,2
This photo I took looks like four photos stitched together,4201,2
EVERY time he walks by the mirror he stops and looks at himself,4202,7
Jerry loves her job as a therapy dog Here she is all smiles at work,4203,2
My attempt at Venom,4204,4
A solid investment for anyone looking to leverage their savings for a high ROI Invest now Template in comments,4205,2
Even Vladimir Putin knows the proper way to hold a dog,4206,2
Canadian drug dealers trying to get their first real job,4207,2
Duck joins pile of cats,4208,7
