Title,doc,topic
The first time I went to my girlfriends house over 12 years ago the first thing I noticed is not only did we have the same fan but we had both drawn faces on them Weve now been married for 8 years and Bill and Andrew are still with us,5502,2
DNA from seized elephant ivory unmasks 3 big trafficking cartels in Africa,5503,4
Nike has donated three times as much money to Republicans as Democrats this year,5504,2
Me irl,5505,8
Lioness steals a photographer’s camera gives it to her cubs as a new toy,5506,2
Roses are red were here to stay,5507,2
Teachers with 20+ experience whats the difference between the kids then vs the kids now,5508,2
Hello there,5509,2
to be a true Communist,5510,2
VERY VERSATILE FORMATINVEST BIG AND EARLY FOR MAX PROFIT,5511,4
I looked like an awkward step child desperately trying to fit into the family dynamic,5512,2
My face swap,5513,2
Couldn’t help but notice,5514,2
2 Hour Exposure of Andromeda Galaxy,5515,2
rDunderMifflin subscriber count hits 700000 A celebratory interpretive dance ensues,5516,9
Your genius is showing,5517,7
We think elderly drivers are bad now Wait till we have elderly drivers that also know how to use smart phones,5518,2
A Shark Tale,5519,2
Idiots in a Porsche,5520,8
Actual footage of tater tot coming home after a long day,5521,2
🔥 Red Asian Arowana 🔥,5522,2
Relatable,5523,2
Please get better,5524,2
My kind of autumn ❤,5525,8
The shark actually looks relieved someone finally found him,5526,2
When 2D meets 3D [SpiderMan] [Screenshot],5527,2
They added Pewdiepie to Minecraft,5528,5
Clouds in the northern hemisphere of Jupiter captured by NASAs Mission Juno,5529,2
Checkers is like chess after the pawns overthrew the monarchy,5530,7
hmmm,5531,2
Psst President Trump The Chinese aren’t paying for the tariffs you’re imposing We are,5532,2
To call out We Rate Dogs,5533,2
meirl,5534,9
Early Gen Z childhood starter pack,5535,2
There is no curse in Elvish Entish or the tongues of men for this treachery,5536,9
I received this mountain of 360 snickers for free due to a coupon glitch,5537,2
Ignore my battery percentage,5538,0
(GREENSCREEN) An okey movie edit,5539,7
Abbott & Costello  Whos on First Arguably the best routine of alltime,5540,2
MRW Im waiting for food to be delivered and I hear a car door shut,5541,2
My boyfriend was dying I was by his bedside when he said something with a weak voice Theres something I must confess,5542,2
One of my favorite Kelly dialogue,5543,2
I think I can I think I can,5544,2
North Carolina’s Famous Wild Horses Emerge from Hurricane Florence Unscathed,5545,8
Let me just clear it off my own guy,5546,2
A complete unit,5547,5
I made a poster combining all of the Halloween movies I love,5548,2
Spiral stone wall,5549,4
How in the world is this guy doing this,5550,2
My vehicle is just 3 yrs old and this is so uncomfortable,5551,2
Puppies first experience with wind,5552,2
This was at the bottom of the dried fruit pot to take up more space,5553,2
Good luck capturing this in live action,5554,2
The actual original photo that the NBA logo is based on,5555,9
It is known,5556,1
[I ate] Nacho cheese fries,5557,7
Im pretty sure somebody has already made this meme but Im doing it anyways,5558,2
To the people saying if you dont support Trump,5559,2
Apples Upcoming Streaming Service Is Reportedly So Bland Staff Are Calling It Expensive NBC,5560,2
PsBattle Kids in their Halloween costumes,5561,2
Top tier glassmaking,5562,4
The view outside the door in my Airbnb on the Isle of Skye our closest neighbor is half a mile away,5563,2
Well this will wake him up,5564,2
Slinky mode activated,5565,7
A pat down,5566,2
What a brave boy,5567,8
horse drawn carriage [OC],5568,2
Is that Ashton Kutcher,5569,4
If we’re talking about a big budget streaming series I think this particular Band of Brothers deserves one,5570,2
g o o d b o y e does a T A S T E,5571,5
The minions remake is looking goood,5572,8
Cow goes bark dog goes moo,5573,1
Picked up a seashell today with beautiful converging lines,5574,8
[text] Walt Disney was called uncreative on his first shot A record label told the Beatles their music was bad Clearly the people who called you untalented could be proven wrong,5575,2
Kitten falls off his bike,5576,2
Cables managed,5577,1
I knew there was going to be a moment which made the dash cam worth buying This is not what I expected that to be,5578,8
The three main components Doctor Strange needed to ensure that this timeline was the one in which the Avengers won,5579,2
Stop him,5580,2
TIFU by having a spider in my shower and accidentally creating a gas chamber,5581,2
Next crash will be ‘worse than the Great Depression’ experts US household debt of $133 trillion now exceeds the 2008 peak That’s due in part to mortgage lending which is hovering near its decadeago level of $9 trillionplus,5582,5
Upstanding citizens,5583,2
Shared Socks,5584,7
I have vbucks down here,5585,5
My friend works at a doggy daycare and sends me pictures of this guy everyday,5586,2
I finally managed to beat the last missing boss from the Dark Souls series When I came home the next day I found out that my 10 year old son had built me a statue out of fimo to celebrate the achievement It kind of took my breath away,5587,2
This cat sees himself in the mirror,5588,2
Waiting for the rain to pass,5589,2
Free trip,5590,2
Fish pupper,5591,8
Savage Reflection,5592,1
Thank you everyone for everything My brother and I loved playing Rainbow 6 together and I wanted to thank all of you for creating a community in which this game could thrive Thank you for being a part of his 17 years here His tag was Cloneyre and he was a JagerFuze main because they look cool,5593,2
My BF took some photos of our dogs today This one looks like she’s trying to be Clint Eastwood,5594,2
Okay i swear I’m done,5595,9
Only 12 seconds,5596,8
I got to name my own crayon at the Crayola Factory,5597,7
Oof ouch brrom,5598,1
Acting like youre going to shave your eyebrows and actually do it,5599,2
I knew there was going to be a moment which made the dash cam worth buying This is not what I expected that to be,5600,8
Confused big dog,5601,2
TIL a Curaçao woman rescued a flamingo that crashed into a window nursing it back to health and after realizing she couldnt release it back to the wild made it an ambassador for his species visiting schools with her to teach children about island wildlife and the importance of conservation,5602,2
It be real,5603,2
What were the odds,5604,8
Fast charging really has come a long way,5605,2
The good the bad an the living jukebox,5606,2
The size of these lads,5607,2
Honey,5608,7
Outfits that give you PTSD,5609,2
My buddy’s stylist “do you want to try something new”,5610,2
After getting out of the habit of reading I set a goal of reading 12 books in 2018 Yesterday I hit that goal,5611,2
Instantly thought of this sub when I saw this scene,5612,2
I have no idea what youre doing but I want to be involved,5613,1
Priorities,5614,5
Im confused,5615,2
Soldier comes home to surprise his best friend,5616,2
[Highlight] On 3rd and 10 Josh Allen runs and hurdles over 65 Anthony Barr to get the first down,5617,2
This is what Sunday mornings should feel like,5618,2
Only in Russia will you find a creature that tastes like almonds,5619,7
Solo shows the perfect way to have the Empires presence while not having them the main antagonist,5620,2
Racism Can Affect Your Mental Health From As Early As Childhood The study which researchers say is the first metaanalysis to look into racisms effects on adolescents (as opposed to adults) examined 214 peerreviewed articles examining over 91000 adolescents between the ages of 10 and 20,5621,8
Ben Wyatt and Jennifer Barkley were married in Step Brothers,5622,8
Harvesting pointy bois,5623,4
Grandpa,5624,2
Yale Students To Prof Who Denies Coaching Kavanaugh Clerks You’re Lying,5625,1
Rebels (OC),5626,1
The way water droplets collect on my dogs nose after he walks around sniffing the grass with fresh dew on it,5627,2
TIL that the Russians partied so hard after the end of WW2 was announced that the entire city of Moscow ran out of Vodka,5628,2
In the video game movie Doom staring The Rock the Universal Studios logo is Mars instead of the normal Earth logo,5629,2
Recursive,5630,3
Kitty likes head rubs,5631,2
soulmate au,5632,9
(LEGO) Viridian Forest Beware the wild Kakuna,5633,8
I knew there was going to be a moment which made the dash cam worth buying This is not what I expected that to be,5634,8
APUSH teacher is really stepping up his game,5635,7
Our 9 year old comrades,5636,2
Reading the lyrics on the cassette insert,5637,3
In InsideOut in Imagination Land the house of cards has face cards resembling Riley and her parents,5638,7
These orange push up pops were delicious,5639,8
The bathroom door at our friends house built in 1910,5640,2
Im welling up here,5641,2
You just lost,5642,2
Fat Joe and Big Pun,5643,2
To the guard outside the player exit that was sad no one wanted a picture with him,5644,2
m e g a i n f l a t i o n,5645,5
Yes,5646,2
Woah,5647,7
meow😿irl,5648,4
Me irl,5649,8
Trust issues,5650,9
I met Gary today,5651,2
Little dude showed up in a yard covered in mange trip to the vet a special bath (and a onzey so that he doesn’t lick) and he’s on the road to recovery This is Bandit,5652,8
The Coke machine really wanted me to get Fanta,5653,2
In Memento Lenny tells us in the beginning that you learn to trust your own hand writing When Teddy pressurizes him to write something about Natalie he doesnt use his normal hand writing so that he doesnt trust it later He changes it eventually with his real hand writing,5654,2
Positive Thoughts,5655,5
It do be like that,5656,2
Autumn in Boston Massachusetts,5657,0
Shadow Play,5658,2
My parents have officially replaced me,5659,7
Programmers,5660,5
My life is now a lie,5661,2
Former congressman Trump has completely destroyed the Republican Party,5662,6
[Meme] This is for furry art isnt it,5663,7
Saw this natural phenomenon near my home,5664,2
me irl,5665,8
Easily one of my favorite Sm4sh moments of all time,5666,9
Calm Cat,5667,2
This trash can I found in India,5668,2
I need a sequel to the 2011 Adventures of Tintin,5669,1
Cop,5670,2
My husband doesn’t like cats so naturally my cat does whatever he can to subtly annoy him,5671,2
It really do be like that sometimes,5672,2
[Wojnarowski] In a deal that cements him as the franchise’s longterm cornerstone Minnesota Timberwolves AllStar center KarlAnthony Towns has agreed to a 5year $190M supermaximum extension league sources tell ESPN,5673,8
per 4 servings,5674,2
Fixed the vertical line on my damaged apple watch,5675,2
ITAP of my barber’s chair,5676,2
Smile pumpkin,5677,9
My buddy made me this BotW Goddess statue for my birthday,5678,2
I took this astrophoto in Death Valley a couple weeks ago Check out the Andromeda Galaxy as a tiny smudge there in the center,5679,2
Asked the girl i like out yesterday,5680,2
[NO SPOILERS] I visited the Iron Islands today ,5681,8
Camel Crushed Spirit,5682,9
What was the point of reworking stealth to improve its gameplay when rework Akali comes along and breaks all the new stealth rules,5683,1
God bless your striking features,5684,1
Wait,5685,2
Are you feeling blue,5686,8
Only gamers will understand,5687,2
2 years ago my friends and I set out to make an animalbased adventure game This week we released its first gameplay teaser,5688,2
THIS FACE My friend’s cat after being spayed,5689,2
Jesus was a longhaired darkskinned liberal pacifist socialist in other words everything Christians are not,5690,2
Put on the black suit and everything changes,5691,2
Winner photo of NatGeos 2015 Travel Photo Contest by Anuar Patjane Floriuk shows the sheer enormity of a humpback whale with her calf compared to a group of divers,5692,2
When I drink alcohol people call me an alcoholic But when I drink Fanta no one calls me _______,5693,1
hmmm,5694,2
Playing Spiderman when I found a building that looked familiar,5695,2
Two brothers were rescued and treated at different NGOs The reaction when they are reunited is priceless,5696,2
Cant get this shampoo outta my hair,5697,2
Fantastic view from google earth,5698,2
shark,5699,2
Cat finds ears,5700,2
This is how I was greeted by my cat when I got home last night,5701,2
After 26 years with no country I finally have a place to call home Tears were shed,5702,2
Yeah me too,5703,2
LPT High schoolers dont think you have to go to college to be successful Not great at school look at learning a trade You can make a good sustainable income as an electrician plumber welder etc You can enroll in a technical college or better yet find a apprenticeship at a larger company,5704,2
This Welding Pumpkin,5705,0
Found an owl lying in my backyard this morning (don’t worry I took him to a wildlife rescue center),5706,2
This actual periodic table table my university has,5707,5
Don’t forget your brother,5708,2
Police departments that collect more in fees and fines are less effective at solving crimes,5709,8
This pup maintains good boy status even when getting his nails clipped,5710,2
Spotting an orca,5711,2
My breakfast sausages begged for their lives this morning Listen to their cries for mercy,5712,2
Coin stack i made,5713,1
TIL that when NASA was preparing for Sally Ride to travel as the first American female astronaut engineers initially were at a loss about how many tampons to send “Is 100 the right number” they asked her “No That would not be the right number” she replied,5714,2
TIL the reason why clocks run clockwise They do because in the Northern hemisphere thats how sundials cast shadow,5715,2
Honey bees exposed to glyphosate the active ingredient in Roundup lose some of the beneficial bacteria in their guts and are more susceptible to infection and death from harmful bacteria Glyphosate might be contributing to the decline of honey bees and native bees around the world,5716,1
[Image] No matter what happens in life; you can always start over,5717,2
Seattle court agrees to clear past marijuana convictions,5718,2
You had one job,5719,2
Brought my first dog home yesterday—Reddit meet Marty,5720,2
This soldier carrying his service dog because it was 117°F(47°C) and the rocks were burning his paws,5721,2
Whaddup unc,5722,1
Ultimate f*ck up,5723,2
Artist tip,5724,2
me irl,5725,8
My gramps looking suave He’s 98 now,5726,8
Lifecycle of my gaming habits,5727,5
It is how it is (original in comments),5728,6
Not a chance,5729,8
Supreme Court nominee Brett Kavanaughs Yale roommate says he believes second accuser,5730,1
The app we need,5731,2
Reddits Largest ProTrump Subreddit Appears To Have Been Targeted By Russian Propaganda For Years,5732,2
Quartz found in Arkansas is worth $4 million,5733,2
Wasnt planned but got to meet the protagonists from Gta V Super funny guys,5734,2
It has been said,5735,2
The Latest AP source says Rosenstein expecting to be fired,5736,2
Made some custom controllers for my friends Decided to make one for myself,5737,2
Nintendo was founded 129 years ago today in Kyoto,5738,2
Trump No statehood for Puerto Rico with critics in office,5739,2
What do you call a priest that becomes a lawyer,5740,2
This dude somehow survives with not even a single scratch,5741,2
hmmm,5742,2
Jeremy Corbyn has warned the rich they are on “borrowed time” because a Labour government is coming as he took aim at their tax breaks and offshore havens His speech comes after Labour launched a radical plan to require private companies to hand over a 10 per cent share of their equity to workers,5743,1
This sound is fing crispppp,5744,2
Hello there,5745,2
🔥 Leptocephalus the transparent larva of an eel 🔥,5746,2
We got this new guy at work Hes really nice,5747,2
PhD in Construction Management,5748,7
Im just going to lay down right here,5749,2
All Airports Should Have This,5750,7
As War on Drugs Again Declared Failure Trumps UN Event Dismissed as Splashy BackwardThinking Photo Op President Trump is the last person who should be defining the global debate on drug policy,5751,2
Stop Littering,5752,2
Monsantos global weedkiller harms honeybees research finds  The world’s most used weedkiller damages the beneficial bacteria in the guts of honeybees and makes them more prone to deadly infections new research has found,5753,2
What kind of potato is this,5754,8
Megathread Additional accusations of sexual misconduct made against Brett Kavanaugh,5755,1
The feels ( RIP Alan Rickman,5756,3
I hate this,5757,6
Astronomers witness an Earthsized clump of matter fall into a supermassive black hole at 30% the speed of light,5758,7
Another unbelievable chocolate sculpture made by the amazing Amaury Guichon,5759,2
Carving,5760,5
here,5761,0
A meteor shooting across the sky,5762,8
Me irl,5763,8
General Kenobi,5764,9
Sea lion pups roll in the sand to protect themselves from the sun,5765,7
To make a witty Popeye reference,5766,2
This happens to me to often,5767,2
Shadow Play,5768,2
Man Survives Jumping Into Zoos Elephant Enclosure as Animals Show Mercy and Escort Him Out,5769,2
Somewhere in tibet,5770,0
My username on XBL is a fat kid My messages feed is always entertaining,5771,2
Carved from a stump,5772,4
Little did i know,5773,2
Leaked PG13 VENOM Footage VS Unreleased RRated Version (SFW),5774,2
Love note,5775,2
Sweet dreams are made of this,5776,2
I made him angry we have ascended to phase two,5777,2
The price is savage,5778,2
Fortnite is overrated My favorite shooter game is _______,5779,7
Avenatti Claims to Have Evidence That Brett Kavanaugh Was Involved in Gang Rapes in High School,5780,1
Y’all ever read something so untrue that you wished it had never been thought up,5781,2
Gary Kurtz producer on American Graffiti Star Wars and The Empire Strikes Back has died,5782,2
2meirl4meirl,5783,7
shark,5784,2
[Homemade] That’s a Pastrami,5785,8
Netflix did it again,5786,2
Megathread Deupty AG Rod Rosenstein to remain in job meeting with President Trump on Thursday,5787,9
The world needs more people like Dolly Parton,5788,2
They blocked me after I said “did you draw this” They just cropped out the signature at the bottom,5789,9
Shredded Anakin > Ben Swolo,5790,7
The realest multiplayer map that ever existed,5791,7
Stormtrooper roadster,5792,4
Absolute madlass,5793,2
Facebook sad cringe,5794,2
Education matters,5795,7
A skinny little white guy walks into an elevator looks up and sees this HUGE black guy standing next to him,5796,2
Yeah sure,5797,2
It’s always this way,5798,2
The most ironic meme in the west,5799,6
Mondays Forbidden Repost,5800,8
The burmese star tortoise is one of the few animals that have comeback from being called functionally extinct,5801,2
Yall Android users are poor Starter pack,5802,2
In Scott Pilgrim Vs The World Michael Cera throws a cd and says don’t listen to that The cd lands in the Beck section Beck wrote all the music for Sex Bobomb Cera’s band in the movie,5803,2
Drawn and Quartered,5804,3
Meirl,5805,9
I don’t even have to write anything,5806,2
And you feel somewhat responsible,5807,7
Tarot Reader Girl,5808,2
Blake Griffin dated Kendall Jenner,5809,5
SpiderMan,5810,2
Literally all of us nutshell,5811,2
Found this in my AP computer science class,5812,2
Doggo got skills,5813,2
We all know the best kind of tutorials,5814,2
Roses are red some cats are blonde,5815,6
Every time I go to the dentist I have an awkward moment with the hygienist,5816,7
ladies and gentlemen,5817,2
Aint that the truth,5818,0
Dance move,5819,2
My parents neighbors have an outdoor kitty that drools when hes with people and happy,5820,2
First Season 6 Teaser All parties need a great DJ,5821,8
Its dangerous for everyone They know what they signed up for,5822,2
Handsome cat,5823,2
hmmm,5824,2
Italy WW2 memes are SO hot right now,5825,7
This is a tower for rolling dice,5826,7
Deputy Attorney General Rod Rosenstein is reportedly resigning,5827,9
Marriage Struggles,5828,2
Elon Musk connoisseur,5829,2
[WP] Two warriors engage in battle One with the power to move superhumanly fast and the other with the ability to slow down time Theyre both a little confused when it seems like their powers dont seem to be working,5830,2
Whats something you found out about your SO years into the relationship that made you reevaluate the whole relationship,5831,2
Little Libraries Spread Worldwide After Strong Start in Madison Wisconsin,5832,8
Purple Iris,5833,4
Absolute madlad,5834,2
Woof_irl,5835,6
Baffling tragedy,5836,4
I bought a dump for my first house and gutted it,5837,2
Golden puppy meeting his human for the first time,5838,2
I told her she was beautiful,5839,8
Were starting to have roundabouts introduced in some areas of the US Many dont know how they work,5840,2
James Lipton Retiring From Inside the Actors Studio,5841,8
Dr phil dark nights,5842,2
This silent hills cosplay,5843,7
The entire sub at this point,5844,2
Orca chasing you,5845,2
A surprise to be sure,5846,6
Curvy brick wall,5847,4
Facebookjpg,5848,0
Kawhi Leonard I’m a fun guy,5849,2
All Airports Should Have This,5850,7
Aaaaaa,5851,5
I have a sinking feeling that something is off,5852,2
New York City  1890s,5853,2
Americans eat babies and kill POWs,5854,2
The gameshow taxes are high anyway,5855,7
Saviours,5856,6
Waking up on vacation with your family in the mid 2000s starter pack,5857,2
Mailed the package boss,5858,7
Donna don’t deserve the ManMilk©,5859,6
Cant beat that folks,5860,1
Got a picture with cam newton today,5861,2
Rey & Kylo by Sandara Tang,5862,0
[OC] Silly Item  Boots Made For Walking,5863,2
What years of use in a commercial kitchen looks like the knife on the left was once the same as the knife on the right,5864,2
CNN focus group of conservative women turns out to be comprised of GOP operatives,5865,2
My biology professor is playing Quigon’s conversation about midichlorians in class to talk about mitochondria,5866,1
Low quality OC but the hard truth,5867,7
<( O _ O )>,5868,0
The scene that will win the show Emmys,5869,2
What other reason do we need,5870,2
Foam gliders,5871,8
Master bedroom in our airbnb had an en suite saunabomb shelterdungeon and found a gold mask Behold the results,5872,6
My mom recently got into cross stitching This is what she just made for me,5873,2
Winter is coming,5874,8
Now that is quite amazing ,5875,2
give me lamps brother,5876,1
HandDrawn Thanos,5877,0
Built my second PC,5878,2
Dog saves cat from potential fight,5879,2
Bubble ring magic,5880,7
Cholo StarWars,5881,9
Red Dead Redemption 2 will have around 200 species of animals,5882,2
The original Nintendo headquarters 129 years ago in Kyoto﻿,5883,2
We Created a Monster by TheBourgyMan,5884,2
Oldie but a goodie Reminded of this after getting a new dog this past week,5885,2
The Decision Not to Call in the FBI is Looking Worse and Worse,5886,2
Life of a Tree 5501891,5887,2
Friend broke his leg in a dirt bike accident this weekend Pharmacist has no chill,5888,2
Slightly threatening update from UKMail,5889,6
Wondering why my cup was wobbling after I set it in my drink holder Nothing under it when I lifted it up 🙄,5890,1
Granny gives the answer we’ve all been looking for,5891,2
If they really cared the staff would finish The Walking Dead without pay,5892,2
🔥 A chrysalis on our garage 🔥,5893,8
A party invite,5894,6
When your barber is a dog,5895,2
In this house we love & appreciate,5896,2
This must be what the Pearly Gates look like,5897,2
Barcode hair is a no for me,5898,8
The perfect respoo never mind,5899,2
Magic mixed with physics,5900,7
After my bike was locked by campus police for being illegally parked I damaged property to get my bike free and get out of a ticket,5901,2
Rock Tunnel  OC,5902,2
Raise your hand if rcats is your favorite way to start your day,5903,2
CEO Elon Musk revealed over the weekend that the company’s famed rendering which shows a series of BFR rockets stationed on the red planet alongside roads and a more permanent base could become reality by 2028,5904,2
Legolust,5905,7
*notices soul* OwO what’s this,5906,9
Thats the drawing of beautifull Severus made by my wife rdrawing people said that you all might enjoy it too ) What do you think about it,5907,2
My now husband 10 to 15 years ago in highschool Yes he made those swords,5908,2
Edge mode on,5909,0
Goodmorning people sorting by new,5910,2
Mlather rinse and repeat,5911,4
New York Times Sues FCC For Information About Net Neutrality Comments,5912,7
Eminem is rap god MGK is rap devil and Im rap _____,5913,1
This cat carrying backpack,5914,9
Im usually not confrontational but this is a friend of mine and she has gorgeous hair I couldnt let her become another victim of Monat Well see if the hun comes after me,5915,2
I need this,5916,2
 Children of Darkness an Oscar nominated 1983 documentary film,5917,2
Two Kavanaugh Allies Withdraw From Statement Disputing New Yorker Allegation,5918,2
Welp was nice knowing yah,5919,7
and now a word from our sponsor,5920,8
Friendship goals,5921,8
This juice says it has 100%(100%) of juice so people think it has 100% if they look quickly,5922,2
[Schefter] MRI showed what 49ers feared Jimmy Garoppolo tore his ACL and his season is over per source,5923,8
Instagram This,5924,2
Finally hit GM after starting at 2000 in season 2 and getting 3998 last season,5925,2
2000 IQ observation,5926,5
One of his favourite things to do is have me carry him around in shopping bags I keep one on the kitchen table because when I get home the first thing he does is jumps inside and waits for me to pick it up and walk around with him in it Hell meow from inside the bag until its done,5927,2
😀 #Advertising,5928,3
Mark Hamill turns 67 today Happy Birthday Luke,5929,8
Ferret had babies TIMLN,5930,2
| || || |_,5931,0
Turtle Slap,5932,8
From the Fog,5933,2
Yesterday I took a shower The first since 93017,5934,2
252 months the day,5935,2
Some essential oils may ease the burn AVers,5936,9
When you embarrass yourself in front of your crew ,5937,2
