Title,doc,topic
RIP potato,0,8
At a certain point in your life sitting at home alone watching TV on a Friday night goes from being super depressing to the most enjoyable part of your week,1,2
The glass globe of this light focused the sunlight enough to burn the suns path in the grass,2,2
France becomes first country in Europe to ban all five pesticides killing bees  France will take a radical step towards protecting its dwindling bee population on Saturday by becoming the first country in Europe to ban all five pesticides researchers believe are killing off the insects,3,2
I ordered chickfila online for the first time There was a slider for extra pickles I set it to max This is what I got,4,7
A bird perched on my head took flight as I took the picture,5,2
Guess who’s not allowed back in the Olivideo shopping center,6,2
TIL “Shoeless” Joe Jackson was illiterate In restaurants rather than ask someone to read the menu to him he would wait until his teammates ordered and then order one of the items that he heard,7,2
Never lost my ticket again,8,2
Mr Hands over here On a NATIONALLY televised broadcast,9,9
Its just only me who wants safety tips  D ),10,2
The Unabombers cabin held in an FBI storage facility near Sacramento,11,2
Half malamute half golden,12,2
Just found this 1989 gem in the family album My parents and I arriving at the cabin for the weekend,13,2
Friends,14,2
Creepy Pastor Digs Fingers Into Ariana Grandes Breast at Aretha Franklins Funeral,15,4
Won the school art contest with this sculpture,16,8
This jump,17,1
To honor fallen teammate Jordan McNair Maryland took the field with only 10 players leaving the guard position empty and took a delay of game penalty Texas declined the penalty,18,2
This church showed up at a Pride Parade and offered free momdadgranpastor hugs to people who had been shunned by their family,19,2
Ill upvote your mums Christmas Tree and raise you this Pirate Ship Didnt know Reddit loved cards so much,20,2
Cuddling with a cheetah,21,0
Have you ever heard the sound of a gif making the front page,22,2
My son planted this carrot months ago Tonight we feast,23,2
Pineapple on pizza is like the country music of pizza People either like it or they will literally threaten to murder everyone that even speaks of it,24,2
My daughter went to Preschool then we homeschooled her for 9 years and last week she started High School Apparently for your student ID they use the last photo on record,25,2
Found this in Louisiana,26,2
Steam irks me sometimes,27,2
The most beautiful thing you see today,28,2
First ever trials on the effects of microdosing LSD set to begin,29,7
A ship and its Captain,30,1
Like father like son,31,2
to be a feminist,32,4
You can see my pulse through the blister,33,2
A hotel in Tokyo has a reception desk that is run by robot dinosaurs,34,2
Instant regret,35,2
My husband < your husband,36,2
Disney disguise their princesses with a robe when they are not performing,37,8
cute birdie,38,4
Can be used in anyway INVEST,39,2
Begone mother,40,5
I thought I’d lost my dog’s ball in a pond but then some fish brought it back,41,2
cute otter,42,4
For every upvote this post gets I will walk 1 foot hobbitfooted to cast away the One Ring No limits and no regurgitation,43,2
Dramatic house cleaning,44,2
TIL the bluest blue (to date) was accidentally discovered when a researcher received a grant to explore novel materials for electronics applications and tried to heat together oxides of manganese yttrium and indium at two thousand degrees Fahrenheit,45,5
My mother 2 aunts and gorgeous grandmother with cheek bones for days (Dominican Republic 1960’s),46,2
Hehhehehehehehehehehe,47,0
Nestle says slavery reporting requirements could cost customers,48,1
Some can and some not so much,49,2
Four years ago I lost over 50 pounds Im not done yet but today Im celebrating keeping the weight off,50,2
Me irl,51,8
Good cloud eats some tasty food,52,2
This madlad isnt wrong,53,2
I FEEL FOR THEM,54,2
This porridge is hotter than your ass,55,3
My wife told me “If anything happens to me I want you to meet someone new”,56,2
Stop treating tech jerks like gods,57,2
hmmm,58,2
Whats the saved Reddit post you go back to most often,59,2
Teachers of reddit whats the most interesting thing a child has brought in for show and tell,60,2
PsBattle A pitbull licking Tom Hardy,61,4
Yup,62,9
Did I just catch that,63,7
Trump administration withholds 100K Kavanaugh pages ahead of Supreme Court Justice decision,64,2
At the difference in quality as Batman the Animated Series is being remastered,65,2
The struggle with being a historian on rhistorymemes,66,6
Agents Tried to Flip Russian Oligarchs The Fallout Spread to Trump,67,2
99yearold ex Marine walks 6 miles each day to visit wife in hospital,68,2
Would you like some cheese with that wine,69,2
When your legs dont work like they used to before,70,2
MRW people post videos of their kids saying how smart they are for their age,71,2
Mum gecko is very happy,72,8
Jack Nicholson gave the same great performance over seven takes in A Few Good Men,73,2
He just wont get old,74,2
There was an attempt,75,2
Cursed Match,76,2
Please describe him without mentioning his skin color,77,2
meirl,78,9
This goodboye has mastered the BALL,79,2
Saw this in my library gave me a chuckle,80,2
FINALLY a way to buy apples AND add plastic to landfills and oceans,81,2
Duallayer solar cell developed at UCLA sets record for efficiently generating power  The team’s new cell converts 224 percent of the incoming energy from the sun a record in power conversion efficiency for a perovskite–CIGS tandem solar cell as reported in Science,82,2
Babushkas of the Round Table,83,5
LPT If dealer asks why you want to sell your car say youre looking to upgrade If you say other reasons like need the money moving town etc they will lowball you with the price offer knowing youre desperate to sell it and will most likely take whatever they offer,84,2
HotBOYE cooling down ,85,6
SLPT  be this man,86,2
2meirl4meirl,87,7
I save earth 🌎,88,7
(NOT OC) But how is this even LEGAL,89,7
What an absolute savage,90,2
The luckiest killshot I’ve ever had in a game,91,7
Keep your girlfriends and mothers away from this man he’s insane,92,2
The Builder | Default Diaries #009,93,7
Mods are asleep upvote evil trains,94,2
AlmostalmostDamn,95,3
This is my good boy Pepper Found a bump on his hip and over time it got bigger turns out it was an abscess He did a brave boy thing and stayed at the vet a few nights and this is him back today better and happier than ever with his new toy,96,2
Dont judge a gif by its tumbnail,97,2
[OC][ART] Behold,98,5
Whites from counties that experienced historical civil rights protests are more likely to identify as Democrats and support affirmative action,99,2
Sunset over Water 11 x 9 inches Pen and Ink,100,2
[OC] The growth of reddit (Interactive Demo in Comments),101,6
me_irl,102,9
2meirl4meirl,103,7
Incredible Borderlands Cosplay,104,7
Me_irl,105,9
Unstoppable prankster tries to reverse the flow of time,106,2
TIL that Terry Pratchett was a Skyrim and Oblivion modder,107,2
Animal Testing,108,2
infinity war spoilers,109,2
Papadopoulos Trump Approved Proposed Meeting with Putin Ahead of 2016 Election,110,2
Kyrgios reaction to Federers amazing around the post winner,111,2
Haha yes,112,9
I am sorry mumble one,113,1
[Homemade] Caramel Stuffed Chocolate Chip Cookies,114,2
It’s charging then,115,8
oof,116,1
If Earth had rings like Saturn,117,7
Black salt White pepper Doing my head in,118,2
It was a high tide today (OC),119,7
HMJB while I try coke for the first time,120,2
goldenpup cuddle club,121,9
Wipeout,122,7
Pulling power of a Belgian draft horse against 18 men,123,2
Not worth paying because theyre in a bad situation,124,2
[Homemade] Battenberg cakes chocolaterye whiskey and roselemon,125,0
Photo of deer hugging a firefighter near Burns Lake goes viral,126,1
Life sized Walrus I carved 7 feet x 11 feet,127,2
Wholesome,128,8
meirl,129,9
Look how excited he is He can finally be a dog again,130,2
Big Show’s transformation is inspiring,131,4
Love this business card (crosspost from rgif),132,9
S Tier Gatekeeping,133,7
Spectators get a little too close to the action,134,2
Finally,135,2
YOU GET AN UPVOTE YOU GET AN UPVOTE AND YOUUU GET AN UPVOTE,136,2
Hot Take R2D2 is the most consistently best shot character in the franchise,137,2
Synchronised fireworks,138,4
The impossible has been done,139,6
Dont think so either,140,2
I seriously have no idea I had it on autopay via my debit card and I still have Gold 4 years after having my card replaced,141,2
Colors on table,142,5
This dude is the mayor of my city lol,143,2
The day we adopted to now,144,2
Parkland student rips Rubio for complaint about Neil Armstrong movie Where was this energy after school shooting,145,2
Stefáns family just uploaded a playlist of the songs he wanted played when they laid him to rest Please read the description and get Stefán to 1 million subscribers,146,2
Harsh truths over here,147,3
You’ve all heard of nope ropes and danger noodles but have you heard of fear spheres,148,7
Happy Birthday to this incredible honorable talented and generous man Keanu Reeves,149,8
PsBattle A captain and his ship,150,1
The true origin of the Avengers Initiative,151,2
Creating Comic Book Covers in SpiderMan PS4,152,9
Zoeys last zoomies caught on camera,153,7
Kimi Räikkönen is on pole for the 2018 Italian Grand Prix,154,5
Slack Wyrm #340  Lord Edgelord Arrives,155,4
How to Recognise Anxiety in Yourself and Others,156,5
Molly gives me a dance every day when I come home,157,2
I’m enjoying the new upvote buttons on this sub,158,2
John McCain Lies in State at the US Capitol,159,2
I love League but Im starting to hate Riot,160,2
The Speed of Smell,161,7
My gf dumped me so ive redecorated my bed room,162,2
When you just love them so much,163,2
How To Ruin a Pervert’s “Happy Time”,164,9
As an amateur of photography Im extremely proud of this shot of mine,165,9
The difference a few months makes,166,2
I dont work here and a venomous manager tried to write me up for it,167,2
Excusme what the f,168,4
The wing structure of the hornet in relation to its weight is not suitable for flight but he does not know this and flies anyway,169,2
A monkey clinging to a Chihuahua,170,5
New documents Kavanaugh has ‘constitutional problems’ with campaign finance regulation,171,1
Coral reef acrylics on cardboard 19 x 12 cm,172,8
Made fun of my mom for not knowing tomatoes are fruits She made me fruit salad for dessert,173,2
Mr Beast is always 1 step ahead of us 9 year olds,174,2
From 1967 until his death in 2012 Roger Ebert made a top 10 list (save a few exceptions) of his favorite movies each year He is still regarded as perhaps the most widelyknown film critic of all time These were his favorites,175,2
Rare video footage of Neil Armstrong planting flags all over the solar system,176,2
TIL of a study that examined the brains of nuns who engaged in “centering prayer” which is meant to create a feeling of oneness with God The nuns’ brain scans showed similarities to people who use drugs like psilocybin mushrooms,177,8
woof_irl,178,6
Baws deep,179,7
In The Aristocats the basset hound sleeps in a bassinet,180,0
Trying a new technique to make realistic Lego water drain pipes,181,2
To win a tug of war against a lion,182,2
I was told this sub might appreciate The Swanson I ate IRL,183,2
Wife passed away I would truly appreciate some help figuring out where I stand,184,2
Worked at car week in Carmel CA last week and had to park in between these two McLarens,185,2
Welcoming attitude,186,0
Just saw this one on facebook,187,2
Our clothes,188,7
(0015) Just a dog minding his own business,189,2
I like trebuchets,190,7
Im sorry what,191,1
Technically this is where the MCU started,192,2
Entry is 10 dollars but the wedgies are free,193,2
Wife got a haircut noticed I didn’t even look before speaking,194,2
The Queen has died Announcing our next monarch King ______,195,2
Tries to add a false sentimental story to a cheap WalMart ring,196,2
My Favourite Carnival Ride,197,8
What’s the most BS Ted talk you’ve ever seen,198,7
Exotic Car Dealership Wanted 60ft Mural for Less Than Material Costs in Exchange for ‘Exposure’,199,2
What the seedpod looks like,200,7
you may have 🛐,201,2
Avengers Infinity Friends,202,2
One of the rarest monkey species in the world Françoiss langurs are born with bright orange hair that eventually turns black as they grow The running theory is that the orange babies are easier for their parents to keep track of in their treetop habitat,203,7
Wise words from Jackspidicy,204,6
I want 10 of him,205,2
ITAP of this old Citroen nestled away in a French garden,206,2
Lindsey Graham Trump will be investigated to death if Democrats win the House,207,2
Service dog goes to Amos Rex art museum,208,1
Obama on McCain We never doubted we were on the same team,209,2
Everyone this is Roofus Roofus this is everyone,210,2
If the moon was 1 pixel,211,2
The Matriarchy Any guesses on the topic of discussion,212,3
TIL that R Lee Ermey actor for the drill instructor in Full Metal Jacket,213,7
Macys discount sign they have on all of their racks,214,7
My grandma’s beloved sunflower,215,3
me_irl,216,9
Smarty pants,217,4
Here’s my personal take on an icesnow biome on the battle royale island,218,2
Ill leave that here,219,2
This is beyond cute,220,4
🔥 Kingfisher enjoying its lunch 🔥,221,2
Livingworking in Hawaii took a break to travel,222,2
My favourite video of my very smart girl Dandelion,223,2
Got em,224,7
[Rocket League] C A L C U L A T E D,225,5
Sony’s NorCal headquarters is ready for the new SpiderMan,226,2
meow 🥖 irl,227,8
What’s this handsome little fella Found it in Pocono Mountains PA,228,2
This cat is an absolute unit,229,2
My luckiest moment,230,8
Mega O O F,231,4
Last week I finished a ring box for getting engaged My (now fiancee) loves hiking and the outdoors I told her I wanted to get into woodworking so I did,232,2
[WP] You are a medieval villager who has been cursed by a witch She curses you to be live until you are the last human alive After a 1000 years you try to start the apocalypse,233,2
People of reddit who got divorced and then remarried the same person again whats your story,234,2
eat your numbers,235,2
My lambo with bitcoin,236,9
Semipantograph failure causes severe damage to the catenary network,237,3
Dream on,238,8
Ammunition divided by color,239,7
My little white friend loves to surprise „attack“ me around corners,240,2
More Than Half of Millennials Plan to Vote This November Poll Finds,241,2
When Doomfist gets Nanoboosted he yells IM COMING FOR YOU ALL and I hate to disappoint my Ana,242,2
People of reddit who are sitting in your living rooms right now what would you honestly do if a gorilla burst through your front door right now,243,2
Incredible innovation to this simple specialized tool,244,2
I had the whole house to myself on Friday night with my parents miles away what did I do,245,2
Horses,246,8
Hes Wonderful,247,2
How I would like Lockouts displayed,248,2
First photo of us six years later,249,2
Good fences make good neighbours,250,2
Cat practises his moves while waiting his turn,251,2
This 1000 piece holographic monstrosity I just finished,252,4
Ive looked at him the same way since 1975,253,2
Isnt it time,254,2
Husky telling hooman hes scared of the water,255,2
Illegal picture taken inside the US Supreme Court in 1932 Dr Erich Salomon faked a broken arm so he could hide a camera in his cast,256,2
Marvelous Abraham Lincoln Animatronic,257,3
Petition to have our logo be the same but with the planet tilted the other way,258,2
Depression is the most common mental illness yet it somehow convinces everyone that they’re completely alone,259,2
Littering out of a Taxi,260,1
Samoan Prime Minister Leaders Who Deny Climate Change Are ‘Utterly Stupid’ Tuilaepa Sailele suggested that such skeptics should be taken to a mental institution,261,7
Meme celebrity meetup,262,2
My father having small talk with a monk while waiting at the DMV,263,2
Trust is key,264,9
Goofing off and not working,265,2
If I’m not happy you can’t be happy either,266,8
The city of brotherly love,267,2
I wanted natural light in a basement that has no windows Paid $10 for two old windows Painted them frosted the glass installed them into my wall with 12” LED flat panel lights behind them Now it’s always 2pm at the basement bar,268,1
What do you need a compliment on that would make your day better,269,2
I photographed the full moon rising over the ocean through some clouds and atmospheric distortion which rendered the moon a beautiful yellowgold hue,270,2
Dragon departing from the ISS,271,2
Arizona States NKeal Harry beats the entire defense to score a TD,272,2
TIL The world’s oldest known spider lived to be 43 Named Number 16 she died after being stung by a wasp,273,2
Steve Irwin is visited at work by his daughter Bindi dressed as a lion,274,2
Incredibles 2 becomes first animated film to pass $600M domestic Also its the third Disney produced superhero film to pass $600M domestic this year,275,6
Labor Day weekend is for heroes like this daredevil,276,2
After many years he finally broke down the Berlin Wall c 1960s > 1990s,277,2
i asked my buddy how his vacation was going he sent me this,278,2
TIL that even though daddylongleg spiders dont have powerful enough venom to harm humans they hunt and kill larger spiders that can kill humans like the redback spider They use their long legs to quickly wrap other spiders with webbing immobilizing them before biting and eating them,279,2
These metro seats that change direction,280,2
Flat earthers must be afraid that meteorites could hit the earth from underneath,281,2
When you get a new sister,282,2
Bob Ross Creator of worlds,283,2
Tax avoiders blocked from honours list secret UK government memo reveals  Tax avoiders are to be blocked from receiving knighthoods and other honours as authorities clamp down on rewarding “poor” financial behaviour,284,9
 to number babies instead of name them,285,2
When the world just makes sense,286,2
When I ask mom what were having for dinner,287,2
The Milky Way and a meteor shower,288,2
Police say Free Candy van not a threat to public,289,2
New experimental painkiller is like stronger morphine without the addiction The drug called AT121 targets the same opioid receptors in the brain but also latches on to nociception receptors that block the brain’s addictionforming response in a primate study in Science Translational Medicine,290,2
Was excited for the extra drawer space outside our bathroom in the new house But I let my wife choose her side first,291,2
Why everyone should go camping  this is what we woke up to today,292,2
My dad stationed in Germany standing next to the border of Czechoslovakia  1982,293,2
We need more people like this,294,2
Thousands of Oakland school children wont be getting meals due to budget cuts,295,2
The Wasp cosplay by Chris Lee,296,7
Haha yes homework,297,9
The Alpacalypse,298,0
Grandmas words speak loudest,299,2
DUI arrests cut in half since ridesharing began in Louisville,300,2
Tell me more about your world,301,2
squish,302,3
David Hogg raises thousands to place billboard of Trumps antiCruz tweet in Texas,303,2
uJmgill12 explains why University of Maryland football shouldn’t be celebrated for “honoring” one of their players who recently died,304,2
YouTube 2018 portrayed by Spongebob,305,2
playing to loose,306,4
He waited patiently for his turn then it stopped working,307,2
Smoothie the Cat lives up to her name,308,2
Eh he’s got 2 more,309,2
Truck Driver Taking OffRamp Too Fast,310,2
Smart but,311,2
If it’s wrong I don’t want to be right,312,2
CrOc MeLtS iN BuRniNg HeAt,313,4
Changing the focal length,314,8
PsBattle A man holding this cucumber,315,2
Apartment complex flooded at least 3 feet Good neighbors saved dogs trapped inside,316,2
Being young this condor appeared with a wounded leg Edgardo Dellagaspera owner of a ranch in Argentina healed him and taught him to feed on his own Every so often keeps coming back to say hello,317,2
If it works it works Harry Potter probably,318,2
Finally found the perfect stick,319,2
Some guy in 1990 buys a Satellite TV and records unedited raw sat feed Results are mindblowing,320,2
You can never have too many happy trees ),321,2
Insane punt return (XPost from rsports),322,8
Bear celebrates being released into the wild by being a wild bear,323,8
yep,324,6
Always a pleasure to meet a Jedi,325,2
This is Florida Stanley,326,8
My husband lost in his fantasy football league last year he finally did his penance last friday,327,2
Trump Is Mentally Ill Doctor and Former Vermont Governor Howard Dean Says,328,2
Kuwaiti police have shut down a fish store that was sticking googly eyes on fish to make them appear more fresh than they are ),329,8
The most moving jealousy in the world,330,2
Two friends at the same college sent me these a year apartit has to be the same mad lad,331,2
My Luna Lovegood Cosplay complete with Lion Hat,332,7
I still think this is the best introduction of a recasted character I’ve ever seen,333,7
V̷̛̫̒͑̔̍̆͒̔̈͊͝͠isiting,334,6
To put on this face mask,335,2
2meirl4meirl,336,7
Brain volume may be tied to emotionally protective traits  A new study finds that people with larger volumes in the prefrontal cortical brain regions may be more likely to have greater personality traits such as optimism that can protect against emotional distress,337,2
[Homemade] Fried chicken sliders with goat cheese and honey,338,7
Do you meet the quota,339,2
Roses are red oh god it stings,340,6
It’s Not Just Robert Mueller President Donald Trump Faces Six Separate Investigations And Lawsuits,341,8
Memories like the corners of his mind,342,2
Manifestation is real,343,2
Once In A Lifetime Digital Painting 660x863,344,2
hmmm,345,2
Sky in Texas coming home from work yesterday,346,2
The first signs of an uprising of machines,347,4
me irl,348,8
My sister’s cat follows me everywhere here’s a video of her following me to the bathroom,349,2
Wow okay then,350,4
Its a bit ridiculous the way some modern action movies never go more than 12 seconds without quickcutting Some fight scenes will have 10 cuts in 10 seconds It becomes extremely difficult to stay immersed,351,2
This photo from the Toronto Airshow,352,0
Its a race,353,5
Kevin had just gotten a new car and was out for a drive,354,2
FACTS,355,2
How it looks like this hippo charger has bitten and broken my phone,356,7
Thank you Patrick very cool,357,7
Um no I didnt,358,2
CSS,359,0
Drax knows what the people want,360,2
[image] PlayStation offices are getting pumped for the release SpiderMan,361,2
Simple Rick by Anfidersio,362,9
defaults are so nice they are taking revives from other people,363,7
2meirl4meirl,364,7
He Said On LWIAY He Would Bring It Back Maybe He Forgot So Lets Remind Him Again,365,2
TIL that Bhutan is the only country in the world whose nature converts more CO2 than the land itself produces,366,2
An old classmate posted this I’m at a loss for words,367,2
Meirl,368,9
Ken M on Pampers,369,1
Steve Carell mirin his wife,370,2
Back to school,371,2
World wars,372,2
They said it,373,2
[homemade] steak night with waffle fries,374,2
The Office Dog (Instagram fluffyface_enzo),375,2
LPT If you move to a new place or simply want to make friends try volunteering Volunteer at as many places as you have the time for long term or onetime events parks beach clean up library museum local animal shelter fundraisers etc,376,2
Riding through blossoms,377,0
Found the meme Invest now while you can,378,2
It takes a lot of balls to _____ the way I do,379,2
The best petty revenge,380,2
Did I ask No,381,2
Sunday Dinner on a cake stand,382,2
Richard Hammond and his wife were gassed and robbed in holiday villa in France,383,6
it was,384,0
MRW I am trying to cook but the recipe is 90% the author telling me about their childhood memories pets and kids and 10% how to cooking the food,385,2
Meirl,386,9
Whats that all about jean,387,2
This curved escalator,388,6
Bring me Solo,389,2
Toledo scores one of the quickest punt returns ever to kick off college football weekend 201819,390,2
🔥 These waterfalls are beautiful ,391,8
[OC] My moon themed character sheet got a positive response on twitter so thought Id share it here,392,2
Unidos,393,9
The development of the human face during gestation,394,7
My salt rock lamp in high humidity created a puddle of crystals,395,2
Why does everyone know this fact though,396,2
Just hold my redbull,397,4
If Tomato Temple was a Zombies map,398,7
hmmm,399,2
3D printed RGB pump cover,400,2
Women at the beach making fun of a sign telling them to wear full bathing suits 1934,401,7
Lets start this day with an explosion and a cookie,402,2
TIL During WW2 air support had been requested against a German occupied city By then the British took the city but were unable to radio the RAF to stop the bombing so a pigeon named GI Joe was sent to stop it arriving just as the planes were preparing to take off saving thousands of men,403,2
Luigiana Purchase,404,3
Staying up all night in 2001 Starterpack,405,2
Winston 💙,406,7
Hehe,407,3
[Rainbow Six Seige] Octopus Intensifies,408,9
The color makes this 128yearold photo of the construction of London Tower Bridge feel like it was taken yesterday,409,7
Us as astronauts Digital 42x297 cm,410,2
This entire sub,411,2
Originalz,412,3
I’d love to know what this reaction is,413,2
me irl,414,8
Felt cute might delete later,415,2
Helicopter tail activate,416,7
We’ve done it,417,2
If you google un flag the 11th picture is a UN flag redesign by a user of this subreddit,418,2
First Image of Matt Smith as Charles Manson in CrimeBiopic Charlie Says,419,7
Some people just aren’t destined to be nba superstars,420,9
*screaming internally*,421,6
Nervous strangers trying to be friends,422,2
