Title,doc,topic
Its a meme design so it has chances to win the competition,1705,2
Attempted robbery of vape shop,1706,6
Ron Swanson vs Technology,1707,2
Papadopoulos sentenced to 14 days in jail for lying to FBI in Mueller probe,1708,2
Bear gets smacked in the nuts,1709,1
The worst ad I’ve ever seen on Snapchat,1710,2
Since we are doing this Ayyylon thing,1711,7
Found on rfunny,1712,2
What a legend he was,1713,2
My girlfriends pigeon,1714,2
[Image] Just when I thought PlayStation have standardized their limited edition box sizes and I’d be able to sleep easy Spiderman,1715,2
‘Cosby’ Actor Geoffrey Owens Will Take Role on Tyler Perry Show,1716,1
John Carpenters The Fog Escape from New York Prince of Darkness and They Live To Receive 4K Restoration Releases,1717,2
The First Benders for the Four Nations🤔,1718,2
Was not looking to get a new cat so soon after losing my older girl This kitten had other ideas She came up to me in the driveway yelled at me and proceeded to climb and scent mark me Say hello to Tabitha,1719,2
The flag of Brazil but with inverted colors looks like something straight out of the 90s,1720,7
Science academies urge paper ballots for all US elections,1721,2
For Susan Collins A Vote For Kavanaugh Would Be Political Suicide,1722,1
[Highlight] Julio with a nasty stiff arm against Rodney McLeod,1723,1
anime_irl,1724,3
Tap n Twirl,1725,5
My Lucy just turned 12  She thinks she is a sea otter and float on her back,1726,2
What an amazing ad,1727,2
Elizabeth Warren Calls for the Cabinet to Invoke the 25th and Remove President Trump,1728,2
2meirl4meirl,1729,7
Order of Embers Exalted horse mount vs Worgen lvl 40 horse 9990g for a saddle and ankle armor,1730,3
Cat,1731,2
Typical Xbox,1732,0
After being divorced for 25+ years my parents reconnected moved to Texas and bought a farm Today they are getting married again This is their wedding portrait,1733,2
F,1734,4
My moms rescue dog Rico is best friends with my baby I interrupted them watching Peppa Pig,1735,2
With new SpiderMan occuping the headlines lets not forget about this gem,1736,2
Red Sox fan gives a foul ball to a young Yankees fan,1737,6
TIL that Robert Kearns the inventor of intermittent windshield wipers tried to sell his idea to the auto industry and was turned away When they began showing up on new cars he sued the manufacturers from the industry and won millions of dollars in settlements,1738,2
Robin Williams offering a toilet roll to ’ The Thinker’ (early 90s),1739,2
My brother and I have been remaking Toy Story 3 in our free time as a passion project for several years now Here’s the trailer,1740,2
10000 year old Skull and Antlers of an extinct Elk found by fishermen in Ireland,1741,2
My Dad found this cash under a drawer while cleaning an old rusty medical cabinet,1742,2
This is what a living plush toy looks like,1743,7
My best bud just turned 9 years old and his greys make him twice as precious,1744,2
Boston Red Sox fan gives a foul ball to a young Yankees fan,1745,6
The balloon guy had a binder for kids to pick what they wanted The last page was the best,1746,2
This restaurant has a quote from Marilyn Manson,1747,7
Apology Video Starterpack,1748,2
Wholesome coincidence at the grocery store,1749,8
Pizza,1750,2
The reduce volume button,1751,2
Amazing Kick,1752,2
TIL that according to one legend the funeral escort of Genghis Khan killed anyone and anything that crossed their path in order to conceal where he was finally buried After the tomb was completed the slaves who built it were massacred and then the soldiers who killed them were also killed,1753,2
Family Cosplay,1754,7
Hen Guarding Kittens During a Storm,1755,2
This new Spiderman game is wild,1756,2
She lost her beagle brother a few months ago Her cat brother takes care of her,1757,2
3 yr old is a black belt at following directions but not so much at breaking boards,1758,2
My grandfather with Elvis Presley 1950’s,1759,7
Rap god,1760,1
Oddly shaped doggo,1761,6
The entire wait staff singing Happy Birthday to the customer is never a positive experience for either yet it shows no signs of slowing down,1762,2
As a professional photographer I think Im having more fun taking photos than the actual game oc,1763,7
True forest warrior,1764,2
The rain melted this sucker and left the wrapper almost perfect,1765,2
Donald Trump will have to answer questions under oath from sexual assault accuser,1766,2
An actually good attempt,1767,2
Trying to sell a laptop for $120 This person offers me $50 for it,1768,8
Trying to get sleep,1769,2
Roses are Red Tacos are,1770,6
Water is clear sometimes its cloudy,1771,2
I’ll take highly suggestive children’s books for $1000 please Alex,1772,2
Time to leave earth,1773,2
Widely applicable Elon format Invest while you can,1774,4
This splash in a puddle cut in half by a reflection,1775,1
2meirl4meirl,1776,7
TIL just 12 days before he died of a drug overdose Mitch Hedberg went on the Howard Stern show and said I got the drugs under control now and that he only used them for the creative side of it,1777,2
The more you know,1778,2
NYC subway station at site of 911 attack reopens after nearly 2 decades,1779,2
Blue macaw parrot that inspired Rio is now officially extinct in the wild,1780,8
Apple Removes Alex Jones’s Infowars From Its App Store,1781,0
My 13 year old dog still tucks himself in every night cause I did it when we first got him and he looked like he was cold,1782,2
That elbow is the stuff of nightmares,1783,2
Canelo with the head movement clinic,1784,2
meirl,1785,9
What’s something that looked fun but you realized it was horrible once you tried it,1786,2
Not again,1787,0
hmmm,1788,2
Sorry class of 97,1789,1
*snickers* the jokes on you becky,1790,5
Tiny cars big hearts,1791,2
Hes too dangerous to be kept alive,1792,2
According to director Guillermo del Toro the Pale Man monster in Pan’s Labyrinth represented the Catholic Church and their role in facilitating fascism [Trivia],1793,4
This water bridge,1794,2
Sourdough bread [Homemade],1795,0
Tom Cruise has a cameo in Young Guns as some random cowboy who gets shot Aparently he was just visiting the set the day they were filming this scene and Christopher Cain decided Cruise should have a role in the film,1796,2
Trump Administration Discussed Coup Plans With Rebel Venezuelan Officers,1797,2
Study finds antidepressants may cause antibiotic resistance,1798,2
The claw of a juvenile Crowned Eagle,1799,2
Is that legal,1800,1
🔥 Giraffe in snow🔥We had a major snowfall in South Africa last night,1801,2
Millions of ice crystalsbecome tiny lenses,1802,2
me_irl,1803,9
[Video] I think Im IRON MAN now (No spoilers) [SpiderMan],1804,2
The President of Irelands dog Bród acting as a dignitary at reception to honour the Irish women’s field hockey team,1805,2
A year later Equifax lost your data but faced little fallout,1806,2
You Know Who He Who Had To Do It To Them,1807,2
Traumatized cat,1808,2
New format from hungry,1809,4
Hmmm,1810,2
woof_irl,1811,6
Collins Office Received 3000 Coat Hangers Protesting Kavanaugh,1812,2
Is there an “f” in lieutenant,1813,5
Poor Sweet Rabit,1814,1
Ken M teaches us about springtime,1815,1
Watching The Office marathon on the $200 plasma tv in my hospital room,1816,2
Bette Midler is not a hun,1817,1
This models face,1818,9
PsBattle This man diving to hug a statue,1819,2
Caught him midscratch looks like hes posing,1820,7
Swords CXIV,1821,0
roger roger,1822,2
A photo from Steve Carell’s new movie or checking in with Michael and Holly seven years later,1823,2
At the border of Sweden and Norway lies a snowmobile path over 1000 miles long,1824,2
Anyone else still remember this guy,1825,2
How was I even supposed to respond to this,1826,7
pass,1827,2
App design in 2018 starter pack,1828,2
Rabbit rescue at turtle speed,1829,2
Zambia is defaulting on its loans with China and now China is set to take over the national power utility ZESCO,1830,6
Doggo service,1831,2
He spent 27 years wrongly convicted of murder He wants to spend the rest encouraging inmates to read,1832,2
Worst part is she got through her science classes by copying most of her work,1833,2
My cats reaction when I bring a new pupper home,1834,2
Xpost from rhmmm,1835,0
Teen falls to death while trying to take a selfie at Yosemite National Park Reports,1836,2
First try too,1837,2
Reddits Opinion on the Redesign — Who loves it and who hates it I left the survey open so rall could weighin and the results dont look terribly different (n=6936) [OC],1838,2
This barber shop we passed is called “Shear Lock Combs”,1839,2
glass ae milk,1840,3
Hey i found another perfect fit but this time i’d like 9 upvotes,1841,2
Geralt and ciri,1842,5
Bus converted to a cozy hideout,1843,3
MEN What insecurities do you often see in women that men couldn’t care less about,1844,2
LPT When buying tickets for a sporting event for a large amount of people buy some of the tickets in the row behind,1845,2
Everyone else is on that new SpiderMan and Im sitting here like,1846,2
Been having so much fun with the photo mode in spider man ps4,1847,2
Life Cycle of Pasta,1848,2
The screen on my calculator is slightly tilted,1849,5
5 years ago Daft Punk cancelled on Stephen Colbert last minute His response The greatest celebrity dance montage in television history,1850,2
Watching anxiety digital A4,1851,2
Wait Take Me With You,1852,2
To punch a guy,1853,2
Jen Barkley understands US politics,1854,2
Elon Musk and his next car design,1855,2
The ideal male body,1856,1
Guess who went all night with no crate or accidents,1857,7
Thy lover is thyself,1858,4
Rabbit saves trapped kitten,1859,2
DONT LET HIM FORGET,1860,2
The ability to speak does not make you intelligent,1861,7
*Shrug* Guess I’ll just die,1862,2
me irl,1863,8
The Czech National Museum in Prague was recently refurbished to its formal glory,1864,8
Guy nails every accent,1865,2
So this summer I did an art exchange I made some paper art and he made me a freaking puppet of myself Best deal ever,1866,2
They say black cats are hard to photograph well My handsome boy would like to disagree,1867,2
Such a Strange Magician,1868,2
Petition to make these the new arrow symbols,1869,2
Thought this belongs here,1870,2
The first unmanned and autonomous sailboat has successfully crossed the Atlantic Ocean completing the journey between Newfoundland Canada and Ireland The 1800 mile journey took two and a half months,1871,2
I made a friend today,1872,2
New Documents Affirm Kavanaughs Hostility Toward ChurchState Separation,1873,1
Hes not wrong though,1874,2
This popped up on my Facebook feed,1875,2
What if Hmmhmhmhmhmhmmmmmm,1876,7
Kavanaugh’s refusal to recuse disqualifies him,1877,1
Smells like a friend,1878,2
Aaaaannd he sticks the landing,1879,6
Line right now to play Smash at Best Buy NYC,1880,2
McDonald’s Late Night Mascot Mac Tonight,1881,7
relatableéxè,1882,6
When theres one parking spot left,1883,2
Nope not taking that medicine,1884,7
Shhhh Kitty is Dreaming,1885,7
Me irl,1886,8
When I see a great post with zero upvotes,1887,2
This is why you prompt for input (reposted due to accidentally showing friends name in code window Whoopsie),1888,2
[Text] The habits you created to survive will no longer serve you when its time to thrive Get out of survival mode New habits new life,1889,2
Rate of baby boomers embracing marijuana doubled in last decade  Federal survey data shows the number of adults aged 5064 who used marijuana in the last year doubled in the last decade and the rate of those over age 65 is seven times higher than it was,1890,2
THIS IS NOT A DRILL,1891,7
Roses are red summer is gone,1892,2
Roadster,1893,4
Every(ish) villain in the MCU movies Its amazing how much better theyve gotten recently,1894,2
Apparently Im a scammer for selling something at a reasonable price,1895,2
Depressed last night went to go get sad food at Burger King and when I was pulling out the drive thru a beautiful visitor greeted me Sorry for the bad quality photo,1896,2
[Marvels SpiderMan] Your friendly portable SpiderMan,1897,9
David Brock I knew Brett Kavanaugh during his years as a Republican operative Dont let him sit on the Supreme Court,1898,2
A shark and his son go looking for a snack,1899,2
Time to uninstall,1900,7
Rabbit saves trapped kitten,1901,2
SLPT How to see the future,1902,2
Finding nemo,1903,0
Bacon grease too hot cut my glass straight across,1904,2
me_irl,1905,9
Sure I’ll give you the EXACT price you want,1906,2
Amen,1907,2
Opened up a rental book and found this,1908,2
Agree tbh,1909,5
Ive been waiting for this deck since my childhood,1910,2
Deadly Ebola outbreak in eastern Congo reaches city of 14 million,1911,2
Doug and Skeeter did it first,1912,2
Hes destroyed every toy he owns Except for the first one he ever met,1913,2
My boyfriend everyone,1914,2
Im Polish and heres why I think that changing Ciris skin color is racist,1915,7
Damn that’s awwww,1916,5
Redditor makes a fake story to get karma he’s called out,1917,2
earl_irl,1918,5
A Couple Quit Sugar For A Month Heres Their Results And Added Sugars Explained,1919,2
‘Plaid shirt guy’ ejected from Trump rally says Secret Service ‘told me not to come back’,1920,2
welp i finally have a reason to post on this sub reddit lol,1921,2
What bros,1922,2
[WP] Dominos pizza has offered free pizza for life to anyone who tattoos their logo on their body Now other food chains are following that idea but with increasingly absurd requirements and the poor have turned themselves into walking advertisements just so they can eat with each passing day,1923,2
Grandma is not a fan of new profile pic,1924,6
[SpiderMan] Mr Stark I dont feel so good,1925,2
Naomi Osaka Upsets Serena Williams in US Open Final to Win First Career Slam Title,1926,2
Finally finished the original 151 in perler beads Wii U gamepad for scale (dont have a banana im sorry),1927,4
Apparently the businesses in my shopping center decided that the recycling chute (two units down) is too far of a walk That door is my store,1928,2
ELI5 Ive been told that lobsters cant die of old age and that they keep growing their whole life If thats the case then how come it be that weve never seen any super massive lobsters,1929,2
[Homemade] Ribeye steak dinner,1930,2
HMRB while I jump over these 12 people,1931,2
Single player games are dying,1932,2
Kyle does not believe in the superior siege weapon,1933,2
8 september (first year anniversary),1934,7
Amazing new face plant assembly line,1935,2
SpiderMan switches between two vocal takes depending on whether or not hes exerting himself,1936,2
Oddly shaped doggo,1937,6
Boop,1938,1
[MarketWatch] Nike’s online sales jumped 31% after the company unveiled its Kaepernick campaign featuring athletes like LeBron James and Serena Williams,1939,8
In awe of this brainy lad,1940,2
Did I hear you say WALKIES,1941,8
Literally unplayable,1942,2
Be like Fred ,1943,7
NASA’s Curiosity rover just snapped a stunning 360degree panorama of Mars,1944,0
Angry Sweater Floof,1945,2
Clean Meat Will Rapidly Decrease Animal Abuse; CA To Vote on Ban of Pork from Pigs Raised in Gestation Pens,1946,2
Dear Blizzard please make reputation account bound Alts are cool Yay Thanks,1947,2
Shepherds are very brave and protective,1948,8
I don’t think this is the new episode I was looking for,1949,2
Halloween idea Loot Lakes water becomes blood,1950,2
Just a bus stop in Russia,1951,2
My name is Jason,1952,7
Excuse me,1953,1
So She Hit Me In The Head With A Shoe,1954,2
🔥 An Arctic Fox gets a cold drink,1955,2
Whats something that costs less than $100 that not many people own but should,1956,2
The perfect headlock,1957,2
Bought a car today Transmission went out 60 miles from the car lot and everyone had gone home for the day Is there any chance I can get a refund,1958,2
This is a Squirrel King it occurs when the tails of rodents become so tangled and twisted together they are unable to be untied naturally,1959,7
This is why instagram needs a downvote button,1960,2
The newspaper for my town bulletin is complete,1961,2
Xur should sell highdifficulty bounties that reward exotic ornaments catalysts masterwork cores etc,1962,0
Trumps reported dumb southerner jab at Jeff Sessions could be hurting him in Alabama,1963,1
AH YES I DO loveexe SOME WEED MY FELLOW HUMANS,1964,2
Just a hairy jelly cube Id love to hear your opinion on it,1965,8
elongated knows what to do,1966,3
me😡irl,1967,0
Nice bro,1968,2
How Bonsai trees grow trhough time,1969,1
The Last Cosmonaut,1970,2
This bathroom for everyone,1971,2
When you out with a friend,1972,2
I’m No Photographer But This is Probably The Best Pic I’ve Ever Taken,1973,2
[OC][Fanart] A Moment of Solitude my sculpture of Guts,1974,8
Oofer gang,1975,6
I like this doctor,1976,2
Meirl,1977,9
My dog has a cat on the back of her head,1978,2
My Uber driver was a slimmer cooler mustached version of myself,1979,7
Buskers Festival Vienna,1980,3
When youre the main character of an open world video game,1981,2
Friendship goals,1982,8
Apparently its impossible for women to be smart and beautiful at the same time,1983,2
Graphics Then vs Graphics Now,1984,2
My (almost 16) good boy is deaf He didn’t hear us come through the back and thinks we are still in the car,1985,2
Seems unnecessarily complicated but okay,1986,6
Meteor leaves a smoke ring,1987,8
When you walk in 10 min before your cakeday is over,1988,2
This sick picture of a performer ,1989,2
TIL the Barbie Liberation Organization swapped the voice boxes in ~400 talking GI Joes and talking Barbies then returned them to stores Kids bought them and heard Barbie say Vengeance is mine and GI Joe say I love shopping,1990,8
Whenever Grammy comes over Gus sits by her side the whole time wearing his proud face ,1991,9
Thank you for your help guys,1992,2
Beware of attack dog,1993,9
“I’m high as balls…wanna see my special talent”,1994,8
Wholesome fellowkids,1995,8
How he hit so hard,1996,2
Last week at least 6 Turkish teachers who taught at a Moldovan Gülen high school were abducted and forcefully transported to Turkey by the Moldovan state in cooperation with the Turkish government The teachers were taken from their families and their whereabouts are currently unknown,1997,2
Pokémon deserve some wholesomeness too,1998,6
That final sentence tho,1999,2
Wakanda Forever,2000,7
13 Advertisements in a row,2001,2
Its just a dry heat,2002,4
TIL Researchers have determined that bats address each other as individuals and frequently get into arguments,2003,2
Nothing particularly remarkable about this dusty sunset except its been captured by a robot working on Mars few hours ago,2004,2
TIL that although bamboo are commonly refered as bamboo trees,2005,2
TIL That Bob Hawke is the only Australian prime minister with a world record and his world record is for drinking 25 pints of beer in under 11 seconds,2006,2
Microtransactions are a problem,2007,7
Woah,2008,7
It’s never too late,2009,2
It really do be like dat,2010,7
Some one beeds to stop this man,2011,2
This one hurt my heart a lil,2012,6
Russian alcohol label design,2013,1
Waterfall in Iceland,2014,1
The best part of the US Open,2015,2
Cool tables in Plymouth that look like its antigrav,2016,7
Will someone get married,2017,2
This Harpy Eagle is without a doubt one of the supervillains of the animal kingdom,2018,2
Unconditional love does not mean drowning with somebody,2019,9
These bananas are both overripe and underripe,2020,0
Toru kn Master of pointillism,2021,7
Making of a globe (1955),2022,7
Manatee Photobombing,2023,4
Kung Fu Hustle Cosplay,2024,7
Ill just kick myself off the team,2025,1
Advertising done right,2026,6
The disappointment is real,2027,2
Couple of 10s,2028,2
Truth hurts,2029,2
Girl wins homecoming queen then goes on to kick extra point in overtime to win football game,2030,2
Merrick Garland asked to probe perjury allegations against Brett Kavanaugh,2031,1
This design stolen on a tshirt printed on a mug,2032,2
Huge Umbrellas opening in Medina Saudi Arabia,2033,5
what have i done,2034,6
The realization at the end really got me,2035,2
Cleveland Browns field goal attempt to get their first win in 2 years,2036,2
Terms and Conditions of Some Apps,2037,1
Follow up question,2038,1
My now brother in law proposing at my wedding last year,2039,7
 To couple up trains,2040,2
🔥 monkey frog making himself waxy,2041,8
Girl who was temporarily paralyzed surprises her nurse,2042,6
Brett Kavanaugh said he would kill Roe v Wade last week and almost no one noticed,2043,2
Abortnite,2044,5
Too wholesome for me,2045,8
We need a spinoff,2046,2
This cool four sided key,2047,7
Bipolar disorder can be hard to tell from depression due to their similar symptoms except for mania in bipolar Researchers had 80% accuracy in distinguishing bipolar disorder from depression using special MRI scans based on how the amygdala reacted to different facial expressions in a new study,2048,2
Getting a bit dizzy,2049,2
Apparently its impossible for women to be smart and beautiful at the same time,2050,2
Obama tells voters to step up or things can get worse,2051,2
Man the new Spider Man game is fire,2052,2
I love selling stuff on Facebook,2053,2
Lake zoomies,2054,1
MRW I see a new player wandering around where they shouldnt be in a multiplayer game,2055,2
Reddit whats a good icebreaker (for parties talking to strangers etc),2056,2
Another reason to hate Snapchat’s “Discover” tab,2057,6
[Serious] Travellers of Reddit what are some of the creepiestscariest experiences youve had abroad,2058,2
When my 68 year old mother calls my sons shoes The Bomb,2059,2
Making a Pen from an Old Skateboard,2060,4
My grandparents on the Ringling Circus in 1948 He fought in WWII did flying trapeze and later became a clown She was an aerialist and showgirl and later became a realtor and landlord Ill never be this cool,2061,7
Nice,2062,7
Its not happening,2063,7
hello there,2064,2
MInE woUlD bE 138 VOteS,2065,8
What do we want,2066,2
Food delivery mixup sorted between bros,2067,2
Interesting Title,2068,4
Some GTA sh*t in Bosnia,2069,3
Don’t fall asleep in a stadium,2070,2
This is Oscar worthy acting,2071,8
The harder you work the quicker you learn why some people barely lift a finger,2072,2
Let me get my shoes on and I’m ready to go,2073,2
I was going through some minecraft parodies for nostalgia and came across this comment I made 7 years ago,2074,2
Really hope this isnt a set up for season 5,2075,2
Bob Woodward People better wake up to whats going on in the Oval Office,2076,2
hmmm,2077,2
Caught my grumpy cat loving on the new puppy,2078,2
hmmm,2079,2
Words to live by,2080,2
When you thought it was good enough for High Quality Gifs,2081,2
The whitest of whites,2082,6
The aardvark alphabetically the first animal plays an important role in preventing wildlife deaths from fire They dig large underground burrows that wildlife can hide in during fires,2083,2
My 92 year old grandpa just made a new friend,2084,2
My military friend posted this,2085,2
Ready for prison servers Invest your bucks here,2086,7
American Healthcare,2087,1
THE PARKING THOUGH,2088,2
This is it for me boys,2089,6
Accurate thanos cosplay,2090,0
[Homemade] Blueberry Cheesecake,2091,2
For the first time since December 2016 the Cleveland Browns have NOT lost the game They TIE with the Steelers 2121,2092,2
PsBattle this pedestrian crossing for hedgehogs,2093,4
me irl,2094,8
I built a 11000000 model of a German submarine,2095,6
Feeding squirrels at the park,2096,5
NASA images of Jupiter,2097,8
When its September 9th,2098,7
ME HOY MINOY,2099,0
Dont worry Pewds we got your back,2100,2
Colts just revived Eric Ebron then Hype danced for the Touchdown,2101,8
These jouches I found at a local furniture store,2102,2
Cant enjoy Legos,2103,2
Middle aged was like 12,2104,2
Tormunds face ,2105,7
Danny Devito memes make for easy profits,2106,7
A 78 year old German retiree has built this entire city out of cardboards for six decades The city is inspired from American cities but he never visited those places,2107,2
The audacity of Amazon to ask questions,2108,2
Call Of Gardening,2109,9
$7999 for a Tooth Fairy Crown found on Instagram,2110,2
SuPerHerO LAnDinG,2111,6
[I ate] this entire sushi platter,2112,7
Have you ever wanted to see a sumo wrestler fly,2113,2
Serena Williams fined $17000 for US Open violations,2114,2
First post on reddit lets see how this goes,2115,2
An entire spectrum of pebbles,2116,2
2018 is 69% complete,2117,2
TIL that the eagle featured on US currency was modeled on a real bald eagle named Peter who used to live on top of the US Mint After his death in 1836 Peter was stuffed and is still on display inside the very building upon which he once nested,2118,2
Just a small town girl,2119,2
At this angle the yellow and blue sodas make the middle one look green,2120,2
Cards were finally in my favour,2121,7
My coworker brought in her baby goat Matilda 23lbs,2122,1
Roses are red and now with a kiss,2123,6
hmmm,2124,2
Sticking pins through skin,2125,8
What do you call a Female Ocelot,2126,2
SLPT If your dad went out to get groceries 17 years ago watch a movie with a sex scene He will come back exactly when the sex starts,2127,2
Failed rocket launch,2128,2
Too real,2129,2
Angry US Steel workers nationally overwhelmingly back a strike as talks resume,2130,2
A device that erase print,2131,2
TIL that about 14 of people will sneeze on sudden exposure to bright light,2132,2
Celebrated too early,2133,3
I’m really happy for them ),2134,2
When a DNA test reveals youre 3% Irish,2135,1
How the fuc k,2136,1
Found a bored looking Andy Samberg hanging out as a woman in the 1800s,2137,8
Is this thing alive No,2138,2
TIL that in Australia there exists “kangatarianism” which is essentially a vegetarian diet that excludes all meat except kangaroo meat on environmental and ethical grounds,2139,2
The hero she needs,2140,2
Trying to work with cats around can be challenging,2141,2
Fall colors,2142,7
Pasta sugar in Philly,2143,5
