Title,doc,topic
The music this guy makes on a looper in a few minutes never ceases to amaze me,3380,2
Just crawled out from under a broken lift,3381,2
LPT Go to GoodWill in rich areas there will be name brand clothes and probably clothes only ever worn once before,3382,7
Fortnite for Switch won’t require Nintendo’s premium online service for play,3383,5
This is probably only going to look like this for a day or two but boy does it look cool,3384,2
Animated evolution of Houndoom,3385,5
Im World of Warcraft Game Director Ion Hazzikostas and Im here to answer your questions about Battle for Azeroth AMA,3386,2
SpaceX has signed the world’s first private passenger to fly around the Moon aboard our BFR launch vehicle,3387,2
Offensive Fowl,3388,4
When JJ Abrams promises episode IX will tie in the prequels,3389,1
As someone who’s not really a gamer browsing rall for the last week or so,3390,2
I dont like this magician,3391,2
Wow,3392,4
We did it,3393,0
The garbage playing will do,3394,1
MURICA🇺🇲,3395,3
TIL that many PBS stations across the US switched to all childrens programming after the September 11th attacks in order to provide children a safe harbor from continuous news coverage of the attacks,3396,2
[OC] Communism amirite,3397,2
The REAL Spiderman game,3398,2
Yes,3399,2
[Homemade] Smoked Beef Rib Ramen,3400,2
As an introvert how do you feel about this quote by Jim Carrey “Solitude is dangerous It’s very addictive It becomes a habit after you realize how calm and peaceful it is It’s like you don’t want to deal with people anymore because they drain your energy”,3401,2
‘Halloween’ Reboot Blocked Edgar Wright From Using Michael Myers Masks in ‘Baby Driver,3402,9
Can’t wait for the Kyoshi novels now,3403,2
ooh interesting story,3404,2
Mario Multiverse,3405,9
Infinity gauntlet made out of 1728 magnets,3406,2
Found this pic and it just made me think of an alternate Avatar universe Imagine that,3407,2
SEIZURE WARNING,3408,7
Yes thats what illegal means,3409,2
MAY I go to the bathroom,3410,2
Robert Mueller just snagged his Golden Goose,3411,8
MollySiriusHarry Relationship In A Nutshell,3412,8
Sounds counterintuitive but it often works,3413,1
Article 13 memes are hot Buy Now,3414,2
Manafort Surrenders Homes Trump Tower Condo,3415,7
That Friday Feeling,3416,2
That face says “Youyou don’t like it”,3417,2
Senna 🙌🏿,3418,1
If Jeff Bezos wants to help lowincome people why not just pay them better,3419,2
uTheresA_LobsterLoose describes the Border Patrol near Niagra falls and what a bunch of bored people with guns do to terrorize citizens around a near impassable border,3420,2
To report your neighbour,3421,2
Fill your heart and your belly,3422,7
[WP] You hate this one guy in particular You also know witchcraft So you cast a curse to slowly destroy the thing he loves the most As time passes on you find that nothing has changed but you are starting to get sick,3423,2
Kevin made my shot look so cool ),3424,7
We live in a society,3425,2
People who dont use their blinkers must be horrible in relationships because they cant even communicate a simple thought with a light,3426,2
“Hey #bossbabes just here #thriving in my Monday car (all paid for by Rectum Oils of course 😉💅🏼),3427,9
Peekaboo,3428,7
Old man  pencil 5x7”,3429,2
Extortion,3430,0
This meme is illegally posted,3431,2
Home is wherever Im with you,3432,2
legendary german shepherd  golden retriever mix,3433,2
Me_irl,3434,9
Oof,3435,1
me_irl,3436,9
The Puzzle is Too Hard,3437,2
Nintendo Cloud Saves are erased after your subscription expires,3438,5
Report Michael Cohen Is Talking With Mueller Too,3439,2
Spiderman for PC looking pretty dope,3440,2
NJ hotline to report priest sex abuse overwhelmed by number of callers,3441,2
You can pop a balloon with an orange limonene from the orange dissolves or weakens the rubber balloon,3442,9
Tempting offer,3443,2
make it stop,3444,2
PEWDIEPIE ANIMATED GIF *if pewds see this i will make more animation of him*,3445,2
Petition for felix to bring back 5 weird stuff online,3446,2
JUST LET ME TYPE DID,3447,2
Got bored and filled 350 pages with the word sus on Google Docs This is what happened when I loaded it,3448,8
a tennis ball,3449,2
Chris Pratt went to my high school heres his alumni plaque on the wall,3450,2
me irl,3451,8
Start training your pigeons my friends,3452,2
Both have the big gay,3453,4
Two axes thrown simultaneously where one axe managed to split the handle of the other axe,3454,1
Dyedhair mom complains about cost of a parentchild class and proceeds to get burnt to a crisp,3455,1
About two months ago I reported a hun to Plexus Finally reaped the benefits today If you see something say something,3456,2
FORTH EORLINGAS,3457,7
Paul Manafort becomes the fifth Trump campaign team member to plead guilty to criminal charges,3458,8
ELAS ƎVISSAM,3459,0
I see your white papereye bird heres my and my dogs take on this,3460,2
The kids doth smoke too much,3461,2
Me irl,3462,8
Dont worry guys they fixed it,3463,2
Are family reuinions allowed Here’s my husky being reunited with her mother,3464,2
Poor Michael Collins,3465,1
My developmentally delayed 2 year old who cannot say or sign a single word signed “eat” this morning and said the word twice,3466,2
me irl,3467,8
Four for the price of one,3468,2
The ratio of dog to boy stayed constant,3469,2
Login admin Password admin,3470,0
Hector being wholesome,3471,8
TIL about Tokyos incredibly efficient recycling systems All combustible trash is incinerated the smoke and gasses cleaned before release and then the left over ash is used as a replacement for clay in the cement used for construction,3472,6
TIL that Donnie Dunagan a retired United States Marine Corps drill instructor managed to keep secret  throughout his entire career  that he was a voice actor in the Walt Disneys Bambi film providing the voice of young Bambi,3473,2
Get a husky they said It will be fun they said,3474,2
A few weeks back we rode our bikes to Hersheypark but didn’t see any bike racks My son decided to write a letter to see if they could put one on the outer edge of the parking lot He even took a picture to give a suggestion where it could go And today he got his response 🙂,3475,2
The toiletries at my hotel in Switzerland included a rubber ducky,3476,4
In this obscure world memes are facts,3477,2
Newly discovered 50000 year old cave lion cub found perfectly preserved in permafrost,3478,2
Buddy’s freedom ride picture He loves his new family ),3479,2
Found this mushroom while hiking in the woods there’s gotta be a rabbit hole nearby,3480,2
These panda dolphins,3481,6
This mama dog comforting her puppy on its first day as a police dog,3482,2
My favorite part when mowing the lawn,3483,2
3rd degree burn scar covered by a Phoenix,3484,0
Sheriff US border patrol agent arrested suspected of killing 4 women,3485,2
We’re reading The Odyssey in my English class and,3486,2
Guy buys Quail eggs from a supermarket and manages to one to hatch,3487,2
Guy spills sweet tea,3488,2
I was trying to get a selfie with Aunt May,3489,2
So my campus had a suicide awareness and prevention day,3490,2
The Weather Channel be like,3491,2
Moment of peace,3492,2
PostHurricane Florence Nearly 20 years later and this guy still getting me through power outages,3493,2
Xpost from rpics,3494,0
madlad steals toilet then posts to reddit,3495,2
Angel flares,3496,7
took same photo in New York and in SpiderMan,3497,2
Ever got movie high Like when the world felt so unreal after watching a good movie you’re out of the cinema but you just wanna sit and ponder and soak in your emotions,3498,7
Worth it,3499,8
The same researcher who 20 years ago made the discovery that linked abnormalities in egg chromosomes in mice to BPA has just published a new study that found reproductive defects in mice housed in plastic cages made with BPA alternatives suggesting that BPAfree products may not be safe,3500,2
December is just around the corner,3501,2
In Deadpool 2 theres a drawing of Wolverine tagged Prisoner 24601  thats Jean Valjeans prisoner number in Les Miserables,3502,2
Only four people went to the Army football game sad,3503,2
Classic,3504,2
So sad,3505,2
The signs in these botanical gardens have springs so the signs move with the growth of the tree,3506,4
My girlfriend broke up with me so I took her wheelchair,3507,2
me irl,3508,8
me📀irl,3509,8
Dandelion Zoomies,3510,1
Civil War veteran Jacob Miller lived with an open gunshot wound to the forehead He was quoted as saying “17 years after I was wounded a buckshot fell out of my wound and 31 years after two pieces of lead fell out” PhotoQuote circa 1899,3511,6
We know art has some tricks up its sleeve but,3512,8
The good ol’ days,3513,2
Scottish clan gets first chief in 337 years after genealogist keeps promise to find the rightful heir,3514,2
He became the very thing he swore to destroy,3515,7
Told my girlfriend I wanted a PS4 she surprised me with this when I got home from work,3516,2
2019 gonna be an interesting year for the EU,3517,2
PsBattle RedHeaded Man Wearing Blue Underwear Standing in Street with American Flag During Hurricane Florence,3518,2
Trump is reportedly upset about old video footage showing him throwing rolls of paper towels at firstresponders in Puerto Rico,3519,2
MRW someone turns on their blinker before they start to slow down for a turn,3520,2
I’m embarrassed to say it was my first thought too,3521,2
19yearold Brigitte Bardot during the Cannes Film Festival 1953,3522,6
Fibonnaci Bear  Absolute Unit of the Golden Ratio,3523,2
Ajit Pai seems really upset about the California net neutrality bill that passed with bipartisan support,3524,2
Just chilling and cooling down,3525,6
Smoke on the water,3526,2
Oi,3527,0
Yeah they’re the dumbasses,3528,2
Lighting hitting a building,3529,0
Having allies is extremely important,3530,2
McConnell breaks Senate tradition to obstruct Democratic campaigns “He’s resorted to cheap tactics”,3531,1
This is how you can tell youre in a good neighborhood,3532,2
Happy Birthday Buddy,3533,2
A Puppy Puppet,3534,1
My boss asked me to make a sign am I cool yet,3535,7
Tesla Model 3 Stolen From Mall of America Using Only a Smartphone,3536,2
Such thoughtfulness really warms my heart,3537,2
Posting memes in the EU,3538,1
Merchant in remote rainforest in Peru Sells laser sights and full automatic machine pistols,3539,7
Farmers who grow straw how do you feel about some cities and restaurants getting rid of straws,3540,1
Throwing a billiard ball inside the house,3541,2
Red Panda soaking in the sun at the Melbourne Zoo,3542,6
Eddie the hospital therapy dog who carries around his backpack full of toys for kids,3543,2
This comment thread on my RedBox disk,3544,4
Lets create a playlist with music that make you feel the way September from Earth,3545,2
Ohio’s Richest Republican Backer Leslie Wexner Quits Party After Visit From President Obama,3546,6
US universities honor Saudi students who died trying to rescue kids,3547,2
Daily Reminder,3548,2
This Lightning McTron Ferrari Wow,3549,4
Lakes rivers and streams in Finland (revised) [OC],3550,2
Wife’s reaction to gender reveal matches her husband’s shirt,3551,3
The Catholic Church convicts Galileo of heresy (1633),3552,5
Snake molting from its old skin,3553,2
Accurate,3554,2
Speeding cop who struck and killed 18yearold pedestrian handed 8 month sentence,3555,8
Thank you kanye Very cool,3556,7
This bird is such a bro,3557,2
The crinkly feeling of opening these VHS cases,3558,2
When the teacher is fifteen minutes late and tells the class to take a seat,3559,2
8year old WOWS with Harlem Globetrotters,3560,2
The way the sand dries up around it,3561,2
Canadian Burger Chain Sells Out of PlantBased Patties  A&W offering of Beyond Burger exceeded expectations CEO says “Plantbased protein has gained in popularity and it really is something people are very interested in”,3562,2
What is a movie that is actually scary (preferably one that doesnt rely solely on jump scares),3563,2
Eminem responding to MGKs diss track [OC],3564,7
Lovely marriage proposal,3565,2
🔥 I see your Atlas moth and raise you the peacock spider 🔥,3566,2
Maryland being an absolute madlad,3567,2
The real heroes of computing,3568,2
Michael Avenatti Says Michael Cohen Helped Donald Trump Rig the Election and He Deserves the Max Penalty,3569,2
Final scene final take thats a wrap Will somebody please hug Angela,3570,2
Magic Card Trick,3571,7
Destroyers,3572,3
Omg marry me,3573,1
me irl,3574,8
That first scoop is unmatched,3575,7
2meirl4meirl,3576,7
come on up,3577,2
I really must go Lizard business,3578,2
Cant find the keys,3579,2
Justin Bieber looks like a criminal sketch on an old episode of unsolved mysteries,3580,7
LPT For getting stoned,3581,2
Young Russians taking the lead in antiPutin protests,3582,6
Found this on a car recently,3583,2
MRW I hear John Kerry say Trump has the maturity of an eightyearold boy with the insecurity of a teenage girl,3584,2
Oh I cant believe it,3585,2
Content came out two days ago Nice and fresh for your investing,3586,2
North Texas punt returner never waived for a fair catch goes 90 yards for the TD,3587,1
Funny title,3588,7
Thought this belonged here,3589,2
Good pup turns its life around,3590,2
Gatekeeping all social medias,3591,5
how adults see millennials,3592,2
Good boy meets his Australian cousin,3593,2
Cross section of a commercial airplane,3594,4
The trebuchet can send 576PB of data over 300m nearly instantly,3595,1
Confederate dream catcher,3596,8
TIL that George Lucas and Steven Spielberg both personally called Bill Watterson about a Calvin & Hobbes movie and he turned them both down,3597,7
woof irl,3598,8
updated version,3599,2
The Great Escape,3600,8
I don’t think their system works,3601,2
YSK Yelp filters nonrecommended reviews & has been accused of hiding good reviews for companies that refuse to pay them for advertising,3602,2
Thats what we need,3603,2
The cat likes to drop his toys on our faces in the middle of the night to ask to play fetch This is his expression when we say no,3604,2
Redditors who have opted out of a standard approach to life (study then full time work mortgage etc) please share your stories What are the best and worst things about your lifestyle and do you have any regrets,3605,2
This derpy deer,3606,1
Pro Tip He cant get them if you remember,3607,2
Hey uh whyd you stop,3608,2
Just chilling and cooling down,3609,6
The I dont have anything to say,3610,2
Manu’s son pitched him to play one more year with the Spurs because of how good the chicken tenders were at the AT&T Center,3611,2
hmmm,3612,2
to do a straightforward delivery,3613,5
Needless to say she was excited to go home,3614,2
Whatve you done brad Hmmm,3615,6
Perfection,3616,3
Since I won’t cover his rent I don’t have love in my heart lol,3617,2
Two sweethearts showed up on our doorstep during Hurricane Florence After getting a meal and some water they have curled up in an old blanket on the porch I think they’ll be okay ),3618,2
I want to speak at your boss,3619,2
I used to be an adventurer like you but then I developed symptoms indicating the onset of patellofemoral syndrome,3620,2
Post no flyers,3621,2
Having a bad day,3622,2
Capybaras are the largest extant rodents They live together in groups and have been known to communally suckle the babies,3623,2
This is Holly She followed me home a week ago and I’m pretty sure she’s chosen me as her human,3624,2
Running to the beach at full speed,3625,7
I was Scoutmaster for a BSA National Youth Leadership course My course theme was Becoming a Jedi In Scouting Each Scout made a lightsaber in their patrol colors,3626,5
Museums in the future,3627,1
EPIC Games right now,3628,2
Rtx is amazing,3629,2
Private school weans,3630,2
How the EU thinks upload filters will work vs reality,3631,2
Poison 3 color screen print 85x11,3632,7
The cheese on this cheeseburger,3633,0
Mascot dad,3634,2
Whoever parks like this,3635,2
Yup I’m screwed ,3636,9
Want to smell like your favorite websites,3637,7
she just stands there menacingly,3638,1
There are two types of cats when companys over,3639,2
The owner of the restaurant kicked out one of my tables for yelling at me about a receipt,3640,7
Keanu helping girl onto motorcycle and fixing her dress,3641,2
Just do it,3642,0
We need the fullest possible airing of the accusation against Brett Kavanaugh,3643,1
Wanted to share with you guys my Bellatrix Lestrange cosplay work in progress pretty happy so far (More pictures will be posted on my Instagram) ),3644,2
Find 2 russian plumbers,3645,2
TIL that the word procrastinate comes from Latin meaning to put off until tomorrow and there is another word perendinate that means to put off until the day after tomorrow,3646,2
The way the sand dries up around it,3647,2
Out Of Battery Digital  1170 × 1652,3648,0
Mascot protects a kid from a foul ball,3649,6
Oh great,3650,8
DONT FORGET #1,3651,2
Europe calls for aid Unite the Factions,3652,1
[OC][ART] Decided to DnDify Terry Crews into the class of NPC he was born to embody & created artwork to match,3653,2
Turtle says hi,3654,2
German police began to forcibly remove protesters who have been living in tree houses for the past six years in the 12000yearold Hambach Forest which is slated for coal mine expansion,3655,2
The randomly generated syllabic naming system in No Mans Sky occasionally yields a classic,3656,2
Catch me if you can,3657,7
Last week my tiny island had its second ever Pride parade The route passed a church who decided they wanted to make a stand,3658,2
Terry Crews posts apology note from man he says sexually assaulted him,3659,2
State of EMexican Bliss,3660,6
sorry for the missing s lads,3661,1
God Is Watching,3662,1
Deepest darkest secrets,3663,8
This is an alright way to start off a comp game,3664,2
Cat stalking a mouse until,3665,2
🕺,3666,3
Zukos emotions and lightning redirection,3667,4
Captivating book my husband bought me today,3668,7
Silly Germans,3669,0
Hair Helmet,3670,2
This is Benny We visit hospitals together,3671,2
Mascot protects a kid from a foul ball,3672,6
Save yourself some time by reading the grand scheme of the AMA right here,3673,7
ELI5 How do certain websites prevent you from backing out of them to the previous page no matter how many times you click on the back button,3674,2
Weekend started,3675,2
Maggie Smith (Professor McGonagall from Harry Potter),3676,5
This madlad swoops in and states the hard facts,3677,2
This shows why sound travels faster in solids slower in liquids and slowest in gases,3678,5
How to Train a Combat Medic | I made the sequel to my Combat Medic video you guys loved so much,3679,2
[Text] Before you begin scrambling up the ladder of success,3680,2
🍁🍂🍁 [OC],3681,2
[Schefter] Browns are releasing WR Josh Gordon on Monday,3682,2
You may be cool but youre not Ben Franklin doing a finger gun cool,3683,7
Car parked two houses next to my girlfriends,3684,2
Its true,3685,2
Cinnamon Churro Smores,3686,5
Just Your Average Boop,3687,1
This sign at a restaurant in Muskogee OK,3688,7
Big balloons,3689,2
This is how the world ends will we soon see category 6 hurricanes Scientists never imagined that there would be a need for a category 6 storm with winds that exceed 200 miles per hour on a sustained basis,3690,2
Good boye,3691,2
Anyone else think the downed C130 on Erangel could use some loot,3692,2
Love the sinner hate the sin,3693,9
WTF Karen Dont include me on your sad online dating profile,3694,6
Couldnt find my cat when I came home At least she keeps things tidy,3695,2
Haven’t seen many posts utilizing the fisheye here’s a good one,3696,2
$100000 reward offered to find person putting needles in Australia strawberries,3697,8
Survived an emergency plane landing a car crash and people tried to burglarize the house he used to live in all in a week Get him on the Podcast,3698,2
September Slowflakes,3699,7
😂😂,3700,1
circumsise me captain,3701,1
Like me,3702,2
And now I’m sad,3703,2
Mother Chicken Shields Her Babies from the Rain Keeping them Warm and Dry,3704,2
Osseointegration Surgery,3705,3
I tried to tell her the mower was broken,3706,2
News “There’s not too much flooding here” Reporter “I could get on my knees” News “Perfect”,3707,2
An interesting titIe,3708,2
[OC] Speeches at Apple’s September 2018 Keynote visualized,3709,7
Keith is probably my favorite *one episode only* character,3710,7
[Browns] Browns to release WR Josh Gordon Statement from GM John Dorsey,3711,2
Australians told to call hotels rather than rely on booking sites for cheaper rates  Competition watchdog says if people phone hotels directly there’s a ‘very good chance’ they will get a better price,3712,1
IMAX In Active Discussions With Netflix Amazon and Other Streaming Services to Show Their Movies in IMAX Theaters,3713,1
Rekt,3714,1
me💧irl,3715,4
Uniting the People,3716,1
Great Dane doing lunges like his owner,3717,8
TIL a couple invited Queen Elizabeth to their wedding as a joke and she actually showed up,3718,2
Kindness is not dead,3719,7
Ryan Fitzpatrick looks like Conner McGregor’s alcoholic older brother,3720,7
Canada bans artificial trans fats in all foods starting Monday,3721,2
Slippery floor race,3722,1
My gf put the quote on the left it took her 2 weeks to realize I changed it,3723,2
Fake important Junk Mail,3724,5
We built bowser in our summer camp in Israeli scouts,3725,6
High altitude aerial view Wait,3726,2
Some Amazon employees are reportedly accepting cash bribes from online sellers to delete negative product reviews,3727,1
All Hail to the greatest hero in video game history,3728,2
The way this purple vine is growing up this house,3729,2
A very common bad habit,3730,2
Is this the right place to post this,3731,2
First official look at Joaquin Phoenix in ‘Joker’,3732,0
This antique door from 1380 in Regensburg (Germany) helps finding the Keyhole after you drank too much wine,3733,0
Samsung mocks the new generation of IPhones,3734,1
Maybe this will be better appreciated in this sub,3735,2
Ted Cruz Campaign is Mailing Donation Requests Disguised as Legal Summonses,3736,7
Going underwater,3737,2
The grass is green,3738,2
Saw an albino deer today,3739,7
My friend thinks you guys will laugh at him I think its awesome 4 player cabinet on a budget,3740,2
Petition to make this the Subreddit Icon,3741,2
World marathon record smashed by over a minute,3742,2
Thats my password as well,3743,2
My volume knob came off a while back so I improvised with a coke cap,3744,2
Uno is a savage game,3745,7
Impressive cooking technique,3746,2
Yeah you may be a SpiderMan but youre still a muggle,3747,2
Never bring a sword to a magic fight,3748,2
When you play the Sims but forget to rotate,3749,2
No rules hold me back,3750,2
100% OC safe invest,3751,2
Soon you will understand,3752,2
The family posing in front of shuttle Discovery before my dads launch,3753,2
Titans fake punt goes for a 66yard TD,3754,1
MANDATORY FUN TIME,3755,7
So THIS happened today,3756,2
As a teacher who teaches the same class 5 times a day this is the best,3757,1
Momma watching her little potato sleep,3758,8
Office prank,3759,2
I made the Ace of Spades from Destiny 2,3760,2
me+irl,3761,9
Haha never heard that one before,3762,2
Opening news article links in 2018 starter pack,3763,2
well okay then,3764,2
California professor writer of confidential Brett Kavanaugh letter speaks out about her allegation of sexual assault,3765,1
Is that legal,3766,1
WWII refugee children viewing the Statue of Liberty as they enter the United States 1946,3767,2
Whats the most important question to ask someone when you want to get to know them better,3768,2
To give the news,3769,2
I probably spooked this poor guy,3770,1
Grinding  Metal  2’ x 1’,3771,2
MRW I hear a sound and realize its my dog chewing on something,3772,2
This is exactly why we have this technology,3773,1
Was emptying out the recycling Accidentally made a vacuum seal,3774,2
So majestic,3775,1
Late meme,3776,2
AGs suing Trump ask for all communications with foreign officials about Trump Hotel,3777,2
In Marvels The Avengers (2012) the likeness of a halo can be observed around Hawkeyes head foreshadowing his role as savior of the universe in the upcoming Avengers 4,3778,2
Meme master Jimmy Fallon,3779,8
Mr Bones calcium warrior,3780,9
Thank you Jim,3781,9
MRW my cockblocking friend asks why Im mad at him,3782,2
20 tables,3783,8
Had a pair of prescription lenses which fit perfectly in my mask I could see all the fishies clearly,3784,2
What a battle,3785,2
Archaeologists find stone in a South African cave that may bear the worlds oldest drawing at 73000 years,3786,2
royalty free Linus meme,3787,2
Thats talent,3788,2
Great Dane copies owners lunges,3789,8
Dried glue being peeling from a brush [018],3790,6
But now before it completely disappears,3791,9
Unlimited Power,3792,2
woof_irl,3793,6
This is peanut the trucker cat he travels around with his owner that drives a semitruck for a living,3794,2
(SERIOUS) People who were named for negative reasons in suicide letters what is your story How did their death impact your life,3795,0
2meirl4meirl,3796,7
MRW Im enjoying my Sunday but remember theres school tomorrow,3797,2
Don’t need high school 👌,3798,2
These teacups look like they have little holes in them,3799,2
Astronaut Bruce McCandless II 41B mission specialist reaches a maximum distance from the Challenger before reversing direction his manned maneuvering unit (MMU) and returning to the Challenger,3800,5
Severe Typhoon Mangkhut Hitting HK,3801,0
me_irl,3802,9
When a takeaway becomes the choosingbegger,3803,8
Apples $1000 iPhones are turning it into a luxury brand — and it could lose a whole generation of customers,3804,1
Roses are red he goes to the club,3805,6
Happy Little Yellow Tree 4x6 Watercolor,3806,8
Korean Beef [homemade],3807,2
First time in the snow for puppy,3808,2
