Title,Title Link,Score,Num Comments,Subreddit
You can change your PSN ID starting today.,https://www.reddit.com/r/PS4/comments/bbl7c4/you_can_change_your_psn_id_starting_today/,21500,2700,r/PS4
"Ellen, The Generous",https://www.reddit.com/r/BoneAppleTea/comments/bbru6n/ellen_the_generous/,21600,233,r/BoneAppleTea
Atleast I am original,https://www.reddit.com/r/memes/comments/bbq3sa/atleast_i_am_original/,21300,101,r/memes
This is a Picasso Bug and it's a real animal,https://www.reddit.com/r/woahdude/comments/bbl3cn/this_is_a_picasso_bug_and_its_a_real_animal/,21300,198,r/woahdude
2meirl4meirl,https://www.reddit.com/r/2meirl4meirl/comments/bbklf1/2meirl4meirl/,21300,107,r/2meirl4meirl
"TIL that in 2005, Eric James Torpy, was convicted of shooting with intent to kill and robbery. He asked that his sentence be changed from 30 years' imprisonment to 33 so that it would match Larry Bird's jersey number. His request was granted.",https://www.reddit.com/r/todayilearned/comments/bblhyq/til_that_in_2005_eric_james_torpy_was_convicted/,21300,456,r/todayilearned
The real black hole,https://www.reddit.com/r/dankmemes/comments/bbpeno/the_real_black_hole/,21200,134,r/dankmemes
Dropped a G on a king sized bed.. first night and I already got voted off the island,https://www.reddit.com/r/WhatsWrongWithYourDog/comments/bbfmio/dropped_a_g_on_a_king_sized_bed_first_night_and_i/,20900,320,r/WhatsWrongWithYourDog
Magic faucet,https://www.reddit.com/r/blackmagicfuckery/comments/bblqok/magic_faucet/,20600,658,r/blackmagicfuckery
Me trying to go to sleep on April 25,https://www.reddit.com/r/marvelstudios/comments/bbr6sx/me_trying_to_go_to_sleep_on_april_25/,20600,648,r/marvelstudios
"Mike Doyle stands on the floor of the US House and says, ""I did not come to Congress to work for Internet Service Providers.""",https://www.reddit.com/r/pics/comments/bbmgyg/mike_doyle_stands_on_the_floor_of_the_us_house/,20600,523,r/pics
Don't slip pewds,https://www.reddit.com/r/PewdiepieSubmissions/comments/bbi522/dont_slip_pewds/,20500,181,r/PewdiepieSubmissions
Sometimes doing your best is not quite enough,https://www.reddit.com/r/memes/comments/bbkf7h/sometimes_doing_your_best_is_not_quite_enough/,20500,333,r/memes
[BoTW] Link teaching Zelda how to play as him. Art by: ivy-alive (DeviantArt),https://www.reddit.com/r/zelda/comments/bbk620/botw_link_teaching_zelda_how_to_play_as_him_art/,20300,530,r/zelda
The saga mural at Star Wars Celebration Chicago,https://www.reddit.com/r/StarWars/comments/bbspvo/the_saga_mural_at_star_wars_celebration_chicago/,20000,686,r/StarWars
I was told to put my Halloween costume on here,https://www.reddit.com/r/DunderMifflin/comments/bbs624/i_was_told_to_put_my_halloween_costume_on_here/,20000,215,r/DunderMifflin
Two men golfing...,https://www.reddit.com/r/Jokes/comments/bbimhz/two_men_golfing/,20000,308,r/Jokes
Chris Hansen has the chat logs,https://www.reddit.com/r/dankmemes/comments/bbkth4/chris_hansen_has_the_chat_logs/,19900,97,r/dankmemes
Cessna 172 on a Volkswagen Beetle chassis,https://www.reddit.com/r/ATBGE/comments/bbshc4/cessna_172_on_a_volkswagen_beetle_chassis/,19700,264,r/ATBGE
midnight,https://www.reddit.com/r/comics/comments/bbr6ih/midnight/,19700,200,r/comics
Playing Minecraft with your BFF,https://www.reddit.com/r/starterpacks/comments/bbmb8j/playing_minecraft_with_your_bff/,19600,284,r/starterpacks
Skull carved on a pin head 1.5mm,https://www.reddit.com/r/Art/comments/bbrlzs/skull_carved_on_a_pin_head_15mm/,19500,156,r/Art
Husband catches Wife with her Boyfriend While High On Drugs,https://www.reddit.com/r/videos/comments/bbiocb/husband_catches_wife_with_her_boyfriend_while/,19300,657,r/videos
Marketing 100,https://www.reddit.com/r/FellowKids/comments/bbjs6q/marketing_100/,19300,232,r/FellowKids
Exposed,https://www.reddit.com/r/PewdiepieSubmissions/comments/bbol3j/exposed/,19100,93,r/PewdiepieSubmissions
alternative store gatekeeping witch craft??,https://www.reddit.com/r/gatekeeping/comments/bbkh4w/alternative_store_gatekeeping_witch_craft/,19100,448,r/gatekeeping
Perspective,https://www.reddit.com/r/Damnthatsinteresting/comments/bbg4c7/perspective/,19100,262,r/Damnthatsinteresting
meirl,https://www.reddit.com/r/meirl/comments/bbpd7e/meirl/,19000,146,r/meirl
In Russia if you see a kid walking on the road you drag it by the scruff and drive it back to the street,https://www.reddit.com/r/funny/comments/bbr48q/in_russia_if_you_see_a_kid_walking_on_the_road/,18900,303,r/funny
"Septarian nodule ""dragon egg"" geode.",https://www.reddit.com/r/oddlysatisfying/comments/bbnyao/septarian_nodule_dragon_egg_geode/,18800,158,r/oddlysatisfying
We just had to turn the setting on...,https://www.reddit.com/r/pcmasterrace/comments/bbpzb8/we_just_had_to_turn_the_setting_on/,18800,184,r/pcmasterrace
I think he is a beauty,https://www.reddit.com/r/dankmemes/comments/bbqxw9/i_think_he_is_a_beauty/,18600,71,r/dankmemes
The savior of teenagers😢😭,https://www.reddit.com/r/teenagers/comments/bbkkij/the_savior_of_teenagers/,18600,114,r/teenagers
Hmmm,https://www.reddit.com/r/PewdiepieSubmissions/comments/bbqfx7/hmmm/,18600,58,r/PewdiepieSubmissions
Officer earl coming straight for 1st place,https://www.reddit.com/r/dankmemes/comments/bbijhs/officer_earl_coming_straight_for_1st_place/,18500,64,r/dankmemes
Almost every article promoting the news of the first image of a black hole.,https://www.reddit.com/r/funny/comments/bbmpt6/almost_every_article_promoting_the_news_of_the/,18400,567,r/funny
Be kind,https://www.reddit.com/r/wholesomebpt/comments/bbfsbr/be_kind/,18400,218,r/wholesomebpt
"New York City has Ordered Williamsburg residents to get vaccinated for measles, being not vaccinated can now lead to fines (up to $1000)! I feel a Karen storm coming!",https://www.reddit.com/r/vaxxhappened/comments/bbimni/new_york_city_has_ordered_williamsburg_residents/,18200,650,r/vaxxhappened
Nihao,https://www.reddit.com/r/BoneAppleTea/comments/bbgch1/nihao/,18300,489,r/BoneAppleTea
This alleyway is so narrow it has a traffic light,https://www.reddit.com/r/mildlyinteresting/comments/bbk7mi/this_alleyway_is_so_narrow_it_has_a_traffic_light/,18200,211,r/mildlyinteresting
Green Top!😩💥💦👌💯,https://www.reddit.com/r/dankmemes/comments/bbjct9/green_top/,18200,110,r/dankmemes
Texting,https://www.reddit.com/r/Wellthatsucks/comments/bbnqt9/texting/,18000,114,r/Wellthatsucks
"I made a datapack that lets you take photos in-game, and renders them onto maps",https://www.reddit.com/r/Minecraft/comments/bbrq6n/i_made_a_datapack_that_lets_you_take_photos/,17900,255,r/Minecraft
Sloppy Joes,https://www.reddit.com/r/GifRecipes/comments/bbom2m/sloppy_joes/,17900,888,r/GifRecipes
I took it too far...,https://www.reddit.com/r/memes/comments/bbkgoz/i_took_it_too_far/,17900,110,r/memes
It never ends!!,https://www.reddit.com/r/funny/comments/bbqx6u/it_never_ends/,17800,209,r/funny
The rightful king,https://www.reddit.com/r/freefolk/comments/bblh5g/the_rightful_king/,17800,359,r/freefolk
[Image] It’s never too late,https://www.reddit.com/r/GetMotivated/comments/bbg9uc/image_its_never_too_late/,17700,954,r/GetMotivated
Who says the wraith isn't a good AA vehicle?,https://www.reddit.com/r/halo/comments/bbq3qz/who_says_the_wraith_isnt_a_good_aa_vehicle/,17800,385,r/halo
My cat before and after her glow-up.,https://www.reddit.com/r/aww/comments/bboj7j/my_cat_before_and_after_her_glowup/,17700,149,r/aww
Found this masterpiece at a local restaurant,https://www.reddit.com/r/CrappyDesign/comments/bbjcvf/found_this_masterpiece_at_a_local_restaurant/,17700,250,r/CrappyDesign
"This is my 64th attempt to get something on lwiay, pls people sorting by new",https://www.reddit.com/r/PewdiepieSubmissions/comments/bbksal/this_is_my_64th_attempt_to_get_something_on_lwiay/,17600,148,r/PewdiepieSubmissions
[OC] Sometimes you have to remind the party you're men.,https://www.reddit.com/r/DnD/comments/bbj0e4/oc_sometimes_you_have_to_remind_the_party_youre/,17500,589,r/DnD
"Procrastination starter pack, will update tomorrow",https://www.reddit.com/r/starterpacks/comments/bbgv8d/procrastination_starter_pack_will_update_tomorrow/,17500,132,r/starterpacks
Thanos Preparing for Endgame Episode 4: Hulk (disclaimer: makes zero sense),https://www.reddit.com/r/marvelstudios/comments/bbl31p/thanos_preparing_for_endgame_episode_4_hulk/,17500,308,r/marvelstudios
Woof,https://www.reddit.com/r/funny/comments/bbfbe5/woof/,17300,153,r/funny
M87 blackhole,https://www.reddit.com/r/AbsoluteUnits/comments/bbm062/m87_blackhole/,17100,299,r/AbsoluteUnits
Don't underestimate his power,https://www.reddit.com/r/memes/comments/bbpuls/dont_underestimate_his_power/,17000,146,r/memes
Be careful.,https://www.reddit.com/r/PewdiepieSubmissions/comments/bbim1d/be_careful/,16900,74,r/PewdiepieSubmissions
What an extraordinary discovery,https://www.reddit.com/r/dankmemes/comments/bbnf88/what_an_extraordinary_discovery/,16900,52,r/dankmemes
I’ll take the stairs,https://www.reddit.com/r/aww/comments/bbp503/ill_take_the_stairs/,16800,140,r/aww
Think about that,https://www.reddit.com/r/memes/comments/bbft9o/think_about_that/,16800,214,r/memes
Let’s be honest bois,https://www.reddit.com/r/dankmemes/comments/bbfglv/lets_be_honest_bois/,16800,257,r/dankmemes
[I Ate] Korean fried chicken sandwich,https://www.reddit.com/r/food/comments/bbnws8/i_ate_korean_fried_chicken_sandwich/,16800,330,r/food
meirl,https://www.reddit.com/r/meirl/comments/bbiaze/meirl/,16800,64,r/meirl
HoRrIbLe OwNeR gIvEs DePrEsSeD pUpPy A lObOtOmY,https://www.reddit.com/r/PeopleFuckingDying/comments/bbn0tc/horrible_owner_gives_depressed_puppy_a_lobotomy/,16700,90,r/PeopleFuckingDying
By Dolan Dark,https://www.reddit.com/r/dankmemes/comments/bbmo1k/by_dolan_dark/,16600,86,r/dankmemes
To flip over while drunk,https://www.reddit.com/r/therewasanattempt/comments/bbhbs8/to_flip_over_while_drunk/,16600,199,r/therewasanattempt
Only one hour bois,https://www.reddit.com/r/dankmemes/comments/bblakm/only_one_hour_bois/,16600,114,r/dankmemes
Took me a while,https://www.reddit.com/r/memes/comments/bbir9v/took_me_a_while/,16500,115,r/memes
*does fortnite dance*,https://www.reddit.com/r/dankmemes/comments/bbisly/does_fortnite_dance/,16500,162,r/dankmemes
Now this is creativity!,https://www.reddit.com/r/memes/comments/bbjxxc/now_this_is_creativity/,16500,92,r/memes
"Seriously though, this is an amazing feat!",https://www.reddit.com/r/dankmemes/comments/bbml3v/seriously_though_this_is_an_amazing_feat/,16100,66,r/dankmemes
HITLER! 😂😂😂😂😂,https://www.reddit.com/r/youngpeopleyoutube/comments/bbjh36/hitler/,16100,255,r/youngpeopleyoutube
Smh at all these girls complimenting and being nice to each other 😤,https://www.reddit.com/r/notliketheothergirls/comments/bbkony/smh_at_all_these_girls_complimenting_and_being/,16200,267,r/notliketheothergirls
Coked up bear,https://www.reddit.com/r/Bossfight/comments/bbjbul/coked_up_bear/,16000,210,r/Bossfight
Purple man bad,https://www.reddit.com/r/dankmemes/comments/bbj9w9/purple_man_bad/,16000,210,r/dankmemes
filter,https://www.reddit.com/r/technicallythetruth/comments/bbgo43/filter/,16000,50,r/technicallythetruth
Less than 3 inches,https://www.reddit.com/r/memes/comments/bbjezg/less_than_3_inches/,15900,197,r/memes
No no no that's not in the movie,https://www.reddit.com/r/thanosdidnothingwrong/comments/bbl111/no_no_no_thats_not_in_the_movie/,15800,97,r/thanosdidnothingwrong
Happy Cockatoo,https://www.reddit.com/r/funny/comments/bbkyff/happy_cockatoo/,15800,211,r/funny
Expect me to treat kids like crap - I'm going to shut down your daycare!,https://www.reddit.com/r/MaliciousCompliance/comments/bbjjna/expect_me_to_treat_kids_like_crap_im_going_to/,15800,501,r/MaliciousCompliance
"In chat we stay, there are no lies. You know what to do...",https://www.reddit.com/r/boottoobig/comments/bboaah/in_chat_we_stay_there_are_no_lies_you_know_what/,15700,126,r/boottoobig
I Hope This Belongs Here.,https://www.reddit.com/r/FunnyandSad/comments/bbfyxm/i_hope_this_belongs_here/,15600,105,r/FunnyandSad
I just got rejected by Lidl.,https://www.reddit.com/r/CasualUK/comments/bbo6um/i_just_got_rejected_by_lidl/,15500,329,r/CasualUK
"12 years ago I was out there... that’s Jeffree star. I’m in the blue hahaha, thank my sister for saving this gem.",https://www.reddit.com/r/blunderyears/comments/bblpyu/12_years_ago_i_was_out_there_thats_jeffree_star/,15500,621,r/blunderyears
Every parent to child,https://www.reddit.com/r/WatchPeopleDieInside/comments/bbjfdw/every_parent_to_child/,15500,39,r/WatchPeopleDieInside
First image of a black hole,https://www.reddit.com/r/Physics/comments/bbltik/first_image_of_a_black_hole/,16300,512,r/Physics
I had to go afk in FFA because my uncle called. This rein came to keep me safe.,https://www.reddit.com/r/Overwatch/comments/bbpq4u/i_had_to_go_afk_in_ffa_because_my_uncle_called/,15400,330,r/Overwatch
[OC] Swordmite: The Helpful Mimic!,https://www.reddit.com/r/DnD/comments/bbqsgo/oc_swordmite_the_helpful_mimic/,15400,192,r/DnD
Hummingbird accidentally slaps the hell out of a bee with its wing,https://www.reddit.com/r/nevertellmetheodds/comments/bbr94s/hummingbird_accidentally_slaps_the_hell_out_of_a/,15300,230,r/nevertellmetheodds
In a big hurry to get nowhere,https://www.reddit.com/r/interestingasfuck/comments/bbntg6/in_a_big_hurry_to_get_nowhere/,15300,206,r/interestingasfuck
Why ya’ll don’t care?,https://www.reddit.com/r/memes/comments/bbkyq5/why_yall_dont_care/,15200,243,r/memes
Just liked to see the face to face comparison,https://www.reddit.com/r/reddeadredemption/comments/bboqs7/just_liked_to_see_the_face_to_face_comparison/,15300,453,r/reddeadredemption
"Be cool, don’t juul",https://www.reddit.com/r/teenagers/comments/bboitn/be_cool_dont_juul/,15200,304,r/teenagers
Dead or Alive Kasumi cosplay,https://www.reddit.com/r/gaming/comments/bbn65u/dead_or_alive_kasumi_cosplay/,15100,700,r/gaming
The truth NASA doesnt want you to see,https://www.reddit.com/r/PewdiepieSubmissions/comments/bbqkvt/the_truth_nasa_doesnt_want_you_to_see/,15100,94,r/PewdiepieSubmissions
Jimmy has separation anxiety so he holds onto you when you walk in the door,https://www.reddit.com/r/aww/comments/bbslj3/jimmy_has_separation_anxiety_so_he_holds_onto_you/,15100,118,r/aww
Knock knock,https://www.reddit.com/r/PewdiepieSubmissions/comments/bbrrd7/knock_knock/,15000,71,r/PewdiepieSubmissions
The only way I can ever get a kill with the Kraber,https://www.reddit.com/r/apexlegends/comments/bbpxvk/the_only_way_i_can_ever_get_a_kill_with_the_kraber/,15000,356,r/apexlegends
They just don’t get it,https://www.reddit.com/r/dankmemes/comments/bbokto/they_just_dont_get_it/,14900,114,r/dankmemes
Bring it on Google,https://www.reddit.com/r/dankmemes/comments/bbq41h/bring_it_on_google/,14900,75,r/dankmemes
