Title,Title Link,Score,Num Comments,Subreddit
This is Dr Katie Bouman the computer scientist behind the first ever image of a black-hole. She developed the algorithm that turned telescopic data into the historic photo we see today.,https://www.reddit.com/r/pics/comments/bbql1i/this_is_dr_katie_bouman_the_computer_scientist/,215000,6300,r/pics
The first picture of a black hole opens a new era of astrophysics. The supermassive beast lies in a galaxy called M87 more than 50 million light-years away,https://www.reddit.com/r/science/comments/bblu6v/the_first_picture_of_a_black_hole_opens_a_new_era/,155000,5500,r/science
The entire Shrek movie but it's a gif,https://www.reddit.com/r/dankmemes/comments/bbncgy/the_entire_shrek_movie_but_its_a_gif/,149000,3400,r/dankmemes
TIFU by spending the last year on reddit talking to myself after being muted.,https://www.reddit.com/r/tifu/comments/bbgmzp/tifu_by_spending_the_last_year_on_reddit_talking/,143000,3100,r/tifu
Today on reddit,https://www.reddit.com/r/funny/comments/bbofcq/today_on_reddit/,133000,1400,r/funny
Astronomers Capture First Image of a Black Hole,https://www.reddit.com/r/space/comments/bblt4f/astronomers_capture_first_image_of_a_black_hole/,134000,6200,r/space
Humans are much interest,https://www.reddit.com/r/memes/comments/bbmqf8/humans_are_much_interest/,129000,1200,r/memes
13 Year Old Girl nicknamed 'Trash Girl' was regularly bullied for collecting trash on her way to school. On Friday she is to recieve a Points of Light Award award granted from Prime Minister Theresa May.,https://www.reddit.com/r/UpliftingNews/comments/bbqop2/13_year_old_girl_nicknamed_trash_girl_was/,81600,1700,r/UpliftingNews
The first picture of a black hole,https://www.reddit.com/r/interestingasfuck/comments/bblt5r/the_first_picture_of_a_black_hole/,80200,2400,r/interestingasfuck
"A local tv reporter here in our country brings her baby dog in her workplace, the dog stays with here like that until the end of the news show. But the camera only shows the upper half of the reporters body.",https://www.reddit.com/r/aww/comments/bbkphi/a_local_tv_reporter_here_in_our_country_brings/,72100,812,r/aww
"MIT grad Katie Bouman, 29, is the researcher who led the creation of a new algorithm that produced the first-ever image of a black hole",https://www.reddit.com/r/space/comments/bbr85r/mit_grad_katie_bouman_29_is_the_researcher_who/,71300,1600,r/space
Hummingbird accidentally slaps the hell out of a bee with its wing,https://www.reddit.com/r/gifs/comments/bbo89l/hummingbird_accidentally_slaps_the_hell_out_of_a/,70200,1500,r/gifs
It’s time boys...,https://www.reddit.com/r/dankmemes/comments/bbg2hc/its_time_boys/,69800,1300,r/dankmemes
That's how we do it,https://www.reddit.com/r/dankmemes/comments/bbqmfs/thats_how_we_do_it/,67400,346,r/dankmemes
Hard work pays off,https://www.reddit.com/r/memes/comments/bbq15e/hard_work_pays_off/,66300,418,r/memes
The measure of a great game,https://www.reddit.com/r/gaming/comments/bbt4p1/the_measure_of_a_great_game/,65200,1200,r/gaming
"Dr. Katie Bouman, one of the researchers on the Event Horizontal Telescope project, gave a TED Talk two years ago about how pictures of black holes can be taken. Posted on April 28, 2017, she says that a picture of a black hole may be taken within a couple of years...pretty incredible.",https://www.reddit.com/r/videos/comments/bbs76q/dr_katie_bouman_one_of_the_researchers_on_the/,63100,2300,r/videos
The Zangbeto is a ritualistic Gambian dance wherein the dancer is cloaked in palm fronds from head to toe,https://www.reddit.com/r/Damnthatsinteresting/comments/bblpex/the_zangbeto_is_a_ritualistic_gambian_dance/,62600,1500,r/Damnthatsinteresting
Having to deal with customers who act like everything is under your control and your fault.,https://www.reddit.com/r/Wellthatsucks/comments/bbrqdp/having_to_deal_with_customers_who_act_like/,55500,994,r/Wellthatsucks
me_irl,https://www.reddit.com/r/me_irl/comments/bbnxlk/me_irl/,55400,480,r/me_irl
House votes to reinstate Obama-era net neutrality rules,https://www.reddit.com/r/politics/comments/bbnkv7/house_votes_to_reinstate_obamaera_net_neutrality/,54800,1900,r/politics
Adorable birb trustingly falling asleep in its owner's hand,https://www.reddit.com/r/Eyebleach/comments/bbrxzs/adorable_birb_trustingly_falling_asleep_in_its/,54100,368,r/Eyebleach
"But that thing, it scares me",https://www.reddit.com/r/gaming/comments/bbjv9q/but_that_thing_it_scares_me/,53700,353,r/gaming
Sorry mom,https://www.reddit.com/r/BikiniBottomTwitter/comments/bbndxh/sorry_mom/,52900,280,r/BikiniBottomTwitter
On a post about the photograph of the black hole,https://www.reddit.com/r/MurderedByWords/comments/bbrmyk/on_a_post_about_the_photograph_of_the_black_hole/,52700,2500,r/MurderedByWords
Pretending to punch the haunted centaur,https://www.reddit.com/r/gifs/comments/bbfsio/pretending_to_punch_the_haunted_centaur/,52600,384,r/gifs
Cool dog!,https://www.reddit.com/r/WhitePeopleTwitter/comments/bbg2zt/cool_dog/,52300,161,r/WhitePeopleTwitter
Kids spray painted “Fortnite”in front of our drive way and we didn’t know who did it. The parents showed up the next day and cleaned it up. 1000% respect.,https://www.reddit.com/r/pics/comments/bbnfrw/kids_spray_painted_fortnitein_front_of_our_drive/,51100,1300,r/pics
"Today I turned 40, so I decided to relive my 20's",https://www.reddit.com/r/gaming/comments/bbos5e/today_i_turned_40_so_i_decided_to_relive_my_20s/,50700,3100,r/gaming
At least we agree on one thing,https://www.reddit.com/r/memes/comments/bbjy9e/at_least_we_agree_on_one_thing/,50600,1200,r/memes
What motivates you?,https://www.reddit.com/r/funny/comments/bbke0j/what_motivates_you/,50600,748,r/funny
National Science Foundation/Event Horizon Telescope Project Black Hole Picture,https://www.reddit.com/r/pics/comments/bblt5p/national_science_foundationevent_horizon/,50400,1400,r/pics
"Millennials being squeezed out of middle class, says OECD",https://www.reddit.com/r/worldnews/comments/bbqcyf/millennials_being_squeezed_out_of_middle_class/,49300,11600,r/worldnews
TIL that there was a group of middle aged women called “Snapists” who believed that they were married to Severus Snape on the ‘astral plane’ and that he controlled their lives. An independent researcher published an in-depth paper on the matter.,https://www.reddit.com/r/todayilearned/comments/bbkb5i/til_that_there_was_a_group_of_middle_aged_women/,49100,2300,r/todayilearned
Faint boss music,https://www.reddit.com/r/dankmemes/comments/bbjp1m/faint_boss_music/,48600,359,r/dankmemes
Carefully he's a hero,https://www.reddit.com/r/dankmemes/comments/bbracp/carefully_hes_a_hero/,48000,221,r/dankmemes
Enjoying the Sunset.,https://www.reddit.com/r/aww/comments/bbje5g/enjoying_the_sunset/,47900,242,r/aww
Actual size of the SSD,https://www.reddit.com/r/Unexpected/comments/bbpzsn/actual_size_of_the_ssd/,47400,890,r/Unexpected
OH BOB SAGET,https://www.reddit.com/r/Wellthatsucks/comments/bbg9tn/oh_bob_saget/,47300,648,r/Wellthatsucks
When the demons still haven't learned their lesson,https://www.reddit.com/r/gaming/comments/bbkezz/when_the_demons_still_havent_learned_their_lesson/,47000,558,r/gaming
Pluto vs M87 black hole. Just imagine the next 20 years of astrophotography.,https://www.reddit.com/r/interestingasfuck/comments/bbsmm8/pluto_vs_m87_black_hole_just_imagine_the_next_20/,46800,1100,r/interestingasfuck
What the...,https://www.reddit.com/r/youseeingthisshit/comments/bbo9x0/what_the/,46800,394,r/youseeingthisshit
Pretty much how college works,https://www.reddit.com/r/BikiniBottomTwitter/comments/bbijky/pretty_much_how_college_works/,46200,265,r/BikiniBottomTwitter
"This shirt you can't wear anything over, unless you want to look like you have permanent pokey nipples",https://www.reddit.com/r/CrappyDesign/comments/bboiv6/this_shirt_you_cant_wear_anything_over_unless_you/,46100,546,r/CrappyDesign
Police officers who fined stalking victim before she was murdered face disciplinary action,https://www.reddit.com/r/news/comments/bbkslm/police_officers_who_fined_stalking_victim_before/,45800,3100,r/news
Texas lawmakers consider the death penalty for abortion,https://www.reddit.com/r/nottheonion/comments/bbmmd1/texas_lawmakers_consider_the_death_penalty_for/,45700,5000,r/nottheonion
"[No Spoilers] HBO sent me the actual Map Markers for Targaryen, Stark, and Lannister and commissioned me to do a wood carving integrating all 3 to celebrate the final season. Reddit voting my previous GOT carving to the front page was likely a big reason they found me. Thank you! More to come.",https://www.reddit.com/r/gameofthrones/comments/bbl8a9/no_spoilers_hbo_sent_me_the_actual_map_markers/,46200,737,r/gameofthrones
First photo of a black hole in the heart of the M87 galaxy taken by the Event Horizon Telescope,https://www.reddit.com/r/Futurology/comments/bbly5z/first_photo_of_a_black_hole_in_the_heart_of_the/,43900,1100,r/Futurology
If you aren't impressed with the picture of the first Black Hole,https://www.reddit.com/r/Jokes/comments/bbo7ez/if_you_arent_impressed_with_the_picture_of_the/,43700,484,r/Jokes
The staff at our hotel made a cool crocodile out of our towels.,https://www.reddit.com/r/mildlyinteresting/comments/bbl706/the_staff_at_our_hotel_made_a_cool_crocodile_out/,43100,501,r/mildlyinteresting
240p Quality,https://www.reddit.com/r/PewdiepieSubmissions/comments/bbmnts/240p_quality/,42500,170,r/PewdiepieSubmissions
1000 IQ meme,https://www.reddit.com/r/PewdiepieSubmissions/comments/bbs0g7/1000_iq_meme/,42300,498,r/PewdiepieSubmissions
Every one of my matches,https://www.reddit.com/r/Tinder/comments/bbl9sd/every_one_of_my_matches/,41400,985,r/Tinder
You go girl!,https://www.reddit.com/r/WhitePeopleTwitter/comments/bbopzt/you_go_girl/,41400,839,r/WhitePeopleTwitter
Bringing a ball that big to a beach is asking for a disaster,https://www.reddit.com/r/Wellthatsucks/comments/bblc7u/bringing_a_ball_that_big_to_a_beach_is_asking_for/,40400,628,r/Wellthatsucks
*asks roommate to pay utilities bill that is 9 days past due*,https://www.reddit.com/r/ChoosingBeggars/comments/bbnl3h/asks_roommate_to_pay_utilities_bill_that_is_9/,39800,2100,r/ChoosingBeggars
When you thought you could take on a giant at level 2,https://www.reddit.com/r/gaming/comments/bblc3n/when_you_thought_you_could_take_on_a_giant_at/,39700,931,r/gaming
Modern Mating Rituals,https://www.reddit.com/r/WhitePeopleTwitter/comments/bbt1sj/modern_mating_rituals/,39000,297,r/WhitePeopleTwitter
Cow finds a friend to cuddle with,https://www.reddit.com/r/Eyebleach/comments/bbk7bj/cow_finds_a_friend_to_cuddle_with/,38900,884,r/Eyebleach
Only 0.01% of you will understand,https://www.reddit.com/r/PewdiepieSubmissions/comments/bbo8nm/only_001_of_you_will_understand/,38700,175,r/PewdiepieSubmissions
Go to sleep guys,https://www.reddit.com/r/memes/comments/bbh0ud/go_to_sleep_guys/,38100,612,r/memes
"Exactly 100 years ago died one of the coolest guys to ever wear a sombrero. Emiliano Zapata in Mexico city, 1914. Colorized photo.",https://www.reddit.com/r/OldSchoolCool/comments/bbqxks/exactly_100_years_ago_died_one_of_the_coolest/,37600,1100,r/OldSchoolCool
"LPT: Don't judge your ""market value"" as a romantic partner during your teenage years/ early twenties. A lot of decisions during that time are hormone-driven.",https://www.reddit.com/r/LifeProTips/comments/bbkges/lpt_dont_judge_your_market_value_as_a_romantic/,37300,1700,r/LifeProTips
My girlfriend and I finally adopted our first pup! Meet Rocco!,https://www.reddit.com/r/rarepuppers/comments/bbpcas/my_girlfriend_and_i_finally_adopted_our_first_pup/,37000,346,r/rarepuppers
Don’t forget to recharge friendo’s!,https://www.reddit.com/r/wholesomememes/comments/bbjtez/dont_forget_to_recharge_friendos/,36800,400,r/wholesomememes
Call me crazy but she has a point...👀,https://www.reddit.com/r/vaxxhappened/comments/bbq47a/call_me_crazy_but_she_has_a_point/,36000,311,r/vaxxhappened
Supermassive blackhole M86 if we could see it from all perspectives.,https://www.reddit.com/r/oddlysatisfying/comments/bbqmfv/supermassive_blackhole_m86_if_we_could_see_it/,35900,501,r/oddlysatisfying
NASA releases first photo of a black hole (2019),https://www.reddit.com/r/gaming/comments/bbncku/nasa_releases_first_photo_of_a_black_hole_2019/,35500,265,r/gaming
Flying A Plane Over NYC To Promote Pewdiepie,https://www.reddit.com/r/PewdiepieSubmissions/comments/bbl4yb/flying_a_plane_over_nyc_to_promote_pewdiepie/,35100,739,r/PewdiepieSubmissions
“No one gets lynched for exfoliating”,https://www.reddit.com/r/BrandNewSentence/comments/bblgxq/no_one_gets_lynched_for_exfoliating/,35000,670,r/BrandNewSentence
"JUUL electronic cigarette products linked to cellular damage. The nicotine concentrations are sufficiently high to be cytotoxic, or toxic to living cells, when tested in vitro with cultured respiratory system cells",https://www.reddit.com/r/science/comments/bbrq2a/juul_electronic_cigarette_products_linked_to/,34400,2100,r/science
House approves Save the Internet Act that would reinstate net neutrality,https://www.reddit.com/r/technology/comments/bbnkxj/house_approves_save_the_internet_act_that_would/,34100,1400,r/technology
Traveling only appeals to boring people or people who haven’t traveled,https://www.reddit.com/r/unpopularopinion/comments/bbksll/traveling_only_appeals_to_boring_people_or_people/,33800,4900,r/unpopularopinion
The six flags new Orleans sign still says closed for storm 14 years after the park was destroyed by hurricane Katrina,https://www.reddit.com/r/mildlyinteresting/comments/bbsti3/the_six_flags_new_orleans_sign_still_says_closed/,33700,925,r/mildlyinteresting
PsBattle: Dwayne Wade falling into Chrissy Teigen and John Legend,https://www.reddit.com/r/photoshopbattles/comments/bblswl/psbattle_dwayne_wade_falling_into_chrissy_teigen/,33400,583,r/photoshopbattles
Another brave battle won,https://www.reddit.com/r/PewdiepieSubmissions/comments/bbfxwb/another_brave_battle_won/,33200,916,r/PewdiepieSubmissions
Legit MURDER on the floor of the US Congress during the net neutrality debate,https://www.reddit.com/r/MurderedByWords/comments/bbngtf/legit_murder_on_the_floor_of_the_us_congress/,33100,963,r/MurderedByWords
B L A C K H O L E,https://www.reddit.com/r/dankmemes/comments/bbofxk/b_l_a_c_k_h_o_l_e/,33100,113,r/dankmemes
I noticed my friend’s socks,https://www.reddit.com/r/oddlysatisfying/comments/bbkuop/i_noticed_my_friends_socks/,33000,476,r/oddlysatisfying
That's crazy,https://www.reddit.com/r/Damnthatsinteresting/comments/bbhmq9/thats_crazy/,32700,1100,r/Damnthatsinteresting
Too late,https://www.reddit.com/r/funny/comments/bbmbsc/too_late/,32400,852,r/funny
"A surprise to sure, but a welcome one",https://www.reddit.com/r/HistoryMemes/comments/bbqhk0/a_surprise_to_sure_but_a_welcome_one/,32400,192,r/HistoryMemes
The Lion King Official Trailer,https://www.reddit.com/r/movies/comments/bbl5zi/the_lion_king_official_trailer/,32299,5600,r/movies
who comes up with these,https://www.reddit.com/r/dankmemes/comments/bbjhcm/who_comes_up_with_these/,32200,252,r/dankmemes
I drew what I remembered from Mewtwo Strikes Back,https://www.reddit.com/r/pokemon/comments/bbmc5b/i_drew_what_i_remembered_from_mewtwo_strikes_back/,32100,625,r/pokemon
IRS commissioner: No rule against releasing Trump's tax returns while under audit,https://www.reddit.com/r/politics/comments/bbn54i/irs_commissioner_no_rule_against_releasing_trumps/,31900,2100,r/politics
Hummingbird accidentally slaps the hell out of a bee with its wing.,https://www.reddit.com/r/BeAmazed/comments/bbqojd/hummingbird_accidentally_slaps_the_hell_out_of_a/,31800,495,r/BeAmazed
Such a generous dude,https://www.reddit.com/r/HistoryMemes/comments/bbl1ci/such_a_generous_dude/,31300,233,r/HistoryMemes
Karma farming starter pack,https://www.reddit.com/r/starterpacks/comments/bbrcwg/karma_farming_starter_pack/,31200,556,r/starterpacks
My Hotel offers a kettle and glasses to use - but has a folder in a drawer with rules. One of them says you have to pay a fine if you use the kettle.,https://www.reddit.com/r/assholedesign/comments/bbk98e/my_hotel_offers_a_kettle_and_glasses_to_use_but/,30900,962,r/assholedesign
I've been fighting cancer since May of 2017. My daughter and I were still able to keep our regular Mario Kart sessions going even when I had a 2 week stay in the hospital after major surgery.,https://www.reddit.com/r/NintendoSwitch/comments/bbo7ui/ive_been_fighting_cancer_since_may_of_2017_my/,30700,499,r/NintendoSwitch
I wish I could make art my full time job,https://www.reddit.com/r/comics/comments/bbjg8y/i_wish_i_could_make_art_my_full_time_job/,30700,393,r/comics
"DHS, FBI say election systems in 50 states were targeted in 2016",https://www.reddit.com/r/politics/comments/bbpgxu/dhs_fbi_say_election_systems_in_50_states_were/,30600,1900,r/politics
8 puzzles cut by an EDM machine hat make a cube.,https://www.reddit.com/r/blackmagicfuckery/comments/bboda8/8_puzzles_cut_by_an_edm_machine_hat_make_a_cube/,30400,489,r/blackmagicfuckery
The first picture ever taken of a black hole was just released,https://www.reddit.com/r/nextfuckinglevel/comments/bbm6tw/the_first_picture_ever_taken_of_a_black_hole_was/,30100,613,r/nextfuckinglevel
Biggest Pet Peeve,https://www.reddit.com/r/PrequelMemes/comments/bbhb8d/biggest_pet_peeve/,30000,314,r/PrequelMemes
"I can't be the only one, right?",https://www.reddit.com/r/PewdiepieSubmissions/comments/bbhpaz/i_cant_be_the_only_one_right/,29700,589,r/PewdiepieSubmissions
I’ve learned enough to know to definitely swipe right,https://www.reddit.com/r/Tinder/comments/bbfmth/ive_learned_enough_to_know_to_definitely_swipe/,29400,294,r/Tinder
So the image of the Black Hole is finally here,https://www.reddit.com/r/pcmasterrace/comments/bblywe/so_the_image_of_the_black_hole_is_finally_here/,29300,387,r/pcmasterrace
"In Finding Nemo, Bruce the shark starts crying when Marlin starts talking about Nemo, saying “I never knew my father”. Male sharks mate with the female then leave, so baby sharks never actually meet their father.",https://www.reddit.com/r/MovieDetails/comments/bbh58g/in_finding_nemo_bruce_the_shark_starts_crying/,29300,242,r/MovieDetails
[Charania] Magic Johnson has stepped down from President of Basketball Ops of the Lakers.,https://www.reddit.com/r/nba/comments/bbfv5z/charania_magic_johnson_has_stepped_down_from/,29000,4200,r/nba
My school joined the anti juul campaign,https://www.reddit.com/r/teenagers/comments/bboe99/my_school_joined_the_anti_juul_campaign/,28900,667,r/teenagers
China Considers Ban On Cryptocurrency Mining Because It's A Stupid Waste Of Energy,https://www.reddit.com/r/technology/comments/bbi5he/china_considers_ban_on_cryptocurrency_mining/,28900,2600,r/technology
She’s not the brightest but we love her.,https://www.reddit.com/r/WhatsWrongWithYourDog/comments/bbodg7/shes_not_the_brightest_but_we_love_her/,28900,283,r/WhatsWrongWithYourDog
🔥 bath time for a lion cub 🔥,https://www.reddit.com/r/NatureIsFuckingLit/comments/bbm235/bath_time_for_a_lion_cub/,28800,117,r/NatureIsFuckingLit
Aqua best girl,https://www.reddit.com/r/teenagers/comments/bbk6ty/aqua_best_girl/,28700,527,r/teenagers
This walrus had the cutest reaction to getting a birthday cake ever,https://www.reddit.com/r/aww/comments/bbnz3v/this_walrus_had_the_cutest_reaction_to_getting_a/,28300,342,r/aww
Correct,https://www.reddit.com/r/dankmemes/comments/bbkjf2/correct/,28300,157,r/dankmemes
"The Lion King isn't ""live action"", do you see any actor's dressed as animals or actual filmed locations?",https://www.reddit.com/r/AdviceAnimals/comments/bbsqez/the_lion_king_isnt_live_action_do_you_see_any/,28200,688,r/AdviceAnimals
[Charania] Dirk Nowitzki says he is indeed retiring. Twenty-one seasons with the Dallas Mavericks. Future Hall of Famer. What a career.,https://www.reddit.com/r/nba/comments/bbhbbx/charania_dirk_nowitzki_says_he_is_indeed_retiring/,28000,1000,r/nba
It was firefox all along,https://www.reddit.com/r/memes/comments/bbmnmy/it_was_firefox_all_along/,27900,197,r/memes
"TLDR should be at the top of a post, not the bottom.",https://www.reddit.com/r/unpopularopinion/comments/bbr3sb/tldr_should_be_at_the_top_of_a_post_not_the_bottom/,27700,540,r/unpopularopinion
"New Zealand Firearms amendment bill passes 119-1 in Parliament, will go into effect by end of week",https://www.reddit.com/r/news/comments/bbjowx/new_zealand_firearms_amendment_bill_passes_1191/,27600,9300,r/news
Lock your doors,https://www.reddit.com/r/rareinsults/comments/bbmv1g/lock_your_doors/,27500,135,r/rareinsults
Somebody...,https://www.reddit.com/r/dankmemes/comments/bbjxnc/somebody/,27200,1300,r/dankmemes
Your village is being raided by 戲碼為自己,https://www.reddit.com/r/dankmemes/comments/bbjtnr/your_village_is_being_raided_by_戲碼為自己/,27100,273,r/dankmemes
Alexandria Ocasio-Cortez: 'Sec. Nielsen Oversaw One of the Largest-scale Human Rights Violations in Recent History',https://www.reddit.com/r/politics/comments/bbkhz3/alexandria_ocasiocortez_sec_nielsen_oversaw_one/,27000,2800,r/politics
I work at an escape room—here’s the owner’s response to a 1 star review someone left us,https://www.reddit.com/r/quityourbullshit/comments/bbgkwr/i_work_at_an_escape_roomheres_the_owners_response/,27000,430,r/quityourbullshit
Brofist at 100mil,https://www.reddit.com/r/PewdiepieSubmissions/comments/bbjins/brofist_at_100mil/,26900,91,r/PewdiepieSubmissions
Hello there!,https://www.reddit.com/r/PrequelMemes/comments/bbsje8/hello_there/,26700,133,r/PrequelMemes
"""Destroy Reality with Dreams"", Siro Ikuzira, Digital, 2017",https://www.reddit.com/r/Art/comments/bbkxss/destroy_reality_with_dreams_siro_ikuzira_digital/,26600,273,r/Art
"If we were able to look at a black hole from different orientations we would be able to see light even from parts of the accretion disc behind the black hole as they are lensed above and below the shadow region [Credits: L. R. Weih & L. Rezzolla of Goethe University, Frankfurt]",https://www.reddit.com/r/space/comments/bbs1l3/if_we_were_able_to_look_at_a_black_hole_from/,26500,656,r/space
me irl,https://www.reddit.com/r/me_irl/comments/bbgtx5/me_irl/,26400,136,r/me_irl
"Nancy Pelosi: ""I don't trust Barr. I trust Mueller.""",https://www.reddit.com/r/politics/comments/bbql1u/nancy_pelosi_i_dont_trust_barr_i_trust_mueller/,26300,1800,r/politics
This door has great privacy.,https://www.reddit.com/r/CrappyDesign/comments/bbihky/this_door_has_great_privacy/,26100,159,r/CrappyDesign
You stop getting money in birthday cards right around the age you need extra cash the most.,https://www.reddit.com/r/Showerthoughts/comments/bblkr2/you_stop_getting_money_in_birthday_cards_right/,25200,313,r/Showerthoughts
It took so many tries,https://www.reddit.com/r/PrequelMemes/comments/bbkqmx/it_took_so_many_tries/,25000,295,r/PrequelMemes
What scientists predicted the black hole would look like vs how it actually looks,https://www.reddit.com/r/ExpectationVsReality/comments/bbo2sx/what_scientists_predicted_the_black_hole_would/,25400,731,r/ExpectationVsReality
"Treasury denies Democrats’ request to hand over Trump’s tax returns by the end of Wednesday, says it will confer with Justice",https://www.reddit.com/r/politics/comments/bbslij/treasury_denies_democrats_request_to_hand_over/,24300,2600,r/politics
"Christian the Lion reunited with his former keepers, who believed he might not remember them, after being reintegrated into the wild",https://www.reddit.com/r/likeus/comments/bblmbv/christian_the_lion_reunited_with_his_former/,25300,273,r/likeus
"Tigger is my friend, I love Winnie the Pooh",https://www.reddit.com/r/boottoobig/comments/bbixou/tigger_is_my_friend_i_love_winnie_the_pooh/,24000,164,r/boottoobig
This is the buff Gibby Needed,https://www.reddit.com/r/apexlegends/comments/bbhsdv/this_is_the_buff_gibby_needed/,23900,485,r/apexlegends
Me irl,https://www.reddit.com/r/me_irl/comments/bbt56z/me_irl/,23900,159,r/me_irl
Which book is considered a literary masterpiece but you didn’t like it at all?,https://www.reddit.com/r/AskReddit/comments/bbkzy2/which_book_is_considered_a_literary_masterpiece/,23800,21600,r/AskReddit
hmmm,https://www.reddit.com/r/hmmm/comments/bbkrs0/hmmm/,23700,267,r/hmmm
[MEME] The strongest relationships are protected by Gortex,https://www.reddit.com/r/streetwear/comments/bbm0s4/meme_the_strongest_relationships_are_protected_by/,25400,199,r/streetwear
Unsuspecting Hummingbird mutilated by Praying Mantis,https://www.reddit.com/r/natureismetal/comments/bboxna/unsuspecting_hummingbird_mutilated_by_praying/,23600,584,r/natureismetal
🔥 Rare look at a 14-meter giant squid. One of two sightings that have happened in the past decade 🔥,https://www.reddit.com/r/NatureIsFuckingLit/comments/bbia4o/rare_look_at_a_14meter_giant_squid_one_of_two/,23100,607,r/NatureIsFuckingLit
The mods here talking to the guys they’ve just banned.,https://www.reddit.com/r/HighQualityGifs/comments/bbknyo/the_mods_here_talking_to_the_guys_theyve_just/,22800,367,r/HighQualityGifs
I made a character safety chart for Endgame,https://www.reddit.com/r/marvelstudios/comments/bbir53/i_made_a_character_safety_chart_for_endgame/,22800,1700,r/marvelstudios
My friend asked me how to stylize his website,https://www.reddit.com/r/ProgrammerHumor/comments/bbj8sn/my_friend_asked_me_how_to_stylize_his_website/,22700,406,r/ProgrammerHumor
Black hole,https://www.reddit.com/r/freefolk/comments/bbs9nw/black_hole/,22600,152,r/freefolk
Just another day in neighbourhood,https://www.reddit.com/r/gaming/comments/bbk8x0/just_another_day_in_neighbourhood/,22200,1500,r/gaming
You get it,https://www.reddit.com/r/PewdiepieSubmissions/comments/bbq6fy/you_get_it/,21600,130,r/PewdiepieSubmissions
First image of a black hole has been revealed! 4K image on the right,https://www.reddit.com/r/lotrmemes/comments/bbm1fq/first_image_of_a_black_hole_has_been_revealed_4k/,21500,146,r/lotrmemes
