Title,Title Link,Score,Num Comments,Subreddit
I like to design ridiculous & fake products. The Cuisine Curtain is perfect for any conscious eater in public who just can’t chew with their mouth closed.,https://www.reddit.com/r/funny/comments/bihtqb/i_like_to_design_ridiculous_fake_products_the/,84800,1600,r/funny
"The Netflix show ""13 Reasons Why"" was associated with a 28.9% increase in suicide rates among U.S. youth ages 10-17 in the month (April 2017) following the shows release, after accounting for ongoing trends in suicide rates, according to a study.",https://www.reddit.com/r/science/comments/bisiq5/the_netflix_show_13_reasons_why_was_associated/,83600,4600,r/science
Terry likes to dance,https://www.reddit.com/r/gifs/comments/bisv79/terry_likes_to_dance/,73800,1200,r/gifs
[Image] Pressure?,https://www.reddit.com/r/GetMotivated/comments/bitf67/image_pressure/,72400,1200,r/GetMotivated
Someone is not happy about the weather we are having,https://www.reddit.com/r/funny/comments/bimowg/someone_is_not_happy_about_the_weather_we_are/,66900,394,r/funny
I dropped my watch and the numbers fell off,https://www.reddit.com/r/mildlyinteresting/comments/binoit/i_dropped_my_watch_and_the_numbers_fell_off/,65800,1600,r/mildlyinteresting
Just a couple of guys being dudes,https://www.reddit.com/r/wholesomememes/comments/binm0h/just_a_couple_of_guys_being_dudes/,65800,464,r/wholesomememes
Somebody Stop Me!,https://www.reddit.com/r/funny/comments/bim847/somebody_stop_me/,65600,773,r/funny
"Found this little chunk on the side of the road today. I fell in love with her immediately. Yes, her name is Beef",https://www.reddit.com/r/aww/comments/bijd9n/found_this_little_chunk_on_the_side_of_the_road/,64700,1000,r/aww
An eerie underwater cave death warning sign.,https://www.reddit.com/r/creepy/comments/bihzev/an_eerie_underwater_cave_death_warning_sign/,68100,2400,r/creepy
oh no,https://www.reddit.com/r/dankmemes/comments/biqoa5/oh_no/,63200,224,r/dankmemes
Dear god,https://www.reddit.com/r/memes/comments/bio2cg/dear_god/,62300,390,r/memes
Someone's a little tired,https://www.reddit.com/r/aww/comments/biwkwy/someones_a_little_tired/,62100,335,r/aww
When the family photo doesn't come out quite right but it's still cute.,https://www.reddit.com/r/aww/comments/bipbae/when_the_family_photo_doesnt_come_out_quite_right/,61600,315,r/aww
TIL Bill Haast began extracting snake venom at 15 years old. He founded the Miami Serpentarium and injected himself with venom for 60+ years. His blood was used to save 21 snakebite victims. He created a venom serum to cure polio. He was bitten over 170 times and lived to be 100.,https://www.reddit.com/r/todayilearned/comments/biqbwi/til_bill_haast_began_extracting_snake_venom_at_15/,59900,959,r/todayilearned
What felt like a useless piece of advice until you actually tried it?,https://www.reddit.com/r/AskReddit/comments/biviq2/what_felt_like_a_useless_piece_of_advice_until/,59700,20000,r/AskReddit
Welcome to Catan. [OC],https://www.reddit.com/r/gaming/comments/bipiep/welcome_to_catan_oc/,59300,1200,r/gaming
This pink and yellow moth I found outside my front door recently.,https://www.reddit.com/r/mildlyinteresting/comments/bisqs0/this_pink_and_yellow_moth_i_found_outside_my/,55700,1000,r/mildlyinteresting
THERE IT IS,https://www.reddit.com/r/PewdiepieSubmissions/comments/birlbk/there_it_is/,55700,992,r/PewdiepieSubmissions
Why you gotta do me like that?,https://www.reddit.com/r/BikiniBottomTwitter/comments/binvkg/why_you_gotta_do_me_like_that/,54000,256,r/BikiniBottomTwitter
"[Spoilers] His watch has ended, May he rest, the most loyal Soldier.",https://www.reddit.com/r/gameofthrones/comments/bipxts/spoilers_his_watch_has_ended_may_he_rest_the_most/,55600,1400,r/gameofthrones
based on a true story,https://www.reddit.com/r/teenagers/comments/bit9mm/based_on_a_true_story/,53700,275,r/teenagers
fences...,https://www.reddit.com/r/aww/comments/biinoe/fences/,52600,262,r/aww
In Star Wars: Attack of the Clones (2002) the battle droids and clones resemble their makers.,https://www.reddit.com/r/MovieDetails/comments/biqc0i/in_star_wars_attack_of_the_clones_2002_the_battle/,52600,662,r/MovieDetails
There's a $87 dollar difference between searching for a flight on my iPad and computer for the same flight. $269 on the computer and $182 on iPad.,https://www.reddit.com/r/assholedesign/comments/biv08q/theres_a_87_dollar_difference_between_searching/,52500,1400,r/assholedesign
NO SPOILERS,https://www.reddit.com/r/funny/comments/bis5s0/no_spoilers/,51100,1100,r/funny
Workin retail,https://www.reddit.com/r/trippinthroughtime/comments/bimsg4/workin_retail/,52200,860,r/trippinthroughtime
[SPOILERS] Was anybody else blown away by this scene.,https://www.reddit.com/r/gameofthrones/comments/bijjog/spoilers_was_anybody_else_blown_away_by_this_scene/,50900,2300,r/gameofthrones
"Her meowsterpiece is finally here! Reddit, I present Beatrix with a Purrl Earring",https://www.reddit.com/r/aww/comments/biu30z/her_meowsterpiece_is_finally_here_reddit_i/,49800,406,r/aww
Absolutely massive alligator making its way through the undergrowth,https://www.reddit.com/r/natureismetal/comments/bii8a9/absolutely_massive_alligator_making_its_way/,49700,1500,r/natureismetal
Why u do dis!?,https://www.reddit.com/r/WatchPeopleDieInside/comments/bitywc/why_u_do_dis/,48400,312,r/WatchPeopleDieInside
Thanks i hate anime now,https://www.reddit.com/r/TIHI/comments/biowhq/thanks_i_hate_anime_now/,48700,345,r/TIHI
#ThankYouPewdiepie,https://www.reddit.com/r/PewdiepieSubmissions/comments/bijtbs/thankyoupewdiepie/,46600,184,r/PewdiepieSubmissions
The Kingslayer Club!,https://www.reddit.com/r/freefolk/comments/bio2tf/the_kingslayer_club/,46300,1100,r/freefolk
*SPOILER* One of my favourite scenes,https://www.reddit.com/r/marvelstudios/comments/biudm6/spoiler_one_of_my_favourite_scenes/,46400,1500,r/marvelstudios
Here they stood. The end of one of the greatest houses.,https://www.reddit.com/r/freefolk/comments/bij93g/here_they_stood_the_end_of_one_of_the_greatest/,45800,1900,r/freefolk
"LPT: If you want to offer a deep and memorable compliment, ask someone how they did something. It gives them the opportunity to tell their story, and shows your genuine interest.",https://www.reddit.com/r/LifeProTips/comments/biofcx/lpt_if_you_want_to_offer_a_deep_and_memorable/,44600,492,r/LifeProTips
The cleanest of knife switches,https://www.reddit.com/r/oddlysatisfying/comments/bitsko/the_cleanest_of_knife_switches/,44500,986,r/oddlysatisfying
🔥 Female cheetah looking happy as can be 🔥,https://www.reddit.com/r/NatureIsFuckingLit/comments/binbth/female_cheetah_looking_happy_as_can_be/,44500,396,r/NatureIsFuckingLit
This guy is going to make the flight much more enjoyable! He’s so happy to fly.,https://www.reddit.com/r/aww/comments/binxlt/this_guy_is_going_to_make_the_flight_much_more/,44000,450,r/aww
Everyone saying Bran didn't help smh,https://www.reddit.com/r/freefolk/comments/birtb4/everyone_saying_bran_didnt_help_smh/,44100,531,r/freefolk
True story,https://www.reddit.com/r/dankmemes/comments/bikmus/true_story/,43700,187,r/dankmemes
This extremely clean knife flip,https://www.reddit.com/r/Damnthatsinteresting/comments/bitufp/this_extremely_clean_knife_flip/,43400,1000,r/Damnthatsinteresting
She wants it.,https://www.reddit.com/r/Unexpected/comments/bip070/she_wants_it/,43100,395,r/Unexpected
Relationships!,https://www.reddit.com/r/WhitePeopleTwitter/comments/biq1bf/relationships/,43000,258,r/WhitePeopleTwitter
"My brother was injured during the Special Olympics and couldn’t compete. In the picture, is a Special Olympics medal from Friday’s competition. One of these young men won the medal, and chose to give it to my brother as an act of friendship and support.",https://www.reddit.com/r/HumansBeingBros/comments/biqt1l/my_brother_was_injured_during_the_special/,42300,298,r/HumansBeingBros
"There is a whole family of foxes living in our back garden, it's great just sitting here and watching them playfight.",https://www.reddit.com/r/aww/comments/bisoyw/there_is_a_whole_family_of_foxes_living_in_our/,42000,354,r/aww
Marine experts in Norway believe they have stumbled upon a white whale that was trained by the Russian navy as part of a programme to use underwater mammals as a special ops force.,https://www.reddit.com/r/worldnews/comments/bimc0u/marine_experts_in_norway_believe_they_have/,42000,2100,r/worldnews
My mind is far superior to yours,https://www.reddit.com/r/dankmemes/comments/biphyn/my_mind_is_far_superior_to_yours/,41800,212,r/dankmemes
good question,https://www.reddit.com/r/dankmemes/comments/biuu26/good_question/,41800,125,r/dankmemes
"Bill Haast, “The Snake Man”",https://www.reddit.com/r/Damnthatsinteresting/comments/bioftl/bill_haast_the_snake_man/,41800,502,r/Damnthatsinteresting
[SPOILERS] Game of Thrones at Burlington Bar.,https://www.reddit.com/r/gameofthrones/comments/bisqgd/spoilers_game_of_thrones_at_burlington_bar/,41800,4600,r/gameofthrones
We've all been turned into gluttons for punishment,https://www.reddit.com/r/freefolk/comments/bisxfp/weve_all_been_turned_into_gluttons_for_punishment/,41400,1600,r/freefolk
The Snow Leopard is brutally camouflaged !!,https://www.reddit.com/r/natureismetal/comments/biq1r9/the_snow_leopard_is_brutally_camouflaged/,42100,883,r/natureismetal
Tier list for the foods of Minecraft,https://www.reddit.com/r/Minecraft/comments/bisbyq/tier_list_for_the_foods_of_minecraft/,41000,1600,r/Minecraft
An octopus in a low tide,https://www.reddit.com/r/BeAmazed/comments/bik1z7/an_octopus_in_a_low_tide/,40900,622,r/BeAmazed
9 out of 10 scientists hate him,https://www.reddit.com/r/HistoryMemes/comments/bitokk/9_out_of_10_scientists_hate_him/,39800,264,r/HistoryMemes
"UPDATE: My friend is about to ask his girlfriend to marry him, but I’m the only one who knows how unfaithful she is. Do I say anything?",https://www.reddit.com/r/relationship_advice/comments/birl13/update_my_friend_is_about_to_ask_his_girlfriend/,38500,1300,r/relationship_advice
TIFU by being young and dumb I guess,https://www.reddit.com/r/tifu/comments/biqnog/tifu_by_being_young_and_dumb_i_guess/,38200,1400,r/tifu
Robert Laugh Intensifies,https://www.reddit.com/r/freefolk/comments/biv3ha/robert_laugh_intensifies/,38100,665,r/freefolk
Today is Chaser’s 15th birthday!,https://www.reddit.com/r/rarepuppers/comments/bivano/today_is_chasers_15th_birthday/,37900,343,r/rarepuppers
me_irl,https://www.reddit.com/r/me_irl/comments/bipab6/me_irl/,37900,162,r/me_irl
Having to delete your text midway through writing it because the reciever send another message is like getting cut off in a conversation.,https://www.reddit.com/r/Showerthoughts/comments/biqash/having_to_delete_your_text_midway_through_writing/,37800,307,r/Showerthoughts
The Kingslayer Club [fixed],https://www.reddit.com/r/freefolk/comments/biprtg/the_kingslayer_club_fixed/,37800,719,r/freefolk
r/2meirl4meirl same breh,https://www.reddit.com/r/2meirl4meirl/comments/bivbcy/r2meirl4meirl_same_breh/,37500,340,r/2meirl4meirl
Maybe not Accurate,https://www.reddit.com/r/dankmemes/comments/bins08/maybe_not_accurate/,37200,228,r/dankmemes
"A new technology could kill 99.9% of the deadly germs in the air. The study suggests that non-thermal plasma – a cool gas made up of electrically charged particles, despite having no overall charge – could inactivate airborne viruses and provide sterile air.",https://www.reddit.com/r/science/comments/bio7an/a_new_technology_could_kill_999_of_the_deadly/,37100,1300,r/science
This gorgeous faceted pendant,https://www.reddit.com/r/blackmagicfuckery/comments/bisa1h/this_gorgeous_faceted_pendant/,37000,438,r/blackmagicfuckery
This man was ressurected 9 times just to save Arya so she could kill night king and save humanity. The real Azor Ahai,https://www.reddit.com/r/freefolk/comments/bijbs3/this_man_was_ressurected_9_times_just_to_save/,37000,2000,r/freefolk
Duality of Musk (Expanded),https://www.reddit.com/r/dankmemes/comments/biojli/duality_of_musk_expanded/,36900,172,r/dankmemes
Just why,https://www.reddit.com/r/mildlyinfuriating/comments/biutrm/just_why/,36200,368,r/mildlyinfuriating
Cool water hole in the rock,https://www.reddit.com/r/nonononoyes/comments/bis3du/cool_water_hole_in_the_rock/,36500,1200,r/nonononoyes
Childhood mysteries,https://www.reddit.com/r/BikiniBottomTwitter/comments/biuz5e/childhood_mysteries/,35900,220,r/BikiniBottomTwitter
[SPOILERS]Made a gif of the final moment for all of you to enjoy,https://www.reddit.com/r/gameofthrones/comments/bike98/spoilersmade_a_gif_of_the_final_moment_for_all_of/,35700,5000,r/gameofthrones
"An Amazonian parrot called Freddy Krueger has made headlines in Brazil after managing to find its way back to the zoo from which it was stolen while recovering from a four-year nightmare that saw it shot in a gun battle, abducted by armed thieves and bitten by a snake.",https://www.reddit.com/r/UpliftingNews/comments/birmye/an_amazonian_parrot_called_freddy_krueger_has/,35500,580,r/UpliftingNews
Burger King will sell Impossible Whoppers nationwide by end of the year,https://www.reddit.com/r/Futurology/comments/bittja/burger_king_will_sell_impossible_whoppers/,35300,2700,r/Futurology
Guy walks down the worst street in Canada and interviews the people he meets,https://www.reddit.com/r/videos/comments/biwa6r/guy_walks_down_the_worst_street_in_canada_and/,35100,2500,r/videos
#ThankYouPewdiepie,https://www.reddit.com/r/PewdiepieSubmissions/comments/bijznt/thankyoupewdiepie/,34900,331,r/PewdiepieSubmissions
God Bless These Men,https://www.reddit.com/r/memes/comments/bit0ic/god_bless_these_men/,34800,269,r/memes
Go reset the router.,https://www.reddit.com/r/pcmasterrace/comments/binyki/go_reset_the_router/,34800,438,r/pcmasterrace
[SPOILERS] Theon Greyjoy showed today that you don’t need balls to be a man.,https://www.reddit.com/r/gameofthrones/comments/bijc9s/spoilers_theon_greyjoy_showed_today_that_you_dont/,35100,1100,r/gameofthrones
Starbucks cup redesign.,https://www.reddit.com/r/Damnthatsinteresting/comments/biwj1y/starbucks_cup_redesign/,34600,332,r/Damnthatsinteresting
Imagine having to wear this for your job,https://www.reddit.com/r/CrappyDesign/comments/bilqf1/imagine_having_to_wear_this_for_your_job/,34400,286,r/CrappyDesign
"RIP Theon, what a wonderfully written character he was, also mad respect to Alfie Allen for great acting skills",https://www.reddit.com/r/freefolk/comments/bij618/rip_theon_what_a_wonderfully_written_character_he/,33800,1700,r/freefolk
#ThankYouPewdiepie,https://www.reddit.com/r/PewdiepieSubmissions/comments/biwjgb/thankyoupewdiepie/,33600,153,r/PewdiepieSubmissions
"R Kelly claims he can't read, says he couldn't properly defend himself in sex abuse case",https://www.reddit.com/r/nottheonion/comments/bip6ix/r_kelly_claims_he_cant_read_says_he_couldnt/,33700,1700,r/nottheonion
"Team of sweats interrupted us as we were building a house. Unfortunately for them, they missed one of us.",https://www.reddit.com/r/FortNiteBR/comments/bitytg/team_of_sweats_interrupted_us_as_we_were_building/,33900,1300,r/FortNiteBR
Mace Windu Helps Anakin Find a Seat,https://www.reddit.com/r/PrequelMemes/comments/biqgkd/mace_windu_helps_anakin_find_a_seat/,33000,327,r/PrequelMemes
"Box Office Week: Avengers: Endgame tops the all time domestic and worldwide opening weekend records set by Avengers: Infinity War, opening to a monumental $350M domestic and $1.2B worldwide. The film is now the 18th highest grossing film of all time after just 3 days.",https://www.reddit.com/r/movies/comments/bihvw7/box_office_week_avengers_endgame_tops_the_all/,32900,3600,r/movies
PsBattle: This girl with a gun,https://www.reddit.com/r/photoshopbattles/comments/biiga5/psbattle_this_girl_with_a_gun/,32700,603,r/photoshopbattles
We were robbed of a great episode,https://www.reddit.com/r/DunderMifflin/comments/bivk50/we_were_robbed_of_a_great_episode/,32600,289,r/DunderMifflin
"Universal Health Care Might Cost You Less Than You Think—We don’t think of the premiums we already pay as taxes, but maybe we should.",https://www.reddit.com/r/politics/comments/binxnq/universal_health_care_might_cost_you_less_than/,32500,4500,r/politics
Why did they charge tho?,https://www.reddit.com/r/freefolk/comments/bij7di/why_did_they_charge_tho/,32400,1200,r/freefolk
Are crossover memes still a thing?,https://www.reddit.com/r/dankmemes/comments/biq5q4/are_crossover_memes_still_a_thing/,32100,129,r/dankmemes
yee haw,https://www.reddit.com/r/comedyheaven/comments/bip9xn/yee_haw/,32100,186,r/comedyheaven
The goodest of friends,https://www.reddit.com/r/rarepuppers/comments/bii5ic/the_goodest_of_friends/,31200,130,r/rarepuppers
Don't spoil it,https://www.reddit.com/r/dankmemes/comments/bio0qi/dont_spoil_it/,31000,304,r/dankmemes
🔥 Big curious moose checking out a wildlife photographer 🔥,https://www.reddit.com/r/NatureIsFuckingLit/comments/biv8nj/big_curious_moose_checking_out_a_wildlife/,30900,495,r/NatureIsFuckingLit
It's not even funny anymore,https://www.reddit.com/r/dankmemes/comments/bis1cu/its_not_even_funny_anymore/,30700,331,r/dankmemes
"Finally, the day has come. The war is over and it is time for peace. #thankyoupewdiepie",https://www.reddit.com/r/PewdiepieSubmissions/comments/bius2b/finally_the_day_has_come_the_war_is_over_and_it/,30600,146,r/PewdiepieSubmissions
What a great colour scheme,https://www.reddit.com/r/CrappyDesign/comments/bisdhk/what_a_great_colour_scheme/,30600,433,r/CrappyDesign
Beautiful: Saying Hello :),https://www.reddit.com/r/gifs/comments/bijifr/beautiful_saying_hello/,30600,382,r/gifs
Man says to his boss “Can we talk? I have a problem.”,https://www.reddit.com/r/Jokes/comments/bihtjm/man_says_to_his_boss_can_we_talk_i_have_a_problem/,30400,257,r/Jokes
The death of a young adult is generally sadder than the death of a child.,https://www.reddit.com/r/unpopularopinion/comments/biqv1u/the_death_of_a_young_adult_is_generally_sadder/,30300,1100,r/unpopularopinion
Just the way he walks is just so adorable.,https://www.reddit.com/r/aww/comments/biisme/just_the_way_he_walks_is_just_so_adorable/,30100,202,r/aww
Ummmmm,https://www.reddit.com/r/Unexpected/comments/biie97/ummmmm/,30000,313,r/Unexpected
This extremely clean knife flip,https://www.reddit.com/r/BetterEveryLoop/comments/bivsan/this_extremely_clean_knife_flip/,29600,464,r/BetterEveryLoop
[spoilers]Just Arya literally high-fiving NK,https://www.reddit.com/r/gameofthrones/comments/biqmx3/spoilersjust_arya_literally_highfiving_nk/,29700,892,r/gameofthrones
No arrows? No problem.,https://www.reddit.com/r/skyrim/comments/bij4vg/no_arrows_no_problem/,31500,483,r/skyrim
Wholesome flirting class,https://www.reddit.com/r/wholesomememes/comments/bire6f/wholesome_flirting_class/,29300,220,r/wholesomememes
I cant even speak,https://www.reddit.com/r/freefolk/comments/bij605/i_cant_even_speak/,29200,1200,r/freefolk
[SPOILERS] He was just resting his eyes,https://www.reddit.com/r/gameofthrones/comments/bikc7y/spoilers_he_was_just_resting_his_eyes/,29600,1300,r/gameofthrones
Arya at the buzzer,https://www.reddit.com/r/freefolk/comments/bij9jv/arya_at_the_buzzer/,29200,360,r/freefolk
#ThankYouPewdiepie,https://www.reddit.com/r/PewdiepieSubmissions/comments/bintqw/thankyoupewdiepie/,29200,145,r/PewdiepieSubmissions
"#ThankYouPewDiePie Smoothed out arrows and got rid of the T. ~ Love, Bryson.",https://www.reddit.com/r/PewdiepieSubmissions/comments/bin8ol/thankyoupewdiepie_smoothed_out_arrows_and_got_rid/,29100,181,r/PewdiepieSubmissions
2meirl4meirl,https://www.reddit.com/r/2meirl4meirl/comments/binwkp/2meirl4meirl/,29100,109,r/2meirl4meirl
[SPOILERS] LONG LIVE MY QUEEN!,https://www.reddit.com/r/gameofthrones/comments/bij3rx/spoilers_long_live_my_queen/,29000,5500,r/gameofthrones
US Deputy Attorney General Rod Rosenstein quits,https://www.reddit.com/r/news/comments/biv777/us_deputy_attorney_general_rod_rosenstein_quits/,28900,1600,r/news
"John Singleton, director of “Boyz N the Hood” has passed away at 51",https://www.reddit.com/r/movies/comments/bitlh1/john_singleton_director_of_boyz_n_the_hood_has/,28900,1100,r/movies
MRW I can browse Reddit again after seeing Endgame but completely forget about Game Of Thrones.,https://www.reddit.com/r/reactiongifs/comments/bijz02/mrw_i_can_browse_reddit_again_after_seeing/,28700,711,r/reactiongifs
[SPOILERS] What an absolutely incredible character arc.,https://www.reddit.com/r/gameofthrones/comments/bir8ge/spoilers_what_an_absolutely_incredible_character/,28600,1000,r/gameofthrones
[SPOILERS] can we get an F in the chat for one of the most underrated characters.,https://www.reddit.com/r/gameofthrones/comments/bijkt9/spoilers_can_we_get_an_f_in_the_chat_for_one_of/,28500,1800,r/gameofthrones
Megathread: Attorney General Rod Rosenstein submits letter of resignation to Trump,https://www.reddit.com/r/politics/comments/bivi15/megathread_attorney_general_rod_rosenstein/,28100,4400,r/politics
Amazon these days,https://www.reddit.com/r/WhitePeopleTwitter/comments/bit405/amazon_these_days/,27900,124,r/WhitePeopleTwitter
At least he's honest,https://www.reddit.com/r/Tinder/comments/biocy0/at_least_hes_honest/,27700,203,r/Tinder
Better than Endgame,https://www.reddit.com/r/freefolk/comments/bij62w/better_than_endgame/,27600,962,r/freefolk
Theon choosing to rush the Night King,https://www.reddit.com/r/freefolk/comments/bij53o/theon_choosing_to_rush_the_night_king/,27500,352,r/freefolk
Last video before they broke up,https://www.reddit.com/r/gifs/comments/biqkhc/last_video_before_they_broke_up/,27400,352,r/gifs
Old School absolute unit,https://www.reddit.com/r/AbsoluteUnits/comments/binzap/old_school_absolute_unit/,27500,461,r/AbsoluteUnits
🔥 Beautiful flower stream 🔥,https://www.reddit.com/r/NatureIsFuckingLit/comments/bitn9o/beautiful_flower_stream/,27300,144,r/NatureIsFuckingLit
Ban on smoking at Disney parks goes into effect this Wednesday,https://www.reddit.com/r/news/comments/bisbzn/ban_on_smoking_at_disney_parks_goes_into_effect/,26800,2600,r/news
The only person that keeps me from commiting suicide,https://www.reddit.com/r/Jokes/comments/bir1b8/the_only_person_that_keeps_me_from_commiting/,26700,375,r/Jokes
Kinda hot tbh,https://www.reddit.com/r/dankmemes/comments/biquc0/kinda_hot_tbh/,26700,282,r/dankmemes
hmmm,https://www.reddit.com/r/hmmm/comments/biuh13/hmmm/,26300,218,r/hmmm
He just could not resist,https://www.reddit.com/r/freefolk/comments/bismra/he_just_could_not_resist/,26200,270,r/freefolk
A literal meme,https://www.reddit.com/r/freefolk/comments/bij5qm/a_literal_meme/,26200,817,r/freefolk
"[SPOILERS] There is only one god, and His name is Death. And there is only one thing we say to Death...",https://www.reddit.com/r/gameofthrones/comments/bij4hq/spoilers_there_is_only_one_god_and_his_name_is/,26200,1800,r/gameofthrones
It’s weird how melted cheese seems so much unhealthier than non-melted cheese,https://www.reddit.com/r/Showerthoughts/comments/biotf8/its_weird_how_melted_cheese_seems_so_much/,26000,624,r/Showerthoughts
Rule 1 of the marathon. Wear nipple tape,https://www.reddit.com/r/HadToHurt/comments/birfo7/rule_1_of_the_marathon_wear_nipple_tape/,26000,836,r/HadToHurt
Growing bunnies in my flower pot this year!,https://www.reddit.com/r/pics/comments/biow8d/growing_bunnies_in_my_flower_pot_this_year/,25900,346,r/pics
inflation 100,https://www.reddit.com/r/dankmemes/comments/biuagu/inflation_100/,25800,179,r/dankmemes
TIL in Finland some children read to dogs and cows because they actually like listening and are extremely attentive.,https://www.reddit.com/r/todayilearned/comments/bisu20/til_in_finland_some_children_read_to_dogs_and/,25800,436,r/todayilearned
Bet you can't do this on console.,https://www.reddit.com/r/pcmasterrace/comments/bithct/bet_you_cant_do_this_on_console/,25800,383,r/pcmasterrace
He was not the only one with the power!,https://www.reddit.com/r/technicallythetruth/comments/bioa5l/he_was_not_the_only_one_with_the_power/,25700,381,r/technicallythetruth
smol cat,https://www.reddit.com/r/Eyebleach/comments/bis3vf/smol_cat/,25400,104,r/Eyebleach
Beautiful work!,https://www.reddit.com/r/gaming/comments/biijr1/beautiful_work/,25100,551,r/gaming
#Thankyoupewdiepie,https://www.reddit.com/r/PewdiepieSubmissions/comments/binoz4/thankyoupewdiepie/,25100,73,r/PewdiepieSubmissions
This is insane,https://www.reddit.com/r/funny/comments/bilfrz/this_is_insane/,25100,339,r/funny
SPOILERS: Behind the scenes on THAT scene!,https://www.reddit.com/r/marvelstudios/comments/bimx40/spoilers_behind_the_scenes_on_that_scene/,25000,1500,r/marvelstudios
Super grainy,https://www.reddit.com/r/freefolk/comments/biinv6/super_grainy/,25000,506,r/freefolk
And they block the hallway,https://www.reddit.com/r/teenagers/comments/biokcq/and_they_block_the_hallway/,25000,194,r/teenagers
And that's a fact,https://www.reddit.com/r/dankmemes/comments/bildyf/and_thats_a_fact/,25000,373,r/dankmemes
Just try to avoid getting fired...,https://www.reddit.com/r/funny/comments/bivzau/just_try_to_avoid_getting_fired/,24900,371,r/funny
Thanks for the help,https://www.reddit.com/r/HumansBeingBros/comments/bika6y/thanks_for_the_help/,24900,110,r/HumansBeingBros
I’m just now realizing that I am not the subject of this photo my mother took of me Wyoming 1984,https://www.reddit.com/r/OldSchoolCool/comments/biqxp7/im_just_now_realizing_that_i_am_not_the_subject/,24800,414,r/OldSchoolCool
Date Night Magic Trick,https://www.reddit.com/r/funny/comments/biokb4/date_night_magic_trick/,24700,539,r/funny
Now that's one way to establish dominance,https://www.reddit.com/r/youseeingthisshit/comments/biq5vj/now_thats_one_way_to_establish_dominance/,24500,174,r/youseeingthisshit
thanks mom,https://www.reddit.com/r/thanosdidnothingwrong/comments/bisugs/thanks_mom/,24500,254,r/thanosdidnothingwrong
Literally a pic of the King slayer,https://www.reddit.com/r/freefolk/comments/bij4ac/literally_a_pic_of_the_king_slayer/,24500,984,r/freefolk
