Title,Title Link,Score,Num Comments,Subreddit
Police pointed revolver towards journalists after kicking a citizen,https://www.reddit.com/r/pics/comments/cv8444/police_pointed_revolver_towards_journalists_after/,107000,4900,r/pics
🎉 100.000.000 SUBSCRIBERS 🎉,https://www.reddit.com/r/PewdiepieSubmissions/comments/cv2l6w/100000000_subscribers/,100000,8400,r/PewdiepieSubmissions
Livin’ on a prayer,https://www.reddit.com/r/dankmemes/comments/cv9imu/livin_on_a_prayer/,97600,598,r/dankmemes
This is a Minecraft build I've been working on for 9 years,https://www.reddit.com/r/gaming/comments/cva4j9/this_is_a_minecraft_build_ive_been_working_on_for/,95400,2200,r/gaming
Price is Right model accidentally gives away a car.,https://www.reddit.com/r/WatchPeopleDieInside/comments/cv2lxy/price_is_right_model_accidentally_gives_away_a_car/,93700,2200,r/WatchPeopleDieInside
Wholesome Act,https://www.reddit.com/r/memes/comments/cv7ufn/wholesome_act/,90000,684,r/memes
This rusty lock gate looking like a painting.,https://www.reddit.com/r/mildlyinteresting/comments/cv7e0l/this_rusty_lock_gate_looking_like_a_painting/,86600,496,r/mildlyinteresting
Hand eye coordination,https://www.reddit.com/r/memes/comments/cvbkpj/hand_eye_coordination/,85500,410,r/memes
No hooman i just need a cuddle,https://www.reddit.com/r/aww/comments/cvftio/no_hooman_i_just_need_a_cuddle/,84700,705,r/aww
Cursed_duck,https://www.reddit.com/r/cursedcomments/comments/cv6zsf/cursed_duck/,82500,540,r/cursedcomments
TIL The US Military still uses 8 inch floppy disks on outdated IBM computers to run the nuclear missile systems. It's because they are incredibly hard to hack. The computers are essentially air-gapped and the old IBM computers are reliable. They could run for another 40 years with spare parts.,https://www.reddit.com/r/todayilearned/comments/cvct9r/til_the_us_military_still_uses_8_inch_floppy/,80100,3500,r/todayilearned
He played that off pretty smoothly,https://www.reddit.com/r/aww/comments/cvav4l/he_played_that_off_pretty_smoothly/,80100,572,r/aww
Ya my bad blind monk,https://www.reddit.com/r/dankmemes/comments/cvd2dc/ya_my_bad_blind_monk/,76200,281,r/dankmemes
Unpaid Kentucky coal miners have been blocking a train track for 3 weeks,https://www.reddit.com/r/news/comments/cv42fe/unpaid_kentucky_coal_miners_have_been_blocking_a/,74100,4300,r/news
🔥 Beluga Whale joined my morning fishtrip 🔥,https://www.reddit.com/r/NatureIsFuckingLit/comments/cv91b3/beluga_whale_joined_my_morning_fishtrip/,74600,800,r/NatureIsFuckingLit
Very cool,https://www.reddit.com/r/dankmemes/comments/cv3054/very_cool/,73600,530,r/dankmemes
what's that?,https://www.reddit.com/r/HistoryMemes/comments/cvddqk/whats_that/,72600,622,r/HistoryMemes
*laughs like Mr Krabs*,https://www.reddit.com/r/dankmemes/comments/cvg9wu/laughs_like_mr_krabs/,69800,254,r/dankmemes
ITS GAMING WEEK,https://www.reddit.com/r/PewdiepieSubmissions/comments/cv740d/its_gaming_week/,67800,294,r/PewdiepieSubmissions
"Oh well, we still have tons of money",https://www.reddit.com/r/BikiniBottomTwitter/comments/cv7h7z/oh_well_we_still_have_tons_of_money/,67100,851,r/BikiniBottomTwitter
Storytime,https://www.reddit.com/r/dankmemes/comments/cv59oq/storytime/,66700,286,r/dankmemes
Literally the entire star wars fan base at the moment,https://www.reddit.com/r/PrequelMemes/comments/cv6e10/literally_the_entire_star_wars_fan_base_at_the/,66600,699,r/PrequelMemes
"It may seem sexist, but it's the truth...for now",https://www.reddit.com/r/technicallythetruth/comments/cv8elh/it_may_seem_sexist_but_its_the_truthfor_now/,67100,943,r/technicallythetruth
SoCiAl AnXiEtY,https://www.reddit.com/r/memes/comments/cv2qdj/social_anxiety/,65400,299,r/memes
You can’t hide from me,https://www.reddit.com/r/funny/comments/cv6d27/you_cant_hide_from_me/,63700,1100,r/funny
Man vs nature,https://www.reddit.com/r/gifs/comments/cvc990/man_vs_nature/,62600,353,r/gifs
Just throw the whole child away at this point!,https://www.reddit.com/r/Wellthatsucks/comments/cve62w/just_throw_the_whole_child_away_at_this_point/,62400,2900,r/Wellthatsucks
Fixed this meme,https://www.reddit.com/r/dankmemes/comments/cv6c1w/fixed_this_meme/,61700,298,r/dankmemes
Hula hooping.,https://www.reddit.com/r/nextfuckinglevel/comments/cv6er0/hula_hooping/,60700,1000,r/nextfuckinglevel
It's annoying when we walk through the same morning spider webs over and over again because it gets on us. But from the spiders point of view it must be devastating to have a 60 story tall Titan walkthrough your home destroying your livelihood and then try to kill you out of rage on a daily basis.,https://www.reddit.com/r/Showerthoughts/comments/cv4jrz/its_annoying_when_we_walk_through_the_same/,60500,893,r/Showerthoughts
"TIL that famous jazz pianist Fats Waller was kidnapped by gangsters for three days in Chicago in 1926. He was the ""surprise guest"" at Al Capone's birthday party. He was later found very drunk, extremely tired, and had earned thousands of dollars in cash from Capone and other party-goers as tips.",https://www.reddit.com/r/todayilearned/comments/cv97vj/til_that_famous_jazz_pianist_fats_waller_was/,59600,772,r/todayilearned
Public opinion of same-sex relations in the United States [OC],https://www.reddit.com/r/dataisbeautiful/comments/cvdhog/public_opinion_of_samesex_relations_in_the_united/,59600,3800,r/dataisbeautiful
"Every Wednesday the East Providence RI police department turn on their car lights for the children's hospital, and the children flash their lights back. It's tradition to let the children know that someone is thinking of them while they are sick",https://www.reddit.com/r/gifs/comments/cvfyvt/every_wednesday_the_east_providence_ri_police/,58300,820,r/gifs
Whale I drive a goldfish,https://www.reddit.com/r/funny/comments/cv1xpr/whale_i_drive_a_goldfish/,57900,368,r/funny
They miss so much excitement now,https://www.reddit.com/r/WhitePeopleTwitter/comments/cvd1p4/they_miss_so_much_excitement_now/,57800,567,r/WhitePeopleTwitter
2meirl4meirl,https://www.reddit.com/r/2meirl4meirl/comments/cv571l/2meirl4meirl/,59000,925,r/2meirl4meirl
Great Example of the lesser known State Insult,https://www.reddit.com/r/rareinsults/comments/cv659s/great_example_of_the_lesser_known_state_insult/,57800,663,r/rareinsults
"TIL Spain’s S-80 submarine program designed subs that were 70 tonnes too heavy, and likely sink when submerged. Cost overruns to fix it are expected to reach $9 billion. The problem was traced back to an engineer misplacing a decimal point, and had been called the most expensive math error ever.",https://www.reddit.com/r/todayilearned/comments/cv7kw7/til_spains_s80_submarine_program_designed_subs/,57200,1500,r/todayilearned
Must feel really good to be Felix,https://www.reddit.com/r/PewdiepieSubmissions/comments/cv2amq/must_feel_really_good_to_be_felix/,56000,104,r/PewdiepieSubmissions
Why does Joker from Mortal Kombat look like he's aboutta tell me he's the android sent by cyberlife,https://www.reddit.com/r/gaming/comments/cv78pm/why_does_joker_from_mortal_kombat_look_like_hes/,55500,945,r/gaming
Wholesome computer memes,https://www.reddit.com/r/pcmasterrace/comments/cva2zh/wholesome_computer_memes/,55000,373,r/pcmasterrace
Hong Kong Police stand and do nothing as mob with metal pipes and China flags runs to attack protesters,https://www.reddit.com/r/gifs/comments/cv8utu/hong_kong_police_stand_and_do_nothing_as_mob_with/,54900,2100,r/gifs
he acts like their his own,https://www.reddit.com/r/aww/comments/cv52ew/he_acts_like_their_his_own/,54700,719,r/aww
What are some things you’d only know by growing up poor?,https://www.reddit.com/r/AskReddit/comments/cv6tjh/what_are_some_things_youd_only_know_by_growing_up/,54400,19000,r/AskReddit
He's in the mail box! (Credit: Hakim),https://www.reddit.com/r/BikiniBottomTwitter/comments/cv1kyk/hes_in_the_mail_box_credit_hakim/,53700,250,r/BikiniBottomTwitter
He got us all,https://www.reddit.com/r/PewdiepieSubmissions/comments/cvg090/he_got_us_all/,53700,184,r/PewdiepieSubmissions
Trump officials voice anger at G7 focus on 'niche' issues such as climate change,https://www.reddit.com/r/worldnews/comments/cv3tjl/trump_officials_voice_anger_at_g7_focus_on_niche/,53200,3700,r/worldnews
Why the hell are the ads in HD then?,https://www.reddit.com/r/BikiniBottomTwitter/comments/cvdfkf/why_the_hell_are_the_ads_in_hd_then/,53000,229,r/BikiniBottomTwitter
Real Italian crystal vs fake,https://www.reddit.com/r/Unexpected/comments/cve0no/real_italian_crystal_vs_fake/,52900,449,r/Unexpected
Grandfather dies inside as he sees his granddaughter shot liquor like it's nothing,https://www.reddit.com/r/WatchPeopleDieInside/comments/cvbyku/grandfather_dies_inside_as_he_sees_his/,52600,685,r/WatchPeopleDieInside
My first IdiotsInCars submission. I think it belongs here.,https://www.reddit.com/r/IdiotsInCars/comments/cvdrbo/my_first_idiotsincars_submission_i_think_it/,52300,910,r/IdiotsInCars
she’s first time howling!!,https://www.reddit.com/r/aww/comments/cv7d87/shes_first_time_howling/,50500,369,r/aww
"Meet Aiko, the runt if her litter. She was crying until he started doing this. We think it felt like mama licks!",https://www.reddit.com/r/aww/comments/cv1km0/meet_aiko_the_runt_if_her_litter_she_was_crying/,50400,492,r/aww
National Suicide Prevention Hotline is Getting Its Own 3-Digit Number in the US (988) - A quick & easy Number to remember for help like 911.,https://www.reddit.com/r/UpliftingNews/comments/cv3kdc/national_suicide_prevention_hotline_is_getting/,50300,991,r/UpliftingNews
Blursed White Women,https://www.reddit.com/r/blursedimages/comments/cvbwou/blursed_white_women/,49500,194,r/blursedimages
"Pope Francis pledges $50M to end the Amazon wildfires. Nah just kidding, he just wants people to pray.",https://www.reddit.com/r/atheism/comments/cv8kg2/pope_francis_pledges_50m_to_end_the_amazon/,49400,1000,r/atheism
🌇🚫🇬🇧,https://www.reddit.com/r/HistoryMemes/comments/cv7j0k/_/,49100,295,r/HistoryMemes
He is inevitable.,https://www.reddit.com/r/PewdiepieSubmissions/comments/cv8316/he_is_inevitable/,49000,330,r/PewdiepieSubmissions
Just imagine,https://www.reddit.com/r/wholesomememes/comments/cv70yk/just_imagine/,48400,334,r/wholesomememes
"Trump will be blamed for a global recession if he continues his trade war with China, says Boris Johnson",https://www.reddit.com/r/worldnews/comments/cv6vb6/trump_will_be_blamed_for_a_global_recession_if_he/,48300,3400,r/worldnews
"they had us in the first half, not gonna lie",https://www.reddit.com/r/PewdiepieSubmissions/comments/cv8c4j/they_had_us_in_the_first_half_not_gonna_lie/,47800,225,r/PewdiepieSubmissions
We did it gamers.👊,https://www.reddit.com/r/PewdiepieSubmissions/comments/cv2j4o/we_did_it_gamers/,47400,200,r/PewdiepieSubmissions
This is so cuuutteeee!!,https://www.reddit.com/r/PewdiepieSubmissions/comments/cv4gvc/this_is_so_cuuutteeee/,46700,330,r/PewdiepieSubmissions
Made our 1 year wedding anniversary picture!,https://www.reddit.com/r/funny/comments/cvdxbb/made_our_1_year_wedding_anniversary_picture/,46200,904,r/funny
What has NOT aged well?,https://www.reddit.com/r/AskReddit/comments/cv9stg/what_has_not_aged_well/,46200,20800,r/AskReddit
This... does bring a smile to my face,https://www.reddit.com/r/PewdiepieSubmissions/comments/cv610u/this_does_bring_a_smile_to_my_face/,45800,529,r/PewdiepieSubmissions
The size of this Stellar’s Sea Eagle,https://www.reddit.com/r/Damnthatsinteresting/comments/cvcvpi/the_size_of_this_stellars_sea_eagle/,45700,616,r/Damnthatsinteresting
👍,https://www.reddit.com/r/PewdiepieSubmissions/comments/cv6g8b/_/,45500,87,r/PewdiepieSubmissions
"This is wrong, we shouldn't be here",https://www.reddit.com/r/StrangerThings/comments/cv2lm1/this_is_wrong_we_shouldnt_be_here/,50000,250,r/StrangerThings
Maybe maybe maybe,https://www.reddit.com/r/maybemaybemaybe/comments/cv731w/maybe_maybe_maybe/,45400,272,r/maybemaybemaybe
"I'm sorry, little one",https://www.reddit.com/r/memes/comments/cv39iz/im_sorry_little_one/,44900,147,r/memes
Guess how old my son is,https://www.reddit.com/r/mildlyinfuriating/comments/cvclq8/guess_how_old_my_son_is/,44700,1600,r/mildlyinfuriating
"Aldrin snapped this shot in of a teary-eyed Armstrong moments after he returned to the spacecraft and removed his helmet, 1969.",https://www.reddit.com/r/space/comments/cvbxp1/aldrin_snapped_this_shot_in_of_a_tearyeyed/,44600,769,r/space
u/dst8617 is the smart kind of lad,https://www.reddit.com/r/madlads/comments/cva6o0/udst8617_is_the_smart_kind_of_lad/,44300,441,r/madlads
I was crying,https://www.reddit.com/r/PewdiepieSubmissions/comments/cvc27p/i_was_crying/,44200,210,r/PewdiepieSubmissions
Give that man a medal.,https://www.reddit.com/r/WhitePeopleTwitter/comments/cv29iu/give_that_man_a_medal/,43800,1500,r/WhitePeopleTwitter
Just prepare yourselves...,https://www.reddit.com/r/PewdiepieSubmissions/comments/cv28qy/just_prepare_yourselves/,43700,163,r/PewdiepieSubmissions
Party like a Russian,https://www.reddit.com/r/ANormalDayInRussia/comments/cv6yo4/party_like_a_russian/,45100,1800,r/ANormalDayInRussia
Scream,https://www.reddit.com/r/funny/comments/cvegtw/scream/,43600,335,r/funny
How mirrors are made,https://www.reddit.com/r/oddlysatisfying/comments/cvfy6g/how_mirrors_are_made/,43500,634,r/oddlysatisfying
These lovely pancakes,https://www.reddit.com/r/oddlysatisfying/comments/cv98n7/these_lovely_pancakes/,43300,524,r/oddlysatisfying
Worrying about [OC],https://www.reddit.com/r/comics/comments/cv8mwz/worrying_about_oc/,43000,411,r/comics
"""You can't do this to me""",https://www.reddit.com/r/raimimemes/comments/cv7g6n/you_cant_do_this_to_me/,46600,1100,r/raimimemes
Police: Connecticut Man Tests His New Guns By Firing Into Park Full Of Kids Playing Softball,https://www.reddit.com/r/nottheonion/comments/cvbljd/police_connecticut_man_tests_his_new_guns_by/,42700,3600,r/nottheonion
Great exposition,https://www.reddit.com/r/WhitePeopleTwitter/comments/cv8git/great_exposition/,42300,340,r/WhitePeopleTwitter
The first time,https://www.reddit.com/r/dankmemes/comments/cv65tj/the_first_time/,42200,113,r/dankmemes
Woah,https://www.reddit.com/r/dankmemes/comments/cv832p/woah/,42100,199,r/dankmemes
"Thank You Youtube, Verrrrrrrry Cool",https://www.reddit.com/r/PewdiepieSubmissions/comments/cv2rfs/thank_you_youtube_verrrrrrrry_cool/,42000,440,r/PewdiepieSubmissions
What’s happening to me!?,https://www.reddit.com/r/dankmemes/comments/cv98it/whats_happening_to_me/,41900,102,r/dankmemes
there's a beE?!?!!?,https://www.reddit.com/r/dankmemes/comments/cv734x/theres_a_bee/,41800,325,r/dankmemes
Twenty years ago I emailed makeup artist and horror movie icon Tom Savini to tell him that the monster he created for a 1984 episode of Tales from the Darkside had profoundly haunted my childhood. He replied with these photos of him creating it to assure my 7 year old inner self that it wasn’t real.,https://www.reddit.com/r/Damnthatsinteresting/comments/cv8fb4/twenty_years_ago_i_emailed_makeup_artist_and/,41700,470,r/Damnthatsinteresting
"In the credits for THE HOBBIT: THE BATTLE OF THE FIVE ARMIES, Martin Freeman's credit shows him holding an acorn, but the reference for the drawing is actually a picture of Martin Freeman holding a Lego of himself.",https://www.reddit.com/r/MovieDetails/comments/cv2ski/in_the_credits_for_the_hobbit_the_battle_of_the/,41800,289,r/MovieDetails
That's some terrible drainage for a bridge,https://www.reddit.com/r/CrappyDesign/comments/cv2qnr/thats_some_terrible_drainage_for_a_bridge/,41500,406,r/CrappyDesign
Let's hit it with everything we got!,https://www.reddit.com/r/PewdiepieSubmissions/comments/cvg0y4/lets_hit_it_with_everything_we_got/,41200,399,r/PewdiepieSubmissions
Maybe this would stop my kids from grabbing my phone.,https://www.reddit.com/r/blackmagicfuckery/comments/cveatq/maybe_this_would_stop_my_kids_from_grabbing_my/,41000,743,r/blackmagicfuckery
"Faces are hard, Me, Watercolor Pencils, 2019",https://www.reddit.com/r/Art/comments/cvb1vr/faces_are_hard_me_watercolor_pencils_2019/,41100,286,r/Art
I made a fluffy 3D model of the bee!,https://www.reddit.com/r/Minecraft/comments/cv5bmr/i_made_a_fluffy_3d_model_of_the_bee/,40400,459,r/Minecraft
Facts...,https://www.reddit.com/r/dankmemes/comments/cvb1dt/facts/,40100,339,r/dankmemes
This innovative door in my apartment,https://www.reddit.com/r/funny/comments/cv6xh8/this_innovative_door_in_my_apartment/,40000,408,r/funny
This is how you fit a cube through a copy of itself,https://www.reddit.com/r/educationalgifs/comments/cv7o4g/this_is_how_you_fit_a_cube_through_a_copy_of/,40300,733,r/educationalgifs
As Promised,https://www.reddit.com/r/PewdiepieSubmissions/comments/cv3ei3/as_promised/,39900,138,r/PewdiepieSubmissions
This kid can dance!,https://www.reddit.com/r/toptalent/comments/cv1h3z/this_kid_can_dance/,39900,762,r/toptalent
Smiling for the camera,https://www.reddit.com/r/Unexpected/comments/cv3na7/smiling_for_the_camera/,39600,262,r/Unexpected
"Several months ago my Dad said he didn’t want a dog, this is him now :)",https://www.reddit.com/r/aww/comments/cv9s9b/several_months_ago_my_dad_said_he_didnt_want_a/,39400,459,r/aww
"Lmao, he's not even awake yet",https://www.reddit.com/r/PewdiepieSubmissions/comments/cv4suz/lmao_hes_not_even_awake_yet/,39400,250,r/PewdiepieSubmissions
Cheer up,https://www.reddit.com/r/trippinthroughtime/comments/cv995s/cheer_up/,39400,132,r/trippinthroughtime
Tree-planting search engine saw a 1150% increase in downloads after the Amazon rainforest fires: It uses 80% of its profits from search ads to plant millions of trees in Brazil and other emerging economies - says it has planted 65 million trees to date.,https://www.reddit.com/r/worldnews/comments/cv7lv7/treeplanting_search_engine_saw_a_1150_increase_in/,38200,836,r/worldnews
Two Los Angeles Pharmacy Owners Found Guilty in Multimillion-Dollar Health Care Fraud and Money Laundering Scheme,https://www.reddit.com/r/news/comments/cv9iga/two_los_angeles_pharmacy_owners_found_guilty_in/,37900,843,r/news
Ew,https://www.reddit.com/r/PewdiepieSubmissions/comments/cv76u6/ew/,37700,225,r/PewdiepieSubmissions
Real reward,https://www.reddit.com/r/PewdiepieSubmissions/comments/cv58bd/real_reward/,37700,160,r/PewdiepieSubmissions
Thor is the lucky one,https://www.reddit.com/r/thanosdidnothingwrong/comments/cvbfvr/thor_is_the_lucky_one/,37800,657,r/thanosdidnothingwrong
"By December 31st, All teenagers will belong to the 21st century. F to all our 1999 comrades.",https://www.reddit.com/r/teenagers/comments/cv7o5j/by_december_31st_all_teenagers_will_belong_to_the/,37500,1300,r/teenagers
your friends who get married after high school - Gus Johnson,https://www.reddit.com/r/videos/comments/cv9b24/your_friends_who_get_married_after_high_school/,37300,1900,r/videos
This is not ok. How are we only winning by 2%?,https://www.reddit.com/r/PrequelMemes/comments/cva4j3/this_is_not_ok_how_are_we_only_winning_by_2/,37200,434,r/PrequelMemes
Congrats on 100 mil bro bro,https://www.reddit.com/r/PewdiepieSubmissions/comments/cvdkog/congrats_on_100_mil_bro_bro/,37100,138,r/PewdiepieSubmissions
one of the most satisfying things,https://www.reddit.com/r/memes/comments/cve9pa/one_of_the_most_satisfying_things/,37100,124,r/memes
2meirl4meirl,https://www.reddit.com/r/2meirl4meirl/comments/cv9rkg/2meirl4meirl/,36900,253,r/2meirl4meirl
Amazing job!,https://www.reddit.com/r/PewdiepieSubmissions/comments/cvdge1/amazing_job/,36700,120,r/PewdiepieSubmissions
Me_irl,https://www.reddit.com/r/me_irl/comments/cv8hne/me_irl/,36700,261,r/me_irl
We did it 9 year olds,https://www.reddit.com/r/PewdiepieSubmissions/comments/cv40o8/we_did_it_9_year_olds/,36400,72,r/PewdiepieSubmissions
"What’s something you absolutely have to buy name brand, generic can’t compare?",https://www.reddit.com/r/AskReddit/comments/cv1x23/whats_something_you_absolutely_have_to_buy_name/,36400,19300,r/AskReddit
We did it,https://www.reddit.com/r/memes/comments/cvcfw0/we_did_it/,36300,94,r/memes
cursed_squeak,https://www.reddit.com/r/cursedcomments/comments/cvd3a1/cursed_squeak/,36200,180,r/cursedcomments
WandaVision D23 poster,https://www.reddit.com/r/marvelstudios/comments/cvdp85/wandavision_d23_poster/,36000,1400,r/marvelstudios
"Lord Gaben, emptier of wallets",https://www.reddit.com/r/Bossfight/comments/cv6rbm/lord_gaben_emptier_of_wallets/,36600,273,r/Bossfight
What an insane week,https://www.reddit.com/r/PewdiepieSubmissions/comments/cv7asn/what_an_insane_week/,35700,94,r/PewdiepieSubmissions
Welcome Mark,https://www.reddit.com/r/freefolk/comments/cv3jli/welcome_mark/,35400,530,r/freefolk
"I’m sorry Caillou, your cancer is terminal",https://www.reddit.com/r/imsorryjon/comments/cv9hkz/im_sorry_caillou_your_cancer_is_terminal/,35500,509,r/imsorryjon
Absolutely adorable chinchilla,https://www.reddit.com/r/Eyebleach/comments/cvf701/absolutely_adorable_chinchilla/,35300,226,r/Eyebleach
"Cheddar was adopted as an old boy (8), and so his favorite humans (besides his owners) are his elderly neighbors",https://www.reddit.com/r/rarepuppers/comments/cvcw7s/cheddar_was_adopted_as_an_old_boy_8_and_so_his/,35200,208,r/rarepuppers
What's really outdated yet still widely used?,https://www.reddit.com/r/AskReddit/comments/cv7nkl/whats_really_outdated_yet_still_widely_used/,35200,17000,r/AskReddit
[Minecraft Video] ENDER DRAGON BOSSFIGHT,https://www.reddit.com/r/PewdiepieSubmissions/comments/cvc2kl/minecraft_video_ender_dragon_bossfight/,35100,777,r/PewdiepieSubmissions
Both Thor and Pewds fought their main villains three times 🤔,https://www.reddit.com/r/PewdiepieSubmissions/comments/cvf9ja/both_thor_and_pewds_fought_their_main_villains/,35000,110,r/PewdiepieSubmissions
"Research has found emotionally extreme experiences, not just “positive” or “negative” experiences, are more meaningful in life. The greater contemplation associated with intense experiences may increase the likelihood that we consider such events self-defining.",https://www.reddit.com/r/science/comments/cv7amy/research_has_found_emotionally_extreme/,34900,696,r/science
TIFU by leaving my ear tubes in for 13 years and not realizing my hearing was going to be different when I took them out,https://www.reddit.com/r/tifu/comments/cv8utv/tifu_by_leaving_my_ear_tubes_in_for_13_years_and/,34700,1200,r/tifu
KeEp ThE fLaMe GoInG,https://www.reddit.com/r/dankmemes/comments/cve7dd/keep_the_flame_going/,34700,306,r/dankmemes
Blursed chicken,https://www.reddit.com/r/blursedimages/comments/cv238x/blursed_chicken/,34300,167,r/blursedimages
I'm Going To Get In Shape Starter Pack,https://www.reddit.com/r/starterpacks/comments/cv6nbj/im_going_to_get_in_shape_starter_pack/,34100,350,r/starterpacks
this is inspired from a comment i saw from pewds newest video. congrats on 100M,https://www.reddit.com/r/PewdiepieSubmissions/comments/cv3ltt/this_is_inspired_from_a_comment_i_saw_from_pewds/,34000,312,r/PewdiepieSubmissions
Sacrifices must be made,https://www.reddit.com/r/Tinder/comments/cvd6ud/sacrifices_must_be_made/,33900,308,r/Tinder
Best series EVER!!,https://www.reddit.com/r/PewdiepieSubmissions/comments/cvcdzj/best_series_ever/,33800,69,r/PewdiepieSubmissions
TIFU by breathing with one nostril my whole life.,https://www.reddit.com/r/tifu/comments/cv3n0y/tifu_by_breathing_with_one_nostril_my_whole_life/,33800,1200,r/tifu
🔥 Massive leatherback sea turtle making its way back to the ocean after laying eggs 🔥,https://www.reddit.com/r/NatureIsFuckingLit/comments/cv3njg/massive_leatherback_sea_turtle_making_its_way/,33600,555,r/NatureIsFuckingLit
G7 can’t turn a blind eye to ecocide in the Amazon - Leaders must ask themselves if Jair Bolsonaro’s destructive attitude to the forest and its peoples should be considered a crime. The fires in the Amazon remind us this is not just a crime against nature but a crime against humanity.,https://www.reddit.com/r/Futurology/comments/cv7u8w/g7_cant_turn_a_blind_eye_to_ecocide_in_the_amazon/,33400,1500,r/Futurology
Nose is a sad boi,https://www.reddit.com/r/dankmemes/comments/cv716u/nose_is_a_sad_boi/,33400,121,r/dankmemes
"What is the deal with the Joe Biden picture with the caption ""No, I don't think I will""?",https://www.reddit.com/r/OutOfTheLoop/comments/cv5f0i/what_is_the_deal_with_the_joe_biden_picture_with/,34600,813,r/OutOfTheLoop
The nicest moment of a gamer.,https://www.reddit.com/r/PewdiepieSubmissions/comments/cvc1l5/the_nicest_moment_of_a_gamer/,33100,474,r/PewdiepieSubmissions
08.24,https://www.reddit.com/r/PewdiepieSubmissions/comments/cv27rb/0824/,33000,537,r/PewdiepieSubmissions
Bezos and Musk’s satellite internet could save Americans $30B a year,https://www.reddit.com/r/technology/comments/cv8muz/bezos_and_musks_satellite_internet_could_save/,32900,2500,r/technology
"Svenson? Come down for Supper! [This will inevitably be drowned in all of the 100m posts, so Ay congratulations Pewds, I was subscriber 100,000,400.]",https://www.reddit.com/r/PewdiepieSubmissions/comments/cv7q75/svenson_come_down_for_supper_this_will_inevitably/,32900,266,r/PewdiepieSubmissions
F moment,https://www.reddit.com/r/memes/comments/cv6oj8/f_moment/,32800,273,r/memes
Where am I?,https://www.reddit.com/r/dankmemes/comments/cvdm46/where_am_i/,32800,95,r/dankmemes
Dat logic tho,https://www.reddit.com/r/PewdiepieSubmissions/comments/cvc1zk/dat_logic_tho/,32700,115,r/PewdiepieSubmissions
Crazy Journey!,https://www.reddit.com/r/BeAmazed/comments/cvekdg/crazy_journey/,32600,729,r/BeAmazed
Nice,https://www.reddit.com/r/dankmemes/comments/cv1dzp/nice/,32600,295,r/dankmemes
"Alfred Hitchcock used real birds while filming the final sequence of The Birds. The lead actress, Tippi Hedren, had been assured by him that the birds would be mechanical. Instead, she endured a week of having real birds flung at her by two handlers, and needed medical attention.",https://www.reddit.com/r/movies/comments/cv9dzv/alfred_hitchcock_used_real_birds_while_filming/,32600,869,r/movies
