Title,Title Link,Score,Num Comments,Subreddit
He wanted to ask her to the prom,https://www.reddit.com/r/WatchPeopleDieInside/comments/cldu0z/he_wanted_to_ask_her_to_the_prom/,127000,5000,r/WatchPeopleDieInside
Y'all ready?,https://www.reddit.com/r/dankmemes/comments/clmjd5/yall_ready/,119000,814,r/dankmemes
69 nice,https://www.reddit.com/r/dankmemes/comments/clirjl/69_nice/,112000,1000,r/dankmemes
An effortless genocide,https://www.reddit.com/r/MurderedByWords/comments/clj82h/an_effortless_genocide/,107000,3000,r/MurderedByWords
My sister accidentally caught this Pikes Peak proposal on camera,https://www.reddit.com/r/funny/comments/cli9ls/my_sister_accidentally_caught_this_pikes_peak/,101000,832,r/funny
S T O N K S,https://www.reddit.com/r/memes/comments/clpo6d/s_t_o_n_k_s/,100000,722,r/memes
My friend has amassed a collection of over 100 copies of Shrek on VHS,https://www.reddit.com/r/mildlyinteresting/comments/clm9t4/my_friend_has_amassed_a_collection_of_over_100/,100000,3600,r/mildlyinteresting
What a blood donation center looks like in El paso after police said there was an urgent need for blood,https://www.reddit.com/r/HumansBeingBros/comments/clo776/what_a_blood_donation_center_looks_like_in_el/,89000,921,r/HumansBeingBros
Airline passengers would probably pay more for priority deboarding than priority boarding,https://www.reddit.com/r/Showerthoughts/comments/clhkpc/airline_passengers_would_probably_pay_more_for/,86800,2100,r/Showerthoughts
Everybody's got these great pictures of their people sleeping with their pets and I'm over here stuck with this mess.,https://www.reddit.com/r/aww/comments/clmuvb/everybodys_got_these_great_pictures_of_their/,85600,897,r/aww
And now you're stuck in the elevator,https://www.reddit.com/r/instant_regret/comments/cljp0t/and_now_youre_stuck_in_the_elevator/,88000,1600,r/instant_regret
The good kind of gatekeeping,https://www.reddit.com/r/gatekeeping/comments/clg8dr/the_good_kind_of_gatekeeping/,83700,4300,r/gatekeeping
Look who we found!,https://www.reddit.com/r/pics/comments/cljbgp/look_who_we_found/,78800,1100,r/pics
A rare glimpse of a history meme in the wild,https://www.reddit.com/r/HistoryMemes/comments/clhl4l/a_rare_glimpse_of_a_history_meme_in_the_wild/,76100,1300,r/HistoryMemes
"TIL that Nicolas Cage once outbid Leonardo DiCaprio for a 70 million year old dinosaur skull paying $276,000 for it. After later finding out that the skull was stolen he agreed to return it to the Mongolian authorities.",https://www.reddit.com/r/todayilearned/comments/clo8rq/til_that_nicolas_cage_once_outbid_leonardo/,72000,1200,r/todayilearned
O'Hare Air,https://www.reddit.com/r/dankmemes/comments/cld8r3/ohare_air/,70600,683,r/dankmemes
Hand bent glass neon light - AkuAku - what do you Think?,https://www.reddit.com/r/gaming/comments/clin5h/hand_bent_glass_neon_light_akuaku_what_do_you/,70400,863,r/gaming
That’s a so nice,https://www.reddit.com/r/dankmemes/comments/clplj8/thats_a_so_nice/,69300,347,r/dankmemes
UPS man took a moment yesterday for himself. It was a good moment for both him and the cat.,https://www.reddit.com/r/aww/comments/clk47p/ups_man_took_a_moment_yesterday_for_himself_it/,67300,928,r/aww
"Watching my uncle play games introduced me to gaming, what about you?",https://www.reddit.com/r/gaming/comments/clko50/watching_my_uncle_play_games_introduced_me_to/,67000,2200,r/gaming
"And that kids, is how i met your mother",https://www.reddit.com/r/PewdiepieSubmissions/comments/clgi4k/and_that_kids_is_how_i_met_your_mother/,66100,361,r/PewdiepieSubmissions
brrrrrr,https://www.reddit.com/r/memes/comments/clltel/brrrrrr/,65700,380,r/memes
And passports too,https://www.reddit.com/r/facepalm/comments/cllhyb/and_passports_too/,64000,484,r/facepalm
Does this go here,https://www.reddit.com/r/suspiciouslyspecific/comments/cliltl/does_this_go_here/,68200,938,r/suspiciouslyspecific
Me and my husband in the same preschool class at 3 years old in 1994 & our kids on the first day of school in 2019 at 3 and 6 years old.,https://www.reddit.com/r/pics/comments/cli6v1/me_and_my_husband_in_the_same_preschool_class_at/,63900,1300,r/pics
Its really not that serious.,https://www.reddit.com/r/memes/comments/clgx0x/its_really_not_that_serious/,63500,267,r/memes
McDonald's worker fired for refusing to serve paramedics: 'We don't serve your kind here',https://www.reddit.com/r/nottheonion/comments/clj037/mcdonalds_worker_fired_for_refusing_to_serve/,63400,6300,r/nottheonion
"In the movie Pulp Fiction, the glowing object in the briefcase is actually Tarantino's n-word pass that he received from Samuel L. Jackson on set.",https://www.reddit.com/r/shittymoviedetails/comments/clnhgt/in_the_movie_pulp_fiction_the_glowing_object_in/,71100,575,r/shittymoviedetails
Aww maan...,https://www.reddit.com/r/dankmemes/comments/cllwcl/aww_maan/,62400,584,r/dankmemes
"A super-thin slice of wood can be used to turn saltwater drinkable, suggests a new study. Scientists developed a new kind of membrane made of natural wood instead of plastic, which is more energy efficient and doesn’t use fossil-fuel based materials like many other membranes for water filtration.",https://www.reddit.com/r/science/comments/clhwcb/a_superthin_slice_of_wood_can_be_used_to_turn/,62200,1300,r/science
how reddit handles internet justice,https://www.reddit.com/r/videos/comments/clkv42/how_reddit_handles_internet_justice/,57500,2500,r/videos
2meirl4meirl,https://www.reddit.com/r/2meirl4meirl/comments/clo1z1/2meirl4meirl/,56200,1100,r/2meirl4meirl
Static shocks you get when touching things must be one hell of a lightning storm for the bacteria on your skin,https://www.reddit.com/r/Showerthoughts/comments/clppmv/static_shocks_you_get_when_touching_things_must/,55300,449,r/Showerthoughts
I love my girlfriend so much,https://www.reddit.com/r/wholesomememes/comments/clhaba/i_love_my_girlfriend_so_much/,54900,511,r/wholesomememes
Door was stuck so I tried to save the day but it didn’t go exactly as I was expecting,https://www.reddit.com/r/Wellthatsucks/comments/clhbd0/door_was_stuck_so_i_tried_to_save_the_day_but_it/,54000,489,r/Wellthatsucks
"If you got offered $1,000,000 USD but every time you spend it you sneeze for every dollar you spend, would you take it? Why or why not?",https://www.reddit.com/r/AskReddit/comments/clkjhp/if_you_got_offered_1000000_usd_but_every_time_you/,51800,7900,r/AskReddit
aw m,https://www.reddit.com/r/dankmemes/comments/clgxtb/aw_m/,51500,679,r/dankmemes
Home.,https://www.reddit.com/r/HydroHomies/comments/cljflm/home/,54100,505,r/HydroHomies
Ice melting underneath a layer of ice that's surrounding a tree,https://www.reddit.com/r/interestingasfuck/comments/clncqa/ice_melting_underneath_a_layer_of_ice_thats/,49300,435,r/interestingasfuck
U.S. warned Sweden of 'negative consequences' if ASAP Rocky wasn't released,https://www.reddit.com/r/worldnews/comments/cli9jk/us_warned_sweden_of_negative_consequences_if_asap/,49200,8800,r/worldnews
never forget your roots,https://www.reddit.com/r/PewdiepieSubmissions/comments/clfhw0/never_forget_your_roots/,48000,240,r/PewdiepieSubmissions
GET IN THE BOAT,https://www.reddit.com/r/PewdiepieSubmissions/comments/cld45b/get_in_the_boat/,47900,211,r/PewdiepieSubmissions
"200,000 reposts are ready, with a million more well on the way",https://www.reddit.com/r/PrequelMemes/comments/clnjl1/200000_reposts_are_ready_with_a_million_more_well/,47800,118,r/PrequelMemes
"Got gilded recently and wanted to give silver, then of course this happened...",https://www.reddit.com/r/ChoosingBeggars/comments/clg9j5/got_gilded_recently_and_wanted_to_give_silver/,47800,2900,r/ChoosingBeggars
A perfect kitty and video,https://www.reddit.com/r/aww/comments/clfyfi/a_perfect_kitty_and_video/,47600,316,r/aww
"My grandpa, hours before his passing, putting a smile on his newly born great-grandson.",https://www.reddit.com/r/pics/comments/cldntl/my_grandpa_hours_before_his_passing_putting_a/,46700,669,r/pics
Hey Reddit I made another wallpaper of The Rock as a GTA character. Hope you like it.,https://www.reddit.com/r/gaming/comments/cldnss/hey_reddit_i_made_another_wallpaper_of_the_rock/,46700,761,r/gaming
“Less childish”,https://www.reddit.com/r/PewdiepieSubmissions/comments/clk45u/less_childish/,46500,245,r/PewdiepieSubmissions
"99,420,696",https://www.reddit.com/r/PewdiepieSubmissions/comments/clo67v/99420696/,45800,230,r/PewdiepieSubmissions
We can’t evolve much more,https://www.reddit.com/r/memes/comments/clm6t7/we_cant_evolve_much_more/,45600,207,r/memes
Pathetic,https://www.reddit.com/r/dankmemes/comments/clhw0r/pathetic/,45100,317,r/dankmemes
"Tony's Snap with Black Sabbath's ""Iron Man""",https://www.reddit.com/r/marvelstudios/comments/clenqx/tonys_snap_with_black_sabbaths_iron_man/,44300,780,r/marvelstudios
With cheats,https://www.reddit.com/r/memes/comments/cljfku/with_cheats/,43900,502,r/memes
Street performer and a man with the same skill set put on a show,https://www.reddit.com/r/nextfuckinglevel/comments/clf05d/street_performer_and_a_man_with_the_same_skill/,43800,456,r/nextfuckinglevel
"The Latest: Texas officials say 20 dead, 26 hurt in shooting",https://www.reddit.com/r/news/comments/clppmx/the_latest_texas_officials_say_20_dead_26_hurt_in/,43600,15100,r/news
Sad but true,https://www.reddit.com/r/vaxxhappened/comments/clki0v/sad_but_true/,43600,451,r/vaxxhappened
Gameplay of “Crab Champions”,https://www.reddit.com/r/gaming/comments/clou0c/gameplay_of_crab_champions/,43500,905,r/gaming
Shutting down a misogynist,https://www.reddit.com/r/MurderedByWords/comments/clelev/shutting_down_a_misogynist/,43300,1500,r/MurderedByWords
A New York style Hotel I've built.,https://www.reddit.com/r/Minecraft/comments/clirw6/a_new_york_style_hotel_ive_built/,43200,760,r/Minecraft
I've rebooted my pc at least 30 times now,https://www.reddit.com/r/pcmasterrace/comments/clffu0/ive_rebooted_my_pc_at_least_30_times_now/,43000,910,r/pcmasterrace
Pretty embarrassing that Pokémon did it first.,https://www.reddit.com/r/freefolk/comments/cleem2/pretty_embarrassing_that_pokémon_did_it_first/,43000,727,r/freefolk
Such a bro,https://www.reddit.com/r/AnimalsBeingBros/comments/clis1c/such_a_bro/,41900,354,r/AnimalsBeingBros
I͚͍̥̕ͅt̞‘͔ș̺̫̗̲̩ ș̠p̵̖r͓͚̫̹̪e̞̰a̢̯̮̳͔̖di̮̰͙̞̜̬͡n̠̺͙̟̻̠̙g̥͚͎͚̦,https://www.reddit.com/r/imsorryjon/comments/cli5fx/its_spreading/,41500,239,r/imsorryjon
Can you lower the volume?,https://www.reddit.com/r/dankmemes/comments/clkf0e/can_you_lower_the_volume/,40900,187,r/dankmemes
Today is National Alopecia Day! Sending love to all of my fellow bald babes & bros. 👩🏻‍🦲❤️,https://www.reddit.com/r/pics/comments/cloaui/today_is_national_alopecia_day_sending_love_to/,40700,1100,r/pics
It be like that all the time,https://www.reddit.com/r/BikiniBottomTwitter/comments/cll83c/it_be_like_that_all_the_time/,40600,226,r/BikiniBottomTwitter
Oops,https://www.reddit.com/r/sadcringe/comments/clgd02/oops/,43100,568,r/sadcringe
AMATEURS!,https://www.reddit.com/r/PewdiepieSubmissions/comments/clc0ou/amateurs/,39000,264,r/PewdiepieSubmissions
This makes me sad,https://www.reddit.com/r/dankmemes/comments/clgp73/this_makes_me_sad/,39000,905,r/dankmemes
Pupper Happy To Be On A Road Trip,https://www.reddit.com/r/Eyebleach/comments/cln671/pupper_happy_to_be_on_a_road_trip/,38500,122,r/Eyebleach
nice,https://www.reddit.com/r/PewdiepieSubmissions/comments/clgkrd/nice/,38400,120,r/PewdiepieSubmissions
"In Avengers Endgame, 2012 Thor mentions that they are going to lunch. He is referring to the Avengers post-credit scene where they are eating shawarma.",https://www.reddit.com/r/MovieDetails/comments/clnxwd/in_avengers_endgame_2012_thor_mentions_that_they/,38500,618,r/MovieDetails
"‘Moscow Mitch’ merchandise sales top $200,000 in 48 hours, Kentucky Dems say",https://www.reddit.com/r/politics/comments/clc1yf/moscow_mitch_merchandise_sales_top_200000_in_48/,38300,1900,r/politics
Minecraft Pro Exposed,https://www.reddit.com/r/quityourbullshit/comments/clnbfg/minecraft_pro_exposed/,38200,615,r/quityourbullshit
Spotted at my local Barnes and Noble,https://www.reddit.com/r/FellowKids/comments/cljiqn/spotted_at_my_local_barnes_and_noble/,39700,625,r/FellowKids
"How would you feel about introducing an 'undo' function to Reddit, that takes you back to where you were, if you accidentally clicked away while scrolling?",https://www.reddit.com/r/AskReddit/comments/clnu8h/how_would_you_feel_about_introducing_an_undo/,37700,984,r/AskReddit
deMoNIc BeASt AlMoST CatChES HanD oF UnSUspeCTiNg HuMAN,https://www.reddit.com/r/PeopleFuckingDying/comments/clih74/demonic_beast_almost_catches_hand_of_unsuspecting/,37600,220,r/PeopleFuckingDying
BIG BRAIIIIIN,https://www.reddit.com/r/PewdiepieSubmissions/comments/clmuoh/big_braiiiiin/,37000,178,r/PewdiepieSubmissions
Tip for Felix,https://www.reddit.com/r/PewdiepieSubmissions/comments/clgrfd/tip_for_felix/,36800,125,r/PewdiepieSubmissions
"My Babies. Both scratch built, made of steel and represent 9 months of my life.",https://www.reddit.com/r/StarWars/comments/clo269/my_babies_both_scratch_built_made_of_steel_and/,36300,460,r/StarWars
Don't forget about it,https://www.reddit.com/r/memes/comments/cle6lk/dont_forget_about_it/,35800,819,r/memes
Got this extra good boy today. Haven't been able to stop internally crying from how adorable he is!,https://www.reddit.com/r/rarepuppers/comments/clks1r/got_this_extra_good_boy_today_havent_been_able_to/,35700,226,r/rarepuppers
Instant argument win.,https://www.reddit.com/r/godtiersuperpowers/comments/clcajt/instant_argument_win/,39300,309,r/godtiersuperpowers
Life of a single father,https://www.reddit.com/r/gifsthatkeepongiving/comments/cllxen/life_of_a_single_father/,35400,251,r/gifsthatkeepongiving
I bleed Soviet Union,https://www.reddit.com/r/memes/comments/clhua5/i_bleed_soviet_union/,35300,354,r/memes
Glad I kept this since I was like 5 or 6...,https://www.reddit.com/r/dankmemes/comments/clp1u6/glad_i_kept_this_since_i_was_like_5_or_6/,35300,101,r/dankmemes
"This is Sara. We adopted her when she was about 6, now she’s 16! She likes cheese and blueberries.",https://www.reddit.com/r/aww/comments/clcatq/this_is_sara_we_adopted_her_when_she_was_about_6/,34800,286,r/aww
It’s dangerous to go alone! Take this with you.,https://www.reddit.com/r/aww/comments/cllqw8/its_dangerous_to_go_alone_take_this_with_you/,34100,246,r/aww
its how a single person made difference .,https://www.reddit.com/r/BeAmazed/comments/clly9t/its_how_a_single_person_made_difference/,34000,343,r/BeAmazed
Blursed mirror selfie,https://www.reddit.com/r/blursedimages/comments/clipk5/blursed_mirror_selfie/,33700,163,r/blursedimages
Thanks I hate the M&M logo now,https://www.reddit.com/r/TIHI/comments/cli1wd/thanks_i_hate_the_mm_logo_now/,33600,145,r/TIHI
me_irl,https://www.reddit.com/r/me_irl/comments/clo8h5/me_irl/,33200,244,r/me_irl
Perfect,https://www.reddit.com/r/dankmemes/comments/clfws7/perfect/,33100,789,r/dankmemes
to celebrate,https://www.reddit.com/r/therewasanattempt/comments/cllsr9/to_celebrate/,33100,437,r/therewasanattempt
me irl,https://www.reddit.com/r/me_irl/comments/cllroa/me_irl/,32800,458,r/me_irl
We heard zombie noises on our lit up island and decided to investigate,https://www.reddit.com/r/Minecraft/comments/cleabk/we_heard_zombie_noises_on_our_lit_up_island_and/,32700,441,r/Minecraft
Sven: whaaaaaatt?,https://www.reddit.com/r/PewdiepieSubmissions/comments/clft1g/sven_whaaaaaatt/,32600,162,r/PewdiepieSubmissions
.,https://www.reddit.com/r/PewdiepieSubmissions/comments/clmllh/_/,32600,184,r/PewdiepieSubmissions
Fëårstèp: Protector of Planet Fitness,https://www.reddit.com/r/Bossfight/comments/clokk2/fëårstèp_protector_of_planet_fitness/,33000,256,r/Bossfight
TIL that millennials in the ages of 18-34 are more likely to live with their parents instead of a spouse/partner - the first time this has occurred since record-keeping began in the 1880s,https://www.reddit.com/r/todayilearned/comments/cljwgc/til_that_millennials_in_the_ages_of_1834_are_more/,32400,4000,r/todayilearned
Nice.,https://www.reddit.com/r/dankmemes/comments/cliwen/nice/,32299,366,r/dankmemes
Winning fake arguments be like,https://www.reddit.com/r/dankmemes/comments/cll21t/winning_fake_arguments_be_like/,32100,86,r/dankmemes
wait...,https://www.reddit.com/r/memes/comments/clmbs6/wait/,31900,394,r/memes
We all know we could do it better,https://www.reddit.com/r/memes/comments/cld3cr/we_all_know_we_could_do_it_better/,31900,261,r/memes
Payday [OC],https://www.reddit.com/r/comics/comments/clj6as/payday_oc/,31800,242,r/comics
Cozy muffin! Heatwave in Switzerland and only one room has AC,https://www.reddit.com/r/rarepuppers/comments/clgumd/cozy_muffin_heatwave_in_switzerland_and_only_one/,31800,282,r/rarepuppers
The guys face at the end when the cat actually did it!,https://www.reddit.com/r/youseeingthisshit/comments/clch9j/the_guys_face_at_the_end_when_the_cat_actually/,31600,116,r/youseeingthisshit
Anyway to get a better picture of the face,https://www.reddit.com/r/comedyheaven/comments/clm8h7/anyway_to_get_a_better_picture_of_the_face/,31500,183,r/comedyheaven
I have a bad feeling about this.,https://www.reddit.com/r/PrequelMemes/comments/clihef/i_have_a_bad_feeling_about_this/,31400,132,r/PrequelMemes
"DARPA Is Building a $10 Million, Open Source, Secure Voting System",https://www.reddit.com/r/technology/comments/clgek9/darpa_is_building_a_10_million_open_source_secure/,31400,2300,r/technology
The negotiations were short!,https://www.reddit.com/r/PrequelMemes/comments/clfiz6/the_negotiations_were_short/,31200,124,r/PrequelMemes
And that's a fact.,https://www.reddit.com/r/PewdiepieSubmissions/comments/clgps1/and_thats_a_fact/,31100,176,r/PewdiepieSubmissions
So I joined the gym...,https://www.reddit.com/r/memes/comments/clnc1y/so_i_joined_the_gym/,30900,239,r/memes
Cursed title,https://www.reddit.com/r/cursedcomments/comments/clgjig/cursed_title/,30900,278,r/cursedcomments
woof_irl,https://www.reddit.com/r/woof_irl/comments/clmg59/woof_irl/,30800,87,r/woof_irl
"Don't know if this belongs on r/BrandNewSentence, r/MurderedByWords, or here...so here we are.",https://www.reddit.com/r/rareinsults/comments/clhlir/dont_know_if_this_belongs_on_rbrandnewsentence/,30600,735,r/rareinsults
Made me laugh.,https://www.reddit.com/r/funny/comments/cli68v/made_me_laugh/,30400,156,r/funny
Technically the truth!!,https://www.reddit.com/r/technicallythetruth/comments/clczmr/technically_the_truth/,30300,130,r/technicallythetruth
i hope this meme hasn't been made yet,https://www.reddit.com/r/lotrmemes/comments/clieuo/i_hope_this_meme_hasnt_been_made_yet/,30100,449,r/lotrmemes
his reflection is the greatest,https://www.reddit.com/r/AnimalsBeingDerps/comments/clpdhk/his_reflection_is_the_greatest/,29900,117,r/AnimalsBeingDerps
Just another meme,https://www.reddit.com/r/memes/comments/clh66y/just_another_meme/,29700,196,r/memes
2019 needs some Overly Manly Man,https://www.reddit.com/r/AdviceAnimals/comments/clj1om/2019_needs_some_overly_manly_man/,29600,488,r/AdviceAnimals
"TIL of Girgori Perelman, the only person in history to have solved one of the seven Millennium Prize Problems. After solving the Poincaré conjecture Perelman was offered the Field's Medal and $1 million prize money, he declined them both.",https://www.reddit.com/r/todayilearned/comments/clhn1l/til_of_girgori_perelman_the_only_person_in/,29500,1300,r/todayilearned
PsBattle: Chihuahua with paws crossed,https://www.reddit.com/r/photoshopbattles/comments/clhytj/psbattle_chihuahua_with_paws_crossed/,29400,331,r/photoshopbattles
McConnell couldn't escape 'Moscow Mitch' at Kentucky's biggest political picnic,https://www.reddit.com/r/politics/comments/clpq3r/mcconnell_couldnt_escape_moscow_mitch_at/,29300,1200,r/politics
I cant wait to upgrade to 3 monitors,https://www.reddit.com/r/pcmasterrace/comments/clkndi/i_cant_wait_to_upgrade_to_3_monitors/,29200,645,r/pcmasterrace
Only one Sven forever,https://www.reddit.com/r/PewdiepieSubmissions/comments/clgr21/only_one_sven_forever/,28900,177,r/PewdiepieSubmissions
Historians are the best namers of things,https://www.reddit.com/r/HistoryMemes/comments/cldybx/historians_are_the_best_namers_of_things/,28900,165,r/HistoryMemes
"""Bad guys in a movie"" starter pack",https://www.reddit.com/r/starterpacks/comments/clkefu/bad_guys_in_a_movie_starter_pack/,28700,385,r/starterpacks
"Cast into the fire, destroy it!",https://www.reddit.com/r/PewdiepieSubmissions/comments/clmdor/cast_into_the_fire_destroy_it/,28700,70,r/PewdiepieSubmissions
My hero,https://www.reddit.com/r/dankmemes/comments/clept4/my_hero/,28600,246,r/dankmemes
The look on that poor woman's face,https://www.reddit.com/r/youseeingthisshit/comments/clju6w/the_look_on_that_poor_womans_face/,28600,512,r/youseeingthisshit
"Graduate Lecture, me, pen and paper, 2019",https://www.reddit.com/r/Art/comments/clce8a/graduate_lecture_me_pen_and_paper_2019/,28500,395,r/Art
Early Morning Dyslexia Kicked in and I Thought Delta was Telling Me to Kill Myself,https://www.reddit.com/r/pics/comments/clijky/early_morning_dyslexia_kicked_in_and_i_thought/,28500,658,r/pics
Mad dad,https://www.reddit.com/r/madlads/comments/cloc8p/mad_dad/,28500,111,r/madlads
Come on...,https://www.reddit.com/r/Minecraft/comments/clg75f/come_on/,28400,742,r/Minecraft
Damn,https://www.reddit.com/r/thanosdidnothingwrong/comments/cljtjj/damn/,28400,133,r/thanosdidnothingwrong
"TIL When the Six Flags Over Texas theme park opened in 1961, it had a section dedicated to the Confederacy where actors would hunt through the crowd for Union ""spies"" and ""execute"" them by firing squad, and where boys and girls could sign up to defend the South as soldiers and nurses.",https://www.reddit.com/r/todayilearned/comments/cligyf/til_when_the_six_flags_over_texas_theme_park/,28400,1900,r/todayilearned
Only boys Will understand,https://www.reddit.com/r/dankmemes/comments/clibji/only_boys_will_understand/,28400,334,r/dankmemes
Rolf,https://www.reddit.com/r/PewdiepieSubmissions/comments/clbyas/rolf/,28400,226,r/PewdiepieSubmissions
"I love inside trends, I hope to be part of one someday",https://www.reddit.com/r/DunderMifflin/comments/clieoc/i_love_inside_trends_i_hope_to_be_part_of_one/,28100,160,r/DunderMifflin
"Rob, giver of Fives",https://www.reddit.com/r/Bossfight/comments/clhvwg/rob_giver_of_fives/,28000,171,r/Bossfight
"Portrait, Me, Digital, 2019",https://www.reddit.com/r/Art/comments/clhe73/portrait_me_digital_2019/,27900,280,r/Art
"Roses are red, 69 is my favorite number",https://www.reddit.com/r/boottoobig/comments/clpbxi/roses_are_red_69_is_my_favorite_number/,27900,279,r/boottoobig
Female Nurses love pulling the plug on ugly people.,https://www.reddit.com/r/thatHappened/comments/clc6us/female_nurses_love_pulling_the_plug_on_ugly_people/,28700,870,r/thatHappened
Cursed_rain,https://www.reddit.com/r/cursedcomments/comments/cljf1w/cursed_rain/,27500,256,r/cursedcomments
These mushrooms look like cigarettes,https://www.reddit.com/r/confusing_perspective/comments/clnxxg/these_mushrooms_look_like_cigarettes/,27300,437,r/confusing_perspective
"A roaring glacial melt, under the bridge to Kangerlussiauq, Greenland where it's 22C today and Danish officials say 12 billions tons of ice melted in 24 hours.",https://www.reddit.com/r/Futurology/comments/cli1i3/a_roaring_glacial_melt_under_the_bridge_to/,27100,1800,r/Futurology
Fun fact!,https://www.reddit.com/r/FunnyandSad/comments/cljrdu/fun_fact/,27400,80,r/FunnyandSad
"The official Area 51 Raid event was removed by Facebook. (It was recreated by the official owner, link in comments)",https://www.reddit.com/r/dankmemes/comments/clo0k9/the_official_area_51_raid_event_was_removed_by/,26800,346,r/dankmemes
Tiny House,https://www.reddit.com/r/CozyPlaces/comments/clh2sk/tiny_house/,26400,326,r/CozyPlaces
"No matter the gender, religion, or race, we can all agree on one thing",https://www.reddit.com/r/teenagers/comments/cllyxx/no_matter_the_gender_religion_or_race_we_can_all/,26300,883,r/teenagers
Bullets found in an old log I was splitting. You can see their trail marks.,https://www.reddit.com/r/mildlyinteresting/comments/clpkiq/bullets_found_in_an_old_log_i_was_splitting_you/,26300,464,r/mildlyinteresting
"Esqueeze me, leave my pal-o alone. Okey dey?",https://www.reddit.com/r/PrequelMemes/comments/clcxww/esqueeze_me_leave_my_palo_alone_okey_dey/,26300,184,r/PrequelMemes
"Obvious red flag, terrible taste in men",https://www.reddit.com/r/memes/comments/clgj39/obvious_red_flag_terrible_taste_in_men/,26100,110,r/memes
/u/bobleecooper synced the song Iron Man to Tony's snap but didn't have the instrumental. I got you fam.,https://www.reddit.com/r/marvelstudios/comments/clhy7m/ubobleecooper_synced_the_song_iron_man_to_tonys/,26000,395,r/marvelstudios
who'a next?,https://www.reddit.com/r/Unexpected/comments/clebat/whoa_next/,26000,499,r/Unexpected
TIFU by having sex with my wife.,https://www.reddit.com/r/tifu/comments/clmgu5/tifu_by_having_sex_with_my_wife/,26000,2100,r/tifu
One of the funniest things we’ve ever done,https://www.reddit.com/r/gtaonline/comments/cloisy/one_of_the_funniest_things_weve_ever_done/,25800,607,r/gtaonline
MCPE 0.1 looks like a horror game by today's standards,https://www.reddit.com/r/Minecraft/comments/clhl4v/mcpe_01_looks_like_a_horror_game_by_todays/,25700,477,r/Minecraft
A great boy,https://www.reddit.com/r/memes/comments/climwo/a_great_boy/,25500,105,r/memes
Unbelievable save by Steven Odendaal in Moto2,https://www.reddit.com/r/sports/comments/clid43/unbelievable_save_by_steven_odendaal_in_moto2/,25500,479,r/sports
Anybody else watching bcc breakfast notice how scared the Chinook looked?,https://www.reddit.com/r/CasualUK/comments/clg7yz/anybody_else_watching_bcc_breakfast_notice_how/,25600,349,r/CasualUK
