Title,Title Link,Score,Num Comments,Subreddit
First post here hi,https://www.reddit.com/r/PewdiepieSubmissions/comments/cv65qj/first_post_here_hi/,32400,208,r/PewdiepieSubmissions
gatekeeping tattoo sleeves,https://www.reddit.com/r/gatekeeping/comments/cv6ryk/gatekeeping_tattoo_sleeves/,32400,793,r/gatekeeping
My high score is 4700 😎,https://www.reddit.com/r/dankmemes/comments/cv3csb/my_high_score_is_4700/,32100,159,r/dankmemes
Sharing is caring,https://www.reddit.com/r/dankmemes/comments/cv6mva/sharing_is_caring/,32000,100,r/dankmemes
Mighty kitty tries to slay the dragon,https://www.reddit.com/r/funny/comments/cve991/mighty_kitty_tries_to_slay_the_dragon/,31900,171,r/funny
How can you help a friend suffering from depression ?,https://www.reddit.com/r/AskReddit/comments/cvedky/how_can_you_help_a_friend_suffering_from/,31800,2600,r/AskReddit
Giant cluster of wind chimes being released all at once,https://www.reddit.com/r/oddlysatisfying/comments/cv3nzi/giant_cluster_of_wind_chimes_being_released_all/,31800,505,r/oddlysatisfying
This put a smile on my face,https://www.reddit.com/r/wholesomememes/comments/cv4yg1/this_put_a_smile_on_my_face/,31500,93,r/wholesomememes
Titanic miscue,https://www.reddit.com/r/Wellthatsucks/comments/cv7w5u/titanic_miscue/,31200,187,r/Wellthatsucks
"[Schefter] Filed to ESPN: Andrew Luck has informed the Colts he is retiring from the NFL, per source. There will be a press conference Sunday to make it official, but Luck is mentally worn down, and now checking out.",https://www.reddit.com/r/nfl/comments/cv22d0/schefter_filed_to_espn_andrew_luck_has_informed/,31200,9300,r/nfl
The look of pure happiness!,https://www.reddit.com/r/aww/comments/cv3e7i/the_look_of_pure_happiness/,31100,119,r/aww
This investment is sure to get you her dad's approval!,https://www.reddit.com/r/MemeEconomy/comments/cv7rv0/this_investment_is_sure_to_get_you_her_dads/,31100,697,r/MemeEconomy
Now this is an avengers level threat,https://www.reddit.com/r/memes/comments/cv7esn/now_this_is_an_avengers_level_threat/,31100,171,r/memes
CNN's Brian Stelter: ‘We Can't Tiptoe’ Around Trump’s Mental Instability ‘Anymore’,https://www.reddit.com/r/politics/comments/cvakhw/cnns_brian_stelter_we_cant_tiptoe_around_trumps/,31000,1300,r/politics
idc anymore...go ahead,https://www.reddit.com/r/dankmemes/comments/cv85yu/idc_anymorego_ahead/,30900,270,r/dankmemes
Cards Against Humanity Started Pack,https://www.reddit.com/r/starterpacks/comments/cvbxdm/cards_against_humanity_started_pack/,30900,446,r/starterpacks
F for the light users out there,https://www.reddit.com/r/memes/comments/cvfrs3/f_for_the_light_users_out_there/,30600,191,r/memes
I’ve been enjoying the books so far,https://www.reddit.com/r/freefolk/comments/cvf84q/ive_been_enjoying_the_books_so_far/,30500,517,r/freefolk
Basic economy duh,https://www.reddit.com/r/dankmemes/comments/cv8nkk/basic_economy_duh/,30400,161,r/dankmemes
Incredible Job!,https://www.reddit.com/r/PewdiepieSubmissions/comments/cvc4fh/incredible_job/,30200,212,r/PewdiepieSubmissions
Well done everyone!!!!!!!!,https://www.reddit.com/r/PewdiepieSubmissions/comments/cv8kh5/well_done_everyone/,30100,42,r/PewdiepieSubmissions
Bought my husband an adult dinosaur pajama onesie. This is all I see over his computer monitor,https://www.reddit.com/r/pics/comments/cv7n0s/bought_my_husband_an_adult_dinosaur_pajama_onesie/,29800,283,r/pics
Steve King Is Broke And Has Been Abandoned by His Colleagues as He Runs for Re-Election,https://www.reddit.com/r/politics/comments/cv7fyn/steve_king_is_broke_and_has_been_abandoned_by_his/,29800,1400,r/politics
Perhaps Joestars have smalled over the years,https://www.reddit.com/r/ShitPostCrusaders/comments/cv7yl7/perhaps_joestars_have_smalled_over_the_years/,29900,289,r/ShitPostCrusaders
It's a suprise tool,https://www.reddit.com/r/memes/comments/cv8k5u/its_a_suprise_tool/,29700,80,r/memes
Ahh yes Spider-Man Deal..,https://www.reddit.com/r/memes/comments/cv7igp/ahh_yes_spiderman_deal/,29600,378,r/memes
"What's it like, being you?",https://www.reddit.com/r/AskReddit/comments/cv7ina/whats_it_like_being_you/,29500,12200,r/AskReddit
Hold up,https://www.reddit.com/r/HolUp/comments/cv7vro/hold_up/,29500,231,r/HolUp
It was gosh darn beautiful,https://www.reddit.com/r/PewdiepieSubmissions/comments/cvccpb/it_was_gosh_darn_beautiful/,29400,778,r/PewdiepieSubmissions
Let the fight begin,https://www.reddit.com/r/dankmemes/comments/cv6dfl/let_the_fight_begin/,29400,312,r/dankmemes
"TIL the famous ""Keyboard Cat"" video was originally filmed in 1984 and that its star, Fatso, died in 1987, twenty years before it was posted on YouTube.",https://www.reddit.com/r/todayilearned/comments/cv483s/til_the_famous_keyboard_cat_video_was_originally/,29300,434,r/todayilearned
Today I drank straight from an Icelandic glacier. The finest of H20.,https://www.reddit.com/r/HydroHomies/comments/cv17ny/today_i_drank_straight_from_an_icelandic_glacier/,29400,529,r/HydroHomies
Uh oh,https://www.reddit.com/r/comedyheaven/comments/cv33ta/uh_oh/,29100,120,r/comedyheaven
"If you can't do the time, don't do the crime",https://www.reddit.com/r/memes/comments/cv95m3/if_you_cant_do_the_time_dont_do_the_crime/,29000,110,r/memes
sPiDermAn foRcEd tO tWeRk fOr cAsh afTer rEcenT tErminatiOn,https://www.reddit.com/r/PeopleFuckingDying/comments/cv3liz/spiderman_forced_to_twerk_for_cash_after_recent/,28900,205,r/PeopleFuckingDying
I’m so proud right now,https://www.reddit.com/r/dankmemes/comments/cv8ld2/im_so_proud_right_now/,28900,84,r/dankmemes
We have to raid Area 51,https://www.reddit.com/r/memes/comments/cvf5ch/we_have_to_raid_area_51/,28900,55,r/memes
SrGrafo into the Comic-Verse #2,https://www.reddit.com/r/comics/comments/cvaqtw/srgrafo_into_the_comicverse_2/,28900,483,r/comics
Big brain time,https://www.reddit.com/r/dankmemes/comments/cv8aqu/big_brain_time/,28800,243,r/dankmemes
The town hall of Hamburg in Minecraft,https://www.reddit.com/r/Minecraft/comments/cvagwg/the_town_hall_of_hamburg_in_minecraft/,28700,359,r/Minecraft
G(OLD),https://www.reddit.com/r/dankmemes/comments/cv9zfa/gold/,28600,99,r/dankmemes
"Oh right, One last thing...",https://www.reddit.com/r/pcmasterrace/comments/cv4p7q/oh_right_one_last_thing/,28500,615,r/pcmasterrace
This teases me (I created the anime version),https://www.reddit.com/r/memes/comments/cvb4ml/this_teases_me_i_created_the_anime_version/,28300,567,r/memes
Excuse me what,https://www.reddit.com/r/Minecraft/comments/cv8zr7/excuse_me_what/,28100,436,r/Minecraft
And I would have gotten away with it too,https://www.reddit.com/r/dankmemes/comments/cv589a/and_i_would_have_gotten_away_with_it_too/,28100,83,r/dankmemes
Very nice,https://www.reddit.com/r/PewdiepieSubmissions/comments/cv509l/very_nice/,27900,137,r/PewdiepieSubmissions
I crave the 8 hour coma,https://www.reddit.com/r/dankmemes/comments/cv9f43/i_crave_the_8_hour_coma/,27600,296,r/dankmemes
My wife is pregnant and my doctor asked me if I had ever been present at a childbirth before.,https://www.reddit.com/r/Jokes/comments/cvd8rd/my_wife_is_pregnant_and_my_doctor_asked_me_if_i/,27300,204,r/Jokes
THE COUNCIL PREDICTED IT ALL,https://www.reddit.com/r/PewdiepieSubmissions/comments/cvg02m/the_council_predicted_it_all/,27300,143,r/PewdiepieSubmissions
Stonks,https://www.reddit.com/r/comedyheaven/comments/cvacrl/stonks/,27300,135,r/comedyheaven
Joe Walsh announces Republican primary challenge against President Trump,https://www.reddit.com/r/politics/comments/cv8b4n/joe_walsh_announces_republican_primary_challenge/,27000,2500,r/politics
what a time to be alive,https://www.reddit.com/r/PewdiepieSubmissions/comments/cv5dh9/what_a_time_to_be_alive/,26800,67,r/PewdiepieSubmissions
kness boxing,https://www.reddit.com/r/memes/comments/cvei0d/kness_boxing/,26800,141,r/memes
Is it possible to learn this power?,https://www.reddit.com/r/dankmemes/comments/cv7p1q/is_it_possible_to_learn_this_power/,26800,44,r/dankmemes
TIL Richard Harris was so drunk through the 1970s that he forgot he owned a Rolls Royce. It sat in a New York garage for 25 years before he found an old photo of himself with it and his accountant confirmed it was still there running up $90k in garage storage costs.,https://www.reddit.com/r/todayilearned/comments/cv14vl/til_richard_harris_was_so_drunk_through_the_1970s/,26600,584,r/todayilearned
"So everyone is submitting joke characters, so here is mine: Ser Bronn of the Blackwater, Master of Coin",https://www.reddit.com/r/freefolk/comments/cv7fhv/so_everyone_is_submitting_joke_characters_so_here/,26400,464,r/freefolk
Ladies and gentlemen we did it.,https://www.reddit.com/r/PewdiepieSubmissions/comments/cv2jgh/ladies_and_gentlemen_we_did_it/,26100,283,r/PewdiepieSubmissions
Go ahead and touch me-WHY U TOUCH ME?!,https://www.reddit.com/r/youseeingthisshit/comments/cv28zm/go_ahead_and_touch_mewhy_u_touch_me/,26000,191,r/youseeingthisshit
Every single one of them,https://www.reddit.com/r/suspiciouslyspecific/comments/cv3cmh/every_single_one_of_them/,25800,243,r/suspiciouslyspecific
Bad edit but who cares,https://www.reddit.com/r/PewdiepieSubmissions/comments/cvc3gs/bad_edit_but_who_cares/,25800,136,r/PewdiepieSubmissions
Unfreeze when this meme has done well,https://www.reddit.com/r/dankmemes/comments/cvah5n/unfreeze_when_this_meme_has_done_well/,25800,80,r/dankmemes
Got another gift from my crow friends!,https://www.reddit.com/r/aww/comments/cvet0v/got_another_gift_from_my_crow_friends/,25700,470,r/aww
I like this park,https://www.reddit.com/r/memes/comments/cv7sn3/i_like_this_park/,25700,75,r/memes
He predicted Bengt!!,https://www.reddit.com/r/PewdiepieSubmissions/comments/cven4w/he_predicted_bengt/,25700,139,r/PewdiepieSubmissions
You can always perfectly plug things in,https://www.reddit.com/r/godtiersuperpowers/comments/cvd7aw/you_can_always_perfectly_plug_things_in/,27400,261,r/godtiersuperpowers
"A priest is sitting inside the church, when a guy comes in and asks to be confessed.",https://www.reddit.com/r/Jokes/comments/cv6n5b/a_priest_is_sitting_inside_the_church_when_a_guy/,25400,412,r/Jokes
Seen at Toronto’s fan-expo,https://www.reddit.com/r/marvelstudios/comments/cvayph/seen_at_torontos_fanexpo/,25400,138,r/marvelstudios
Golisopod's Emergency Exit,https://www.reddit.com/r/pokemon/comments/cv7y9x/golisopods_emergency_exit/,25400,1200,r/pokemon
PsBattle: breaking in the new trash can,https://www.reddit.com/r/photoshopbattles/comments/cvg0or/psbattle_breaking_in_the_new_trash_can/,25200,396,r/photoshopbattles
Australian spiders,https://www.reddit.com/r/memes/comments/cv85on/australian_spiders/,25100,96,r/memes
"Go ahead, Mr. Joestar.",https://www.reddit.com/r/ShitPostCrusaders/comments/cv6uxj/go_ahead_mr_joestar/,25100,230,r/ShitPostCrusaders
Spider gay,https://www.reddit.com/r/dankmemes/comments/cveh9i/spider_gay/,25000,76,r/dankmemes
Watch pewdiepie hit 100 million on stream,https://www.reddit.com/r/PewdiepieSubmissions/comments/cv5uy2/watch_pewdiepie_hit_100_million_on_stream/,25000,250,r/PewdiepieSubmissions
My service dog got a new bed with our first paycheck after getting our first job together! She’s the hardest worker in the whole office <3,https://www.reddit.com/r/dogswithjobs/comments/cv2n0b/my_service_dog_got_a_new_bed_with_our_first/,25000,206,r/dogswithjobs
Hey Felix! Where is the 12 hour Minecraft stream?,https://www.reddit.com/r/PewdiepieSubmissions/comments/cvcr7h/hey_felix_where_is_the_12_hour_minecraft_stream/,24800,147,r/PewdiepieSubmissions
Found a better meme format for us fanboys,https://www.reddit.com/r/marvelmemes/comments/cv8i5v/found_a_better_meme_format_for_us_fanboys/,25000,140,r/marvelmemes
JamesCharlesFanX ay congratulations !!,https://www.reddit.com/r/PewdiepieSubmissions/comments/cv3scp/jamescharlesfanx_ay_congratulations/,24600,251,r/PewdiepieSubmissions
Headline says the exact opposite thing from the description,https://www.reddit.com/r/assholedesign/comments/cv577v/headline_says_the_exact_opposite_thing_from_the/,24600,167,r/assholedesign
"Steven Spielberg's ""Jaws"" (1975) and ""Lincoln"" (2012) both take place in a country called ""America"", suggesting both films share the same cinematic universe.",https://www.reddit.com/r/shittymoviedetails/comments/cv43kj/steven_spielbergs_jaws_1975_and_lincoln_2012_both/,24500,98,r/shittymoviedetails
Let them taste their own medicine.,https://www.reddit.com/r/whitepeoplegifs/comments/cv7nle/let_them_taste_their_own_medicine/,24500,440,r/whitepeoplegifs
[Homemade] Mongolian Beef Ramen,https://www.reddit.com/r/food/comments/cvc7gc/homemade_mongolian_beef_ramen/,24400,372,r/food
Dome overlooking the sea,https://www.reddit.com/r/CozyPlaces/comments/cv7p5n/dome_overlooking_the_sea/,24400,203,r/CozyPlaces
"I'm a lifeline main, so i painted my headset, what do you guys think?",https://www.reddit.com/r/apexlegends/comments/cvc86c/im_a_lifeline_main_so_i_painted_my_headset_what/,24300,481,r/apexlegends
My kind of a hero,https://www.reddit.com/r/memes/comments/cvewgd/my_kind_of_a_hero/,24200,153,r/memes
The apple doesn't fall far from the stump,https://www.reddit.com/r/rareinsults/comments/cvcn6d/the_apple_doesnt_fall_far_from_the_stump/,24100,162,r/rareinsults
If you see a fork in the road...,https://www.reddit.com/r/nevertellmetheodds/comments/cv8wt4/if_you_see_a_fork_in_the_road/,24000,138,r/nevertellmetheodds
Imagine getting killed by a pile of bones,https://www.reddit.com/r/dankmemes/comments/cve02d/imagine_getting_killed_by_a_pile_of_bones/,24000,74,r/dankmemes
Nice template,https://www.reddit.com/r/HistoryMemes/comments/cv9om6/nice_template/,23700,401,r/HistoryMemes
