Title,Title Link,Score,Num Comments,Subreddit
Browsing in 2019,https://www.reddit.com/r/funny/comments/ebzhdi/browsing_in_2019/,146000,1900,r/funny
I made a hidden glow-in-the-dark galaxy in my resin kitchen floor.,https://www.reddit.com/r/mildlyinteresting/comments/ebomu9/i_made_a_hidden_glowinthedark_galaxy_in_my_resin/,122000,3200,r/mildlyinteresting
Nice try,https://www.reddit.com/r/facepalm/comments/ebu7tw/nice_try/,112000,2000,r/facepalm
Man’s best friend indeed,https://www.reddit.com/r/nextfuckinglevel/comments/ebzz98/mans_best_friend_indeed/,110000,1900,r/nextfuckinglevel
Author after seeing fan fiction of his work,https://www.reddit.com/r/WatchPeopleDieInside/comments/ec22uh/author_after_seeing_fan_fiction_of_his_work/,109000,2300,r/WatchPeopleDieInside
I love my parents,https://www.reddit.com/r/wholesomememes/comments/ec19dv/i_love_my_parents/,102000,351,r/wholesomememes
Sweet home..,https://www.reddit.com/r/dankmemes/comments/ebvn6n/sweet_home/,95900,629,r/dankmemes
Fallon Sherrock just became the first woman to beat a man at the World Darts Championship,https://www.reddit.com/r/sports/comments/ec3d3l/fallon_sherrock_just_became_the_first_woman_to/,90500,3400,r/sports
"There is a well known saying that goes ""Always give the hardest job to the laziest person because they will find the easiest way to do it"" what is the best real-life example to this you have seen?",https://www.reddit.com/r/AskReddit/comments/ebp6ak/there_is_a_well_known_saying_that_goes_always/,89600,13400,r/AskReddit
Just finished wrapping my white elephant gift. Everyone needs an angle grinder!,https://www.reddit.com/r/assholedesign/comments/ebypmi/just_finished_wrapping_my_white_elephant_gift/,89600,1400,r/assholedesign
When you carry the team,https://www.reddit.com/r/memes/comments/ebw7ux/when_you_carry_the_team/,84800,436,r/memes
Fluffy little potato checking to see if the cooking's done,https://www.reddit.com/r/aww/comments/ebx7wp/fluffy_little_potato_checking_to_see_if_the/,81700,802,r/aww
He seems impressed.,https://www.reddit.com/r/youseeingthisshit/comments/ec1ymv/he_seems_impressed/,84500,1000,r/youseeingthisshit
Danny Devito introducing Bernie Sanders at a rally,https://www.reddit.com/r/pics/comments/eby81r/danny_devito_introducing_bernie_sanders_at_a_rally/,80200,2100,r/pics
Teachers am I right?,https://www.reddit.com/r/teenagers/comments/ebyqbx/teachers_am_i_right/,79300,620,r/teenagers
The struggles of selling a microphone online.,https://www.reddit.com/r/mildlyinfuriating/comments/ebv8ug/the_struggles_of_selling_a_microphone_online/,74000,2200,r/mildlyinfuriating
Im gonna do it,https://www.reddit.com/r/PewdiepieSubmissions/comments/ebwion/im_gonna_do_it/,72800,257,r/PewdiepieSubmissions
"Whistleblower claims Mormon Church stockpiled $100 billion in charitable donations, dodged taxes",https://www.reddit.com/r/news/comments/ebqsxw/whistleblower_claims_mormon_church_stockpiled_100/,72100,3700,r/news
Ad Blocker,https://www.reddit.com/r/pcmasterrace/comments/ec0tap/ad_blocker/,70300,1000,r/pcmasterrace
"For all the naysayers who think wrestling is fake, how do you explain this?",https://www.reddit.com/r/gifs/comments/ebnqyd/for_all_the_naysayers_who_think_wrestling_is_fake/,69600,646,r/gifs
In retaliation to the semi automatic gun gang,https://www.reddit.com/r/dankmemes/comments/ec3kus/in_retaliation_to_the_semi_automatic_gun_gang/,69300,870,r/dankmemes
Kids are so stupid,https://www.reddit.com/r/WatchPeopleDieInside/comments/ebstw6/kids_are_so_stupid/,67500,929,r/WatchPeopleDieInside
Herman the office spider likes his name plate,https://www.reddit.com/r/aww/comments/ebph6y/herman_the_office_spider_likes_his_name_plate/,67300,521,r/aww
Friend's cat on vet drugs.,https://www.reddit.com/r/gifs/comments/ebw8j5/friends_cat_on_vet_drugs/,66800,675,r/gifs
Ad Blocker,https://www.reddit.com/r/funny/comments/ec0t1t/ad_blocker/,65800,1400,r/funny
Blursed_execution,https://www.reddit.com/r/blursedimages/comments/eby4y5/blursed_execution/,67000,430,r/blursedimages
22 years ago my friends and I walked home from middle school together for the last time and placed these locks on this fence. Still there today.,https://www.reddit.com/r/pics/comments/ec3xlr/22_years_ago_my_friends_and_i_walked_home_from/,65000,1500,r/pics
Wait what,https://www.reddit.com/r/dankmemes/comments/ebun50/wait_what/,64400,329,r/dankmemes
cursed_graverobbery,https://www.reddit.com/r/cursedcomments/comments/ebvwa2/cursed_graverobbery/,63900,203,r/cursedcomments
They use prisoners from the brig to walk dogs from a local animal shelter,https://www.reddit.com/r/mildlyinteresting/comments/ebxgld/they_use_prisoners_from_the_brig_to_walk_dogs/,63500,1100,r/mildlyinteresting
‘Like a furnace’: Australia to see hottest day ever - with 50C forecast - as devastating bushfires rage | Prime minister Scott Morrison accused of ‘deafening silence’ over climate crisis as dangerous temperatures affect almost entire continent,https://www.reddit.com/r/worldnews/comments/ebr4h7/like_a_furnace_australia_to_see_hottest_day_ever/,62400,4600,r/worldnews
Building a rollercoaster in your backyard? Dad of the year award goes to this man,https://www.reddit.com/r/nextfuckinglevel/comments/ebtz2u/building_a_rollercoaster_in_your_backyard_dad_of/,62000,533,r/nextfuckinglevel
I'm dreaming of a white Stonehenge...,https://www.reddit.com/r/HistoryMemes/comments/ebv7mq/im_dreaming_of_a_white_stonehenge/,61500,455,r/HistoryMemes
[OC] I got annoyed with FedEx and created a visualization of my package's journey.,https://www.reddit.com/r/dataisbeautiful/comments/ec1szk/oc_i_got_annoyed_with_fedex_and_created_a/,60000,1700,r/dataisbeautiful
Dont let the flame die out,https://www.reddit.com/r/PewdiepieSubmissions/comments/ebsg9m/dont_let_the_flame_die_out/,59300,324,r/PewdiepieSubmissions
Amazing shot taken at the right time and in the right place. These antennas on top of the San Francisco Sutro Tower look like a ghost ship.,https://www.reddit.com/r/BeAmazed/comments/ec2c7n/amazing_shot_taken_at_the_right_time_and_in_the/,59200,383,r/BeAmazed
They actually did it!!!,https://www.reddit.com/r/madlads/comments/ebqhgz/they_actually_did_it/,57900,190,r/madlads
To steal,https://www.reddit.com/r/therewasanattempt/comments/ebu7d1/to_steal/,58800,873,r/therewasanattempt
"Title-this-trick Tuesday, winner gets Gold!",https://www.reddit.com/r/toptalent/comments/ebxoff/titlethistrick_tuesday_winner_gets_gold/,58400,5500,r/toptalent
blursed_maths,https://www.reddit.com/r/blursedimages/comments/ebrqbl/blursed_maths/,56300,914,r/blursedimages
Whats the point of photoshopping a starbucks logo on your cup..? Had a good laugh bc of it,https://www.reddit.com/r/Instagramreality/comments/ebuorb/whats_the_point_of_photoshopping_a_starbucks_logo/,60200,1300,r/Instagramreality
"'Stop This Illegal Purge': Outrage as Georgia GOP Removes More Than 300,000 Voters From Rolls; Warning of 2020 impact, one critic said Georgia could remain a red state solely ""due to the GOP purposefully denying people the right to vote.""",https://www.reddit.com/r/politics/comments/ebumhj/stop_this_illegal_purge_outrage_as_georgia_gop/,55200,4200,r/politics
"Comparison is the thief of you, after all.",https://www.reddit.com/r/suspiciouslyspecific/comments/ec3qau/comparison_is_the_thief_of_you_after_all/,57300,183,r/suspiciouslyspecific
Australian farmer (@emulogic) set up a drinking pool for the wildlife of Australia to quench their thirst as the temperature continues to rise and dams dry up.,https://www.reddit.com/r/HumansBeingBros/comments/ec2r3f/australian_farmer_emulogic_set_up_a_drinking_pool/,54400,639,r/HumansBeingBros
"This 18th century sculpture called Disillusion, which includes an intricate net carved from a single block of marble, was created by Francesco Queirolo without assistance, since no apprentice would touch it for fear of the delicate net crumbling in their hands. It took him seven years.",https://www.reddit.com/r/Damnthatsinteresting/comments/ebnorr/this_18th_century_sculpture_called_disillusion/,54400,672,r/Damnthatsinteresting
I wrapped my nephew’s gifts like Super Mario blocks,https://www.reddit.com/r/mildlyinteresting/comments/ebu4jz/i_wrapped_my_nephews_gifts_like_super_mario_blocks/,54200,528,r/mildlyinteresting
ok,https://www.reddit.com/r/comedyheaven/comments/ec2sld/ok/,54300,436,r/comedyheaven
Just waiting for a natural cause,https://www.reddit.com/r/memes/comments/ebx1ms/just_waiting_for_a_natural_cause/,53900,192,r/memes
"A rough experience, I must admit.",https://www.reddit.com/r/Tinder/comments/ebourz/a_rough_experience_i_must_admit/,54000,190,r/Tinder
Is true can confirm,https://www.reddit.com/r/memes/comments/ebvhz1/is_true_can_confirm/,53600,328,r/memes
Playing with your dog...,https://www.reddit.com/r/Unexpected/comments/ebw5w9/playing_with_your_dog/,53500,646,r/Unexpected
He didn't comment back,https://www.reddit.com/r/MurderedByWords/comments/ebnvvk/he_didnt_comment_back/,53000,1100,r/MurderedByWords
Literally happened the other day,https://www.reddit.com/r/memes/comments/ebrnxr/literally_happened_the_other_day/,52800,384,r/memes
Pokemon starters made from layers of paper,https://www.reddit.com/r/gaming/comments/ec0y56/pokemon_starters_made_from_layers_of_paper/,52400,345,r/gaming
Mad cook,https://www.reddit.com/r/madlads/comments/ebvtge/mad_cook/,52400,281,r/madlads
Arg,https://www.reddit.com/r/BikiniBottomTwitter/comments/ec2a0x/arg/,51900,396,r/BikiniBottomTwitter
"Deputy who slammed N.C. middle school student to floor is fired, charged with assault",https://www.reddit.com/r/news/comments/ec1he1/deputy_who_slammed_nc_middle_school_student_to/,50800,2600,r/news
Thanks guys,https://www.reddit.com/r/memes/comments/ebuqep/thanks_guys/,50100,210,r/memes
My grandpa's Xbox Twitch streaming setup. What do you guys think?,https://www.reddit.com/r/gaming/comments/ec03nb/my_grandpas_xbox_twitch_streaming_setup_what_do/,49900,1400,r/gaming
Press F to pay your respects to my original n64 Christmas gift in 98.,https://www.reddit.com/r/gaming/comments/ebqtuu/press_f_to_pay_your_respects_to_my_original_n64/,49600,2700,r/gaming
Cursed_Wand,https://www.reddit.com/r/cursedcomments/comments/ec01pb/cursed_wand/,48700,273,r/cursedcomments
"“What will those tattoos look like when you’re old?” Well, mom, hopefully as badass as this 102 year old woman.",https://www.reddit.com/r/pics/comments/eboi4g/what_will_those_tattoos_look_like_when_youre_old/,48200,1600,r/pics
Henry the service dog has a break from working to visit Dug and Russell from 'UP',https://www.reddit.com/r/rarepuppers/comments/ebyu05/henry_the_service_dog_has_a_break_from_working_to/,48000,306,r/rarepuppers
I have midterms tommorow,https://www.reddit.com/r/teenagers/comments/ebuj65/i_have_midterms_tommorow/,47400,538,r/teenagers
Best school day ever!,https://www.reddit.com/r/KeanuBeingAwesome/comments/ebwjk5/best_school_day_ever/,46900,521,r/KeanuBeingAwesome
"The Akhal-Teke known as the “Golden Horse”, famous for its distinctive metallic sheen.",https://www.reddit.com/r/interestingasfuck/comments/ec2206/the_akhalteke_known_as_the_golden_horse_famous/,46400,476,r/interestingasfuck
Can confirm both,https://www.reddit.com/r/memes/comments/ec021v/can_confirm_both/,46200,477,r/memes
Pro move,https://www.reddit.com/r/WhitePeopleTwitter/comments/ebr559/pro_move/,46000,695,r/WhitePeopleTwitter
"How quick the truck swerves like he's saying, ""go get em!""",https://www.reddit.com/r/oddlysatisfying/comments/ebztov/how_quick_the_truck_swerves_like_hes_saying_go/,45900,359,r/oddlysatisfying
I diagnose you with....,https://www.reddit.com/r/dankmemes/comments/ebullq/i_diagnose_you_with/,45800,153,r/dankmemes
Oh yeah!,https://www.reddit.com/r/memes/comments/ebz5a0/oh_yeah/,45200,250,r/memes
"TIL of the Parthian shot, an ancient military tactic where archers on horses would feign retreat and then turn their bodies while at full gallop to shoot at the pursuing enemy. It required great skill to master. Without a stirrup, the rider relied solely on pressure from his legs to guide his horse.",https://www.reddit.com/r/todayilearned/comments/ebuykr/til_of_the_parthian_shot_an_ancient_military/,45000,1400,r/todayilearned
Typical shrimp watch,https://www.reddit.com/r/suspiciouslyspecific/comments/ebvxb3/typical_shrimp_watch/,46200,221,r/suspiciouslyspecific
A massive sea turtle on the ocean floor,https://www.reddit.com/r/interestingasfuck/comments/ebx8n6/a_massive_sea_turtle_on_the_ocean_floor/,44800,677,r/interestingasfuck
Possible mass grave from 1921 Tulsa Race Massacre found by researchers,https://www.reddit.com/r/news/comments/ebwxkm/possible_mass_grave_from_1921_tulsa_race_massacre/,44400,3200,r/news
Americans plan demonstrations in support of impeaching Trump,https://www.reddit.com/r/politics/comments/ebxf09/americans_plan_demonstrations_in_support_of/,44200,2500,r/politics
"Tana bad, mr beast good",https://www.reddit.com/r/PewdiepieSubmissions/comments/ec0euk/tana_bad_mr_beast_good/,43900,269,r/PewdiepieSubmissions
What is a question you wish people wouldn’t ask you?,https://www.reddit.com/r/AskReddit/comments/ebuquu/what_is_a_question_you_wish_people_wouldnt_ask_you/,42600,28100,r/AskReddit
"A historic metal on metal ""Robin Hood"" throw at the World Axe Throwing Championship last weekend in Arizona",https://www.reddit.com/r/nevertellmetheodds/comments/ebrgq9/a_historic_metal_on_metal_robin_hood_throw_at_the/,42100,424,r/nevertellmetheodds
He's Now Sleeping With The Fishes,https://www.reddit.com/r/dankmemes/comments/ebutm7/hes_now_sleeping_with_the_fishes/,42000,139,r/dankmemes
Don't question it,https://www.reddit.com/r/WhitePeopleTwitter/comments/ebzqkr/dont_question_it/,41800,464,r/WhitePeopleTwitter
Cursed_flag pole,https://www.reddit.com/r/cursedcomments/comments/ebyt7h/cursed_flag_pole/,41700,208,r/cursedcomments
Ah yes...literature,https://www.reddit.com/r/dankmemes/comments/ebtuao/ah_yesliterature/,41500,224,r/dankmemes
Change my mind,https://www.reddit.com/r/PewdiepieSubmissions/comments/ebt16b/change_my_mind/,41300,159,r/PewdiepieSubmissions
LilyPichu used Thunderbolt,https://www.reddit.com/r/perfectlycutscreams/comments/ebxqut/lilypichu_used_thunderbolt/,41800,369,r/perfectlycutscreams
"First Images from 'Bill & Ted Face the Music' Starring Keanu Reeves, Alex Winter, William Sadler, Brigette Lundy-Paine, Samara Weaving, Anthony Carrigan & Kid Cudi",https://www.reddit.com/r/movies/comments/ebwygl/first_images_from_bill_ted_face_the_music/,41200,2200,r/movies
Still going on boy!!!,https://www.reddit.com/r/PewdiepieSubmissions/comments/ebuorj/still_going_on_boy/,40900,121,r/PewdiepieSubmissions
"Where is the mic? Is it on, is it muted?",https://www.reddit.com/r/PrequelMemes/comments/ebxj0q/where_is_the_mic_is_it_on_is_it_muted/,40400,108,r/PrequelMemes
"Wait, dad no!",https://www.reddit.com/r/HolUp/comments/ebtpru/wait_dad_no/,40200,660,r/HolUp
We're almost there,https://www.reddit.com/r/memes/comments/ebut3s/were_almost_there/,40100,242,r/memes
"If someone beat me to it, I'll remove it",https://www.reddit.com/r/rareinsults/comments/ebus8t/if_someone_beat_me_to_it_ill_remove_it/,40000,509,r/rareinsults
"During the food strom in ""Cloudy with a chance of meatballs"" (2009), a man loots a TV, then the remote TV loots a man.",https://www.reddit.com/r/MovieDetails/comments/ebogbf/during_the_food_strom_in_cloudy_with_a_chance_of/,39700,290,r/MovieDetails
2meirl4meirl,https://www.reddit.com/r/2meirl4meirl/comments/ebw6j9/2meirl4meirl/,39700,721,r/2meirl4meirl
🔥 An extremely rare Andean wild cat checking out a wildlife cam 🔥,https://www.reddit.com/r/NatureIsFuckingLit/comments/ec1czh/an_extremely_rare_andean_wild_cat_checking_out_a/,39400,209,r/NatureIsFuckingLit
look both ways before crossing the homicidal ai,https://www.reddit.com/r/memes/comments/ebnyai/look_both_ways_before_crossing_the_homicidal_ai/,39400,419,r/memes
When marketing had balls:,https://www.reddit.com/r/Unexpected/comments/ec3qkv/when_marketing_had_balls/,39400,614,r/Unexpected
b i g b r a i n,https://www.reddit.com/r/PewdiepieSubmissions/comments/ec1utx/b_i_g_b_r_a_i_n/,39300,80,r/PewdiepieSubmissions
"TIL that the Persian Army brought an immense block of marble to the Battle of Marathon, intending to build a monument of their victory. Captured by the Greeks, they sculpted a statue of Nemesis, the goddess who cuts down those with too much pride",https://www.reddit.com/r/todayilearned/comments/eboxqs/til_that_the_persian_army_brought_an_immense/,39200,536,r/todayilearned
Thanks I hate glow stick,https://www.reddit.com/r/TIHI/comments/ebtsbt/thanks_i_hate_glow_stick/,39200,199,r/TIHI
The comfiest spot is on the dog,https://www.reddit.com/r/aww/comments/ebzhk9/the_comfiest_spot_is_on_the_dog/,39200,261,r/aww
Trump writes rambling letter to Nancy Pelosi on eve of impeachment,https://www.reddit.com/r/politics/comments/ec0u9u/trump_writes_rambling_letter_to_nancy_pelosi_on/,38800,5900,r/politics
I did not yet see it anywhere,https://www.reddit.com/r/memes/comments/ebxfu9/i_did_not_yet_see_it_anywhere/,38700,358,r/memes
When I log into Reddit to check how my post has done,https://www.reddit.com/r/HighQualityGifs/comments/ebzjxm/when_i_log_into_reddit_to_check_how_my_post_has/,38600,280,r/HighQualityGifs
Rise of Sheevwalker,https://www.reddit.com/r/PrequelMemes/comments/ebt3t1/rise_of_sheevwalker/,38500,839,r/PrequelMemes
Critical hit,https://www.reddit.com/r/dankmemes/comments/ebvce8/critical_hit/,38400,115,r/dankmemes
Winter in Hallstatt,https://www.reddit.com/r/BeAmazed/comments/ebu65n/winter_in_hallstatt/,38200,380,r/BeAmazed
WE CANNOT LET THE NORMIES WIN!!!,https://www.reddit.com/r/dankmemes/comments/ebux5n/we_cannot_let_the_normies_win/,38200,412,r/dankmemes
Canadian duo invent a toothpaste tablet to eliminate plastic tubes: “Toothpaste tubes take over 500 years to break down and are unable to be recycled. We’ve developed toothpaste tablets that remove the need for a tube altogether.”,https://www.reddit.com/r/Futurology/comments/ebs781/canadian_duo_invent_a_toothpaste_tablet_to/,37600,1800,r/Futurology
It really did,https://www.reddit.com/r/memes/comments/ebwqh6/it_really_did/,37500,189,r/memes
It’s time to die!,https://www.reddit.com/r/HistoryMemes/comments/ebrv21/its_time_to_die/,37500,614,r/HistoryMemes
It’s me. 😢,https://www.reddit.com/r/DunderMifflin/comments/ebo8wg/its_me/,36700,324,r/DunderMifflin
Me irl,https://www.reddit.com/r/me_irl/comments/ebtecn/me_irl/,36500,329,r/me_irl
Literally me at every party,https://www.reddit.com/r/BikiniBottomTwitter/comments/ebwbr0/literally_me_at_every_party/,36400,189,r/BikiniBottomTwitter
It do be like that,https://www.reddit.com/r/memes/comments/ebuyku/it_do_be_like_that/,36200,177,r/memes
"LPT: Don’t put yourself down in order to compliment someone, ESPECIALLY children",https://www.reddit.com/r/LifeProTips/comments/ec20da/lpt_dont_put_yourself_down_in_order_to_compliment/,36100,743,r/LifeProTips
Ashley Eckstein (voice of Ahsoka Tano) at the Rise of Skywalker premiere. Her love for this character is just so awesome.,https://www.reddit.com/r/StarWars/comments/ebwpov/ashley_eckstein_voice_of_ahsoka_tano_at_the_rise/,35400,724,r/StarWars
Salma Hayek's reaction to Kumail Nanjiani's fitness transformation for Eternals,https://www.reddit.com/r/marvelstudios/comments/ebzrb9/salma_hayeks_reaction_to_kumail_nanjianis_fitness/,35400,1400,r/marvelstudios
To gloss over 5year olds in debt,https://www.reddit.com/r/therewasanattempt/comments/ebyabc/to_gloss_over_5year_olds_in_debt/,35300,720,r/therewasanattempt
I was told she played the entire 9 hours she was at Daycare,https://www.reddit.com/r/WhatsWrongWithYourDog/comments/ebrj0u/i_was_told_she_played_the_entire_9_hours_she_was/,35500,299,r/WhatsWrongWithYourDog
It's new real-estate,https://www.reddit.com/r/dankmemes/comments/ebu8l1/its_new_realestate/,34900,155,r/dankmemes
Snow Zoomies,https://www.reddit.com/r/aww/comments/ec4c2n/snow_zoomies/,34700,203,r/aww
How long has this been a thing???,https://www.reddit.com/r/Minecraft/comments/ebp6q6/how_long_has_this_been_a_thing/,34700,952,r/Minecraft
"Thanks, I hate...",https://www.reddit.com/r/TIHI/comments/ec2hka/thanks_i_hate/,34300,174,r/TIHI
My buddy tattooed a fingernail on someone.,https://www.reddit.com/r/mildlyinteresting/comments/ec49qw/my_buddy_tattooed_a_fingernail_on_someone/,34100,437,r/mildlyinteresting
Killing With Kindness,https://www.reddit.com/r/comics/comments/ebvu30/killing_with_kindness/,34000,116,r/comics
Speech 100,https://www.reddit.com/r/memes/comments/ebolrv/speech_100/,33700,76,r/memes
Do you know Fiji?,https://www.reddit.com/r/dankmemes/comments/ebuo1o/do_you_know_fiji/,33700,111,r/dankmemes
They should start putting up traffic lights on lakes,https://www.reddit.com/r/Wellthatsucks/comments/ebu1b4/they_should_start_putting_up_traffic_lights_on/,33400,640,r/Wellthatsucks
.,https://www.reddit.com/r/PewdiepieSubmissions/comments/ebxkk2/_/,33200,157,r/PewdiepieSubmissions
blursed_roadsalt,https://www.reddit.com/r/blursedimages/comments/ebvacu/blursed_roadsalt/,33100,108,r/blursedimages
r/blessed images starter pack,https://www.reddit.com/r/starterpacks/comments/ebx506/rblessed_images_starter_pack/,32900,524,r/starterpacks
[Image] Don’t just do things “good enough.”,https://www.reddit.com/r/GetMotivated/comments/ebwvn0/image_dont_just_do_things_good_enough/,32900,547,r/GetMotivated
Cursed_Equality,https://www.reddit.com/r/cursedcomments/comments/ebofzk/cursed_equality/,32900,59,r/cursedcomments
"New format, invest",https://www.reddit.com/r/MemeEconomy/comments/ec40hw/new_format_invest/,32800,133,r/MemeEconomy
It’s still stealth if no one’s alive to catch you,https://www.reddit.com/r/technicallythetruth/comments/ec00px/its_still_stealth_if_no_ones_alive_to_catch_you/,32700,219,r/technicallythetruth
"Children who engaged in self-talk, saying favorable, encouraging words to themselves, improved their math performance when the talk focused on effort (e.g., ""I will do my very best!""), not ability (""I am very good at this!""), suggests new study (n=212 ages 9 to 13 years).",https://www.reddit.com/r/science/comments/ebtmjf/children_who_engaged_in_selftalk_saying_favorable/,32299,423,r/science
"The names Bond, Santa Bond.",https://www.reddit.com/r/DunderMifflin/comments/ebvval/the_names_bond_santa_bond/,32000,109,r/DunderMifflin
"Scale & Composition of Earth’s surface: crust, water and atmosphere [OC]",https://www.reddit.com/r/dataisbeautiful/comments/ebtln8/scale_composition_of_earths_surface_crust_water/,31900,419,r/dataisbeautiful
Like a well oiled machine. [RDR2O],https://www.reddit.com/r/gaming/comments/ec407e/like_a_well_oiled_machine_rdr2o/,31600,217,r/gaming
The struggle is real sometimes,https://www.reddit.com/r/pcmasterrace/comments/ebrb2o/the_struggle_is_real_sometimes/,31500,456,r/pcmasterrace
I root for you lil' bro!!!,https://www.reddit.com/r/dankmemes/comments/eby3ug/i_root_for_you_lil_bro/,31400,117,r/dankmemes
secks number L O L L M A O,https://www.reddit.com/r/dankmemes/comments/ebusp3/secks_number_l_o_l_l_m_a_o/,31200,137,r/dankmemes
human hand balloon,https://www.reddit.com/r/bonehurtingjuice/comments/ebsps8/human_hand_balloon/,31600,98,r/bonehurtingjuice
Hurry they are getting closer,https://www.reddit.com/r/memes/comments/ebwvlc/hurry_they_are_getting_closer/,30800,149,r/memes
Bringing back old memes for the end of the decade,https://www.reddit.com/r/dankmemes/comments/ebtv2a/bringing_back_old_memes_for_the_end_of_the_decade/,30400,74,r/dankmemes
"When Amy Schumer tried to ""prank"" Kim and Kanye",https://www.reddit.com/r/facepalm/comments/ebzu68/when_amy_schumer_tried_to_prank_kim_and_kanye/,30200,796,r/facepalm
Black magic battery cat,https://www.reddit.com/r/blackmagicfuckery/comments/ec3pvv/black_magic_battery_cat/,29600,345,r/blackmagicfuckery
[OC] I drew a large Eye of Ender,https://www.reddit.com/r/Minecraft/comments/ebugcz/oc_i_drew_a_large_eye_of_ender/,29500,255,r/Minecraft
What's the dumbest thing someone has told you?,https://www.reddit.com/r/AskReddit/comments/ebzush/whats_the_dumbest_thing_someone_has_told_you/,29400,18100,r/AskReddit
Don’t beam me up Scotty,https://www.reddit.com/r/memes/comments/ebxoz4/dont_beam_me_up_scotty/,29400,149,r/memes
Blursed_Nativity,https://www.reddit.com/r/blursedimages/comments/ec2w4i/blursed_nativity/,29400,135,r/blursedimages
"A Methane Leak, Seen From Space, Proves to Be Far Larger Than Thought - The Ohio blowout released more methane than the reported emissions of the oil and gas industries of countries like Norway and France",https://www.reddit.com/r/science/comments/ebw3kq/a_methane_leak_seen_from_space_proves_to_be_far/,29200,978,r/science
Nah just nah,https://www.reddit.com/r/dankmemes/comments/ebstvf/nah_just_nah/,29200,72,r/dankmemes
Doggo present,https://www.reddit.com/r/aww/comments/ebwdpk/doggo_present/,28900,193,r/aww
Pope lifts secrecy rules for sex abuse cases,https://www.reddit.com/r/news/comments/ebv7d1/pope_lifts_secrecy_rules_for_sex_abuse_cases/,28900,1200,r/news
"Nightmare came true, alone in a table for 10 in my birthday",https://www.reddit.com/r/sadcringe/comments/ec41qf/nightmare_came_true_alone_in_a_table_for_10_in_my/,29700,914,r/sadcringe
the thoughts so sharp,https://www.reddit.com/r/memes/comments/ec350a/the_thoughts_so_sharp/,28400,327,r/memes
He does have a point,https://www.reddit.com/r/memes/comments/ebqfqa/he_does_have_a_point/,28300,73,r/memes
I gotta get one of those,https://www.reddit.com/r/dankmemes/comments/ebpsoq/i_gotta_get_one_of_those/,28300,234,r/dankmemes
"But really, what does that cable thing do tho",https://www.reddit.com/r/MurderedByWords/comments/ebven3/but_really_what_does_that_cable_thing_do_tho/,28000,1200,r/MurderedByWords
I’m gay,https://www.reddit.com/r/comedyheaven/comments/ebt3vp/im_gay/,27900,175,r/comedyheaven
I'm so proud,https://www.reddit.com/r/dankmemes/comments/ebohfh/im_so_proud/,27800,794,r/dankmemes
