Title,Title Link,Score,Num Comments,Subreddit
Why so few Christmas memes?,https://www.reddit.com/r/memes/comments/ebu7u9/why_so_few_christmas_memes/,27700,100,r/memes
Really trying to get this template going. It worked last time,https://www.reddit.com/r/dankmemes/comments/ebwqdf/really_trying_to_get_this_template_going_it/,27600,218,r/dankmemes
I can’t leave my seat until TESB is recommended,https://www.reddit.com/r/PrequelMemes/comments/ebpyoy/i_cant_leave_my_seat_until_tesb_is_recommended/,27600,194,r/PrequelMemes
Only metalheads will know this very well know band,https://www.reddit.com/r/gatekeeping/comments/ebwiig/only_metalheads_will_know_this_very_well_know_band/,27500,2300,r/gatekeeping
"""This time my Drow Rogue won't be edgy, I swear!""",https://www.reddit.com/r/dndmemes/comments/ebswlf/this_time_my_drow_rogue_wont_be_edgy_i_swear/,27600,314,r/dndmemes
Bumpy ride,https://www.reddit.com/r/memes/comments/ebqy0t/bumpy_ride/,27400,93,r/memes
He can do it,https://www.reddit.com/r/memes/comments/ebrtcf/he_can_do_it/,27400,162,r/memes
hmmm,https://www.reddit.com/r/hmmm/comments/ebuzcs/hmmm/,27300,134,r/hmmm
This is the meme I've spent more time creating by far ngl.,https://www.reddit.com/r/dankmemes/comments/ebskwe/this_is_the_meme_ive_spent_more_time_creating_by/,27200,176,r/dankmemes
Not my problem,https://www.reddit.com/r/funny/comments/ebwz8n/not_my_problem/,27200,660,r/funny
We can all say that this is the best movie,https://www.reddit.com/r/PrequelMemes/comments/ebuxa0/we_can_all_say_that_this_is_the_best_movie/,27200,206,r/PrequelMemes
Let’s do it bois..,https://www.reddit.com/r/PewdiepieSubmissions/comments/ebz7ly/lets_do_it_bois/,27100,401,r/PewdiepieSubmissions
He is an inspiration,https://www.reddit.com/r/memes/comments/ebzv09/he_is_an_inspiration/,27000,128,r/memes
"The only photograph ever captured of the Concorde Supersonic airliner flying at Mach 2 (1,350 mph), taken by the pilot of an RAF Tornado fighter jet in 1994.",https://www.reddit.com/r/interestingasfuck/comments/ec0iln/the_only_photograph_ever_captured_of_the_concorde/,27000,637,r/interestingasfuck
"Furong, Hunan, China",https://www.reddit.com/r/interestingasfuck/comments/ec37az/furong_hunan_china/,26900,373,r/interestingasfuck
It really be like that.,https://www.reddit.com/r/memes/comments/ebyblq/it_really_be_like_that/,26800,196,r/memes
Red flying foxes trying to cool down in crocodile-infested waters,https://www.reddit.com/r/natureismetal/comments/ebvgnt/red_flying_foxes_trying_to_cool_down_in/,26700,339,r/natureismetal
"I can hear goodbye, Wataboku, Digital, 2018",https://www.reddit.com/r/Art/comments/ebxw2x/i_can_hear_goodbye_wataboku_digital_2018/,26600,184,r/Art
Makes sense,https://www.reddit.com/r/WhitePeopleTwitter/comments/ec3win/makes_sense/,26400,373,r/WhitePeopleTwitter
"Judge: I order you to pay $10,000",https://www.reddit.com/r/Jokes/comments/ebtrtb/judge_i_order_you_to_pay_10000/,26400,226,r/Jokes
I'll remember this betrayal,https://www.reddit.com/r/memes/comments/ebxdgj/ill_remember_this_betrayal/,26300,85,r/memes
"I'm just gonna put my face in this box and... YO, WTF",https://www.reddit.com/r/AnimalsBeingDerps/comments/ec1htm/im_just_gonna_put_my_face_in_this_box_and_yo_wtf/,26300,135,r/AnimalsBeingDerps
Boy Is Surprised To See His Lost Dog Who Was Gone for 2 Weeks When His Parents Pick Him Up From School,https://www.reddit.com/r/wholesomegifs/comments/ebo2xc/boy_is_surprised_to_see_his_lost_dog_who_was_gone/,26200,318,r/wholesomegifs
"Thanks, I hate my late night routine",https://www.reddit.com/r/TIHI/comments/ebo1bl/thanks_i_hate_my_late_night_routine/,26000,192,r/TIHI
Let's hope he doesn't say mine is small,https://www.reddit.com/r/PewdiepieSubmissions/comments/ebsdhe/lets_hope_he_doesnt_say_mine_is_small/,26000,78,r/PewdiepieSubmissions
Cursed park,https://www.reddit.com/r/cursedcomments/comments/ebyjvn/cursed_park/,25900,302,r/cursedcomments
One like and ill pick her up,https://www.reddit.com/r/Eyebleach/comments/ebtc8i/one_like_and_ill_pick_her_up/,25800,160,r/Eyebleach
"I feel you, man. I feel you.",https://www.reddit.com/r/suicidebywords/comments/ec34e8/i_feel_you_man_i_feel_you/,25700,110,r/suicidebywords
We can agree I guess,https://www.reddit.com/r/PewdiepieSubmissions/comments/ebsbrs/we_can_agree_i_guess/,25700,115,r/PewdiepieSubmissions
True story,https://www.reddit.com/r/dankmemes/comments/ebvr7k/true_story/,25700,223,r/dankmemes
My spirit animal,https://www.reddit.com/r/Wellthatsucks/comments/ec28z0/my_spirit_animal/,25300,156,r/Wellthatsucks
And 12 days of Christmas were gifted to the race of men,https://www.reddit.com/r/lotrmemes/comments/ebv4au/and_12_days_of_christmas_were_gifted_to_the_race/,25300,205,r/lotrmemes
Always,https://www.reddit.com/r/dankmemes/comments/ebzgyt/always/,25300,204,r/dankmemes
Gotta avoid that 2nd hand cancer,https://www.reddit.com/r/BikiniBottomTwitter/comments/ebuypz/gotta_avoid_that_2nd_hand_cancer/,25300,434,r/BikiniBottomTwitter
Where my fellow self-deprecating musicians at?,https://www.reddit.com/r/Tinder/comments/ebwnri/where_my_fellow_selfdeprecating_musicians_at/,25200,208,r/Tinder
Zuko and tea,https://www.reddit.com/r/TheLastAirbender/comments/ebxmx8/zuko_and_tea/,25000,300,r/TheLastAirbender
"My son reading to me because im getting over the flu.. What makes the special is that my son is dyslexic and particularly despises reading. But he came in my room, unprompted, to read me Dr. Seuss to make me feel better. I’m one of those lucky parents",https://www.reddit.com/r/aww/comments/ebogsa/my_son_reading_to_me_because_im_getting_over_the/,25000,234,r/aww
OH NO. I FORGOT TO LEARN MY SPANISH,https://www.reddit.com/r/dankmemes/comments/ebxcnm/oh_no_i_forgot_to_learn_my_spanish/,25000,144,r/dankmemes
sorry for the grind and for the old meme template,https://www.reddit.com/r/PewdiepieSubmissions/comments/ec1as8/sorry_for_the_grind_and_for_the_old_meme_template/,24900,72,r/PewdiepieSubmissions
Fast & Furious,https://www.reddit.com/r/memes/comments/ebw8hd/fast_furious/,24600,67,r/memes
Modern day art is a joke,https://www.reddit.com/r/FunnyandSad/comments/ebpahw/modern_day_art_is_a_joke/,24700,1200,r/FunnyandSad
Danny Devito introducing Bernie Sanders at a rally,https://www.reddit.com/r/SandersForPresident/comments/eby8di/danny_devito_introducing_bernie_sanders_at_a_rally/,24500,276,r/SandersForPresident
Ouchy,https://www.reddit.com/r/bonehurtingjuice/comments/ebzf9r/ouchy/,24400,46,r/bonehurtingjuice
I guess Temperance knew him better than the crusaders,https://www.reddit.com/r/ShitPostCrusaders/comments/ebxi74/i_guess_temperance_knew_him_better_than_the/,24200,203,r/ShitPostCrusaders
Those emojis are too bad,https://www.reddit.com/r/woooosh/comments/ebzldf/those_emojis_are_too_bad/,23900,298,r/woooosh
Sometimes I think it’s unfair how cute Mochi is. How am I supposed to say no to this face?!,https://www.reddit.com/r/aww/comments/ec0spb/sometimes_i_think_its_unfair_how_cute_mochi_is/,23800,195,r/aww
I brought tequila. Will you boys let me by?,https://www.reddit.com/r/ShitPostCrusaders/comments/ebuau7/i_brought_tequila_will_you_boys_let_me_by/,23800,128,r/ShitPostCrusaders
Hayden giving himself the high ground,https://www.reddit.com/r/StarWars/comments/ebzlr5/hayden_giving_himself_the_high_ground/,23800,595,r/StarWars
epic time,https://www.reddit.com/r/dankmemes/comments/ec05e8/epic_time/,23800,68,r/dankmemes
"No, I wanna die",https://www.reddit.com/r/thanosdidnothingwrong/comments/ebv5rr/no_i_wanna_die/,23800,94,r/thanosdidnothingwrong
O O F,https://www.reddit.com/r/PewdiepieSubmissions/comments/ebue4g/o_o_f/,23500,117,r/PewdiepieSubmissions
Not an easy job,https://www.reddit.com/r/dankmemes/comments/ebzmsr/not_an_easy_job/,23400,75,r/dankmemes
Does he even age anymore?,https://www.reddit.com/r/memes/comments/ebt71k/does_he_even_age_anymore/,23300,192,r/memes
Le Christmas spirit has arrived.,https://www.reddit.com/r/dogelore/comments/ec3qog/le_christmas_spirit_has_arrived/,24300,291,r/dogelore
"After dealing with the other team telling me and another girl on my team to ""Go back to the kitchen"" and saying other things I wont mention, I HAD to win this game. 1v4 Clutch against a group of jerks. Best game ever! (Side note: I was extremely anxious, sorry)",https://www.reddit.com/r/Rainbow6/comments/ebp7f5/after_dealing_with_the_other_team_telling_me_and/,23200,1400,r/Rainbow6
"The Letter, Me, Oil on Canvas, 2018",https://www.reddit.com/r/Art/comments/ebs684/the_letter_me_oil_on_canvas_2018/,23300,423,r/Art
"After Nearly 500 Days Of Being At The Shelter, Bonita Has Left The Building! ❤️",https://www.reddit.com/r/aww/comments/ebyvuo/after_nearly_500_days_of_being_at_the_shelter/,23200,297,r/aww
Maybe Maybe Maybe,https://www.reddit.com/r/maybemaybemaybe/comments/ebu7fy/maybe_maybe_maybe/,23100,324,r/maybemaybemaybe
Subvert Expectations? Well allow me to retort.,https://www.reddit.com/r/freefolk/comments/ebvjjo/subvert_expectations_well_allow_me_to_retort/,23100,304,r/freefolk
Here We Go Again...,https://www.reddit.com/r/StarWars/comments/ec3184/here_we_go_again/,23000,416,r/StarWars
Am I even real anymore?,https://www.reddit.com/r/memes/comments/ebu0tz/am_i_even_real_anymore/,22900,414,r/memes
I just woke up from hibernation,https://www.reddit.com/r/PewdiepieSubmissions/comments/ebt64r/i_just_woke_up_from_hibernation/,22900,90,r/PewdiepieSubmissions
"Never forget, I guess, but I'd rather forget it.",https://www.reddit.com/r/ATBGE/comments/ebv1kw/never_forget_i_guess_but_id_rather_forget_it/,22900,354,r/ATBGE
Fixed it,https://www.reddit.com/r/memes/comments/ebsefp/fixed_it/,22800,271,r/memes
Hai,https://www.reddit.com/r/AnimalsBeingDerps/comments/ebur4q/hai/,22700,89,r/AnimalsBeingDerps
I’m really good at pinball but suck at ms paint,https://www.reddit.com/r/memes/comments/ebwok5/im_really_good_at_pinball_but_suck_at_ms_paint/,22700,288,r/memes
Sebastian Vettel (Ferrari) yeets Mercedes cap,https://www.reddit.com/r/funny/comments/ebteen/sebastian_vettel_ferrari_yeets_mercedes_cap/,22700,256,r/funny
PsBattle: This Guy In A Room Full Of Bread.,https://www.reddit.com/r/photoshopbattles/comments/ebww8i/psbattle_this_guy_in_a_room_full_of_bread/,22700,573,r/photoshopbattles
Definitely FeelsBadMan,https://www.reddit.com/r/memes/comments/ebrsjo/definitely_feelsbadman/,22700,95,r/memes
Making dinner and notice someone spying.,https://www.reddit.com/r/WhatsWrongWithYourDog/comments/ec06qw/making_dinner_and_notice_someone_spying/,22600,152,r/WhatsWrongWithYourDog
*sad minecraft dog noises*,https://www.reddit.com/r/memes/comments/ebvp0e/sad_minecraft_dog_noises/,22500,145,r/memes
Spraying yourself with colored assault spray,https://www.reddit.com/r/WinStupidPrizes/comments/ebv1va/spraying_yourself_with_colored_assault_spray/,22500,623,r/WinStupidPrizes
Now that's what I call Finishing move!!!!,https://www.reddit.com/r/modernwarfare/comments/ebvt74/now_thats_what_i_call_finishing_move/,22400,342,r/modernwarfare
“So I’m..... not coming back then?”,https://www.reddit.com/r/freefolk/comments/ebonwh/so_im_not_coming_back_then/,22200,495,r/freefolk
Cursed pain relievers,https://www.reddit.com/r/cursedcomments/comments/ebt4zg/cursed_pain_relievers/,22200,86,r/cursedcomments
*boop boop* *dig dig*,https://www.reddit.com/r/wholesomememes/comments/ebrja2/boop_boop_dig_dig/,22200,76,r/wholesomememes
I saw this and translated it. Sorry for the bad edit.,https://www.reddit.com/r/PewdiepieSubmissions/comments/ebroiw/i_saw_this_and_translated_it_sorry_for_the_bad/,22200,184,r/PewdiepieSubmissions
I hate this,https://www.reddit.com/r/memes/comments/ebpm2z/i_hate_this/,22200,126,r/memes
I think I understand,https://www.reddit.com/r/dankmemes/comments/ebnzsl/i_think_i_understand/,22100,106,r/dankmemes
"He won't come back after break, right? Unless.....",https://www.reddit.com/r/PewdiepieSubmissions/comments/ebsbwj/he_wont_come_back_after_break_right_unless/,22000,182,r/PewdiepieSubmissions
Freediving in an old slate qarry. I‘m inside of the drainage shaft.,https://www.reddit.com/r/creepy/comments/ebzns2/freediving_in_an_old_slate_qarry_im_inside_of_the/,22100,501,r/creepy
Watch closely. This guy is working hard.,https://www.reddit.com/r/ANormalDayInRussia/comments/ebuash/watch_closely_this_guy_is_working_hard/,22000,281,r/ANormalDayInRussia
I’ve never been so offended by something I 100% agree with,https://www.reddit.com/r/KamikazeByWords/comments/ebw555/ive_never_been_so_offended_by_something_i_100/,22500,84,r/KamikazeByWords
Tetris Classic Pros Koryan and Joseph playing exactly the same moves for 36 seconds in tournament,https://www.reddit.com/r/youseeingthisshit/comments/ebvfim/tetris_classic_pros_koryan_and_joseph_playing/,21800,242,r/youseeingthisshit
So that was awkward,https://www.reddit.com/r/WhitePeopleTwitter/comments/ec0nmq/so_that_was_awkward/,21600,70,r/WhitePeopleTwitter
Ah yess,https://www.reddit.com/r/memes/comments/eby13j/ah_yess/,21500,64,r/memes
Make BEBE NOWWWWWWW !!!!,https://www.reddit.com/r/PewdiepieSubmissions/comments/ebvbrf/make_bebe_nowwwwwww/,21400,113,r/PewdiepieSubmissions
