Title,Title Link,Score,Num Comments,Subreddit
Hey everyone! Reddit asked me to recreate the little girl looking for her toys to come to life as a painting. So I stayed up last night...and here it is ☺️,https://www.reddit.com/r/aww/comments/ehldvi/hey_everyone_reddit_asked_me_to_recreate_the/,177000,1600,r/aww
"Hey everyone! Back in July I posted our sweet little rescue, Kyra. Everyone asked to see her progress, well Reddit...Here she is in all of her glory!",https://www.reddit.com/r/aww/comments/ehgbnr/hey_everyone_back_in_july_i_posted_our_sweet/,140000,1100,r/aww
"So long, 1999 gang. Enjoy your boomerhood.",https://www.reddit.com/r/teenagers/comments/ehsatv/so_long_1999_gang_enjoy_your_boomerhood/,122000,2100,r/teenagers
My mom painted this outlet to match the rocks.,https://www.reddit.com/r/mildlyinteresting/comments/ehfjh8/my_mom_painted_this_outlet_to_match_the_rocks/,114000,1000,r/mildlyinteresting
I drew a PS1 exploded view,https://www.reddit.com/r/gaming/comments/ehgqra/i_drew_a_ps1_exploded_view/,110000,2100,r/gaming
why,https://www.reddit.com/r/comedyheaven/comments/ehgh7g/why/,111000,587,r/comedyheaven
rate my setup,https://www.reddit.com/r/gaming/comments/eho2pf/rate_my_setup/,101000,2500,r/gaming
Genius cosplay,https://www.reddit.com/r/pics/comments/ehmpay/genius_cosplay/,98900,512,r/pics
House dog brings home and rescues a stray kitten,https://www.reddit.com/r/aww/comments/ehuh1m/house_dog_brings_home_and_rescues_a_stray_kitten/,94400,1100,r/aww
The “you missed the point my idolizing them” Starter Pack,https://www.reddit.com/r/starterpacks/comments/ehrjow/the_you_missed_the_point_my_idolizing_them/,98200,4800,r/starterpacks
Getting a speeding ticket on your towed car,https://www.reddit.com/r/mildlyinfuriating/comments/ehmq9t/getting_a_speeding_ticket_on_your_towed_car/,90000,982,r/mildlyinfuriating
"Either body soap or hair soap, Grafo not dum dum",https://www.reddit.com/r/funny/comments/ehomm8/either_body_soap_or_hair_soap_grafo_not_dum_dum/,89000,2000,r/funny
It's a no from me,https://www.reddit.com/r/dankmemes/comments/ehj6ku/its_a_no_from_me/,88600,1500,r/dankmemes
Lefty squad where y'all at,https://www.reddit.com/r/dankmemes/comments/ehnew1/lefty_squad_where_yall_at/,85200,888,r/dankmemes
Built a Pyramid PC,https://www.reddit.com/r/pcmasterrace/comments/ehjgy2/built_a_pyramid_pc/,84600,1800,r/pcmasterrace
Don’t drag me into this,https://www.reddit.com/r/memes/comments/ehk08x/dont_drag_me_into_this/,83700,369,r/memes
Peace out mo-fos!,https://www.reddit.com/r/memes/comments/ehfn15/peace_out_mofos/,80000,346,r/memes
I peaked in terms of laziness last night,https://www.reddit.com/r/perfectlycutscreams/comments/ehmr54/i_peaked_in_terms_of_laziness_last_night/,78500,500,r/perfectlycutscreams
Honeybee nest warning signal,https://www.reddit.com/r/interestingasfuck/comments/ehkwq8/honeybee_nest_warning_signal/,78200,1300,r/interestingasfuck
Let’s get this party started yo,https://www.reddit.com/r/BikiniBottomTwitter/comments/ehtly9/lets_get_this_party_started_yo/,79500,350,r/BikiniBottomTwitter
Let me tell you bout my best friend,https://www.reddit.com/r/wholesomememes/comments/ehrn6s/let_me_tell_you_bout_my_best_friend/,75600,336,r/wholesomememes
Hats of to you guys!,https://www.reddit.com/r/memes/comments/ehn9fm/hats_of_to_you_guys/,72200,1400,r/memes
Credit to u/AlexUrBoii.,https://www.reddit.com/r/rareinsults/comments/ehgha2/credit_to_ualexurboii/,75300,377,r/rareinsults
Go commit die,https://www.reddit.com/r/dankmemes/comments/ehekle/go_commit_die/,71400,279,r/dankmemes
How to moonwalk,https://www.reddit.com/r/BeAmazed/comments/ehkih4/how_to_moonwalk/,71500,759,r/BeAmazed
The Sniper,https://www.reddit.com/r/dankmemes/comments/ehkwkx/the_sniper/,70700,363,r/dankmemes
Truck crushes a car when making a turn,https://www.reddit.com/r/IdiotsInCars/comments/ehl5ve/truck_crushes_a_car_when_making_a_turn/,70600,1800,r/IdiotsInCars
We are a kind and generous people,https://www.reddit.com/r/EmpireDidNothingWrong/comments/ehqt2g/we_are_a_kind_and_generous_people/,70400,1100,r/EmpireDidNothingWrong
My mans played it cool.,https://www.reddit.com/r/madlads/comments/ehj6n6/my_mans_played_it_cool/,67200,218,r/madlads
A video of the office robin for those asking,https://www.reddit.com/r/aww/comments/ehni6t/a_video_of_the_office_robin_for_those_asking/,67000,961,r/aww
Let’s go Karen!!!,https://www.reddit.com/r/wholesomememes/comments/ehg4cw/lets_go_karen/,66300,285,r/wholesomememes
"These two champs, they knew what they were doing",https://www.reddit.com/r/madlads/comments/ehpr0i/these_two_champs_they_knew_what_they_were_doing/,64500,234,r/madlads
"Hey Reddit, When did your “Somethings not right here” gut Feeling ever save you?",https://www.reddit.com/r/AskReddit/comments/ehg5ac/hey_reddit_when_did_your_somethings_not_right/,63600,13000,r/AskReddit
In Harry Potter: TOOTP (2007) the girl in white can be seen recoiling in the background; this is because she has bumped into a Thestrel connected to the carriage.,https://www.reddit.com/r/MovieDetails/comments/ehfekc/in_harry_potter_tootp_2007_the_girl_in_white_can/,64400,905,r/MovieDetails
Grizzly bears' muscles don't atrophy during hibernation because they produce additional amino acids that stimulate muscle cell growth.,https://www.reddit.com/r/science/comments/ehp7ph/grizzly_bears_muscles_dont_atrophy_during/,62200,1100,r/science
I used to make tiny houses and furniture and left them around for my little sister to find so she would think little people lived in the house. Eventually I got kinda good at it.,https://www.reddit.com/r/pics/comments/ehegly/i_used_to_make_tiny_houses_and_furniture_and_left/,61700,801,r/pics
Google Earth is an amazing place,https://www.reddit.com/r/Unexpected/comments/ehorj3/google_earth_is_an_amazing_place/,61600,345,r/Unexpected
Ouch,https://www.reddit.com/r/Tinder/comments/ehpjrz/ouch/,61900,309,r/Tinder
Well done and smooth for the distance,https://www.reddit.com/r/PraiseTheCameraMan/comments/ehmyjy/well_done_and_smooth_for_the_distance/,68200,502,r/PraiseTheCameraMan
"Jonas Salk didn’t patent his 1955 polio vaccine so that it would be affordable for all people. As a result, he lost an estimated 7 billion dollars. Saying in an interview: “There is no patent. Could you patent the sun?”",https://www.reddit.com/r/OldSchoolCool/comments/ehgtao/jonas_salk_didnt_patent_his_1955_polio_vaccine_so/,59200,1400,r/OldSchoolCool
"RIP Syd Mead, the illustrator who was largely responsible what people in the 80's thought the future was going to look like, thanks to his work on Blade Runner, TRON and Aliens.",https://www.reddit.com/r/movies/comments/ehr12q/rip_syd_mead_the_illustrator_who_was_largely/,57100,483,r/movies
Homemade Snow Shovel,https://www.reddit.com/r/gifs/comments/ehqwr5/homemade_snow_shovel/,56500,1300,r/gifs
This restaurant has an angled mirror over the chefs so you can see an overhead view,https://www.reddit.com/r/mildlyinteresting/comments/ehndz8/this_restaurant_has_an_angled_mirror_over_the/,56300,822,r/mildlyinteresting
Blursed security,https://www.reddit.com/r/blursedimages/comments/ehmic6/blursed_security/,56500,342,r/blursedimages
How to cold start your pupper,https://www.reddit.com/r/aww/comments/ehkluh/how_to_cold_start_your_pupper/,55400,697,r/aww
Kermit the legend,https://www.reddit.com/r/memes/comments/ehsl1d/kermit_the_legend/,55100,447,r/memes
Crikey,https://www.reddit.com/r/PrequelMemes/comments/ehppx1/crikey/,55000,352,r/PrequelMemes
Tulsi Gabbard missed 85% of House votes this fall. Hawaii's ex-governor wants her to resign,https://www.reddit.com/r/politics/comments/ehlepq/tulsi_gabbard_missed_85_of_house_votes_this_fall/,53200,5000,r/politics
I feel your pain Jaskier...,https://www.reddit.com/r/witcher/comments/ehdy6g/i_feel_your_pain_jaskier/,53100,902,r/witcher
Being medium ugly is lit.,https://www.reddit.com/r/BrandNewSentence/comments/ehm8ai/being_medium_ugly_is_lit/,55100,451,r/BrandNewSentence
Bebe when?,https://www.reddit.com/r/PewdiepieSubmissions/comments/ehi5ja/bebe_when/,52500,164,r/PewdiepieSubmissions
"If plants could think, they would look at predators like lions and hyenas as their protectors from the evil herbivores.",https://www.reddit.com/r/Showerthoughts/comments/ehpp4r/if_plants_could_think_they_would_look_at/,52300,422,r/Showerthoughts
It do be like that,https://www.reddit.com/r/witcher/comments/ehs774/it_do_be_like_that/,52300,325,r/witcher
That bear isn’t gonna mess with a russian again.,https://www.reddit.com/r/memes/comments/ehjfqt/that_bear_isnt_gonna_mess_with_a_russian_again/,51900,239,r/memes
Picture of eagle taken the moment before diving in,https://www.reddit.com/r/Damnthatsinteresting/comments/ehjln0/picture_of_eagle_taken_the_moment_before_diving_in/,51500,597,r/Damnthatsinteresting
K-pop group performing in north korea,https://www.reddit.com/r/Wellthatsucks/comments/ehhwgy/kpop_group_performing_in_north_korea/,51200,1600,r/Wellthatsucks
"I made this, use it wisely",https://www.reddit.com/r/teenagers/comments/ehn8rg/i_made_this_use_it_wisely/,50900,371,r/teenagers
Blursed quiz,https://www.reddit.com/r/blursedimages/comments/ehrj4l/blursed_quiz/,48000,353,r/blursedimages
The dad reflex is strong with this one. Surviving an earthquake.,https://www.reddit.com/r/DadReflexes/comments/ehpt44/the_dad_reflex_is_strong_with_this_one_surviving/,49100,1300,r/DadReflexes
Goodbye to the only ones who will remember this,https://www.reddit.com/r/teenagers/comments/ehognm/goodbye_to_the_only_ones_who_will_remember_this/,47600,843,r/teenagers
My sister will die from cancer today. A room full of exhausted loves ones fighting with her!,https://www.reddit.com/r/pics/comments/ehi7ud/my_sister_will_die_from_cancer_today_a_room_full/,47400,2300,r/pics
"2019 has been the best year in global history. Child mortality is at its lowest ever. Every day 170,000 people moved out of extreme poverty, 325,000 people got their first access to electricity, 200,000 got piped water for the first time & 650,000 went online",https://www.reddit.com/r/UpliftingNews/comments/ehesr7/2019_has_been_the_best_year_in_global_history/,47400,3300,r/UpliftingNews
"Release m̡e̤̬͞,̗̺͠ Jͫͬ̾ỏͬͤn̒ͣͬ.ͯͣ̈́҉̴̛̦",https://www.reddit.com/r/imsorryjon/comments/ehloyi/release_me_jon/,48300,216,r/imsorryjon
Well that isn't good,https://www.reddit.com/r/agedlikemilk/comments/ehlq24/well_that_isnt_good/,48500,579,r/agedlikemilk
Smol,https://www.reddit.com/r/suicidebywords/comments/ehe5pk/smol/,50100,281,r/suicidebywords
TIL that a wedding planner in England died after eating a scalding-hot fishcake at a wedding. It burned his throat so badly that it left him unable to breathe. The cause of death was ruled as asphyxiation. The coroner said it was similar to smoke inhalation from house fires.,https://www.reddit.com/r/todayilearned/comments/ehrjw9/til_that_a_wedding_planner_in_england_died_after/,46900,2100,r/todayilearned
Baby tiger sneaks up on its mom,https://www.reddit.com/r/gifs/comments/ehffl7/baby_tiger_sneaks_up_on_its_mom/,46700,346,r/gifs
"The next question is, What about the Witcher?",https://www.reddit.com/r/lotrmemes/comments/ehr85i/the_next_question_is_what_about_the_witcher/,46000,583,r/lotrmemes
Evolution of Observer,https://www.reddit.com/r/Minecraft/comments/ehqile/evolution_of_observer/,45000,520,r/Minecraft
Blursed_Blast,https://www.reddit.com/r/blursedimages/comments/ehiw62/blursed_blast/,45000,424,r/blursedimages
Boat wreck reclaimed by nature and turned into an island.,https://www.reddit.com/r/interestingasfuck/comments/ehp7b7/boat_wreck_reclaimed_by_nature_and_turned_into_an/,44600,319,r/interestingasfuck
We're all fine now,https://www.reddit.com/r/dankmemes/comments/ehqls5/were_all_fine_now/,44000,136,r/dankmemes
He spotted a new friend,https://www.reddit.com/r/Eyebleach/comments/ehepbh/he_spotted_a_new_friend/,43900,317,r/Eyebleach
Old but gold,https://www.reddit.com/r/WatchPeopleDieInside/comments/ehs9rr/old_but_gold/,43500,746,r/WatchPeopleDieInside
"Erik Prince, a major Republican donor and founder of controversial security firm Blackwater, has been referred to the U.S. Treasury Department for possible sanctions violations tied to his recent trip to Venezuela for a meeting with a top aide of President Nicolas Maduro",https://www.reddit.com/r/worldnews/comments/eht8bn/erik_prince_a_major_republican_donor_and_founder/,43200,1600,r/worldnews
Teenage climate change activist Greta Thunberg said on Monday that talking to Trump at a UN summit on global warming would have been a waste of time since he would not have paid any attention.,https://www.reddit.com/r/worldnews/comments/ehmal0/teenage_climate_change_activist_greta_thunberg/,42900,4000,r/worldnews
This car dealership’s desk is an old Rolls-Royce,https://www.reddit.com/r/mildlyinteresting/comments/ehmch1/this_car_dealerships_desk_is_an_old_rollsroyce/,42800,418,r/mildlyinteresting
He's got a good point..,https://www.reddit.com/r/trippinthroughtime/comments/ehmmpz/hes_got_a_good_point/,43300,120,r/trippinthroughtime
Døminœs the warrior,https://www.reddit.com/r/Bossfight/comments/ehmow2/døminœs_the_warrior/,46600,369,r/Bossfight
Just no.,https://www.reddit.com/r/awfuleverything/comments/eheqt3/just_no/,43200,577,r/awfuleverything
Pizza time.,https://www.reddit.com/r/dankmemes/comments/ehmx3x/pizza_time/,42400,368,r/dankmemes
Stil sweet tho,https://www.reddit.com/r/memes/comments/ehmwuh/stil_sweet_tho/,42300,232,r/memes
🔥 A young swordfish swimming around a marina 🔥,https://www.reddit.com/r/NatureIsFuckingLit/comments/ehtszp/a_young_swordfish_swimming_around_a_marina/,42200,300,r/NatureIsFuckingLit
Me_irl,https://www.reddit.com/r/me_irl/comments/ehsxdl/me_irl/,42000,285,r/me_irl
Me_irl,https://www.reddit.com/r/me_irl/comments/ehj8zn/me_irl/,41900,89,r/me_irl
Why can't i see anything?,https://www.reddit.com/r/facepalm/comments/ehjuwb/why_cant_i_see_anything/,41600,264,r/facepalm
🔥 Petrified opal tree trunk located in Arizona (about 225 million years old),https://www.reddit.com/r/NatureIsFuckingLit/comments/ehmfu7/petrified_opal_tree_trunk_located_in_arizona/,41500,476,r/NatureIsFuckingLit
Eliminate,https://www.reddit.com/r/trippinthroughtime/comments/ehtyqo/eliminate/,41700,340,r/trippinthroughtime
I miss him,https://www.reddit.com/r/memes/comments/ehm3oc/i_miss_him/,41300,567,r/memes
"I am so proud of my mother (General Leia) and how much love she brings to the Star Wars community. May the Force Be With You, Always.",https://www.reddit.com/r/StarWars/comments/ehu9b3/i_am_so_proud_of_my_mother_general_leia_and_how/,41200,840,r/StarWars
My friend tries Elytra for the first time,https://www.reddit.com/r/Minecraft/comments/ehkb1i/my_friend_tries_elytra_for_the_first_time/,41000,365,r/Minecraft
mAn CRuShEs OpPONenT wITH a RoCK,https://www.reddit.com/r/PeopleFuckingDying/comments/ehn2kx/man_crushes_opponent_with_a_rock/,41600,347,r/PeopleFuckingDying
genius cosplay,https://www.reddit.com/r/nextfuckinglevel/comments/ehpm09/genius_cosplay/,40700,202,r/nextfuckinglevel
Sealing floor tiles with grout,https://www.reddit.com/r/oddlysatisfying/comments/ehmsbp/sealing_floor_tiles_with_grout/,40300,470,r/oddlysatisfying
Clean swipe,https://www.reddit.com/r/gifs/comments/ehkipa/clean_swipe/,39900,555,r/gifs
Haha epic he ded,https://www.reddit.com/r/dankmemes/comments/ehlko7/haha_epic_he_ded/,39700,117,r/dankmemes
FYI,https://www.reddit.com/r/suspiciouslyspecific/comments/ehtub4/fyi/,39900,329,r/suspiciouslyspecific
I’d like to eat here. Unsure when is ok,https://www.reddit.com/r/CrappyDesign/comments/ehmp52/id_like_to_eat_here_unsure_when_is_ok/,39300,727,r/CrappyDesign
"Asked a girl out, she said no, I got nervous turned around and broke my clavicle by slipping on ice. How was your day.",https://www.reddit.com/r/teenagers/comments/ehn6be/asked_a_girl_out_she_said_no_i_got_nervous_turned/,39300,1100,r/teenagers
Poor girl,https://www.reddit.com/r/notliketheothergirls/comments/ehlepm/poor_girl/,44700,775,r/notliketheothergirls
Whoopi cushion,https://www.reddit.com/r/wholesomememes/comments/ehnvpp/whoopi_cushion/,38500,118,r/wholesomememes
Maybe Maybe Maybe,https://www.reddit.com/r/maybemaybemaybe/comments/ehlrao/maybe_maybe_maybe/,38500,1100,r/maybemaybemaybe
Ahh yes 5318008 I remember,https://www.reddit.com/r/memes/comments/ehhba0/ahh_yes_5318008_i_remember/,38200,140,r/memes
My Arm Tastes Good,https://www.reddit.com/r/Eyebleach/comments/ehu4fa/my_arm_tastes_good/,38200,122,r/Eyebleach
Literally the only person who enjoyed Cats.,https://www.reddit.com/r/DunderMifflin/comments/ehuhki/literally_the_only_person_who_enjoyed_cats/,38000,545,r/DunderMifflin
They just wanted a hug,https://www.reddit.com/r/rarepuppers/comments/ehqs5g/they_just_wanted_a_hug/,37700,191,r/rarepuppers
Getting a speeding ticket on your car as it’s being towed,https://www.reddit.com/r/Wellthatsucks/comments/ehmpww/getting_a_speeding_ticket_on_your_car_as_its/,37600,349,r/Wellthatsucks
"So I managed to Rick roll this person and I asked if I got them, they responded with this. The r/rareinsults is a Rick roll as well.",https://www.reddit.com/r/rareinsults/comments/ehntp3/so_i_managed_to_rick_roll_this_person_and_i_asked/,37400,392,r/rareinsults
[Homemade] Nashville Hot Chicken Sandwich,https://www.reddit.com/r/food/comments/ehmanl/homemade_nashville_hot_chicken_sandwich/,37200,744,r/food
Always that little shock,https://www.reddit.com/r/pcmasterrace/comments/eholfc/always_that_little_shock/,36700,292,r/pcmasterrace
The chosen one! [not deleted],https://www.reddit.com/r/PrequelMemes/comments/ehlncm/the_chosen_one_not_deleted/,36600,314,r/PrequelMemes
Angry Boyle has the best insults,https://www.reddit.com/r/brooklynninenine/comments/ehnxtw/angry_boyle_has_the_best_insults/,36000,169,r/brooklynninenine
SLPT: Say no to drugs,https://www.reddit.com/r/ShittyLifeProTips/comments/ehrjnw/slpt_say_no_to_drugs/,36200,187,r/ShittyLifeProTips
How to cold start a dog,https://www.reddit.com/r/Eyebleach/comments/ehmta8/how_to_cold_start_a_dog/,35800,293,r/Eyebleach
"This implies that the person played the game for 8,492 hours, and then gave it a negative review. After doing that, they played the game for another 9,165.9 hours.",https://www.reddit.com/r/gaming/comments/ehs3pz/this_implies_that_the_person_played_the_game_for/,35800,1100,r/gaming
I too practice what I preach,https://www.reddit.com/r/dankmemes/comments/ehouvo/i_too_practice_what_i_preach/,35500,182,r/dankmemes
"TIL ""Accuracy"" is the ability to hit a target, ""Precision"" is the ability to achieve the same results over and over. You can be accurate without being precise, and precise without being accurate.",https://www.reddit.com/r/todayilearned/comments/ehno11/til_accuracy_is_the_ability_to_hit_a_target/,35300,1300,r/todayilearned
Someone took the English subtitles of a pirated Chinese copy of Revenge of the Sith and turned them into a dub of the original movie,https://www.reddit.com/r/videos/comments/ehj358/someone_took_the_english_subtitles_of_a_pirated/,35000,1300,r/videos
That's how UNO works,https://www.reddit.com/r/dankmemes/comments/ehuf33/thats_how_uno_works/,34800,123,r/dankmemes
The year isn't over yet! Go donate!,https://www.reddit.com/r/dankmemes/comments/ehk3oe/the_year_isnt_over_yet_go_donate/,34600,181,r/dankmemes
this pupper shaved like a horse,https://www.reddit.com/r/awfuleverything/comments/ehmil2/this_pupper_shaved_like_a_horse/,34800,235,r/awfuleverything
She has now seen it all,https://www.reddit.com/r/youseeingthisshit/comments/ehh0b7/she_has_now_seen_it_all/,34600,253,r/youseeingthisshit
I think we always knew bullies were weak-boned.,https://www.reddit.com/r/Neverbrokeabone/comments/eho19y/i_think_we_always_knew_bullies_were_weakboned/,38700,412,r/Neverbrokeabone
Hold up,https://www.reddit.com/r/HistoryMemes/comments/ehktrl/hold_up/,34500,275,r/HistoryMemes
That's the most kick-able grin,https://www.reddit.com/r/memes/comments/ehjrgz/thats_the_most_kickable_grin/,34000,122,r/memes
2meirl4meirl,https://www.reddit.com/r/2meirl4meirl/comments/ehiokz/2meirl4meirl/,33900,236,r/2meirl4meirl
I liked them all,https://www.reddit.com/r/PrequelMemes/comments/ehmseq/i_liked_them_all/,33800,746,r/PrequelMemes
The Witcher original books' writer's jab at the very moment GoT showrunners run out of source material.,https://www.reddit.com/r/freefolk/comments/ehkzp7/the_witcher_original_books_writers_jab_at_the/,33700,1200,r/freefolk
Sorry for eventual error but im not english,https://www.reddit.com/r/PewdiepieSubmissions/comments/ehlc8b/sorry_for_eventual_error_but_im_not_english/,33600,105,r/PewdiepieSubmissions
Sniping a roach with a blowdart,https://www.reddit.com/r/nextfuckinglevel/comments/ehgkk5/sniping_a_roach_with_a_blowdart/,33500,595,r/nextfuckinglevel
I want to wrestle with the maid too!,https://www.reddit.com/r/dankmemes/comments/eho2lj/i_want_to_wrestle_with_the_maid_too/,33400,107,r/dankmemes
Some bizarre facts,https://www.reddit.com/r/ShitPostCrusaders/comments/ehlurq/some_bizarre_facts/,33900,641,r/ShitPostCrusaders
Especially from front camera,https://www.reddit.com/r/memes/comments/ehlcrl/especially_from_front_camera/,33300,133,r/memes
4 underage men accused of drinking while operating horse and buggy,https://www.reddit.com/r/nottheonion/comments/ehpqh7/4_underage_men_accused_of_drinking_while/,33100,2100,r/nottheonion
Best friends,https://www.reddit.com/r/aww/comments/ehppa3/best_friends/,33100,190,r/aww
Cheap sunglasses in front of iPhone lens makes for eerie warmth (oc),https://www.reddit.com/r/pics/comments/ehrqbm/cheap_sunglasses_in_front_of_iphone_lens_makes/,32900,335,r/pics
"Now, I don’t really care",https://www.reddit.com/r/dankmemes/comments/ehrk5f/now_i_dont_really_care/,32900,111,r/dankmemes
Stop It YouTube,https://www.reddit.com/r/dankmemes/comments/ehk5ds/stop_it_youtube/,32700,115,r/dankmemes
Hmmmmmmmm,https://www.reddit.com/r/memes/comments/ehlo7u/hmmmmmmmm/,32600,138,r/memes
When you had too much fun at the beach,https://www.reddit.com/r/rarepuppers/comments/ehjs26/when_you_had_too_much_fun_at_the_beach/,32100,230,r/rarepuppers
I can't think of an interesting title,https://www.reddit.com/r/PewdiepieSubmissions/comments/ehkkjq/i_cant_think_of_an_interesting_title/,32000,111,r/PewdiepieSubmissions
Go Commit Not Alive,https://www.reddit.com/r/dankmemes/comments/ehmuxv/go_commit_not_alive/,31900,285,r/dankmemes
Fast delivery,https://www.reddit.com/r/technicallythetruth/comments/eht3ts/fast_delivery/,31800,182,r/technicallythetruth
When Will We Stop Screwing Poor and Rural Americans on Broadband?,https://www.reddit.com/r/technology/comments/ehmy7q/when_will_we_stop_screwing_poor_and_rural/,31600,2800,r/technology
GOP purges voters in close election states ahead of 2020,https://www.reddit.com/r/politics/comments/ehfb5d/gop_purges_voters_in_close_election_states_ahead/,31200,2000,r/politics
Turning People into JoJo Characters until Stone Ocean is announced: Day 24,https://www.reddit.com/r/ShitPostCrusaders/comments/ehs4qb/turning_people_into_jojo_characters_until_stone/,31300,238,r/ShitPostCrusaders
One of the cutest argument,https://www.reddit.com/r/gifs/comments/ehmaqs/one_of_the_cutest_argument/,31000,317,r/gifs
For all the Dunder Mifflinites that sort by new.,https://www.reddit.com/r/DunderMifflin/comments/ehefny/for_all_the_dunder_mifflinites_that_sort_by_new/,30900,368,r/DunderMifflin
"In Walk Hard: The Dewey Cox Story (2007) after Dewey marries Darlene while still married to Edith, he can be seen wearing both of his wedding rings",https://www.reddit.com/r/MovieDetails/comments/eho175/in_walk_hard_the_dewey_cox_story_2007_after_dewey/,30900,640,r/MovieDetails
apolgy for bad english,https://www.reddit.com/r/dankmemes/comments/ehm93u/apolgy_for_bad_english/,30800,140,r/dankmemes
His beat boxing is bad ass plus she has a beautiful voice,https://www.reddit.com/r/nextfuckinglevel/comments/ehfd1r/his_beat_boxing_is_bad_ass_plus_she_has_a/,30700,438,r/nextfuckinglevel
"The North Atlantic Current may cease temporarily in the next century. It transports warm water from the Gulf of Mexico towards Europe, providing north-western Europe with a relatively mild climate. There is a 15% likelihood that there will be a temporary change in the current in the next 100 years.",https://www.reddit.com/r/science/comments/ehkld8/the_north_atlantic_current_may_cease_temporarily/,30700,1600,r/science
"My Dad just started a new job, and today he sent me this picture saying they share an office building with a company I might know.",https://www.reddit.com/r/pcmasterrace/comments/eht9nc/my_dad_just_started_a_new_job_and_today_he_sent/,30600,489,r/pcmasterrace
Why do we pay anyway?,https://www.reddit.com/r/technicallythetruth/comments/ehmbzs/why_do_we_pay_anyway/,30500,167,r/technicallythetruth
Sneak Level 100,https://www.reddit.com/r/AnimalsBeingDerps/comments/ehs15i/sneak_level_100/,30100,217,r/AnimalsBeingDerps
My mind when the teacher describes cell division,https://www.reddit.com/r/dankmemes/comments/ehmp1k/my_mind_when_the_teacher_describes_cell_division/,30000,214,r/dankmemes
Unpopular Opinion and I'm ready for you to attack me,https://www.reddit.com/r/PewdiepieSubmissions/comments/ehnxos/unpopular_opinion_and_im_ready_for_you_to_attack/,30000,320,r/PewdiepieSubmissions
The actual reason he became Joker,https://www.reddit.com/r/dankmemes/comments/ehgus3/the_actual_reason_he_became_joker/,30000,164,r/dankmemes
It’s almost 2020 make it happen,https://www.reddit.com/r/WhitePeopleTwitter/comments/ehnah7/its_almost_2020_make_it_happen/,30000,300,r/WhitePeopleTwitter
To prank Kansas,https://www.reddit.com/r/therewasanattempt/comments/ehov9s/to_prank_kansas/,29800,722,r/therewasanattempt
Mad bot,https://www.reddit.com/r/madlads/comments/ehei91/mad_bot/,29800,174,r/madlads
Reality is often disappointing,https://www.reddit.com/r/dankmemes/comments/eht326/reality_is_often_disappointing/,29500,103,r/dankmemes
