Title,Title Link,Score,Num Comments,Subreddit
You get brutally murdered if you forget your flair,https://www.reddit.com/r/teenagers/comments/ehiiyl/you_get_brutally_murdered_if_you_forget_your_flair/,29300,90,r/teenagers
A shape measuring tool that helps create custom edges,https://www.reddit.com/r/Damnthatsinteresting/comments/eho1qp/a_shape_measuring_tool_that_helps_create_custom/,29300,322,r/Damnthatsinteresting
What do you collect?,https://www.reddit.com/r/AskReddit/comments/ehtq3g/what_do_you_collect/,29100,17100,r/AskReddit
Video games make kids violent (not),https://www.reddit.com/r/dankmemes/comments/ehqj6m/video_games_make_kids_violent_not/,29000,121,r/dankmemes
"🔥 Bengal tiger walking along fort ruins on a misty morning, by Nitish Madan 🔥",https://www.reddit.com/r/NatureIsFuckingLit/comments/ehkcvz/bengal_tiger_walking_along_fort_ruins_on_a_misty/,29000,119,r/NatureIsFuckingLit
20 Years of Anime,https://www.reddit.com/r/anime/comments/ehn1dt/20_years_of_anime/,29100,1000,r/anime
"Tim Boyle, Veteran Recording Engineer and Scoring Mixer, Dies at 71 - Worked On Over 300 Films, Including 'The Sandlot', 'Bill & Ted', 'Starship Troopers', 'Team America', 'South Park', 'Johnny Mnemonic'",https://www.reddit.com/r/movies/comments/ehl69c/tim_boyle_veteran_recording_engineer_and_scoring/,28800,306,r/movies
It's getting worse and worse,https://www.reddit.com/r/teenagers/comments/ehfi7f/its_getting_worse_and_worse/,28500,249,r/teenagers
Is she ok?,https://www.reddit.com/r/suspiciouslyspecific/comments/ehf459/is_she_ok/,28300,169,r/suspiciouslyspecific
Hope this doesn’t break this sub.,https://www.reddit.com/r/aww/comments/ehtwjf/hope_this_doesnt_break_this_sub/,28200,197,r/aww
So i was bored and decided to look up if Deino has eyes and-,https://www.reddit.com/r/pokemon/comments/ehlkrx/so_i_was_bored_and_decided_to_look_up_if_deino/,28200,361,r/pokemon
Completing an all black puzzle [OC],https://www.reddit.com/r/oddlysatisfying/comments/ehns0b/completing_an_all_black_puzzle_oc/,28000,259,r/oddlysatisfying
Donald Trump must be cross-examined at his impeachment trial where he can't run from facts,https://www.reddit.com/r/politics/comments/ehooqo/donald_trump_must_be_crossexamined_at_his/,27900,1300,r/politics
Those 400 side quests weren’t going to complete themselves Ciri,https://www.reddit.com/r/witcher/comments/ehnqn2/those_400_side_quests_werent_going_to_complete/,28000,359,r/witcher
How it feels to chew 5 Gum,https://www.reddit.com/r/freefolk/comments/ehshx5/how_it_feels_to_chew_5_gum/,27800,262,r/freefolk
Not good seeing ya😉,https://www.reddit.com/r/rickandmorty/comments/ehovpj/not_good_seeing_ya/,27800,154,r/rickandmorty
Twas a good decade,https://www.reddit.com/r/dankmemes/comments/ehldid/twas_a_good_decade/,27700,292,r/dankmemes
Little girl does a spinout on her new toy,https://www.reddit.com/r/funny/comments/ehtvb6/little_girl_does_a_spinout_on_her_new_toy/,27700,837,r/funny
me_irl,https://www.reddit.com/r/me_irl/comments/ehmo1u/me_irl/,27500,241,r/me_irl
🔥 Baby seal about to surface,https://www.reddit.com/r/NatureIsFuckingLit/comments/ehrm31/baby_seal_about_to_surface/,27300,182,r/NatureIsFuckingLit
The Thief Catching Net from 1969!,https://www.reddit.com/r/specializedtools/comments/ehkrna/the_thief_catching_net_from_1969/,27400,446,r/specializedtools
Legal reasons,https://www.reddit.com/r/memes/comments/ehegnk/legal_reasons/,27100,168,r/memes
Untitled Goose Game has sold 1 million copies!,https://www.reddit.com/r/NintendoSwitch/comments/eht5cu/untitled_goose_game_has_sold_1_million_copies/,26700,695,r/NintendoSwitch
Old format but whatever,https://www.reddit.com/r/memes/comments/ehla89/old_format_but_whatever/,26700,68,r/memes
Trump and Putin Had a Nice Christmas Chat But the White House Isn't Talking About It,https://www.reddit.com/r/politics/comments/ehn14j/trump_and_putin_had_a_nice_christmas_chat_but_the/,26600,1400,r/politics
Here we are after surviving what ended up being 50:34 of straight movies. I only slept through Iron Man 3 and half of Infinity War.,https://www.reddit.com/r/marvelstudios/comments/ehgkgt/here_we_are_after_surviving_what_ended_up_being/,26600,644,r/marvelstudios
"Careful, we got a smart one!",https://www.reddit.com/r/woooosh/comments/ehmaaa/careful_we_got_a_smart_one/,26600,257,r/woooosh
Grandma is the best,https://www.reddit.com/r/memes/comments/ehqfkv/grandma_is_the_best/,26500,126,r/memes
No idea what day of the week or what the number is,https://www.reddit.com/r/memes/comments/ehjajh/no_idea_what_day_of_the_week_or_what_the_number_is/,26500,101,r/memes
Never thought about it that way,https://www.reddit.com/r/technicallythetruth/comments/ehe4j0/never_thought_about_it_that_way/,26100,96,r/technicallythetruth
"Bolton Has No Excuse, ‘Must Testify’ Now That Judge Has Dismissed Kupperman’s Lawsuit: Legal Experts",https://www.reddit.com/r/politics/comments/ehtpti/bolton_has_no_excuse_must_testify_now_that_judge/,26100,728,r/politics
Me returning to work today after the Christmas break,https://www.reddit.com/r/reactiongifs/comments/ehmcy4/me_returning_to_work_today_after_the_christmas/,26000,313,r/reactiongifs
[He stabs him],https://www.reddit.com/r/dankmemes/comments/ehljb0/he_stabs_him/,26000,227,r/dankmemes
Tiny little flying pigs,https://www.reddit.com/r/Minecraft/comments/eheb6w/tiny_little_flying_pigs/,26000,331,r/Minecraft
Cursed_Dr.Suess,https://www.reddit.com/r/cursedcomments/comments/ehgcrz/cursed_drsuess/,26000,313,r/cursedcomments
"The Pepe I posted earlier this week was hit by a meteorite today, really feelsbadman.",https://www.reddit.com/r/Terraria/comments/ehryp4/the_pepe_i_posted_earlier_this_week_was_hit_by_a/,28700,415,r/Terraria
I'll never forget the day I accidentally made Nicolas Cage in Bloodborne.,https://www.reddit.com/r/gaming/comments/ehm57q/ill_never_forget_the_day_i_accidentally_made/,25800,312,r/gaming
1’s opponent went AFK so I switched the field up on him.,https://www.reddit.com/r/RocketLeague/comments/ehoc3d/1s_opponent_went_afk_so_i_switched_the_field_up/,25800,381,r/RocketLeague
betrayal at its finest,https://www.reddit.com/r/memes/comments/ehkh20/betrayal_at_its_finest/,25600,94,r/memes
Just get the popcorn kernel out,https://www.reddit.com/r/memes/comments/ehgfte/just_get_the_popcorn_kernel_out/,25600,75,r/memes
i hope someone helps him,https://www.reddit.com/r/memes/comments/ehnk87/i_hope_someone_helps_him/,25500,619,r/memes
Microsoft Paint 100,https://www.reddit.com/r/memes/comments/ehk7f1/microsoft_paint_100/,25400,141,r/memes
*laser sounds*,https://www.reddit.com/r/funny/comments/ehms1o/laser_sounds/,25400,219,r/funny
"Happy new year, gamers",https://www.reddit.com/r/dankmemes/comments/ehgcm1/happy_new_year_gamers/,25400,57,r/dankmemes
Christmas village beggar returns. I don't know how to link my original post but you can find it in my profile. Worth the back story. Honestly was excited to see a message from this guy again haha,https://www.reddit.com/r/ChoosingBeggars/comments/ehkdvy/christmas_village_beggar_returns_i_dont_know_how/,25200,1000,r/ChoosingBeggars
Give them the ol’ razzle dazzle...,https://www.reddit.com/r/AnimalsBeingDerps/comments/ehe5aa/give_them_the_ol_razzle_dazzle/,24700,141,r/AnimalsBeingDerps
Sad day,https://www.reddit.com/r/ANormalDayInRussia/comments/ehfcni/sad_day/,24800,170,r/ANormalDayInRussia
Joe Mixon accidentally takes out a referee with his helmet while celebrating,https://www.reddit.com/r/sports/comments/ehlq8w/joe_mixon_accidentally_takes_out_a_referee_with/,24500,633,r/sports
My grandma was the Underwood Typewriter girl. It’s one of her favorite stories that she tells everyone within 10 minutes of meeting her. She got her hands on one recently and took it for a spin. Original picture from 1945.,https://www.reddit.com/r/OldSchoolCool/comments/ehm0wy/my_grandma_was_the_underwood_typewriter_girl_its/,24500,260,r/OldSchoolCool
"My girlfriend’s rabbit, Banjo, has a smaller rabbit on his nose",https://www.reddit.com/r/aww/comments/ehsxqb/my_girlfriends_rabbit_banjo_has_a_smaller_rabbit/,24400,115,r/aww
[He stabs him],https://www.reddit.com/r/dankmemes/comments/ehmy66/he_stabs_him/,24300,106,r/dankmemes
Who says crime doesn't pay?,https://www.reddit.com/r/memes/comments/ehpbpx/who_says_crime_doesnt_pay/,24200,52,r/memes
🔥 A gorgeous baby Emperor penguin having trouble with some thin ice 🔥,https://www.reddit.com/r/NatureIsFuckingLit/comments/ehf6d0/a_gorgeous_baby_emperor_penguin_having_trouble/,24200,204,r/NatureIsFuckingLit
[OC] A real knock-out criteria,https://www.reddit.com/r/memes/comments/ehlr69/oc_a_real_knockout_criteria/,24100,344,r/memes
Visible confusion,https://www.reddit.com/r/memes/comments/ehheq3/visible_confusion/,24000,128,r/memes
"Christian parents are the best, aren’t they?",https://www.reddit.com/r/memes/comments/ehoxta/christian_parents_are_the_best_arent_they/,24000,179,r/memes
What a year,https://www.reddit.com/r/CasualUK/comments/ehnllb/what_a_year/,24000,464,r/CasualUK
hmmm,https://www.reddit.com/r/hmmm/comments/ehst81/hmmm/,23700,489,r/hmmm
Bartender M.D.,https://www.reddit.com/r/tumblr/comments/ehruc2/bartender_md/,23600,149,r/tumblr
"Killer Bean memes are a great investment, buy some shares now [OC]",https://www.reddit.com/r/MemeEconomy/comments/ehrivl/killer_bean_memes_are_a_great_investment_buy_some/,23600,141,r/MemeEconomy
I have the power of god and anime on my side,https://www.reddit.com/r/dankmemes/comments/ehlwbc/i_have_the_power_of_god_and_anime_on_my_side/,23500,72,r/dankmemes
The best NYE ever,https://www.reddit.com/r/wholesomememes/comments/ehthn6/the_best_nye_ever/,23400,217,r/wholesomememes
My wedding cake topper from 8 years ago.,https://www.reddit.com/r/gaming/comments/ehqjpr/my_wedding_cake_topper_from_8_years_ago/,23200,846,r/gaming
The 501st is life,https://www.reddit.com/r/PrequelMemes/comments/ehu9q0/the_501st_is_life/,22800,148,r/PrequelMemes
F for my man Carter,https://www.reddit.com/r/suicidebywords/comments/ehu41t/f_for_my_man_carter/,22800,120,r/suicidebywords
Purple Friends are the best,https://www.reddit.com/r/memes/comments/ehkxf4/purple_friends_are_the_best/,22600,105,r/memes
Dead birds and rashes: Hong Kong residents fear tear gas poisoning,https://www.reddit.com/r/HongKong/comments/ehsvr3/dead_birds_and_rashes_hong_kong_residents_fear/,22500,382,r/HongKong
bruh moment,https://www.reddit.com/r/dankmemes/comments/eheugt/bruh_moment/,22500,148,r/dankmemes
Years of evolution wasted,https://www.reddit.com/r/dankmemes/comments/ehspen/years_of_evolution_wasted/,22300,63,r/dankmemes
A thank you would’ve been nice,https://www.reddit.com/r/memes/comments/ehlmwb/a_thank_you_wouldve_been_nice/,22100,57,r/memes
Just going for a hike,https://www.reddit.com/r/nonononoyes/comments/ehkc38/just_going_for_a_hike/,22100,99,r/nonononoyes
"Yeah, 10 years ago",https://www.reddit.com/r/youngpeopleyoutube/comments/ehqkjy/yeah_10_years_ago/,22100,248,r/youngpeopleyoutube
Hej Hej,https://www.reddit.com/r/PewdiepieSubmissions/comments/ehncdl/hej_hej/,21900,75,r/PewdiepieSubmissions
justgoblinthings,https://www.reddit.com/r/raimimemes/comments/ehk136/justgoblinthings/,23300,97,r/raimimemes
Why would you say something so controversial yet so brave?,https://www.reddit.com/r/memes/comments/ehn9r0/why_would_you_say_something_so_controversial_yet/,21900,257,r/memes
consider it Felix ;),https://www.reddit.com/r/PewdiepieSubmissions/comments/ehstg3/consider_it_felix/,21900,153,r/PewdiepieSubmissions
This huge fish caught in the jungle.,https://www.reddit.com/r/oddlyterrifying/comments/ehnys4/this_huge_fish_caught_in_the_jungle/,22000,617,r/oddlyterrifying
I passed!,https://www.reddit.com/r/teenagers/comments/ehqbqz/i_passed/,21800,241,r/teenagers
"""go without me friends"" - corgis just can't jump :(",https://www.reddit.com/r/thisismylifenow/comments/ehkyao/go_without_me_friends_corgis_just_cant_jump/,21700,172,r/thisismylifenow
7years and counting..,https://www.reddit.com/r/GlobalOffensive/comments/ehjtli/7years_and_counting/,22100,1300,r/GlobalOffensive
UwU,https://www.reddit.com/r/PewdiepieSubmissions/comments/ehgtq0/uwu/,21600,291,r/PewdiepieSubmissions
This Musical Instrument Museum has an air guitar on display,https://www.reddit.com/r/mildlyinteresting/comments/ehpxct/this_musical_instrument_museum_has_an_air_guitar/,21600,253,r/mildlyinteresting
So sad,https://www.reddit.com/r/teenagers/comments/ehfhde/so_sad/,21500,289,r/teenagers
Lol she wish,https://www.reddit.com/r/PewdiepieSubmissions/comments/ehl0hh/lol_she_wish/,21400,137,r/PewdiepieSubmissions
