Title,Title Link,Score,Num Comments,Subreddit
This statue kind of looks like Mark Zuckerberg,https://www.reddit.com/r/mildlyinteresting/comments/ahuot6/this_statue_kind_of_looks_like_mark_zuckerberg/,23500,367,r/mildlyinteresting
Anakin doesn't speak broke,https://www.reddit.com/r/PrequelMemes/comments/ahwlpl/anakin_doesnt_speak_broke/,23400,155,r/PrequelMemes
le penseur,https://www.reddit.com/r/comics/comments/ahyf9u/le_penseur/,23200,71,r/comics
Invest while it’s hot,https://www.reddit.com/r/MemeEconomy/comments/ai1g82/invest_while_its_hot/,22900,252,r/MemeEconomy
A 3 weeks ago she was at the pound- now she’s transformed to Action Pup!,https://www.reddit.com/r/aww/comments/ai1ol1/a_3_weeks_ago_she_was_at_the_pound_now_shes/,22800,132,r/aww
A friend unironically sent me this piece of work today,https://www.reddit.com/r/ComedyCemetery/comments/ahx11k/a_friend_unironically_sent_me_this_piece_of_work/,23400,411,r/ComedyCemetery
New Orleans 1997 A shell of a man...,https://www.reddit.com/r/blunderyears/comments/ahyh0p/new_orleans_1997_a_shell_of_a_man/,22900,636,r/blunderyears
I took a picture with Ben Shapiro and told him I liked him on meme review,https://www.reddit.com/r/PewdiepieSubmissions/comments/ai27jo/i_took_a_picture_with_ben_shapiro_and_told_him_i/,22500,458,r/PewdiepieSubmissions
Just a dog feeding his farm bros,https://www.reddit.com/r/AnimalsBeingBros/comments/ahx6zd/just_a_dog_feeding_his_farm_bros/,22400,170,r/AnimalsBeingBros
Dog,https://www.reddit.com/r/aww/comments/ai02hy/dog/,22200,135,r/aww
This is america,https://www.reddit.com/r/memes/comments/ahz3lg/this_is_america/,22200,168,r/memes
Poor People Buy Watches that are $980 Dollars.,https://www.reddit.com/r/im14andthisisdeep/comments/ahz4sf/poor_people_buy_watches_that_are_980_dollars/,22800,1000,r/im14andthisisdeep
There is Dope a meme in your brain now,https://www.reddit.com/r/memes/comments/aht9r0/there_is_dope_a_meme_in_your_brain_now/,21800,102,r/memes
"Thanks, I hate popsicles now",https://www.reddit.com/r/TIHI/comments/ahuxe8/thanks_i_hate_popsicles_now/,21700,112,r/TIHI
This game is still relevant 😡😡😡,https://www.reddit.com/r/PewdiepieSubmissions/comments/ahxtz8/this_game_is_still_relevant/,21700,201,r/PewdiepieSubmissions
Are my cat and my dog dating?,https://www.reddit.com/r/aww/comments/ahumas/are_my_cat_and_my_dog_dating/,21600,186,r/aww
"Christina's World, Andrew Wyeth, Tempera on panel,1948",https://www.reddit.com/r/Art/comments/ahxwfw/christinas_world_andrew_wyeth_tempera_on_panel1948/,21600,501,r/Art
Don't tell John,https://www.reddit.com/r/bonehurtingjuice/comments/ai39qj/dont_tell_john/,21500,153,r/bonehurtingjuice
Yeast,https://www.reddit.com/r/comedyheaven/comments/ahv1s3/yeast/,21500,247,r/comedyheaven
Save the Turtles,https://www.reddit.com/r/funny/comments/ahwdoa/save_the_turtles/,21300,169,r/funny
Me when someone tells me they are only in Ch. 2,https://www.reddit.com/r/reddeadredemption/comments/ahy40q/me_when_someone_tells_me_they_are_only_in_ch_2/,21600,794,r/reddeadredemption
Spider-Kenobi!,https://www.reddit.com/r/marvelstudios/comments/ai2l2m/spiderkenobi/,21100,416,r/marvelstudios
The world's leading expert on European wasps walks into a record shop.,https://www.reddit.com/r/Jokes/comments/ahz0bg/the_worlds_leading_expert_on_european_wasps_walks/,21000,286,r/Jokes
"Expulsion: MAGA hat wearing pupils from Kentucky Catholic school, who taunted Native American elder, could face expulsion",https://www.reddit.com/r/atheism/comments/ahxx3u/expulsion_maga_hat_wearing_pupils_from_kentucky/,20800,187,r/atheism
"SLPT work smarter, not harder.",https://www.reddit.com/r/ShittyLifeProTips/comments/ahwl1f/slpt_work_smarter_not_harder/,20800,154,r/ShittyLifeProTips
mAN’s BEsT FriEnD aTtaCKeD bY ViCiOUs wOLf pACk,https://www.reddit.com/r/PeopleFuckingDying/comments/ahwyvw/mans_best_friend_attacked_by_vicious_wolf_pack/,20700,36,r/PeopleFuckingDying
Was startled to find a giant Lego head wedged between 2 buildings in an alley way.,https://www.reddit.com/r/mildlyinteresting/comments/ai14nq/was_startled_to_find_a_giant_lego_head_wedged/,20600,437,r/mildlyinteresting
This horse is out of your league,https://www.reddit.com/r/funny/comments/ahx043/this_horse_is_out_of_your_league/,20600,440,r/funny
My dog bragging about conquering this mountain after we carried him the whole way,https://www.reddit.com/r/aww/comments/ai13pu/my_dog_bragging_about_conquering_this_mountain/,20400,79,r/aww
I added a rubber bumper designed for boats to the kerb outside my house. Now I can park as close as I like and not ruin my wheels!,https://www.reddit.com/r/lifehacks/comments/ai09vr/i_added_a_rubber_bumper_designed_for_boats_to_the/,20300,708,r/lifehacks
It’s currently -6C outside...,https://www.reddit.com/r/AdviceAnimals/comments/ai2qj2/its_currently_6c_outside/,20000,524,r/AdviceAnimals
A different kind of aww. Zachariah is the keeper of the last 2 northern white rhinos on the planet. They love carrots.,https://www.reddit.com/r/aww/comments/ahyib2/a_different_kind_of_aww_zachariah_is_the_keeper/,20000,294,r/aww
Tai'ler The Magic Genie,https://www.reddit.com/r/Bossfight/comments/ahvcyr/tailer_the_magic_genie/,19900,179,r/Bossfight
"Sasuke, you're to weak",https://www.reddit.com/r/PewdiepieSubmissions/comments/ahs5yx/sasuke_youre_to_weak/,19600,148,r/PewdiepieSubmissions
This 3D level transition in a 2D game,https://www.reddit.com/r/gaming/comments/ai1nwf/this_3d_level_transition_in_a_2d_game/,19500,252,r/gaming
Big Man !,https://www.reddit.com/r/AbsoluteUnits/comments/ahsrdj/big_man/,19400,142,r/AbsoluteUnits
How to catch Pallas cat. For science.,https://www.reddit.com/r/interestingasfuck/comments/ahs01a/how_to_catch_pallas_cat_for_science/,19300,424,r/interestingasfuck
Shoebill Storks is the living proof that dinosaurs are not extinct. Change my mind.,https://www.reddit.com/r/gifs/comments/aht7px/shoebill_storks_is_the_living_proof_that/,19000,754,r/gifs
I think this might be the most beautiful dog I’ve ever seen,https://www.reddit.com/r/aww/comments/ai1wbi/i_think_this_might_be_the_most_beautiful_dog_ive/,19000,103,r/aww
10 year challenge,https://www.reddit.com/r/ScottishPeopleTwitter/comments/ahs1tj/10_year_challenge/,18800,110,r/ScottishPeopleTwitter
Instagram Bad,https://www.reddit.com/r/dankmemes/comments/ahvxma/instagram_bad/,18700,56,r/dankmemes
𝗥𝗘𝗗𝗗𝗜𝗧. MEET My ĐØǤ. He makes this face every time i ＳＵＭＭＯＮ ＨＩＭ.,https://www.reddit.com/r/surrealmemes/comments/ahwhpu/𝗥𝗘𝗗𝗗𝗜𝗧_meet_my_đøǥ_he_makes_this_face_every_time/,18900,120,r/surrealmemes
Jet blast destroying a runway,https://www.reddit.com/r/CatastrophicFailure/comments/ai2kn2/jet_blast_destroying_a_runway/,18700,596,r/CatastrophicFailure
All posted by the same person,https://www.reddit.com/r/thatHappened/comments/ahy1ph/all_posted_by_the_same_person/,18700,237,r/thatHappened
"Jeffreys Bay in South Africa is famous for abundant seashells: the variety of colors, sizes and shapes, makes of it one of the most famous places for seashells collection",https://www.reddit.com/r/pics/comments/ahye32/jeffreys_bay_in_south_africa_is_famous_for/,18700,218,r/pics
That wasn't part of my plan,https://www.reddit.com/r/HistoryMemes/comments/ahtpxd/that_wasnt_part_of_my_plan/,18600,239,r/HistoryMemes
Dammit Jim,https://www.reddit.com/r/DunderMifflin/comments/ahxubb/dammit_jim/,18500,98,r/DunderMifflin
"GIAnT CaNABaL DeVoURs HaRd WoRKing, INnOCeNt StRiPPeR",https://www.reddit.com/r/PeopleFuckingDying/comments/ai23aw/giant_canabal_devours_hard_working_innocent/,18300,133,r/PeopleFuckingDying
This awesome ring process!,https://www.reddit.com/r/Damnthatsinteresting/comments/aht3x6/this_awesome_ring_process/,18200,354,r/Damnthatsinteresting
Perth puts the ass in class. [SFW],https://www.reddit.com/r/australia/comments/ahw6qt/perth_puts_the_ass_in_class_sfw/,18000,250,r/australia
Only after getting a new bf/gf you realize how little nice looking underwear you own,https://www.reddit.com/r/Showerthoughts/comments/ahxr0b/only_after_getting_a_new_bfgf_you_realize_how/,17900,542,r/Showerthoughts
"A new format, invest fast!!",https://www.reddit.com/r/MemeEconomy/comments/ahwp79/a_new_format_invest_fast/,17800,254,r/MemeEconomy
"In Saving Private Ryan (1998), when the military personnel pull up to inform Ms. Ryan about her three sons that were killed, there's a photo with all four boys on the right with the American flag covering the face of presumably James Ryan who is missing.",https://www.reddit.com/r/MovieDetails/comments/ahso33/in_saving_private_ryan_1998_when_the_military/,17600,232,r/MovieDetails
The Storm Hit Hard,https://www.reddit.com/r/FortNiteBR/comments/ahzvkg/the_storm_hit_hard/,17600,256,r/FortNiteBR
I feel personally attacked,https://www.reddit.com/r/PandR/comments/ahx2tm/i_feel_personally_attacked/,17600,75,r/PandR
My reaction browsing Reddit during the past 24 hours...,https://www.reddit.com/r/reactiongifs/comments/ahvo2u/my_reaction_browsing_reddit_during_the_past_24/,17500,103,r/reactiongifs
me irl,https://www.reddit.com/r/me_irl/comments/ahztno/me_irl/,17500,114,r/me_irl
Those extra 24hz matter,https://www.reddit.com/r/pcmasterrace/comments/ahv4z1/those_extra_24hz_matter/,17400,774,r/pcmasterrace
You know it's the truth,https://www.reddit.com/r/memes/comments/ahxcsy/you_know_its_the_truth/,17400,105,r/memes
Trump just confused weather with climate change ... again,https://www.reddit.com/r/politics/comments/ahy141/trump_just_confused_weather_with_climate_change/,17400,992,r/politics
It really do be like that sometimes,https://www.reddit.com/r/memes/comments/ahsepp/it_really_do_be_like_that_sometimes/,17400,76,r/memes
That's true you know,https://www.reddit.com/r/ProgrammerHumor/comments/ai23ah/thats_true_you_know/,17200,314,r/ProgrammerHumor
"My dad was griefed and cussed out while playing RDR2, so he followed the guy back to his camp and sent this while he was AFK",https://www.reddit.com/r/gaming/comments/ai22jg/my_dad_was_griefed_and_cussed_out_while_playing/,17200,225,r/gaming
"Manny ""Pac Man"" Pacquiao, in His Return to America, Wins His 61st Fight by Unanimous Decision",https://www.reddit.com/r/sports/comments/ahv3r0/manny_pac_man_pacquiao_in_his_return_to_america/,17000,645,r/sports
"Vancouver City Council votes to declare ‘climate emergency’. Now that the motion has passed, city staff will come up with new ways to reduce greenhouse gas emissions and set new climate change targets.",https://www.reddit.com/r/Futurology/comments/ahxmag/vancouver_city_council_votes_to_declare_climate/,16800,758,r/Futurology
Surfer on record high wave (24 meters) [September 2017],https://www.reddit.com/r/gifs/comments/ahyjpk/surfer_on_record_high_wave_24_meters_september/,16800,599,r/gifs
Oh no,https://www.reddit.com/r/PewdiepieSubmissions/comments/ahw1hj/oh_no/,16800,128,r/PewdiepieSubmissions
That's illegal,https://www.reddit.com/r/dankmemes/comments/ahwkjt/thats_illegal/,16700,62,r/dankmemes
Finally happy with my curls 2.5 years after losing my hair from chemo,https://www.reddit.com/r/curlyhair/comments/ai0tom/finally_happy_with_my_curls_25_years_after_losing/,16700,208,r/curlyhair
Don't call yourself a gamer unless you played Jimmy Neutron Attack of the Twonkies.,https://www.reddit.com/r/memes/comments/ahxxya/dont_call_yourself_a_gamer_unless_you_played/,16700,189,r/memes
What a hero,https://www.reddit.com/r/memes/comments/ahx3jo/what_a_hero/,16600,208,r/memes
The way the snow drifted under a tiny gap in our garage door.,https://www.reddit.com/r/mildlyinteresting/comments/ai1qtz/the_way_the_snow_drifted_under_a_tiny_gap_in_our/,16500,206,r/mildlyinteresting
I dropped her water dish and she took off,https://www.reddit.com/r/StartledCats/comments/ahsecy/i_dropped_her_water_dish_and_she_took_off/,16300,89,r/StartledCats
He will never BALLIN,https://www.reddit.com/r/comedyheaven/comments/ahyocc/he_will_never_ballin/,16300,124,r/comedyheaven
Its a 'one way' one way or another,https://www.reddit.com/r/funny/comments/ai19y8/its_a_one_way_one_way_or_another/,16000,310,r/funny
Glitter drops.,https://www.reddit.com/r/woahdude/comments/ahzogy/glitter_drops/,15900,138,r/woahdude
We found 2 diamond rings wrapped in a shopping list in a display trash bin in IKEA,https://www.reddit.com/r/mildlyinteresting/comments/ai2yqk/we_found_2_diamond_rings_wrapped_in_a_shopping/,15900,660,r/mildlyinteresting
can we make origamemes a thing please,https://www.reddit.com/r/dankmemes/comments/ahujlw/can_we_make_origamemes_a_thing_please/,15900,86,r/dankmemes
the best beach potato,https://www.reddit.com/r/aww/comments/ahve5b/the_best_beach_potato/,15900,40,r/aww
‘It’s like hell here’: Australia bakes as record temperatures nudge 50C,https://www.reddit.com/r/worldnews/comments/ahtzmf/its_like_hell_here_australia_bakes_as_record/,15800,2600,r/worldnews
it has been a honor.,https://www.reddit.com/r/PewdiepieSubmissions/comments/ahyw4k/it_has_been_a_honor/,15800,221,r/PewdiepieSubmissions
Thanks for the encouragement,https://www.reddit.com/r/wholesomememes/comments/ai19rn/thanks_for_the_encouragement/,15800,41,r/wholesomememes
Lettering to feed yoursoul,https://www.reddit.com/r/oddlysatisfying/comments/ai03lp/lettering_to_feed_yoursoul/,15800,81,r/oddlysatisfying
"Turtle, Ink and Marker, 8.5x11""",https://www.reddit.com/r/Art/comments/ahuclj/turtle_ink_and_marker_85x11/,15700,159,r/Art
I donated my ____ to the cancer kids at the hospital,https://www.reddit.com/r/AskOuija/comments/ahvzk5/i_donated_my_to_the_cancer_kids_at_the_hospital/,15700,625,r/AskOuija
Think of the child,https://www.reddit.com/r/WhitePeopleTwitter/comments/ai0mvv/think_of_the_child/,15500,516,r/WhitePeopleTwitter
Sneak 100,https://www.reddit.com/r/memes/comments/ahxfcu/sneak_100/,15500,73,r/memes
It all makes sense now...,https://www.reddit.com/r/pcmasterrace/comments/ahx06i/it_all_makes_sense_now/,15500,234,r/pcmasterrace
Save them!,https://www.reddit.com/r/Breath_of_the_Wild/comments/ai1t7f/save_them/,15500,165,r/Breath_of_the_Wild
Soviet Union theme song playing,https://www.reddit.com/r/memes/comments/ahvq37/soviet_union_theme_song_playing/,15100,149,r/memes
What’s a good name for a detective?,https://www.reddit.com/r/Jokes/comments/ai0xmu/whats_a_good_name_for_a_detective/,15000,405,r/Jokes
Charlton Athletic fan accidentally kicks a player on his favorite team between the legs while celebrating a goal,https://www.reddit.com/r/sports/comments/ai0iw6/charlton_athletic_fan_accidentally_kicks_a_player/,14900,196,r/sports
