Title,Title Link,Score,Num Comments,Subreddit
Kazakhstani language is the sound of a diesel engine trying to start up in -40 degrees,https://www.reddit.com/r/funny/comments/ai31gt/kazakhstani_language_is_the_sound_of_a_diesel/,121000,2600,r/funny
"In the anime, Ash Ketchum was supposed to be a huge Pokémon fan before he left on his journey. But every time he sees any kind of Pokémon, he has to pull out his Pokédex because he doesn’t know what it is. Ash Ketchum was a poser before he left on his journey.",https://www.reddit.com/r/Showerthoughts/comments/aht7l3/in_the_anime_ash_ketchum_was_supposed_to_be_a/,119000,1800,r/Showerthoughts
This made my day,https://www.reddit.com/r/WhitePeopleTwitter/comments/ai1go5/this_made_my_day/,106000,1600,r/WhitePeopleTwitter
My Grandpa turned 100 yesterday! He’s the oldest person in our family and the most pleasant to be around.,https://www.reddit.com/r/pics/comments/ai09km/my_grandpa_turned_100_yesterday_hes_the_oldest/,103000,1300,r/pics
The speed of light between Earth and Moon in real time,https://www.reddit.com/r/space/comments/ahww32/the_speed_of_light_between_earth_and_moon_in_real/,101000,2400,r/space
"Tom Brady looks like a single, divorced mother who just won full custody of her kids and is leaving the courtroom.",https://www.reddit.com/r/gifs/comments/ai2v9o/tom_brady_looks_like_a_single_divorced_mother_who/,90100,1500,r/gifs
AK-47 muzzle blast deflecting rain,https://www.reddit.com/r/Damnthatsinteresting/comments/aht1tj/ak47_muzzle_blast_deflecting_rain/,90600,1100,r/Damnthatsinteresting
Portrait of a Female Buffalo with frozen snow on its cost by Tom Murphy,https://www.reddit.com/r/pics/comments/ahx23y/portrait_of_a_female_buffalo_with_frozen_snow_on/,89800,1000,r/pics
Smol awoos,https://www.reddit.com/r/aww/comments/ahypgy/smol_awoos/,88400,589,r/aww
How oysters are able to filter (and ultimately clean out) water through their digestive system,https://www.reddit.com/r/gifs/comments/ahymm5/how_oysters_are_able_to_filter_and_ultimately/,87200,2100,r/gifs
Tech writer suggests '10 Year Challenge' may be collecting data for facial recognition algorithm,https://www.reddit.com/r/news/comments/ahxjkn/tech_writer_suggests_10_year_challenge_may_be/,81300,3600,r/news
European Problems,https://www.reddit.com/r/dankmemes/comments/aht4m9/european_problems/,78200,598,r/dankmemes
Bro,https://www.reddit.com/r/HumansBeingBros/comments/ai3d2i/bro/,75500,629,r/HumansBeingBros
"In Up (2009), Dug is the only dog to successfully track down the Tropical Bird because he is the only Hunting Dog (Golden Retriever). All the others are Guard Dog breeds.",https://www.reddit.com/r/MovieDetails/comments/ahylbi/in_up_2009_dug_is_the_only_dog_to_successfully/,77300,576,r/MovieDetails
I took the cat off the street. Photos before and after. One month difference.,https://www.reddit.com/r/aww/comments/ahs13f/i_took_the_cat_off_the_street_photos_before_and/,71600,654,r/aww
Harry Potter could have been hallucinating everything due to carbon monoxide poisoning by being stuck in the cupboard under the stairs.,https://www.reddit.com/r/Showerthoughts/comments/ai2oi5/harry_potter_could_have_been_hallucinating/,68600,1300,r/Showerthoughts
Some small detail that I just noticed in Halo 2 during my replay. Impressive for a 15 y/o game,https://www.reddit.com/r/gaming/comments/ahwr4i/some_small_detail_that_i_just_noticed_in_halo_2/,66900,1500,r/gaming
"“Sure, I can text and drive at the same time” starterpack",https://www.reddit.com/r/starterpacks/comments/ahz1ld/sure_i_can_text_and_drive_at_the_same_time/,68300,1100,r/starterpacks
Controversial No Call on a Potential Pass Interference in the NFC Championship Game,https://www.reddit.com/r/sports/comments/ai3ltc/controversial_no_call_on_a_potential_pass/,65600,5700,r/sports
Adventure Games...,https://www.reddit.com/r/gaming/comments/ahyp3x/adventure_games/,62200,1500,r/gaming
Astronaut back on earth,https://www.reddit.com/r/Unexpected/comments/ahsemj/astronaut_back_on_earth/,62200,558,r/Unexpected
He can steal your girl,https://www.reddit.com/r/aww/comments/ai1dmg/he_can_steal_your_girl/,60800,441,r/aww
This is most definitely wholesome,https://www.reddit.com/r/wholesomememes/comments/ai18tr/this_is_most_definitely_wholesome/,60600,306,r/wholesomememes
"Not mine, but the face is hilarious",https://www.reddit.com/r/funny/comments/ahy1ac/not_mine_but_the_face_is_hilarious/,60300,462,r/funny
[IMAGE] Never Give Up,https://www.reddit.com/r/GetMotivated/comments/ahs7wb/image_never_give_up/,60100,1100,r/GetMotivated
A warm and fuzzy feeling,https://www.reddit.com/r/HumansBeingBros/comments/ahxstt/a_warm_and_fuzzy_feeling/,59700,178,r/HumansBeingBros
This Mexican restaurants menu...,https://www.reddit.com/r/funny/comments/ahzj4t/this_mexican_restaurants_menu/,59000,646,r/funny
Realistic Emotions from Animation,https://www.reddit.com/r/Unexpected/comments/ahwzak/realistic_emotions_from_animation/,57600,494,r/Unexpected
Russian car prank,https://www.reddit.com/r/ANormalDayInRussia/comments/ai06qq/russian_car_prank/,60500,657,r/ANormalDayInRussia
I only browse while I'm eating,https://www.reddit.com/r/dankmemes/comments/ai2tgp/i_only_browse_while_im_eating/,57100,352,r/dankmemes
She didn’t have to go that hard,https://www.reddit.com/r/MurderedByWords/comments/ai0r6t/she_didnt_have_to_go_that_hard/,56800,1000,r/MurderedByWords
Covington Catholic: Longer video shows start of the incident at Indigenous Peoples March,https://www.reddit.com/r/news/comments/ai0qcf/covington_catholic_longer_video_shows_start_of/,55800,13600,r/news
me irl,https://www.reddit.com/r/me_irl/comments/ahwsag/me_irl/,55600,387,r/me_irl
Oops,https://www.reddit.com/r/WatchPeopleDieInside/comments/ai0vtp/oops/,55300,1000,r/WatchPeopleDieInside
An absolute madlad,https://www.reddit.com/r/memes/comments/ahv4wy/an_absolute_madlad/,54600,477,r/memes
"Girlfriend had surgery, luckily she has 3 nurses to help keep her comfy",https://www.reddit.com/r/aww/comments/ahvd9t/girlfriend_had_surgery_luckily_she_has_3_nurses/,53900,463,r/aww
10 years challenge,https://www.reddit.com/r/Wellthatsucks/comments/aht4eh/10_years_challenge/,53800,700,r/Wellthatsucks
When your Gym tryies hard to motivate you but fails to make any sense.,https://www.reddit.com/r/CrappyDesign/comments/ai04c9/when_your_gym_tryies_hard_to_motivate_you_but/,54200,1400,r/CrappyDesign
"The Chimbu, an isolated tribe in Papua Nee Guinea, dress in skeleton body paint to intimidate their enemies",https://www.reddit.com/r/interestingasfuck/comments/ahyxax/the_chimbu_an_isolated_tribe_in_papua_nee_guinea/,53700,1700,r/interestingasfuck
Lightning colliding with volcanic eruption,https://www.reddit.com/r/interestingasfuck/comments/ahtod2/lightning_colliding_with_volcanic_eruption/,53600,492,r/interestingasfuck
Howard Stern says Trump's border wall won't solve immigration problems: It's just something 'morons can get behind',https://www.reddit.com/r/politics/comments/ahzyig/howard_stern_says_trumps_border_wall_wont_solve/,53100,4300,r/politics
I think I have this album...,https://www.reddit.com/r/WhitePeopleTwitter/comments/ahx4jy/i_think_i_have_this_album/,53000,396,r/WhitePeopleTwitter
that’s how r/PewdiepieSubmissions works,https://www.reddit.com/r/PewdiepieSubmissions/comments/ai2h3o/thats_how_rpewdiepiesubmissions_works/,51200,162,r/PewdiepieSubmissions
Incredible jump,https://www.reddit.com/r/BeAmazed/comments/ahwk96/incredible_jump/,50900,721,r/BeAmazed
Fresh from Messenger...,https://www.reddit.com/r/antiMLM/comments/ahzgzb/fresh_from_messenger/,53400,573,r/antiMLM
Wholesome lilo and stitch experiment :),https://www.reddit.com/r/wholesomememes/comments/ahz4ih/wholesome_lilo_and_stitch_experiment/,50400,412,r/wholesomememes
The real 10 year challenge,https://www.reddit.com/r/BikiniBottomTwitter/comments/ai1mvy/the_real_10_year_challenge/,50200,155,r/BikiniBottomTwitter
underrated scene,https://www.reddit.com/r/DunderMifflin/comments/ai0v0z/underrated_scene/,50400,320,r/DunderMifflin
Mad panini lad,https://www.reddit.com/r/madlads/comments/ahsrzq/mad_panini_lad/,49500,397,r/madlads
Journalist in Ghana who exposed soccer corruption shot dead,https://www.reddit.com/r/worldnews/comments/ai0whc/journalist_in_ghana_who_exposed_soccer_corruption/,48400,742,r/worldnews
Saw Eleanor after dinner.,https://www.reddit.com/r/pics/comments/ahtwal/saw_eleanor_after_dinner/,48000,882,r/pics
We cook ourselves in the sun to look tasty to other people.,https://www.reddit.com/r/Showerthoughts/comments/ai3t61/we_cook_ourselves_in_the_sun_to_look_tasty_to/,46500,524,r/Showerthoughts
Girl teaches her puppy how to slide.,https://www.reddit.com/r/aww/comments/ahz4ty/girl_teaches_her_puppy_how_to_slide/,46400,278,r/aww
Pals with paws,https://www.reddit.com/r/rarepuppers/comments/ai1pmd/pals_with_paws/,46400,169,r/rarepuppers
"Psilocybin combined with psychological support might correct pessimism biases in depression - The psychedelic drug psilocybin could help alleviate depression by causing people to have a less pessimistic outlook on life, according to new preliminary research.",https://www.reddit.com/r/science/comments/ai2lvw/psilocybin_combined_with_psychological_support/,46000,1200,r/science
woof irl,https://www.reddit.com/r/woof_irl/comments/ahz9uj/woof_irl/,46500,188,r/woof_irl
Let's settle this for good so we can focus on our true enemy.,https://www.reddit.com/r/dankmemes/comments/ai3n2b/lets_settle_this_for_good_so_we_can_focus_on_our/,45800,478,r/dankmemes
What fact totally changed your perspective?,https://www.reddit.com/r/AskReddit/comments/ai3j84/what_fact_totally_changed_your_perspective/,45600,18600,r/AskReddit
But is it though,https://www.reddit.com/r/WhitePeopleTwitter/comments/ai3b8r/but_is_it_though/,45400,774,r/WhitePeopleTwitter
"The space shuttle Atlantis passes in front of the sun during the STS-125 mission, May 2009",https://www.reddit.com/r/space/comments/ai0xvj/the_space_shuttle_atlantis_passes_in_front_of_the/,44800,551,r/space
This awesome ring process!,https://www.reddit.com/r/oddlysatisfying/comments/ahtwcf/this_awesome_ring_process/,44600,630,r/oddlysatisfying
Only in Australia,https://www.reddit.com/r/memes/comments/ahx1lw/only_in_australia/,44100,266,r/memes
It is really fun though,https://www.reddit.com/r/dankmemes/comments/ahya16/it_is_really_fun_though/,44000,389,r/dankmemes
meirl,https://www.reddit.com/r/meirl/comments/ahysva/meirl/,44400,161,r/meirl
Losing a friend hurts,https://www.reddit.com/r/Wellthatsucks/comments/ahwry7/losing_a_friend_hurts/,42800,387,r/Wellthatsucks
"TIL Research shows that cats that are provided with empty boxes are more interactive, friendly and comfortable with the people around them as compared to those cats that do not have a box to snuggle in. So, it can be said that cats derive comfort and security from boxes.",https://www.reddit.com/r/todayilearned/comments/ahzh6z/til_research_shows_that_cats_that_are_provided/,42400,599,r/todayilearned
“Can it be done on the weekend?”,https://www.reddit.com/r/facepalm/comments/ai3vi0/can_it_be_done_on_the_weekend/,42000,262,r/facepalm
Yuki the Pomsky,https://www.reddit.com/r/rarepuppers/comments/ahwoaa/yuki_the_pomsky/,41700,189,r/rarepuppers
Crazed Maniac Possesses innocent animal,https://www.reddit.com/r/funny/comments/ai01za/crazed_maniac_possesses_innocent_animal/,41600,308,r/funny
The sneakiest of sneaks,https://www.reddit.com/r/Eyebleach/comments/ahs70m/the_sneakiest_of_sneaks/,41300,169,r/Eyebleach
"Trump Touts Border Wall In San Antonio, Which Has No Wall And Isn't On The Border",https://www.reddit.com/r/politics/comments/ahslaa/trump_touts_border_wall_in_san_antonio_which_has/,40700,2300,r/politics
Found this today. Someone must have read a lot of Calvin and Hobbes,https://www.reddit.com/r/funny/comments/ahs24k/found_this_today_someone_must_have_read_a_lot_of/,40700,273,r/funny
"Surely, I can't be the only one who has noticed this date",https://www.reddit.com/r/AdviceAnimals/comments/ahsrr9/surely_i_cant_be_the_only_one_who_has_noticed/,40700,3400,r/AdviceAnimals
🔥 Black Heron shades water with wings to see prey better 🔥,https://www.reddit.com/r/NatureIsFuckingLit/comments/ahy3er/black_heron_shades_water_with_wings_to_see_prey/,40600,255,r/NatureIsFuckingLit
My life is a lie,https://www.reddit.com/r/BikiniBottomTwitter/comments/ahwi27/my_life_is_a_lie/,40400,243,r/BikiniBottomTwitter
Just a normal day in the Sub,https://www.reddit.com/r/PewdiepieSubmissions/comments/ahxfkw/just_a_normal_day_in_the_sub/,40300,470,r/PewdiepieSubmissions
I’m 21 and she’s 30,https://www.reddit.com/r/Tinder/comments/ai08u8/im_21_and_shes_30/,40000,817,r/Tinder
A happy vending!,https://www.reddit.com/r/comics/comments/ahv7gs/a_happy_vending/,39700,450,r/comics
This brave little dog,https://www.reddit.com/r/gifs/comments/ahxwyb/this_brave_little_dog/,39400,269,r/gifs
To get a date.,https://www.reddit.com/r/therewasanattempt/comments/ai2nxx/to_get_a_date/,39000,656,r/therewasanattempt
Trust me im a scientist,https://www.reddit.com/r/dankmemes/comments/ahw0yd/trust_me_im_a_scientist/,38700,171,r/dankmemes
LPT: One of the first things you should do when moving into a new home is to change the locks. You never know who might have a key to the house in their possession.,https://www.reddit.com/r/LifeProTips/comments/ai12u0/lpt_one_of_the_first_things_you_should_do_when/,38700,1100,r/LifeProTips
Wait I just saw this in scooby doo,https://www.reddit.com/r/PewdiepieSubmissions/comments/ahudp1/wait_i_just_saw_this_in_scooby_doo/,38400,342,r/PewdiepieSubmissions
Accurate,https://www.reddit.com/r/FunnyandSad/comments/ai2yer/accurate/,39800,1000,r/FunnyandSad
Lets keep this chain going.,https://www.reddit.com/r/PewdiepieSubmissions/comments/ai0e0t/lets_keep_this_chain_going/,38200,481,r/PewdiepieSubmissions
What is the scariest encounter with another human you have ever experienced?,https://www.reddit.com/r/AskReddit/comments/ahuzqq/what_is_the_scariest_encounter_with_another_human/,37600,9800,r/AskReddit
This baby will get the job done,https://www.reddit.com/r/PrequelMemes/comments/ahvp31/this_baby_will_get_the_job_done/,37100,441,r/PrequelMemes
🔥 Defensive Display of the Rhombic Egg-eater (Dasypeltis Scabra) 🔥,https://www.reddit.com/r/NatureIsFuckingLit/comments/ai1gcf/defensive_display_of_the_rhombic_eggeater/,36800,401,r/NatureIsFuckingLit
Millions of years in a single photograph.,https://www.reddit.com/r/Damnthatsinteresting/comments/ai3m7x/millions_of_years_in_a_single_photograph/,36300,346,r/Damnthatsinteresting
"We're running with less than half the crew, and I don't even have anyone to give me a task right now.",https://www.reddit.com/r/AdviceAnimals/comments/ahy9cb/were_running_with_less_than_half_the_crew_and_i/,35800,322,r/AdviceAnimals
"What is one thing you had never noticed before it was pointed out to you, but now you notice it all the time?",https://www.reddit.com/r/AskReddit/comments/ahzlfd/what_is_one_thing_you_had_never_noticed_before_it/,35600,18100,r/AskReddit
This was how they were brought in for their vet appointment.,https://www.reddit.com/r/aww/comments/ahy46m/this_was_how_they_were_brought_in_for_their_vet/,35600,121,r/aww
Long showers are the best,https://www.reddit.com/r/Tinder/comments/ahwxxz/long_showers_are_the_best/,35500,251,r/Tinder
Well...,https://www.reddit.com/r/WhitePeopleTwitter/comments/ahtg7d/well/,35300,1200,r/WhitePeopleTwitter
"""Elephants have first right over forest"" - Indian Supreme Court. Orders for demolition of wall that was blocking elephant migration corridor",https://www.reddit.com/r/UpliftingNews/comments/ahv7xa/elephants_have_first_right_over_forest_indian/,34900,442,r/UpliftingNews
Youtube Trending favoring things that bring in more advertising dollars instead of actual content,https://www.reddit.com/r/assholedesign/comments/ahvlxc/youtube_trending_favoring_things_that_bring_in/,34900,713,r/assholedesign
"If we could travel at 99.9% the speed of light, it would take 4 years to get to Alpha Centauri. Would the people on the spaceship feel like they were stuck on board for 4 years or would it feel shorter for them?",https://www.reddit.com/r/askscience/comments/ahyapf/if_we_could_travel_at_999_the_speed_of_light_it/,34400,3100,r/askscience
"Just like ""Don't shop, adopt!"" Movement for animals, there should be a huge movement of ""Don't reproduce, adopt"".",https://www.reddit.com/r/unpopularopinion/comments/ahxfak/just_like_dont_shop_adopt_movement_for_animals/,33800,3100,r/unpopularopinion
Tae Kwon Do,https://www.reddit.com/r/youseeingthisshit/comments/ai1gbg/tae_kwon_do/,33600,321,r/youseeingthisshit
to make an inspirational quote,https://www.reddit.com/r/therewasanattempt/comments/ahwjz2/to_make_an_inspirational_quote/,33100,208,r/therewasanattempt
"After posting about becoming homeless due to a leak and mold issue the mom group from Reddit sent me diapers, wipes, toys and necessities. One mom drove over 200 miles to give me a huge amount of clothes and buy groceries for my family. September Bumpers are amazing!",https://www.reddit.com/r/pics/comments/ai1fuy/after_posting_about_becoming_homeless_due_to_a/,32900,396,r/pics
Let’s get this brad,https://www.reddit.com/r/PewdiepieSubmissions/comments/ai3wnb/lets_get_this_brad/,32700,285,r/PewdiepieSubmissions
"“He’s behind me, isn’t he?”",https://www.reddit.com/r/aww/comments/ai1q8y/hes_behind_me_isnt_he/,32500,609,r/aww
These WW2 bunkers are just incredible,https://www.reddit.com/r/HistoryMemes/comments/ai29j9/these_ww2_bunkers_are_just_incredible/,32299,144,r/HistoryMemes
The Legend Of 1R0NYMAN,https://www.reddit.com/r/wallstreetbets/comments/ahy7dy/the_legend_of_1r0nyman/,34100,953,r/wallstreetbets
Never surrender,https://www.reddit.com/r/PewdiepieSubmissions/comments/ahw4ur/never_surrender/,32100,331,r/PewdiepieSubmissions
I believe this qualifies this guy a certified Disney princess if I’m not mistaken,https://www.reddit.com/r/aww/comments/ai2lvi/i_believe_this_qualifies_this_guy_a_certified/,32000,341,r/aww
And don't come back! French bulldog chasing off two bears.,https://www.reddit.com/r/funny/comments/ahzt2j/and_dont_come_back_french_bulldog_chasing_off_two/,31900,634,r/funny
🔥 harvest mice chilling out on crops 🔥,https://www.reddit.com/r/NatureIsFuckingLit/comments/ahunro/harvest_mice_chilling_out_on_crops/,31800,153,r/NatureIsFuckingLit
2meirl4meirl,https://www.reddit.com/r/2meirl4meirl/comments/ahvi74/2meirl4meirl/,31700,203,r/2meirl4meirl
"I have an idea, let me take a sip...",https://www.reddit.com/r/instant_regret/comments/ai38b1/i_have_an_idea_let_me_take_a_sip/,31200,855,r/instant_regret
I’m sorry little one,https://www.reddit.com/r/thanosdidnothingwrong/comments/ahyuni/im_sorry_little_one/,30900,152,r/thanosdidnothingwrong
keep scrolling......,https://www.reddit.com/r/dankmemes/comments/ahtmxi/keep_scrolling/,30700,1300,r/dankmemes
Where are the aliens?...,https://www.reddit.com/r/funny/comments/ahw13u/where_are_the_aliens/,30600,597,r/funny
"[OC] I’ll try Kenobi, it’s a good trick!",https://www.reddit.com/r/PrequelMemes/comments/ahybre/oc_ill_try_kenobi_its_a_good_trick/,30500,130,r/PrequelMemes
Pelosi is winning battle with Trump because she's better at her job,https://www.reddit.com/r/politics/comments/ai1ztj/pelosi_is_winning_battle_with_trump_because_shes/,30500,2800,r/politics
This does put a smile on my face,https://www.reddit.com/r/thanosdidnothingwrong/comments/aht90z/this_does_put_a_smile_on_my_face/,30100,356,r/thanosdidnothingwrong
"Oh, wait! 🥕❤",https://www.reddit.com/r/wholesomememes/comments/ahtwgb/oh_wait/,29900,120,r/wholesomememes
My GF’s pup falling asleep on this road trip,https://www.reddit.com/r/aww/comments/ahu00t/my_gfs_pup_falling_asleep_on_this_road_trip/,29700,164,r/aww
I’m speechless at how stupid this is,https://www.reddit.com/r/DiWHY/comments/ahyolt/im_speechless_at_how_stupid_this_is/,29900,782,r/DiWHY
"I finally can afford to buy all three, I just don't have time to play",https://www.reddit.com/r/gaming/comments/ahxjne/i_finally_can_afford_to_buy_all_three_i_just_dont/,29500,988,r/gaming
[Highlight] Controversial Robey -Coleman no call,https://www.reddit.com/r/nfl/comments/ai3hey/highlight_controversial_robey_coleman_no_call/,29400,5900,r/nfl
My mosaic of the California Nebula in natural color with 25 hours of exposure,https://www.reddit.com/r/space/comments/ahrzhc/my_mosaic_of_the_california_nebula_in_natural/,29300,258,r/space
She is one of my favourite politicians from now on,https://www.reddit.com/r/FellowKids/comments/ahy0hw/she_is_one_of_my_favourite_politicians_from_now_on/,29500,1600,r/FellowKids
My parent’s new place... offering sanctuary from the cold Michigan winter.,https://www.reddit.com/r/CozyPlaces/comments/ahya8t/my_parents_new_place_offering_sanctuary_from_the/,28900,293,r/CozyPlaces
What happens when your post has bad grammar.,https://www.reddit.com/r/HighQualityGifs/comments/ahxmli/what_happens_when_your_post_has_bad_grammar/,28800,199,r/HighQualityGifs
[NO SPOILERS] Got my brand new Lannister prosthetic. Lannister gold!,https://www.reddit.com/r/gameofthrones/comments/ai01iq/no_spoilers_got_my_brand_new_lannister_prosthetic/,28900,424,r/gameofthrones
Saving the world,https://www.reddit.com/r/wholesomememes/comments/ahxr9k/saving_the_world/,28800,152,r/wholesomememes
Hes a groundhog dog,https://www.reddit.com/r/AnimalsBeingDerps/comments/ai0c2h/hes_a_groundhog_dog/,28700,175,r/AnimalsBeingDerps
Visual representation of the word “Sorry”.,https://www.reddit.com/r/funny/comments/ai003c/visual_representation_of_the_word_sorry/,28200,241,r/funny
"First Image from Comedy-Thriller 'Villains' - Starring Bill Skarsgård, Maika Monroe, Jeffrey Donovan, and Kyra Sedwick - Amateur criminals break into a suburban home, they stumble upon a dark secret that two sadistic homeowners will do anything to keep from getting out.",https://www.reddit.com/r/movies/comments/ahz3h5/first_image_from_comedythriller_villains_starring/,28100,760,r/movies
Archie’s first time in the snow,https://www.reddit.com/r/aww/comments/ai25ws/archies_first_time_in_the_snow/,27700,78,r/aww
"Went to learn to ski for the first time, but guess I'm not allowed😭😭",https://www.reddit.com/r/funny/comments/ai31qq/went_to_learn_to_ski_for_the_first_time_but_guess/,27300,390,r/funny
"The Republic of Congo has created its fifth national park, protecting western lowland gorillas, chimpanzees, elephants and other threatened wildlife.",https://www.reddit.com/r/UpliftingNews/comments/ai0rk0/the_republic_of_congo_has_created_its_fifth/,27200,172,r/UpliftingNews
Jameela Jamil is the Hero We All Need.,https://www.reddit.com/r/antiMLM/comments/ahsqmp/jameela_jamil_is_the_hero_we_all_need/,27700,693,r/antiMLM
My mom accidentally texted me instead of my dad...,https://www.reddit.com/r/teenagers/comments/ahwg3d/my_mom_accidentally_texted_me_instead_of_my_dad/,26900,466,r/teenagers
"No, I want you to pay for delivery",https://www.reddit.com/r/ChoosingBeggars/comments/ahy87g/no_i_want_you_to_pay_for_delivery/,26600,665,r/ChoosingBeggars
"""Great again""",https://www.reddit.com/r/pics/comments/ahs65w/great_again/,26500,1100,r/pics
"TIL It’s hypothesized that warm-bloodedness evolved in mammals and birds because it provided defense against fungal infections. Very few fungi can survive the body temperatures of warm-blooded animals. By comparison, insects, reptiles, and amphibians are plagued by fungal infections.",https://www.reddit.com/r/todayilearned/comments/ahs4kw/til_its_hypothesized_that_warmbloodedness_evolved/,26300,670,r/todayilearned
Life Goals,https://www.reddit.com/r/aww/comments/ahykeb/life_goals/,26300,188,r/aww
PsBattle: this young dog scanning the horizon,https://www.reddit.com/r/photoshopbattles/comments/ahsi20/psbattle_this_young_dog_scanning_the_horizon/,25900,157,r/photoshopbattles
There isn't one,https://www.reddit.com/r/memes/comments/ahz1xb/there_isnt_one/,25600,490,r/memes
Sleepy cat,https://www.reddit.com/r/aww/comments/ahybgu/sleepy_cat/,25200,68,r/aww
MRW im 8 years old and my friend comes round for dinner and says 'Crap' at the table.,https://www.reddit.com/r/reactiongifs/comments/ai3bms/mrw_im_8_years_old_and_my_friend_comes_round_for/,25000,137,r/reactiongifs
Sometimes you gotta cut them a deal,https://www.reddit.com/r/ChoosingBeggars/comments/ahs2q2/sometimes_you_gotta_cut_them_a_deal/,24900,359,r/ChoosingBeggars
Guy goes to the doctor for a checkup and gets bad news.,https://www.reddit.com/r/Jokes/comments/ahuww1/guy_goes_to_the_doctor_for_a_checkup_and_gets_bad/,24900,447,r/Jokes
Daww!,https://www.reddit.com/r/aww/comments/ai2vb0/daww/,24300,203,r/aww
An adorable pair,https://www.reddit.com/r/aww/comments/ai3xyp/an_adorable_pair/,24300,126,r/aww
"With 4 meters of snow in Slovenia, I present you 3 beer bottles of snow in Germany. Taken in Sonthofen im Allgäu.",https://www.reddit.com/r/europe/comments/ahw09j/with_4_meters_of_snow_in_slovenia_i_present_you_3/,24200,681,r/europe
This is some dope shiet...,https://www.reddit.com/r/funny/comments/ahyizp/this_is_some_dope_shiet/,24100,395,r/funny
The voice of God,https://www.reddit.com/r/tumblr/comments/ahs2fj/the_voice_of_god/,24000,344,r/tumblr
It's a very very mad world,https://www.reddit.com/r/BikiniBottomTwitter/comments/ahvgua/its_a_very_very_mad_world/,24000,101,r/BikiniBottomTwitter
Good boy!,https://www.reddit.com/r/tumblr/comments/ahxi65/good_boy/,23800,155,r/tumblr
"Catholic high school students in 'Maga' hats mock Native American after D.C. rally, could face expulsion",https://www.reddit.com/r/politics/comments/ahuafb/catholic_high_school_students_in_maga_hats_mock/,23800,5200,r/politics
Emmm...,https://www.reddit.com/r/funny/comments/ahx89x/emmm/,23800,301,r/funny
hmmm,https://www.reddit.com/r/hmmm/comments/ai179i/hmmm/,23700,240,r/hmmm
Taking the little one out for a happy meal,https://www.reddit.com/r/funny/comments/ai041j/taking_the_little_one_out_for_a_happy_meal/,23600,401,r/funny
