Title,Title Link,Score,Num Comments,Subreddit
Husband said he was going to make a bed frame. I thought it was for our new mattress.... It was for the cat.,https://www.reddit.com/r/aww/comments/awyf90/husband_said_he_was_going_to_make_a_bed_frame_i/,178000,1600,r/aww
Last Fallout 76 player officially deemed the loneliest person on earth,https://www.reddit.com/r/gaming/comments/awxpoh/last_fallout_76_player_officially_deemed_the/,139000,2900,r/gaming
Kowabunga it is,https://www.reddit.com/r/dankmemes/comments/aww6gp/kowabunga_it_is/,90600,457,r/dankmemes
Rescued kitten smiling on his way to his new home,https://www.reddit.com/r/aww/comments/awp24k/rescued_kitten_smiling_on_his_way_to_his_new_home/,87300,389,r/aww
Into the Sarlacc pit with you!,https://www.reddit.com/r/gifs/comments/awri9m/into_the_sarlacc_pit_with_you/,86000,1400,r/gifs
What's some juicy gossip you just found out in your personal lives?,https://www.reddit.com/r/AskReddit/comments/awwcfb/whats_some_juicy_gossip_you_just_found_out_in/,85100,22500,r/AskReddit
Top 15 Steam games by player count Jan 2015 - Dec 2018,https://www.reddit.com/r/gaming/comments/awpmj0/top_15_steam_games_by_player_count_jan_2015_dec/,83700,4800,r/gaming
Vanilla becoming the default flavour of ice cream is the greatest underdog story of all time.,https://www.reddit.com/r/Showerthoughts/comments/awx46q/vanilla_becoming_the_default_flavour_of_ice_cream/,83100,2800,r/Showerthoughts
Purrfect day for a hike on the Pacific Coast,https://www.reddit.com/r/gifs/comments/awoacg/purrfect_day_for_a_hike_on_the_pacific_coast/,83000,620,r/gifs
Laser printing on a shirt,https://www.reddit.com/r/interestingasfuck/comments/awsxo9/laser_printing_on_a_shirt/,81100,1100,r/interestingasfuck
🔥 A storm I saw flying through East Africa that our plane avoided.,https://www.reddit.com/r/NatureIsFuckingLit/comments/awv35r/a_storm_i_saw_flying_through_east_africa_that_our/,83400,764,r/NatureIsFuckingLit
Chihuahua out of nowhere,https://www.reddit.com/r/wholesomememes/comments/awvpfn/chihuahua_out_of_nowhere/,79800,358,r/wholesomememes
Cosplay of Belle from Beauty and the Beast,https://www.reddit.com/r/pics/comments/awopnf/cosplay_of_belle_from_beauty_and_the_beast/,77600,1000,r/pics
"Every child deserves parents, but not all parents deserve children.",https://www.reddit.com/r/Showerthoughts/comments/awu0nw/every_child_deserves_parents_but_not_all_parents/,76900,786,r/Showerthoughts
Game of the year every year,https://www.reddit.com/r/gaming/comments/ax05pa/game_of_the_year_every_year/,76300,1400,r/gaming
Missing 5-year-old and 8-year-old sisters found alive,https://www.reddit.com/r/news/comments/awy3nt/missing_5yearold_and_8yearold_sisters_found_alive/,75200,1400,r/news
"TIL about Ewa Wiśnierska, a german paraglider that got surprised by a thunderstorm and got sucked up by a cumulonimbus cloud to an altitude of 10.000m (33.000ft). She survived temperatures of -50*C and extreme oxygen deprivation at a height higher than the Mt. Everest.",https://www.reddit.com/r/todayilearned/comments/awyr2v/til_about_ewa_wiśnierska_a_german_paraglider_that/,74500,1600,r/todayilearned
REEEEEE,https://www.reddit.com/r/dankmemes/comments/awqnvv/reeeeee/,66900,398,r/dankmemes
Chick-fil-A employees are lucky that they don't have to handle the post-church crowd,https://www.reddit.com/r/Showerthoughts/comments/awpjod/chickfila_employees_are_lucky_that_they_dont_have/,65700,2800,r/Showerthoughts
"I extracted the color data from 150k images of the moon so you can see where impacts ""paint"" the moon with different minerals. Wallpaper version and animation linked in the comments [OC]",https://www.reddit.com/r/space/comments/awo9ce/i_extracted_the_color_data_from_150k_images_of/,64900,622,r/space
This small text on the rockets in Spider-Man ps4 game,https://www.reddit.com/r/gaming/comments/awtzch/this_small_text_on_the_rockets_in_spiderman_ps4/,64599,468,r/gaming
The power of imagination,https://www.reddit.com/r/MurderedByWords/comments/awvjz0/the_power_of_imagination/,63100,358,r/MurderedByWords
My grandpa travels a lot and keeps all the little hotel shampoos,https://www.reddit.com/r/mildlyinteresting/comments/awx227/my_grandpa_travels_a_lot_and_keeps_all_the_little/,62600,1100,r/mildlyinteresting
This is my toy. Don't touch it pleease.,https://www.reddit.com/r/aww/comments/awtc6j/this_is_my_toy_dont_touch_it_pleease/,61800,325,r/aww
This pisses me off so much,https://www.reddit.com/r/dankmemes/comments/awokd6/this_pisses_me_off_so_much/,61800,602,r/dankmemes
Trump ordered to pay legal fees after losing court battle over his Scottish golf course,https://www.reddit.com/r/worldnews/comments/ax08kn/trump_ordered_to_pay_legal_fees_after_losing/,60700,2200,r/worldnews
It was never about the location; it was just the wrong man...,https://www.reddit.com/r/DunderMifflin/comments/awvhsq/it_was_never_about_the_location_it_was_just_the/,61300,761,r/DunderMifflin
Pupper just making sure his human knows they’re loved,https://www.reddit.com/r/aww/comments/awuov7/pupper_just_making_sure_his_human_knows_theyre/,59200,243,r/aww
Is... is this? No it can’t be...,https://www.reddit.com/r/memes/comments/awu6yk/is_is_this_no_it_cant_be/,58100,991,r/memes
The drains for the sinks in the Minneapolis airport are airplanes,https://www.reddit.com/r/mildlyinteresting/comments/awu8ri/the_drains_for_the_sinks_in_the_minneapolis/,57700,722,r/mildlyinteresting
Hippidy hoppidy,https://www.reddit.com/r/dankmemes/comments/awux0s/hippidy_hoppidy/,57600,554,r/dankmemes
A fan's phone falls and others send it back to him,https://www.reddit.com/r/sports/comments/awp081/a_fans_phone_falls_and_others_send_it_back_to_him/,57000,460,r/sports
"After 10 years, I'm proud to say that I'm am an American citizen",https://www.reddit.com/r/pics/comments/awuvy8/after_10_years_im_proud_to_say_that_im_am_an/,56300,2300,r/pics
minecraft.jpeg,https://www.reddit.com/r/dankmemes/comments/awswlm/minecraftjpeg/,55300,291,r/dankmemes
Mother and son portrait by Taiwanese artist Hsiao-ching Wang,https://www.reddit.com/r/pics/comments/awwmvj/mother_and_son_portrait_by_taiwanese_artist/,54100,368,r/pics
Genius,https://www.reddit.com/r/Tinder/comments/awwhwt/genius/,52200,360,r/Tinder
Drove 6 hours on a whim to watch the sun rise over Niagara Falls,https://www.reddit.com/r/pics/comments/awtrmr/drove_6_hours_on_a_whim_to_watch_the_sun_rise/,52000,793,r/pics
YouTube shows favoritism,https://www.reddit.com/r/BikiniBottomTwitter/comments/awzzlq/youtube_shows_favoritism/,51900,259,r/BikiniBottomTwitter
Elon coming through clutch again,https://www.reddit.com/r/dankmemes/comments/awyoob/elon_coming_through_clutch_again/,51800,387,r/dankmemes
Ha! got em,https://www.reddit.com/r/memes/comments/awv2fe/ha_got_em/,50300,234,r/memes
Bouncer throws man out of bar,https://www.reddit.com/r/Unexpected/comments/awojpm/bouncer_throws_man_out_of_bar/,50300,737,r/Unexpected
There's something wrong with your dog.,https://www.reddit.com/r/gifs/comments/awtq9d/theres_something_wrong_with_your_dog/,48400,618,r/gifs
He has become a very great threat.,https://www.reddit.com/r/PrequelMemes/comments/awxq6n/he_has_become_a_very_great_threat/,48300,527,r/PrequelMemes
The way this barn was enlarged,https://www.reddit.com/r/mildlyinteresting/comments/awv9ds/the_way_this_barn_was_enlarged/,48200,326,r/mildlyinteresting
A small gesture of love goes a long way.,https://www.reddit.com/r/wholesomememes/comments/awrse8/a_small_gesture_of_love_goes_a_long_way/,47700,683,r/wholesomememes
me irl,https://www.reddit.com/r/me_irl/comments/aww21o/me_irl/,47700,183,r/me_irl
"A few weeks ago I shared with you my retro space art and everyone really enjoyed it, so I figured I'd share with you my Series 2 collection!",https://www.reddit.com/r/space/comments/awusju/a_few_weeks_ago_i_shared_with_you_my_retro_space/,47300,496,r/space
"My favorite hike ended with what became my favorite photo. Rawson Lake, Peter Lougheed Provincial Park, Alberta, Canada.",https://www.reddit.com/r/pics/comments/awx00r/my_favorite_hike_ended_with_what_became_my/,46800,472,r/pics
To post on r/OldSchoolCool,https://www.reddit.com/r/therewasanattempt/comments/awzs3m/to_post_on_roldschoolcool/,46800,384,r/therewasanattempt
me🍰irl,https://www.reddit.com/r/me_irl/comments/awouw0/meirl/,46700,142,r/me_irl
My grandfather doesn’t peel the plastic off of anything and won’t let me peel it off. I’m about to have a heart attack.,https://www.reddit.com/r/mildlyinfuriating/comments/awv2s1/my_grandfather_doesnt_peel_the_plastic_off_of/,46100,878,r/mildlyinfuriating
Looks like this Spanish magazine does their research on reddit,https://www.reddit.com/r/gaming/comments/awytfx/looks_like_this_spanish_magazine_does_their/,46100,556,r/gaming
Women's cycling race forced to pause after lead rider catches men's race,https://www.reddit.com/r/nottheonion/comments/awv9fm/womens_cycling_race_forced_to_pause_after_lead/,46000,2300,r/nottheonion
Oops.,https://www.reddit.com/r/WhitePeopleTwitter/comments/awua3k/oops/,44600,254,r/WhitePeopleTwitter
Not your average biker gang,https://www.reddit.com/r/Damnthatsinteresting/comments/awxjhm/not_your_average_biker_gang/,44100,713,r/Damnthatsinteresting
Nematode slowly eaten alive under a microscope,https://www.reddit.com/r/natureismetal/comments/awuhmy/nematode_slowly_eaten_alive_under_a_microscope/,43600,1100,r/natureismetal
The thin line between scary and beautiful,https://www.reddit.com/r/Damnthatsinteresting/comments/awz1be/the_thin_line_between_scary_and_beautiful/,43000,540,r/Damnthatsinteresting
Have you ever seen a baby seagull? Me neither.,https://www.reddit.com/r/pics/comments/awysn3/have_you_ever_seen_a_baby_seagull_me_neither/,42200,412,r/pics
I called two girls hipsters and got slapped.,https://www.reddit.com/r/Jokes/comments/awv5wo/i_called_two_girls_hipsters_and_got_slapped/,41500,386,r/Jokes
"In Spider-Man: Into the Spider-Verse Gwen's origin story shows subtle, blue traces of scales on the body of her universe's Peter. This is a reference to the comics, in which Peter turned himself into the Lizard.",https://www.reddit.com/r/MovieDetails/comments/awx2oz/in_spiderman_into_the_spiderverse_gwens_origin/,41300,768,r/MovieDetails
hmmm,https://www.reddit.com/r/hmmm/comments/awslkm/hmmm/,41900,682,r/hmmm
I love when they get called out. Checked her page and she posts this constantly,https://www.reddit.com/r/antiMLM/comments/awup6d/i_love_when_they_get_called_out_checked_her_page/,42800,317,r/antiMLM
It cant be,https://www.reddit.com/r/PrequelMemes/comments/awt0uc/it_cant_be/,40100,216,r/PrequelMemes
My long exposure of SpaceX Crew Dragon Demo-1 Launch,https://www.reddit.com/r/space/comments/awzp3g/my_long_exposure_of_spacex_crew_dragon_demo1/,39700,333,r/space
Our planet never sleeps.,https://www.reddit.com/r/Damnthatsinteresting/comments/awtf3z/our_planet_never_sleeps/,39300,764,r/Damnthatsinteresting
me irl,https://www.reddit.com/r/me_irl/comments/awt8fh/me_irl/,39200,124,r/me_irl
BBC News: Donald Trump launches furious attack on Robert Mueller,https://www.reddit.com/r/worldnews/comments/awoool/bbc_news_donald_trump_launches_furious_attack_on/,39100,5600,r/worldnews
"Individuals high in authenticity have good long-term relationship outcomes, and those that engage in “be yourself” dating behavior are more attractive than those that play hard to get, suggesting that being yourself may be an effective mating strategy for those seeking long-term relationships.",https://www.reddit.com/r/science/comments/awsult/individuals_high_in_authenticity_have_good/,38400,1300,r/science
"Ah-Weh-Eyu (Pretty Flower), Seneca Native American, 1908",https://www.reddit.com/r/OldSchoolCool/comments/ax030q/ahweheyu_pretty_flower_seneca_native_american_1908/,37700,487,r/OldSchoolCool
Heartbroken,https://www.reddit.com/r/Wellthatsucks/comments/awuggo/heartbroken/,37700,645,r/Wellthatsucks
Lil' otter got a treasure.,https://www.reddit.com/r/Eyebleach/comments/ax072b/lil_otter_got_a_treasure/,37300,270,r/Eyebleach
Seeds bursting,https://www.reddit.com/r/blackmagicfuckery/comments/awst20/seeds_bursting/,37200,397,r/blackmagicfuckery
This one caught me a little off guard. We always buy these same ones and this time I pulled the tube out and it's the size of those mini ones.,https://www.reddit.com/r/assholedesign/comments/awvtek/this_one_caught_me_a_little_off_guard_we_always/,37100,1000,r/assholedesign
"12-year-old Tilly lost both of her arms as a baby. Today, her superstar status reaches new heights as she stars in a TV advert for O2, wearing her two Hero Arms",https://www.reddit.com/r/Damnthatsinteresting/comments/awod28/12yearold_tilly_lost_both_of_her_arms_as_a_baby/,37000,601,r/Damnthatsinteresting
I will not stand for this cyberbullying...,https://www.reddit.com/r/PewdiepieSubmissions/comments/aww35u/i_will_not_stand_for_this_cyberbullying/,36700,172,r/PewdiepieSubmissions
"Final Hope, Pixelart, 305x200px",https://www.reddit.com/r/Art/comments/awu3z0/final_hope_pixelart_305x200px/,36600,229,r/Art
Home,https://www.reddit.com/r/gaming/comments/awu7p8/home/,36200,250,r/gaming
Suggestion to Add Mozambique Pings Tracker,https://www.reddit.com/r/apexlegends/comments/awt7bv/suggestion_to_add_mozambique_pings_tracker/,36500,548,r/apexlegends
Dog fart cat puke,https://www.reddit.com/r/WatchPeopleDieInside/comments/awsnyg/dog_fart_cat_puke/,36000,413,r/WatchPeopleDieInside
A honorable virgin,https://www.reddit.com/r/dankmemes/comments/aws68o/a_honorable_virgin/,35800,428,r/dankmemes
High-fiving the demon under my bed,https://www.reddit.com/r/aww/comments/ax05e3/highfiving_the_demon_under_my_bed/,35700,188,r/aww
This cozy loft!,https://www.reddit.com/r/CozyPlaces/comments/awupnl/this_cozy_loft/,35900,412,r/CozyPlaces
A baby turtle in all its cuteness,https://www.reddit.com/r/aww/comments/awxs6k/a_baby_turtle_in_all_its_cuteness/,35400,158,r/aww
I know it's not easy but we all need a bit of patience,https://www.reddit.com/r/apexlegends/comments/awxw5m/i_know_its_not_easy_but_we_all_need_a_bit_of/,35200,2400,r/apexlegends
My mother took a photo of the Space Shuttle Challenger explosion,https://www.reddit.com/r/mildlyinteresting/comments/awq1xv/my_mother_took_a_photo_of_the_space_shuttle/,34900,815,r/mildlyinteresting
Warner: 'Enormous evidence' of contacts between Trump campaign and Russia,https://www.reddit.com/r/worldnews/comments/awyl45/warner_enormous_evidence_of_contacts_between/,34600,2800,r/worldnews
"My mom is the worlds biggest Elton John fan but has never seen him live, so for her 72nd birthday my sister and I pulled our money together so she could see him play his last show ever in New Jersey",https://www.reddit.com/r/pics/comments/awzbdl/my_mom_is_the_worlds_biggest_elton_john_fan_but/,34300,557,r/pics
You have to be kidding me,https://www.reddit.com/r/facepalm/comments/awv517/you_have_to_be_kidding_me/,34300,551,r/facepalm
hmmm,https://www.reddit.com/r/hmmm/comments/awwzuc/hmmm/,34400,380,r/hmmm
Mr X is Terrifying,https://www.reddit.com/r/gaming/comments/awv6ed/mr_x_is_terrifying/,34200,497,r/gaming
"Just because you can, doesn’t mean you should",https://www.reddit.com/r/DiWHY/comments/awul69/just_because_you_can_doesnt_mean_you_should/,34900,2000,r/DiWHY
That would be cool actually.,https://www.reddit.com/r/dankmemes/comments/awoj7v/that_would_be_cool_actually/,33800,230,r/dankmemes
Name the parts of the duck,https://www.reddit.com/r/ContagiousLaughter/comments/awzno3/name_the_parts_of_the_duck/,34500,343,r/ContagiousLaughter
"Deadbeat dad ditched my mom when she was pregnant with me 50 years ago (they were married). No child support, no nothing. Now he’s dead and left a 1M+ estate to a charitable trust. In the trust he stated he had no children. Do I have any recourse? State is California.",https://www.reddit.com/r/legaladvice/comments/awvja4/deadbeat_dad_ditched_my_mom_when_she_was_pregnant/,33800,99,r/legaladvice
The Milky Way over Yosemite National Park.,https://www.reddit.com/r/interestingasfuck/comments/awp3hk/the_milky_way_over_yosemite_national_park/,33700,303,r/interestingasfuck
Don’t mess with my ice cream,https://www.reddit.com/r/WatchPeopleDieInside/comments/awvefx/dont_mess_with_my_ice_cream/,33500,703,r/WatchPeopleDieInside
"OH SNAP, what a burn",https://www.reddit.com/r/PewdiepieSubmissions/comments/awy3wz/oh_snap_what_a_burn/,33000,142,r/PewdiepieSubmissions
(3),https://www.reddit.com/r/pcmasterrace/comments/awqbca/3/,32600,357,r/pcmasterrace
Adventure movie in a strange land starterpack,https://www.reddit.com/r/starterpacks/comments/awv3lx/adventure_movie_in_a_strange_land_starterpack/,32500,396,r/starterpacks
Big facts,https://www.reddit.com/r/pcmasterrace/comments/awzujg/big_facts/,32500,378,r/pcmasterrace
"My cat passed away today, at home. This is the email I got from my vet a few minutes after we told them what happened.",https://www.reddit.com/r/HumansBeingBros/comments/awoxp9/my_cat_passed_away_today_at_home_this_is_the/,32400,389,r/HumansBeingBros
Man Lost in Snow for Five Days Survived on Taco Bell Sauce Packets,https://www.reddit.com/r/nottheonion/comments/awpu5g/man_lost_in_snow_for_five_days_survived_on_taco/,32400,1100,r/nottheonion
Captain Raymond Holt,https://www.reddit.com/r/brooklynninenine/comments/awzywa/captain_raymond_holt/,32100,477,r/brooklynninenine
The greatest flex of all...,https://www.reddit.com/r/dankmemes/comments/awxujv/the_greatest_flex_of_all/,32000,342,r/dankmemes
Azurite geode | Credit to @dusted77,https://www.reddit.com/r/woahdude/comments/awuo2z/azurite_geode_credit_to_dusted77/,31800,307,r/woahdude
Oof owie historical revisionism,https://www.reddit.com/r/HistoryMemes/comments/awvn1h/oof_owie_historical_revisionism/,31600,524,r/HistoryMemes
"But we must continue to 100,000,000",https://www.reddit.com/r/PewdiepieSubmissions/comments/awwben/but_we_must_continue_to_100000000/,31400,272,r/PewdiepieSubmissions
New Pink Guy meme on the rise! Invest now!,https://www.reddit.com/r/MemeEconomy/comments/awy0lx/new_pink_guy_meme_on_the_rise_invest_now/,30900,1200,r/MemeEconomy
2meirl4meirl,https://www.reddit.com/r/2meirl4meirl/comments/awqh2s/2meirl4meirl/,30700,115,r/2meirl4meirl
Jerry has invited you to play TF2,https://www.reddit.com/r/BikiniBottomTwitter/comments/awx3fm/jerry_has_invited_you_to_play_tf2/,29900,244,r/BikiniBottomTwitter
Wow Bottle Sand Art..,https://www.reddit.com/r/BeAmazed/comments/awsgt2/wow_bottle_sand_art/,29900,287,r/BeAmazed
"Damn, my cousins are savages!",https://www.reddit.com/r/youseeingthisshit/comments/awtcii/damn_my_cousins_are_savages/,29700,113,r/youseeingthisshit
Happy Anniversary Nintendo Switch,https://www.reddit.com/r/NintendoSwitch/comments/awqul4/happy_anniversary_nintendo_switch/,29500,644,r/NintendoSwitch
11 kids dead at N.J. nursing facility. 36 infected. Feds fine Wanaque Center $600K.,https://www.reddit.com/r/news/comments/awum7a/11_kids_dead_at_nj_nursing_facility_36_infected/,29400,998,r/news
This Fork.,https://www.reddit.com/r/mildlyinfuriating/comments/awq9ig/this_fork/,28800,476,r/mildlyinfuriating
Wholesome biker gang,https://www.reddit.com/r/wholesomememes/comments/awtp5q/wholesome_biker_gang/,28700,260,r/wholesomememes
How am I supposed to do my work with this?😫😂,https://www.reddit.com/r/WhatsWrongWithYourDog/comments/awsyx1/how_am_i_supposed_to_do_my_work_with_this/,28600,169,r/WhatsWrongWithYourDog
Can I get an f?,https://www.reddit.com/r/memes/comments/awtkes/can_i_get_an_f/,28400,613,r/memes
Found a hole behind some shelves at work that leads to underground tunnels.,https://www.reddit.com/r/creepy/comments/awrkqi/found_a_hole_behind_some_shelves_at_work_that/,29000,1100,r/creepy
Sounds about right.,https://www.reddit.com/r/justneckbeardthings/comments/awz25e/sounds_about_right/,31800,725,r/justneckbeardthings
Forget Fridays with PewDiePie 9 year olds. Only Beast Master 64 can save us now.,https://www.reddit.com/r/PewdiepieSubmissions/comments/awuq3y/forget_fridays_with_pewdiepie_9_year_olds_only/,27700,172,r/PewdiepieSubmissions
"He doesn't have a job yet, but he's ready for his interview.",https://www.reddit.com/r/dogswithjobs/comments/awtk81/he_doesnt_have_a_job_yet_but_hes_ready_for_his/,27300,111,r/dogswithjobs
Why vaccines? This is before there were a vaccine for diphtheria. Can you imagine losing 5 kids in 5 days?,https://www.reddit.com/r/vaxxhappened/comments/awttk3/why_vaccines_this_is_before_there_were_a_vaccine/,26700,576,r/vaxxhappened
Did hurt my your back knife?,https://www.reddit.com/r/CrappyDesign/comments/awtfx1/did_hurt_my_your_back_knife/,26600,312,r/CrappyDesign
What’s next...,https://www.reddit.com/r/BikiniBottomTwitter/comments/awppzc/whats_next/,26600,459,r/BikiniBottomTwitter
Stick Trick,https://www.reddit.com/r/nevertellmetheodds/comments/awuabp/stick_trick/,26500,106,r/nevertellmetheodds
Schiff claims there's already 'direct evidence' of collusion by Trump campaign,https://www.reddit.com/r/politics/comments/awvmuj/schiff_claims_theres_already_direct_evidence_of/,26500,1800,r/politics
Mongolian,https://www.reddit.com/r/BoneAppleTea/comments/awwjin/mongolian/,27100,363,r/BoneAppleTea
this is keroro ~♡,https://www.reddit.com/r/aww/comments/awv4b8/this_is_keroro/,26200,167,r/aww
When someone asks me if i’m ready for Endgame,https://www.reddit.com/r/marvelstudios/comments/awtn4f/when_someone_asks_me_if_im_ready_for_endgame/,26100,274,r/marvelstudios
How to make mozzarella,https://www.reddit.com/r/GifRecipes/comments/awx2r0/how_to_make_mozzarella/,25800,739,r/GifRecipes
Only us youngsters know this one 😎😎,https://www.reddit.com/r/gatekeeping/comments/awrqhe/only_us_youngsters_know_this_one/,25700,499,r/gatekeeping
Now You See Me - Markus Åkesson - Oil on Canvas - 2019,https://www.reddit.com/r/Art/comments/awzhzn/now_you_see_me_markus_åkesson_oil_on_canvas_2019/,25400,279,r/Art
Is this for real?,https://www.reddit.com/r/funny/comments/awxt1f/is_this_for_real/,25400,316,r/funny
in the 2002 Spider-Man the Green Goblin wore Nike Air Flightposites,https://www.reddit.com/r/MovieDetails/comments/awpkwf/in_the_2002_spiderman_the_green_goblin_wore_nike/,25400,176,r/MovieDetails
The Future of Healthcare: “Kill bacteria with robots and not antibiotics that create antibiotic resistant germs”,https://www.reddit.com/r/Futurology/comments/awtlh9/the_future_of_healthcare_kill_bacteria_with/,25200,901,r/Futurology
Thank God,https://www.reddit.com/r/comics/comments/awur42/thank_god/,25000,141,r/comics
"Oh yeah, we believe you...",https://www.reddit.com/r/dankmemes/comments/awtha4/oh_yeah_we_believe_you/,24700,130,r/dankmemes
What does Eevee evolve into when you give it money?,https://www.reddit.com/r/Jokes/comments/ax07fc/what_does_eevee_evolve_into_when_you_give_it_money/,24600,469,r/Jokes
I was silly to worry about the language barrier while traveling overseas.,https://www.reddit.com/r/funny/comments/awywv4/i_was_silly_to_worry_about_the_language_barrier/,24500,211,r/funny
South Americans be like,https://www.reddit.com/r/dankmemes/comments/awua34/south_americans_be_like/,24400,331,r/dankmemes
I wept working 25¢ over minimum wage at McDonalds,https://www.reddit.com/r/WhitePeopleTwitter/comments/awwjpu/i_wept_working_25_over_minimum_wage_at_mcdonalds/,24300,602,r/WhitePeopleTwitter
PUPILS. 💕,https://www.reddit.com/r/aww/comments/awy3u0/pupils/,24300,158,r/aww
Card domino,https://www.reddit.com/r/oddlysatisfying/comments/awsd9g/card_domino/,24100,365,r/oddlysatisfying
anime_irl,https://www.reddit.com/r/anime_irl/comments/awtf1l/anime_irl/,25400,186,r/anime_irl
This woodland-themed birthday cake has an actual campfire,https://www.reddit.com/r/mildlyinteresting/comments/awwxuf/this_woodlandthemed_birthday_cake_has_an_actual/,23900,144,r/mildlyinteresting
Nearly forgot my phone on my last flight.,https://www.reddit.com/r/Perfectfit/comments/awtz7o/nearly_forgot_my_phone_on_my_last_flight/,24700,146,r/Perfectfit
One of the most underrated guest appearances on the show.,https://www.reddit.com/r/PandR/comments/awsn9k/one_of_the_most_underrated_guest_appearances_on/,23900,220,r/PandR
Trump ordered to pay legal fees after losing court battle over his Scottish golf course,https://www.reddit.com/r/politics/comments/awyd09/trump_ordered_to_pay_legal_fees_after_losing/,23800,862,r/politics
Quest Added,https://www.reddit.com/r/tumblr/comments/awucu0/quest_added/,23600,224,r/tumblr
Don’t tell the police!,https://www.reddit.com/r/madlads/comments/awwl1w/dont_tell_the_police/,23500,115,r/madlads
Poor Mongolians who don't know of other languages,https://www.reddit.com/r/iamverysmart/comments/awtndo/poor_mongolians_who_dont_know_of_other_languages/,23500,579,r/iamverysmart
"Everyone knows devs use dark theme, why is Stack Overflow light?",https://www.reddit.com/r/ProgrammerHumor/comments/awt2lx/everyone_knows_devs_use_dark_theme_why_is_stack/,23400,478,r/ProgrammerHumor
The assembly process of a Boeing 787 dreamliner,https://www.reddit.com/r/educationalgifs/comments/awxdky/the_assembly_process_of_a_boeing_787_dreamliner/,23100,655,r/educationalgifs
Relationship goals,https://www.reddit.com/r/cats/comments/awth6h/relationship_goals/,23000,138,r/cats
There’s always that guy,https://www.reddit.com/r/woooosh/comments/awvwop/theres_always_that_guy/,22900,243,r/woooosh
True family bonding.,https://www.reddit.com/r/wholesomememes/comments/awydba/true_family_bonding/,22600,107,r/wholesomememes
I can see WTF in his eyes.,https://www.reddit.com/r/funny/comments/awwugt/i_can_see_wtf_in_his_eyes/,22500,156,r/funny
Any Rescue Ranger fans out there?,https://www.reddit.com/r/nostalgia/comments/awvyge/any_rescue_ranger_fans_out_there/,23100,570,r/nostalgia
I will always protect you.,https://www.reddit.com/r/aww/comments/awurju/i_will_always_protect_you/,22400,143,r/aww
My dog made a “nope” circle this morning,https://www.reddit.com/r/funny/comments/awukq9/my_dog_made_a_nope_circle_this_morning/,22400,166,r/funny
Wreeeee,https://www.reddit.com/r/thanosdidnothingwrong/comments/awxnsr/wreeeee/,22300,299,r/thanosdidnothingwrong
