Title,Title Link,Score,Num Comments,Subreddit
"For fun I design fake products, behold The Infinity Saucelet, wield all of your favorite fast food sauces at once. Cover everything in sauce...whatever it takes.",https://www.reddit.com/r/funny/comments/bvbaf9/for_fun_i_design_fake_products_behold_the/,93800,2300,r/funny
I drove past the Five Guys where the oil was being dumped from the pic yesterday and saw this man cleaning the mess up this morning.,https://www.reddit.com/r/pics/comments/bv98op/i_drove_past_the_five_guys_where_the_oil_was/,93800,2900,r/pics
"I created a plague doctor sculpture in Minecraft, I think it turned out pretty good!",https://www.reddit.com/r/gaming/comments/bv6a72/i_created_a_plague_doctor_sculpture_in_minecraft/,89600,1500,r/gaming
It really do be like that sometimes,https://www.reddit.com/r/dankmemes/comments/bv8pjr/it_really_do_be_like_that_sometimes/,88100,1200,r/dankmemes
This guy on my way into work was killing time at the red light by blowing bubbles. I want to be at that level of carefree someday.,https://www.reddit.com/r/gifs/comments/bve0uo/this_guy_on_my_way_into_work_was_killing_time_at/,84100,1100,r/gifs
The weed man,https://www.reddit.com/r/wholesomememes/comments/bv0umt/the_weed_man/,79000,321,r/wholesomememes
You have us Keanu Reeves,https://www.reddit.com/r/wholesomememes/comments/bvaysh/you_have_us_keanu_reeves/,77100,591,r/wholesomememes
The most original DVD i have seen,https://www.reddit.com/r/pics/comments/bvbvy0/the_most_original_dvd_i_have_seen/,76100,834,r/pics
One confident little kitten,https://www.reddit.com/r/aww/comments/bved7z/one_confident_little_kitten/,74900,546,r/aww
The hardest choices require the strongest wills,https://www.reddit.com/r/dankmemes/comments/bv66i3/the_hardest_choices_require_the_strongest_wills/,73500,459,r/dankmemes
So our dog gets a bit excited when asked about walks...,https://www.reddit.com/r/WhatsWrongWithYourDog/comments/bv7x95/so_our_dog_gets_a_bit_excited_when_asked_about/,81900,829,r/WhatsWrongWithYourDog
"Forget Xanax, we're about that hydration",https://www.reddit.com/r/HydroHomies/comments/bveoot/forget_xanax_were_about_that_hydration/,78100,1200,r/HydroHomies
This is one awesome keychain,https://www.reddit.com/r/gaming/comments/bv13p9/this_is_one_awesome_keychain/,71600,1100,r/gaming
You need to open up more...,https://www.reddit.com/r/wholesomememes/comments/bvelms/you_need_to_open_up_more/,71500,589,r/wholesomememes
What's classy if you're rich but trashy if you're poor?,https://www.reddit.com/r/AskReddit/comments/bvdaci/whats_classy_if_youre_rich_but_trashy_if_youre/,66100,18000,r/AskReddit
"Even stray dogs deserve love, sunrise scene.",https://www.reddit.com/r/pics/comments/bv67n2/even_stray_dogs_deserve_love_sunrise_scene/,65600,821,r/pics
I was recently the best man at a wedding in the Caribbean.,https://www.reddit.com/r/funny/comments/bv7f7w/i_was_recently_the_best_man_at_a_wedding_in_the/,63500,1100,r/funny
"The decline of trust in science “terrifies” former MIT president Susan Hockfield: If we don’t trust scientists to be experts in their fields, “we have no way of making it into the future.”",https://www.reddit.com/r/Futurology/comments/bv72gv/the_decline_of_trust_in_science_terrifies_former/,63000,4700,r/Futurology
Kudos for trying,https://www.reddit.com/r/Wellthatsucks/comments/bv1b6d/kudos_for_trying/,62400,1200,r/Wellthatsucks
Hey little buddies.,https://www.reddit.com/r/aww/comments/bv6rvb/hey_little_buddies/,61500,349,r/aww
The web on a dollar bill is made by a spider,https://www.reddit.com/r/mildlyinteresting/comments/bve50k/the_web_on_a_dollar_bill_is_made_by_a_spider/,60400,16700,r/mildlyinteresting
"When we make r/gameofthrones kneel to us, Emilia personally thanks us, and we reach 1 million members all in a single week.",https://www.reddit.com/r/freefolk/comments/bv6dd1/when_we_make_rgameofthrones_kneel_to_us_emilia/,58800,926,r/freefolk
Bear climbing up a steep cliff,https://www.reddit.com/r/natureismetal/comments/bvadx1/bear_climbing_up_a_steep_cliff/,58000,1200,r/natureismetal
Not all heroes wear capes,https://www.reddit.com/r/dankmemes/comments/bv3yrr/not_all_heroes_wear_capes/,56000,164,r/dankmemes
Italy is evicting Steve Bannon from the medieval monastery he planned to turn into a far-right training academy,https://www.reddit.com/r/worldnews/comments/bva42f/italy_is_evicting_steve_bannon_from_the_medieval/,53800,2500,r/worldnews
Russia Deployed Its Trolls to Cover Up the Murder of 298 People on MH17,https://www.reddit.com/r/worldnews/comments/bv5e19/russia_deployed_its_trolls_to_cover_up_the_murder/,52700,3500,r/worldnews
“A life is not saved just by letting it be born”,https://www.reddit.com/r/pics/comments/bvcg3k/a_life_is_not_saved_just_by_letting_it_be_born/,51900,6000,r/pics
Gender Reveal Magic,https://www.reddit.com/r/Unexpected/comments/bvb2hc/gender_reveal_magic/,51800,1300,r/Unexpected
"When people from other subreddits start talking about how ""we"" came together to help Emilia",https://www.reddit.com/r/freefolk/comments/bv88ci/when_people_from_other_subreddits_start_talking/,51200,862,r/freefolk
Pupper does a grow from 8 weeks to nearly a year,https://www.reddit.com/r/rarepuppers/comments/bvatsv/pupper_does_a_grow_from_8_weeks_to_nearly_a_year/,50300,215,r/rarepuppers
"Children who nap midday are happier, excel academically, and have fewer behavioral problems, suggests a new study of nearly 3,000 kids in China, which revealed a connection between midday napping and greater happiness, self-control, and grit; fewer behavioral problems; and higher IQ.",https://www.reddit.com/r/science/comments/bvdsr8/children_who_nap_midday_are_happier_excel/,49900,1400,r/science
Idk what to title,https://www.reddit.com/r/rareinsults/comments/bv5rpe/idk_what_to_title/,49100,225,r/rareinsults
JustGiving fundraiser for Kit Harington's charity Mencap,https://www.reddit.com/r/freefolk/comments/bv3ute/justgiving_fundraiser_for_kit_haringtons_charity/,48700,1300,r/freefolk
"Depressed, suicidal, or otherwise extremely downtrodden members of reddit: what is your go-to quote, phrase, or particular memory in life that keeps you going?",https://www.reddit.com/r/AskReddit/comments/bv51tj/depressed_suicidal_or_otherwise_extremely/,48300,21600,r/AskReddit
"When nervous, fawns' instinct is to lie down in the grass and keep an eye on threat. But sometimes, they'll do it in plain sight and think they're hidden.",https://www.reddit.com/r/interestingasfuck/comments/bvc4w6/when_nervous_fawns_instinct_is_to_lie_down_in_the/,46900,390,r/interestingasfuck
"LPT: pack your toiletry bag the night prior to traveling and only use that travel bag when getting ready the morning that begins your travels. This way, you will identify anything you may not have packed the night before and will have time to add it to your toiletry bag before setting off.",https://www.reddit.com/r/LifeProTips/comments/bv7rjq/lpt_pack_your_toiletry_bag_the_night_prior_to/,46000,647,r/LifeProTips
Snapped a photo inside an old rolled up blueprint at work the other day and felt like sharing...,https://www.reddit.com/r/pics/comments/bv75pa/snapped_a_photo_inside_an_old_rolled_up_blueprint/,46000,606,r/pics
My dad before prom in the 70s. His brother is a professional photographer and got this legendary photo.,https://www.reddit.com/r/OldSchoolCool/comments/bv9gjk/my_dad_before_prom_in_the_70s_his_brother_is_a/,44900,936,r/OldSchoolCool
The Reset,https://www.reddit.com/r/imsorryjon/comments/bv3le7/the_reset/,45600,315,r/imsorryjon
No need to explain,https://www.reddit.com/r/facepalm/comments/bv4zqs/no_need_to_explain/,43900,1100,r/facepalm
Naming is the most difficult part,https://www.reddit.com/r/ProgrammerHumor/comments/bvdrhd/naming_is_the_most_difficult_part/,43900,778,r/ProgrammerHumor
Impressive snake mural on a staircase,https://www.reddit.com/r/Damnthatsinteresting/comments/bv9prf/impressive_snake_mural_on_a_staircase/,42700,195,r/Damnthatsinteresting
Homemade dynamic 3D paper cut day cycle clock light box,https://www.reddit.com/r/interestingasfuck/comments/bv8d7a/homemade_dynamic_3d_paper_cut_day_cycle_clock/,42400,355,r/interestingasfuck
"In Zoolander (2000), Maury Ballstein says he thinks cell phones cause brain cancer and as a result holds his phone by his waist or in a pocket while using a headset. Later, Maury complains his prostate is swollen and he can’t urinate. These are both signs of prostate cancer.",https://www.reddit.com/r/MovieDetails/comments/bv7edi/in_zoolander_2000_maury_ballstein_says_he_thinks/,42400,390,r/MovieDetails
"When you disable your comments, you know you're defeated",https://www.reddit.com/r/PewdiepieSubmissions/comments/bv9i4b/when_you_disable_your_comments_you_know_youre/,41800,523,r/PewdiepieSubmissions
Kid tasting a lime at a ceremony,https://www.reddit.com/r/instant_regret/comments/bvdady/kid_tasting_a_lime_at_a_ceremony/,41300,293,r/instant_regret
A cat meeting tigers for the first time,https://www.reddit.com/r/youseeingthisshit/comments/bvardd/a_cat_meeting_tigers_for_the_first_time/,41100,291,r/youseeingthisshit
Who do they think they are trying to TEACH us.,https://www.reddit.com/r/dankmemes/comments/bv6dzb/who_do_they_think_they_are_trying_to_teach_us/,40900,282,r/dankmemes
That's the money I paid for your toys,https://www.reddit.com/r/dankmemes/comments/bv6e1j/thats_the_money_i_paid_for_your_toys/,40900,242,r/dankmemes
me_irl,https://www.reddit.com/r/me_irl/comments/bv5w6n/me_irl/,40300,478,r/me_irl
🤧,https://www.reddit.com/r/WatchPeopleDieInside/comments/bv96wr/_/,40000,747,r/WatchPeopleDieInside
Construction pupper helps build a house,https://www.reddit.com/r/rarepuppers/comments/bv5n62/construction_pupper_helps_build_a_house/,39800,281,r/rarepuppers
[NO SPOILERS] This will defintely be deleted by the mods 👏🏻👏🏻,https://www.reddit.com/r/gameofthrones/comments/bvdknk/no_spoilers_this_will_defintely_be_deleted_by_the/,40000,1500,r/gameofthrones
Drogon lamp I 3D printed.,https://www.reddit.com/r/mildlyinteresting/comments/bv0m9j/drogon_lamp_i_3d_printed/,39700,387,r/mildlyinteresting
This guy made an incredible bonsai tree just from copper wires,https://www.reddit.com/r/oddlysatisfying/comments/bva990/this_guy_made_an_incredible_bonsai_tree_just_from/,39600,377,r/oddlysatisfying
"'Ford v Ferrari' Official Poster (Matt Damon, Christian Bale)",https://www.reddit.com/r/movies/comments/bv9cry/ford_v_ferrari_official_poster_matt_damon/,39300,1400,r/movies
You pay me $400 to tear down my garage,https://www.reddit.com/r/ChoosingBeggars/comments/bvaps9/you_pay_me_400_to_tear_down_my_garage/,39300,1100,r/ChoosingBeggars
[Visible confusion],https://www.reddit.com/r/PrequelMemes/comments/bv4zfe/visible_confusion/,39100,117,r/PrequelMemes
the true enemy,https://www.reddit.com/r/dankmemes/comments/bv49gc/the_true_enemy/,38800,184,r/dankmemes
go crazy aAaAAaaAaa,https://www.reddit.com/r/dankmemes/comments/bvcczi/go_crazy_aaaaaaaaaa/,38600,148,r/dankmemes
"Beards, the male push-up bra.",https://www.reddit.com/r/DunderMifflin/comments/bv4qz9/beards_the_male_pushup_bra/,38000,707,r/DunderMifflin
Dog runs and then smiles!,https://www.reddit.com/r/BetterEveryLoop/comments/bv6bcw/dog_runs_and_then_smiles/,38100,191,r/BetterEveryLoop
Young love...,https://www.reddit.com/r/youngpeopleyoutube/comments/bvd238/young_love/,41200,604,r/youngpeopleyoutube
This is what a phone screen looks like at 200x magnification,https://www.reddit.com/r/gifs/comments/bvb1tm/this_is_what_a_phone_screen_looks_like_at_200x/,37000,636,r/gifs
Someone drew the r/Teenagers mascot on my school campus with chalk today,https://www.reddit.com/r/teenagers/comments/bvayi2/someone_drew_the_rteenagers_mascot_on_my_school/,36900,588,r/teenagers
What did it cost us?,https://www.reddit.com/r/freefolk/comments/bvblkx/what_did_it_cost_us/,36400,774,r/freefolk
"In light of R. Kelly's latest series of abuse, let's not forget another special kind of person",https://www.reddit.com/r/AdviceAnimals/comments/bv2fdu/in_light_of_r_kellys_latest_series_of_abuse_lets/,36400,1100,r/AdviceAnimals
Me creating fake accounts to sign the petition so that Kit Harington gets his longclaw sword :),https://www.reddit.com/r/freefolk/comments/bvcasu/me_creating_fake_accounts_to_sign_the_petition_so/,36400,282,r/freefolk
Its complicated but true.,https://www.reddit.com/r/technicallythetruth/comments/bv4wp6/its_complicated_but_true/,35900,493,r/technicallythetruth
Putting an overly picky girl in her place.,https://www.reddit.com/r/rareinsults/comments/bvbqti/putting_an_overly_picky_girl_in_her_place/,35200,376,r/rareinsults
Best ad this week,https://www.reddit.com/r/dankmemes/comments/bv9o1c/best_ad_this_week/,35000,178,r/dankmemes
Insane time and effort,https://www.reddit.com/r/toptalent/comments/bv62cq/insane_time_and_effort/,35000,406,r/toptalent
Elizabeth Warren says she wants to make it legal to indict presidents,https://www.reddit.com/r/politics/comments/bv79du/elizabeth_warren_says_she_wants_to_make_it_legal/,34900,2400,r/politics
Illinois House passses bill to legalize recreational marijuana,https://www.reddit.com/r/news/comments/bvdgqn/illinois_house_passses_bill_to_legalize/,34800,2100,r/news
Me_irl,https://www.reddit.com/r/me_irl/comments/bv30ec/me_irl/,34700,138,r/me_irl
:'),https://www.reddit.com/r/Tinder/comments/bv0jhh/_/,34400,371,r/Tinder
The bigger the nose...,https://www.reddit.com/r/BikiniBottomTwitter/comments/bvbj7d/the_bigger_the_nose/,34300,142,r/BikiniBottomTwitter
Navy official confirms White House requested USS McCain be kept away during Trump visit,https://www.reddit.com/r/politics/comments/bv6ent/navy_official_confirms_white_house_requested_uss/,34300,2900,r/politics
"Jesus, Garfield, you are a freak",https://www.reddit.com/r/raimimemes/comments/bv5c63/jesus_garfield_you_are_a_freak/,38200,324,r/raimimemes
That's my food,https://www.reddit.com/r/BikiniBottomTwitter/comments/bv6sv6/thats_my_food/,34000,178,r/BikiniBottomTwitter
Shout-out to Oscar with the best ELI5,https://www.reddit.com/r/DunderMifflin/comments/bvcjc6/shoutout_to_oscar_with_the_best_eli5/,33400,295,r/DunderMifflin
I believe him,https://www.reddit.com/r/funny/comments/bv7re5/i_believe_him/,33300,593,r/funny
The Space Race,https://www.reddit.com/r/HistoryMemes/comments/bvdsrc/the_space_race/,33000,147,r/HistoryMemes
The only benchmark you cannot pass without lagging,https://www.reddit.com/r/pcmasterrace/comments/bv9caq/the_only_benchmark_you_cannot_pass_without_lagging/,32800,702,r/pcmasterrace
A CG human eye created with free software by Chris Jones. xpost r/blender,https://www.reddit.com/r/interestingasfuck/comments/bv9jqe/a_cg_human_eye_created_with_free_software_by/,32100,603,r/interestingasfuck
benadryl commandersnatch,https://www.reddit.com/r/dankmemes/comments/bv6etb/benadryl_commandersnatch/,32000,154,r/dankmemes
"AndyMation's Biggest 658-Pages Flipbook of ""The Return of Grumpy Cloud""",https://www.reddit.com/r/BeAmazed/comments/bv4d63/andymations_biggest_658pages_flipbook_of_the/,32000,349,r/BeAmazed
Virginia Beach police say multiple people hurt in shooting,https://www.reddit.com/r/news/comments/bvd0ko/virginia_beach_police_say_multiple_people_hurt_in/,31900,10000,r/news
How Scoliosis (Curvature of the Spine) Surgery is Performed,https://www.reddit.com/r/educationalgifs/comments/bvblny/how_scoliosis_curvature_of_the_spine_surgery_is/,32000,2000,r/educationalgifs
Aerogel - The world's lightest solid - Impossible to see against a white background,https://www.reddit.com/r/blackmagicfuckery/comments/bvaryw/aerogel_the_worlds_lightest_solid_impossible_to/,31800,687,r/blackmagicfuckery
Elephant seal pup says hello to a photographer,https://www.reddit.com/r/Eyebleach/comments/bv5nw1/elephant_seal_pup_says_hello_to_a_photographer/,31700,277,r/Eyebleach
Poor Bucky,https://www.reddit.com/r/marvelmemes/comments/bvbm5a/poor_bucky/,32900,571,r/marvelmemes
Smart dog and good drivers.,https://www.reddit.com/r/Damnthatsinteresting/comments/bv0gl2/smart_dog_and_good_drivers/,31000,205,r/Damnthatsinteresting
Justice Department fails to comply with court order to release transcripts of Michael Flynn’s conversations with Russian ambassador,https://www.reddit.com/r/politics/comments/bvdtn4/justice_department_fails_to_comply_with_court/,31000,2300,r/politics
"finally, finished building this PC",https://www.reddit.com/r/pcmasterrace/comments/bv3qwh/finally_finished_building_this_pc/,30900,735,r/pcmasterrace
"A classic game of double yellow chicken, I guess I lost?",https://www.reddit.com/r/IdiotsInCars/comments/bv1u09/a_classic_game_of_double_yellow_chicken_i_guess_i/,30500,486,r/IdiotsInCars
I met Taika Waititi. He tried to get me to sign up for his revolution but he didn’t print enough pamphlets,https://www.reddit.com/r/marvelstudios/comments/bv819z/i_met_taika_waititi_he_tried_to_get_me_to_sign_up/,30400,378,r/marvelstudios
"Touch the darkness within me, jon",https://www.reddit.com/r/imsorryjon/comments/bv9qs4/touch_the_darkness_within_me_jon/,30300,339,r/imsorryjon
Petition for a Davos bot that corrects grammar,https://www.reddit.com/r/freefolk/comments/bv7w3u/petition_for_a_davos_bot_that_corrects_grammar/,29800,686,r/freefolk
Explain this Youtube,https://www.reddit.com/r/PewdiepieSubmissions/comments/bv3m78/explain_this_youtube/,29700,316,r/PewdiepieSubmissions
"Russian trolls fueled anti-vaccination debate in U.S. by spreading misinformation on Twitter, study finds",https://www.reddit.com/r/worldnews/comments/bv8vey/russian_trolls_fueled_antivaccination_debate_in/,29700,1900,r/worldnews
When I'm watching ROTS with my wife and her friend and we get to the Youngling scene.,https://www.reddit.com/r/PrequelMemes/comments/bv9yw4/when_im_watching_rots_with_my_wife_and_her_friend/,29600,214,r/PrequelMemes
Not today,https://www.reddit.com/r/thanosdidnothingwrong/comments/bv3yk9/not_today/,29400,233,r/thanosdidnothingwrong
How about a raise?,https://www.reddit.com/r/funny/comments/bv6xs7/how_about_a_raise/,29300,1300,r/funny
The meal today will be mashed potatoes,https://www.reddit.com/r/dankmemes/comments/bv3k0r/the_meal_today_will_be_mashed_potatoes/,29200,105,r/dankmemes
MRW my bf asks if I want to get brunch after a night out.,https://www.reddit.com/r/reactiongifs/comments/bv6nrz/mrw_my_bf_asks_if_i_want_to_get_brunch_after_a/,29000,307,r/reactiongifs
"[Post Game Thread] The Toronto Raptors defeat the Golden State Warriors, 118-109, take a 1-0 lead.",https://www.reddit.com/r/nba/comments/bv2mi5/post_game_thread_the_toronto_raptors_defeat_the/,28900,6700,r/nba
me_irl,https://www.reddit.com/r/me_irl/comments/bv437a/me_irl/,28800,121,r/me_irl
"Perfectly dated, as all things should be",https://www.reddit.com/r/thanosdidnothingwrong/comments/bvbywo/perfectly_dated_as_all_things_should_be/,28700,143,r/thanosdidnothingwrong
Applying the finishing touches,https://www.reddit.com/r/oddlysatisfying/comments/bv20v2/applying_the_finishing_touches/,28400,394,r/oddlysatisfying
[Poetry] Climate Change Facts don't care about your Climate Denial Feelings,https://www.reddit.com/r/youtubehaiku/comments/bvcqd1/poetry_climate_change_facts_dont_care_about_your/,28900,1600,r/youtubehaiku
Ball boy meet wall boy,https://www.reddit.com/r/Wellthatsucks/comments/bv9v53/ball_boy_meet_wall_boy/,27800,326,r/Wellthatsucks
Someone knowing you exist is such intimate knowledge. There are billions of people that don't know you exist.,https://www.reddit.com/r/Showerthoughts/comments/bv5oyg/someone_knowing_you_exist_is_such_intimate/,27600,338,r/Showerthoughts
Copy Cats,https://www.reddit.com/r/funny/comments/bv6w9i/copy_cats/,27600,270,r/funny
My life in a nutshell.,https://www.reddit.com/r/dankmemes/comments/bv48yp/my_life_in_a_nutshell/,27400,85,r/dankmemes
Goddamn snitches,https://www.reddit.com/r/WhitePeopleTwitter/comments/bv7py8/goddamn_snitches/,27300,177,r/WhitePeopleTwitter
"Thanks, I hate bellybutton face",https://www.reddit.com/r/TIHI/comments/bv6g9m/thanks_i_hate_bellybutton_face/,27300,215,r/TIHI
WUAH,https://www.reddit.com/r/perfectlycutscreams/comments/bv5dfe/wuah/,27200,227,r/perfectlycutscreams
"In Terrifying Interview, William Barr Goes Full MAGA",https://www.reddit.com/r/politics/comments/bvb6k8/in_terrifying_interview_william_barr_goes_full/,27000,2800,r/politics
Female detective in movies/shows starter pack,https://www.reddit.com/r/starterpacks/comments/bvbujg/female_detective_in_moviesshows_starter_pack/,27000,688,r/starterpacks
First meme,https://www.reddit.com/r/lotrmemes/comments/bvdds2/first_meme/,26900,661,r/lotrmemes
I was recently the best man at a wedding in the Caribbean.,https://www.reddit.com/r/funny/comments/bv7fpy/i_was_recently_the_best_man_at_a_wedding_in_the/,26600,599,r/funny
The hardest choices require the strongest wills,https://www.reddit.com/r/dankmemes/comments/bvbwee/the_hardest_choices_require_the_strongest_wills/,26600,61,r/dankmemes
Run Forrest Run,https://www.reddit.com/r/dankmemes/comments/bvchqe/run_forrest_run/,26100,115,r/dankmemes
Haiti and Lichtenstein at the 1936 Olympic Games,https://www.reddit.com/r/HistoryMemes/comments/bv7b21/haiti_and_lichtenstein_at_the_1936_olympic_games/,26100,169,r/HistoryMemes
to fly like Iron Man,https://www.reddit.com/r/therewasanattempt/comments/bv8ocb/to_fly_like_iron_man/,26000,319,r/therewasanattempt
My teacher told me I'd never be good at poetry because I'm dyslexic.,https://www.reddit.com/r/Jokes/comments/bv8e0i/my_teacher_told_me_id_never_be_good_at_poetry/,26000,455,r/Jokes
All women on the internet are actually dudes,https://www.reddit.com/r/dankmemes/comments/bv61xy/all_women_on_the_internet_are_actually_dudes/,26000,532,r/dankmemes
Absolutely brutal,https://www.reddit.com/r/HistoryMemes/comments/bv5sb6/absolutely_brutal/,25900,159,r/HistoryMemes
Genetically Enhanced Fungus killed 99% of Malaria-causing mosquitos in trial,https://www.reddit.com/r/UpliftingNews/comments/bv2rbr/genetically_enhanced_fungus_killed_99_of/,25400,898,r/UpliftingNews
It's time to stop,https://www.reddit.com/r/woooosh/comments/bv4cco/its_time_to_stop/,25400,397,r/woooosh
"Don't offer it money, don't touch it's neck",https://www.reddit.com/r/boottoobig/comments/bv7z2d/dont_offer_it_money_dont_touch_its_neck/,25300,75,r/boottoobig
Nice ad,https://www.reddit.com/r/dankmemes/comments/bvdnq8/nice_ad/,25000,54,r/dankmemes
Always gets me,https://www.reddit.com/r/creepy/comments/bvd51t/always_gets_me/,25700,396,r/creepy
Ugly mug,https://www.reddit.com/r/funny/comments/bv61si/ugly_mug/,24700,362,r/funny
[No Spoilers] My Recent Paintings in Honor of Emilia and Kit - Turned Out Better Than Expected,https://www.reddit.com/r/gameofthrones/comments/bv81jw/no_spoilers_my_recent_paintings_in_honor_of/,24700,243,r/gameofthrones
This is a new meta.,https://www.reddit.com/r/FellowKids/comments/bv7k9k/this_is_a_new_meta/,24800,306,r/FellowKids
Tug of war,https://www.reddit.com/r/reallifedoodles/comments/bvadh3/tug_of_war/,24400,220,r/reallifedoodles
We will hold the world ransom for... $1million,https://www.reddit.com/r/teenagers/comments/bv68vs/we_will_hold_the_world_ransom_for_1million/,24400,243,r/teenagers
me_irl,https://www.reddit.com/r/meirl/comments/bv4fr3/me_irl/,24200,215,r/meirl
Precision flying,https://www.reddit.com/r/PraiseTheCameraMan/comments/bv54gm/precision_flying/,24200,279,r/PraiseTheCameraMan
2meirl4meirl,https://www.reddit.com/r/2meirl4meirl/comments/bv8ciu/2meirl4meirl/,23800,266,r/2meirl4meirl
Did anyone else watch Unwrapped?,https://www.reddit.com/r/nostalgia/comments/bv0z1v/did_anyone_else_watch_unwrapped/,24300,708,r/nostalgia
2meirl4meirl,https://www.reddit.com/r/2meirl4meirl/comments/bve7v8/2meirl4meirl/,23600,191,r/2meirl4meirl
King in the north.,https://www.reddit.com/r/aww/comments/bv7cpw/king_in_the_north/,23600,180,r/aww
to catch coffee from a few floors above,https://www.reddit.com/r/therewasanattempt/comments/bv4rhr/to_catch_coffee_from_a_few_floors_above/,23600,275,r/therewasanattempt
Well let’s see what morgz will do,https://www.reddit.com/r/PewdiepieSubmissions/comments/bv3jwn/well_lets_see_what_morgz_will_do/,23500,144,r/PewdiepieSubmissions
Cuz you know! Memes belong here!,https://www.reddit.com/r/lostredditors/comments/bv30c4/cuz_you_know_memes_belong_here/,24700,371,r/lostredditors
ViCioUs pAcK Of dOgS TeArs cAT tO ShRedS.,https://www.reddit.com/r/PeopleFuckingDying/comments/bv8bsf/vicious_pack_of_dogs_tears_cat_to_shreds/,23300,218,r/PeopleFuckingDying
i like anime titties,https://www.reddit.com/r/dankmemes/comments/bv5rud/i_like_anime_titties/,23200,72,r/dankmemes
Eating blueberries every day improves heart health - Findings show that eating 150g of blueberries daily reduces the risk of cardiovascular disease by up to 15 per cent,https://www.reddit.com/r/science/comments/bv4efq/eating_blueberries_every_day_improves_heart/,23200,1100,r/science
When Emilia Clarke says she should be bending the knee to us,https://www.reddit.com/r/freefolk/comments/bv6ir2/when_emilia_clarke_says_she_should_be_bending_the/,23100,210,r/freefolk
[request] how much would this cost?,https://www.reddit.com/r/theydidthemath/comments/bv6rkq/request_how_much_would_this_cost/,23900,405,r/theydidthemath
So much hard work paying off for all of them!,https://www.reddit.com/r/wholesomememes/comments/bv8ed2/so_much_hard_work_paying_off_for_all_of_them/,22900,335,r/wholesomememes
Unmatched but worth it,https://www.reddit.com/r/Tinder/comments/bv1qly/unmatched_but_worth_it/,22800,229,r/Tinder
Accuracy 100,https://www.reddit.com/r/memes/comments/bv1n83/accuracy_100/,22800,134,r/memes
Finals week! I can STILL make it!,https://www.reddit.com/r/dankmemes/comments/bvdspd/finals_week_i_can_still_make_it/,22700,61,r/dankmemes
We'll We'll We'll,https://www.reddit.com/r/Jokes/comments/bv4f6a/well_well_well/,22700,541,r/Jokes
How the turntables.,https://www.reddit.com/r/dankmemes/comments/bv6khm/how_the_turntables/,22400,148,r/dankmemes
Always a nice surprise,https://www.reddit.com/r/AdviceAnimals/comments/bv9ard/always_a_nice_surprise/,22300,300,r/AdviceAnimals
