Title,Title Link,Score,Num Comments,Subreddit
Student becomes the Master,https://www.reddit.com/r/HistoryMemes/comments/bmwe9v/student_becomes_the_master/,23600,151,r/HistoryMemes
He won't be forgotten...,https://www.reddit.com/r/ShitPostCrusaders/comments/bn27k9/he_wont_be_forgotten/,23500,152,r/ShitPostCrusaders
TIL that blue eyes don’t have blue pigment and are instead blue for the same reason that water and the sky are blue: they scatter light so that only blue light reflects out,https://www.reddit.com/r/todayilearned/comments/bn4i0n/til_that_blue_eyes_dont_have_blue_pigment_and_are/,23500,969,r/todayilearned
MRW I saw Thor in Endgame.,https://www.reddit.com/r/HighQualityGifs/comments/bmxzzp/mrw_i_saw_thor_in_endgame/,23400,414,r/HighQualityGifs
Animators forget about stuff sometimes...,https://www.reddit.com/r/funny/comments/bn1grh/animators_forget_about_stuff_sometimes/,23400,380,r/funny
True pain,https://www.reddit.com/r/rickandmorty/comments/bn5d1k/true_pain/,23300,182,r/rickandmorty
Seriously wtf?,https://www.reddit.com/r/dankmemes/comments/bmyac3/seriously_wtf/,23300,268,r/dankmemes
After you get your friend to switch from Istagram.,https://www.reddit.com/r/memes/comments/bn17ng/after_you_get_your_friend_to_switch_from_istagram/,23200,740,r/memes
Cat-Like Reflexes,https://www.reddit.com/r/BetterEveryLoop/comments/bmvbpi/catlike_reflexes/,23200,167,r/BetterEveryLoop
I've seen endgame 5times already,https://www.reddit.com/r/dankmemes/comments/bmzxgj/ive_seen_endgame_5times_already/,23100,114,r/dankmemes
My partner's family just got a new kitten and he has stolen all our hearts,https://www.reddit.com/r/aww/comments/bmwmc7/my_partners_family_just_got_a_new_kitten_and_he/,23100,151,r/aww
Buying a gaming monitor.,https://www.reddit.com/r/pcmasterrace/comments/bmusy0/buying_a_gaming_monitor/,23000,1000,r/pcmasterrace
That’s life,https://www.reddit.com/r/WhitePeopleTwitter/comments/bmrwk0/thats_life/,22900,203,r/WhitePeopleTwitter
Boys locker room:,https://www.reddit.com/r/teenagers/comments/bmzze4/boys_locker_room/,22600,338,r/teenagers
[yeeted],https://www.reddit.com/r/dankmemes/comments/bmu89j/yeeted/,22400,99,r/dankmemes
Oldie but a goodie 👖,https://www.reddit.com/r/ATBGE/comments/bmys9m/oldie_but_a_goodie/,22300,441,r/ATBGE
Minecraft good,https://www.reddit.com/r/dankmemes/comments/bmz1dt/minecraft_good/,22200,81,r/dankmemes
Engineering is King,https://www.reddit.com/r/iamverysmart/comments/bmsqrb/engineering_is_king/,22200,498,r/iamverysmart
A North Korean Soldier Walks Into A Bar,https://www.reddit.com/r/Jokes/comments/bmw3ae/a_north_korean_soldier_walks_into_a_bar/,22000,317,r/Jokes
Merirl,https://www.reddit.com/r/me_irl/comments/bn53tp/merirl/,22000,60,r/me_irl
Hero that we need,https://www.reddit.com/r/dankmemes/comments/bmu0kr/hero_that_we_need/,22000,285,r/dankmemes
My favorite quote of all time,https://www.reddit.com/r/comedyhomicide/comments/bn47my/my_favorite_quote_of_all_time/,22400,269,r/comedyhomicide
hmmm,https://www.reddit.com/r/hmmm/comments/bmw8i2/hmmm/,22000,297,r/hmmm
"""We've restored your pokémon to full health""",https://www.reddit.com/r/gaming/comments/bn5oci/weve_restored_your_pokémon_to_full_health/,21900,169,r/gaming
Sneakpool,https://www.reddit.com/r/dankmemes/comments/bmxgm9/sneakpool/,21800,46,r/dankmemes
The hairdresser had “no idea” how this happened.,https://www.reddit.com/r/Justfuckmyshitup/comments/bms7ys/the_hairdresser_had_no_idea_how_this_happened/,22500,523,r/Justfuckmyshitup
TIL that Because of their naturally friendly dispositions Samoyeds usually make for terrible guard dogs. They don't attack threats; just kind of smile and bark at them.,https://www.reddit.com/r/todayilearned/comments/bn3pot/til_that_because_of_their_naturally_friendly/,21700,569,r/todayilearned
MRW my girlfriend takes me back for the 5th time and i show up to a get together with her friends.,https://www.reddit.com/r/reactiongifs/comments/bmz1xi/mrw_my_girlfriend_takes_me_back_for_the_5th_time/,21600,407,r/reactiongifs
ASSAULT VEHICLE ACQUIRED,https://www.reddit.com/r/teenagers/comments/bmwhkv/assault_vehicle_acquired/,21600,167,r/teenagers
Co-worker gets me fired. My many years waiting for revenge.,https://www.reddit.com/r/ProRevenge/comments/bn2hor/coworker_gets_me_fired_my_many_years_waiting_for/,22300,621,r/ProRevenge
They'll never see it coming,https://www.reddit.com/r/dankmemes/comments/bn3rdt/theyll_never_see_it_coming/,21300,175,r/dankmemes
Little big fella,https://www.reddit.com/r/AbsoluteUnits/comments/bn541h/little_big_fella/,21200,216,r/AbsoluteUnits
Tf did you just bring upon this cursed land,https://www.reddit.com/r/dankmemes/comments/bmw9px/tf_did_you_just_bring_upon_this_cursed_land/,21100,122,r/dankmemes
All aboard the cray cray train,https://www.reddit.com/r/dankmemes/comments/bmxe65/all_aboard_the_cray_cray_train/,21000,144,r/dankmemes
The most badass way to figure out a career path,https://www.reddit.com/r/nextfuckinglevel/comments/bmt2n1/the_most_badass_way_to_figure_out_a_career_path/,21000,274,r/nextfuckinglevel
Chancla incoming,https://www.reddit.com/r/dankmemes/comments/bmxejg/chancla_incoming/,21000,90,r/dankmemes
Blursed Doggo,https://www.reddit.com/r/blursedimages/comments/bmxqlb/blursed_doggo/,20900,176,r/blursedimages
No I must save him,https://www.reddit.com/r/AnimalsBeingDerps/comments/bmx8yg/no_i_must_save_him/,20900,143,r/AnimalsBeingDerps
Ungrateful 😒,https://www.reddit.com/r/memes/comments/bmv1r9/ungrateful/,20800,95,r/memes
Real picture from the holy bible,https://www.reddit.com/r/dankmemes/comments/bn0tdd/real_picture_from_the_holy_bible/,20800,157,r/dankmemes
Drawing on my friend’s guitar with acrylic marker! Still deciding what to fill in the last part with,https://www.reddit.com/r/gifs/comments/bn4bjg/drawing_on_my_friends_guitar_with_acrylic_marker/,20700,420,r/gifs
Great now where do I fit Jupiter in my room?,https://www.reddit.com/r/facepalm/comments/bmxg6q/great_now_where_do_i_fit_jupiter_in_my_room/,20700,180,r/facepalm
"The harder you slap someone’s ass, the less awkward it is.",https://www.reddit.com/r/Showerthoughts/comments/bms4ct/the_harder_you_slap_someones_ass_the_less_awkward/,20600,392,r/Showerthoughts
"For full offense, scream and snap:",https://www.reddit.com/r/boottoobig/comments/bmvlev/for_full_offense_scream_and_snap/,20600,92,r/boottoobig
am yes,https://www.reddit.com/r/dankmemes/comments/bn2egr/am_yes/,20600,148,r/dankmemes
A classic,https://www.reddit.com/r/dankmemes/comments/bmv849/a_classic/,20600,97,r/dankmemes
new PewDiePie flavor,https://www.reddit.com/r/PewdiepieSubmissions/comments/bmyrgk/new_pewdiepie_flavor/,20400,400,r/PewdiepieSubmissions
Real Hug- oh this is nice 💕,https://www.reddit.com/r/marvelmemes/comments/bmwwkn/real_hug_oh_this_is_nice/,20200,287,r/marvelmemes
Boys locker room be like.,https://www.reddit.com/r/dankmemes/comments/bms5xz/boys_locker_room_be_like/,20100,166,r/dankmemes
Everything is an illusion on this woman’s profile,https://www.reddit.com/r/Instagramreality/comments/bmyc1y/everything_is_an_illusion_on_this_womans_profile/,20100,259,r/Instagramreality
Ya'll ever attend a Hacker Viewing Party?,https://www.reddit.com/r/apexlegends/comments/bmwqya/yall_ever_attend_a_hacker_viewing_party/,19900,659,r/apexlegends
Size of acupuncture needle,https://www.reddit.com/r/interestingasfuck/comments/bn2stg/size_of_acupuncture_needle/,19900,574,r/interestingasfuck
meirl,https://www.reddit.com/r/meirl/comments/bmtr3t/meirl/,19800,172,r/meirl
I crocheted a bunch of Pokémon the last few weeks!,https://www.reddit.com/r/gaming/comments/bmzl4l/i_crocheted_a_bunch_of_pokémon_the_last_few_weeks/,19700,518,r/gaming
"After three years, I've finished my imperial astromech droid, K4-G8!",https://www.reddit.com/r/EmpireDidNothingWrong/comments/bmxwux/after_three_years_ive_finished_my_imperial/,19900,371,r/EmpireDidNothingWrong
"In Infinity War Thanos uses a small double-bladed knife to demonstrate how perfectly balanced it is. When we see Thanos again in Endgame, the knife has grown into a giant double-bladed sword. This symbolizes the passage of time.",https://www.reddit.com/r/shittymoviedetails/comments/bmtbi5/in_infinity_war_thanos_uses_a_small_doublebladed/,19500,260,r/shittymoviedetails
TrAsH PaNdA rElEnRlEsSlY aTtAcKiNg InNoCeNt MaN,https://www.reddit.com/r/PeopleFuckingDying/comments/bmxvb5/trash_panda_relenrlessly_attacking_innocent_man/,19500,133,r/PeopleFuckingDying
Interesting marketing techniques,https://www.reddit.com/r/dankmemes/comments/bn2knf/interesting_marketing_techniques/,19400,198,r/dankmemes
New cough emoji looks great,https://www.reddit.com/r/dankmemes/comments/bn0ds1/new_cough_emoji_looks_great/,19400,81,r/dankmemes
Gromit me old chum,https://www.reddit.com/r/dankmemes/comments/bmu2xq/gromit_me_old_chum/,19300,128,r/dankmemes
Veterans remember,https://www.reddit.com/r/dankmemes/comments/bmwlwa/veterans_remember/,19200,146,r/dankmemes
Motivation for the writers of this sub,https://www.reddit.com/r/freefolk/comments/bmz8b5/motivation_for_the_writers_of_this_sub/,19200,326,r/freefolk
Keep getting one up-ed like,https://www.reddit.com/r/Tinder/comments/bmtbwo/keep_getting_one_uped_like/,19100,63,r/Tinder
Me🍝Irl,https://www.reddit.com/r/meirl/comments/bn1vmh/meirl/,19100,47,r/meirl
Thanks,https://www.reddit.com/r/gatekeeping/comments/bn5a2t/thanks/,19100,704,r/gatekeeping
Happens to all of us,https://www.reddit.com/r/teenagers/comments/bmwvqf/happens_to_all_of_us/,19000,186,r/teenagers
"I know, I know",https://www.reddit.com/r/dankmemes/comments/bn1jfw/i_know_i_know/,18900,209,r/dankmemes
TIFU by accidentally having sex with my cousin at a family wedding,https://www.reddit.com/r/tifu/comments/bn5e7z/tifu_by_accidentally_having_sex_with_my_cousin_at/,19000,2200,r/tifu
"Perfectly Equal, As All Things Should Be",https://www.reddit.com/r/dankmemes/comments/bmyqxn/perfectly_equal_as_all_things_should_be/,18900,123,r/dankmemes
SWEET,https://www.reddit.com/r/dankmemes/comments/bmuaxe/sweet/,18800,117,r/dankmemes
Censorship is a joke,https://www.reddit.com/r/BikiniBottomTwitter/comments/bn0oav/censorship_is_a_joke/,18800,106,r/BikiniBottomTwitter
life is like a box of chocolates,https://www.reddit.com/r/yesyesyesyesno/comments/bmuo64/life_is_like_a_box_of_chocolates/,18800,187,r/yesyesyesyesno
"Mental health advocate wants to reach out to Asian Americans, has offensive subheading attributed to her instead. (Subheading taken down after five days and going viral on social media.)",https://www.reddit.com/r/quityourbullshit/comments/bn5fbg/mental_health_advocate_wants_to_reach_out_to/,18700,352,r/quityourbullshit
"After three years, I've finally finished my own custom astromech droid!",https://www.reddit.com/r/StarWars/comments/bmxv4f/after_three_years_ive_finally_finished_my_own/,18700,508,r/StarWars
What a unit,https://www.reddit.com/r/AbsoluteUnits/comments/bmvlv3/what_a_unit/,18500,101,r/AbsoluteUnits
On my friends timeline,https://www.reddit.com/r/vaxxhappened/comments/bmumb4/on_my_friends_timeline/,18400,326,r/vaxxhappened
I still win,https://www.reddit.com/r/pcmasterrace/comments/bmyo22/i_still_win/,18300,320,r/pcmasterrace
Still not as useless as Black widow or Hawk-eye,https://www.reddit.com/r/memes/comments/bn1r9l/still_not_as_useless_as_black_widow_or_hawkeye/,18200,119,r/memes
MyPillow Lays Off 150 Workers Months After CEO Credited Trump Tax Cuts for Economic Boom,https://www.reddit.com/r/politics/comments/bn1kkn/mypillow_lays_off_150_workers_months_after_ceo/,18200,1600,r/politics
Low impact parkour,https://www.reddit.com/r/whitepeoplegifs/comments/bmzmlx/low_impact_parkour/,18100,135,r/whitepeoplegifs
Can programmers solve a light bulb error?,https://www.reddit.com/r/ProgrammerHumor/comments/bmtwxi/can_programmers_solve_a_light_bulb_error/,18100,222,r/ProgrammerHumor
Real nugget biscuit hours,https://www.reddit.com/r/youngpeopleyoutube/comments/bn4fph/real_nugget_biscuit_hours/,18100,144,r/youngpeopleyoutube
Ahoy!!!,https://www.reddit.com/r/funny/comments/bmyv68/ahoy/,17900,204,r/funny
"Our cat, after we got her from a shelter.",https://www.reddit.com/r/aww/comments/bmx8qt/our_cat_after_we_got_her_from_a_shelter/,17800,254,r/aww
REVOLUTION!!!,https://www.reddit.com/r/HistoryMemes/comments/bmx8j8/revolution/,17700,156,r/HistoryMemes
Just having a smoke,https://www.reddit.com/r/blackmagicfuckery/comments/bn548w/just_having_a_smoke/,17700,334,r/blackmagicfuckery
Shalom,https://www.reddit.com/r/dankmemes/comments/bmvl3f/shalom/,17600,85,r/dankmemes
S H R E K,https://www.reddit.com/r/dankmemes/comments/bmzj84/s_h_r_e_k/,17500,85,r/dankmemes
Theodore the hamster climbing up stairs,https://www.reddit.com/r/aww/comments/bn04y1/theodore_the_hamster_climbing_up_stairs/,17300,159,r/aww
jAbLiNsKi,https://www.reddit.com/r/dankmemes/comments/bmuerk/jablinski/,17300,57,r/dankmemes
"I hate craigslist. This guy has been bothering me all day, never posting my number again",https://www.reddit.com/r/ChoosingBeggars/comments/bmss8p/i_hate_craigslist_this_guy_has_been_bothering_me/,17300,499,r/ChoosingBeggars
Wow that definitely wasn't the joke,https://www.reddit.com/r/woooosh/comments/bn3n90/wow_that_definitely_wasnt_the_joke/,17100,152,r/woooosh
