Title,Title Link,Score,Num Comments,Subreddit
What Jonesy saw when he came out of the bunker on console,https://www.reddit.com/r/FortNiteBR/comments/bnokjz/what_jonesy_saw_when_he_came_out_of_the_bunker_on/,21500,599,r/FortNiteBR
I love Don Cheadle,https://www.reddit.com/r/dankmemes/comments/bnpabe/i_love_don_cheadle/,21400,623,r/dankmemes
This foe is beyond any of you.,https://www.reddit.com/r/lotrmemes/comments/bno8ip/this_foe_is_beyond_any_of_you/,21400,107,r/lotrmemes
Honestly same :(,https://www.reddit.com/r/suicidebywords/comments/bnnl9n/honestly_same/,21300,134,r/suicidebywords
My friend taught himself to beatbox and play the flute. You might want to unmute this one.,https://www.reddit.com/r/toptalent/comments/bnvf0m/my_friend_taught_himself_to_beatbox_and_play_the/,21100,621,r/toptalent
Just change band for OC,https://www.reddit.com/r/notliketheothergirls/comments/bnuf22/just_change_band_for_oc/,22000,295,r/notliketheothergirls
A high schooler asked to use my song for his Animation Final Project. Wasn't prepared for how good it was going to be,https://www.reddit.com/r/videos/comments/bnvqkf/a_high_schooler_asked_to_use_my_song_for_his/,20700,1200,r/videos
A war worth fighting,https://www.reddit.com/r/dankmemes/comments/bnmxs8/a_war_worth_fighting/,20700,72,r/dankmemes
"The Andes, Peru",https://www.reddit.com/r/BeAmazed/comments/bnufpv/the_andes_peru/,20600,106,r/BeAmazed
damn Felix,https://www.reddit.com/r/PewdiepieSubmissions/comments/bno424/damn_felix/,20600,167,r/PewdiepieSubmissions
Helping your friend when they get too high,https://www.reddit.com/r/coolguides/comments/bnot1g/helping_your_friend_when_they_get_too_high/,20600,588,r/coolguides
The NINE-NINE is back for season 7!,https://www.reddit.com/r/brooklynninenine/comments/bnso3l/the_ninenine_is_back_for_season_7/,20500,344,r/brooklynninenine
Betrayal,https://www.reddit.com/r/PrequelMemes/comments/bnnmax/betrayal/,20400,236,r/PrequelMemes
It took 20 mins to make this meme,https://www.reddit.com/r/memes/comments/bnp9qv/it_took_20_mins_to_make_this_meme/,20200,124,r/memes
Why You In My Tub?,https://www.reddit.com/r/AnimalsBeingDerps/comments/bnkgsx/why_you_in_my_tub/,20200,234,r/AnimalsBeingDerps
Finally got a kill with the Mozambique,https://www.reddit.com/r/apexlegends/comments/bnjc7g/finally_got_a_kill_with_the_mozambique/,19900,399,r/apexlegends
"Newly Discovered Bat-Like Dinosaur Reveals the Intricacies of Prehistoric Flight. Though Ambopteryx longibrachium was likely a glider, the fossil is helping scientists discover how dinosaurs first took to the skies.",https://www.reddit.com/r/science/comments/bntihx/newly_discovered_batlike_dinosaur_reveals_the/,19500,294,r/science
She's really trying,https://www.reddit.com/r/bonehurtingjuice/comments/bnmwx6/shes_really_trying/,19500,204,r/bonehurtingjuice
Sponsorship handling can really make or break content more than I'd like to admit.,https://www.reddit.com/r/BikiniBottomTwitter/comments/bnnw0y/sponsorship_handling_can_really_make_or_break/,19400,225,r/BikiniBottomTwitter
*Stabeds you*,https://www.reddit.com/r/creepyasterisks/comments/bnueqs/stabeds_you/,20300,321,r/creepyasterisks
"The Awe Of Motherhood, Tiana Maros, Digital, 2018",https://www.reddit.com/r/Art/comments/bnutu1/the_awe_of_motherhood_tiana_maros_digital_2018/,19300,213,r/Art
"Officer I swear I'm not drunk, that sign really did come out of nowhere! [Days Gone]",https://www.reddit.com/r/gaming/comments/bnqvk4/officer_i_swear_im_not_drunk_that_sign_really_did/,19200,455,r/gaming
A Soldier of 3 Armies,https://www.reddit.com/r/HistoryMemes/comments/bnpuwa/a_soldier_of_3_armies/,19100,374,r/HistoryMemes
Nike heels,https://www.reddit.com/r/ATBGE/comments/bnpqp0/nike_heels/,19000,146,r/ATBGE
The power of make-up,https://www.reddit.com/r/Instagramreality/comments/bnqe0q/the_power_of_makeup/,19100,529,r/Instagramreality
Happy boi,https://www.reddit.com/r/Eyebleach/comments/bnjku3/happy_boi/,18900,87,r/Eyebleach
Ex-Racists of reddit what event or events changed you?,https://www.reddit.com/r/AskReddit/comments/bnqk9j/exracists_of_reddit_what_event_or_events_changed/,18800,4300,r/AskReddit
"Why a lot of people thought the new Facebook logo was off-set to the left, because originally it was off-set to the right and out brain is unfamiliar with the change. Also the new blue sucks.",https://www.reddit.com/r/mildlyinfuriating/comments/bnnq5g/why_a_lot_of_people_thought_the_new_facebook_logo/,18600,648,r/mildlyinfuriating
"""Try that again. I dare you.""",https://www.reddit.com/r/pokemon/comments/bntth4/try_that_again_i_dare_you/,18500,391,r/pokemon
We have found a true intellectual,https://www.reddit.com/r/memes/comments/bnnz3a/we_have_found_a_true_intellectual/,18500,103,r/memes
"""Do you see now Jon?""",https://www.reddit.com/r/imsorryjon/comments/bnotlp/do_you_see_now_jon/,18400,143,r/imsorryjon
Elon's Musk,https://www.reddit.com/r/dankmemes/comments/bnp9ne/elons_musk/,18400,136,r/dankmemes
Banjos sound like a guitar with a southern accent,https://www.reddit.com/r/Showerthoughts/comments/bnt62n/banjos_sound_like_a_guitar_with_a_southern_accent/,18400,179,r/Showerthoughts
Brigitte vs. Dragonstrike,https://www.reddit.com/r/Overwatch/comments/bnoc04/brigitte_vs_dragonstrike/,18300,384,r/Overwatch
MRW I try the new Snapchat filter that turns you into a girl,https://www.reddit.com/r/reactiongifs/comments/bnk5wu/mrw_i_try_the_new_snapchat_filter_that_turns_you/,18200,363,r/reactiongifs
No matter what the Fook happens in tonight's episode. I just wanna say thank you Lena Headey for giving us the character of Cersei.,https://www.reddit.com/r/freefolk/comments/bnspx0/no_matter_what_the_fook_happens_in_tonights/,18200,334,r/freefolk
It's been nearly a whole month and it seems pewds hasn't noticed sammy so let's get him to see this,https://www.reddit.com/r/PewdiepieSubmissions/comments/bnois0/its_been_nearly_a_whole_month_and_it_seems_pewds/,18200,149,r/PewdiepieSubmissions
The way the windblown snow hit these trees makes them look like they were illustrated...,https://www.reddit.com/r/interestingasfuck/comments/bnq7z5/the_way_the_windblown_snow_hit_these_trees_makes/,18200,107,r/interestingasfuck
"When the show breaks your heart, but you still watch it anyways.",https://www.reddit.com/r/freefolk/comments/bnpcoz/when_the_show_breaks_your_heart_but_you_still/,18100,207,r/freefolk
He is living the dream,https://www.reddit.com/r/aww/comments/bntrd5/he_is_living_the_dream/,18000,172,r/aww
The little tricks we do in Css,https://www.reddit.com/r/ProgrammerHumor/comments/bnudu1/the_little_tricks_we_do_in_css/,18000,149,r/ProgrammerHumor
Pretty much,https://www.reddit.com/r/PewdiepieSubmissions/comments/bnpjcc/pretty_much/,18000,188,r/PewdiepieSubmissions
What did I just do,https://www.reddit.com/r/GlobalOffensive/comments/bnnujc/what_did_i_just_do/,18200,281,r/GlobalOffensive
The times were so simple...,https://www.reddit.com/r/memes/comments/bnk3xe/the_times_were_so_simple/,17900,125,r/memes
"There’s nothing wrong with wanting to live a quiet, mediocre life.",https://www.reddit.com/r/unpopularopinion/comments/bnq50r/theres_nothing_wrong_with_wanting_to_live_a_quiet/,17700,863,r/unpopularopinion
Got it right,https://www.reddit.com/r/dankmemes/comments/bnob9g/got_it_right/,17700,57,r/dankmemes
That part didn’t age well,https://www.reddit.com/r/HistoryMemes/comments/bnr1cy/that_part_didnt_age_well/,17700,199,r/HistoryMemes
I used Marzia’s old photo for painting practice :),https://www.reddit.com/r/PewdiepieSubmissions/comments/bnkneu/i_used_marzias_old_photo_for_painting_practice/,17700,92,r/PewdiepieSubmissions
I made this a year ago and i completely forgot about it..pewds never saw it so here goes nothing,https://www.reddit.com/r/PewdiepieSubmissions/comments/bnnck5/i_made_this_a_year_ago_and_i_completely_forgot/,17600,134,r/PewdiepieSubmissions
Straight men: exist,https://www.reddit.com/r/teenagers/comments/bnria6/straight_men_exist/,17600,364,r/teenagers
"In “ The Godfather” Michael’s soon-to-be wife stumbles. This moment refers to the Mario Puzo’s book. She did that intentionally, since she’s good at climbing and walking on such surfaces, she simply wanted him to touch her before marriage.",https://www.reddit.com/r/MovieDetails/comments/bntti7/in_the_godfather_michaels_soontobe_wife_stumbles/,17600,187,r/MovieDetails
The most good boi,https://www.reddit.com/r/nextfuckinglevel/comments/bnq537/the_most_good_boi/,17500,280,r/nextfuckinglevel
A match made in heaven,https://www.reddit.com/r/PewdiepieSubmissions/comments/bnugr9/a_match_made_in_heaven/,17500,127,r/PewdiepieSubmissions
me_irl,https://www.reddit.com/r/me_irl/comments/bnolgd/me_irl/,17300,203,r/me_irl
Some turkey knocked on my back door early this morning. Caught it on the security camera. Good thing the dog scared them away.,https://www.reddit.com/r/funny/comments/bntw07/some_turkey_knocked_on_my_back_door_early_this/,17000,381,r/funny
gotta get them 8 hours,https://www.reddit.com/r/wholesomememes/comments/bnks3z/gotta_get_them_8_hours/,17000,493,r/wholesomememes
Master piss,https://www.reddit.com/r/BoneAppleTea/comments/bnrp9s/master_piss/,17000,138,r/BoneAppleTea
George Carlin had alot of things such as this in his work.,https://www.reddit.com/r/BrandNewSentence/comments/bnq6ir/george_carlin_had_alot_of_things_such_as_this_in/,16900,173,r/BrandNewSentence
Reality TV show contestant leaving starter pack,https://www.reddit.com/r/starterpacks/comments/bnnr37/reality_tv_show_contestant_leaving_starter_pack/,16900,98,r/starterpacks
Me irl,https://www.reddit.com/r/me_irl/comments/bnjp5s/me_irl/,16800,79,r/me_irl
The real hero,https://www.reddit.com/r/marvelmemes/comments/bnstvj/the_real_hero/,16700,166,r/marvelmemes
Fight me! You f*king coward fi-- o f*ck f*ck nvm run,https://www.reddit.com/r/funny/comments/bnmk20/fight_me_you_fking_coward_fi_o_fck_fck_nvm_run/,16700,276,r/funny
"Misty, spring morning in Bridport, UK",https://www.reddit.com/r/CozyPlaces/comments/bnp3ak/misty_spring_morning_in_bridport_uk/,16600,157,r/CozyPlaces
give my boy some credit!,https://www.reddit.com/r/marvelmemes/comments/bnnjj2/give_my_boy_some_credit/,16600,327,r/marvelmemes
Happy mother's day!,https://www.reddit.com/r/pcmasterrace/comments/bnmaen/happy_mothers_day/,16500,93,r/pcmasterrace
as much as this season hurts.. the memes have me dying,https://www.reddit.com/r/freefolk/comments/bnt9dn/as_much_as_this_season_hurts_the_memes_have_me/,16400,102,r/freefolk
Call the Republicans' bluff. Impeach Trump,https://www.reddit.com/r/politics/comments/bnohc3/call_the_republicans_bluff_impeach_trump/,16400,1100,r/politics
Who else does is annoyed by this?,https://www.reddit.com/r/dankmemes/comments/bnorx5/who_else_does_is_annoyed_by_this/,16400,319,r/dankmemes
Snap these Loans Away!,https://www.reddit.com/r/FunnyandSad/comments/bno199/snap_these_loans_away/,16400,241,r/FunnyandSad
Why does everyone think reddit is so bad,https://www.reddit.com/r/memes/comments/bno9s3/why_does_everyone_think_reddit_is_so_bad/,16300,108,r/memes
😍😍😍😍😍😍,https://www.reddit.com/r/perfectlycutscreams/comments/bnnbc2/_/,16200,404,r/perfectlycutscreams
In Avengers: Endgame (2019) we see a flashback to Falcon and Hawkeyes military service. This a subtle nod to the fact that I watched the Hurt Locker instead,https://www.reddit.com/r/shittymoviedetails/comments/bnspzy/in_avengers_endgame_2019_we_see_a_flashback_to/,16200,105,r/shittymoviedetails
My friend sent this to another friend today,https://www.reddit.com/r/rareinsults/comments/bno06d/my_friend_sent_this_to_another_friend_today/,16100,121,r/rareinsults
Oof ouch my scythe,https://www.reddit.com/r/bonehurtingjuice/comments/bntdbr/oof_ouch_my_scythe/,16100,66,r/bonehurtingjuice
