Title,Title Link,Score,Num Comments,Subreddit
"I painted my fanblades red blue and yellow, and when you take a picture it creates more colors",https://www.reddit.com/r/mildlyinteresting/comments/bv6cjz/i_painted_my_fanblades_red_blue_and_yellow_and/,22200,414,r/mildlyinteresting
Oh,https://www.reddit.com/r/thanosdidnothingwrong/comments/bv96h2/oh/,22000,200,r/thanosdidnothingwrong
When you are savage af.,https://www.reddit.com/r/nextfuckinglevel/comments/bv6oli/when_you_are_savage_af/,22000,720,r/nextfuckinglevel
Colorado Governor Signs Gay Conversion Therapy Ban,https://www.reddit.com/r/news/comments/bvczmx/colorado_governor_signs_gay_conversion_therapy_ban/,21900,732,r/news
"🔥 Yesterday's tornado in Concepcion, Chile",https://www.reddit.com/r/NatureIsFuckingLit/comments/bvdqf3/yesterdays_tornado_in_concepcion_chile/,21900,761,r/NatureIsFuckingLit
Front page BBC news! Proud moment,https://www.reddit.com/r/freefolk/comments/bv8f02/front_page_bbc_news_proud_moment/,21900,430,r/freefolk
They're gatekeeping dog breeds for seniors.,https://www.reddit.com/r/gatekeeping/comments/bv65yd/theyre_gatekeeping_dog_breeds_for_seniors/,21800,399,r/gatekeeping
Big brain move.,https://www.reddit.com/r/dankmemes/comments/bvcp4s/big_brain_move/,21800,131,r/dankmemes
My arm from laying on cables,https://www.reddit.com/r/mildlyinteresting/comments/bv61zz/my_arm_from_laying_on_cables/,21700,581,r/mildlyinteresting
Live Die Repeat,https://www.reddit.com/r/funny/comments/bv17yl/live_die_repeat/,21700,155,r/funny
SLPT: How to download a YouTube video.,https://www.reddit.com/r/ShittyLifeProTips/comments/bv3igq/slpt_how_to_download_a_youtube_video/,21600,133,r/ShittyLifeProTips
Tony,https://www.reddit.com/r/comics/comments/bv6eeo/tony/,21400,82,r/comics
Very patient doberman,https://www.reddit.com/r/aww/comments/bv84qc/very_patient_doberman/,21400,166,r/aww
Why wearing pants when you have... this?,https://www.reddit.com/r/ATBGE/comments/bv7ia0/why_wearing_pants_when_you_have_this/,21300,481,r/ATBGE
President Donald Trump's poor mental health is grounds for impeachment,https://www.reddit.com/r/politics/comments/bv58z1/president_donald_trumps_poor_mental_health_is/,21000,2100,r/politics
I neeeed it,https://www.reddit.com/r/dankmemes/comments/bvb84b/i_neeeed_it/,21000,121,r/dankmemes
"Dumpster diving for food is considered theft in Germany, even if others have thrown the food away. The city of Hamburg wants Germany to decriminalize the act and prohibit supermarkets from throwing out food",https://www.reddit.com/r/worldnews/comments/bvdxm5/dumpster_diving_for_food_is_considered_theft_in/,21000,846,r/worldnews
“Disastrous”: Dow Sinks as Markets Realize Trump Really Is This Stupid,https://www.reddit.com/r/politics/comments/bvej1x/disastrous_dow_sinks_as_markets_realize_trump/,21000,2200,r/politics
It isn’t adding up,https://www.reddit.com/r/PewdiepieSubmissions/comments/bv2q2v/it_isnt_adding_up/,20900,63,r/PewdiepieSubmissions
"My friends and I started this game as students 2 years ago, we've come so far!",https://www.reddit.com/r/gaming/comments/bv99fg/my_friends_and_i_started_this_game_as_students_2/,20900,524,r/gaming
"Caught this little guy sneaking up on me, he looks floating",https://www.reddit.com/r/pics/comments/bve1y9/caught_this_little_guy_sneaking_up_on_me_he_looks/,20900,230,r/pics
His name is Merlin.,https://www.reddit.com/r/aww/comments/bvbs3i/his_name_is_merlin/,20800,349,r/aww
Maybe Maybe Maybe,https://www.reddit.com/r/maybemaybemaybe/comments/bv9pmg/maybe_maybe_maybe/,20700,180,r/maybemaybemaybe
she’s NOT like the other girls,https://www.reddit.com/r/notliketheothergirls/comments/bvajyv/shes_not_like_the_other_girls/,21600,187,r/notliketheothergirls
His mustache is upside down 😂,https://www.reddit.com/r/facepalm/comments/bvcow3/his_mustache_is_upside_down/,20500,416,r/facepalm
"[NO SPOILERS] Let’s band together as a community once again for a great cause, and show Kit that his dedication had meaning and changed lives. We came together for Emilia now let’s stand behind Kit in solidarity.✊🏻",https://www.reddit.com/r/gameofthrones/comments/bv3d7j/no_spoilers_lets_band_together_as_a_community/,20400,1500,r/gameofthrones
I didn't spend 7 minutes in photoshop for this not to get to the front page,https://www.reddit.com/r/PewdiepieSubmissions/comments/bv9miw/i_didnt_spend_7_minutes_in_photoshop_for_this_not/,20300,98,r/PewdiepieSubmissions
[OC] Top 10 Most Valuable Companies In The World (1997-2019),https://www.reddit.com/r/dataisbeautiful/comments/bv8d3k/oc_top_10_most_valuable_companies_in_the_world/,20100,1200,r/dataisbeautiful
Paul Rudd doing Paul Rudd stuff,https://www.reddit.com/r/marvelstudios/comments/bv69fj/paul_rudd_doing_paul_rudd_stuff/,20100,221,r/marvelstudios
I like trains,https://www.reddit.com/r/dankmemes/comments/bvcwfw/i_like_trains/,20100,109,r/dankmemes
Me_irl,https://www.reddit.com/r/me_irl/comments/bv5f1z/me_irl/,20100,359,r/me_irl
My kinda people,https://www.reddit.com/r/TikTokCringe/comments/bv9cx5/my_kinda_people/,20100,163,r/TikTokCringe
"TIL That the man tho says ""Bye, Have a Beautiful Time"" at the end of American Dad episodes was the former security officer at the office building where Family Guy and American Dad! were produced.",https://www.reddit.com/r/todayilearned/comments/bvaopn/til_that_the_man_tho_says_bye_have_a_beautiful/,19900,463,r/todayilearned
New Balance Drops Kawhi Billboard in Oakland,https://www.reddit.com/r/nba/comments/bv8d1h/new_balance_drops_kawhi_billboard_in_oakland/,19900,1500,r/nba
Huzzah! A man of quality!,https://www.reddit.com/r/dankmemes/comments/bv4qzp/huzzah_a_man_of_quality/,19800,162,r/dankmemes
TIFU (UPDATE) by letting my manager know I had sex with her daughter and that I took a pic of her too,https://www.reddit.com/r/tifu/comments/bv2wgu/tifu_update_by_letting_my_manager_know_i_had_sex/,19800,1200,r/tifu
i want to dead,https://www.reddit.com/r/dankmemes/comments/bvdduk/i_want_to_dead/,19500,83,r/dankmemes
What is your name?,https://www.reddit.com/r/comedyheaven/comments/bv7l9b/what_is_your_name/,19200,542,r/comedyheaven
Transcript released of Flynn voicemail from Trump lawyer showing possible attempt to obstruct,https://www.reddit.com/r/politics/comments/bvcjvj/transcript_released_of_flynn_voicemail_from_trump/,19100,1100,r/politics
"In fallout 4 (2015) there is a random encounter at level 20 causing an alien crash, this is a nod to the fact that I'm on the completely wrong subreddit.",https://www.reddit.com/r/shittymoviedetails/comments/bv8jhe/in_fallout_4_2015_there_is_a_random_encounter_at/,19000,101,r/shittymoviedetails
He ate 6 Jehovah Whiteness,https://www.reddit.com/r/BoneAppleTea/comments/bv8aa0/he_ate_6_jehovah_whiteness/,18600,389,r/BoneAppleTea
The front one. His eyes. His smile.,https://www.reddit.com/r/dankmemes/comments/bv4lj0/the_front_one_his_eyes_his_smile/,18300,177,r/dankmemes
A photo I took of a pretty rare(for me) valley carpenter bee,https://www.reddit.com/r/mildlyinteresting/comments/bv86ey/a_photo_i_took_of_a_pretty_rarefor_me_valley/,18300,227,r/mildlyinteresting
Rip Graham,https://www.reddit.com/r/Tinder/comments/bv6ybt/rip_graham/,18200,208,r/Tinder
r/freefolk to Kit Harington right now.,https://www.reddit.com/r/freefolk/comments/bv8nck/rfreefolk_to_kit_harington_right_now/,18200,211,r/freefolk
How bloody wholesome,https://www.reddit.com/r/oldpeoplefacebook/comments/bv5zdt/how_bloody_wholesome/,18300,375,r/oldpeoplefacebook
We've all been there [OC],https://www.reddit.com/r/DnD/comments/bv3fvp/weve_all_been_there_oc/,18100,385,r/DnD
Bye Kowalski,https://www.reddit.com/r/dankmemes/comments/bvc0vk/bye_kowalski/,17900,99,r/dankmemes
True story :(,https://www.reddit.com/r/dankmemes/comments/bvddbp/true_story/,17900,241,r/dankmemes
"""You're a funny little boy"" - Padme Amidala, to her future husband",https://www.reddit.com/r/PrequelMemes/comments/bv9rnm/youre_a_funny_little_boy_padme_amidala_to_her/,17900,112,r/PrequelMemes
"A fawn I saw ""hiding"" in plain sight. He thinks he's totally invisible.",https://www.reddit.com/r/aww/comments/bv8a1x/a_fawn_i_saw_hiding_in_plain_sight_he_thinks_hes/,17800,188,r/aww
You can’t tell me what to do.,https://www.reddit.com/r/PewdiepieSubmissions/comments/bv5alt/you_cant_tell_me_what_to_do/,17800,132,r/PewdiepieSubmissions
This Unit heading home,https://www.reddit.com/r/AbsoluteUnits/comments/bv5e72/this_unit_heading_home/,17800,172,r/AbsoluteUnits
"Our Captain America, everyone",https://www.reddit.com/r/marvelstudios/comments/bv24wi/our_captain_america_everyone/,17800,284,r/marvelstudios
"When whispers start running round that Kit thinks it’s him and his performance that we’re disappointed in, and not the writing.",https://www.reddit.com/r/freefolk/comments/bv4ykg/when_whispers_start_running_round_that_kit_thinks/,17700,322,r/freefolk
Sweet home Alabama...,https://www.reddit.com/r/dankmemes/comments/bv688g/sweet_home_alabama/,17700,77,r/dankmemes
r/ihadastronke,https://www.reddit.com/r/ihadastroke/comments/bv65o0/rihadastronke/,17700,156,r/ihadastroke
me_irl,https://www.reddit.com/r/me_irl/comments/bv7v52/me_irl/,17600,200,r/me_irl
Satisfying armour stands,https://www.reddit.com/r/Minecraft/comments/bv6wlv/satisfying_armour_stands/,17600,210,r/Minecraft
hmmm,https://www.reddit.com/r/hmmm/comments/bv4jec/hmmm/,17600,201,r/hmmm
How to workout like and Instagram model.,https://www.reddit.com/r/videos/comments/bv6zrr/how_to_workout_like_and_instagram_model/,17500,1500,r/videos
Rather than teaming up with r/freefolk,https://www.reddit.com/r/freefolk/comments/bv0xwz/rather_than_teaming_up_with_rfreefolk/,17500,211,r/freefolk
Terraria is now officially the second game in Steam history to surpass 200k Overwhelmingly Positive reviews!,https://www.reddit.com/r/Terraria/comments/bvdhoq/terraria_is_now_officially_the_second_game_in/,17800,452,r/Terraria
Jake was the best boy,https://www.reddit.com/r/dankmemes/comments/bv79zs/jake_was_the_best_boy/,17300,683,r/dankmemes
you gotta be careful out here boys,https://www.reddit.com/r/Tinder/comments/bv2d01/you_gotta_be_careful_out_here_boys/,17300,311,r/Tinder
"When you die, the last part of your body to stop working are your pupils.",https://www.reddit.com/r/Jokes/comments/bvc9gl/when_you_die_the_last_part_of_your_body_to_stop/,17200,247,r/Jokes
A happy man,https://www.reddit.com/r/PewdiepieSubmissions/comments/bv68fp/a_happy_man/,17200,116,r/PewdiepieSubmissions
"I'll put em back, pls dont call mom",https://www.reddit.com/r/dankmemes/comments/bv8qg8/ill_put_em_back_pls_dont_call_mom/,17100,74,r/dankmemes
"That’s my stop. (Tram n°3, Rome)",https://www.reddit.com/r/softwaregore/comments/bvb1sy/thats_my_stop_tram_n3_rome/,17100,441,r/softwaregore
Yeetus that Feetus,https://www.reddit.com/r/dankmemes/comments/bv6c5n/yeetus_that_feetus/,17000,80,r/dankmemes
"Doctor Deflator, Master of Style.",https://www.reddit.com/r/Bossfight/comments/bvdrpr/doctor_deflator_master_of_style/,17000,297,r/Bossfight
"'Chernobyl 3828' - Actual Footage From the Accident, Used to Create the HBO Mini-Series 'Chernobyl'",https://www.reddit.com/r/videos/comments/bv1x4e/chernobyl_3828_actual_footage_from_the_accident/,16900,1400,r/videos
A sign of the times,https://www.reddit.com/r/FunnyandSad/comments/bv9fyp/a_sign_of_the_times/,16900,114,r/FunnyandSad
‘Unapologetically’ Christian pizza parlor went viral — then its owner got busted for trying to have sex with underage staff,https://www.reddit.com/r/atheism/comments/bvb03v/unapologetically_christian_pizza_parlor_went/,16900,846,r/atheism
"3,6 not great but not terrible",https://www.reddit.com/r/dankmemes/comments/bv72uf/36_not_great_but_not_terrible/,16700,140,r/dankmemes
If Indiana Jones worked at a warehouse..,https://www.reddit.com/r/nextfuckinglevel/comments/bvd1t0/if_indiana_jones_worked_at_a_warehouse/,16700,136,r/nextfuckinglevel
Happy boi gets licks,https://www.reddit.com/r/aww/comments/bv586x/happy_boi_gets_licks/,16700,132,r/aww
This is no place to die.,https://www.reddit.com/r/PewdiepieSubmissions/comments/bvalz9/this_is_no_place_to_die/,16600,126,r/PewdiepieSubmissions
Double whammy,https://www.reddit.com/r/comedyhomicide/comments/bve34w/double_whammy/,16600,172,r/comedyhomicide
Beer is good. Fortnite is gay,https://www.reddit.com/r/dankmemes/comments/bv6ny2/beer_is_good_fortnite_is_gay/,16600,98,r/dankmemes
"PSA: Just a friendly reminder to not purchase any games until E3. If history is anything to go by, there’ll be sales on several games.",https://www.reddit.com/r/NintendoSwitch/comments/bv7qab/psa_just_a_friendly_reminder_to_not_purchase_any/,16500,941,r/NintendoSwitch
Season 1 at Season 8 Speed,https://www.reddit.com/r/freefolk/comments/bvd2j1/season_1_at_season_8_speed/,16400,244,r/freefolk
One hell of a loot box,https://www.reddit.com/r/apexlegends/comments/bvd6f1/one_hell_of_a_loot_box/,16400,263,r/apexlegends
me irl,https://www.reddit.com/r/me_irl/comments/bvc2dw/me_irl/,16200,173,r/me_irl
An F-22 Raptor pulling so many Gs the low pressure air over the fuselage gets cold enough for the water to condense. The angle is just right for sunlight to make rainbow colors around the jet,https://www.reddit.com/r/woahdude/comments/bv7ptc/an_f22_raptor_pulling_so_many_gs_the_low_pressure/,16200,232,r/woahdude
Alexandria Ocasio-Cortez Just Gave a Passionate Speech About Why Housing is a Human Right | “Our access and our guarantee to having a home comes before someone else’s privilege to earn a profit.”,https://www.reddit.com/r/politics/comments/bv1on0/alexandria_ocasiocortez_just_gave_a_passionate/,16200,2900,r/politics
Russia Deployed Its Trolls to Cover Up the Murder of 298 People on MH17,https://www.reddit.com/r/technology/comments/bv75vt/russia_deployed_its_trolls_to_cover_up_the_murder/,16100,490,r/technology
