Title,Title Link,Score,Num Comments,Subreddit
Hal & Lois reunited tonight,https://www.reddit.com/r/pics/comments/bn7lys/hal_lois_reunited_tonight/,110000,2400,r/pics
"We got a new kitten, but I think our cat got a new kitten.",https://www.reddit.com/r/aww/comments/bneknt/we_got_a_new_kitten_but_i_think_our_cat_got_a_new/,100000,669,r/aww
Cat rolls in edible glitter instantly becomes beautiful galaxy,https://www.reddit.com/r/aww/comments/bnc4i5/cat_rolls_in_edible_glitter_instantly_becomes/,95200,999,r/aww
"If you could eliminate a race within the year, which would it be, and why?",https://www.reddit.com/r/formula1/comments/bnaceq/if_you_could_eliminate_a_race_within_the_year/,98600,6300,r/formula1
I hate titles,https://www.reddit.com/r/dankmemes/comments/bnf7dp/i_hate_titles/,90600,3100,r/dankmemes
It's all ned's fault,https://www.reddit.com/r/funny/comments/bnce4o/its_all_neds_fault/,90400,2200,r/funny
The most good boi,https://www.reddit.com/r/rarepuppers/comments/bnfjai/the_most_good_boi/,89100,1600,r/rarepuppers
only reddit mobile users can understand this meme,https://www.reddit.com/r/dankmemes/comments/bni6bu/only_reddit_mobile_users_can_understand_this_meme/,79700,676,r/dankmemes
TIFU by asking Reddit which ethnic group to exterminate,https://www.reddit.com/r/tifu/comments/bndou6/tifu_by_asking_reddit_which_ethnic_group_to/,80400,3100,r/tifu
U.S. does not join plastic waste agreement signed by 187 countries,https://www.reddit.com/r/worldnews/comments/bnfjzw/us_does_not_join_plastic_waste_agreement_signed/,76800,5900,r/worldnews
Cruising between layers,https://www.reddit.com/r/oddlysatisfying/comments/bnh8oy/cruising_between_layers/,67200,466,r/oddlysatisfying
This church built into the side of a mountain in Italy,https://www.reddit.com/r/pics/comments/bnb3xu/this_church_built_into_the_side_of_a_mountain_in/,67000,1000,r/pics
A one way TV that you can see through from the back.,https://www.reddit.com/r/blackmagicfuckery/comments/bnbug5/a_one_way_tv_that_you_can_see_through_from_the/,61300,897,r/blackmagicfuckery
"Been traveling through the 50 states with my best friend who passed away from brain cancer. Today I visited my 43rd state, Rhode Island, to see him.",https://www.reddit.com/r/pics/comments/bn5xjk/been_traveling_through_the_50_states_with_my_best/,60600,1200,r/pics
"Kids at Disneyland surprised by Spider-Man who reveals himself to be Tom Holland. Also ft. Zendaya, Gyllenhaal, and Batalon",https://www.reddit.com/r/marvelstudios/comments/bng656/kids_at_disneyland_surprised_by_spiderman_who/,60000,1200,r/marvelstudios
The tables have turned,https://www.reddit.com/r/dankmemes/comments/bnao4h/the_tables_have_turned/,58600,442,r/dankmemes
"I love walking around the city at night looking for cinematic moments. Here's what I captured on a foggy night in Austin, Texas",https://www.reddit.com/r/pics/comments/bnblkx/i_love_walking_around_the_city_at_night_looking/,56700,926,r/pics
We admire what we are,https://www.reddit.com/r/pics/comments/bnhruj/we_admire_what_we_are/,55500,545,r/pics
James Oofles,https://www.reddit.com/r/PewdiepieSubmissions/comments/bncvsy/james_oofles/,55100,908,r/PewdiepieSubmissions
Noice,https://www.reddit.com/r/dankmemes/comments/bn9mff/noice/,54600,285,r/dankmemes
Nice painting.,https://www.reddit.com/r/BeAmazed/comments/bnc9bv/nice_painting/,54000,814,r/BeAmazed
Sneaky,https://www.reddit.com/r/dankmemes/comments/bn9pug/sneaky/,53200,479,r/dankmemes
I would listen to his podcast,https://www.reddit.com/r/WhitePeopleTwitter/comments/bnb5je/i_would_listen_to_his_podcast/,53000,422,r/WhitePeopleTwitter
"Yeah,well, that's just, like, your opinion, man",https://www.reddit.com/r/trippinthroughtime/comments/bni228/yeahwell_thats_just_like_your_opinion_man/,54300,285,r/trippinthroughtime
My dad has a cap with a solar powered fan on it.,https://www.reddit.com/r/mildlyinteresting/comments/bnbnpx/my_dad_has_a_cap_with_a_solar_powered_fan_on_it/,52500,1000,r/mildlyinteresting
to keep up with the human,https://www.reddit.com/r/therewasanattempt/comments/bnewis/to_keep_up_with_the_human/,52700,726,r/therewasanattempt
"People who pooped on the bathroom floor in highschool, why?",https://www.reddit.com/r/AskReddit/comments/bniexw/people_who_pooped_on_the_bathroom_floor_in/,52400,7400,r/AskReddit
The crown prince of Jordan participates in #trashtag,https://www.reddit.com/r/pics/comments/bnd5e9/the_crown_prince_of_jordan_participates_in/,52400,819,r/pics
Pit bull breaks up chicken fight.,https://www.reddit.com/r/aww/comments/bn5s2t/pit_bull_breaks_up_chicken_fight/,52200,1200,r/aww
We eat chickens before they're alive and after they are dead.,https://www.reddit.com/r/Showerthoughts/comments/bnf1x9/we_eat_chickens_before_theyre_alive_and_after/,52100,1200,r/Showerthoughts
This is Simit’s first jump in his life,https://www.reddit.com/r/aww/comments/bn6atc/this_is_simits_first_jump_in_his_life/,52000,403,r/aww
Batdad,https://www.reddit.com/r/Unexpected/comments/bndobb/batdad/,48300,592,r/Unexpected
Nah my daughter doesn't drink yet,https://www.reddit.com/r/WatchPeopleDieInside/comments/bnh89z/nah_my_daughter_doesnt_drink_yet/,47200,546,r/WatchPeopleDieInside
lil bun bun,https://www.reddit.com/r/aww/comments/bnhzed/lil_bun_bun/,46900,229,r/aww
Can I offer you a hedgehog in these trying times?,https://www.reddit.com/r/Eyebleach/comments/bn7rc2/can_i_offer_you_a_hedgehog_in_these_trying_times/,46900,373,r/Eyebleach
me_irl,https://www.reddit.com/r/me_irl/comments/bnanvr/me_irl/,46600,1100,r/me_irl
"If Jeff Bezos died and left his fortune to whoever completed a some sort of challenge, what challenge would be most appropriate?",https://www.reddit.com/r/AskReddit/comments/bndpre/if_jeff_bezos_died_and_left_his_fortune_to/,45300,5700,r/AskReddit
In Shrek 2 the warning label on Fairy Godmother's potion is only visible after it has been drunk.,https://www.reddit.com/r/assholedesign/comments/bnesf0/in_shrek_2_the_warning_label_on_fairy_godmothers/,45100,298,r/assholedesign
What a power move lmao,https://www.reddit.com/r/WhitePeopleTwitter/comments/bngdwx/what_a_power_move_lmao/,44600,140,r/WhitePeopleTwitter
"TIL there is a city in Washington named 'George'. Every year, George, Washington celebrates the 4th of July by baking the world's largest cherry pie.",https://www.reddit.com/r/todayilearned/comments/bn7cb7/til_there_is_a_city_in_washington_named_george/,44400,645,r/todayilearned
That's a lotta money,https://www.reddit.com/r/dankmemes/comments/bnhzbf/thats_a_lotta_money/,44100,481,r/dankmemes
It’s rewind time,https://www.reddit.com/r/thanosdidnothingwrong/comments/bniixa/its_rewind_time/,43400,356,r/thanosdidnothingwrong
Makeup brand new lexicon,https://www.reddit.com/r/BrandNewSentence/comments/bnawej/makeup_brand_new_lexicon/,43900,656,r/BrandNewSentence
I drew a comment that made me laugh last week,https://www.reddit.com/r/comics/comments/bnbiti/i_drew_a_comment_that_made_me_laugh_last_week/,42300,204,r/comics
Tiny grabby paws,https://www.reddit.com/r/aww/comments/bn9dns/tiny_grabby_paws/,42000,165,r/aww
"Methane-consuming bacteria could be the future of fuel, with new discovery in journal Science illuminating how they turn methane gas into liquid methanol, removing a harmful greenhouse gas while also generating a sustainable fuel at room temperature, compared to current processes at 1,300 Celsius.",https://www.reddit.com/r/science/comments/bnb53v/methaneconsuming_bacteria_could_be_the_future_of/,41800,822,r/science
no time to spare,https://www.reddit.com/r/BikiniBottomTwitter/comments/bnfe5g/no_time_to_spare/,41800,250,r/BikiniBottomTwitter
A quick brown fox jumps over the lazy dog,https://www.reddit.com/r/Eyebleach/comments/bnbwj2/a_quick_brown_fox_jumps_over_the_lazy_dog/,41700,315,r/Eyebleach
"Chillicus, the lord of Idongivafuch",https://www.reddit.com/r/Bossfight/comments/bnbt9y/chillicus_the_lord_of_idongivafuch/,43600,312,r/Bossfight
Best roast ever,https://www.reddit.com/r/PewdiepieSubmissions/comments/bnbfjg/best_roast_ever/,40300,551,r/PewdiepieSubmissions
The fact that Cat will never know that Ned was truly loyal to her after all these years still upsets me,https://www.reddit.com/r/freefolk/comments/bnf5ov/the_fact_that_cat_will_never_know_that_ned_was/,40100,1700,r/freefolk
Hostage Situation,https://www.reddit.com/r/pcmasterrace/comments/bndqyu/hostage_situation/,40000,599,r/pcmasterrace
I can't believe something so smol is walking,https://www.reddit.com/r/aww/comments/bnf18u/i_cant_believe_something_so_smol_is_walking/,39900,625,r/aww
The reflection from my tv looks like the moon is hovering over my swimming pool,https://www.reddit.com/r/mildlyinteresting/comments/bncans/the_reflection_from_my_tv_looks_like_the_moon_is/,39800,674,r/mildlyinteresting
This might be an awesome teaching method,https://www.reddit.com/r/wholesomememes/comments/bnbn8a/this_might_be_an_awesome_teaching_method/,39600,168,r/wholesomememes
"At TCU graduation today, this support staff worker stood in the atrium, and applauded for EVERY SINGLE graduate.",https://www.reddit.com/r/HumansBeingBros/comments/bnfkki/at_tcu_graduation_today_this_support_staff_worker/,39500,309,r/HumansBeingBros
"Large brewery commissions work or sets fake interviews to solicit marketing ideas, steals them without paying or crediting the contributors. Owner doesn't understand when people take issue.",https://www.reddit.com/r/ChoosingBeggars/comments/bnb6f6/large_brewery_commissions_work_or_sets_fake/,39500,1800,r/ChoosingBeggars
Season 8 in a nutshell,https://www.reddit.com/r/freefolk/comments/bnaqdz/season_8_in_a_nutshell/,39100,789,r/freefolk
Incorruptible,https://www.reddit.com/r/madlads/comments/bn7are/incorruptible/,39100,334,r/madlads
Saw this today.,https://www.reddit.com/r/gaming/comments/bnhhyj/saw_this_today/,39000,663,r/gaming
The brofist statue is finally done :) my first attempt to get in lwiay (this thing took me way to long to make),https://www.reddit.com/r/PewdiepieSubmissions/comments/bna0iq/the_brofist_statue_is_finally_done_my_first/,38100,611,r/PewdiepieSubmissions
This dudes drinking a Bud Light at a McDonalds drive thru.... its 11 am,https://www.reddit.com/r/IdiotsInCars/comments/bndrcg/this_dudes_drinking_a_bud_light_at_a_mcdonalds/,37900,2900,r/IdiotsInCars
My Housemate still hasn’t got rid of his pumpkin from Halloween...,https://www.reddit.com/r/mildlyinfuriating/comments/bnbvcf/my_housemate_still_hasnt_got_rid_of_his_pumpkin/,37800,1100,r/mildlyinfuriating
hmmM,https://www.reddit.com/r/HistoryMemes/comments/bndqux/hmmm/,37600,329,r/HistoryMemes
We can eliminate at least one Stark...,https://www.reddit.com/r/freefolk/comments/bn9mjj/we_can_eliminate_at_least_one_stark/,37100,586,r/freefolk
The way she colors the page,https://www.reddit.com/r/oddlysatisfying/comments/bndbid/the_way_she_colors_the_page/,36500,472,r/oddlysatisfying
Epic swing in Bali Indonesia,https://www.reddit.com/r/gifs/comments/bn8g01/epic_swing_in_bali_indonesia/,36400,685,r/gifs
Alright don't mess this up the whole country is watching,https://www.reddit.com/r/Wellthatsucks/comments/bncs4t/alright_dont_mess_this_up_the_whole_country_is/,36100,745,r/Wellthatsucks
This smart-ass...,https://www.reddit.com/r/Tinder/comments/bnahd9/this_smartass/,35900,405,r/Tinder
I made a LEGO Meat Boy that holds Nintendo Switch games,https://www.reddit.com/r/gaming/comments/bnba96/i_made_a_lego_meat_boy_that_holds_nintendo_switch/,35400,469,r/gaming
Yin's golf shot. never tell me the odds,https://www.reddit.com/r/nevertellmetheodds/comments/bnd2u1/yins_golf_shot_never_tell_me_the_odds/,35200,475,r/nevertellmetheodds
Judge strikes down Kentucky law banning abortion procedure,https://www.reddit.com/r/politics/comments/bnajaf/judge_strikes_down_kentucky_law_banning_abortion/,35200,2300,r/politics
Only a Sith deals in absolutes,https://www.reddit.com/r/PrequelMemes/comments/bn6tgz/only_a_sith_deals_in_absolutes/,35100,118,r/PrequelMemes
Dirk Nowitzki attempts a bicycle kick in a charity game,https://www.reddit.com/r/sports/comments/bnh8q0/dirk_nowitzki_attempts_a_bicycle_kick_in_a/,34900,477,r/sports
"Mr. Stark, i dont feel so good",https://www.reddit.com/r/CrappyDesign/comments/bnf0xq/mr_stark_i_dont_feel_so_good/,34900,274,r/CrappyDesign
Downvotes incomming,https://www.reddit.com/r/HistoryMemes/comments/bnaf0s/downvotes_incomming/,34600,1100,r/HistoryMemes
He lost more than the race,https://www.reddit.com/r/Wellthatsucks/comments/bnha67/he_lost_more_than_the_race/,34400,236,r/Wellthatsucks
I miss that show,https://www.reddit.com/r/PewdiepieSubmissions/comments/bngzpw/i_miss_that_show/,34300,188,r/PewdiepieSubmissions
🔥 Time lapse in the bee yard🔥,https://www.reddit.com/r/NatureIsFuckingLit/comments/bnfsvm/time_lapse_in_the_bee_yard/,33700,229,r/NatureIsFuckingLit
That's pretty hot,https://www.reddit.com/r/Damnthatsinteresting/comments/bngicj/thats_pretty_hot/,33300,294,r/Damnthatsinteresting
"In the movie Oblivion, the sky tower scenes used 12 projectors instead of green screens for interior shots. This meant the sky would be reflected in the actors’ eyes and on the surfaces of the house.",https://www.reddit.com/r/MovieDetails/comments/bne5x2/in_the_movie_oblivion_the_sky_tower_scenes_used/,33100,475,r/MovieDetails
Euron: The Bowmaster of King's Landing,https://www.reddit.com/r/freefolk/comments/bnh60i/euron_the_bowmaster_of_kings_landing/,33000,781,r/freefolk
I made a simple 2-button fighting game with help from the local FGC,https://www.reddit.com/r/gaming/comments/bnigex/i_made_a_simple_2button_fighting_game_with_help/,32800,572,r/gaming
I am groot,https://www.reddit.com/r/memes/comments/bnbn18/i_am_groot/,32700,430,r/memes
Title town,https://www.reddit.com/r/technicallythetruth/comments/bnfzgt/title_town/,32400,139,r/technicallythetruth
Nyeh I sure hope this is original,https://www.reddit.com/r/dankmemes/comments/bnaule/nyeh_i_sure_hope_this_is_original/,32299,244,r/dankmemes
Blursed Fred,https://www.reddit.com/r/blursedimages/comments/bni4mx/blursed_fred/,32200,160,r/blursedimages
Why is there 2 d's in 'Reddit'?,https://www.reddit.com/r/teenagers/comments/bnb3qq/why_is_there_2_ds_in_reddit/,32200,602,r/teenagers
Finally I have them all,https://www.reddit.com/r/PewdiepieSubmissions/comments/bnbk04/finally_i_have_them_all/,32200,206,r/PewdiepieSubmissions
Smoooshy face,https://www.reddit.com/r/rarepuppers/comments/bnbbnu/smoooshy_face/,32000,198,r/rarepuppers
"[No Spoilers] My wife graduated today, I thought this might belong here.",https://www.reddit.com/r/gameofthrones/comments/bngxmc/no_spoilers_my_wife_graduated_today_i_thought/,32100,403,r/gameofthrones
Bye bing bong,https://www.reddit.com/r/memes/comments/bng01h/bye_bing_bong/,31800,359,r/memes
"Roses are red, on the bed he sat,",https://www.reddit.com/r/boottoobig/comments/bnc1wx/roses_are_red_on_the_bed_he_sat/,31500,100,r/boottoobig
Praise Peter Jackson people,https://www.reddit.com/r/lotrmemes/comments/bn5pjl/praise_peter_jackson_people/,31200,367,r/lotrmemes
Such a shame,https://www.reddit.com/r/dankmemes/comments/bna71v/such_a_shame/,31200,154,r/dankmemes
"TIL that Disney is an anglicized version of the French name “D’Isigny”, meaning “From Isigny”. Descendants from the same ancestors as Walt formed a cheese company in France. They sometimes collaborate and make Mickey-themed cheese packages.",https://www.reddit.com/r/todayilearned/comments/bncfpy/til_that_disney_is_an_anglicized_version_of_the/,31200,425,r/todayilearned
Popping balloons!!,https://www.reddit.com/r/WatchPeopleDieInside/comments/bnaw8h/popping_balloons/,31100,381,r/WatchPeopleDieInside
Me_irl,https://www.reddit.com/r/me_irl/comments/bn6o8t/me_irl/,30800,191,r/me_irl
I've lost count....,https://www.reddit.com/r/FunnyandSad/comments/bnforx/ive_lost_count/,31300,199,r/FunnyandSad
Pupper getting overexcited by his new sprinkler toy,https://www.reddit.com/r/AnimalsBeingDerps/comments/bndz6q/pupper_getting_overexcited_by_his_new_sprinkler/,30200,96,r/AnimalsBeingDerps
You never really lived if you've never done this.,https://www.reddit.com/r/gatekeeping/comments/bncbg8/you_never_really_lived_if_youve_never_done_this/,30300,332,r/gatekeeping
PsBattle: Hal & Lois reunited,https://www.reddit.com/r/photoshopbattles/comments/bnchjm/psbattle_hal_lois_reunited/,30100,336,r/photoshopbattles
I love pixels,https://www.reddit.com/r/dankmemes/comments/bndrvb/i_love_pixels/,30000,268,r/dankmemes
In Eyes Wide Shut You Can See a Painting of Stanley Kubrick’s Beloved Cat Olly,https://www.reddit.com/r/MovieDetails/comments/bn883z/in_eyes_wide_shut_you_can_see_a_painting_of/,29800,672,r/MovieDetails
Guy wins against claw machine like none other,https://www.reddit.com/r/Unexpected/comments/bni5cw/guy_wins_against_claw_machine_like_none_other/,29600,276,r/Unexpected
My friend lives in the same complex as the Pokémon Pickup!,https://www.reddit.com/r/gaming/comments/bni31n/my_friend_lives_in_the_same_complex_as_the/,29300,412,r/gaming
Let's Get This Bread,https://www.reddit.com/r/gaming/comments/bndrxs/lets_get_this_bread/,29200,368,r/gaming
"If movie titles were taken literally, what blockbuster film would suddenly be the most boring?",https://www.reddit.com/r/AskReddit/comments/bncqlb/if_movie_titles_were_taken_literally_what/,29200,12400,r/AskReddit
In Front of the 7m Iron Man Statue in Hong Kong,https://www.reddit.com/r/marvelstudios/comments/bnb3nk/in_front_of_the_7m_iron_man_statue_in_hong_kong/,29100,460,r/marvelstudios
Lioness just trying to get attention,https://www.reddit.com/r/aww/comments/bne9mz/lioness_just_trying_to_get_attention/,29000,832,r/aww
TIL about an unnamed Viking warrior who was tasked with guarding a narrow (4 person wide) bridge against the Saxons in 1066. He survived constant attack for 1 hour until a clever Saxon floated down the river in a barrel and piked him in the groin from under the bridge.,https://www.reddit.com/r/todayilearned/comments/bnbgq2/til_about_an_unnamed_viking_warrior_who_was/,28900,1000,r/todayilearned
Shadowshop,https://www.reddit.com/r/confusing_perspective/comments/bnddwq/shadowshop/,29000,161,r/confusing_perspective
Terry Fox the wholesome madlad,https://www.reddit.com/r/Damnthatsinteresting/comments/bncr3q/terry_fox_the_wholesome_madlad/,28600,462,r/Damnthatsinteresting
I’m going to Alabama to visit my sister and I need help,https://www.reddit.com/r/teenagers/comments/bne3p9/im_going_to_alabama_to_visit_my_sister_and_i_need/,28600,527,r/teenagers
"Brilliant, But Brilliant",https://www.reddit.com/r/dankmemes/comments/bncguo/brilliant_but_brilliant/,28500,115,r/dankmemes
The black mirror doesn’t lie! Buy and it’ll be profits you clean up!,https://www.reddit.com/r/MemeEconomy/comments/bnbrpx/the_black_mirror_doesnt_lie_buy_and_itll_be/,28200,1100,r/MemeEconomy
Nice painting.,https://www.reddit.com/r/toptalent/comments/bnemz0/nice_painting/,28200,367,r/toptalent
He was disappointed when I brought up Wholefoods didn't sell calzones.,https://www.reddit.com/r/PandR/comments/bnftt8/he_was_disappointed_when_i_brought_up_wholefoods/,28000,478,r/PandR
"Haa, *pauses* got em",https://www.reddit.com/r/madlads/comments/bni892/haa_pauses_got_em/,27800,150,r/madlads
This is so neat !!!,https://www.reddit.com/r/funny/comments/bn9ry6/this_is_so_neat/,27800,850,r/funny
People in wheelchairs are witches,https://www.reddit.com/r/tumblr/comments/bncz1c/people_in_wheelchairs_are_witches/,27600,208,r/tumblr
"ELI5: How, at 93 million miles away, does the sun feel so warm, yet when a simple cloud passes over it the warmth is incredibly dampened?",https://www.reddit.com/r/explainlikeimfive/comments/bnajh3/eli5_how_at_93_million_miles_away_does_the_sun/,27200,1200,r/explainlikeimfive
"I hope this hasn't been done before, but lets be honest, it probably has.",https://www.reddit.com/r/PrequelMemes/comments/bnicx2/i_hope_this_hasnt_been_done_before_but_lets_be/,27000,143,r/PrequelMemes
Please.....Stop....This!,https://www.reddit.com/r/mildlyinfuriating/comments/bn980v/pleasestopthis/,27000,565,r/mildlyinfuriating
Found this while weeding the garden at my new house,https://www.reddit.com/r/StarWars/comments/bndwvl/found_this_while_weeding_the_garden_at_my_new/,26800,663,r/StarWars
Seeing him laugh brightens my day,https://www.reddit.com/r/wholesomememes/comments/bncho4/seeing_him_laugh_brightens_my_day/,26200,74,r/wholesomememes
Chicago bachelor pad for me and the pup.,https://www.reddit.com/r/malelivingspace/comments/bne23q/chicago_bachelor_pad_for_me_and_the_pup/,29000,712,r/malelivingspace
"Girlfriend’s cat hid under the bed after clipping his nails, tried to give him a treat and this is what he does",https://www.reddit.com/r/aww/comments/bnefqy/girlfriends_cat_hid_under_the_bed_after_clipping/,26100,352,r/aww
Putin falls flat on his face while waving to crowd at all-star ice hockey game,https://www.reddit.com/r/worldnews/comments/bn94c8/putin_falls_flat_on_his_face_while_waving_to/,25900,1700,r/worldnews
The “we have food at home” starter pack,https://www.reddit.com/r/starterpacks/comments/bn9e0e/the_we_have_food_at_home_starter_pack/,25900,936,r/starterpacks
Poor Jared,https://www.reddit.com/r/MurderedByWords/comments/bniajz/poor_jared/,25700,596,r/MurderedByWords
UK companies failing to tackle climate change would be delisted from the London Stock Exchange under radical plans for greening the economy being drawn up by Labour.,https://www.reddit.com/r/worldnews/comments/bnaf5l/uk_companies_failing_to_tackle_climate_change/,25500,1400,r/worldnews
The “I’m going to have a summer body this year” starter pack,https://www.reddit.com/r/starterpacks/comments/bnf7ge/the_im_going_to_have_a_summer_body_this_year/,25500,446,r/starterpacks
Very satisfying way of painting,https://www.reddit.com/r/oddlysatisfying/comments/bnewho/very_satisfying_way_of_painting/,25500,329,r/oddlysatisfying
He's one of the best,https://www.reddit.com/r/dankmemes/comments/bni1do/hes_one_of_the_best/,25100,97,r/dankmemes
My mum always wraps Birthday presents in maps,https://www.reddit.com/r/mildlyinteresting/comments/bnci7n/my_mum_always_wraps_birthday_presents_in_maps/,25100,293,r/mildlyinteresting
Are you seriously gonna scroll by without breathing?,https://www.reddit.com/r/memes/comments/bnbun2/are_you_seriously_gonna_scroll_by_without/,25100,126,r/memes
Laughs in 9 year old,https://www.reddit.com/r/PewdiepieSubmissions/comments/bn8dd4/laughs_in_9_year_old/,25000,141,r/PewdiepieSubmissions
The only officer I trust,https://www.reddit.com/r/aww/comments/bnh3xp/the_only_officer_i_trust/,25000,337,r/aww
Women can't be feminine,https://www.reddit.com/r/gatekeeping/comments/bni93a/women_cant_be_feminine/,25000,439,r/gatekeeping
Is it possible to learn this power?,https://www.reddit.com/r/dankmemes/comments/bnbs4k/is_it_possible_to_learn_this_power/,24900,88,r/dankmemes
My friends over at r/cactus thought you mind find my baby king copper cactus adorable too! 😍🌵,https://www.reddit.com/r/aww/comments/bnhp2i/my_friends_over_at_rcactus_thought_you_mind_find/,24800,179,r/aww
Me_irl,https://www.reddit.com/r/me_irl/comments/bnaask/me_irl/,24700,197,r/me_irl
#thankyoupewdiepie,https://www.reddit.com/r/PewdiepieSubmissions/comments/bn6z5e/thankyoupewdiepie/,24700,113,r/PewdiepieSubmissions
I [26M] upset a woman [20sF] and my friends are acting like I'm in the wrong.,https://www.reddit.com/r/relationship_advice/comments/bnagtv/i_26m_upset_a_woman_20sf_and_my_friends_are/,24600,3500,r/relationship_advice
Happens way too many times,https://www.reddit.com/r/memes/comments/bncvzg/happens_way_too_many_times/,24400,60,r/memes
Marvel thinks they're slick,https://www.reddit.com/r/dankmemes/comments/bnblfp/marvel_thinks_theyre_slick/,24100,141,r/dankmemes
I found this book on the 10 Year Anniversary Minecraft Map. The book is by “Herobrine” and is titled “Code Translator”.,https://www.reddit.com/r/Minecraft/comments/bndkim/i_found_this_book_on_the_10_year_anniversary/,23800,633,r/Minecraft
This,https://www.reddit.com/r/mildlyinfuriating/comments/bnickd/this/,23600,228,r/mildlyinfuriating
Time lapse of Bee yard !!!,https://www.reddit.com/r/pics/comments/bnekbn/time_lapse_of_bee_yard/,23600,253,r/pics
Onion -> NYT,https://www.reddit.com/r/ABoringDystopia/comments/bndxt2/onion_nyt/,23600,452,r/ABoringDystopia
JSJJS,https://www.reddit.com/r/dankmemes/comments/bna5g6/jsjjs/,23500,172,r/dankmemes
Captain Marvel action figures,https://www.reddit.com/r/Wellthatsucks/comments/bn6044/captain_marvel_action_figures/,23400,378,r/Wellthatsucks
My Lemon in my glass,https://www.reddit.com/r/Perfectfit/comments/bndi50/my_lemon_in_my_glass/,23900,264,r/Perfectfit
Cha cha real smooth,https://www.reddit.com/r/dankmemes/comments/bnfxg7/cha_cha_real_smooth/,23100,73,r/dankmemes
They are legends,https://www.reddit.com/r/memes/comments/bn8xn8/they_are_legends/,23000,106,r/memes
I should probably get a better internet connection,https://www.reddit.com/r/memes/comments/bng8md/i_should_probably_get_a_better_internet_connection/,22800,143,r/memes
that's a twist. that's very twisty,https://www.reddit.com/r/dankmemes/comments/bngoi1/thats_a_twist_thats_very_twisty/,22800,237,r/dankmemes
True dat.,https://www.reddit.com/r/memes/comments/bnd6wj/true_dat/,22400,225,r/memes
[No Spoilers] I just finished this painting of Arya,https://www.reddit.com/r/gameofthrones/comments/bnc6zn/no_spoilers_i_just_finished_this_painting_of_arya/,22400,380,r/gameofthrones
Always helps!,https://www.reddit.com/r/funny/comments/bndpe4/always_helps/,22300,266,r/funny
Is Ragnarok still relevant,https://www.reddit.com/r/dankmemes/comments/bnesqw/is_ragnarok_still_relevant/,22200,117,r/dankmemes
0 beautiful children,https://www.reddit.com/r/cursedcomments/comments/bneruf/0_beautiful_children/,22200,203,r/cursedcomments
What do you all think?,https://www.reddit.com/r/Minecraft/comments/bnbjb6/what_do_you_all_think/,22100,615,r/Minecraft
"""This belongs here fren""",https://www.reddit.com/r/aww/comments/bnb8hu/this_belongs_here_fren/,21900,114,r/aww
