Title,Title Link,Score,Num Comments,Subreddit
hmmm,https://www.reddit.com/r/hmmm/comments/bn996h/hmmm/,21800,199,r/hmmm
City of Tears [OC],https://www.reddit.com/r/NintendoSwitch/comments/bne9uk/city_of_tears_oc/,21800,333,r/NintendoSwitch
Oh no,https://www.reddit.com/r/comedyheaven/comments/bnep2t/oh_no/,21700,521,r/comedyheaven
"The King Octopus, Me, Acrylic On Canvas, 2019",https://www.reddit.com/r/Art/comments/bnfk1p/the_king_octopus_me_acrylic_on_canvas_2019/,21700,225,r/Art
He can't drop it while you're Poppin it,https://www.reddit.com/r/Wellthatsucks/comments/bnap2x/he_cant_drop_it_while_youre_poppin_it/,21500,284,r/Wellthatsucks
I see this done on Reddit all the time and it bothers me to no end,https://www.reddit.com/r/AdviceAnimals/comments/bnbv97/i_see_this_done_on_reddit_all_the_time_and_it/,21300,906,r/AdviceAnimals
Bleacher Report did the Rockets dirty,https://www.reddit.com/r/nba/comments/bn7oaj/bleacher_report_did_the_rockets_dirty/,21300,843,r/nba
"This is my favorite, ever",https://www.reddit.com/r/rareinsults/comments/bnbhke/this_is_my_favorite_ever/,21300,71,r/rareinsults
"Works every time, 60% of the time.",https://www.reddit.com/r/bonehurtingjuice/comments/bn5q2g/works_every_time_60_of_the_time/,21200,93,r/bonehurtingjuice
Woof_irl,https://www.reddit.com/r/woof_irl/comments/bnan2i/woof_irl/,21200,143,r/woof_irl
Americans driving to Canada for cheaper insulin as prices skyrocket,https://www.reddit.com/r/news/comments/bnfjir/americans_driving_to_canada_for_cheaper_insulin/,21100,2000,r/news
my mum is hot i know,https://www.reddit.com/r/dankmemes/comments/bngbxs/my_mum_is_hot_i_know/,21000,65,r/dankmemes
Pew news episode on it today?,https://www.reddit.com/r/PewdiepieSubmissions/comments/bnbt9d/pew_news_episode_on_it_today/,21000,117,r/PewdiepieSubmissions
Ant-man is inevitable,https://www.reddit.com/r/dankmemes/comments/bncf1z/antman_is_inevitable/,20900,134,r/dankmemes
I think most of you can relate,https://www.reddit.com/r/wholesomememes/comments/bnfrnx/i_think_most_of_you_can_relate/,20800,226,r/wholesomememes
My Favorite Mission with The Boys,https://www.reddit.com/r/reddeadredemption/comments/bnha81/my_favorite_mission_with_the_boys/,21200,196,r/reddeadredemption
World Record Longhorn,https://www.reddit.com/r/AbsoluteUnits/comments/bncehl/world_record_longhorn/,20600,247,r/AbsoluteUnits
I’m crying can someone do this irl please?,https://www.reddit.com/r/dankmemes/comments/bna3y9/im_crying_can_someone_do_this_irl_please/,20400,97,r/dankmemes
Pc users go away,https://www.reddit.com/r/dankmemes/comments/bnd9th/pc_users_go_away/,20400,237,r/dankmemes
We do often go siko mode on em,https://www.reddit.com/r/dankmemes/comments/bn5zyy/we_do_often_go_siko_mode_on_em/,20400,91,r/dankmemes
"Why Elon Musk, MIT and a 16-year-old inventor are going after mind-reading technology - Merging the human brain with a computer would change our species forever. Researchers are developing technology that can transfer data between computers and our brains.",https://www.reddit.com/r/Futurology/comments/bnbut8/why_elon_musk_mit_and_a_16yearold_inventor_are/,20300,1800,r/Futurology
Every time I see this pic of Elizabeth Olsen and Chris Evans at the Civil War premiere I just bust out laughing,https://www.reddit.com/r/marvelstudios/comments/bn6tc8/every_time_i_see_this_pic_of_elizabeth_olsen_and/,20400,814,r/marvelstudios
We can do it guys,https://www.reddit.com/r/dankmemes/comments/bn9usl/we_can_do_it_guys/,20100,27,r/dankmemes
12 years,https://www.reddit.com/r/MurderedByWords/comments/bn8tak/12_years/,20000,209,r/MurderedByWords
"A rock squirrel strangling a snake before eating it. Texas, USA.",https://www.reddit.com/r/natureismetal/comments/bncigf/a_rock_squirrel_strangling_a_snake_before_eating/,19900,401,r/natureismetal
Mechanical LEGO Torbjörn Turret (speed test with drill),https://www.reddit.com/r/Overwatch/comments/bnaouz/mechanical_lego_torbjörn_turret_speed_test_with/,19700,194,r/Overwatch
K A R E N! Where's my food?,https://www.reddit.com/r/tippytaps/comments/bnev21/k_a_r_e_n_wheres_my_food/,19700,254,r/tippytaps
What real pain is.,https://www.reddit.com/r/woooosh/comments/bnbvnv/what_real_pain_is/,19600,173,r/woooosh
We wanted our kids to memorize our cell phone numbers so that they could reach us in case of emergency. We made the passcode on the iPad our cell phone numbers. They had them memorized in days.,https://www.reddit.com/r/lifehacks/comments/bnhgn7/we_wanted_our_kids_to_memorize_our_cell_phone/,19300,283,r/lifehacks
Saw this on r/sciencememes,https://www.reddit.com/r/pcmasterrace/comments/bnaguy/saw_this_on_rsciencememes/,19300,274,r/pcmasterrace
I’ve been alive for four decades and have never seen a fireman get a cat out of a tree.,https://www.reddit.com/r/Showerthoughts/comments/bni526/ive_been_alive_for_four_decades_and_have_never/,19200,506,r/Showerthoughts
"Danielle Steel's desk...a giant stack of her own novels! Kind of badass for the total ego trip that it is, but still utterly tacky & hideous.",https://www.reddit.com/r/ATBGE/comments/bn84cr/danielle_steels_deska_giant_stack_of_her_own/,19200,638,r/ATBGE
Strange irony,https://www.reddit.com/r/marvelmemes/comments/bn9haa/strange_irony/,19300,273,r/marvelmemes
Brought home Luna a few weeks ago. I think she is broken.,https://www.reddit.com/r/WhatsWrongWithYourDog/comments/bnbvdb/brought_home_luna_a_few_weeks_ago_i_think_she_is/,19200,121,r/WhatsWrongWithYourDog
Bruh sound effect #2,https://www.reddit.com/r/comedyheaven/comments/bnbf5c/bruh_sound_effect_2/,19100,264,r/comedyheaven
'Power Rangers' actor Pua Magasiva dead at 38,https://www.reddit.com/r/movies/comments/bndnhs/power_rangers_actor_pua_magasiva_dead_at_38/,19000,1000,r/movies
I was told since I was 25 that I couldn't have kids & was ok with that. At 40 years old I'm about to celebrate my first Mother's Day with the best baby ever and I'm so thankful for him.,https://www.reddit.com/r/pics/comments/bn6f6l/i_was_told_since_i_was_25_that_i_couldnt_have/,19000,462,r/pics
Safety first,https://www.reddit.com/r/memes/comments/bnc0q7/safety_first/,19000,62,r/memes
This is a real tweet,https://www.reddit.com/r/dankmemes/comments/bnhxfv/this_is_a_real_tweet/,18900,256,r/dankmemes
🤔,https://www.reddit.com/r/PewdiepieSubmissions/comments/bna5if/_/,18900,52,r/PewdiepieSubmissions
"Strawboney, Me, Watercolour, 2019",https://www.reddit.com/r/Art/comments/bnadck/strawboney_me_watercolour_2019/,18800,245,r/Art
Not everyone can pass the entrance exam.,https://www.reddit.com/r/HistoryMemes/comments/bnhtzd/not_everyone_can_pass_the_entrance_exam/,18800,86,r/HistoryMemes
I still cry about him,https://www.reddit.com/r/dankmemes/comments/bn95o8/i_still_cry_about_him/,18800,72,r/dankmemes
PsBattle: A sleeping kitten,https://www.reddit.com/r/photoshopbattles/comments/bn6841/psbattle_a_sleeping_kitten/,18500,93,r/photoshopbattles
Your friendly neighborhood Ant-Man,https://www.reddit.com/r/memes/comments/bneedx/your_friendly_neighborhood_antman/,18500,118,r/memes
I uSe DArk MoDE,https://www.reddit.com/r/dankmemes/comments/bn6edi/i_use_dark_mode/,18400,45,r/dankmemes
It was all a dream...,https://www.reddit.com/r/suicidebywords/comments/bnd4eu/it_was_all_a_dream/,18400,178,r/suicidebywords
"ZA WARDO, STOP TI-",https://www.reddit.com/r/ShitPostCrusaders/comments/bnbqbx/za_wardo_stop_ti/,18100,127,r/ShitPostCrusaders
Bern,https://www.reddit.com/r/europe/comments/bnfnj9/bern/,18100,322,r/europe
"TIL that medieval dentists knew how to fill cavities, treat facial fractures, could spot oral cancer, and even knew the basics of whitening teeth. Evidence also suggests they knew how to create dentures out of cow bone and human teeth.",https://www.reddit.com/r/todayilearned/comments/bnazvc/til_that_medieval_dentists_knew_how_to_fill/,18100,312,r/todayilearned
Made a lego working trebuchet. It can throw a 9g projectile over 3 meters!,https://www.reddit.com/r/trebuchetmemes/comments/bnavoh/made_a_lego_working_trebuchet_it_can_throw_a_9g/,18100,184,r/trebuchetmemes
"[Post Game Thread] The Golden State Warriors (4-2) eliminate the Houston Rockets (2-4) yet again, 118-113, to advance to the Conference Finals despite the absence of Kevin Durant",https://www.reddit.com/r/nba/comments/bn7n2o/post_game_thread_the_golden_state_warriors_42/,18000,7300,r/nba
"making a false comparison between a ""lithium mine"" and an oilsands site.",https://www.reddit.com/r/quityourbullshit/comments/bng6hg/making_a_false_comparison_between_a_lithium_mine/,18000,548,r/quityourbullshit
Emilia Clarke at the game last night,https://www.reddit.com/r/youseeingthisshit/comments/bncasm/emilia_clarke_at_the_game_last_night/,17800,283,r/youseeingthisshit
People who own big houses or apartments will never know the joy of vacuuming the whole house in 5mins using one outlet,https://www.reddit.com/r/Showerthoughts/comments/bncdwa/people_who_own_big_houses_or_apartments_will/,17800,475,r/Showerthoughts
Blursed Date,https://www.reddit.com/r/blursedimages/comments/bnbjq4/blursed_date/,17700,126,r/blursedimages
Stupid me it’s Pikachu and not Pikatchu,https://www.reddit.com/r/dankmemes/comments/bng9sc/stupid_me_its_pikachu_and_not_pikatchu/,17700,123,r/dankmemes
That's why I love my land,https://www.reddit.com/r/dankmemes/comments/bn9w0q/thats_why_i_love_my_land/,17600,178,r/dankmemes
SLPT : Feeling lonely? Pay someone to follow you around.,https://www.reddit.com/r/ShittyLifeProTips/comments/bnbumm/slpt_feeling_lonely_pay_someone_to_follow_you/,17600,166,r/ShittyLifeProTips
[OC] Barbarian Wizard Comic,https://www.reddit.com/r/DnD/comments/bnheym/oc_barbarian_wizard_comic/,17500,416,r/DnD
Let's not go to hot !,https://www.reddit.com/r/memes/comments/bn91cw/lets_not_go_to_hot/,17400,94,r/memes
IT'S A BOY! I'm so freaking excited! My cecropia moth finally emerged 😍 will post again when his wings are finished drying.,https://www.reddit.com/r/pics/comments/bndr38/its_a_boy_im_so_freaking_excited_my_cecropia_moth/,17300,664,r/pics
Lying on his deathbed is a Russian Communist,https://www.reddit.com/r/Jokes/comments/bn9nvq/lying_on_his_deathbed_is_a_russian_communist/,17300,557,r/Jokes
Walking distance to the nearest pub [OC],https://www.reddit.com/r/dataisbeautiful/comments/bnbc18/walking_distance_to_the_nearest_pub_oc/,17100,383,r/dataisbeautiful
I won’t turn away.,https://www.reddit.com/r/wholesomememes/comments/bne2h9/i_wont_turn_away/,17100,96,r/wholesomememes
A cat after rolling in glitter,https://www.reddit.com/r/woahdude/comments/bnh7xp/a_cat_after_rolling_in_glitter/,16900,225,r/woahdude
Cries in build.gradle,https://www.reddit.com/r/ProgrammerHumor/comments/bne1d3/cries_in_buildgradle/,16900,361,r/ProgrammerHumor
What animal is this?,https://www.reddit.com/r/whatisthisthing/comments/bnb6ka/what_animal_is_this/,16700,99,r/whatisthisthing
[workshop] I made the passive Zenyatta deserves,https://www.reddit.com/r/Overwatch/comments/bni140/workshop_i_made_the_passive_zenyatta_deserves/,16400,339,r/Overwatch
Dog rescues dog 🐶🐶🐶,https://www.reddit.com/r/AnimalTextGifs/comments/bn9b7p/dog_rescues_dog/,16400,106,r/AnimalTextGifs
Owner bites his cat,https://www.reddit.com/r/PraiseTheCameraMan/comments/bn65ac/owner_bites_his_cat/,16400,111,r/PraiseTheCameraMan
"If you watched P&F, you know he actually made that",https://www.reddit.com/r/dankmemes/comments/bndesu/if_you_watched_pf_you_know_he_actually_made_that/,16300,94,r/dankmemes
Work really does suck..,https://www.reddit.com/r/FunnyandSad/comments/bn78c0/work_really_does_suck/,16300,251,r/FunnyandSad
One of the largest domestic coal companies has voluntarily filed for Chapter 11 bankruptcy,https://www.reddit.com/r/news/comments/bn9xny/one_of_the_largest_domestic_coal_companies_has/,16300,1100,r/news
Euron Greyjoy: The gift that keeps on giving,https://www.reddit.com/r/videos/comments/bnf4r8/euron_greyjoy_the_gift_that_keeps_on_giving/,16200,1300,r/videos
An interesting title perhaps.,https://www.reddit.com/r/PewdiepieSubmissions/comments/bn8g3y/an_interesting_title_perhaps/,16200,313,r/PewdiepieSubmissions
Mamma mia!,https://www.reddit.com/r/dankmemes/comments/bnbs11/mamma_mia/,16200,92,r/dankmemes
My drawing of Pewdiepie made with pencils,https://www.reddit.com/r/PewdiepieSubmissions/comments/bnh37k/my_drawing_of_pewdiepie_made_with_pencils/,15900,507,r/PewdiepieSubmissions
Little girl telling her cat a bedtime story,https://www.reddit.com/r/wholesomegifs/comments/bncynk/little_girl_telling_her_cat_a_bedtime_story/,15900,168,r/wholesomegifs
hmmm,https://www.reddit.com/r/hmmm/comments/bnh32t/hmmm/,15900,163,r/hmmm
Son donates part of his liver to his mom Son jokes he's off the hook for Mother's Day gifts,https://www.reddit.com/r/UpliftingNews/comments/bndo4e/son_donates_part_of_his_liver_to_his_mom_son/,15800,117,r/UpliftingNews
"I raise you, my husband at age 16. A recent immigrant to the US and roped into a themed photo shoot. He still refers to this photo as “pew pew” and shows it off proudly.",https://www.reddit.com/r/blunderyears/comments/bn6jrq/i_raise_you_my_husband_at_age_16_a_recent/,15800,248,r/blunderyears
Garfield 3 Looks Sick!,https://www.reddit.com/r/memes/comments/bndws0/garfield_3_looks_sick/,15700,121,r/memes
