Title,Title Link,Score,Num Comments,Subreddit
We cannot forget about #trashtag!,https://www.reddit.com/r/pics/comments/bnndxg/we_cannot_forget_about_trashtag/,104000,931,r/pics
Smile,https://www.reddit.com/r/gifs/comments/bnue1r/smile/,97000,703,r/gifs
I saw this in a Facebook group. Different families same outfits,https://www.reddit.com/r/pics/comments/bnurmu/i_saw_this_in_a_facebook_group_different_families/,95300,1400,r/pics
A wonderful scene in our garden this morning,https://www.reddit.com/r/aww/comments/bnn9v9/a_wonderful_scene_in_our_garden_this_morning/,88900,705,r/aww
And that’s a fact.,https://www.reddit.com/r/memes/comments/bnoq09/and_thats_a_fact/,76400,404,r/memes
Does it count then?,https://www.reddit.com/r/WhitePeopleTwitter/comments/bnokuq/does_it_count_then/,75300,524,r/WhitePeopleTwitter
Made me happy,https://www.reddit.com/r/wholesomememes/comments/bnrheg/made_me_happy/,73900,314,r/wholesomememes
"Found on r/trashy, thought it also belonged here.",https://www.reddit.com/r/Wellthatsucks/comments/bnna3f/found_on_rtrashy_thought_it_also_belonged_here/,71500,1700,r/Wellthatsucks
Impossible!,https://www.reddit.com/r/dankmemes/comments/bnmv1p/impossible/,67700,377,r/dankmemes
Love You Mom ❤️,https://www.reddit.com/r/dankmemes/comments/bnqh44/love_you_mom/,62100,553,r/dankmemes
"Hubble scientists have released the most detailed picture of the universe to date, containing 265,000 galaxies. [Link to high-res picture in comments]",https://www.reddit.com/r/space/comments/bniwvn/hubble_scientists_have_released_the_most_detailed/,61900,2600,r/space
GOD.The dialogues was strong then,https://www.reddit.com/r/freefolk/comments/bnoaxi/godthe_dialogues_was_strong_then/,60900,1800,r/freefolk
Everyone should know about this. This is getting out of hand.,https://www.reddit.com/r/PewdiepieSubmissions/comments/bnt233/everyone_should_know_about_this_this_is_getting/,60000,839,r/PewdiepieSubmissions
"Stanley Kubrick's 'Napoleon', the Greatest Movie Never Made: Kubrick gathered 15,000 location images, read hundreds of books, gathered earth samples, hired 50,000 Romanian troops, and prepared to shoot the most ambitious film of all time, only to lose funding before production officially began.",https://www.reddit.com/r/movies/comments/bnqje9/stanley_kubricks_napoleon_the_greatest_movie/,59800,1500,r/movies
Even more money,https://www.reddit.com/r/PewdiepieSubmissions/comments/bnnk85/even_more_money/,58800,280,r/PewdiepieSubmissions
This pocket knife was gifted to my Great Grandfather by the King of Sweden over 100 years ago.,https://www.reddit.com/r/pics/comments/bnkc78/this_pocket_knife_was_gifted_to_my_great/,58700,1000,r/pics
Hasta la vista baby,https://www.reddit.com/r/dankmemes/comments/bnodo4/hasta_la_vista_baby/,58600,257,r/dankmemes
Noice,https://www.reddit.com/r/madlads/comments/bnojzf/noice/,58600,1100,r/madlads
Pupper does a reverse,https://www.reddit.com/r/aww/comments/bnqmq2/pupper_does_a_reverse/,57900,324,r/aww
Also every lady walking their dog: he must smell your dog,https://www.reddit.com/r/trippinthroughtime/comments/bnrpy3/also_every_lady_walking_their_dog_he_must_smell/,60100,650,r/trippinthroughtime
I feel cheated,https://www.reddit.com/r/gaming/comments/bnn8ac/i_feel_cheated/,55300,593,r/gaming
Get it together.,https://www.reddit.com/r/WhitePeopleTwitter/comments/bnldqo/get_it_together/,54000,678,r/WhitePeopleTwitter
Idiots have leveled up,https://www.reddit.com/r/IdiotsInCars/comments/bnnyvr/idiots_have_leveled_up/,54000,1700,r/IdiotsInCars
Take my honey,https://www.reddit.com/r/CrappyDesign/comments/bnseb4/take_my_honey/,53500,385,r/CrappyDesign
Douglas Lima deals with cocky fighter standing sideways,https://www.reddit.com/r/gifs/comments/bnogkm/douglas_lima_deals_with_cocky_fighter_standing/,52700,2200,r/gifs
Mrw I finally buy my own HBO subscription to watch season 8,https://www.reddit.com/r/freefolk/comments/bns8p9/mrw_i_finally_buy_my_own_hbo_subscription_to/,52100,894,r/freefolk
food standards,https://www.reddit.com/r/WhitePeopleTwitter/comments/bnu4rn/food_standards/,51100,671,r/WhitePeopleTwitter
RIP Yinsen,https://www.reddit.com/r/dankmemes/comments/bnp4d7/rip_yinsen/,50400,245,r/dankmemes
me_irl,https://www.reddit.com/r/me_irl/comments/bnolqe/me_irl/,49700,209,r/me_irl
Has VR gone too far? [Blade & Sorcery],https://www.reddit.com/r/gaming/comments/bnsgev/has_vr_gone_too_far_blade_sorcery/,48500,755,r/gaming
🔥 Seals are the dogs of the sea 🔥,https://www.reddit.com/r/NatureIsFuckingLit/comments/bnnbl2/seals_are_the_dogs_of_the_sea/,48400,685,r/NatureIsFuckingLit
So exciting!,https://www.reddit.com/r/PrequelMemes/comments/bnqyfu/so_exciting/,48200,381,r/PrequelMemes
When my friends talk about Endgame and I pretend to care.,https://www.reddit.com/r/HighQualityGifs/comments/bnoooi/when_my_friends_talk_about_endgame_and_i_pretend/,47300,961,r/HighQualityGifs
*clears throat* ahem. SHOTS FIRED,https://www.reddit.com/r/MurderedByWords/comments/bnqa58/clears_throat_ahem_shots_fired/,46800,614,r/MurderedByWords
All smiles,https://www.reddit.com/r/aww/comments/bnpk62/all_smiles/,46600,379,r/aww
Discord are open to putting discord on switch,https://www.reddit.com/r/NintendoSwitch/comments/bnsgif/discord_are_open_to_putting_discord_on_switch/,45700,969,r/NintendoSwitch
The Milky Way and a Meteor shower from my window seat on a Boeing 737,https://www.reddit.com/r/space/comments/bnqzlz/the_milky_way_and_a_meteor_shower_from_my_window/,45500,672,r/space
"Parents no longer can claim personal, philosophical exemption for measles vaccine in Wash.",https://www.reddit.com/r/UpliftingNews/comments/bnpu19/parents_no_longer_can_claim_personal/,44800,1800,r/UpliftingNews
This garlic I found in my garden. The entire head is one clove.,https://www.reddit.com/r/mildlyinteresting/comments/bnjj8s/this_garlic_i_found_in_my_garden_the_entire_head/,43500,1300,r/mildlyinteresting
"$150 college text book, doesn’t come with rings.",https://www.reddit.com/r/assholedesign/comments/bno1st/150_college_text_book_doesnt_come_with_rings/,43600,2000,r/assholedesign
"if you are a gamer, there is a high chance that someone somewhere in the world screamed your username in rage",https://www.reddit.com/r/Showerthoughts/comments/bnqkss/if_you_are_a_gamer_there_is_a_high_chance_that/,43200,2000,r/Showerthoughts
Sounds about white,https://www.reddit.com/r/facepalm/comments/bns4jt/sounds_about_white/,42600,760,r/facepalm
fire and water,https://www.reddit.com/r/Damnthatsinteresting/comments/bntj6z/fire_and_water/,42600,687,r/Damnthatsinteresting
"A long long time ago, in a galaxy far before Apps...",https://www.reddit.com/r/funny/comments/bnpo1g/a_long_long_time_ago_in_a_galaxy_far_before_apps/,42400,416,r/funny
Living the dream,https://www.reddit.com/r/rarepuppers/comments/bnokp5/living_the_dream/,42300,226,r/rarepuppers
I feel like reddit would enjoy these birdies I doodled onto some colour tests!,https://www.reddit.com/r/pics/comments/bnoyvn/i_feel_like_reddit_would_enjoy_these_birdies_i/,42100,327,r/pics
Measles vaccinations jump 106% as B.C. counters anti-vaxxer fear-mongering,https://www.reddit.com/r/worldnews/comments/bnrj8n/measles_vaccinations_jump_106_as_bc_counters/,41500,1200,r/worldnews
FB is a disaster today.,https://www.reddit.com/r/AdviceAnimals/comments/bnqtrp/fb_is_a_disaster_today/,41300,1100,r/AdviceAnimals
"Train snowplough accidentally buried a deer, luckily the train crew saw the tragedy happen and dug it out again.",https://www.reddit.com/r/HumansBeingBros/comments/bnq8um/train_snowplough_accidentally_buried_a_deer/,40600,328,r/HumansBeingBros
Tennessee judge shares links saying 'Jews should get the f*** over the Holocaust' and calling Muslims 'foreign mud',https://www.reddit.com/r/politics/comments/bnukox/tennessee_judge_shares_links_saying_jews_should/,40000,2900,r/politics
everytime,https://www.reddit.com/r/memes/comments/bnneez/everytime/,40000,322,r/memes
A worthy sacrifice,https://www.reddit.com/r/dankmemes/comments/bnisyy/a_worthy_sacrifice/,39700,209,r/dankmemes
Fame has really changed you pewds smh,https://www.reddit.com/r/PewdiepieSubmissions/comments/bns2dm/fame_has_really_changed_you_pewds_smh/,38600,196,r/PewdiepieSubmissions
Hope this doesn't die in new,https://www.reddit.com/r/dankmemes/comments/bnpjbb/hope_this_doesnt_die_in_new/,37700,139,r/dankmemes
Only the first 3 Pokémon generations are relevant nothing else,https://www.reddit.com/r/gatekeeping/comments/bnp56h/only_the_first_3_pokémon_generations_are_relevant/,38000,1500,r/gatekeeping
How the tables have turned,https://www.reddit.com/r/dankmemes/comments/bnnb9w/how_the_tables_have_turned/,36800,226,r/dankmemes
"I’m a professional, I know what I’m doing...",https://www.reddit.com/r/gifs/comments/bnp5xq/im_a_professional_i_know_what_im_doing/,36500,1100,r/gifs
My eight year old daughter asked if she could make a funny mother's day card with one bad word.,https://www.reddit.com/r/funny/comments/bnqrb0/my_eight_year_old_daughter_asked_if_she_could/,36300,739,r/funny
me_irl,https://www.reddit.com/r/me_irl/comments/bnlp2e/me_irl/,36100,131,r/me_irl
HI SISTERS,https://www.reddit.com/r/PewdiepieSubmissions/comments/bnp3ky/hi_sisters/,36100,214,r/PewdiepieSubmissions
Happy Mother's Day to the woman with the greatest musical taste in the galaxy.,https://www.reddit.com/r/marvelstudios/comments/bnu6le/happy_mothers_day_to_the_woman_with_the_greatest/,36000,623,r/marvelstudios
2meirl4meirl,https://www.reddit.com/r/2meirl4meirl/comments/bnswxc/2meirl4meirl/,35900,236,r/2meirl4meirl
"Tagging and blood tests for bison. Just to give you an idea of how big they are, this male weighs around 3000lbs.",https://www.reddit.com/r/Damnthatsinteresting/comments/bnkvaw/tagging_and_blood_tests_for_bison_just_to_give/,35800,646,r/Damnthatsinteresting
NASA wants to know your location,https://www.reddit.com/r/technicallythetruth/comments/bnnvi9/nasa_wants_to_know_your_location/,35800,358,r/technicallythetruth
Millennium Falcon Drone,https://www.reddit.com/r/interestingasfuck/comments/bnomr2/millennium_falcon_drone/,35600,307,r/interestingasfuck
I have trouble with the commands,https://www.reddit.com/r/dankmemes/comments/bnnf87/i_have_trouble_with_the_commands/,35200,154,r/dankmemes
I decided to try a new approach to Tinder and cast a wide net,https://www.reddit.com/r/Tinder/comments/bnpesa/i_decided_to_try_a_new_approach_to_tinder_and/,35000,726,r/Tinder
"[NO SPOILERS] 2 more episodes and we bid farewell to one of the greatest tv shows ever. Hate it or love it, thank you Game of Thrones!",https://www.reddit.com/r/gameofthrones/comments/bnr6t8/no_spoilers_2_more_episodes_and_we_bid_farewell/,35200,1800,r/gameofthrones
Season 8 episode 5 battle clip LEAKED,https://www.reddit.com/r/freefolk/comments/bnmbbb/season_8_episode_5_battle_clip_leaked/,34300,1500,r/freefolk
There's always a bigger box office.,https://www.reddit.com/r/PrequelMemes/comments/bnmtxa/theres_always_a_bigger_box_office/,34100,407,r/PrequelMemes
"Wait, what?!",https://www.reddit.com/r/youseeingthisshit/comments/bnjvn3/wait_what/,34000,425,r/youseeingthisshit
"Not yet Halloween season but welp, its always the time for wholesomeness",https://www.reddit.com/r/wholesomememes/comments/bnpy65/not_yet_halloween_season_but_welp_its_always_the/,34000,134,r/wholesomememes
Color changing hard,https://www.reddit.com/r/blackmagicfuckery/comments/bnnb59/color_changing_hard/,33500,256,r/blackmagicfuckery
bring s4 Tyrion back,https://www.reddit.com/r/freefolk/comments/bnsrmq/bring_s4_tyrion_back/,33400,614,r/freefolk
pErFecTly bAlaNcEd,https://www.reddit.com/r/PewdiepieSubmissions/comments/bnnkq3/perfectly_balanced/,33000,153,r/PewdiepieSubmissions
My PP hard,https://www.reddit.com/r/PewdiepieSubmissions/comments/bnrjsq/my_pp_hard/,32900,226,r/PewdiepieSubmissions
Happy Mother’s Day to one of these three interns.,https://www.reddit.com/r/DunderMifflin/comments/bnpvfb/happy_mothers_day_to_one_of_these_three_interns/,32600,354,r/DunderMifflin
Cave dwellings > literally any other house in Minecraft,https://www.reddit.com/r/Minecraft/comments/bnoido/cave_dwellings_literally_any_other_house_in/,32400,440,r/Minecraft
"TIL peekaboo is universal to all cultures, and developmental psychologists believe it is important to infant development.",https://www.reddit.com/r/todayilearned/comments/bnqj1o/til_peekaboo_is_universal_to_all_cultures_and/,32200,455,r/todayilearned
"Unmarried couples living apart have the highest levels of sexual satisfaction while married couples are among the least satisfied, finds a new German study (n=3,207) of sexual satisfaction among seven relationship-status groups. Only unmarried individuals with no partner scored lower than married.",https://www.reddit.com/r/science/comments/bnnyb8/unmarried_couples_living_apart_have_the_highest/,32200,1600,r/science
My girl died last week at age 15. These were her best zoomies.,https://www.reddit.com/r/Zoomies/comments/bnngmg/my_girl_died_last_week_at_age_15_these_were_her/,32299,341,r/Zoomies
Planetary gears at my local Mexican restaurant,https://www.reddit.com/r/mechanical_gifs/comments/bnqg1e/planetary_gears_at_my_local_mexican_restaurant/,32400,248,r/mechanical_gifs
Screw you Janet,https://www.reddit.com/r/BikiniBottomTwitter/comments/bnusgp/screw_you_janet/,31700,131,r/BikiniBottomTwitter
"To all the Mothers around the world, ____________",https://www.reddit.com/r/AskOuija/comments/bnjrzf/to_all_the_mothers_around_the_world/,32500,710,r/AskOuija
Finally saved enough money to make my own gaming PC!,https://www.reddit.com/r/gaming/comments/bnscvh/finally_saved_enough_money_to_make_my_own_gaming/,31300,1300,r/gaming
tbh he's really underrated,https://www.reddit.com/r/dankmemes/comments/bnrt6z/tbh_hes_really_underrated/,30800,154,r/dankmemes
The Side Effects of Vaccines - How High is the Risk?,https://www.reddit.com/r/videos/comments/bnogbc/the_side_effects_of_vaccines_how_high_is_the_risk/,30800,2300,r/videos
Oopsie Doopsie!,https://www.reddit.com/r/PewdiepieSubmissions/comments/bnqrtn/oopsie_doopsie/,30800,132,r/PewdiepieSubmissions
you better believe it :),https://www.reddit.com/r/wholesomememes/comments/bnoghl/you_better_believe_it/,30700,479,r/wholesomememes
The best years of my life were spent in the arms of another man's wife...,https://www.reddit.com/r/Jokes/comments/bnmmkk/the_best_years_of_my_life_were_spent_in_the_arms/,30300,225,r/Jokes
Home CCTV camera captures footage of meteor over Chicago,https://www.reddit.com/r/gifs/comments/bnsmfr/home_cctv_camera_captures_footage_of_meteor_over/,30200,519,r/gifs
Me_irl,https://www.reddit.com/r/me_irl/comments/bntmlh/me_irl/,30100,217,r/me_irl
TIFU by asking too much from my gf's mom,https://www.reddit.com/r/tifu/comments/bnrch7/tifu_by_asking_too_much_from_my_gfs_mom/,29900,751,r/tifu
I’m always ready for snuggles,https://www.reddit.com/r/wholesomememes/comments/bnqpg8/im_always_ready_for_snuggles/,29700,294,r/wholesomememes
"Swords, Edits and Crossovers!",https://www.reddit.com/r/comics/comments/bnqmyc/swords_edits_and_crossovers/,29700,985,r/comics
I’ve seen this raw strength only one before,https://www.reddit.com/r/dankmemes/comments/bnp5mh/ive_seen_this_raw_strength_only_one_before/,29600,174,r/dankmemes
My first attempt,https://www.reddit.com/r/comedynecromancy/comments/bnojdv/my_first_attempt/,29900,134,r/comedynecromancy
Me waiting for Ant-Man to go into Cersei’s ass,https://www.reddit.com/r/freefolk/comments/bnuyi4/me_waiting_for_antman_to_go_into_cerseis_ass/,29100,118,r/freefolk
This street art,https://www.reddit.com/r/confusing_perspective/comments/bnryfw/this_street_art/,29200,111,r/confusing_perspective
TIFU by letting my nephew play with my Google Home Mini,https://www.reddit.com/r/tifu/comments/bnvhqa/tifu_by_letting_my_nephew_play_with_my_google/,28900,584,r/tifu
"TIL about how BBC once convinced people Spaghetti grew on trees. In 1957,BBC broadcast a 3min program about Switzerland farms growing Spaghetti trees. The farmers harvested them and put in the sun to dry them.The presenter explained Spaghetti always grows to the same length. People believed it.",https://www.reddit.com/r/todayilearned/comments/bnoc5u/til_about_how_bbc_once_convinced_people_spaghetti/,28400,661,r/todayilearned
Good old times...,https://www.reddit.com/r/BikiniBottomTwitter/comments/bnpmbh/good_old_times/,28100,114,r/BikiniBottomTwitter
Cursed image to begin with,https://www.reddit.com/r/cursedcomments/comments/bnpf4e/cursed_image_to_begin_with/,28000,208,r/cursedcomments
Office boi attempting to join the meeting,https://www.reddit.com/r/rarepuppers/comments/bnkkzm/office_boi_attempting_to_join_the_meeting/,28000,142,r/rarepuppers
Passing the baton,https://www.reddit.com/r/nonononoyes/comments/bnjo3f/passing_the_baton/,28000,280,r/nonononoyes
One of our treasures in 30 seconds (with added music and done on imovies),https://www.reddit.com/r/PrequelMemes/comments/bnuvom/one_of_our_treasures_in_30_seconds_with_added/,27900,299,r/PrequelMemes
View from the hotel,https://www.reddit.com/r/Unexpected/comments/bnpi05/view_from_the_hotel/,27900,204,r/Unexpected
Meme italiano,https://www.reddit.com/r/dankmemes/comments/bnmmvq/meme_italiano/,27900,111,r/dankmemes
Every time,https://www.reddit.com/r/memes/comments/bnp3hg/every_time/,27800,64,r/memes
It got old real fast,https://www.reddit.com/r/memes/comments/bnoktp/it_got_old_real_fast/,27500,114,r/memes
What movie really changed an actor's career?,https://www.reddit.com/r/AskReddit/comments/bntob1/what_movie_really_changed_an_actors_career/,27400,11800,r/AskReddit
Science: Am I a joke to you?,https://www.reddit.com/r/thanosdidnothingwrong/comments/bntbm1/science_am_i_a_joke_to_you/,27400,398,r/thanosdidnothingwrong
Invisible glass,https://www.reddit.com/r/funny/comments/bnsoeo/invisible_glass/,27400,365,r/funny
Another “illegal video” from Chris Evans’ Twitter,https://www.reddit.com/r/marvelstudios/comments/bnr4nu/another_illegal_video_from_chris_evans_twitter/,27300,760,r/marvelstudios
woof_irl,https://www.reddit.com/r/woof_irl/comments/bniztz/woof_irl/,27300,94,r/woof_irl
A woman dies and goes to the gates of heaven.,https://www.reddit.com/r/Jokes/comments/bnqwpx/a_woman_dies_and_goes_to_the_gates_of_heaven/,27000,350,r/Jokes
He looks like a puppy to me,https://www.reddit.com/r/rarepuppers/comments/bnspbf/he_looks_like_a_puppy_to_me/,27000,114,r/rarepuppers
What’s going on?,https://www.reddit.com/r/BetterEveryLoop/comments/bnsham/whats_going_on/,27000,408,r/BetterEveryLoop
A reminder that all that you see isn’t what it is...,https://www.reddit.com/r/Instagramreality/comments/bnl71d/a_reminder_that_all_that_you_see_isnt_what_it_is/,27200,602,r/Instagramreality
yip E,https://www.reddit.com/r/dankmemes/comments/bnpb66/yip_e/,26400,143,r/dankmemes
Happy mothers day,https://www.reddit.com/r/aww/comments/bnqp73/happy_mothers_day/,26400,108,r/aww
"Antface, destroyer of crumbs",https://www.reddit.com/r/Bossfight/comments/bnpnck/antface_destroyer_of_crumbs/,26300,327,r/Bossfight
This trucker is living in 2099,https://www.reddit.com/r/pics/comments/bnojbo/this_trucker_is_living_in_2099/,26200,322,r/pics
"wait, that’s illegal",https://www.reddit.com/r/dankmemes/comments/bns0e0/wait_thats_illegal/,26200,222,r/dankmemes
"TIL During WWII, the German army used a radar system called Wotan. The British scientist R.V. Jones figured out how the system worked by assuming that it used a single beam based on the fact that the Germanic god Wotan had only one eye.",https://www.reddit.com/r/todayilearned/comments/bnkzdq/til_during_wwii_the_german_army_used_a_radar/,26100,810,r/todayilearned
Really hope this doesn't backfire😂,https://www.reddit.com/r/BikiniBottomTwitter/comments/bnqsnn/really_hope_this_doesnt_backfire/,25900,124,r/BikiniBottomTwitter
The more you look at it the worse it becomes,https://www.reddit.com/r/dankmemes/comments/bno3hs/the_more_you_look_at_it_the_worse_it_becomes/,25900,331,r/dankmemes
hmmm,https://www.reddit.com/r/hmmm/comments/bno6q2/hmmm/,25900,169,r/hmmm
"I made this starter pack a year ago, the formula remains",https://www.reddit.com/r/starterpacks/comments/bnjyd9/i_made_this_starter_pack_a_year_ago_the_formula/,25800,515,r/starterpacks
When you got your marzia from the discount shelf,https://www.reddit.com/r/PewdiepieSubmissions/comments/bnpxj0/when_you_got_your_marzia_from_the_discount_shelf/,25800,170,r/PewdiepieSubmissions
"Peggy Lipton, 'Twin Peaks' & 'A Dog's Purpose' Actress and Mother of Rashida Jones, Dies at 72",https://www.reddit.com/r/movies/comments/bnkiqs/peggy_lipton_twin_peaks_a_dogs_purpose_actress/,25500,675,r/movies
Show your b@lls and invest in this! Profits that will have your pockets sagging!,https://www.reddit.com/r/MemeEconomy/comments/bnji0b/show_your_blls_and_invest_in_this_profits_that/,25500,1100,r/MemeEconomy
Woke AF,https://www.reddit.com/r/thanosdidnothingwrong/comments/bnp6rz/woke_af/,25400,601,r/thanosdidnothingwrong
Thaños,https://www.reddit.com/r/dankmemes/comments/bnlzc6/thaños/,25200,349,r/dankmemes
Sharing is caring,https://www.reddit.com/r/memes/comments/bnokpp/sharing_is_caring/,25200,214,r/memes
Realized this after making my own meals for a week,https://www.reddit.com/r/AdviceAnimals/comments/bnjlgp/realized_this_after_making_my_own_meals_for_a_week/,25100,920,r/AdviceAnimals
PsBattle: This two-legged cat yawning.,https://www.reddit.com/r/photoshopbattles/comments/bnpgsg/psbattle_this_twolegged_cat_yawning/,25000,445,r/photoshopbattles
Fortnite bad. Minecraft good.,https://www.reddit.com/r/iamverysmart/comments/bnsa7m/fortnite_bad_minecraft_good/,25000,525,r/iamverysmart
Someone had to do it,https://www.reddit.com/r/dankmemes/comments/bnoodq/someone_had_to_do_it/,24900,109,r/dankmemes
Sleepy boy,https://www.reddit.com/r/aww/comments/bnkagt/sleepy_boy/,24800,82,r/aww
"PsBattle: Lady Gaga, Bill Murray and David Letterman",https://www.reddit.com/r/photoshopbattles/comments/bnl2sn/psbattle_lady_gaga_bill_murray_and_david_letterman/,24700,343,r/photoshopbattles
Someone put Elon Musk face on a bunch of babies,https://www.reddit.com/r/whitepeoplegifs/comments/bnog0j/someone_put_elon_musk_face_on_a_bunch_of_babies/,24600,344,r/whitepeoplegifs
my mother and i accidentally wore the same outfit. Happy mother’s day!,https://www.reddit.com/r/pics/comments/bnp1pe/my_mother_and_i_accidentally_wore_the_same_outfit/,24500,569,r/pics
Jared Kushner and Ivanka Trump Should Be Subpoenaed Like Donald Trump Jr. Says Ex-Federal Prosecutor,https://www.reddit.com/r/politics/comments/bnnjo7/jared_kushner_and_ivanka_trump_should_be/,24000,724,r/politics
to be seductive,https://www.reddit.com/r/therewasanattempt/comments/bntqor/to_be_seductive/,23900,566,r/therewasanattempt
"Happy Mother’s Day, Momma",https://www.reddit.com/r/memes/comments/bnn1ln/happy_mothers_day_momma/,23900,52,r/memes
We're better together,https://www.reddit.com/r/wholesomememes/comments/bnrfgg/were_better_together/,23900,178,r/wholesomememes
Corgi puppy trust fall,https://www.reddit.com/r/Eyebleach/comments/bnnonj/corgi_puppy_trust_fall/,23800,54,r/Eyebleach
Tunnel Monster,https://www.reddit.com/r/aww/comments/bnqoeb/tunnel_monster/,23600,112,r/aww
HEY YOU GUYS!!! Invest in a Mother’s love.,https://www.reddit.com/r/MemeEconomy/comments/bnrqyh/hey_you_guys_invest_in_a_mothers_love/,23500,943,r/MemeEconomy
"People who were adults during Y2K, what was the most radical action someone you know did to prepare for the ""apocalypse?""",https://www.reddit.com/r/AskReddit/comments/bnlib2/people_who_were_adults_during_y2k_what_was_the/,23300,4700,r/AskReddit
"Untitled, Wang Ling (WLOP), Digital, 2019",https://www.reddit.com/r/Art/comments/bnoab8/untitled_wang_ling_wlop_digital_2019/,23300,293,r/Art
İt is not for sale,https://www.reddit.com/r/thanosdidnothingwrong/comments/bnnlmk/i̇t_is_not_for_sale/,23200,167,r/thanosdidnothingwrong
I am groot,https://www.reddit.com/r/memes/comments/bnjtxl/i_am_groot/,23200,205,r/memes
A Mother's Day Gift,https://www.reddit.com/r/funny/comments/bnpdq3/a_mothers_day_gift/,23100,115,r/funny
Painting with a cylinder,https://www.reddit.com/r/Unexpected/comments/bntucq/painting_with_a_cylinder/,23000,202,r/Unexpected
I guess I'm not supposed to eat my soup?,https://www.reddit.com/r/WeWantPlates/comments/bnp5jv/i_guess_im_not_supposed_to_eat_my_soup/,25200,523,r/WeWantPlates
Only on wednesdays,https://www.reddit.com/r/woooosh/comments/bnncmd/only_on_wednesdays/,22800,200,r/woooosh
A+ for effort,https://www.reddit.com/r/facepalm/comments/bnk2fe/a_for_effort/,22800,268,r/facepalm
Mobile user master race,https://www.reddit.com/r/memes/comments/bnnetj/mobile_user_master_race/,22600,96,r/memes
[NO SPOILERS] Baby ghost for the throne!,https://www.reddit.com/r/gameofthrones/comments/bnneax/no_spoilers_baby_ghost_for_the_throne/,22400,155,r/gameofthrones
[yeeted],https://www.reddit.com/r/dankmemes/comments/bnq2iz/yeeted/,22300,113,r/dankmemes
View from the hotel,https://www.reddit.com/r/assholedesign/comments/bnueek/view_from_the_hotel/,22300,156,r/assholedesign
Frozen items on random shelves,https://www.reddit.com/r/mildlyinfuriating/comments/bnpqr9/frozen_items_on_random_shelves/,22100,336,r/mildlyinfuriating
This sub is on fire,https://www.reddit.com/r/dankmemes/comments/bnn7m6/this_sub_is_on_fire/,22000,74,r/dankmemes
Normies,https://www.reddit.com/r/dankmemes/comments/bnok9i/normies/,21900,75,r/dankmemes
Cheetahs receive emotional support dogs and it is the cutest thing you will see all day,https://www.reddit.com/r/Eyebleach/comments/bnryq2/cheetahs_receive_emotional_support_dogs_and_it_is/,21800,172,r/Eyebleach
Master doofensmirtz,https://www.reddit.com/r/PrequelMemes/comments/bnjeus/master_doofensmirtz/,21700,110,r/PrequelMemes
SHAME!,https://www.reddit.com/r/freefolk/comments/bnuayv/shame/,21600,130,r/freefolk
I'm a duck. Food.,https://www.reddit.com/r/AnimalsBeingDerps/comments/bnnv9j/im_a_duck_food/,21500,73,r/AnimalsBeingDerps
