Title,Title Link,Score,Num Comments,Subreddit
I made my 17 year old King Arthur a cardboard iron throne.,https://www.reddit.com/r/aww/comments/bn1q67/i_made_my_17_year_old_king_arthur_a_cardboard/,96900,995,r/aww
"Today, I will have accomplished what I set out for almost 13 years ago (4 years of undergrad, 3 years of medical research, 6 years of medical school). I’m the first generation on both sides of my family to go to college or graduate school and today I will officially be a Doctor of Medicine!",https://www.reddit.com/r/pics/comments/bmyxc8/today_i_will_have_accomplished_what_i_set_out_for/,91000,2700,r/pics
"TIFU by accidentally getting sexual with my dentist, again.",https://www.reddit.com/r/tifu/comments/bmrr18/tifu_by_accidentally_getting_sexual_with_my/,94800,3300,r/tifu
"Thanks to a couple of amazing redditors who helped me get back to my mom, I get to spend my final Mother’s Day with her.",https://www.reddit.com/r/pics/comments/bn30e6/thanks_to_a_couple_of_amazing_redditors_who/,90300,2900,r/pics
Saw this bumper sticker during my drive around town the other day,https://www.reddit.com/r/funny/comments/bn0py4/saw_this_bumper_sticker_during_my_drive_around/,84200,1400,r/funny
Would you support a mandatory environmental service for adults 18 - 30 ? Kind of like military service but instead of fighting you must spend a few months on reforestation projects or ocean cleanup ? Why or why not ?,https://www.reddit.com/r/AskReddit/comments/bn3bpz/would_you_support_a_mandatory_environmental/,83000,6300,r/AskReddit
Mexico wants to decriminalize all drugs and negotiate with the U.S. to do the same,https://www.reddit.com/r/worldnews/comments/bmtt1s/mexico_wants_to_decriminalize_all_drugs_and/,82400,5500,r/worldnews
View of a track on a tractor,https://www.reddit.com/r/gifs/comments/bmy5mf/view_of_a_track_on_a_tractor/,74200,969,r/gifs
Seems like Disney is using the same guy from the graphics department.,https://www.reddit.com/r/funny/comments/bn2q3h/seems_like_disney_is_using_the_same_guy_from_the/,73000,2000,r/funny
[::] I spent over 500 handwritten commands on a magical door. Definitely worth it! (Download in the comments),https://www.reddit.com/r/Minecraft/comments/bmzsmw/i_spent_over_500_handwritten_commands_on_a/,72200,839,r/Minecraft
"TIL that Nintendo pushed usage of the term ""game console"" so people would stop calling products from other manufacturers ""Nintendos"", otherwise they would have risked losing their trademark.",https://www.reddit.com/r/todayilearned/comments/bmyam0/til_that_nintendo_pushed_usage_of_the_term_game/,69400,2100,r/todayilearned
Millennials kill yet another thing,https://www.reddit.com/r/WhitePeopleTwitter/comments/bn0oba/millennials_kill_yet_another_thing/,68500,2300,r/WhitePeopleTwitter
"Working night shift, wife sends this",https://www.reddit.com/r/aww/comments/bmt432/working_night_shift_wife_sends_this/,67000,571,r/aww
North Dakota quietly decriminalized marijuana,https://www.reddit.com/r/UpliftingNews/comments/bmyzm8/north_dakota_quietly_decriminalized_marijuana/,66800,1500,r/UpliftingNews
Took me way to long to find out d&d is Dan and Dave,https://www.reddit.com/r/freefolk/comments/bmuycc/took_me_way_to_long_to_find_out_dd_is_dan_and_dave/,65800,797,r/freefolk
He's trying his best,https://www.reddit.com/r/wholesomememes/comments/bn0z3g/hes_trying_his_best/,64700,580,r/wholesomememes
Cap said it so...,https://www.reddit.com/r/funny/comments/bmyknt/cap_said_it_so/,63900,985,r/funny
A little late,https://www.reddit.com/r/dankmemes/comments/bmz9k1/a_little_late/,63500,703,r/dankmemes
"LPT: When handling firearms, always assume there is a bullet in the chamber. Even if the gun leaves your sight for a second, next time you pick it up just assume a bullet magically got into the chamber.",https://www.reddit.com/r/LifeProTips/comments/bn0qjk/lpt_when_handling_firearms_always_assume_there_is/,63600,3600,r/LifeProTips
Dad jokes are where a man's creative energies go when it is no longer appropriate to use pick up lines.,https://www.reddit.com/r/Showerthoughts/comments/bmzv3h/dad_jokes_are_where_a_mans_creative_energies_go/,63400,626,r/Showerthoughts
OMG BECKY,https://www.reddit.com/r/dankmemes/comments/bmwy62/omg_becky/,62600,835,r/dankmemes
Ancient moa footprints millions of years old found underwater in New Zealand,https://www.reddit.com/r/gifs/comments/bmwjhc/ancient_moa_footprints_millions_of_years_old/,59400,958,r/gifs
"Not a meme, just some considerate people❤️",https://www.reddit.com/r/wholesomememes/comments/bmsv5d/not_a_meme_just_some_considerate_people/,56900,719,r/wholesomememes
"Almost every country in the world has agreed on a legally binding framework for reducing polluting plastic waste, with the United States a notable exception, United Nations environmental officials said Friday",https://www.reddit.com/r/worldnews/comments/bn3h96/almost_every_country_in_the_world_has_agreed_on_a/,53900,2500,r/worldnews
"Notre Dame fire, Me, Oil Painting, 2019",https://www.reddit.com/r/Art/comments/bmwpaz/notre_dame_fire_me_oil_painting_2019/,54400,698,r/Art
"TIL The blue whale is not only the largest animal currently on the planet, but the largest animal to have ever existed",https://www.reddit.com/r/todayilearned/comments/bn2jfm/til_the_blue_whale_is_not_only_the_largest_animal/,53500,2400,r/todayilearned
Made from 10 layers of paper,https://www.reddit.com/r/gaming/comments/bmwtrk/made_from_10_layers_of_paper/,52100,373,r/gaming
This mosque in Istanbul looks like it was rendered on the lowest settings possible,https://www.reddit.com/r/mildlyinteresting/comments/bn3lre/this_mosque_in_istanbul_looks_like_it_was/,51700,591,r/mildlyinteresting
🔥 A white deer tries to hide but doesn't realize he lacks the ability to camouflage like his other deer friends.,https://www.reddit.com/r/NatureIsFuckingLit/comments/bn0chi/a_white_deer_tries_to_hide_but_doesnt_realize_he/,51700,696,r/NatureIsFuckingLit
cursed_family,https://www.reddit.com/r/cursedcomments/comments/bn5b0b/cursed_family/,51200,234,r/cursedcomments
"Bench seat, seat bench",https://www.reddit.com/r/oddlysatisfying/comments/bn3yfz/bench_seat_seat_bench/,50800,309,r/oddlysatisfying
THE OFFICE CHILD EDITION,https://www.reddit.com/r/DunderMifflin/comments/bn3yk2/the_office_child_edition/,49300,712,r/DunderMifflin
"Atheists of reddit, what is one thing you admire about religion? Religious people of reddit, what is one thing you admire about atheism?",https://www.reddit.com/r/AskReddit/comments/bn3ab7/atheists_of_reddit_what_is_one_thing_you_admire/,49000,13100,r/AskReddit
Locker room memes are funny right?,https://www.reddit.com/r/dankmemes/comments/bmtwzu/locker_room_memes_are_funny_right/,48600,514,r/dankmemes
Every time I wake up,https://www.reddit.com/r/dankmemes/comments/bmvcvg/every_time_i_wake_up/,48200,688,r/dankmemes
Hundreds Of Children Terrified When Movie Theatre Plays La Llorona Instead Of Detective Pikachu,https://www.reddit.com/r/movies/comments/bn1tl5/hundreds_of_children_terrified_when_movie_theatre/,48200,1500,r/movies
The chosen one,https://www.reddit.com/r/PewdiepieSubmissions/comments/bmrfld/the_chosen_one/,47800,171,r/PewdiepieSubmissions
Wanted to cancel my subscription....now I have to talk to someone. 😖,https://www.reddit.com/r/assholedesign/comments/bmxsf7/wanted_to_cancel_my_subscriptionnow_i_have_to/,47900,1700,r/assholedesign
"TIL that in 1970, a fighter pilot was forced to eject during a training mission. His plane, however, righted itself and continued flying for miles, finally touching down gently in a farmer's field. It earned the nickname ""The Cornfield Bomber.""",https://www.reddit.com/r/todayilearned/comments/bmt23f/til_that_in_1970_a_fighter_pilot_was_forced_to/,47100,774,r/todayilearned
"""We're all born bald, baby.""",https://www.reddit.com/r/awfuleverything/comments/bmwjee/were_all_born_bald_baby/,47700,692,r/awfuleverything
My mate went chin first into a rock whilst mountain biking! Nasty x-ray,https://www.reddit.com/r/Wellthatsucks/comments/bmw47o/my_mate_went_chin_first_into_a_rock_whilst/,45900,1900,r/Wellthatsucks
"The Issus coleoptratus, an insect, has gears that help it jump. These are the only natural occurring gears in the animal kingdom.",https://www.reddit.com/r/interestingasfuck/comments/bn0hws/the_issus_coleoptratus_an_insect_has_gears_that/,45400,559,r/interestingasfuck
"It's 6 months since my life changed completely. I'm feeling happy and positive and I don't care, we have only 1 life to enjoy, make the most of it, be like no one else!",https://www.reddit.com/r/pics/comments/bmsrif/its_6_months_since_my_life_changed_completely_im/,45400,1500,r/pics
An absolutely massive gator making its way along a Florida golf course,https://www.reddit.com/r/natureismetal/comments/bn4qyd/an_absolutely_massive_gator_making_its_way_along/,45500,1600,r/natureismetal
Sitting ballerina Kylie Shea,https://www.reddit.com/r/interestingasfuck/comments/bmsmbc/sitting_ballerina_kylie_shea/,45100,1100,r/interestingasfuck
Be different!,https://www.reddit.com/r/facepalm/comments/bn4et6/be_different/,44800,496,r/facepalm
"A new study of suicide timing in 18 US states found that suicide rates rose in March, peaked in September, and was lowest in December. Suicide was more likely to occur in the first week of the month, which may be due to bill arrivals, and early in the week, possibly due to work-related stress.",https://www.reddit.com/r/science/comments/bmxh7l/a_new_study_of_suicide_timing_in_18_us_states/,44800,1100,r/science
What did it cost?.........Everything,https://www.reddit.com/r/dankmemes/comments/bmsq8s/what_did_it_costeverything/,44200,269,r/dankmemes
me irl,https://www.reddit.com/r/me_irl/comments/bmx25s/me_irl/,44000,249,r/me_irl
$300k video wall came down today in Vegas,https://www.reddit.com/r/CatastrophicFailure/comments/bmt0r0/300k_video_wall_came_down_today_in_vegas/,45900,1300,r/CatastrophicFailure
An interesting title,https://www.reddit.com/r/PewdiepieSubmissions/comments/bn3hxk/an_interesting_title/,43200,342,r/PewdiepieSubmissions
Me_irl,https://www.reddit.com/r/me_irl/comments/bmu0p9/me_irl/,43100,177,r/me_irl
A real turning point,https://www.reddit.com/r/WhitePeopleTwitter/comments/bmw24t/a_real_turning_point/,43000,322,r/WhitePeopleTwitter
Am I a Joke t You,https://www.reddit.com/r/dankmemes/comments/bmxb3x/am_i_a_joke_t_you/,42300,185,r/dankmemes
The waiting room starter pack,https://www.reddit.com/r/starterpacks/comments/bmzhky/the_waiting_room_starter_pack/,41900,698,r/starterpacks
Comrade Anastasiya reporting for duty.,https://www.reddit.com/r/Tinder/comments/bmy8k8/comrade_anastasiya_reporting_for_duty/,41500,501,r/Tinder
to make a simple u-turn,https://www.reddit.com/r/therewasanattempt/comments/bmuw16/to_make_a_simple_uturn/,41000,705,r/therewasanattempt
Making a star wars sphere,https://www.reddit.com/r/interestingasfuck/comments/bn2bky/making_a_star_wars_sphere/,40900,433,r/interestingasfuck
Apple CEO Tim Cook: 'I Don't Think a Four-Year Degree is Necessary to Be Proficient at Coding',https://www.reddit.com/r/technology/comments/bn1so2/apple_ceo_tim_cook_i_dont_think_a_fouryear_degree/,40800,3200,r/technology
Mexico wants to decriminalize all drugs and negotiate with the U.S. to do the same,https://www.reddit.com/r/Futurology/comments/bmyi5a/mexico_wants_to_decriminalize_all_drugs_and/,40800,2400,r/Futurology
Real men's ASMR,https://www.reddit.com/r/dankmemes/comments/bmwhqh/real_mens_asmr/,40700,215,r/dankmemes
Let me scare people,https://www.reddit.com/r/Unexpected/comments/bn4rdy/let_me_scare_people/,40600,341,r/Unexpected
*Rip and Tear plays*,https://www.reddit.com/r/teenagers/comments/bmtp2n/rip_and_tear_plays/,40100,783,r/teenagers
That'll show 'em,https://www.reddit.com/r/AdviceAnimals/comments/bn2fvl/thatll_show_em/,40000,519,r/AdviceAnimals
i dont use light mode btw,https://www.reddit.com/r/dankmemes/comments/bn17ny/i_dont_use_light_mode_btw/,39600,1100,r/dankmemes
My transfer student’s graduation cap.,https://www.reddit.com/r/DunderMifflin/comments/bmxxx1/my_transfer_students_graduation_cap/,39500,260,r/DunderMifflin
You know i'm right,https://www.reddit.com/r/dankmemes/comments/bmv71v/you_know_im_right/,39500,191,r/dankmemes
Truer words have never been spoken,https://www.reddit.com/r/teenagers/comments/bmwuvf/truer_words_have_never_been_spoken/,39400,320,r/teenagers
It was said you would make a gif not a slide show.,https://www.reddit.com/r/PrequelMemes/comments/bmx2al/it_was_said_you_would_make_a_gif_not_a_slide_show/,39400,200,r/PrequelMemes
Man can’t believe that a couple are daggering in public,https://www.reddit.com/r/youseeingthisshit/comments/bmwlnu/man_cant_believe_that_a_couple_are_daggering_in/,39400,1200,r/youseeingthisshit
My school store blacks out the prices on everything so you can’t tell how much you’re spending,https://www.reddit.com/r/assholedesign/comments/bmratk/my_school_store_blacks_out_the_prices_on/,38000,1100,r/assholedesign
TIL Lisa Kudrow (Phoebe from the sitcom Friends) published an academic paper in neurology the same year that Friends debuted on TV.,https://www.reddit.com/r/todayilearned/comments/bn05yx/til_lisa_kudrow_phoebe_from_the_sitcom_friends/,37900,971,r/todayilearned
You can feel the disappointment,https://www.reddit.com/r/WatchPeopleDieInside/comments/bmy1n4/you_can_feel_the_disappointment/,37800,603,r/WatchPeopleDieInside
OMG Becky!,https://www.reddit.com/r/dankmemes/comments/bmvyxz/omg_becky/,37600,168,r/dankmemes
It really hurts,https://www.reddit.com/r/PewdiepieSubmissions/comments/bmvrxn/it_really_hurts/,37200,322,r/PewdiepieSubmissions
Should 11-year-old girls have to bear their rapists’ babies? Ohio says yes.,https://www.reddit.com/r/politics/comments/bmwp6i/should_11yearold_girls_have_to_bear_their_rapists/,37100,6500,r/politics
Joey no...,https://www.reddit.com/r/comedyheaven/comments/bmw26i/joey_no/,37100,221,r/comedyheaven
here we go again,https://www.reddit.com/r/HistoryMemes/comments/bmu4pd/here_we_go_again/,36300,196,r/HistoryMemes
There’s an actual book that copies this sub. Found in Urban Outfitters,https://www.reddit.com/r/trippinthroughtime/comments/bmybns/theres_an_actual_book_that_copies_this_sub_found/,35700,295,r/trippinthroughtime
DRA-VARYS,https://www.reddit.com/r/freefolk/comments/bmzv3g/dravarys/,35500,357,r/freefolk
Hard work,https://www.reddit.com/r/dankmemes/comments/bmtows/hard_work/,35400,182,r/dankmemes
Chris Hemsworth and his stunt double,https://www.reddit.com/r/pics/comments/bmrfoh/chris_hemsworth_and_his_stunt_double/,35400,1000,r/pics
3 production companies say they won't film in Georgia after abortion law signed,https://www.reddit.com/r/news/comments/bn0ii7/3_production_companies_say_they_wont_film_in/,35300,3200,r/news
Both stalls share one roll of toilet paper...,https://www.reddit.com/r/CrappyDesign/comments/bmrnb8/both_stalls_share_one_roll_of_toilet_paper/,34900,423,r/CrappyDesign
They clothes school down tomorrow.,https://www.reddit.com/r/BoneAppleTea/comments/bmyip4/they_clothes_school_down_tomorrow/,37000,279,r/BoneAppleTea
TIFU by slapping my teachers ass,https://www.reddit.com/r/tifu/comments/bmxptm/tifu_by_slapping_my_teachers_ass/,34700,1100,r/tifu
I need it,https://www.reddit.com/r/BikiniBottomTwitter/comments/bn47wj/i_need_it/,34400,122,r/BikiniBottomTwitter
When you hit the ground after Endgame,https://www.reddit.com/r/marvelstudios/comments/bmy9ji/when_you_hit_the_ground_after_endgame/,34300,474,r/marvelstudios
The Best Sneaky Yet,https://www.reddit.com/r/PewdiepieSubmissions/comments/bmu44w/the_best_sneaky_yet/,33500,120,r/PewdiepieSubmissions
The two-sided statue of Mephistopheles and Margaretta (19th Century) at the Salar Jung Museum in India. The sculpture is carved out of a single log of sycamore wood. Artist unknown,https://www.reddit.com/r/interestingasfuck/comments/bn4joj/the_twosided_statue_of_mephistopheles_and/,33500,301,r/interestingasfuck
Signs we ignored,https://www.reddit.com/r/freefolk/comments/bmyovr/signs_we_ignored/,33300,2400,r/freefolk
True or not true... The question is now,https://www.reddit.com/r/BikiniBottomTwitter/comments/bmyczh/true_or_not_true_the_question_is_now/,32800,249,r/BikiniBottomTwitter
I love cake,https://www.reddit.com/r/comedyheaven/comments/bn2jsc/i_love_cake/,32600,180,r/comedyheaven
"LPT: If you don't have a dog and are feeling lonely, local rescues are ALWAYS looking for volunteer dog walkers",https://www.reddit.com/r/LifeProTips/comments/bms6di/lpt_if_you_dont_have_a_dog_and_are_feeling_lonely/,32400,674,r/LifeProTips
I call shotgun!,https://www.reddit.com/r/HistoryMemes/comments/bmy8ua/i_call_shotgun/,32299,401,r/HistoryMemes
To sit down,https://www.reddit.com/r/therewasanattempt/comments/bn33ys/to_sit_down/,32200,267,r/therewasanattempt
When you realize OG Thanos died happy because he believed he won leaving the Avengers without a chance of undoing what he did.,https://www.reddit.com/r/thanosdidnothingwrong/comments/bn2o5k/when_you_realize_og_thanos_died_happy_because_he/,32200,694,r/thanosdidnothingwrong
I have poked myself in the eye putting my glasses on with my hands...,https://www.reddit.com/r/gifsthatkeepongiving/comments/bn5dd3/i_have_poked_myself_in_the_eye_putting_my_glasses/,32100,833,r/gifsthatkeepongiving
I thought Hogwarts was a fictional place??? How did separate the cards exactly the second time around ??,https://www.reddit.com/r/blackmagicfuckery/comments/bms2mw/i_thought_hogwarts_was_a_fictional_place_how_did/,31900,469,r/blackmagicfuckery
Phone call timeline,https://www.reddit.com/r/funny/comments/bn1dp1/phone_call_timeline/,31900,272,r/funny
TIE fighter art glass ball.,https://www.reddit.com/r/oddlysatisfying/comments/bmzjfj/tie_fighter_art_glass_ball/,31800,366,r/oddlysatisfying
A Dog's Wish,https://www.reddit.com/r/comics/comments/bn26vj/a_dogs_wish/,31700,211,r/comics
Iam ironman,https://www.reddit.com/r/marvelstudios/comments/bmuosv/iam_ironman/,31600,885,r/marvelstudios
Mom wanted us to rub that nipple mouse,https://www.reddit.com/r/dankmemes/comments/bmw1k8/mom_wanted_us_to_rub_that_nipple_mouse/,31600,259,r/dankmemes
The original Leeroy Jenkins video was uploaded on the internet on 11 May 2005. Today is its 14th anniversary.,https://www.reddit.com/r/videos/comments/bn306b/the_original_leeroy_jenkins_video_was_uploaded_on/,31000,1100,r/videos
Freakin doctors...,https://www.reddit.com/r/woooosh/comments/bmwhim/freakin_doctors/,30700,371,r/woooosh
Pewds last video,https://www.reddit.com/r/PewdiepieSubmissions/comments/bmwu7q/pewds_last_video/,30600,89,r/PewdiepieSubmissions
Square Enix be like,https://www.reddit.com/r/gaming/comments/bmuku4/square_enix_be_like/,30400,1000,r/gaming
Raisin him right,https://www.reddit.com/r/gaming/comments/bmsenv/raisin_him_right/,30200,170,r/gaming
When you open a naming contest to the public,https://www.reddit.com/r/PrequelMemes/comments/bmzv5r/when_you_open_a_naming_contest_to_the_public/,30100,468,r/PrequelMemes
"U.S. Army develops new type of cathode chemistry that makes batteries safer and more efficient. Currently, soldiers carry batteries weighing between 15-20 lbs. But the new type of cathode and electrolyte would result in safer and more efficient batteries weighing half as much.",https://www.reddit.com/r/science/comments/bn4et0/us_army_develops_new_type_of_cathode_chemistry/,30000,1200,r/science
Wack,https://www.reddit.com/r/BikiniBottomTwitter/comments/bmv1r8/wack/,30000,134,r/BikiniBottomTwitter
The snoot squad doin a heckin good snooze,https://www.reddit.com/r/rarepuppers/comments/bn1oow/the_snoot_squad_doin_a_heckin_good_snooze/,29700,226,r/rarepuppers
Wholesome seal,https://www.reddit.com/r/AnimalsBeingBros/comments/bmyrzx/wholesome_seal/,29600,277,r/AnimalsBeingBros
Uhhh,https://www.reddit.com/r/mildlyinfuriating/comments/bmz2t0/uhhh/,29500,352,r/mildlyinfuriating
A 50 year old azalea bonsai.,https://www.reddit.com/r/pics/comments/bn2nx8/a_50_year_old_azalea_bonsai/,28600,259,r/pics
Little cutie hiding in plain sight,https://www.reddit.com/r/aww/comments/bms675/little_cutie_hiding_in_plain_sight/,28400,258,r/aww
You can’t hide anything from mommy! Invest for profits that will show no matter what!,https://www.reddit.com/r/MemeEconomy/comments/bmx3qh/you_cant_hide_anything_from_mommy_invest_for/,28300,1300,r/MemeEconomy
Something other than “boy’s locker rooms”,https://www.reddit.com/r/dankmemes/comments/bn0aqk/something_other_than_boys_locker_rooms/,28300,116,r/dankmemes
Chicago Cubs' Javier Baez Slides Smoothly Into Third Base,https://www.reddit.com/r/sports/comments/bmz2ts/chicago_cubs_javier_baez_slides_smoothly_into/,28100,537,r/sports
After PE:,https://www.reddit.com/r/dankmemes/comments/bmua2u/after_pe/,28100,172,r/dankmemes
[NO SPOILERS] Stark inspired cocktail I created for my bar,https://www.reddit.com/r/gameofthrones/comments/bmrjkt/no_spoilers_stark_inspired_cocktail_i_created_for/,28100,745,r/gameofthrones
Postman looking out for the poultry.,https://www.reddit.com/r/HumansBeingBros/comments/bn1xq1/postman_looking_out_for_the_poultry/,28000,172,r/HumansBeingBros
I love you 3000,https://www.reddit.com/r/dankmemes/comments/bmzw52/i_love_you_3000/,27800,106,r/dankmemes
Germans Officials defending themselves at the Nuremberg Trials:,https://www.reddit.com/r/HistoryMemes/comments/bn55k5/germans_officials_defending_themselves_at_the/,27700,146,r/HistoryMemes
Found this while clearing out my phone pictures,https://www.reddit.com/r/assholedesign/comments/bn20h0/found_this_while_clearing_out_my_phone_pictures/,27600,460,r/assholedesign
Finally... I have them all,https://www.reddit.com/r/dankmemes/comments/bmwsij/finally_i_have_them_all/,27500,414,r/dankmemes
Poor T’challa,https://www.reddit.com/r/tumblr/comments/bn5722/poor_tchalla/,27400,85,r/tumblr
I’m about to be a criminal,https://www.reddit.com/r/dankmemes/comments/bmstom/im_about_to_be_a_criminal/,27100,606,r/dankmemes
11yo tries and fails to bribe Prime Minister Jacinda Ardern into funding dragon research,https://www.reddit.com/r/nottheonion/comments/bn3d4n/11yo_tries_and_fails_to_bribe_prime_minister/,27100,550,r/nottheonion
White House Asked McGahn to Declare Trump Never Obstructed Justice,https://www.reddit.com/r/politics/comments/bn4j1n/white_house_asked_mcgahn_to_declare_trump_never/,26900,1300,r/politics
I’m a guy. It’s been an interesting day.,https://www.reddit.com/r/Tinder/comments/bn516u/im_a_guy_its_been_an_interesting_day/,26700,379,r/Tinder
Ow oof ouch my bones hurt,https://www.reddit.com/r/bonehurtingjuice/comments/bmxlv2/ow_oof_ouch_my_bones_hurt/,26800,160,r/bonehurtingjuice
Kid glued to his smartphone walks off with wrong parents!,https://www.reddit.com/r/holdmyjuicebox/comments/bn31sd/kid_glued_to_his_smartphone_walks_off_with_wrong/,27000,526,r/holdmyjuicebox
Evolution of Tyrion's insults,https://www.reddit.com/r/freefolk/comments/bmzodx/evolution_of_tyrions_insults/,26500,638,r/freefolk
save the turtles,https://www.reddit.com/r/teenagers/comments/bmytky/save_the_turtles/,26400,341,r/teenagers
Don’t look back. Just run.,https://www.reddit.com/r/CasualUK/comments/bmvh4e/dont_look_back_just_run/,26800,303,r/CasualUK
Smh my head,https://www.reddit.com/r/dankmemes/comments/bmxp4z/smh_my_head/,26400,268,r/dankmemes
TIFU by showing my friend nude pictures of his sister,https://www.reddit.com/r/tifu/comments/bn2t2a/tifu_by_showing_my_friend_nude_pictures_of_his/,25900,1100,r/tifu
"Well performance issues I guess, it’s not uncommon, 1 out of 5",https://www.reddit.com/r/thanosdidnothingwrong/comments/bmx4lk/well_performance_issues_i_guess_its_not_uncommon/,25700,278,r/thanosdidnothingwrong
Hmmmmm,https://www.reddit.com/r/dankmemes/comments/bmu3j1/hmmmmm/,25500,187,r/dankmemes
Detective Pikachu is pretty good,https://www.reddit.com/r/dankmemes/comments/bmu9bi/detective_pikachu_is_pretty_good/,25100,66,r/dankmemes
Today's media,https://www.reddit.com/r/FunnyandSad/comments/bmxdak/todays_media/,25100,284,r/FunnyandSad
A Tron-themed rollercoaster in Shanghai,https://www.reddit.com/r/BeAmazed/comments/bmsll8/a_tronthemed_rollercoaster_in_shanghai/,24600,372,r/BeAmazed
Cal Poly faculty vote to remove Chick-fil-A from campus,https://www.reddit.com/r/news/comments/bn4sq3/cal_poly_faculty_vote_to_remove_chickfila_from/,24600,6400,r/news
"Ninja telling the truth , streamers and their audience are destroying this game , complaining about everything",https://www.reddit.com/r/FortNiteBR/comments/bmy4oo/ninja_telling_the_truth_streamers_and_their/,24600,3100,r/FortNiteBR
Professor's dog,https://www.reddit.com/r/aww/comments/bn4m4h/professors_dog/,24500,169,r/aww
In ‘Harry Potter and the Chamber of Secrets’ one of the places Mrs. Weasley has marked on the clock that tells her where her family members are is “prison.”,https://www.reddit.com/r/MovieDetails/comments/bmy816/in_harry_potter_and_the_chamber_of_secrets_one_of/,24500,508,r/MovieDetails
so true,https://www.reddit.com/r/teenagers/comments/bn1k99/so_true/,24400,194,r/teenagers
Happy birthday C418! (person who makes music for Minecraft),https://www.reddit.com/r/Minecraft/comments/bmrpoj/happy_birthday_c418_person_who_makes_music_for/,24300,302,r/Minecraft
Slam,https://www.reddit.com/r/youngpeopleyoutube/comments/bmvldt/slam/,24100,1600,r/youngpeopleyoutube
2meirl4meirl,https://www.reddit.com/r/2meirl4meirl/comments/bmw0yl/2meirl4meirl/,24000,80,r/2meirl4meirl
What a happy face,https://www.reddit.com/r/funny/comments/bmxf3t/what_a_happy_face/,23900,182,r/funny
You shouldn't see any horror movie today,https://www.reddit.com/r/Jokes/comments/bn1il7/you_shouldnt_see_any_horror_movie_today/,23800,405,r/Jokes
LockPickingLawyer removes a Car Boot with ease!,https://www.reddit.com/r/videos/comments/bmzm3a/lockpickinglawyer_removes_a_car_boot_with_ease/,23800,1900,r/videos
Fake news gets upvoted to the top of r/all,https://www.reddit.com/r/quityourbullshit/comments/bmxmo1/fake_news_gets_upvoted_to_the_top_of_rall/,23700,453,r/quityourbullshit
