Title,doc,topic
Waterboarding at Guantanamo Bay sounds super rad if you don't know what either of those things are.,0,4
So I woke up to this out front,1,4
If you cut a fun-size Crunch bar to read inch,2,4
That would make me want to tip more,3,4
My brother's shirt,4,4
As an engineer this is very relevant,5,4
I curled the snow on the fence into a satisfying roll.,6,4
"TIL that when recycled glass is used to manufacture new glass containers, it is virtually infinitely recyclable. Furthermore, every metric ton (1,000 kg) of glass recycled into new glass items saves 315 kg (694 lb) of carbon dioxide from being released into the atmosphere.",7,8
Had this discussion today...,8,9
My British friend on the Super Bowl.,9,4
Looking up at the night sky.,10,4
I decided to repurpose my old vodka bottles! What do you think?,11,4
The little kitten I found outside last week is really adjusting to life as an indoor kitty,12,4
Oh Google...u so hipster,13,6
"TIL Our genes show that we all share a male ancestor that is called Y-Chromosomal Adam. He lived approximately 208,300 years ago.",14,4
My GRAVITY lawsuit and how it affects every writer who sells to Hollywood,15,4
"GDT: Superbowl XLIX: Seattle Seahawks vs. New England Patriots, 3:30 PST / 7:30 EST",16,4
7 Year old me knew what was up.,17,4
Scumbag Facebook,18,4
My friend received this while stationed in Italy,19,9
Looks like the new puppy has been accepted,20,4
It only took 18 years...,21,4
Poor guy,22,4
The first Super Bowl lit with LED lights will cut energy use by 75%,23,4
Gently blow on your screen...,24,9
This is a Tree of Life and it is the largest of its kind.,25,4
This is a nifty invention.,26,5
Picked her up yesterday. The pink rhino smells like her mom,27,4
Daily struggle.,28,4
Just a little snow storm in my city,29,4
"10 years later, House is still as relevant as he ever was.",30,4
Cap'n America and Starlord Superbowl bet is now set.,31,4
My old man looking majestic in the snow,32,4
Skinny people,33,4
No turning back half-wall book shelf,34,4
My work is really starting to interfere with my gaming experience.,35,4
What happens when your housemate has a wax seal and trust issues.,36,4
Every time I trust auto-correct,37,4
How Greece decided to deal with its debt.,38,4
My best friend turned 15 today,39,4
I miss this guy,40,4
What question is best left unanswered?,41,4
Mike Rowe might be a little crazy...,42,4
Something's just not right,43,4
Dropped icecream on my cake made by my sister,44,4
Are you even trying Luigi?,45,4
Camel Gets a Hair Cut!,46,9
Two Saudi men during their first time on a plane.,47,4
"TIL that Daniel Radcliffe's stunt double, David Holmes, was paralysed while performing a stunt for The Deathly Hallows Part 1 (2009)",48,9
"Once again... it doesnt need embellishment, people.",49,4
Riding the Subway,50,9
He believes that he is a pug too.,51,5
My new boss is a real piece of work,52,4
Neil Gaiman response to all the Fifty shades of Grey craziness..,53,4
"PsBattle: My friend after hitting a half court shot and winning $10,000",54,4
I found a very unique clock at a friend's house,55,4
Metal Bruce Almighty,56,1
Hey you.,57,4
Free diver playing in ocean current,58,4
Proper way to merge in Russia,59,4
Primal instinct,60,5
Hey are you done with your homework yet?!,61,9
"TIL that the last recorded kill using a bow and arrow in war was made in WWII by British officer Jack Churchill, who carried a longbow, bagpipes and a Scottish broadsword into battle",62,4
Playing with the kitty,63,4
Mine has a map of the world,64,9
A different Cone,65,4
One of my favourite scenes from the American Office.,66,4
Soon.,67,3
Anyone else having trouble completing this side quest?,68,4
"TIL that there exists a planet between Mars and Jupiter known as Ceres. It's a dwarf planet, like Pluto, and may contain water and an atmosphere.",69,4
"A look into reddits elite 1%. Supposed to be a secret if you don't have gold. /r/lounge, ladies and gentlemen.",70,3
Her reaction to anal when you try just the tip,71,8
It smells SO good...,72,9
The girls who played Ross and Rachel's baby on Friends,73,4
"Whenever he looks at me and closes his eyes like this, I feel like everything is going to be alright.",74,4
1000$ on Mango vs Leffen,75,0
TIFU by proposing a threesome on the first date.,76,4
Every time you look away for a second...,77,4
THE 12th Man,78,4
"[Serious] Gay men who lived through the HIV Epidemic of the 1980s, what was it like?",79,4
I live in Australia,80,4
"Britons like Israel better only than North Korea, poll finds: Some 35 percent of Britons name Israel as their least favorite non-European country, a worse score than Iran's.",81,4
Hears father's voice,82,2
Layered coffee,83,9
My new boy hearing popcorn being popped for the first time! :),84,4
"72 year old man, more agile than most 20 year olds attributes it all to play.",85,4
My son put lego hair on Mace Windu and it made Jules from Pulp Fiction. Say what again.,86,9
"TIL Uwe Boll made a bid to direct the World of Warcraft film but was turned away by Blizzard, who said We will not sell the movie rights",87,4
Game Thread: New England Patriots (12-4) at Seattle Seahawks (12-4),88,4
Be quiet,89,3
Flawless logic.,90,3
What do you call a wife that knows where her husband is at all time?,91,4
"I love the evolution of the trooper helmet design, so I made a series of simple graphics showing the progression from early Mandalorian to the Episode 7 Stormtrooper",92,4
Team Rwanda see snow for the first ever time. - The one that started it all!,93,4
Gabi really took it to the next level here...,94,4
My rooting interests for The Big Game,95,4
Literal football fan spotted on CBS broadcast,96,4
Riot has been deleting the jokey passives like This unit is a mighty pirate hunter and This unit is a flippin Ninja in the past few patches!,97,7
Every time I discover a new band.,98,4
They say there's no such thing as bad publicity...,99,4
As a fat guy who has lost some weight...,100,4
"I live in a place called Portloe in Cornwall, UK. It's incredibly underrated.",101,4
"I am Natalie Bennett, Leader of the Green Party of England and Wales -- AMA",102,4
Still one of my favourite easter eggs,103,4
This gif,104,4
Religious people in a nutshell,105,4
Petra. Highly detailed recreation by mrc93,106,6
Watching a demolition,107,9
Meeting your girlfriend's father,108,4
The lab has jokes,109,0
I've married a winner,110,9
These shoes have a flipable part in the sole to reveal metal picks for grip when walking on ice.,111,9
"Croatia writes off debts of 60,000 poorest citizens",112,5
me irl,113,4
"Okay, you can come get me now.",114,4
"My first post on reddit, this is my best friend having a pretty awesome day",115,4
Voyager 1's approach to Jupiter over a period of 60 days,116,2
Was cooking on the barbie and this fella came along,117,4
"High adherence to Mediterranean Diet seems to be associated with a lower risk of incident ischemic stroke, new study shows",118,4
"Iraq's monument to the fallen Iraqi soldiers of the Iran-Iraq war. The Al-Shaheed Monument, Baghdad.",119,9
"Antti Niemi, who wears 31, is 31 years old, and just made 31 saves for his 31st career shutout on January 31",120,0
The face she makes when you catch her swimming in the pond right after a bath,121,4
WiFi-Adapter was overheating...,122,5
But I mean does he know,123,4
Such an awesome dude,124,4
In her element,125,6
"I'm a cashier, not your therapist.",126,4
Snow Leopard caught it's tail at the OKC zoo,127,4
Get your loved ones off Facebook,128,4
No campfire? no problem.,129,8
TV survival expert knows how to find his bearings.,130,2
Low Poly Dog,131,4
Frost growing on a fence,132,9
Found a dog and brought him home. My own dog never been happier,133,4
Disgraceful,134,9
PsBattle: Vince Vaughn and Owen Wilson eat ice cream,135,4
Piglet not using Masteries in C9 vs. TL?,136,4
Fleet Foxes - Mykonos [indie folk] (2008),137,9
"So, a buddy of mine came out of work to find this...",138,4
Otherwise I'll feel even dirtier.,139,4
My scumbag sister on my Mom's birthday,140,4
"[WP] Instead of Oceans, they are all big forests, that gets taller and darker instead of deeper, with more dangerous animals living further out in the forest. A person decides to cross the Mariana Trench",141,4
Two Lebanese men see snow for the first time and insist on shoveling their new neighbor's yard (x-post /r/canada),142,4
Aaron Rodgers wins MVP.,143,8
LEFFEN V MANGO. $1000. IT'S HAPPENING.,144,0
Some of you may remember the 10 year old kitty I adopted from my local shelter about a year ago. Here's an update!,145,4
Texas boy suspended for saying he could make classmate ‘disappear’ with ‘Lord of the Rings’ sorcery,146,4
Spongebob Squarepants logic in Stranded Deep,147,9
Color POV men vs. women,148,4
Every now and then tumblr gets it right.,149,4
Mythbusters video games special,150,4
Metal group Trivium's lead singer stops show immediately mid-song when seeing fan pass out in the pit.,151,4
Today is my day!,152,4
Worf is kind of a jerk.,153,1
Found this gem had to swipe right.,154,4
So I was watching Fast Five... Very subtle Star Wars Reference,155,9
Missed a few days of work due to contagious illness... (story in comments),156,4
DRAW ME LIKE ONE OF YOUR FRENCH GIRLS HOMIE,157,4
Santorin's combined score of TSM's two games this week was 0/0/23. He participated in 23 out of the 25 kills they had.,158,9
The engraving came out pretty good.,159,4
Ny cop draws gun on youths to stop a snowball fight,160,4
Sign at the local kids soft play park...,161,9
This cat discovers snow for the first time,162,4
Face Swap Optical Illusion,163,4
First escalator in Uzbekistan,164,4
It just makes sense,165,2
Why competitors open stores next to eachother,166,7
[Spoiler] The Ultimate Taunting Championship,167,9
Dad.. [picture],168,3
"[No Spoilers] Daenerys, Mother of Dragon Age. Someone from a PS4 community on FB made this.",169,9
Whenever I am at home,170,4
"I was consoling a drunk acquaintance, who was feeling lonely in a new college. Suggested she calls home more often.",171,4
the stink eye I always get whenever he catches me taking pictures of him,172,4
After explaining it to him he still thinks I'm at fault.,173,4
PsBattle: Boy watching television for first time through an appliance store window in 1948,174,4
This subreddit for the past couple of days.,175,4
Babysitter Needed,176,4
Don't trust cheap-ass tools,177,4
Got him,178,4
Chicky chicky boom,179,3
The sure to get your ass kicked bumper sticker,180,4
Seriously Blizz...fix Warsong Commander already FFS,181,1
LPT: Chill/Nearly Freeze an Orange to Make Peeling Easier and Eliminate Nearly All the Pith.,182,4
Tissue dispenser at my friends house,183,4
"Troll Hunter, A Norwegian Mockumentary about a man who hunts trolls, followed by a group of film students, surprising quality and hilarity.",184,9
Ed's onto something.,185,0
All you need is thumbs:,186,4
Bros v. Hoes,187,6
Want to play a game?,188,4
I take your Bobby Hill/Bro and raise you a Cotton Hill/random dude in parking lot.,189,4
TotalBiscuit:Every time you see a PC writer/Youtuber saying framerate doesn't matter,190,4
"Jesus, it's not funny! Give back the ball!",191,4
Every Nurses Wet Dream.,192,8
Dog running animation for a WIP mod of mine,193,4
I HAD THE TIME OF MY LIFE AND I NEVER FELT THIS WAY BEFORE,194,4
Glow in the Dark Room!,195,4
[Spoiler] Counter Logic Gaming vs Cloud 9 / NA LCS 2015 Spring Week 2 / Post-Match Discussion,196,9
Oh yeah I remember when woody gunned down everyone with an automatic rifle in toy story 3,197,4
The gaze into an abyss,198,8
15 years old but still my baby.,199,4
Rajon Rondo getting kneed in the face by a teammate,200,4
(Spoilers Aired) The magic behind dragons,201,4
TIL that Stephen Fry is the only person alive who knows why Douglas Adams chose 42 as the answer to Life,202,4
"Boogie printed, signed and mailed out EVERY tweet that voted for him into the all star game.",203,4
Patrick Star...,204,2
I thought this was common courtesy.,205,4
"US Young Adults Then and Now: Explore how the people age 18 to 34 have changed over the last four decades (by state, metro area, county)",206,4
My uncle from outta town wanted me to post his dog on the Internet for him. Reddit meet Lucky.,207,4
Five years dedicated love! Both from animal rescue.,208,4
Hyper voice,209,2
Chinese kids see a ginger for the first time.,210,4
That's why you don't pass on a blind corner,211,4
Physicists achieve superconductivity at room temperature,212,4
Found a Cheeto shaped like a double helix,213,4
Verizon Wireless to allow customers to actually opt-out of controversial supercookie tracking: Verizon really shouldn't be doing this in the first place and it should really be opt-in,214,4
Adopted this beautiful boy!,215,4
"In-depth weapons sats spreadsheet for PVP(TTK, Damage, RPM, perk table etc.) every legendary and exotic",216,2
I got a surprise in the mail today! American Doll liquid lipstick by Anastasia Beverly Hills.,217,4
I'll mark this down as a win.,218,4
Everything that is bad about the new drop system.,219,4
States which are based on religion confine their people in a circle of faith and fear... Secularism is the practical solution to lift countries out of the third world and into the first world. Saudi blogger Raif Badawi – sentenced to 1,220,4
RWBY has made its way to Netflix! Congrats to the whole RWBY team.,221,4
Game Thread: New England Patriots (12-4) at Seattle Seahawks (12-4) - Second Quarter,222,4
Legally Blind man sees for the first time in 20 years.,223,4
Tabletop RPG gaming (D&D) with a digital battle mat and physical minis,224,9
I was unfortunately one of those girls always drawing horses on everything... You could say I'm pretty well practised now at 23.,225,4
Someone got the Dragon Lore (FN) mission reward in my game today.,226,4
"Helen Mirren, 1970s",227,5
New glimmer farm/lootcave,228,4
"Boy watching TV for the first time in an appliance store window, 1948",229,4
"Nintendude in the ER, second Sezuire",230,9
Drew the state of Wyoming on my etch-a-sketch,231,9
Newfoundland is beautiful,232,4
Tristana's E looks a lot like the beginning of her rocket jump,233,4
Krabby's Secrets Finally Revealed,234,9
"Went to the Dodgers Fan Fest yesterday, hit up the $40 Mystery Grab Bag booth an just grabbed the first one I saw off the top. Started immediately hyperventilating.",235,4
Pediatricians Say Don't Lock Up Teenagers For Using Marijuana,236,4
Wiggins gets Lebron one on one,237,4
"I'm an American living in France. Here's a small sampling of what I've been eating and drinking these past few months, plus a few homemade dishes as well. This country knows how to eat.",238,4
Knock knock jokes,239,3
A little girl donates a dollar. Her mother is furious.,240,4
"Israeli medical marijuana creates buzz but no high: the marijuana is coveted for life-saving medical benefits for epileptic children, doctors say — without the high",241,1
"Well, I'm glad some people could resist the lures of the big game.",242,4
"She's the smallest, bravest, and my only cat willing to venture in the snow.",243,4
"Redditors that check behind the shower curtains whenever you enter the bathroom, what's your plan if a killer is actually there?",244,4
"Negative emotions (chronic stress, depressive symptoms, hostility) are associated with increased risk of stroke in middle-aged and older adults, University of Minnesota study shows",245,7
So my buddy was at a steakhouse in a small town in Texas and... Wu Tang.,246,9
NFL gets billions in subsidies from U.S. taxpayers,247,4
"TIL Pablo Escobar's cartel was, at one point, spending $2500/month on rubber bands to hold all their cash.",248,9
"An elderly man in my neighborhood had a heart attack while shoveling his driveway. Paramedics took him to the hospital, then returned to finish shoveling his driveway for him.",249,4
"Dear Katy Perry, I wore it better.",250,4
ZZ Top just posted this on Facebook,251,4
[AMA Request] Person Wearing Shark Costume at Katy Perry's Super Bowl Halftime Show,252,4
Too soon? [OC],253,4
New Spongebob Movie Poster spoofs Fifty Shades of Grey [xpost /r/spongebob],254,4
I woke up in the middle of the night to my cat singing me the song of his people.,255,4
"9 months ago, my 58 year old father was 340 lbs., had type II Diabetes and was being wheeled into an operating room to have heart surgery. As of today, after a change in diet and exercise he has reversed his Diabetes and is currently down to 237 lbs. Go, Dad, go.",256,4
At least I got one question right,257,4
As a European logging on to Reddit this morning,258,4
Katy Perry entering the halftime show,259,4
How I feel watching these super bowl commercials,260,4
Cat tries to intercept a pass,261,4
Katy Perry did fine but...,262,4
"Well played, Netflix. Happy Groundhog Day.",263,4
What about me?,264,4
11 Parodies of Oscar Nominated Film Posters,265,4
Katy Perry's halftime show outfit,266,4
Monty Oum has passed away,267,4
FOOTBALL!,268,0
PsBattle: This teacher from my Facebook feed.,269,4
The resemblance is uncanny...,270,6
Verizon's net neutrality nightmare is about to come true -- FCC will propose reclassifying ISPs under Title II,271,6
Black Wolf Hybrid,272,4
8am in Belfast City centre traffic,273,4
He's not alone,274,4
"A new guard for Asgard: Iceland building first temple to Norse gods in 1,000 years",275,4
"My accidental sacrifice in the name of art. Goodbye, eyelashes.",276,2
Shark on the left wasn't quite on his game,277,4
Selfie with Rihanna at the Superbowl,278,4
"Started playing Spider-man (SNES), and spotted this familiar looking character.",279,4
How not to display the gemstones you're selling online,280,4
Superbowl XLIV looks like the roman numeral version of ELI5,281,4
Underwater rodeo,282,4
I can see McDonald's Pay with lovin' campaign backfiring real quick,283,9
Spider-Man looks like he's had better days.,284,4
Anti-Vaccine Doctor: I Don't Care If My Kids Make Others Gravely Sick,285,4
"Involuntary quarantine okay, but vaccination not?",286,2
"From District 12, Katy Perry!",287,4
"Monty Oum, who worked on RvB and RWBY Passes Away at 33",288,5
Back to the Future was right.,289,4
Russian army girls,290,4
Everyone on reddit last night.,291,4
Aging sucks,292,0
"Drunk me is not a very smart man, but last night he did alright!",293,4
Every woman I've dated. Ever.,294,4
Looks like Slate is having a 'who can write the worst article' competition,295,4
Being immature in Vegas.,296,5
I'm British and living in America. Here's a small sampling of what I've been eating and drinking these past few months. This country knows how to eat.,297,4
JJ Watt - Standing box jump,298,4
I live in the north with a very long driveway. This is my current struggle,299,4
Everyone is talking about the sharks and nobody cares that this kid finally went pro.,300,4
Seattle fans right now,301,4
"IamA Martin Sheen, actor and activist - AMA!",302,4
I'll just help myself,303,4
How did I end up dating this girl?,304,4
This still boggles my mind,305,2
This Evil Dead beer I'm drinking has a ALC of 6.66%,306,9
I've made it mom! I'm going to be in the Super Bowl show!,307,4
"ELI5: When my cat sits on my touch lamp, i can use his nose as an on/off button. How does this work?",308,4
My sister's daughter to her mom...,309,4
TIFU By Wearing Pants,310,4
When you can't remember the word for an aquariam.,311,4
"You've come a long way, baby",312,4
How I flirt,313,6
Who's a good boy?!,314,2
It's time to check your reflexes Mr. Falcon,315,2
Seeing all the I wore it better posts...this one takes the cake.,316,4
When Russel Wilson sees Marshawn Lynch in the locker room,317,8
TIL in a review of the film Groundhog Day,318,4
Will you play with me?,319,4
Esurance: Breaking Bad commercial; Say My Name: Extended Cut,320,4
"Dear Reddit, please help me to find the rest of the Pet Fiction cast",321,4
McDonalds,322,7
"11 years later, and still my favourite easter egg.",323,4
"/u/Qohelethian, don't think we forgot about you buddy",324,4
It was only a matter of time,325,4
PLEASE KATY,326,4
I received these images from the ISS on 145.800MHz channel using RTL-SDR and a simple antenna.,327,4
My friend proposed under the Aurora,328,9
What are some things you should avoid doing during an interview?,329,4
Moroccan trilobite looks positively sci-fi,330,4
"Apparently, my Dad was the original Borat. [1989]",331,9
"Light is the fastest thing in the universe, but it still takes 43 minutes to just get to Jupiter. Here it is in real time. (x-post /r/cosmology)",332,4
Breakin the law,333,2
How I picture the people commenting on r/gonewild posts.,334,4
Hey Superman! Look what I found!!,335,4
Saw this masterpiece at a friends house yesterday. Very informative.,336,4
FCC on verge of killing state laws that harm municipal broadband,337,6
/r/hockey creates a SuperBowl game thread that confuses both football and hockey fans alike,338,4
Stairway of Paris Opera,339,6
Too soon? [OC],340,4
Pretty sure Katy Perry was using a Wii Remote lanyard on her microphone at the Super Bowl halftime show...,341,4
Rob Lowe's next commercial,342,4
Here's a summary of Katy Perry's Superbowl halftime performance,343,4
Amazing Save.,344,4
TIL that there's a religion based on the movie The Big Lebowski called Dudeism. Dudeism advocates and encourages the practice of going with the flow,345,4
Protestor,346,2
IAMA Palm Tree in the Super Bowl XLIX Halftime Performance featuring Katy Perry. AMA!,347,4
Apparently I bear some resemblance to my great great grandfather,348,4
Turbine interchange Jacksonville,349,9
This Menu Board,350,0
"TIL That the last two speakers of a dying Mexican language, Ayapaneco, refused to speak to each other because they didn't like each other",351,4
"Science Ama Series: I am Eugene Gu, CEO of Ganogen, Inc. I successfully transplanted human fetal kidneys and hearts into animals, which subsequently grew larger and matured. My hope is to end the shortage of donor organs. AMA!",352,4
Creationist Ken Ham is angry that Carnival referenced evolution during its Super Bowl ad -- Carnival used a speech from JFK when he said We are tied to the ocean. And when we go back to the sea,353,4
This is how my school advertises safe sex,354,4
The temperature app is not working,355,4
Huckabee: having to accept gay marriage is like telling Jews to serve 'bacon-wrapped shrimp',356,9
Someone is curious,357,9
I'm not Batman,358,4
"Viruses have merged with our DNA, and researchers can use them to better understand evolution and how we can resist cancer",359,4
Know when fruit is in season to save money,360,4
"I hate being bipolar, it's great",361,4
My take on the Super Bowl Halftime show.,362,4
Chipotle just throws them to the wolves,363,9
My 5 year old daughter this morning,364,4
"Teachers of Reddit, what's some behind the scenes drama you had to hide from your students?",365,4
Rest in peace Monty,366,7
"TIL that Cary Grant’s girlfriend convinced him to see Alice Cooper in concert. On the ride home, when she asked him what he thought of it, he said, “Remember I told you about the time I took LSD in my doctor's office and shat all over his rug and floor?… Well now I know how that poor doctor felt.",367,4
Mystery Unraveled,368,4
My first thought last night,369,4
Pete Carroll logic,370,7
Caught myself putting those social skills to work,371,4
All I am hearing is that Seattle made a terrible play call. But what about Malcolm Butler simply making a great play? The play call was fine. How often do you see an interception on a short slant?,372,4
Tropes vs Women Refund,373,9
"For sports fans who don't like hearing about how non-fans don't like sports, try to put yourself in their shoes just a little bit",374,4
Very Round Egg,375,7
Sh*ts and giggles is kind of cute,376,2
I recently got a job at an adult entertainment broadcasting company.,377,4
Kerbal the majestic Ragdoll,378,4
Leaping ray,379,4
"Gov. Rick Scott, a wealthy former businessman who put up millions of his money to help his two campaigns, is refusing to hand over detailed financial information that could answer whether he is violating a state ethics law",380,4
Sony Online Entertainment becomes Daybreak Game Company. Not affiliated with Sony anymore.,381,4
Passion Pit - Sleepyhead [Indietronica],382,7
This was just posted by my local doggy daycare. I don't think they looked very closely...,383,4
"My Husky, Linux, enjoying a stick while playing in the snow",384,4
This is the tip jar at the bar I'm at...,385,4
"In Peter Jackson's King Kong, Carl Denham suggests contacting Fay to play the main character of his film",386,4
[S4] The magic behind dragons!,387,4
"Dealership in Ohio wrecks customer's car, then threatens to sue for libel (story in comments) x-post from /r/Subaru",388,9
60 below in Canada!,389,2
"Sharks are great and all, but this guy was my favorite part of the Super Bowl.",390,4
I think I will go back to lurking. byebye,391,4
Got up early to wash last night's dishes before I left for work....came home to find this,392,4
"Mummified monk is ‘not dead’ and in rare meditative state, says expert",393,5
"Kristin Chenoweth: singer, actor, dancer from Broadway, film and TV! AMAA!",394,4
"Brigitte Helm cooling off on the set of Metropolis, 1927",395,6
Best advice for this time of year. How to walk on ice safely.,396,4
"What I found refreshing: it felt like the refs let the players play. No coaches' challenges, very few penalties, and fewer stoppages.",397,4
Superbowl XLIV Post Game Discussion Thread,398,4
What harsh truth has life taught you?,399,4
We adopted a kitten who was stood on by a drunk and now has very limited use of the back legs that she's adorably hugging onto while she naps.,400,0
"This was back in third grade, I was the only person in the room who knew what I was talking about.",401,4
No one wanted to come with me,402,4
After seeing how everyone is talking about the 970...,403,4
Going to cash in my change tomorrow. Will give gold to the first person that gets closest to the actual amount.,404,4
She found a friend.,405,4
