Title,doc,topic
This is why I have to avoid small talk,3361,4
scarra the noob coach,3362,0
"Waking up, and checking Facebook first thing in the morning on Valentine's Day...",3363,4
Cut in half Pyritized Ammonite,3364,4
Kids found this guy outside in the cold last night. I guess we have a cat now..,3365,4
Apparently I can be self conscious about literally anything,3366,4
That's how a Valentine's Day card should be,3367,4
[Image] Focus On You,3368,4
Air pollution from Europe and America is making the tropics drier. What we found was a distinct drying trend in Belize since 1850 that coincides with a steady rise in industrial aerosol emissions in North America and Europe.,3369,8
Bill would allow concealed weapons across state lines,3370,4
Because I hadn't seen Pam going King Kong in Archer as a GIF yet!,3371,4
Bernie Sanders: we are moving away from our democratic heritage into an oligarchic form of society — where were are experiencing a government of the billionaires,3372,4
me irl,3373,4
"When I was 12, I wanted to become a DJ. My mom knew, and she told my grandmother, who laughed in my face. Tomorrow night, I'm opening for Dada Life, a huge DJ duo touring worldwide.",3374,4
TIL: Mortal Kombat II was so popular when it hit the arcades that several of the machines were later installed with deadlock security panels on the back to prevent thieves from ripping the game's motherboard straight out of the machine and taking it home.,3375,4
My wife didn't appreciate my Valentine's day card...,3376,4
"16 hours later, she is recovering in a hospital bed after an emergency gall bladder removal surgery. Happy Valentine's Day and Anniversary to us!",3377,4
This guy made a 3d representation of his wifi signal strength. Really cool to watch.,3378,4
Classic,3379,2
Two Malaysian Airlines flights were responsible for 44% of all aircraft fatalities last year [OC],3380,4
Happy valentines <3,3381,4
Picking up girls with programming [post from /r/Tinder],3382,4
Having a SO on Reddit on Valentine's Day,3383,4
"Hey /r/minecraft, I spent the last few months building MineAtlas so you can see a map of your world.",3384,4
This gif reduces me to laughter everytime.,3385,3
"TIL Researchers in Tokyo have developed a mirror that tweaks the viewer's reflection in real-time to make it look like they're smiling. The projected application for this tech is for use in shopping mall bathrooms, in hopes that happier shoppers will buy more.",3386,4
My friend knows I love Mario Kart so she surprised me with this awesome present for my birthday!,3387,9
But I'm not a gross type,3388,4
Cats love pigs.,3389,2
Canadian Police Say They've Foiled Valentine's Day Mass Shooting Plot,3390,4
"In terms of difficulty, dedication, and reward, this is the final boss of Ocarina of Time.",3391,4
"Costco sells a dozen roses for $20.00 even on Valentines day, and they do not run out.",3392,4
"Alright, here's the plan: half of us work out nothing but our upper bodies, while the other focus entirely on legs. I'm talking beefy. Downright smuggling hams. Then, we all meet on a remote island to participate in a battle of wits. The winners get a used Chrysler LeBaron. Just the one, though.",3393,9
"Netflix, please never put ads/commercials in your shows [ALL].",3394,9
I hate my roommate ...,3395,4
My most common 1st world problem,3396,4
How many divorced men does it take to screw in a light bulb?,3397,4
My pencil snapped in a perfect pattern,3398,8
Call of Duty Player Talks About League of Legends!,3399,4
My Ex boyfriend had a bit of a problem with Tekken,3400,4
Everytime we stopped at a light he'd pop his little head out.,3401,4
[WP] Two people discover a fountain of youth. The problem is that upon drinking the water you turn back into an infant. The two decide to take turns raising each other in order to live forever until one day one of them decides to break this agreement.,3402,4
Bernie Sanders: Keeping US from Becoming Oligarchy Is ‘A Struggle We Must Win',3403,2
Pond Hockey at the Great Wall,3404,4
The Atomic Bomb,3405,2
ptr handshake attempt fail <3,3406,6
Parent's left on a flight for Hawaii yesterday,3407,4
I love these haha,3408,2
My friend drew me my favorite Pokemon,3409,4
"Dying Light 1.4.0 just went live, and part of its update is support for modded games and handling modded games online (modded and vanilla wont work, modded - modded will), and other performance improvements.",3410,4
The House of Eevee,3411,4
"TIL in order to save 140 tonnes of carbon annually in reduced transportation, British supermarket Sainsbury's shrunk the inner cardboard tube of all their toilet rolls by 11mm.",3412,2
Mechanical blinds flip open outward and rest horizontally,3413,7
A perfectly polished tungsten carbide tube,3414,3
Dealing with Genies [OC],3415,5
Beaded Deer Skull,3416,9
[ATLA] /r/onetruegod has come to us. . . the off-series is a hard time.,3417,4
Exactly my face when I opened the package.,3418,4
"Some people call me Maurice, cause I speak of the ṕ͜ǫ̡ḿ̵p̀͜͡i̵t͏̶u̡͡s ̴̨͢of̀ ̵̛T̴̢́h̴͜e҉̴́̕ ̛̀͏Ę̶͘͠͝ĺ͟d̕͢͟͏̧e̸̡̧̢ŕ͢ ́͘҉Ģ̸̶̛ǫ̶̛͡͡ḑ͢ś̵",3419,1
OKAY THIS IS TOO MUCH VALVE,3420,4
"YSK about Ninite.com, a website to safely, quickly, and easily download programs without bloatware.",3421,8
"[Spoiler] If we win, GIRLFREINDS for EVERYONE",3422,9
"California has tentatively approved Comcast's $45.2 billion acquisition of Time Warner Cable, but Comcast isn't entirely happy because some of the conditions demanded by the state create a more intrusive regulatory regime.",3423,9
"I'm not a bad tipper, I'm just really bad at math",3424,4
Glorious Shades of Grey (by k009 @ tumblr),3425,4
"Can't control me, Cadre!",3426,4
Never getting to Greenland...,3427,4
MRW My girlfriend says I can have a guys night instead of seeing 50 shades of grey with her,3428,4
Graham Norton Show - The only male audience member who has read 'Fifty Shades of Grey' shares his thoughts with the film's star Jamie Dornan,3429,9
How far is the horizon from a human point of view?,3430,4
Dew on a fungus,3431,5
This is how I feel about most people I meet,3432,4
Suddenly getting messages from a girl I hooked up with once 6 months ago.,3433,4
me irl,3434,4
Don't split your soul.,3435,6
Dunk Contest Drinking Game,3436,9
"I realize the pun but after almost getting hit crossing the street and subsequently flipped off, I'm going with the mallard",3437,4
Yeaaa 12 am valentines,3438,4
Damian Lillard spitting on Sway in the Morning,3439,6
Dwight has Valentine's Day figured out,3440,4
Its as big as the Sahara,3441,4
TIL a 12-year-old girl discovered that all except one US president is descended from 13th century King John of England.,3442,4
How to become a respected developer in today's gaming industry.,3443,4
Friend forgot what high tops were called.,3444,4
Girlfriend is a goldsmith and crafted me this for Valentine's Day!,3445,4
"My parents put our dog on a diet, this is now how he greets me when i come to visit.",3446,4
"I met Motzie today, the 2nd tallest cat in the world. 20lb 10 y/o Savannah breed.",3447,4
The things you find when moving into a new house.,3448,4
What do you fantasize about when you're bored?,3449,8
"1 dead, 3 cops wounded during terror attack on conference about free speech and art, in Copenhagen, Denmark. Terrorists still on the loose. (Danish article, no international articles yet)",3450,9
Bank Hackers Steal Millions via Malware -- the scope of this attack on more than 100 banks and other financial institutions in 30 nations could make it one of the largest bank thefts ever,3451,4
"TIL: Inspired by the character Lt. Uhura, Mae Jemison joined NASA and became the first African American woman in space, then later became the first real astronaut to appear on Star Trek.",3452,4
Sonic the hedgehog,3453,3
My handsome boy.,3454,2
Steve Irwin Mice Invasion Video. NOPE!,3455,4
Valentine's Day Advice,3456,4
A Valentine my friend drew,3457,4
Some hype for the TSM vs CLG rivalry match tmw!,3458,2
Let's Play Minecraft - Episode 142 - Legends Of The Hidden Tower,3459,4
Tsk Tsk,3460,8
This is Norton and he loves his ears rubbed.,3461,4
Ferris Bueller's Day Off pool mistake I noticed the other day when I was watching this.,3462,4
Jehovah’s Witnesses use 1st Amendment to hide child sex abuse claims,3463,4
New theory suggests Universe always existed,3464,4
I colorized this army mugshot of Elvis from the late 1950's. What do you think Reddit?,3465,4
John Wall vs. Steph Curry HORSE competition in 15 seconds,3466,4
What's a scam many people fall for?,3467,4
My Nana asked me to fix her phone because the outside clock is always showing the wrong time.,3468,4
"/r/funny seems really proud of it's 7,000,000+ subscribers, so I thought I'd make a pie chart to help bring the mods back down to Earth.",3469,4
Peanuts vs Plain nuts,3470,9
"He's real! Life, finds a way...",3471,4
[Spoiler] Counter Logic Gaming vs Team SoloMid / NA LCS 2015 Spring Week 4 / Post-Match Discussion,3472,9
This isn't even my final form!,3473,4
"oh, how the tables have turned...",3474,4
Me and my mini me,3475,3
F15 flyby in a valley at the lake district (UK),3476,9
Slam Dunk Contest winner does Space Jam dunk,3477,9
Props to the maids. And happy Valentine's day,3478,4
I got a new Kadabra plushie,3479,4
"My friend, one of the nicest people I know, waited on a couple on Valentine's. They left him this.",3480,4
Proposed to the love of my life today who I have known since birth. Needless to say we were both in tears.,3481,4
"My puppy just reunited with her brother, who she hasn't seen since we took her home 6 months ago. Needless to say they remembered each other",3482,4
Weatherman gets all amped up after catching Thundersnow on camera not only once,3483,9
"Rihanna looks like two small people, one on top of the other, trying to look older.",3484,4
"TIL identical twin boys were raised as a brother-sister pair (botched circumcision). The truth came when the one being raised as a girl INSISTED he was a boy; the parents admitted he was the subject of an experiment trying to prove gender identity was nurture, not nature. He later committed suicide.",3485,4
I made an adult pillow fort for my girlfriend yesterday,3486,4
Shiburrito,3487,2
What really happened that night.,3488,4
Katy Perry and I have the same taste in women,3489,4
Cartoon handbag. . .except it's real,3490,3
50 shades of me,3491,4
Somebody put these in the mens bathroom at the movie theater on valentines day,3492,4
We maintain proper respect in this house,3493,4
There should be a TV channel that shows failed TV pilot shows that most people have never seen.,3494,4
Golden Tortoise Beetle,3495,2
My daughter's boyfriend didn't get her anything for Valentine's day.,3496,4
Adult life in a nutshell,3497,4
Used a make up app on my 7 week old son...,3498,4
Hungry hungry hippos,3499,3
You know there's a handful of them out there...,3500,4
I get nervous for these two just looking at the picture.,3501,4
How to twerk,3502,5
ISIS in Libya releases a video of beheading 21 Egyptian Christians.,3503,9
What kind of immortality would you rather come true?,3504,4
Finally got a shiba.,3505,4
emergency Cheeto,3506,6
Resentment has mounted so much in South Korea against what has come to be known as gabjil,3507,4
Why is the person on the back of the cinnamon toast crunch box eating cereal with a fork,3508,4
Your move!,3509,5
Abandoned Russian house found in the woods,3510,4
Florida Everglades,3511,9
"My Grandfather's best friends in high school were troublemakers, not that this pic would imply it (1939)",3512,4
This guy's jersey.,3513,3
TIL Women and men who like the taste of beer are 60% more likely to have sex on the first date,3514,4
Co-worker just dropped these off with no context,3515,4
What a view!,3516,5
Would never get to play if she lived with me,3517,4
Petition to change the Canadian Flag,3518,0
The guy on my moving box looks really mean,3519,4
Askreddit in a nutshell,3520,4
This bothers me more than it should,3521,0
Somone stole our mailbox a few weeks ago. Found this today in our new one.,3522,4
"I bought my wife a dozen roses for valentine's day, she was not impressed",3523,4
Atomic Bomb,3524,2
"I love Canada, but seriously. This winter thing is (not) for the birds.",3525,4
The dog did it...,3526,4
She is too young to have a boyfriend. I'm constantly single.,3527,4
Elephant Rock in New Zealand,3528,4
My parent's dogs. Guess which one loves me.,3529,4
Gollum launches modeling career,3530,4
This snow and water separation,3531,4
"reddit's advice for everything, even if they are single.",3532,4
For pretty much everyone here tonight.,3533,4
50 shades of Home Depot,3534,4
My grandpa's old zippo next to my new one. Almost 60 years of difference,3535,4
Meet best buds Simba and Kip,3536,4
Now that's what I call a scary cloud,3537,4
"TIL after being caught by casino owners and prosecuted in court for cheating, the Hyland card counting team was acquitted of all charges after the judge ruled that the players' conduct was not cheating, but merely the use of intelligent strategy.",3538,4
So this is my life right now.,3539,4
Persistence,3540,0
"First image showing clouds in Neptune's atmosphere, taken by Voyager 2 in 1989",3541,4
Spongebob never ceases to amuse me,3542,9
"TIL that the Honeyguide bird leads humans (and other large mammals) to beehives. Once the hive is broken and the human has removed the honey, the bird can feed on the beeswax and larvae.",3543,4
So big blueberries,3544,4
"The National Security Agency listed Israel among a handful of nations considered to pose the “greatest threat” to American government, military and industrial secrets, classified documents leaked by Edward Snowden reveal.",3545,5
"TIL after cutting phone lines, snipers attacked a California power station, taking out 17 transformers. They disappeared one minute before the police arrived, never to be caught or identified.",3546,4
PsBattle: Albino deer family,3547,4
Your 80085 and 123456 pics are cute and all,3548,4
On a door at University,3549,4
Beaver walking about on two legs while carrying sticks,3550,4
Introducing the world's most offensive map,3551,4
My animal rescue just got the most unfortunate looking dog ever. He's my new favorite.,3552,4
Just overheard this from my 8 year old talking to his friend in the next room,3553,4
"Patty cake, patty cake, baker's man...",3554,0
Rocky the warrior at 8 weeks,3555,8
"Teddy Roosevelt's diary entry on the day he lost both his mother and his wife within hours. If you thought you were alone yesterday, it could be so much worse.",3556,4
Boston this morning.,3557,4
Solar powered clock...,3558,8
The dream of every referee...,3559,4
1968. How come this seems like yesterday? My yearbook pic.,3560,4
Mountain Lion,3561,5
Glazed donuts stuffed with chocolate chip cookie dough hand dipped in chocolate.,3562,0
TIFU talking to a girl.,3563,4
The real reason peasants hate 60 FPS Ft. TotalBiscuit,3564,2
"They were really nice, kind people.",3565,4
Zach LaVine goes between the legs for the reverse slam,3566,7
Shrek's Dank Kush,3567,3
TIL a man was cured of HIV in Germany via a bone marrow transplant from a donor whose gene mutation made him immune to HIV. That gene is relatively common in N. Europe. Researchers have speculated that the gene is the result of natural selection during diseases similar to small pox or Black Death,3568,4
My cat hates my brother. Like really really hates him.,3569,4
"Gamers, of Reddit; you learn upon your death that when you die, you are reincarnated as an NPC in a videogame. What games would be heaven and which would be hell?",3570,9
"Remember the Ukrainian redditor who awoke to a Russian rocket on his balcon and was accused of lying and being a propaganda account? Well, he delivers some proof.",3571,4
I've drawn a Minecraft village :),3572,4
Thanks random stranger for taking our photo.,3573,4
"For all the single Redditors out there, my doge will be your Valentine.",3574,0
Definitive proof that two characters are not the same person (Spoilers ADWD),3575,4
Shots fired near Copenhagen synagogue,3576,5
"This film clip was shot using 80 actors in one take on an 80 metre stretch of road in a car on a Phantom Flex 4K. Filmed at 1000fps, it was shot in 5 seconds for the 3:30 clip. FIVE SECONDS. WHAT.",3577,4
Jesus has his priorities straight,3578,7
Letter frequency in different languages [OC],3579,4
You are so cute!,3580,0
Are things like this even legal?,3581,4
Very smart redditor lets hobo know he's doing it wrong.,3582,4
Nutella owner Michele Ferrero dies at 89,3583,8
Made some teddy bear hot tub cookies with my little man.,3584,4
Foxes,3585,9
TIL a man was able to steal $10 million because bank employees kept an important code on a post-it on the wall.,3586,4
"I pushed the water button with my hand, thinking it would follow the ice. Water sprayed my hand and went everywhere",3587,4
Final Fantasy VII 1998 ad,3588,4
"Of all the princess and Frozen stuff in the Disney store, my daughter only wanted one thing, screamed until she got it. My wife is confused, I'm just proud of my little Wampa lover.",3589,4
How to peel an orange,3590,4
Our Hippie-Redneck Solar-heated Kiddo Swimmin' Pool. And Hot Tub.,3591,4
My german shepard Nymeria can sleep peacefully in any position.,3592,5
With the weather as bad as it is in the northeast i feel like more people need to understand this.,3593,4
Train rails preventing water from escaping.,3594,4
The annual reminder to EA.,3595,2
"As a women in my 30's, seeing the same man for a few weeks. I thought my Valentine's would end with more than a hug.",3596,4
Dog ate the steaks that going to get grilled for valentines dinner.,3597,4
Took my daughter to the dentist and they had this in the kids waiting area.,3598,4
A Rose From My Valentine,3599,9
Told a seal a good joke today,3600,4
Doing so often ends in embarrassment for everybody envolved,3601,4
5'7 kid spends 6 months attempting to dunk a basketball.,3602,4
"I was going to buy my mom a T-shirt from my university, but I don't want people getting the wrong idea.",3603,4
This bathroom has an electronic rating machine,3604,4
TIL that Johnny Cash's estate once refused permission for his hit Ring of Fire to be used in a commercial for haemorrhoid cream.,3605,4
Amazing thrift store find!,3606,9
There's a fossil in my windowsill,3607,4
Ever have one of those days?,3608,4
Franklin has a Red Dead book on his bookshelf (GTA V),3609,8
How To Tell If Your Valentine's Date Is Your True Love,3610,4
April Gloria's Astrid Cosplay,3611,9
Crows Understand Analogies: What birds can teach us about animal intelligence,3612,4
me irl,3613,4
me irl,3614,4
Don't understand why everyone made a big deal out of it,3615,4
Obama signs Executive Order -- Promoting Private Sector Cybersecurity Information Sharing,3616,4
Rayman Fake?,3617,9
With the weather as bad as it is in the northeast i feel like more people need to understand this. [Fixed],3618,4
Grassy waves,3619,0
I'm speechless.,3620,4
Friendly advice from Susan,3621,2
Can we not do this? You don't need a $5000 gaming rig to be considered part of the Master Race,3622,5
Zach LaVine goes BEHIND THE BACK for the dunk,3623,4
"TIL the world's fastest supercomputer (TH-2) requires 24 million Watts of power, but still needs to be about 100,000 times faster to match our 20 Watt brain.",3624,4
Needless to say he didn't know about it,3625,4
"CLG vs. TSM is gonna be tri-cast with Jatt, Kobe and Rivington.",3626,2
[Video] 5'7 kid spends 6 months attempting to dunk a basketball [xpost /r/videos],3627,4
World's smartest dog,3628,4
"If we were to discover life on other planets, wouldn't time be moving at a completely different pace for them due to relativity?",3629,4
13 year old schoolgirl gang raped by four men; her village classed her as a “black virgin” and ordered her killed: when her family refused they were all forced to flee.,3630,4
Kid locks himself out of a moving car,3631,4
ELI5:Do speakers of languages like Chinese have an equivalent of spelling a word to keep young children from understanding it?,3632,6
Geoff In A Ball Pit,3633,7
Train rails preventing water from escaping,3634,4
Video showing KennyS eating dinner with his love on Valentines day,3635,4
What is the most unflattering thing a person can do to themselves?,3636,4
Well placed ace.,3637,4
"My pops, circa 1985.",3638,0
So it's okay when you do it. Got it.,3639,4
I was really excited too,3640,4
"/u/Storieswithdad describes how a major LSD distributor got taken down by the feds and driven to suicide, all because of a chain reaction of events beginning with a 16-year-old girl getting busted with a joint.",3641,4
Very important in-game stats,3642,4
My favorite pick up line,3643,4
InstaDoom RC1 released. Doom w/ Instagram filters and a selfie-stick.,3644,6
"I didn't think I could laugh any harder...until she started snoring. World, here's my Boxer Reba.",3645,4
"Fifty years ago today, the red-and-white Maple Leaf became Canada's new national flag. Here's a look at some of the designs that didn't make the cut.",3646,4
Real pride in the jersey shown by the mascot in the England vs Italy rugby match yesterday,3647,4
Undulatus asperatus﻿,3648,5
ELI5: New theory says that the Big Bang might not have happened?,3649,4
Saw a wolf crossing the road today,3650,4
One of the most oddly satisfying things I have ever seen.,3651,4
My friend's kid is starting to have some doubts...,3652,4
Act lady like,3653,4
Well... that's one way to do it,3654,4
"Ooh, burn.",3655,7
"Please for the love of all that is holy, release the voice comms of the game TSM Vs CLG game",3656,2
"Talking to you, Mr. 91 Civic hatchback with cherry bomb exhaust...[fixed]",3657,2
[SKYRIM] He died before he could unstretch his bow,3658,8
Dog takes horse for a walk,3659,4
An accurate representation of my Valentines Day.,3660,4
Jesus dominated: Passion of the Christ opening day box office record beaten by 50 Shades of Grey,3661,4
This is how he sleeps when his face is cold,3662,4
All the snow not compacted by footprints were blown away.,3663,0
Mr. Budders has a new box,3664,4
Gulu-Gulu Cafe has the most relevant A-Frame Message in Massachusetts right now!,3665,4
PETER PREVC just did that terribly good [world record 250m],3666,2
Some sketches Ken Sugimori put up on his twitter,3667,9
There's a reason she didn't have a date on Valentine's Day,3668,4
Hot Dog V-Day dinner.,3669,4
My friend teaches at a middle school and had to confiscate this Valentine's day card.,3670,4
At least once a day as a stay at home dad,3671,4
Comedian and former convict tells funny story about preparing for a prison riot,3672,9
Swiss Army knives should have a blank blade on them that can be cut into a key,3673,9
Is this my new bed?,3674,4
You can't take the sky from me,3675,4
squad fresh af,3676,5
Big Telecom tried to kill net neutrality before it was even a concept,3677,4
Bad day at the office,3678,4
We all just wanted to melt into the floor,3679,5
The nice old lady at the Walmart Photo Center told me she really liked my poster.,3680,4
The cruelty of girls,3681,4
"My Valentine's Pizza Tattoo - Kelly McGrath. Art Alive - Archdale, NC",3682,4
Spending Valentine's Day in hospital isn't too bad when you know your 10 month old son is kicking open heart surgery in the ass. (Removed from /r/aww),3683,4
TIL The mother of serial killer Ted Bundy died in 2013 at 88. For many years she refused to believe her son could have murdered dozens of women and told him You'll always be my precious son right before his execution,3684,4
"TIL an Indiana man who repeatedly drugged his wife, raped her in her sleep, and videotaped the assaults over a three year period received no jail time, 8 years home confinement, and a 12 year suspended sentence. Prosecutors had asked for 40 years in prison.",3685,4
According to the ACLU,3686,4
THE NEW DRAGON,3687,4
Brain implants: Restoring memory with a microchip. The team now thinks that it will see a memory device being implanted in a small number of human volunteers within two years and available to patients in five to 10 years.,3688,4
Swim resort in Bali,3689,5
This is so Canadian,3690,0
Retro decal with matte finish on my Wii U,3691,9
My 11 year old gets braces tomorrow so I'm showing my support,3692,4
Cats sitting in weird positions will never not be funny,3693,4
"[AMA Request] Hotel Maids who worked today, the day after Valentine's Day",3694,4
I just went back to bed,3695,4
I've been playing WoW with my boyfriend for 10 years. He just gave me this.,3696,4
My GF got me a sweet candle in homage of St Neil on Valentine's Day.,3697,4
The James May Collection,3698,4
Wedding photo of original owner of our house built in 1915 found in crawl space,3699,4
Russian Armed Forces,3700,7
Well known historical photographs colorized.,3701,4
Zach LaVine says he didn't even bring out his best dunks for 2015 NBA All-Star contest and is open to returning next year to defend his title. I got some tricks in the bag still.,3702,7
Recently got a cat. As an insomniac I am extremely jealous.,3703,4
Beautiful.,3704,3
"TIL that Clair Patterson, the geochemist who discovered the Earth's age to be 4.5 billion years old using lead isotopic data from the Canyon Diablo meteorite, also spearheaded the campaigning of the US government to finally ban of the use of lead in gasoline, paint and food packaging.",3705,4
Bill Clinton Apologizes To Mexico For War On Drugs,3706,4
"Reddit, meet Stevie my new rescue kitty.",3707,4
'Murican Giving a Redcoat a History lesson in /r/AskReddit,3708,4
There should be a dollar store in the UK called Pound Town,3709,4
SO was told the women's bathroom was by the men's room.,3710,4
Galio E coded as wards,3711,7
As the father of two children under the age of 4,3712,4
Diagon Alley at night,3713,9
I love Donna's and Tom's friendship,3714,2
Million dollar skin idea riot.,3715,9
A mother listening to her deceased son's heartbeat inside the recipient the heart was donated to (story in comments),3716,9
