Title,doc,topic
"This is the look I wake up to every morning. He stares at me until I move or open my eyes, then his tail starts going crazy and the kisses start.",5211,4
Impossible standards for Pokemon trainers,5212,0
Behind the skyscrapers in Dubai,5213,4
Looked underneath my bed at the Hilton hotel...,5214,4
Found $300 in a parking lot last night. Got really excited until I looked closer...,5215,4
Oh hey,5216,4
When your friends hairy arm looks like a cat,5217,4
Two Bills Introduced in Congress to Legalize and Legitimize Marijuana on a Federal Level,5218,4
After putting my cereal into the microwave (twice) this week,5219,8
TIL Tom Green won 5 Raspberry Awards for Freddy Got Fingered in 2002. He showed up in a white Cadillac,5220,4
Failing to do this will ruin a friendship.,5221,0
West Ham Fans Taking A Dig at Chelsea Fans by Politely Letting A Black Man On Their Train,5222,4
Everyone watched him struggling to silence his phone.,5223,4
Matt Wheatcroft bounces his golf ball off a fence to get on the green,5224,4
Whenever I talk to a girl.,5225,4
Parents retract the birth announcement of their daughter in the newspaper from 1995,5226,4
Smoking halo,5227,4
I told him I loved him today,5228,4
I've been duped,5229,9
"35 years ago today, a group of unknown college kids took down the USSR.",5230,4
What do I do with my hands?,5231,4
This restaurant has a garbage can for both English and Pig-Latin speakers.,5232,2
Just rented a new place. Previous tenant left the wall mirror...and a dirty secret!,5233,4
My brother bought a pack of Angry Birds playing cards from a Chinese store and found this.,5234,4
MRW my bestfriend who promised me I'd never be replaced by his new girlfriend hasn't seen me in a month,5235,4
Found this neat Youtube account of a 91 years old woman cooking cheap meals from the depression. (x-post from /r/Food),5236,4
The Superfish problem is Microsoft's opportunity to fix a huge problem and have manufacturers ship their computers with a vanilla version of Windows. Versions of windows preloaded with crapware (and now malware) shouldn't even be a thing.,5237,4
The Struggle,5238,2
Start planning your financial future today. Here's some sound advice.,5239,4
My Dad took this with a point and shoot through a telescope,5240,4
Canadian Kids fighting over a puck.,5241,9
New HPV vaccine is effective against 9 strains of the virus,5242,4
"If it was discovered that one animal species had actually been aliens that have been spying on Earth this entire time, what species would you expect it to be?",5243,4
Peter Dinklage catches you up on Game of Thrones,5244,4
My son turned 9 today. When's the last time you were this excited?,5245,4
Americans are having more trouble paying off their student debt than their houses,5246,7
"Bit into a chocolate M&M, it was only layers of shell.",5247,0
Nice handwriting,5248,4
This is the first selfie I've ever received from my dad. I think he's enjoying his vacation.,5249,4
Beagle puppy + subway grate,5250,4
"My dad spent 30 years in the army - went to Ranger School, the Persian Gulf War, and the War in Afghanistan. As a newly-retired vet, he's been training for ultramarathons. This is him after completing a 50k in single-digit weather and heavy snow.",5251,4
Never realised this,5252,9
"I am Bassem Youssef, the Jon Stewart of the Middle East. AMA!",5253,8
UK artist Kendra Haste who creates reproductions of animals from chicken wire.,5254,4
"TIL that in 1746, Jean-Antoine Nollet conducted an experiment in which 200 monks formed a circle (1.6 km in circumference) and were linked by iron wire. He then had electricity pass through them which shocked all the monks simultaneously. He concluded that the speed of electricity was very high.",5255,6
"Thought I'd seen every It's Always Sunny episode, but I was wrong...!",5256,4
Because I'm a potato,5257,4
"I saw the post on biased benchmarks, and raise you with this guy.",5258,4
You did it guys.,5259,4
Remember the guy who tried to sabotage my job because he thought I was banging his girlfriend? I heard back from my boss.,5260,4
"Just found out about socially average penguin, just sounds way too much like me",5261,4
My friend's nephew made this birdhouse at camp...,5262,4
This puzzle is made to never be completed,5263,4
"The gray fox hasn't been seen in SF's Presidio since 2004. Park biologist caught a picture of one this weekend, hiding in a tree from a coyote prowling below.",5264,4
Disturbingly relatable tonight.,5265,4
So me and a lot of people have been making pasta wrong apparently.,5266,4
you had one job,5267,4
I can't find fault in this logic,5268,4
So we arrive at our villa for our honeymoon and this wonderful gentleman was there to greet us. He showed up on our deck every morning.,5269,9
"I drove 3 hours, skipped a night of sleep and stood out in 0°F to take this picture",5270,4
My roommate made him a hat...,5271,4
I 3D printed this tiny snowman mold,5272,4
Australia's Prime Minister admits the system let us down as the government releases the first report into the Sydney siege: A national security hotline received 18 calls about the self-styled cleric Man Haron Monis just days before he took 18 people hostage at a cafe in Sydney.,5273,4
Where camels go to drink,5274,4
Comedian Kurt Braunohler hired a sky writer to do this over LA,5275,9
I even told him that I loved him today,5276,4
Wiz Khalifa's password for everything should be BlackAndYellow and the hint should be You know what it is.,5277,2
So I made that spacetime coffee table from /r/pics a few months back,5278,4
The Washington Monument’s shadow on Google Maps moves throughout the day,5279,4
Charlotte Co. Jail is being investigated for recording attorney client meetings and sending the recordings to the State Attorney's Office,5280,6
World's Best Robber,5281,4
"Took our 17 week old beagle for two long walks, this was him after on the stairs to our apartment.",5282,4
Go to my friends house and find her kitty like this.,5283,4
"TIL In 1900, a German mathematician outlined a list of 23 unsolved problems in mathematics that he hoped would be solved in the 20th century. As of 2015, only 10 have been answered.",5284,4
Starbucks CEO: As an American,5285,9
"Deadly bomb blast hits peaceful rally in Kharkiv, Ukraine",5286,2
Who's the magician now?,5287,4
You had one job...,5288,4
Think Spring,5289,9
The small victories are what make the war worth fighting.,5290,4
"The Blessed/The Damned, Livio Scarpella, made of marble, quartz and amethyst, c. 2014",5291,9
Is this a joke?,5292,0
Mama bear rescues cub from highway,5293,4
He said the room was spinning and we wanted to help him - Drunk girls at party last night.,5294,4
Fire Dragon,5295,4
Where would be the worst place to all of a sudden go blind?,5296,4
Gnoosic - a recommendation website for music. It discovers new music for you. Type in 3 bands you like and it instantly suggests other music you will like.,5297,4
Barney synced up to Straight Outta Compton,5298,0
One of the racist Chelsea fans sought after the Paris metro incident is an ex-policeman and director of the World Human Rights Forum,5299,4
"I've been drawing and drawing and concepting for Days now. What do you guys think? Suggestions, before I start applying to the model? Thanks!",5300,4
Girls showing off their golf skills,5301,2
She's flexible? I'M flexib--,5302,4
"TIL the Cincinnati Library has 3D printers, audio and visual equipment, laser cutters and engravers, sewing machines, cameras and other hardware and software tools that patrons can use for free.",5303,4
Money Tip,5304,4
PsBattle: Baby floating above dark water,5305,4
"He said the bathroom was the second door on the left, but this is just an empty closet...",5306,4
Mom's going to be pissed...,5307,8
I am not a smart man,5308,4
LPT: Wake up at the same time every day of the week to avoid being groggy in the morning and tired in the day,5309,4
My dad took us to see Star Wars in this theater sometime during the summer of '77.,5310,9
"TIL in 1971, Saddam Hussein imported 95,000 tons of grain treated with fungicidal mercury. The grain was intended for planting, but the Iraqis, unable to understand the English and Spanish warnings or the skull and crossbones image",5311,4
Snowed in and decided to make scotch eggs.,5312,8
*Facepalm*. These god dammed noobs.,5313,2
"Hey....you awake?... Wake up, I'm hungry",5314,3
"This is an email from my RA my senior year at a small conservative, Christian university.",5315,9
I sell Bento Boxes. Here Are the Most Beautiful Photos taken by our customers.,5316,4
Poured Paint,5317,5
Someone had to do this.,5318,4
Florida Tribe Threatens Rick Scott: Let Us Build A Casino Or We Start Growing Pot,5319,4
Neptune and Triton,5320,8
35 years ago today a group of unknown college kids beat the USSR.,5321,4
True Story,5322,9
I forgot about this Ghostbusters cameo Casper.,5323,7
Sarlacc,5324,5
[Spoiler] Team Liquid vs Team SoloMid / NA LCS 2015 Week 5 / Post-Match Discussion,5325,9
Friend sent me this pic of a Sprinkler System in Nicaragua.,5326,4
The forever alone table at the pub that lets you watch yourself be sad and drunk,5327,4
"I REALLY needed this victory. Sorry if it isn't the right meme exactly, but I couldn't think of a more appropriate one.",5328,4
Found this neat Youtube account of a 91 years old woman cooking cheap meals from the depression.,5329,4
My boyfriend took me to Starwars night at a hockey game. They say don't meet your heroes but I was far from disappointed,5330,4
Tug of war,5331,4
"TIL, Comedian Lisa Lampanelli once pledged to donate $1,000 to gay charity in the name of the Waterboro Baptist Church of each of its members that showed up to protest her show. She ended up donating $50,000.",5332,9
"In my defense, the water came out really fast.",5333,4
Kingsman: The Secret Service Is The Best Action/Comedy Movie I've Seen In Years,5334,4
"My car just broke down, so my boss does this without any hesitation.",5335,4
The disappointment is real for that first moment.,5336,4
As a male nurse going for his dinner...,5337,4
My beer foam looks like a dinosaur,5338,4
We see touchdown celebration GIFs all the time. Who has the best sack celebration? My vote goes to Aldon Smith.,5339,4
New level of slide to unlock,5340,4
"TIL that the saying 'blood is thicker than water' may have once been 'the blood of the covenant is thicker than the water of the womb', meaning that friends are actually more important than family",5341,4
"ELI5 Why do we frequently end words with 'y' when we're talking with children, i.e. mommy, daddy, doggy, kitty? Also, is this just an English language thing, or are there similar instances of this in other languages?",5342,2
It's because you're not on PC,5343,4
Kirk Cameron and Saving Christmas sweep major Razzie awards: Worst picture,5344,4
Forgotten fossil is a new species - A forgotten museum specimen mistaken for a plaster copy is found to be the fossilized remains of a new species of ancient reptile.,5345,4
Aubrey Plaza accepting an award on behalf of Amy Poehler,5346,5
A Baby Cockatiels First 30 Days,5347,4
"If any great Scientist had died as a child, other scientists would have eventually made their discoveries. If any great Writer had died as a child, no one else would ever have written their books.",5348,4
Tyson at his unhittable best.,5349,9
ELI5:What is the difference between regular soap and shampoo? Is that long list of chemicals actually doing a better job of cleaning my hair?,5350,4
Live. Love. Laugh. (GTAV),5351,5
Insane J.R. Smith oop + great Cavs bench reaction,5352,9
'The Blessed and the Damned',5353,9
Sticker,5354,4
Barney is in a fitness magazine!,5355,0
filtered water,5356,4
A Python programmer attempting Java,5357,4
TIL it takes 600 cows to make one full season's worth of NFL footballs.,5358,4
Bunny tries to take nap in bowl of water,5359,4
Last Game of Spectate Faker. Forced shutdown :(,5360,4
This cat looks like Hitler,5361,4
My friend's son pointed out that Rachel Dawes (TDK) looks like Princess Leia wearing Han Solo's clothing... I'm inclined to agree,5362,4
"Oh, you're resting, I'll just squish right..in..here.",5363,4
"Tower Bridge, London",5364,8
"German music group sends DMCA takedown against Python, EFF, TorProject, Red Hat, Ubuntu and others",5365,4
Found on a baby changing station,5366,4
Balls.,5367,3
That's not how file formats work.,5368,6
He is 100% smiling. This is Flake by the way...,5369,4
On a truck in my malls parking lot,5370,4
But wait there's more! - Furniture for a bedroom in a box,5371,4
The Darkest Dungeon is being illegally sold on the Windows Game Store.,5372,4
The motion capture for the famous Metal Gear Solid 3: Snake Eater revolver scene is equally as bad-ass as the actual scene.,5373,5
"We all have our limits for pause times, bud",5374,1
NEW Fallout comic- The reason why Johnny Guitar is played on the radio so much,5375,4
Start a rumor that Taylor Swift is dating Louis CK (more in text),5376,2
I guess there's still some good in the world.,5377,4
"This little guy is a stray, we take him in on really cold days and nights. We have two dogs, so the only place we can keep him is in the bathroom",5378,4
"19 aircraft were refused use of Irish airspace or airports in 2014 over concerns they were carrying indiscriminate military hardware like cluster bombs | The mainly US planes, classed as civilian, were rejected on advice from the Department of Foreign Affairs and forced to re-route.",5379,4
Sea Jewels,5380,2
Mr. Meeseeks I would like a meme,5381,4
"As a college student with depression, this is my weekend",5382,4
How I Feel Posting Between Months Of Lurking,5383,4
Bad day,5384,4
Thank God Mr. Incredible ended up marrying Elastigirl. He probably would have killed anyone else he tried to have sex with...,5385,2
"TARS, what's your minecraft setting?",5386,4
I told my cat not to wait up when I left tonight....came back and found her like this,5387,4
PsBattle: My dog Rina in action,5388,4
Sleepin on a cloud.,5389,7
22:22:22 22/2 22.2°C,5390,3
I was searching 'bamboo' and hit enter too fast and was presented with this... I'm not even mad.,5391,4
Great Advertising,5392,4
Rich Gang schooling more nerds in OCE,5393,9
Chickangea,5394,7
"This Week in Science: Searching for Life on Europa, X-Ray Vision, A Mystery Cloud on Mars, and More!",5395,9
Mom got snowed in. She did this with the snow that was blocking her from leaving the house.,5396,4
2015 is a delightfully palindromic binary number 11111011111,5397,9
"A sign up the street from my local Wal-Mart here in Clarkston, Washington.",5398,9
What do I do with my hands?!,5399,3
College dean gets box of fake IDs meant for student named Dean,5400,4
Donkey Kong,5401,0
Damn Australians,5402,4
"My church-going, doctor dad started acting weird and mentioning strange lights.",5403,4
Cat alarm clock,5404,4
Told you might like my photo,5405,4
A pretty depressing night,5406,4
OP delivers on pictures of himself sneaking into the set of gone girl,5407,4
My new waterproof case is going to be fun!,5408,4
My sneakers are the same colour as this floor paint.,5409,3
"No, Honey. I'm just going to have one beer.",5410,4
"What two fictional characters, when paired as roommates, would make for the funniest sitcom?",5411,4
[Haiku] The Year of the Sheep Anthem,5412,9
She said she hates Steve Carell,5413,4
Just like Mom used to make,5414,4
What is the smallest thing anyone can do to make you insanely angry?,5415,4
The adorable face of absolute defeat,5416,4
"dump him, date me :(",5417,4
I was finally able to say what I've always wanted to say.,5418,4
This pie chart in a local newspaper,5419,6
Anyone need anything glued?,5420,4
"Sister's friend snapped this, thought you might enjoy: Venus, Mars, and the Moon dancing at dusk",5421,4
Why does hot water make more bubbles than cold when I'm washing my hands?,5422,4
"Missouri Lawmakers Propose Banning Public From Viewing Footage From Police Body Cams - The bill, introduced by Sen. Doug Libla (R), would make all footage recorded by police officers, including dashboard and body cameras, exempt from the state’s open records law.",5423,9
Found this while cleaning my aunt's house.,5424,4
Theater accidentally shows 'Fifty Shades of Grey' instead of new Spongebob Squarepants movie,5425,9
Happy Birthday to Steve Irwin,5426,4
Evil shoes (found on /r/funny),5427,4
Spot On!,5428,0
"300 Days 'til Star Wars. Here, have some troops.",5429,9
Took a picture of my girlfriend out in the snow today.,5430,4
Europeans solved this problem ages ago.,5431,4
KSP Pacific Rim Jaeger,5432,5
Elijah Wood. Upvote this picture and Google Image Search will show this picture of Elijah Wood.,5433,4
I am very smart Twitter page,5434,9
Skyrim Is Very Serious,5435,7
Steam Addiction,5436,4
brrmmm,5437,3
I'm so high up!,5438,4
My 14 year old brother's rendition of the mythical Boogeyman,5439,4
BMO & Bender from Futurama: Fresh Boyz,5440,5
Got 'em,5441,4
Canadian Sniper [parody trailer],5442,0
So what do you want me to do then?,5443,4
D-Link’s scary looking new routers are ready to deliver insanely fast Wi-Fi speeds,5444,4
A stranger at my college made me cry today.,5445,4
Make Ohmwrecker open the gates!,5446,4
"This video shows how aggressive swooping Magpies can be in Australia, and how I developed agoraphobia.",5447,2
"[US] Dredd (2012)- In a dystopic future where street cops are judge, jury and executioner, gang members attempt to stop one of the more ruthless judges. But they picked a fight with the wrong judge... LAST CHANCE TO WATCH BEFORE IT EXPIRES TOMORROW NIGHT (2/23)!",5448,4
He's Disconnected! Get him!,5449,4
"We are Edward Snowden, Laura Poitras and Glenn Greenwald from the Oscar-winning documentary CITIZENFOUR. AUAA.",5450,5
My ice maker works. So I got that goin for me which is ice,5451,4
My 6 year old cousin was the DJ at his mom's wedding the other night. I would say this majestic shot summed up his night.,5452,4
This is not a painting. This is the Namib desert.,5453,5
A woman asked me why I was wearing sunglasses when it is winter.,5454,4
Best college football sign ever!,5455,4
My bike was stolen today. I don't know who the bigger idiot was.,5456,4
Clearing the pool table in style,5457,4
( ͡° ͜ʖ ͡°),5458,8
First time my cat has seen a watermelon.,5459,4
Hard Drive Half-pipe,5460,4
Friend laid this doozy on me the other day,5461,4
He made his bed and ofcourse he had to lay in it...,5462,4
Caught my dog running with purpose,5463,4
Ping pong snuff out,5464,0
My wife and I have been together for 7 years. Today she tells me that she has this....,5465,4
 I must go. My people need me ,5466,4
"Musk claims Apple has been offering top car-battery experts a $250,000 signing bonus plus salaries 60 percent higher than what they currently earn for Apple Cars.",5467,4
"TIL Genghis Khan would marry off a daughter to the king of an allied nation, dismissing his other wives. Then he would assign his new son-in-law to military duty in the Mongol wars, while the daughter took over the rule. Most sons-in-law died in combat, giving him shield around the Mongol lands",5468,4
"Police seized more than $24 million in assets from Michiganders in 2013, under asset forfeiture laws. In many cases the citizens were never charged with a crime but lost their property anyway.",5469,9
I happen to be able to make car noises. Ford hired me.,5470,4
Bruce Lee door lock.,5471,1
It makes sense to me...,5472,4
"There's a massive new leak of confidential spy files from MI6, Mossad and the FSB",5473,4
We're safe. I found a backup.,5474,4
A man and his Corgi,5475,4
The voices behind the Peanuts characters,5476,4
Ahh the good old days,5477,4
"Nothing more, nothing less",5478,9
"Seriously, what did I do?",5479,2
"Phone Thief, Skill level: MAX",5480,4
Breakdown of Men's Tape Measure Usage,5481,5
Just the right amount,5482,4
Meteorologist braves the storm to bring you the news,5483,7
"TIL Dr Phil hasn't had a license to practice psychology professionally for 9 years, and considers himself retired from psychology.",5484,9
Am I a pretty princess yet?,5485,4
MRW I'm reading the Snowden AMA and my internet connection stops working,5486,4
Here is a goat on top of a goat.,5487,4
Netflix is the most successful anti-piracy program ever intiated.,5488,9
Emma Stone doesn't need your real Oscar.,5489,4
Edward Snowden writes an impromptu manifesto on how citizens should respond when legality becomes distinct from morality,5490,5
Somebody tagged our building over the weekend... I added something to it...,5491,4
The snow on my table spins around as it melts,5492,4
God damnit.,5493,2
Sometimes I come to reddit and I'm like,5494,4
China to credit Ukraine for $3.6 bln to reduce dependence on Russian gas,5495,5
"Roughly $3,000,000 after inflation",5496,4
Lady Gaga - Performance of 'The sound of Music' soundtrack at The Oscars [Classical],5497,9
the monkey in the back is my spirit animal,5498,4
Sometimes You Get a Little Too Comfortable Working From Home,5499,4
The phrase Do go on contains 3 different pronunciations of the letter 'o',5500,4
Reddit meet Maximus (then and now),5501,4
I was cleaning some space on the DVR. Now I remember why I taped this......,5502,4
When expanding the picture makes it smaller...,5503,2
Feast - Disney's short that just won Best Animated Short Film.,5504,4
Brought a souvenir back from Kyoto and kitty went catzilla on it,5505,4
Since the Oscars didn't honor him. Here is Richard Kiel.,5506,9
My wife took a picture of a hawk on a snowy day.,5507,4
There aren't a whole lot of billionaires around there...,5508,4
It's unjust towards peanut fans everywhere!,5509,4
"'Citizenfour,' the Edward Snowden documentary, wins an Oscar",5510,5
"Another year, the same result.",5511,4
"Comcast, Walmart, E.A, etc.",5512,5
"Aww, that's cu... ewww",5513,4
Catsitting for a friend. They asked how things were going. Sent them this.,5514,4
Beer bottle under changing light colors,5515,2
Jesus' first miracle was bringing alcohol to a party.,5516,4
Women will know the feeling,5517,4
Deep injection of wastewater is the primary cause of the dramatic rise in detected earthquakes... in the central U.S.  - US Geological Survey,5518,4
"He doesn't cook and means well, so I didn't ask questions.",5519,4
Best Robin Williams impression I have seen,5520,4
Clever advertising,5521,4
I was hired to do a design for Charles M. Schulz's Peanuts team. I decided to draw Snoopy on a Hoverboard.,5522,4
"Literally saved me $1500, you should try it!",5523,4
"TIL: 1968, Olympic long jumper Bob Beamon's first attempt exceed the limit of the official measuring equipment. It took over 15 minutes before a distance was posted, and only then did he realize he had broken the world record by nearly 2 feet (0.6m).",5524,4
TIFU by pissing off a squeaker.,5525,2
How a Video Games Company pleased my Girlfriend more than I ever could (How Customer Support SHOULD be done),5526,4
So this came through work tonight.,5527,4
What is one thing you thought existed but it actually doesn't?,5528,4
Scott Walker’s spineless silence On two occasions in recent days,5529,0
Presto chango!,5530,2
"Earth and moon, as photographed by an Expedition 24 crew member.",5531,4
We rescued a puppy yesterday. This is Lou on his way home!,5532,4
Democrats want to add right to vote to the Constitution,5533,4
Homestead Selfie,5534,9
"New study: Marijuana may be even safer than previously thought, researchers say",5535,4
Shadows of leaves from a tree during a solar eclipse,5536,4
"Photo of my brother dressed as a robot is 50 years old this month, Feb 1965",5537,4
I couldn't find him all morning. Then the leaves began to shake...,5538,4
The water bowl must be empty,5539,4
Rick from Pawn Stars calls you in to be an expert. What is your expertise and the item you are examining ?,5540,4
A terrorist is holding dad at gunpoint,5541,9
I think I found myself a definite keeper.,5542,4
...I think I'll pass. [Alien: Isolation],5543,4
When you don't let your Pokemon evolve,5544,8
Puppy love..and one patient cat,5545,4
Are beans your life?,5546,4
Just try to stop me,5547,4
Tree farm,5548,4
MRW my girlfriend breaks up with me and my boys come over to cheer me up.,5549,4
Australia’s first carbon-positive prefab house produces more energy than it consumes,5550,4
John Travolta not letting go of Idina Menzel's face [gif],5551,4
My grandma thinks she should quit painting because nobody would like them. I told her that there are some people on the internet that just might.,5552,4
It's even got teeth,5553,4
Edward Snowden documentary Citizenfour wins Oscar,5554,5
His face says it all...,5555,4
My cat is also a Hoarder. We found her stash while cleaning under the furniture.,5556,4
Retired U.S. Army Sgt. throws the first pitch,5557,9
"TIL Genghis Khan killed an estimated 40 million people, resulting in a man-made climate change. The Mongol invasion effectively cooled the planet, scrubbing around 700 million tons of carbon from the atmosphere.",5558,4
One of the more manly men's rooms I've been in.,5559,4
TIL that soldiers are required to route step (or walk out of step) when crossing bridges because,5560,9
I made a series of Sailor Moon inspired desserts. There's one for each of the ten major Senshi.,5561,4
Luke Skywalker puppet used by ILM to achieve the leap from the carbon-freezing chamber in The Empire Strikes Back,5562,0
She waited a whole year for this moment.,5563,4
Beyoncé getting complimented (0:04),5564,0
Sesame Street did a House of Cards Parody and it's amazing.,5565,1
[S4] The outcome in a better world...,5566,4
"Honestly, THIS is why books gets pirated. Stop being so greedy Amazon!",5567,9
Would you like fries with that ass-whoopin'?! (Soul Caliber 5),5568,4
"[Serious] People who have been in a viral video/photo, how has it affected your life for the better or worse?",5569,4
I tried the CoD:AW trial on Steam and two guys got into a fight over voice chat.,5570,4
Tried getting out there again after a 4 year relationship and this happened....,5571,9
My Limbo sleeve by Aleksandr Grey Hartsyz,5572,2
