Title,doc,topic
Lady blamed me for running a red light. The video doesn't lie.,1499,9
Hooray! I'm a dog!,1500,4
Our prayers have been answered...,1501,4
cmon lets play,1502,4
MRW I hear Netflix and Nintendo are working together on a Legend of Zelda tv series,1503,4
Top UN Official Says 'Global War on Terror' Is Laying Waste to Human Rights:Battling terrorism shouldn’t justify torture or mass surveillance,1504,0
"Today i'm moving, so I decided to leave a little present for the next tenants.",1505,4
Introducing chia Groot,1506,4
Why you shouldn't agree to dogsit when you have a robot vacuum,1507,9
Good Samaritan tackles off-duty LMPD officer during alleged beating : I noticed he had her in a choke hold and he was standing behind her and her feet were barely touching the ground and I didn't know if he was trying to kill her or what.,1508,4
I know she had to be crazy to go on a date with me but damn..,1509,4
"Cop makes other officer turn off dash cam to threaten couples lives, recieves 30 day unpaid Suspension. NO Criminal Charges Files",1510,4
Definitely wasn't expecting this!,1511,0
First blood! Double kill! Triple kill!,1512,2
"TIL in studies where random Monopoly players were given twice the money as their opponents, they began to act rudely towards other players and argued that they used strategy and skill to achieve victory.",1513,4
My apartment community has a hidden color color palette,1514,4
How I picture everyone on reddit,1515,4
My friend at the gym everybody.,1516,9
"9 controllers, 8 different games, 2 copies of Mario Kart, 2 copies of Strikers...and nobody brought their GameCube.",1517,4
Awesome bunk beds,1518,8
Rain (cross)check on the first date,1519,4
Move Over Usain,1520,2
This hostess stand. Come on.,1521,4
I wanna hold your hand. Could you not?,1522,4
"‘Darwinian’ test uncovers an antidepressant’s hidden toxicity. Rodent study finds that exposure to an antidepressant in womb or in youth can cause lifetime decline in sexual behavior, body weight, and competitive ability.",1523,0
Girl Scouts are the ONLY door to door salesmen that make me want to say Where the hell have you been?! when they show up,1524,4
I don't know how much longer I can cuddle him before he rips my eyes out (x-post from r/cats),1525,4
MRW I see my username mentioned in a thread,1526,4
Nope nope nope nope,1527,7
What popular subreddit has a really toxic community?,1528,4
After 128 years the torch finally went out.,1529,4
Mikey liked it... to excess.,1530,4
Battlebots is back! Get your robot ready!,1531,3
"Old Chocolates are just as adorable as babies! My best old man, Hobbes.",1532,4
Das my jam,1533,2
didn't ever notice that...,1534,4
Survival of the fittest,1535,2
Introduced the new GF to the roomies today,1536,4
MRW I'm lying in bed but I remember that I have an essay due for the next day,1537,4
I was the first person in the convenience store this morning.,1538,4
Dad's can do hair too :-),1539,1
I'm going to miss Brian Williams during his hiatus. He always had the most entertaining stories.,1540,4
McRib and Shamrock shake,1541,8
"Shibas, shibas everywhere.",1542,8
I see what you did they're,1543,4
"As a dyslexic, in school back in the day this was a real problem...",1544,4
"i is so sorry you must always take bath, weird cat.",1545,4
Best Dating Profile Ever.,1546,4
Taking a leap of faith,1547,4
Mario and Sonic? I had this guy...,1548,3
Hitman cat takes no pleasure in his job.,1549,4
My kid's school sent home a note telling us to discard this month's lunch menu. Here's what was on the menu.,1550,4
PsBattle: My tortoise trying to eat a bolt.,1551,4
Just looking through some Amazon reviews and I saw this.,1552,4
The knight can visit each square on a chess board exactly once,1553,0
Anthony Davis hits the game winning three.,1554,4
"Damn girl, you're diabolical!",1555,4
Leg day struggles,1556,0
IamA Lazaro Dubrocq (One of the kids that read to George Bush on 9/11) AMA!,1557,9
Mass breakout from Brazilian jail after female inmates in fantasy police costumes seduce prison wardens,1558,9
"This was taken in the county lockup, you'll never guess the charge.",1559,6
When they take a nap on your favorite pillow and somehow it just exploded while they're sleeping.,1560,4
Cannabis use in patients with a psychotic disorder has a long-lasting negative effect on illness outcome,1561,4
I found an original Crapper toilet,1562,9
Spotted at the Stop&Shop,1563,4
New US poster for Neill Blomkamp's Chappie.,1564,4
Was installing a mod for Thief: Deadly Shadows when I decided to read the agreement for once and saw this...,1565,4
My local news asking the important questions.,1566,6
[Poetry] Plane,1567,4
Hamster got a pool ring,1568,4
"If someone with schizophrenia was hallucinating that someone was sat on a chair in front of them, and then looked at the chair through a video camera, would the person still appear to be there?",1569,4
Retail,1570,1
"Bronies, a visual metaphor.",1571,9
Germany is battling a measles outbreak that is 10 times worse than the one in the U.S.,1572,4
ELI5:How did vanilla come to be associated with white/yellow even though vanilla is black?,1573,4
Good without god... Then there's Pat Robertson,1574,4
Princess Cake my wife made from cupcake for our daughter's 4th birthday party.,1575,4
"My son came back from the future, and sat at the next table.",1576,4
Why is this always the case?,1577,4
"Turns out I wasn't weird, I was just ahead of my time",1578,4
Something tells me that you don't...,1579,4
Whenever I go to close the garage when I leave my house (when you see it),1580,4
My cat gave birth to 6 kittens. Here's one of them staring into your soul.,1581,4
Floridians forced to sell their homes at huge losses. A state law can force some Floridians out of their condo units for only a fraction of what they originally paid.,1582,4
Pac Man gets it,1583,4
Cat? What cat?,1584,6
Conservatives want to rewrite the history of the Crusades for modern political ends,1585,4
Angry Veteran To Republicans: ‘Don’t You Dare Thank Me For My Military Service’,1586,2
My buddy got snowed in and his power has been out for 3 days. This is his solution to stay warm.,1587,4
The thrift shop gods truly smiled at me today (X-post to /r/pics).,1588,8
Because nobody else touches my baby,1589,4
Disney's Pocket Princesses,1590,0
Just saw this girl who apparently hates shopping,1591,4
Redditor captures the essence of awkward in a response to a Writing Prompt,1592,4
ITAP of a koala looking at the sea,1593,2
I don't know how much longer I can cuddle him before he rips my eyes out,1594,4
I just can't think of a clever title for this...,1595,4
"I already told you, it was the cat!",1596,4
What's for dinner?,1597,4
Jus' chillin' brah. - Dying Light,1598,8
So fluffy it hurts. And just a little cute.,1599,4
My friend Corey does hair and makeup.,1600,9
TIFU by being deaf.,1601,2
How to say I love you best without using the word love ?,1602,4
Don't think he enjoys Caturday as much as Reddit...,1603,4
EVERY SINGLE SHACO,1604,4
Mmm love that hospital restaurant,1605,8
My grandparents on their wedding day. Mexico 1953,1606,4
Wasted talent,1607,3
Leadership of Australia,1608,2
Stumbled upon this gem today while browsing.,1609,4
Dad discovers speech-to-text. My brother's name is TJ.,1610,4
"Pls fix clouds, literally unplayable",1611,7
Samuel Forest has raised over $450k on GoFundMe to help raise his son with Down Syndrome after his wife asked for a divorce in the delivery room.,1612,4
Got to avoid those lawsuits...,1613,4
"Anti-Tesla Motors states win 2014 Luddite Award - The states of Arizona, Michigan, New Jersey and Texas have won the 2014 Luddite Award for their efforts to prevent Tesla Motors (NASDAQ:TSLA) from opening stores in their states to sell cars directly to consumers.",1614,9
[Image] I hated every minute of training...,1615,4
Had a go at a face swap.. What have i created?,1616,4
we have all endured,1617,5
White girls be like...,1618,4
"We are proud to introduce HaroldCoin, the best new online currency!",1619,4
Dying veteran donates his home to Habitat for Humanity so another veteran's family can move in,1620,4
I did the fabled hit an arrow with another arrow causing the aluminium to banana peel out in a 1 in a million effect.,1621,9
Local Radio Shack closing and had 90% off. This is the clerk holding my receipt.,1622,9
TIL Google is offering $20 million to any private team that can land on the moon by New Year's Eve of 2016,1623,4
Guess I am making guacamole,1624,4
Why do you never wear two monocles at the same time?,1625,9
Every Super Bowl Losing teams unused winning logo from the past 20 years,1626,4
TIL a cat has predicted the deaths of 25 residents in a nursing home in the US. The cat displayed sudden affection for dying residents,1627,9
Apparently my rabbit is an artist...,1628,7
Quote from my buddy whenever we play Dynasty Warriors and encounter Lu Bu...,1629,4
"TIL the only perfect diamond ever found was found in Arkansas. Scoring a 0/0/0 on the AGS grading, its considered to be one-in-a-billion.",1630,4
I was supposed to die in there. IT WAS MY DESTINY!,1631,9
I've never been one for good timing nor by any means am I a ladies man.,1632,4
Little girls eating warheads,1633,4
"Apparently, the authors of Interesting NPCs are fans of reddit.",1634,7
So... Free samples?,1635,5
My hotel room had a heated panel behind the bathroom mirror to stop it from steaming up after a shower.,1636,4
How reliable is your car brand? Toyota/Lexus and Honda/Acura tops at any age.,1637,5
How they make fences,1638,4
Adopted my first dog today! Everyone meet Whiskey!,1639,4
16 Foot 5 Ton Glass Canoe in the Bavarian Forest,1640,8
This old fellow lives at a local animal hospital. He's 22!,1641,4
This Chris Pratt guy is all over the front page.,1642,9
[WP] A permanent storm rages across a planet. The only inhabitants are nomads who constantly travel inside the eye of the storm.,1643,4
The game hasn't even been released yet and there are already 3 dlc packs that will be available for purchase,1644,4
My Grandma worked at RTX in 2013. Monty saw her working and asked if he could take a picture with her.,1645,4
"I'm actually really good at my job, but ...",1646,4
Dolphin Emulator: Changing games to be 60 FPS,1647,2
Unbelievably squared-off cloud.,1648,7
Friberg: Counter-Strike should not be played BO1,1649,4
What's something that will soon be obsolete?,1650,4
She turns 1 today!,1651,4
Neil Armstrong's purse: First moonwalker had hidden bag of Apollo 11 artifacts,1652,6
"Well, my Halo 4 disk got scratched and now you can only hear the grunts from when you die.",1653,4
Great White Shark smashes its way into a shark cage,1654,4
What if maps did this (or something similar) on your very first game?,1655,4
Avocad-owned,1656,3
he walked right into this one...,1657,4
What is the most interesting thing within 10 ft/3 m of you?,1658,4
If you make something easier for yourself they call you lazy. If you make something easier for everyone else they call you a genius.,1659,4
Leafs set a franchise record with their 11th consecutive loss.,1660,4
"TIL German Chocolate Cake is not German, its from Texas, named after the German Chocolate used in the cake",1661,4
Sometimes Craigslist pays off.,1662,2
As a single 25 year old male,1663,4
Unhealthy for Them,1664,3
A real American sniper unloads on “American Sniper” - We are talking about human beings and I hate quantifying that. Each life is so precious. We destroy that every time. One was too many,1665,4
"Reuse old calendars for that cool retro look in your office or home. This year you can use calendars from 2009, 1998, 1987, 1981, 1970, 1959, 1953, 1942, 1931, and 1925.",1666,4
It takes two to rebuild a relationship.,1667,4
Boat on a clear river.,1668,2
You won't believe how the Conservative party is using clickbait!,1669,4
Who else feels like taking a break from Destiny until the next expansion?,1670,4
Appa,1671,9
15 years old this month. She was part of the family before there was a family. Goodbye Cactus,1672,4
Explosion + shockwave,1673,9
"Well Done, Bro",1674,4
Millencolin - No Cigar [Punk],1675,9
Just happened to look over and saw this guy smiling at me,1676,4
Meet Gladys. Missing 3 days. She was found 20 miles from home in field hanging out with her new cow friends.,1677,4
When we Right-click on a card to take a closer look,1678,4
Good Guy OnStar,1679,4
Clever.,1680,2
Obama riles right with accurate remarks at Prayer Breakfast: remember that during the Crusades and the Inquisition,1681,4
Capable Is My Middle name,1682,4
reverse condemn stun,1683,8
I can't wait to see what shows up.,1684,4
KUNG FU,1685,0
This is a team actually playing in the new OPL... (Oceanic LCS),1686,4
"As a white man, I had no idea how to respond",1687,4
I am on the USA Skeleton World Cup team. This is my helmet.,1688,4
MRW girls on this sub talk about not finding Childfree men,1689,4
"US Surgeon General Admits Science Is Real, Says Marijuana Has Medical Benefits | VICE |",1690,1
"Damn it mom. How about not, and say you did?",1691,4
Realistic Tec-9 Magazine,1692,7
Such a satisfying sound - M1 Garand Ping,1693,2
What bands do you think are ruined by the vocals?,1694,4
If raiding guilds were actually honest,1695,3
"Just found you guys, I think I like it here",1696,4
The thrift shop gods truly smiled upon me today.,1697,8
LPT Request: How to not become the outsider of a group?,1698,9
do you even lift bro?,1699,4
"Bend, but don't break.",1700,3
Instructions in white text?,1701,4
"If Hitler was Hitler today, and Hitler cloning machine. You hold world hostage with Hitler Clone Hitler Unlimited Hitler. What hold hostage with exchange for Hitler Hitler?",1702,4
[Other] Clickbait stepping their game up,1703,4
Charlie Work is now the #1 rated episode on IMDb,1704,9
Console and PC #6: GabeN,1705,4
Binding a book in denim.,1706,4
"The Fellowship of the Ring gathers for the first time after being cast, 1999",1707,4
The people in my apartment building are so clever!!!,1708,4
TIL Newton's flaming laser sword is a philosophical razor that states anything that cannot be settled by experiment is not worthy of debating.,1709,9
Expanding foam sealant developed a slow leak. Kind of beautiful.,1710,4
BBC reporter accidentally interviews former Liverpool keeper,1711,9
Payne & Lynch (GTA5),1712,4
The pangolin is the world's most trafficked animal. It's currently threatened with extinction because of trafficking.,1713,8
Special edition controller for Resident Evil 4 [x-post r/gaming],1714,4
This drives me crazy. Some people have different needs.,1715,4
"Nujabes - Aruarian Dance [instrumenta hip-hop] Happy birthday, Seba Jun.",1716,2
Bird touches wrong wire and explodes,1717,4
All these complaining about DJ Sona's body on PBE makes me wonder...,1718,9
My husband and I were cuddling in bed and turned to see our three doxies having a cuddlefest of their own,1719,4
"YSK that if you're an adult without a record of a childhood measles vaccine, there's a blood test that can check your immunity.",1720,4
"I was inspired by some of you guys & girls on here, and built my own desk & PC!",1721,4
Got bored and decided to make the flag of every country in the world using wool.,1722,4
Honey Sriracha Chicken Wraps - Best thing I've tasted in a looong time,1723,4
Jerry Rice on Stickum use: All players did it.,1724,4
Any backyard mechanic will understand,1725,4
"Pope says it’s okay to smack your children, says a good father is able to “correct with firmness”",1726,4
TIL That there was a guy named John Titor who was supposedly a time traveler from the year of 2036. He said that in his timeline in the year of 2015 there will be World War III. Also someone patented his time machine sketches - http://www.freepatentsonline.com/20060073976.pdf,1727,4
An observation on how Abzan/Junk makes 28% of the Pro Tour meta,1728,1
You can't lose what you never had [OC],1729,4
Seeing a movie with a scary scene,1730,4
I downloaded SnapChat a couple months ago and I'm pretty disappointed.,1731,4
"Piranha plant by Darion Griffith, Golden Lotus, Little Rock, AR",1732,5
Two British Children appear to describe ritual sexual abuse and child sacrifice.,1733,4
"Tax havens such as Bermuda, Jersey and Guernsey will have six months to open their books or face international blacklisting if Labour wins the General Election in May, Ed Miliband has vowed.",1734,9
"Thanks to PC gaming, I have finally achieved my dream of becoming a rocket surgeon.",1735,4
I like my computer way too much..,1736,4
I know how to stand up for myself.,1737,4
The authentic Soloqueue experience,1738,4
"Small sketch of The Lich, thought you guys might enjoy :] (OC)",1739,4
"Dude, how we gonna go to the park if he can't shut the door?",1740,4
My friends' dog made a new friend at the beach today,1741,4
190 year old pub in Belfast,1742,4
When Anti-vaccers claim their process is working,1743,9
"6 months since injury. They got a piece of me, just a piece. :)",1744,4
I was shoveling outside work the other day... and a kid came out with his mom after buying a kids size shovel. Just trying to be nice.,1745,4
College was the worst.,1746,4
"Antibiotics that target mitochondria effectively eradicate cancer stem cells, across multiple tumor types: Treating cancer like an infectious disease | Lamb",1747,4
This screenshot of FFXV looks more real than real life.,1748,4
Viking burial mounds in Denmark,1749,2
This T-Shirt is beautiful,1750,4
Details of the hand of David.,1751,4
Oh the humanity,1752,6
"TIL that war pigs were used in ancient warfare, to counter against war elephants, which feared the pigs (and their squeals) and would bolt. War pigs were sometimes lit on fire to enhance this effect.",1753,4
This happened at the gym today,1754,4
Mine isn't for another 3 months...,1755,4
Spotify should have a setting to remove all Clean versions of albums.,1756,4
"You asked for a Mango burrito, here it is.",1757,4
"Well, at least my cousin TRIED to keep people in check at her wedding reception...",1758,4
I left the bathroom door open and came in to find this...,1759,4
Best. Headline. Ever.,1760,4
MRW I remember an awkward moment from my early teens,1761,4
"My friend got these for her birthday, they almost work too well...",1762,4
My brother is having some colon issues and is getting lots of tests. I drew him something to cheer him up.,1763,4
"Don't lie, I know you do the same thing! Confess now!!",1764,9
"Fresh Goat, less than 2 weeks old",1765,4
Built my daughter a VW bus bed for around $100. She loved it.,1766,4
"Cool, stone age phone cases",1767,6
"TIL Nissan.com is not owned by the car company, but by a single guy named Uzi Nissan. He has been fighting the car company in court since 1999",1768,4
"'SpongeBob 2' Soaks Up $56M Weekend, 50% of the audience was over 18. New childhood cartoon reboots on the way?",1769,5
I can't believe it... I'm on display!,1770,4
Grammys are tonight. If they are there just remember.,1771,4
I found this old picture of me on christmas 1998. I had no idea what greatness awaited,1772,4
Nailed it,1773,4
TIL Goldman Sachs complained to Microsoft that Word always autocorrected Goldman Sachs to Goddamn Sachs,1774,6
Over 500 rabbis urge Israel to stop demolition of Palestinian homes. Rabbis for Human Rights (RHR) say Benjamin Netanyahu's stance is against “international law and Jewish tradition.”,1775,3
"This is mango, my hot-baths-lover-lovebird, she turned 1 yesterday!",1776,9
Jamaica Passes Landmark Marijuana Law On The 70th Birthday Of Bob Marley,1777,4
My cat is sitting on her haunches with her front legs apart.,1778,4
"Toys R Us should change their mascot from a giraffe to a dinosaur, a Toysaurus.",1779,9
My brother just came home with a new puppy.,1780,4
"One pill, 10 years: Kentucky high court reviews vet's sentence. An injured Gulf War veteran with no prior felony record, Kidd was convicted of drug trafficking in a controlled substance in 2009 for selling a single pill and sentenced to 10 years in prison.",1781,4
"Severus Snape's most important scenes and arcs in the Harry Potter film series in chronological order, from meeting Lily to his memory living on in a name",1782,4
Rush hour in rural Ireland,1783,4
My all-time favorite photobomb,1784,9
"Jordan: Approximately 7,000 IS members killed in strikes",1785,2
That's one way to play volleyball..,1786,4
How do they justify this anymore?,1787,9
Haven't you got anything smaller?,1788,4
"If you could sell years of your life for $1m per year, how many years would you sell?",1789,4
"What to wear to the Grammy awards, according to the band Mastodon.",1790,4
Drain in airport restroom is a little airplane,1791,4
me irl,1792,4
Sexual Taboo Survey Results [OC],1793,0
"MRW I'm binge watching a series on Netflix and the main character's life is in danger, but there are still 4 seasons left in the show",1794,4
The nuclear test Operation Teapot's effects on houses,1795,6
I got cho back homey.,1796,4
Usain Bolt posing with his winning tortoise at a tortoise race,1797,2
r/aww needs more bulls,1798,7
"Intel CFO: We're so far ahead, Apple's performance would be seriously hindered if it stopped working with us",1799,4
The Earth in Infrared,1800,4
Some people say Calgary spent too much on their Peace Bridge. I say it makes a nice $25 million wedding photograph,1801,4
These are not the droids you are looking for.,1802,2
Things you find the morning after your Australian housemate got hammered,1803,4
Wait a second....,1804,9
Our tax return got rejected because our deceased infant son's social security number had already been filed...,1805,4
"reddit, meet my friend.",1806,4
This Anti-vaxxer children’s book is getting destroyed in Amazon troll campaign,1807,9
Do we have to keep it?,1808,6
You can stare a cow in the eye whilst ordering a hamburger at this drive thru,1809,1
Our cat is beautiful.,1810,3
[AMA Request] The girls from 2 girls one cup.,1811,4
Anti-vaccine megachurch hit by measles outbreak now offering free vaccinations.,1812,4
Why A4 is better than US Letter,1813,4
My spiral cutter leaves potato mushrooms after making hash browns,1814,9
Finnish Passport has flip-book animation,1815,7
"Stingray visits spider-crab horde, has lunch",1816,1
Driving 180km/h in a city. Oh wait...,1817,2
Only art people will get this!!!!,1818,4
The right’s crusade against Obama Such is the daggers-drawn state of political discourse in Washington these days that President Obama could go to the National Prayer Breakfast,1819,4
12 worthwhile films from last year that you (actually) may have missed,1820,9
Never skip leg day,1821,0
"Portrait of Usain Bolt, the Human Cheetah, Graphite",1822,0
Shel Silverstein warned me about this...,1823,5
Peter Pan,1824,7
So that's why there's a long line for the restroom..,1825,4
The power of Hubble,1826,4
Why is Pavlov's hair so soft?,1827,1
This happened at a hockey game. I guess I had it coming being a fan of the away team.,1828,4
Milky way and Lion King,1829,4
That got dark fast,1830,4
"Looked at a property for sale last night. House was empty, but smelled funny. Found a full litter box in the kitchen and a cat with cabin fever on the 2nd floor. Didn't buy house. Did take cat. His name is Scoopy.",1831,4
Teen who gets his kicks confusing others with his thesaurus,1832,2
Reversible Covers are my favorite surprises of buying physical copies of games.,1833,8
Cat walk,1834,4
Anyone else experienced this?,1835,4
My engineering professor is building me a custom watch.,1836,4
Is it safe?,1837,6
"This generation, always on their phones!",1838,4
"One potato, two potato, three potato, four!",1839,4
I guess I'm 25 years to early,1840,4
heh,1841,2
Nobody walked away a winner in this exchange [Fixed Censoring],1842,9
The woman who alleges that she was made to have sex with Prince Andrew when she was 17 has told a court she believes US authorities hold video footage of her having underage sex with powerful associates of Andrew’s friend Jeffrey Epstein.,1843,4
"You Teach Me, and I'll Teach You... (Disney Meets Pokémon by Kuitsuku)",1844,4
Excuse me sir...,1845,6
"TIL Originally all humans were lactose intolerant, and those who aren't lactose intolerant are the ones with a mutation.",1846,8
Near death airplane collision with skydiver in free fall,1847,4
Tequila > love,1848,9
Not enough room for the two of us!,1849,4
We'll just have my parents look after her...,1850,4
I'm an idiot...,1851,4
My dog slipped and I laughed at him...,1852,4
"Yeah, I should stop. But she truly thinks shes helping out the environment",1853,8
"Samsung: Our Smart TVs record your living room chatter, also passes them onto third parties",1854,4
Batman gets it,1855,4
Money we leave on our desks kept going missing... We finally found the culprit,1856,4
Surprised my gf by taking her to a donut shop where a custom big donut awaited her and asked the question. She said yes!,1857,4
Hnnnnngggggg,1858,6
Took me five years to finish it but I finally built my dream car. My 950whp 1994 Toyota Supra 6spd.,1859,4
Hey guess what.,1860,4
HSBC files show how Swiss bank helped clients dodge taxes and hide millions,1861,4
MRW I play the whole music library on shuffle and my favourite song comes first,1862,4
Freezing Bubbles,1863,4
Popping over the sofa to see you!,1864,4
For the greatest catch in the history of football,1865,4
My favorite Futurama joke,1866,4
Reddit Co-founder Aaron Swartz stood up for freedom and fairness – and was hounded to his death,1867,4
Brian Williams at the D-Day landing.,1868,0
I Regret Ever Working In The South Pole.,1869,4
TIL Bill Murray had no scripted lines in Caddyshack and improvised all his lines,1870,4
TIL The Black Death resulted in a stronger and longer-living human population. Scientists examined the bones of those who died before and after the plague and determined that people who were born after were stronger and more fit.,1871,4
The numbers on Zilean's Q clock are wrong.,1872,6
Han Solo fridge door,1873,4
