Title,doc,topic
TIL Since 1995 7Eleven has provided more than 6 million coupons to police departments across the country to ticket young people caught in random acts of kindness dubbed Operation Chill,5651,2
[FOTD] One year ago vs todayI owe my life to you guys <3,5652,2
Fla official says he was punished for using ‘climate change’ in report Bibler was then suspended for two days and told to get a mental health exam before returning to work,5653,2
The Longsleeve Polo  The most versatile shirt you dont already own  12 Looks  2 Shirts [Original Content],5654,2
Its called being broke because you dont work,5655,2
YSK About a host of scam emails doing the rounds [again] claiming to be from PayPal This one is especially polished,5656,7
Waking The Demon Photomanipulation [1268x1200],5657,1
Last year I posted this picture of a friends great grandmother She spent the day with her sisters after having recently beaten cancer Today I was able to tell her shed become famous,5658,2
Stop fighting,5659,7
me irl,5660,8
[Spoilers] Someone had to do it,5661,2
Cuba booming as tourists flock there before Americans come,5662,2
Tossing a container of water into a crater of lava,5663,4
Majority of Canadians oppose state surveillance new report says,5664,2
Very Serious Full AP Teemo Montage  Kshaway,5665,4
My cat is always so full of awewonderpure dread when the doorbell rings,5666,4
My sister bought a HP envy 14K110eo touch laptop that came with web waltz installed This is spyware similar to superfish from Lenovo [Xpost from rbuildapc],5667,1
Baby Owl Getting Scratched,5668,2
I mean at least Ive got Ds goin for me,5669,2
Cloud 9 Lucian Cosplay,5670,9
10 Year Veteran Coin Got it right here,5671,2
Woman manipulated the criminal justice system in hopes of getting custody of her child Judge Judy sees right through her Ex wins case without saying a word,5672,2
5 years later ‘Obamacare’ critics can’t believe their lying eyes,5673,2
TIL theres a food truck in New York that sells a $666 burger called the Douche Burger They wanted to make a burger and pile all the rich people stuff on it and it would be the douchiest thing in the world”,5674,2
I went from 362 lbs to 170 in under a year With pictures,5675,2
How to win an argument,5676,2
Family photo from 2009,5677,2
What if a shooting star is actually somebody driving off rainbow road,5678,2
meow,5679,0
Kerbal looking fluffy,5680,4
So this happened tonight,5681,7
Got my wife today,5682,2
My cats new fav spot to rest his head,5683,2
(No Spoilers) Game of Thrones showrunners confirm TV show will overtake the books making bookreaders lives a spoiler nightmare,5684,7
Too Far Gone,5685,2
MRW I see a beautifully made gif,5686,2
I guess I should take you home now,5687,2
[Cities Skylines] An efficient way to take a curve [xpost from rCitiesSkylines]  [012],5688,1
To date Tom Cruise has been directed by Martin Scorsese Paul Thomas Anderson Stanley Kubrick Steven Spielberg Rob Reiner Oliver Stone Francis Ford Coppola Brian De Palma Any other actors have such an impressive and diverse resume,5689,6
Dead center,5690,7
MRW I go to the strip club for the first time,5691,2
Paul George Cleared By Doctors To Play,5692,2
The Last Supper  Finland edition,5693,2
One of Nikes First Ads  There is no finish line,5694,7
The best restaurant name,5695,2
Awesome artwork  Annoyotron vs Deathwing,5696,2
james bond gosu,5697,8
me irl,5698,8
Twitch Blog Possible breach Passwords & stream keys need to be reset on next login and accounts connected to YouTube & Twitter need to be reconnected,5699,2
Then and Now Version 20,5700,7
ukinyutaka decodes a cool nugget (likely) planted by JK Rowling in The Sorcerers Stone,5701,4
Batman Arkham Knight gets a slight delay  now launching 23rd June,5702,7
So I was thinking of naming my son Julian,5703,2
When You Run Out of Drugs (Shooterwilliamson)[309],5704,2
EA bought a million fake likes from Thailand for Origins Facebook page,5705,2
American Doctors Are Killing Themselves and No One Is Talking About It It’s estimated that at least 400 US doctors kill themselves every year Many are struggling with depression,5706,2
[Forza Horizon 2] Here comes Peter Cottontail,5707,7
Guys thats not OPs grandmother Heres the original uncropped version with the photographers name intact,5708,2
The realest thing Ive heard all day and It was at the roast of Justin Beiber,5709,2
Heres an old picture I found of my grandfather He was in the Navy,5710,2
He was sad playtime was over and he had to go inside,5711,2
For those of you that were curious,5712,7
An open letter to American cable companies who are now trying to sue the FCC over net neutrality,5713,2
Airliner crashes in French Alps,5714,6
Cats’ reaction to seeing the ceiling fan move for the first time,5715,2
There was no tape draped across a finish line but NASA is celebrating a win The agencys Mars Exploration Rover Opportunity completed its first Red Planet marathon Tuesday  26219 miles (42195 kilometers)  with a finish time of roughly 11 years and two months,5716,2
House Introduces Bill to Repeal the Patriot Act,5717,2
Parents letting their children play on the Vietnam Womens Memorial Right in front of Veterans,5718,2
My housemates used Faceswap and we were not disappointed with the results,5719,1
Woman Held For 8 Days In Psych Ward For Saying Obama Follows Her On Twitter… Even Though He Does,5720,2
Livin a dogs life,5721,2
When I casually tell my boss its my 8 year work anniversary,5722,2
[Image] Focus on what really matters to you,5723,2
Super Troopers 2 Pitch,5724,2
David Hasselhoff calls Sharknado 3 “the worst movie you have ever seen” confirms return for Sharknado 4,5725,2
So true Valve so true,5726,7
CNNs reaction upon hearing about ANOTHER plane crash,5727,8
Not a cat person but I just couldnt not take her home,5728,2
Revenge is a dish best served cold,5729,2
The greatest chew toy of all time,5730,2
I have no idea why I made this,5731,2
Wassabi Woman,5732,7
Neighbor kid getting a little too handsy with my daughter,5733,2
Street name,5734,2
To the guy who got a call back 10 minutes after applying for a job,5735,2
I set a trap for my girlfriend in my sock drawer on laundry day she fell for it,5736,2
This snakes defense mechanism is to become a treble clef,5737,2
[Serious] Professors what is the most simple thing students do which grants them your respect or annoys you to death,5738,2
Unsung hero,5739,2
Just dont make eye contact,5740,7
Grandpas creepy Level Expert,5741,2
We are Jay Chandrasekhar Paul Soter Steve Lemme Erik Stolhanske and Kevin Heffernan of BROKEN LIZARD  AUA,5742,6
Jesus take the wheel,5743,2
Im not a relationship expert But come on dude youre playing with fire,5744,2
A girl I know got bored in class and drew this guys shirt,5745,2
Water balloon physics,5746,2
Google Fiber Is Expanding To Salt Lake City,5747,2
Well that escalated quickly,5748,2
This hotel thinks of everything,5749,2
Too young,5750,2
My cat looks like toothless the dragon,5751,2
I painted my boombox,5752,0
I started a new job this week Im so hungry,5753,2
The government is revising its definition of what it means to farm meaning some people who receive farm subsidies but dont do any of the work would receive less government cash,5754,2
Two students from a nearby University created a device that uses sound waves to extinguish fires,5755,2
The best way to a mans heart,5756,2
Incredible 301 yard bow and arrow shot,5757,7
TIFU by not wearing any clothes,5758,4
Homer Simpson shares his secret to a long term marriage,5759,2
Costa Rica is now running completely on renewable energy Costa Rica is running without having to burn a single fossil fuel and it’s been doing so for 75 straight days,5760,6
Live with a gay guy they said Itll be fun they said,5761,2
My girlfriend told me all guys are shallow I told her Im not because Im dating her and she isnt all that attractive,5762,2
I made a Sunset Riders hoodie ),5763,2
Some guy at our school wrote this today We all went home,5764,2
Please dont Pull in front of big trucks,5765,2
Frost on windshield this morning looks like choppy oceanscape,5766,2
Surprise Another Christian Terrorist Did you hear about the man who entered New Orleans’ airport with explosives and a machete No Well you would have if he’d been Muslim,5767,2
Math,5768,2
My coworker flipped off the nicest girl,5769,2
Let yourself in,5770,2
ELI5 When we use antibacterial soap that kills 9999% of bacteria are we not just selecting only the strongest and most resistant bacteria to repopulate our hands,5771,8
This is how my local tire shop keeps their used tires,5772,2
And they wonder why he doesnt talk to them,5773,7
Philadelphia Cops Shoot and Kill People at Six Times the Rate of the NYPD A new Justice Department report details the use of deadly force by Philly police officers,5774,7
Hey im Madeon im french and I make electronic music  AMA,5775,2
When using just the pool table isnt enough for a trick shot,5776,2
Brutal but fair,5777,4
For the last three years my girlfriend has had an egg dying party before Easter I van Gogh every year,5778,2
Tie Fighter Incredible animated Star Wars Short by Paul Johnson finally finished,5779,7
Ap Shaco Montage ft Pink Ward,5780,4
I think we all know someone like this,5781,2
Internet arguments in real life,5782,2
A fully connected 6way interchange,5783,1
Cost of carbon should be 200% higher today say economists This is because says the study climate change could have sudden and irreversible impacts which have not to date been factored into economic modelling,5784,2
Water (blue) + Sun (yellow) = Plants (green),5785,6
A friend on facebook posted this,5786,2
TIL Real life castaway drifted into the Pacific Ocean for 13 months surviving off rainwater fish and sea turtles Several large ships saw him but refused to help him He eventually drifted to land,5787,2
I got tired of people at working asking permission to take one,5788,2
Disappearing Dress,5789,0
My cats reaction to seeing the ceiling fan move for the first time (MIC),5790,2
Big mama and Tod,5791,2
Multitasking is Glorious,5792,4
Im not entirely sure how I should feel about this,5793,2
Good bouncer shows restraint,5794,7
The President of Cameroon has hired a worldclass photoshop expert to make him seem more important than he really is,5795,2
Ludacris is Ludaversal AMAA,5796,0
Bears,5797,7
Forget Toothless My dog looks like Falcor the Dragon from The Neverending Story,5798,2
To bosses everywhere,5799,4
Dis stick is mine,5800,2
Visiting Texas this month My understanding of the state so far,5801,2
Silvers Struggle,5802,8
Timing,5803,2
Sometimes I worry about my sister,5804,2
If you have ever wondered how people get from Earth to the ISS Smarter Every Day just released a video explaining the beautiful physics behind it,5805,2
This apple hasnt got time for your science experiments,5806,2
Airliner crashes in French Alps,5807,6
My sister found a silver penny,5808,2
I sleep here instead,5809,2
The real reason the USS Theodore Roosevelt is off the coast of Portsmouth,5810,2
My new favorite way to read fortune cookies Add Master Wayne at the end and read with an English accent,5811,2
Vi har inte tillräckligt med feta mejmejs på förstasidan Låt mig presentera Hygglig Tjomme Jänkare,5812,0
PsBattle Dog making a perplexedshocked face,5813,7
Human I require your assistance right meow,5814,2
So my dog destroyed a box and attempted to hide,5815,7
Lined up a good paying job for a friend,5816,2
This door looks like its melting,5817,2
TSN now using the Senators Hamburglar logo as a transition,5818,0
Ted Cruz says satellite data show the globe isn’t warming This satellite scientist feels otherwise,5819,2
Jeremy Clarkson to be sacked by the BBC,5820,7
House Members Move To Repeal The Patriot Act With Strongest AntiSurveillance Bill To Date,5821,2
Why is this so entertaining,5822,7
Norman was thoroughly excited to eat his breakfast today,5823,2
Its been months but Im finally done with this TF2 Lineup,5824,2
Students got caught copying each others work,5825,2
junk,5826,2
Gigantic pork tonkatsu twice the size of my face No banana nearby so hand for scale,5827,2
I am John Dunsworth You might recognize me because I play Jim Lahey on Trailer Park Boys AMA,5828,2
Brock Lesnar resigns with WWE,5829,5
Pencil drawing,5830,2
Photo of OPs grandmother as an extra at a movie set gets called out,5831,7
the cutest little tongue,5832,2
Things you see on the subway,5833,2
Arcades these days are just large and expensive App Stores,5834,2
Imagine,5835,1
I just dont understand,5836,2
Indian Supreme Court strikes down law that allowed the government to arrest people for posting offensive statements online,5837,2
My best friend spent the past 5 years of his life making a stop motion movie He hit a lot of ups and downs along the way but the final result is fantastic I had to share,5838,2
Calvin and Hobbes Chris Toler done at the Hampton Roads Tattoo Convention,5839,1
the CEO called all of the interns into his office yesterday Im going to miss working for him when I graduate,5840,2
Sound off like youve got a pair Happy 71st birthday to R Lee Ermey the iconic Gunny,5841,2
Antarctica,5842,8
Caught my cat Marcy all sprawled out sleeping looks comfortable,5843,7
Incredible 301 yard bow and arrow shot,5844,7
[OC] What I Learned in Law School,5845,2
South Park did it,5846,2
The One True Religion,5847,7
Can we get store pickup,5848,2
Make teambuilder faster by letting people queue for multiple positions,5849,7
Clever crow knows only the heavy blocks will raise the water level,5850,4
MRW I ate BBQ Saturday Sunday and Monday,5851,2
I was dead for 13 billion years before I was born and that wasnt so bad,5852,2
YouTube to relaunch livestreaming service with focus on esports and gaming,5853,2
Had to do a uturn for this one,5854,7
Who says pcmasterrace is only behind a desk,5855,7
EMSK These Kitchen Cheat Sheets,5856,6
A true gentleman receives a special note from a strangerand,5857,7
My time is valuable and I cant be wasting it on such menial tasks,5858,7
New Zealand win against South Africa with one ball to spare to reach Cricket World Cup final,5859,2
TIL An American gymnast with a wooden leg won six medals including three gold in a single day at the 1904 Olympics He was the only Olympian to have competed with a prosthetic limb for the next 100 years until 2008,5860,2
Thought it came out pretty rad what do you guys think,5861,2
Aatrox ultimate SFX in reverse,5862,1
I traveled 7333mi from New Zealand to watch the Denver Nuggets play Watched three blowout wins met the team got a media pass sat courtside and interviewed Steph Curry Here are some photos of my trip (xpost rdenvernuggets),5863,2
It appears FHM has not yet seen the light,5864,2
My dad who is in Korea sent me this picture from a toilet,5865,2
TIL In 2006 a teacher stopped a school shooter by hugging the shooter The shooter dropped the gun and the teacher held him firmly against her until other teachers arrived to help,5866,2
My 8 year old PlayDoh has grown crystals,5867,2
Patch 56 notes,5868,4
The slow realization,5869,8
Formerly obese redditors what was the most surprisingunexpected change after losing weight,5870,2
Sound off like you got a pair Happy 71st birthday to R Lee Ermey the iconic Gunny,5871,2
Blizzard sent me a survey This was one of the questions,5872,2
My lab Bailey likes to wake up before the sunrise,5873,2
Beijing to Shut All Major Coal Power Plants to Cut Pollution,5874,2
[NEW] Incredible Animated TIE FIGHTER short film (EXTENDED TO 7 MINS) by OtaKing77077,5875,4
Girls at the club be like,5876,2
After a very long time debating I finally got a tattoo Was time to stop hiding my lack of faith from friends and family,5877,2
Thats what we call a hole in one,5878,2
Not wanted,5879,2
I feel terrible that my mom paid to have these done,5880,2
),5881,2
TIL that despite smoking in numerous films Clint Eastwood has never smoked habitually and has practiced healthy dieting and meditation since his youth,5882,7
After 2 years the guys at work have learned to understand my CS GO addiction,5883,2
Why is 6 afraid of 7,5884,2
TIL Pearl Jam sued Ticketmaster for creating a monopoly on ticket sales Pearl Jam wanted to charge no more than $1850 for tickets in ’94 with service fees of no more than $180 Ticketmaster balked saying that it needed at least $2 in fees simply to cover its own costs,5885,7
I think I got stupeder by reading this,5886,2
Costa Rica provides record 75 days of power solely from renewable energy,5887,6
I love this game ),5888,2
Flirting with a girl,5889,2
[S2] Photos of cast and crew filming north of the Wall,5890,2
Bloodborne Review Thread,5891,2
Parked right in front of the store too,5892,2
Teemo  Special Forces,5893,2
You Sure Are,5894,2
The horrible things she must have seen,5895,2
Make Zilean dance the dance in Cant Killean the Zilean,5896,5
Still my favorite news headline,5897,2
[SPOILERS] Predictions on the season 5 finale,5898,7
Science AMA Series Im David Sherman a Principal Investigator at Seattle BioMedical Research Institute a nonprofit infectious disease research center in Seattle Washington My research focuses on tuberculosis (TB) a disease that affects nearly one third of the worlds population AMA,5899,2
MRW my friend complains about his girlfriend finding out that he cheated on her,5900,7
Ill be your hat buddy Ill be your hat,5901,2
9 going on 55,5902,2
Why are you able to review an album before its released,5903,2
How My Family Got Through The Recession,5904,2
TIL that three men were arrested for attempting to steal Elvis Presleys remains for ransom This is why his body along with his mothers was moved to Graceland where they are monitored by security,5905,7
Secret $15 million donation from Wisconsin billionaire uncovered in Scott Walker darkmoney probe,5906,4
Twitch still cant damage Inhibitors and the Nexus while his ultimate is active,5907,7
Hello there,5908,2
Why do milk jugs have these,5909,9
I attempted to recreate the Land of Ooo in my front yard,5910,7
Which fictional character would perform the worst in a customer service job,5911,2
[IMAGE] Bus driver talks woman out of suicide,5912,2
Human hand after 21 years of not being eaten,5913,7
So I got bored and 3D printed this,5914,2
How firewalls work according to CSICyber,5915,2
When using just the pool table isnt enough for a trick shot,5916,2
Heres the winning post (Sphynx catElephant) from the first rHybridAnimals battle Dont forget to vote in the following battles,5917,2
Skinned alive when he would not renounce his Christianity this statue of St Bartholomew also has no skin,5918,2
No Im not gonna cry this time Skyler,5919,2
The Current State of Netflix Suggestions,5920,2
US troops driving through Poland get warm welcome,5921,2
Man rescues fox cub with head stuck in a tin can,5922,7
Youre not my Dad,5923,2
Not an auto shop I work at Non destructive Testing facility as a radiographic welding inspector These Bugatti Veyron wheels just came in for inspection $70k for a set,5924,7
The Scottish accent and a voice activated elevator,5925,7
The NFL asked the Bills to do Hard Knocks They declined,5926,2
me irl,5927,8
I bet society never thought this line would be crossed,5928,2
TIL while exploring South Dakota in 1822 Hugh Glass was left for dead after being mauled by a grizzly bear He later awoke set his broken leg laid upon a rotting log to let maggots eat his gangrenous flesh and crawled 200 miles to the nearest settlement living off berries and roots,5929,2
Former Orca Trainer For SeaWorld Condemns Its Practices,5930,6
We let him play a few rounds before he got distracted,5931,2
Secret Spiral Staircase,5932,6
This is why you shouldn’t believe that exciting new medical study More often than not single studies contradict one another — such as the research on foods that cause or prevent cancer,5933,2
Ladies and Gentlemen Your 2015 NFL Coaches Yearbook Photo,5934,2
Rep Paul Shepherd urges congress to impeach judges who rule in favor of samesex marriage so I bought his campaign site before he renewed it to promote samesex marriage,5935,2
[SERIOUS] Redditors who ended up marrying your high school sweethearts what is your story,5936,2
After losing fifty pounds,5937,7
I guess I should go to sleep before I break everything in my apartment,5938,2
I feel so lucky to have this right out of college,5939,2
They dont suspect a thing,5940,2
Kid decides to come out to his mom,5941,2
TIL that there are three power grids in America One for the West one for the East and one forTexas,5942,2
Matt Smith wants to play Newt Scamander in Fantastic Beasts and Where To Find Them movie,5943,2
Bill Belichick on whether he gets a lot out of the NFL meetings No,5944,2
Young shrews join their mother on foraging bouts by following her in a chain,5945,2
Seth MacFarlane Beats Ted Lawsuit With Independently Created Bear  A production company that also featured a cursing teddy bear says it is now satisfied Ted was created by MacFarlane,5946,2
Elijah Would The most wonderful thing Ive seen on IMGUR,5947,2
NEW ZEALAND WIN WITH ONE BALL TO SPARE,5948,2
Give them a chance to not do the thing,5949,2
List of essential free software in case you decide to install a fresh OS (Seen on Imgur),5950,6
[US] Snowpiercer (2013) Distant future Earth has frozen over The only remaining inhabitants are confined to a single train circling the globe Poor people in the back rich people in the front A revolution brews among the classdivided cars,5951,7
Taking 50 years to the build this French fortification island was already obsolete when it was finished in 1857 so it was used as a a prison,5952,6
Would a black hole just look like a (fading redshifting) collapsing star frozen in time,5953,7
Scathing report on health of Canada’s waters accuses Ottawa of wilful negligence Council of Canadians report describes Great Lakes as “a dumping ground for our toxic waste and more recently as a carbon corridor to transport tar sands bitumen fracked gas and fracking wastewater”,5954,0
Seriously am I,5955,2
I made a video pretending to care about One Direction CBS aired it,5956,2
Come on and SLAM,5957,1
sassquatch,5958,7
This is a busy time of year for me,5959,2
Sooo I forgot I had potatoes,5960,7
Thats no way to treat a fan,5961,2
Psychiatrist,5962,2
Really cool watch,5963,2
House effort would completely dismantle Patriot Act,5964,2
First image of Jesse Eisenberg as Lex Luthor in Batman v Superman Dawn of Justice,5965,2
Keep it cool,5966,2
My copy machine was programmed not to completely copy money,5967,2
Redditors Husband,5968,2
Yaying mantises,5969,9
Germanwings Pilot Was Locked Out of Cockpit Before Crash in France,5970,8
Super Troopers 2 Fully Funded In Just Over 24 Hours,5971,2
I got bored and photoshopped jupiter into a coffee mug,5972,2
To ball is to live To live is to ball,5973,7
Stray dog joins adventure race team follows them for a 430 mile long race Gets adopted afterwards,5974,2
Was having a super bad day Then I looked in my neighbors yard,5975,2
My friend just posted this on Facebook,5976,2
TIL Russia has a vast diamond field containing trillions of carats,5977,2
Not my proudest moment but at least I tried,5978,2
A rare moment of stillness,5979,2
ISIS Takes Tatooine As Tourists Warned Away From Star Wars Locations In Tunisia,5980,7
MRW Im watching Game of Thrones with a person who has never seen it before and the first major character dies,5981,2
me irl,5982,8
CD shattering at 170000 FPS,5983,4
Lefty loosey,5984,6
I didnt know foxes too could make these eyes,5985,2
In a 500day period I could theoretically meet someone get married have a baby and get divorcedand yet Id still be using the same box of Qtips,5986,2
Hats off to Chrome,5987,0
IamA Female Afghanistan veteran and current antipoaching advisor (poacher hunter) AMA,5988,2
Scientists have discovered a simple way to cook rice that dramatically cuts the calories,5989,2
Pervert Timing,5990,5
loneliness,5991,9
People over 40 What is a question that you dont think people under 25 would know but just about everyone over 40 would know,5992,2
Gas Station In Slovakia,5993,0
My dad recorded these kids at Walmart today,5994,2
Whos the burger now ,5995,7
The definitive guide to good beer,5996,2
I think my son is doing it wrong,5997,2
Whos laughing now,5998,9
Pint glass wisdom,5999,8
Oh its actually MY makeup on MY baby sister,6000,2
Target locked Death kicks engaged,6001,2
University of Phoenix has lost half its students,6002,2
HJ Heinz Company And Kraft Foods Group Sign Definitive Merger Agreement To Form The Kraft Heinz Company,6003,2
This globe making machine,6004,7
GTAV logic,6005,4
The Rainworks art project trying to get people to feel better about rainy days,6006,2
Tonight we feast urban rooftop beekeeping finally paid off,6007,2
A true king always defends his castle,6008,7
Just accidentally signed off an important email with Many hanks,6009,2
Party on Flames,6010,2
Hail Satan kids,6011,2
CNN struggling with some basic logic,6012,2
Belichick went off in closed meetings ‘We spend money to send the Pro Bowl to Brazil,6013,2
Traveling when youre sick is the worst,6014,2
Jeremy Clarkson dropped from Top Gear BBC confirms,6015,7
The best paper airplane throw of my life (Memorialized),6016,2
Different countries same problem,6017,2
The Run of your Life,6018,2
Blackfoot Indian Chief being recorded on a phonograph in 1916,6019,2
BBC drops Clarkson as Top Gear host,6020,7
Inappropriate Quotes,6021,5
I am vengeance I am the night,6022,7
RadioShack puts customer personal data up for sale in bankruptcy auction,6023,7
This is my friends dog Porter He LOVES sticks,6024,2
it made me go AWW,6025,2
Thief,6026,9
Peta,6027,4
Heres hoping,6028,0
The size of my wifes socks never ceases to amaze me,6029,1
MRW I just got surround sound speakers and I watch Lord of the Rings,6030,2
Local pawn shop had a great deal on DVDs,6031,2
