Title,doc,topic
A window as the kitchen backsplash,3777,9
Our Shiny New Net Neutrality Rules Wont Be Worth Squat If The FCC Isnt Willing To Act,3778,2
Sculpture is three different numbers depending on persepctive,3779,2
Thanks for making my income look totally legitimate Lester,3780,2
Dammit dad,3781,2
Politics Is Poisoning NASA’s Ability to Do What It Needs to Do,3782,2
Always is a long time I just dont think im ready,3783,2
X Factor Judges Fired After Berating Contestant for Disgusting Looks,3784,7
My mom is back in college and I basically had to pry her off of the phone,3785,2
Marcin Gortat (Washington Wizards) during interview,3786,5
One of these things is not like the other,3787,2
Dubai from above,3788,5
My friends dinner date last night,3789,2
How fast was Mike Tyson Fast,3790,2
TIL that Scrubs was shot in a real (former) hospital,3791,7
The GOP takes it a letter too far John Boehner,3792,2
Wonderful gem at the dog park,3793,2
Classroom Thug,3794,3
Space age memes,3795,8
Connecticut Supreme Court rules past marijuana convictions can be erased  because the state decriminalized misdemeanor possession of pot in 2011,3796,2
Manu Ginobili calls a technical foul on the ref,3797,5
Dr Rockso professional meanmugger,3798,4
Dude breaks deadlift record while Arnold yells at him,3799,6
MRW My buddy who wont get on Reddit keeps showing me content Ive seen days and weeks ago,3800,2
Deer and dog,3801,7
Original movie posters from the Lucas Theatre in Savannah,3802,7
Obey one Baloney,3803,7
My friends son died of a brain injury last week He donated his organs and this is the result Faith in humanity restored [OC],3804,8
Spring break Wife is at work Just me and the kids at home I am a hero in my childrens eyes,3805,2
Dancing with the stars,3806,1
If at first you dont succeed try try slowly again,3807,2
My pets werent too happy when I interupted their secret meeting,3808,2
Why do the babies get all the love,3809,2
Virginia school suspends an 11yearold for one year over a leaf that wasn’t marijuana,3810,2
A girl in my class just walked into class with this shirt,3811,2
TIL phones in GTA V produce light,3812,2
I already have to drive 15 mph dont make it worse,3813,2
MRW I a white Canadian visit Detroit,3814,2
Shes quite the handful,3815,2
This is why I never had a girlfriend in high school I looked 35 when I was 14,3816,2
The chemicals in the pool made some of these leaves turn clear,3817,2
I built this career day display about dams and reservoirs (complete with running water),3818,7
Dont get more Murican than this,3819,2
This crap from Apple,3820,2
Buzz Aldrin just tweeted this (Xpost from rpics),3821,7
TIL Nien Nunb a minor character in Return of the Jedi,3822,2
PsBattle This Jamaican Easter cheese ad,3823,7
[Xpost ritsaunixsystem] Youtuber is a very smart hacker,3824,1
About 8 months ago I posted a photo of myself and my ID showing the progress Ive made post cancer Ive made even more progress,3825,2
Whoever stole my Microsoft Office Im coming after you,3826,2
Ordered an xbox to use for parts I opened the box and got a good laugh when I did Beer pong anyone,3827,2
As an adult that has to wake up at 5 AM,3828,2
Crow Hops by Suzy Todd Two Birds Tattoo Seattle,3829,8
Banks Say “Thanks for the Bailout” Now We’ll Park our Profits in Overseas Tax Havens,3830,2
I am Hank Green founder of Subbable (a crowdfunding platform) here with Jack Conte founder of Patreon (a crowdfunding platform that just acquired Subbable) Were excited to be joining forces  Ask us anything,3831,6
Saviors Hide my first cosplay,3832,2
TIL there is a group of Pacific Islanders that can control their pupil dilation and see clearly underwater,3833,2
wanna touch my ball,3834,7
Well they cant you know,3835,7
Burnie on why Gus smiles when he wakes up,3836,4
Rocket out of a matchstick,3837,0
hes very happy about his birthday (repost from raww),3838,2
Im the superhappycorgifarmguy that posted here a few days ago Some people asked to see pictures of the actual puppy that we picked up so here are a few His name is Watson,3839,2
The University of Iowa found out that they play Davidson in the NCAA Tournament this conversation ensued,3840,2
The reason Groudon is the Upvote button,3841,1
Quite the fall,3842,2
Extinguish the Cigarette,3843,5
Found this in my moms 1973 yearbook,3844,2
I thought the stone was supposed to do the spinning,3845,2
Reckless driver multiple close calls,3846,2
France aims to criminalize advertising with anorexic models,3847,1
Rand Pauls latest minority outreach effort,3848,8
Best part of owning a motorcycle according to my best friend,3849,2
CocaCola has been paying fitness and nutrition experts to suggest its cola as a healthy treat,3850,0
Awkward Superhero moment,3851,2
Bomp bomp bomp,3852,4
Traffic Simulation in CS,3853,3
Turning on a wet stove,3854,0
[SPOILERS] They become one with the Force,3855,2
MRW my exgirlfriend came out of the closet,3856,7
Tip Use your phones pano cam and a mirror to argue with your reflection,3857,2
The concept of Europe is now clearer than ever,3858,2
The pupils in our eyes shrink when faced with bright light to protect our vision Why cant our ears do something similar when faced with loud sounds,3859,2
Putin Orders Northern Fleet to Full Alert for Combat Readiness Exercise include 38000 military personnel 3360 pieces of equipment 41 ships 15 submarines and 110 airplanes and helicopters,3860,4
Probably the greatest Baron steal Ill ever make  Blind Jinx Ult,3861,2
Patience is a virtue [OC],3862,9
Why you should always yell Fore,3863,4
What is your most outlandish theory about the disappearance of Vladimir Putin,3864,4
A human patient with late stage leukemia will be given DNA nanobot treatment Without the DNA nanobot treatment the patient would be expected to die in the summer of 2015 Based upon animal trials they expect to remove the cancer within one month,3865,2
The best part of owning a motorcycle according to rmotorcycles,3866,2
Frenchman hides Russian wife in a suitcase to sneak her into EU  Polish border guards have detained a French citizen who packed his Russian wife in a suitcase attempting to smuggle her over the Belarus border Officials noted later that she wouldve been able to enter EU legally,3867,2
In the US taxes are mandatory but voting isnt People who pay taxes but dont vote are basically saying Here,3868,2
Russias Putin appears in public for first time since March 5,3869,2
Fnatec new logo,3870,2
[SPOILERS] Tonights episode in a nutshell,3871,2
The Sevenfold Falcon Punch,3872,1
Cat Owner Instant Karma,3873,2
BBCs Top Gear slot loses 4m viewers after Jeremy Clarkson suspension,3874,7
Good Guy Kroger just opened a new store and was giving free stuff out,3875,2
Canadian universal drug plan would save billions UBC researchers say $1$54 billion annual public cost offsetting $82 billion annual private sector cost,3876,2
[No spoilers] If Bioware could make this happen I would be so happy,3877,2
Youre better than that,3878,2
Top 25 richest living comedians [OC],3879,7
Isnt that all they really are,3880,2
PsBattle Cat sitting in a weird position,3881,7
I AM MR SKELTAL KEEP SCROLLING IF U HATE ME UPVOTE AND COMMENT IF U THANK ME,3882,2
TIL that Kanzi a male bonobo once snapped twigs for a fire lit them with matches and toasted marshmallows on a stick He is also an accomplished stone tool maker and can flake cutting knives He can play and understand how to beat a game of PacMan too,3883,7
A Shen watercolor my Dad finished this week Enjoy,3884,2
The odd couple,3885,2
Weighing around one kilogram (22 pounds) at birth the young Chinese water deer is able to stand after just an hour and spends most of the first few weeks hiding in vegetation,3886,2
me irl,3887,8
Unlike the character its served in the coffee always hits the spot,3888,2
Horny trumpets,3889,4
Man is asked to leave metro station you cant make this up,3890,2
I was visiting my neighbor island Vieques on the weekend needless to say I made a new friend meet Lola,3891,2
While I was making breakfast my 3 year old got the PC on picked his movie started a game and moved them to his preferred display Glad to know my boy is smarter than the average peasant already,3892,2
But then I forget wash them again and the cycle repeats,3893,2
Thank you Reddit A year ago today you frontpaged a video of our barbershop quartet and its completely changed our lives Its been an incredible ride heres a quick recap You guys are the best,3894,2
I went to the restaurant Casa Bonita tonight and saw Cartman by the water fall,3895,2
Adam Schefter on Twitter Tebow working out for the Eagles,3896,1
ELI5 What is the purpose of tearscrying,3897,8
A House GOP rep is quietly planning to sell off Americas national forests,3898,2
Journey to the Centre of the Earth  Great depiction of what lies below the Earths surface,3899,7
3D Printed manual transmission,3900,0
Private Company Suspected of Dumping Biohazards Into Oklahoma River Hundreds of used syringes and blood vials in biohazard containers ended up in the Arkansas River after a private company was hired to dispose of them investigators said,3901,2
After twentyeight tomatoe loving years I finally found the best way to keep my tomatoes on my sandwich Maybe it can help you out too,3902,2
Whats the scariest movie you know that has LITTLE TO NO JUMP SCARES,3903,2
Fnatic actually just changed their logo made byusoaliar,3904,2
Islamic State fighters caught fleeing battlefield dressed as women,3905,7
(Spoilers) S05E14 Ill show myself out,3906,2
I can show you the world,3907,2
Ted Cruz renews call for unlimited campaign contributions,3908,2
And this guy has a Masters Degree,3909,2
How peasants think we hack,3910,2
After 10 years of PVP server I finally got this,3911,2
Under Obamacare America’s uninsured rate has fallen 35 percent,3912,6
This church needs a new graphic designer (xpost from rfunny),3913,7
I guess they still havent learn their lesson,3914,2
Metric vs Imperial in a nutshell,3915,7
I hate feelings,3916,2
The Hero we need and deserve,3917,7
Garlic fries all day,3918,2
TIL A primary school in Suffolk have children raise piglets as a class which will be ultimately butchered for meat and eaten This is to teach them a lesson on the provenance of food The older children are involved in creating recipes,3919,2
Terrorists are invading Facebook,3920,6
The proper way to open a beer,3921,2
Upvoted because girl,3922,1
MRW I start rolling a joint and I remember my parents are coming over for dinner,3923,2
I thought she was joking when she made this comment on Facebook but nope,3924,2
Washingtons #1 construction company,3925,5
Say hello to Samson,3926,2
My neighbor knocked on my door at 230 AM,3927,2
Roughly 2 years apart nearly identical hits on Ben Lovejoy by Pavel Datsyuk (Credit uawood40),3928,7
Nick Kristof  To Kill a Chicken IF you torture a single chicken and are caught,3929,2
Our hair turning gray is like our body running out of ink,3930,2
A GTA V take on a classic,3931,2
How the United States and Mexico jointly created the Mexican Drug War historian Mike Wallace (author of the Pulitzerprize winning book Gotham) and novelist Carmen Boullosa examine cartels,3932,2
[Serious] What is the scariest thing you have seen with your own eyes,3933,2
Homer is this how you pictured married life,3934,2
Tysons fight with a cocky Peter McNeeley from 1995  look at Tysons eyes at 0216,3935,2
TumblrInAction gets it,3936,7
Whats the best medicine for a broken heart,3937,2
This is how a successful adult usually gets through their day,3938,2
My Favorite Quote from Abraham,3939,2
NEW Fallout comic When you think youre prepared for Sierra Madre,3940,2
Different sizes same attitude,3941,2
You know who you are,3942,7
[no spoilers] My Oberyn Martell cosplay finally got a proper photoshoot,3943,7
Lost my best friend of 20 years this morning No other kitty will be quite like you (,3944,2
Instead of Xbox Take a screenshot It should be Mom get the camera,3945,2
Submerge a limb long enough for it to become barnacle encrusted Put on long clothing and then go check into a fancy hotel Swim in their pool for a while and then complain that their water gave you barnacles Use this as leverage to gain access to and subsequently lay waste to their mini bar,3946,2
I too met the Amys (Karen and Caitlin),3947,0
Kayaking the dyed green Chicago River for St Patricks Day Taken Yesterday,3948,2
My 92 year old Grandpa happy as ever showing off one of his homegrown avocados I suspect he might live forever but he says he will be ready to go on his 105th birthday,3949,2
Ikea Bans HideAndSeek In Stores,3950,4
I have a small Stream(1525 viewers) Yesterday H2k Hjärnan and H2k kaSing wanted to join a Viewergame made my life,3951,2
Kitten Begging To Be Saved In Vietnam,3952,2
i want to go to this school,3953,2
My new Wraith Squadron inspired tattoo I got Saturday night,3954,2
PawNs skin whether its Jayce or Talon should feature the captains jacket,3955,1
PsBattle Creepy bird and a terrified girl,3956,7
Vince Wilfork signs with Texans,3957,0
Love Story featuring Aui_2000 and Universe,3958,3
[Inspiration] Subtle teal placed above her eyeliner starting from 13rd of her eye,3959,9
These two troublemakers,3960,2
This is why we dont let him use the sniper,3961,2
Trust me Im an engineer,3962,2
TIL a million Europeans were enslaved by North African slave traders between 1530 and 1780,3963,2
BattleStation and Ultimate Man Cave,3964,7
TIL Bruce Lee used edible Marijuana on a regular basis,3965,2
Where XFiles stands in the relationship (note from Dad to Mom about 20 years ago),3966,2
I fold money too I’ve been doing origami since I was 7 to ease my anxiety and depression here are some of the models I’ve designed,3967,7
If there was reddit in the afterlife or Deaddit what sort of content and subreddits would be on it,3968,2
[SPOILERS] Found Ricks ToDo List,3969,2
Things might get weird,3970,2
I made some fake selfhelp books and left them at a local bookstore,3971,2
Failed hijack attempt of United flight out of Dulles,3972,2
We were trying to get a cute St Patricks Day picture but the wind wasnt cooperating,3973,2
As a 44 yr old father trying to spend time with his 13 yr old son Secretly wished he wanted a dirt bike instead I have no idea how to play this game,3974,2
Trying to fall asleep [fixed],3975,2
Journey Into A CPU,3976,2
Scientists discover how to change human leukemia cells into harmless immune cells,3977,2
Leaked screenshot of the first mobile Mario game,3978,7
Thats a put me down face if Ive ever seen one,3979,2
Mixed Messages,3980,5
The new teaser poster for SPECTRE (2015),3981,2
Stripsearched girl cant return to her school Quebec judge rules  In the strip search the girl was asked to remove all her clothing including her underwear No drugs were found,3982,2
This makes me feel worse than I did before,3983,2
1st gen Toyota Celica,3984,2
Dont touch my baby,3985,2
Irish nofrills airline Ryanair confirmed its board has approved plans to start flying lowcost transatlantic routes starting from $14 in the next five years,3986,2
Scumbag (soon to be former) Rep Aaron Schock (RIL),3987,8
My cousin You dont forget some things about people when you grow up,3988,2
Muhammad Ali brags Best brag Ive ever seen,3989,2
Ive stolen pens from the bank Technically Ive robbed a bank,3990,2
Dragon Age Inquisitions Cover with a negative effect,3991,2
Tommy Wiseau creator of THE ROOM and the new TV show THE NEIGHBORS available now on Hulu AMA,3992,2
Fake sets of conspiracies of real events,3993,7
Its a trap,3994,2
I know ive seen your face before,3995,2
Its not easy being green,3996,0
So I was reading some articles about human cloning and stumbled on this picture,3997,7
TIL Istanbul has a vending machine that releases food and water for the citys stray dogs in exchange for recycled plastic bottles,3998,2
Road to the mountain,3999,2
A small percent of police officers account for almost half of all complaints and they are almost never disciplined study,4000,2
A judge in NY State has ordered law enforcement to release details on the use of cell phone tracking technology The court today has confirmed that law enforcement cannot hide behind a shroud of secrecy while it is invading the privacy of those it has sworn to protect and serve,4001,9
Found this little man a few summers ago He didnt let go for a good 20 minutes,4002,2
I FINALLY FOUND IT,4003,2
Do you hear that bass mom,4004,2
Chop top Beetle,4005,2
These are the top 100 reasons the Hubble Space Telescope is so highly regarded,4006,2
Stay strong and Never Ever Give Up,4007,2
Rick Santorum Blames EU For Gay Marriage  The European Union doesnt have the word God in its Constitutionit is the reason you are seeing this assault [in the US] Uh,4008,2
me irl,4009,8
Im Irish [OC],4010,2
Mars One finalist breaks silence claims organization is a total scam,4011,6
219,4012,7
2 soon 2 furious,4013,7
Mars One Is Broke Disorganized and Sketchy as Hell,4014,0
It was a very important email Im just hoping they dont notice,4015,2
The alternative to Afraid to Ask Andy,4016,2
Well I guessI meanAlright,4017,2
What,4018,0
Its nontransferable and theres no cash portion,4019,2
TIL The Beatles have sold more records than Bob Marley Tupac Shakur Nirvana the Beach Boys AND Kanye West COMBINED by over 30 million units,4020,2
Let us not forget the real reason for St Patricks Day,4021,2
Looks like we got some redditors at Book Soup on Sunset Blvd,4022,2
My son made a very important decision and I couldnt be a prouder Pokémom,4023,2
A scumbag on Chatroulette How is this guy even allowed to have kids,4024,2
Mashup,4025,4
[xpost  rNBA2k] AHHHHHHHHHHHHHHHHHHHHHHHH,4026,1
My dad always told me its nice to be nice and to just shut up every now and then,4027,2
MRW I look through my submission history,4028,7
Found at a gas station in Georgia,4029,2
The dysfunctional GOP is failing to govern There is no plan Republican majorities in both the House and Senate are so out of control that they’ve managed a feat once thought impossible They make the Democratic Party look like a model of unity and discipline,4030,2
Happy St Patricks Day,4031,2
A person is put in a room for 24 hours if they stay in the room for the full duration they receive 1 Million Dollars What ideas would YOU put in the room that could potentially make them forfeit,4032,2
They get 2 weeks now,4033,2
Plumbing 101,4034,5
Jeb Bush Calls For The Elimination Of The Federal Minimum Wage,4035,7
Was marathoning John Oliver videos and reading the associated Reddit threads when I came across this comment on becoming a soldier after 911,4036,2
Happy St Patricks day,4037,2
Ring bell for service,4038,2
Kevin from ABC ask permission to use OPs picture and video from a plane situation instead in of hijacking them without permission,4039,2
Enjoy your Whitney Houston and Enya,4040,2
His name is Nimble,4041,2
Self boop,4042,1
Owls dont like garlic,4043,2
Dont stare directly at it,4044,9
Reddit I was incredibly lucky to walk away from this 12car wreck caused by a drunk semitruck driver Never forget to tell the people in your life that you love them,4045,2
Spain finds Don Quixote writer Cervantes tomb in Madrid,4046,0
This delightful Vader toaster has settings that range from Lukewarm to Owen and Beru,4047,0
My dad chatting with some kids by his police cruiser early 70s,4048,2
Biking home I saw something on the ground Apparently my 12 year old cousin knew my route after volleyball practice everyday and did this for my birthday He was hiding behind bushes about 50 feet away just in case I missed it,4049,2
So I won that argument,4050,8
This new Terminatorinspired liquid resin 3D printing technique,4051,8
69% of US parents believe their kids need a college degree or more to achieve the American Dream,4052,2
Matthias Steiner promised his wife a gold medal in the 2008 Olympics she passed away a year before the games and this is what happened in Beijing,4053,2
Say hello to our new ragdoll kitten Gary,4054,2
I managed to play a few songs perfectly as Zora Link inside Majoras Mask 3D,4055,2
MRW I turned on the demo massage chair in Brookstone and it was set to high,4056,7
The guy that made these cakes,4057,2
TIL Before the Terracotta army when chinese emperors died all their servants were killed to aid them in the afterlife Building the terracotta army spared emperor Qin from killing more than 8000 people,4058,8
Beautiful Shoreline,4059,2
TIL that The shortest St Patricks Day parade in the world takes place in Dripsey,4060,2
My dad was fired from his job in road work for theft,4061,2
Jehovahs witnesses are my first visitors to my new house,4062,2
Uber 911 In NYC the median response time for an ambulance is 6 minutes The median wait time for an Uber is 242 minutes,4063,2
IMA bar owner in Dublin Ireland on StPaddys day,4064,2
Cat IS the hat,4065,2
UPDATE ON GABEN HUNK VOTE Heat Magazine are now well and truly aware of our Gabe Newell votes,4066,2
Chris Borland Retiring Due To Head Injury Concerns,4067,7
Random creepy pictures,4068,2
Lady gave this to me for free at a garage sale she thought it was a movie(came with all discs),4069,2
Are you my new dad,4070,2
Tried this out today and was really helpful,4071,2
In this German supermarket the regular Coke bottles all had male names while the sugarfree Cokes all had female names,4072,2
Now thats a BBQ pit,4073,2
When my 15 year old niece tells me she wants to learn Photoshop so she can remove the clothes on pictures of hot celebrities,4074,2
No video from The Onion has struck me like this one,4075,2
[NO SPOILERS] You know nothing of smiling Jon Snow,4076,7
Oregon House approves bill banning gay conversion therapy,4077,2
Look at the games I found in my grandpas basement,4078,2
TIFU by talking to Mark Cuban,4079,2
What its like playing against VirtusPro on Nuke,4080,2
Saint Patricks Day,4081,2
ELI5 why is the skin on a baldshaved head so shiny compared to the skin on the rest of your body,4082,2
I turn away for 5 seconds,4083,2
Good thing he works in dentistry and not hair,4084,2
Everyone remembers these kids from recess,4085,7
Elon Musk cars you can drive will eventually be outlawed,4086,9
When you order two cakes with Happy birthday on both,4087,2
Priorities,4088,3
MRW I go to take a dump at work and the custodial staff is in there cleaning,4089,2
Helping a woman over a puddle 1960,4090,1
Got up at 200 AM to take this pic today Right out my back yard in Hugo Minnesota,4091,2
PsBattle Terrified Two Year Old,4092,2
Should older Legendary skins be updated,4093,2
This is how we do democracy on reddit,4094,2
PsBattle Tiger in the water,4095,7
My friends dad looked like James Franco while he was in the Navy,4096,2
The Simpsons Writing Room 1992,4097,2
You’re not going to make it,4098,2
Reddit whenever a video gets deleted,4099,2
Free to play vs paying player,4100,2
The Batgirl cover that was cancelled at request of the Artist,4101,2
Set the pizza box down for one minute,4102,7
GIF of Apples website in 1997,4103,3
Sleepy Trainer,4104,0
Here,4105,0
Ashe passive should work only against champions,4106,3
Crysis vs Avengers Ultron Poster,4107,2
Why does leather armor make you better at sneaking,4108,7
Wonder what Moms yipin about,4109,2
TIL that the average American household receives 848 pieces of junk mail per household equal to 15 trees every year—more than 100 million trees for all US households combined,4110,2
This is why your phone breaks,4111,6
“No secret instructions” from Obama to FCC Wheeler tells Congress Obama influenced net neutrality decision but so did 4 million public comments,4112,2
Bard breaking the game oO that was weird,4113,7
This is his I want food face,4114,2
My Dungeon Train Finn cosplay from London Super Comic Con this past weekend I had a mathematical time,4115,7
[Serious] Doctors have you ever wanted to refuse a patient What did heshe do,4116,2
Our dawnguard and stalhrim costumes from Lexington comic con,4117,9
Ellen for President,4118,2
The repeat what a creeper says till they get angry game,4119,7
Gay couple wont leave $15 to $18 million dollar estate to University of Alabama because of states war on samesex marriage,4120,2
Pixels  Official Trailer (HD)  Summer 2015 Adam Sandler Peter Dinklage,4121,7
My brother and I are in a bit of a prank war so I decided to take it up a notch Lets see if he sees this before he gets home,4122,2
YSK That Alcoholics Anonymous is one of the worst treatments for addiction,4123,2
Snapping isnt cutting it I desperately want this,4124,2
They really captured the realism of citizens in the game,4125,2
My new glass dry erase board cost me 35 dollars The ones for sale at Staples are more than 500 bucks,4126,2
Nintendo announces they will develop smartphone games with DeNA using Nintendo IP,4127,8
Dropkick Murphys put on a show at Logan Airport while they waited to board their flight to Dublin for St Paddys day (sorry potato quality),4128,2
We will help you,4129,2
Respect the turtleneck Lana,4130,3
Matchstick rocket,4131,0
The GOP House budget calls DoD climate research ‘waste’ DoD calls climate change an ‘immediate risk’,4132,2
Help Keep Your School All American  [1940s50s America comic book],4133,2
Now that we have emails in multiplayer Xpost from rgtaonline [uMahooMushi],4134,6
Obama If Enough States Decriminalize Marijuana Congress May Change Federal Law,4135,2
Its almost like actions have consequences or something,4136,2
Why wont this clooh nm,4137,7
Thought it was a clever idea to use a hole puncher to make an extra belt hole It was not,4138,7
NJ Senate condemns Christies Exxon settlement,4139,6
Nice try Mr Serial Killer,4140,2
This is sign is hanging in a subway in Mesa AZ,4141,2
Police say naked man standing in doorway is not breaking law; neighbors are fed up,4142,2
APPS,4143,9
Connecticut Supreme Court rules past marijuana convictions can be erased,4144,2
Doublelift And Keith Duo In Platinum Elo,4145,6
Bodybuilder Kai Greene just posted this to his Instagram,4146,9
