Title,doc,topic
I received a birthday card Thanks grampa,0,2
This is a nanoinjector a microscopic machine used to inject cells with DNA,1,2
my boyfriend doesnt believe that his cat bullies mine,2,2
I did a half face comparison of myself and my daughter today its kind of freaky,3,2
My son is a ridiculous little person,4,2
Royal Flycatcher,5,8
TIL After a video that went viral in 2012 showing a bus monitor getting bullied by students  a Canadian man set up a fundraiser to collect $5000 for a vacation for her In the end they ended up collecting and giving the women over $700000 She has since retired,6,2
Is it just me or do the trees from Pokemon look like angry men flexing,7,2
UFC 184,8,5
Oldschool trolling from 1930,9,0
TIL that Google Maps calculates traffic by tracking how fast Android devices are moving on the road,10,2
Woke up early dont think the hubby realizes Im gone,11,2
queen,12,5
Forest Dragon Lizard,13,6
A fathers love,14,3
A friend of mine photoshopped a giant snow man next to his house A local news truck was seen driving around looking for it and a national paper published an article about it,15,2
When a dog smiles at you,16,2
My Pokémon loving dad turned 63 yesterdy He was adorably excited to get this special birthday greeting,17,2
This is a nanoinjector a microscopic machine being used to inject cells with DNA,18,2
TIL contrary to popular belief orange does in fact rhyme It rhymes with Blorenge (a mountain in Wales) and sporange (a sac where spores are made),19,2
These sinks are tires (and their faucets are gas pumps),20,0
Small World at Disneyland is on fire,21,2
Witnessed 2 generations collide today,22,2
Oh no,23,2
Whenever I wash socks,24,2
So we made it to the Gand Canyon,25,7
The bin in my hotel room,26,7
My heart hurts Mr Spock,27,2
Got a new travel wallet and I found this in the back of the notebook that came with it,28,2
I am aware of the irony that I photographed them,29,2
Bernie Sanders “if Hillary Clinton decides to run and I decide to run we’re going to have very good debates you know about the role of Wall Street in our society about trade policy about foreign policy—and these are the kinds of debates that absolutely need to take place”,30,2
I spent the summer building sets in my yard and flooding them to create this photo series,31,2
Are you awake,32,4
David Finchers Advice to Young Filmmakers,33,2
ThatJustHappened,34,9
Forrest Gump is in Google Street View,35,7
A guy in my hometown made a 30 X 30 TV dinner out of the snow in his front yard,36,2
Known for his push to legalize cannabis spartan lifestyle and devotion to his threelegged dog Uruguays outspoken President Jose Pepe Mujica will step down Sunday more popular than ever,37,2
Hey you Lets fight,38,2
Home made Batman suit blocks multiple punches,39,2
Tiny house in Tokyo,40,2
hifw i prove my buddy wrong,41,2
There should be a show like chopped but for tinkerersengineers Instead of food you get scrap and have to make an interesting concept,42,2
To those freaking out about SNLs ISIS sketch,43,7
My fishing hole in northern Minnesota this morning,44,2
MRW the server walks by my table with food but it isnt my order,45,2
Incredible archery shot,46,7
HE INVITED ME,47,2
My friend has been training a peregrine falcon she sent me this picture today,48,2
Cat on a snowy mission,49,2
My dog when he was younger,50,2
My friend moved to Tokyo and is working ~80 hours a week as a salary man,51,2
An australian spider that looks like its made of stainedglass,52,7
My brother everyone,53,2
This chicken’s body is all black even the organs meat and bones,54,8
Just never let her know,55,2
Us & Them,56,2
Mushroom called devils fingers looks like a hand reaching out of the ground,57,7
This happened on my college campus this week So thats who to blame for all the snow and cold,58,2
classic Ron,59,7
This morning at breakfast,60,2
Leos most prestigious award,61,6
Googled common core math to try to explain it to my boyfriend This was the first image result,62,2
Hoggin with minimes,63,0
[AMA Request] Jump master who saved the guy having a seizure while skydiving,64,1
When your GIF just *bombs*,65,1
My new toaster oven has an A bit more button,66,2
Good 10 Guy Greg,67,2
Bill O’Reilly admits he did not see “Irish terrorists kill” in Northern Ireland,68,6
TIL that for release in Finland the original Mortal Kombat had to be censored in an unusual way Censors were fine with the gore but insisted the music be replaced with traditional Christian songs,69,7
Life hacks says find 3 hobbies 1 to make you money 1 to keep you in shape and 1 that lets you be creative What are some examples of this,70,2
Fractal,71,5
Bill Nye debated GMOs with uHexaploid in his AMA 3 months ago In a video on Wednesday he said he had changed his mind and would be updating his book,72,2
What if Walt had listened to the doubters [Image],73,4
Happened last night story in comments,74,2
Driving all day in the freezing rain,75,2
I work at an animal rescue I decided to take this sweet girl Zelda out of the kennel for a while and come get lunch with me Here we are in the In N Out drive thru line The smile says it all,76,2
I have massive appreciation for this Good Girl Gina waitress today who helped save my GFs birthday,77,2
To the person tailgating me on icy roads last night,78,7
Im going to have to put you on howld,79,2
As it gets inflated our anticipation is piqued Ear or no ear,80,5
Reddit what in your opinion is the most attractive profession a member of the opposite gender can have,81,6
1010 would bang,82,2
Mechanical Keyboards,83,7
I built some World Wonders,84,7
Apparently drunk me has better fiscal sense than sober me,85,2
NASA satellite imagery shows that rain forest deforestation is speeding up not slowing down as previously thought,86,1
Spanish actress fakes going to the Oscars on Instagram and is found out to have fabricatedphotoshopped her entire acting history,87,2
death recap is the most uninformative and bugged feature in game,88,1
A vegan slaughterhouse,89,4
This will happen if Valve announces HalfLife 3,90,2
Fivetimes married Texas state representative Tony Tinderholt writes letter to judge complaining about letting two women get married in Austin Bonus He sent the letter to the wrong judge,91,2
My wife is stuck at work today so me and the cat texted her some selfies,92,2
50k strong antigovernment march in Moscow today,93,2
MRW I hear my friend call his new girlfriend his exs name,94,2
Cutest little ghost,95,2
How Apple lost $533 million to an 8thgrade dropout patent troll,96,8
Found this car blocking traffic on route 16,97,2
Notes on watching Aliens for the first time again,98,2
Total Honesty,99,6
Melting a big ice cube,100,7
This plunger is unnecessarily tall,101,3
This happens more than Id like to admit,102,2
I had to go all the way back to the grocery store,103,2
When My Dogs Lie Next To Each Other Their Coat Patterns Make A Heart,104,2
The Faith United Church of Christ in Union New Jersey,105,2
Its right there sir in the bright pink container directly behind you at perfect eye level,106,2
Thai temple to build separate toilets for nonChinese visitors because of the state that Chinese tourists were leaving the toilets in,107,6
Local hardware store made Starry Night entirely out of doorknobs and backplates,108,7
Message to the like an adult guy,109,2
Updated emotional word wheel  The Feel Wheel,110,2
Savoury breakfast biscuits with bacon cheddar and green onions (recipe in comments),111,0
How Scott Walker Built a Career Sending Wisconsin Inmates to Private Prisons,112,4
TIL Almost all chickens eaten today come from the winner of the 1948 Chicken of Tomorrow Contest whose genetics now dominate poultry farms worldwide,113,9
HTC Just Announced Valve as its VR Partner,114,7
This is Merlin my adorable and strange kitten,115,2
The true heroes of the Internet,116,7
A microscopic image of a human tongue,117,2
Pendulum waves,118,4
Coffee Table with Glow Resin,119,2
List of games to get excited for this year,120,2
Childrens books have 50% more rare words written in them than words spoken in an average showing of adult primetime television (PDF),121,1
[Air Brawl] I just improved the flight physics of my game a lot by adding proper momentum (You go faster when going down),122,2
Burnies beautiful words about Monty one month later,123,2
Punday,124,5
Kasparov makes a big mistake,125,2
(Animation) The Thresh Prince of Bot Lane,126,2
Having a manual transmission is considered a theft deterrent in USA Here is my antiinfiltration device,127,0
Its really not that hard to do It takes like 10 seconds,128,2
Tickets for Grateful Dead reunion being sold for $15000,129,2
Monta Ellis 360 reverse layup,130,1
[S5] Lemon Cakes Coming April 12,131,2
What the,132,0
Went to a party last night and saw this in the bathroom,133,2
TIL that the homeopathic flu remedy Oscillococcinum is so diluted that there would need to be 10 to the power of 320 more universes to simply have one molecule of the active substance (duck liver) in the final substance,134,2
RIP rBreakingBad moderator uedify one of the nicest people Ive ever known I have been in contact with his family and set up a GoFundMe campaign to help offset the cost of his funeral expenses,135,2
me irl,136,8
So my friends ferret crawled into one of her socks,137,2
I am the smoothest man alive Godtier sexting 1010,138,7
I tore out an old closet for a builtin bench check it out,139,2
Super Mario Cat,140,2
Ive done some stupid things when I first wake up in the morning but this takes it to a whole new level,141,2
This emergency call box is just what you need in an emergency,142,2
The worlds first vertical bathtub,143,7
Cat Gets its Teeth Brushed,144,7
I met this wizard last night,145,2
TIL that a man named Tsutomu Yamaguchi was on a business trip in Hiroshima when the atomic bomb dropped He was wounded but returned to his hometown of Nagasaki where the very next day the second atomic bomb was dropped He survived both blasts and lived to 93,146,2
Bards portal interactions with abilities,147,7
On this day in 1995 the car chase between Xenia Onatopp and James Bond was being shot The Ferrari was rented and after colliding with 007s car had to be repaired overnight at a cost of $80000,148,2
TIL that George Lazenby wasnt an actual actor He got himself a suit a rolex and a new haircut then met with the producer and made up movies he had been in He later landed the role of James Bond,149,2
ELI5 Why does it take years to make a single 15 hr film but HBO can create hour long episodes that air week after week,150,2
Like come on isnt this basic,151,2
Jackie Chan giving a tour of his secret home,152,2
I flew over New York last night and managed to get a picture of Manhattan in the distance,153,2
This Week in Science A Record Breaking Black Hole Wireless Speeds of 1 Terabyte Per Second A Radical Strategy For Conducting Human Head Transplants and More,154,2
This would be a great idea,155,2
Lazy Facetime with your console,156,2
Video Exonerates Man Set Up By Louisiana Cops And Prosecutors,157,7
TIL theres no evidence that Moses Solomon and other prominent figures from the Old Testament ever existed,158,2
TIL that Prince Charles charges a wildlife trust one daffodil per year to lease several small islands from him,159,2
I made a luge track at my house Its nothing spectacular but my kids love it,160,2
Aussie response to an American troll,161,8
New Girl seems to get my life goals,162,2
Got a girl at a party,163,2
Killer guard dog chases down a person trespassing on private property,164,2
Lithuania signs US deal to replace Russian gas ,165,2
Why can cheese age for years at a time yet get moldy after a short time in my home,166,2
Pretty sure I just saw a volcano erupting during my flight to Mexico City It went from normal looking mountain to this in about 2 minutes then the plane turned and I lost sight of it (Sorry for potato),167,2
THANKS DAD,168,2
nature,169,2
Inside of a smoke detector,170,2
Theres no denying how true this is,171,7
Nice little tribute to Leonard Nimoy from the casters,172,7
( ͡° ͜ʖ ͡°),173,4
My thoughts on Rousey vs Zingano,174,6
Romanian_Vampire posts a picture of a trashy tinder user The user shows up,175,7
I need this in my life,176,2
me irl,177,8
TIL one would need to drink about 591 liters of SodaStream cola before breaking even To put that in perspective that’s 162 liters about 45 cans every day for an entire year without actually saving any money,178,2
Remember the game Snake,179,7
US Navy SEAL Brendan Looney pictured here with an interesting load in his utility pouch He was KIA on 92110 RIP [620x821],180,2
VA Refuses to Recognize Veteran’s Wife and Child The Department of Veterans Affairs has frozen the disabled veteran’s benefits until she pays back the full amount the VA mistakenly awarded for her wife and child,181,7
colored thigh piece by daniel lovre at cicada tattoo in seattle one session left,182,2
His stick broke so he brought back both pieces,183,2
My therapist says Im paranoid,184,7
Peter Northugs crazy finish to win Nordic World Ski Championship 50km race (xpost rxcountryskiing),185,2
Methane Found on Mars Indicates Life May Once Have Existed There Nasa,186,2
Ubud Bali,187,0
Steve the walrus,188,1
My friend did this tonight,189,7
IKEA will start selling wireless charging lamps and tables,190,4
Most minimalistic logo for a toilet,191,7
Fake out,192,4
He insisted on wearing it,193,4
A lizard With a cat,194,7
Camera cut at the wrong damn time,195,2
Buy enough ChikFilA on Saturday to start a black market on Sunday Give the proceeds to Gay and Atheist organizations,196,2
ATAT ATAT ATAT,197,5
How to pick up American women,198,2
I have no title,199,2
Dont tell me what to ignore,200,2
Man who made thousands posting women’s stolen nudes goes after news sites that posted pictures of him,201,2
Chris Christie Settles ExxonMobil Case After Oil Giant Gave RGA Big Cash,202,2
The Painterly Style of Shigatsu Wa Kimi no Uso,203,7
Had an old tribal decided not to cover it up  Serghei from Castor Ink Iasi Romania,204,7
Made my own Graphics Card in KSP,205,2
Speaking of bringing Back memes,206,8
LPT Every time you accomplish something make a note of it on an Accomplishments List When youre feeling sad,207,2
You still get tired at work See how they work in China,208,2
Can a microwave oven interfere with my wifi,209,0
Clucking hell the church that looks like a petrified chicken,210,2
Fake Id,211,2
PC gaming is basically sex,212,2
Danny Trejo just posted this on his Facebook page,213,2
This company takes the makeup off of childrens dolls to promote natural beauty,214,2
I Used to Work Night Security At A Zoo,215,2
Parents of Reddit what is something you know about your child that they are unaware of,216,2
[EU] Batman is replaced by an evil doppelganger and the only one who has figured it out is the Joker,217,2
Childhood luxury,218,7
I build my own Graphics Card,219,2
[Spoiler] Team Impulse vs Team SoloMid  NA LCS 2015 Spring Week 6  PostMatch Discussion,220,2
MRW I disable flux at 3 in the morning,221,2
I begged you,222,2
Got Leaverbusted from the Tutorial while movement was inhibited,223,2
Waste bin [OC],224,7
Jumping on the therapy animal bandwagon Meet Muffin the therapy miniature pony that comes into the nursing home at which I work,225,7
Heat Map of Furries WorldWide [OC],226,7
Not sure if its intended but you can globally hear dragon being killed even when you have absolutely no vision of it,227,2
Theres no right turn here,228,2
Ava and Mae relaxing after a snowy playtime,229,1
I hate you Internet,230,2
The fat acceptance starter pack,231,2
Private police carry guns and make arrests and their ranks are swelling,232,2
My girlfriend and I at Machu Picchu,233,2
Fun facts about Yorick,234,4
The worlds second most venomous snake vs a red back spider Spider 1  Snake 0 Welcome to Australia,235,7
YOU SHALL NOT PASS,236,2
This just happened at rChristianity,237,1
I invented a son to shut people up,238,2
Necropolis  First screenshots from the Harebrained Schemes Dungeon Crawler,239,2
My grandmas lipstick holder Needs a little tlc but still beautiful,240,2
What do poor people have an abundance of that rich people dont have a lot of,241,2
I dont think hes doing this right,242,2
Decided to try some Big Team today,243,2
This temple in Thailand features a rift to the underworld,244,1
[META] Please if you do not know exactly what youre talking about do not comment on things as if you do,245,2
This chicken’s body is all black even the organs meat and bones,246,8
Which company do you work for A major one,247,2
A picture under the Mackinaw Bridge in Michigan,248,1
Teach your kids to play Magic,249,2
Back In My Day [Comic],250,2
Chris Pratt gets pranked,251,7
Google confirms it wants to be a wireless carrier,252,2
Tell me Sir Mittens,253,2
Dad my game froze,254,2
The best transportation in all of Skyrim,255,2
She cries in the car until we do this moving or not,256,2
After a few cold weeks on the East Coast,257,2
Geicos commercial rewards you for not skipping after the first 5 seconds,258,2
France is ordering manufacturers to inform consumers how long they can expect their TV cell phone or other appliance to last — before they buy it,259,2
Deadpool and Spiderman,260,3
Thanks Andy,261,0
Ive been going to the same barber for at least 5 years,262,2
Nick Offerman dropping think bombs,263,3
This was Links first car ride He did not let go of me the whole way,264,2
Ive heard of painting yourself into a corner but my wife took it a step further I dont even know,265,2
The Hobbit The Fates of The Dwarves,266,7
US judge rules Nebraska samesex marriage ban unconstitutional,267,2
Damn Im good,268,2
I had to make a 1530 second video to apply for an internship this summer They said it could be about anything This is the result  [030],269,2
Thousands in Moscow chant ‘Russia without Putin’,270,9
I drive by this crappy motel at least once a week,271,2
My Bert and Mary met their doppelgangers at Disneyland today,272,2
A stunt like Inhofe tossing a snowball on the Senate floor and claiming this refutes climate science actually tells you everything you need to know about giving the Republican Party power over government policy,273,2
And the Lord said Go forth and multiply,274,2
As a teenager in high school whos taken to the doctor by his parents,275,2
weeeeeeee,276,1
So this is an intersection in my city,277,7
My Roommate and his GF just did this to me,278,2
The frost on this Beaver Tails food truck makes the girl look like a zombie,279,2
His ears finally stood up after 3 months,280,2
Our new HR lady,281,2
How I feel about my doctor,282,2
My friend everyone,283,2
Vast Majority Of Us Would Prefer A Thicker Smartphone If It Meant A Better Battery,284,2
he sleeps in the weirdest positions ,285,6
Guy pretends to have won an Oscar walks around Hollywood reaping the benefits,286,2
Meh still counts,287,2
Flying kick at the skatepark,288,2
Unreal Engine 4 is now free,289,2
[AMA Request] A participant in the 1971 Stanford Prison Experiment,290,1
Took a picture of my hometown and realized it looked postapocalyptic,291,2
A student created a bank notes for a thesis project  and they are incredible,292,2
DEA warns of stoned rabbits if Utah passes medical marijuana,293,4
The guy who brings an acoustic guitar to the party,294,2
My dorms toilet paper is so thin you can take pictures through it,295,2
Kids today,296,2
Living the dream,297,7
Exxon Settles $9 Billion Pollution Case in New Jersey for Far Less Contamination and loss of use of more than 1500 acres of wetlands marshes meadows and waters in northern New Jersey has been quietly settled by the state for around $250 million,298,2
Out of all the perfectly timed photos this one trips me out the most,299,2
France wants companies to make appliances that last longer,300,2
This is gypsy She is far from mean but her permanent mean mug face will make you think otherwise,301,2
Press A to corn,302,7
TIL James Franco took up a latenight job at McDonalds a while back in order to support himself and take acting lessons While working there he practiced accents on customers and stopped being a vegetarian,303,2
After seeing the WBC plans on picketing Leonard Nimoys funeral,304,2
World record speed climber makes wall look horizontal,305,2
Scamming a scam company that target the elderly online,306,2
Americans Turning Away From Organized Religion in Record Numbers,307,2
You cant be serious,308,2
I feel so stupid,309,2
The shirt checks out,310,2
So thats why people would want to upgrade stamina,311,2
Unreal Engine 4 is now free,312,2
HOLY FU oh,313,9
Good morning Did you sleep well,314,2
Swirl Faucet,315,8
Screw it Im moving to Norway to hunt mythical beast,316,2
RIP rTheWalkingDead moderator uedify one of the nicest people Ive ever known I have been in contact with his family and set up a GoFundMe campaign to help offset the cost of his funeral expenses,317,2
An 8 year old prodigy Samuel Reshevsky defeating French masters in 1920,318,2
My roommate after trashing the apartment Thursday,319,7
Whats one harsh truth when it comes to datingrelationships,320,2
Roza Shanina 19yearold Russian WWII sniper with 54 confirmed kills in 1944,321,8
So poor they couldnt even afford a car with 4 seats,322,2
My friend didnt understand why people were honking and flashing their lights at him,323,2
uedify moderator of rBreakingBad and rTheWalkingDead passed away yesterday Users in his subreddits raise money to help his family cover the funeral costs,324,2
A furry old man,325,7
TIL Robert Liston is the only surgeon in history to have performed an operation with a 300% mortality rate losing his patient to infection accidentally amputating his assistants fingers who also died of infection and slashing a spectator who died from shock,326,7
The Writer an automaton made in the 1770s with 6,327,7
Correlation is not oh wait yes Yes it is,328,2
A Naughty Dogs homage,329,1
Fitness is for winners,330,1
TIL researchers found a single genetic mutation that occurred about 10 million years ago and endowed our ancestors with a stronger ability to metabolize ethanol As getting drunk off fruit would render one unable to defend territory or look for food selection favored those with the new mutation,331,2
Im sure everyone actually cares about the disease and it wasnt just a fad,332,2
Ive never posted with my chocolates before but I hope you like them,333,2
Peoples attention to detail are truly impressive,334,7
Eyes of God  Prohodna cave in Bulgaria,335,2
Pretty accurate to my life,336,2
I got a random text for somebody named Ash The opportunity was too good to pass up,337,2
Sister snuck this into my bathroom while I was in the shower Never been so scared in my life,338,8
Vladimir Putin on the murder of critic Boris Nemtsov,339,4
2500 caps later I ended up with this,340,2
Really intense mosh pit,341,7
The kind you love to invite again,342,3
Leonard Nimoy Funeral Westboro Baptist Church Cancels Protest Plans Can’t Find Where Funeral Will Be Held,343,2
TIL Contrary to popular belief Marilyn Munroe was nowhere near a plus size 12  16 she was closer to a US size 0  UK size 8,344,2
TIL Yoko Ono used John Lennons blood stained glasses from the day he was shot as a prop for her album art,345,2
Bet they hate when this happens from the geniuses of 9gag,346,2
He wants you ladies The psychology of guys checking out girls,347,2
Get all the one hit wonder bands together for a massive concert where they each only play their one song,348,2
PsBattle Little Girl Amazed By Huge Bowl of Soup (Pho),349,1
What is your single favorite episode of any TV show and why,350,2
I see your owl signs and raise you the signs in Scotland,351,2
Being very poor for 9 months has given me incredible perspective on things,352,2
Just noticed something subtly clever about The Gang gets trapped Am I over thinking this,353,2
How to Program (in four easy steps),354,8
He was the first pet I ever had I was 24 when I got him as a kitten 11 years later and he still cuddles like one,355,2
Which pokemon is most pimplike,356,1
MRW my controversial comment is being downvoted to hell but at least someone agrees with me,357,2
Unreal Engine 4 available for free,358,2
And thats actually why shes my ex mother in law,359,2
TIL Enzo Ferrari told a man you may be able to drive a tractor but you will never be able to handle a Ferrari Properly the man was so pissed he vowed to create the perfect car,360,2
TIL that before he died in a car wreck Walter Gehring discovered a segment of DNA called the homeobox that has the exact same parts in organisms as diverse as fungi and humans further indicating that all species evolve from a common ancestor,361,7
Pippi Longstocking Colored Pencil A4,362,3
A map that shows you where the ISS is over in real time,363,2
That look of shock,364,2
Eugene has the fastest reflexes [gif],365,7
Google to offer own cellular network plan,366,2
uPhilosoaxolotl requests proof of his fathers claim that he created a Dungeons & Dragons spell in the 70s uNerdcuse delivers,367,2
How did I not realise that,368,2
Dedicated to grandpa,369,2
Meine,370,5
TIL Paulownia is also known as the princess tree because it was once customary to plant a Paulownia tree when a baby girl was born,371,2
And she said it couldnt be done,372,2
MFW I find the last Cup in the Store,373,2
Doc McStuffins is now on the Do Not Watch list,374,2
Aw lookit his little paw print through the bowl,375,1
Sleazy lounge lizard pick up lines,376,6
pffflattt,377,8
Guy makes résumé using Snapchat to get job at Snapchat,378,2
Oh Civ you make me blush,379,2
MMA Fighter Jason Miller goes nuts after seeing his virtual players stats in a new EA sports MMA game,380,7
Russian chessmaster Kasparov Now theres no chance for a peaceful transition beyond Putin,381,7
Go,382,2
Finding cheating students using multiplechoice comparisons,383,0
Wait,384,2
Flying weasel,385,8
PayPal stops accepting payments for Kim Dotcom  s Mega service because it uses encryption,386,7
