Title,doc,topic
I purchased a 1st ed copy of A Tree Grows in Brooklyn and found a 70yearold note tucked inside I was able to reunite the book with the son of the original owner My local paper covered the story (Links to article and photos inside),1895,2
MRW my Asian postman delivers a package with no name or address on it,1896,2
Here comes the flood,1897,1
Cold front allowed me to finally rock my new jacket,1898,2
Ellen can be funny sometimes,1899,2
This Week in Science A Quantum Teleportation Breakthrough Modeling Potential MethaneBased Life on Titan 3D Printing Bones and More,1900,8
TIL In 2008 Doritos beamed a 30second advertisement into a planetary system 42 light years away in collaboration with EISCAT Space Center in Norway,1901,2
Oh Hello,1902,2
RI GOP official Steven Frias says research finds no economic benefit from having sports franchise,1903,7
I was at a home show and saw a company that makes deathstar firepits,1904,2
I met an old man in Petra Jordan He showed me this and said The Romans had fun while they were here,1905,2
I couldnt find Brynjolf so I decide to try and spawn him with the console I messed up,1906,2
History_Teacher reads Rengar like an open book,1907,2
This is the correct way to bring a village clean water,1908,2
rBreakingBad and other subs have raised $12460 $1318216 to pay for mod uedifys funeral He passed away in a house fire and his family cant afford this Were only $79216 away but the funeral home wants the money so we have to close the campaign later today,1909,2
This keyboard has a ctrl+alt+del key,1910,4
Still got it,1911,2
Oh well hello there,1912,2
Chris Evans dressed as Captain America visits Childrens Hospital with Chris Pratt,1913,7
TIL that during the 20s there was an orchestra in the Soviet union that was led by a committee instead of a conductor because the idea of a conductor was against Marxist ideals,1914,2
Heard an argument between the owner of a Corvette and a passerby,1915,2
MRW I learn theres giant methane storms on Uranus,1916,7
Dad and 8yearold son creating a punfueled food map,1917,2
♥ Golden Darn  VelKoz Montage  Sp4zie,1918,3
MRW I try to download something and The Pirate Bay is down,1919,2
Girls perform better academically in almost all countries,1920,2
ELI5 Whyhow is it that with all the incredible variety between humans practically every body has the same healthy body temperature of 986° F (or very close to it),1921,2
Remember to set your clocks back an hour tonight before going to bed,1922,2
Mybrand new lightsaber I have wanted a proper one for years Couldnt be happier with it,1923,2
When light strikes a metal a photon can excite an electron to leave Does the metal ever run out of electrons,1924,2
how the bottlerefill exploit works,1925,2
Pc Vs ConsolesThe real winner,1926,2
Chris Evans dressed as Captain America visits Childrens Hospital with Chris Pratt,1927,7
When ever a guy on Tinder asks me how its going they get this standard reply from me This is the first guy that bossed his reply He got a date the same day,1928,2
I feel selfish saying this but I honestly hate it,1929,2
Randall Cobb back to Green Bay on a 4year $40 million deal per source,1930,2
Go home shark youre drunk,1931,2
Could you repeat that please,1932,2
LPT If you have to iron a tie iron it from the back to avoid a shiny front,1933,2
Just gave someone Gold for the first time Then I realized it was the wrong comment,1934,2
First day home with new Great Dane puppy,1935,2
Kid with a kid,1936,2
I just cant stand her mom and hate when she visits (But I do love cats though),1937,2
Betty Paige 1950s Bad girl,1938,2
What I wake up to in the morning Not all the pets just these two Always these two goobers Right in my face,1939,2
Trying to find a new game to play on Android that isnt made for children,1940,2
TIL in Switzerland a group of citizens may challenge a law passed by Parliament if they gather 50000 signatures against the law within 100 days A national vote is scheduled where voters decide by a simple majority whether to accept or reject the law,1941,2
And it ends when you jump off a cliff,1942,2
‘Big Hero 6′ Hugs $605M Global Now Disney’s 3rd Biggest Animated Title Ever,1943,2
TIL that Jim Croces first album was financed by a $50000 wedding gift from his parents The money came with one condition; Jim must use it to make an album His parents rationale Jim would surely fail and thereby abandon his dreams of becoming a professional musician to get a real job,1944,2
Patrick Kramer GravityOil on canvas 24X36,1945,5
Hair spray cant melt steel beams,1946,2
A tornado sucks in a bright rainbow,1947,8
What is a personal flaw that you can openly admit,1948,7
Jagr brings back the mullet for a picture with some young fans,1949,2
I just noticed that New Vegas begins on the day it was released,1950,2
Exwife shows up to funeral of her former husbandIt Iooped three times before she finally found it in her purse to shut it off,1951,2
Donald Trump continues to be wrong about literally everything,1952,2
I love Nintendo After getting 1000 hits,1953,2
Neil Young & Crazy Horse  Hey Hey My My (Into the Black) [Rock] (1979),1954,2
I wore out my shoe and a Chinese symbol appeared,1955,9
Dallas Morning News today,1956,2
TIL worlds rarest insect is 15cmlong tree lobster that lives on 1,1957,7
LPTIf you work for a large company or organization that uses Microsoft Office products you might be able to get Office Pro for $1000 dollars,1958,2
TIL the Curiosity rover is powered by a chunk of onboard plutonium,1959,6
Creators of BF2 Mod Project Reality to release standalone on the Unreal 4 engine Squad,1960,2
Just a friendly reminder,1961,1
Mr Moogy was imaginary He had to be,1962,2
Did a subtle little tattoo of my favorite show,1963,2
Over a month of work and 25+ hours of total exposure time  M81 & M82,1964,2
Hehehe,1965,5
When posing with your computer got the ladies  Ha 1988,1966,2
HaHa ClintonDix just uploaded this on Instagram,1967,3
Ill just leave this here,1968,2
TIFU by hiding in the shower,1969,2
Kid with a kid,1970,2
I dont know why but Im laughing so hard,1971,2
Piglet and Impact A Look Back to Move Forward,1972,7
Pool Hustler,1973,2
Adults driving Barbie Jeeps down a hill,1974,1
How To Dr Boom,1975,0
Why you dont try to kiss a fish,1976,2
There should be dorms for single adults similar to the ones at colleges When you’re single life would be a lot better if you are surrounded by attractive members of the opposite sex and get all of your food made for you in a cafeteria,1977,2
Rubber Poppers,1978,3
Russian Magazine Features Putin Being Licked by Bear for Womens Day,1979,2
Who says gear storage cant look good,1980,2
[Image]This has been the single most motivational quote that keep me going day in and day out,1981,2
Would anyone be interested in Steam keycaps,1982,2
Suspect in Russian Politician’s Killing Blows Himself Up Report Says,1983,2
Love the detail,1984,3
Tinderella (xpost from rfunny),1985,7
LIFE according to The Simpsons,1986,2
TIL Israel Kamakawiwoole called a sound studio at 3am asked nicely to record got there 15 mins later then recorded Over the Rainbow in just one take,1987,2
An 8 year old girl feeds the crows in her backyard and they pay her back in trinkets,1988,2
My uncle has had a prosthetic leg for the past 18 years He swaps out legs every few years due to heavy usage This is his new one,1989,2
The community donated a van so that boy who was separated from the class during lunch as punishment for being late wont be late to school anymore,1990,2
They said he was crazy,1991,2
I eat dis,1992,2
My cousins lighter hes had for years He barely noticed the issue when I saw it for the first time today and pointed it out,1993,2
TIL Leonard Nimoy fought to get pay equity for Nichelle Nichols on Star Trek in the 1960s,1994,7
From now on maybe Grape Nuts should only be displayed in front,1995,7
My GF told me to turn down my screen brightness,1996,2
Its is my life  Jon Bovi,1997,8
What 2 years of filming and 5TB of footage look like,1998,2
Upon hearing that my friend wants one,1999,2
This driverless Volkswagon is cruising around San Francisco blowing everyones minds,2000,6
Smile,2001,2
fetish,2002,5
Long string wand flow,2003,2
Sand in the Sahara,2004,7
American CEOs,2005,7
Ever hate a game so much you,2006,2
What fact did you learn at an embarrassingly late age,2007,2
This is probably the most welldone parody video Ive ever seen,2008,2
This driverless vehicle has been seen cruising around the Middle East for years blowing up everyones minds,2009,2
Its so fluffy,2010,4
Wave bigger than the lighthouse its hitting,2011,8
Dogs first time seeing snow,2012,2
This guy sat in my section tonight & left a note on the back of his receipt,2013,2
Hello fellow rabbits,2014,2
I live on a boat This guy follows me to work every morning,2015,2
MRW my 90 year old grandmother told me she hates how I play violent video games so she ordered me Borderlands The Handsome Collection because Im her handsome grandson,2016,2
Photos of Jim Carrey in the makeup chair for The Mask,2017,3
As a parent reading that they are trying to find the right story to make Frozen 2,2018,2
me irl,2019,8
Jeb Bush believes net neutrality rules are the craziest ideas,2020,7
SAE Oklahoma packing up after getting kicked off campus for racist chants,2021,2
me irl,2022,8
At least RARE didnt lose their humor,2023,2
This couch looks as if its colours have been inverted in real life,2024,8
Kid said this in class out loud,2025,2
UK Parliament says banning Tor is unacceptable and impossible,2026,2
Everyone stared at me I quickly left the scene,2027,2
Katherine Hepburn only drank water throughout The African Queen production as a protest against John Huston and Humphrey Bogarts alcoholism However most of the cast and crew became sick from the water and only Bogart and Huston were unaffected because they only drank whiskey,2028,4
Seriously didnt you all play with Legos,2029,2
Most people are well dressed when they are buried,2030,7
Hi Im Muhammad President of ExMuslims of North America here with our leadership We envision a world where every person is free to follow their conscience Ask us anything,2031,2
It was 3 am at a gas station,2032,2
18 hours of data of the Rosette Nebula processed in a modified Hubble palette,2033,0
City Worker goes to Jail for taking out the garbage before 7 am in a rich Atlanta neighborhood,2034,6
Im 31,2035,2
Putin reveals Russia secret Crimea takeover,2036,8
This condo looks as if it is floating in the sky,2037,7
Well I am sleeping on the couch tonight,2038,7
To everyone on this sub who helps people with crazy tech problems,2039,7
I didnt quite get this Simpsons joke as a kid,2040,2
A faucet that creates water patterns to save water,2041,2
Nobody should have to sit on glass,2042,8
Show some respect,2043,2
Thats not how you steal the purse,2044,2
What it seems like all other superheroes are up to during standalone movies,2045,2
Cleaning out some of my dads old files I dont know what I expected,2046,2
Giant dune,2047,7
TIFU when our cat showed up to his own funeral,2048,2
103987 toothpicks later…,2049,4
These cats must somehow know my wife is pregnant every day like a magnet,2050,2
A Dead Space painting my friend did for me,2051,2
All knives are beautiful (OC),2052,2
AVG develops glasses that can protect the wearers identity from facial recognition software,2053,1
What a nine year friendship looks like,2054,2
A much more likely representation of the new Apple Watch,2055,2
Blastoise used rain dance,2056,1
Monkey see Monkey do,2057,7
Works for nearly every occasion,2058,2
Its replayed at least twice a day for the past week,2059,2
A stranger leaves a waiter a $25000 tip to provide for dental surgery Smiles all around,2060,4
Dallas Morning News accidentally prints placeholder text and redditors do the same for a generic reddit thread,2061,2
Satisfaction when a customer wants to complain,2062,2
Bambi and Thumper,2063,4
LPT When online shopping begin the check out process but do not complete it The website will send you coupons to encourage the sale,2064,2
TIFU by teaching my 4yearold the phrase godless liberals,2065,4
I really need to learn to keep my mouth shut,2066,2
Liquid rubble,2067,2
Radical Vaccine Design Effective Against Herpes Viruses,2068,4
I was fired from work for taking this disgusting photo of improper food handling in the kitchen,2069,2
Anchors sink Why is that so hard to understand,2070,7
A group of 47 Republican senators has written an open letter to Irans leaders warning them that any nuclear deal they sign with President Barack Obamas administration won’t last after Obama leaves office,2071,2
My friend just did a perfect F,2072,2
Conan OBrien and Bob Odenkirk in the SNL writers room 1988,2073,3
Sign the petition to remove In God We Trust from the Mark Twain commemorative coins,2074,2
True loves kiss is Disney for and then they boned,2075,7
This makes me happy,2076,2
Found this little guy hiding under my lawn mower (Dont worry his mom came back for him),2077,2
My meal prep Sunday,2078,7
It just isnt your day,2079,2
Baby girl all grown up ),2080,2
Scaring a cat in GTAV (xpost from rPS4),2081,7
My dad in 1984 He lived by himself in this little place in Alaska for 5 years before he met my mom,2082,2
So I found this at my local gamestop,2083,2
Silverback gorilla doesnt like the painters,2084,2
This little girl is as American as they get,2085,2
This billboard has been erected in ‪Iran‬ It reads as follows Have you ever seen ‪Batman‬ or ‪Zorro‬ getting defeated No because their Hijab is proper So you too mind your Hijab sister,2086,2
If a tattoo artist pays a stripper back with tattoos would that be the only truely TitForTat relationship,2087,2
University of Oklahoma fraternity Sigma Alpha Epsilon on a bus chanting There will never be a n***r at SAE,2088,7
These make me uncomfortable,2089,7
My brisket,2090,5
Cats are magnificent creatures,2091,1
My security camera emailed me at 5am that it detected movement,2092,2
Poll Fox News most trusted network,2093,7
Of Canadas antiterror bill C51,2094,2
My exwife of 15 years divorced me 3 months ago to be with my best friend Successfully cut her out of my life,2095,2
San Andreas Movie Poster actionadventure disaster film starring Dwayne Johnson,2096,7
Meet Toby His previous owners abused him but has a huge heart Literally,2097,8
Oh My God,2098,2
[SERIOUS] People who have had amnesia and recovered what was it like not knowing who you were,2099,2
Collection of my space photos made by scanning household items Scanography,2100,2
My golden tasting lemon for the first time,2101,2
I got this,2102,2
Unidentified gunmen kill more than 12 Islamic State militants in eastern Syria,2103,2
Failure to process,2104,6
[Serious]Reddit whats the closest youve ever come to dying,2105,2
HBO Now is launching as an Apple Exclusive,2106,1
A real creature straight out of Hayao Miyazakis Movie,2107,4
All this foreshadowing is getting a little ridiculous,2108,2
PsBattle The Mountain crushes skull anywhere he goes,2109,1
Glitch Carpets handwoven thread by Faig Ahmed,2110,5
Grandpa has it all,2111,2
Skyrim modders come together to honour Taylor and Bear,2112,2
I just watched a movie about a y=x graph,2113,4
Bladesmith quenching sword,2114,5
ELI5 Why is there a country called Turkey and an animal called turkey when the two have nothing to do with each other Is there any relationship between the two or is it just coincidence,2115,2
[NO SPOILERS] The greatest twist of all,2116,7
One of my roommates and I had a productive day the other one is a scumbag steve,2117,2
An Itsy Bitsy Pygmy Possum,2118,1
God makes little girl gay,2119,2
Found this in a bathroom at my university,2120,2
I told her she couldnt chase a squirrel this was her reaction,2121,2
With the game on the line Dave knew it was his chance to shine,2122,7
I spotted this renaissance classic inside a local sports bar,2123,2
Tools of the Trade,2124,7
What do you say to that A no didnt seem sufficient,2125,2
Duty Calls,2126,7
Spotted at Hornchurch Country Park Guess its official,2127,2
FINALLY,2128,2
TIL that IBM has stated that the Scroll Lock key on your keyboard does nothing When PC Magazine asked an executive of keyboard manufacturer Key Tronic about the keys purpose he replied I dont know,2129,2
[SPOILERS] [S5E13] Boogeyman checks for Carol,2130,0
TILWhile serving abroad in World War II Christopher Robin Milne began to resent what he saw as his fathers exploitation of his childhood and came to hate the Winnie the Pooh books that had thrust him into the public eye,2131,2
I gave my wife a kidney Ask us anything,2132,2
Foreshadowing,2133,7
How to master profile pics when you have no friends,2134,2
Lost figures at the LCS on Sunday,2135,2
I wouldnt say if was all smooth sailing,2136,7
Dear freeweek supports; play whatever the heck you want but get a damn sightstone,2137,2
Conversation with my peasant brother and we missed TWD because we played LoL,2138,2
Built a little house for this stray cat,2139,2
New supplement,2140,2
Eiffel tower the handicapped,2141,5
Coffee Table with Lift Mechanism,2142,2
TIL that wolves have musical culture that changes depending on geographic location Though mutually intelligible howls of European wolves are much more protracted and melodious than those of North American wolves whose howls are louder and have a stronger emphasis on the first syllable,2143,2
[WP] A new invention enables people to remember their dreams with absolute clarity It turns out we were forgetting them for a very good reason,2144,2
This dog and this fox are real bros,2145,2
What are some internet classics no one talks about anymore,2146,2
Bladesmith quenching sword,2147,5
New Tomorrowland trailer Starring George Clooney Directed by Brad Bird,2148,4
Blastoise used Rain Dance (xpost rpokemon),2149,1
All she wanted for her birthday,2150,2
The World Congress [OC],2151,2
The Freshest Lobster Pasta you can get,2152,7
We have found them all (xpost rautos),2153,2
Must have overshot the Wadsworth constant,2154,2
I know most will find this disgusting but to me its probably close to the most satisfying feeling in the world,2155,2
you keep your stress in your neck dont worry I work it out okay,2156,2
In a relationship,2157,2
What Happened To All Those TF2 Killers A Look Back,2158,2
A thought this sub would enjoy this,2159,2
Meanwhile in England,2160,3
[Serious] Israeli redditors what is your honest opinion on how the crisis with the Palestinians should be resolved,2161,0
Neuroscientists have implanted false memories into the brains of sleeping mice Using electrodes to directly stimulate and record the activity of nerve cells they created artificial associative memories that persisted while the animals snoozed and then influenced their behaviour when they awoke,2162,7
Cooking with kitty,2163,2
My cat used to want nothing to do with me Now that I have a fulltime job this is how Im greeted every day,2164,2
maturity,2165,8
U of Oklahoma President Boren to racist SAE frat boys You are disgraceful Disbands frat and gives them all until midnight to leave their frat house,2166,7
[Gettin] Source the #49ers are bracing themselves for the loss of LB Patrick Willis Expecting him to retire,2167,5
(No Spoilers) GRRM just confirmed that TWOW did not come out in 2014,2168,9
When my laptop is plugged in and Im using headphones there is essentially a continuous string of wirestechnology connecting my body to some power plant miles away,2169,7
New Yorker Magazines take on the return of baseball,2170,2
100% of the enemy in 3 shots,2171,6
Time to eliminate daylight savings,2172,7
Irans Foreign Minister To US Senators The World Is Not The United States,2173,2
Pit bull owner dies from heart attack another man attempts cpr pit bull kills man while trying to resuscitate him,2174,7
What is the most interesting origin of a word you know of,2175,2
Saw this at my college,2176,2
The Siberian flying squirrel is the only species of flying squirrel found in Europe It is considered vulnerable within the European Union where it is found only in Finland Estonia and Latvia,2177,2
My friend just recently started playing He has great potential,2178,2
The ESRB has revealed what caused the Batman Arkham Knight M rating,2179,2
My biggest Regret is Losing Her,2180,7
The Cookie Monster,2181,3
TSM LEFFEN,2182,1
Ultrons ultimate weakness,2183,7
The Cranberries  Zombie [AltRock] A song with a strong message behind it highlighting the prevalence of violence during the troubles in Northern Ireland,2184,6
Never thought I would see this happen to me Tree of Win,2185,2
MRW the web developer intern mistakenly used <b> tags instead of <br> tags,2186,6
Rush Hour Botlane The Escape,2187,2
My friend made this after seeing that the new Macbook will have only one USBC port (xpost from rfunny),2188,7
It saves me from listing everything we have in the pantry for the 10th time today,2189,2
I always get nervous that Riot will nerf a champion just for being flavour of the month,2190,2
Putin Signs Amendments Lowering Penalties For Bribes,2191,0
ELI5Why are some insects like cockroaches and ants afraid of humans while others like flies and moths are not,2192,2
The Gabest of lines,2193,6
(Kingdom of the Crystal Skull) How Indy survives the nuke,2194,0
Nords are awesome but,2195,7
Right in the feels,2196,2
A friend said that it was silly that smoking marijuana could have lots of tar,2197,2
Valid questions,2198,9
Russell Westbrook with his 5th triple double in 6 games,2199,8
What happens when my laptop get too hot while playing Skyrim TIL Pizza Box + Box Fan = Happy Laptop,2200,2
The most recurrent word on each country’s Wikipedia page,2201,2
Fluorescent tubes under 400kV line,2202,7
Part Time Americans (2015)  My doc was featured as part of John Olivers segment on territories last night I thought Id share it in full,2203,2
This was up at the comic book shop I go to,2204,2
Whats a perfect date for you,2205,2
After being down voted and ridiculed for correcting someones spelling and grammar,2206,3
[Tutorial] for my Smokey Winged Eyeliner look  as requested,2207,7
Science AMA Series I’m John Treanor chief of Infectious Diseases and vaccine researcher at the University of Rochester Medical Center in Rochester New York AMA,2208,2
Burger King drops soft drinks from kids meals,2209,7
Regarding A Certain Outift,2210,6
The GirlScouts should name their cookies after famous women of history,2211,2
Had to make our own grill,2212,7
Ruths account of the Whistlers  Part 4,2213,2
[S5] Season 5 Trailer #2,2214,2
Luke hit Vader in the neck not the shoulder [ESB],2215,8
How to know youre going to lose in EU mm,2216,2
Let´s roll through the week like my little bunny,2217,2
Splashing,2218,5
MRW I see a post on Twitter or Facebook,2219,2
[Haiku] you can never have too much cheese,2220,7
AngryDad having trouble with the sprinkler,2221,5
Bangladesh upset England in the Cricket World Cup to reach the quarter finals and knock England out,2222,2
Fastfood employees of reddit what is the most disgusting secret that your chain keeps from the public,2223,2
How I feel when playing Gun Game in Counter Strike,2224,2
My schools brilliant method of disabling cd drives on student computers,2225,6
Anyone else find it hard to get behind teams as key players dont stay around long enough for us to care as spectators,2226,2
This morning at 5am my cat gave me a present of plastic grocery bags It didnt wake me up so he must have thought that I didnt approve So he woke me up by laying a foil sheet (covering my toaster) on my pillow next to my face promptly waking me up Im very loved by my kitty,2227,2
Why Why waste this space So unnecessary,2228,8
I made an Innistrad themed draft cube  vampire slayer kit (details in comments),2229,7
A Baby Skunk,2230,6
When flash bangs fail,2231,5
It just keeps pouring on the 49ers apparently FB Bruce Miller was arrested for spousal abuse on March 5th,2232,7
My old dogbert,2233,2
My niece decided that her cats should sleep in bunk beds,2234,2
Igor is my brotherinlaw He and my sister have been living with us for the last few monthsI present Life With Igor,2235,2
Zoolander just walked the runway at Paris Fashion Week,2236,2
So my sister is in Paris today,2237,2
Apartment building in Turin holds 150 trees,2238,2
Came back to this after a nap,2239,2
Avalanche Ah Screw it Back flip time,2240,7
My mates Dad is officially having a mid life crisis He ordered this from Thailand,2241,2
The best preowned game cover i have ever seen,2242,2
Pope Francis has called for greater transparency in politics and said elections should be free from backers who fund campaigns in order to prevent policy being influenced by wealthy sponsors,2243,2
me irl,2244,8
When your dive buddy makes this signal,2245,2
Heres how my 9year explained Net Neutrality to his friend,2246,2
Pup found on route 17 No ID Rutherford pd found,2247,2
4foot shark eaten in one bite by huge Grouper fish,2248,8
I awoke from my nap up to find this puppy fast asleep,2249,2
People who wear tapout clothing,2250,2
When my wife goes out with her friends,2251,2
My 5 year old daughters Looney Tunes coloring book has an unsolvable maze,2252,2
Wikipedia is suing the NSA By tapping the backbone of the Internet,2253,9
I am Sir Tim BernersLee inventor of the Web Join me to talk about making the future of technology more human reddit AMA,2254,7
This is why I watch old Whose Line episodes,2255,2
Fair enough,2256,4
Did 47 US Senators Just Commit Treason By Attempting to Sabotage Iran Deal,2257,7
If an astronaut tells you how to pose for a pictureyou pose for the picture,2258,1
How the Panama canal works,2259,2
How the people who can afford the $10000 Apple watch feel about the critics,2260,2
Relationship problems,2261,7
Redditors 9 year old son explains net neutrality better than anyone else ever has,2262,2
An Italian church in the middle of fall,2263,2
Fast as fast can be youll never catch me,2264,2
Earth from Mars and Mars from Earth,2265,0
Spring,2266,2
