Title,doc,topic
I care more about being invited than i do about going to the actual event,4108,2
Poll Young Americans fear they will be worse off postTrump,4109,2
Dog hammock,4110,2
Russian soldiers feeding a polar bear from their tank 1950,4111,1
Man has never been so flabbergasted in his entire life,4112,2
Through the uprights and its good,4113,2
I like Marios and zeldas,4114,8
[Homemade] Some woodland themed shortbread cookies for a baby shower Decorated with royal icing,4115,7
Megathread Barack Obama commutes Chelsea Mannings prison sentence,4116,9
So ridiculously proud of him Roger is a therapy cat and we visited a new assisted living this weekend and he did amazing Circulating among patients sitting in laps spreading joy,4117,2
Astrology makes everyone get to feel special while astronomy makes everyone get to feel insignificant,4118,2
Knifeclops and Wolverbeam,4119,1
Watched this guy try and drift a corner in an ice storm,4120,2
Im gonna get you  wait what,4121,2
Having a great picnic,4122,2
Just makes my heart melt,4123,2
Crosby who wears #87 pulls into tie for 87th alltime in scoring after winning an 87 game,4124,7
This man helping his disabled corgi on a walk,4125,2
Decided to tell my dad a joke from rjokes today Just to clarify the drugs were prescribed by a doctor,4126,7
Master Skywalker by Rafa Castorena,4127,8
Move over Sombra we have a new stealth hero,4128,2
Betsy Devos wants to use Americas Schools to build Gods Kingdom,4129,2
TIL When Australia beat England in a cricket match in 1882 a British newspaper published an obituary proclaiming the death of English cricket The symbolic ashes of its cremation were placed in an urn and both teams still compete to win them back every two years,4130,2
Anyone else hoarding an unhealthy amount of candy for anything,4131,2
Caught them,4132,2
Titanfall 2 is one of the most fun games Ive played More people should be aware of how awesome it is,4133,2
Nonlinear warfare (2014) Adam Curtis discussing how missinformation and media confusion is used in power politics 507,4134,2
These poorly photoshopped stolen photo ads seem legit,4135,2
New Zenyatta buff soon coming to the PTR,4136,2
I wish either of them looked at me like they look at each other,4137,2
A still photo I took from a video I took with my cell phone camera,4138,2
My brother got married this weekend Here was the cake,4139,7
Pyramid Sunset,4140,5
Hi Reddit I am Joseph Glajch the Director of Analytical Development for Momenta Pharmaceuticals Ask me anything about biosimilars or what it’s like for chemists to work in the private sector,4141,2
Reid Parks Baby Nandi in all her glory,4142,1
team work,4143,2
Dog Hammock,4144,2
Why wont Clinton Democrats like Sally Albright stop lying about Bernie Sanders,4145,2
TIL its incredibly difficult to read text during your dreams This is precisely why Inception doesnt have even a single dream sequence of people reading text,4146,2
15 Year Old German Soldier After Being Captured 1945,4147,2
Sometimes chickens need hugs too,4148,7
TIL  2000 was the first year Martin Luther King Jr Day was officially observed in all 50 states,4149,2
A 3 hour flight home Dont mind if I do,4150,2
The Big Dipper as it was The stars are in motion and they do move albeit very slowly This is how the Dipper would have appeared to our ancestors 50000 years ago,4151,2
me irl,4152,8
I dont know how I can make it more clear,4153,2
[UPDATE][NC] Our neighbor told us hed killed seven people Roommate is freaking out and wants to move What are our options here,4154,2
[Post Game Thread] The Golden State Warriors (356) Massacre the Cleveland Cavaliers (2911) with final score of 12691,4155,7
One of a base jumpers worst nightmares,4156,2
Never thought opening a bag of chips would make me sad until our dog passed,4157,2
Me😑irl,4158,5
long boyes,4159,4
Serenity [1920 x 1080],4160,5
This bathroom closure,4161,2
We are improving our product Pray we dont improve it any further,4162,4
My cousins wife He had planned this for more than two months,4163,2
Trump plans to take off his first weekend in office,4164,2
KD with the block on LeBron,4165,8
How are some Redditors able to consistently show up at the top of rall on a daily basis while many OC creators never get to achieve this once,4166,2
Nude Beach,4167,4
When Donald Trump talks remember that Donald Trump almost always lies,4168,2
Rick and Morty playing behind Batman in the Justice League trailer,4169,2
Figure Ocho Racing,4170,1
Besides Take On Me what are the quintessential 80s songs,4171,2
My Trump Chia Pet Only Received Sunlight From the Right Resulting in a Perfect Comb over,4172,2
The Subway Traveler,4173,2
First tattoo by Harriet Hapgood @ Good times London ),4174,2
[Booker] How cheap is your tart,4175,2
Koala Skeleton 3DVR from a CT scan,4176,7
Since were on about croc carnage today heres some more,4177,2
We will turn on him so quick Rust Belt voters who put faith in Trump expect results,4178,2
A white guy a black guy and a Chinese guy go to work at a coal mine,4179,2
Tax Filing Software Megathread A comprehensive list of tax filing resources,4180,2
When you open the front camera on accident but it doesnt matter because youre glorious,4181,2
The New England Patriots are now 150 in games Deion Lewis has played,4182,2
Unlike Trump Americans want strong environmental regulator,4183,2
Team Skull vs Snorlax at Magfest,4184,1
Trump’s Health Secretary Pick in Trouble Over Insider Trading Accusations,4185,2
This TurboTax fake review is LIT AF FAM,4186,2
Guy I know has an encounter with his ex from middle school,4187,2
[Meme] Carl Wheezer is a Heathen,4188,1
Happy dog is happy,4189,2
AskScience AMA Series Hi Im Kate Adamala biochemist working on building synthetic cells Ask Me Anything,4190,2
Thats one mean mother,4191,2
I bet if they said live edge it would have sold for more (xpost from rfunny),4192,2
Pls to boop snoot,4193,9
I Am catch 22 Filmmaker Josh Folan and I Make Real Movies With Basically No Money,4194,2
[Haiku] Gus knows what he wants,4195,2
[Besiege] Facehugger,4196,9
Why do people insist on saying that only jedisith can wield a lightsaber when Han Solo used one in the empire strikes back,4197,2
A new HIV neutralising antibody called 101074 has been successfully shown to suppress viremia in HIV1infected individuals in a new human trial published in Nature Medicine by US and German researchers,4198,2
Overgrowth is now in BETA,4199,4
[Screenshot] The PlayStation retail site has jokes,4200,2
CIA chief categorically denies he leaked dossier calls Trump’s comments ‘repugnant’,4201,2
That strength,4202,4
RIP Bitcoin Its Time to Move Onfunny billboard driving around in Miami,4203,2
To the newly engaged couple  I hope this picture finds you Congratulations,4204,2
People running backwards put in reverse looks like theyre being chased by something mildly dangerous,4205,2
TIL an estimated 1 in 4 Alabamans are functionally illiterate meaning theyre unable to manage daily living and employment tasks that require reading skills beyond a basic level,4206,2
Unintentional modern art,4207,2
where am i,4208,0
These video game graphics look like real life,4209,2
When an old girl gets a second chance,4210,2
Elephants trample poacher to death another poacher seriously injured,4211,2
Ohh the irony,4212,0
TIL in 1995 convicted killer Daniel Luther Heiss discovered that the key pictured on his prisoners information handbook was the masterkey for the whole prison Fellow inmate Shane Baker a trained jeweller replicated it and both escaped,4213,0
Trump reportedly has written his own inaugural address how can we turn it into a drinking game,4214,2
Well then,4215,2
This layer of ice looks like cling film,4216,8
TIL Lionel Richie grew up in racially segregated Alabama and once unwittingly drank from a whites only fountain White men confronted his father who grabbed Richie and ran off Richie asked his father why he didn’t stay and fight His dad answered “I had a choice to be a man or be a father”,4217,2
Birthday boy was all smiles,4218,2
The abortion rate is at an alltime low — and better birth control is largely to thank Use of contraception especially the most effective methods like IUDs and implants did much more to reduce abortion rates than restrictive laws,4219,2
Shoe game on point,4220,2
In the next 20 years everything on raww will most likely be dead,4221,2
My friend went to a wedding Someone took this Enjoy internet,4222,2
LPT When going to a casino everyone always sets a limit of how much they are willing to lose But just as important set a reasonable number that if you do win thats when you walk away,4223,2
You wanna take a picture of me,4224,2
Caved and bought YouTube Red Instant regret,4225,6
George Best what a man,4226,2
44 Sitting Members of Congress Have Accepted Donations From Trump,4227,2
LPT If youre already having a terrible day do as many things that youve been dreading that you can,4228,2
Here Comes The Sun  acrylic on canvas 90 x 60 cm,4229,2
Wholesome pranking,4230,7
MRW a website says Weve noticed youre using an Adblocker,4231,2
I would be flattered but,4232,2
I broke my ring finger when I was a kid and now when its cold out its the only finger that doesnt respond,4233,8
I am Mason Tvert and I am working to legalize marijuana in the United States I represent the nation’s largest marijuana policy organization AMA,4234,2
Crowded train,4235,2
After Snowden showed everyone how much the US tracks peoples browsing,4236,2
2016 was the third annual temperature record in a row and the warmest year on record [OC],4237,2
Garbage Trucks,4238,0
Harlem antiwar protester 1967,4239,8
This 4 man backflip,4240,2
In English there are certain phrases said in other languages like cest la vie or etc due to notoriety or lack of translation What English phrases are used in your language and why,4241,2
Man Gives His Cat 11453 Stern Looks,4242,2
Eating a Nature Valley bar,4243,7
[Image] My friend found a poem that his daughter wrote I think it belongs here,4244,2
DNC CHAIR CANDIDATE TOM PEREZ REFUSES TO SUPPORT BAN ON CORPORATE MONEY AND LOBBYISTS,4245,2
This is my dog Her name is Honey and shes old,4246,2
Citing grizzlies education nominee says states should determine school gun policies,4247,2
Eartha Kitt by the pool 1957,4248,4
Classic example of someone wanting to be full time just for the benefits,4249,2
A new study finds parents who talk with their high schoolers about science and math can increase competency and career interest in the fields The findings show a 12% increase on the science ACT for students whose parents were provided with information on how to convey the importance of science,4250,2
Thievery,4251,1
When the other team bails but sportsmanship is life,4252,4
Do we know if this has any merit at all,4253,2
This is by far my best Hanzo POTG,4254,4
Time to Start Fresh,4255,8
The Godfathers of Beyblade battle it out,4256,5
How Louis CK tells a joke,4257,9
[homemade] Bacon fresh out of the smoker,4258,8
pic pls,4259,2
My ingrown beard hair was a tiny hair spring,4260,2
Swedish supermarkets replace sticky labels with laser marking Food retailers aiming to cut plastic packaging by ditching stickers on fruits and vegetables instead using hitech ‘natural branding’,4261,8
Tesla is investing $350 million in its Nevada factory and hiring hundreds of workers,4262,2
Fountain in Singapore,4263,5
Trump meets with potential Supreme Court nominee who wants gays jailed for having sex,4264,2
Shiny Gengar in the middle of mega evolving,4265,9
A guy in a pub is trying to prove to his girlfriend that hes at home in bed,4266,2
Biden calls Russia biggest threat to international order  Under President Putin,4267,2
My best friend for the past ten years,4268,2
Something to cheer you up ),4269,7
Bob at it again with the MADNESS,4270,7
My Home Library app aims to close the book gap by pairing donors with lowincome kids Each kid makes a wishlist of books that donors browse to sponsor a specific childs personal library,4271,2
Pioneering a new front for the glorious pc master race  DIY side panel LCD window,4272,2
[Image]Kevin Spacey on achievement,4273,4
Youve got a friend in me,4274,2
[Haiku]I am sold,4275,7
2000 GM workers to lose jobs on Trump Inauguration Day,4276,2
This group wants to fight ‘antiscience’ rhetoric by getting scientists to run for office,4277,2
Please stop that,4278,2
Inexpensive minesweeper,4279,7
aids,4280,5
In 500 years NASA could be a travel company,4281,2
12 Reasons that the Oceans 12 laser dance confuses me,4282,4
Matches Prank,4283,4
My aunts know the importance of checking their facts,4284,2
The Discovery Official Trailer starting Rooney Mara and Jason Segel,4285,1
Graph of numbers connected by divisibility center point is 1 first ring are primes second ring are (generally) numbers with 4 divisors and so on [OC],4286,2
The Indian Roller,4287,2
I thought the hair made me look cool I sometimes wore it in a pony tail Im a guy,4288,2
Sea Lion Plays a Game of Drag and Drop,4289,2
Chivalry alive and well,4290,2
Seriously boys,4291,2
Its so fluffy,4292,5
Sombras Highlight Intro is the closest thing to a CoOp POTG,4293,4
Colorado Flat Irons by  me Harry Catsis Bound By Design Denver CO,4294,2
ELI5 Why is Judaism considered as a race of people AND a religion while hundreds of other regions do not have a race of people associated with them,4295,2
I am a Jedi,4296,4
Overly Dramatic Cat,4297,7
Im sure thats great for a childs development,4298,2
meirl,4299,6
Redditor asks if Gabe Newell (president of Valve) knows about Valve News Network He says no 5 minutes later he agrees to an interview with uvalvenewsnetwork,4300,2
Please look at this picture of a dog if youre having a bad day,4301,2
My Monthly HQG Employee Evaluation,4302,6
Words to live by,4303,2
WATCH Al Franken destroys Education appointee Betsy DeVos over her support for gay conversion therapy,4304,2
Hey rDnD is trending Roll for Initiative,4305,8
that is not berry nice,4306,2
Lions watching The Lion King,4307,2
Me when I found this Sub 🤓,4308,2
good reason to not have kids,4309,2
I didnt really have anywhere else to go anyway,4310,2
Kawasaki to Stop Sponsoring ‘Apprentice’ Because of Trump Involvement,4311,1
Study finds links between swearing and honesty Psychologists have learned that people who frequently curse are being more honest,4312,7
What did the weird kid do in your school that youll never forget,4313,2
Making some voxel art through Minecraft enjoy,4314,2
On the train comparison between the Switch and PS4,4315,2
How much does homefield advantage help you Belichick I dont know Go ask Dallas and Kansas City,4316,2
Taliban bomb expert accidently kills himself and 4 sons,4317,8
Its Always Sunny FB page shuts down annoying nerd,4318,2
ITT  Share your favourite doctored MMA Gif,4319,6
I put a black hole in my living room,4320,2
Girlfriend just finished an oil painting of Senna,4321,2
How to BM as Ana,4322,1
Chancellor Palpatine memes on the rise invest now,4323,2
Took this picture of my new buoy and it looks like a minimalist rendered wallpaper,4324,8
I didnt do it,4325,2
Old person #1 mistakenly gives a bad 5 star review Old person #2 decides its the perfect ad for their Facebook campaign,4326,2
Who said the Empire couldnt be dank,4327,2
StellarisCivilization VI photos almost lineup perfectly,4328,2
She was not prepared,4329,2
If a car wore pants,4330,2
continental breakfast,4331,2
Long Shot,4332,2
TIL In 1954 the CIA deposed a democratically elected Guatemalan president and replaced him with a dictator to save investments in a banana company,4333,2
[Poetry] Paul Ryan gets asked a question,4334,2
Trains are awesome,4335,2
Spurgeon catches the puck and bats it into the net (courtesy of uChariotOfFire),4336,5
[] Ive made some creepers who fail to explode and then run away in shame,4337,2
Cant tell if this is the cast of The Phantom Menace or ABCs next sitcom,4338,2
Deltron 3030  Upgrade [hiphop],4339,2
Actually There Is Not a Lot of Debate Sanders Forced to Correct Trump Nominee on Climate Science,4340,2
This is probably a long shot but I won AMAZs 50 pack giveaway and someone faked my identity and I dont know what to do,4341,2
Charisma check,4342,2
The hardest choice,4343,2
He grew up so fast,4344,8
A man goes into a restaurant with his pet snake,4345,2
I have accumulated over 1200 uncommon and rare Pepes I will flood the market rendering all Pepes worthless unless I am paid $10bil USD You have until Sunday,4346,9
After a long vacation this is how my boss welcomes me,4347,2
me irl,4348,8
Squirtle squad,4349,9
Lake Charlevoix in Michigan right now,4350,2
My friends constantly tell me I need to watch Its Always Sunny in Philadelphia I had no interest until they had me watch this clip,4351,2
31 years,4352,2
Singer stops show to rescue harassed Girl,4353,2
Take me down to New York City,4354,2
[WP]Today I found a 1949 British Shilling in my change This is particularly interesting as I live in Pennsylvania It must have had one hell of a journey since 1949 Tell me how it made its way to me,4355,2
Dog slipping on ice,4356,9
so my comment got featured in a CollegeHumor article,4357,2
President Obama Pardons Georgia Man Imprisoned For Being Gay In The Military,4358,2
The saddest book of all,4359,2
Organic Gummy Cherries,4360,6
Jumping over legs,4361,2
Teen son,4362,2
Nursing homes in 50 years Look behind the couch,4363,2
TIL that a child was prosecuted as an adult for having naked images of himself on his own phone,4364,2
So it took me a while to figure out names for my new wifi with guest network,4365,2
The art of the 5050,4366,2
Incredible 4 man backflip,4367,2
How These Bricks Happen,4368,2
Made a behind the couch shelf out of a fallen cherry tree Let mekmiw what you think Also Ive never posted an album before hope i did it right,4369,2
Joe Biden Russia Is Trying to Take Down Democracy Around the World,4370,2
Eat the Apple,4371,2
Trump Says Hell Show Off The US Military In Parades,4372,2
[NO SPOILERS] HBO has fun crosspromoting Last Week Tonight with GoT and other shows,4373,2
They see me rollin they hatin,4374,2
29 year old girl goes insane over cancelled date,4375,2
Call me Captain Vader,4376,2
me irl,4377,8
Like a cat to water,4378,2
Obama climbs to 60 percent approval in final presidential approval rating PostABC poll finds,4379,2
Harry Potter fan base in a nutshell,4380,2
A photo I took showing the diversity of Hong Kong,4381,4
TIL that writer Walt Whitman volunteered during the American Civil War by writing countless letters on behalf of soldiers some of whom were illiterate or were dying back home to their loved ones,4382,7
I guess it may be humorous for the uneducated andor low IQ folk,4383,7
It really ties the babys room together,4384,2
woof_irl,4385,0
How different animals see the world compared to humans,4386,2
When a real person coughs its no big deal but when a movie character coughs Im 99% sure theyre going to die,4387,2
If the world only had 100 people,4388,2
Even forced confidence helps,4389,2
29 year old girl goes insane over cancelled date,4390,2
[Kavner] Chris Paul will need surgery for a torn left thumb ligament Likely out 68 weeks,4391,0
What did Germany do after WWII that made it become an economic power,4392,2
A boy is writing a paper on childbirth and asks his parents How was I born,4393,2
This USB front panel was amazed to be part of my PC,4394,2
Party ice breaker,4395,9
This shadow on my neighbors shed looks like a dog face with a monocle,4396,2
Me_irl,4397,9
I voted for Donald Trump and I already regret it,4398,2
me irl,4399,8
Late to work,4400,2
Shout out to my mom,4401,2
Huntsman Cancer Institute researchers finds elephant protein destroys human cancer cells,4402,2
TIL Steve Harvey once gave a winning Family Feud contestant an additional $25k of his own money after later finding out the contestant was terminally ill and doing everything he could to support his family,4403,2
Lowcost Android One phones reportedly coming to the US,4404,2
This game is too cute sometimes,4405,7
Denver starts work on allowing marijuana in public a first in US,4406,2
In retraction request to CNN Trump team confirms CNN story,4407,2
Gaben AMA Summary,4408,2
Republicans Say They Assume Trump Didnt Mean To Promise Health Insurance For All,4409,2
Binging with Babish Kevins Famous Chili from The Office,4410,5
31 years,4411,2
Sign me up for Box Wars ,4412,2
The Devil of Hells Kitchen,4413,1
Paul Ryan Is Lying In Order To Destroy Medicare,4414,2
MaximusBlack defeats jade,4415,7
Betsy DeVos Just Flunked Her Senate Test,4416,2
A guy in Russia mounts a surveillance camera over his apartment door Neighbours arent very happy,4417,2
[Spoilers] Kono Subarashii Sekai ni Shukufuku wo 2  Episode 2 Discussion,4418,2
Nice try Satan,4419,2
People that voted for Trump and now regret it what was the straw that broke the camels back,4420,2
Opening scene from the Matador  an excellent movie that never really gets a mention It also has one of Brosnans best performances as the jaded hitman,4421,2
my first legendary card there wasnt much to choose from,4422,2
Wifes stuffed penguin is shrinking at an alarming rate,4423,3
TIL NASA has developed a technology called FINDER used to detect breathing or heartbeats through up to 30 feet of rubble or 20 feet of solid concrete and was used to save lives during the 2015 Napal earthquakes,4424,9
Dad reflexes on point,4425,2
Erm thats not how honey works,4426,2
Paul Ryan sharing his feelings,4427,2
TIFU by using a fallen tree as a bridge,4428,8
Obama calls threat of voter fraud fake news says US is only democracy that makes it harder and not easier to vote,4429,2
In honor to Kurt Angles induction in the Hall of Fame Scott Steiner tells us what happens when you add Kurt Angle to the mix,4430,2
Falcons QB Matt Ryan was voted NFL MVP and Offensive Player of the Year by the @PFWAwriters,4431,4
This guy welded a second set of doors to his Prius The car was ugly enough,4432,2
So its Estelles birthday today,4433,2
The Colorado Avalanche are on pace for the most regulation losses since the expansion Atlanta Thrashers of 19992000,4434,3
My Walmart has officially given up,4435,2
What is this a bunny rabbit for ants,4436,5
Me_irl,4437,9
Dehydrated Water,4438,4
Path of Exile is coming to Xbox One in 2017 Heres the trailer including a few surprises,4439,2
What color to paint every room according to science,4440,2
When you want to play DPS but your team needs a healer,4441,4
[OC] Chicken Tenders with Honey BBQ Sauce,4442,1
This quiz question couldnt be laid out much worse,4443,2
Senegal forces to enter Gambia at midnight unless President Jammeh quits,4444,9
I recently found out that Aleks went to my high school This is his yearbook photo for senior year,4445,2
The patterns in this table change by a robotcontrolled magnet,4446,2
Xi Jinping calls for world without nuclear weapons,4447,2
Hardest Decision,4448,2
Cool hedgehogs dont look at explosions,4449,4
This official photo of the Golden God should be the #1 highest upvoted post in Reddit history,4450,2
Iranian advertising before the Islamic revolution 1979,4451,6
Jimmy Carters note placed on the Voyager spacecraft from 1977,4452,2
In order to function properly a paper shredder needs to rest for 18 hours per day,4453,2
Munich mayor extends Oktoberfest invite to US President Barack Obama  The outgoing US president has said he would like to visit Germanys famed beer festival as a private citizen Now the mayor of Munich has welcomed him to do just that,4454,2
Steve Carell looking the way I picture Michael Scott looked his first day at Dunder Mifflin (1984),4455,2
Today marks 1000 days since Flint had clean drinking water,4456,2
Drug lord Joaquin El Chapo Guzman has been extradited from Mexico to the United States,4457,2
Stormtrooper of the month,4458,2
Google Has Finally Started Penalizing Mobile Websites With Intrusive PopUp Ads,4459,4
This Guy Was Born To Be A Fire Fighter,4460,2
This is why Im a dog person,4461,2
My friend got his cat a tank,4462,2
Donald Trump has assembled the worst Cabinet in American history,4463,2
I made the Gorillaz Demon Days cover out of unusable records,4464,2
New Hat,4465,4
When people ask me why I foster dogs I show them this picture,4466,2
Completely oblivious,4467,6
Who Wore it Better,4468,2
Borderlands 2 but without the bright colors or the HUD,4469,2
TIL all telephone service in the US and Canada was silenced for one minute on August 4th 1922 to mark the funeral of Alexander Graham Bell,4470,2
American Airlines is banning carryon bags and overhead bin use for basic economy passengers,4471,2
Isnt that the guy from Sherlock,4472,2
Golden eagle enjoying a belly rub,4473,6
Why its called a patch,4474,2
Home Ownership,4475,7
Heads up The federal government just filed suit against Navient claiming they scammed millions of borrowers between 20102015 to the tune of $4 billion This is huge,4476,2
<Number of people that want to save Brendan Lets let him know we are here,4477,2
PsBattle Man standing on clear ice,4478,2
If she starts shivering I carry her so her woofyfoofers dont have to touch the cold cold ice,4479,4
me_irl,4480,9
Logan Official Trailer #2,4481,2
Bill would replace Columbus Day with day honoring Chief Standing Bear other Native American leaders,4482,1
Was wondering why my wife was giggling when she asked me to change the air filters,4483,2
Caloric restriction increases lifespan in nonhuman primates New study finds that food intake does influence longevity with control monkeys nearly twice as likely to die as calorie restricted monkeys at any time point during the study,4484,2
That itch,4485,1
Cat curious about humans ear,4486,2
Elizabeth Warren The GOP is putting the country in danger by ignoring ethics rules,4487,3
The official portrait of our leader should be the #1 most upvoted post in Reddits history,4488,2
[Homemade] Carved Watermelons for a 50th Birthday,4489,7
