Title,doc,topic
It was suggested I post this here My dog was very curious about a bottle of rubbing alcohol I let him smell it (Xpost rsurpriseddogs),5659,2
Brought my boyfriend a FH shirt for his birthday next week he broke up with me so now I get to keep it TIS A GOOD DAY,5660,2
The Brewess cosplay (The Witcher 3),5661,6
I found The John Marston,5662,2
A blood moon is rising,5663,4
Trump Aide Says He Won’t Release Taxes Breaking Campaign Pledge,5664,2
TIL Chimpanzees fart so loudly and frequently that scientists locate them in forest occasionally by following the farts,5665,2
FYI You can ALWAYS use Threshs Lantern if you just zoom in entirely and then pick it up  no matter how many people try to block it,5666,8
There’s no evidence that Trump’s inauguration was the mostwatched in history Period,5667,2
Trump knows words he has the best words (but not for his wife),5668,2
Dog living life on the edge,5669,2
I made a star shaped firepit,5670,2
[Haiku] Down Under the Piano,5671,0
Fractal Tesseract,5672,8
I know what I saw,5673,2
Voyage of St Brendan Digital 900 x 1200,5674,9
The latest addition to our survival server,5675,7
YSK that checks deposited with a mobile app can be redeposited by someone else if they find them You are held responsible if that happens The actual checks take precedent over the photos of them taken by your phone via the app,5676,2
I drew these three years ago,5677,2
On TV Trumps Inauguration Was the Worst in 40 Years,5678,2
Bought a monitor that was supposed to be 24 inches and got a 50 inch,5679,2
Poor Woman A Victim Of Police Brutality,5680,2
Ethics lawsuit to claim Trump is in violation of Constitution,5681,2
[Text] Teddy Roosevelts diary on the day his wife dies of kidney failure and mother of typhoid fever,5682,8
A Rediscovered Mark Twain Fairy Tale Is Coming Soon,5683,1
Dont confuse Day One nervousness with lack of affection,5684,2
Mugshot of the year goes to,5685,7
I wish it was colder,5686,2
An uncommon view of Los Angeles,5687,2
This First Grade PE Class A Cool Way To Get Kids Moving,5688,2
Sales of George Orwells 1984 surge after Kellyanne Conways alternative facts,5689,1
Husky doesnt want the playing to end,5690,2
Alaskan Flat Tire,5691,7
When normal stunts are too easy so you switch it up,5692,6
From the Facebook page of the Mosque that was set on fire in Houston (Xpost from rislam),5693,2
My mom has MS and recently started painting rocks to pass the time I think her newest batch is pretty cool,5694,2
Do you think theyll notice,5695,2
Donald Trump to sign orders restricting refugee access and immigration from Muslim countries,5696,2
TIL that Ted Kennedy was reluctant to run for the US presidency after his brothers John and Bobby were assassinated because he said Theyre going to shoot my ass off,5697,2
Who ever did this is my hero,5698,2
TIL Michael Cera was an extra in The Witcher 3,5699,2
Cab Driver Claims John Elway Is The Best QB Of AllTime Has No Idea Elway Is Sitting In The Back Seat,5700,2
As long as insurance companies are involved Aetna is proof of that this morning,5701,4
What do you call an emo a capella group,5702,2
Canada oil pipeline spills 200000 liters on aboriginal land,5703,7
Working with AI ive created this art by accident,5704,2
Ryan ‘No evidence’ of mass voter fraud as Trump claimed,5705,2
A true scientist,5706,2
People who live where the air hurts their faces why do you live where the air hurts your face,5707,2
PsBattle Donald Trump Garbage Bin,5708,2
Banging your head against the wall,5709,2
My burger sauce doesnt have a picture of a burger on the front,5710,8
When your aim is off but your Ana still believes in you,5711,4
At White House Trump tells congressional leaders 35 million illegal ballots cost him the popular vote,5712,2
Slicing open a pack of insulation,5713,0
Goals,5714,9
Time to eat the rich,5715,2
Joakim Noah with one of the worst free throws in the history of basketball,5716,2
Just a quick reminder,5717,2
me irl,5718,8
My car can handle the water,5719,2
Ireland to outlaw sex with people whove fallen asleep drunk,5720,2
Daddy German Shepherd Plays With His Pups,5721,7
Girlfriends come and go likes are forever,5722,2
Printed and attached to wifes spraying air freshener while she wasnt home Spits acid every 30 minutes,5723,1
My younger brother private pilot high school senior,5724,2
My grandparents on the day they first met also their wedding day Circa 1950s,5725,2
The Terrifying Tasmanian Devil,5726,1
Til the creator of BUMFIGHTS showed up to a Dr Phil interview dressed up like Dr Phil and called him out for exploiting people saying they were the same,5727,2
The student is now the master,5728,8
Climate researchers say the 2 degrees Celsius warming limit can be maintained if half of the worlds energy comes from renewable sources by 2060,5729,2
If every actor had the ability to rally an army of all the fictional characters theyve played who would have the strongest army,5730,2
I added Michael Jackson grunts to a shootout scene from John Wick,5731,2
China reminds Trump that supercomputing is a race,5732,2
Oh okay,5733,7
I put an iPhone 5S and a Galaxy S6 under a microscope to see their screens,5734,2
This photo taken in the Algerian Desert of sand covered snow looks like Tiramisu,5735,2
UK government loses Brexit court ruling  BBC News,5736,2
[Image] Found this on my little cousins door who suffers from down syndrome which really warms my heart,5737,2
JEANNETTE,5738,6
LED Screen Backsplash,5739,7
Tesla quietly brings online its massive – biggest in the world – 80 MWh Powerpack station with Southern California Edison,5740,2
Dad and 4yearold daughter duet Youve Got a Friend in Me,5741,2
First order of business,5742,2
TIL in 458 BC Aeschylus an ancient Greek tragedian was killed by a tortoise dropped by an eagle that had mistaken his bald head for a rock suitable for shattering the shell of the reptile,5743,0
Nimbus 2000 build process I Made as a gift for a family friends son,5744,2
Companies such as MicrosoftGoogleFacebookLinkedInAppleNetflixWikipediaTwitteretc should throttle accounts belonging to politicians opposing Net Neutrality to 01KBs for a month,5745,5
Kill the Mercy they said,5746,2
Dog saves another dog from drowning,5747,2
Red Riding Hood,5748,6
🍖 + 💧 + ❤️ + ⌛️ = Norman,5749,2
New Coach,5750,2
Anyone else terrified by Anas new skin,5751,2
Khajit has wares if you have coin,5752,5
Wont somebody think of the shareholders,5753,2
Hes good,5754,2
Rare actual picture of an rdankmemes admin in a crowded hallway,5755,2
bleppppppppppp,5756,6
Meanwhile in Canada,5757,1
Clever dog figures out how to use ice dispenser on a refrigerator,5758,3
The Full List of the 2017 Oscar Nominees,5759,2
I walked away for 5 minutes the joys of being a cat owner #RIP,5760,2
Being the fastest ever isnt just a dream of his,5761,2
The Mannequin Challenge Korean Basketball League edition,5762,2
When you cant make the shot,5763,2
31 year old asks 89 year old neighbor to move in to help care for her  Hes like the grandson I never had,5764,2
Scientists unearth fossil of a 62millionyearold otter It is among the largest otter species on record,5765,6
LPT Dont post pictures of yourself on vacation Wait until you get home Posting them on vacation alerts people that your house is empty Perfect for burglars,5766,2
We hope you enjoyed your stay If you happen to forgetmisplace anything,5767,2
LPT Make it a rule to not make excuses when you are late or cancel plans,5768,2
These two are almost too wholesome to take,5769,2
What is one thing your SO hid from you until later in the relationship,5770,2
Parroting On Point,5771,9
You Dont Need to Build a PC to Ascend Comments on New Build Posts,5772,2
What What What,5773,0
Lazy Skills,5774,2
Fight Fake News Know Who is Reputable,5775,2
Self portrait oil on panel 18 x 24 inch 2016,5776,2
The way he throws the 2 pound dumbbells,5777,7
Education pushes back age of marriage for rural women in India,5778,2
Cards Against Humanity is hiring a CEO but it requires candidates to be Barack Obama,5779,2
Mothers,5780,2
Artists 30 hour labour of love to transform mans old tribal tattoo,5781,2
He is good,5782,2
Vintage Birthcontrol Still only 99% effective,5783,2
20 kilograms of red hot steel vs frozen lake,5784,6
The EPA which protects Americans from poison and pollution has been frozen under Trump,5785,2
o heck he done broked the laws is still good boye though,5786,2
[Homemade] Killed cut and prepared deer sirloin,5787,7
How changing the focal length affects how a persons face appears,5788,2
I Finally Found Peace,5789,4
what,5790,0
Father and son accused of raping 13yearold girl only want to be judged by the laws of the Bible,5791,2
Local police bring some sass with battering ram,5792,2
The Saga so far,5793,1
Donald Trump Is Becoming an Authoritarian Leader Before Our Very Eyes,5794,2
Typing,5795,3
Ranked Choice Voting An Easy Solution to Fix Our Broken Elections,5796,2
A temp I barely knew was actively trying to get me fired behind my back,5797,2
Drinking wine,5798,2
TEMPERATURE TEMPERAMENT,5799,6
Rare Encounter With A Sperm Whale At 600m Below The Surface,5800,2
My teammate is a god damn savage And a legend,5801,2
2meirl4meirl,5802,2
Election Karma [OC],5803,2
Tick,5804,8
Sleepy baby elephant,5805,7
Flipped this photo of the Eiffel Tower because the water in the reflection looked like an oil painting [2754 × 4018] Paris France,5806,2
La La Lands Damien Chazelle directing Ari Robbins crazy incamara whippans,5807,5
No bamboozles,5808,4
MASSIVE potential here,5809,2
Donald Trump signs executive actions to push through Dakota Access and Keystone XL pipelines,5810,2
[Image] My favorite comedian spills some truth,5811,2
Pretty much this sub,5812,2
Teen spared jail so he can club baby seals,5813,7
TFW you get two headshots with one projectile,5814,2
Oh well they think im crazy anyway,5815,2
TIL that before 1935 that Thai family law listed three kind of wives  official wife minor wife and slave wife,5816,2
[WP] You live in a world where everybody is blind and gets futuristic contacts installed when they are born to let them see the world But one day your contact breaks and you realize you can see But the world you see is much different than what your contacts showed you,5817,2
This was from a local colleges twitter account,5818,2
split custody christ,5819,4
The pasha gif that we want but dont deserve,5820,2
Meanwhile in opposite world,5821,1
Smartest person in philosophy class,5822,4
Brexit Live  Supreme Court rules UK Cannot trigger article 50 without parliamentary vote,5823,2
Ireland to outlaw sex with people whove fallen asleep drunk,5824,2
As Fords continue to catch fire in South Africa vehicles are recalled but no refund offered Ford claims purchase agreement voids Consumer Protection Act also claims a burning death was unrelated to this issue,5825,2
Burger King HP Hearty Mozzarella Bacon Cheeseburger,5826,8
My Blind Kitten Milo,5827,1
An adorably happy bat,5828,2
The only man right for the job,5829,2
The Resident Evil 7 logo looks like a confused bear,5830,2
Went to get my daughter a kitten today couldnt bear the thought of separating her from her brother,5831,2
Panetta to Trump CIA is not the appropriate place to start whining about inauguration crowd size,5832,2
Baby otter learning from mom,5833,7
Philip Rivers will redeye to Orlando for the skills challenge fly back to SD to attend his daughters fatherdaughter dance,5834,2
So Overwatch is a horror game now,5835,2
[Poetry]Cooper is nuts,5836,5
A video from Meis VA in celebration of Lunar New Year,5837,2
MOD POST NO MORE THINLY VEILED VALIDATION POSTS,5838,7
MaN ReLeNtLeSsLy PuRsUeD bY tErRiFyInG tAsMaNiAn DeViL iN a DeAtH rAgE,5839,1
My Maremma nursing a sick lamb I was the only one allowed anywhere near lambsie,5840,2
Pharma companies disown Shkreli; Pissed Shkreli airs their dirty laundry,5841,7
Um guys Maeve and Dolores,5842,8
Coheed and Cambria  In Keeping Secrets of Silent Earth 3 [ProgressiveAlt rock],5843,2
We are Ashly Burch (Hey Ash Whatcha Playin Tiny Tina  Borderlands 2) TJ Storm  our mocap guru (Colossus  Deadpool Godzilla  Godzilla Decimus  Halo) and Steve Blum (Wolverine Grunt  ME Zeb  Rebels Tank Dempsey  COD Tom  Toonami) ASK US ANYTHING,5844,2
Firefighters rescue puppies from rubble after Italy avalanche,5845,7
No BS Brass Band  3 AM Bounce [BrassHiphopBRASS] (2016),5846,2
Heartseeker Quinn as a Pokemon Trainer,5847,4
Just finished Siddhartha by Herman Hesse Blew my mind,5848,4
Donald Trump’s watching a lot of television and it’s worrying his aides reports,5849,2
US solar power employs more people than oil coal and gas combined report shows,5850,2
How current WWE World Champion travels,5851,2
Meanwhile at ninja camp,5852,1
sav hero comforts a woman in a breakup after her boyfriend left for a posting abroad,5853,2
TIL that Cartman has made a cameo in Futurama,5854,2
Whoever laid these tiles gets it,5855,7
What do you call a snake thats exactly 314 meters long,5856,4
MRW my friend says Dont make it obvious but that girl at the bar isnt wearing underwear,5857,2
Trying to be smooth,5858,7
Relatability,5859,4
USDA Scientists Have Been Put On Lockdown Under Trump,5860,2
NEW HD TRAILER FOR YEAR OF THE ROOSTER,5861,2
She is shocked about being pregnant,5862,5
Scooter trick with a stabilized camera,5863,3
[WP] Everyone on earth has a super power Rarely someone will have two powers One in a billion will have three You have thousands of powers and dont really want to call attention to yourself but crap keeps happening around you,5864,2
FatherSon Dinner,5865,8
Falling is an art,5866,2
Widowmaker is ALWAYS on the winning team,5867,9
We like to snuggle Later we bite,5868,2
Trump’s unsupported claim he has ‘received awards on the environment’,5869,2
Using VPN in China is now officialy a crime,5870,8
OldFashioned Latkes,5871,6
LPT When you share something personally embarrassing or sad with another person and they respond with a similar story dont think of it as oneupping Focus on the fact that they made it through that tough time and so will you,5872,2
I need to share what I found in my attic last night,5873,2
Dion Waiters puts Miami up three with half a second left,5874,2
Sith Lords are our specialty,5875,1
Laci Green disabled ratings on her vids,5876,4
Donald Trump expected to push forward Dakota Access and Keystone XL pipelines with executive actions,5877,2
When I see a gif that loops perfectly,5878,2
MRW my wife asks me how I plan on dealing with the mice that have moved into our garage this winter,5879,2
Samsung Galaxy S8 Rumoured to have an Headphone Jack,5880,4
It made me dislike more than I think,5881,2
Cat meets a tiger,5882,2
LED Screen Backsplash,5883,7
I got bored of practicing my flying as Pharah,5884,2
Donald Trumps new FCC pick is essentially a death sentence for net neutrality,5885,2
You gotta think about the future,5886,2
Goats were originally domesticated 10 000 years ago They were domesticated not only for their meat and milk but also for their dung which could be used for fuel,5887,2
[Haiku] [Loud] We hate Trump and we want to make a change,5888,2
Asianpeoplegifs vs Whitepeoplegifs BATTLE,5889,1
me irl,5890,8
Somethings fishy,5891,3
[Image] You only live once,5892,2
NFL RedZone Saved Viewers From 35 Hours of Commercials This Season,5893,2
Dont litter in NYC,5894,4
A nail after one month of exposure to Detroit water (above) and Flint River water (below),5895,2
switching seats (Sam Adams gameplay),5896,3
Ken M on calling 911,5897,2
I have been an Xbox owner my entire life and have never owned a Playstation but my girlfriend got me a PS4 and I have to say Last of Us is the greatest game I have ever played,5898,2
Dandelion timelapse,5899,0
Oh no (we had a windstorm last night),5900,2
she does have a very nice figure Ive said if Ivanka werent my daughter,5901,2
my ult landed on reinhardts head,5902,3
Donald Trump to sign orders restricting refugee access and immigration from Muslim countries,5903,2
Barbarism vs Civilization by René Georges HermannPaul,5904,1
Once in a lifetime picture,5905,7
Smile and nod smile and nod,5906,8
My little man Alfie,5907,2
This is one of my most favorite lines,5908,2
Alright what the hell is this,5909,5
It is glorious,5910,0
Donald Trump Who Lies Constantly Spent His First Few Days as President Lying,5911,2
[homemade] Caramel Cheesecake with Apple Roses,5912,6
Donald Trumps Company Is Receiving Direct Payments From Foreign Agents Right Now,5913,2
My brother showing me his new mondragon he unlocked,5914,2
GOTY,5915,7
You were the Chosen One You were supposed to assist the regional manager not become one You were supposed to bring balance to The Office not leave it in recession,5916,2
LPT If you cant sleep after watching a scary movie watch the movies bloopers,5917,2
Use it every day works better than any stove I have ever owned Only 90 years old  I guess the company was wellnamed Reliable,5918,2
How AJ Styles travels,5919,0
White House temporarily freezes EPA grants contracts,5920,2
Trump’s new FCC chief is Ajit Pai and he wants to destroy net neutrality,5921,2
hmmm,5922,5
Dutch government wants to counter Trump with abortion funds,5923,2
Erin Andrews was diagnosed with cervical cancer last year,5924,2
The Infamous Mathausen Stairs of Death,5925,0
I was just looking at some Valve source code,5926,4
Badlands National Park Has Gone Totally Rogue And Started Tweeting Climate Facts,5927,2
Ever get that feeling of déjà vu,5928,2
Lens flare in this photo looks like Eric Cartman,5929,8
WW2 Vet walking alone on Victory Day He is the last of his squad,5930,2
Brutal police shootout,5931,2
Up to 20 countries have indicated support for the Netherlands’ plan to set up an international safe abortion fund to plug a $600m funding gap caused by Donald Trump’s reinstatement of the “global gag rule” the Dutch international development minister Lilianne Ploumen said on Wednesday,5932,2
My little cousins turtle died He made the grave built the cross and got dressed without any parental supervision My uncle caught this towards the end of the ceremony,5933,2
Make America,5934,2
When video game antipiracy was in its infancy,5935,2
As of 10AM Eastern on January 25,5936,2
Teaching kids the joys of PC Gaming,5937,2
Fish driving its aquarium around by swimming in different directions,5938,2
Google has banned 200 publishers after it passed a new policy against fake news,5939,2
Massachusetts lawmakers float aggressive bill mandating 100% renewables by 2035,5940,7
Nineteen EightyFour soars up Amazons bestseller list after alternative facts controversy,5941,8
Trump orders wall to be built on Mexico border,5942,2
Stop trying to make fetch happen,5943,2
Sunlight through this glass doorknob started a housefire,5944,1
Flip book of a gif of me flipping through a gif that I printed into a flip book,5945,4
Corgicopter,5946,9
How do we make it clear that its a male hand without seeing the nails,5947,2
Bought my 7 year old daughter a bracelet making kit Found this on the table the next day,5948,2
Four more journalists get felony charges after covering inauguration unrest,5949,2
A comment on a puppy video,5950,2
Who am I,5951,0
Boy watches TV for the first time from an appliance store window 1948,5952,2
Saw this onlinesets up perfect title for Episode IX,5953,2
North Korean elite is turning against Kim Jongun says defector,5954,2
A Canadian Standoff,5955,2
me irl,5956,8
Trump bans government scientists from sharing their work with the public who fund it,5957,2
Five States Are Considering Bills to Legalize the Right to Repair Electronics,5958,7
Mexican President Considering Canceling Trip to Washington Amid Border Wall Order,5959,2
Thats something younger generation will never get,5960,2
A cute girls wave leads to chaos,5961,2
Steve Bannon Is Registered to Vote in Two States,5962,2
Dont whistle at Gordon Ramsay,5963,4
Thanks to Trump Scientists Are Going To Run For Office,5964,2
Synchronized Wagging,5965,9
Found him in the engine of a Chevy Tahoe so we named himTahoe Say hi Reddit,5966,2
Trump is announcing details about his wall building plan later today,5967,2
It was raining so I went on California Screamin 4 times then photoshopped myself in every seat,5968,2
Donald Trump says millions voted illegally Thats dreadful We must have another election now,5969,2
My 90 year old grandmother died yesterday because someone did this,5970,2
Trump White House Senior Staff Have Private RNC Email Accounts,5971,2
[OC] Fitting In,5972,2
Skier accidentally skis off cliff,5973,2
Consoles vs Pc,5974,2
My dog asks before he does anything by placing his paw on what he wants,5975,2
Trump calls for major investigation into voter fraud,5976,2
me irl,5977,8
The bottom of my cup fell off while making a hot chocolate,5978,2
TIL the woman responsible for the botched potato Jesus restoration receives 49% of all of the churchs souvenir sales featuring the image,5979,7
LPT Take a screenshot of your mobile boarding pass before boarding an airplane so if you lose internet access you can still pull it up,5980,2
Making of Kubo and the Two Strings,5981,2
Donald Trump to sign executive order to dramatically reduce funding of United Nations,5982,2
🔥Huge flock of birds taking over a city🔥,5983,0
Trump steps out onto the White House lawn in the dead of winter,5984,2
Ivanka Trumps Clothing Is Made in China Indonesia and Vietnam,5985,2
Sums things up quite well,5986,2
Usain Bolt will have to hand back one of his nine Olympic golds as a teammate tests positive for a banned substance,5987,2
New Zealand and Denmark deemed the least corrupt countries in the world,5988,2
Now which one is the prince,5989,2
Steve Bannon registered to vote in two states despite Trumps cries of voter fraud,5990,2
Perfect water shield,5991,2
meirl,5992,6
this is beyond relatable,5993,7
An outspoken Nebraska state legislator who was fined for having cybersex using a state computer resigned Wednesday after causing further outrage by sending a tweet that implied participants at a womens march were too unattractive to be victims of sexual assault,5994,6
uAnzai explains in detail why the alternative facts incident is deeply problematic,5995,2
Im pretty sure the answer is A,5996,2
If china can do it,5997,2
Speakers of futureless tongues (those that do not distinguish between the present and future tense eg Estonian) show greater support for futureoriented policies such as protecting the environment,5998,3
PhARMA calls out Martin Shkreli on price increase Shkreli creates a website detailing each members of the group history of doing the same thing,5999,2
Making of a fight scene in stop motion  Kubo and the Two Strings,6000,2
[I Ate] Frozen hot chocolate with chocolate cake,6001,7
Donald Trump stopping US government scientists from speaking out publicly is chilling,6002,2
@SenSanders on Twitter Republicans talk about giving people choices And yet they try to defund Planned Parenthood,6003,2
[Feigen] DAntoni asked about Rockets going 35 past few weeks Actually we won all those games Im going with that alternative fact thing,6004,2
Youre never too old for a trampoline,6005,2
Report Trump Complains Negative Press Means He Cant Enjoy White House,6006,2
In 2007 then Georgia governor Sonny Perdue held a prayer vigil at the state Capitol to pray for rain in his drought stricken state (it didnt work the drought lasted another two years) He is now Trumps nominee for the Secretary of Agriculture,6007,2
Skater Bin,6008,6
I heard you like cablemanagement,6009,8
suchlaph Angel of Verdancy 24x36 digital,6010,5
Unusual bird called a Potoo photographed in Venezuela,6011,2
George Orwells 1984 Is Now the #1 Bestselling Book on Amazon,6012,2
TIL that 7 months after Russia declared war on Germany in 1914 a small band of Georgian warriors from a remote part of Georgia clad in medieval armor rode into the capital of Tiflis and up to the governors palace reporting for military duty stating We hear theres a war Wheres the war,6013,2
TIFU by not locking my door at night,6014,2
Ding Dong,6015,4
My day couldnt get any better,6016,2
Food at Shake Shack JFK is about a penny per calorie [OC],6017,2
I want this GPS,6018,2
Level 243 and I just realized this path on Kings Row,6019,2
Did you ever hear the tragedy of Darth Plagueis the Wise,6020,2
Asian dinner,6021,2
Palestinians say Obama’s lastminute $221 million payout frozen by Trump,6022,2
Ahh Neighborly love,6023,2
What was the most sadistic thing you did as a child,6024,2
Donald Trump is facing a preemptive backlash over his reported plans for a ban on people from seven Muslimmajority countries entering the US,6025,2
How to Mercy 101,6026,6
Different types of color blindness demonstrated,6027,6
Iam Independent Journalist Tim Pool founding member of VICE News I was arrested in DC during the riots but released without charge AMA,6028,2
Owl carved out of a dragonfruit,6029,7
I ordered three pairs of drumsticks from amazon They all showed up separately in boxes way bigger than necessary,6030,2
Hi Im Mercy from Overwatch and youre watching the Play of the Game,6031,2
President Donald Trump to bring back CIA black site prisons in executive order draft,6032,2
Golden Gate National Park has tweeted climate science in support of the Bad Lands NP,6033,2
Trumps most senior staff use a private email server,6034,2
A true gentleman is always there to help,6035,2
Complicated,6036,0
So my mate unknowingly matched with a transgender girl today,6037,2
Harry Potter cant tell the difference,6038,2
Found on a car in Cincinnati,6039,2
Really lucky driver,6040,2
🔥Orchid Bees🔥,6041,9
TIL marijuana levels in the bloodstream do not match levels of cognitive impairment making it difficult to test reliably for driving while stoned,6042,2
Dude accidentally skis off 150foot cliff and captures the whole thing on his helmet cam,6043,2
Governor Inslee on border wall If Presidents prediction for wall size is like inauguration estimates,6044,6
Never knew the struggles,6045,2
