Title,doc,topic
Costa Rica completes 2016 without having to burn a single fossil fuel for more than 250 days 982% of Costa Ricas electricity came from renewable sources in 2016,0,2
The camels are the white lines and the black the shadows,1,2
Its official Half Life 3 will not be coming out in 2016,2,2
I dont know who did this to the Hollywood Sign,3,2
Heres to another lousy year,4,2
Take that 2016 She made it,5,2
Hollywood Sign Vandalized and Now Reads Hollyweed,6,2
Happy New Year neighbour,7,2
This store sorts its Bananas by how ripe they are,8,8
He gets it,9,7
About to teach my daughter about real life,10,2
Happy new year,11,2
Cat accepts being sucked into a black hole,12,4
The Fox and the hound are all grown up,13,2
The pattern in my dads shirt change to hexagons when wet,14,9
What did the most drunk person say or do last night at your party,15,2
A satisfying use of 3D printing,16,8
Waking up on 11,17,1
I find strangers attractive because they havent pissed me off yet,18,2
2017 claims its first victim,19,2
Loves her ducks,20,2
Movie theaters should charge babies as adults to deter people from bringing them,21,2
Hey man what did you do for New Years,22,2
Jo Ann is angry,23,6
Finland officially begins its 100th year with Darude Sandstorm,24,2
TIL that German internet users have a 23yearold meme where they pretend the town of Bielefeld (330000) does not exist,25,2
IT WORKED I tapped the screen lightly ~30 times Your move 2017,26,7
LPT Most people at the gym are to busy with themselves to pay attention to you or anyone else so dont sweat it,27,2
Cologne police defend use of racial profiling on New Years Eve In a bid to prevent a repeat of last years sex attacks state police focused on men of North African descent on New Years Eve Police Chief Jürgen Mathies has faced criticism for praising the sucess of the practice,28,2
Did you hear that NYC paid Hillary Clinton $2000000 as a consultant for New Years Eve,29,2
anyone can paint ),30,2
Is this sub still active,31,2
With all these I havent blank since last year jokes coming,32,2
A Woof in Sheep Clothing,33,8
PsBattle A cat watching a deer watching a dog,34,2
HAPPY BIRTHDAY EVERY USER ON STEAM,35,2
Sanders For President The Return,36,2
me_irl,37,9
When you time it perfectly,38,2
Mariah Carey just completely bombed LIVE at Times Square,39,1
One of the greatest moments in the history of television,40,2
Once is never enough,41,2
Liveaction Bambi,42,8
me🎊irl,43,7
The way this ball stays in one place,44,2
[Homemade] Sourdough Cast Iron Pizza with Roasted Garlic Alfredo and Garlic Sauce Old World Soppressata and Genoa Salami,45,1
Leave Mariah alone,46,2
My brother and I were testing out my nephews telescope We attempted to take a picture of the moon and got this,47,2
An amazing eyeball drawn with ballpoint Pen (source in comments),48,8
In case you didnt know Eminem personally annotates his own lyrics on Geniuscom If youre a fan I suggest you check it out,49,2
I raised my credit score by 73 points in 3 months and got myself out of debt thank to this subreddit,50,2
Remembering old redditors,51,2
me irl,52,8
Cats only No Dogs allowed,53,8
Trump wants couriers to replace email No computer is safe,54,2
Competition for worst performance of 2016,55,2
When you survive 2016,56,2
Babys Best Friend,57,2
Still image of Mariah Careys New Years performance,58,2
Waterfall swing,59,4
When your friends Snapchat story is an hour long,60,2
Found someone with similar style on NYE,61,2
20 Great Films About Loneliness That Are Worth Your Time,62,2
Ghost ship projected onto jets of water in Amsterdam,63,7
Mouse Rat  5000 Candles in the Wind [Rock],64,2
Your Life in 4680 Weeks,65,2
Homeless Man Had Worn The Soles Off His Shoes; Cops Buy Him New Boots,66,2
Swedish Army Knife,67,7
Gas station sign,68,2
Stoke player Erik Pieters consoles Chelseas Willian after Willian scored a goal Willian lost his mother to cancer a few months ago,69,8
Unexpected Risks Found In Editing Genes To Prevent Inherited Disorders,70,0
On Sand,71,6
James Harden with an insane 53 points 17 assists and 16 rebounds in a win over the Knicks,72,1
Its 2017 she is still single,73,2
ufantastic_comment compiles a list of horrible things Facebook has done over the course of 2016,74,2
We left our dog Bruno with our sisterinlaw while we went on vacation I guess someone is having a better time than we are,75,2
thats gotta hurt,76,2
I see your RC jumbo jet and Raise you the RC Jellyfish,77,9
Club Nintendos final message from the 2016 calendar,78,2
DMX could possibly be onto something,79,2
Pickpocket level fallout,80,2
2016 inspired me to make my first gif,81,2
2meirl4meirl,82,2
New Years problems,83,2
So my grandma is quite active on Github,84,4
Historic Image of uPoppwall Our Wholesome Founder ),85,7
Bramble showing off her floof in the morning sunlight,86,4
Dried Sponge,87,0
me irl,88,8
me🎉irl,89,6
This is what happens when Adele runs into sound system failure,90,2
They tried,91,2
Me🐎irl,92,6
Trump I know things about hacking that other people dont,93,2
Found the weed dealer in Pokemon,94,2
Kevin Spacey sure did bamboozle us,95,4
My gf was looking for a hummingbird feeder for her grandmas birthday gift on Amazon and came across this picture of how a reviewer used his,96,2
Girafarig Fakemon Evolutions,97,3
TIFU by not washing down a bloody nose out of my bath tub,98,8
this is the name Ive made for myself,99,2
Roadhogs hook is always so unpredictable,100,1
Thats maybe not the best combination,101,2
Baby elephants are like human toddlers They are spatially unaware possibly drunk and apparently hellbent on killing themselves,102,2
This disabled bathroom has a sign to say its OK for anyone of any disability to use it,103,2
Looks like the security took the night off last night in Hollywood,104,2
Out of Bounds,105,9
Big Rig truck driver uses his skills to avoid crashing into another semi,106,2
23 Item Charcuterie Board [Homemade],107,7
Child sleeping with Reindeer in Mongolia,108,6
Ronda Rousey after seeing all the online mockery of her loss,109,2
Read the following sentences and rewrite them Islam is my religion All religions except for Islam are wrong  From a textbook taught to children in all Saudi public schools Indoctrination at its finest,110,2
Meteos going 124 in ranked,111,2
For April Fools they should swap Roadhog & Widowmakers hooks without any sort of explaination,112,2
Vicious Syndicate responds to Reynads misconceptions about the vS Data Reaper,113,2
TINDER GAME STRONG,114,2
The best welcome you could possibly get for the upcoming year,115,2
Me at the store,116,2
Trumps pick for Labor Secretary doesnt think workers should get breaks,117,2
No Mans Sky Wins TotalBiscuts The Stop PreOrdering Video Games Award for Biggest Launch Disaster Arbitrary Award,118,2
Uhh did they watch the movie,119,2
Swiss say goodbye to banking secrecy,120,4
THE SAN DIEGO PADRES HAVE BEEN ELIMINATED FROM PLAYOFF CONTENTION,121,1
happy 2017 from merry England,122,2
Your sassy,123,2
My old laptop didnt handle this,124,2
The 2017 patch is here What are some achievements you want to try to get this update,125,2
I made a Lord of the Rings cribbage board,126,2
Cards against humanity meme style,127,2
Meet Eve last of her litter born on 123199 Happy 17th old friend,128,2
[ATLA] When you didnt know Prince Zuko was skilled with broadswords,129,1
Ill wait for the next one,130,2
For those worrying about the safety of Ethan Hila and Ian in the last video,131,2
Mods are celebrating new years post misleading thumbnails,132,4
eels and escalators,133,7
Pig playing in pool,134,2
me irl,135,8
me irl,136,8
[WP] Your life is an endless series of horror movies Youre always at the wrong place at the wrong time Youre stuck seeing all your friends die right after you make them The reason youre still alive You can hear the horror music,137,2
300 years old hedge,138,2
Hugs for the New Year,139,2
Happy New Year,140,2
Slime Stretch,141,9
Every hour of my 2016 charted by category [OC],142,2
This bath mat at my parents house,143,2
schnell die Amis schlafen Pfostiert Sonderschrauben,144,2
Went to China to visit my grandparents and saw this picture on their wall They thought it meant something inspirational in English,145,2
ELI5 why does it hurt when you swallow a beverage wrong ,146,2
new years resolutions,147,2
Now isnt the best time,148,2
Sweet Sixteen She cant see the cake anymore but she can still smell it,149,2
Its a great start to a new year,150,2
[Post Game Thread] Clemson Defeats Ohio State 310,151,7
Tesla is being sued by a SKorean celebrity claiming his Model X accelerated on its own into his garage logs show user mistake,152,1
Light,153,2
rip,154,1
Avocado Pesto Pasta,155,8
Bitcoin hits 1000$ on January 1st,156,2
TIL that the anti piracy chip was the main cause of cartridge boot failures on the NES,157,2
Were in dire need of a word for this,158,2
If a game on your wishlist has a free weekend you should be emailed,159,2
Me💺irl,160,5
Crazy how times change (Fixed),161,2
Now that all is said and done this is what pissed me off the most about 2016,162,2
Repost from rpics These shadows are 🔥 The camels are the white lines,163,2
On the bright side I can fit into womens mediums,164,2
Birth of a dolphin,165,7
Its official 2016 was the year of only one operation,166,2
MITs selffolding origami technology,167,9
ಠ_ಠ,168,7
The High School Motivational Speaker Starterpack,169,2
My dad and his first pupper 1955,170,2
me irl,171,8
January 1st is the only day of the year where I recognize 12am as a new day,172,2
Might wanna improve your MS Paint skills before making a dedicated page to web design,173,2
As of now Barack Obama will go down in history as the president who prosecuted more truthtellers often under the draconian World War Iera Espionage Act than all other presidents combined,174,2
Glad we got hungry for McDonalds at 2 in the morning ),175,2
Doctor Strange confirmed for Thor Ragnarok,176,7
Thats just a low blow,177,7
MM Broken,178,2
The Xwing shooting at the heroes photoshopped in backwards,179,2
Rocket League was one of the best sellers of 2016 in Steam,180,2
Energy Thdrinks,181,2
[OMalley] Now that Tom Bradys day is done he will keep the record for best TDINT ratio ever (28 TDs 2 INTs),182,2
MRW watching Mariah Carey perform on New Years Eve,183,2
A Lions mane jellyfish in Northern Newfoundland,184,9
Aha is still nailing every high note 32 years later,185,2
Look who came to deliver our baby in place of the stork,186,2
TIL Pigeons die when they have sex,187,2
We are Deep Six a hard science scifi series Cocreator Davin Lengyel (Pure Pwnage Space Janitors) Jaymie Matthews (UBC Astrophysicist) and Robert Godwin (Author or publisher of over 100 books including several with Stanley Kubriks technical advisor) AUA,188,2
Launching a firework rocket with a GoPro attached,189,4
Wild KO at a local MMA event,190,6
Roadhog thinks hes Widowmaker,191,9
Best Sellers of 2016wait WHAT,192,2
Uk House of Lords revolt over Government reforms to turn university world upside down  Lords warn the new Higher Education and Research Bill could allow private companies to run institutions as businesses driving a ‘marketisation’ of the sector,193,2
Howdy Doody,194,7
Baby otter cuddling with a gator plushy,195,7
Classy till the very end,196,2
Progress of an artist,197,2
Four consecutive dart posts Three are the exact same unique occurrence,198,2
Congratulations to Ravenclaw,199,2
Wishing you all a,200,1
The Cleveland Browns have secured the number one pick in the draft,201,2
My great grandma Ruth with the car she used to smuggle alcohol from Canada to Milwaukee during the prohibition in the 1920s The car had a false bottom for bootlegging,202,2
reu4 and rciv are declaring us war for taking Just 5 more minutes Award,203,2
Dont step on my food,204,2
TIL that in medieval times Catburning was an accepted practice thought to bring good luck It was custom to burn a barrel full of live cats over a bonfire as people shrieked with laughter while they were singed and roasted French Kings often witnessed it and even ceremoniously started the fire,205,2
The only reason I havent replayed the Mass Effect games recently is because I cant get the PC version + DLC without a whole bunch of Bioware points,206,2
5 weeks ago the magic jersey wearing puppy put on her jersey Tonight after going 50 we run the table,207,2
San Francisco is expected to make sweeping changes dismissing both HC Chip Kelly and GM Trent Baalke league sources tell ESPN,208,2
TIL Caltech students snuck into two fairs at MIT for the prospective freshmen and handed out Tshirts that were packaged so that MIT was on the front,209,7
MaN puNcheS foX In tHe HeaD aNd caUSes EpilEpTic SeiZUre,210,2
Now introducing Amazon Timetravel,211,2
A true inspiration,212,2
Patient Blep,213,6
And here it goes With his family concerned about his health Gary Kubiak likely is stepping down as Broncos HC league sources tell ESPN,214,2
[Tool] Close 2016 plan 2017 Fill out a year planning booklet and have a greater awareness of your life,215,2
So should I practise or should I not try it at home,216,2
4 years ago I wrote a case study on reddit on my $4k per month local business Ive since built that company into a multimillion dollar company and the redditors that followed are now doing a combined $50 million dollars per year Updated case study and AMA,217,2
Crossing the street during a bicycle race,218,4
[Image] The future looks bright for PlayStation (something I put together),219,2
William Christopher Father Mulcahy on MASH dies at 84,220,2
A candle creating vacuum,221,4
Photographer Ok You two hold hands & u in the back hold a gun to that guys head Nice Ill add blush in post,222,2
My cat keeps me company at the dinner table,223,2
2016 complete,224,2
Left a little surprise for my gf,225,4
At least they tried,226,2
[Found] The Apple pie by Cédric Grolet,227,6
LPT Have old towelssheetsblankets Donate them to a local animal shelter,228,2
Auston Matthews scores the OT winner for the Leafs in the Centennial Classic,229,8
Remember about that candidate Lets inspire more of them and help rebuild america Are you with us reddit,230,2
<_< >_> Betty White made it to 2017,231,2
BERNIE SANDERS TELLS TRUMP ‘KEEP YOUR PROMISES’ DON’T CUT SOCIAL SECURITY OR MEDICARE,232,2
[WP] So many new exoplanets are being discovered that planet deeds now make wellknown novelty gifts You recieved such a deed last year on your birthday,233,2
Siri & Google Assistant = Apples and oranges,234,2
The Arizona Coyotes have extended their losing streak to 7 games,235,4
me_irl,236,9
Ran into this Nazgûl while on holiday in Hessen Germany,237,7
me_irl,238,9
just trying to survive a mad Genji,239,7
literally unplayable,240,6
New Evidence Proves That Nixon Sabotaged Vietnam Peace Talks in 1968 Thats Worse Than Watergate,241,2
Starting today,242,7
me_irl,243,9
This pitstop looks like 0 gravity,244,8
William Christopher Father Mulcahy on MASH dies at 84,245,2
I hate it when they leave exhibits empty,246,2
Anybody else taking this into 2017,247,2
You is kind You is smart You is important,248,0
Scorpion graphite drawing  Took me about 12 hours to complete ,249,2
This is the weirdest faceswap I have ever done,250,4
Mindmelting skateboard trick,251,8
Happy to see the array of dogbones,252,2
At least theyre honest,253,4
This Watusi bull looks transparent through its spots,254,8
The body of an elite NFL athlete,255,1
Aw man they left,256,2
TIL in the extinct Australian language Mbabaram the word for dog is dog This is purely a coincidence and there is no relation between the words,257,2
Look what I found in the Barn,258,2
Well everything is better,259,2
Frozen roads in Norway,260,6
Hamster preaching to his people,261,2
me irl,262,8
Mindblowing Card Trick,263,8
Then and Now,264,0
Mommy loves you too,265,2
Harvard discovers a few of its library books are bound in human flesh,266,9
Someone should tell this girl that this cant be done,267,2
Waking up to this face every morning brightens my day,268,2
One of Worlds Most Dangerous Supervolcanoes Is Rumbling,269,2
Doug is super proud of his first modeling gig,270,2
And now Im the most fabulous dad in my office,271,2
The Running Man Barb Wire and the epilogue of Harry Potter are all set in the faroff year of 2017,272,2
TIL if you receive a blood transfusion with the wrong blood type a very strong feeling that something bad is about to happen will occur within a few minutes,273,2
This girl soldering her hand,274,2
Yes Donald Trump ‘lies’ A lot And news organizations should say so,275,2
I dont see why you would become an Islamic fundamentalist suicide bomber on the off chance that when you die you get 72 virgins,276,2
I am Philip DeFranco AMA HostYoutuberPDS Creator,277,2
This isnt a birdshaped cloud A bird flew into this window and left this mark,278,2
An avalanche on Mars captured as it was occurring,279,4
PB&J oil 12x16,280,2
What hobby doesnt require massive amount of time and money but is a lot of fun,281,2
My colleagues thought of a fun waste of time,282,2
LPT Before buying a house check it out on a very rainy day to see how effectively water drains,283,2
Darth Vader’s castle on the volcanic planet of Mustafar  After a power wash,284,2
My cat walked in on me taking a dump and was terrified,285,2
PsBattle Margot Robbie excited at a hockey game,286,7
My 4yearold really wanted a stuffed Onix for Christmas but I couldnt find one Made one instead she loves it,287,2
The Mexican bad guy in every movie ever Starter pack,288,2
Highway signs in Arizona are back at it again by throwing shade,289,7
I Made a raspberry pi Spotify Jukebox with colorchanging LEDs volume & playlist controls and a webapp,290,7
Treebared,291,8
Indian court bans politicians from using religion caste to win votes,292,2
Tifu by accidentally becoming gay on New Years,293,2
The People You May Know section of Facebook Put up these pictures that allign perfectly with unrelated people,294,2
Catholic priest accused of organising orgies in rectory and pimping out 15 women,295,2
Stayverystill,296,7
Hidden Apple Tatin [found],297,6
Reflected Zarya Ult and Tracer Ult,298,3
Pregnancy test,299,5
Four people fall to their death as the ground opens up for an unexpected Brett Favre,300,0
Joe Rogans enitre being condensed into 9 seconds,301,2
Devoted mum to donate two organs to save her little boys life This is going to be your year,302,2
[Serious]Former depressed teen cutters of Reddit what can or should a mom do to help,303,2
✨ 2017 is going to be amazing friendos ✨,304,8
Based on his smile I dont think it was his first selfie with an American It was my first selfie with a Wallaby though,305,2
If this thread gets 1000 upvotes the design of rdiablo will stay like this until the D4 is announced,306,7
Now THIS is old school cool Waynesburg PA 1915,307,2
Tickling a cute potato,308,8
Day 1 of my raw food diet begins today,309,2
This Is the Year Donald Trump Kills Net Neutrality,310,2
me irl,311,8
2meirl4meirl,312,2
When you think Genji is suiciding but hes going to make big plays,313,2
Boom,314,4
French mayor names deadend road ‘Rue du Brexit’ in honour of British leave vote,315,2
[Image] Yesterday you wrote page one,316,2
Morning,317,2
Cant help but think the kindle version might miss some of the tactile aspects of the book,318,2
Lightspeed as a kid,319,2
Our new car came with car shaped chocolates,320,2
ujacksonmills breaks down how TED Talks have become platforms for corporate insiders instead of promoting true innovation and new ideas,321,2
me🐢irl,322,6
Real life GTA NPC,323,2
MRW my mom starts commenting on all of my Facebook posts,324,2
Power washed cat in New York,325,2
New years hotpot dinner at my Chinese parents house [homemade],326,2
My friend got me a Lapras plush for Christmas because Im the only one in our group who doesnt have one yet,327,2
I will KILL you all once the vet is done,328,2
How to solve a Rubiks cube,329,2
TIL The actors who played Ferris Buellers parents in the movie met during the filming and married in real life,330,2
Roleplay,331,6
Man glassed during taking a photo every day,332,2
When I binge watch tv shows I realized Im watching actors live a fake life while I sit and waste my real one away,333,2
Club Penguin got an update,334,2
Cmon hit me,335,2
Sand noodle,336,6
Fun times with friends,337,2
Unfinished business,338,2
Determined To Fit,339,4
COMMANDOOOOOOO,340,0
TIL treadmills were originally a punishment used to harness human power on a giant wheel used to grind grains; hence the name treadmill,341,9
A boy has no name,342,2
This guy gets it,343,2
Newfoundland dogs known for their gentle demeanor and strong swimming ability have webbed toes which helps their swimming They were originally bred and used as working dogs in Newfoundland an island in Eastern Canada,344,2
Darwin and his communist buddies lied about evolution,345,4
Changed her life1,346,1
PsBattle Cat Interrupting Scrabble Game,347,2
NYE Aftermath When youre so drunk you lose your home phone,348,2
How have TED talks gone from people hyping them for being so inspirational etc to people now rolling their eyes when you mention TED,349,1
Can someone make a list of all the curse words in the show,350,2
Expost from rlanguage learning,351,7
Given the time it is now no one will probably see this but IM GOING TO BE A DADDY,352,2
This adorable German shepherd puppy,353,7
My parents cat is a goddamn model,354,2
MIT study says 3000 ridesharing cars could replace every cab in New York City,355,2
Ames Room Illusion,356,2
Of all the places the ketchup could drop,357,2
me_irl,358,9
My first tattoo by Phil TwoRavens at lustandconsume in LA,359,2
A dozen doctors pharmacy owners and marketing pros have been accused of a kickback scheme that prosecutors allege involved a sham medical study used to bilk up to $102 million from the publicly funded federal health program for military family members,360,2
Secretary,361,2
The holy trinity Socks Crocs and Ankle monitor,362,3
Me trying to get on the front page with my first post,363,2
If birds had social media,364,2
When I found her in my garage and 14 years later,365,2
[WP] You live in a world where magic exists however you must sacrifice a memory in order to cast a spell The more memories or the more precious a memory the more powerful the magic You just woke up with no memory save a name,366,2
POSTNFC NORTH CHAMPIONSHIP MEME THREAD,367,2
For those people whose New Years Resolution is to lose weight,368,2
TIL that the Hollywood sign was modified to read Hollyweed after some pranksters added $50 of fabric to it On January the 1st 1976,369,2
A friend of mine caught this memorable photo of a temple elephant sitting Thid was taken at Tiruvanaikovil India Her name is Akila,370,2
Lens flare in a picture I took looks like the Death Star,371,2
Tyler The Creator  Yonkers [HipHop],372,2
Many in US Skeptical Trump Can Handle Presidential Duties,373,2
One of my favourite Vader pics a younger Vader with his mask removed,374,2
California Blames Incarcerated Workers for Unsafe Conditions and Amputations,375,7
What is this card category,376,8
[EVERYTHING] car rental service ad,377,2
The girlfriend asked me to shovel a path to the garage (Xpost rCalgary),378,7
Just a lady casually walking her pigeon here in Seattle,379,2
Such good friends,380,2
Sarah Ramadan the girl who overcame anorexia,381,9
Milling machine at work,382,4
‘Obama & other Muslims not welcome here’ Convenience store’s signs spark outrage,383,8
China apparently has 128tick matchmaking,384,2
10 likes and Ill jump,385,2
Learning to cat,386,7
ELI5 Nikola Teslas plan for wireless electricity,387,2
Skyrim habits die hard,388,2
Digital painting I did of Agatha from The Grand Budapest Hotel,389,2
Driveway being sealed,390,3
Drinks sold at airports have to go through the Xray machines at security,391,2
A Klingon defending his humble abode,392,3
If only everyone was a good sport like this guy,393,2
To understand the banana you must become one with the banana,394,2
This movie trailer has me seeing double,395,2
When you thought there were no witnesses,396,1
Busch Stadium for the Winter Classic,397,2
An apology to my future self,398,2
Teachers of Reddit what would you change about the school system (Serious),399,2
Beijings subway ads a glorious glimpse a dystopian future,400,2
Shaking hands,401,4
TIL despite him being Jewish when Bernie Sanders was mayor of Burlington he dressed up as Santa to give out presents to families in lowincome housing,402,2
🔥 lightning strike on the beach,403,8
My 21 week pregnant and my 40s maternity fashion photo shoot idea,404,2
Took my dogs to the park and ended up with this inspiring pic,405,2
Fordite polished layers of car paint from a Detroit factory,406,7
Yu should definitely watch rush hour,407,1
After finishing my five years of service ive finally got what ive wanted for longer than i could remember Reddit meet Milo,408,2
Coal country afraid Trump will repeal black lung benefits with Obamacare,409,4
As a kid I used to think some kids were so much cooler than other kids As an adult I think all kids are turds and no matter what they do its impossible to be cool,410,2
I colorized a photo of my Grandma and Grandad on their wedding day back in 1948 Heres the before and after,411,2
[Schefter] 49ers officially have informed Chip Kelly he no longer is their coach per source,412,2
This is how my dogs sleep,413,8
anime irl,414,8
Bill and Melinda Gates back an implant that could prevent HIV,415,2
Stuck under the couch cushions,416,8
me_irl,417,9
Whats the point of Symmetra yelling Protect the tpshield gen if her teammates cant see the location of it through walls,418,2
Do mosquitoes share blood with each other Also do they steal blood from other mosquitoes,419,4
Like a teenagers first time with a girl,420,2
Meet The Halperts,421,7
My son has been working on this since June Sooo many pieces,422,2
Mad lights,423,2
