Title,doc,topic
[No Spoilers] Heaviest objects in the universe,2073,4
Daddy Save Me,2074,2
restoring a ring smashed in a drivers car seat (xpost RPics),2075,7
The true face of guilt,2076,2
Evan Rachel Wood opts not to wear a gown at the Golden Globe Awards  our kind of rebel,2077,7
Realtime dithered spheres pixelart animation,2078,5
Everybody ignoring the do not stack print,2079,4
Heckin big pupper doesnt give a bork about social standards,2080,2
Trump fires back at ‘overrated’ Meryl Streep,2081,7
TIL While filming Das Boot an actor fell overboard and broke a few ribs Someone shouted Man overboard The director didn’t realize it was an accident and yelled,2082,8
The LittleKnown Patterns on British Streets,2083,0
That was really awkard,2084,2
I survived stage 3 ovarian cancer as a 17 year old high school student AMA,2085,2
Mans shirt was made off center,2086,2
Apple removes app that let you find your AirPods,2087,6
I made my wife an extendable dining table as my first MAJOR woodworking project,2088,2
me_irl,2089,9
The absolutely mental Youtuber probably doesnt even make his bed in the morning,2090,2
Cute dog has an evolution moment,2091,2
Meryl Streep Calls Out Donald Trump for Mocking Disabled Reporter in Riveting Golden Globes Speech,2092,7
Cover of NY Post today,2093,2
ELI5 When we feel drowsy why do our eyes lose focus first before any other senses,2094,2
Bernie Sanders Becomes A Massive Thorn In Trump’s Side With One Statement On Social Security,2095,2
100000 SUBSCRIBER UPVOTE PARTY,2096,9
Older dogs need homes too This is Shadow,2097,2
Good boys reaction smelling Vicks Vaporub,2098,2
What is this magic,2099,2
When Merida asks for a photo with you cause your hair matches,2100,2
My first tattoo a little paper airplane by Ben Moore at Ink Dreams Tattoos in Bryan TX,2101,2
MRW Im not sure about a song at first but then realise its an absolute tune,2102,2
Took this little guy home last week,2103,2
If you like pineapple slices on pizza,2104,2
1900 year old stepwell in India,2105,2
key caps being engraved with a laser at the cherry factory,2106,7
Raiding the military base [GTA],2107,2
Edgy 15 yo Profile Picture Starter Pack,2108,2
Team Communication,2109,4
Anime_IRL,2110,4
Handsome,2111,7
New York City Population and Number of Homicides by Year [OC],2112,2
My brother went to an adoption even and came back with this gal,2113,2
A way to naturally regrow damaged teeth in mice using drug designed to treat Alzheimer’s disease has been discovered in a breakthrough that could significantly reduce the need for fillings It works by stimulating stem cells already present in the pulp to create new dentine,2114,2
A woman had to have invented the term scratching your balls,2115,2
5 years,2116,2
People who have been hit by the slime from nickelodeon,2117,2
Protip  When stuck by a Junkrat trap immediately look down and melee,2118,2
My grandpa 1940s in Texas Today would have been his 94th birthday,2119,9
going from cutscene graphics to ingame graphics,2120,2
ESEA hacked 15 million records leaked after alleged failed extortion attempt,2121,7
Mexico’s expresident calls ‘f—ing wall’ a ‘racist monument’,2122,4
Here we see two mighty dinguses trying to lick a slug off a window,2123,2
When your family and friends think your good with tech but this is what you actually do,2124,2
My majestic angel,2125,5
Suggestion After using Symmetra ult repurpose the ultimate meter as the health bar for teleporter or shield generator,2126,8
So my friend moved into his new dorm room,2127,2
Bernie has 21 health care rallies planned so far Let’s double that by calling state and local representatives All the info you need inside,2128,2
This was retweeted by Nintendo Spain Official or not its amazing,2129,2
Michael Cera needing only 33 takes to nail the OvertheShoulder package throw short in Scott Pilgrim,2130,3
Do a halfflip they said it will be fun they said,2131,2
I was told this belongs here,2132,8
Snake on a plane cancels Emirates flight to Dubai,2133,2
Gentlemen whats an absolute nono for a girl to do on a first date,2134,2
Overwatch Seasons summed up,2135,8
His profile said he drove a Mercedes and owned his own home,2136,7
Cashier Makes Day of Boy With Cerebral Palsy,2137,2
When your awkward years arent so awkward,2138,2
AARON RODGERS THE KING OF THE HAIL MARYWIN PARTY THREAD,2139,2
Avengers Infinity War I & II will have a combined budget of $500 million and will be filmed backtoback in Scotland Government of Scotland estimates $10 million local earnings from the movie shoot,2140,2
Therapist mom has a new client,2141,2
Larry,2142,9
me_irl,2143,9
TIL that a cement truck crashed near Wingamon Oklahoma in the 1950s and the mixer was too heavy to move Its still there and locals have painted it to look like an abandoned NASA space capsule,2144,2
They should have a TV show called Help,2145,2
Man Selfie Guide,2146,1
Friend of mine passed this car the other day,2147,2
Arbys has a deal with Pepsi to feature them in two commercials a year Arbys forgot an made a commercial admitting the mistake,2148,2
I dont know Serana but it sure sounds like a dare to me [Dawnguard spoilers],2149,8
MRW listening to the new Run the Jewels album,2150,2
Throwback to when we raided Fort Zancudo,2151,7
We were ethics lawyers for Bush and Obama Trumps cabinet hearings must be delayed,2152,2
Bored seal tries to entertain himself by sliding,2153,3
Gamora (Zoe Saldana) Confirmed for Avengers Infinity War,2154,2
To the all the people Im hearing around campus complaining about not having a syllabus day and actually having a class,2155,2
How is it season 7 and death recap is still this bad,2156,2
Im 20 years old She was 15 If I have any memories of life before her; I dont remember them Goodnight Tessa I miss you,2157,2
Simple Geometry,2158,7
a few years ago i posted my friends invention and you guys really helped him get his business going heres an update,2159,2
A mans personality obviously resides in his muscles,2160,8
When you want to be alone,2161,2
On the Russia scandal Trumps lies start to pile up,2162,2
We are able to cure more diseases in mice than in humans forcing me to conclude that the Hitchhikers Guide was right and mice are only using us to do their busy work for them,2163,2
When Alan Rickman died I decided what tattoo I wanted I told myself that if I still wanted it a year later I could get it I know its not a particularly original idea but it means a lot to me,2164,2
TIL in Denmark there are facilities called fix rooms letting addicts inject certain type of drugs under supervision,2165,7
How does heat propagate in a vacuum if there are no particles for it to move through,2166,4
Cougars by eating herbivores with seeds in their stomachs and then leaving scat across a large range are able to plant around 94000 plants a year,2167,5
My Prince & I,2168,8
#KarenWasInnocent,2169,7
Me irl,2170,8
What a jump,2171,2
You know you live in a rural area when your local movie theatre does this,2172,2
How did Roman military generals command so much power,2173,2
McConnell Not Following Confirmation Process He Demanded From Reid In 09,2174,2
Donald Trump had nothing to do with our new US jobs Fiat Chrysler reveals,2175,2
Ken M on Telescopes,2176,6
Honchkrow is coming for your kneecaps opened a tumblr too,2177,1
Sacramento Kings on Twitter Bad weather outsidefair weather inside,2178,3
It Just Occurred to Me ,2179,9
Thanks God,2180,7
[Image] Creepy,2181,2
I WANT TO GET REAL STRONG BECAUSE I AM A HUMAN,2182,2
Found on IMDB,2183,2
JANUARY 9 2017 BANNED AND RESTRICTED ANNOUNCEMENT,2184,2
A great photo of our elite boys in black,2185,2
AntiTrump Laws Elizabeth Warren Introduces Presidential Conflicts Of Interest Act Of 2017,2186,2
My wife walked into my office and placed this chair on my desk,2187,2
Not your typical before and after but still impressive,2188,4
So I might have found the perfect girl,2189,2
My ramen has a builtin strainer,2190,8
He loves travelling,2191,2
cRaZy MaN suiCiDeS aFteR seeIng tHe WorsT cEreALs in tHE grOCery sToRe,2192,2
Lieutenant Crunch,2193,9
Another day another halfflip save,2194,2
This momma is so done,2195,2
Reddit meet Gloria She was a stray pup D,2196,7
My parents in WWII,2197,2
2020,2198,2
3 Years later Im 133 pounds 3 years ago I was 320 Boy has my life changed,2199,2
Me irl,2200,8
Bernie Sanders Trump has to rescue Obamacare or admit he’s a liar,2201,2
Time to invade Hungary lads,2202,4
TIFU by turning my ceiling lamp into a flashbang grenade,2203,7
A flank route I discovered that Ive never seen before,2204,2
TIL that Julius Caesar and Cleopatra had a child together name Caesarion which translates to little caesar,2205,2
Protests Erupt in Kentucky After GOP Supermajority Passes Extreme AntiChoice AntiUnion Bills,2206,7
Put glasses on a dog immediately smarter,2207,2
DC Dress Shops Dispute Trumps Claim That They Are SoldOut for Inauguration Theres Never Been Less Demand,2208,2
[WP] Youve stumbled across Death Notes younger cousin Mild Inconvenience Note,2209,2
dazed has trouble understanding LDLC logo,2210,2
My friends PSU cords werent long enough,2211,4
[Wojnarowski] Brooklyn has waived former No 1 overall pick Anthony Bennett,2212,2
Well This is awkward,2213,2
Its haiii noon,2214,7
Printing has come a long way,2215,2
Excellent,2216,3
Jagex fix this MultiBillion GP Issue that is flooding our game,2217,7
No they havent,2218,2
TIL Keanu Reeves got the role for Neo in The Matrix because Will Smith turned it down in order or shoot Wild Wild West,2219,2
Hot stud fingers girl on bus,2220,1
when you are fed up with dvazarya combos,2221,4
I think this friend of mine is really talented,2222,2
Little boy takes care of his pup,2223,2
His first entry into his secret diary I just couldnt resist peeking,2224,2
How my graphic designer sister likes to send my Christmas presents,2225,2
Identical twins play a mirror prank,2226,4
Russia considers banning sale of cigarettes to anyone born after 2015,2227,2
Waiting for my doctors appointment when suddenly,2228,6
TIL shortly before she died Majel Barrett recorded an entire library of phonetic sounds allowing her voice to be used in future products outside of Star Trek and quite possibly as the computer voice in Star Trek Discovery Thus she could live on as the voice of Starfleet possibly for all time,2229,2
Asking for a booking,2230,5
My Grandpa has played this MMO for over 17 years and its servers shut down this month,2231,2
Things Got Crazy In Badminton,2232,2
Guy is honest about why he is using social media,2233,2
Me_irl,2234,9
This ad for the Nintendo Switch reveal is a callback to the first ad for the NES,2235,2
TIL that after his crimes were discovered serial killer Marcel Petiot grew a beard and joined the police using the alias Captain Valeri Valeri was assigned to find Petiot until someone recognized him,2236,2
Only if,2237,0
This play area looks a bit like an Amish Millennium Falcon,2238,2
The Pentagon is changing the nuclear codes to over 140 characters,2239,8
[I ate] Lego Wedding Cake,2240,7
Working at a movie theater has its perks,2241,2
26 year old Ozzy Osbourne 1974,2242,2
Gordon Ramsay can be wholesome too,2243,7
Meet Luna our Bengal kitten 😄,2244,7
A 1000footthick ice block about the size of Delaware is snapping off of Antarctica,2245,9
Boyhood had no funding one year because IFC forgot the film was still going and had closed the books The films director Richard Linklater funded production that year because he had insurance money from his house burning down,2246,2
Plane lands almost vertically due to strong headwinds,2247,2
That time I brought my kitten to work,2248,2
Veteran airsoft player leads by example on how to treat newbies in any hobby,2249,4
You tried your hardest buddy,2250,2
Dumb ATM Mugger,2251,4
I felt bad but didnt matter had sex,2252,2
Get baited meit,2253,5
Only a laptop but I finally ascended,2254,4
Monopoly will let the internet vote to replace all of the board games classic tokens,2255,2
What Trump is really saying in his tweets I’m weak,2256,2
This library was built exactly over the CanadaUSA border (the black line),2257,6
me📜irl,2258,6
LPT If you find yourself lost in unfamiliar wilderness immediately STOP and begin marking your location  break brush organize branches or stones or dig trenches into clear man made shapes,2259,2
These are the best guys in town (012),2260,2
Reminder Khan Academy still has basic explanations on taxes in the US This should help you with understanding tax brackets deductions and other related information,2261,2
The Case of the Package of the Bees,2262,2
The Italian Navy,2263,6
Stop ignoring me,2264,2
Verizon Confirms Its Booting Unlimited Data Users At the end of the day people dont need unlimited plans,2265,2
Painting hidden in gilt edges of rare book,2266,2
The sign is there for a reason,2267,2
dont jump,2268,2
[Poetry] lets read 5 YouTube comments,2269,2
A genie grants you immortality under the condition you choose one possible but improbable way you can be killed What is your immortality loophole,2270,2
[Post Game Thread] Clemson Defeats Alabama 3531,2271,7
[WP] The Devil appears before you and puts a heavy hand on your shoulder Look,2272,2
[Image] Stronger Braver Smarter,2273,2
Shower Thought There are places in the galaxy where Leia could go and still see Alderaan in the night sky with a powerful telescope because the light that bounced off the planet a thousand years ago is still arriving there,2274,2
This baby was a mob boss in his previous life,2275,2
Perfect spot for a chubby cat,2276,2
Whats the quickest way someone lost your respect,2277,2
Why you shouldnt trust Geek Squad ever again,2278,4
Dont spell part backwards,2279,2
MormonLeaks dumps 4 new documents about LDS Church,2280,2
I think this should be behind glass at least,2281,1
You can see every sip taken from my pint,2282,2
The Suspense Is Palpable,2283,5
Whats something thats completely legal but that pisses you off when you see someone doing it,2284,2
What would be the motto now,2285,2
As of the night of 192017 umlbofficial has officially passed unba as the sports league account with the most total karma (113434),2286,2
Human attempts iguana scene from Planet Earth II,2287,2
Booties for pupper,2288,9
Martin Shkrelis obsession over a married female journalist imposing his face over her husbands face in his profile inviting her to inauguration as his +1 and changing his Twitter background to a collage of pictures of her with romantic italic text leading him to be suspended from Twitter,2289,2
A cardboard centrifuge separates blood cells from plasma in 2 minutes Based on an ancient toy it costs 20 cents and weighs just 2 grammes,2290,2
Mysterious masks and cloaks found hidden in a Boston subway station after more than 60 years,2291,2
The Original Shower Thoughts,2292,7
2meirl4meirl,2293,2
Making a vase out of colored pencils,2294,8
Combine rEnoughTrumpSpam and rThe_Donald and watch both sides downvote each others posts so that they never make it to the front page but still be angry at each other,2295,2
Redditors take over Amazon listing after finding out the boots leave swastikas in the print,2296,2
Stone Cold Digital,2297,8
My dogs memory lives on through my login passwords,2298,2
Wind power now runs all electric passenger trains in the Netherlands,2299,2
Self Portrait Digital 8x105,2300,2
Swiss Muslim girls must swim with boys,2301,2
Open Letter of Apology,2302,0
How SATA is my new drive,2303,2
When you accidentally murder your best friend,2304,2
lets read 5 youtube comments,2305,2
Hollywood and politics,2306,2
[Image] Today is a gift,2307,2
Kitty inspecting a beard,2308,8
Anderson Cooper is just sayin,2309,3
Prototypes of Razer triple screen gaming laptop stolen,2310,7
The Joys Of Living In The Redwood Forest,2311,4
Hardest game of our childhoods,2312,4
Ever wondered what a tortilla sounds like on a record player,2313,2
Rick and Morty as a pulp fiction magazine,2314,2
Warwick the Uncaged Wrath of Zaun  League of Legends,2315,2
Demarcus Cousins promises to release an R & B album if he is voted into the all star game,2316,2
Swiss Muslim girls must swim with boys European court rules,2317,2
If only everyone was a good sport like this guy,2318,2
Former fatshaming redditor vividly describes his own spiral into weight gain with an open apology,2319,0
Nations of the World  Animaniacs [Educational Pop],2320,2
First 151 Pokémon as Hearthstone Cards,2321,2
Marriott gets it,2322,7
Live broadcast,2323,2
What are some of the most interesting SOLVED mysteries,2324,5
Corsola Fakemon Evolution (Response to Toxapexs Pokedex Entry),2325,1
PsBattle This pug who hates the cold,2326,4
Donald Trump a Tremendous Loser Has No Famous Friends Sad,2327,2
Steak Dinner For Two,2328,2
This rolypoly visited the office today,2329,2
Obama says shift to green energy is irreversible despite Trump,2330,2
Sessions failed to disclose oil interests as required ethics experts say,2331,2
My wedding bouquet by Megan Mac at Mercy Seat Tattoo in Kansas City,2332,2
I remodeled my tiny bathroom and its now my favorite place in my house,2333,2
Waterpowered charger,2334,0
Fantastic Cloud Strife cosplay,2335,4
Playing The Mandolin,2336,2
This is Jerry the blue heeler cattle dog some might say part panda,2337,2
Huts in Finland,2338,6
Report Russia spread fake news and disinformation in Sweden  Russia has coordinated a campaign over the past 2years to influence Sweden’s decision making by using disinformation propaganda and false documents according to a report by researchers at The Swedish Institute of International Affairs,2339,2
Live Free or Die,2340,2
Dylann Roof trial Jury reaches verdict,2341,4
The Obvious Sky Marshal Starter Pack,2342,2
Monte and Doa have left LCK,2343,4
Australia Post,2344,2
YSK that if youre boiling something turning up the heat at boil will do nothing but evaporate water faster The water itself will NEVER be hotter than 100°C,2345,2
I miss Animaniacs Probably one of the best 90s cartoons,2346,2
I updated my old Rocket League poster with more effects and vibrant colours Hope you all like,2347,2
Hen protecting kittens during a storm,2348,3
My dad made this pic of our rock climbing trip when I was in 5th grade Was sent to mom Mom not amused,2349,2
Congress Quietly Passes New Rule Allowing House Members To Hide Records From Ethics Probes,2350,2
My sister in law everyone,2351,2
Please don’t tell us the truth House GOP blocks budget watchdog from reviewing cost of Obamacare repeal,2352,2
Is there anything the human body has three of,2353,2
Words are my weapons,2354,2
Corner drawer,2355,4
After reading patch 715 notes,2356,7
This hoodies design makes me führious,2357,2
Oh the places youll go,2358,2
Just finished my first play through of the Witcher 3 Loved it but kept thinking of Geralts own words from the trailer,2359,2
A beautiful poem for someone you hate,2360,2
Michael Bennett was asked if he prefers going up against the best offense I prefer to play a terrible team because it makes the game a lot easier,2361,2
The Lucas biography really shed light on Anakins sand grudge,2362,2
Are you serious,2363,4
Worldwide Human Sex Ratio,2364,2
Passed this earlier today; I cant help but feel I should draw power,2365,2
TIL that a family went into hiding from Soviets in Siberia after WWI And werent found for over 40 years unaware of WWII the space race or plastic bags,2366,2
What do you guys think of my Guzma cosplay,2367,2
If you park in the dumpsters spot its your own damn fault,2368,2
At least Im getting a kitten out of it,2369,2
It snowed at Magfest I got a pretty cool picture of my Simon Petrikov cosplay,2370,4
Cows have best friendsbut they dont always have to be other cows,2371,4
Hologram,2372,4
Pacific Mirror  30x40 palette knife acrylics on canvas,2373,7
[Serious] How dangerous is it to attend a cult meeting just as a joke,2374,9
Snowed this morning wonder how the roads are,2375,2
Bop it,2376,1
Franken catches Session lying about his civil rights record,2377,2
My friends kitten is too cute,2378,2
Answer the question,2379,2
Just a reminder Bernie Sanders has been fighting Jeff Sessions for years Call your Senator today and tell them to vote no on his confirmation as Attorney General,2380,2
Elon Musk recommends to play Overwatch,2381,8
The SawStop mechanism uses an explosive charge to stop the table saws blade in less than 5 ms,2382,2
From my point of view there were too many younglings,2383,2
Its mamas little baby,2384,7
I guess theres a new sheriff in town,2385,2
A new study shows that among the affluent people in affluent neighborhoods a clear reminder of others’ poverty does not induce a show of generosity,2386,2
me🐶irl,2387,2
My entire team left in a Comp game so they let me get a POTG as mercy,2388,2
TIL of Williams syndrome a rare genetic condition characterized by a distinctive cheerful and endearing personality heightened social skills and friendliness but poor visuospatial ability and heart problems,2389,8
Favorite FaceSwap,2390,4
Ken M on American holidays,2391,2
The pipes in our server room leak so rather than fixing them our Buildings Dept decided to throw a tarp over it with a drain hoseits been like this for a few years apparently,2392,2
Cat,2393,2
Abusing the new hook for good,2394,2
Jazz Gina Ekiss 1991,2395,5
me irl,2396,8
Also Dragon Age Origins Battlefield Bad Co 2 & Battlefield 3 are coming to Xbox One Backward Compatibility today,2397,2
I think this belongs her [xpost routrun],2398,4
Just because it looks like grass,2399,8
Posting on Reddit be like,2400,2
Two cuties ),2401,7
[Wojnarowski] Sources There are team officials teammates and close associates unclear of reason for Derrick Roses absence for KnicksPelicans at MSG,2402,4
Grandpa plays GTA for the first time,2403,2
Legendary dropped from Blingtron 6000 (715),2404,1
We are allowed to suspend beliefI promise Van Gogh died with one ear secluded broke and a nobody One of the saddest stories in history You have to love Doctor Who for paying tribute to an amazing Man,2405,2
Painting hidden in gilt edges of rare book,2406,2
The Silent Shagger,2407,7
CS boat sat in the water for a while Not running like it used to,2408,2
When u at work not working,2409,2
[haiku] arfmp4,2410,0
My kids talent show had a 10 minute parentonly act,2411,2
Champion Update Warwick The Uncaged Wrath of Zaun,2412,2
Catch the last ride home oil paint,2413,2
meirl,2414,6
Adorable Husky Pupper,2415,2
me irl,2416,8
TIL Viggo Mortensen wore a Montreal Canadiens tshirt under his armor throughout filming the Lord of the rings trilogy,2417,2
One year ago we got this little poophead,2418,2
Hotshot basketball,2419,2
Trump Pick Monica Crowley Plagiarized Parts of Her PhD Dissertation,2420,2
Nana Nana Nana Nana Batman,2421,4
I want Niantic NOT to announce gen 2 beforewhen they launch it,2422,2
FBIs Comey Republicans also hacked by Russia,2423,2
Whats that You want to go out,2424,2
Pokemon silver had no chill,2425,4
What are the most interesting uses of guerrilla warfare throughout history,2426,2
No Mitch McConnell we’re not going to “get past” it — the president your voters elected is a dangerous idiot,2427,2
Twothirds of all new HIV cases in Europe are being recorded in just one country – Russia More than a million Russians now live with the virus and that number is expected to nearly double in the next decade,2428,2
[shower thought] 10 years ago sent from my iphone meant you were at the leading edge of technology now it means you probably dont know how to turn off autosignature,2429,2
Emma Watson,2430,0
Anyone else hoping Valve will make a big CS announcement at the closing of ELeague Major like they did for Dota2 700 at the Boston Major,2431,2
What are some completely normal hobbies humans enjoy,2432,6
[OC] Which monk path,2433,7
When he was a child DeShaun Watsons family was the recipient of a Warrick Dunn house,2434,2
The floor is lava,2435,4
Family Secrets,2436,2
Oasis Is Really Forgiving,2437,7
During all of 2016 which purchase under $150 brought the most happiness into your life,2438,2
The red ring and red USA lettering on my Olympic cup have completely disintegrated over years of washing,2439,6
This sub never ceases to amuse me,2440,2
How is that,2441,0
Bernie Plans Nationwide January 15th Rallies to Save Health Care – Voices of the Revolution,2442,2
Widowmaker opens up Oasis with 100% accuracy,2443,7
MonSTroUS CaR oUT oF COntRol 4 dEd,2444,2
My Taco Bell Taco had star shaped cheese,2445,2
Furrocious Lion,2446,6
TIL Dazed took a break from Csgo to play Call Of Duty on the xbox 360 due to call of duty having larger prize pools than counterstrike at the time,2447,2
Minor Threat  Straight Edge [hardcore punk],2448,2
He kept telling them things we had been saying all along,2449,2
Jagr not thinking about retirement I feel good so I go to 55,2450,2
The real question,2451,2
Oh my goodness New leak changes everything,2452,2
Dog Mistakes Pond for Grass,2453,2
A blind gamer beat Ocarina of time after 5 years of trying,2454,2
People at my school took their snow caves very seriously,2455,2
After 2800+ hours time of consideration,2456,2
Took this screenshot in Fallout 4 think it looks pretty cool,2457,2
[EVERYTHING] I just realized that if Stannis,2458,2
SpiderMan Confirmed For Avengers Infinity War,2459,2
You got the official wave man,2460,2
This is the ideal male body You may not like it but this is what peak performance looks like,2461,2
This stock footage of someone playing Pokémon Go,2462,2
How did massive armys of the past carry enough food with them for potentially thousands of men to eat everyday over the course of a long march,2463,2
TIL that the guards at The Tomb of the Unknowns have never left their posts due to bad weather They stayed outside during Hurricane Isabel in 2003,2464,2
Leibnizs Cosmological Argument for the Existence of God,2465,7
Hes six years old,2466,2
The Dawnguard Problem (SPOILERS),2467,4
Two seconds left on clock UFC,2468,2
LeBron on Cavs shooters We have guys that have the ultragreen light JR,2469,2
